angelsbaseball,3dsxty,stuckinthepow,31,Sun Jul 19 03:46:33 2015 UTC,RICHARDS CGSO!!!!  ALL HAIL RALLY SPIDER PLANT!!!!!!!!!!!!!!!!!!!!!!
angelsbaseball,3dsxty,naaahhman,7,Sun Jul 19 03:47:15 2015 UTC,+/u/User_Simulator naaahhman
angelsbaseball,3dsxty,UltSomnia,10,Sun Jul 19 03:57:55 2015 UTC,You could have it immediately. This Mike Trout is the funniest thing about Jeff Dunham.  ~ naaahhman    Info | Subreddit
angelsbaseball,3dsxty,User_Simulator,15,Sun Jul 19 03:59:01 2015 UTC,Kole and Garrett decided to give Trout a break tonight.
angelsbaseball,3dsxty,wiNNA_monstER,16,Sun Jul 19 03:47:52 2015 UTC,Thank you red sox offense you guys are nice :)
angelsbaseball,3dsxty,UltSomnia,15,Sun Jul 19 03:49:26 2015 UTC,1.5 GAMES UP AWWWWWWWWW YEEEEEEEEEEEA
angelsbaseball,3dsxty,lukotheboss,10,Sun Jul 19 03:54:40 2015 UTC,richards with the cgso. Light that baby up!
angelsbaseball,3dsxty,PM_ME_Y0UR_ARMPITS,10,Sun Jul 19 03:47:28 2015 UTC,CHOOOOOOOOOOOO!!! CHOOOOOOOOOO!!!!
angelsbaseball,3dsxty,Rogueofoz,8,Sun Jul 19 03:51:42 2015 UTC,GRich!GRich!GRich!GRich!GRich!GRich!GRich!
angelsbaseball,3dsxty,KennyGardner,8,Sun Jul 19 03:50:31 2015 UTC,http://giant.gfycat.com/IllegalWarmheartedFrilledlizard.gif
angelsbaseball,3dsxty,bigmanlavos,5,Sun Jul 19 03:55:05 2015 UTC,http://i.imgur.com/XR3qXlx.gifv
angelsbaseball,3dsxty,natural_disaster0,5,Sun Jul 19 05:18:00 2015 UTC,Yes!!!
angelsbaseball,3dsxty,mrdodie88,6,Sun Jul 19 03:54:22 2015 UTC,NO POST ASG SLUMP!!!
angelsbaseball,3dsxty,tMoneyMoney,9,Sun Jul 19 05:03:40 2015 UTC,+/u/User_Simulator only_says_mike_trout
angelsbaseball,3dsxty,UltSomnia,14,Sun Jul 19 03:56:12 2015 UTC,C Mike Trout Mike Trout Mike Trout 3B Mike Trout SP Mike Trout CF Mike Trout CF Mike Trout Mike Trout RF Mike Trout CF Mike Trout SP Mike Trout RF Mike Trout SP Mike Trout 1B Mike Trout Mike Trout 2B Mike Trout RP Mike Trout LF Mike Trout Mike Trout CF Mike Trout Mike Trout Mike Trout.  ~ only_says_mike_trout    Info | Subreddit
angelsbaseball,3dsxty,User_Simulator,2,Sun Jul 19 03:56:59 2015 UTC,+/u/user_simulator UltSomnia
angelsbaseball,3dsxty,Fuzzylumpkin,2,Sun Jul 19 04:17:52 2015 UTC,"It was just a funny thing that they would get the ball from where they touched it rather than $4,000, but what? He got no replies cuz no one will listen to them.  ~ UltSomnia    Info | Subreddit"
angelsbaseball,3dsxty,User_Simulator,1 point,Sun Jul 19 04:18:48 2015 UTC,+/u/usersimulator kylethemachine
angelsbaseball,3dsxty,kylethemachine,1 point,Sun Jul 19 18:27:30 2015 UTC,+/u/user_simulator Fuzzylumpkin
angelsbaseball,3dsxty,UltSomnia,3,Sun Jul 19 04:21:14 2015 UTC,"That's why you don't know if that means anything. Look outside, is only around 7,000 students.  ~ Fuzzylumpkin    Info | Subreddit"
angelsbaseball,3dsy69,srzhk,18,Sun Jul 19 03:50:37 2015 UTC,http://giant.gfycat.com/IllegalWarmheartedFrilledlizard.gif
angelsbaseball,3dsy69,bigmanlavos,21,Sun Jul 19 03:58:01 2015 UTC,God dammit Arte just make those jerseys our daily wears already
angelsbaseball,3dsy69,legionfresh,13,Sun Jul 19 04:25:55 2015 UTC,Vintage Richards via 2014 was on display tonight.
angelsbaseball,3dsy69,stuckinthepow,12,Sun Jul 19 04:30:35 2015 UTC,Now we just need 2014 Shoe back.
angelsbaseball,3dsy69,tMoneyMoney,11,Sun Jul 19 05:04:53 2015 UTC,I'll take a 2014 Weaver as well.
angelsbaseball,3dsy69,DonnieDon24,5,Sun Jul 19 08:49:02 2015 UTC,And a 2013 CJ
angelsbaseball,3dsy69,MartOut,8,Sun Jul 19 19:17:49 2015 UTC,"Now I am GRich, destroyer of the Red Sox."
angelsbaseball,3dsy69,sweetwattah,3,Sun Jul 19 04:32:03 2015 UTC,I can dig it :)
angelsbaseball,3dtcns,stuckinthepow,3,Sun Jul 19 06:55:11 2015 UTC,Reagins was basically there to be a place holder for the demands of Scioscia and Moreno so I can't say I'm too confident about the next hire if Dipoto's hires leave.
angelsbaseball,3dtcns,Kelmon,2,Sun Jul 19 07:18:29 2015 UTC,"Could be Blacky, which on one hand I love because Buddy is close to the organization, a phenomenal talent utilizer, and has a wonderful baseball acumen. On the other hand, he's too close to Scioscia and basically becomes his FO strongman."
angelsbaseball,3dtcns,shiftyeyedgoat,2,Mon Jul 20 05:14:20 2015 UTC,"From what I've heard from the baseball insiders like the Olneys and Rosenthals, Bud Black prefers to be in the dugout and he's probably going to find a manager position sometime in the future.   Dipoto wasn't perfect, but he left the organization in better shape than when he started in 2011. My hope is the assistant GM Matt Klentak stays and becomes GM. He was director of baseball operations with the Orioles for 3 years before Dipoto hired him. He has the front office experience, but he's also has the eye for advanced metrics that, I think, are an absolute must for player evaluations."
angelsbaseball,3dtcns,wonderbread403,-1,Mon Jul 20 19:23:32 2015 UTC,Well that placeholder had more success that Jerry ever had as a GM.
angelsbaseball,3dtcns,Titan67,1 point,Mon Jul 20 09:22:54 2015 UTC,I don't understand why the majority of Halo's fans consistently credit Dipoto. Anyone care to explain?
angelsbaseball,3dtcns,Edhop,1 point,Mon Jul 20 07:23:42 2015 UTC,"It puzzles me too, like everyone here loves to shit on Reagins but he did oversee 3 AL West division championship seasons, and before that he over saw player development. Development of players such as Aybar and Kendrick. His scouting regime found Trout. He drafted Richards. But one bad trade that the owner forced him to do and he is crucified while good ole Jerry gets a pass for those moves."
angelsbaseball,3dtcns,Titan67,1 point,Mon Jul 20 08:58:12 2015 UTC,"You do know that Reagins fired Eddie Bane, the director of scouting from 2004-2010 that drafted Weaver, Adenhart, Trumbo, Trout, Skaggs, and Richards, right?"
angelsbaseball,3dtcns,wonderbread403,0,Mon Jul 20 19:10:40 2015 UTC,"Whoever Mike Trout wants. On a serious note I'm not ready to give Jerry all of the credit for the teams success, without Mike Trout and Pujols we aren't having 50 win upvote parties. Calhoun was drafted before Dipoto was GM. I'm not trying to say Jerry sucks but thinking he is the SOLE reason for the success right now is misguided in my opinion."
angelsbaseball,3dtcns,Titan67,4,Sun Jul 19 08:48:04 2015 UTC,"He is the reason our pitching has been great this year, and the pitching depth we now have will allow us to make a big deadline acquisition, something we haven't had much of in recent history."
angelsbaseball,3dtcns,breakfast_cats,1 point,Sun Jul 19 19:29:52 2015 UTC,"No, our pitching is great this year because our pitchers are doing great, Heaney is great because our coaching staff coached him up on his delivery. A GM has no effect on on-field performance. Garret Richards was an Angel before Jerry was. Jerry didn't make Richards who he is today, Garret did."
angelsbaseball,3dtcns,Titan67,4,Mon Jul 20 09:13:27 2015 UTC,So you're giving Dipoto no credit for acquiring Santiago and Heaney? Then who cares at all about the GM? Clearly their job doesn't matter.
angelsbaseball,3dtcns,dukiehazzard,4,Mon Jul 20 13:13:42 2015 UTC,Not to mention how he completely rebuilt the bullpen in the middle of last year. Signing Smith and trading for and extending Street were fantastic Dipoto moves. I guess some people don't remember how bad our pitching was just 2 years ago.
angelsbaseball,3dtcns,breakfast_cats,1 point,Mon Jul 20 14:35:51 2015 UTC,"One reason our pitching sucked 2 years ago was Joe fucking Blanton, someone that Jerry signed. Dipoto did an awesome job with the bullpen but not every Jerry move was fantastic, we could really use that Grischuk kid he traded to St. Louis right now. I also haven't heard a word about that Cuban kid they dropped a lot of $$ for."
angelsbaseball,3dtcns,Titan67,1 point,Mon Jul 20 17:20:42 2015 UTC,"I never said every move was great. I agree about Grichuk definitely. And obviously Blanton was terrible, but at the time of the signing, it wasn't a bad idea. Arte had just given Hamilton all the money in the world, and Jerry had to create a rotation with almost no money to work with. Blanton was a decent back of the rotation innings eater type his entire career, nobody could have predicted he would be anywhere near as bad as he was."
angelsbaseball,3dtcns,breakfast_cats,1 point,Mon Jul 20 17:36:56 2015 UTC,"Jerry signed Blanton because Arte made him sign Hamilton and he had no money left over for pitching, which is what he wanted to spend on in the first place."
angelsbaseball,3dtcns,cshenton,1 point,Mon Jul 20 18:03:18 2015 UTC,"That's not my point. It's not like Santiago and Heaney are pitching well because Jerry told them to do it. Mike Scioscia and the coaching staff probably had more to do the with success of those guys than Jerry. Jerry did a great job of getting the guys, he deserves credit for that, but the players he got aren't good JUST because Jerry Dipoto got them they're good because they put the work in themselves."
angelsbaseball,3dtcns,Titan67,3,Mon Jul 20 17:10:30 2015 UTC,"I don't think you realize just how insane it was that we got not one but TWO great young lefty starters for one Mark Fucking Trumbo. That may have been one of the best trades this team has made in the last 10 years. Add that to the Kendrick for Heaney trade and the rebuilt bullpen and pitching depth, Jerry did a lot more to help this team than you're giving credit for. Sure he's not the reason the players are good. They are good because they are good players. And if it wasn't for Jerry we wouldn't have them on our team."
angelsbaseball,3dtcns,breakfast_cats,1 point,Mon Jul 20 17:59:15 2015 UTC,"If all those moves Jerry made didn't pan out this sub would be calling for Scioscia's head. But since they did pan out Jerry gets the credit. He deserves credit for getting the guys, as I said above, but they still needed to be coached. Here is an article that explains how Heaney was coached up on his delivery by Mike Butcher Jerry did a good job in getting him, but the coaching staff deserves more credit in this sub for the teams success than its getting."
angelsbaseball,3dtcns,Titan67,2,Mon Jul 20 18:25:28 2015 UTC,"I agree with pretty much everything here except-   If all those moves Jerry made didn't pan out this sub would be calling for Scioscia's head.   I'm pretty sure we'd all be calling for Dipoto's head if all his moves backfired. Only the idiots would be blaming Sosh for it.  Also, I agree that the coaching staff should get more credit, I never said anything to the contrary. But this thread is about our opinion of Dipoto, and IMO he is a big reason for why our pitching situation is very good right now."
angelsbaseball,3dtcns,breakfast_cats,1 point,Mon Jul 20 19:46:42 2015 UTC,"Jerry did a great job of getting the guys, I'm just of the the opinion that it necessarly isn't a death sentence for the team if the next GM isn't a carbon copy of him. OP of this thread mentioned how he couldn't IMAGINE how bad it was during Reagins tenure, well I was there, I was watching the team, it wasn't a nightmare that people here seem to believe."
angelsbaseball,3dtcns,Titan67,2,Tue Jul 21 02:30:40 2015 UTC,But without Pujols (or Hamilton) he would have had a lot more resources. We don't know who would be on the team or how they would be doing without Pujols.
angelsbaseball,3dtcns,dukiehazzard,1 point,Sun Jul 19 20:01:03 2015 UTC,Well that winter the Angels needed a 1B and a big bat to replace Vlad. We all saw how Prince was in Detroit. I loved Trumbo but now it's obvious that we made the right move in trading him.
angelsbaseball,3drzxp,angelsbaseball,2,Sat Jul 18 22:05:05 2015 UTC,We could've got zero hits and still would've won. Based Richards with the gem.
angelsbaseball,3drzxp,stuckinthepow,4,Sun Jul 19 04:52:13 2015 UTC,Richards killed it tonight!
angelsbaseball,3drzxp,mculatie,8,Sun Jul 19 03:46:53 2015 UTC,Fap fap fap fap fap fap fap LTBU!!!
angelsbaseball,3drzxp,Angela_Twerkel,6,Sun Jul 19 03:46:34 2015 UTC,50 WINS UP VOTE PARTY!
angelsbaseball,3drzxp,stuckinthepow,9,Sun Jul 19 03:46:14 2015 UTC,Based Richards Complete Game Shut Out!
angelsbaseball,3drzxp,IAmTheWalkingDead,5,Sun Jul 19 03:45:55 2015 UTC,LTBU!!!
angelsbaseball,3drzxp,Rogueofoz,5,Sun Jul 19 03:45:53 2015 UTC,LTBU
angelsbaseball,3drzxp,GoldLobster,6,Sun Jul 19 03:45:37 2015 UTC,Complete game shut out. LTBU! Great job Richards!
angelsbaseball,3drzxp,stuckinthepow,3,Sun Jul 19 03:45:29 2015 UTC,RICHARDS IS A BEAST!
angelsbaseball,3drzxp,DonnieDon24,4,Sun Jul 19 03:45:18 2015 UTC,LTBU! SHUTOUT #2!!
angelsbaseball,3drzxp,tacocarnitas,4,Sun Jul 19 03:45:15 2015 UTC,Richards pitched terrific. Let's see if he comes back out for the 9th to throw a complete game.
angelsbaseball,3drzxp,stuckinthepow,10,Sun Jul 19 03:34:00 2015 UTC,Man it still scares me a little bit when garrett runs to cover 1st base :/
angelsbaseball,3drzxp,HotKingChocolate,3,Sun Jul 19 03:33:47 2015 UTC,Im hard for Kalhoun
angelsbaseball,3drzxp,Rogueofoz,4,Sun Jul 19 03:04:43 2015 UTC,https://38.media.tumblr.com/ad373d158520cdfbdc8ceafc2f55266d/tumblr_nres7uAdS41uwvnvuo1_500.gif
angelsbaseball,3drzxp,Angela_Twerkel,4,Sun Jul 19 02:51:56 2015 UTC,Kole putting the red sock clowns in their place!
angelsbaseball,3drzxp,tacocarnitas,1 point,Sun Jul 19 02:51:25 2015 UTC,Lol.
angelsbaseball,3drzxp,RedNotWhite,3,Sun Jul 19 04:16:50 2015 UTC,KOLE!
angelsbaseball,3drzxp,GoldLobster,9,Sun Jul 19 02:50:49 2015 UTC,Hell yeah Calhoun!  Shut those away team asshole fans right up
angelsbaseball,3drzxp,FuntCision,10,Sun Jul 19 02:50:47 2015 UTC,Astros lost!!! Let's extended this lead!!!
angelsbaseball,3drzxp,ST4TEOFW4R,1 point,Sun Jul 19 02:45:41 2015 UTC,"God I hate transplants  It bothers me to no end to hear heavy cheers for a visiting team  These transplants are the same assholes who are constantly talking shit on our great state and continuously hype up their own state.  Go the fuck home, and take your stupid fan affiliations with you. Fucking tired of Anaheim being a second home for many traveling teams.  Maybe I'm not a as mad as I sound... But does anyone else have to deal with the same home circumstances?  Both the Angels and the Ducks get bombarded with transplants.   I'm blame the transplants from the shitty weather areas for our shitty weather today :p"
angelsbaseball,3drzxp,FuntCision,1 point,Sun Jul 19 02:44:12 2015 UTC,"It'll never happen cause you kill 2 birds with one stone, Disneyland and visiting the stadium, kids and wife happy and you get something in return."
angelsbaseball,3drzxp,naaahhman,0,Sun Jul 19 02:51:26 2015 UTC,"Anaheim really doe have a lot of appeal.  Transplants wouldn't be so bad, if they at least admitted that so cal is better than their homeland.  It's common courtesy, if I were to move to some random state like Michigan, Ohio, some other backwoods state, I would at the very least take their teams as my 2nd teams. And I wouldn't be constantly talking about how bad it is... Because if the place is that bad, then I would leave..."
angelsbaseball,3drzxp,FuntCision,2,Sun Jul 19 03:00:37 2015 UTC,Porcello is at 80+ pitches through 4. That's rough.
angelsbaseball,3drzxp,stuckinthepow,6,Sun Jul 19 02:34:48 2015 UTC,"They still owe him $82.5M over the next 4 years, that's rough."
angelsbaseball,3drzxp,naaahhman,3,Sun Jul 19 02:39:28 2015 UTC,Are the Red Sox bats still in Cincinnati taking a break?
angelsbaseball,3drzxp,theathleticjew,2,Sun Jul 19 02:24:52 2015 UTC,"Only Holt was an all star, silly."
angelsbaseball,3drzxp,RedNotWhite,5,Sun Jul 19 04:17:53 2015 UTC,"It is so weird seeing rain like this for an Angels HOME game.   Edit: I know it isn't a lot of rain, but it is still uncommon, especially in July."
angelsbaseball,3drzxp,TBTrpt3,1 point,Sun Jul 19 02:20:36 2015 UTC,All the rain went here in San diego. And the very loud thunder. Floods everywhere.
angelsbaseball,3drzxp,oraleholmes27,4,Sun Jul 19 04:07:02 2015 UTC,Also... drought.
angelsbaseball,3drzxp,Angela_Twerkel,1 point,Sun Jul 19 02:30:02 2015 UTC,Is that drought thing still going on?
angelsbaseball,3drzxp,FuntCision,5,Sun Jul 19 03:22:50 2015 UTC,He absolutely pulverized that ball.
angelsbaseball,3drzxp,Angela_Twerkel,3,Sun Jul 19 02:06:22 2015 UTC,I'm not sure Kole could have squared that one up any better.  What a beauty!
angelsbaseball,3drzxp,wiNNA_monstER,1 point,Sun Jul 19 02:06:12 2015 UTC,we have a run! without a hit
angelsbaseball,3drzxp,Rogueofoz,3,Sun Jul 19 01:55:41 2015 UTC,1 run on 0 hits...  ...nice.
angelsbaseball,3drzxp,mculatie,1 point,Sun Jul 19 01:55:28 2015 UTC,"Heads up guys, at the park now, rain has stopped."
angelsbaseball,3drzxp,boxcutter3005,1 point,Sun Jul 19 00:41:59 2015 UTC,Woo-hoo!
angelsbaseball,3drzxp,RedNotWhite,6,Sun Jul 19 00:50:12 2015 UTC,15 COMMENTS BEFORE A GAME!?!?!?    rain delay questions
angelsbaseball,3drzxp,dslicex,2,Sun Jul 19 00:00:18 2015 UTC,"Let's head to pub, have a pint, and wait for this whole thing to blow over."
angelsbaseball,3drzxp,stuckinthepow,1 point,Sat Jul 18 23:02:54 2015 UTC,I bought two tickets in the 108 section row M (right next to our dugout) and my friend canceled because he didn't want to drive in the rain. Do you guys think its weird to go to a game alone?
angelsbaseball,3drzxp,throwawayfashizzle,1 point,Sat Jul 18 23:06:46 2015 UTC,I've been alone a couple times cuz the SO was working. I had a good time. It's not so bad going alone.
angelsbaseball,3drzxp,winknod,2,Sat Jul 18 23:24:41 2015 UTC,"Fuck no, you can always sell it at 714 tix before the game."
angelsbaseball,3drzxp,naaahhman,2,Sat Jul 18 23:08:59 2015 UTC,So it is weird to go alone.....  :(
angelsbaseball,3drzxp,throwawayfashizzle,2,Sat Jul 18 23:20:07 2015 UTC,Not at all!
angelsbaseball,3drzxp,mwada1,2,Sat Jul 18 23:42:10 2015 UTC,"No, I'm saying it's not weird and you could sell the extra for more beer money! You might not get much, but something is better than nothing."
angelsbaseball,3drzxp,naaahhman,1 point,Sat Jul 18 23:23:48 2015 UTC,Awesome. Sounds good!!!! Thanks guys
angelsbaseball,3drzxp,throwawayfashizzle,17,Sat Jul 18 23:27:42 2015 UTC,"I've been watching replays of Trout's game winner all day....  In related news, I've rubbed my cock raw."
angelsbaseball,3drzxp,naaahhman,4,Sat Jul 18 22:35:09 2015 UTC,You and me both.
angelsbaseball,3drzxp,stuckinthepow,2,Sat Jul 18 23:02:33 2015 UTC,"Like, separately? Or together?"
angelsbaseball,3drzxp,Nineties,4,Sun Jul 19 03:37:55 2015 UTC,We're all in this together.
angelsbaseball,3drzxp,Laaoa47,3,Sun Jul 19 03:47:34 2015 UTC,Any chance of a rainout?
angelsbaseball,3drzxp,ThoseProse,1 point,Sat Jul 18 22:08:16 2015 UTC,Its looking less and less likely.  The back side of rain is quickly moving through from south to north.  Most of OC will be out of the rain in next 45 minutes or so.  Might even see the sun poke through before sunset.
angelsbaseball,3drzxp,rex_llama,2,Sat Jul 18 23:58:31 2015 UTC,Not at the moment:  https://twitter.com/JeffFletcherOCR/status/622525013795540992
angelsbaseball,3drzxp,laaabaseball,2,Sat Jul 18 22:17:37 2015 UTC,"I plan to go to the game and bear it out, but its coming down a pretty good amount right now and im about 20miles away."
angelsbaseball,3drzxp,boxcutter3005,1 point,Sat Jul 18 22:48:19 2015 UTC,@JeffFletcherOCR   2015-07-18 21:55 UTC  Angels have cancelled BP because of the rain. May be some rain during the game too. Still scheduled to start on time at 6.     This message was created by a bot  [Contact creator][Source code]
angelsbaseball,3dpgf3,icanbeyourzero,49,Sat Jul 18 04:38:40 2015 UTC,It is getting to the point where I can't even wrap my mind around how good Trout is. How great is it that he is an Angel. We are so fortunate to witness this history in the making.
angelsbaseball,3dpgf3,Audioms,22,Sat Jul 18 04:44:16 2015 UTC,"Nigga woah, I literally just wrote this exact post almost without reading yours. I completely agree. Fuck he's so great."
angelsbaseball,3dpgf3,OC_Slim,7,Sat Jul 18 04:58:47 2015 UTC,And he continues to get better.  There is going to be a lot of good Angels baseball for years to come.
angelsbaseball,3dpgf3,IronMan2017,42,Sat Jul 18 07:16:15 2015 UTC,Trout Week > Shark Week
angelsbaseball,3dpgf3,Kelmon,8,Sat Jul 18 04:47:10 2015 UTC,Bold... and true
angelsbaseball,3dpgf3,TortoiseMetaphors,38,Sat Jul 18 07:16:25 2015 UTC,I called it! Moment calhoun got out I said trout is getting a walk off. 2 seconds later BAM! The man is a freak of nature and I love it! UPTROUTS FOR EVERYONE!!
angelsbaseball,3dpgf3,Capt_Smuckers,19,Sat Jul 18 04:41:24 2015 UTC,Proud to be an Angels fan :')
angelsbaseball,3dpgf3,throwawayfashizzle,2,Sat Jul 18 04:49:46 2015 UTC,"I did too.  Got my daughter to bed, son was sleeping away, and momma was relaxing on the couch.  I glanced up from the dishes, looked at my wife and said, ""I'll finish the dishes in a minute, Trout is about to walk off.""  She looked at me like I was out of my mind as she has no clue what a walk off is.  Trout hit it out, I said I told you so, and went back to the dishes. She still thinks I'm crazy."
angelsbaseball,3dpgf3,BeachBum2012,23,Sat Jul 18 22:43:39 2015 UTC,Fuck Ya Trout!
angelsbaseball,3dpgf3,Gelu6713,24,Sat Jul 18 04:40:23 2015 UTC,"I'd let him impregnate my gf... trout genes, worth it."
angelsbaseball,3dpgf3,tsloan27,7,Sat Jul 18 04:50:42 2015 UTC,I'd let him impregnate me.  I'm a dude.
angelsbaseball,3dpgf3,laagamer,26,Sat Jul 18 15:53:20 2015 UTC,Aybar with the gatorade.
angelsbaseball,3dpgf3,TBTrpt3,24,Sat Jul 18 04:41:29 2015 UTC,http://giant.gfycat.com/IllegalWarmheartedFrilledlizard.gif
angelsbaseball,3dpgf3,bigmanlavos,12,Sat Jul 18 04:45:20 2015 UTC,"Man, they really need to wear those more often."
angelsbaseball,3dpgf3,Kelmon,4,Sat Jul 18 08:08:34 2015 UTC,Seriously.  They should be their Sunday home game unis.
angelsbaseball,3dpgf3,bigmanlavos,18,Sun Jul 19 01:29:32 2015 UTC,I can only get so hard Trout pls
angelsbaseball,3dpgf3,Nineties,19,Sat Jul 18 04:45:24 2015 UTC,Was at the game. Knew it was gone the moment he hit it.   Unreal
angelsbaseball,3dpgf3,lukotheboss,5,Sat Jul 18 04:54:41 2015 UTC,Same here man. Fucking majestic
angelsbaseball,3dpgf3,Weaver4prez,14,Sat Jul 18 05:07:57 2015 UTC,I love him
angelsbaseball,3dpgf3,Titan67,16,Sat Jul 18 04:47:47 2015 UTC,Stole Shigeru Robertson's walkoff.
angelsbaseball,3dpgf3,UltSomnia,13,Sat Jul 18 04:51:17 2015 UTC,YAAAAAAAAAA!
angelsbaseball,3dpgf3,LeBaconator,10,Sat Jul 18 04:56:46 2015 UTC,MASHED.
angelsbaseball,3dpgf3,wiNNA_monstER,21,Sat Jul 18 04:53:18 2015 UTC,UPTROUT UPTROUT UPTROUT UPTROUT UPTROUT UPTROUT UPTROUT UPTROUT UPTROUT UPTROUT UPTROUT UPTROUT UPTROUT UPTROUT UPTROUT UPTROUT UPTROUT UPTROUT UPTROUT UPTROUT
angelsbaseball,3dpgf3,GravyWaltz,8,Sat Jul 18 04:46:57 2015 UTC,Fuckin A! Light that Goobie up! !fuck ALL HAIL BASED SPIDER PLANT!
angelsbaseball,3dpgf3,Gmouth,5,Sat Jul 18 05:04:33 2015 UTC,"fuck you ixrs  I am a bot, and this action was performed automatically. Please contact the moderators of this subreddit if you have any questions or concerns."
angelsbaseball,3dpgf3,4niner,8,Sat Jul 18 05:04:33 2015 UTC,He's one of the troutiest trouts that's ever trouted.
angelsbaseball,3dpgf3,OC_Slim,12,Sat Jul 18 05:11:27 2015 UTC,Guys can I just say how fucking lucky the Halos are to have Trout. He really is a god. We're wittnessing history for sure and HE'S ON OUR TEAM! FUCK YA ANGELS 2k15!
angelsbaseball,3dpgf3,lrocha88,5,Sat Jul 18 04:57:34 2015 UTC,"I started yelling in my car, I didn't even care who stared!"
angelsbaseball,3dpgf3,TJeffersonsBlackKid,5,Sat Jul 18 05:56:31 2015 UTC,Friend bought me tickets right behind the Angels dugout for tonights game. I think there is blood in my throat from yelling.
angelsbaseball,3dpgf3,Shogun_36,4,Sat Jul 18 06:06:26 2015 UTC,MIKE FUCKING TROUT!!! I'M SO GLAD HE'S OURS! :)
angelsbaseball,3dpgf3,DMmeTh,6,Sat Jul 18 07:43:52 2015 UTC,"I was having a shitty day and this happens, I wasn't even able to see the game and my dad texted me a few highlights like no hitter and iannetta walking, then trout. It made me feel really happy when I needed it"
angelsbaseball,3dpgf3,Fuzzylumpkin,7,Sat Jul 18 11:05:47 2015 UTC,I don't think my donger could get any longer !meme
angelsbaseball,3dpgf3,Rogueofoz,1 point,Sat Jul 18 05:18:02 2015 UTC,"/u/kelmon makes dank memes  I am a bot, and this action was performed automatically. Please contact the moderators of this subreddit if you have any questions or concerns."
angelsbaseball,3dpgf3,laaabaseball,7,Sat Jul 18 05:18:03 2015 UTC,I'm hard for Trout
angelsbaseball,3dpgf3,tMoneyMoney,6,Sat Jul 18 06:01:19 2015 UTC,we're all hard for trout haha
angelsbaseball,3dpgf3,laaabaseball,3,Sat Jul 18 07:36:59 2015 UTC,JESUS WALKS OFF!!!
angelsbaseball,3dr88l,meeshkyle,6,Sat Jul 18 18:03:25 2015 UTC,"$40-$60, a little more if it's a charity you really like or don't mind spending money. Salmon autographs aren't exactly rare or valuable."
angelsbaseball,3dr88l,naaahhman,1 point,Sat Jul 18 20:15:16 2015 UTC,This is just an excuse to donate money! The Tim Salmon ball is just a cool souvenir of your good deed.
angelsbaseball,3dpgyf,laaabaseball,7,Sat Jul 18 04:44:24 2015 UTC,http://giant.gfycat.com/IllegalWarmheartedFrilledlizard.gif
angelsbaseball,3dpgyf,bigmanlavos,8,Sat Jul 18 04:49:22 2015 UTC,MVP
angelsbaseball,3dpgyf,i-need-approval,7,Sat Jul 18 04:49:28 2015 UTC,Video: BOS@LAA: Trout launches a walk-off shot to center  Larger Version (14.89 MB)  Smaller Version (4.77 MB)    More Info
angelsbaseball,3dpgyf,MLBVideoConverterBot,5,Sat Jul 18 04:52:03 2015 UTC,"Don't get to watch too many games. This one was a little slow, but that ending made up for it. TROUT MVP"
angelsbaseball,3dpgyf,icanbeyourzero,5,Sat Jul 18 04:51:39 2015 UTC,Albert getting all up in the Gooch during that celebration.
angelsbaseball,3dpgyf,liberaljedi,3,Sat Jul 18 05:45:14 2015 UTC,MVT
