angelsbaseball,3bex7j,Air_M_Jordan,2,Mon Jun 29 00:01:19 2015 UTC,2 Games over .500 %!
angelsbaseball,3bex7j,Rogueofoz,3,Sun Jun 28 23:07:01 2015 UTC,Endings like that really put the season in perspective. Thank god we're not the Mariners
angelsbaseball,3bex7j,legionfresh,6,Sun Jun 28 23:01:48 2015 UTC,rally spider plant
angelsbaseball,3bex7j,dslicex,7,Sun Jun 28 22:55:46 2015 UTC,I just won 3 lunches. I live in Seattle and all my coworkers are Mariners fans. I bet 3 of them lunch on the series.  LTBU!
angelsbaseball,3bex7j,Angela_Twerkel,4,Sun Jun 28 22:54:22 2015 UTC,Go for the expensive stuff ;)
angelsbaseball,3bex7j,DwightSchrute27,3,Sun Jun 28 22:55:49 2015 UTC,Rofl. I don't know what that was but I'll take it.
angelsbaseball,3bex7j,eye8urkids,3,Sun Jun 28 22:53:34 2015 UTC,I'll take it!
angelsbaseball,3bex7j,mculatie,3,Sun Jun 28 22:53:29 2015 UTC,Happy for you guys. A walkoff is a walkoff
angelsbaseball,3bex7j,illmatic2112,5,Sun Jun 28 22:53:08 2015 UTC,Lol
angelsbaseball,3bex7j,Cooleybob,6,Sun Jun 28 22:52:40 2015 UTC,That was a fucking gift.
angelsbaseball,3bex7j,lethalred,1 point,Sun Jun 28 22:52:33 2015 UTC,Is Mike Trout going to be intentionally walked at every at-bat for the rest of the season or something?
angelsbaseball,3bex7j,-FLuX-,3,Sun Jun 28 22:48:59 2015 UTC,I don't think that(the 2nd time) was as much about not pitching to him as it was forcing the guy on third to have to run home.
angelsbaseball,3bex7j,JJ_Spicket,1 point,Sun Jun 28 22:53:13 2015 UTC,Jesus christ
angelsbaseball,3bex7j,Enemu,3,Sun Jun 28 22:19:36 2015 UTC,"Fuck, Seager always crushes us"
angelsbaseball,3bex7j,CHUN_BUNS,4,Sun Jun 28 22:19:16 2015 UTC,sign the guy that just caught that foul ball.
angelsbaseball,3bex7j,mculatie,1 point,Sun Jun 28 22:15:41 2015 UTC,walk trout to pitch to pujols thisgonbegud.gif  not bad I guess
angelsbaseball,3bex7j,Enemu,3,Sun Jun 28 22:05:15 2015 UTC,lol intentional walk to get to pujols.
angelsbaseball,3bex7j,-FLuX-,2,Sun Jun 28 22:03:00 2015 UTC,"That commercial. Words can't bring me down, bitch."
angelsbaseball,3bex7j,TrustMeImALawStudent,4,Sun Jun 28 21:32:47 2015 UTC,Nothing could piss me off more than 3-0 and rolling rover into a double play.
angelsbaseball,3bex7j,attempt_number_two,6,Sun Jun 28 21:20:54 2015 UTC,"Anything near the zone, he's gotta be hackin'.    Mark Gubicza talking about a 3-0 count."
angelsbaseball,3bex7j,dukiehazzard,6,Sun Jun 28 21:23:09 2015 UTC,Guby pls
angelsbaseball,3bex7j,han__yolo,2,Sun Jun 28 21:39:41 2015 UTC,"Do you guys see the guy with the neck tats and the hat that just says ""jesus""? So edgy"
angelsbaseball,3bex7j,Fuzzylumpkin,5,Sun Jun 28 21:19:46 2015 UTC,"He couldn't possibly be as edgy as Felix. If there's a douchier looking player in MLB, I certainly haven't seen him."
angelsbaseball,3bex7j,dukiehazzard,3,Sun Jun 28 21:25:57 2015 UTC,Josh Donaldson. Fuck his rat face. He's good though.
angelsbaseball,3bex7j,Fuzzylumpkin,7,Sun Jun 28 21:37:41 2015 UTC,i want to see that pursuit
angelsbaseball,3bex7j,kroe_bar,1 point,Sun Jun 28 21:09:54 2015 UTC,I think the one thing I hope for when facing Felix is that he doesn't throw a perfect game/no hitter. We accomplished getting a hit so that's a win in my book.
angelsbaseball,3bex7j,StrokenBlast,4,Sun Jun 28 21:00:16 2015 UTC,"Anyone read in the Register about Santiago's massive memorabilia collection? I didn't know it was a thing, but apparently he's big on getting everyone in the mlb's signature. I thought it was pretty funny."
angelsbaseball,3bex7j,han__yolo,1 point,Sun Jun 28 19:53:54 2015 UTC,There's also a really nice article about Trumbo in the Register too.
angelsbaseball,3bex7j,IAmTheWalkingDead,2,Sun Jun 28 21:34:08 2015 UTC,He got a nice ovation during his first at bat yesterday.
angelsbaseball,3bex7j,TrustMeImALawStudent,2,Sun Jun 28 21:37:08 2015 UTC,Crazy impressive collection.
angelsbaseball,3bex7j,TrustMeImALawStudent,5,Sun Jun 28 21:24:17 2015 UTC,"Well our SP has a better ERA, anyway."
angelsbaseball,3bex7j,dukiehazzard,6,Sun Jun 28 19:06:40 2015 UTC,RALLY SPIDER PLANT  (See you at .500)
angelsbaseball,3bex7j,dslicex,6,Sun Jun 28 17:35:53 2015 UTC,Lets get that series win!!  Oh Felix is pitching...  IBELIEVE
angelsbaseball,3bdfca,wspaniel,3,Sun Jun 28 04:14:12 2015 UTC,Poor Featherston... He must have felt so bad.
angelsbaseball,3bdfca,soupdup,2,Sun Jun 28 11:14:33 2015 UTC,is there a video of it? I was at the game and i missed it. i was wondering why he was replaced with a DH
angelsbaseball,3bdfca,colehock,2,Sun Jun 28 06:00:57 2015 UTC,Screencap here: http://m.mlb.com/video/topic/vtp_mm_wrapup/v204890783?game_pk=414778  Aftermath (including a shot of the mouse on Cano's forehead) here: http://m.mlb.com/video/v204284383?game_pk=414778
angelsbaseball,3bdfca,MLBVideoConverterBot,1 point,Sun Jun 28 06:10:56 2015 UTC,Video: SEA@LAA: Cano exits game after getting hit in head  Larger Version (8.77 MB)  Smaller Version (2.47 MB)    More Info
angelsbaseball,3bdfca,colehock,1 point,Sun Jun 28 06:15:23 2015 UTC,Ahh thanks now i see
angelsbaseball,3bdfca,Angela_Twerkel,2,Sun Jun 28 06:23:23 2015 UTC,That's one way for Cano to start making contact with the ball.
angelsbaseball,3bdfca,TheJanitorsofChaos,1 point,Mon Jun 29 01:55:23 2015 UTC,He was pissed.
angelsbaseball,3bc0d3,tehdargon,8,Sat Jun 27 19:50:11 2015 UTC,Welcome to Orange County!   I have a three month old so we used to have interests but gave that up 90 days ago. Great idea btw.
angelsbaseball,3bc0d3,prpldrank,3,Sun Jun 28 01:07:11 2015 UTC,Thank you and congratulations. The wife is a nanny if you need some help sometime!
angelsbaseball,3bc0d3,hardangelfan,3,Sun Jun 28 03:57:29 2015 UTC,Fuck man. My girl and I are perfect! 29 and 30 Same exact interests! But I am at work and we going to tomorrow's game. Have fun!!
angelsbaseball,3bc0d3,StephieCupcakes,3,Sat Jun 27 23:40:01 2015 UTC,Well we are still looking for friends! Let us know if you want to hang out sometime.
angelsbaseball,3bc0d3,StephieCupcakes,3,Sun Jun 28 03:58:11 2015 UTC,"Oh wow, that describes my husband and I pretty closely! Unfortunately he has to work Saturday night, but maybe next time!"
angelsbaseball,3bc0d3,Logikz,3,Sun Jun 28 03:05:47 2015 UTC,"Still searching for friends, let us know if you want to meet up sometime!"
angelsbaseball,3bc366,angelsbaseball,3,Sat Jun 27 20:15:16 2015 UTC,"Fox announcers were so dreadful tonight.  ""Freese will make it in to third without a play-- oh, no, he's out at third!!""  AAAAUUUUGH.  Watched most of the 8th/9th with them muted."
angelsbaseball,3bc366,AlmostLucy,1 point,Sun Jun 28 07:31:04 2015 UTC,WOO SECOND PLACE
angelsbaseball,3bc366,DarinFuckingErstad,7,Sun Jun 28 05:22:31 2015 UTC,Tonight has been of the best of my life. Just wanted to share with my angels fam. Love yall.   Hopefully we can LTBU  Edit: time difference didn't help to make me realize that we had already won by the time I had posted this. LOL I feel like a dumbass haha anyways LBTU
angelsbaseball,3bc366,lukotheboss,1 point,Sun Jun 28 02:16:18 2015 UTC,Enjoy it buddy!
angelsbaseball,3bc366,Titan67,5,Sun Jun 28 06:24:03 2015 UTC,LTBU. Let's take the series tomorrow!
angelsbaseball,3bc366,IAmTheWalkingDead,3,Sun Jun 28 01:57:42 2015 UTC,LTBU!
angelsbaseball,3bc366,xobscure,7,Sun Jun 28 01:57:12 2015 UTC,"fml, that was close."
angelsbaseball,3bc366,hb_alien,5,Sun Jun 28 01:54:14 2015 UTC,Man. I hope Cano is okay. Did everyone see that bump on his head? And I don't just want him to be okay because I'm going to tomorrow's game and I really want to see him play.
angelsbaseball,3bc366,RedMachismo,5,Sun Jun 28 01:18:32 2015 UTC,"I know our game threads are quiet, but damn, 3 comments through 6? It's definitely a quiet game..."
angelsbaseball,3bc366,dslicex,5,Sun Jun 28 00:47:00 2015 UTC,"Considering that 90% of all the comments on it are things like ""Eat a dick Cano"", I never understand how the Mariners gameday threads are so active compared to other teams."
angelsbaseball,3bc366,JJ_Spicket,3,Sun Jun 28 01:15:23 2015 UTC,We usually use the IRC chat most of the time
angelsbaseball,3bc366,lukotheboss,9,Sun Jun 28 03:44:17 2015 UTC,"I bought a spider plant today. If we win, rally spider plant goes in the sidebar.  Ok, i'll settle for it being part of our vernacular  RALLY SPIDER PLANT"
angelsbaseball,3bc366,dslicex,5,Sat Jun 27 22:54:40 2015 UTC,"Bought a dog today, looks like we'll have to split the sidebar space."
angelsbaseball,3bc366,Air_M_Jordan,4,Sun Jun 28 02:15:25 2015 UTC,At this point it seems like we need our pitchers to throw 7 innings of shutout ball for us to win
angelsbaseball,3bc366,Hick_I_Am,5,Sat Jun 27 21:28:29 2015 UTC,Probably 17 innings of shutout ball would be best.
angelsbaseball,3bbt2b,angels_fan,8,Sat Jun 27 18:45:04 2015 UTC,"The train doesn't hit HB at all. Hopefully, you are renting a car, cause that's your best bet."
angelsbaseball,3bbt2b,naaahhman,5,Sat Jun 27 19:11:20 2015 UTC,"Also, are you an axe murderer? How many people is ""we""? I could probably give you a ride if work schedule permits."
angelsbaseball,3bbt2b,tom_whore,5,Sat Jun 27 19:47:03 2015 UTC,"""We"" is my wife and I.  I haven't murdered anybody with an ax for like a week, so...  :)"
angelsbaseball,3bbt2b,tom_whore,3,Sat Jun 27 21:07:36 2015 UTC,Just let me know the date and I'll see what I can do then. Where are you guys coming from?
angelsbaseball,3bbt2b,naaahhman,1 point,Sat Jun 27 22:39:59 2015 UTC,Coming from Utah.
angelsbaseball,3bbt2b,tom_whore,1 point,Sat Jun 27 23:34:37 2015 UTC,"This is your new best bet, /u/angels_fan. Tomwhore will even put on his best British accent. It's kind of phony and a bit muddled, but otherwise it's a good try at the accent."
angelsbaseball,3bbt2b,RelevantRange,2,Sat Jun 27 20:01:14 2015 UTC,I've heard worse... This acting career is going to take off I tell you...
angelsbaseball,3bbt2b,whothehelldidihit,4,Sat Jun 27 20:23:23 2015 UTC,Uber would likely be under $25 each way
angelsbaseball,3bbt2b,attempt_number_two,3,Sat Jun 27 19:40:18 2015 UTC,"I don't think the train comes from HB, but it's really easy to get there. You can take Beach Blvd to Katella. Katella is the street on the north side of the stadium. Shouldn't take too much time, even with traffic"
angelsbaseball,3bbt2b,tom_whore,2,Sat Jun 27 19:00:40 2015 UTC,Depending where your at in HB this could be far out of the way.  I take Victoria>55>5>57>Orange
angelsbaseball,3bbt2b,poundpoundpound,3,Sat Jun 27 19:36:09 2015 UTC,"Get the 72 down warner to harbor, then the 43 up harbor into Anaheim"
angelsbaseball,3bbt2b,tom_whore,3,Sat Jun 27 19:45:46 2015 UTC,Ooh interesting choice. I live on the north side of town and I take Springdale to the 405N to the 22E.
angelsbaseball,3bbt2b,FuckTheClippers,2,Sat Jun 27 20:08:48 2015 UTC,I used to get the 72/43 (or the commuter 543) when I was without a car working in Anaheim. The beauty is in its ease.
angelsbaseball,3bbrz1,MeatSnake9,2,Sat Jun 27 18:35:08 2015 UTC,Hey Im going today as well! although i havent gone in a while the little sundays in Mini helmets are pretty good
angelsbaseball,3bbrz1,colehock,4,Sat Jun 27 19:24:27 2015 UTC,Yes! The helmet nachos are a must!
angelsbaseball,3bbrz1,Shogun_36,1 point,Sat Jun 27 20:00:11 2015 UTC,The Christmas in june props may still be up.  Those are cool to check out
angelsbaseball,3bbrz1,halo_will27,1 point,Sat Jun 27 20:28:12 2015 UTC,How old are you? Try the Packing House if you are young enough to deal with all the insufferable hipsters.
angelsbaseball,3b8z0z,angelsbaseball,1 point,Fri Jun 26 23:05:11 2015 UTC,Doesn't look like Albert will be getting a pitch to hit anytime soon. He has walked in six straight games.
angelsbaseball,3b8z0z,TheJanitorsofChaos,1 point,Sat Jun 27 04:59:21 2015 UTC,What happened to aybar? I missed it
angelsbaseball,3b8z0z,The_OutRunner,1 point,Sat Jun 27 04:18:40 2015 UTC,They just showed him grabbing his ham string dosent look too serious.
angelsbaseball,3b8z0z,gregmau5,2,Sat Jun 27 04:22:10 2015 UTC,"Just turned the game on, had no idea Trumbo was playing for the Mariners now. I wish the Angels still had him."
angelsbaseball,3b8z0z,cats_are_overrated,1 point,Sat Jun 27 03:56:50 2015 UTC,What's up with the lack of walk up music tonight?
angelsbaseball,3b8z0z,Politicallybeastly,2,Sat Jun 27 03:31:02 2015 UTC,I could imagine the Mariners sub imploding if aybar is safe.
angelsbaseball,3b8z0z,StrokenBlast,2,Sat Jun 27 03:07:18 2015 UTC,The Mariners sub has a real hard on for mike trout eh? The hate is real.
angelsbaseball,3b8z0z,StrokenBlast,6,Sat Jun 27 03:00:41 2015 UTC,We're really just upset cause we got fucking Dustin Ackley.
angelsbaseball,3b8z0z,analogboy56,1 point,Sat Jun 27 03:11:47 2015 UTC,The ump is screwing shoe right now
angelsbaseball,3b8z0z,g0angels,6,Sat Jun 27 02:59:41 2015 UTC,Austin Jackson was safe by a mile. I'd be mad if I was a mariners fan.
angelsbaseball,3b8z0z,StrokenBlast,5,Sat Jun 27 02:49:02 2015 UTC,Our sub is livid
angelsbaseball,3b8z0z,sibewolf,2,Sat Jun 27 02:50:23 2015 UTC,I was listening to an MLB tv show yesterday and they were talking about the review guys that are former umps may have a biased against overturning calls against fellow umps. Sometimes I feel/think the same thing.
angelsbaseball,3b8z0z,StrokenBlast,2,Sat Jun 27 02:54:49 2015 UTC,"I was just complaining that it seems like a lot of replays are not being called correctly under the 'not enough evidence' rule. And it's not any specific ball clubs that I can tell, so maybe there is a little something to that theory."
angelsbaseball,3b8z0z,Just_for_shits,2,Sat Jun 27 03:00:52 2015 UTC,It could be solved by hiring a third party to do reviews.. but then I'd imagine you would get complaints that they don't know what to look for with a lack of experience that they'd have. It's sorta a slippery slope.
angelsbaseball,3b8z0z,StrokenBlast,1 point,Sat Jun 27 03:02:43 2015 UTC,For all we know they could just two guys rock paper scissoring over it with how secretive they are about the process.
angelsbaseball,3b8z0z,analogboy56,6,Sat Jun 27 03:13:34 2015 UTC,why is matt joyce allowed on the field?
angelsbaseball,3b8z0z,g0angels,2,Sat Jun 27 02:33:58 2015 UTC,"Technically, he's not. He's still in foul ground."
angelsbaseball,3b8z0z,naaahhman,2,Sat Jun 27 02:37:59 2015 UTC,thats not gonna change anytime soon
angelsbaseball,3b8z0z,g0angels,2,Sat Jun 27 02:58:41 2015 UTC,Trout. Yessss.
angelsbaseball,3b8z0z,yank_gooner,7,Sat Jun 27 02:22:14 2015 UTC,"It is currently 1:45 AM in Terciera, I'm staying up to watch this game with you fucks."
angelsbaseball,3b8z0z,lukotheboss,2,Sat Jun 27 01:45:20 2015 UTC,How long has trout been at the 3 hole? Is he/your team doing well there?
angelsbaseball,3b8z0z,pirana6,1 point,Sat Jun 27 01:07:58 2015 UTC,"The lineup has been like this for 9 games 5-4 in those games. It's not Trout teams should worry about right now, it's Pujols."
angelsbaseball,3b8z0z,naaahhman,5,Sat Jun 27 01:42:33 2015 UTC,Welcome back Mark. Plz no Trumbombs tho.
angelsbaseball,3b8z0z,IAmTheWalkingDead,2,Sat Jun 27 00:40:32 2015 UTC,"My day has been shit, let this game and trout be good to me."
angelsbaseball,3b8z0z,StrokenBlast,1 point,Sat Jun 27 00:11:58 2015 UTC,Here's hoping
angelsbaseball,3b8z0z,dslicex,1 point,Sat Jun 27 00:12:58 2015 UTC,Merry Christmas!
angelsbaseball,3b8z0z,TrustMeImALawStudent,1 point,Fri Jun 26 23:44:31 2015 UTC,"I have a good feeling about this game. Probably because it's the only thing I have to look forward to and I really don't want it to be a shit show.   But still, I have a good feeling about this  Edit: !$%@$%)!#$!)#%!$%#@_$%@)#$!$%!$%(!$*!  )$&!$!$%(!)%!  $%(!#($%"
angelsbaseball,3b8z0z,MartOut,3,Fri Jun 26 23:39:24 2015 UTC,"Tell me last year was real Shoe, it felt real to us."
angelsbaseball,3b8z0z,dslicex,0,Fri Jun 26 23:31:38 2015 UTC,"Guys we can't underestimate this last place team. They have some talent, though the are sitting in last place. We could lose this game to a last place team. This last place team is on the mend, they've gone 5-5 in their last 10. Though this last place team recently lost a game to Joe Blanton.   Face it guys, our Angels are about to lose this game to a last place team. The Angels always underestimate last place teams and it bites them in the butt. Did I mention the Mariners are in last place?"
angelsbaseball,3b8z0z,naaahhman,1 point,Fri Jun 26 23:18:06 2015 UTC,"I called it, I knew we'd fuck this one up. Cyjaun Walker. Jesus."
angelsbaseball,3b8z0z,naaahhman,2,Sat Jun 27 04:53:25 2015 UTC,Stahp
angelsbaseball,3b8z0z,StrokenBlast,2,Sat Jun 27 00:10:31 2015 UTC,Let's go Shoe! Keep the ball down and you'll be golden
angelsbaseball,3b5hb7,beepbopborp,10,Fri Jun 26 03:17:15 2015 UTC,Poor guy
angelsbaseball,3b5hb7,gambit700,1 point,Fri Jun 26 04:05:17 2015 UTC,"Eh apparently that's his third wife, when I see him on the show he seems to give off a ""oh fuck me where's the alcohol"" demeanor. Did good for himself though!"
angelsbaseball,3b5hb7,Titan67,4,Sun Jun 28 06:27:36 2015 UTC,It's her and Hammy's wife was added. Then Hammy's marriage and life fell apart.
angelsbaseball,3b5hb7,naaahhman,2,Fri Jun 26 04:06:31 2015 UTC,Oh the little blonde is hammys ex? My wife said she was married to another ball player but wasn't sure who.
angelsbaseball,3b5hb7,naaahhman,2,Fri Jun 26 04:15:00 2015 UTC,"I don't know, the house being built is next to the one Josh is selling. Other than that, she won't be featured much after the first couple of episodes."
angelsbaseball,3b5hb7,Titan67,1 point,Fri Jun 26 04:19:07 2015 UTC,"Yup, the other one is Hammy's wife, soon to be Ex, feel bad their dirty laundry got on national media and then she came onto to that show."
angelsbaseball,3b3gwz,naaahhman,3,Thu Jun 25 17:39:35 2015 UTC,"Awesome news. I heard he is tearing it up in the minors right now, does anyone know his stats? I'd look them up myself but T-Mobile's international data is super ridiculously slow"
angelsbaseball,3b3gwz,lukotheboss,1 point,Fri Jun 26 00:49:14 2015 UTC,Here you go. Low A he was amazing. High A not as much but still pretty good. Rocking 50 SO in 38 innings pitched with the 66ers!  http://www.baseball-reference.com/minors/player.cgi?id=newcom000sea&mobile=false
angelsbaseball,3b3gwz,seeg6,1 point,Fri Jun 26 01:33:44 2015 UTC,"Saw him pitch in Lake Elsinore a few weeks back! His stuff is electric, his control is where he needs to improve. He walked way too many people and got bounced early as a result, but man, the potential is tantalizing."
angelsbaseball,3b3gwz,cshenton,1 point,Fri Jun 26 15:37:47 2015 UTC,"@Alden_Gonzalez:   2015-06-25 16:41:06 UTC  #Angels pitching prospect Sean Newcomb selected for the Futures Game, will pitch for US roster.     [Mistake?] [Suggestion] [FAQ] [Code] [Issues]"
angelsbaseball,3b0lqu,Fuzzylumpkin,4,Thu Jun 25 00:31:13 2015 UTC,"I know it's a weekday game, but man is that depressingly empty. Sweet seats!"
angelsbaseball,3b0lqu,Jammer27,4,Thu Jun 25 05:41:48 2015 UTC,"It is, but I was originally in section 527 and was able to move down to right behind the Astros dugout for extras, so that's a plus. I could really see how short altuve is from that close."
angelsbaseball,3b0lqu,Neverend3r,2,Thu Jun 25 08:28:24 2015 UTC,"I really wouldn't expect California residents to be at this game when they could go to the previous night game instead. We got work, man. and its hot out there. We don't know how to handle 85 degrees and no shade."
angelsbaseball,3b0lqu,Frogface40,3,Thu Jun 25 17:41:12 2015 UTC,For real. I was melting but it was worth it.
angelsbaseball,3ayv1j,naaahhman,6,Wed Jun 24 16:34:19 2015 UTC,Just heard this on the radio. Fucking excited. Any news on what happened to Shoe?
angelsbaseball,3ayv1j,mwada1,7,Wed Jun 24 16:38:26 2015 UTC,"Too many dingers, that's really bad v the Astros. That's all they do."
angelsbaseball,3ayv1j,clutchyball,3,Wed Jun 24 16:52:28 2015 UTC,"Hey now - to be fair, we strike out as well. ;)"
angelsbaseball,3ayv1j,Rogueofoz,2,Wed Jun 24 17:27:08 2015 UTC,"No, we strike out and hit dingers"
angelsbaseball,3ayv1j,clutchyball,3,Wed Jun 24 19:27:45 2015 UTC,Stros fan here - what's the word on Heaney? I don't follow too many prospects aside from the Stros farm. Power arm?
angelsbaseball,3ayv1j,han__yolo,8,Wed Jun 24 17:31:24 2015 UTC,"He was the 30th rated prospect in all MLB, his numbers in AAA are inflated because altitude. He will strikeout at a good clip, but also walk a fair number."
angelsbaseball,3ayv1j,clutchyball,5,Wed Jun 24 17:27:41 2015 UTC,"I actually think he was the 20th, not that it's that big of a difference."
angelsbaseball,3ayv1j,Fuzzylumpkin,3,Wed Jun 24 17:29:28 2015 UTC,Thanks for the quick response!
angelsbaseball,3ayv1j,Rogueofoz,4,Wed Jun 24 17:53:21 2015 UTC,"Going to the game today. Was expecting shoe, but I'm excited to see Heaney in person!"
angelsbaseball,3ayv1j,TweetPoster,3,Wed Jun 24 17:30:06 2015 UTC,Heaney!!!!!!!!
angelsbaseball,3ayv1j,tMoneyMoney,1 point,Wed Jun 24 18:16:30 2015 UTC,@EKayAngels:   2015-06-24 16:24:54 UTC  Today's #Angels lineup. Heaney to start. Shoemaker now Friday pic.twitter.com [Imgur]     [Mistake?] [Suggestion] [FAQ] [Code] [Issues]
angelsbaseball,3ayv1j,Packattack622,1 point,Wed Jun 24 19:22:32 2015 UTC,Can't decided if I'm more excited to see Heaney or more excited that I won't have to see Weaver implode on the mound again.
angelsbaseball,3ayv5z,angelsbaseball,-5,Wed Jun 24 16:35:06 2015 UTC,"Yeah you guys stole that one being the awful calls in the 8th and 9th where we should have won the game, whatever Qualls sucks and I knew it was over when he came in."
angelsbaseball,3ayv5z,tormentlive,8,Thu Jun 25 13:07:18 2015 UTC,All three of those were the right call. Relax.
angelsbaseball,3ayv5z,cshenton,4,Thu Jun 25 15:13:45 2015 UTC,Featherston? Huh.
angelsbaseball,3ayv5z,dslicex,10,Thu Jun 25 00:19:51 2015 UTC,Stayed the whole game and got to move right behind the Astros dugout. What a game. LTBU!
angelsbaseball,3ayv5z,Fuzzylumpkin,6,Thu Jun 25 00:12:33 2015 UTC,Ltbu!! Nice bloop!
angelsbaseball,3ayv5z,tacocarnitas,8,Thu Jun 25 00:09:52 2015 UTC,That was most definitely a balk
angelsbaseball,3ayv5z,parrosstach,15,Thu Jun 25 00:07:37 2015 UTC,What the fuck is the point of manager challenges if the crew chief is gonna challenge everything close anyways?
angelsbaseball,3ayv5z,Cooleybob,3,Wed Jun 24 22:54:27 2015 UTC,The problem with playing the Astros is that I feel like at any moment they could homer
angelsbaseball,3ayv5z,Fuzzylumpkin,8,Wed Jun 24 22:46:01 2015 UTC,"Crewchief review? Seriously? Regardless of the call, this is bullshit"
angelsbaseball,3ayv5z,adf714,11,Wed Jun 24 22:26:07 2015 UTC,Out of reviews? No problem! The crewchief has your back!
angelsbaseball,3ayv5z,adf714,1 point,Wed Jun 24 22:54:35 2015 UTC,Got him!
angelsbaseball,3ayv5z,adf714,2,Wed Jun 24 22:22:55 2015 UTC,"Maybe it works out, but why are we sticking with Smith here? I don't like this"
angelsbaseball,3ayv5z,Fuzzylumpkin,3,Wed Jun 24 22:21:31 2015 UTC,4 strikeouts for Trout in the last 2 games...
angelsbaseball,3ayv5z,TBTrpt3,2,Wed Jun 24 22:21:25 2015 UTC,Smith pls
angelsbaseball,3ayv5z,adf714,5,Wed Jun 24 21:56:10 2015 UTC,LOOOOOOOL THAT BALL WAS HIT SO WELL IT MADE IT ALLTHE WAY TO THE WARNING TRACK
angelsbaseball,3ayv5z,MartOut,6,Wed Jun 24 21:53:54 2015 UTC,I've noticed Rojas getting really excited about routine flyballs to the outfield lately. Like even off the bat I could tell it didn't really have a chance
angelsbaseball,3ayv5z,adf714,5,Wed Jun 24 21:56:04 2015 UTC,"I noticed that yesterday too. With these two teams, though, he's right more times than he's wrong"
angelsbaseball,3ayv5z,MartOut,2,Wed Jun 24 21:57:51 2015 UTC,"Yeah I suppose, but I've always assumed that most broadcasters have been around the game long enough to have a pretty good idea of what is going to be a homerun and what is not. I'm not saying Rojas isn't knowledgable, but it kind of comes off as amateurish. Oh well, still love the guys in the booth"
angelsbaseball,3ayv5z,adf714,5,Wed Jun 24 22:01:09 2015 UTC,"He's a human being who is bound to get excited about things. It's actually more impressive to be excited and enthusiastic while maintaining a lack of bias towards the home team in everything else, like this duo has. There are more professional sportscasters out there, and there are more enjoyable ones, but this duo us alright, mostly because of that attitude"
angelsbaseball,3ayv5z,MartOut,2,Wed Jun 24 22:03:52 2015 UTC,Yeah that's true. I always love his bluntness when talking about an underperforming player and the chemistry he and Gubicza have. The only Angels broadcaster I'm not fond of is Langston.
angelsbaseball,3ayv5z,adf714,5,Wed Jun 24 22:06:42 2015 UTC,Fucking score runs angels!
angelsbaseball,3ayv5z,Rogueofoz,3,Wed Jun 24 21:52:19 2015 UTC,Odds on ianetta coming through here? I say just south of 0  Eta: that walk was good though
angelsbaseball,3ayv5z,Fuzzylumpkin,3,Wed Jun 24 21:29:12 2015 UTC,Come on guys! Let's get Heaney some run support for this great first start he's having!
angelsbaseball,3ayv5z,Cooleybob,4,Wed Jun 24 21:22:07 2015 UTC,This pitch count is pure sex
angelsbaseball,3ayv5z,Weaver4prez,7,Wed Jun 24 20:31:38 2015 UTC,"Heaney with 24 through 3? Wtf is this ""pitch economics""? It's refreshing"
angelsbaseball,3ayv5z,dslicex,6,Wed Jun 24 20:29:48 2015 UTC,Is this Heaney's first start with us? I feel like I've seen him pitch this year but I can't remember
angelsbaseball,3ayv5z,Fuzzylumpkin,5,Wed Jun 24 19:58:25 2015 UTC,"He pitched v Dodgers, right before the start of the season. Other than that, no."
angelsbaseball,3ayv5z,naaahhman,4,Wed Jun 24 20:02:26 2015 UTC,He hasn't pitched for us before today. This is his Angels debut :)
angelsbaseball,3ayv5z,Cooleybob,1 point,Wed Jun 24 20:02:05 2015 UTC,Trout please don't start striking out 3 times a game again.
