angelsbaseball,39n7dk,MikeXiL,10,Sat Jun 13 04:48:19 2015 UTC,"Does that say ""Calhoonigans"" in the outfield?"
angelsbaseball,39n7dk,Grantology,8,Sat Jun 13 04:42:47 2015 UTC,In the Calzone!
angelsbaseball,39n7dk,IAmTheWalkingDead,3,Sat Jun 13 05:04:23 2015 UTC,Way better then the Hamiltown crap last year.
angelsbaseball,39n7dk,Firstadam,3,Sat Jun 13 06:30:08 2015 UTC,Home run crew delivers!! 
angelsbaseball,39n7dk,tacocarnitas,12,Sat Jun 13 04:41:09 2015 UTC,"Trout and Calhoun are studs! Hell yeah, go Angels!"
angelsbaseball,39n7dk,Politicallybeastly,7,Sat Jun 13 04:39:52 2015 UTC,BOOOOM  Halos teeing off.
angelsbaseball,39n7dk,hb_alien,5,Sat Jun 13 04:39:26 2015 UTC,God dammit Salas....
angelsbaseball,39n7dk,MikeXiL,7,Sat Jun 13 04:18:20 2015 UTC,What a bullshit inning. Umpire blows the call at first and can't review it and Navarro gets called out on a ball. The umpires handed the A's two outs that inning.
angelsbaseball,39n7dk,Kelmon,0,Sat Jun 13 04:11:38 2015 UTC,"You didn't do a pregame maymay, we were bound to lose."
angelsbaseball,39n7dk,naaahhman,2,Sat Jun 13 04:29:42 2015 UTC,Damn we got hosed in that inning. Gia and then Navarro. On the Gia call I can understand why they don't want managers to have limitless challenges but 2 or 3 per game might be more fair.
angelsbaseball,39n7dk,ShittyDetectiving,3,Sat Jun 13 04:09:27 2015 UTC,Safe by a mile!!!
angelsbaseball,39n7dk,tacocarnitas,3,Sat Jun 13 04:05:52 2015 UTC,Horseshit call.  The ref knows he fucked up.
angelsbaseball,39n7dk,mculatie,15,Sat Jun 13 04:05:22 2015 UTC,Give it to em Sosh. Gia was safe.
angelsbaseball,39n7dk,dslicex,-2,Sat Jun 13 04:04:15 2015 UTC,We fucking suck.
angelsbaseball,39n7dk,naaahhman,0,Sat Jun 13 03:39:14 2015 UTC,"Goddammit /u/H1N1777, stop using your alts to harass and cause drama. This is a final warning."
angelsbaseball,39n7dk,naaahhman,6,Sat Jun 13 19:59:17 2015 UTC,are we the worst base-stealing team in baseball?  feels that way.
angelsbaseball,39n7dk,mculatie,3,Sat Jun 13 21:34:00 2015 UTC,I feel like runners rarely get caught stealing against us as well.
angelsbaseball,39n7dk,IAmTheWalkingDead,5,Sat Jun 13 02:43:06 2015 UTC,Checking in from the big A. Section 522. 12th game of the season and I'm not a season ticket holder. Lord help me. I'm addicted to Angel baseball.
angelsbaseball,39n7dk,RedMachismo,9,Sat Jun 13 03:30:36 2015 UTC,Jesse Chavez looks like a dude that would steal your tv and then help you look for it.
angelsbaseball,39n7dk,naaahhman,11,Sat Jun 13 01:48:25 2015 UTC,You've used this before
angelsbaseball,39n7dk,dslicex,8,Sat Jun 13 00:47:39 2015 UTC,"So? Does it negate the fact that Jesse Chavez looks like a dude who would steal your tv and help you look for it? No, it's still a relevant comment"
angelsbaseball,39n7dk,naaahhman,3,Sat Jun 13 00:55:30 2015 UTC,Gona be there. Getting my Kalhoun Bobblehead
angelsbaseball,39n7dk,Peffico,3,Sat Jun 13 00:57:02 2015 UTC,Hail Santiago. Our quality start starter is on the mound
angelsbaseball,39n7dk,dslicex,0,Sat Jun 13 00:01:02 2015 UTC,"Guise, I'm watchin the Reds/Cubs....  Boeschenhitler just Ked.... Classic Boeschowitz."
angelsbaseball,39laev,Rogueofoz,14,Fri Jun 12 15:01:38 2015 UTC,"Pujols through Apr 24: 17 G, 69 PA, .177/.261/.355, 3 HR, 7 RBI  Pujols since Apr 24: 40 G, 170 PA, .302/.341/.604, 14 HR, 25 RBI"
angelsbaseball,39laev,scolbert08,3,Fri Jun 12 17:02:00 2015 UTC,"GOING, GOING.. GONE!"
angelsbaseball,39laev,dudmun,9,Fri Jun 12 20:38:37 2015 UTC,doesnt matter when no one is on base :O
angelsbaseball,39laev,proteinMeMore,15,Fri Jun 12 16:20:00 2015 UTC,"Yes, but their continued reliance on the long ball is not good.  They're 8th in the league in percentage of hits that are HRs but 21st in runs scored.  I would love to see them be able to scratch out runs again."
angelsbaseball,39laev,zodar,6,Fri Jun 12 15:49:58 2015 UTC,"Yeah... If the rest of the line up could raise their OBP, that'd be great..."
angelsbaseball,39laev,muzakx,4,Fri Jun 12 16:11:29 2015 UTC,The good news is that in the last 20 games we've moved from dead last in MLB in OBP up to 23rd. So that's something.
angelsbaseball,39laev,ShittyDetectiving,1 point,Fri Jun 12 16:52:13 2015 UTC,Pujols' OBP isn't that great either. Hopefully it continues to rise.
angelsbaseball,39laev,tMoneyMoney,7,Sat Jun 13 03:29:14 2015 UTC,"Agreed. Mike has made his name as a manager using small ball. He needs to channel that again. That being said, it's really refreshing to see Albert being Albert again."
angelsbaseball,39laev,ratmrocks89,2,Fri Jun 12 16:10:20 2015 UTC,I think he's trying but this team just isn't as good as stealing and bunting as teams in the past.
angelsbaseball,39laev,tMoneyMoney,3,Sat Jun 13 03:30:32 2015 UTC,"Yesterday was a good ""small-ball"" type game; the problem is the basepaths have been absolute murder on the Angels. They've made more baserunning mistakes than any other team."
angelsbaseball,39laev,shiftyeyedgoat,2,Fri Jun 12 19:24:41 2015 UTC,Perhaps the best he's looking in an Angel uniform. Very excited for the rest of the season.
angelsbaseball,39lvzy,The_Illa_Vanilla,1 point,Fri Jun 12 17:28:45 2015 UTC,Holy crap that place is depressing with everything taken away from it.
angelsbaseball,39hanl,molodyets,9,Thu Jun 11 18:35:03 2015 UTC,What a classy freaking guy!   Makes me proud to wear his Jersey!
angelsbaseball,39hanl,trabbledot,8,Thu Jun 11 19:21:05 2015 UTC,"Trout is a good man, and I am so proud to be his supporter."
angelsbaseball,39hanl,chupa72,10,Fri Jun 12 04:28:42 2015 UTC,"This is awesome, Albert does stuff like this too."
angelsbaseball,39hz8y,g3allen10,1 point,Thu Jun 11 21:06:02 2015 UTC,Nice...
angelsbaseball,39hz8y,stuckinthepow,1 point,Fri Jun 12 14:45:45 2015 UTC,That's a really solid number huh?  Also Bastille day.
angelsbaseball,39hqf7,angelsbaseball,1 point,Thu Jun 11 20:10:07 2015 UTC,Kubitza is batting
angelsbaseball,39hqf7,Rogueofoz,6,Fri Jun 12 14:56:05 2015 UTC,"First, congrats to Pujols on 537.  Dude is a beast.  Second, thank you Angels bros for beating the Rays.  I knew there was a reason I liked you."
angelsbaseball,39hqf7,ajwhite98,14,Fri Jun 12 02:26:24 2015 UTC,I like the Pujols v Trout home run race.... But they should go every other day.
angelsbaseball,39hqf7,naaahhman,1 point,Fri Jun 12 02:12:18 2015 UTC,Was Aybar jogging to the plate again on that double?! Scioscia was not happy with him when he got back to the dugout and he almost never says anything to a guy like that.
angelsbaseball,39hqf7,dukiehazzard,2,Fri Jun 12 01:35:08 2015 UTC,That's the Jeppy I remember!
angelsbaseball,39hqf7,DonnieDon24,1 point,Fri Jun 12 01:28:15 2015 UTC,Can someone explain to me why Iannetta didn't bunt?
angelsbaseball,39hqf7,DonnieDon24,2,Fri Jun 12 01:26:08 2015 UTC,Because he sucks at bunting. He hasn't bunted successfully since 2011.
angelsbaseball,39hqf7,Fuzzylumpkin,5,Fri Jun 12 01:36:33 2015 UTC,Holy shit we did a thing!
angelsbaseball,39hqf7,mculatie,2,Fri Jun 12 00:56:16 2015 UTC,"If any mods are around, I submitted a text post about the draft last night but I think it got caught in a spam filter or something. If there's not a problem with it maybe it could be released or I could re-post it."
angelsbaseball,39hqf7,IAmTheWalkingDead,2,Thu Jun 11 23:36:38 2015 UTC,"I fixed it, for some reason automoderator took it down."
angelsbaseball,39hqf7,naaahhman,2,Fri Jun 12 00:19:15 2015 UTC,Thanks!
angelsbaseball,39hqf7,IAmTheWalkingDead,3,Fri Jun 12 01:13:55 2015 UTC,500 BASEBALL BABYY LETS GOOOO
angelsbaseball,39hqf7,dslicex,2,Thu Jun 11 22:31:08 2015 UTC,We fucking blow!! but... Win this one!
angelsbaseball,39hqf7,Rogueofoz,4,Thu Jun 11 21:37:58 2015 UTC,"Hey Angels fans! My dad accidentally bought tickets to tomorrow's game back when they went on sale (he was trying to buy ones for Saturday, which we did eventually get). Problem is: we still have them! We thought they'd be easy to sell on stubhub because it's a bobblehead game, but no go. We paid $106 each for them BEFORE service fees. They're now listed on stubhub for $80 $70, which includes fees. You'd be getting a steal. 4 tickets available. They're Field MVP 125, Row Z. Instant download, so you could buy them today or even tomorrow and print them out. Please please someone buy them! Haha. Right now they're listed as only being able to buy all 4, but if you are really interested in them, we're getting desperate and we could probably change it to selling in sets of 2 if you message me with your interest.   Meanwhile, I will be at the games on Saturday and Sunday. :-)  EDIT: $70 NOW!"
angelsbaseball,39hqf7,callie06,1 point,Thu Jun 11 21:07:19 2015 UTC,Hope you find someone to take them! I would but I already have tickets i bought months ago. If you are near the stadium you could sell them in person to someone pretty quick. like in the restaurants/bars next to the stadium.
angelsbaseball,39hqf7,Neverend3r,2,Fri Jun 12 19:57:33 2015 UTC,"Someone FINALLY bought them off stubhub today when they were reduced to $60. We're going to be in town, but at Disneyland today so it would've been hard to sell them in person."
angelsbaseball,39hqf7,callie06,5,Fri Jun 12 20:36:09 2015 UTC,I'm so tired of this team playing such mediocre baseball. Just win some damn games.
angelsbaseball,39hqf7,Kelmon,1 point,Thu Jun 11 20:48:41 2015 UTC,I blaming the lack of your memes. That and ixrs wearing a new fox suit.
angelsbaseball,39hqf7,naaahhman,3,Thu Jun 11 20:53:01 2015 UTC,Should I submit a rally meme?
angelsbaseball,39hqf7,Kelmon,1 point,Thu Jun 11 21:00:45 2015 UTC,"You may submit a high quality meme if it a) makes fun of ixrs and 2) helps us win a game.  Please don't cause, we don't want memes in the subreddit. If you must, the game threads are the only place for them."
angelsbaseball,39hqf7,naaahhman,4,Thu Jun 11 21:03:21 2015 UTC,"This is the best I got for you, /u/naaahhman"
angelsbaseball,39hqf7,Kelmon,2,Thu Jun 11 21:12:02 2015 UTC,So many questions...  1)  Was ixrs in the house?  ii. Was ixrs wearing his fox suit?  C. Was ixrs getting shit on by a 2 bit hooker?
angelsbaseball,39hqf7,naaahhman,2,Thu Jun 11 21:18:05 2015 UTC,fuck ixrs
angelsbaseball,39hqf7,Rogueofoz,1 point,Thu Jun 11 21:36:53 2015 UTC,yes   ii. of course  C. this is ixrs; yes   he is dead
angelsbaseball,39hqf7,Kelmon,2,Thu Jun 11 21:20:14 2015 UTC,If we get shutout we're blaming the quality of your meme.
angelsbaseball,39hqf7,naaahhman,1 point,Thu Jun 11 21:21:11 2015 UTC,ahem
angelsbaseball,39hqf7,Kelmon,1 point,Fri Jun 12 04:59:27 2015 UTC,"You now gotta do one, and only one, in the game thread before each game."
angelsbaseball,39c9ky,angelsbaseball,2,Wed Jun 10 20:10:25 2015 UTC,Jepsen :(
angelsbaseball,39c9ky,Rogueofoz,2,Thu Jun 11 01:00:53 2015 UTC,It's only the 3rd Weave... Pls keep it under control. Thx.
angelsbaseball,39c9ky,IAmTheWalkingDead,2,Thu Jun 11 00:07:33 2015 UTC,Hell of a first day for Kubitza. His mind must be racing everywhere.
angelsbaseball,39c9ky,IAmTheWalkingDead,1 point,Wed Jun 10 23:54:37 2015 UTC,"He's earning the nickname of Gomer, real fast."
angelsbaseball,39c9ky,naaahhman,1 point,Thu Jun 11 00:00:32 2015 UTC,"Damn, Kubitzas not making the smartest plays out there. Hopefully it's just the debut jitters."
angelsbaseball,39c9ky,ST4TEOFW4R,2,Wed Jun 10 23:54:35 2015 UTC,This is some sloppy baseball
angelsbaseball,39c9ky,ilikehockey2,3,Wed Jun 10 23:44:03 2015 UTC,"Ok, I'm cautiously returning to the fold today."
angelsbaseball,39c9ky,dslicex,2,Wed Jun 10 21:28:08 2015 UTC,"Fuck your cautious, we reckless."
angelsbaseball,39c9ky,naaahhman,1 point,Wed Jun 10 21:41:17 2015 UTC,Kubitza got that literally
angelsbaseball,39c9ky,Rogueofoz,2,Thu Jun 11 00:30:50 2015 UTC,"Well, we know Weaver's ERA is...but..."
angelsbaseball,39c9ky,dslicex,3,Wed Jun 10 22:00:01 2015 UTC,ITS KUBI TIME
angelsbaseball,39c9ky,breakfast_cats,4,Wed Jun 10 20:39:28 2015 UTC,Let's win this!!
angelsbaseball,39c9ky,Rogueofoz,1 point,Wed Jun 10 20:30:23 2015 UTC,Sorry.
angelsbaseball,39c9ky,stuckinthepow,1 point,Thu Jun 11 07:04:27 2015 UTC,we suck :(
angelsbaseball,39c9ky,Rogueofoz,-2,Thu Jun 11 14:52:12 2015 UTC,"So long fucknut, our old friend.  Hello Kubitza..."
angelsbaseball,39c9ky,naaahhman,2,Wed Jun 10 20:21:37 2015 UTC,fucknut is still there
angelsbaseball,397esd,angelsbaseball,2,Tue Jun 9 20:10:42 2015 UTC,LTBU!
angelsbaseball,397esd,Rogueofoz,7,Wed Jun 10 15:12:28 2015 UTC,These game threads are as dead as Tropicana field
angelsbaseball,397esd,ScrambleSoup,2,Wed Jun 10 02:26:51 2015 UTC,and the chat is no better :(
angelsbaseball,397esd,Rogueofoz,6,Wed Jun 10 15:12:37 2015 UTC,HOLY SHIT WE WON A GAME!
angelsbaseball,397esd,DwightSchrute27,2,Wed Jun 10 02:12:40 2015 UTC,Making up for that lack of runs against the Yanks
angelsbaseball,397esd,Shinanigins,7,Wed Jun 10 00:53:20 2015 UTC,Albert with that dinger ties Mickey Mantle on the all time home run list!
angelsbaseball,397esd,DwightSchrute27,3,Wed Jun 10 00:39:27 2015 UTC,so... Pujols....
angelsbaseball,397esd,Rogueofoz,5,Wed Jun 10 00:35:29 2015 UTC,GO HALOS!
angelsbaseball,397esd,xobscure,4,Tue Jun 9 23:15:05 2015 UTC,RIDE OR DIE BABY! ALL ABOARD! CHOOO CHOOO! TRAIN TO HELL HERE WE COME!
angelsbaseball,397esd,stuckinthepow,3,Tue Jun 9 23:02:26 2015 UTC,"Ok, if we dont take this series i think I'll be taking a break from baseball I can't take take anymore Anaheim disappointments.."
angelsbaseball,397esd,DwightSchrute27,6,Tue Jun 9 23:01:37 2015 UTC,WE'RE ON THE SUCK TRAIN TO SUCK TOWN ALL WHILE WE GET TO PLAY IN SUCK STADIUM. DEAR GOD WE SUCK.
angelsbaseball,397esd,naaahhman,4,Tue Jun 9 21:21:57 2015 UTC,"Yeah, Moe"
angelsbaseball,396jhz,alexei5000,1 point,Tue Jun 9 16:47:26 2015 UTC,more info
angelsbaseball,393tjm,mistere676,15,Tue Jun 9 01:41:22 2015 UTC,"Hey, I know him! He went to my high school! Some of my friends and I are scratching our heads over why he was chosen in the first round though..."
angelsbaseball,393tjm,kgbagent090,11,Tue Jun 9 02:32:43 2015 UTC,Well that's reassuring.
angelsbaseball,393tjm,muzakx,5,Tue Jun 9 13:37:45 2015 UTC,Lol so he didn't look good enough in high school to be a first round talent? That inspires confidence.
angelsbaseball,393tjm,Cooleybob,2,Tue Jun 9 16:59:41 2015 UTC,"Same here. I'm from Fresno, not exactly a gold mine of talent. But, these guys brought us Trout... so who am I to question."
angelsbaseball,393tjm,mightyneek,10,Tue Jun 9 19:59:54 2015 UTC,"I don't follow the draft closely, but apparently this was a big ""WTF"" moment. Most experts seemed to think he was not a 1st round guy.  I love that MLB Network showed the Angels' draft room celebrating after the Orioles' pick, too. ""OMG the guy nobody else wanted is still available somehow!"""
angelsbaseball,393tjm,dukiehazzard,5,Tue Jun 9 01:59:39 2015 UTC,"Video: Draft Report: Taylor Ward, College Catcher  Larger Version (12.3 MB)  Smaller Version (3.91 MB)    More Info"
angelsbaseball,393tjm,MLBVideoConverterBot,3,Tue Jun 9 01:43:45 2015 UTC,"I am surprised that Daz Cameron slipped through the first round. I think we should have taken a pitcher, Yankees took Funkhouser like 4 picks later..."
angelsbaseball,393tjm,soupdup,6,Tue Jun 9 04:55:09 2015 UTC,I wish we would have picked up Funkhouser based on his name alone.
angelsbaseball,393tjm,adf714,2,Tue Jun 9 06:30:03 2015 UTC,"I mean really, a College catcher over a College pitcher? Was it the right choice to go that way with our first pick? And we don't have another until 70, I hope we take an arm at that spot.  Edit: looks like we took an OF with pick #70. We're gambling on Tropeano and Heaney it seems, and Newcomb has already moved up to high A. Maybe Newcomb can be given a ST invite next spring if he does well in high A."
angelsbaseball,393tjm,soupdup,6,Tue Jun 9 08:07:37 2015 UTC,Fresno State alumn--confused but hopeful.
angelsbaseball,393tjm,dudmun,4,Tue Jun 9 06:59:35 2015 UTC,As I understand from the little analysis that I've seen...  we got another good defensive catcher who doesn't really hit?  Am I right in that assumption?  What gives?
angelsbaseball,393tjm,BeachBum2012,4,Tue Jun 9 15:42:57 2015 UTC,"That's what it appears to be.  The Angels draft room looked super excited about getting somebody who should've been on the board a lot longer according to projections:  ""Ward, who just finished his junior year at Fresno State, was slated as the 70th overall prospect by Baseball America, and mlb.com ranked him 99th.  The Los Angeles Angels thought even higher of Ward, taking him with the 26th overall pick in the first round of the draft."""
angelsbaseball,393tjm,soupdup,3,Tue Jun 9 16:29:04 2015 UTC,"From the article on the At Bat app, that'd be the exact words that came from the Angels scouting director for the most part.  ""Wilson projects he can be ready by 2018 and believes he can be ""a .250, .255 hitter, maybe 12- to 15 homer type.  Defense is his biggest strength. Offense is his biggest question""."
angelsbaseball,393tjm,BeachBum2012,5,Tue Jun 9 15:52:12 2015 UTC,"So, more of the same.  Groovy.  Just what we needed."
angelsbaseball,393tjm,Johnnystan69,3,Tue Jun 9 16:12:01 2015 UTC,You don't pick a projected .250 position player with 10+ HR pop in the top 50. Especially given that projections are best-case. He better be clone of Yadier defensively to make this pick worth it.
angelsbaseball,393tjm,g0angels,6,Tue Jun 9 16:32:19 2015 UTC,Please not another Mathis
angelsbaseball,393tjm,Imperial10,7,Tue Jun 9 01:42:31 2015 UTC,Dont you talk bad about GOAT .180 BA Mathis.
angelsbaseball,393tjm,naaahhman,6,Tue Jun 9 02:13:38 2015 UTC,"You'll take your Mathis, and /u/goattnder and /u/phronesis will like it."
angelsbaseball,393tjm,GoatTnder,2,Tue Jun 9 02:00:39 2015 UTC,We do!!!
angelsbaseball,393tjm,cshenton,1 point,Tue Jun 9 04:15:34 2015 UTC,"In defense of the pick: from what I understand, the teams were a lot higher on Ward than the draft experts were. The Angels draft room was celebrating because they were actually not expecting him to be available when we drafted.  Welcome Taylor, best of luck!"
angelsbaseball,393t2z,lukotheboss,11,Tue Jun 9 01:37:33 2015 UTC,"I'm a little confused, I thought we needed some hitters. This guy is a D first type."
angelsbaseball,393t2z,Audioms,5,Tue Jun 9 01:46:11 2015 UTC,"Slow, can't hit... don't we have that guy on our roster now?"
angelsbaseball,393t2z,mistere676,4,Tue Jun 9 01:48:25 2015 UTC,Which one? There are many to choose from
angelsbaseball,393t2z,gambit700,3,Tue Jun 9 06:44:06 2015 UTC,"Video: Draft Report: Taylor Ward, College Catcher  Larger Version (12.3 MB)  Smaller Version (3.91 MB)    More Info"
angelsbaseball,393t2z,MLBVideoConverterBot,1 point,Tue Jun 9 02:01:26 2015 UTC,"Is drafting Taylor Ward come kind of attempt at a ""moneyball"" move? Some kind of magical OPS or something?  Or is it a money issue/draft bonus pool issue of some kind?"
angelsbaseball,393t2z,IAmTheWalkingDead,1 point,Tue Jun 9 07:15:39 2015 UTC,"If I had to guess, it's that there's a big shortage of major league level backstops.  So this guy could be trade leverage down the road, or some scout has seen something impressive in his ability enough to convince Dipoto/Scioscia this is the way to go."
angelsbaseball,393t2z,schplat,1 point,Tue Jun 9 17:28:51 2015 UTC,Or perhaps convert him to pitcher?
angelsbaseball,393t2z,AlmostLucy,1 point,Tue Jun 9 23:11:22 2015 UTC,"But is that a sound strategy for a first round draft pick? Wouldn't you want to draft someone who, as best as you can guess, is going to produce at the position they're at? And save the pitching conversions for ""shit, might as well give this a try"" as a last ditch effort?"
angelsbaseball,393t2z,IAmTheWalkingDead,1 point,Tue Jun 9 23:20:55 2015 UTC,He's not moving to pitcher..
angelsbaseball,393t2z,cshenton,1 point,Tue Jun 9 23:30:10 2015 UTC,Lots of college guys this year
angelsbaseball,38wpwb,angelsbaseball,1 point,Sun Jun 7 14:05:06 2015 UTC,"Damn it angels, letting the yanks roll you over like that. Need them to lose!"
angelsbaseball,38wpwb,andycaps,4,Sun Jun 7 22:23:16 2015 UTC,Trout has been homer or bust as of late. Really the whole team has.The offense needs to start stringing together real rallies instead of 2 out solo shots.
angelsbaseball,38wpwb,Cooleybob,2,Sun Jun 7 21:37:01 2015 UTC,"His last 4, and 5 of his last 6 hits have been HR's. He's been lining out a lot and his BABIP is down significantly this year (.310 entering today. He's at .356 for his career.) I expect he'll get hot soon."
angelsbaseball,38wpwb,dukiehazzard,3,Sun Jun 7 22:03:33 2015 UTC,FUCK THE SHORT PORCH
angelsbaseball,38wpwb,lukotheboss,3,Sun Jun 7 19:12:19 2015 UTC,Holy shit this is painful.. I'm about ready for some major trades to happen! Or at least one.
angelsbaseball,38wpwb,Laaoa47,2,Sun Jun 7 18:38:08 2015 UTC,"Yeah, but we don't exactly have the means to be buyers. Heaney, Newcomb, and maybe Tropeano are about the only prospects worth anything."
angelsbaseball,38wpwb,dukiehazzard,2,Sun Jun 7 19:16:13 2015 UTC,And I'm pretty sure all three are hands off at the moment
angelsbaseball,38wpwb,schplat,3,Sun Jun 7 23:34:17 2015 UTC,Back to doing this now...time to go outside!
angelsbaseball,38wpwb,tacocarnitas,4,Sun Jun 7 18:26:35 2015 UTC,I'll see you guys tomorrow. Fuck. This. Game!!!
angelsbaseball,38wpwb,hardangelfan,2,Sun Jun 7 18:25:57 2015 UTC,Here we go again...
angelsbaseball,38wpwb,IAmTheWalkingDead,2,Sun Jun 7 18:25:43 2015 UTC,That was terrible.
angelsbaseball,38wpwb,CaptainHadley,3,Sun Jun 7 17:59:21 2015 UTC,Run Aybar. -_-
angelsbaseball,38wpwb,wspaniel,8,Sun Jun 7 17:45:16 2015 UTC,"Ianetta, Cron, and Joyce.  Back to having a massive black hole in the lineup."
angelsbaseball,38wpwb,dukiehazzard,8,Sun Jun 7 17:31:33 2015 UTC,How long are we going to do this Joyce thing?
angelsbaseball,38wpwb,The_Illa_Vanilla,4,Sun Jun 7 17:30:58 2015 UTC,"We really like these solo shots, don't we?"
angelsbaseball,38wpwb,2king,1 point,Sun Jun 7 17:16:06 2015 UTC,Home run derby!
angelsbaseball,38wpwb,IAmTheWalkingDead,3,Sun Jun 7 17:13:35 2015 UTC,*fly ball derby!!
angelsbaseball,38wpwb,Chodly,6,Sun Jun 7 17:16:41 2015 UTC,Can Victor Espinoza take the mound for us today? Or is American Pharoah available?
angelsbaseball,38wpwb,IAmTheWalkingDead,6,Sun Jun 7 17:08:06 2015 UTC,Can he hit?
angelsbaseball,38wpwb,KennyGardner,3,Sun Jun 7 17:21:57 2015 UTC,CC Sabathia CG SO.  Because only a 2-7 5+ ERA can stop us now!
angelsbaseball,38wpwb,schplat,1 point,Sun Jun 7 17:04:17 2015 UTC,Fear the broom.   Let's get the win.  GO HALOS!
angelsbaseball,38wpwb,xobscure,7,Sun Jun 7 16:42:06 2015 UTC,We gonna get swept! Hooray for being below average! I blame everyone and everything.
angelsbaseball,38wpwb,naaahhman,5,Sun Jun 7 15:03:52 2015 UTC,"Ahh yes, that moment when you realize we're in 3rd place while the Astros are in first and we may not be a competing team for quiet some time to come."
angelsbaseball,38wpwb,stuckinthepow,3,Sun Jun 7 20:03:50 2015 UTC,"I've got stockholm syndrome, the Angels don't have me, I'm the Angels."
angelsbaseball,38tylj,angelsbaseball,1 point,Sat Jun 6 20:15:08 2015 UTC,Glad I turned this one on late
angelsbaseball,38tylj,The_Illa_Vanilla,10,Sun Jun 7 02:11:02 2015 UTC,"Of course these announcers have to talk about Hambone. At least Victor, Gubie, Jose Mota and Alex Curry will be back tomorrow morning."
angelsbaseball,38tylj,IAmTheWalkingDead,5,Sun Jun 7 00:58:47 2015 UTC,"Oh, so we're doing this again today?"
angelsbaseball,38tylj,stuckinthepow,4,Sun Jun 7 00:44:14 2015 UTC,Trout's having some rough luck this series. Had a few smoked line drives caught and that throw to 3rd earlier this game should've been an out.
angelsbaseball,38tylj,Kelmon,13,Sun Jun 7 00:33:37 2015 UTC,http://i.imgur.com/abBAQaB.gif
angelsbaseball,38tylj,IFightClouds,4,Sun Jun 7 00:26:21 2015 UTC,"Ha, this game is actually televised this morning here in China...I should have slept in instead."
angelsbaseball,38tylj,rex_llama,2,Sun Jun 7 00:06:58 2015 UTC,what the hell happened?
angelsbaseball,38tylj,let_me_play_coach,7,Sat Jun 6 23:56:19 2015 UTC,"It's bad enough that this game is likely fucked, but now we have to sit through the awful national announcers try to make sense of this shit show and fill air time. Adding insult to injury."
angelsbaseball,38tylj,IAmTheWalkingDead,7,Sat Jun 6 23:50:40 2015 UTC,Ahhh remember when we used to be the yankee's kryptonite. Good times
angelsbaseball,38tylj,HotKingChocolate,2,Sat Jun 6 23:47:58 2015 UTC,I was ok with losing seasons... As long as we took 5/6 from the yanks!
angelsbaseball,38tylj,hardangelfan,3,Sun Jun 7 02:37:33 2015 UTC,Haha i was usually ok with losing the season series but then eliminating them in the division series ;)
angelsbaseball,38tylj,HotKingChocolate,2,Sun Jun 7 02:55:07 2015 UTC,Really rubbed it in their faces that year
angelsbaseball,38tylj,hardangelfan,11,Sun Jun 7 03:19:58 2015 UTC,"Welp, I'm out..."
angelsbaseball,38tylj,chrispy145,5,Sat Jun 6 23:44:38 2015 UTC,"Winners of 5 straight and then after today, they'll be losers of 4 straight. Stay consistent, Angels!"
angelsbaseball,38tylj,Kelmon,2,Sat Jun 6 23:43:06 2015 UTC,Roller coaster of a season.
angelsbaseball,38tylj,me_coopsta,6,Sat Jun 6 23:59:00 2015 UTC,Let's see what Richards we get today. Turns on game Well I guess I'm drinking tonight.
angelsbaseball,38tylj,Firstadam,4,Sat Jun 6 23:40:56 2015 UTC,Why would you throw to 2nd
angelsbaseball,38tylj,WyattLewis,2,Sat Jun 6 23:39:51 2015 UTC,"Wow, this couldn't be going any worse."
angelsbaseball,38tylj,dukiehazzard,5,Sat Jun 6 23:38:07 2015 UTC,"No it could be a lot worse,  ixrs could've sang the national anthem. This would make our military quit and the USA secede from itself."
angelsbaseball,38tylj,naaahhman,13,Sat Jun 6 23:53:34 2015 UTC,"Oh good, we're ready to make asses of ourselves on national TV. 4-0 yanks, 1 out in the 1st.   Fuck."
