angelsbaseball,3ch50w,Angela_Twerkel,4,Tue Jul 7 22:40:44 2015 UTC,"Here's another good article:  http://sabr.org/research/home-run-derby-curse-fact-or-fiction  CONCLUSION   Home Run Derby curse, fact or fiction? We have no choice but to conclude that its fiction. If we consider all the ways that the statistics should behave if there is no curse, we find that they consistently match that model. Certainly, some players will have a decline in power-hitting statistics from the first half of the season to the second after participating in the Derby, but it is clear from the analysis that this would have occurred for those players regardless of whether they chose to participate or not."
angelsbaseball,3ch50w,chrispy145,5,Tue Jul 7 22:47:37 2015 UTC,"Oh, here's another!  Garrett Anderson 2003 (winner of the HRD that year)  22 HR in first half  7 HR in second half"
angelsbaseball,3ch50w,z0mb0t,8,Tue Jul 7 22:39:49 2015 UTC,GA only broke 30 HR in a season once in his entire career. The 22 he hit before the break in 2003 was clearly a huge fluke.
angelsbaseball,3ch50w,sweetpooptatos,2,Wed Jul 8 01:52:59 2015 UTC,I still think he had one of the prettiest follow-throughs on his swing I've ever seen.
angelsbaseball,3ch50w,cshenton,1 point,Wed Jul 8 03:51:42 2015 UTC,His stroke was so smooth and clean. Doubles all day for GA
angelsbaseball,3ch50w,Titan67,2,Wed Jul 8 16:46:53 2015 UTC,"I remember that 2003 All Star break, I remember being all ""wtf is going on"" when GA won the Derby AND took home the MVP award. That was sooo random too considering we didn't do much that year"
angelsbaseball,3ch50w,z0mb0t,2,Thu Jul 9 00:25:59 2015 UTC,"Brendan Donnelly got the W in that ASG, too!"
angelsbaseball,3ch50w,TweetPoster,2,Thu Jul 9 09:19:16 2015 UTC,"@Alden_Gonzalez:   2015-07-07 21:28:40 UTC  Albert Pujols is doing the HR Derby, he said.     [Mistake?] [Suggestion] [FAQ] [Code] [Issues]"
angelsbaseball,3ch50w,Austiny1,1 point,Tue Jul 7 21:37:57 2015 UTC,Idk how I feel about Pujols getting into the HR Derby. He's in such a hot streak kinda wish he would just chill...
angelsbaseball,3ch50w,chrispy145,-3,Wed Jul 8 13:06:35 2015 UTC,http://www.nooooooooooooooo.com
angelsbaseball,3ch5fv,angelsbaseball,5,Tue Jul 7 21:40:07 2015 UTC,LTBU! One game back in the loss column!!!
angelsbaseball,3ch5fv,rex_llama,3,Wed Jul 8 03:14:54 2015 UTC,Has Arenado robbed any hits yet?
angelsbaseball,3ch5fv,falloutranger,2,Wed Jul 8 02:15:51 2015 UTC,yes
angelsbaseball,3ch5fv,Rogueofoz,4,Wed Jul 8 02:17:46 2015 UTC,My pants are sooo tight right now...
angelsbaseball,3ch5fv,DwightSchrute27,5,Wed Jul 8 01:40:22 2015 UTC,Thoughts on Heaney?
angelsbaseball,3ch5fv,Shinanigins,1 point,Wed Jul 8 01:36:12 2015 UTC,Great deceptive delivery
angelsbaseball,3ch5fv,acalomin,5,Wed Jul 8 15:32:13 2015 UTC,"I like him, hope he can get better with experience."
angelsbaseball,3ch5fv,GeneralBS,15,Wed Jul 8 01:44:46 2015 UTC,http://i.imgur.com/sMMbz9H.png
angelsbaseball,3ch5fv,Angela_Twerkel,8,Wed Jul 8 01:33:51 2015 UTC,"Quick, lets figure out ways that Dipoto was holding this team back.  I say he made them wear cotton uniforms."
angelsbaseball,3ch5fv,KennyGardner,8,Wed Jul 8 01:32:34 2015 UTC,"His sabermetric scouting reports were too complicated.   Scioscia's scouting report of see ball, hit ball, score runs is working out well."
angelsbaseball,3ch5fv,naaahhman,2,Wed Jul 8 01:45:45 2015 UTC,"""Old school"""
angelsbaseball,3ch5fv,MartOut,5,Wed Jul 8 02:29:02 2015 UTC,BEING AT THIS GAME IS LOTS OF FUN
angelsbaseball,3ch5fv,legionfresh,2,Wed Jul 8 01:27:36 2015 UTC,They are seeing beach balls out there!! Nothing but dingers and web gems lately  And of course the all star break is coming up lol
angelsbaseball,3ch5fv,ShibbyBacon,4,Wed Jul 8 01:25:22 2015 UTC,Ianetta.... when it rains it pours
angelsbaseball,3ch5fv,Rogueofoz,3,Wed Jul 8 01:23:47 2015 UTC,Been a while since I've seen him smile like that
angelsbaseball,3ch5fv,Neverend3r,2,Wed Jul 8 01:26:07 2015 UTC,I kinda feel bad for Bettis.
angelsbaseball,3ch5fv,GeneralBS,2,Wed Jul 8 01:23:36 2015 UTC,"Yeah my brain and heart say I feel this, but my donger says otherwise"
angelsbaseball,3ch5fv,Vesuvias,7,Wed Jul 8 01:27:16 2015 UTC,WHAT IN THE FUCK IS HAPPENING?! :-(
angelsbaseball,3ch5fv,JSA17,4,Wed Jul 8 01:23:08 2015 UTC,"we can suddenly hit, I guess"
angelsbaseball,3ch5fv,Rogueofoz,3,Wed Jul 8 01:31:19 2015 UTC,Right?
angelsbaseball,3ch5fv,GeneralBS,5,Wed Jul 8 01:33:40 2015 UTC,Iannetta would also like to mash!
angelsbaseball,3ch5fv,wiNNA_monstER,10,Wed Jul 8 01:22:38 2015 UTC,Let's just hit reset on this game. Deal?
angelsbaseball,3ch5fv,JSA17,2,Wed Jul 8 01:15:56 2015 UTC,Don't worry; at this rate the Angels are going to flip the odometer.  Scoreboards only hold two digits.
angelsbaseball,3ch5fv,zodar,3,Wed Jul 8 02:06:39 2015 UTC,Guessing you are visiting from /r/ColoradoRockies?  Rangers fans were doing the samething a few days ago.
angelsbaseball,3ch5fv,GeneralBS,7,Wed Jul 8 01:20:55 2015 UTC,"We usually wander around. Our sub stays pretty slow, especially when we suck, so it's fun to go see what other people are saying."
angelsbaseball,3ch5fv,JSA17,5,Wed Jul 8 01:22:16 2015 UTC,"We're mostly just talking about how much you guys suck :p  I'm just joshin', welcome!"
angelsbaseball,3ch5fv,chrispy145,5,Wed Jul 8 01:26:34 2015 UTC,That's all we are talking about in our sub.  That and posting a bunch of sad gifs.
angelsbaseball,3ch5fv,JSA17,6,Wed Jul 8 01:29:54 2015 UTC,"That's our sub in a nutshell, most GameDay threads here don't get past 50-60 comments on a good day."
angelsbaseball,3ch5fv,StrokenBlast,6,Wed Jul 8 01:26:04 2015 UTC,You guys use IRC a lot though right?
angelsbaseball,3ch5fv,JSA17,4,Wed Jul 8 01:27:23 2015 UTC,Yeah we do. I need to get on more though
angelsbaseball,3ch5fv,Vesuvias,2,Wed Jul 8 01:28:36 2015 UTC,"I do the same, fun to see what the other teams subs are saying."
angelsbaseball,3ch5fv,GeneralBS,3,Wed Jul 8 01:24:48 2015 UTC,SOMEONE CORKED OUR BATS?!?! Mashing n smashin' night boys!
angelsbaseball,3ch5fv,Vesuvias,4,Wed Jul 8 01:15:44 2015 UTC,Rockies pitching has that effect on batters. :/
angelsbaseball,3ch5fv,Hurleybirdie,3,Wed Jul 8 01:21:54 2015 UTC,I legit feel bad for Bettis....damn that is demoralizing. I need you Rockies to destroy the Doyers. That is all.
angelsbaseball,3ch5fv,Vesuvias,3,Wed Jul 8 01:25:50 2015 UTC,Holy shit that trout home run exited so fucking fast
angelsbaseball,3ch5fv,Weaver4prez,5,Wed Jul 8 01:14:20 2015 UTC,Is this is real life?
angelsbaseball,3ch5fv,Rogueofoz,4,Wed Jul 8 01:13:15 2015 UTC,I walk away to warm up some ribs and come back to 5 more runs...
angelsbaseball,3ch5fv,GeneralBS,5,Wed Jul 8 01:12:57 2015 UTC,Fucking Joyce hommer!!! I tink we are on Colorado
angelsbaseball,3ch5fv,Rogueofoz,4,Wed Jul 8 01:12:47 2015 UTC,HOLY OFFENSE BATMAN!   SOMEONE SHOULD CALL THE FIRE DEPARTMENT BECAUSE THIS TEAM IS ON FIRE AND IS GOING TO BURN THIS PLACE DOWN!
angelsbaseball,3ch5fv,stuckinthepow,5,Wed Jul 8 01:09:46 2015 UTC,Everything's coming up Milhouse!
angelsbaseball,3ch5fv,Neverend3r,2,Wed Jul 8 01:09:41 2015 UTC,"Real people who work in the Angels' front office: Bill Beverage, Molly Jolly, Angel Rodriguez, Jennifer Whynott, and Dr. Craig Milhouse."
angelsbaseball,3ch5fv,MollysYes,4,Thu Jul 9 07:20:42 2015 UTC,this team is on fire right now!
angelsbaseball,3ch5fv,mculatie,6,Wed Jul 8 01:08:55 2015 UTC,LOLOLOL
angelsbaseball,3ch5fv,Angela_Twerkel,4,Wed Jul 8 01:08:27 2015 UTC,looool
angelsbaseball,3ch5fv,Freedomsoldier17,3,Wed Jul 8 01:08:02 2015 UTC,WE MASHING TONIGHT BOYZZZZZZZZZZZZZZZZZZZZZ
angelsbaseball,3ch5fv,Imperial10,3,Wed Jul 8 01:07:56 2015 UTC,"Trout, can mash."
angelsbaseball,3ch5fv,wiNNA_monstER,2,Wed Jul 8 01:07:54 2015 UTC,Hits for everybody!
angelsbaseball,3ch5fv,tom_whore,2,Wed Jul 8 01:05:25 2015 UTC,I kinda like this team when they can hit!
angelsbaseball,3ch5fv,Imperial10,6,Wed Jul 8 01:04:53 2015 UTC,Joyce can mash?
angelsbaseball,3ch5fv,wiNNA_monstER,5,Wed Jul 8 01:01:48 2015 UTC,We're just warming Pujols up for the derby
angelsbaseball,3ch5fv,MrFancier,4,Wed Jul 8 00:55:21 2015 UTC,Someone shouldn't tell Pujols this isn't the home run derby yet. Just let him keep smashing.
angelsbaseball,3ch5fv,stuckinthepow,4,Wed Jul 8 00:54:26 2015 UTC,Albert straight crushing it!
angelsbaseball,3ch5fv,bigmanlavos,7,Wed Jul 8 00:52:00 2015 UTC,Man I love me some big albert. Why didn't we move him to #4 sooner.
angelsbaseball,3ch5fv,The_Illa_Vanilla,4,Wed Jul 8 00:50:35 2015 UTC,"That ball looked sexy coming of that bat, sound made it even better.  GJ Pujols"
angelsbaseball,3ch5fv,GeneralBS,2,Wed Jul 8 00:49:52 2015 UTC,Thanks PooHoles
angelsbaseball,3ch5fv,tom_whore,2,Wed Jul 8 00:49:10 2015 UTC,mash
angelsbaseball,3ch5fv,wiNNA_monstER,4,Wed Jul 8 00:48:18 2015 UTC,Hopefully we still have hits in us after Texas.  Edit - Apparently we do.
angelsbaseball,3ch5fv,GeneralBS,2,Wed Jul 8 00:41:59 2015 UTC,Go Halos!  Get your RED ON!
angelsbaseball,3ch5fv,xobscure,9,Wed Jul 8 00:22:54 2015 UTC,"I'm at Coors today, there's NO Rockies fans here yet. Gotta be 80% Red."
angelsbaseball,3ch5fv,legionfresh,4,Wed Jul 8 00:11:45 2015 UTC,"Wow, that's pretty awesome. Hope we kill them slowly with small ball runs or just hit some nice Coors dingers!"
angelsbaseball,3ch5fv,Air_M_Jordan,3,Wed Jul 8 00:22:42 2015 UTC,POO HOLES
angelsbaseball,3ch5fv,legionfresh,6,Wed Jul 8 00:52:33 2015 UTC,Let's go Heany Weenie!
angelsbaseball,3ch5fv,DisciplineAccount,3,Wed Jul 8 00:08:54 2015 UTC,"Why isn't Cron in for Joyce?      Scioscia knows Joyce sucks, why keep jamming him in when you can go with the hot hitter?"
angelsbaseball,3ch5fv,Rogueofoz,1 point,Tue Jul 7 23:13:16 2015 UTC,Well at least nobody can pretend they saw that coming..
angelsbaseball,3ch5fv,tom_whore,9,Wed Jul 8 01:04:03 2015 UTC,Say you're sorry!
angelsbaseball,3ch5fv,chrispy145,4,Wed Jul 8 01:02:49 2015 UTC,"""Defensive reasons"""
angelsbaseball,3ch5fv,Redpubes,4,Tue Jul 7 23:37:38 2015 UTC,"Yeah, but Joyce is bad at D too."
angelsbaseball,3ch5fv,Fuzzylumpkin,19,Wed Jul 8 00:07:09 2015 UTC,This is your complimentary spider plant announcement. Spider plant lead us to glourious victory. Let's go based Heaney.
angelsbaseball,3ch5fv,Air_M_Jordan,12,Tue Jul 7 22:19:46 2015 UTC,"I'd like one win, pls!!!"
angelsbaseball,3ch5fv,naaahhman,2,Tue Jul 7 22:09:59 2015 UTC,"I usually don't like to jinx these things, but you may get what you want tonight."
angelsbaseball,3ch5fv,chrispy145,11,Wed Jul 8 01:25:11 2015 UTC,"GIVE ME OFFENSE OR GIVE ME DEATH!  Edit: Btw, I like that we have had some consistency in our line up, especially with lead off. Johnny seems to be doing a good job there."
angelsbaseball,3ch5fv,dslicex,10,Tue Jul 7 22:05:05 2015 UTC,No better place to keep this offense rollin' than Denver.  Full steam ahead.
angelsbaseball,3ce1ok,cptnjack007,4,Tue Jul 7 04:37:30 2015 UTC,"Yeah! I'll be there, wearing my Pujols jersey (or Trout shirt). Expecting to see lots of bombs!"
angelsbaseball,3ce1ok,quakthunder,5,Tue Jul 7 19:09:31 2015 UTC,Was there tonight. First time seeing the Angels play in 2 years. Awesome to see Pujols and Trout go yard.
angelsbaseball,3ce1ok,Livingthedream_,3,Wed Jul 8 05:10:27 2015 UTC,Looked like there was a lot of red there!
angelsbaseball,3ce1ok,parrosstach,2,Wed Jul 8 07:04:38 2015 UTC,"I won't be at the game but I will say that Coors field is fucking awesome. If you haven't been, you'll love it, and it's within walking distance of all kinds of cool bars and shit too."
angelsbaseball,3ce1ok,lethalred,1 point,Wed Jul 8 21:12:41 2015 UTC,"I'll be there, first time seeing them play since 2010. Where are you tickets?"
angelsbaseball,3cc93o,scolbert08,14,Mon Jul 6 20:01:06 2015 UTC,"Craig Dunkin @oxybroadcast  33m33 minutes ago @Alden_Gonzalez @Buster_ESPN Yeah, but Stoneman will not want to give up Brandon Wood.  Slam."
angelsbaseball,3cc93o,pofshrimp,8,Tue Jul 7 01:39:32 2015 UTC,"ahh, this takes me back.."
angelsbaseball,3cc93o,schplat,4,Tue Jul 7 02:05:27 2015 UTC,Let's also not forget Dallas McPherson.
angelsbaseball,3cc93o,tMoneyMoney,1 point,Tue Jul 7 20:50:24 2015 UTC,"Those two guys are the reason I give no fucks about having ""one of the worst farm systems in the league"""
angelsbaseball,3cc93o,Titan67,3,Tue Jul 7 22:42:04 2015 UTC,Shots fired!
angelsbaseball,3cc93o,Rogueofoz,3,Tue Jul 7 01:53:27 2015 UTC,That made me sad inside. :(
angelsbaseball,3cc93o,corndog819,12,Tue Jul 7 04:56:39 2015 UTC,He can only come to us if he uses careless whisper as his walk up song again
angelsbaseball,3cc93o,Fuzzylumpkin,8,Mon Jul 6 23:07:28 2015 UTC,He usually beats on us pretty bad...doesn't he?
angelsbaseball,3cc93o,dslicex,2,Mon Jul 6 21:10:40 2015 UTC,"Not for that past season or two, although that could mostly be due to a lack of playing time. He's come up to pinch hit a couple of times against the Angels, but nothing too significant these days. But yeah. he always seemed to stomp the Angels."
angelsbaseball,3cc93o,NoisomeOne,4,Tue Jul 7 01:56:41 2015 UTC,"His bat would be a welcome addition, but a couple of things to consider: he would be playing out of position in LF (only played 39 career games there and none since 2011) and he likely comes at a steep cost."
angelsbaseball,3cc93o,ShittyDetectiving,3,Mon Jul 6 21:21:57 2015 UTC,"According to Ken Rosenthal, ""the A's gave the Angels a flat 'no' on Reddick."" The teams also discussed Zobrist before Dipoto's resignation."
angelsbaseball,3cc93o,slinkey1998,3,Tue Jul 7 01:03:17 2015 UTC,I'm okay with that.
angelsbaseball,3cc93o,Imperial10,2,Mon Jul 6 21:04:33 2015 UTC,Wait with what
angelsbaseball,3cc93o,ownage99988,5,Mon Jul 6 22:04:56 2015 UTC,yes
angelsbaseball,3cc93o,Imperial10,8,Mon Jul 6 22:27:53 2015 UTC,With getting him or with not getting him?
angelsbaseball,3cc93o,dclarsen,6,Mon Jul 6 22:43:12 2015 UTC,yes
angelsbaseball,3cc93o,jubelo,0,Mon Jul 6 23:22:30 2015 UTC,That joke is getting old real quick.
angelsbaseball,3cc93o,Firebitez,1 point,Tue Jul 7 00:00:13 2015 UTC,"To be fair, I feel ok both ways about this. I wouldn't mind adding Reddick, but I'm glad we didn't part with any of our minor leaguers to do it. Chris Ellis and Trevor Gott's names were mentioned a few times in other possible trades, and those are two players right now I would not like to see get traded."
angelsbaseball,3cc93o,NoisomeOne,2,Tue Jul 7 01:58:53 2015 UTC,"@Alden_Gonzalez:   2015-07-06 18:45:04 UTC  #Angels tried to trade for Reddick before Dipoto's resignation, even tried to get the Red Sox involved, but couldn't. Maybe that changes.     [Mistake?] [Suggestion] [FAQ] [Code] [Issues]"
angelsbaseball,3cc93o,TweetPoster,2,Mon Jul 6 20:01:22 2015 UTC,I would be good with a trade for riddick as long as we don't give up anything useful
angelsbaseball,3cc93o,ownage99988,-2,Mon Jul 6 22:05:19 2015 UTC,[INTENSE SARCASM] I really hope they don't get rid of cron [/INTENSE SARCASM]
angelsbaseball,3cc93o,trabbledot,7,Mon Jul 6 23:50:42 2015 UTC,"If you compare Reddick's early numbers to what cron is doing right now it makes Cron look beastly. Yeah he's not hitting super well this season as a whole but he's young and still has some stuff to figure out. When it all clicks I feel like Cron is gonna be a beast.   Reddick to me just feels to much like the Joyce or Freese deals, just wouldn't work out as great as people would think."
angelsbaseball,3cc93o,han__yolo,1 point,Tue Jul 7 00:28:22 2015 UTC,"One thing to note is that Cron is barely 25 years old. He was a first-round pick in 2011...  He is by no means a finished product. Even when he was first called up, there was a question of the team rushing him a bit. I don't see anything special in him as a player right now, but this weekend proved he has quite the potential"
angelsbaseball,3cc93o,MartOut,1 point,Tue Jul 7 02:29:14 2015 UTC,This would have been a great trade! Reddick is exactly the type of player the Angels need
angelsbaseball,3cb1f1,ScrambleSoup,17,Mon Jul 6 14:43:52 2015 UTC,"Halos Heaven and Angelswin are places that have an older fan base. Both have some quality OC, but the user base is more or less  parrots. We don't allow either website to post content on here, because everyone knows where to find it. Sorry about your experiences."
angelsbaseball,3cb1f1,naaahhman,9,Mon Jul 6 15:41:19 2015 UTC,"I absolutely cannot stand Halos Heaven, never have been. Literally every single article is depressing or pessimistic and its just not a fun place to talk about sports, let alone your favorite baseball team.   EDIT: To add, I think this subreddit is great. Sure it isn't filled with thousands of people constantly but the discussions are always fun and interesting, all the people have been great, and there is a great sense of realism in here but also hilarity and optimism. I love this sub and its my go to Angels info/talking point."
angelsbaseball,3cb1f1,dill911,2,Mon Jul 6 17:51:31 2015 UTC,I've never boycotted a website until Halo's Heaven. It's a place for knuckleheads who love to complain when they have nothing else to talk about. They boil any entire game's outcome to one play or decision and demand a lynching after a loss.
angelsbaseball,3cb1f1,wonderbread403,4,Wed Jul 8 03:07:07 2015 UTC,Remember that creepy Hamilton rant that got posted and quickly removed?   That was the end of the line for me.
angelsbaseball,3cb1f1,DalysDozen,2,Mon Jul 6 22:43:49 2015 UTC,"Rev's posted some controversial stuff in his time, but that one took the cake for me."
angelsbaseball,3cb1f1,iusebadlanguage,3,Mon Jul 6 23:16:57 2015 UTC,"This subreddit right here, it's by far the best to talk angels baseball, we might be few but it doesn't matter 'cause I know the regulars here are knowledgeable about baseball and usually don't whine, making really good points. Other places like Halos Haven or the Angels facebook has a lot of fans who don't know baseball all that much and value more ""team chemistry"" and a fan appreciation player than a really good player i.e. the Howie trade, everyone there was pissed off, but in here people were cool about it, 'cause we now it was a steal"
angelsbaseball,3cb1f1,Rogueofoz,2,Mon Jul 6 22:22:43 2015 UTC,"Their daily ""HaloLinks"" are great. I stay away from the comment threads there and I've belonged to that site since 2006. I wish this sub was a bit more active!"
angelsbaseball,3cb1f1,jtkelly86,2,Tue Jul 7 05:28:40 2015 UTC,"I enjoy the content posted here, even if the sub is less active. I'm glad the game day threads don't have 300+ comments of saying "" of course so and so struck out"" or whatever."
angelsbaseball,3cb1f1,StrokenBlast,-24,Tue Jul 7 20:56:16 2015 UTC,"It's okay, this place is pretty whiny too. And more vulgar."
angelsbaseball,3cb1f1,GoatTnder,14,Mon Jul 6 15:20:31 2015 UTC,"Surprise, surprise, goattnder is complaining again. You're the biggest whiner on here. I'm sorry we don't meet your golden seal of fucking approval. I'm sorry /u/noisomeone acts too Mexican for you. We should try to be better people for you. No wait, we're doing just fine. You're the one that comes into chat and adresses us as ""people you don't like."""
angelsbaseball,3cb1f1,naaahhman,9,Mon Jul 6 15:47:44 2015 UTC,Hey bro check your vulgar
angelsbaseball,3cb1f1,tom_whore,2,Mon Jul 6 17:26:54 2015 UTC,What an odd username mention.
angelsbaseball,3cb1f1,NoisomeOne,2,Mon Jul 6 22:39:36 2015 UTC,lawl.
angelsbaseball,3c9gkt,Weaver4prez,6,Mon Jul 6 03:23:56 2015 UTC,Really hoping Santiago finds his way in
angelsbaseball,3c9gkt,HaloManiaC27,4,Tue Jul 7 05:27:18 2015 UTC,"Seriously fuck Ned Yost though, he selects Kelvin Herrera over Street? I'm someone who believes that the relievers should be closers because of high leverage situations."
angelsbaseball,3c9gkt,cshenton,2,Tue Jul 7 03:18:26 2015 UTC,"He went with his player, almost every All-Star manager does it. Personally, I would rather have seen Hector than Huston. He's having a hell of a season."
angelsbaseball,3c9gkt,NoisomeOne,13,Tue Jul 7 21:18:50 2015 UTC,"Pujols is starting at 1st! We did it, reddit!  But seriously, it's really cool, and most certainly well deserved. Congrats to Pujols."
angelsbaseball,3c9gkt,FuntCision,-3,Tue Jul 7 01:53:09 2015 UTC,Surprised to see Trout make it  Awesome!
angelsbaseball,3c9gkt,rex_llama,10,Tue Jul 7 00:49:40 2015 UTC,"Hopefully Albert ends up starting at 1B in place of Miggy.  He deserves it.  Stats wise, Prince Fielder is definitely in the argument, but Albert has him beat in both WAR flavors plus actually plays 1B about 70% of the time (Prince has played 1B in 11 games this year).  EDIT: Well fuck   To determine the new ASG starter, the All-Star reserve who received the most votes on the Player Ballot at the injured player's position moves into the starting lineup.   So, if Hosmer or Fielder make the team as a reserve, they will automatically start over Albert.  Yeah, that's a crock of shit.    EDIT2: ALBERT WILL START!!!!  and I guess I don't understand the rule"
angelsbaseball,3c9gkt,cshenton,3,Mon Jul 6 16:02:00 2015 UTC,"Player Ballot, not fan vote."
angelsbaseball,3c9gkt,rex_llama,3,Tue Jul 7 15:47:55 2015 UTC,"Ah, my reading comprehension failed me.  Yeah, that makes sense."
angelsbaseball,3c9gkt,dukiehazzard,9,Tue Jul 7 15:58:55 2015 UTC,"I will be pretty annoyed if Trout isn't in CF. Cain is better defensively, but Trout is the far better player and deserves his natural position.   Besides, Cain  has a lot more experience than Trout in RF, and he has a better arm. He is a better fit in RF, and Trout is still a good CF'er. We'll see what Yost does, though."
angelsbaseball,3c9gkt,srzhk,13,Mon Jul 6 06:09:53 2015 UTC,"Cain: 598 innings, 4 errors. Trout: 698 innings, 0 errors.  ALL ABOARD THE TROUT TRAIN"
angelsbaseball,3c9gkt,Rogueofoz,3,Mon Jul 6 09:49:05 2015 UTC,We are gonna play with a DH and he NL is not?
angelsbaseball,3c9gkt,Fuzzylumpkin,5,Mon Jul 6 04:57:07 2015 UTC,They don't have a vote for it since there are no dh players. The coach selects their dh
angelsbaseball,3c9gkt,breakwater,5,Mon Jul 6 06:36:25 2015 UTC,"I thought the rule is based on the park where the game is played.  The ASG is in NL territory, so I'd think no DL."
angelsbaseball,3c9gkt,dukiehazzard,3,Mon Jul 6 05:14:37 2015 UTC,"That was the rule up until 2010, when MLB announced the ASG would be played with a DH at both AL and NL parks."
angelsbaseball,3c9gkt,JTRoberts,2,Mon Jul 6 06:13:51 2015 UTC,"I get why they do this, since it would be excluding an entire position from contention every other year and that's flat out not fair... but it also seems really silly to force the NL to use a DH in an NL park."
angelsbaseball,3c9gkt,Rogueofoz,1 point,Tue Jul 7 00:29:47 2015 UTC,"yeah, Nelson can be a OF or 1B"
angelsbaseball,3c844n,angelsbaseball,1 point,Sun Jul 5 20:05:06 2015 UTC,"Man that was satisfying!  Only thing that could have made it better, is Hamilton playing all three games and striking-out 10+ times."
angelsbaseball,3c844n,DonnieDon24,4,Mon Jul 6 08:16:19 2015 UTC,LTBU
angelsbaseball,3c844n,Rogueofoz,5,Mon Jul 6 02:52:23 2015 UTC,"You sumbitch, you never kick it with us anymore."
angelsbaseball,3c844n,naaahhman,6,Mon Jul 6 02:16:05 2015 UTC,Damn Walmart Wifi has its limits
angelsbaseball,3c844n,laaabaseball,5,Mon Jul 6 02:18:58 2015 UTC,SWEEP boys!
angelsbaseball,3c844n,HaloManiaC27,8,Mon Jul 6 04:47:17 2015 UTC,3 games back!
angelsbaseball,3c844n,Angela_Twerkel,7,Mon Jul 6 02:15:21 2015 UTC,Gott is no longer perfect :(
angelsbaseball,3c844n,HaloManiaC27,5,Mon Jul 6 02:11:14 2015 UTC,Cron could find himself back in this lineup and back into our hearts.
angelsbaseball,3c844n,HaloManiaC27,8,Mon Jul 6 01:31:32 2015 UTC,Cron definitely ate his Wheaties before this series. Holy shit!
angelsbaseball,3c844n,winknod,21,Mon Jul 6 01:22:36 2015 UTC,"Angels = US, Rangers = Japan."
angelsbaseball,3c844n,inatr4nce,10,Mon Jul 6 01:15:07 2015 UTC,So what the hell happened to our team that now they blow up for 33+ runs in the last three games?!
angelsbaseball,3c844n,Imperial10,11,Mon Jul 6 00:58:52 2015 UTC,This is easily the most fun series since at least the 4 game sweep of the A's last August.
angelsbaseball,3c844n,dukiehazzard,4,Mon Jul 6 00:56:54 2015 UTC,I need more upvotes to give!!!
angelsbaseball,3c844n,sprocktologist,3,Mon Jul 6 00:54:24 2015 UTC,Cron is looking like he did last July.
angelsbaseball,3c844n,HaloManiaC27,3,Mon Jul 6 00:54:13 2015 UTC,https://instagram.com/p/3TMHKRFbUm/?taken-by=joycer247
angelsbaseball,3c844n,naaahhman,8,Mon Jul 6 00:39:30 2015 UTC,His wife is hot.
angelsbaseball,3c844n,DisciplineAccount,8,Mon Jul 6 00:32:20 2015 UTC,http://gfycat.com/KaleidoscopicVacantCorydorascatfish
angelsbaseball,3c844n,naaahhman,4,Mon Jul 6 00:47:13 2015 UTC,POO BOMB!
angelsbaseball,3c844n,HaloManiaC27,7,Mon Jul 6 00:26:29 2015 UTC,Our offense might be finding its way back.
angelsbaseball,3c844n,HaloManiaC27,31,Mon Jul 6 00:17:49 2015 UTC,Can we play in Texas every day?
angelsbaseball,3c844n,hardangelfan,11,Mon Jul 6 00:00:51 2015 UTC,Trout is so due to crush a homer!
angelsbaseball,3c844n,winknod,7,Sun Jul 5 23:45:38 2015 UTC,Does anyone agree that play was an out?  I dont see it. I thought u needed clear evidence  to over turn
angelsbaseball,3c844n,Neverend3r,6,Sun Jul 5 23:34:32 2015 UTC,Colby Lewis is having a better time than Japan at least...
angelsbaseball,3c844n,Kelmon,3,Sun Jul 5 23:22:27 2015 UTC,Why is this place always so dead?
angelsbaseball,3c844n,JeSuisAmiralAckbar,11,Sun Jul 5 23:21:59 2015 UTC,Most of our active members post in our irc chat.
angelsbaseball,3c844n,gregmau5,16,Sun Jul 5 23:21:49 2015 UTC,"CAN'T STOP, WON'T STOP"
angelsbaseball,3c844n,AlmostLucy,13,Sun Jul 5 23:28:19 2015 UTC,The Angels offense so far is curing my hangover
