asktrp,3e0sod,Chinny4daWinny,4,Tue Jul 21 15:21:19 2015 UTC,"Its called fear of failure and it is a bitch defined by the need for external validation. So learn to self actualize, the fear will become nonexistent. As someone who was neglected as a kid, abused by my wife I get this is a hard one. Put your head down, be determined, get it done."
asktrp,3e0sod,Hunter2isit,1 point,Tue Jul 21 05:32:09 2015 UTC,"This. You procrastinate because by not trying you won't feel the pain of your effort being good enough. It's a survival strategy you probably learned to adopt somewhere in childhood.   OP,  just be aware of your self talk and when the procrastination comes up, tell it that what is doing, while well intended, is actually leading to a much more detrimental result in the long run."
asktrp,3e0sod,Brian_Official,2,Tue Jul 21 12:51:30 2015 UTC,Or is it because you fear your best effort will turn out to be more than enough and your current failure is only due to your own weakness?   https://www.reddit.com/r/asktrp/comments/3azjam/knowing_what_you_need_to_do_but_not_doing_it/cshfuzi
asktrp,3e0sod,MrEiffel,1 point,Tue Jul 21 11:38:32 2015 UTC,How do you guys cope with it and gain confidence to maintain self discipline and hope that it will pay off.    Practice makes perfect. So what if your best is not good enough at the moment. Do it enough times and your best is going to become good.
asktrp,3e0sod,frequentlywrong,1 point,Tue Jul 21 07:24:01 2015 UTC,"Grow some outcome independence. Really, it doesn't matter if you fail or not. Your life is just not that big a deal. So enjoy it."
asktrp,3e0sod,kingofpoplives,0,Tue Jul 21 20:55:59 2015 UTC,yeah this is a tough one. i dont know an answer for this
asktrp,3e4jtj,Nikem45,1 point,Tue Jul 21 22:15:42 2015 UTC,Axe current relationship. If you aren't living up to what you want to he she isn't good for you.
asktrp,3e4jtj,A_Medical_Physicist,1 point,Tue Jul 21 22:54:42 2015 UTC,"That's the thing. I kind of want to ditch her, I do, but somewhere I can't cope with the thought of actually doing it."
asktrp,3e4jtj,fnordsnord,1 point,Tue Jul 21 22:57:30 2015 UTC,"You don't.  Alphas are born, not made.  What you CAN do it become more masculine than you were yesterday.  Without specifics, it's hard to give you advice."
asktrp,3e2qni,FelixCopy,1 point,Tue Jul 21 14:40:11 2015 UTC,"Can't speak for grad school, but I started undergrad at 22 after serving in the military. Busted ass and graduating next May after only three years.  I had a similar strategy, speaking as little as possible. At first it was because I felt out of place and I spent my time busting ass at my work. It ended up working extremely well for me. No one thinks it's a big deal when the student sitting front row speaking just as much as the professor every class aces the test, but different story for the quiet guy in back. I can't tell you how many times someone next to me looked over at my graded test and were too shocked to not say something. It's easy conversation starter and they immediately respect you. I've actually pulled women like this seeking ""study partners"".  And not just students. Professors approach me outside of class, often just for casual conversation. One hooked me up with my summer internship. Another encouraged me to run for student government association executive board. I was elected on and now on a first name basis with the dean, president, provost, etc."
asktrp,3e2qni,SgtRimjob,1 point,Tue Jul 21 19:19:16 2015 UTC,"Seems like you commanded presence in the aloof manner I described. Its something I have noticed to work, contrary to the ""try hard"" character we might want to be. That's why I've been thinking about being that guy instead this time around. Appreciate the anecdote.  I'd like to hear more, was your undergrad one in which you share classes with all of your peers, or more of a ""I'm taking this and that and a few crossed paths in some""?"
asktrp,3e3m31,whatgold,1 point,Tue Jul 21 18:21:26 2015 UTC,"Money is a useful tool, but it's not that attractive."
asktrp,3e3m31,fnordsnord,1 point,Tue Jul 21 21:04:59 2015 UTC,"In everywhere BUT the US (except maybe the Middle East), being American and not fat will get you pretty far"
asktrp,3e3m31,mikeyostro,0,Tue Jul 21 21:38:51 2015 UTC,"money [is] the #1 attractiveness trait as it is in the USA?   Wrong, wrong, wrong. Money is far from the most attractive trait. Read the sidebar in full."
asktrp,3e3kig,Xemnas81,3,Tue Jul 21 18:10:59 2015 UTC,"attempting the 7-day rule to get that 50% T boost.    ISHYGDDT, not worth it. Porn & masturbation aren't bad because of how they effect Test (basically don't), they're bad because of how they effect your ""reward circuitry"" (Dopamine / Serotonin systems) when combined with porn. In & of itself masturbation maintains your pipes - just don't do it to porn or, like eating, out for boredom / for entertainment."
asktrp,3e3kig,AFPJ,1 point,Tue Jul 21 18:12:57 2015 UTC,"This. I jerk off if my plate doesn't come over for a few days, to keep myself focused if nothing else. If I hold off for too long I seem to lose it and get more desperate for sex. It keeps me aloof when I might be inclined to act otherwise."
asktrp,3e3kig,RPthrowaway123,1 point,Tue Jul 21 18:36:00 2015 UTC,"Do you think your actions get too needy if you don't jerk off, then? Because my experience is if I jerk off and lie in bed too much, then my next interactions are done with a foggy mind and quite Nice Guy-ey."
asktrp,3e3kig,RPthrowaway123,1 point,Tue Jul 21 18:42:50 2015 UTC,"Yeah I think my brain gets foggy if I don't jerk off. I start wanting sex more and more and getting more needy about it. I also have much worse sex, because I cum faster which obviously doesn't make me feel like much a dominant, strong guy. I guess we just react to the absence of it differently."
asktrp,3e3kig,AFPJ,1 point,Tue Jul 21 18:49:53 2015 UTC,"Honestly it doesn't feel good now, just necessary or something to fill in the gap between one rumination and another.   I also mean to porn, of any kind (e.g. I just fapped to Holly Hagan, now I'm thinking why, she's not even that hot and she has a stupid duck face, also I should have gone the fucking gym already)."
asktrp,3e3kig,AFPJ,1 point,Tue Jul 21 18:37:49 2015 UTC,"Sounds like you're in a self-induced death spiral, stop asking for easy advice & put in the hard work to fix your shit."
asktrp,3e3kig,OmLaLa,1 point,Tue Jul 21 18:39:58 2015 UTC,Of course but I was just wondering whether there was any scientific validity behind NoFap.
asktrp,3e3kig,Whisper,1 point,Tue Jul 21 18:41:54 2015 UTC,"I'm scientifically savvy but am no neuroscientist or endocrinologist - alas I don't need science to tell you that you should be sweating and grunting under some heavy iron instead of posting on reddit right now. The thing about motivation is that it's easy - when you're unmotivated you have to depend on a much harder virtue: discipline.  Go lift, run around and don't touch your phone or computer when you come back. You'll find useful shit to do."
asktrp,3e2n23,IamGale,3,Tue Jul 21 14:11:13 2015 UTC,"Sales manager here, one thing I always do is stand up. People are naturally more confident in a standing position than sitting down. Second, use your headphones/earpiece, when you can talk naturally it flows like a conversation. Me, I'm part Italian, so I need to have my hands-free just like when I'm in front of you. The key is, do what you would to if you were in front of the guy having a beer."
asktrp,3e2n23,UEMcGill,1 point,Tue Jul 21 18:31:41 2015 UTC,Definitely trying this next round thanks!
asktrp,3e2n23,Hecticchow,2,Tue Jul 21 19:24:57 2015 UTC,Pick up the phone and dial before you make up excuses in your head. It's the same strategy you would use when contemplating whether or not to approach that cute girl in the library.
asktrp,3e2n23,bicepsblastingstud,1 point,Tue Jul 21 14:21:15 2015 UTC,Practice makes perfect. Just gotta pick up the phone.
asktrp,3e2n23,bicepsblastingstud,2,Tue Jul 21 14:27:45 2015 UTC,"You're right I wrote out a script to make it easier but I'm not sure I'm on the money. This might be an odd request for the sub, but could take a look at it?  ---script  Hi,  You're a very big events company and I'm enquiring towards how you make each event unforgettable and larger than life?  R: bla bla bla  Ahh very interesting. I'm offering a service that will add a very large wow effect to your events. We do projection mapping in which we project custom tailored videos onto walls to create amazing 3D illusions that your customers are sure to never forget.  Would you be interested in having a projection mapping service for one of your events?  ----end script"
asktrp,3e3e59,anonymousASKTRP,3,Tue Jul 21 17:27:46 2015 UTC,"""Sure, I know stairs are hard for you, just come inside and I'll carry it for you up the stairs.""   Your post isn't clear. Were you being sarcastic or genuine. Regardless, you handled her tantrum well.   there's no reason for a guy to carry a purse   WTF are you talking about? There are plenty of reasons why you might carry something for someone you give a shit about."
asktrp,3e3e59,secret_barber,2,Tue Jul 21 17:37:22 2015 UTC,I was being serious. Anyways since I've got 2 people scolding me I'll try to be nicer to her. My goal is to build a strong frame . The idea of carrying a girl's purse for her just seems so shameful to me.
asktrp,3e3e59,Zaorish9,1 point,Tue Jul 21 17:48:57 2015 UTC,"So, to be clear. She asked you to do something. You agreed. She threw a tantrum. If this is the case, fine.   The idea of carrying a girl's purse for her just seems so shameful to me.   If, instead, you implied this sentiment, than it makes sense that she blew up. Your's is a ridiculous position - that a purse is anything more than a bag of shit."
asktrp,3e3e59,secret_barber,1 point,Tue Jul 21 17:58:47 2015 UTC,Ok. Thanks for clarifying.
asktrp,3e3e59,Zaorish9,1 point,Tue Jul 21 18:05:02 2015 UTC,"Wait, was the problem that you didn't want to hold a woman's purse?   Don't worry, you won't have your man card taken away automatically for this.  It won't be the first time in life this happens; if its practical for the situation just do it like its no big deal, because its not."
asktrp,3e3e59,MentORPHEUS,0,Tue Jul 21 18:11:11 2015 UTC,"A post-op patient will have muscle issues.  If she was bed-ridden for 3 months as you say, she literally has muscle atrophy.  In my opinion, you are taking this whole thing wrong.  It was a simple matter of helping her due to her leg muscles being weakened.  She was suffering, and asked you for a little help.  Instead you chose to take it as a power struggle, and a way to control her.  You should have taken the old fashioned gentleman's approach and actually helped her.  In my opinion, you failed.  It wasn't even a shit test, but you turned it into one as evidenced by her reactions after the fact.  If you absorb too many treat-a-nail-with-a-hammer bits of info and nothing else, you will soon see EVERYTHING as a nail, and treat it ALL with hammers."
asktrp,3e3e59,MeatCurtainRod,0,Tue Jul 21 17:42:47 2015 UTC,"She was bed ridden for 12 days.  This pisses me off because before I read up on TRP I would have absolutely done that without question and now apparently I'm an asshole for trying to do what's right.  Anyways you're probably right, thanks for the reply."
asktrp,3e3e59,Zaorish9,3,Tue Jul 21 17:46:15 2015 UTC,You posted on the wrong account.  Just a heads up.
asktrp,3e3e59,yoyoz69,2,Tue Jul 21 17:56:23 2015 UTC,"I'm an asshole for trying to do what's right.   Helping a partner in need is the right thing to do, always. TRP only encourages you to be aware of whether that need is genuine or not."
asktrp,3e3e59,secret_barber,1 point,Tue Jul 21 18:01:12 2015 UTC,"Hang on a sec.  A critical bit of missing info here is she was bed-ridden for only 12 days.  In the grand scheme of things, that is nothing.  Sure, she will feel leg pains, but that is only because at 12 days, the muscles begin to get lazy and stiffen up.  Every time I've heard of a woman going through any hospitalization, it is literally the end of the world, and her recovery is the second coming.  Give her a small amount of support but treat it as a laughable or light-hearted thing.  Don't stone-wall her, but make sure to let her know that her issues are miniscule.  In other words, empathize with her ordeal, but make it clear that it isn't a big deal and that she will need to man up and muscle through the painful recovery.  NEVER cater to her whims of servicing her whims due to this.  If she is asking you to all of a sudden cook all her food and do all the house work for her, then put her in her place."
asktrp,3e3e59,MeatCurtainRod,1 point,Tue Jul 21 17:56:51 2015 UTC,I have been getting the impression that she has been pushing the victim hood a little past it's due date . I will be more gentle about my push backs thanks.
asktrp,3e3e0a,mrPikkabo,8,Tue Jul 21 17:26:47 2015 UTC,"I'd reply ""exactly"" to that.  and then stop texting non-logistics shit like you're supposed to be doing."
asktrp,3e3e0a,abdada,1 point,Tue Jul 21 17:29:17 2015 UTC,why aren't you an asktrp endorsed member?
asktrp,3e3e0a,trp-throw,2,Tue Jul 21 17:53:35 2015 UTC,"No idea.  Mods aren't always too happy with me.  I'm endorsed over at the main TRP subreddit but I've been banned there before (temp of course) and I think I've been banned here once or twice, too.  I get charges of ""cock measuring"" often enough.  Which is always comical on a TRP community site, heh."
asktrp,3e3e0a,abdada,1 point,Tue Jul 21 18:01:21 2015 UTC,"I get charges of ""cock measuring"" often enough.   I'd agree with that."
asktrp,3e3e0a,bicepsblastingstud,1 point,Tue Jul 21 18:20:19 2015 UTC,"Screw with her, I like it because it's funny to me and slightly mindfucking.  Her: ""Are you a dog person or a cat person?""  Me: ""Yes."" -stare-"
asktrp,3e3e0a,throw_em_all,1 point,Tue Jul 21 17:45:04 2015 UTC,She's freaked out because she's having casual sex with you. Those plates never last long.
asktrp,3e3c61,FartWillGoOn,4,Tue Jul 21 17:14:25 2015 UTC,"This would be a comfort test. Women need drama in their lives. They are fueled by emotions. Sans real drama, they will manufacture it to get the feels.   An LTR is a push-pull dynamic. She is testing you to see if you love her still and care about her. This is the time when you embrace her, show her some caring masculinity and assure her all will be well.   This will happen often if you err too much on the alpha side. If you err too much on the beta side, expect more shit testing instead of comfort testing. Find a balance, you're the captain. What your crew is telling you (GF) is how she feels in direct response to your leadership behavior in your relationship."
asktrp,3e3c61,jeanclaudevanman,1 point,Tue Jul 21 17:36:42 2015 UTC,"This is a very difficult challenge for me. I need to learn the difference between shit tests and comfort tests, because I get both. Is there any reading I can absorb to help me with this issue?"
asktrp,3e3c61,AEther_Flux,1 point,Tue Jul 21 18:34:57 2015 UTC,"There is a post on the sidebar at theredpill that's dedicated to shit tests and comfort test, check it out it helped me"
asktrp,3e3c61,Jani1157,1 point,Tue Jul 21 20:09:13 2015 UTC,"No, you don't need to. Do you want to?"
asktrp,3e3c61,secret_barber,1 point,Tue Jul 21 17:20:07 2015 UTC,Sometimes. She's just too clingy and I feel like she expects too much out of me. I think I provide enough support. What the hell is support in a girl's eyes?
asktrp,3e3c61,secret_barber,1 point,Tue Jul 21 17:25:09 2015 UTC,"It different for everyone. The only point that matters is that you aren't doing something right. Perhaps you can change, if you want to. Or, perhaps, you two are simply not a good match. And then, some people will never be satisfied, because they are looking externally for something that grows internally - validation."
asktrp,3e3c61,MeatCurtainRod,1 point,Tue Jul 21 17:30:34 2015 UTC,"Can you give an example of such an event?  There is one thing about being the emotional support of an SO to better the relationship, but there is another thing about being the emotional punching bag to satisfy your SO's personal issues."
asktrp,3e3c61,MeatCurtainRod,1 point,Tue Jul 21 17:32:50 2015 UTC,"Here's an example. Yesterday she stayed at work really late trying to get something done. I was at my apartment hanging out. She was going to come over when she was done working. As it got later she said she might not come over. I was fine with it, it didn't matter to me. I start getting tired and I told her that I was going to bed. It somehow turns into me not being there for her when she's stressed, I don't want to see her, etc. Just stupid bullshit. Finally she comes over, like she always said she was going to once she finished up with work, but somehow I hadn't been doing a good enough job of helping her when she was having a ""stress breakdown"". What the fuck?"
asktrp,3e3c61,AEther_Flux,2,Tue Jul 21 17:38:37 2015 UTC,"This is a lack of communication.  Did she tell you she was having a shitty day and wanted to see you after work?  Did you clearly state that you had to go to bed earlier for some important reason?  Communication is key here.  She seems to be emotionally invested in you, sort of like a LTR.  If you chose to ignore her cry for help and chose to go to bed instead, yes it will come off as asshole-ish to her, but not in a good way.  See, your decisions like choosing to sleep early will need to have a reason, and it could be anything.  But she will prioritize your time for her unless you prioritize your own time.  It isn't the fact that you chose to go to sleep, but that you value your sleep over her stress issues.  So have a reason to go to sleep early and all is right in the world by putting her in her place."
asktrp,3e3c61,kingofpoplives,1 point,Tue Jul 21 17:49:05 2015 UTC,"The plan was always for her to come over after work. Then she said she was staying late and might not be able to come over. She was texting me about being stressed and I was acknowledging that it sucks and it's shitty and all that. What the hell am I supposed to do? Text her ""awww baby it's ok I wuv u so much"" over and over again?"
asktrp,3e3c61,AEther_Flux,1 point,Tue Jul 21 18:10:05 2015 UTC,"No, tell her when you plan on going to bed and you will help her if she comes over before then. If she can't make it before lights out then make time for her the next day if you can. If she is still upset tell her you are trying to help, but you have your own responsibilities (work, other appointments, etc.) that come before her. LTRs are very tricky since you have to walk this thin line between alpha and beta. At least that is how an LTR feels to me."
asktrp,3e3apw,StrangeStart,2,Tue Jul 21 17:04:42 2015 UTC,"Let's play the name game   This is horrible. You've quickly and clearly set yourself up as being too available, so much so that you actually want to waste time fingering your phone. Not only that, but you're playing a childish game. Your goal in texting needs to be focused on negotiating logistics that will allow you to get within arms reach of this girl."
asktrp,3e3apw,secret_barber,1 point,Tue Jul 21 17:24:58 2015 UTC,How can I not be available and negotiate logistics
asktrp,3e3apw,secret_barber,1 point,Tue Jul 21 17:41:54 2015 UTC,"By focusing on what you want to talk about, logistics. You don't have time for games or get-to-know-you nonsense. That's what the date is for.   Hey, this is StrangeStart ...just met you on the bus (or a reminder related to your conversation on the bus). Let's grab a drink Thursday at 8pm, at Shitholes.   Think of it this way - she should enjoy being around you much more than she enjoys texting you."
asktrp,3e3apw,__Archaeus__,1 point,Tue Jul 21 18:06:38 2015 UTC,"I agree with this. A man is too busy to be texting on his phone. You have shit to do... always. Tell her when you are free. If she was interested, she'll agree to it.   Also, you shouldn't be ""taking her out"" as a reward for playing your game, she should be joining you when you are out."
asktrp,3e3apw,__Archaeus__,1 point,Tue Jul 21 18:40:22 2015 UTC,"i dont want to bring this chick out with my friends, that would be kinda weird  and id have no reason to be out unless with friends"
asktrp,3e3apw,throw_em_all,1 point,Tue Jul 21 19:01:34 2015 UTC,"More in the sense of: ""I want to go out and play some pool, you should join me."" If she declines, you were going to do it anyways, so it doesn't matter if she joins or not."
asktrp,3e2dkj,redpillcynic,6,Tue Jul 21 12:45:04 2015 UTC,They sort of do. The journey is a lonely one. Most people are mediocre. You'll find your crowd near the peak
asktrp,3e2dkj,jeanclaudevanman,4,Tue Jul 21 12:56:40 2015 UTC,"Always remember that you are the average of the 5 closest friends you keep.   Just as you would a woman, your friends must be vetted by you before entering your world and you must actively manage their places in your life. You should give no extra thought to how long they've been around or because you grew up together. All of your friends, both past and present, must meet your benchmarks and expectations or they get the boot.  As you continue to progress to the top, I can assure you the last thing you'll need are more ""friends."" Additionally, as you climb to the top, you will meet others who are there that climbed as well (and continue to do so). Those are the ones you want to surround yourself with."
asktrp,3e2dkj,secret_barber,4,Tue Jul 21 13:15:30 2015 UTC,"They sort of just drift away. There is no need to announce an official end to friendships, or communicate any difference in lifestyle or opinion. Relationships are fluid, they come and go. Let them."
asktrp,3e2dkj,kingofpoplives,3,Tue Jul 21 13:19:24 2015 UTC,"You don't need to get rid of them, but it's advisable to keep them separated from you conquests of poon. Haters gonna hate."
asktrp,3e2dkj,JackGoldsteinWrites,2,Tue Jul 21 13:12:43 2015 UTC,"You just end up running in different circles. My own friends who did the classic BB route are almost all happy, it's just that they and I both know I have no desire to go see them to sit on a couch for 11 hours watching sports while listening to crying kids and nagging wives.   We'll maybe see each other 1-2x a year, for big events like a World cup match, a boxing match, etc. Always at my house, always ""no spouses or kids"". Some of them have are really irked by my unmarried and relatively free life (I have an LTR though), they can and do pressure me to ""man up"" and ""start building something"". It doesn't even register in my brain anymore."
asktrp,3e2dkj,awalt_cupcake,1 point,Tue Jul 21 19:22:44 2015 UTC,I have only a few beta friends that I can get favors off of. See the 48 laws of power.
asktrp,3e2dkj,TheBigO420,1 point,Tue Jul 21 14:51:05 2015 UTC,"Drop them, they are a ticking time bomb. They WILL lash out at you and they have the ammo to cause serious damage if they were close enough with you.  Don't learn this lesson the hard way."
asktrp,3e2dkj,A_Medical_Physicist,1 point,Tue Jul 21 15:50:22 2015 UTC,"In my experience it will be easier and less painful for everyone involved.   It's up to you whether you want to burn out or fade away from your friends but it's pretty inevitable.   I think ""turn on you"" is a bit light of a term to be honest. I almost feel directly as if, once I had made a final push and was at least 51% red pill, I was being openly sabotaged by these guys. My circle went back a ways and we all started in the same town, in the same neighborhood, same family income and probably all at the same aesthetic level to be fair. I think they are jealous to see just how high they could have risen if they were willing to lift for a year and even try to break out of the bubble they've developed: get together with same 4-5 guys everyday, smoke weed, zombie around for four hours doing nothing social or productive.  I went to college in my hometown and tried to keep them at arm's length. It is not possible. At one point they resulted to a level that could really only be considered stalking just to try to get to some of the parties at my townhouse."
asktrp,3e2dkj,flying_cumshot,1 point,Tue Jul 21 17:18:08 2015 UTC,"Hell, I even cut off my alpha friends.  Basically any ""friend"" that gives you less benefit than you give to them, is useless. That's just my opinion though..."
asktrp,3e2dkj,squirrelcuisine,1 point,Tue Jul 21 20:50:07 2015 UTC,"Inevitable - it will happen and it is a waste of time having them in the first place.   that average of 5 friends thing.. I like that. I am going to use that for future reference.   funny there is a lot of gold in this thread. Im 40+ and had 2 beta friends for the longest time. The last one just bailed on me. He is married to a man hating feminist and has 2 kids from another beta guy. He calls those kids ""Sweetheart"" fuck it made my cringe every time and he said he is their father too.   Total henpecked pussy too. Probably got tired of me telling him to tell her to STFU.   one of the first people to put a rainbow on his facebook profile too.. Good god.   Im surprised at how right on the comments in this thread are.   Glad to be rid of the dead weight."
