asktrp,3e3lw0,torbodork,24,Tue Jul 21 18:20:09 2015 UTC,"Ban on social media except for stuff which will give you direct, concrete self-improvement advice, until everything else you need doing is done for the week. Ban on any story which might induce some 2nd phase bitching. Ban on any feels over realz relationship posts too which might induce Disney syndrome, oneitis etc.  Download StayFocusd for Windows, or WasteNoTime and SelfControl for Mac if you have them. Yes these are site blockers, I know your type I am one myself. Be frugal with how much time you allow yourself. Apply StayFocusd Nuclear Option at 11pm, every night. Self Control and Nuclear Option are perfectly red pill app options because once you go Nuclear they won't listen to your inner omega chimp cry for access until time has ran out. If you have Android, FocusON is a great site-blocker. Afraid I can't help you with an iPhone or brick, but it's Apple man, they're going to have something. Get to bed midnight latest. Rise by 8pm latest.  Cold showers as recommended.  You don't have to lift every day but you get outside and get a fucking walk every fucking day. In the sunlight. Every 3 days you are under something heavy and sweating or running somewhere cold but exciting and sweating, no questions. Lifting and HIIT are your best friends for aesthetics and the Alpha mindset. You should know all of this being here, but I'll repeat it for you. If you don't eat protein, GTFO. Limit sugar and carbs if possible. Carbs are for pre and post-workout or bulks, otherwise you'll have an energy crash and get fat. If you can afford it and are cutting, go palaeo. Protein shakes esp.  lean whey are your friend.  Fruit and veggies always. EFAs and monos such as peanut butter, olive oil; these keep your brain functioning alpha, and your ticker working nicely. Fish at least once a week, ideally twice for the omega-3s to reduce anxiety and depression. Yoghurt is your daily dessert, everything else is cheat day. Minimal cheat days, and meditate while having your cheat meal (srs)  every cheat meal/day, your SMV decreases slightly, so choose wisely and enjoy the experience.  Regular meditation, morning before school/work and evening before bed.  Visualisation and self-mastery exercises (letmegooglethatforyou.jpg)  Do not allow yourself extensive amounts of time lying on your bed doing FA. If you have work to do at home, do it downstairs. Before bed, make a list of your goals/tasks for tomorrow. Do not let this leave your sight. If you fail to check off everything on it, observe what you did that day that stopped you from doing it. Change your behaviour next time, the definition of insanity is doing the same thing and expecting different results. Again for Android, GoalTracker and Memorix are good apps. But handwritten is better.  Read: Cognitive Behavioural Therapy for Dummies, The Chimp Paradox, Stop Talking Start Doing, 7 Habits of Highly Effective People   Always remember, a man is what a man does.  Any questions get back to me, I'm off to run and squat."
asktrp,3e3lw0,Xemnas81,3,Tue Jul 21 18:57:05 2015 UTC,This is great advice ty
asktrp,3e3lw0,Benjruba,6,Tue Jul 21 19:30:34 2015 UTC,"Don't thank me, make use of it."
asktrp,3e3lw0,Xemnas81,2,Tue Jul 21 19:45:50 2015 UTC,Excellent list.    Visualisation and self-mastery exercises (letmegooglethatforyou.jpg)   Mind elaborating on this? What these are and their advantages.
asktrp,3e3lw0,areyouacyborg,7,Tue Jul 21 20:58:30 2015 UTC,"Just did my yearly monk, I was going to actually do a submission, but I think its more helpful here,and I don't want to flood trp with something which I feel is still not acceptable quality. I feel you should monk.   Summary: Monk mode over, do this every year for 1 month. Here's how I improved and why you should do it yearly if you're already red.   Take into account the following; I'm in cohabitation with an ltr of almost 6 years.   I'm dissociative.   I own a business, at a young age.   I've been lifting for years.   My business requires social media.   It may be hard to do this if you're not in compete control of your schedule.   Body:  First the goals.   I just spent my thirty day monk mode without any Internet except business. My close friend u/laughkisskill apparently had a blast with you guys on my phone, and learned a lot. He probably won't be on often anymore, he's doing fine as is.  Over this last month I read through (and copy edited) the RP handbook, the laws of power, nmmng, wisnifg, and of course, the book of pook, one of my favorite bedtime stories for the adult male. I had set the following goals for myself on a day to day basis.   1) gain more muscle. I started June 15th at 187, 17%, ended today,  the 15th of july, at 200, 18% I'm not that interested in cutting because I already look good. Though more definition may happen by accident in the future.   2) relax on the work addiction. I run a business with some old friends and we've been through an accelerator program this summer, I have serious issues trusting others so I normally do 65 to 80 hours a week. This had to stop. I had to learn to trust my partners again.   3) approach every day. Not for sex. Not to dread my girl. Just to take a hard look at a serious problem that popped up a year or two ago. ""coming across far too intense"". I learned how to relax myself to not look at everything as opportunity cost.  4) digest the lessons I've learned and put them into a series of articles. Currently there are 8. I spent a good thirty minutes a day taking some of the best RP lessons I've lived through, and will be posting them, hopefully someone will learn something, then again they may be absolute shit and I'll learn to give up on giving any type of advice. (each of these lessons was personally requested at some point by a user from trp, or asktrp)   Second, the how:  1) I switched from sl5x5 to ppl, upped protein and total calories per day to 150g and 2800 respectively. If i didn't lift ppl, I swam or did cardio. I also quit smoking using the ""quit smoking now"" app on Google Play store. Feel great.   2) I noticed working hard has gotten me far, but overworking had turned me into a very acerbic aggressive guy. Beyond what's aggressive attractive. This actually worked for me most of the time but for the recent two years it's actually scaring people away. I decided that going out 4 nights a week and giving away my cell to the aforementioned friend (so I couldn't keep working) was the best method to distance myself from my obsession. (btw my business is literally my lifetime hobby, I just get to make bank on it, if it helps explain my happiness being a workhorse)   3) Approaching every day helped me, I was more of an mgtow in mentality. The only reason I'm with my girl right now is because she's a truly rp woman. I do care about her immensely, love her. We live largely seperate lives, though together physically. In order to address the  intensity issue, let me give you an example. We're hiring like crazy, and I've scared more applicants away who've said (I don't want to fail him) than we've gained. It has become an issue. As a rule I decided I must insert one harmless joke into every interaction. Every day. It's helped boatloads. I also made a point of going to comedy clubs for my outings, and started building a set. As my girl says (you've just become so much more relatable, you're not a machine anymore.) because I admit, I eat, sleep, breathe, talk, and even play like a terminator.   4) I wrote every day. Each day. I already write about 200pgs a week,  edit about 300, so taking a break from work I moved to 14 pages, 2 a day in a journal attempting to address the topics requested as best I could. My writing hasn't improved I don't think, but maybe I can give back to the community, from whom I have taken so much.   Summary: 30 days dedicated to 4 simple areas of improvement helps massively. At least for me, hopefully for you. Don't take on too many tasks, just be focused. Your yearly monk also reminds your social circle how much they need you. (nice added benefit) or teaches you how much you aren't of value. (if they're not looking for you)."
asktrp,3e3lw0,Metalaggeddon,2,Tue Jul 21 19:48:26 2015 UTC,Excellent advice but I don't think he's ready for all of this yet. He doesn't know how to go about monk mode.
asktrp,3e3lw0,Xemnas81,0,Tue Jul 21 20:54:55 2015 UTC,Damn. I miscalculated again huh. Guess the intensity needs another few weeks
asktrp,3e3lw0,Metalaggeddon,2,Tue Jul 21 21:04:12 2015 UTC,"There's some excellent advice here already, but let me add my two cents.  Become addicted to self improvement. Most peoples issues with willpower and discipline stem from being addicted or enjoying negative behaviors that give them instant gratification. You need to learn to become addicted to things that take more time to attain that gratification.   Someone already mentioned taking cold showers, take two every day, one when you get up and the other before you go to bed. It might feel shit at first, but believe me at the end of the week you'll feel great. Same applies for lifting. Same applies for building a business."
asktrp,3e3lw0,Rorta,2,Tue Jul 21 21:03:19 2015 UTC,"You should read The Willpower Instinct, it's a great book that has helped me a ton in beating some addictions and fighting procrastination."
asktrp,3e3lw0,Wolfsdorf,3,Tue Jul 21 21:42:02 2015 UTC,Here's an easy one: take cold showers. Will yourself through the discomfort. Then build from there.
asktrp,3e3lw0,RPthrowaway123,1 point,Tue Jul 21 18:32:41 2015 UTC,"Discipline and willpower issues in modern boys primarily stem from instant gratification.  Instant gratification is a result of many things that happen to the boy over the course of years.  Individually, each variable that contributes to this is negligible, which is why such issues go unnoticed until it is far too late.  So here's the thing:  You need to unplug from the modern world.  You need to put down your video games and internet and tv and movies.  The modern world has gotten to the point where no one ever has to work for their answers.  They no longer have to struggle to find what they are looking for, because the mass media spews their garbage answers all day every day.  So why is this a problem?  Because instant gratification makes you a lazy entitled fuck.  It makes you a person who can't stand to wait even a little bit, even though you know waiting is going to yield better results.  It makes you a person who can't sit down to work through a problem.  Did you know there is are articles floating around everywhere saying that 97% of boys are misdiagnosed with ADD and ADHD?  There is a direct correlation between instant gratification and the symptoms exhibited in ADD/ADHD.  And we all know the key symptoms of ADD/ADHD are lack of focus, lack of willpower, and lack of discipline."
asktrp,3e3lw0,MeatCurtainRod,1 point,Tue Jul 21 20:52:05 2015 UTC,Success breeds success.  Start with small challenges and build up to bigger ones.  Willpower is a limited resource - eliminate bad habits one at a time.  (Quitting smoking AND heroin at the same time is probably a bad idea)
asktrp,3e3lw0,fnordsnord,1 point,Tue Jul 21 21:06:33 2015 UTC,"Paging /u/abdada, I always like to hear his thoughts on the same subject."
asktrp,3e4jr2,Liminalsnap,9,Tue Jul 21 22:15:11 2015 UTC,How about just 0's and 1's i.e. I am not attracted and I am attracted?
asktrp,3e4jr2,OscarWhisky,1 point,Tue Jul 21 23:14:59 2015 UTC,"but sometimes there are girls who you wouldn't fuck at first glance, but their personality makes up for it which makes them more attractive"
asktrp,3e4jr2,flying_cumshot,6,Tue Jul 21 23:23:38 2015 UTC,"So they're a 1.  My friend and I play the binary system, it's no bullshit to us.  You either would, or wouldn't fuck that girl and that's that."
asktrp,3e4jr2,life_manager,0,Tue Jul 21 23:29:43 2015 UTC,"No.... my point was that there are girls you would not fuck at all, but may fuck if you got to know them.  Creating an absolute of 0 and 1 is not accurate at all. A girl you just met would be a 0, and then you decide later that she's a 1? then what is the point of that system? might as well keep 1-10 then.  Patrice O'neal also proposed that a scale of 1-30 would be even more accurate."
asktrp,3e4jr2,flying_cumshot,2,Tue Jul 21 23:35:59 2015 UTC,"No.... my point was that there are girls you would not fuck at all, but may fuck if you got to know them.   I'm not saying this isn't true for people in general but I don't think you will find many of us are at a point in our lives where we consider this to be true for ourselves."
asktrp,3e4jr2,A_Medical_Physicist,1 point,Wed Jul 22 00:55:49 2015 UTC,"And a scale of 1-99999 would be even more accurate, but a system that has 1 and 0, but room for changing those numbers based on level of information is more useful.  You would fuck a hot chick, but change your mind if she has aids as an example."
asktrp,3e4jr2,648262,8,Wed Jul 22 02:41:20 2015 UTC,their personality makes up for it   You can't fuck a personality.
asktrp,3e4jr2,RemyPrice,7,Wed Jul 22 01:16:31 2015 UTC,"Nonsense. A great personality has the potential to move a woman up the scale in my book. I don't care how pretty a woman is and what her body looks like, if her personality is horrendous, down the scale she goes. I've turned down some solid 9's because of their terrible and obnoxious persona and character. Huge turnoff."
asktrp,3e4jr2,Gencooil,11,Wed Jul 22 01:46:27 2015 UTC,"The binary scale is my favorite for plates.  Rate them on whatever scale you want, but it all boils down to would-I-or-wouldn't-I."
asktrp,3e4jr2,machimus,5,Tue Jul 21 23:25:26 2015 UTC,"Try the Hard/Soft binary:  Hard 0: would not fuck with your worst enemy's dick  Soft 0: would normally not fuck, but suffering a slump/her personality/alcohol could make it happen  Soft 1: would probably fuck on any given day  Hard 1: would sell your soul to duck"
asktrp,3e4jr2,Asoka11111,2,Wed Jul 22 00:14:12 2015 UTC,Where do you find ducks that purchase souls? I've yet to find one.
asktrp,3e4jr2,dooblegoo,2,Wed Jul 22 00:47:23 2015 UTC,"Ad a point between you Soft 0 and Soft 1, and you have a 5 point scale.  Double it, and you have a 10 point scale."
asktrp,3e4jr2,Red-Zen,2,Wed Jul 22 02:47:20 2015 UTC,There is this:  Link
asktrp,3e4jr2,redparadigm,1 point,Tue Jul 21 22:37:31 2015 UTC,Full of White Girls. Unrealistic graph. And I like white girls but come on.
asktrp,3e4jr2,monkxae,0,Wed Jul 22 00:53:03 2015 UTC,I'm honestly not sure many of those girls are 9s in my book.  Maybe the first blonde one in the top row.
asktrp,3e4jr2,A_Medical_Physicist,0,Tue Jul 21 22:43:24 2015 UTC,"Agreed, this is a TERRIBLE scale.   I would guess that scale was made to make girls feel better about themselves."
asktrp,3e50gh,GunsGermsAndSteel,0,Wed Jul 22 00:26:30 2015 UTC,"The 5x5 thing gets oversold on this sub. You really need more training volume (eg, more sets, more time under tension) after the first year or so. Arnold's encyclopedia of bodybuilding has two beginner/intermediate workouts that imo are all you need. But they're full-body and up to 3 hours long. So wake up early."
asktrp,3e4ti7,markfeel,2,Tue Jul 21 23:30:08 2015 UTC,"I'm an industrial designer, I give everyone a business card, works wonders on the approach.   I offer 20% to anyone who brings me a client and I am on a few freelance websites. I am constantly building my portfolio too.  I spend a lot on partying, traveling on the weekend, camping etc. I split costs with people.  Its not just making money, its about keeping costs down.  Keep your job, figure out what marketable skills you have and sell them like they are going out of style.  You play a sport or instrument? Give lessons.  You make something? Make a bunch at top quality and sell them. You would be amazed how many people I saw at this festival last weekend making a killing selling tie dye shirts, dream catchers, bead bracelets and necklaces. There was a guy blowing glass bowls bongs etc. People were even cooking food and mixing drinks at their camp site and selling it.  Find something people want to buy and start producing and selling it."
asktrp,3e3q9s,Kaptin_Kiwi,6,Tue Jul 21 18:50:09 2015 UTC,"DON'T DO IT.  Don't seek to prove a point, don't try to show her how much you've changed, don't go out and seek revenge, don't go try and plate an old crush or ex-LTR...  Just DON'T.   However, more often than not, I get the, ""Well, you're acting different. Let me know when the old Kiwi comes back.""   This is common. All of these women are used to the beta version of you, and in you're pursuit to prove something to them or yourself, you'll revert right back.  If you're only a month in, avoid old girls in your life like the plague. They can and will undo you, especially if you're making progress.  But you're not ready. You're far from ready. If you were ready, this post wouldn't be sitting in AskTRP.   Again, with most of these women I was LJBF'd and was having absolutely no luck with.   Case and point. Even so, what would you be trying to prove? And to who? Alpha men don't require validation from women or peers, so don't stress over the approval of others.  And if you're trying to prove something to yourself this early on, you're asking for trouble.  Head my advice, new RPer: avoid old flings."
asktrp,3e3q9s,OmLaLa,4,Tue Jul 21 19:19:37 2015 UTC,Crabs in a bucket.  People see you trying to change yourself and all they want to do is to pull you back down to when they knew you and you were predictable.
asktrp,3e3q9s,MUTHAFATHAGENTLEMAN,1 point,Tue Jul 21 20:50:43 2015 UTC,"Thanks for this solid advice. I think in a way, this is what I had expected to hear. I hadn't seen a lot of material addressing this.   But you're not ready. You're far from ready.   Out of curiosity however, what am I not ready for? The RP has been a large part of my life since unplugging, and I've gone through a bunch of the material. Obviously, there's more to it than reading books and blogs, but I like to think I have a semi-firm grasp on everything."
asktrp,3e3q9s,MeatCurtainRod,4,Tue Jul 21 20:23:46 2015 UTC,"This is a pipe dream.  This is the hollywood movies telling you that you will randomly run into your EX and he will be all overweight and ugly, and you are fabulous and walk by swinging your long hair as it blows in the wind and you ignore him as you pass him by, while he shrivels up gawking at you knowing that he missed his shot at marrying you.  And yes you guessed that this passive aggressive dream notion is targeted towards girls.  You've also noticed that this notion is somewhat childish.  TRP dictates that you ignore these people.  Forget them.  Focus on yourself because you have no time to focus on your past."
asktrp,3e3q9s,Whisper,2,Tue Jul 21 22:18:20 2015 UTC,"At this point, should I just axe everyone from the pre-RP out of my life completely?   You don't have to. But don't let people hold you back.   And absolutely do not try to get with any women you knew before your transformation. Their image of you has been tarnished forever."
asktrp,3e4b05,FamousAuthor47,11,Tue Jul 21 21:12:57 2015 UTC,I don't know man.  A girl who suggests calling the cops on fake charges on the first date... You might not have failed a shit test so much as dodged a bullet.
asktrp,3e4b05,otterberg1,3,Tue Jul 21 21:44:36 2015 UTC,This is the right answer. Passing shit tests is nice but people lose sight of why shit tests exist. They test your fitness as a rational decision maker and as a man to trust in a bind to keep firmly to his mission. When passing shit tests that usually means ignoring her but in this case it means keeping himself safe when there's a threat coming from a crazy chick. I'm giving you a point for looking through the shit test at what really counts.  ♂
asktrp,3e4b05,CisWhiteMaelstrom,-1,Wed Jul 22 00:05:31 2015 UTC,"You're trying too hard. Just relax and have fun, no matter where you are. It sounds like she wasn't having nearly as good of a time as you want to believe.   my seduction spot   Come on, man."
asktrp,3e4b05,secret_barber,2,Wed Jul 22 01:04:25 2015 UTC,"Girl: Where are we going?  Me: ... beach   You were angling for a mystery-location. You then told her, ruining that surprise and capitulating. Correct response would have been 'wait and see'.   Girl: Ugh, no last time I was there I was with Mark (her ex). Can you just take me home?   At this point, you froze up. Best thing to do would have been to A&A and tease. Take the idea 'no I did that with my boyfriend' and blow it up. Is that Froyo place ruined for her now that she's been there with you? ""I would sleep with you, but I already did that with my ex..."" ""I would drive you home, but it reminds me of that time I did that with my gf"". etc. Add in some prodding in the side of the ribs, a falsetto and even some 'talking' hand flapping gestures to accentuate the peculiarity, depending on how comfortable you are with her. (At least, that's how I'd handle that stuff.)   Girl: You know I could call the police and tell them I've been kidnapped right?   Laugh and tell her she doesn't need to call the boys in blue; she can get off the tour whenever she wants, but you're going to be enjoying your walk on the beach. Tell her she can get out now or wait by the car while you take your walk.  Remember, don't take the conversation seriously at all. Logic is a garnish for charisma, not vice versa. Bemused is always better than bitter."
asktrp,3e4b05,despoticVeracity,1 point,Wed Jul 22 02:25:53 2015 UTC,"Yeah double failed shit test.  Girl: Ugh, no last time I was there I was with Mark (her ex)  Womanese for: my last man fucked me silly here. Are you a real man? I guess not?   Girl: You know I could call the police and tell them I've been kidnapped right?  Womanese for: Are you seriously going to fail that little test this hard? Fucking man up and make me wet!!!!  So yeah...you should have A&A and she would have been happy to get fucked on the beach."
asktrp,3e332q,ThunderCuntAsaraus,6,Tue Jul 21 16:12:00 2015 UTC,"My theory is that the women in your family can't think beyond what they would seek in a mate. Since they hit the wall or are post wall they assume that all women want what they want, a provider."
asktrp,3e332q,WolfenSatyr,4,Tue Jul 21 17:09:28 2015 UTC,"Because that's what they want now. They already experienced the alpha cock and now at their age, they want men that are Beta Bux. They're projecting their current mindset onto you."
asktrp,3e332q,flying_cumshot,3,Tue Jul 21 22:19:58 2015 UTC,"I've seen exactly what you describe many times. My theory is that it's a survival of the fittest thing. Females spray these bullshit notions at nearby males to see if they will absorb it and wither or stand strong with a thick skin. They are not aware they are doing this, it is just an instinctive thing."
asktrp,3e332q,Zaorish9,2,Tue Jul 21 17:44:52 2015 UTC,"So, there's a theory about male homosexuality that would also explain women doing this. Basically, a woman's epigenetics might be trying to kill off male relatives:  DNA is famously half and half from mother and father, but a baby gets some extra stuff from the mother only (mitochondrial DNA, and epigenetic things that influence gene activation in the nuclear DNA).   This extra stuff only gets passed on through the female line, so from its PoV, male children are dead ends. So it has evolved to influence a woman to favor her daughters over sons, and female relatives over males more generally. It probably contributes to males' higher infant mortality rates, and to male homosexuality (grandchildren through a son might divert resources from grandchildren through a daughter). It might also contribute to mothers abusing or giving bad advice to their sons.   This theory is compatible with psych explanations like 'well they just don't know how to give good advice' and 'ALL women SAY they want betas, this is not mother-specific'. These epigenetic factors could be part of why women evolved to give shitty advice to men (whether deliberately or b/c they really just don't know better)."
asktrp,3e332q,Zanford,2,Tue Jul 21 19:24:06 2015 UTC,It is a mistake to try and communicate with women on the same level you communicate men. There are vast swathes of non-spoken ideas that never get brought up when women are dispensing their advice to young men.
asktrp,3e332q,dreckmal,1 point,Tue Jul 21 16:40:18 2015 UTC,Because dealing with a male child is demanding. Instead of encouraging male behaviours they try to suppress them to make them easier to handle.
asktrp,3e332q,RunawayGrain,1 point,Tue Jul 21 20:10:45 2015 UTC,They don't know not to.  Probably wouldn't understand why not to.
asktrp,3e332q,VerticalSmileyCyrus,1 point,Tue Jul 21 23:04:42 2015 UTC,"Because they don't know shit, and they don't think about the consequences of their actions. Only a woman's current emotional state is real to her.   And if you let children do whatever they want, they'll eat cake for every meal."
asktrp,3e2t5m,LedZepIsLife,3,Tue Jul 21 14:59:49 2015 UTC,"I'm one year younger than you, eighteen and lost my father last year when I was seventeen, so quite a similar situation here.   His dad was an abusive alcoholic, he grew up and remained poor for a lot of his young life to keep his family afloat.   Your father did it without having a real role model father, so you (or we) can do it aswell without a father figure."
