asktrp,3e0zux,AlphaAsFAQ,3,Tue Jul 21 06:28:02 2015 UTC,"You pretty much described my early 20s. I've failed badly in college, got kicked out. My parents threatened to disown me. It messed me up psychologically, but I had a glimmering thought that I wasn't all that dumb and useless, so I slowly worked on myself.  I went back to the same degree, focused on the actual learning, and not the grades. I was doing fairly average, if not poorly. I didn't know if I was doing the right thing. I felt like quitting a gazillion times. I was completely stressed out, unhappy, directionless, but despite that I somehow had an insane belief in myself - this inner confidence in my abilities. I somehow knew that I must keep going despite anything that happens. I religiously studied self-help books trying to fix my messed up brain, trying to figure out the ""objective"" answer to questions (""Am I doing the right thing?""). My life was like an endless bleak wave of uncertainly and torture. Worst of all, I saw my classmates out having a normal life, socializing, getting good grades, passing courses, living a good life, being in relationships, whatever. I had none of that. I couldn't dream of it.  You know, the most demoralizing part was that I somehow just knew that I don't deserve to be  loved by anyone (I have no success, so I am a failure, and failures don't deserve love). I simply rejected the idea of me being any good. That thought made me clench my teeth in painful agony while I felt like gnawing my own eyes out. Quite often, the fantasies of me being crushed by a bus would bring such an intense wave of relief and pleasure that I'd forget to breathe. I felt like I had nothing to look forward to in life. I lost, game over. Given time, however, I managed to completely rebuild the foundation of my personality where the only person who decides how I am doing in life is me - not my parents, not my grades, not women. Nobody but me. I struggled to create my own vision of things, my own standards, what I call ""objective reality"". (if TRP is for relationships, OR is for life in general).  Come graduation time, I had a tiny chunk of my life figured out, I felt more stable and maybe even a little bit... happy? I do an interview for a Fortune 500 company for a bet with a classmate of mine. He bet me there was no way someone like me with such poor grades, no work ethic, no ambitions (all unlike him, of course), could ever land a good job, let alone one in a respected company. I had nothing to lose since I've already been to the absolute rock bottom, so I went for a round of interviews. All the extra studying, all the self-help books - they created a monster (I mean, that's how I feel) who was a perfect fit for a high profile, well compensated position. Everything just clicked. Somehow I knew every trick; I saw my interviewers like an open book. It was so simple it made me laugh.  You know, the funniest thing was how everyone around me was telling me how wrong I was about everything, messing it all up, being an all-around failure, and yet once they saw my value in the real world the tables flipped. Suddenly, everyone wanted to know the secret to my success. I felt like fish in the water while they were like blind kittens threading cautiously through tall dangerous grass.  Two years passed since then, and only NOW I am slowly realizing that I might be finally standing on solid ground. Only now do I understand how valuable it was for my self-growth to hit that rock bottom, to be rejected and deemed hopeless by people who I thought would stand by me no matter what. After having to defeat my inner demons, knowing what I went through gave me insane confidence from within that I could accomplish anything I could wish for.    As for your situation, OP, I feel like you are on the right track. You are working on yourself, and even if you might not have a specific goal right now, at least you know the general direction you should be heading in. Which is quite a lot, believe me!  I can't comment on what degree to take, or what to do with your life, but know this: when you aim to become the kind of person who will always have a job, will be a perfect candidate for your dream job (you don't even have to know what it is!), there is a chance you will get just that if you work for it.  As for the stress, you have a lot on your plate right now, especially with all the uncertainty with college. I think there is only two types of cure here: 1) experience in the real world; 2) understanding yourself, figuring out the real root of your stress and finding a way to turn your fears into positive. For example:   a lot of my coworkers are very stressed because they aren't sure if they will have a job tomorrow (some changes happening in the company). As for me? I am not worried at all. In fact, I'd welcome it. Why? Because it is a change. I get a kick in the ass to move, to find a better opportunity, perhaps start my own business. The thought of losing a job does not worry me, in fact it makes it something I secretly desire. Why the hell would I stress about it? a friend of mine ended up in a situation where he hates his job to the point when he cannot sleep. He lost 20 pounds in a month simply from worrying too much about not liking his new job. He was ready to quit at a moments notice, which meant he would have to return relocation money, signing bonus, and have to go back to his home country. Which freaked him out even more. So I sat him down and explained that he is looking at it all wrong. Look, if he hates his job, that's fine, but quitting is the dumbest thing he could possibly do. What is the alternative? Simply to be bad at the job so he gets fired. Why? Then he'd get to keep all the money :). And knowing that he doesn't have to work hard anymore, he could instead focus on doing things at his own slow pace the way he thinks is right ;). This different look on things ended his worries in an instant. He went from being depressed for 3 months to being the happiest man alive. And you know what? He is still there, but instead of slacking off and waiting to get fired he is becoming the top performer on his team. Once the stress was gone, he had a new look on the situation where he realized things weren't all that bad."
asktrp,3e0zux,subtle_enough,2,Tue Jul 21 11:21:52 2015 UTC,What you aren't working on is your game. You need to get out running game somewhere. Maybe go to a local town that's nearby on the weekends and start picking up the girls around there.
asktrp,3e0vq1,awayofthought,7,Tue Jul 21 02:31:09 2015 UTC,"Don't own a facebook page.  If for whatever reason you must have a facebook, here are my personal opinions -   Don't post statuses unless it's extremely meaningful - if you move, get a new job, stuff like that. Don't post anything about religious beliefs, politics, what you think about other people. You never know what people will be offended by. Don't allow tagged photos/statuses to show up on your profile. I personally think it's stupid to have a cover photo at all. Just leave it blank Be careful about what you like and comment on. Only like/comment on things like your friends graduating, getting married etc. Oh and liking that photo of your hot friend isn't going to make her want to sleep with you. Don't have captions on your profile pictures. Only spend time on facebook to see what your new friends are all about. Mindlessly going on there every day is a complete waste of time"
asktrp,3e0vq1,calmbreeze91,1 point,Tue Jul 21 02:58:56 2015 UTC,"Don't allow tagged photos   This is #1 in my opinion. You never know what retarded inside joke from middle school get might triggered when your friend sees something in a store. I don't think you want to be that guy getting tagged as a Lego set with some obscure caption that only you understand.    Oh and liking that photo of your hot friend isn't going to make her want to sleep with you.    I have a personal policy about not liking or commenting on anything women post on Facebook unless it is something I'd imagine them including in their life story one day (e.g. family member died, got engaged, finished grad school). Long story short I am never one the 217 people who like the picture of her before she goes to the club. I have this whole ridiculous theory that ultimately women will start putting out more if I can attract a huge amount of men to this cause."
asktrp,3e0vq1,A_Medical_Physicist,2,Tue Jul 21 17:30:48 2015 UTC,"In today's world social media is becoming more pervasive and potentially more necessary.  If you are going to use it, use it wisely.  In a way, you can take some tips from women and from guys that are successful on Tinder.  IE only post pictures that show you in the best possible way.  Keep them few and far between.  If you are going to do status updates make them ones that accentuate your SMV.  They should be calculated to inspire tingles by showing that you travel broadly to fun exciting locations, think deeply, and live well."
asktrp,3e0vq1,Rygoth100,1 point,Tue Jul 21 04:56:47 2015 UTC,"I didn't realize RP preaches no social media. That seems ridiculous.  That reminds me of advice I've heard before about how texting a girl shows cowardice, and that you're better off calling her to display confidence. Also ridiculous.  Times change and it's important to adapt. While I agree Facebook is becoming less and less relevant as the years go by, I still think it's important to have at least a minimal amount of social media presence. If you're under 35, being totally off the grid isn't normal and it may even seem creepy  The TRUTH of the matter is it's NOT easy to maintain a social media account as an adult male that receives a sufficient amount of likes/comments without compromising your SMV or authenticity. This is why most men give up.  For me personally, I use Instagram and Facebook. There used to be all sorts of things I thought were worth sharing when I was younger, but that time has passed. Now I just post a pic on Instagram about every 2 weeks, which i share over on Facebook every other 2 weeks. I take my time with posts and only post the coolest pictures I've taken. It's a wonderful ego boost to receive several comments and several dozen likes, and it keeps me loosely connected to a network of people that were, at one point in time, very important to me.  Most importantly as far as trp is concerned, I think it's the simplest way to display social proof and has allowed me to stay connected to female friends of my past that I was able to move forward with later on. I suppose there's easier ways to pick up chicks, but it's especially nice to get a second shot with a girl from your past."
asktrp,3e0vq1,Ezreal3,1 point,Tue Jul 21 09:25:44 2015 UTC,I think texting a new girl is infinitely better than calling her at first.   For one you can send a well crafted reply that might not have come to you in an active conversation. Secondly the delay between her sending a text and receiving mine is built in mini dread.
asktrp,3e0vq1,A_Medical_Physicist,1 point,Tue Jul 21 17:37:44 2015 UTC,"Definitely agree. I just used that as an example of how fast times change and how we need to adapt.   There's a lot of PUA advice from a long time ago that puts emphasis on calling women over texting them so you will seem more confident and sexy.   But the reality is, phone calls are a nuisance, especially ones from a stranger. They interrupt your day and demand your attention.  If you're under 35 it's all about the text game."
asktrp,3e0vq1,Ezreal3,1 point,Tue Jul 21 18:46:48 2015 UTC,"just hide 95% of the shit on it. Don't obsess over what's on their like some fucking tween, just put up like your ten best photos, a few statuses about going to the gym or reading and then just leave it."
asktrp,3e0vq1,RidleySmith,1 point,Tue Jul 21 11:43:47 2015 UTC,"Facebook is essentially two things: 1) Self-Marketing.  This is where you limit your content, but only things that portray you in a good light toward your audience.  Who is your audience?  Whoever is on your friend list.  Don't let anything show up as public unless absolutely necessary, and don't post to it on a regular basis.  For example, I've got a few lists, including: relatives, old friends/acquaintances, and current friends.  You can set up groups and post things to each of those as needed.  That way my mom, grandparents, etc. can see the pictures of my kids (Facebook is actually awesome for showing that kind of stuff to your family) but exclude those sorts of things from everyone else that doesn't care. 2) Seeing other people's stuff.  This is the bigger time waster.  Don't spend too much time browsing through other people's stuff and responding to their posts.  For me, I just occasionally click like on something positive that someone posts if I happen to see it, or wish a happy birthday to an old friend I haven't seen in person for years.  Don't get involved with drama, and don't act like you have no life.  Even if you are seeing something, don't post a comment or click ""like"" unless it means something (e.g. if your cousin posts a picture where they graduated college against all odds, it's nice to make a positive post congratulating them.)  The other part of this is where you use Facebook for events, messaging, or being parts of groups.  My neighborhood has a Facebook page that is like our own local version of Craigslist, without all the weirdness.  It works great.  In terms of setting up your own profile, I'd just have a generic profile picture (because it's public) and maybe post some nice photos occasionally of you so your family can see that you're happy and healthy.  Don't really add anything other than that to it unless you have a specific use (e.g. my example above of the community FB page.)  Definitely don't ""like"" businesses or other pages, unless it's a business owned by a close friend or relative that you'd like to support.  The rest is all data mining crap and you don't want that."
asktrp,3dze1a,Tiway22,4,Mon Jul 20 19:40:11 2015 UTC,"I had this buddy who I considered ""bro"" but he was depressed. I tried hard to make him move, do shit together, go for running to the park and all the usual stuff but he kept focusing on all the negative stuff.  The only thing you can do is realize that people like your friend and my friend need a professional for their case.   If you suggested him to look for professional help and declined, drop him only if he gets you emotionally, as you say."
asktrp,3dze1a,Myrpl,6,Mon Jul 20 19:54:29 2015 UTC,I'd advise against trying to bring people up from depression. Carrying someone else's burdens gives you twice the load.
asktrp,3dze1a,OmLaLa,3,Mon Jul 20 19:44:58 2015 UTC,"Don't give him advice unless he asks for it. This can be very hard, but most of the time people don't want your advice. They just want an emotional tampon."
asktrp,3dze1a,pinstrap,2,Mon Jul 20 22:50:48 2015 UTC,How long is a piece of string?
asktrp,3dze1a,cray-cray-cray,1 point,Tue Jul 21 00:21:11 2015 UTC,"You see, men have this uncanny ability to pick themselves up and keep moving forward.  Or if they face a problem, they can tackle it from a different angle and solve it.  If they don't exercise these skills, they then fall into the common position of feeling entitled.  Your friend is reaching out because he wants someone to help him, or tell him everything will be alright, and solve his problems for him.  You know this trait?  It is the trait of a boy.  By the way, he isn't depressed based on your description.  He is just a whiny little boy.  Tell him to man up and do something about his problems.  This behavior is toxic so you need to minimize contact."
asktrp,3dze1a,MeatCurtainRod,1 point,Mon Jul 20 19:56:32 2015 UTC,"The first time they tried dragging my mood down or sought pity from me I would cut them out.   I have enough mental and emotional energy for myself, I don't need to feed emotional vampires that do nothing but take."
asktrp,3dze1a,NidStyles,1 point,Mon Jul 20 19:58:09 2015 UTC,"No need to cut him loose completely.  You could always keep him as a contact.    If you want to try to ""save"" him, you could always induce some sort of catharsis."
asktrp,3dze1a,favours_of_the_moon,1 point,Mon Jul 20 21:24:03 2015 UTC,If you don't enjoy talking to him don't hang out with him past the utility of work.   If you think he has actual depression past a bad outlook on life advise him to seak medical attention.   I cut people out when I don't see the win win of hanging out. No one likes a leech.
asktrp,3dze1a,aroploen91,1 point,Mon Jul 20 21:30:54 2015 UTC,"hey you should do it instantly, don't get use to listen people complaining. I'll do it a bit for a friend if I knew him before his depressed phase. don't help random people it's bad for you."
asktrp,3dze1a,afroose,1 point,Mon Jul 20 22:59:28 2015 UTC,"Be a man about it, tell him whats up.   ""Dude (whatever), all this negativity is bullshit and a poor reflection on both of us. I don't want to hear it anymore. Its done."" Go on with: If you need to voice it to someone by all means do but it can't continue to consume our social interactions"
asktrp,3dze1a,Hunter2isit,1 point,Tue Jul 21 00:14:58 2015 UTC,Constantly complaining doesn't necessarily mean depression. Complaining can just be a bad habit.
asktrp,3dze1a,pickledpeas,1 point,Tue Jul 21 00:16:11 2015 UTC,"When would you cut someone out?   The older I get, the quicker I cut people loose. I have no interest in negativity. ""Either do something about it or STFU."""
asktrp,3e0tj3,badgeryshitlord,2,Tue Jul 21 02:12:58 2015 UTC,Don't respond to her apology. Just continue the conversation and set up a meetup.
asktrp,3e0tj3,Hecticchow,1 point,Tue Jul 21 08:47:14 2015 UTC,"I'd just reply with 'That's cool' or something along the IDGAF lines, then arrange a meet up since she clearly has interest as she apologised."
asktrp,3e0tj3,TRPAlternative,1 point,Tue Jul 21 08:38:19 2015 UTC,"Yeah, don't respond at all and she will go crazy.  Next time you text her only text her for a meetup"
asktrp,3e1heb,LordPorker,1 point,Tue Jul 21 05:57:16 2015 UTC,she works in customer care in a store   Do you realize that she is paid to be nice?
asktrp,3e1heb,secret_barber,1 point,Tue Jul 21 12:58:14 2015 UTC,There's not enough information here to say whether or not she's into you.
asktrp,3e1heb,OmLaLa,0,Tue Jul 21 13:54:27 2015 UTC,"RP has a pretty strong stand point on avoiding single mums. You won't get much of the ""go get her"" advice you are looking for here!"
asktrp,3e1heb,AlphaAsFAQ,1 point,Tue Jul 21 05:59:34 2015 UTC,"That's BS. Single mums are plate material. Anyway, in this day and age, guys like us are running into loads of mums."
asktrp,3e1heb,shablamman,1 point,Tue Jul 21 06:18:45 2015 UTC,Avoid single moms.
asktrp,3e1heb,Johnny10toes,1 point,Tue Jul 21 11:49:45 2015 UTC,"Yeah, good luck with that one. Single mums are everywhere.   To answer my own question - I'm gonna offer to hook up, and make it clear I'm not looking for anything serious."
asktrp,3e1heb,TRPAlternative,1 point,Tue Jul 21 12:31:18 2015 UTC,"While this is the general advice, and for a great reason, there is a subset that should be noted.  If you are going to game a single mom there are things you should consider.   She's guaranteed to be an alpha widow. You're never going to be number 1 in her life. Men come and go but my kids are forever. Her time is limited. Work, kids, stuffing cocks in her vagina, etc.  She's already proven to fail. She's going to try to make you a BB. After all she's strong and independent and doesn't need no man except for the 2 or 3 that thinks giving her money for opening her legs.   There are more. You can game them but you're going to have to vet really tight with the asshole game in the end because it's not going to work out and you'll have to hang her dry. Beta game comes to mind."
asktrp,3e1heb,Johnny10toes,1 point,Tue Jul 21 12:29:29 2015 UTC,"The issue with singles mothers (Mainly as an LTR) are there's only two options, and neither are good for you.  Either she is a good mother and takes good care of her kids, which means you'll never be the number one priority in her life and you'll spend a lot less time together unless you want to be raising another mans kids (About as beta as you can get) or she isn't a good mother and doesn't take care of her children well, in which case why are you with her because she's a bitch."
asktrp,3dzcdv,mrOpenMindedLoser,12,Mon Jul 20 19:28:17 2015 UTC,"If you can see this coming in the first place:  ""Wait, you're not sleeping in the bed with me, are you?""  If you've already picked a side and she doesn't like your choice:  ""sucks for you"" // ""too bad"" // ""no""  It's not that hard."
asktrp,3dzcdv,bicepsblastingstud,1 point,Mon Jul 20 19:32:26 2015 UTC,Those are my go to responses when a girl says /does shit like this.
asktrp,3dzcdv,prodigy2throw,23,Tue Jul 21 16:17:18 2015 UTC,"Easy solution, don't live like a ghetto queen with a damn TV in your bedroom."
asktrp,3dzcdv,NidStyles,4,Mon Jul 20 20:00:39 2015 UTC,"Q. She then proceeds to tell him that she wants to watch TV and if he is on that side then he will be in the way of the TV.  A. ""WHY THE FUCK DID U ASK ME WHICH SIDE I WANT TO SLEEP ON IF U ALREADY KNOW U WANT TO SLEEP ON THE SIDE CLOSER TO THE TV DUMBASS?!?!?""   I'd turn that response into...   ""Tough.""   Nothing more needs to be said to her. You're the man, she asked you to choose, you did. End of story.   If she got upset, I'd say...   ""You shouldn't've asked.""   Silly girl."
asktrp,3dzcdv,OmLaLa,4,Mon Jul 20 19:47:52 2015 UTC,"""Don't ask questions you don't want the answer to.""  A line I use a lot (with girls I've already plated), and it works here as well."
asktrp,3dzcdv,intelcorei5,3,Mon Jul 20 22:51:37 2015 UTC,"Promote her asking directly what she wants rather than beating around the bush.  If she said ""can i sleep on this side of the bed to see the TV?"" you wouldn't bat an eye... she's almost making a covert contract type deal... it's not exactly that but it's some unspoken type deal when she could easily just be forward about what she wants"
asktrp,3dzcdv,druganswer,2,Mon Jul 20 22:22:45 2015 UTC,"That is such a weird, awkward question the begin with.  I'd probably just say I am going to be on top of you in bed tonight and that's all that matters.  And who has a TV?  I haven't seen a girl with a TV... Ever.  They all have laptops and tablets.  I'd probably just laugh in her face though if she tried to take back giving me the option.  And honestly I don't care what side of bed I sleep on as long as she puts out.  There's nothing wrong with saying that."
asktrp,3dzcdv,Authority8,2,Mon Jul 20 21:37:17 2015 UTC,"Natural response, ""guess you're sleeping on top of me.""  No reason for it to make you angry."
asktrp,3dzcdv,intelcorei5,2,Mon Jul 20 22:52:28 2015 UTC,"What would you say?  You're going to let her know, without any ambiguity, that you are going to sleep on the side that you want to sleep on.  And if any elaboration is necessary, the only thing that needs to be said is because you want to.  This lets her know you're being real.  Now...because you see potential problems with you sleeping closer to the TV, you may decide that you now rather sleep on the side furthest.  Just make sure when you choose the furthest, it's clear to her it's because you want to.  If you don't, she will suspect you're not being real.  When she thinks you're not being real, more arguments and shit tests follow.  Why did she ask this way?  Women are indirect.  Stating what she really wants puts her in the position of being the bad guy.  If you had chose the side she didn't want, she never has to be the bad guy.  Since Patrice chose the side she wants, she now has to say things in a way that still doesn't make her look bad (""in the way of the TV"" sounds like an innocent reason.)"
asktrp,3dzcdv,www777com,1 point,Tue Jul 21 01:36:20 2015 UTC,"This is the best answer. That last paragraph hit the nail on the head.  I couldn't really articulate what was infuriating me about this, but it is exactly what you said: Women being indirect or as /u/druganswer said ""beating around the bush"". I just realized this isn't a shit test, its just an intrinsic machiavellian mechanism that women have to try and avoid being the ""bad guy"" as you said.  I think now that I understand this, I'll have an easier time dealing with my frustration over situations like this.  Underrated post ♂"
asktrp,3dzcdv,www777com,1 point,Tue Jul 21 13:17:16 2015 UTC,"""Women never want to be the bad guy"". Great tool for navigating female communication and understanding of their actions."
asktrp,3e1czk,Deanb1307,3,Tue Jul 21 05:10:02 2015 UTC,"When you feel like it. I don't do it on social media and I only keep extremely controversial opinions to myself at work because that could come back and bite you in the ass.  If it's just a casual conversation outside of work then state your opinion when you want, regardless if people don't like it. If they don't like it, sucks for them."
asktrp,3e1czk,SecondThreat,1 point,Tue Jul 21 05:32:23 2015 UTC,"I do something similar. In discussions I voice my opinions. But if a person is ranting over something I just listen, unless they actually ask for my view of the subject"
asktrp,3e1czk,rymdsylt,-1,Tue Jul 21 07:09:36 2015 UTC,"Precisely. Does your opinion facilitate any sort of understanding? Probably not. Best to keep that to yourself. Remember, there exists power in limiting speech, son. Side bar for you"
