battlebots,3e4mwi,500500,7,Tue Jul 21 22:38:34 2015 UTC,"No, its not a sport.  Its a competition.  There is nothing wrong with that.  'Competitions' can be equally or even more exciting than traditional sports.  Ever watch baseball or cricket?  A desperate attempt to legitimize your hobby by forcing a mainstream audience to recognize it as a 'sport' is futile.  It leads to endless bickering over pointless labels.  Enjoy it for what it is.  Fucking awesome robot combat."
battlebots,3e4mwi,CarlCaliente,3,Wed Jul 22 04:52:52 2015 UTC,"Having seen 5 years of fruitless debate over E-Sports, I agree.  Defining a sport is getting to a point of being as elusive as defining ""Art"". Whatever, who cares, what's important is that people like watching it, and people enjoy the act of competing with fighting robots."
battlebots,3e4mwi,Xciv,1 point,Wed Jul 22 05:38:48 2015 UTC,"Long time esport fan here as well, surprised there aren't more of us.  For some reason people still hold the TV as the holy grail of competition.  It's what brings in the money for the NFL and the NBA, but there are plenty of other ways to grow your brand.  I've said it in a few other threads but I've said it again, this show has done an excellent job in rekindling my childhood memories and I'd be more than happy to throw down on some type of PPV internet service.  If for any reason the BB network show fails I really hope they explore alternates like Twitch or a competitor.  I'd be happy to subscribe."
battlebots,3e4mwi,CarlCaliente,3,Wed Jul 22 05:46:36 2015 UTC,"Excellent article, must read for any robot combat enthusiast."
battlebots,3e4mwi,ausda,1 point,Wed Jul 22 02:21:37 2015 UTC,Awesome article.  Who's the UK spinner and the paraplegic bot (inb4 wrecks joke)?
battlebots,3e4mwi,qwertythe300th,0,Wed Jul 22 04:31:46 2015 UTC,assbots
battlebots,3e5jah,tiemyshoelace,1 point,Wed Jul 22 03:01:09 2015 UTC,"They look awesome! $22 is a little steep for my budget, but damn!"
battlebots,3e5jah,sinlad,1 point,Wed Jul 22 03:48:05 2015 UTC,Will buy
battlebots,3e5jah,FaceBagman,1 point,Wed Jul 22 05:07:31 2015 UTC,"BTW, the Bronco guys said they'll be doing shirts soon too (or... trying to). Let's keep our fingers crossed more folks do this for funding!"
battlebots,3e5jah,snowbirdie,1 point,Wed Jul 22 05:37:21 2015 UTC,"Would love to get one if I could! Hopefully I'll be able to within the next 10 days, definitely my 2nd favorite team."
battlebots,3e4j2v,Michael_MegaX,3,Tue Jul 21 22:10:23 2015 UTC,I wish we had videos like this for every match
battlebots,3e4j2v,andrewpe,4,Wed Jul 22 02:06:54 2015 UTC,"This video is actually a great example of why they have to dub in recorded bot sounds and synthesize others. The audio is immensely muffled and you can barely hear the bots. If they had a mike in the arena, it would have a ton of reverberation and wouldn't be coming from directions consistent with the camera."
battlebots,3e4j2v,teamtestbot,1 point,Wed Jul 22 03:10:57 2015 UTC,The audience sounded pretty fake though. I'm pretty sure I recognize them from Final Cut.
battlebots,3e4j2v,Advacar,2,Wed Jul 22 05:00:49 2015 UTC,"Seeing it again, it's even more clear that Biteforce deserved the win it got. Other than that one good bite on the treads at the very end, the tank controlled this match."
battlebots,3e4j2v,Astonishmunt,2,Wed Jul 22 02:52:25 2015 UTC,"The front fangs on overhaul are allowed to move upwards too much. If they locked them horizontally and maybe put little casters in them, they could have continued moving after picking other robots up, and they probably would have won."
battlebots,3e4j2v,BrainSlurper,1 point,Wed Jul 22 05:33:21 2015 UTC,The bots and the bees?  Couldn't they find a better tag?
battlebots,3e4j2v,RA2lover,1 point,Tue Jul 21 23:08:30 2015 UTC,WUUUUUUUB WUBWUBWUB PHRRRRRRBTBTBT
battlebots,3e4j2v,Baryshnikov_Rifle,1 point,Wed Jul 22 02:33:39 2015 UTC,This is so much better than listening to the announcers...especially Ole Crossleg
battlebots,3e4j2v,matroe11,5,Wed Jul 22 02:33:41 2015 UTC,I'm the only one who actually likes watching the full episodes? I feel narrators are part of almost every sport.
battlebots,3e4j2v,the_popcorn_pisser,3,Wed Jul 22 02:46:00 2015 UTC,"I don't watch traditional sports, but if I've learned anything from watching E-Sports for the last 6 years (Starcraft BW, Starcraft II, Street Fighter IV, League of Legends, World of Tanks), there will always be people that shit on the commentators no matter what. It's almost a law at this point."
battlebots,3e4j2v,Xciv,1 point,Wed Jul 22 05:43:17 2015 UTC,Im with you.
battlebots,3e4j2v,Thats_absrd,1 point,Wed Jul 22 03:49:54 2015 UTC,Needs incredibly overdramatic commentating.
battlebots,3e4qh2,SkepticSarah,12,Tue Jul 21 23:05:52 2015 UTC,It was cool having the various weight classes but I bet they wont in season 2 not only to have more standardized regulations but to streamline the show better. Itll take much more episodes and development to televise multiple weight classes and Im sure ABC wont want to bother with it.
battlebots,3e4qh2,Dtr45,5,Tue Jul 21 23:14:03 2015 UTC,No.  I think it's only going to be the 250 lb class for a while.
battlebots,3e4qh2,freedomfightre,2,Wed Jul 22 00:47:45 2015 UTC,Why 250 pounds?  Isn't 220 the standard at most events for heavyweights?
battlebots,3e4qh2,glorkvorn,3,Wed Jul 22 03:28:29 2015 UTC,"Battlebots ABC wanted to give competitors a little more weight to work with than normal (new competition; mix things up), so they bumped the max up a little bit."
battlebots,3e4qh2,freedomfightre,4,Wed Jul 22 03:48:44 2015 UTC,"If they do it, they'll only really televise the heavier categories :-/"
battlebots,3e4qh2,RA2lover,2,Tue Jul 21 23:09:49 2015 UTC,I think sure Greg Munson implied they were going to stick with the one weight class in an interview I read or saw somewhere.
battlebots,3e4qh2,markymark_inc,2,Tue Jul 21 23:39:01 2015 UTC,"Not a good idea, they only have a limited amount of episodes. I would rather see bigger bots."
battlebots,3e4qh2,Bithorp,1 point,Wed Jul 22 01:54:30 2015 UTC,I've made a promise to myself (and the bot obsessed starry-eyed kid I was) that if the lightweight division is brought back that I'd compete now that building a decent LW is moderately feasible with my finances. I might be able to swing a miracle if they continue to be HW-only though. Just depends on what kinds of stuff I can pick and if I get lucky.
battlebots,3e4qh2,ZetaGator,1 point,Tue Jul 21 23:46:47 2015 UTC,"I really hope so. It'd mean more diverse robots, and maybe longer seasons."
battlebots,3e4qh2,SparkleSorceress,1 point,Wed Jul 22 01:33:26 2015 UTC,"I think it's good for the sport to keep holding lightweight competitions at Robogames, etc, but I kind of like having one weight class for Battlebots. Condenses all the building talent into one tournament. When I was at the first taping and saw that Complete Control was a heavyweight, I nerded out a little."
battlebots,3e4qh2,ZeroAce11,1 point,Wed Jul 22 02:08:43 2015 UTC,I like the focus that this season has on one weightclass. Although if they held a tournament for a smaller weightclass (BW/FW) they could stream the matches online.
battlebots,3e52pn,EntropyInTheUK,1 point,Wed Jul 22 00:45:23 2015 UTC,"Removed as a consideration for others.  Even though you used spoiler tags, they don't work on mobile devices.  If you want to talk about this better to use a spoiler flared post with a title describing the nature of what you are speculating here but not actually revealing anything..      e.g. This post seems good for heavy speculation https://www.reddit.com/r/battlebots/comments/3dzrwf/potential_spoilerdid_abc_show_us_the_winner/"
battlebots,3e52pn,varoan,0,Wed Jul 22 02:24:28 2015 UTC,"it'll probably win it all, unless ghost raptor somehow manages another win.   that's the kind of armor that wrecks tombstones blade just like stinger and witch doctor."
battlebots,3e32fh,FaceBagman,8,Tue Jul 21 16:07:15 2015 UTC,I love how Whirligig starts spinning around and Carnage Raptor sits there like Oh you think youre fancy? I can do that too! and he starts spinning. It was like a dance off with both of them spinning in place next to each other
battlebots,3e32fh,Dtr45,4,Tue Jul 21 23:08:40 2015 UTC,"What the heck was the hazards guy doing, there? The ref was pretty clearly telling him that Whirligig had tapped out. Could he not hear him or was he ignoring him?"
battlebots,3e32fh,Warbird36,4,Tue Jul 21 16:44:09 2015 UTC,"That's Pete, and he has no fucks to give.    Seriously though, it's more about entertaining the crowd and giving them a good show. I'm guessing if the bot had been more intricate, expensive, and not driven by a fresh contender Pete would have given him a little more respect."
battlebots,3e32fh,ThisKillsTheCrabb,3,Tue Jul 21 17:20:18 2015 UTC,Fuck Pete
battlebots,3e32fh,QuixoticViking,4,Tue Jul 21 18:34:45 2015 UTC,"Pete has the most impressive record in the battlebox, only losing once when a bot ripped the pulverizer out of it's socket."
battlebots,3e32fh,Nsongster,3,Tue Jul 21 23:59:31 2015 UTC,P U C K F E T E
battlebots,3e32fh,Bithorp,3,Tue Jul 21 19:12:07 2015 UTC,OMG! LMAO! They keep hitting him over and over again hahaha
battlebots,3e32fh,ausda,1 point,Tue Jul 21 19:52:14 2015 UTC,PETE YOU TROLL!
battlebots,3e2ax0,abhishekcal,20,Tue Jul 21 12:18:23 2015 UTC,"Yeah, mostly the latter.  Sponsors are great if you can get them.  Since this season was invitational, the builders got a stipend, but it's unlikely they'll do that again since next season is intended to be an open competition.  Merchandising is another way to make some money; that's why some builders make robots that look like they'd make good toys.  But for the majority of builders, the majority of money is out of pocket, and they do it for the love of the sport."
battlebots,3e2ax0,ResettisReplicas,9,Tue Jul 21 13:47:42 2015 UTC,The show is killing the ratings. Why wouldn't stipends continue?
battlebots,3e2ax0,Spats_McGee,6,Tue Jul 21 15:14:19 2015 UTC,"More money directly to the network. Plus since this time they were invitational, they controlled how many bots there were plus alot of the teams already had bots and just repainted and renamed them for the competition. With next season being open, we dont know how many people will attempt to enter or who will and you cant really pay every bot that enters."
battlebots,3e2ax0,NachoManSandyRavage,4,Tue Jul 21 16:34:34 2015 UTC,where do they have information about next season?  is this from a source or your speculation?
battlebots,3e2ax0,varoan,2,Tue Jul 21 16:57:05 2015 UTC,that's why some builders make robots that look like they'd make good toys   Ginsu was a terrible design but cool enough that not only was it one of the 50 collectible minibots but also a McDonalds toy too.
battlebots,3e2ax0,Dtr45,1 point,Tue Jul 21 23:02:59 2015 UTC,holy fuck i had that toy but I had no idea it was a battlebot!
battlebots,3e2ax0,locoattack1,1 point,Wed Jul 22 00:34:47 2015 UTC,Spektrum had to have been a sponsor. Their Tx got a lot of airtime.
battlebots,3e2ax0,roburrito,7,Wed Jul 22 02:20:03 2015 UTC,"Most have sponsors at least, who do it for public exposure"
battlebots,3e2ax0,Osmarov,7,Tue Jul 21 13:16:27 2015 UTC,"Television royalties were dispensed during the Comedy Central seasons, and there were talks that it was one of the reasons why they stopped airing the rumbles at the end of the seasons. For some builders, such as Complete Control, they were able to rebuild their robots on the royalty checks alone."
battlebots,3e2ax0,ZetaGator,2,Tue Jul 21 15:02:47 2015 UTC,"As I understood it the builders in the 1 on 1 matches were paid for each showing as well. A set amount for the first showing and less for each rerun.  In the CC season 5 there were 500+ robots competing with only a small fraction getting on TV and even less getting any merchandise deals so very few builders saw any money. To OPs question for me it was for love of the sport. Since most of the robots in this season were actually shown on TV I'd think there was a better chance to recoup expenses or maybe even make a profit. Not begrudging them that, there wasn't much time to get ready and the quality of the bots are pretty good."
battlebots,3e2ax0,Expired_Twinkie,1 point,Tue Jul 21 18:35:25 2015 UTC,A lot of the builders already work for robotics companies and have internal resources.
battlebots,3e2ax0,snowbirdie,1 point,Tue Jul 21 17:57:29 2015 UTC,they have sponsors and I assume a prize money for placing higher in competition.
battlebots,3e5hhj,Mike_Savage_Ledger,5,Wed Jul 22 02:46:18 2015 UTC,"I agree %100 with you. I know Tombstone and Bronco will give a great show..but knowing GR he will get lucky/ have some stupid ass additon to his ""perfect bot"" ( that didn't last 1 round in tact) and it will half way work and he will ""glot"" all over himself. So he will probably skate to the finals. As much as I love Bronco....I am willing to see him lose a good match to watch Tombstone put a big ass blade on his bot spin the bad boy up and tear GR so bad he won't shit right"
battlebots,3e5hhj,StremeSpoats,4,Wed Jul 22 04:19:00 2015 UTC,"In my opinion if he can MacGuyver enough interchangeable weapons to beat Biteforce and Tombstone then he is plenty deserving of the nut.  I'm really not seeing the beef with Ghost Raptor here. Sure its blade was hollow and lasted no time at all, but after that its been adapted to suit its opponent and I feel that should be commended. The de-icer was inspired and I want him to win off of that alone."
battlebots,3e5hhj,HarleyWorking,2,Wed Jul 22 05:07:58 2015 UTC,"To be honest, I'm not sure if there is anything ""cheap"" that can be built to counter Biteforce. That robot isn't going to fuck itself up like Icewave did."
battlebots,3e5hhj,fb39ca4,4,Wed Jul 22 07:17:29 2015 UTC,You shut your whore mouth
battlebots,3e5hhj,VivaElToro,7,Wed Jul 22 02:54:19 2015 UTC,Ghost raptors defense against bite force: The toothbrush
battlebots,3e5hhj,CarlCaliente,2,Wed Jul 22 02:56:40 2015 UTC,"Adapt and overcome bitch  It really is a silly competition given the circumstances.  I loved the thought they put into their shock absorbers, I want to believe they'd still have a decent weapon if they had time to repair it  But if a cheap win in the finals leaves you buttmad then I'm equally satisfied"
battlebots,3e5hhj,CarlCaliente,2,Wed Jul 22 04:56:46 2015 UTC,"I picked them as a favorite after the tested videos.  I can't really hold any grudges given the nature of the shooting, its clearly all about TV #1 and competition #2.    I can see the attitude that their 'adaptable' weapon was cheap since it was basically created to nullify Icewave (who was a very close 2nd favorite of mine).  At the same time it would've been great to see them to head to head with properly working weapons.  But I'd rather see a few 'crap' matches to secure a long term deal than some honest fights that go back into the underground  ...that is, unless you know someone with dem underground tickets"
battlebots,3e5hhj,FaceBagman,1 point,Wed Jul 22 05:37:32 2015 UTC,"Chuck's doing an AMA on Thursday. You can ask him if this happens then? I'm sure he can't answer, but still..."
battlebots,3e5hhj,ZetaGator,-2,Wed Jul 22 05:42:34 2015 UTC,"Spaz, a thwackbot, managed to win the season two middleweight title on dumb luck alone and BattleBots mustered another three seasons. Not all hope is lost...?"
battlebots,3e5hhj,StremeSpoats,1 point,Wed Jul 22 04:56:52 2015 UTC,and the build of TAZ and GR are the same guy....
battlebots,3e5hhj,ZetaGator,2,Wed Jul 22 03:20:00 2015 UTC,"I can't remember the name of the guy who built Spaz, but that was a robot from Team Vicious. Chuck did have a lightweight thwackbot though, called Carnage (later renamed Carnage Raptor)."
battlebots,3e5hhj,FaceBagman,1 point,Wed Jul 22 04:19:30 2015 UTC,None of this seems correct.
battlebots,3e1yjx,lXlxlXlxlXl,19,Tue Jul 21 09:40:08 2015 UTC,That... was supremely unsatisfying.
battlebots,3e1yjx,twoscoopsofpig,14,Tue Jul 21 13:30:21 2015 UTC,What am I watching?   Also that arena looks incredibly dangerous for the viewers.
battlebots,3e1yjx,nomelonnolemon,16,Tue Jul 21 11:08:01 2015 UTC,"This is Robot Wars 1995, the precursor to Battlebots.  And yes, the arena was very not-safe. Blendo made its debut at this tournament and was forced to retire because it was throwing shrapnel into the audience... And that's why we have lexan walls today."
battlebots,3e1yjx,Warbird36,5,Tue Jul 21 11:17:31 2015 UTC,And here's another fight with SPS2 as well...
battlebots,3e1yjx,Warbird36,2,Tue Jul 21 09:40:38 2015 UTC,"Wait, that first bot was built by the guy who built Ziggo?"
battlebots,3e1yjx,droopyGT,2,Tue Jul 21 16:38:18 2015 UTC,It is.
battlebots,3e1yjx,V900,5,Tue Jul 21 17:49:55 2015 UTC,"I'm just amused that the pendulum, which looks like it would be an otherwise completely useless hazard, manages to smack the flying bot."
battlebots,3e1yjx,sillyinches,5,Tue Jul 21 16:39:15 2015 UTC,That was just... weird. Like Cirque Du Soleil for robots weird.
battlebots,3e1yjx,varoan,3,Tue Jul 21 21:41:47 2015 UTC,"Imagine if we had a flying bot like that today, but instead of a shoddy little net it had a giant Nightmare-looking spinning blade."
battlebots,3e1yjx,yaomon17,7,Tue Jul 21 14:42:39 2015 UTC,i imagine it'd look like a nightmare-looking spinning blade sitting idly on the ground with 2 balloons tied to it. That shoddy little net weighs nothing.
battlebots,3e1yjx,TinyLittleBirdy,3,Tue Jul 21 17:53:54 2015 UTC,"nah, give it a really nasty flame-thrower.  a balloon with a flamethrower chasing other bots sounds hilarious to me.  you could even make it a multibot.   one with the blade so it gets on TV, the others with flame-throwers."
battlebots,3e1yjx,ProfessorBarium,1 point,Tue Jul 21 17:42:34 2015 UTC,"Also, assuming it gets off the ground, if the blade starts spinning in any direction at all, the robot will fly and tumble in every imaginable direction until it crashes into a wall and falls."
battlebots,3e1yjx,SkepticSarah,1 point,Tue Jul 21 22:00:02 2015 UTC,"Use a rotor to counter act the torque, that's what helicopter do."
battlebots,3e1yjx,SkepticSarah,1 point,Wed Jul 22 01:10:39 2015 UTC,"Interesting to see a spherical bot. I've been thinking about doing something similar, but I still haven't quite worked out weapon alignment."
battlebots,3e1yjx,TinyLittleBirdy,1 point,Tue Jul 21 20:46:51 2015 UTC,"I'm confused, can someone explain to me what's wrong with omni-directional movement?"
battlebots,3e1yjx,TinyLittleBirdy,2,Tue Jul 21 22:56:23 2015 UTC,"There's nothing really wrong with it. It gives some advantages, but it has draw backs too.  In the case of Orb of Doom, there's very few ways to mount weapons on a design like that. And there is a disadvantage in traction and pushing power... Actually, it has very little going for it.  In another thread people were discussing omnidirectional drive systems, as used on robots like Alcoholic Stepfather. This design does have some advantages, as it can keep a heavily armored front to the opposing robot at all times. But ultimately, it's still not as good as regular wheels because mecanum wheels are expensive, fragile, offer less traction, difficult to build, and no redundancy.   You can read the thread I was referencing here."
battlebots,3e1yjx,Astonishmunt,1 point,Tue Jul 21 23:18:27 2015 UTC,I always thought you could mount flamethrowers on the inside of something like Orb of doom with noozles coming out the side.
battlebots,3e0233,legolots,16,Mon Jul 20 22:32:15 2015 UTC,3spooky5me
battlebots,3e0233,goomylord,3,Tue Jul 21 02:21:04 2015 UTC,Can confirm. Sent shivers up my spine.
battlebots,3e0233,GWFKegel,12,Tue Jul 21 04:52:14 2015 UTC,"A bit of trivia on this:  The Great Pumpkin only actually fought once with the inflatable pumpkin as far as I know. As it turned out, the fabric was very easily punctured, causing the pumpkin to deflate and become an accidental entanglement device. It was quickly replaced with a hard plastic pumpkin for this reason."
battlebots,3e0233,HotDealsInTexas,15,Tue Jul 21 03:20:13 2015 UTC,"As it turned out, the fabric was easily punctured.   Shocking."
battlebots,3e0233,MustBeNice,5,Tue Jul 21 04:26:09 2015 UTC,And that ruined it. That ridiculously large pumpkin was hilarious.
battlebots,3e0233,ManlyHairyNurse,1 point,Tue Jul 21 03:46:09 2015 UTC,Here's a combat video of the Great Pumpkin. It was uh... not particularly effective.
battlebots,3e0233,droopyGT,8,Tue Jul 21 19:51:20 2015 UTC,Kinda makes me wonder if Ray's strategy for BETA involved an inflated shield/cushion. There was mention of a BETA BLOCKER and he has a certain affinity for large balloon creatures.
battlebots,3e0233,VivaElToro,6,Mon Jul 20 23:06:02 2015 UTC,"a certain affinity for large balloon creatures   Man, where I come from that has a completely different connotation."
battlebots,3e0233,ZetaGator,2,Mon Jul 20 23:48:39 2015 UTC,"That would be fantastic, haha, though i'd have to imagine it would limit the bot's ability to drive upside-down should it be popped."
battlebots,3e0233,HardcoreRay,7,Mon Jul 20 23:09:48 2015 UTC,"Glad everyone enjoyed this :) The history with the Great Pumpkin is here on my site:  http://www.hardcorerobotics.com/gp1.html   I probably would have given up on this one a while ago, but my team mate Rick took over the project and has continued working with it over the last few years."
battlebots,3e0233,ForceAndFury,2,Wed Jul 22 01:19:56 2015 UTC,I'll always be a fan of that bot just for the licking it gave Touro Maximus a little while back.
battlebots,3e0233,picklesitter,8,Wed Jul 22 01:37:32 2015 UTC,I really appreciate his huge grin there.
battlebots,3e0233,HighOverlordXenu,4,Tue Jul 21 00:02:25 2015 UTC,"Truly, Ray Billings is a dark wizard."
battlebots,3e0233,EviRs18,2,Tue Jul 21 00:03:30 2015 UTC,I want a new neighbor.
battlebots,3e0233,CK159,2,Mon Jul 20 23:47:41 2015 UTC,One that can tear a hole through your wall from down the block?
battlebots,3e0233,EviRs18,4,Tue Jul 21 02:58:07 2015 UTC,"I'd refer to it as an ""Awesome"" one"
battlebots,3e0233,Swade9wade,2,Tue Jul 21 03:18:28 2015 UTC,Damn this guy could make his own little robot Halloween parade.
battlebots,3e0233,C0L4ND3R,2,Tue Jul 21 02:47:50 2015 UTC,That's absolutely terrifying.
battlebots,3e0233,TheGuyWithFace,2,Tue Jul 21 03:28:37 2015 UTC,That laugh at 28 seconds...
battlebots,3e0233,ausda,3,Tue Jul 21 03:51:34 2015 UTC,Confirmed battlebots halloween special!
battlebots,3e0233,LochnessDigital,2,Tue Jul 21 07:04:51 2015 UTC,The way the head tilts back makes me giggle.
battlebots,3e0233,nadarko,1 point,Tue Jul 21 09:52:55 2015 UTC,He is truly a master of the macabre.
battlebots,3e0233,RA2lover,1 point,Tue Jul 21 20:36:34 2015 UTC,"As for the guys who built Plan X...  Yep, they've also built another terrifying robot."
battlebots,3e0233,Cyral,4,Tue Jul 21 02:13:59 2015 UTC,"I mean, this robot and Plan X are about equally as effective for combat."
battlebots,3e0233,ARC157,4,Tue Jul 21 02:37:36 2015 UTC,It looks like they are using the same base. (Plan X was built from a kit IIRC)
battlebots,3e0233,internetlad,-7,Tue Jul 21 03:10:40 2015 UTC,"Congrats! You're participating in the easiest and lamest circlejerk on reddit! To claim your prize, please visit /r/daeplanxsucks"
battlebots,3e0233,ForceAndFury,4,Tue Jul 21 12:53:50 2015 UTC,Honestly it's not even. That was just a funny robot. Mfw tinfoil wings and an LED kit in a competition where people use quarter inch steel plate.
battlebots,3e0233,ARC157,-4,Tue Jul 21 13:17:28 2015 UTC,"We get it. Plan X was a bad bot. This thread had nothing to do with Plan X, but yet the same recycled joke is still being spouted.   That qualifies it as a lame, easy circlejerk."
battlebots,3e0233,ARC157,2,Tue Jul 21 13:44:33 2015 UTC,is it still cool to make fun of Radioactive?
battlebots,3e0dfu,MikeNCR,4,Tue Jul 21 00:02:15 2015 UTC,You probably want to post that over here: https://www.reddit.com/r/IAmA/comments/3e0dcf/hi_i_am_the_leaderdriver_of_the_battlebot_bite/
battlebots,3e0dfu,STICH666,5,Tue Jul 21 00:32:51 2015 UTC,You probably want to post that over here:   https://www.reddit.com/r/IAmA/comments/3e0dcf/hi_i_am_the_leaderdriver_of_the_battlebot_bite/
battlebots,3e0inu,jdtran408,19,Tue Jul 21 00:44:54 2015 UTC,I don't normally make gifs but I found it funny so here you go.
battlebots,3e0inu,neon121,6,Tue Jul 21 04:59:17 2015 UTC,I am saving this. It will be useful in MANY situations.
battlebots,3e0inu,Nickvr628,3,Tue Jul 21 12:27:00 2015 UTC,haha thanks a lot man i appreciate it.
battlebots,3e0inu,joecb91,2,Tue Jul 21 05:37:30 2015 UTC,"Thanks  As soon as I saw it during the episode, I was just thinking ""I hope someone makes a gif of that"""
battlebots,3e0inu,nomelonnolemon,2,Tue Jul 21 19:30:55 2015 UTC,Ya that was pretty funny!
battlebots,3e0inu,DokerinZion,1 point,Tue Jul 21 11:04:41 2015 UTC,"it remember that, but forgot what they did to incite it."
battlebots,3e25cs,scorpion1m,4,Tue Jul 21 11:14:12 2015 UTC,"I wouldn't say a mockery, they took it pretty seriously at the filming.  that was a 12 hour filming session i'd rather forget."
battlebots,3e25cs,ktetch,-1,Tue Jul 21 13:52:14 2015 UTC,that's why its so funny
battlebots,3e25cs,ktetch,1 point,Tue Jul 21 13:53:02 2015 UTC,If you say so.  who can ponder the mind of a 13yo...
battlebots,3e25cs,ktetch,-2,Tue Jul 21 13:56:40 2015 UTC,I'm 19
battlebots,3e25cs,V900,1 point,Tue Jul 21 13:57:28 2015 UTC,riiiiight
battlebots,3e25cs,connorworley,-3,Tue Jul 21 13:59:13 2015 UTC,if you don't believe me that's fine  I have 4 subbredits to moderate  a webstie to edit and manage and I need upload a vid to my youtube channel on thursday
battlebots,3e25cs,ktetch,2,Tue Jul 21 14:04:42 2015 UTC,I have 4 subbredits to moderate   All of which have less than 100 subscribers.
