battlebots,3dwdls,picklesitter,8,Mon Jul 20 13:45:11 2015 UTC,"Look at what With Doctor did to tombstone; I could see a similar scenario playing out with an up-armored Ghost Raptor. It's a well made bot at its core, even if the spinner looked like it came out of a happy meal."
battlebots,3dwdls,Tetragramatron,8,Mon Jul 20 12:36:56 2015 UTC,I bet they rotate that icebreaker and use it to catch the front frame area the spinner resides in.
battlebots,3dwdls,UselessGadget,3,Mon Jul 20 13:01:43 2015 UTC,That's would be interesting
battlebots,3dwdls,Tetragramatron,2,Mon Jul 20 13:17:23 2015 UTC,Are you sure they could do that without getting torn to bits?
battlebots,3dwdls,picklesitter,3,Mon Jul 20 13:46:50 2015 UTC,"Witch Doctor did pretty good and very few people thought they had a chance.  I imagine if they have something that they can use to push it around, they can make it self destruct."
battlebots,3dwdls,UselessGadget,4,Mon Jul 20 13:50:25 2015 UTC,"Same here. His whole 'bot reeks of over-engineered, and he was really, really cocky when they first interviewed him."
battlebots,3dwdls,picklesitter,1 point,Mon Jul 20 13:46:03 2015 UTC,"I don't understand how this subreddit all got behind ice wave so completely. It's a lawnmower engine bolted on top of a sliverbot with no structural cohesion and way more self destructive energy than it knows what to do with. Even if it absolutely liquifies the first several bots it encounters, not every hit is going to be a perfect one. Zero chance it makes it to finals."
battlebots,3dwdls,nopenopenopenoway,0,Tue Jul 21 07:43:38 2015 UTC,"Really? Is Icewave really that beloved? I'm more of a fan of Chuck and Ghost Raptor mainly because he seems like a genuine veteran that keeps pulling out wins. Same goes for Ray and Tombstone, except he looks like he's just having fun."
battlebots,3dwdls,Rackintosh,33,Mon Jul 20 18:01:29 2015 UTC,That's what I'm saying. I can remember a lot of bots back in the day using different attachments and such for different opponents and I never heard any bitching then. Redditors can get so salty over anything.  That was a smart as hell move by pitzer. If he didn't do that he would have lost.badly
battlebots,3dwdls,HikerAdam2,14,Mon Jul 20 02:19:17 2015 UTC,"Not really. The wedge affected ICE's balance on hit #2, not the new attachment."
battlebots,3dwdls,FaceBagman,9,Mon Jul 20 02:27:08 2015 UTC,I saw the de-icer keep holding onto the top of icewave. Without that icewave would have hit him long before he did if I had to guess.
battlebots,3dwdls,HikerAdam2,5,Mon Jul 20 02:30:12 2015 UTC,"Yep, but the first full-force hit is what ended the match by sending ICE reeling, more or less.  You could argue the fork indirectly helped because they had to keep the wedge up at that angle to stop GR from scraping the floor."
battlebots,3dwdls,FaceBagman,5,Mon Jul 20 02:33:45 2015 UTC,I'll agree it helped indirectly. Who knows what would have happened if raptor wasn't able to block that first hit.
battlebots,3dwdls,HikerAdam2,1 point,Mon Jul 20 02:46:42 2015 UTC,"Then again, if the hit had come straight on instead of off to the side because of the de-icer, would it have been able to flip it over, or would it have been more of a glancing blow? If the arm had moved up to try and deflect them higher straight on, would the blade have dug in and ripped it off instead of it being a side shot that puts them over on their head?  Was it the sole reason? Nope. But I can't tell you how much or how little of a role it played. It may well have been what won him the match indirectly by making Ice Wave unable to come at them from the front."
battlebots,3dwdls,Mirechath,2,Mon Jul 20 12:11:32 2015 UTC,"the blade rode up the wedge, the body got tilted up being carried by the tilted balde. bot topples over due to being unbalanced. it's pretty simple."
battlebots,3dwdls,Gitguds,2,Mon Jul 20 05:03:02 2015 UTC,Thank you!
battlebots,3dwdls,KCIV,28,Mon Jul 20 03:47:49 2015 UTC,"There's a difference between general, pre-planned modularity, and explicit robot-counter designs.   Modularity is general purpose changeable configurations, designed to counter different archtypes of robots. See Bite Force and the Plow vs. Jaw, Stinger's forks, or Tombstone's different blades. This is pretty universally accepted.   What's pretty controversial (and I don't like in the slightest), is explicit ""Robot X Killer"" design. Generally, this completely takes away the spirit of your own robot design, in order to exploit a ""weakness"" of your opponent that really isn't there if, like any sane engineer facing the problem statement of ""Survive against/kill completely unknown robots,"" you assume that your opponents are built for general purpose rather than specifically to kill your robot and nothing else. See Tornado vs. Razer (and the never-ending controversy) for the classic example of this. Don't get me wrong, the innovation is impressive, but I think that it undermines the spirit of the design challenge and inherit tradeoffs posed by the combat robotics challenge."
battlebots,3dwdls,personizzle,30,Mon Jul 20 02:24:59 2015 UTC,"I consider it to be pretty much fair game in combat to make modifications based upon who you draw in the brackets. I've got several modular bots and I've got no problem saying that some attachments were designed with specific opponents in mind. That's one perk of modularity. I can also guarantee that a good portion of the bots at this season of BattleBots had a ""Tombstone Plan"" or if not that specifically, a horizontal spinner plan."
battlebots,3dwdls,MikeNCR,8,Mon Jul 20 02:28:45 2015 UTC,The same is true in all sports. The big slugger doesn't hit lefties well? Send one up. The running back is a speed machine? Time to put in the small quick linebackers.
battlebots,3dwdls,majinspy,9,Mon Jul 20 13:07:51 2015 UTC,"I did not like the mod Tornado made against Razer, but what Ghost Raptor did didn't make it unstoppable.  Icewave could have still gotten to the side or back of Ghost Raptor and gotten some hits in. The adaption worked beautifully and they did a great job coming up with it, but it didn't make GR invulnerable either."
battlebots,3dwdls,joecb91,4,Mon Jul 20 04:21:42 2015 UTC,"I agree that Icewave exhibited some really crappy driving that match -- it drove right into it.   Ghost Raptor definitely wasn't unbeatable, but the effectiveness of the mod isn't really what matters, it's the spirit of the thing."
battlebots,3dwdls,personizzle,6,Mon Jul 20 04:52:20 2015 UTC,"Not to mention the fact Icewave lacked the ability to do anything when flipped over. People give warhead shit, but it lasted the full 3:00 against two bots that would have take Icewave out in the first 20 seconds."
battlebots,3dwdls,Deserterdragon,1 point,Mon Jul 20 11:21:10 2015 UTC,"Yeah, there's some relief in seeing someone else make this point. A lot of posters seem to look at a bots performance in a match without appreciating the variance in opponent difficulty."
battlebots,3dwdls,MajesticCount,16,Mon Jul 20 14:45:34 2015 UTC,"The dude lost his weapon his very first match. What do you expect him to do?Take his blade off,keep it how itd be if the blade was on it and hope for the best? Oh no. I'd do the exact same thing if I was in his position."
battlebots,3dwdls,HikerAdam2,10,Mon Jul 20 02:32:01 2015 UTC,"This is nonsense to me. To be able to ""Apollo 13"" a design to win is the most exciting thing about the sport."
battlebots,3dwdls,SoyDivisionIV,5,Mon Jul 20 10:51:08 2015 UTC,Anyone who had pre-planned modular designs probably had something in mind specifically for horizontal bar spinners (basically Tombstone). I don't think it's suddenly against the spirit of the competition just because Team Raptor made something on the fly.
battlebots,3dwdls,ZeroAce11,13,Mon Jul 20 05:32:58 2015 UTC,"I'm glad that someone smarter than me could put into words why I hate what I just saw.   What Ghost Raptor just did was just as cheap as putting a box with a net in it on the front of your robot to fight a spinner. It's not against the rules, it's just fucking cheap."
battlebots,3dwdls,SutterCane,25,Mon Jul 20 02:29:25 2015 UTC,"Not really. It's not even a novel idea. People have been doing similar things for years. I know folks did it against megabyte.  It's actually a pretty obvious weakness and somebody was bound to do it eventually.   Folks hate ghost raptor because it's a lame robot with a good driver who keeps getting lucky.  I wouldn't consider the de-icer out of line at all though, and I wanted to see ghost raptor get shredded as much as anybody."
battlebots,3dwdls,Spida-Mernkey,14,Mon Jul 20 03:25:38 2015 UTC,"Folks hate ghost raptor because it's a lame robot with a good driver who keeps getting lucky.   For me at least, it's because it's because in the Tested coverage before the first episode ran, he said ""this is the best engineered bot to ever enter the arena,"" or something to that effect. The very first time his blade hits something, it breaks in half because of the ""moving the weight to the outside"" he did by making it hollow. He boasted about it being better engineered than the others, but couldn't even withstand his own bot hitting something."
battlebots,3dwdls,sarahbau,6,Mon Jul 20 03:36:47 2015 UTC,Looks like all the talk of how well engineered it was was just... ... Spin.
battlebots,3dwdls,Tetragramatron,8,Mon Jul 20 12:41:12 2015 UTC,"Haha I have an old joke about folks only testing their spinners against watermelons, and this one perfectly fits the bill.  As for the trash talk, it's just trash talk to me.  They think they're supposed to, and they kind of are.  It's annoying, but it's TV after all."
battlebots,3dwdls,Spida-Mernkey,4,Mon Jul 20 03:43:56 2015 UTC,"Most people probably don't even really have a safe way of testing their spinners at full power. Building a battle box that can withstand their shrapnel can be more expensive than the bot itself. Even if it's just a 4x4x4 cube, that can be expensive. I can't find 1"" thick Lexan (which is still thinner than the Battle Box's 1.25""), but at $350 for a 48x48"" sheet 1/2"" thick, double paned, you'd need 10 of them, totaling $3,500. I guess if you found a really out of the way place, you could get away with crouching behind a single piece."
battlebots,3dwdls,sarahbau,1 point,Mon Jul 20 07:02:40 2015 UTC,"complete control looked like a final contender, too, and they had character."
battlebots,3dwdls,nopenopenopenoway,1 point,Tue Jul 21 07:49:09 2015 UTC,The original Complete Control was one of my favorites. I was really looking forward to seeing them fight.
battlebots,3dwdls,sarahbau,7,Tue Jul 21 07:55:38 2015 UTC,The De-ICEer was not a big factor in the fight.      Ghost raptor took a full hit and sent Icewave on it's top..      From there it was all over.
battlebots,3dwdls,sschering,7,Mon Jul 20 05:31:26 2015 UTC,"So then Stinger changing it's weapons every round is also ""fucking cheap?"""
battlebots,3dwdls,SutterCane,-3,Mon Jul 20 13:05:12 2015 UTC,"Stinger, Bite Force, and others who brought attachment changes aren't cheap. People can easily just prepare for their attachments with their own because they know those other bots are modular.   What Ghost Raptor did was have something that was only meant to fight one bot and only one bot. And they did it with some metal just laying around. So there's literally no way to prepare against that. Just like there's no way to prepare against a net in a box. And wasn't the match redone because the net wasn't a declared weapon from the start of the competition? How is Ghost Raptor getting a pass for doing the same shit to another bot?"
battlebots,3dwdls,elcapitaine,2,Mon Jul 20 13:35:22 2015 UTC,"The net match being redone had nothing to do with ""declared weapons"" - it was because using a net is illegal. Now, had they declared it, the tournament organizers could have told them that it was against the rules. But the penalty had nothing to do with them not declaring their weapon."
battlebots,3dwdls,ThePurplePanzy,6,Mon Jul 20 18:55:18 2015 UTC,"So, by innovating and throwing together a brand new attachment from random stuff laying around in between fights is fucking cheap, and not an impressive feat of engineering and improvisation. Comparing this to the net in a box is just fucking stupid and mental gymnastics that I can't keep up with.  You're just salty that he beat one of your favourite bots, stop trying to make it seem like he did anything wrong. You sound like the kid who makes fun of the smart kids for getting an A+ on their test."
battlebots,3dwdls,Rflkt,2,Mon Jul 20 13:52:59 2015 UTC,It's just basic engineering really
battlebots,3dwdls,RazgrizSeed,3,Mon Jul 20 17:16:07 2015 UTC,"He lost his main weapon. If he still had it, there wouldn't have been a de-icer."
battlebots,3dwdls,Thats_absrd,-1,Mon Jul 20 05:57:53 2015 UTC,Well said. Much better than how I've been trying to explain it.
battlebots,3dwdls,Spidora19,2,Mon Jul 20 13:26:21 2015 UTC,I don't know that he still wouldn't have won without it actually.   Ice wave hit that front wedge and threw itself all over the place. I bet the de-icer really didn't make a difference on the outcome.
battlebots,3dwdls,Torchedini,8,Mon Jul 20 03:58:32 2015 UTC,Because they just had to watch their favorite bot get taken down so easily with a simple piece of shaped metal added at the last minute.
battlebots,3dwdls,ElectricNed,4,Mon Jul 20 02:36:06 2015 UTC,"Oh god the counter counter game, You could make so much more drama from that and ways that go horribly wrong.   Totally in favor"
battlebots,3dwdls,freedomfightre,13,Mon Jul 20 06:25:28 2015 UTC,"His blade was really poorly designed, and he didn't even have a spare, apparently. He's lucked his way into victory with every match so far. ...and that's why he's unstoppable."
battlebots,3dwdls,LUK3FAULK,31,Mon Jul 20 18:59:49 2015 UTC,"Tonight was NOT luck. Tonight was pure engineering prowess.  The best design is not the one that looks the prettiest, but the one that gets the job done."
battlebots,3dwdls,RazgrizSeed,22,Mon Jul 20 02:36:39 2015 UTC,"I don't get the downvotes, the attachment was designed for a specific purpose and it completed it very well. That's the definition of good engineering."
battlebots,3dwdls,LUK3FAULK,3,Mon Jul 20 03:01:18 2015 UTC,"I think the reasoning is it somewhat goes tongue-in-cheek against the spirit of combat robotics. The general idea is to build a bot that can win over all of the other bots. Swapping things out for specific bots, although a legitimate strategy, makes some people feel cheated because it isn't a static design."
battlebots,3dwdls,ZapTap,4,Mon Jul 20 03:25:03 2015 UTC,I would have been more happy if it were a predesigned attachment rather than made right before for the specific match. I think they should make it so that all weapons must be approved before the tournament and only repaired or replaced. But what happened was completely legal so I'm ok with it.
battlebots,3dwdls,cochon101,8,Mon Jul 20 13:24:07 2015 UTC,"Yeah, I'm hesitant to praise it for stellar engineering, since it's a simple design that would be hard to mess up, but it was absolutely a fair win."
battlebots,3dwdls,Arcosah,15,Mon Jul 20 14:23:46 2015 UTC,"simple design that would be hard to mess up   As an engineer, that means it's a great design."
battlebots,3dwdls,KCIV,1 point,Mon Jul 20 03:29:33 2015 UTC,"Because its not very fair that he got to build a part explicitly designed to beat icewave. Being able to build able bot that counters the opponent defeats the purpose of the show in a lot of ways, but as modularity in the robots is allowed- I'd consider what he did fair, albeit cheap imo."
battlebots,3dwdls,GreenPylons,-4,Mon Jul 20 05:34:50 2015 UTC,"The design was not to make icewave flip. That is why you are being down voted. His win condition design was not in his win at all. rather a ""chaos theory"" result."
battlebots,3dwdls,BrainSlurper,11,Mon Jul 20 16:20:41 2015 UTC,"Flipping from Newton's Third Law is inherent to spinners (see Tombstone tonight), and the fact that Ice Wave cannot self-right was a massive design flaw on their part. There was much more to this than luck."
battlebots,3dwdls,KCIV,4,Mon Jul 20 03:47:11 2015 UTC,The point he is making is that the attachment did not let them win. Icewave's blade still made contact even when the fork was doing its job.
battlebots,3dwdls,Gitguds,3,Mon Jul 20 04:31:52 2015 UTC,"That was ice waves design, again not apart of ""rapters ingenuity""   I am fully aware of qualities natural to X bots design. But again those having nothing to do with Rapters adaptation. Rapter did not ""design"" a bot to make the Third law (that is absurd), He made a bot to keep icewave at bay, It didn't do that, and Third law let him win anyway.  don't get me wrong a win, is indeed a win, but to say ""tombstone vs witchdocter"" was anything but luck and ""rapter vs ice wave"" was anything but luck is just, not clearly analyzing the situation. That or they have a better understanding of Chaos theory."
battlebots,3dwdls,Rflkt,-3,Mon Jul 20 04:39:16 2015 UTC,"wedge makes spinning balde flick up and topples over bot. use long stick for good measure.  ""engineering prowess"""
battlebots,3dwdls,Rflkt,2,Mon Jul 20 04:33:33 2015 UTC,Luck and skill. He's a good driver and that is the biggest factor in him still being here.
battlebots,3dwdls,newfor2015,2,Mon Jul 20 05:00:37 2015 UTC,"Idk. I always thought their design was bad, but they keep pulling through because of their creativity and driving. He's a really good driver and highly underrated in that category vs others. That's one of the biggest reasons he's still here. Making it this far with a broken bot is no easy feat. They've got my support now."
battlebots,3dwdls,cochon101,14,Mon Jul 20 05:59:30 2015 UTC,"Don't hate Ghost Raptor just because ICEwave has a fatal design flaw that came into play. I'd say it's gotten to the point where if you can't show your bot to be able to right itself after being flipped upside down, you're automatically disqualified even before entering the arena."
battlebots,3dwdls,Randomwoegeek,7,Mon Jul 20 05:45:56 2015 UTC,"Exactly this. Flippers, lifters, and spinners have so much power now that every fight has the potential of your bot winding up on its back. If you don't design for that, I don't see how you can make it far in the tournament.   Ghost Raptor is kind of the outlier here but I wouldn't be shocked if it lost next week from bite force flipping it over."
battlebots,3dwdls,Rackintosh,5,Mon Jul 20 05:13:32 2015 UTC,"Everyone is raging about tombstone, I don't tombstone deserves the rage."
battlebots,3dwdls,FaceBagman,3,Mon Jul 20 05:27:15 2015 UTC,Absolutely not. I love Ray and how much fun he's having.
battlebots,3dwdls,ShazbotSimulator2012,4,Mon Jul 20 09:30:48 2015 UTC,I've been setting up a bracket for a Reddit's Favorite Battlebot tournament in the offseason. It seems like both Witch Doctor and Ghost Raptor will earn slightly better seeding than I previously had them at.
battlebots,3dwdls,BrainSlurper,5,Mon Jul 20 18:03:18 2015 UTC,"I'm not sure about Ghost Raptor. It may be winning, but I'm not sure it's doing it in a way that makes people like it."
battlebots,3dwdls,Mirechath,6,Mon Jul 20 03:41:49 2015 UTC,"""That's not how I would want to win"" he says after being netted, proceeds to win the next two fights because the other robot self destructs"
battlebots,3dwdls,bochez,2,Mon Jul 20 03:58:57 2015 UTC,"What got the most about that comment was the bot itself. Before the tournament you're told that wedges and brick bots are not allowed. That is a HUGE boon to spinning robots. So what do you do? You build a spinner, the bot that has the odds skewed in your favor in the tournament because the bots that do the best against you are banned. And then you want to claim a higher moral ground that you wouldn't want to win by using the rules to your advantage? I mean, net is cheap and it should be outlawed, I am 100% against nets. But that comment made me actually laugh out loud. It's fine that you wanted to build a spinner, and I don't think he's some horrible person. It was just funny when he said it, at least to me. I commend him for making it this far in the competition. Though I hope next year the bot he builds holds together for him. He'll actually have time to build it, the whole thing, so it should be lots better."
battlebots,3dwdls,Mirechath,2,Mon Jul 20 04:42:06 2015 UTC,"The best part about this is he started as a spinner, but ultimately became a wedge (with an added pokey thing for this last fight)."
battlebots,3dwdls,mangodroplet,5,Mon Jul 20 12:27:52 2015 UTC,"Just goes to show the man knows how to build a chassis. Spinner? Not so much. :)  I remember his other bots very rarely failed, effective or not. He does know how to build a sturdy bot. He just needs practice with weaponry it seems."
battlebots,3dwdls,Rackintosh,3,Mon Jul 20 18:49:15 2015 UTC,That was an amazing fight. Witch Doctor ALL THE WAY!
battlebots,3dwdls,erconn,3,Mon Jul 20 18:57:41 2015 UTC,"Come on. If you can't admit that the strategy that Chuck and the Ghost Raptor team implemented wasn't brilliant and effective, you then have to admit you're being a sour fan of Icewave."
battlebots,3dwdls,chaosfire235,7,Mon Jul 20 04:11:54 2015 UTC,Ghost raptors mod was really clever. He deserved that win
battlebots,3dwdls,SparkleSorceress,3,Mon Jul 20 18:06:12 2015 UTC,"At this point I'm kinda rooting for him to win the entire thing (I known, not likely). It would be the ultimate underdog upset."
battlebots,3dwdls,legolots,3,Mon Jul 20 08:40:39 2015 UTC,"Dude, could you imagine the salt?  I mean, I respect Ghost Raptor, but if it wins I'll eat my own socks."
battlebots,3dwdls,SparkleSorceress,2,Mon Jul 20 19:29:43 2015 UTC,Tagged. I'll hold you to that!
battlebots,3dwdls,Rackintosh,2,Mon Jul 20 20:22:58 2015 UTC,I'm going to feel like that guy who said he was going to send a dick pic to his father-in-law.
battlebots,3dwdls,A_Hint_of_Lemon,1 point,Mon Jul 20 20:43:27 2015 UTC,"I couldn't agree more. That was brilliant, even if he didn't believe it was going to work."
battlebots,3dwdls,getoffmyface,2,Tue Jul 21 01:58:40 2015 UTC,"I'm just about to see the fight now (fuck west coast time slots). Is this gonna be a Storm II/Typhoon fight? We'll find out.  EDIT: This is why you put in Srimecs, but man, I am a Witch Doctor fan now."
battlebots,3dwdls,mossdog427,2,Mon Jul 20 18:04:03 2015 UTC,It was so close. Gotta have a self-righting mechanism.
battlebots,3dwdls,thatoneirishmate,1 point,Mon Jul 20 04:07:29 2015 UTC,"If losing to bronco means you suck, then who does that leave? lol"
battlebots,3dwdls,MeetUrDo0m,1 point,Mon Jul 20 06:32:37 2015 UTC,"No, FUCK YOU! Respect to Ghost Raptor.   As for Witch Doctor, your absolutely right, I have a great amount of respect for them and the way they held their own against Tombstone."
battlebots,3dwet5,AustinTheGeek,36,Mon Jul 20 02:25:50 2015 UTC,DJ Roomba grew up in the streets.
battlebots,3dwet5,05fuckem,18,Mon Jul 20 02:34:52 2015 UTC,Here's the rest of your army  http://i.imgur.com/jwHMmcr.jpg
battlebots,3dwet5,ZSNO,10,Mon Jul 20 07:25:38 2015 UTC,"Whoah, spoiler tags, man. Think about the rest of us."
battlebots,3dwet5,KorracaiTron,7,Mon Jul 20 03:44:07 2015 UTC,Would probably beat Radioactive/10
battlebots,3dwet5,Parsleymagnet,6,Mon Jul 20 06:50:36 2015 UTC,Needs a flipping mechanism for if it's tipped over.
battlebots,3dwet5,ifiasco,7,Mon Jul 20 04:27:49 2015 UTC,It fires the gun. That is always the right move.
battlebots,3dwet5,nileo2005,6,Mon Jul 20 13:24:18 2015 UTC,"PLOT TWIST: A metal blade extends out of the nozzle, and the gun starts spinning."
battlebots,3dwet5,SpyroFan-17,4,Mon Jul 20 04:45:15 2015 UTC,Plan X doesnt stand a chance...
battlebots,3dwet5,sjogerst,3,Mon Jul 20 14:18:04 2015 UTC,"Sorry bro, no projectiles.  Check da rules."
battlebots,3dwet5,G_I_Joe_Mansueto,1 point,Mon Jul 20 11:10:36 2015 UTC,"AFAIK the rules allow for untethered projectiles that don't damage or foul up the arena.  it doesn't allow for explosives, or self-destructing weapons though."
battlebots,3dwet5,RA2lover,2,Mon Jul 20 12:55:08 2015 UTC,Real question.  Can I fire a harpoon?
battlebots,3dwet5,Protosega,2,Mon Jul 20 17:04:09 2015 UTC,"I was thinking a powerful tethered magnet that shoots out. Needs the ""come over here!"" audio though for full effect."
battlebots,3dwet5,SoCo_cpp,1 point,Mon Jul 20 17:19:47 2015 UTC,"actually, that's a pretty good idea... why not hook up a battery to the outside of the bot and electro-magnetize the whole thing...(unless you know, it messes with the RF lol)?"
battlebots,3dwet5,CamGoldenGun,2,Mon Jul 20 21:02:48 2015 UTC,"They showed that one bot had magnetized tracks, suggesting a ferrous metal floor of the arena. One magnet to the opponent and one to the floor tethered together would make for nasty trap. Don't know how that'd fly with the rules though."
battlebots,3dwet5,SoCo_cpp,2,Mon Jul 20 21:16:08 2015 UTC,"There was something in the rules about EM fields I think... and an electro-magnet would probably qualify. I think it would be pretty cool to polarize the bot and be able to push your opponent around without even touching it, or the reverse: pull it, drag it where you want and let the hammer slam into it."
battlebots,3dwet5,CamGoldenGun,1 point,Mon Jul 20 21:22:08 2015 UTC,could fall within entanglement devices - not sure whether that would be legal.
battlebots,3dwet5,RA2lover,1 point,Mon Jul 20 17:05:12 2015 UTC,A bullet could definitely damage the arena.
battlebots,3dwet5,fb39ca4,2,Mon Jul 20 21:02:56 2015 UTC,the bot's weapon mounting would destruct itself on the first shot though. no way a single pass of duct tape can hold a .45 pistol firing.
battlebots,3dwet5,RA2lover,2,Mon Jul 20 21:04:59 2015 UTC,/r/Doomba
