battlebots,3dwpi5,RazgrizSeed,17,Mon Jul 20 16:00:35 2015 UTC,"Absolutely no more wildcards. Yeah, yeah, I know, Witch Doctor had a great run and clearly deserved to be in the round of 16. I still don't like the whole mysterious selection process, though.  If the show gets renewed for 13 episodes, I'd like to see a 64-bot single-elimination tournament. That's about five fights per episode, if my math is right. If it's renewed for six episodes, then I'd like to see a 32-bot tournament, which comes out to just over five fights per episode. Fill with rumbles and ""grudge match"" exhibitions, if need be.  An extra fight will fix the show's pacing problem while keeping the network television dramatic storytelling aspect.  I'd also like to see the box hazards either controlled by a ""boxmaster,"" like the old show, or have each hazard activated by motion sensors. The drivers are busy enough driving - they shouldn't have to constantly remind their teammates to hit a button to activate the pulveriser. It should just be automatic. If a bot drives over that 10-inch dot on the floor, the hammer comes down.  Additionally, I'd like to see the removal of the first-minute prohibition on floor hazards. I always considered the killsaws to be an iconic hazard from the old show. I've seen those things pop up ... three times, I think?  They also need to show judge's scorecards on bouts that go to a decision. You can't just say ""Bot X wins!"" like they did tonight, especially when fights are close. The old show did this, and it took no longer than a few seconds. There's no reason that it can't be done on the revival, especially when there's not a lot going on between fights.  But, aside from that, I'm pretty happy with the show. I miss lightweights - I always appreciated the speed of lightweight fights - but I also understand that you want to try to avoid confusion among casual fans, and multiple brackets for multiple weight divisions will probably harm clarity among people who just want to watch robots shred the crap out of each other.  Fingers crossed for a 13-episode run next summer or sooner."
battlebots,3dwpi5,MC151,10,Mon Jul 20 05:58:51 2015 UTC,"The thing that draws in the viewers isn't backstories or filler. It's the fights. The fights are enhanced by sharing the technical details of what's going on behind the scenes (such as Tombstone using a smaller and lighter blade for a match, or why a team is going with heavier armor for another). Knowing some strategy and some of the tech makes the fights more interesting, which adds to the excitement. It's one thing to see a bot get cut open. It's another to know what's getting cut open."
battlebots,3dwpi5,flint_and_fire,3,Mon Jul 20 16:36:36 2015 UTC,"The old show almost never showed up the proper scores from the judges, just their bs battlestats, and even when they did show us the scores, they managed to not show the ones on the fight everyone wanted to see them, which was Biohazard vs Son of Whyachi."
battlebots,3dwpi5,KCIV,1 point,Mon Jul 20 13:04:57 2015 UTC,"The show needs to be picked up by someone like Discovery.  It's better than the garbage Discovery has right now, and they can do it justice, vs. a network like ABC that wants to make it into some dramatic storytelling pukefest."
battlebots,3dwpi5,KCIV,15,Mon Jul 20 23:13:12 2015 UTC,"I think the arena is ok, I would rather see more fights, and less ""talking about our randomly assigned stats"".  maybe show some different weight classes as well. 30 minutes of heavy weights (not 2 every half hour) and then 30 minutes of medium weight (again not 2 every half hour)  I would love to see more pit time, Talking about a robot. Even ""so you think you can dance"" and ""so you think you got talent"" do story reals. Replace the story with the bot mechanics in the pit and I would be a very happy nerd."
battlebots,3dwpi5,lamperkat,7,Mon Jul 20 04:10:49 2015 UTC,"I agree, they could do Double the bots in the same amount of time"
battlebots,3dwpi5,freedomfightre,9,Mon Jul 20 04:14:45 2015 UTC,"I think the pace was good for episode 5, but only because the matches were very good. But episode 1 and 2 was just all over the place."
battlebots,3dwpi5,internetlad,2,Mon Jul 20 04:17:16 2015 UTC,1 and 2 were wierd because they were doing a lot of bios on the builders even if they weren't really interesting.  They seem to have abandoned them for 3-5.  2 was especially weird because there were 8 matches and they showed only clips from 4 of them without any discussion between each clip.  IMO the pacing in episodes 3-5 were perfectly fine and even episode 1 was fine if that's the direction the show needed to go to get a season 2.  It'll be interesting to see what they do with episode 6 considering they only have 3 matches instead of 4.
battlebots,3dwpi5,usableclown,2,Mon Jul 20 13:43:14 2015 UTC,"very happy nerd.   There's the problem: nerds are a VERY small minority of the viewers watching. ABC has to keep it digestible to the stupid masses that watch TV; aka less fighting, next to zero tech, dumming down the science/strategy, more drama (yuck)."
battlebots,3dwpi5,DerNubenfrieken,6,Mon Jul 20 05:47:19 2015 UTC,""" did you see that, they wouldn't slap hands Kenny""  ""I believe that's called a high five Chris""  ""Damn it Kenny, why do you always have to show me up on air??"""
battlebots,3dwpi5,usableclown,4,Mon Jul 20 05:54:46 2015 UTC,How does less fighting make it more digestible to the masses? I'm pretty sure everyone wants to see more fighting and less filler.
battlebots,3dwpi5,DerNubenfrieken,2,Mon Jul 20 08:09:42 2015 UTC,"Where would they get more fighting from? They cut out maybe 5 minutes of fighting, 3 of which was the horrendous radioactive fight."
battlebots,3dwpi5,lamperkat,1 point,Mon Jul 20 13:35:56 2015 UTC,"I'm not sure, but I still have no idea how less fighting is supposed to be what the masses want."
battlebots,3dwpi5,kneepins,1 point,Mon Jul 20 13:43:29 2015 UTC,"Trust me, not even the live audience wanted to watch the radioactive match from the first round."
battlebots,3dwpi5,KCIV,1 point,Mon Jul 20 17:22:46 2015 UTC,You'd be surprised.
battlebots,3dwpi5,RazgrizSeed,2,Mon Jul 20 13:43:50 2015 UTC,It's not just a nerdfest .. I know a bunch of stoners  and mechanics even whole families totally hyped on their first season of battlebots .
battlebots,3dwpi5,Elementium,1 point,Mon Jul 20 13:32:27 2015 UTC,"Look an ninja warrior... Fast, quick, get into the action. Its not 2 runs every half hour.  I see your point, but if the only way for battle bots to be successful is to AVOID the actual battling of bots, then don't you think that will just doom the show from the beginning?"
battlebots,3dwpi5,iamthegraham,1 point,Mon Jul 20 15:05:35 2015 UTC,"Not really. People love Mythbusters, and that's pretty technical. You can present technical content and appeal to more people by simply making that content easier to digest. You don't have to go in to details about armor thickness and motor strength when you can just say ""we put on heavier armor, so we needed stronger motors to be more maneuverable""."
battlebots,3dwpi5,DerNubenfrieken,1 point,Mon Jul 20 16:41:17 2015 UTC,"That's not true at all though. My mom watches it now and she's jumping up and down and screaming during fights, she loves it."
battlebots,3dwpi5,joverla,13,Mon Jul 20 22:53:53 2015 UTC,"Get rid of the ""ring out"" rails, but put better hazards along the walls to compensate. That way flippers can still do serious damage to opponents but it's not an insta-win."
battlebots,3dwpi5,broken42,5,Mon Jul 20 06:22:32 2015 UTC,I was thinking they could have like one or two ring out areas that only open in the last minute of the match. But I agree with better wall hazards. I'd love to see some drums built into the wall to fling robots in the air.
battlebots,3dwpi5,rhadamanthus52,6,Mon Jul 20 12:05:39 2015 UTC,Co2 can freeze in the lines causing a safety hazard. They instead use high pressure air or nitrogen which do not freeze and can be used quicker.
battlebots,3dwpi5,A_Hint_of_Lemon,5,Mon Jul 20 07:53:48 2015 UTC,I don't see why you could just use HPA like Bronco does.
battlebots,3dwpi5,rhadamanthus52,8,Mon Jul 20 14:40:15 2015 UTC,"I think the active weapon rule should be clarified.  The DE-ICER, while cool due to moxie/novelty/on-the-fly engineering was good for TV once, but if it leads to the rise of ""DE-HORIZONTAL-SPINNER"" then it will quickly be a negative for the sport. I think most people want to see robots ripping each other apart, and anything that cheeses against that or disincentives destructive robot designs is counterproductive. If a team like Ghost Raptor and others want to design a specifically tailored DE-OPPONENT weapon for each fight awesome! However I think it's important that they meet some minimum standard so that the new bot design with the new weapon/attachment can legitimately damage or knock out it's opponent on it's own, not make it self-destruct if it's spun up. Other we are going to see the rise of strong drive train bots with custom attachments against all the most interesting weapons, while spinners and potentially even flippers are held at bay by silly looking attachments that lead to less entertaining fights."
battlebots,3dwpi5,snowbirdie,2,Mon Jul 20 14:38:42 2015 UTC,"That said, the De-Icer worked because it was able to press up against Icewave specifically, since Icewave has it's weapon engine on top of the rest of the bot.   Now try to imagine what would happen if GR tried to fight Tombstone, there's no counter-weapon for that aside from the wedge."
battlebots,3dwpi5,BrainSlurper,1 point,Mon Jul 20 12:57:13 2015 UTC,"I disagree, there is plenty of clearance the blade in front. They could build a custom blade that looked like like this: ----[ for Tombstone (rather than the: ----< blade for ICE). It's less wiggle room but still plenty to use that tactic."
battlebots,3dwpi5,auxiliary-character,3,Mon Jul 20 17:40:15 2015 UTC,"I thought they already had it in the rules that you could not change your primary weapon between fights. You can change it out for similar weapons, but not an entirely new one. That really bummed me and I considered that fight extremely unfair as it was more along the lines of entrapment."
battlebots,3dwpi5,thirtyseven1337,1 point,Mon Jul 20 18:08:36 2015 UTC,It doesn't make for good tv if bots get disqualified for not being able to field their original weapon
battlebots,3dwpi5,erconn,6,Mon Jul 20 16:03:03 2015 UTC,16 bot free for all.
battlebots,3dwpi5,broken42,2,Tue Jul 21 10:23:36 2015 UTC,"Demolition derby style, last one standing wins."
battlebots,3dwpi5,206-Ginge,4,Mon Jul 20 07:27:39 2015 UTC,if there are wild cards i think they should be voted for
battlebots,3dwpi5,Gitguds,4,Tue Jul 21 02:28:18 2015 UTC,"It would be nice if for season two they re-introduced multiple weight classes, that way we get more than a 6 episode season and we'd get to see some of the more fun and chaotic fights that happen in the lower weight classes."
battlebots,3dwpi5,DerNubenfrieken,2,Mon Jul 20 08:44:18 2015 UTC,"I completely disagree, the rails should remain the same. Otherwise flippers don't have a KO strategy when competing against well-built bots."
battlebots,3dwpi5,boomboom4132,11,Mon Jul 20 14:35:44 2015 UTC,"they don't need KO's they get more points for more flips and keeping bots in the air is as incapacitating as ripping wheels off.   flipper/launcher bots are fine as they are.  arena outs denies viewers a good match stinger, witch dr/vs bronco and BOTH teams get less time to fight.   KO arena's is this."
battlebots,3dwpi5,GreenPylons,6,Mon Jul 20 05:04:42 2015 UTC,"I think the rails should stay, but be reduced in size and area. The area like stinger was in last night shouldn't exist or should only open in the last minute."
battlebots,3dwpi5,MC151,2,Mon Jul 20 05:18:41 2015 UTC,i agree with you the rail along the screw is awesome its now the best wall hazard where as before they were a joke but there area that stinger got flipped to was stupid you shouldnt be able to go behind the rail
battlebots,3dwpi5,David182nd,2,Mon Jul 20 13:37:22 2015 UTC,I hate KOs we need more carnage and destruction
battlebots,3dwpi5,TheRisingTide,5,Mon Jul 20 17:48:39 2015 UTC,"It's either a KO or a judge's decision with unclear reasons. I'd much, much rather have the former."
battlebots,3dwpi5,snowbirdie,1 point,Mon Jul 20 05:09:54 2015 UTC,"i want the judges to explain themselves, like how reality food challenge judges do it"
battlebots,3dwpi5,sarahbau,-2,Mon Jul 20 05:18:58 2015 UTC,"So in other words, keep them so Bronco can have a cheap easy way to win?  Seems legit"
battlebots,3dwpi5,MC151,1 point,Mon Jul 20 05:21:55 2015 UTC,I can't say I like the screws at all. It just seems to be luck whether you get stuck on top of them or not.  I don't have an issue with robots being flipped out of the arena though. If you're good enough to drive someone into a corner and powerful enough to throw them over a wall then you deserve to be winning.   If you remove ringouts then you're just going to end up with spinners. They're fun to watch but it's a bit boring when they're all doing it.
battlebots,3dwpi5,TheRisingTide,-13,Mon Jul 20 13:06:34 2015 UTC,"Bring back fucking Biohazard, Vlad the Impaler, frenZy, Mauler, Deadblow, a competent robot from the C2 guys, and some new blood.  Ban the Whyachi team, ban the weaboos, ban shitty robots cobbled together from a fucking test kit like that awful brain robot driven by that pink haired girl."
battlebots,3dwpi5,ForAHamburgerToday,4,Mon Jul 20 11:17:25 2015 UTC,Whyachi makes great bots. What is wrong with your brain? Son of Whyachi was one of my favorite spinners.
battlebots,3dwpi5,Gitguds,4,Mon Jul 20 06:43:40 2015 UTC,"Biohazard might win a couple matchups, but the rest wouldn't stand a chance against any of today's bots, especially Frenzy and Mauler, who weren't even winning bots 15 years ago."
battlebots,3dwpi5,Okamifan1,2,Mon Jul 20 16:04:51 2015 UTC,"You want to ban the shitty robots but bring back Mauler who more often then not, ended up on his back because of his shell?"
battlebots,3dwpi5,JD9940,1 point,Mon Jul 20 08:15:05 2015 UTC,Entertaining as hell.
battlebots,3dwpi5,VoidInsanity,4,Mon Jul 20 13:02:33 2015 UTC,2edgy5me
battlebots,3dwzrg,ausda,11,Mon Jul 20 05:57:08 2015 UTC,"I think the arena is just fine. These are 250 lb robots. If you can grab or throw your opponent across the box and over the wall you deserve some sort of award and that award is that sometimes your opponent lands out of bounds.   As for the hazards,  Im fine with them being weak. If two robots are fighting I don't want to see a saw pop up and win the match. One of the bots should win, not a killsaw. I think everyone forgets that back on comedy central the hazards had little to no effect the heavyweights. This isn't a new development.   I think the difference is the ring outs and hammers are more of passive hazards. They only come into effect because one team made a driving mistake or one team manhandles their opponent and puts them in the hazards way.   And about the screws, everyone complained they were too powerful but Bronco showed last night that with some good driving and luck you can get out of them."
battlebots,3dwzrg,QuixoticViking,8,Mon Jul 20 14:39:01 2015 UTC,"Rings outs have been a thing for a long time in the sport. The problem is, how do you reduce ring outs? You can make the walls higher, but that only means that robots with lifters like Stinger can't get them out, while launchers like Bronco still can... You can remove the gap entirely, but that reduces the value of lifters, flippers, and clampers over other weapons. Especially clampers. Now that the arena hazards are automated and random, they can't just hold the other bot over the kill saws, they don't have the speed and traction to slam them into the wall, can't use the pulverizers... The only real choice is the screws or the outside of the arena.  I think it could also be important to note that having a higher knock out percentage isn't necessarily bad... When you have a huge field of robots to get through and more fights per episode. But for a small tournament format that has a really high knock out percentage, we are actually losing significant amounts of fight time.  I think maybe the gap between the wall and the arena barrier should be decreased to give robots a better chance of escaping. Stinger got put in a place where it had no chance.   Or you could decrease the height from the bottom of the pit to the top of the arena barricade, so bots have a better chance of bouncing out.  Or perhaps it should be less of a pit and more of an area that is difficult to get out of, like an uneven floor or stepped tiers to get stuck on, like how so many robots got their corners up on the spike strip of the old box.   Or a one unstick rule."
battlebots,3dwzrg,lXlxlXlxlXl,3,Mon Jul 20 06:30:42 2015 UTC,They just need better hazards. So far they've been ineffective or not even used at all.
battlebots,3dwzrg,ZetaGator,2,Mon Jul 20 13:33:16 2015 UTC,"Came here to say this. I remember the arena hazards fondly from previous seasons, which is why I made that ""Season Six by the Numbers"" thing on my website's homepage to count up all the hazard damages. Thus far, after five episodes there's been only three hits from the Killsaws. That sucks. :(  The Pulverizers also seem a bit suspect as well. When Bite Force took that shot right on the chain and sprocket for its lifter I was expecting it to have broken or warped. I don't think the Pulverizer has caused any significant damage to any robot, despite there being a few dozen blows dealt thus far."
battlebots,3dwzrg,Baryshnikov_Rifle,1 point,Mon Jul 20 16:57:02 2015 UTC,"OHHHHHHH!!, DIDJA SEE THAT?  He almost got taken out by the marshmallow cannon!"""
battlebots,3dwzrg,Gitguds,-2,Mon Jul 20 19:19:38 2015 UTC,"ringouts suck for viewing fights, it deprives us and the drivers of fighting action.  yes the arena needs a redesign, no more gaps between the walls and get rid of those damn hellraiser floors that everyone gets stuck on."
battlebots,3dwzrg,David182nd,10,Mon Jul 20 06:15:08 2015 UTC,"I agree and disagree.   Bronco's final flip on Stinger was brilliant, I have no problem with that sort of ringout.   But the amount of robots that have been pushed on top of the screws has been incredibly lame. It'd be better if they span the other way so that they're doing damage to the robot but not getting it stuck on top of them. I'd just replace them with a horizontal saw personally."
battlebots,3dwzrg,BrainSlurper,2,Mon Jul 20 11:23:02 2015 UTC,I wouldn't mind the floor being uneven if it wasn't so detrimental to one side and not the other.
battlebots,3dwf1h,Infernaltank,8,Mon Jul 20 02:28:01 2015 UTC,"I wanted to be at Bot Blast so much this weekend, but had to work. I think your durability was as important as your driving!"
battlebots,3dwf1h,ElectricNed,8,Mon Jul 20 02:41:14 2015 UTC,That's the kitbots wedge/brick kit right? Are you running the 1000 rpm beetle motors on 4s?
battlebots,3dwf1h,mateo9944,4,Mon Jul 20 02:44:51 2015 UTC,"Yep, but I'm running 3s. Might switch at some point."
battlebots,3dwf1h,acealeam,7,Mon Jul 20 02:45:41 2015 UTC,"Damn, you dominated."
battlebots,3dwf1h,LUK3FAULK,2,Mon Jul 20 02:31:39 2015 UTC,Thank you!
battlebots,3dwf1h,ahalekelly,7,Mon Jul 20 02:36:51 2015 UTC,The cheap shot joke :l
battlebots,3dwf1h,Mirechath,4,Mon Jul 20 03:30:39 2015 UTC,"I must have been in the pits for this one. It was a great fight, and you definitely deserved the Best Driver award."
battlebots,3dwf1h,Warbird36,3,Mon Jul 20 03:08:21 2015 UTC,Well done. Asymmetrical blade designs still leave me in awe. But great job sticking right to him and not letting him get anything done that fight!
battlebots,3dwf1h,Warbird36,3,Mon Jul 20 12:41:57 2015 UTC,"""With great driving.""   Me: Pssh, yeah, sure, sounds like a total self-call to--   Immediately outflanks, retreats, smacks bot across the face, several bumps, another flanking, square up and smack disk, slick sideswipe to cause the disc to dig into the ground and send the bot flying   Damn. Impressively done! You weren't kidding when you said you had great driving!"
battlebots,3dwf1h,fb39ca4,1 point,Mon Jul 20 20:52:21 2015 UTC,Thank you! I got an award for Best Driver.
battlebots,3dwue6,HardAsBalls,21,Mon Jul 20 04:55:56 2015 UTC,"My guess at why Matt went with the module he did is twofold: the forks were longer than the wedge, giving him extra room between his bot and Bronco's flipping arm, and the forked design meant Bronco's spatula could easily miss its target by popping between the prongs of the fork."
battlebots,3dwue6,maverick_ninefingers,9,Mon Jul 20 05:48:18 2015 UTC,"Personally, I don't really see much use for flamethrowers, either. It doesn't look like it does a lot."
battlebots,3dwue6,SpyroFan-17,10,Mon Jul 20 05:00:25 2015 UTC,"It might not do a lot, but it certainly looks cool. If stinger hadn't been flipped out of the ring, it probably would've come down to a judges decision, and those flames very well may have helped him gain an edge in the judge's opinion."
battlebots,3dwue6,TheGuyWithFace,6,Mon Jul 20 05:29:05 2015 UTC,"Well, darn. I know they're judged in four categories, but I can't remember which ones the flamethrower would effect. All I remember are aggression and strategy."
battlebots,3dwue6,SpyroFan-17,3,Mon Jul 20 05:31:17 2015 UTC,"I think one was control, maybe the last one was damage? All I can remember was that this past week a lot of people said that if it came to a judges decision, Bronco would probably win just because him flipping bots that high is so darned impressive. Stinger pushing bronco in a corner and engulfing him in flames could have been equally impressive, and was probably what Max was aiming for."
battlebots,3dwue6,TheGuyWithFace,2,Mon Jul 20 05:36:02 2015 UTC,"And don't forget that it didn't work against Bronco previously, either."
battlebots,3dwue6,Xarrin,2,Mon Jul 20 05:34:41 2015 UTC,They included the flamethrower so when Stinger was thrown out of the arena it looked like a NASCAR accident.
battlebots,3dwue6,ZetaGator,5,Mon Jul 20 18:43:11 2015 UTC,"I agree. I don't know the exact dimensions of the battle box ring, but I get the feeling that he may have been able to flip himself back over and into the fight if he had his original flippy wedge thing (yes, that is a technical term). I also noticed that the new fork got caught on the floor a lot. I remember a video in which max did a breakdown of Sewer Snake, in which he mentioned that he doesn't have any fancy mechanism for the wedge to ""know"" where it's neutral position, that it just rests on the floor. Clearly that worked far better for that wedge which rests on the floor than for the fork shape which appeared to dig into the floor a bit."
battlebots,3dwue6,TheGuyWithFace,26,Mon Jul 20 05:33:15 2015 UTC,We shattered the gears that run his lifter with that giant toss.
battlebots,3dwue6,wzcx,17,Mon Jul 20 06:31:02 2015 UTC,I wish they would have told us that on the show. That's fucking amazing.
battlebots,3dwue6,G_I_Joe_Mansueto,6,Mon Jul 20 11:12:49 2015 UTC,"Ok, that's really cool - I wish they had shown more of the aftermath!"
battlebots,3dwue6,TheGuyWithFace,7,Mon Jul 20 14:16:06 2015 UTC,"I wish there had been time for things like that too, but everyone was frantic for the entire filming. Broken part? Toss it and replace, quick!"
battlebots,3dwue6,wzcx,3,Mon Jul 20 14:22:13 2015 UTC,"Ah. That makes a lot more sense. I'm wondering though-  It didn't make any sense that Matt would have immediately been acting dejected after being thrown out of the ring, since if there's any robot that had the potential to climb back into it- it's Stinger with its 6-wheel-drive ""breakdance"" maneuver. Did the judges immediately call the fight when Matt was thrown out or did they give him a chance to try to get back in, he failed due to the broken gear, and THEN he got counted out?"
battlebots,3dwue6,Astonishmunt,4,Mon Jul 20 21:44:37 2015 UTC,"But perhaps that could be why he chose the forks. The forks DID get underneath Bronco's flipper at least once. As it turns out, being low enough to get under Bronco's flipper also means being low enough to catch the floor seams..."
battlebots,3dwue6,lXlxlXlxlXl,3,Mon Jul 20 06:12:33 2015 UTC,"Yeah. It's one of my favorite designs ever for a bot. Stinger/Sewer Snake's design is so versatile and simple, it's down-right beautiful to watch."
battlebots,3dwue6,Rackintosh,1 point,Mon Jul 20 18:11:16 2015 UTC,"It looked like the forks caught the floor a few times in the fight, like Complete Control. That probably killed momentum and forced a different driving style, leading to the eventual pin and flip"
battlebots,3dwue6,A_Windrammer,1 point,Mon Jul 20 13:36:39 2015 UTC,I disagree.  The forks actually kept bronco further out then the wedge would have.  Either way it would have been about whether or not he could stay in the arena.
battlebots,3dwrzs,Drsmall,7,Mon Jul 20 04:30:59 2015 UTC,Pretty sure Suicidal Tendencies did in S2.  Paging /u/ZetaGator here for this one though.
battlebots,3dwrzs,qwertythe300th,2,Mon Jul 20 04:57:38 2015 UTC,"That is correct, sorta. For the original Comedy Central seasons there was no ""out"" of the arena, the spike strip was attached directly to the walls and above it was just a few inches of the beam the spikes were mounted to.  Technically you could consider Suicidal Tendencies' knockout an ""out of the arena"" since it got stuck up behind the Pulverizer and couldn't get down from there.  Racking my brain trying to think of other fights though, because I know someone else got tangled up in the messy corner of the arena where the entrance ramp used to be. Spin Orbiting Force got tossed up there by Hazard in season one, but was able to get down."
