battlebots,3dzkyu,ausda,4,Tue Jul 21 02:31:37 2015 UTC,The music breaks the tension for me. I like the silence being periodically broken by sudden crashes.
battlebots,3dzkyu,dyrtjones,5,Mon Jul 20 23:04:54 2015 UTC,That's why I dislike the announcers. For me they take away from the fight with their constant quips.
battlebots,3dzkyu,mynumberistwentynine,2,Tue Jul 21 06:07:55 2015 UTC,"I'd hardly call them ""quips"""
battlebots,3dzkyu,Catharsis1394,2,Tue Jul 21 14:03:05 2015 UTC,Verbal vomit?
battlebots,3dzkyu,mynumberistwentynine,2,Tue Jul 21 14:16:32 2015 UTC,Sounds about right.
battlebots,3dzkyu,Catharsis1394,2,Tue Jul 21 15:48:49 2015 UTC,Is it Jeremy Clarkson? I hear he's available...
battlebots,3dzkyu,danakinskyrocker,5,Mon Jul 20 23:08:00 2015 UTC,"Sadly, although I love Top Gear to death, Jeremy really was just painfully awkward on Robot Wars, and only stuck around for one season.   I would've thought it'd be a natural fit as well, but he never really ""got"" the sport."
battlebots,3dzkyu,MustBeNice,1 point,Mon Jul 20 23:58:48 2015 UTC,The 2015 reboot also needs more Sklars
battlebots,3dzdrz,qwertythe300th,12,Mon Jul 20 19:38:20 2015 UTC,"I caught it, and I made special note of it because you are absolutely right, that was the first appearance of the Hellraisers this season. It just comes up like ""hey sup"". I didn't even know they were still a thing."
battlebots,3dzdrz,ZetaGator,8,Mon Jul 20 21:19:54 2015 UTC,I also noticed that they boxed it up a bit so you can't easily get caught underneath... Or at least in theory.
battlebots,3dzdrz,lXlxlXlxlXl,14,Mon Jul 20 22:40:21 2015 UTC,That didn't stop me from getting caught under it!
battlebots,3dzdrz,teamtestbot,1 point,Mon Jul 20 23:22:08 2015 UTC,Expert advice: You have to many pokey things on the front. Only way to avoid it is to not have too many pokey things on the front.
battlebots,3dzdrz,Rflkt,1 point,Wed Jul 22 02:04:39 2015 UTC,BUT MY POKEY THINGS
battlebots,3dzdrz,teamtestbot,2,Wed Jul 22 02:27:40 2015 UTC,Hellraiser back from the underworld!!!!
battlebots,3dzdrz,FaceBagman,2,Tue Jul 21 01:07:34 2015 UTC,"This episode was the first time the commentators even explained what the deal with the hazards is. They said that they come into play ""60 seconds into a match"". Good timing telling us that, right before the season ends. The deployment speed and frequency the killsaws come into play might as well be non-existent.   Also, what's the deal with that little area in one of the corners that the bots can actually push an opponent out of the ring? This came into play in two of the fights in episode 5 and they barely even recognized that prior to this episode.  Was there a point in any of the episodes where they give an overview of the battlebox and the rules?  They should have done that in episode 1. I generally fast-forward through everything but the fights because I find the commentators and hosts extremely boring."
battlebots,3dzdrz,johnnytaco7333,1 point,Tue Jul 21 22:51:40 2015 UTC,I only watch the commentary between fights because molly is pretty. That is it. And I'm a Florian fan.
battlebots,3dzdrz,EdipusRez,4,Wed Jul 22 00:43:28 2015 UTC,pretty sure we had that hazard on previous seasons.
battlebots,3dzdrz,RA2lover,3,Mon Jul 20 20:59:43 2015 UTC,"Actually, hellraisers were removed after season 3, so it was a return"
battlebots,3dzdrz,MC151,1 point,Mon Jul 20 23:43:23 2015 UTC,http://battlebots.wikia.com/wiki/BattleBox
battlebots,3dzdrz,expectationlost,1 point,Tue Jul 21 00:00:06 2015 UTC,"I was looking away for a brief moment and I saw it out of the corner of my eye. I was like, where the hell did that come from?"
battlebots,3dzdrz,nadarko,1 point,Tue Jul 21 06:07:29 2015 UTC,all the hazards disappoint this season for me at least.   they aren't remotely activated which makes them far worse.
battlebots,3dzdrz,varoan,1 point,Tue Jul 21 17:05:32 2015 UTC,"I noticed it too! I think to make them most effective they'd need a quicker release and a slightly higher incline; easier for incoming bots to slam into the wall, and also makes it easier for bots driving on top to aim too high (especially against low-riding opponents)."
battlebots,3dy6fr,Bricktricity,4,Mon Jul 20 14:28:34 2015 UTC,"That is rad, and they're so little too! :D  Welcome to the ""Senpai Noticed Me uwu"" Club, you are hereby entitled to free access to reruns of old BattleBots episodes... plus VHS copies of Bil Dwyer's stand-up routines and a lifetime membership to the Tim Green Turtleneck Sweater Museum.  Not all the perks are that great.  edit: Lego BattleBots are badass and they're the reason why I was kicked off of my high school's Mindstorms team. :P"
battlebots,3dy6fr,ZetaGator,1 point,Mon Jul 20 17:21:39 2015 UTC,That's really cool!
battlebots,3dy6fr,my_memes_are_bad,1 point,Mon Jul 20 17:24:19 2015 UTC,"Dude, lego needs to make these, like yesterday"
battlebots,3e1ae4,Hamfry,3,Tue Jul 21 04:43:17 2015 UTC,"Im a combat bot builder of 16 years, moved to nola 2 years ago. Im hoping to at least get an insect class event going in a year or so. The last event here was a month before Katrina. Robotic Revolution at the Pontchartrain center.  Conniption was my 60lb lightweight bot, Verbal Irony my champion 1lb antweight. Had many others.   Im a busy guy but keep in touch."
battlebots,3e1ae4,aenonymosity,1 point,Tue Jul 21 19:08:22 2015 UTC,"Omg please do. I'm 3 hours away from Nawlins, and I'd love to watch it live."
battlebots,3e1ae4,majinspy,1 point,Tue Jul 21 19:34:33 2015 UTC,"Awesome! There's a makerspace called IDIYA that opened recently, may be a good place to start. If you end up finding time to host robot building classes, I'd attend the hell out of 'em.  In the interim, I'm trying to convince some friends to start a poor man's robot combat league, the idea being that we're all required to use the same exact ~$20 RC car as a platform so no one (read: me) goes crazy and spends way too much money."
battlebots,3dxxtk,HiThisIsAFakeAccount,14,Mon Jul 20 13:15:28 2015 UTC,"Glad someone else remember this, I  made the same point in the megathread. I'm not convinced that armor on the sides is strong enough to keep Tombstone/Last Rites for doing its thing."
battlebots,3dxxtk,deadguydrew,2,Mon Jul 20 15:43:33 2015 UTC,If you watch the preview for E06 frame by frame you will have your answer.
battlebots,3dxxtk,raid0yolo,6,Mon Jul 20 19:32:18 2015 UTC,Do you have a link to the episode 6 preview? I can't find it.
battlebots,3dxxtk,ABrothelOfLuigis,1 point,Mon Jul 20 20:58:31 2015 UTC,It was at the very end of episode 5.
battlebots,3dxxtk,raid0yolo,3,Tue Jul 21 21:57:03 2015 UTC,"I'm desperately avoiding spoilers so please don't hurt me, don't hurt me, no more."
battlebots,3dxxtk,deadguydrew,4,Mon Jul 20 23:52:48 2015 UTC,"Don't hurt me, no M.O.E."
battlebots,3dxxtk,Roobotics,11,Tue Jul 21 10:17:20 2015 UTC,"Tombstone has the same vulnerability, but Bronco, only having a flipper can't take advantage of it. ICEwave might have been able to."
battlebots,3dxxtk,droopyGT,4,Mon Jul 20 18:05:45 2015 UTC,"That's something that concerns me if I'm in Tombstone's corner. Tombstone becomes a shark out of water without the use of it's wheel(s). I do love that bot though, that thing is 100% pure offense."
battlebots,3dxxtk,Likes_MMA_Stuff,6,Mon Jul 20 22:17:01 2015 UTC,"The thing is, it's two-wheeled, so it's pretty much always oriented towards the opposition. The only way to attack it is to take at least one good hit."
battlebots,3dxxtk,picklesitter,4,Tue Jul 21 03:20:05 2015 UTC,"As is with most vertical spinners though, I don't know how you engage a bot like IceWave without taking at least one hit. I don't know what weight Tombstone clocks in at, but if they could wield a bar around those wheels to provide some defense it might prove valuable."
battlebots,3dxxtk,Likes_MMA_Stuff,3,Tue Jul 21 03:36:04 2015 UTC,"True, but if the bar got bent, it would hinder the movement just as much."
battlebots,3dxxtk,picklesitter,3,Tue Jul 21 13:23:42 2015 UTC,"I'm worried Tombstone will bend the armour inwards, jamming the wheels of Bronco."
battlebots,3dytu4,teamtestbot,8,Mon Jul 20 17:18:19 2015 UTC,"Colsonbot is a beetleweight (3lber) I built originally as an inside joke, but took too seriously this time around. It's now actually competitive.   Imgur  The chassis is one-piece 3D printed (with separate lids)"
battlebots,3dytu4,Baryshnikov_Rifle,2,Mon Jul 20 19:10:00 2015 UTC,I like your flair.  Dey madbro.
battlebots,3dytu4,mercury_289,3,Mon Jul 20 19:13:12 2015 UTC,It also actually is Charles.
battlebots,3dytu4,droopyGT,1 point,Mon Jul 20 20:23:14 2015 UTC,"I was looking at the Bot Blast site earlier today, but it looks like it's been hugged to death now. Anyway, why was this match only 2 minutes instead of three?"
battlebots,3dytu4,Badnik96,1 point,Mon Jul 20 21:12:16 2015 UTC,"There were a ton of bots, so all the matches were cut down a minute to fit the tournament into one day.  I fought the Colson later on with my beetle and lost to it as well. That thing is hard to hit with a horizontal bar."
battlebots,3dytu4,youRFate,2,Mon Jul 20 21:50:56 2015 UTC,"I see quite a few ""Tomb-pebble"" marks on the side...   It's literally the best possible armored against such designs c:"
battlebots,3dytu4,celo753,4,Mon Jul 20 22:42:34 2015 UTC,What was the plan of the round spinner? Did he forget his blade at home?
battlebots,3dytu4,sarahbau,4,Mon Jul 20 18:04:54 2015 UTC,"He's what is known as an ""assbot""."
battlebots,3dytu4,Gregoryv022,10,Mon Jul 20 18:07:41 2015 UTC,I think Charles built it too well to be an assbot. My favorite assbot is Ham Slicer. I just love everyone's reactions as it's brought out.
battlebots,3dytu4,Yoshiman400,3,Mon Jul 20 19:50:01 2015 UTC,Oh god.... That is hilarious.
battlebots,3dytu4,ZetaGator,2,Tue Jul 21 04:27:38 2015 UTC,Drift king of robot combat.
battlebots,3dytu4,MikeNCR,4,Tue Jul 21 17:26:23 2015 UTC,"Okay, dumb question here. I know what Colson wheels are, but what's the inside joke associated with them?"
battlebots,3dytu4,Hamfry,8,Mon Jul 20 18:31:24 2015 UTC,"Not sure if this is exactly it, but a few years back the Robot Battles insect arena had a spinning Colson as a ""hazard"" and it wound up being shockingly destructive against insect class bots. A year or two after that hazard was retired the first Colsonbot was made and built to look very similar to the retired hazard.  Since then there have been a few rebuilds of Colsonbot mostly focused around keeping costs low and upping the durability so it would at least keep running throughout a fight."
battlebots,3dytu4,ElectricNed,4,Mon Jul 20 18:47:38 2015 UTC,And here's the build report!
battlebots,3e0p0s,Dark-tyranitar,6,Tue Jul 21 01:37:13 2015 UTC,Me and my friend had a drinking game for everytime she crossed her legs
battlebots,3e0p0s,MapleSyrup69,5,Tue Jul 21 07:55:47 2015 UTC,You focus on some strange things.
battlebots,3e0p0s,ZetaGator,2,Tue Jul 21 04:54:00 2015 UTC,Maybe her feet are just tired from all the filming.
battlebots,3e0p0s,Infernaltank,3,Tue Jul 21 17:32:58 2015 UTC,"Oh god XD this is too funny XD Poor girl, :( she does a great job! but this is rather funny and on point XD  I think they stopped panning up from her ankles like they did in other episodes :)"
battlebots,3dxsf6,thisdesignup,43,Mon Jul 20 12:23:03 2015 UTC,"Stepfather team member here. The downsides have been summed up pretty well in other comments here (lower traction, no redundancy, complexity, higher weight, lower robustness, etc.). The four wheels, without motors or gearboxes, weigh a total of 64 pounds. Even for a superheavyweight, that is a lot of weight to give up. Also, the custom metal parts alone for each wheel cost over $1000.  About the only actual fighting advantage is they allow us to keep the heavily reinforced, half-inch thick titanium parts at the front of the bot pointed at the opponent quite well. By comparison, the rest of the bot was lightly armored.   We only used this kind of drive because it looks so cool. We honestly never expected to win any fights. We only wanted to last long enough that people said ""Holy shit, that is cool!"" a few times before we died."
battlebots,3dxsf6,krellsteel,11,Mon Jul 20 15:20:41 2015 UTC,"We only used this kind of drive because it looks so cool. We honestly never expected to win any fights. We only wanted to last long enough that people said ""Holy shit, that is cool!"" a few times before we died.   That's the attitude I was hoping for! :P Really it's a cool bot! If everyone else did the same then those bots could all fight in one cool battle."
battlebots,3dxsf6,krellsteel,5,Mon Jul 20 15:32:48 2015 UTC,"I am very happy that you like Alcoholic Stepfather!  One thing to keep in mind, when BattleBots was at the peak of their popularity, far more bots tried out than could be shown on TV. A team had to win two rounds in order to work their way into the televised rounds. Many unusual and creatively designed bots were eliminated by more functional bots in those rounds. That is why AS never made it on TV."
battlebots,3dxsf6,fb39ca4,10,Mon Jul 20 17:47:23 2015 UTC,"You can get off-the-shelf Mecanum wheels nowadays. Still pricey, but quite a bit less than $1000 for a set. (For heavyweight you would probably want the largest size)  http://www.andymark.com/Mecanum-s/53.htm"
battlebots,3dxsf6,personizzle,9,Mon Jul 20 18:15:50 2015 UTC,Those wheels wouldn't last two seconds in combat. Superheavyweight combat construction and durability requirements are on a whole other plane of existence from FRC.
battlebots,3dxsf6,krellsteel,3,Mon Jul 20 19:44:02 2015 UTC,The bent sheet metal construction of the commercial mecanum wheels are good for keeping the costs down and could be fine in applications outside of heavyweight combat. They would even be good to use as one debugs their system.  But I also cannot imagine using them to carry the loads that really large bots must survive.
battlebots,3dxsf6,fb39ca4,1 point,Mon Jul 20 19:54:48 2015 UTC,How were the wheels on Alcoholic Stepfather constructed? Is it two halves machined from solid blocks of metal?
battlebots,3dxsf6,krellsteel,4,Mon Jul 20 20:50:03 2015 UTC,"The main outer wheel was machined out of a single piece of 7075 aluminum, with pockets at 45 degrees for the rollers. There is an inner hub that connected to the outer one only through a series of elastomeric cylinders. This inner hub had to be made from two pieces, and is fully hidden within the outer wheel. This image shows the outer wheel in blue and the inner hub parts in red and tan. We were able to achieve several mm of travel in the vertical direction yet still achieve high stiffness in the other degrees of freedom."
battlebots,3dxsf6,fb39ca4,1 point,Tue Jul 21 03:57:50 2015 UTC,"Wow, I'm still trying to comprehend how those pockets were machined."
battlebots,3dxsf6,Scrial,1 point,Tue Jul 21 04:17:00 2015 UTC,"Machinist here, 5-axis CNC machine, not that difficult if you have the machine.   Actually a normal 3 axis with a controlled B axis could do the job as well.  Edit: I figured this is just a bunch of nonsense if you don't have experience, so here is a video of a 5 axis mill in action: https://www.youtube.com/watch?v=tvDXg1iuqNw"
battlebots,3dxsf6,krellsteel,1 point,Tue Jul 21 14:08:27 2015 UTC,"We designed the wheels to require only 3-axis (trying in vain to keep costs down). Each roller's pocket has all of its features come in from one plane. When one pocket is done, increment the wheel rotation and do the next one."
battlebots,3dxsf6,Scrial,1 point,Tue Jul 21 17:30:29 2015 UTC,"That makes more sense. Don't know what I was thinking, if it were synchronous you would get pockets following the surface, and axes just don't turn as well if they aren't straight."
battlebots,3dxsf6,fb39ca4,1 point,Wed Jul 22 08:00:19 2015 UTC,"The smaller wheels, no. But the 10"" wheels I could see working.  Here is the results of some tests they did on 6"" wheels. The 10"" wheels would only be more durable.  http://files.andymark.com/6inch-HD-Mecanum-evaluation.pdf"
battlebots,3dxsf6,KnightOfAshes,0,Mon Jul 20 20:49:09 2015 UTC,Mecanum would be even worse for robot combat.
battlebots,3dxsf6,fb39ca4,3,Mon Jul 20 18:53:50 2015 UTC,But isn't that what Alcoholic Stepfather was using?
battlebots,3dxsf6,KnightOfAshes,0,Mon Jul 20 19:27:34 2015 UTC,Hurr durr. I didn't click through to the video for a visual. Ignore me!
battlebots,3dxsf6,iamthegraham,3,Mon Jul 20 20:04:06 2015 UTC,"About the only actual fighting advantage is they allow us to keep the heavily reinforced, half-inch thick titanium parts at the front of the bot pointed at the opponent quite well.   Seems like if you had a short-range but powerful weapon like a drum spinner on the front (set inside a wedge probably) this could be a pretty viable strategy."
battlebots,3dxsf6,krellsteel,4,Mon Jul 20 19:28:26 2015 UTC,That does seem like an appropriate tool for an omni-wedge  like AS. I will strongly consider that as we try to integrate an active weapon into him for next year (assuming that we get a Season 2). Thanks!
battlebots,3dxsf6,hoja_nasredin,2,Mon Jul 20 21:28:32 2015 UTC,random guy passing by to tell:  Sideway movement combined with the name really lit up my day.  Thanks
battlebots,3dxsf6,krellsteel,2,Wed Jul 22 00:20:51 2015 UTC,This 83-second video is my favorite Stepfather fight. We have the drive system optimized and the flamethrower at its best.
battlebots,3dxsf6,Mirechath,16,Wed Jul 22 00:46:21 2015 UTC,"Mostly weight and complexity. You now have to have 4 motors with 4 heavy wheels and a suspension system to keep all wheels in contact as best as you can. Also, the wheels that are 2-3X heavier than just typical wheels are also more fragile and prone to breaking. So you really need to protect them as best as possible.   Biggest, redundancy. Stinger is the best example of this. At least one set of wheels gets messed up every fight he's in it seems. They are completely exposed and take plenty of abuse. So he put 6 on there so that he can loose 2 sets a side and still be mobile. With Mecanum wheels and holonomic drive, you have 0 redundancy. It is a very tricky balance you have to strike. Alcoholic Stepfather custom made their own wheels and rollers to take the abuse and not be that heavy. In the 250lb class, that's your only real option for those wheels."
battlebots,3dxsf6,Remigus,7,Mon Jul 20 12:39:19 2015 UTC,"None the less, that thing is gorgeous."
battlebots,3dxsf6,Mirechath,5,Mon Jul 20 14:16:50 2015 UTC,Agreed. I'm actually picking out parts and trying to design a holonomic drive bot myself in the smaller weight classes because I think it'll be tons of fun to drive and will be something different. I think it's a great idea if you can get it to function as well as they have.
battlebots,3dxsf6,Okamifan1,2,Mon Jul 20 14:44:22 2015 UTC,Exactly my thoughts :P I wasn't thinking about effectiveness or practicality but I was thinking purely for the show. Right now we have effective and practical and it isn't the most interesting when it comes to bot fights. It would be fun to see people take a bit more of a risk and get more creative with the bots. Although I guess I need to realize there are reasons such as time constraints for why creativity didn't happen as much. Still would have been nice.
battlebots,3dxsf6,krellsteel,4,Mon Jul 20 15:04:54 2015 UTC,"Yeah but you have to remember this is one of the bots that have beaten Tombstone when it was a SuperHeavyWeight, which puts it in the same league as Witch Doctor who came close."
battlebots,3dxsf6,Valzy,7,Mon Jul 20 15:55:49 2015 UTC,"It surprised the crap out of us both times we beat SHW Tombstone. However, regardless of our cool drive, we are just a wedge/brick, and well-designed bricks generally do well against spinners. Manipulators and flippers tend to mop the floor with us. Such is the rock/paper/scissors nature of well designed bots."
battlebots,3dxsf6,Mirechath,1 point,Mon Jul 20 17:59:40 2015 UTC,"Holonomic drives have redundancy. As long as the drive still has 2 powered wheels, it can be driven controllably."
battlebots,3dxsf6,Valzy,1 point,Mon Jul 20 20:42:00 2015 UTC,"It can be driven as a tank style. You are correct that technically it does.   Just remember, you can't just use the typical one stick steering unless you set it up as such. The most intuitive set up, at least what all the game designers use in their games, has the forward, reverse, and strafe commands on one stick. You would want to practice tank driving the bot and would need to know you can't translate sideways if you lose a wheel. It could certainly be done, just would need to be practiced or a program set up with a spare channel, if you had one, to switch."
battlebots,3dxsf6,Mirechath,2,Mon Jul 20 21:09:01 2015 UTC,"I thought 2 stick steering was the norm with omni wheels. One stick is used to control linear movement and the other to control rotational movement.   A 4 wheel holonomic drive that has lost 1 wheel would still retain its ability to move omnidirectionally, but would have to be programmed to correct for the lost for the lost motor."
battlebots,3dxsf6,ZetaGator,1 point,Mon Jul 20 21:55:40 2015 UTC,"Last I knew it was similar to video games. One stick moves in one plane and the other pivots. You can't get there axis movement from one stick. Tank style typically is one stick and you get forward, reverse, and turning on that one stick. At least from what I know, which isn't as hands on as I'd like.  Losing one motor would make attempting to strafe rotate your bot as well because you'd have nothing keeping it in check for one direction."
battlebots,3dxsf6,krellsteel,7,Mon Jul 20 22:40:40 2015 UTC,"Gonna be a stickler here and point out that I think Alcoholic Stepfather's wheels are called ""Mecanum"" wheels. Omni-directional wheels do not have powered individual rollers if I remember correctly. But yes, they are a complicated mess mostly because it messes with your head and makes it hard to maintain your forward heading.  As for durability, Donald Hutson used Omni wheels in the middleweight version of Root Canal and the tires ended up getting broken by a thwack bot that hit it just right. Razer also uses Omni wheels for its rear tires to allow for better handling, and I believe at one point the saw blade on Pussycat just shredded them to bits."
battlebots,3dxsf6,droopyGT,7,Mon Jul 20 16:42:48 2015 UTC,"You are right that our wheels are Mecanum, not omni. And as odd as it is to wrap your head around, the rollers are not powered but rather are free to spin about their own axes."
battlebots,3dxsf6,ZetaGator,5,Mon Jul 20 18:02:09 2015 UTC,Quit wasting time here and go write the update for Ep 5. Thank you. ;-)
battlebots,3dxsf6,droopyGT,5,Mon Jul 20 17:47:58 2015 UTC,LMAO  I am work right now. :( I've gotten as far as I can get without having the episode downloaded locally for me to rewind and watch five more times. :P
battlebots,3dxsf6,RA2lover,2,Mon Jul 20 18:30:14 2015 UTC,Sabertooth cat.
battlebots,3dxsf6,picklesitter,6,Mon Jul 20 18:47:48 2015 UTC,"these wheels tend to have worse traction, reliability, and weight than their normal counterparts."
battlebots,3dxsf6,krellsteel,5,Mon Jul 20 13:00:12 2015 UTC,"They're very, very difficult to get right. Alcoholic stepfather is the only one that has so far. They're difficult to build, and they're fragile because you need all 4 running to be able to steer."
battlebots,3dxsf6,EntropyInTheUK,5,Mon Jul 20 15:42:56 2015 UTC,"Although this thread has mainly dealt with holonomic drive systems, I think that the main point you want discussed is why don't we see more bots doing unusual things (drive systems, weapons, strategy, etc.) on the show.  I think that there are two main reasons for this: resources and adoption.  Resources: In these weight classes, as everyone knows, bots are very expensive. It is exceedingly rare that you will find a builder willing to foot the bill for something of this magnitude, especially if research and development is involved, with little more than a slight hope for marginal functionality. Alcoholic Stepfather's development took years and also a major chunk of stock-option fueled dollars to perfect. Imagine trying to find someone willing to spend this time or money when the most likely outcome will be embarrassment in arena.  Adoption: In the early days of BattleBots, many different concepts were tried. Those configurations that fared well were emulated and refined. Those that didn't were abandoned. There are now fewer and fewer even marginally viable concepts that have not been tried. Worse yet, those novel concepts are now going against bots that are about as optimized in their methodologies as the rules allow. If by chance some new or modified technique is shown to be effective, it will be adopted by enough other builders so it quickly becomes less novel. Combat events have been going on many times per year across the country during all of the years that BattleBots has been off the air, so the bot designs have evolved and adopted effective concepts. Novel but effective designs become commonplace fairly quickly when they emerge.  This is not to say that we should not fight for novel approaches, perhaps with rules that allow different weapons, but it is unlikely that the novel bots will make it very far in a competition.  Just my two cents"
battlebots,3dxsf6,hoja_nasredin,2,Tue Jul 21 04:02:17 2015 UTC,Mecanum wheels on a killsaw?  No thanks!
battlebots,3dxsf6,krellsteel,1 point,Mon Jul 20 18:55:01 2015 UTC,Stupid question from somebody that just recently discovered Battlebots.  WHy wasn't Alcoholic Stepfather in this year competition?
battlebots,3dxsf6,chimphunter,2,Wed Jul 22 00:31:49 2015 UTC,We weren't invited. I don't know why. Could be because we haven't fought in many years.
