ChronicPain,3e32lo,rizahsevri,5,Tue Jul 21 16:08:34 2015 UTC,Lyrica arms?
ChronicPain,3e32lo,RoscoLM,5,Tue Jul 21 16:43:45 2015 UTC,Yep! Been using sample packs while I am out of insurance and they only had lower dosages so I got more pills for my artwork lol
ChronicPain,3e32lo,RoscoLM,3,Tue Jul 21 18:23:20 2015 UTC,I love it. Clever and funny.   I'm (thankfully)  not at the stage that I cam figures out of meds
ChronicPain,3e32lo,msheaven,3,Tue Jul 21 19:48:16 2015 UTC,"I remember the first day I had to take so many at once I could make some medicine art with it. I felt like a kindergartner playing with macaroni noodles, it helped take the worry over all the pain and meds away just a bit. I hope you manage to avoid it though!!"
ChronicPain,3e32lo,allonzy,5,Tue Jul 21 20:14:13 2015 UTC,you made me laugh.  Hubby knows when I am stressed because I line mine up in size order.  to be playful if he thinks I am stressed he will line them up for me
ChronicPain,3e32lo,allonzy,5,Tue Jul 21 18:10:29 2015 UTC,"Aww!! It's nice to have someone who can be playful with all these issues. It's straining but can also bring two people so much closer too. My SO brings me a spoon with my coffee, half because it's hard to hold a heavy cup up so I drink it like soup some days but partly because he loves the spoon theory."
ChronicPain,3e32lo,allonzy,6,Tue Jul 21 18:25:15 2015 UTC,Haha!  This genuinely made me laugh!      I have a dorky little poem to help me remember all my morning meds.  I kind of like the idea of Morning Med Man better though....
ChronicPain,3e32lo,taoshka,5,Tue Jul 21 18:14:14 2015 UTC,"When I first was diagnosed and started a bunch of medication, I had a couple of Med people walking a Med dog every morning.   There is something fun, and a bit demented, about taking the legs off a Med Man and eating it piece by piece. A bit of horrible therapy against the trials of chronic illness."
ChronicPain,3e32lo,sushisay,5,Tue Jul 21 18:30:36 2015 UTC,You.  I like you.
ChronicPain,3e32lo,Smgth,3,Tue Jul 21 20:08:43 2015 UTC,Haha! I have gotten a demented sense of humor with all this. Laughter is great medicine but sometimes your mind is just dark from pain :P
ChronicPain,3e32lo,Smgth,3,Tue Jul 21 20:14:55 2015 UTC,I think I was born with a demented sense if humor.  It has certainly served me well through life!
ChronicPain,3e32lo,SnaKiZe,1 point,Tue Jul 21 20:17:06 2015 UTC,It makes life more interesting!
ChronicPain,3e2tzq,sandhouse,2,Tue Jul 21 15:05:56 2015 UTC,Thanks for this.
ChronicPain,3e2tzq,Sharkycode,1 point,Tue Jul 21 15:23:17 2015 UTC,Weird bracket typo.   So this is completely free but they are promoting a book. It might not be free forever. I'm trying their various suggested methods and it's nothing magical but useful.
ChronicPain,3e2tzq,upandalive,2,Tue Jul 21 15:08:05 2015 UTC,"Interesting post, thank you."
ChronicPain,3e4ua0,isaretha,1 point,Tue Jul 21 23:36:21 2015 UTC,Your story sounds like a lot of other peoples'.  Remember you are not the only one.
ChronicPain,3e4ua0,deletetables,1 point,Wed Jul 22 01:52:46 2015 UTC,I have bad fatigue and pain myself. I've made friends here on reddit that I've become friends with in real life.  Find a subreddit that is local to where you live and or involves something you're interested in. That's what I did and it added like a handful of good new friends. Just a suggestion 😊
ChronicPain,3e4tn9,OLIVERHEART,1 point,Tue Jul 21 23:31:15 2015 UTC,"Also my facet arthrits is in my lower lumbar I believe, L5-S1 I think."
ChronicPain,3e4tn9,zutroi67,1 point,Tue Jul 21 23:32:04 2015 UTC,"Hello mate. I'm 48. Have had cervical neck facet arthritis (+ a few crumbly disks) for about 12 years now. Constant upper right-sided neck pain, bilateral headache and painful bilateral musculature around the front of my neck. Medicated with Tramadol 200 BD for years, but recently made the nasty jump to Targin 20/10. Tramadol was good, but I increasingly became tolerant to it and was taking 400 BD instead. Have been taking Lyrica or like for a few years, but these drugs make me DUMB. I'm a health professional, and these drugs have robbed me of my mind. I'm now on Sodium Valproate, which is weaker, but still helps with the headache and neck pain (a bit!) Physical therapy used to help, but at AU$100 a pop, I couldn't afford it really, and besides, it started to become ineffective. My facet pain started as a small upper right C3-C4 spot of pain and it now controls my entire life. I have become a nasty, shitty, annoying person, with no tolerance for anything challenging. I am sometimes a total asshole to my little boy and wife, and this makes me feel like shittier than shit. My marriage is about to break. I have had the same GP/doctor for 10 years. He recently turned on me when he found that my pain specialist had moved me from Tramadol to Targin. My GP now thinks I'm drug seeking, which is semi-true, as I cannot tolerate the pain some days, and without the analgesia, I would have suicided years ago. I recently paid AU$1000 to see another pain specialist here in Melbourne, who actually showed some understanding and listened to me when I complained about my medication issues (both the Targin making me feel sick and my GP angry that I had ""escalated"" to full opiates. We are now trialling Palexia, along with my other secondary drugs, while weaning off the Targin. I'm surprised the wean is going well, but today I am in hell (pain) but in good spirits mentally. I truly hope that your facet stuff doesn't worsen like mine did. On a graph, over time, my pain is just trending up and up, busting the usefulness of my medication. I swore to my wife and GP that I would NEVER use opiates (full opiates, as opposed to partial agonists like Tramadol) but I'm now fully dependent on these drugs just to survive. There is nothing to say that your pain will worsen like mine did: we're totally different people/cases. I think the only advice I can give you is maintain a good relationship with your carers, both personal and professional. I don't know where you are in the world, but I hope you have a good doctor etc. Knowing how most doctors treat chronic painers, you may need to keep your options open as far as finding another doctor. These guys either just don't know chronic pain, or they also don't want to know about chronic pain. I'll finish my rant now. Good luck!"
ChronicPain,3e2z06,DrLemniscate,6,Tue Jul 21 15:42:48 2015 UTC,"If you want to you should. But they won't know that you have them either way and you don't know if you will need them at some point in the future. What if you go there for 2 visits and it sucks and you don't have any meds leftover?  I'd say don't toss em, don't bring em in, and don't tell them you have them.   I only used to bring in the meds that my doc prescribed me to the doc that prescribed them when I was switching meds. And he still lets me keep them now for emergencies. I have to switch every 2 weeks to make the lowest dose have an effect on me. Can't wait till I'm off them and on to better management solutions."
ChronicPain,3e2z06,Halt_I_Am_Ragnar,2,Tue Jul 21 15:54:55 2015 UTC,I agree. You never know if you are going to have a bad pain day that is worse then normal. Or if your appointment gets bumped a few days and you are going to appointment for refills. Shit happens. Best to keep it and use it if you need it. You are clearly responsible about it. I don't think you should disclose it.
ChronicPain,3e2z06,Viperbunny,1 point,Tue Jul 21 16:13:19 2015 UTC,Pain specialists are always on the lookout for drug seekers. ANYTHING could make them suspect you. My policy is to never mention a drug. Let them bring up opiates. If they don't give you what you need then you need a new doctor. Sorry if it sounds bitter. I've just learned that some doctors play hardball so I have to play too. (I hate opiates btw but I've been labeled as a drug seeker because I told a doc that Ambien helps my pain a lot. I thought he would find it as weird and interesting as I did. But he thought I was lying(?) and ended my prescription.)
ChronicPain,3e2z06,sandhouse,2,Tue Jul 21 17:09:19 2015 UTC,"Yep, sandhouse is pretty spot-on here. I understand OP's views on showing the establishment that we aren't necessarily hunting drugs for the sake of it, but most doctors don't give a shit (don't get me wrong, sometimes I NEED extra drugs). It's difficult to keep your mouth shut while remaining informed and self-protective. For instance, if a new doctor says ""Well, try acetaminophen for 2 weeks and see how that goes"" then most of us chronic painers are gonna think ""Hey, you know what you can do with your shitty, weak, ineffective tablets?"" Showing your hand is probably going to end in tears, unless you are on amazingly good terms with your doctor. They say it's about trust, but really, they're just worried about you eating your tablets, turning into an injecting drug user and then getting them into trouble by overdosing. That's my exact problem with my doctor, despite him treating me solely for over 10 years: he doesn't trust me.    Before I go to my doctor, I write a list of my arguments as I often forget exactly what to say when I'm there. I would include self-preservation notes on that list, so that you can counter and argue your points clearly and articulately without screwing yourself over with a slip of the tongue about what you want/need. It would be great to be able to go to your doctor and say ""Fuck doc, my pain is getting worse, and I'm losing my mind. I have thought about how peaceful it would be to hang myself, just to get an hour without pain: GIVE ME SOMETHING STRONGER AND EFFECTIVE"" but most of the time the result will be not so good!    TL;DR IMO, no, don't take the tablets, but do take a list of things you have tried previously. How you deliver your opinions about old therapies is up to you, but I wouldn't overdo it."
ChronicPain,3e2z06,zutroi67,1 point,Wed Jul 22 03:18:48 2015 UTC,"Just a note on the depression - I recommend seeking out a counselor or a pain psychologist if you can. While you could get prescribed antidepressants for your pain, your pain management doc is worried about your pain symptoms, not your depression ones. You also need to make sure to actually treat the depression. And talking about how you deal with pain and the effects it has on your life with a counselor can be really helpful. Pain and depression don't have to be synonyms."
ChronicPain,3e3nw5,vegasidol,1 point,Tue Jul 21 18:33:42 2015 UTC,"I can't give a lot of advice from here. Have you asked the doctor about this? Were the injections done with some sort of scan to determine where his needles were pointing? I don't have much experience with nerve block specifically but my understanding was in this day an age doctors should not be injecting things without ultrasound or some other sort of scan because they cannot definitely know where the tip of the needle is as the structures in joints are all so close together. I don't trust shoulder or knee injections done by very qualified doctors unless they are done under ultrasound. If they were done with some sort of imaging then there is a chance that despite looks they did inject the same area. My brain is not functioning well at the moment but I do know that in spinal injections they need angle the needle and things so the entry point on the skin could be different . This would be even more the case if your back happened to be bent slightly differently in the second procedure. To be honest though, you really need to talk to the doc who did them about your concerns and see what he says.  God luck with it all. Have you noticed any effect from the blocks?"
ChronicPain,3e3nw5,ninja_wifey,1 point,Wed Jul 22 01:35:27 2015 UTC,"I have an appointment to talk to the doctor next Wed. I just thought I'd get anyone else's thoughts or experience with this, since I have nothing else to go by.  The Block is done with xray guidance. They have to get the anesthesia close enough to the Medial Branch nerves. I don't doubt that he actually did the procedure correct, just the wrong vertebrae. I was on the same table with the same pads in as in the first procedure the second time, so position should not have mattered.   Effects from the block(s). The first time, the dr 'hit the nerve' or I was 'really sensitive in that area'. I say it this way, because the dr didn't give me a straight answer about exactly what did happen.   The first two vertebrae hurt mildly. There as a lot of pressure and it was pretty uncomfortable. The third one (working from bottom to top, so that 'should have been T8) hurt a lot. Enough for me to vocalize an 'ouch' and a sharp electrical sensation to radiate around my rib cage to my chest. That got me pretty freaked out.  So, that block...I had some relief. I'd like to say that a couple 'golf balls sized areas' around where I had the injections felt okay after 'testing' the injection (doing regular things that cause you pain, for me - walking). But the rest of my back around that area, hurt, maybe slightly less than usual.  Knowing that going into the second block, the dr said he'd 'be more careful' around that area (in fact, looking like he missed T8 all together).  That the pain I felt the first time could have been because of the painful reaction I experienced. The rest of my back should not have hurt. The second time each injection hurt more than the first ones did, but I did not have the shooting pain around to my chest.  Testing it out that afternoon, I felt as though I got more relief than the first time. At the end of the day after exerting myself I was starting to hurt for sure, but that was hours after the block was supposed to have worn out. I was hurting but not 'paralyzing pain-hurting'. It was manageable.   It's a tough choice...whether or not to go forward. Obviously there is the trust issue. There is the pressure to go ahead and 'try' the ablation since I have met my deductible with 2 of these $5600 procedures. But there is also fear. Killing nerves in your back...knowing it 'might not work' is pretty scary.  There's a lot to think about..."
ChronicPain,3e3nw5,zutroi67,1 point,Wed Jul 22 03:19:17 2015 UTC,"Hi vegasidol. The docs can use several techniques for judging positions: manually palpating and counting, or using low-power xray/fluoroscopy while positioning the needles/injections. Your scans suggest a couple of issues that the doctors could be trying to block, so your question is difficult to answer with any precision. Also, MBB's aren't necessarily definitive. I've had 6 bilateral blocks which NEVER gave me any relief from my cervical facet arthropathy. Sometimes the blocks just don't work, making judgements on forthcoming RFA's difficult. Personally, if I had never-ending money, I would have all of my cervical facet medial branches burnt off, just in hope of SOME relief! I hope you can find your answers. Good luck. (Source: I'm a longtime, experienced RN, with longtime facet joint pain.)"
ChronicPain,3e3nw5,philnoir,1 point,Wed Jul 22 03:43:24 2015 UTC,"Yes, but where is the facet hypertrophy? The quote you share says that you have facet disease located everywhere in the thoracic spine.  The facet athropathy is why you're considering medial-branch neurotomy. It is an excellent tool for eliminating this aspect of back pain.   It could very well be that your severely hypertrophic facets ie, the worst arthritic facet joints, are not bilaterally symmetrical.  Your doc is working off the MRI to decide on which levels to anesthetize, and using the flouroscope to find anatomical landmarks that identify specific throacic structures.  So, ask more questions about his decisions. Why these joints? Why only 3? Etc."
ChronicPain,3e2bqh,upandalive,1 point,Tue Jul 21 12:26:30 2015 UTC,"It can't hurt to ask but in my experience my pain doctors only handle my pain, rheumatologist has their orders and meds. They try to defer to other doctors or my primary for any issue that is not pain related.  My hematologist did order an antibiotic(Friday afternoon appt) for me once when I was very ill on a blood check day, with the instructions to follow up with my general doctor."
ChronicPain,3e2bqh,CorvieNoir,1 point,Tue Jul 21 19:36:46 2015 UTC,"My pain doctor prescribes mine.  She was the one who pushed me to take them.  I resisted for months but when I tried them, the pain relief was almost instant (it was definitely within the first 4-6 hours).  It doesn't hurt to ask.  Depression and anxiety are part of the chronic pain feedback loop, so a neurologist might already have some suggestions as to which kinds they would want you to try first."
ChronicPain,3e2bqh,kaleidoscopic_prism,1 point,Wed Jul 22 02:12:04 2015 UTC,Certainly pain guys do prescribe AD's. They're a staple in pain medicine. AD's can be fantastic medicines for pain and psychological support.
ChronicPain,3e2bqh,zutroi67,1 point,Wed Jul 22 03:45:27 2015 UTC,"My doctor prescribed amitriptyline which is an antidepressant but also helps with nerve pain. That being said, if you are looking for something for depression you may have to try several different types of antidepressants. These drugs work differently for each person."
ChronicPain,3e2bqh,netbich,1 point,Wed Jul 22 04:08:47 2015 UTC,"Possibly - mine continues to prescribe mine though a GP started me on them to treat depression. If you're depressed, it doesn't hurt to see a specialist or a counselor. Pain & depression are related, but they aren't the same."
ChronicPain,3e0uu7,the_watdabney,4,Tue Jul 21 02:23:37 2015 UTC,"fuck, I'm in a very similar situation. it feels so..acutely painfully futile...like..I never knew what true hopelessness was like until I suffered years of chronic pain that no one can help me with  I never knew..waking life could be like the hell you describe, I never thought this would happen to me. now it has been so long, and nothing helps, nothing improves. I wake up in pain, I go to bed dreading waking up again.   I can't work..I may never be able to work, it drives me insane...we just want to be able to work and lead our own lives  I want my own house or my own apartment, I want to be able to have my own dog, I want to be able to work every day and have friends  FUCK. it's really fucking miserable and fucking unfair, that sounds so childish to say but it is...so many people are blessed with baseline health and they don't even really comprehend how lucky they are  I'm so so sorry. I wish I could help you. I wish I could help us  I don't know...what are we supposed to do now? I don't know...doctors have given up on me, therapists, psychiatrists...I don't know..  I really want someone to tell me..too...something to do to move forward because my life refuses to move forward at all no matter what I do  I feel like..it's good to be angry, it's good to fight and feel passionate and want to claim your life, just make sure that stays alive, don't deaden yourself or your desires just because it is hard  we have to alter things..to fit the way we are...  I still don't know how to accept something I despise so thoroughly, I know I have to move towards accepting it  I'm sorry for babbling, I really wish I had something useful to say but I have nothing. I just really relate to everything you're saying  I think..that our efforts are worth something even if the outcomes aren't what we want...I think our fighting in itself is indicative of our strength and we will be okay. I truly believe things can be okay, and you can focus on fulfilling things that you're capable of doing - focus on the things you can control, not the things out of your control (I know there are..far too many things...it can be maddening to obsess over them) - at least that's what I'm trying to do.. I don't know it is hard to be positive after being beaten into the ground over and over again haha"
ChronicPain,3e0uu7,spaghettiodragon,1 point,Tue Jul 21 02:51:43 2015 UTC,"You hit the nail on the head for sure.  I feel so alone right now, mostly because I am always alone, but even more so now that I have no idea what to do.  I first applied for disability back in Dec. 2010 and since then, went through my entire savings, lost my apartment, my car, everything I own and had to pack up what remained and move in with my mother, who is not a supportive person on her best days, which are far and few between.  I had been in a perfect place in my life, having moved to a different state to continue working on my degree while dealing with the pain I was having until it became too much for me to even get out of bed in the mornings.  I had no insurance so no real way to get the treatment I needed to keep the pain and degeneration in my spine at bay and now I am paying the price.  I have lost almost all my friends over time and feel like a burden to anyone else, so I try to keep my true thoughts to myself, which makes things even worse.  I was going to therapy for a while last year until things became difficult between my mother and myself and I could hardly ever borrow her car and I had to stop going to my weekly therapy appointments.  Now I just sit alone every day in my room, keeping myself occupied with the internet or gaming, but that gets very boring after years of the same old thing every day.  I feel like I am lost in a foreign world with nobody even noticing I am even alive unless I stand in front of them screaming my head off, and even then I feel like I'm just pushed aside as someone brushing off an annoying fly or mosquito.    As you said, you are going through similar things but it still feels like I'm all alone in this fight for survival and someone just took my last scrap of clothing from me, leaving me naked and cold and scared in a corner, afraid to even speak.  I used to have dreams, I used to have goals, I used to have fun even on my own, but now I dread the future and my biggest fear of all is coming true...  I will probably die alone, yet another penniless vagrant that will get tossed aside and regarded as a loser in life as the winners forget about me a second later.  I have lost all strength to fight for what I want or even what I need and I have no clue how to get that back."
ChronicPain,3e0uu7,Debz1965,2,Tue Jul 21 03:13:48 2015 UTC,"I know exactly how you feel, and I'm sure everyone here does to some extent. I have no advice to offer. Just know at least everyone here understands. That's why I came here. The real world seems like a cruel joke right now.  ((Hugs))"
ChronicPain,3e0uu7,ninja_wifey,1 point,Tue Jul 21 02:50:12 2015 UTC,thanks
ChronicPain,3e0uu7,Veridical_Cupcakes,2,Tue Jul 21 03:14:47 2015 UTC,"I don't have any advice or help, I just wanted to send you an internet hug & tell you I am sorry things are so sucky at the moment."
ChronicPain,3e0uu7,Veridical_Cupcakes,1 point,Tue Jul 21 02:51:34 2015 UTC,thanks
ChronicPain,3e0uu7,Moosekababs,2,Tue Jul 21 03:14:37 2015 UTC,"I feel you. I fought for it for 4 years and got denied time and again. The judge actually told my lawyer that he felt it was his job to save the government money. Not like, ya know, help determine who has a legitimate disability... but to save the fucking government money. The expert even said there were no jobs available for someone with my limitations. Judge was just like nahhhhh. I'm still pretty bitter about it. I got the same judge twice. That shouldn't be a thing. My state can be a total cesspit sometimes... The governor is an asshole and it just goes down from there, apparently. I had a good lawyer and everything. But the judge just dripped with disinterest and disbelief. He went so far as to call my testimony ""not credible"" which I think just means he thinks I'm a liar. I at least have a husband who supports me, money is tight as fuck but we get by most of the time. I am so sorry about your situation. It sounds a lot less tenable than mine. But please don't give up, there has got to be a way to get by. Do you have places local to you like food banks or other types of charitable assistance? I'm currently going to a low cost clinic in my area and the copay is only $5 per visit and $2 for each medication. Places like that can be really helpful if you're not already on that. And sometimes they can point you toward other types of assistance that's available in your area, especially for people like us who tend to slip through the cracks. My lawyer advised me to get more evidence and go back to try again later. Maybe with this clinic helping me out I will be able to obtain enough evidence of being permanently screwed to convince them that, yes, I really am fucking disabled. Friend, please don't lose hope entirely. Things may be really hard right now but there is always the chance that they will get better. You just have to give it time and keep looking. There have been so many points where I was convinced nothing was ever going to change, but then it did. Life is change, and it's not always for the worse. I'll keep my fingers crossed that you find something to help you out soon."
