ChronicPain,3dmh28,lbsmith5,3,Fri Jul 17 21:06:40 2015 UTC,"I sympathize greatly with the no pain lets do all the things situation.  That used to happen to me years ago. It's a crazy feeling.  I used to tell people ""it's like getting out of jail"", you finally feel normal and like you can do stuff after hurting however long. And naturally you want to do as much as you can because you know the pain will be back. Also I would feel guilty.  Like ""I've neglected so much stuff and now that I'm feeling halfway human, i really should be doing........"" That's how I usually end up overdoing it. So now I try to set single easy tasks for myself when my meds work and I wanna get up and do stuff."
ChronicPain,3dmh28,SHADOWORZA0,1 point,Fri Jul 17 21:38:15 2015 UTC,"You aren't alone. My pain meds make me unable to sleep, so I tend to either come off of them several hours before bed or take something to help sleep (usually benadryl.)"
ChronicPain,3dmh28,hmhieshetter,2,Sat Jul 18 05:03:22 2015 UTC,The first moment when I wake up is the worst. My pain gets bad at the end of the day as well but that first moment is kind of awful.
ChronicPain,3dmh28,LittleKitchenWitch,2,Fri Jul 17 17:00:03 2015 UTC,"When I wake up my brain says, ""YOUR LEGS HURTS, FIX IT NOW!!!"" and then I proceed to walk out the pain, until it stops. That's how every morning is, sometimes I get lucky and my brain doesn't use caps lock."
ChronicPain,3dmh28,dibblah,2,Fri Jul 17 20:11:24 2015 UTC,Yes.
ChronicPain,3dmh28,netvoyer,2,Fri Jul 17 20:23:25 2015 UTC,"Mornings suck! Not only is RA worse in the mornings but last nights pain pills have long worn off so you feel like death on top of the pain AND stiffness.  I have to make sure or at least try my hardest to ensure every single doc appointment, interview, anything at all that requires a reservation or appointment time is at least noon or later or I'll never make it.  Most people just think I'm lazy but whatever, it's just another thing to ignore from assholes who don't believe in chronic pain and/or invisible illnesses.   Edited to remove an extra letter. OCD is a bitch lol"
ChronicPain,3dmh28,mrsj74,1 point,Fri Jul 17 22:38:16 2015 UTC,For me mornings are kind of a lottery as to whether I feel bad or not. Sometimes I feel not too bad...Sometimes I feel dreadful. Usually even if I feel terrible in the morning I am slightly better by afternoon /evening. So I dread mornings.
ChronicPain,3dmh28,goodlit,1 point,Fri Jul 17 17:39:33 2015 UTC,"Yes. Some mornings mean that my pain is so bad I just take MMJ or a sleeping aide to help go back to sleep and wait out the Claire up. So I sleep for a day or two straight and when I can, I get back into my exercises and stretches. Today is one of the sleeping days lol  Nighty night!"
ChronicPain,3dmh28,ninja_wifey,1 point,Fri Jul 17 19:41:26 2015 UTC,"I absolutely hate mornings! My back, hands, & feet feel like someone is holding a flaming torch on them. It's sad that I feel like if I wake up & can get out of bed w/o tears then I've accomplished something. Glad I'm not  the only one who deals with this struggle, although I wish we all didn't have to."
ChronicPain,3dmq53,fatbudha1,2,Fri Jul 17 15:02:25 2015 UTC,"I'd go down to the doctor's office with a laptop and a phone and set up shop in the lobby.   Be extremely polite and collaborative with the office people. ""Oh those insurance people, always wanting something... I thought I'd stop by to get it all settled, thanks so much for your help!""  Call the insurance people and hand the phone to the smartest of the office people.   Bring a beverage, set up camp and don't leave until you've got what you need. If you like the doctor, you're going to have to resist acting pissed off with the staff, or they'll label you ""nuts"" and stop helping altogether.  Also, call every morning before you leave the house for an appointment, to verify the appointment time hasn't changed."
ChronicPain,3dmq53,ThrowAwayMom11,2,Fri Jul 17 17:26:25 2015 UTC,Verify the time hasn't changed or if they are running late. That might save you some time in the waiting room.
ChronicPain,3dmq53,deletetables,2,Fri Jul 17 19:38:21 2015 UTC,"Oh my god, right?! I hate office staff. A lot of them just don't care. Personally, I get pissed off. I let them hear rage in my voice. I let myself cry if I need to. I make emotional pleas. I offer to do things myself. I ask them WHY it's not happening. I put them on the spot. I tell them why it's important, and I tell them the impact their inaction has on my life. Oh, also complain to the doctor about them."
ChronicPain,3dmq53,rainbow_butterfly,1 point,Fri Jul 17 17:48:19 2015 UTC,"I've found the more this happens (from some experience myself and most experience watching others do this) that the patient gets ostracized for doing so. It sucks that you have to play nice with people who don't do that, but if it's worth getting the correct treatment sometimes we need to play a different role.  I'm sorry about your experiences, mine have been similar to that as well."
ChronicPain,3dmq53,Halt_I_Am_Ragnar,1 point,Fri Jul 17 18:50:50 2015 UTC,"I found this too. Being an asshole gets you cut off. Human nature, I guess, but I am frustrated at my Rheumy's staff too."
ChronicPain,3dmq53,hasslefree,1 point,Fri Jul 17 23:41:03 2015 UTC,"I went to the same rheumetologist for 20 years. She NEVER had an office staff that didn't suck. One time they MOVED OFFICES and DIDN'T TELL ME! Worthless people. I loved the doctor though. Eventually I was fired for missing too many appointments...right when I ran out of money, weird coincidence..."
ChronicPain,3dmq53,Smgth,1 point,Fri Jul 17 18:56:53 2015 UTC,"I'm glad (but I shouldn't be lol) that this is more common than I realized. I LOVE LOVE LOVE my PCP but the girls in his office are awful!  I mean most are nice, just really fucking inept at their job.  Also,  his nurses and assistants blow.  But I suck it up because my doctor is amazing and I wouldn't trade him for the world.  But when I am having problems with any of his staff I usually use the clinic's patient portal and email him privately and directly.  99% of the time the problem is fixed within a half hour.  Obviously I wish this didn't happen to other people but I at least feel a little better knowing I'm not the only one out there dealing with this!"
ChronicPain,3djhbc,weiss27md,15,Thu Jul 16 19:41:42 2015 UTC,No shit.  If I had access to medical marijuana I would probably be off my opiates in a month.   Forever.
ChronicPain,3djhbc,StochasticLife,6,Thu Jul 16 20:13:17 2015 UTC,"I'm not sure that's 100% true.  It works differently for everyone.  I take CBD oil, which helps lower my pain, but I still need to use a pain patch and opiates with it because it doesn't take it away enough.  I can't take THC because it triggers migraines for me.  I'm totally an advocate for MMJ, but the assumption that it is a cure-all for everybody is simply false."
ChronicPain,3djhbc,SidSuicide,3,Thu Jul 16 21:40:00 2015 UTC,"Yeah, I'm sure it's a case of YMMV. My (intolerable) pain comes in flares, so I don't have to depend on pain meds on a daily basis. (Baseline is a 4, which is what I consider noticeable but still tolerable. Level 5 headache is intolerable but can often be helped with acetaminophen and/or ibuprofen, and level 6 is the tipping point at which a heating pad or OTC drug isn't going to cut it.)  I hate taking opiates. I hate the way they make me feel - other than the pain relief part, of course. Friends want me to try MJ, but I'm going to wait until it's legally available. Secondhand pot smoke at rock concerts makes me terribly ill, and I'm not convinced that illegally obtained edible MJ won't do the same. They've technically voted to legalize MMJ in my state, but patients won't have access to it until at least next year. I intend to wait until I can get a prescription for it so that I know there's been decent quality control and I'm getting the stuff without the THC."
ChronicPain,3djhbc,WELLinTHIShouse,2,Thu Jul 16 23:02:57 2015 UTC,"Sorry to hear about the thc induced migraines. I've been doing concentrates and flowers for pain for 4+ years now. They are much more effective when you are able to take all the cannabinoids combined, known as the entourage effect.   I grow my own, and have found which percentages of cbd/thc/cbn works best for my issues. I still get occasional flare-ups, but I just hated how I felt on all those narcotics. I'd rather be the giggling hippie over the disconnected zombie."
ChronicPain,3djhbc,ErisGrey,1 point,Fri Jul 17 04:00:18 2015 UTC,I have tried it multiple times. Nothing happened. Like at all. I was wondering if my tolerance to pain medicine could have contributed to that but u don't know. And I used it with others as well so I could see their reactions compared to my own. Just kinda figures...
ChronicPain,3djhbc,Dalekette,1 point,Fri Jul 17 04:12:05 2015 UTC,Same. In fact it put me in more pain because I got up to use the microwave 3 times. I felt zero benefit from it.
ChronicPain,3djhbc,Slider1338,1 point,Fri Jul 17 08:20:44 2015 UTC,I laughed! The comment was meant to be funny? Hehe.
ChronicPain,3djhbc,Imightbenormal,1 point,Fri Jul 17 14:57:52 2015 UTC,Yes. But still true :)
ChronicPain,3djhbc,Slider1338,3,Fri Jul 17 17:42:42 2015 UTC,"I'm so glad that I'm not the only one who read the title and went  NO FUCKING SHIT, DUMBASSES.   Give me a grant and I will study it. 😓 Pretty elementary."
ChronicPain,3djhbc,idontgetbacon,2,Fri Jul 17 01:01:45 2015 UTC,"My first thought was ""... and the winner of the No Shit Sherlock category is""  At least news is for once not treating us all like addicts. Oh wait nvm"
ChronicPain,3djhbc,xsunxspotsx,2,Sun Jul 19 23:42:14 2015 UTC,"I've said it before, and I will say it again:   Maybe I am an addict, but it isn't to pills.   You know those wonderful mornings that you wake up right before the alarm? The sun shining in the window as you stretch lazily in bed before grabbing a cup of coffee and jumping in the shower? Those mornings you take for granted? THAT is my drug of choice. I would mainline that shit all day; alas, it is my flying dragon, never to be caught.   Or how about those days that you get a phone call out of the blue and everyone gets together for lunch before heading to the beach, or the mall, or even to the gym? Those calls stopped for me a long time ago: I just can't keep up with everyone. I can barely keep up with my appointments, my medicine, my self. You want to go grab drinks? Sorry, I just did my injection yesterday and have to watch my liver. You want to hit the town for a night of fun? I might have enough meds to make it, but then I'm stiff and sore and depressed because you wake up smiling after drinking all night while I can barely walk without looking like a velociraptor and I was sober.   That is what I am addicted to. And for someone who gets to live that way every day, and then write a two-bit article on how bad pain killers are-- who are you to judge when you take everything that I want for granted?   dismounts soap box   Sorry. It's under my skin today."
ChronicPain,3djhbc,idontgetbacon,1 point,Mon Jul 20 01:31:05 2015 UTC,"For me its a terminal addiction to the forests, the rivers, the wildlife, and the trees (lol not those trees). Give me 200 acres and a dog and I will be the happiest woman in the world, that is my dragon I chase. I hope I am never cured :)  The medication is just a means to get to these places and keep me moving through the trails and enjoying and immersing myself in nature."
ChronicPain,3djhbc,xsunxspotsx,3,Tue Jul 21 15:23:57 2015 UTC,"Opiates, well, they help my pain, some of it, but they don't really improve my quality of life. If my pain is too great to where I need opiates it's already too great for me to do anything that causes me pain and thus kind of pointless. Marijuana on the other hand I find actually makes my pain worse, I think only mentally, I focus on it more, well, mostly mentally, it does cause mild muscle soreness which I already have a problem with so that's no good. It does however amplify the pain killing effects of opiates, but then we're in the same problem back with opiates.   I'm not everyone of course, but my point is it's not for everyone either. However I do feel, from general opinions I've heard over the years, that it probably could be used in conjunction with opiates to decrease the amount needed. It also helps some of the side effects of opiates, particularly the nausea and decreased appetite."
ChronicPain,3djhbc,kryptobs2000,2,Fri Jul 17 02:24:10 2015 UTC,"I want the ability to buy to correct form of marijuana, I do not live in a medical state and I unlikely to be able to use it legally until something happens on a federal level,  /Sanders 2016"
ChronicPain,3djhbc,StochasticLife,2,Fri Jul 17 02:27:45 2015 UTC,What?
ChronicPain,3djhbc,kryptobs2000,3,Fri Jul 17 02:29:23 2015 UTC,"I was on 6 opiates.. I cut 5 of them in February when I started cannabis.. No withdrawal and it only took 2 weeks, despite being on them for 8 years!"
ChronicPain,3djhbc,potpastor,2,Fri Jul 17 02:10:39 2015 UTC,"Very similar scenario to me! When I told people, they thought I was crazy. ""You just weren't on that strong of a dose."" Yeah right. It's most definitely not a panacea, but I will prefer it to most other Rx's I've been on."
ChronicPain,3djhbc,ErisGrey,1 point,Fri Jul 17 04:03:10 2015 UTC,"I would LOVE to be able to try medical marijuana. Instead of the 6 different pills I'm currently on. That are known to affect the liver, kidneys, etc.  If only the lawmakers would get their heads out of their asses and listen to medical professionals."
ChronicPain,3djhbc,netbich,1 point,Fri Jul 17 14:17:33 2015 UTC,I have discovered that opiates don't really help my actual pain level. I think they just put me in a euphoric state that lets me mentally handle it better. I would so prefer mmj. Florida is stupid...
ChronicPain,3djhbc,Dalekette,0,Fri Jul 17 04:10:07 2015 UTC,"Also, scientists have discovered that dinosaurs are extinct."
ChronicPain,3djhbc,LitiG8tR,5,Fri Jul 17 14:52:08 2015 UTC,Marijuana and opium have been used by people for hundreds of years without government regulation or interference.   Which drug do you think is known historically to have greater use and efficacy against pain worldwide?
ChronicPain,3djhbc,philnoir,2,Fri Jul 17 00:05:52 2015 UTC,"Your question is not very clear, do you mean between marijuana and opium? Can you answer it for me because I'm curious to hear what your follow up would have been : )."
ChronicPain,3djhbc,kryptobs2000,2,Fri Jul 17 02:19:32 2015 UTC,"With my questions, I wanted to eliminate our social bias against either of these plants -- the hemp plant, and the opium poppy. Consider a world where we don't regulate what can and cannot enter our bodies.  Opium has been used since prehistoric times. Evidence exists for its use as a pain reliever and ""heart warmer"" in the Mediterranean civilizations c. 1100 BCE. The Greeks used a mixture of hemlock and opium to put people to death.  Laudanum, a tincture of opium and alcohol was used to treat pain and a number of other conditions in Europe as early as the middle ages.  Morphine was isolated from opium in 1804 and has been since then, the drug of choice for moderate to severe pain.  Cannabis has been used for an equally long time for relaxation, sleep, and spiritual purposes. Yet, some people do achieve some amount of analgesia from smoking reefer. We get a similar result with some of the minor tranquilizers -- people experience pain relief from their sedating properties.  Modern research shows that certain cannabinoids are opioid sparing, and there may be other medical uses of grass. These two plants can be used together in the treatment of pain in a way that is safer than the use of opioids with benzodiazepenes.   Those frightening, addictive, society threatening opioids have always been and are still the best medication for analgesia, especially for the relief of moderate to severe pain.  Both of these plants are gifts from God.  Our nervous system is activated by both marijuana and opium. The human body contains both  neuroreceptors for the medicinal use of compounds derived from both plants, and itself manufactures endogenous compounds that mimic the effect of these substances.   Only in the late 19th century did these substances become regulated and outlawed. The English, looking for a source of cheap labor, outlawed the use of opium in China. In the US, legislation against psychoactive substances began in the first decade of the 20th century, when American industry needed a cheap source of labor.   Who knew that Coca Cola contained cocaine until 1906. Many health tonics available in the 19th century contained a mixture of opium and cocaine.  All the fuss about addiction and abuse are symptoms of modern society. Most of the harm that is derived from either pot or opioids comes from the legal consequences of breaking the law. Would opioid addiction be a problem if there were no laws preventing its open purchase?  Would people die from heroin overdose if pure heroin (diacetylmorphine) could be purchased from your local 7-11? It is only our drug laws that create artificial heroin like China White that contains fentanyl, a synthetic that is 200 times as powerful as morphine.  Now, look at what's happened in Colorado since Mary Jane became legal in 2014. Crime is down and many of the alarmist warnings about the decay of society have been proven false.   Have I've turned this post into a call for the legalization of medicinal substances?  You bet your sweet ass I have."
ChronicPain,3djhbc,philnoir,2,Fri Jul 17 07:34:39 2015 UTC,"I wish clapping was more easily portrayed on Reddit!!   I have had a lot of opioid drugs and smoked (both CND oil and straight up plant). With one I'm almost ok but I don't feel balanced. A small bit of opioid and a small bit of MJ and it's the most perfect feeling my poor arthritic body ever has. But thanks to new drug laws here I am unlikely to get a Fentanyl script any time soon (allergic to everything but morphine and fent :( ) and I live in a state where smoking is illegal and very much prosecuted. It's a not fun experience being 24, using a cane, missing out on birthdays and weddings because of exhaustion...it needs to be legalized. It all needs to be decriminalizes at the very least. Don't make it 20 years in jail for me to function on the most basic human levels."
ChronicPain,3djhbc,rizahsevri,2,Fri Jul 17 12:52:33 2015 UTC,"Also want to point out that Portugal legalized all drugs and is treating addiction as the medical problem it is, and drug abuse is plummeting.  It is the only way to win the war on drugs."
ChronicPain,3djhbc,xsunxspotsx,2,Sun Jul 19 23:48:07 2015 UTC,"For me there is no comparison. I completely believe marijuana should be legal and can help many. But I need opiates. First of all, I can't work on marijuana. Opiates are painkillers many can function normally on and they are much more effective. I am out of opiates but have a bag in my drawer right next to me. I don't reach for it because it honestly doesn't help me much at all. I think we need both legalization of marijuana and less restricted use of opiates in pain patients."
ChronicPain,3djhbc,probably_a_bitch,1 point,Sat Jul 18 23:38:58 2015 UTC,I am curious on how well it would help my neuropathy.
ChronicPain,3dl8kb,netbich,2,Fri Jul 17 04:25:48 2015 UTC,Maybe tell her a few things that she can help with that don't cross the line with you. Just a thought.
ChronicPain,3dl8kb,tim1967,4,Fri Jul 17 04:56:14 2015 UTC,"I did tell her if she really wanted to help me, ask what things I'd like help with. Apparently this is up to her as well. In her world I have no say."
ChronicPain,3dl8kb,xbrand2,2,Fri Jul 17 06:09:33 2015 UTC,"In your world you need to reclaim your house key and anything else which gives her access to private spaces (get car keys, change gate combinations/security codes/online passwords)."
ChronicPain,3dl8kb,xbrand2,2,Fri Jul 17 09:17:15 2015 UTC,"We're going to have a talk tomorrow. Hopefully she will understand my point of view. If not, the locks will be changed."
ChronicPain,3dl8kb,tim1967,1 point,Fri Jul 17 14:01:22 2015 UTC,Sounds like a good plan.
ChronicPain,3dl8kb,tim1967,2,Fri Jul 17 16:32:32 2015 UTC,I just sent her a text saying we need to talk face to face not via text.  We're going to have a sit down discussion tomorrow.  If you could think of that P word I would appreciate it. I'll be going over what I want to say in my head all day.
ChronicPain,3dl8kb,tim1967,1 point,Fri Jul 17 14:00:36 2015 UTC,I think i was trying to think of patronizing but... i'm not sure...yes deeming is good!!
ChronicPain,3dl8kb,tim1967,2,Fri Jul 17 17:36:42 2015 UTC,Good for you it sounds like you did the very best you can. And you are correct that nobody who has not been there will ever completely understand. That is a really healthy thing to come to terms with. I told you about my mother earlier doing the same thing. I forgot to mention she is also a chronic pain patient so she I think came to see things from my perspective a bit quicker when I had to tell her to stop doing such things.  I hope your mom can come to a place of acceptance. In the end she doesn't have to completely understand -- she needs to accept your privacy.
ChronicPain,3dl8kb,ninja_wifey,1 point,Sun Jul 19 16:45:59 2015 UTC,"I have dealt with this she sounds like my mom. And I am 49! And I also have my own place etc. Great person and good intention but often would cross way over the line. Enter my place without asking to do things like you describe. clean or whatever, etc. I had to sit my Mom down, and explain what it makes me feel like when she does this. I had to do this a few times. But she never does that anymore, ever, and I think now, after some time. She even understands. I hope you can get through to your mom too. It really is not acceptable. There is word that is not coming to me at the moment that describes how this can make one feel.... Starts with a P... Oh well if i remember I will tell you.  It may take some time but you need to be firm on this. It only will get worse if you let her continue. But yes be calm. :) good luck!"
ChronicPain,3dl8kb,ninja_wifey,2,Fri Jul 17 04:54:26 2015 UTC,"Is pissed? Lol.... but seriously, I know I have to let the anger I'm feeling now subside before I talk to her.  I also foster animals and I have an elderly cat right now that I'm keeping in the spare room because she doesn't like my cats. She belongs to a veteran who's in the hospital right now.  I mentioned that I was thinking of fostering a kitten too. I usually have kittens that are too young for adoption. And she says ""No"" I don't know when our relationship transitioned into me being a child again. The ironic thing is that my brother says shit like this to her and she hates it. We definitely need to talk before this attitude becomes a serious problem. Or rather more serious."
ChronicPain,3dl8kb,ninja_wifey,1 point,Fri Jul 17 05:06:25 2015 UTC,"Oh I foster animals too that is great. Yeah this sounds sorta of a toxic situation. Whatever makes her feel that she has a right to do this stuff, she needs to get over that. You may have to set some really harsh rules, like remove her access to your place unless invited. I hope that she just listens and accepts it.  OR hey if that doesn't work go in her house and rearrange everything! "" I was just helping mom!"" lol no don't do that. Just kidding. It really doesn't feel good when people invade our lives like that, especially parents. It is demeaning. And they also take away our ability to things in our time and get that good feeling when you finally do. I got furious when my mom did this. I had to calm down too. Let me know how it goes!"
ChronicPain,3dl8kb,DragonToothGarden,2,Fri Jul 17 05:17:30 2015 UTC,"Demeaning is the perfect word, also violated. We will definitely be having a talk this weekend."
ChronicPain,3dkgwi,Powerlift30,3,Fri Jul 17 00:15:38 2015 UTC,Hey there! Sorry about your pain. I have herniated discs in my cervical spine but when I was in physical therapy they always told me my exercises shouldn't hurt while I'm doing them. They told me specifically to tell them if something hurts so we could try something else. Is it while you are doing the rowing and stuff that it hurts or is it just after you're done?
ChronicPain,3dkgwi,Sarahtaha,1 point,Fri Jul 17 02:44:56 2015 UTC,"It hurts during and it lingers a bit (pain to a much lesser degree) when Im done. Honestly the pain during the exercises is very minimal. Im more concerned on the days after I do the therapy. Right now, it seems like my symptoms are getting worse on my off-days but Ive only been doing this PT for a week. Shes saying that most likely the muscles and ligaments will adapt and the pain will subside soon.  By the way, can I ask how you are doing now and how long it took you to get there?"
