ChronicPain,3dbupi,rainbow_butterfly,2,Wed Jul 15 20:31:01 2015 UTC,"Hey there! I've had Botox treatment for spasms in my jaw and nerve pain. So that's my scalp, jaw, neck, behind my ears, forehead, and trapezius muscles. I found it worked well but couldn't continue because it wasn't covered for me.  It will feel funny. Not a bad feeling, more of a neutral feeling (after the injections). I found that my facial muscles didn't move right after, but that's really what Botox does. You can try and move with all your might, and it'll feel like you're moving it but it only responds a fraction, kind of like if a limb falls asleep and doesn't move quit right.  Good luck to you, I hope this end up being a good solution for you"
ChronicPain,3d9194,SoftApricot,12,Tue Jul 14 13:18:39 2015 UTC,Then he wrote me my script for dilaudid and valium. Strong meds for a soft tissue injury. I told him I was suicidal and he just wrote it on paper and did and said nothing else.   This is what I would consider unethical behavior worthy of a malpractice claim.  Edit; YOU have nothing to be embarrassed about. It's this quack who should be embarrassed.
ChronicPain,3d9194,netbich,2,Tue Jul 14 13:36:49 2015 UTC,I wouldn't even know how to go about it. I just feel so crappy.
ChronicPain,3d9194,sushisay,5,Wed Jul 15 06:45:40 2015 UTC,"I know it wasn't your intention, but your post brought me to tears.  I'm so sorry you're having it so rough.  I can relate, of course.  Your doctor is an ass, to say the least.  I'm sure if there was a way to switch, you would, right?  I would hate to give you any useless advice because I hate getting useless advice and people give it to me all the time.    What is an embarrassment is that we got this issue shoved down our throats:  chronic pain.  Not just pain, but the kind of pain that makes us question our will to stay here in this life.  When I reach that level of frustration, I just try to focus on the love I have for my family.  For me, the pain started later in life though (8 1/2 years now of chronic daily fucking migraines) so I do have kids and a husband, but with that comes a great deal of guilt...it's hard to take care of anyone and that, essentially is my role...I'm the caretaker and I definitely am embarrassed when there's no food the house and my husband has come home from an exhausting day of busting his ass at work and the kids are hungry but I just can't possibly do a thing about it.    So even though our situations differ, you can become a toddler any time in life.  ;)  But as I mentioned earlier, we are not the embarrassment...it's this fucking lot in life we were handed that is the shameful thing.  Nobody chooses this kind of life.    I really do hope you get the automatic car.  You know, things do change in life sometimes.  I'm not going to sit here and tell you that you'll get it one day, but it is a possibility.  If you do get a different car, then maybe you can get one that has these sensors on the side that tell you if there's a car in your blindspot.  It's a really useful feature for those of us who struggle with turning our heads.    I really hope you get that DSP payment.  How long before you find out?    Hey, please know you're not a failure because if you are, then a lot of really good people who are suffering would be considered failures too.  Does that make sense?  I struggle with making sense because my head hurts too much.    For me, the mornings are the worst usually.  I wake up and am already in agony so it takes a few hours to just come to terms with it.    Finally, is there anyone you can talk to about being suicidal?  If you feel like a failure, please don't.  Your post means a lot to me because I feel so alone with my troubles.  I do think that our chronic pain should be our job because it takes a lot of effort to live this way...much more effort than any normal job requires, that's for sure."
ChronicPain,3d9194,sushisay,2,Tue Jul 14 13:50:39 2015 UTC,"I'm sorry if this upset you :( It wasn't my intention.   I am going to get a new doctor. I have been thinking about it for awhile, the only reason I stayed with this guy is because I have been his patient for 15 years (off and on, I first visited him 15 years ago). He is also very quick to hand out the scripts I need. I'd hate to go to a new clinic and be denied anything that will help me.   Having said that, I think his complete lack of interest or care outweighs the benefit of script writing. My friend has a doctor she really likes and I will be trying them. I will just have to take the risk and hope that they will be able to help me instead of throw pills at me.   I try to focus on things that make me happy, or moreso things I have responsibility for. I have a dog. She is the only thing keeping me here. It would be pretty cruel to have adopted her and then left her. I stay for her.   I have never heard of cars with sensors on them on the sides. That's cool. The one I looked at has very big mirrors. I can get away with only moving minimally. I'm glad you understand thestruggle to move the head issue though. Most people think I am insane.I have no lack of function or flexibility, my neck is actually really flexible. The issue is that it effing hurts to turn it, especially multiple times or quickly. Grocery shopping is exhausting.    Hey, please know you're not a failure because if you are, then a lot of really good people who are suffering would be considered failures too. Does that make sense?   I would never think anyone else is a failure because of this. We are always the harshest on ourselves, I guess.   I do have a psychologist, but we don't really talk about it. Maybe part of me is afraid what will happen if I admit it. Will they commit me? I have visited someone in a mental institution before and it was awful. We have talked about me feeling worthless, but there isn't really quick fix for it."
ChronicPain,3d9194,automatedcrumpet,1 point,Wed Jul 15 06:55:02 2015 UTC,"Don't be sorry.  If we can't be honest with complete strangers, then who can we be honest with? ;)  I just searched on Google and you can actually purchase car blind spot detectors.  I'm not sure how effective they are compared to the ones that are already on the car.  I know the new Subaru Outback has this feature.    I'm not sure about shrinks and their policy on suicidal ideation (btw, I don't like the term ideation when it's next to the word suicide).  Perhaps you can ask here on reddit.    Dogs are so incredible.  I'm so glad you have your dog and that you adopted her is even better.    Glad you're going to a new doctor.  You can always go back to the old one if you get desperate for scripts (we call them prescriptions here, so I'm guessing you're in England?).    I was going to say something else but now I've forgotten.  I think all these years of chronic daily migraines have left me with a worse memory...but it could just be that I'm getting old.  Oh and yeah, not only can't I turn my neck but just walking, I have to be so careful with how I step on the ground.  If I don't walk very carefully, my pain can go from a 6 or 7 to an 8 or 9, which is very different...although sometimes it can get that bad for no apparent reason.  A few weeks ago, my mother in law was visiting and when she gave me a kiss on the cheek, she bumped my head a bit too hard (nothing any normal person would notice at all) and I was in agony for many weeks and I hated my life more than ever.  Now I don't let anyone kiss me on the cheek unless they promise to do it very gently.  So yeah, I can relate to people thinking I must be crazy.  The only reason they don't completely thing I've lost my mind is that I have an abnormal MRI which shows my migraine on it.    Have you heard of myofacial release?  Someone here on reddit chronic pain suggested it.  It's a type of massage that can help with chronic pain.  I don't know if you can get it or if it would even help but it's one thing I haven't tried and am hoping to try one day.    Actually, I just remembered something I wanted to say.  My husband's friend was in a mental institution.  It was horrible and I was very angry at the way things were in there and I was glad once he got out of there but then a week later, he hanged himself and now I wish he had stayed there longer because even though it wasn't a great set up, maybe it would have helped him somehow.  I don't even know what I'm trying to say but I want you to find more to live for than just your dog.  It's none of my business, of course, but I do care.    I hope I'm not driving you crazy with this jumbled post but can you do your grocery shopping online?  I know we have that option here and it could save you some pain."
ChronicPain,3d9194,rizahsevri,3,Wed Jul 15 14:58:02 2015 UTC,"Hello   I can't really help but I am also going through the frustration of being 27 with nothing to show for it apart from a body that doesn't want to work. If you need to vent, please message me."
ChronicPain,3d9194,netbich,1 point,Tue Jul 14 16:27:18 2015 UTC,Thank you. It is so frustrating :(
ChronicPain,3d9194,rizahsevri,4,Wed Jul 15 07:05:00 2015 UTC,"I know what you mean. I'm 24 and haven't worked since 19. Even the state agreed I was so sick and put me on disability. Now I face the judgement of, ""well when are you going to get off disability and contribute""...well I'd love to do that, but I can't even walk to my couch without help in the mornings.  On the doc front, new one if possible. He sounds like a money hungry crack who lost his care for patients years ago. Find a health care team all around the listens to you. It's worth it. I went from doctors trying to commit me because they assumed it was in my head and years later I'm still trying to remind myself that I'm sane, there is a physical cause.   I see everyone moving on with their next steps in life and I feel stuck and inside this pain flare I feel depressed to a new level about it. I don't know how to deal yet, but I do know you aren't alone being lost and embarrassed! ((hugs))"
ChronicPain,3d9194,kryptobs2000,5,Tue Jul 14 13:41:35 2015 UTC,"On the flip side of your situation.. I am in my 50's - I should be thinking about retirement. My so called ""Golden Years""  Instead I'm working 10 - 14 hour shifts trying to save enough for my next surgery. I can't live on what disability would pay me, not to mention it takes most people at least 2 years to start collecting it. And because I've been working with the pain, I'm going to have a hard time convincing them that I can't work. And I have to work in order to keep my insurance.  I feel really bad for the young people with chronic pain. I am always hearing that they won't give you the meds you need because they don't want you to get addicted. The entire system sucks for all of us."
ChronicPain,3d9194,netvoyer,2,Tue Jul 14 13:49:44 2015 UTC,"I managed SSI first time applying with no attorney. I haven't heard of that happening before or since in my state, average is 3rd appeal. It was then I realized how much I would have to face so young. I am on SSDI now, survivor benefits. I'll only get 75% of what my father would have gotten of retirement because I was ""lucky"" to become disabled ""young enough"" to qualify for it when he passed. But I'll never have income higher than part of retirement, it's a rough outlook so young.   I had one doctor who wouldn't do anything but toss medications at it and my pharmacy gave hell filling it. I'm weary myself of medications. I know my illnesses are degenerative and I don't want the tolerance, addiction aside if they don't work one day I'm totally out of luck.  Good luck on the surgery and I'll keep you in my thoughts in the coming weeks!!"
ChronicPain,3d9194,kryptobs2000,2,Tue Jul 14 14:06:42 2015 UTC,"I'm young (24 when this started), I never asked for pain meds or anything and yet I've been treated more often than not like it's in my head to the point that drs have done the least possible, did not encourage me to make follow up appointments, didn't call back with test results, etc, I very much got the impression they were simply trying to get rid of me. I just wanted to know what was wrong with me. That went on for months until I was out of money, gave up and not long after lost my insurance (Yes, I spent all of my savings, about $2000, with insurance). If I just wanted opiates I could get them a lot cheaper and with less hassle, fuck.  It's now 4 years later and I don't even have a diagnosis. I have an appt with a rheumy which I had to shell out 250$ just for them to schedule the damn thing, I can't help but feel like I'm throwing my money away, but I don't know what to do, I'm at the end of my rope. I might just use the last of it to end my pain for good."
ChronicPain,3d9194,netvoyer,1 point,Tue Jul 14 16:23:01 2015 UTC,"I really hope you don't give up. All life is precious, but I very much understand the Desiree to end it. It's a struggle because I also understand people who chose death with dignity. Before that though can you sign up for Medicaid or the affordable care act insurance or anything like that?"
ChronicPain,3d9194,kryptobs2000,2,Tue Jul 14 20:15:40 2015 UTC,"I'm trying to. My biggest reason for wanting to give up right now is that I don't believe there's anything they can do. I think the most realistic treatment, perhaps only, is symptom management with opiates. I'm sure I can get them, but I really don't think they'll help much which basically leaves me with no options. I've applied for medicaid (or is it care?) about a month ago, but I have not gotten a call or any kind of follow up on my application."
ChronicPain,3d9194,rainbow_butterfly,1 point,Tue Jul 14 20:32:11 2015 UTC,"My experience with, I don't know which it is lol in California it's medical. Medicare sounds good, is it takes a while. Call them up like once a week until you get a case worker then call him or her up until they get sick of you to make sure they push your file through quicker. Even if it's only symptom relief through opioid, it's better than constant pain. I don't know, it's tough. It's a crappy deck we've been dealt, and we have to figure out the best kind of life we can lead with what we have. I wish I had something Very Smart to say, because when ever I've needed advice, someone usually has been there for me with Wise Words that have helped me out but I am lacking in this regard.  If you need to vent or anything I'm very open to listening and you can pm me to chat if you'd like."
ChronicPain,3d9194,rainbow_butterfly,2,Wed Jul 15 00:33:04 2015 UTC,"Hey, thanks for the support, I will friend you in case I do need someone to talk to. I'm not exactly suicidal fwiw, I'm not constantly depressed or anything, but I just can't imagine another 10 years of this. I'm not even 30 and I feel worse than most... 80 year olds lol. God, how will I feel if I actually make it to old age? I just think one day it's going to get to the point where I'm just so disabled and it takes so much effort to do menial things that I'll have to consider if it's worth living : /.   I don't tend to dwell on it per say, but it has made me turn away from people and things. I was planning to get a dog awhile back for instance, I was pretty excited about it for awhile, but then I decided against it knowing it would be with me for 10+ years and I may not make it that long. Same thing with a girlfriend, I've taken myself out of the dating pool for about a year now for the same reasons. It's a tough choice.   On the one hand I know those things will help keep me going, but on the other it's just more work in the case of a dog, and it's already hard to do basic things. In regard to a girl I feel like I'd be a burden and in regards to both it's just more holding me back if I did decide to go one day it would not be fair on them. I dunno, it's been a year now since I made that decision and I haven't wanted to do it, I've still got at least a few years I think if not more, and most of my relationships don't even last that long lol."
ChronicPain,3d9194,manaolana,1 point,Wed Jul 15 00:55:50 2015 UTC,"Ah yes, the contribution to society. I started work at 15, as soon as the law let me. At 17 I was working full time in an office (I was much younger than everyone else in my graduating class). When I had my accident, I was finishing my bachelors degree in psychology (which makes me laugh) and was getting ready for my next degree. Now, the highlight of my week is being able to wash my hair. I spend all day watching Netflix, to the point that I get anxiety if I have to do anything else.   A friend of mine has a doctor she really likes, so I will be going to see them. It's a daunting thought, but it needs to be done. I guess I'm also worried that they will just say,oh, haha, there's nothing wrong with you.   ((hugs)) to you too. Thanks for replying."
ChronicPain,3d9194,xsunxspotsx,2,Wed Jul 15 06:59:17 2015 UTC,"I know these feels. I'm 24, and I've suffered 3 years. God, does being here suck. I've lost almost everything. It's surreal. I keep waiting to wake up from the nightmare. But your doctor is an utter shitwad and has done you a massive disservice. Have you looked into meds for longterm nerve pain management and/or spinal cord stimulation? Don't give up until you've tried everything."
ChronicPain,3d9194,cubeitshmuck,2,Tue Jul 14 16:14:48 2015 UTC,"It really does suck. I have nightmares at night about dinosaurs and scary things, and then I wake up and things are still shit. Those are the worst days, it's like there's no relief.   I was on Lyrica, and  I think it did help with the pain (why would he give me lyrica for soft tissue damage???) but it didn't help at all with my depression or the size of my ass. I was also given a script for gabapentin but have been reluctant to try it given my experience with Lyrica. At the time it also wasn't as bad, I am now in near constant flare up.   A friend has a TENS machine they are willing to lend me if they can find it, I should ask again. Sometimes it's just easier to sit in bed and cry than get up and face all these things. I am happy to fight for anyone else, but when it comes to fighting for myself, my brain decides its break time and leaves me stranded."
ChronicPain,3d9194,LittleKitchenWitch,1 point,Wed Jul 15 07:03:07 2015 UTC,"Ugh, Lyrica. I refuse to take it or Gabapentin. They aren't the only possibilities. SNRIs are used to treat nerve pain, too, and they can help with your depression. I really liked Savella, but it gave me urinary retention that required me to take another medication to make my bladder contract. I actually lost a ton of weight on it. There's also Cymbalta and a few others."
ChronicPain,3d9194,upandalive,2,Wed Jul 15 15:20:59 2015 UTC,"My heart goes out to you and all the young people on here. I hope you can get a better doctor to do the diagnosis and paperwork correctly for you.  I hope you also find something that you can do while you are suffering with this condition, something that will give your days purpose.  Also /u/netbitch is so correct: You have nothing to do be embarrassed about!"
ChronicPain,3d9194,piugattuk,1 point,Tue Jul 14 16:24:46 2015 UTC,"Thank you.   I tried to contribute to a facebook page that does subtitles of youtube videos, but even that was a challenge. I am unreliable, as much as I absolutely hate it. Then I would get anxiety about not doing as much work as others, which turned into a rabbit in the headlights fear instead of motivating me to do more work."
ChronicPain,3d6ohk,Esmeisme,5,Mon Jul 13 23:08:05 2015 UTC,"While I don't have any recommendations for you (I'm also trying to get my hands on some high CBD low THC stuff), I've found that eating it instead of smoking really helps cut down on the 'high' and paranoia. I'm in Canada where MMJ is legal, but access isn't great and fairly expensive.  I don't know how you've been taking it, but I make oil (with coconut oil) and I've been given butter. Use those to make some baked goods (peanut butter cookies seems to have the best flavour, but I haven't experimented too much), and eat a bit at a time. It takes about 20-30 min to get into your system that way, but I prefer it because I don't get high unless I eat too much.  Would you mind letting us know how things go, if you can find a good strain or two?   Oh yes, I do remember reading about some oils that were being sold in places where MMJ isn't legal. It was marketed as CBD oil (I think), but it was basically a scam. I will see if I can find any of the articles."
ChronicPain,3d6ohk,Nymphetamean,4,Mon Jul 13 23:51:24 2015 UTC,"Ah yes, the 'CBD oils' are made from hemp and don't have high enough levels of CBD to be theraputic.  Discussing CBD vs THC, also talks about not being legal to sell CBD oil online http://www.cbdfarm.org/cbd-oil-for-sale.html  Doctors talking about 'CBD oil' and why it doesn't work, along with a link to the FDA, warning against it.  http://www.drugpolicy.org/blog/are-websites-claim-ship-cbd-oil-non-medical-marijuana-states-legit  Finally, High Times talking about hemp oil and CBD strains http://www.hightimes.com/read/difference-between-hemp-oil-and-high-cbd-strains"
ChronicPain,3d6ohk,Nymphetamean,3,Mon Jul 13 23:58:40 2015 UTC,I know several families who have their children on Charlotte's Web for complex seizures and it's making phenomenal changes to their lives....
ChronicPain,3d6ohk,47attemptslater,2,Tue Jul 14 00:27:55 2015 UTC,"There is a strain of MMJ called Charlottes Web and it's supposed to be excellent at helping folks with seizures as well as other medical conditions.  There are companies selling help oil, which doesn't have enough CBD in it to be therapeutic, who are using the name (because it's well known) to sell a product that doesn't work.   If people can get Charlotte's Web MJ, that's awesome! But the poster was asking both about it and about the 'CBD oil' that is sold online - which is hemp oil and ineffective.  Sorry I wasn't more clear."
ChronicPain,3d6ohk,Nymphetamean,1 point,Tue Jul 14 00:35:42 2015 UTC,"Oh ok, I get it. Thanks for clearing it up."
ChronicPain,3d6ohk,47attemptslater,1 point,Tue Jul 14 01:39:12 2015 UTC,"Charlotte's web does come in an oil though, and it's produced by the same man who cultivated that strain. Most children using it for seizures take the oil."
ChronicPain,3d6ohk,There-Wolf,3,Tue Jul 14 08:39:40 2015 UTC,"Thanks! I was specifically wondering about this http://cwbotanicals.com/charlottes-web-hemp-oil-products.html?mode=list ...made by the people who created the Charlotte's Web strain. But it's really expensive, and I can't understand how they can sell it online.   I was doing a little Googling and looking around on Reddit and found this, which listed some of the high CBD strains.  http://www.medicalseeds.com/cbd-high-strains.html  I'm just not sure how many dispensaries carry them.   Nymphetamean, I really don't have access to much pot. I'm on the older side, and I don't know many people my age who smoke it anymore (or at least admit that they do). I don't get enough or have access to enough to be experimenting. :)  I had a bad experience the last time I tried it. Initially it helped with my pain. But then I smoked it one time and I felt like it made it worse...but I think I got really paranoid and that contributed.   I might have my hopes too high. Valium really helps me--with anxiety but also the muscle relaxer helps with with the nerve pain somehow. But I have a limited supply of valium and don't want to build up a tolerance."
ChronicPain,3d6ohk,ErisGrey,3,Tue Jul 14 00:57:10 2015 UTC,"Charlottes Web is some of the best CBD stuff you can get for pain. There are many knock-offs of the stuff out there so you need to be careful. /r/CBD has a lot of great advice if you are interested in pursuing that option. I personally switched to high cbd strains I grow for myself in California.   Every year there are different strains with different levels of THC and CBD. Smoking isn't always required. You can make edibles, make capsules, concentrates. There are a dozen different ways, most all are better than smoking for health reasons. I personally grow CBD Shark, which runs equal levels of THC and CBD. I've tried higher CBD strains such as Harley Quinn but couldn't find breeders or seeds to grow myself.   Most collectives in mmj states should have the cannabis broken down by type. Unfortunately you will only really ever have 2 choices on the type of really high CBD strains they carry at one time.   I've never shopped from medicalseeds.com, so I can't vouch for them. However, those prices seem super inflated. I add to my seed bank twice a year, always buying some top genetics/cup winners. Purchasing 16 seeds, plus 17 free seeds I got for frequent shopper/bonus buys, for only $154 counting stealth shipping.   There are so many strains and breeders around the world, you can find something equally effective for less than half the price if you shop around."
ChronicPain,3d6ohk,WhiskeyHeart,3,Tue Jul 14 05:19:12 2015 UTC,Refer to /r/medicalmarijuana. Lots of really good information and experienced people there regarding different strains for different kinds of pain releif.
ChronicPain,3d6ohk,wildgreengirl,2,Tue Jul 14 00:52:47 2015 UTC,"/r/eldertrees is a good place for discussion too. I smoke but its not covered here or very accessible in MN.....migraines and back pain. What I can find is better than nothing I guess, but medical would be great to try."
ChronicPain,3d6ohk,rainbow_butterfly,2,Tue Jul 14 03:27:34 2015 UTC,"Herijuana. I had it in Colorado in 2012, so I have no idea if it'll be the same, but it actually felt like heroin."
ChronicPain,3d6ohk,summerofsin,3,Tue Jul 14 04:50:40 2015 UTC,I'd smoke that.
