ChronicPain,3dwb9l,bugmom,6,Mon Jul 20 03:52:12 2015 UTC,"Sorry - my reaction is not so positive.  The problem I have is that there are many of us with chronic conditions that cannot be cured and that leave us in constant pain but we frequently get lumped under the term ""chronic pain""  Chronic pain is often defined as ""any pain lasting more than 12 weeks. Whereas acute pain is a normal sensation that alerts us to possible injury, chronic pain is very different. Chronic pain persists—often for months or even longer.""  However, in a disease like Rheumatoid arthritis, my pain really is acute pain - the finger joints that are screaming in pain as I type this ARE being damaged, right now, this very moment.  They are swollen, red, inflamed, and let me repeat, being damaged.  I know this and my doctor knows this from the MRI's we use to follow their ongoing deterioration.  However, because it is a lifelong condition, it gets thrown in under the term ""chronic pain.""  A great attitude, exercising more, eating the right berries will not stop the ongoing damage or the constant acute pain associated with it.  And there are many other conditions that fall into this category.  The condition is chronic but the pain is acute but since it goes on for years they call it chronic.  Articles like the one you wrote do a disservice to people like us because they cause others to think our pain isn't real or it could simply be ""cured"" if we just worked harder at it.  I work very hard at living the best life I can, every day.  I also work very hard just to walk across the room.  Hell, some days I work very hard just to be able to shower.  And my two knee replacements have me pretty convinced that the pain I had before them, bone on bone pain due to horrible deterioration, well that pain was not in my head."
ChronicPain,3dwb9l,eimhir,1 point,Mon Jul 20 15:40:15 2015 UTC,Well said! I totally agree.
ChronicPain,3dwb9l,kifferella,0,Mon Jul 20 18:17:04 2015 UTC,"That's a perspective I certainly haven't looked at in enough detail before. Thank you for that. However, I disagree that a good attitude is not important even if pain is the result from a damaging condition.   I recognize that there is no finish line when it comes to this stuff. But a negative mindset will do a person more harm over the course of ones life than a positive one.   I'll have the go over my wording again because the last thing I want to do is give an impression that the pain is not real. All I'm trying to draw attention to is that some people add to their real pain with unnecessary psychological pain. I know my pain was real, but I also know that some of my behavior was self sabotaging. I'm not talking about being cured, or that pain is illusory. Just that pain wrecks havoc on the mind, and then it interferes with our ability to help ourselves achieve a better quality of life, whatever that means for each person. I hope that clears up what my intent was.   My goal is to reduce suffering, and this is a tricky area to talk about. I'd love to keep this dialogue open if you don't mind."
ChronicPain,3dwb9l,Imightbenormal,2,Tue Jul 21 00:52:05 2015 UTC,"I appreciate the additional clarity!  And yes, I agree that mindset can make a huge difference.  It certainly has for me.   It's just that so many of us are out here, our bodies hopelessly deteriorating, living daily with unrelenting pain.  And we are surrounded by people (including many in the medical field who are supposed to be helping us) who cannot fathom what our lives are like, who think because they cannot see our conditions (funny, you don't look sick,) or they believe we are drug seeking, or just lazy slackers, and those people jump at the ""you can make yourself feel better"" aspect as proof of those beliefs.  I realize it's not what you set out to do but I long for a way for those people to understand the hell in which we exist -- not because I'm loving my pain but because we long for a little empathy.  A positive attitude can absolutely help me walk across the room or get me through the day but it only takes a second for one of those people and their judgmental attitude to remind me of the reality of it."
ChronicPain,3dxx65,NorthsideB,2,Mon Jul 20 13:09:26 2015 UTC,"I go to the Rush Pain clinic. The wait can sometimes be long, but I've found the doctors open-minded and professional. It's nice for me because my other docs are at Rush, so they can communicate with each other easily."
ChronicPain,3dxx65,shrimpsmalls,2,Mon Jul 20 13:30:20 2015 UTC,Do you see Lubenow? I've seen him a few times which we talked about Ketamine .
ChronicPain,3dxx65,Halt_I_Am_Ragnar,1 point,Mon Jul 20 14:37:39 2015 UTC,"For pain or depression?  Ive heard it do some amazing things for depression, but not so much for on going pain issues?"
ChronicPain,3dxx65,MrOtsKrad,2,Mon Jul 20 14:55:57 2015 UTC,"Probably not for your issues from what your flair says, but for neuropathic pain which are the root of my problems (allegedly)...it is pretty proven. Side effects aren't even bad with the use of a benzo during infusions. I've had oral administration (liquid) and also ket based cream for my body. Both haven't done shit so I won't be pursuing it. Just the MMJ that I have the card for. I won't go too much into that as I already did in a previous post. I also can't stop talking about it.   I'm just so anxious, living like this is just the worst. We can all agree on that."
ChronicPain,3dxx65,Halt_I_Am_Ragnar,2,Mon Jul 20 15:03:06 2015 UTC,"PM me for a list if you'd like. I know a lot in the suburbs, I've been to a serious amount of docs.  Otherwise, I went to RIC for their pain program and I was really disappointed and it was a terrible experience on the whole. All the good doctors have left, my old psychologist worked there for twenty years and he quit because he saw that shit coming.  Loyola and UIC aren't bad really at all. Go to Northwestern med, try with Dr. Walega if you can. He's rude but he knows his shit. Be prepared to have your entire medical record with you.  In Milwaukee, Froedtert is a very good school.  I have been to docs who studied there.  Don't go to Illinois Bone and Joint . unless you have those issues I guess. They have tons of rheumatologists though, I'd recommend them for that department.  I'll tell you more if you'd like, message me ."
ChronicPain,3dxx65,Halt_I_Am_Ragnar,2,Mon Jul 20 14:36:57 2015 UTC,"Thanks, I will be in touch"
ChronicPain,3dxx65,PlayingWithWildFire,1 point,Mon Jul 20 15:48:02 2015 UTC,"I started going to Premier Pain Clinic just this summer. They have locations in the rubs and downtown (downtown is the location where I've been going.) I see Dr. Patel. I've only went a couple of times as I'm new to pain management, but so far the doc has been understanding & helpful. He prescribed some drugs, one of which gave me pretty ad side effects - so I quit taking that script & when I went back I explained & now we're trying a combination of different meds until something works."
ChronicPain,3dxx65,conversesap,1 point,Mon Jul 20 15:58:51 2015 UTC,"I see Dr. Victoria Brander at Northwestern and I am really impressed by her. I've never had a doctor take the time to sit down and get to know me like she did. She and her PA are very involved and like to keep up with how you're doing. She's really helped me with my pain management and to establish a better baseline. Also, she is in a great network and makes wonderful referrals based on what you need. The PT she sent me to has been phenomenal. I greatly recommend her."
ChronicPain,3dxx65,nurse_kiki,1 point,Mon Jul 20 17:06:00 2015 UTC,Northwestern is a good start since all my other docs are thru Northshore.
ChronicPain,3dxx65,PopWhatMagnitude,1 point,Tue Jul 21 00:15:39 2015 UTC,"I second Rush. It is a haul from the northside but worth it. I see Dr Jaycox and he has been spectacular. I saw him after my surgeons for my hip thought the amount of pain I was still having 12 weeks post-op was weird and fake. Dr Jaycox confirmed I wasn't crazy that I still had pain and explained that even pain a year out is normal especially since I went 8 months without a diagnosis and was on Norco the entire time.  He actually worked with me, had a plan of other pain medication management if the current medicine I was taking wasn't working.  He was not afraid to prescribe the dose that I need which is quite high. He also gave me a few refill which nobody has ever done. Gave me hope and relief I hadn't had in a year or with any other pain doctor."
ChronicPain,3dwwnz,VidenTheColdOne,5,Mon Jul 20 05:19:56 2015 UTC,I have had the same experience in my foot and I am also on gabapentin. In my situation when I try to sleep my foot feels like an oven and little gnomes are stabbing it with the swords you get in a drink. I have found lidocaine gel pretty helpful at calming it down to the point I can at least sleep. It may not be affective if you need it for your whole lower body though :/
ChronicPain,3dwwnz,unclepierre,1 point,Mon Jul 20 05:31:56 2015 UTC,"Afaik with gabapenton the doses have to be huge beige you see any real effect. My mom took doses of like 2600/3200 or so before seeing an effect.   Also, cortisone shots? I get them in my spine to help the horrific nerve pain I get down my buttock ad leg. Works for about 8-12 months at a time if done correctly."
ChronicPain,3dwwnz,47attemptslater,2,Mon Jul 20 06:08:07 2015 UTC,"I have been having horrible neuropathy in my feet and legs, even with Lyrica (another drug involving gaba) and it was still getting worse.   Just found out my Vitamin B12 extremely low and it being at this level could cause the nerve damage to be permanent. It may be worth having your doctor check it and trying a basic OTC supplement for it."
ChronicPain,3dwwnz,rizahsevri,2,Mon Jul 20 11:33:59 2015 UTC,"I take Nucynta, it helps with nerve pain, though it is an opioid."
ChronicPain,3dwwnz,FailedTech,1 point,Mon Jul 20 14:41:07 2015 UTC,"This may sound crazy but right after my surgery when the nerve pain was so bad I couldn't even put on a pair of shoes I would duct tape and ice pack to my foot before going to bed. The cold numbed the burning/stabbing sensation so I could at least get a few hrs of sleep.   I tried all sorts of supplements like b12, co enzyme Q10, alpha lipoid acid, etc. but none of those made any difference for me."
ChronicPain,3dx0n9,just_me_29,3,Mon Jul 20 06:07:43 2015 UTC,"The exchange varies by state, as do the plans. You HAVE to read the literature on the plans to see what is covered and know what you will be expected to pay. If you need help, you can call and they can assist you - some states even have exchange sites where you can go in.  Here's an example of my current plan sheet: http://docdro.id/hmiZlIv  They'll all look similar to that - they're standardized for a reason. HMOs are cheaper than PPOs in general, however they usually have a more limited network of doctors and often require you to select a PCP. The HMO will then only cover specialist visits if you have a referral from your PCP.  For example, re bloodwork with my plan - it says once my deductible is met, I'm only responsible for 10% of the bill. Up until my $1500 deductible though, I'll pay the prorated UHC rate for them. I just switched from a PPO to an HMO because I've been out of work for a year and need to save money.   You just really need to research your plan before you commit to it. You can call them directly to ask as well. Also, ask your doctors which insurances they accept (and let them know you'll be getting an ACA plan - my doctor took Aetna for example, so I made sure that's what I got, and when I tried to go in - NOPE, just kidding!! Not ACA Aetna! :|)"
ChronicPain,3dx0n9,lbsmith5,1 point,Mon Jul 20 06:47:49 2015 UTC,"As long as I can physically afford it, I plan on using a PPO. I have heard a lot of bad stories about the hurdles of HMO's. I read almost the entire benefit booklets for the 2 I was looking at, and called the company to verify providers that were covered. I am doing a cost analysis if it can save me money, because I do not make much per year anyway. Healthcare is expensive.  I called BCBS, w/ my current plan info. They explained what their network system is, and what it would be if I bought the plan. They then looked up the providers for me. I am pretty sure it is what I need. It is only for a few months until open enrollment though.  What I have to make sure: PT and Lab tests are covered. The lab bill to insurance on Average for a comprehensive gc/ms UDS from PM doctor is $4000.  I can't afford a HDHP, I would go broke."
ChronicPain,3dx0n9,lbsmith5,2,Mon Jul 20 23:00:41 2015 UTC,"Definitely get a PPO. My best experiences have been with PPOs. I was on HDHPs for many years through work before ACA, and it was a horrible experience. I only recently switched to a HMO because I'm having some money issues right now (getting divorced, out of work). I have a bunch of interviews lined up and made sure they all had great benefits, haha. Healthcare is SO expensive - my PPO was almost $400 a month, my HMO is just over $300. But I knew what I needed to be covered."
ChronicPain,3dx0n9,workerdaemon,1 point,Tue Jul 21 03:21:41 2015 UTC,"I am getting a PPO. The other ones available actually had less benefits for close to the same price. I am sorry you are going through all of those issues right now, it has to be tough. Thank you for the knowledge though. Yes, healthcare is very expensive. I hope things improve and get brighter for you!  Now I just have to decide vision and dental..... At least those aren't as complicated as Health."
ChronicPain,3dx0n9,Halt_I_Am_Ragnar,3,Tue Jul 21 04:41:45 2015 UTC,"The trap I fell in is that there is a difference between the ACA and non-ACA version of an insurance. For example, it's not just BlueShield -- it's ACA BlueShield.   If you want to make absolutely sure the new insurance is accepted, call and ask specifically if the Healthcare Exchange version is covered.   I was fucked over royally with this. Spent $550/mo on a plan that no one could accept because no one had any contracts with that version yet. I had to pay all my doctor visits and proceedures out of pocket."
ChronicPain,3dwfyg,endergrrl,1 point,Mon Jul 20 02:36:29 2015 UTC,"I've never done this, but I am considering stopping all my narcotic pain meds about 1 month before my decompression/fusion surgery. Of course I will ask my surgeon first. But I'm scared to death that the post surgery meds will be ineffective. I've had a prior back surgery and it was the worst pain I'd ever had."
ChronicPain,3dwfyg,netbich,1 point,Mon Jul 20 03:01:43 2015 UTC,"What are they decompressing/fusing? Have you talked to your surgeon about your pain anxiety? I take 10 mg Oxycontin with 5 oxy for breakthrough and .25-1.0 mg Xanax for pain-related anxiety. I've been able to stay at the same level for years by taking ""holidays"".  But, I had a DVT last year: my leg was so swollen and painful they had to temporarily put me on a morphine pump and then I dosed down to 40 mg, 20 mg then back to 10. You may need to have temporarily increased pain relief and you shouldn't have to suffer for a month."
ChronicPain,3dwfyg,netbich,1 point,Mon Jul 20 20:38:46 2015 UTC,"The surgery will be at the L4/L5 level (I am assuming)  I don't have a surgeon yet, but when I get the referral I have a long list of questions for him. As for the pain management, I see the pain doctor next week. I have been working a lot of overtime (35 hours last pay period) and my pain level has really increased.  I'm going to ask for something to help with this. I hesitate to ask for anything specific because that is a good way to get labeled as a drug seeker."
ChronicPain,3dwfyg,netbich,1 point,Mon Jul 20 22:25:49 2015 UTC,"I recently went from ocycodone 10mg to Oxycontin, same dosage. She also gave me 5mg oxycodone for breakthrough. I didn't ask for it. I just told the doctor that my current meds weren't keeping me at a level at which I could function (we talked pretty extensively about what I meant by ""functioning"") and I needed better coverage and help for extra bad days. She filled in the rest.   Edit: she is actually the same doctor who gave me the pump when I was in the hospital. She knows me and understood that when I said I needed serious help, I wasn't fucking around."
ChronicPain,3dwfyg,someone_fishy,1 point,Mon Jul 20 23:46:45 2015 UTC,I've only seen this pain doctor one time. I hope he's as understanding as yours.
ChronicPain,3dwfyg,Smgth,1 point,Tue Jul 21 02:59:49 2015 UTC,"I'm in the process of changing my pain meds for just this reason. The OxyContin is losing its potency and I was in the process of changing to palexia.   Unfortunately the palexia had no effect so I stopped it, I still have another month before my next appointment so maybe cutting back for a few days may help me until then."
ChronicPain,3dv619,ucncdcecrcwcecacr,1 point,Sun Jul 19 19:57:04 2015 UTC,"I understand the absolute frustration of not knowing what's wrong with you. I think I'm three years on without an explanation for the various types of pain that have cropped up. The rheumatologist said I definitely have arthritis, but it's idiopathic and there was nothing he could do for me. I've seen so many other specialists, to no avail, and I know I still should get checked out by a neurologist for the nerve pain, and someone for the muscle pain. So many tests, so many disappointments.  I hope you find an answer that comes with a reasonable solution. I'm grateful that I'd been forced to go into business for myself after I was laid off in 2009 because I can work from my bed using my laptop. (That's what I'm doing right now.) I have other complicating factors like CFS that are more debilitating than the pain, though. I'm actually kind of lucky that the pain isn't the worst of my troubles, after reading how many people in this sub live each day.   I'd like to thank you for being a nurse, because nurses are so often overworked and underappreciated, and we were blessed with a wonderful nursing team when my dad finally succumbed to cancer last year. I hope you find relief both so you can continue the good work that you do and so that you can have some peace."
ChronicPain,3dv619,WELLinTHIShouse,1 point,Sun Jul 19 20:30:35 2015 UTC,"I've been there. I'm 20 years in, and still no definitive diagnosis. All the tests come up inconclusive, but the pain is real. It has cost me many, many relationships, and many ambitions. But I'm still here, still fighting, because it's either fight or give up and even in the worst pit of depression I somehow still want to find a way through this personal hell. Know that you're not alone, that if you keep fighting you may find better treatments and learn how to live through the pain to still find meaning in life. I nearly gave up after my pain contributed to the end of my marriage, but I fought my way through it, and years later found love again. I hope you can find the strength within you to find your way through this."
ChronicPain,3dv619,fipfapflipflap,1 point,Sun Jul 19 20:42:00 2015 UTC,"Physiotherapist checking in here. It sucks when you are trying to help/treat people & you look worse than they do. I had patients trying to pick things I had dropped up for me because they thought I needed the help more.  You are not alone & I am sending hugs over the Internet. Do you happen to work in a hospital, or with physios at all? You may be able to ask one nicely just to have a look & you can let them know why you are concerned about officially going to physio. If I worked with you & knew how long you had been dealing with it & why you couldn't go to a physio I would never have minded trying to help."
ChronicPain,3dv619,ninja_wifey,1 point,Sun Jul 19 23:53:50 2015 UTC,I wonder if its a better idea to wait for the MRI first instead of going straight into a physio?  Reading this I feel very fortunate that MRI here is readily available.
ChronicPain,3dv619,standinside,2,Mon Jul 20 06:06:48 2015 UTC,"I get where you're coming from, but my self management techniques aren't enough at the moment so I need something to tide me over until my MRI. I'm lucky it's available, and that it's covered by my health insurance too !"
ChronicPain,3dv619,ninja_wifey,1 point,Mon Jul 20 20:49:39 2015 UTC,"Also, a good physio should be able to assess fully so at least they don't do more damage & should be able to treat without an MRI, unless there is something they believe needs to be cleared by a scan first (then hopefully they can bump you up the list).They should also then be able to say if your MRI results correlate with your symptoms or not.  You can have things show up on MRI that are not the problem & are not causing any problems."
ChronicPain,3dv619,ninja_wifey,1 point,Mon Jul 20 21:52:58 2015 UTC,"I've been to a physiotherapist through work (four months ago) which was free, but useless - It really did nothing for me. They went straight to strengthening exercises without working on resolving the pain first.  I then saw my own physio privately and I responded well to his treatment but I have regressed in the last 2-3 weeks again.   We have a neurophysiotherapist at work but to be honest she's a bit useless herself.. I have asked for her advice but every time I do she just hmmms a bit and says since she's not a musculoskeletal physio she can't really say much. Ugh. A pain. :("
ChronicPain,3dt6h2,vanessaspagnol,4,Sun Jul 19 05:26:21 2015 UTC,"Filled this out for you. Hope it helps. No option for constant on the time question, so the 20000 minutes I stuck in is unfortunately accurate."
ChronicPain,3dt6h2,Sheps11,4,Sun Jul 19 06:21:27 2015 UTC,"Ha. Fellow constant headache sufferer here. I calculated 14 days x 24 hours x 60 minutes = 20,160 minutes. So sorry to hear you're going through this as well. Have you found any good coping strategies? I'm still kind of drowning."
ChronicPain,3dt6h2,rewards_program,1 point,Sun Jul 19 15:27:24 2015 UTC,"I mostly try to just keep myself in as good a health as possible, and not to let the headache get in the way of general day to day goings on. Stubbornness probably helps a little there too. My GP probably gets sick of me pitching possible causes to him whenever I have to visit, but I'm unfortunately yet to find out why I'm stuck with it."
ChronicPain,3dt6h2,Sheps11,1 point,Mon Jul 20 08:26:20 2015 UTC,I get the same feeling from my doctors when I come in with a list of possibilities to rule out. But my pain is so bad I can't work or do any of my usual hobbies. So my new hobby is trying to cure my headache. :) When I try to do normal activities (like spending a few hours with my niece the other day) I end up curled up in bed crying for hours afterwards. So I won't stop looking for answers no matter how annoyed my doctors get with me! Someone has to be looking out for me because they sure the hell aren't.
ChronicPain,3dt6h2,rewards_program,2,Mon Jul 20 16:08:40 2015 UTC,"Do you experience headaches on more than 15 days per month? As part of my master of clinical psychology thesis, I am aiming to investigate causes of chronic headache pain as there is limited research in this area. With your help there is potential to improve our understanding of chronic headaches in order to develop better preventions and treatments. If you have 8-10 minutes to spare, please complete my anonymous online survey.  Please note that if you choose to provide your email, it is not connected with your answers. It is never exported from the survey system together with other answers. Email addresses will be used to inform you of the study's results once the study is complete. They will not be shared with anyone else, and will be deleted after the study is complete."
ChronicPain,3dt6h2,avitar35,1 point,Sun Jul 19 05:26:31 2015 UTC,Hopefully this is x-posted to /r/migraine
ChronicPain,3dsn6h,rewards_program,5,Sun Jul 19 01:52:55 2015 UTC,"It depends on the day for me. Mostly I have loads. My pain doesn't diminish anyone else's pain or suffering. Other times I'll get grumpy over people complaining about minor everyday stuff. In my head, not out loud.   Occasionally people are tactless like my colleague who was told she couldn't dance for 8 weeks following her sprained ankle. At this point I hadn't been able to dance in 4 or 5 years & unlikely to be able to ever again. I was very sympathetic but I definitely wasn't feeling the empathy that day.   You know those people who have nothing else to do except complain about nothing? I don't have much energy for those people anymore.   But for people who are genuinely having a hard time, I still have all the empathy in the world."
ChronicPain,3dsn6h,printerclips,4,Sun Jul 19 08:59:12 2015 UTC,"I think (some) people want to feel empathy. I don't think they are capable of understanding something on this level the same way I'm not capable of understanding what a rape victim feels or what it's like to grow up in a war zone. You can attempt empathy, but sometimes it's not possible.  Then there are people who don't even try. Those are the people that make life more complicated."
