Deathmetal,3e4ch4,Sikthty,3,Tue Jul 21 21:23:19 2015 UTC,Would anyone be interested in a sub for metal showerthoughts?
Deathmetal,3e4ch4,SweetBrotato14,-3,Wed Jul 22 11:54:01 2015 UTC,they don't have to make a new album they already made the greatest death metal album that is and will ever be.
Deathmetal,3e4ch4,CptJimbo,6,Tue Jul 21 23:24:22 2015 UTC,"That's your opinion and you're entitled to it, but you're wrong"
Deathmetal,3e4ch4,Injineered,1 point,Wed Jul 22 03:50:28 2015 UTC,I don't think any album ever can claim that title because there isn't any objective way of judging music in a way that can be agreed upon by everybody.
Deathmetal,3e4ch4,Metal_Malachy,1 point,Wed Jul 22 04:19:12 2015 UTC,"Cryptopsy's None So Vile is an immediate contender. Odious Mortem's Cryptic Implosion, as well, for me. I'd definitely put Epitaph in the top 10. Number 1 is tough, but I really want to give it to Pierced from Within."
Deathmetal,3e4ch4,iamkoloss,1 point,Wed Jul 22 12:23:09 2015 UTC,"Pierced From Within is definitely one of my favourite tech-death albums, but I don't know if I could ever call it the number one best death metal album of all time."
Deathmetal,3e4ch4,Metal_Malachy,1 point,Wed Jul 22 12:31:45 2015 UTC,I'm a sucker for Death - The Sound of Perseverance
Deathmetal,3e3rou,ConnellCorpse,2,Tue Jul 21 18:59:37 2015 UTC,"Again, just not looking for feedback on the fact it's midi.  Thanks for all the feedback on icon of Sin guys! i'll make sure to keep my feedback posts about equal with the actual death metal bands I like to post on here!"
Deathmetal,3e3rou,Ozwegian,1 point,Tue Jul 21 19:00:27 2015 UTC,"Sounds awesome mate, great headbanging material. It sounds like what should be played first at a concert to get the audience revved up when you make it big."
Deathmetal,3e3rou,Greybard_the_ent,2,Tue Jul 21 20:04:21 2015 UTC,Thanks man! I'm glad you enjoyed it! I'll forward that idea to the band about this being a good opening song!
Deathmetal,3e3rou,Greybard_the_ent,1 point,Wed Jul 22 05:28:37 2015 UTC,"Sounds too much like electronic music to me and i think it sounds a little empty with ought vocals (unless thats what youre going for). That being said, I think it (and you) has a lot of potential. Keep up the good work! Would love to hear more of your stuff in the future."
Deathmetal,3e0ur8,YoloSwag4Jesus420fgt,3,Tue Jul 21 02:22:49 2015 UTC,"Props to them for finding their shtick and nailing it, but this first album was such an awesome blend of their Hour of Penance roots with a wall of sound element that would become symphonic."
Deathmetal,3e20yc,AlsvartrKhaos,1 point,Tue Jul 21 10:14:11 2015 UTC,zombies....
Deathmetal,3dzlzj,flytrap666,1 point,Mon Jul 20 20:36:24 2015 UTC,wasn't this the first band to use consistently screamed vocals? talk about making history!
Deathmetal,3dzlzj,FlyingFuckasaur,1 point,Tue Jul 21 03:03:59 2015 UTC,"Depends on your definition of harsh vocals, Venom, Kreator, and Possessed did it first, but Death was perhaps a bit more harsh than any of those."
Deathmetal,3dzlzj,ian92293,1 point,Tue Jul 21 05:43:55 2015 UTC,I actually listened to this on the way to work this morning. Rock on!
Deathmetal,3e2kdl,iWumbo_uWumbo,1 point,Tue Jul 21 13:48:42 2015 UTC,"TL;DR: A fucking awesome death metal version of a popular buddhist scripture.  Adding a little context here from what I know. The song was originally arranged by a vocaloid producer called Utsu-P off the album TRAUMATIC. The guys in the video (who I assume to be internet musicians on the Japanese video site, nicovideo) covered the song. Utsu-P is the bass player in the Giraffe mask. Here's a link to the original vocaloid arrangement  The lyrics are all taken from a popular buddhist scripture called the heart sutra. I don't pretend to know what exactly the lyrics mean, but from what I gather it states the doctrine of emptiness (lack of inherent meaning in all things) that is a foundation of Mahayana buddhism.     Here is an english translation of the lyrics"
Deathmetal,3dx9hj,Captain_Man,1 point,Mon Jul 20 08:07:14 2015 UTC,Gotta rep those local bands
Deathmetal,3dx9hj,Jonny_Be_Good,1 point,Mon Jul 20 08:07:31 2015 UTC,Thanks for the upload dude! It's the vocalist here ☺
Deathmetal,3dx419,ConnellCorpse,1 point,Mon Jul 20 06:51:06 2015 UTC,"Not looking for feedback on: The fact that the sound quality isn't great, and the fact that the instruments are midi. This is just how we write our demos since we do not have a way of recording them at the moment."
Deathmetal,3dx419,crissdecacanoir,1 point,Mon Jul 20 06:53:26 2015 UTC,"Another thing, we are a thrash/death metal band. Heavily influenced by early and some newer thrash metal, along with classic DM acts."
Deathmetal,3dx419,Kill_The_Christian,1 point,Mon Jul 20 10:42:50 2015 UTC,I find it cool !
Deathmetal,3dx419,Kill_The_Christian,1 point,Mon Jul 20 12:57:51 2015 UTC,Thanks man! What about it do you find cool?
Deathmetal,3drrt4,DjItchyNipples,7,Sat Jul 18 20:52:03 2015 UTC,Please submit some decent content to /r/metalmemes
Deathmetal,3drrt4,Metal_Malachy,6,Sat Jul 18 23:55:02 2015 UTC,The girth of his neck never ceases to frighten and amaze me.
Deathmetal,3drrt4,Spedmonger,1 point,Sun Jul 19 13:12:06 2015 UTC,he's a walking thumb with a face
Deathmetal,3drrt4,Captain_Man,3,Mon Jul 20 01:13:57 2015 UTC,I cvm memes
Deathmetal,3drrt4,flytrap666,4,Sun Jul 19 03:50:54 2015 UTC,"I'm a bot, bleep, bloop. Someone has linked to this thread from another place on reddit:   [/r/metaljerk] More top tier metal memes   If you follow any of the above links, please respect the rules of reddit and don't vote in the other threads. (Info / Contact)"
Deathmetal,3dp1pw,cheesecakerice,1 point,Sat Jul 18 02:13:01 2015 UTC,Fucking love it! Gets me in the mood instantly
Deathmetal,3dlh4o,FancyTea,4,Fri Jul 17 06:02:16 2015 UTC,MUDDY AS FUCK. The tone is slightly similar to stoner/doom metal.
Deathmetal,3dlh4o,StormMFeel,2,Fri Jul 17 14:57:56 2015 UTC,There's definitely some doom thrown into the mix; it's goddamn awesome.
Deathmetal,3dlh4o,oGRE3,1 point,Fri Jul 17 16:56:02 2015 UTC,I can hear some Sleep - Dopesmoker in that guitar. Damn
Deathmetal,3dj925,hamieli,1 point,Thu Jul 16 18:41:31 2015 UTC,Sounds like Obituary I like it.
Deathmetal,3dj925,membranesymphony,1 point,Fri Jul 17 03:21:19 2015 UTC,"Uh, I said Uh!   Oh dear."
Deathmetal,3dhs61,StormMFeel,2,Thu Jul 16 11:24:59 2015 UTC,One of my favorite OSDM albums of all time.
Deathmetal,3dajby,deadkennedysrock,40,Tue Jul 14 19:48:22 2015 UTC,finish high school move out of the south
Deathmetal,3dajby,PlumbTheDerps,3,Tue Jul 14 21:27:56 2015 UTC,"Actually I live in Washington. My family though, is from Tennessee."
Deathmetal,3dajby,AveLucifer,9,Wed Jul 15 19:49:50 2015 UTC,"As a Satanist, I am nothing like you and proud to be this way. I like my earlobes intact, and hate Trivium."
Deathmetal,3dajby,flytrap666,-2,Wed Jul 15 11:55:48 2015 UTC,"My friend is a Satanist, (he says, but I've yet to see proof) and he is exactly what you'd (well not you exactly, but people) think. Except he doesn't make it widely known. He introduced me to death metal, e wears all black all the time, he's in a death metal band, and he loves talking about Satan."
Deathmetal,3dajby,TotesMessenger,5,Wed Jul 15 19:38:51 2015 UTC,Being Pagan's more metal. Trust me.
Deathmetal,3dajby,Crith_Angel,-1,Wed Jul 15 19:40:58 2015 UTC,"My other friend, who got me to like Beyond Creation, his family is from Sweden. He is Pagan and he also likes the band Tyr. Yeah, he is the most metal guy I know."
Deathmetal,3dajby,Narian,7,Wed Jul 15 19:44:08 2015 UTC,"I'm a bot, bleep, bloop. Someone has linked to this thread from another place on reddit:   [/r/metaljerk] Hovv to cvre spookyness?   If you follow any of the above links, please respect the rules of reddit and don't vote in the other threads. (Info / Contact)"
Deathmetal,3dajby,Black_ValoR,14,Wed Jul 15 00:38:35 2015 UTC,I just tell them I'm a member of a satanic cult of rapists with a particular aptitude for bestiality and incest. They usually think I'm alright after that.
Deathmetal,3dajby,ukkoylijumala,2,Tue Jul 14 20:36:00 2015 UTC,Sounds good haha.
Deathmetal,3dajby,PhaiLLuRRe,6,Tue Jul 14 20:38:13 2015 UTC,"This is like trying to educate the idiots who think metal = ""kill your mother rape your daughter"" music. I have heard this exact same phrasing from multiple different people but I've yet to hear a song about that (I'm sure it exists) and this is what people think metal is all about.   They have no concept that metal has sub-genres - no concept about anything metal-related. Power metal? Tech death? Beatdown deathcore?   The best way to deal with them is to not play. You will never win. If you want to try then just start providing education and asking them questions about why they feel that way and what they believe Satanism to be. Put it on them."
Deathmetal,3dajby,highly_cyrus,11,Tue Jul 14 20:29:58 2015 UTC,You're probably thinking of Kill Your Mother Rape Your Dog by Dying Fetus  Edit: link for the uninitiated
Deathmetal,3dajby,finalgates,1 point,Tue Jul 14 20:32:45 2015 UTC,"Wow, he was right. Funny stuff, man."
Deathmetal,3dajby,TribeWars,5,Tue Jul 14 20:37:56 2015 UTC,"The best way to deal with them is to not play. You will never win. If you want to try then just start providing education and asking them questions about why they feel that way and what they believe Satanism to be. Put it on them.    I think this is the most sound advice you will get. Try to calmly educate them, if it doesn't seem to work, just leave it. If these people like you as a person, this shouldn't be a major concern anyway."
Deathmetal,3dajby,h3lme7,1 point,Tue Jul 14 21:07:53 2015 UTC,"Ha thanks. The #2 annoying fucking question I get is ""Oh, so you listen to screamo?"" NO! I don't actually! I listen to metal! The thing about sub-genres is so true. They think it's all the same! I'm like, listen to Breaking Benjamin or Dragonforce, and tell me that's the same as Nirvana 2002 or Behemoth, and tell me it's the same as Tyr. Really. I think I will try to educate, but most people don't care."
Deathmetal,3dajby,Jazjustice,2,Tue Jul 14 20:35:12 2015 UTC,Just don't bother.
Deathmetal,3dajby,Plastonick,5,Tue Jul 14 23:45:44 2015 UTC,"""it's ok mom, I'm an atheist not a satanist"""
Deathmetal,3dajby,FancyTea,2,Wed Jul 15 11:47:06 2015 UTC,"My family is very, very Christian, and also black. I am black white and Mexican, so you wouldn't know it by looking at me, but my grandma and older generations grew up in Tennessee, and they would disown me. I am not even kidding. My aunt tried to baptize me when we went to the lake, because she heard my music and told me she was trying to ""force Mephistopholes out and send him packin'."""
Deathmetal,3dajby,DepositePirate,3,Wed Jul 15 19:41:17 2015 UTC,"I know it's difficult, because when you're 16, it matters what other people think, BUT... I came across a few ""real"" Satanists and all of them were really cool guys. So, if you're not a Christian, I wouldn't worry about it at all ;-). Just don't take it seriously and have fun. Satanism is kinda ridiculous anyway - and not much scary."
Deathmetal,3dajby,sullyj3,3,Tue Jul 14 22:11:22 2015 UTC,IMO the ideology seems pretty close to existentialism with being free to choose and whatnot. Definitely not scary.
Deathmetal,3dajby,ChefExcellence,1 point,Wed Jul 15 05:52:11 2015 UTC,"The Satanists I know are really cool, even to people who aren't into stuff like this and that."
Deathmetal,3dajby,Crosstitution,3,Wed Jul 15 19:48:40 2015 UTC,It doesn't matter.
Deathmetal,3dajby,Crosstitution,0,Tue Jul 14 22:27:53 2015 UTC,Yeah.
Deathmetal,3dajby,bongxlord666,3,Wed Jul 15 19:47:55 2015 UTC,"It's a reasonable conclusion to make given all the effort to appear Satanic/anti-Christian/anti-religion or whatever - in both the lyrical content and the artwork and the names the bands choose.  I think it's important to acknowledge that it's a valid conclusion for an outsider to make - if you want to have an intelligent conversation about it.  Now, ""why"" they do it and ""why"" you listen can be discussed and that can go in about any direction.  But it's not difficult to establish that it is artwork and there are subtle nuances that fans come to appreciate, much in the same way as fans of beer can taste differences others can't.  Some people may or may not have a personal conviction to one faith or another, but at the same time enjoy the apparent sport with which some bands try to ""out-evil"" one another.  I also like to point out that in today's world the monsters often don't look like monsters - they look like normal people and sometimes they look like clergy, teachers, dentists, and moralizing comedians.  Perhaps the point of the art is to show how people are aghast at the statement of evil, but are quick to rationalize or forgive it when people actually DO evil.  If you are sharing it, be prepared for the reactions and embrace the conversation that follows!"
Deathmetal,3dajby,bongxlord666,1 point,Wed Jul 15 00:00:29 2015 UTC,Well okay then. Thanks (I think).
Deathmetal,3dajby,Maledicte,3,Wed Jul 15 19:47:33 2015 UTC,"Tell them you've heard of the fairy tale of Cinderella but you've managed to grasp onto reality and don't believe in fairy godmothers or magic pumpkin carriages. So you'll probably not buy into satanism either.  Or hell, tell them you love your buddy Satan and want to engage in relations with him.  Or don't if you're from the south of the US. That might not be wise."
Deathmetal,3dajby,augoza,1 point,Wed Jul 15 00:45:37 2015 UTC,My family is from Tennessee. So.... yeah.
Deathmetal,3dajby,halfmanhalfpigbear,3,Wed Jul 15 19:42:17 2015 UTC,"I'm 19, and sorta had this problem from family when I was quite young.  I always compare my music to horror movies. It's all theatrics, a shtick, shock factor, just entertainment, that doesn't mean it neccesserily reflects your real world values.  You're at an age where many people won't understand. Many teenagers won't listen or try to understand. And those who won't or reject you or make fun of you aren't worth your time.  :)"
Deathmetal,3dajby,AveLucifer,0,Wed Jul 15 05:17:55 2015 UTC,True. Thanks for the smiley face.
Deathmetal,3dajby,Himbookoo,4,Wed Jul 15 19:41:47 2015 UTC,It's a waste of time trying to explain things to irrational people who believe in fairytales.
Deathmetal,3dajby,Himbookoo,1 point,Tue Jul 14 21:11:23 2015 UTC,Yes.
Deathmetal,3dajby,Himbookoo,2,Wed Jul 15 19:50:04 2015 UTC,"It doesn't really matter what idiots think. If it was your mother, say, it'd be different."
Deathmetal,3dapih,ImASharkImAShark,1 point,Tue Jul 14 20:30:42 2015 UTC,A Beethoven cover done in Death-Thrash Metal!
Deathmetal,3d8vut,FancyTea,2,Tue Jul 14 12:27:40 2015 UTC,thought this was a Nile song at first...not bad.
Deathmetal,3d8vut,joshteacha,2,Tue Jul 14 13:41:29 2015 UTC,Great album! Got their CD recently \m/
Deathmetal,3d8vut,meetra_surik,2,Wed Jul 15 02:55:31 2015 UTC,I'm gonna try and snag one myself soon. It's fucking fantastic.
Deathmetal,3d29ad,anawfullotoffalafel,1 point,Sun Jul 12 23:03:31 2015 UTC,"Admiring the syphilitic visage,  of the pustule ridden genitals that I adore   Oozing sebum and pus dribbling on the labia,   leaves me panting for more   Vaginal excrements fume and funk,   the stench of festering menstrual discharge   The wafting odor tortues my nasal passage,  the glistening cunt wet with blood   A crust ridden musty flap of lust suffering,   from severe dermatological disorder   The sanguined slit lined with papules,   And genital warts along its fleshy borders   Licking the sickening twat   The foul stench of the blistering crotch   Drinking the menstruated slop   Delight in each pustular drop   Passing blood clots   Eating crotch rot   Septic blood and pus   Consume the runny crust   Urine flows out of the slit   Piss washes over the clit   Taste the blood and piss   Nothing compares to this   My face fully buried within   The pubic mound of grime and warts   Voraciously lapping up excrements   Of every sordid type and nauseating sort   The atrocious nauseating odour,  proves too strong to resist in the end   The nauseating fumes overwhelm me,   as I vomit into the moist pungent gash   Regurgitate onto the cunt   Puke on the gore ridden slut   Drunk off the urine flow   I bathe in the afterglow"
Deathmetal,3d29ad,Crisp_Volunteer,1 point,Sun Jul 12 23:05:15 2015 UTC,Blocked overhere (netherlands). Copyright crap.
Deathmetal,3d29ad,Crisp_Volunteer,2,Mon Jul 13 17:39:51 2015 UTC,"Sucks. I just bought this album, its their re-recording and remastering of their first album gore metal. It's sooo good and sounds so much better than their old versions currently on YouTube. I threw up a few songs from it on YouTube."
Deathmetal,3d0b51,Wndwrt,1 point,Sun Jul 12 12:24:02 2015 UTC,Have to see this dude play.  I heard his strumming technique is insane!
Deathmetal,3cynax,Spiner202,2,Sat Jul 11 23:41:00 2015 UTC,I'm listening to the new album now and it really is brutal stuff. Krisiun is one of the few death metal bands that I feel is truly just mindless anger and aggression yet love. They offer up so many riffs that it's hard to deny. I think people are really going to dig this record.
Deathmetal,3cynax,Crisp_Volunteer,1 point,Sat Jul 11 23:41:37 2015 UTC,Love the solo at the end.
Deathmetal,3cxcpl,ImASharkImAShark,2,Sat Jul 11 16:48:20 2015 UTC,Damn I haven't really given their new stuff a full listen yet. Loved that intro
Deathmetal,3cxcpl,micmea1,2,Sat Jul 11 23:47:15 2015 UTC,Every music video need to be filmed like this this
