Economics,3e32gj,justcallcollect,60,Tue Jul 21 16:07:28 2015 UTC,"TL;DR: people that have a cash reserve to ensure they won't starve or be on the street can take the risks involved in starting a new company.  Well already knew it, this was more about quantifying the odds and coming up with evidence."
Economics,3e32gj,InFearn0,14,Tue Jul 21 16:27:23 2015 UTC,"Adds another point to the notion that 'self made men' don't really exist, or are at least extremely rare."
Economics,3e32gj,CunninghamsLawmaker,11,Tue Jul 21 17:11:24 2015 UTC,"Rare when coming from abject poverty, certainly. But it's quite a stretch to say a billionaire isn't self made because they came from a middle or upper-middle class family."
Economics,3e32gj,working_shibe,15,Tue Jul 21 18:12:41 2015 UTC,"It's still disparaging for the billionaire to call himself a 'self-made man' when telling those in poverty to take 'personal responsibility,' if he had family reserves to help his initial risk-taking."
Economics,3e32gj,annoyingstranger,7,Tue Jul 21 18:19:38 2015 UTC,"No billionaire or anybody should kick the poor while they're down. But neither will I listen to people who act like any billionaire ""didn't build that."""
Economics,3e32gj,working_shibe,0,Tue Jul 21 18:35:30 2015 UTC,I'm not sure I should be any more impressed with someone who started with a comfortable cushion and became a billionaire than with someone who started in poverty and built a cushion for their kids.
Economics,3e32gj,annoyingstranger,6,Tue Jul 21 18:41:31 2015 UTC,"Perhaps you should just judge people on their specific situation and successes, instead of attempting to generalize things."
Economics,3e32gj,catapultation,6,Tue Jul 21 18:45:28 2015 UTC,"Sure, but I'm a politician at heart, so forming more accurate generalizations seems more important than abandoning the idea that laws can be made to apply equally..."
Economics,3e32gj,annoyingstranger,3,Tue Jul 21 19:08:05 2015 UTC,You want laws to apply based on what impresses you more?  Remind me not to vote for you.
Economics,3e32gj,catapultation,1 point,Tue Jul 21 20:28:10 2015 UTC,"Neither am I, I'd definitely be extremely impressed with both."
Economics,3e32gj,working_shibe,1 point,Tue Jul 21 18:43:32 2015 UTC,"Good.  Now if we could get our politicians to acknowledge the same, we might be able to fix a few things."
Economics,3e32gj,annoyingstranger,6,Tue Jul 21 18:44:33 2015 UTC,"I'm not sure which politicians you're referring to. The same politicians who praise billionaires as job creators and entrepreneurs also praise those who lift themselves out of poverty. Your example was of the much hated ""bootstraps"" narrative."
Economics,3e32gj,working_shibe,8,Tue Jul 21 18:48:38 2015 UTC,"Well what other than the cost of an education, what's stopping you from being a self made man other than your negative attitude? You go to work, save up some money, invest it, pool it with others' and use it to start some kind of a project from which you can reap a profit and grow that slowly over time. It's risky, but what's to stop you from doing it? You make it seem as though accumulating wealth is some magic random even that happens instantaneously."
Economics,3e32gj,lead999x,5,Tue Jul 21 20:03:55 2015 UTC,I know both types intimately. It seems to me to be much more difficult on a personal level to overcome impoverished beginnings than to start upper-middle class and become mega-rich.
Economics,3dz22g,MELBOT87,246,Mon Jul 20 18:15:02 2015 UTC,"""Reliability"" Was the single biggest reason myself and my co-workers switched to Uber.  When your job requires weekly travel, getting to the airport ontime is a must. Cabbies consistently never showed to pick me up to get me to the airport. Or were so late (hours) that I missed my flight.  That costs a LOT of money to change around the itinerary.  Uber has never ""not showed"".  (This is Denver, cabbie experience I'm sure varies across the country.)"
Economics,3dz22g,digiphaze,86,Mon Jul 20 20:56:02 2015 UTC,Ran into cab no shows many times in Philly and DC. Fuck cab companies.
Economics,3dz22g,Robo-Mall-Cop,5,Mon Jul 20 21:36:34 2015 UTC,DC is the worst!
Economics,3dz22g,Sec_Hater,70,Tue Jul 21 02:46:35 2015 UTC,"100% Agreed. I would consistently call 2 or 3 cab companies to get picked up at the same time and cancel whoever didn't show up first. It sounds like a dick move, but cab company management did this to their employees by being inept. There was about a 50% success rate at cabs showing up even when I called 24 hours in advance. Screw them.  edit: I live about a mile from DC and there's no shortage of cabs."
Economics,3dz22g,bent_my_wookie,57,Mon Jul 20 23:09:24 2015 UTC,That's the cycle. Cabbies getting canceled on prompts them to pick up a guaranteed fare on the way to a pickup that gets canceled 2/3 times.   The app environment should break this bad cycle. Old cab companies just need to modernize.
Economics,3dz22g,fcn_fan,14,Tue Jul 21 00:28:35 2015 UTC,"Old cab companies just need to modernize.   Better if they'd just evaporate, honestly."
Economics,3dz22g,los_angeles,46,Tue Jul 21 00:48:38 2015 UTC,That wouldn't be better. It's always better to have competition. It makes the services better.
Economics,3dz22g,Leek5,19,Tue Jul 21 01:16:41 2015 UTC,"Oh there will be plenty of competition for this multi billion dollar industry. I just don't want it from violent, rude, entitled, progess-fearing taxi companies."
Economics,3dz22g,los_angeles,2,Tue Jul 21 01:18:58 2015 UTC,Violent?
Economics,3dz22g,Schoffleine,12,Tue Jul 21 05:02:41 2015 UTC,Paris and Mexico City come to mind.
Economics,3dz22g,thatmorrowguy,18,Tue Jul 21 05:25:44 2015 UTC,"I live in a small city and use Uber to go out on the weekends. They're a million times better than the local cab company. My round trip costs as much as a one way with the cab company. Trying to get one requires 10 minutes of automated crap on the phone and then cabs don't show up for like an hour. The only city I've been to whose cab service comes anywhere close is Minneapolis, as they were smart and released an Android app that makes the whole process the same as how Uber works. So, just anecdotally, the title of the study is exactly what I've experienced personally."
Economics,3dz22g,pr01etar1at,25,Tue Jul 21 01:06:14 2015 UTC,"Cabbies in my city would just pump some guy answering calls over their company radio (which may or may not be listened to in the cabs over music) and told everyone that called ""yes be there 10 to 15 mins"" and hoped some driver was nearby AND heard the call AND decided to take it. No backend to it, just a broadcast and a hope."
Economics,3dz22g,Propane,4,Mon Jul 20 23:50:10 2015 UTC,Wow - that is so fucked up.
Economics,3dz22g,kpurn6001,11,Tue Jul 21 14:38:19 2015 UTC,"American yellow cabs don't use smartphone apps yet?  I ask because where I live in Brazil cabs used to be as bad as you described (you would call a company and then half the time no one would show up, or it would show up 30 min late because he got another fare on his way). But the easy-taxi app (and now some other similar competitors) changed all that completely."
Economics,3dz22g,BadgerRush,5,Tue Jul 21 01:54:40 2015 UTC,Just because they use an app doesn't mean it'll get you a taxi there in time (or at all). Mine didn't.
Economics,3dz22g,Kowzorz,3,Tue Jul 21 05:29:41 2015 UTC,"But the good things about the using an app are:   Taxis closer to you have priority in accepting the fare, no more dishonest drivers accepting a fare from far away as a return fare and then leaving you waiting while they cross the whole city in their original fare. Since you can see the taxi movements on the map, you can clearly see if they are still moving away to finish another fare, then you can cancel that one and call for another. And the most important, you can clearly see if and when a cab accepted your fare (or not), and how long it will take him to arrive, this way you don't lose time waiting if nobody is coming, and can plan for contingencies.   I mean, using a smartphone doesn't fix all the problems with taxis (not even close), but just by extinguishing the dreadful ""waiting while not knowing if somebody is coming or not"" it made the taxi experience much much better."
Economics,3dz22g,BadgerRush,4,Tue Jul 21 13:06:58 2015 UTC,Live in the boondocks of San Francisco. Cannot get a cab to pick me up.
Economics,3dz22g,Zeppelin415,4,Tue Jul 21 00:35:57 2015 UTC,"How do the prices compare to taxis? I'm currently in Denver, and Uber wanted $43 to take me 4.4 miles straight down County Line."
Economics,3dz22g,MrDavidCrane,9,Tue Jul 21 00:43:37 2015 UTC,"UberX comes out about the same.  It seems Denver has a cap on the price Cabbies can charge to go downtown from the airport. 50 bucks.  (Probably because its so far out).  Though if you go outside of downtown, you get charged a lot.  UberX cost me about 35 from Stapleton to the Airport. Regular uber is like 55, but there are more of them around the airport so shorter wait."
Economics,3dz22g,digiphaze,2,Tue Jul 21 00:47:12 2015 UTC,Thank you. I had nothing to compare the prices I'd seen.
Economics,3dz22g,MrDavidCrane,6,Tue Jul 21 02:52:30 2015 UTC,"I've had a few no-show Ubers. It's very rare and I still use it all the time, just sayin."
Economics,3dz22g,youcanteatbullets,10,Tue Jul 21 00:21:45 2015 UTC,"The difference is you can see in the app that they're not coming for you, cancel, and order another one."
Economics,3dz22g,antonivs,5,Tue Jul 21 02:30:23 2015 UTC,"Ironically, in NYC, no-shows is the problem Uber is creating if you schedule ahead to avoid surges from bad weather or just rush hour."
Economics,3dz22g,ModernDemagogue2,5,Tue Jul 21 00:55:22 2015 UTC,I can't believe they world be hours late. They could have told you or cancelled!
Economics,3dz22g,cmVkZGl0,314,Mon Jul 20 22:43:42 2015 UTC,"Disclaimer:   Even though Uber had no control over our data analysis or interpretation, the fact that Uber paid for the study makes some skepticism about our results natural and proper. We will happily share our data and methods with other research teams for re-analysis and replication."
Economics,3dz22g,Zeppelin415,36,Mon Jul 20 18:15:33 2015 UTC,So did you see anything from the data and methods that makes this questionable?
Economics,3dz22g,ocamlmycaml,24,Mon Jul 20 20:05:21 2015 UTC,"They aggregate their statistics a lot, across samples collected in different neighborhoods. We could get a richer / more complex story if we break down some of those features."
Economics,3dz22g,Zeppelin415,3,Tue Jul 21 00:31:28 2015 UTC,You mean they didn't control for neighborhood picked up/dropped off?
Economics,3dz22g,ocamlmycaml,8,Tue Jul 21 00:33:42 2015 UTC,Most of the paper presents aggregated summary statistics. They crudely do neighborhood controls in Appendix C. I'm not familiar enough with LA to have an intuition on possible bias.
Economics,3dz22g,wonmean,3,Tue Jul 21 00:37:49 2015 UTC,Nose goes.
Economics,3dz22g,los_angeles,1 point,Mon Jul 20 23:08:39 2015 UTC,"So, no."
Economics,3dz22g,youcanteatbullets,3,Tue Jul 21 00:56:16 2015 UTC,"Might be a good intellectual exercise, figure out how they could rig the study without interfering with the data analysis. I'm sure a major cab company/union will have some words."
Economics,3dz22g,diogenesofthemidwest,132,Tue Jul 21 00:22:29 2015 UTC,"Unless the DOT wants to foot the bill, along with a mountain of complaints from vested interests like medallioned cabs, who else was going to pay for this study?"
Economics,3dz22g,JackleBee,88,Mon Jul 20 19:55:22 2015 UTC,"Universities pay for studies like this all the time. But, I see your point."
Economics,3dz22g,frozenbobo,14,Mon Jul 20 20:21:50 2015 UTC,University research is generally funded by grants from outside entities (like DOT or NSF in other cases) with only small amounts coming from the university accounts.
Economics,3dz22g,Unhelpful_Scientist,19,Tue Jul 21 01:49:18 2015 UTC,if Uber made the data available to professors the results could be verified.
Economics,3dz22g,spinlock,18,Mon Jul 20 23:00:00 2015 UTC,It didn't sound like Uber had the results (the researchers do) and they are available for analysis.
Economics,3dz22g,frausting,14,Mon Jul 20 23:53:08 2015 UTC,Those universities are usually funded by government agencies like the DOT.
Economics,3dz22g,Camellia_sinensis,2,Tue Jul 21 00:47:41 2015 UTC,Are universities funding the studies or is it grants that are given to the universities?
Economics,3dz22g,Grommmit,16,Tue Jul 21 01:17:07 2015 UTC,Market research groups?
Economics,3dz22g,threeseed,5,Mon Jul 20 20:37:56 2015 UTC,"Why is this being up voted ?  Do you really think every study has been sponsored by some vested interest ? Of course not.   Governments, think tanks, NGOs, consumer representative groups, science organisations, independent industry groups, universities etc pay for much of the research studies that get produced.   We should be very wary of any study directly sponsored by a company."
Economics,3dz22g,diogenesofthemidwest,16,Mon Jul 20 22:05:16 2015 UTC,"We should be very wary of any study directly sponsored by a company.   Wary. Yes. Undoubtedly.   We will happily share our data and methods with other research teams for re-analysis and replication.   I'm not really the data trolling type, but I'd love it if somebody else replicated this study and found differing results.   What one can do in the meantime to not look like a raving conspiracy theorist is at least post some concerns over the methodology instead of the automatic gainsaying of anything with a whiff of corporate finance."
Economics,3dz22g,antonivs,3,Mon Jul 20 22:36:50 2015 UTC,"I'm not really the data trolling type, but I'd love it if somebody else replicated this study and found differing results.   This is a case where you can easily replicate the results for yourself - just take the same trips a few times in Ubers and in cabs.  The ""half the price"" part is easy to verify, you'll see it on just about every trip.  As for time, I've never actually timed it, but pickup time is invariably much faster with Uber."
Economics,3dz22g,filologo,29,Tue Jul 21 02:41:19 2015 UTC,"I would say that most studies are sponsored by a vested interest, even in academia. Studies just don't happen unless there is a professor who is really interested in the results, or some grant money supplied by people who are really interested in the results.  Researchers constantly have to work on maintaining objectivity."
Economics,3dz22g,Dathadorne,6,Mon Jul 20 22:19:28 2015 UTC,Do you really think every study has been sponsored by some vested interest ? Of course not.   The comment doesn't say that at all. Put your pitchfork down. It's a curious person asking a question.
Economics,3dz22g,RotWeissRot,4,Tue Jul 21 00:33:51 2015 UTC,Would be interesting to see a comparison between large cities and smaller towns.
Economics,3dz22g,diomed3,7,Mon Jul 20 22:53:21 2015 UTC,"My experience with cabs in smaller towns are awful. I can't imagine Uber would be any worse, but I'm not saying they are any better either. Would be interesting to see."
Economics,3dz22g,antonivs,7,Tue Jul 21 00:00:30 2015 UTC,"Uber is much better, in my experience, in the areas where they have coverage. Also, the fact that you can watch your car coming to you in the app makes a big difference."
Economics,3dz22g,atl2ptown,254,Tue Jul 21 02:44:39 2015 UTC,I don't need a study for this. It's obvious to ANYONE who lives in a big city.
Economics,3dz22g,SD99FRC,140,Mon Jul 20 19:36:50 2015 UTC,"Yep. While I'm lucky enough to live in a fairly high traffic area with common destinations, it rarely takes more than 5-6 minutes for me to get picked up. When I'm lucky, the guy was waiting in the parking lot a couple blocks from my house and ""arrives"" as I'm walking out the door.   I fully agree with a lot of the grievances the cab companies have about Uber. They're not competing in a fair space. But most of the cab companies haven't done themselves any favors by not keeping up with technology and the generally mediocre service and experience they offer."
Economics,3dz22g,atl2ptown,110,Mon Jul 20 19:44:27 2015 UTC,"The only complaints cab companies have are the legacy costs of getting medallions and licenses. For all intents and purposes they serve no value in the marketplace anymore.  Their cars are worse, the service is poor, and the drivers make less while customers pay more.   My solution has been for cities to depreciate the cost of the medallions based on the original price, time owned and some average return per year, and then buy them back at that depreciated cost. Sure, it sucks for the city, but they are wrecking markets by trying to keep a dinosaur from going extinct."
Economics,3dz22g,mattinthecrown,17,Mon Jul 20 19:48:57 2015 UTC,"What city can afford that, though.  Consider Chicago, for example.  It's quite a fix.  The medallion system was utterly idiotic.  If they wanted to limit the number of cabs, it should have been on an annual basis, and the rents should have gone to the city.  Now everyone's fucked."
Economics,3dz22g,atl2ptown,9,Mon Jul 20 21:48:44 2015 UTC,It's better than remaining beholden to ancient technology just because. I'd even settle for some sort of state tax rebate period until it's paid back.
Economics,3dz22g,mattinthecrown,2,Mon Jul 20 22:10:56 2015 UTC,"Maybe so.  But no matter what, someone is going to feel some serious pain getting from here to there."
Economics,3dz22g,atl2ptown,4,Mon Jul 20 22:28:22 2015 UTC,"Yeah. That's why I like a depreciated cost of return paid via tax deductions going forward. Least pain to all, while letting the market thrive."
Economics,3dz22g,pzone,2,Mon Jul 20 23:51:28 2015 UTC,"If the city decides to end the medallion system, the medallions become worthless.  In other words, the city can set whatever price it likes to ""buy back"" the medallions.  They can choose a price that seems politically palatable."
Economics,3dz22g,SD99FRC,36,Tue Jul 21 06:41:13 2015 UTC,"Drivers making less is speculation given that a cab driver who doesn't own his own car also isn't paying the maintenance on that car, nor incurring the depreciation of the asset as the miles increase.  Though I agree that the end result needs to be a complete overhaul of the system for the cab companies, with some concessions coming from the licensing municipalities."
Economics,3dz22g,Yosarian2,21,Mon Jul 20 20:07:51 2015 UTC,"There was a study done a few months back showing that uber drivers make significantly more then cab drivers, even accounting for gas and maintenance.  http://techcrunch.com/2015/01/22/uber-study/  Of course, it's worth mentioning that that study was also partly funded by uber."
Economics,3dz22g,DarkRider23,12,Tue Jul 21 00:26:25 2015 UTC,"That study doesn't say that Uber drivers make more. It days that they only make more if Uber drivers costs don't exceed more than $6 per hour, which isn't a hard number to reach at all. According to the IRS, each mile put on a car puts $0.55 of wear on the car (some immediate, some long term). Assuming a conservative 20 MPH average for an Uber driver per hour gets the driver to $11 in costs per hour. Go conservative with the IRS number and use $0.25 and uber drivers make a tiny bit more than cab drivers."
Economics,3dz22g,fiskfisk,7,Tue Jul 21 04:04:59 2015 UTC,"Remember that IRS numbers are intended for averages for a whole sleeve of businesses, and does not necessarily represent an accurate cost when the amount of miles goes way up."
Economics,3dz22g,Turdsworth,4,Tue Jul 21 08:34:34 2015 UTC,"Yes! I'm New York most taxis get about 400,000 miles over a shorter lifespan than regular cars. They depreciate less per mile because they are driven so much."
Economics,3dz22g,nickik,9,Tue Jul 21 12:59:06 2015 UTC,"Institutional, free market economist have long understood that one time payoff to rent holder might be the best solution to replace goverment protected market with free markets. This is shitty but often easier to do then deal with the politcal fight.   This is something I would do as president, use the taxes to buy back the rights of politcal interest groupes.   I know that sounds shitty, and it is. But its the only way in many cases."
Economics,3dz22g,pyroxyze,4,Mon Jul 20 21:43:32 2015 UTC,Any real precedent to one-time payoffs to see how it has fared?
Economics,3dz22g,thatmorrowguy,4,Tue Jul 21 01:44:11 2015 UTC,"Eminent domain cases happen all the time for property.  The Fed has used reverse auctions to buy up bonds at the lowest price someone is willing to sell to them for.  My guess would be either the city and the taxi medallion holders come to an agreed upon price and wipes them all out at the same time, or the city sets up a reverse auction, and buys the lowest 10% of prices offered per year."
Economics,3dz22g,mrfocus22,4,Tue Jul 21 05:42:06 2015 UTC,All of this assumes that municipal politicians have a grasp of the huge picture that is today's technology. As opposed to most cases where it serves as a trampoline for said politician's career for a higher level of government.
Economics,3dz22g,atl2ptown,2,Mon Jul 20 22:06:10 2015 UTC,That's where consumers come in.
Economics,3dz22g,kavien,4,Mon Jul 20 22:14:34 2015 UTC,People also lost their retirement and life savings when the stock market crashed. Technology and innovation have killed their business model. They are still trying to sell a B&W tube TV in an HD LED flat screen world. Life gives you shit sometimes.
Economics,3dz22g,atl2ptown,2,Mon Jul 20 23:48:45 2015 UTC,Not remotely analogous. You don't have to pay government to get in the markets. The state required huge investments for taxis and now are letting a competitor in with lower barriers. This isn't a market problem like stocks.
Economics,3dz22g,kavien,7,Mon Jul 20 23:55:38 2015 UTC,"An analogy doesn't have to align 100% to make sense and be useful. You know that. Plus your counter is circuitous as the industry itself pushed for the regulations that are destroying their business model. I believe its called ""Painting yourself into a corner."""
Economics,3dz22g,Robo-Mall-Cop,16,Tue Jul 21 00:13:41 2015 UTC,"When I use Uber, I get s car quickly and cheaply. I can watch a map to know when they'll arrive. When I call a cab company, sometimes the cab doesn't even show up. Even if the price were identical, I'd pick Uber for that alone."
Economics,3dz22g,Not_Pictured,27,Mon Jul 20 21:32:51 2015 UTC,"The reason the space isn't fair is because up until recently it was unfair for everyone except the taxi companies.  They shit their own bed, they built the regulatory framework that they find themselves in, and now they are are forced to lay in it."
Economics,3dz22g,penguinv,6,Mon Jul 20 20:19:28 2015 UTC,As a past Chicagoan I could not laugh in agreement more.
Economics,3dz22g,Turdsworth,6,Tue Jul 21 00:14:23 2015 UTC,A taxi medallion costs about a million dollars in New York City. That entitles them to make street hails. Uber isn't a street hail. If you want to pay for a street hail you're essentially paying for the medallion. I don't really find that fair. I don't find it fair that before uber it could take hours to catch a cab. I don't think it's fair that some taxi lines can take literally an hour. The time it would take to walk three miles. I'm for market solutions and uber provides it. Both the driver and the passenger are better off. Medallion owners speculated on an asset and I don't feel bad for them.
Economics,3dz22g,I_Fuck_Milk,27,Tue Jul 21 12:54:45 2015 UTC,They're not competing in a fair space.   Yes they are. The taxi companies just want it to be unfair in their favor.
Economics,3dz22g,SD99FRC,32,Mon Jul 20 20:55:48 2015 UTC,"That part is irrelevant. The regulations are in place, and if companies like Uber and Lyft are circumventing those regulations, then that's not a fair space. The rideshare apps either need to work in that space, or the regulations need to be changed.   The world is evolving, but that doesn't mean we just say ""Fuck you"" to every existing business that came before the change.   Like I said, the taxi companies have shot themselves in the foot repeatedly, but that doesn't mean their complaints aren't well-founded. You need to divorce your own personal opinion from the basic facts of the situation."
Economics,3dz22g,I_Fuck_Milk,23,Mon Jul 20 21:06:30 2015 UTC,"That part is irrelevant.    How? The taxi companies have gigantic lobbies to make the competition unfair. Uber is just fighting back. I don't see a problem at all.  You're right that the regulations need to be changed, but I won't feel sorry for taxi companies losing business to Uber."
Economics,3dz22g,SoldiersofGod,30,Mon Jul 20 21:08:33 2015 UTC,"If anything, it's rather the opposite.   Chicago taxi drivers (or most cities) have to attend a 2-week course (112 hours total, unrestricted chauffeur certified if student gets an 85% on final exam) which covers the city's geography, rules & regulations, and TAP program (course covering the ADA and White Cane Law). Taxi drivers also have to pay $242k+ to own a medallion (excluding the fixed costs and the car itself) If no intention to purchase the metal plate, they must pay the $400 weekly lease from the lessor.   Uber does not have any course(s) that offers professionalism, a course of the city's geography, nor an access program course for the disabled/blind/deaf. The only requirement from Uber is for an employee to own a smart with a Google Maps access and to fill out the application.   Competition is good of course, but Uber drivers have it real easy.  This is coming from a taxi and uber driver.   Edit: I also must mention that I took the final exam a total of 4x due to not reaching the the 85/100 benchmark.  The exam is really difficult; the exam has 80 multiple choice questions, and the wordbank has over 600 questions."
