Economics,3dxpjd,hooliahan,1 point,Mon Jul 20 17:49:47 2015 UTC,"a rise in employee costs doesn't necessarily demand a rise in prices. there are lots of ways a business might choose to respond to increased costs.   While this is true in general, considering Wal-Mart's business model, I don't think it applies to the situation.   if they do raise some prices (by how much?) then we're not sure how many customers will go elsewhere.   It's the combination of the reduced margin and reduced customers which would hurt Wal-Mart. There doesn't need to be a big variation, since Wal-Mart's biggest component to their low cost is their huge scale and, thus, bargaining power. A reduction in customers in any size would have at least a proportional reduction in bargaining  power (perhaps more), and that would further hurt margins more, which would hurt prices more, and end up in a downward spiral.   probably Walmart will not raise them to a point which totally ends America's preference for shopping there, and if Walmart did, it would probably not stick to this policy to the point where the company ceases to exist   You are probably right. But it would hurt them in a way that Wal-Mart's unique value proposition would cease to exist. People will not longer have a low-price alternative.   economic causes and effects are messy, and drawing a straight line from increased workers' benefits to the inevitable bankruptcy of Walmart as a direct result is a bit simplistic   I wasn't. I drew a line, not necessarily a straight one, between higher wages and/or benefits for workers and the end of the low-price retailer. This is a very clear line, and easy to see, and not at all exaggerated.  My point was that, when people say that taxes are subsidizing Wal-Mart, in fact, they are subsiding the low-price retailer, and this includes Wal-Mart and other retailers, but also McDonald's and other fast food, low-margin, low-price restaurants, and many others like them.   This has a multiplier effect. It keeps people working for a wage, plus the benefits they get from the government, plus it keeps their living affordable by providing goods and services that are affordable to them. By raising benefits, at least some of them would lose jobs and all of them would lose affordability. Raising benefits is a lose-lose in this situation (italics for emphasis).  It is better to promote a healthy market that can afford to pay higher wages and better benefits, than to mandate them by law, as mandates are usually unsustainable, and hurt more than they intend to benefit."
Economics,3dxpjd,hseldon10,2,Mon Jul 20 18:34:55 2015 UTC,"You have no idea how much of a price increase Walmart would have to make, do you? According to one study it would cost the average consumer 46 cents more per trip. Even if they did not raise prices, the only people affected would be shareholders with a lower ROI. All you are giving us is a slippery slope fallacy."
Economics,3dxpjd,explohd,3,Mon Jul 20 18:41:24 2015 UTC,"The other view is that these employees have very little utility.  But if they can be hired for $6-7/hr, then a store like Walmart can eke out just enough work to have them make sense.  Instead of these people relying on 100% gov benefits to survive, the govt only has to pay for the small marginal amount above what the person earns.  If someone earns 80% of the poverty rate, great the govt is only on the hook for 20% instead of 100%."
Economics,3dxpjd,z500zag,1 point,Mon Jul 20 18:58:12 2015 UTC,"How do you intend to incentive people to work for such a low wage without threatening to throw them into an unsustainable living standard if they don't? Given how costly homelessness and poverty is to society, your model would either end up causing more costs as you try to force people to work or cut benefits for people who actually need them, or you have to increase the benefit those people receive so that the sum total is greater than 100%.   Otherwise you end up with the classical problem where people receive no reward for having a job, and you end up wasting more money in means testing and trying to harass the unemployed to get a job than you saved by trying to force them into work which pays an unsustainable small wage."
Economics,3dxpjd,waveswan,2,Mon Jul 20 19:31:06 2015 UTC,"Except the companies aren't the one's being subsidized; low wage workers are.   If you remove that which is subsidized, subsidies go away. Removing those companies doesn't reduce the subsidies because now those workers are unemployed, which means if anything subsidies go up.  If those workers' wages go up the subsidies go down, because low wage workers are who are being subsidized."
Economics,3dxpjd,TracyMorganFreeman,2,Tue Jul 21 03:19:16 2015 UTC,Well first employees would have to have perfect available data on wages. In other words force companies to publish wage data for each and every person and what their job title is.  Then they would need to have the available data on what the benefits offered cost and their value.
Economics,3dxpjd,Slaves2Darkness,1 point,Mon Jul 20 16:06:13 2015 UTC,"For a ""Happy Meal"" analogy to work well, there are a number of things lacking.  Employer monopsony - there are only a certain number of job openings for a particular skill set in an area at any given point in time.  There are more if the employee is mobile, but that increases the transaction cost.  You might only have 5-10 ""restaurants"" near you, so your options are limited to what those places are selling - whether value meals or a la carte.  If there's insufficient competition, then the employers have a lot of negotiating power here.  Tax advantages of Employer Healthcare and group plan discounts - since in the US, employer contributions to health insurance are pre-tax and insurance companies often offer lower rates to group policies, an employer can offer a service for a much lower price than the employee could buy it for.  That allows the employer arbitrage, capturing most if the economic advantage of their position.  Analogical McDonalds can sell their Hamburger for $4 and their Value Meal for $6 knowing that the Fry Shack and the Coke Machines in the area each cost $1.25, despite the Frys and Cokes only costing McDonalds $.50 each.  People who would like contract labor aren't getting compensated enough extra to make up for their reduced wages.  Job Security/Unemployment Benefits - Despite many states becoming at-will employment states, unless a termination is for some documented reason of misconduct, an employee is eligible for unemployment benefits.  A contractor is subject to no such conditions when their contract is up.  There is no good way to demonstrate this ""stickyness"" in the Value Meal fallacy for either the employer or the employee.  Social Benefits - Despite a restaurant not offering a soda with their value meal, their customers clearly will need to drink SOMETHING, so they all start patronizing the water fountain outside that is funded by everyones' taxes.  This turns into a free-loader problem whereby the customers and restaurants that do provide beverages are having to help fund the water fountain that was meant for those who can't afford a beverage, but is instead being used by customers of cheapskate restaurant.    All of these are benefits of employment that are not easily captured by the addition of additional ""side items"" on the menu."
Economics,3dxpjd,thatmorrowguy,5,Mon Jul 20 18:37:57 2015 UTC,"Employer monopsony   This doesn't change how compensation would be determined between wages and benefits. Firms will still set MC=MB; you're still reducing wages when you mandate benefits.    Tax advantages of Employer Healthcare and group plan discounts   If employers are underutilizing these tax advantages, why? Why would they need to have it mandated?   Job Security/Unemployment Benefits    How does this effect the wage differential arguments?   Social Benefits    What are the externalities or public goods you are thinking about here?"
Economics,3dxpjd,besttrousers,1 point,Mon Jul 20 18:42:17 2015 UTC,"I think leaving out monopsony characteristics does weaken the efficacy of this supposed fallacy. The laid out assumption is that people are offered a burger and a combo, and are freely given the choice between the two. This clearly isn't the case. Partial monopsony power can allow the employer to limit choices of the employee's compensation.   If firms are required to provide benefits to contractors they will lower the contractor wage. But how do we know the extra benefits arent worth the reduction in wages? If the extra benefits were worth more to workers than they cost firms, firms would have eagerly provided these benefits as a way of increasing profits. Firms can profit whenever buyers are willing to pay more for a product than its cost. Benefits are a product that workers buy from firms. Workers buy benefits from firms by offering to work at a lower wage. Firms are happy to sell benefits when workers will accept a wage reduction that covers the cost of the benefit. Thus, if workers value a benefit by more than its cost, there is a mutually profitable deal to be made. The firm will provide the benefit and wages will fall by more than the cost but by less than the value of the benefit. Both firms and workers will be better off. Its implausible that firms and workers will overlook mutually profitable exchanges. Thus requiring firms to provide benefits with every job means requiring firms to sell benefits that workers value less than their cost and that makes both firms and workers worse offjust like requiring restaurants to sell burgers with fries and a drink makes firms and customers worse off.   This part screams, ""let's just ignore monopsony influence!"" It's the same stuff we see with (near) minimum wage stickiness that's laid out here.  Also, you've gone from arguing for the fallacy as a whole and into arguing the obvious point of wages are substituted by compensation and pretending that some of these people are arguing on the same level."
Economics,3dxpjd,aksfjh,1 point,Mon Jul 20 23:53:24 2015 UTC,Partial monopsony power can allow the employer to limit choices of the employee's compensation.   How? I don't see any mechanism by which this would be true.  Monopsony allows a firm to set a workers total compensation to be below that individual MPL. I don't know of any reason to think it would have a different effect on how that compensation is allocated between wage and benefits.
Economics,3dxpjd,besttrousers,1 point,Tue Jul 21 01:19:46 2015 UTC,"The argument that monopsony can affect wages essentially boils down to their power to affect how employment contracts are drafted. In the most simple terms, they control compensation, but it can be expanded to include schedules and compensation composition. The idea being that they can control the supply of employees available to them through the details of the contract. They don't have to raise compensation or provide benefits (in lieu of wages) in order to get their minimum required utility from employees. They don't have to offer compensation options because there is no competitive alternative. It's a very ""take it or leave it"" arrangement."
Economics,3dxpjd,aksfjh,1 point,Tue Jul 21 02:09:28 2015 UTC,"The argument that monopsony can affect wages essentially boils down to their power to affect how employment contracts are drafted.   No, the argument about how monopsony effect wages has to do with how demand and supply curves interact to form price and quantity. It only would change total compensation; there's no reason to expect that it would change allocation.  If that's not true, I want to see the actual mathematics underlying it! Because it certainly isn't coming out of a monopsonistic S+D curve."
Economics,3dxpjd,besttrousers,1 point,Tue Jul 21 03:07:40 2015 UTC,A monopsonistic S+D curve is a model that describes the motivations behind the game theory scenario in which one party has an overwhelming advantage while drawing up a contract. It provides a useful answer to the question of how a monopsonistic (or monopolistic) relationship can arrive at a non-arbitrary price point. Here is a law paper on the subject at hand outside of the economic model and more in line with the game theory side of it. It even has a section on non-price terms (aka schedules and benefits in labor markets).
Economics,3dxpjd,aksfjh,1 point,Tue Jul 21 04:49:36 2015 UTC,"This doesn't change how compensation would be determined between wages and benefits. Firms will still set MC=MB; you're still reducing wages when you mandate benefits.   No, firms set MC <= MB.  Given that employers will want to optimize their costs, they will want to pay the least amount they can.   If employers are underutilizing these tax advantages, why? Why would they need to have it mandated?   The tax advantages are for the employees, not the employers.   How does this effect the wage differential arguments?   It means that the difference between an employee position or a contractor position are qualitatively different.  The difference is not just how many side items are included on the meal, but a promise of meals beyond the first.  It's the difference between an individual transaction of money for burger and a McDonalds Membership Plan where you join their club, and you get a value meal at a set price, and even if they drop you from their membership plan, they will sell you value meals at 120% of that price for a period of time.  It makes employment vs contract labor qualitatively different rather than simply this is the contract price in cash, and this is the contract price in cash + benefits.   What are the externalities or public goods you are thinking about here?   Health insurance subsidies, housing assistance, food stamps, EITC, Medicaid, mandatory ER treatment."
Economics,3dxpjd,thatmorrowguy,8,Mon Jul 20 19:16:54 2015 UTC,"No, firms set MC <= MB. Given that employers will want to optimize their costs, they will want to pay the least amount they can.   No.   If MC<=MB the firm is leaving money on the table.    The tax advantages are for the employees, not the employers.   It doesn't matter; incidence is determine by elasticity.   . It makes employment vs contract labor qualitatively different rather than simply this is the contract price in cash, and this is the contract price in cash + benefits.   No, it will be (cash - cost  of providing benefits) + benefits   Health insurance subsidies, housing assistance, food stamps, EITC, Medicaid, mandatory ER treatment.    These are not externalities or public goods."
Economics,3dxpjd,besttrousers,4,Mon Jul 20 19:22:16 2015 UTC,What externalities would you say this ignores?
Economics,3dxpjd,hseldon10,24,Mon Jul 20 16:31:07 2015 UTC,Which externalities?  You can't call something a spherical cow just because you dislike the conclusion.
Economics,3dxpjd,Lazyleader,2,Mon Jul 20 14:17:26 2015 UTC,"Rule IV  Please be civil. Please stick to well-reasoned debate, citing figures and published research where appropriate.  thanks"
Economics,3dxpjd,lua_x_ia,4,Mon Jul 20 14:32:17 2015 UTC,"Sure. You see, the problem with the word ""benefits"" is that it's fungible, it doesn't describe anything, but really the only ""benefits"" with any significant price tag attached that anyone talks about mandating are healthcare and time off.   Suppose we're looking at an oil rig in Louisiana. This is all made-up and I don't know much about oil rigs, but the story takes place before the introduction of DDT.  Most of the workers at the rig work during the day and make X dollars. But some of the workers show up in the evening and make 1.5X dollars. In a number of cases someone who works during the day will switch to working evenings because of financial problems, personal competitiveness, et cetera.   Unfortunately the mosquitoes in the swamp show up during the evening and people who work evenings are six times as likely to get malaria as people who work in the daytime. So now you have a situation where people occasionally end up in some dire financial situation, start working evenings, and die of malaria.  Do you ban working in the evening? Why or why not?  If you change the variables to healthcare and social and mental health, you start to see why these sort of laws hold water. Is it offensive to people's personal freedom -- even paternalistic -- to ban them from taking personal risks for money? It absolutely is, and I think we should try to avoid it as much as possible. But as a pure economic question, protecting human capital from damage can be an important component of any long-term strategy, methinks. And the truth is, anyone stuck in that situation probably doesn't really feel like they have a whole lot of freedom anyway, so it doesn't matter quite as much exactly whose shit sandwich they're eating, anyway."
Economics,3dxpjd,Lazyleader,3,Mon Jul 20 18:04:11 2015 UTC,"I do not completely disregard your argument, but   But as a pure economic question, protecting human capital from damage can be an important component of any long-term strategy   the thing is, it's not your life and the notion that the state has to protect the ""human capital"" against their own will can lead to dangerous forms of government. The lack of freedom has negative externalities as well and often times this is ignored."
Economics,3dxpjd,lua_x_ia,2,Mon Jul 20 18:05:02 2015 UTC,"That's probably why ""Happy Meal""-like arguments are part of the public-facing justification for such policies."
Economics,3dxpjd,Lazyleader,3,Mon Jul 20 19:03:52 2015 UTC,But the article was against benefits.
Economics,3dxpjd,lua_x_ia,2,Mon Jul 20 19:06:26 2015 UTC,"Right, but now we're talking about something else: the ideological foundation of an idea versus its likely economic consequences. The mechanistic idea makes sense but thinking like that has led to very bad governance historically; the populist idea seems wrong but it's applied in plenty of successful economies (Western Europe, the Commonwealth, the Arabian Peninsula) and it's nowhere near as bad as, say, trade protectionism (Latin America). There's a reason, I guess, that we examine things differently based on who we're talking to and how near we are to a subject.  The long-term goal is people's quality of life. We can't ever imagine the whole process so we get used to doing things that seem to be associated with harmony.  EDIT: For the record, I chose to say ""protect human capital from damage"" deliberately in order to sound as coldhearted and value-free as I could. Obviously that's a pretty nihilistic way of thinking."
Economics,3dxpjd,mccoyn,11,Mon Jul 20 19:11:05 2015 UTC,"One issue, not included in the happy meal fallacy is that when the supply of available workers is high and demand for them is low, a potential worker has decreased negotiating power.  The employer will likely only accept an option that benefits them even if it does not benefit the worker.  A regulation can attempt to rebalance this by forbidding the unfair option."
Economics,3dxpjd,Lazyleader,30,Mon Jul 20 20:24:32 2015 UTC,"Your first sentence is just a description of supply and demand and applies to everything, not just workers. Then you say that there is a downward trend for wages because of a higher supply of workers. Your solution is that the government can increase the cost of workers by mandating health insurance. Not only does the government completely ignore the individual situation the worker is in, which means it applies to high demand workers as much as low demand workers, it reduces the demand of said workers even further in artificially increasing the cost of them."
Economics,3dxpjd,Zifnab25,-2,Mon Jul 20 15:05:20 2015 UTC,"If a worker yields $20/hr in labor, the employer can pay up to $20/hr in wages.  Increasing the supply of workers might dilute individual bargaining power, but it doesn't change the yield a given worker produces (as that's more tightly tied to efficiency of business capital at low-skill job levels).  A population of low-skill workers therefore has an incentive to negotiate with the employer collectively, as any single worker - when pitted against all other workers of his skill level - will be at a disadvantage.  The smaller employer hiring pool has a functional monopsony on labor relative to the higher-population worker pool.  Employers aren't going to hire fewer workers.  One way to negotiate collectively is to unionize.  Unfortunately, unionization is a difficult legal maneuver and leaves individual workers advocating for unionization exposed to blacklisting and other discriminatory hiring practices.  Another way to negotiate collectively is to support legislation at the municipal, state, or federal level.  This negotiation is more powerful as it makes higher wages contingent on access to a real estate area rather than a labor pool.  And it's more difficult to pin down advocates and blacklist them when they are advocating reforms through secret ballot across a population than advocating a straight vote exclusively among company employees.  Each useful worker yields $20/hr.  Unuseful workers yield $0/hr.  So changing the negotiated wage rate (as long as it stays below the $20/hr mark) doesn't influence the demand for labor.  But negotiating a higher salary across a general population does significantly improve quality of life among that population."
Economics,3dxpjd,Lazyleader,15,Mon Jul 20 15:30:35 2015 UTC,"Each useful worker yields $20/hr. So changing the negotiated wage rate (as long as it stays below the $20/hr mark)   But that's my point. You are arguing for something like a union that looks at what the worker could be paid without the company going broke and advocates to pay them that amount.  Mandatory benefits add a fixed cost on all wages no matter how small the gap between ""worker yield"" and wage is. It even applies to companies that already pay more than what they receive. If all companies had a gap between worker yield and wages no company would ever go insolvent. But they do because like some of them pay too little others pay too much. Mandatory benefits do not address the gap at all."
Economics,3dxpjd,KhabaLox,3,Mon Jul 20 16:23:12 2015 UTC,"So changing the negotiated wage rate (as long as it stays below the $20/hr mark)   I agree with everything you've said, but it should be highlighted that this clause is very difficult to achieve.  For example, minimum wage regulations apply to all jobs, which all have different productivity values.  Not to mention, there is productivity variance among the set of minimum wage employees."
Economics,3dxpjd,Zifnab25,1 point,Mon Jul 20 16:35:28 2015 UTC,"I believe there's something of a ""natural"" minimum wage.  There's a wage below which people simply won't work, because working is more expensive than not working.  If you're paying me $.01/hr, I can earn more doing a host of other things - from panhandling to dumpster diving to subsistence farming on squatted land - such that you'll never entice me to work for that wage.  For many jobs, this ""natural"" minimum exceeds the legal minimum.  If it costs you $30k/year to live in New York, you can't work a 40 hour week at $10/hr.  The numbers don't crunch.  So the increase in minimum wage isn't going to hit everyone equally.  In many locations, the increase has already been accounted for.  Past that, there is an assumption that as wages rise you can see the cost-pie shift.  If you operate a retail outlet in a strip mall and 20% of your revenue goes to renting the location while 10% goes to payroll, an increase in payroll doesn't necessarily put you out of business.  The business owner can always turn to the landlord and say ""We need you to cut our rent in half or you'll lose our business"".  And, if costs go up across the board, the landlord will be more likely to agree given that he is less likely to find a replacement.  Likewise, you could see prices increase proportionally.  So there could be a 10% bump in retail sales prices in order to cover a 100% increase in wages.  Or a 5% increase in prices and a 25% decrease in rent.  Or whatever mix is appropriate.  So there's a lot of ways the cost of a min-wage increase could be absorbed.  It's not simply ""Fire half the staff or go out of business"".  Wages aren't the only place where costs fluctuate in a business environment, and good business owners are well-equipped to adjust their strategies accordingly."
Economics,3dxpjd,KhabaLox,1 point,Mon Jul 20 18:21:10 2015 UTC,"So there's a lot of ways the cost of a min-wage increase could be absorbed.   Absolutely.  I was just pointing out that a min wage regulation that requires the min wage to be below (but close to) worker productivity is hard to achieve in reality because of it applies across regions, employees and industries which all have different costs/productivities.  By it's nature, it's a blunt tool, and has to be pegged to the least productive worker."
Economics,3dxpjd,cockmongler,-6,Mon Jul 20 18:50:15 2015 UTC,Supply and demand when applied to healthcare is just saying to let the poorer workers die.
Economics,3dxpjd,Lazyleader,7,Mon Jul 20 18:56:10 2015 UTC,"First of they don't die. Second supply and demand are not things we impose on others, they exist whether we acknowledge their existence or not. Because of that fact the increase in labor cost through benefits has a negative impact on wages. Thus the only way to escape supply and demand is if we don't try to make the economy more social but shift to models like the universal basic income which is paid by the taxpayer and not the employer."
