Economics,3dxpjd,aksfjh,3,Mon Jul 20 19:34:32 2015 UTC,"Yeah, I've always found the kind of paternalism they advocate to be highly distasteful. It assumes they know better than the poor what the poor want, and then often assumes a one size fits all solution to achieve this imagined goal."
Economics,3dxpjd,cjet79,0,Mon Jul 20 14:53:00 2015 UTC,"Are you making the judgement that some other worker needs some form of non-monetary compensation without actually knowing their specific circumstances? This seems like a huge 'fuck you' to employee and employer demonstrated preferences. I think its far more reasonable to assume a worker can decide for themselves what kind of benefits package they want. Just because they are poor doesn't mean they magically lose the ability to decide for themselves what kind of benefits package might be best for them.   I'm arguing that the wages that would be paid in lieu of the benefits would benefit the working poor less. What keeps people in poverty in the developed world isn't a lack of wages, it's a lack of security and proper fixes to issues when they arise. ""Benefits"" generally target the former in some way, at a cost that is much less than the employee would have to pay."
Economics,3dxpjd,taleinat,3,Mon Jul 20 16:19:38 2015 UTC,"You make assumptions about the goals and preferences of the poor, and then advocate a single top-down solution to get to your goal.  You don't speak for the poor, even if you are poor or know plenty of poor people. They are not a single entity, so a single solution isn't guaranteed to help.  Even assuming you are some magical voice for the poor, and they all need security for various things in life. Employee benefits often aren't an a-la-carte selection. They are a package deal. You could easily have a situation where an employee needs security from problem x, and that security costs $50 outside of the job. The job secures him against problems x, y, and z for $100 less in wages. He didn't need security for y and z. So this is just like the happy meal problem above where they are paying $50 for something they don't want rather than $0 for something they don't want.  More money can always be used to solve an unforeseen problem. More in kind benefits increase your protection from known potential problems, and decrease your protection from unforeseen problems (because you have less money). By forcing employees to take a certain package of benefits that will protect them against some problems, you do not make them more secure. Its a tossup, and probably heavily dependent on the specific circumstances for each person. Which is why a market solution makes way more sense. Let people figure out what works for them, and stop assuming you know their situation better than they do."
Economics,3dxpjd,superfunny,21,Mon Jul 20 15:10:43 2015 UTC,"I couldn't disagree with this more...  A) People ""choose"" what food to buy according to preference, but employees don't ""choose"" jobs with lower benefits - they usually take the job with the highest wage and benefits that they can. Allowing employers to offer jobs with lower benefits reduces their expenses at the direct expense of the employees. Just like there is a minimum wage, there should be minimal benefits and protections for employees. And these protections exist! Hiring contractors is a way around those protections, which has become widely abused.  B) Some people order just a hamburger because it is by far healthier to eat just a burger rather than a burger with french fries and a soft drink. French fries are soaked with unhealthy fats and soft drinks are full of simple sugars (or alternative sweeteners, which are also being shown to be unhealthy)."
Economics,3dxpjd,jmartkdr,12,Mon Jul 20 16:17:52 2015 UTC,Allowing employers to offer jobs with lower benefits reduces their expenses at the direct expense of the employees   But isn't the employer getting a less-skilled worker then if they were offering more compensation?
Economics,3dxpjd,tripperda,14,Mon Jul 20 12:47:18 2015 UTC,"Only in a healthy job market where unemployment is relatively low.  If there are more workers than jobs, employers can offer crappy compensation and still get good employees because all the other employers are also offering crappy compensation; for the employee, the choice isn't always a choice between good compensation and bad, sometimes (like during a recession or period of very slow growth) a choice between bad compensation and none.  Also, as someone who does hiring: being more skilled than necessary rarely has much benefit to the employer. For the majority of positions: either you an do the job or you can't, how good you are beyond ""capable"" doesn't translate into added profits for the company."
Economics,3dxpjd,Mimshot,4,Mon Jul 20 13:06:21 2015 UTC,"Only in a healthy job market where unemployment is relatively low.   So we should make long term laws based on short term realities   how good you are beyond ""capable"" doesn't translate into added profits for the company.   Agreed, but usually that means the person can target a job that requires their skills. Again, short term markets may limit this, but this is how things work. For example, it's common for a new person (usually a teen) entering the food industry to work as a busboy or dishwasher, then move into prep cook, then into a cook. Along the way, they've learned more valuable skills, moved into a new position and received higher pay as a result."
Economics,3dxpjd,Sanfranci,2,Mon Jul 20 14:29:55 2015 UTC,So we should make long term laws based on short term realities   Can you name a point in U.S. history where we had anything aproximating an efficient market for labor?
Economics,3dxpjd,jmartkdr,1 point,Mon Jul 20 15:48:35 2015 UTC,"1860s possibly. Good worker mobility between regions and areas, although not as much as today, no unions or labor laws to change how the market functioned. Not many monopolies either, although many industries were oligopolic. Labor demand was strong and expanding for much of the period. Heavy immigration did reduce the impact this had on wages , but the continuing industrial revolution saw urban employment explode.  Any labor markets after this time inevitably had some form of labor laws, the strong prescense of unions or monopolies, or other factors making them imperfect."
Economics,3dxpjd,dontfightthefed,3,Mon Jul 20 18:31:51 2015 UTC,"So we should make long term laws based on short term realities   No, but we also shouldn't assume that things will always be better. Wages have been rising below inflation for the past 40 years; I think that's a strong argument for minimal worker protections.  On a more specific scale: I'm not sure Uber needs to be buying it's drivers health insurance (heck, I'd much rather prefer getting employers out of the health care market entirely) but if we expect employers to provide health insurance, than we should expect all employers to provide health insurance."
Economics,3dxpjd,besttrousers,5,Mon Jul 20 20:01:20 2015 UTC,"Wages have been rising below inflation for the past 40 years; I think that's a strong argument for minimal worker protections.   Yes, but compensation hasn't.  Wages =/= total compensation."
Economics,3dxpjd,annoyingstranger,15,Mon Jul 20 15:59:57 2015 UTC,"but employees don't ""choose"" jobs with lower benefits - they usually take the job with the highest wage and benefits that they can   That is a choice..."
Economics,3dxpjd,besttrousers,4,Mon Jul 20 16:12:56 2015 UTC,In the same way whether or not to eat this week is a choice...
Economics,3dxpjd,typical_pubbie,15,Mon Jul 20 14:36:28 2015 UTC,"Not really. People change jobs all the time. Look at the JOLTs date every month, about 3 million people voluntarilly quit their job."
Economics,3dxpjd,potato1,2,Mon Jul 20 14:47:35 2015 UTC,"But how many of them end up at a job with work and benefits comparable to the one they had before?  I'm a low skill worker. I can choose to work at a Taco Bell, a WalMart, a McDonalds, or a Payless Shoe Store. Look at all the options!"
Economics,3dxpjd,typical_pubbie,1 point,Mon Jul 20 14:50:53 2015 UTC,"If you want upward mobility, you should consider doing something to enhance your skills."
Economics,3dxpjd,DrHenryPym,1 point,Mon Jul 20 15:44:18 2015 UTC,It's hard to enhance your skills when you have no savings and spend every week living hand to mouth.
Economics,3dxpjd,potato1,2,Mon Jul 20 19:04:18 2015 UTC,i.e. the only way to have options is to have upward mobility; shocker.
Economics,3dxpjd,Valridagan,2,Mon Jul 20 19:16:15 2015 UTC,"There are choices without upward mobility, the user I was responding to was complaining that they weren't good choices. The clear solution to that problem is upward mobility."
Economics,3dxpjd,besttrousers,1 point,Mon Jul 20 19:32:54 2015 UTC,"That's 1/100th of the American population quitting per month.  So, assuming that none of those people were repeat quitters, a maximum of 12% of the population quits one job per year.  Which is to say, 88% of the population does not quit their job.  Is that ""all the time"", and would they quit even so often if they had more benefits?"
Economics,3dxpjd,Nwallins,13,Mon Jul 20 19:46:32 2015 UTC,"That's 1/100th of the American population quitting per month   It's 1/50th of the labor force, though, which is the relevant statistic.So about 1/4 workers quit annually."
Economics,3dxpjd,annoyingstranger,2,Mon Jul 20 15:37:38 2015 UTC,"No, it's a choice between hamburgers and Happy Meals.  Let's stick to the analogy."
Economics,3dxpjd,mhollender,1 point,Mon Jul 20 15:58:04 2015 UTC,"Employees choose not to order their fries and drink because there are no fries or drink available to them, or because the expense is not worth the benefit."
Economics,3dxpjd,aksfjh,1 point,Mon Jul 20 17:28:23 2015 UTC,"It is true for adult and main breadwinner type of employees. Not all employees are like that. When my wife decided to go back to work after we had a kid, she preferred a job that would accept a 5 hour per day part-time job and more time for childcare, over a job that would pay more per hour but would accept only 8 hours a day.  This is actually a complicated problem. Consider the following. I live in a country where per law shops are closed on sunday. This is to allow workers (the main breadwinner types) to spend half a weekend with their families. It is true that without the law they could not choose or prefer to do so because from the angle of main breadwinners they need as much income as possible and they don't have much negotiation power. They must take whatever schedule their employer gives them and this is bad. However there were people e.g. college students who actually preferred working on sundays, seriously did as they had no classes on sundays. So for them this regulation is not so  good, when jobs are regulated to 9 to 18 Mo-Sat, college student workers will obviously suffer.  So this is a huge dilemma how to have regulation that protects the main breadwinners, yet allows flexibility for part-time working moms, college students, people who have different preferences.  This is seriously difficult, we need to get smart here.  Perhaps a basic income would simply increase negotiation power there."
Economics,3dxpjd,ontopic,1 point,Mon Jul 20 17:41:46 2015 UTC,"Allowing employers to offer jobs with lower benefits reduces their expenses at the direct expense of the employees. Just like there is a minimum wage, there should be minimal benefits and protections for employees. And these protections exist! Hiring contractors is a way around those protections, which has become widely abused.   I agree to an extent. While it's probably not a rampant issue, a lot of firms do abuse the contractor title in order to shortchange their workers and lower labor costs. However, I think tying benefits to any sort of minimum runs into issues with how you measure the benefits and whether the benefits are actually being served. There is a lot of regulatory burden in there, and there is good evidence that even simple regulatory wage regulations (like overtime) are widely overlooked. I imagine anything tied to benefits would end up even worse."
Economics,3dxpjd,hive_worker,11,Tue Jul 21 09:23:45 2015 UTC,"Meanwhile, in real life, employers are floating the idea that there aren't enough skilled workers for tech positions while colluding to fix wages across the industry.  Putting aside that the ""Happy Meal"" metaphor is just awful and dumb, this is a ridiculous concept."
Economics,3dxpjd,annoyingstranger,10,Mon Jul 20 13:32:44 2015 UTC,Tech workers make a killing and are treated great. I'm one of them. There is no problem in this industry.
Economics,3dxpjd,hive_worker,2,Mon Jul 20 13:29:13 2015 UTC,There is no problem in this industry.   How many of you are out of work?
Economics,3dxpjd,annoyingstranger,4,Mon Jul 20 14:28:56 2015 UTC,"Well there is only one of me, and I've never been out of work since graduating 7 years ago.  My company has had the same jobs posted for a year+ now and just can't find any qualified candidates.   We hire any and all we can find."
Economics,3dxpjd,hive_worker,7,Mon Jul 20 14:50:04 2015 UTC,"I'm sorry, I thought it was clear that my ""you"" was referring to the ""them"" in the comment to which I replied, not to yourself personally.  You do recognize the difference between an anecdote and evidence though, right?  (Edit: That last one was the personal, singular ""you,"" just to be clear)."
Economics,3dxpjd,annoyingstranger,5,Mon Jul 20 14:55:27 2015 UTC,"Yeah I gotcha. I don't have any sector by sector unemployment data memorized. I'm sure google could answer your question.   Edit: ""Information"" workers have a 3.9% unemployment rate? http://www.bls.gov/news.release/empsit.t14.htm"
Economics,3dxpjd,killerstorm,-1,Mon Jul 20 15:04:28 2015 UTC,"Possibly.  My primary concern is the inaccuracy of your statement:   Tech workers make a killing and are treated great. I'm one of them. There is no problem in this industry.   You should consider editing this to read ""Employed tech workers,"" or at least consider removing or softening the claim about the state of the industry."
Economics,3dxpjd,juslen,3,Mon Jul 20 15:12:44 2015 UTC,"You shouldn't replace all your reasoning with statistics.  You need to look closer to understand that there are people with bad skills. It was observed that a non-insignificant fraction of people applying to programming jobs cannot program even the most basic program.  So those 3.9% could be just outliers: people with bad skills, people with obsolete skills who can't bother to learn something new (mental issues), people living in odd places where there are no tech jobs etc.  While the industry -- which aims to hire people with the right skills, use modern tools and work in areas where talent is plentiful -- is doing quite well. You should look at the new investments this industry attracts, not at number of unemployed people who claim that they are programmers."
Economics,3dxpjd,RT17,1 point,Mon Jul 20 15:14:26 2015 UTC,"It's like some guy takes a class on carpentry and then buys some tools. Are they carpenters? If they don't have a job, are they unemployed carpenters? Of course not, they have to prove themselves, they have to work, gain experience, discover if they are really cut out for the job. That's really the true test for any profession, even those lower order professions."
Economics,3dxpjd,hive_worker,20,Mon Jul 20 19:42:25 2015 UTC,Arguments from analogy are perhaps the most specious of arguments.
Economics,3dxpjd,onafarawaybeach,15,Tue Jul 21 00:55:38 2015 UTC,Huh? Analogical reasoning is one of the corner stones of human intelligence.
Economics,3dxpjd,Mimshot,6,Mon Jul 20 12:59:55 2015 UTC,"Maybe the idea is that if this point needed an analogy then it is probably specious. Analogy is the cornerstone of human intelligence (really language) but it's very easy to create false analogies that barely make sense. Equating a happy meal with fringe worker benefits is stupid but pretty typical with these ""government regulations always bad"" articles."
Economics,3dxpjd,hive_worker,1 point,Mon Jul 20 14:26:45 2015 UTC,"On the happy meal side of the analogy, the government put restrictions on the supply side of the transaction.  On the employee benefits side of the analogy, the government put restrictions on the demand side of the transaction.  The analogy really doesn't work at all."
Economics,3dxpjd,RT17,2,Mon Jul 20 16:45:41 2015 UTC,"On the happy meal side of the analogy, the government put restrictions on the supply side of the transaction   The restriction was put on both sides in both cases. The government outlawed a type of voluntary transaction or agreement. You can no longer sell or buy burgers without fries."
Economics,3dxpjd,taleinat,2,Mon Jul 20 18:34:03 2015 UTC,"Analogies are excellent explanatory tools... If the analogy is actually correct.  Arguments from analogy prove nothing. Just because something 'makes sense' doesn't mean it is true. The argument provides no proof the analogy itself is correct.  And all analogies, even good ones, break down at some point.  If you look at any sort of woo peddling, evolution denial or any other sort of crankery you will see that they rely heavily on arguments from analogy, leveraging people's intuition to lead them to an incorrect conclusion.  People are highly susceptible to reasoning from analogy even when it is invalid, hence arguments from analogy are the most specious.  /u/beguiledfoil put it excellently:   The entirety of the scientific revolution was brought on by abandoning argument by analogy and all other logical constructs and instead relying ultimately on experimentation."
Economics,3dxpjd,Lazyleader,3,Mon Jul 20 18:46:52 2015 UTC,"Not always, but the analogy used in this article is exceptionally poor."
Economics,3dxpjd,ex-turpi-causa,10,Tue Jul 21 02:52:33 2015 UTC,Why? I've never heard an argument against the proper use of analogies.
Economics,3dxpjd,takatori,8,Mon Jul 20 16:06:15 2015 UTC,It's a bit like arguing you didn't like the conclusion because you didn't understand the inductive process of the analogical reasoning ...
Economics,3dxpjd,Lazyleader,2,Mon Jul 20 14:21:25 2015 UTC,"It's like bringing a knife to a gun fight: sure, you can use them, but stronger arguments will win."
Economics,3dxpjd,takatori,4,Mon Jul 20 14:26:27 2015 UTC,That's a bad analogy because it already assumes that analogies are the weaker argument. In the happy meal analogy there were no such assumptions.
Economics,3dxpjd,Lazyleader,2,Mon Jul 20 14:26:44 2015 UTC,"And, there's your argument against the use of analogies. :)"
Economics,3dxpjd,beguiledfoil,6,Mon Jul 20 15:14:18 2015 UTC,"I know that it was meant to direct me to that conclusion. That's why I gave the specific reason of why it is a bad analogy. I can make up a bad study, but that doesn't mean all studies are bad."
Economics,3dxpjd,Lazyleader,1 point,Mon Jul 20 15:22:03 2015 UTC,The entirety of the scientific revolution was brought on by abandoning argument by analogy and all other logical constructs and instead relying ultimately on experimentation. There's a reason Aristotelian logician is not a viable career path.
Economics,3dxpjd,beguiledfoil,1 point,Mon Jul 20 15:37:38 2015 UTC,"But politics is not science. How do you base your opinion on gay marriage on experimentation? You base political decisions on principle. Most people arguing in favor of gay marriage argue that two consenting loving adults should be allowed to marry oneanother. That's a principle and they apply it to both different sex and same sex couples. You are basically saying, you can't compare different with same sex couples because analogies are not scientific and you have to experiment in order to know the truth. What truth? Politics is opinion based. Science can not give you opinions on how we should live."
Economics,3dxpjd,weekendofsound,1 point,Mon Jul 20 21:25:01 2015 UTC,"How do you base your opinion on gay marriage on experimentation?   You allow it for a while in some localities, and when it proves not to result in any sort of apocalyptic effect you universalize the right. The states are the laboratories of democracy. Arguments of analogy are used in convincing people to try the hypothesis, not when determining truth."
Economics,3dxpjd,TheReaver88,8,Tue Jul 21 03:44:43 2015 UTC,"Buying a happy meal has NOTHING to do with benefits. These kind of arguments are feeble minded horseshit. At some point, every single worker SHOULD go to the doctor, and going to the doctor is beneficial to both the employer and the employee because it can help prevent illnesses and therefore will maintain productivity. An intelligent employer will understand that this is an investment in your workforce - that employees with good benefits are going to be more satisfied and more productive and will have less stress in their lives than employees who have to buy these things off the ""free market.""   This is a huge issue with our culture that MUST be rectified - a certain portion of Americans that we have no responsibilities to collective society is going to fuck us over when we can no longer compete in the global market because our population is uneducated and unhealthy, and those same citizens came to that conclusion through false analogies like this one."
Economics,3dxpjd,weekendofsound,1 point,Tue Jul 21 04:18:33 2015 UTC,An intelligent employer will understand that this is an investment in your workforce   So why wouldn't they all do it without the government's help? Are they just dumber than the bureaucrats enforcing these rules?
Economics,3dxpjd,TheReaver88,0,Mon Jul 20 15:11:31 2015 UTC,Yes.
Economics,3dxpjd,OliverSparrow,1 point,Mon Jul 20 16:57:52 2015 UTC,"I find that hard to believe. One has money at stake, and the other is attempting to win popularity contests among people who may or may not understand basic economics."
Economics,3dxpjd,Mimshot,2,Mon Jul 20 17:05:49 2015 UTC,"This is one of those strained analogies that take discussion into irrelevant detail. ""Marriage is like setting off on a long sea voyage"", and then everyone starts talking about cabin trunks and life boats.   The question could go in one of two ways. In situations of high employment, would you. Sir, prefer highly paid part time work of lesser paid permanent work with all the trimmings? That is not the sense of the question, however, which tends int he other direction: in times of surplus labour, is it better policy to clear the market in any way that is available, or to dictate that certain boxes have to be ticked before people can work? And if you prefer to go with the box ticking, monitoring route, then what are sensible limits to this? Factories Acts that keep child workers out of the machinery are generally held to be a Good Thing, at least in the wealthy world. Requirements that price a significant number of low skill people out of work - and consequent make-up welfare funding to handle this - is increasingly seen as foolish. Where the dotted line should go is not an economic question, however, but a political one."
Economics,3dxpjd,besttrousers,2,Mon Jul 20 17:15:26 2015 UTC,I'm confused. Is the fallacy that the article is reversing which side is supply and which side is demand in the labor market?
Economics,3dxpjd,Ateist,2,Mon Jul 20 17:31:25 2015 UTC,A lot of people in this thread need to read The Accidental Theorist.
Economics,3dxpjd,Sanfranci,3,Mon Jul 20 18:30:25 2015 UTC,"Nah. It there's a monopsony, you don't actually have to read An Accidental Theorist,   <waves hands wildly>"
Economics,3dxpjd,Available_user-name,4,Mon Jul 20 19:56:43 2015 UTC,"Would a law requiring firms to provide all workers with fries and a drink help workers?   Depends on the salary before and after. If the wages are extremely depressed (i.e. at minimum wage) due to overabundance of unemployed people, adding mandatory benefits would indeed help workers (as long as the firm doesn't close and the workers are not also co-owners of the firm) ."
Economics,3dxpjd,tazias04,1 point,Mon Jul 20 20:14:03 2015 UTC,"Well but if they are already minimum wage, and you add benefits, you basically raised the minimum wage. Some people's marginal product must be worse than the new minimum wage plus benefits, such that those people would then be fired. The question is do all of the workers increased earnings add up to more than the loss of all the jobs and their related earnings. If yes, workers benefited, if not they lost. The answer is probably yes, workers earnings do increase, a lot of minimum wage jobs are surprisingly hard to eliminate."
Economics,3dxpjd,beguiledfoil,3,Mon Jul 20 14:27:10 2015 UTC,"I would never buy fries or soft drinks (besides water), and know other people who wouldn't. Not sure why it is assumed that everyone would want them"
Economics,3dxpjd,besttrousers,2,Mon Jul 20 20:55:01 2015 UTC,fuck fries.  I want 3 mcjunior's and peace.
Economics,3dxpjd,beguiledfoil,2,Mon Jul 20 15:27:11 2015 UTC,Some restaurants offer burgers without fries and a drink. These restaurants cater to low-income people who enjoy fries and drinks but cant always afford them.   This is not why restaurants offer individual burgers... I can't believe articles like this generate serious discussion. This is praxeology at its worst.
Economics,3dxpjd,drukath,0,Mon Jul 20 15:26:42 2015 UTC,I don't think this is a prax - it's a well understood model with a lot of evidence behind it.
Economics,3dxpjd,besttrousers,1 point,Mon Jul 20 17:24:11 2015 UTC,"Feel free to link to something less shitty, then. As far as I'm concerned this is more of Milton Friedman's ""The best thing we can do for the black man is remove the minimum wage"" bullshit."
