Economics,3dz22g,NevadaCynic,2,Mon Jul 20 22:04:52 2015 UTC,That's exactly what taxis also do when they don't work the airport.
Economics,3dz22g,danny841,3,Tue Jul 21 00:27:34 2015 UTC,"Taxis in cities like LA, Denver, Albuquerque, or other ""car cities"" don't really get people hailing them down for rides easily. I understand dispatch sends them places but it's also not as convenient as the Uber app."
Economics,3dz22g,NevadaCynic,2,Tue Jul 21 00:57:21 2015 UTC,"Let me rephrase then, that is exactly what taxis in Nevada do, and Nevada has nothing but ""car cities"". The casinos may distort the behavior of drivers in Nevada somewhat though."
Economics,3dz22g,Yosarian2,2,Tue Jul 21 01:03:05 2015 UTC,"There was a study a few months ago showed that, on average, uber drivers get paid much more then cab drivers.  On average, by more then $6 an hour.  That's enough so that they're still significantly better off then cab drivers even including vehicles, gas, and upkeep.  http://techcrunch.com/2015/01/22/uber-study/"
Economics,3dz22g,NevadaCynic,2,Tue Jul 21 00:32:58 2015 UTC,"That study is far more plausible. I could easily believe the pay difference, especially because so many Uber drivers only work during peak demand.  The OP however remains patently ridiculous."
Economics,3dz22g,OMG_TRIGGER_WARNING,5,Tue Jul 21 00:53:18 2015 UTC,That's not an externality in the economic sense
Economics,3dz22g,ucstruct,3,Mon Jul 20 21:25:12 2015 UTC,"Medallions usually run into the hundreds of thousands, they were topping a million in NYC."
Economics,3dz22g,atl2ptown,2,Mon Jul 20 20:38:22 2015 UTC,"Yeah it varies wildly by city though, so I used tens of thousands as an average."
Economics,3dz22g,traal,14,Mon Jul 20 20:57:26 2015 UTC,Which externalities does Uber take advantage of?
Economics,3dz22g,eo10998,17,Mon Jul 20 19:36:14 2015 UTC,"Uber/Lyft hire drivers via independent contractor-ship. This means drivers provide their own vehicles and phone, and Uber/Lyft essentially offload risk/high capital requirements on drivers. They also don't pay fees related to taxi licensing etc.  Whether or not these are OK or bad things will find different opinions from different people, but essentially this is what makes these companies viable (for now)."
Economics,3dz22g,potato1,8,Mon Jul 20 19:43:12 2015 UTC,One could argue that the fees aren't productive and are more of a barrier to entry put in place by a cartel.
Economics,3dz22g,eo10998,3,Mon Jul 20 20:20:35 2015 UTC,"Not arguing for or against on this, again, but technically you could say this about all licensing and fees. They are meant to protect consumers, whether it be environmental, safety, or other issues. If they don't work, then we need to address. OP's point was duh its cheaper, they don't have to pay for X, which is valid. Whether or not they should be is a different issue"
Economics,3dz22g,potato1,8,Mon Jul 20 20:32:04 2015 UTC,"It's not necessarily true of all licensing and fees if they actually fix an externality problem or provide value in ensuring service quality or something (like a restaurant health inspection, for instance). Uber's high service quality is generally indicative that taxi medallions aren't effective."
Economics,3dz22g,eo10998,2,Mon Jul 20 20:41:10 2015 UTC,"Yup, very true. I was hinting more towards the issue of licensing and fees isn't black and white. It's more of an ""overall opinion"" when it comes to their effectiveness. Most would agree that health codes are necessary, while some environmental requirements are superfluous. Eye of the beholder type of deal.  That being said, I think that Uber/Lyft's service is great. Some theorize that the initial drivers for these companies were from a certain demographic which was less prone to crime, but as with most large companies, the type of worker they attract changes. Hopefully Uber and Lyft's driver screening practices remain up to par, but many people would argue that there should be some sort of standard - how that is implemented is another issue"
Economics,3dz22g,potato1,3,Mon Jul 20 20:49:55 2015 UTC,"The hope, I suppose, is that peer review can replace imposed regulations as sufficient to ensure quality and safety. Time will tell whether this bears out for Uber, but it has been shown through experience to work in other markets (eBay, for example), so I think it's clear there is potential."
Economics,3dz22g,TheBoat15,21,Mon Jul 20 20:56:23 2015 UTC,"That'd still be reflected in the price, though, wouldn't it? If the drivers are paying for these externalities, then they wouldn't drive for a price point lower than what would make it profitable for them. Unless I'm misunderstanding your point."
Economics,3dz22g,aswanson121,10,Mon Jul 20 19:57:32 2015 UTC,"Yeah.  Not sure where the ""externality"" exists.  We are using too loose of a definition for externality.  An externality should be affecting someone, either negatively or positively, whom was not involved in the decision-making process.  Taxi medallions MAY be thought of as potentially fixing the externality of congestion in city roads.  I don't agree with this, but this is the only externality in terms of Uber that I can imagine."
Economics,3dz22g,HunterHearstHemsley,9,Mon Jul 20 20:41:00 2015 UTC,"I've talked with a few uber drivers about this. Apparently Uber is focusing heavily on recruiting new drivers then keeping new ones. Fares have been going down which cuts into the drivers pay. Essentially, Uber would rather have a bunch of part time drives that work for a couple of hours a week for 6-months than drivers who are committed for the long-term.   So it's not at the point where fares are low enough to keep drivers away, but they might be low enough to keep drivers from staying."
Economics,3dz22g,Richandler,6,Mon Jul 20 20:33:22 2015 UTC,Basically Uber driver is a high school job for adults.
Economics,3dz22g,atl2ptown,4,Mon Jul 20 23:43:53 2015 UTC,That's why they get 80% of the fare.
Economics,3dz22g,docebt,3,Mon Jul 20 20:15:13 2015 UTC,Don't they have high turnover for pretty much that reason?  http://www.forbes.com/sites/ellenhuet/2015/01/22/uber-study-workforce/
Economics,3dz22g,eo10998,10,Mon Jul 20 22:07:27 2015 UTC,"My theory is that drivers don't think about this, and really consider the top line number. Vehicle upkeep is not a cost that's easily measured, especially when it's also your personal vehicle"
Economics,3dz22g,aksfjh,12,Mon Jul 20 20:09:12 2015 UTC,"Or maybe they are still willing to work for the wage after (roughly) accounting for the cost of vehicle upkeep. Their pricing model works out pretty well for this. If your costs are too high, you'll stop driving and send fare prices up. Enough people do this, and enough drivers will re-enter the market."
Economics,3dz22g,eo10998,9,Mon Jul 20 20:32:27 2015 UTC,"Yup, as much as people hate on surge pricing, I agree. The idea isn't to gouge customers, it's to provide an equilibrium between driver and customer.  This works out in the long term, and over a large amount of drivers however. The individual driver in the short term can still be screwed, but that can be said about any situation"
Economics,3dz22g,naasking,12,Mon Jul 20 20:41:47 2015 UTC,"They also don't pay fees related to taxi licensing etc.   Fees and licensing are supposed to prevent externalities. What externalities these specific fees supposed to be preventing? If there are none, or they are now obsolete, I doubt any reasonable person would consider Uber's approach on this issue ""bad""."
Economics,3dz22g,eo10998,7,Mon Jul 20 19:56:45 2015 UTC,I agree that if the fees don't actually protect anything then they are useless. I would disagree that no one thinks uber's approach is bad. A lot of people don't like their business practices (outside of taxi drivers).
Economics,3dz22g,naasking,3,Mon Jul 20 20:12:15 2015 UTC,"I don't see what their business practices have to do with their position on the specific issue of fees and licensing, which is how I qualified my statement."
Economics,3dz22g,SilasX,2,Tue Jul 21 01:05:59 2015 UTC,"IMHO, the logic for limiting medallions makes sense on economic grounds, but only for vehicles that look for and pick up street hails by sight. This causes congestion above and beyond what an ordinary driver on the road would cause, when drivers have to clog the major streets looking for hails.   But there's no similar congestion for a pre-arranged service, where drivers don't vie ""shoulder to shoulder"" for people hailing them. In that case, they only go where requested and otherwise don't have to crowd the popular areas.  So it makes sense from a policy standpoint to only apply the limo limit to those taking street hails."
Economics,3dz22g,I_Fuck_Milk,4,Tue Jul 21 08:58:08 2015 UTC,"Drivers voluntarily participate. It's not ""taking advantage"" of anything.  As for the taxi licensing, it should have never been legal in the first place."
Economics,3dz22g,nogodsorkings1,3,Mon Jul 20 20:57:46 2015 UTC,"Drivers voluntarily participate. It's not ""taking advantage"" of anything.   Uber recruitment is as dishonest as the military."
Economics,3dz22g,I_Fuck_Milk,4,Tue Jul 21 00:15:00 2015 UTC,"But unlike the military, you don't have to stay in for 4 years.  Drivers can leave when they want, I don't see a problem."
Economics,3dz22g,nogodsorkings1,1 point,Tue Jul 21 00:17:12 2015 UTC,"You've still wasted your time, and likely incurred expenses to become a driver. But more likely, the hapless drivers who get signed up don't know how to calculate their expenses, and get strung along for a while working for less than minimum wage without realizing it. Uber relies on naive drivers' perception that driving is basically free after gas. Once you figure out how little you're making, you drop out as fast as you can, but at that point Uber's signed up two new guys to take your place. They use highly exploitative, pyramid scheme style recruiting, and it's not honest to present the situation as one of symmetric information."
Economics,3dz22g,I_Fuck_Milk,2,Tue Jul 21 00:40:02 2015 UTC,"You've still wasted your time, and likely incurred expenses to become a driver.   All it requires is a car and a smartphone. Still not seeing how this is some huge problem. You can leave in a week if you want.  Seeing as a lot of people know about it, their dishonest tactics should become well known and people will stop driving for them soon enough if it ever turns into a real problem.  You're creating problems where there aren't any."
Economics,3dz22g,Not_Pictured,2,Tue Jul 21 00:44:12 2015 UTC,People acting in their own interest counter to the interests of /u/slash196 I imagine.
Economics,3dz22g,bamdastard,2,Mon Jul 20 19:37:49 2015 UTC,Cab companies also offload most responsibilities to the cabbie. Cabbies lease the vehicle from the company for a shift and the companies often dictate where they Can or can't offer rides.
Economics,3dz22g,abd9344,2,Mon Jul 20 21:19:07 2015 UTC,"Yeah, just like eBay ""offloads the externalities"" onto their sellers? There are no externalities here, drivers choose when and how frequently they want to use Uber to pick up fares and what share of the sales they have to pay to use the service to connect with users (just like eBay does), no one is ""offloading"" anything."
Economics,3dz22g,NevadaCynic,5,Tue Jul 21 16:43:27 2015 UTC,"Think I may have found a major source of bias in their structure. The people they had gathering data for this spent an entire day alternating between ubers and taxis. So their data is a nice flat representation of an entire day, which is entirely unrepresentative of how Uber is used as it massively under states surge pricing in the data.   A graph (with time of day and number of users as your two axes) of normal usage of Uber might have peaks around surge pricing times, and troughs on the other times. The graph of their data is a nice flat line across the board."
Economics,3dz22g,Schoffleine,3,Tue Jul 21 01:00:40 2015 UTC,It can't be entirely unrepresentative.  Not everyone uses it during surge pricing to come home from the bar.
Economics,3dz22g,pzone,2,Tue Jul 21 05:15:13 2015 UTC,"Excellent point. The study says around one sixth of all rides were subject to surge pricing.  I could not possibly imagine that's representative.  That said I personally use Uber for speed and reliability, not because of any cost advantage."
Economics,3dz22g,the_Synapps,2,Tue Jul 21 06:59:11 2015 UTC,"They also failed to make use of the service during peak evening hours (8-10/11) when surge pricing is most common. I doubt the prices would ever be as high as the taxi fares, but they would be much closer than the study reflects."
Economics,3dz22g,dahdly,3,Tue Jul 21 14:05:45 2015 UTC,"Good, timely service, or shitty service (if you even get the chance)?  Hmmm lets see, which do I choose...  Taxi companies had a monopoly and abused it, now they are getting what they deserve."
Economics,3dz22g,becausebacon,2,Tue Jul 21 03:12:21 2015 UTC,"I'm no mathematician, but I think that makes Uber 4x better."
Economics,3dz22g,big__cheddar,4,Tue Jul 21 00:19:07 2015 UTC,"Sure, twice as fast, half as expensive, for a reason  https://www.jacobinmag.com/2014/09/against-sharing/"
Economics,3dz22g,SilasX,5,Tue Jul 21 05:21:15 2015 UTC,"What reason? I'm wading through the piles of social justice talking points looking for ""this one weird trick that gives Uber it's unfair advantage"". What is it? Since you thoroughly read the article and understand it, can you put it in your own words so we don't have to read 1000 words to be alerted of which dynamic you're trying to alert the forum of?  The closest I could find was the usual rant about independent contractor status -- never mind that conventional cab companies do the same to their workers, and that (if forced) Uber could just cut rates to cover the cost, effectively mandating that Uber drivers but benefits only via uber.   So, what's the one weird trick that totally demolishes Uber's legitimacy click here?"
Economics,3dz22g,Fake_Unicron,5,Tue Jul 21 09:13:52 2015 UTC,How on earth is this abou social justice talking points? Or is social justice the new way to say bullshit?
Economics,3dz22g,Plopdopdoop,3,Tue Jul 21 11:33:08 2015 UTC,"This study comparing prices is disingenuous worth little when Uber's are artificially--but temporarily--lower. I mean, haven't they admitted their strategy is in essence a predatory pricing model--setting prices below cost until smaller competitors have been driven out?  As a user I admit I use Uber because they are far cheaper (amongst other reasons). But no one really thinks these low prices prices will last, do they? When their temporary price cuts happen--and they seem to happen an awful lot--they're still paying their drivers the original price. That's not sustainable.  Relevant articles, if a little old:  UBER JUST CUT PRICES IN DALLAS AGAIN, BUT DON'T EXPECT IT TO LAST  Uber Is Now Losing Money On Every UberX Ride  Edit: To the replies mentioning basic economic theory, that's of course understood (and assumed). My comment pertains to the study referenced here. The headline lists price as one of two differentiating factors. My point is that lower price--and by necessity lower cost--isn't a natural or inbuilt feature of the product. As opposed to speed, scheduling, and other informationally driven advantages Uber legitimately has.   Uber hasn't fundamentally changed anything about the total business cost of taxi service. What they have been successful at is distributing some of the traditional industry costs to other parties: driver insurance (Uber's driver insurance isn't primary), maintenance, etc. But I argue that's only temporary; those costs will gradually be pushed back on them as issues like contractor (vs employee) designations, liability, and others are decided against Uber. They then may still be left with some cost savings because of technology and scale. But those are only marginal minor.    Now, if they succeed in a long term plan to switch to driverless cars then they'll truly be able to reduce cost.  To summarize:   Much of Uber's price advantage is due to significantly below cost rates, subsidized with their huge war chest of funding   That situation is temporary, by necessity  Some price advantage is due to lower cost of service by successfully having distributed traditional industry costs to other (less sophisticated) parties   That distribution of costs is, too, largely temporary"
Economics,3dz22g,d3adbor3d2,2,Mon Jul 20 21:21:12 2015 UTC,"once cab companies dwindle/disappear and they start rideshare companies of their own, let's see how saturated the market will be since there's no regulation involved and everyone's an ""owner-operator""... per uber."
Economics,3dz22g,TheSliceman,4,Mon Jul 20 21:20:27 2015 UTC,"But remember people: decentralized industry is ONLY better with ride-sharing. Everything else is better being centrally controlled.   Stuff like how much to pay employees, who you can and can't bake cakes for etc..  That's all better being dictated by the state."
Economics,3dz22g,ertebolle,2,Mon Jul 20 21:43:29 2015 UTC,"Uber drivers aren't allowed to refuse people rides for being gay - if they did, they'd be terminated so quickly it would cause a rift in the space-time continuum."
Economics,3dz22g,Canadian_Infidel,2,Tue Jul 21 02:25:40 2015 UTC,"It would have been just as cheap, although not quite as fast, with unlicensed cabs. I like uber, but the cab drivers have gotten ripped off. If I took out a massive mortage for something the government would have fined and or arrested me for working without and then immediately gave the licenses away the next day i would lose my mind. The government should have to pay that money back. Or the cabs should be in the Uber system by law and ""licensed cab"" should show up when you are choosing."
Economics,3dz22g,cyancynic,2,Mon Jul 20 22:50:49 2015 UTC,Its amazing how you can cut costs when you don't have to comply with state and local laws.
Economics,3e2jlt,Gargamel42,13,Tue Jul 21 13:41:52 2015 UTC,"In 92 I remember an article came out in the times of London and it essentially lambasted the entire idea of a monetary but not fiscal Union. I didn't understand how stupid smart people could be until then, and still don't."
Economics,3e2jlt,bahhumbugger,12,Tue Jul 21 13:57:45 2015 UTC,"A few remarks: Many people (here and elsewhere) like to repeat how obvious it was that the euro was a bad idea. A recurrent complaint is how EU politicians and economists could fail to see its obvious flaws. This betrays great ignorance of the history of the euro pre-1999 (beginning of Stage 3 of the EMU). The supporters of the euro may turn out to have been wrong, but to suggest that there was a clear consensus is simply incorrect.  All the obvious, and many more, less obvious, qualitative arguments for and against the euro that you read over and over were widely studied and debated long before Stage 3. For an example of a US-based economist addressing the question of the supposed need for fiscal integration (which seems to now be accepted by the US press as an obvious, unconditional imperative for monetary union), see Eichengreen in European Monetary Unification, Ch. 9. This was based on Eichengreen and Hagen, 1996.   Which brings me to the next point. Without quantitative information or at least estimates, how could you possibly tell whether things like attachment to nationalist ideas and language barriers will be minor problems, or on the contrary are sufficient to dampen economic mobility to the point where it is a problem? It is obvious that language will make a difference, but it is far from obvious how much of a difference it makes.   If it is ""obvious"" to you that the euro could not work because of language barriers, ask yourself this: if someone in 1992 told you they didn't believe the language barrier would prevent Spaniards from moving to Germany for jobs, because low-skill jobs require only limited language proficiency, and highly-educated workers in Europe are largely multilingual, would you really be able to give a better response than ""I still don't think the Maastricht legal framework will be enough to ensure sufficient mobility""?  All these questions were addressed in the long and rich debate among economists on the EMU starting in the 1980s. Neither side provided truly conclusive arguments. Presenting the euro as a purely political project that was rammed through without consideration for basic economic objections a five year old would understand is extremely misleading.   For a more serious (albeit already seriously outdated) review of negative opinions on the currency union before Maastricht, see this."
Economics,3e2jlt,kohatsootsich,6,Tue Jul 21 16:19:01 2015 UTC,"Great post, but my look back gives me the impression that this debate really only seriously occurred within European circles. American economists seemed pretty consistent in saying that the euro was a bad idea at the time. Maybe that's a misinformed perception though."
Economics,3e2jlt,manuscelerdei,3,Tue Jul 21 16:41:01 2015 UTC,"American economists seemed pretty consistent in saying that the euro was a bad idea at the time. Maybe that's a misinformed perception though.   This is largely correct, although Eichengreen is a notable exception. Re-reading European Monetary Unification (essentially a collation of his papers on EMU from the late 80s to 1997) 20 years later is very interesting.   Even in ""hard"" sciences like physics, culture and affiliation play some role in the acceptance of new ideas and where experts stand on current controversies. Where professional economists stood on the euro was most certainly influenced by their views on the European project as a whole.   My main point was that the simple objections you read every day now were well-known to everybody, and that, after perusing the 1980-Maastricht literature (even those papers and opinions written by Euro-sceptics), it is far from clear how important each of these objections were."
Economics,3e2jlt,kohatsootsich,17,Tue Jul 21 17:01:16 2015 UTC,"A few economists doubted the euro. I still remember and saying economists were right is a rewrite of history because in reality the overwhelming majority of economists were cheerleading the Euro is great parade all the way, along with business leaders, politicians, the media and european bureaucrats. The only group that mentioned serious concerns with the euro were average citizens and they got shouted down by the aforementioned groups as being progress stopping idiots that didn't understand anything about how the economy works."
Economics,3e2jlt,ColdfireSC3,7,Tue Jul 21 13:52:21 2015 UTC,"Krugman's been mocking this recently, as an example of a couple of pro-euro economists doing a premature victory lap and calling out their opposition, and thus managing to build themselves a roll-call of influential economists who got it right."
Economics,3e2jlt,interfail,2,Tue Jul 21 19:00:27 2015 UTC,"I think it depended where you were. I clearly remember Sweden's ""no"" vote in the referendum 2003 and they had a lot of economists on their side. As did the Danes and the Brits."
Economics,3e2jlt,Blahallon,1 point,Tue Jul 21 14:16:06 2015 UTC,2003 was a little later though right?
Economics,3e2jlt,Bumlo,1 point,Tue Jul 21 17:08:32 2015 UTC,"Well, it was after the Euro officially began but it is when Sweden had a referendum.  Swedes had been promised a referendum and that the outcome would be respected and we voted no to that in 2003.  I think the politicians held off a few years hoping the tide would turn but it never did. Which was good for Sweden. Dear God, we are so against the Euro now, and all the bailouts. I think you have an easier time finding people who believe in aliens or ghosts than the Euro."
Economics,3e2jlt,Blahallon,2,Tue Jul 21 18:23:39 2015 UTC,"As did the Danes and the Brits.   The UK expressed very strong concerns over the Euro, so I'm not sure how it can be suggested that doubt of the Euro was a fringe concern."
Economics,3e2jlt,Carnagh,2,Tue Jul 21 17:28:52 2015 UTC,Mainland Europe :-)....Everything outside is fringe or jealousy.
Economics,3e2jlt,Blahallon,-1,Tue Jul 21 18:24:27 2015 UTC,"Fair comment =)  While I get your point, that has been part of the problem here."
Economics,3e2jlt,Carnagh,2,Tue Jul 21 18:34:30 2015 UTC,"Actually Sweden voted no because they couldn't defend their peg (same with the UK). They lost billions because they thought they could ""greek"" the system.  You lose control of too much IMO. I think the US would do better with 4-5 currencies and an automated exchange based on regions. I know when they implemented contractionary measures in the 80s it pushed Oklahoma and Texas much farther into recession because of the oil bust.   We discussed all this in my econ/finance classes before the Euro was available (but was planned), so it's not that much of a stretch to say ""economists"" had thought it through.  Look up how Soros made so much off the UK. Lol first fucking link: https://www.google.com/?gws_rd=ssl#q=soros+uk"
