Fantasy,3dzng2,Retsam19,1 point,Mon Jul 20 23:29:08 2015 UTC,Thanks a lot. I hope it becomes something useful. The good news and something that keeps me going is that all of the work is up front. Once it's up and running and how we want it the system pretty much takes care of itself with minor upkeep.
Fantasy,3dzng2,CrazyCatLady108,2,Tue Jul 21 00:03:54 2015 UTC,Sweet. I love watching this come together. Gotta get back to my summaries soon! Thanks for all your hard work on this.
Fantasy,3dzng2,CrazyCatLady108,2,Tue Jul 21 05:08:45 2015 UTC,Thanks for contributing! The more we all contribute the better the site becomes for everyone.
Fantasy,3dzng2,phiL0co,1 point,Tue Jul 21 14:58:29 2015 UTC,"Cool as ever to see progress being made.  Two things I'm noticing now:   Can't open summaries if not logged in Summaries are showing twice the number of chapters that they actually contain, on the summaries list page."
Fantasy,3dzng2,rulkezx,1 point,Mon Jul 20 21:35:06 2015 UTC,Thanks for the help. I think I got those fixed up.
Fantasy,3dzng2,break80,1 point,Mon Jul 20 21:45:08 2015 UTC,question:  is there a reason it says #undefined next to the book title?
Fantasy,3dwq0i,elquesogrande,53,Mon Jul 20 04:11:09 2015 UTC,Photo for those not linking to Facebook
Fantasy,3dwq0i,ProfessorLake,26,Mon Jul 20 04:16:37 2015 UTC,"When the second Riddick movie came out, I did a phone interview with him for a now-defunct website. He was incredibly nice, one of the more gracious people I've ever encountered."
Fantasy,3dwq0i,DavidWFrank,43,Mon Jul 20 14:09:10 2015 UTC,Vin Diesel +5 Geekcred.
Fantasy,3dwq0i,PromisedPrince694,52,Mon Jul 20 04:39:32 2015 UTC,"His tattoo in xXx saying ""Melkor"" was one of his characters. We know where he got the name ;P  Also he apparently wrote the foreword for a book celebrating the 30th anniversary of  D&D and he's been playing for 20 years. Dude is a hardcore geek. Made his own video game too iirc."
Fantasy,3dwq0i,LazerSturgeon,33,Mon Jul 20 07:13:22 2015 UTC,He owns the studio that makes the Riddick games.  He also owns the Riddick film franchise. It's actually the reason he has that cameo at the end of FF3: Tokyo Drift. He showed up in exchange for the rights to Riddick.
Fantasy,3dwq0i,shadowplanner,7,Mon Jul 20 12:00:48 2015 UTC,Make some more Riddick movies and games then.  I'm ready to see them.
Fantasy,3dwq0i,Daemias,2,Mon Jul 20 17:31:50 2015 UTC,"They're making more movies. Dunno about games,  though."
Fantasy,3dwq0i,ApparentlyNotAToucan,18,Mon Jul 20 22:02:25 2015 UTC,"The game - Riddick, Escape from Butcher Bay - is also quite good!"
Fantasy,3dwq0i,Osama_Bin_Batman,10,Mon Jul 20 07:16:02 2015 UTC,its really good man! I bought assualt on dark athena and decided to play butcher bay first since it was on the disk. I loved it so much I never even completed the second one! I just went back and played the first one again halfway through.
Fantasy,3dwq0i,DavidWFrank,1 point,Mon Jul 20 11:50:21 2015 UTC,I bet he has a crazy collection of painted figurines :)
Fantasy,3dwq0i,Battlingdragon,17,Mon Jul 20 18:51:30 2015 UTC,"When he was filming Riddick with Dame Judy Dench, he taught her to play D&D. Man gets a lot more than 5 geek cred."
Fantasy,3dwq0i,DavidWFrank,3,Mon Jul 20 14:28:03 2015 UTC,That is seriously epic.
Fantasy,3dwq0i,Jeakel,2,Mon Jul 20 18:50:39 2015 UTC,"I'll give you another example of his geek cred, dude put his own house up as collateral to make the 3rd Riddick movie, he seriously a scifi/fantasy geek"
Fantasy,3dwq0i,ashearmstrong,26,Mon Jul 20 14:24:41 2015 UTC,Vin deserves more love.
Fantasy,3dwq0i,Modernpreacher,21,Mon Jul 20 04:39:29 2015 UTC,Bonus points for it being pre 4th edition.
Fantasy,3dwq0i,shad0wpuppetz,14,Mon Jul 20 05:17:08 2015 UTC,"Hey now, 5th ed is pretty solid."
Fantasy,3dwq0i,morallyharmful,4,Mon Jul 20 12:50:22 2015 UTC,I'm glad to hear that. Maybe I should actually check it out.
Fantasy,3dwq0i,AvalonBright,5,Mon Jul 20 13:17:05 2015 UTC,You definitely should. It feels like the perfect blend of 3e and the parts of 4e that actually worked. My only complaint is the fact Wizards releases less new material than Paizo for it. It's been out for nearly a year and there hasn't been a single new splatbook. If people don't want inundated with the things fine but jesus christ it's getting a bit ridiculous to play for an entire year without a single new class and only a minimum of new options from Unearthed Arcana articles monthly.
Fantasy,3dwq0i,morallyharmful,7,Mon Jul 20 16:11:27 2015 UTC,The optimist in me hopes they are being very careful about what they put out. Just about every tabletop rpg in the past gets bloated at some point. I'm already starting to feel like Paizo is getting to the breaking point with content.
Fantasy,3dwq0i,shadowplanner,5,Mon Jul 20 17:13:48 2015 UTC,"I heard it took things from 3e but went more with a 1st edition feel.   4e sucked ass in my opinion.   Trying to MMOify PnP.  I like the content in 3e, 3.5e, PAthfinder... but my first session usually is absorbed by making characters.  1st edition (and even 2nd) I could make a pretty detailed character in 15 minutes and spend the rest of the session actually playing.   I miss that aspect.   I've heard 5th edition has brought some of that back."
Fantasy,3dwq0i,vampatori,4,Mon Jul 20 17:34:36 2015 UTC,"I came from 2nd basic (red book) and 5th feels very natural to me.  The thing I liked most about 2nd was that there were so few rules, you focus on the role-playing - however it actually had too few, there was no class/race separation, magic users couldn't do much most of the time, there were no ability checks, and so on.  So we ended up homebrewing a lot of rules.  We looked into moving to 3.5/pathfinder/4 but there they had the opposite problem.. far, far too many rules.  There was some sort of rule for everything, which meant looking it all up, and so on.  5th really sits almost perfectly between the two.  There's enough rules so that it's obviously a modern RPG game.  But, there's so few rules that you still focus on the role-playing.  And it's interesting, but most of our homebrew 2nd rules are actually in the game (some slightly different, others spot-on).  It just feels right - it's intuitive.  If I don't know the rule for something I'll just guess, and I'm almost always right (well, as DM I am always right.. but you know what I mean!)."
Fantasy,3dwq0i,deathkraiser,0,Mon Jul 20 19:38:53 2015 UTC,I heard that Wizards doesn't want to put out many (if any) splat books and wants to focus on adventures and settings.  Sounds great to me!
Fantasy,3dwq0i,AvalonBright,-1,Mon Jul 20 23:42:54 2015 UTC,"Sounds like shit. Who wants to play the same game for the better part of ten years with barely a single actual update? We have DMs, we can make our own damn campaigns."
Fantasy,3dwq0i,deathkraiser,2,Mon Jul 20 23:58:36 2015 UTC,"Well as I understand, a majority of the complaints about 3.5 and 4th Edition were about the number of splat books that bogged down and broke the game. I guess Wizards wants to try alleviate that.  Honestly I think if a system and DM are both good enough, you could easily play the same game for the better part of 10 years.  DMs can introduce new mechanics as needed for their campaigns."
Fantasy,3dwq0i,ghostchamber,2,Tue Jul 21 00:04:32 2015 UTC,Seconded. Enjoying 5th quite a bit.
Fantasy,3dwq0i,SSkorkowsky,2,Mon Jul 20 13:23:10 2015 UTC,Agreed.  Long time 1st/2nd Edition player finally converted to something new.  Cleanest RPG system I've ever found.
Fantasy,3dwq0i,MikeOfThePalace,5,Mon Jul 20 17:58:14 2015 UTC,3.5 forever.
Fantasy,3dwq0i,thoughtdancer,5,Mon Jul 20 14:25:23 2015 UTC,Does anyone have the credits on the person/company that made the cake?   I want a DIY / how to / show-and-tell on how that cake was made!
Fantasy,3dwq0i,vesi-hiisi,5,Mon Jul 20 13:20:56 2015 UTC,"it's not that hard. there are loads of geeks posting the DIY instructions to  make such cakes on instructables.com, someone even made a whole death star cake there. It's basically loads of fondant and food coloring."
Fantasy,3dwq0i,thoughtdancer,2,Mon Jul 20 14:47:52 2015 UTC,I...didn't know that website existed.  How the hell did I not know about this?   I feel like I did the day I finally found TVtropes.
Fantasy,3dwq0i,vesi-hiisi,3,Mon Jul 20 14:54:58 2015 UTC,"I have a cake decorating hobby, so that's where I found the awesome DIY stuff. They even made a superb Skyrim cake and some awesome steampunk cakes! There's all kinds of cool stuff on that site, not just food but all kinds of geeky DIY things, it's full of geeks."
Fantasy,3dwq0i,thoughtdancer,2,Mon Jul 20 15:00:08 2015 UTC,"You've made my day....  But like I said, I think I'm going to have a few hours disappear. It really does remind me of when I finally found out about TVTropes."
Fantasy,3dwq0i,vesi-hiisi,2,Mon Jul 20 15:09:28 2015 UTC,"you can follow me there, I have tons of aweosme stuff  in my favorites list, among those many geeky things (from Portal cake to Harry Potter sugar quills, beholder cupcakes, death star, etc ) http://www.instructables.com/member/rsloan2"
Fantasy,3dwq0i,thoughtdancer,2,Mon Jul 20 15:16:50 2015 UTC,"Awesome, cool.  I'm thinking about adding to the bread making, though it's been a while.  I make ""idiot's"" fruit breads."
Fantasy,3dwq0i,vesi-hiisi,2,Mon Jul 20 15:41:19 2015 UTC,I found awesome gluten free bread recipes. I have celiac and gluten free bread is too expensive so I figured I should make my own. Found a ton of great stuff too. Those beholder cupcakes are the bomb!
Fantasy,3dwq0i,thoughtdancer,1 point,Mon Jul 20 20:06:35 2015 UTC,"I can eat gluten (thought I had the problem, found out later it was my gallbladder hating it when I have too much fat at once), so my breads are very much with gluten.  But celiac is a pain!  I can see why you back your own."
Fantasy,3dwq0i,kazuri85,1 point,Mon Jul 20 20:42:27 2015 UTC,"It doesn't look super complex(tho super well done and amazing paintjob)   but it seems to mostly be flat sheets of fondant that have had stencils for lettering and then cut out with razor knife, all the book details are just flat cutouts of fondant then layered together.  Avg person could probably make something like this, wont look as professional but I bet most would look way better than grocery store cake."
Fantasy,3dwq0i,thoughtdancer,1 point,Mon Jul 20 19:28:52 2015 UTC,"I've not even started working with fondant yet.  I'm still developing my basic sweet-baked-goods skills.  (I can do yeast breads and all from scratch, but I'm at the basic pancakes and waffles when it comes to sweet doughy stuff.)"
Fantasy,3dwq0i,TLSupremacy,11,Mon Jul 20 20:41:04 2015 UTC,one of us... one of us...
Fantasy,3dwq0i,kalyissa,8,Mon Jul 20 05:11:22 2015 UTC,It's well known that Vin Diesel is a fantasy fan he has played wow and dnd in the past no idea if he still does.
Fantasy,3dwq0i,Darkchyylde,23,Mon Jul 20 05:38:33 2015 UTC,From that cake I'd say it's a safe bet he still plays.
Fantasy,3dwq0i,SSkorkowsky,4,Mon Jul 20 06:01:33 2015 UTC,"So how do we get Vin for an AMA?  I bet his take on gaming, the fantasy genre, and the industry would be fun."
Fantasy,3dwq0i,DickSmithers,7,Mon Jul 20 18:00:17 2015 UTC,"Gooble gobble, gooble gobble"
Fantasy,3dwq0i,-ArthurDent-,4,Mon Jul 20 05:08:17 2015 UTC,"We accept him, one of us."
Fantasy,3dwq0i,sar_nouraei,7,Mon Jul 20 13:36:47 2015 UTC,"Man, not that I was feeling bad about it at all, but now I feel a whole lot better for liking D&D.  Although, if it's possible to like D&D and be a bodybuilding action movie star, I now feel a whole lot worse about my other life choices!"
Fantasy,3dwq0i,Battlingdragon,7,Mon Jul 20 12:35:38 2015 UTC,"From what I understand, he got into bodybuilding because he was getting picked on in high school for being a geek. This may not be accurate though."
Fantasy,3dwq0i,sar_nouraei,10,Mon Jul 20 14:26:53 2015 UTC,"You're not helping! Now I feel even worse! When I got picked on for being a geek, I moved school to where there were lots of geeks."
Fantasy,3dwq0i,kazuri85,2,Mon Jul 20 14:31:29 2015 UTC,"Fear not, for many paths can lead to the same goal grasshopper."
Fantasy,3dwq0i,vesi-hiisi,2,Mon Jul 20 19:37:12 2015 UTC,They should have added some of these: http://www.instructables.com/id/Beholder-Cupcakes/
Fantasy,3dwq0i,Ankari,2,Mon Jul 20 14:50:47 2015 UTC,"I wonder who bought it for him. A true friend, indeed, whoever it was. Would be perfect if a beholder toy was in the Monster Manual layer!"
Fantasy,3dwq0i,axialcartographer,1 point,Mon Jul 20 05:36:41 2015 UTC,I wonder if he still plays
Fantasy,3dwq0i,AmbidextrousDyslexic,29,Mon Jul 20 05:27:57 2015 UTC,"Dude, of course he does. One does not get a themed birthday cake of a thing he doesn't do anymore. That would be like if I got my sister a zune cake when she has an iphone."
Fantasy,3dwq0i,Kelaos,9,Mon Jul 20 06:43:32 2015 UTC,"One does not stop playing D&D, one may simply take a break for we all return again"
Fantasy,3dwq0i,makinglogs,1 point,Mon Jul 20 10:57:52 2015 UTC,"Well you gotta figure if 1 out of 100 people love fantasy stuff, then 1 out of 100 celebrities must too.  I believe brent weeks was invited to a wrestling show by 'The Big Show', if I'm remembering right. Robin williams is rumored to have enjoyed at least some aspects of warhammer 40k(cant remember if he played or said he just enjoyed painting them or something?), jay from jay and silent bob also use to enjoy painting the figures.  For every hobby you have there are rich and successful people who participate. Its strange but true. I collect hobbies and every one I've went deep into I've found examples of celebrities participating.  On a slightly related, coincidental, blatant bragging note, I managed to talk to someone famous yesterday who has literally left the planet, because we share a hobby/interest. I'm bragging, but really what I'm getting at is these people are just normal people in every other way than fame.."
Fantasy,3dwq0i,Tob13,1 point,Mon Jul 20 19:48:17 2015 UTC,https://m.reddit.com/r/todayilearned/comments/1kxw56/til_vin_diesel_is_a_huge_dungeons_and_dragons_fan/
Fantasy,3dwq0i,CheckYourHead2727,1 point,Mon Jul 20 22:27:09 2015 UTC,Is he a paid endorser of this product?  Cool cake.
Fantasy,3dwq0i,Smithburg01,1 point,Tue Jul 21 00:33:39 2015 UTC,"Even though I'm pretty clueless about this stuff, I would love to play with him at some point"
Fantasy,3dwq0i,lrich1024,1 point,Mon Jul 20 10:08:39 2015 UTC,"Ah, pretty cool. My husband would love a cake like that."
Fantasy,3dwq0i,jefferyffe,-42,Mon Jul 20 11:11:03 2015 UTC,Jokes on us. Vin Diesel can't read.
Fantasy,3dzx97,tuf-havilandtuf,4,Mon Jul 20 21:56:27 2015 UTC,"I agree and disagree with him. Yes endless nitpicking is bad, but doing research and thinking through the implications of things can bring much needed depth to the fantasy world. It's a balance in my opinion"
Fantasy,3dzx97,Jota-Pe,6,Tue Jul 21 00:07:49 2015 UTC,We have a term for fantasy where everything is sufficiently rational and realistic and plausible and historically/technically/scientifically accurate to give the most pedantic of readers a chubby: hard science fiction.
Fantasy,3dzx97,starbreakerauthor,1 point,Mon Jul 20 23:06:42 2015 UTC,"Link now 404s on the site. I did a quick hunt around, but it looks like the post has been removed. Or I'm being a dingbat. If the latter, let me know..."
Fantasy,3dzx97,pornokitsch,1 point,Tue Jul 21 15:47:03 2015 UTC,"Well, durn."
Fantasy,3dzx97,pornokitsch,1 point,Tue Jul 21 15:50:59 2015 UTC,I wonder what happened!
Fantasy,3dzx97,sindeloke,-2,Tue Jul 21 17:24:59 2015 UTC,"I think he misses the point on the sexism complaint. I'm not sure anyone has ever just baldly said on reading a book ""this should be less sexist because that society wouldn't be that sexist."" They simply say ""this should be less sexist because sexism is played out, unfun, painful and ubiquitous and I just want to read something that doesn't revel in it for once,"" and then some jackhole responds with ""but it's realistic for the setting!"" And that's when people start saying ""no it isn't even that."" Also a big thing in the universe of incessantly white medieval fiction, where the automatic and universal response is the patently false ""but there only were white people in the real world version."" The defenders of he universe are the ones who bringing the idea up to begin with, and the objectors only address it to dismiss an illegitimate defense against a legitimate complaint, not because they give a damn about ""historic realism"" themselves.  Now, verisimilitude, that matters, and is a hell of a lot easier to create and maintain if you base your work on research about how people and cultures actually function. He's right that that's not absolutely necessary, but you need a fair amount of both talent and luck as a writer to go without. I think probably a fair number of readers don't realize the distinction themselves, either, so probably a lot of the ""realism""-related complaints he sees are really due to an author's failure to establish verisimilitude. After all, if a world doesn't feel real, it's a lot easier to identify and therefore blame a particular odd bit of magical physics than to parse out the nebulous quality of narrative that isn't there to make you willing to overlook it."
Fantasy,3dzx97,yourfaceisannoying,4,Tue Jul 21 07:56:50 2015 UTC,"They simply say ""this should be less sexist because sexism is played out, unfun, painful and ubiquitous and I just want to read something that doesn't revel in it for once   Firstly, you're implying any work that depicts sexist attitudes is 'reveling' in it, which is intellectually dishonest.   Second, you just called anyone making a reasonable point in a debate a 'jackhole' purely because a fact annoys you, not cool.   Listen, you are entitled to want to read fantasy that makes an effort to build a world or characters with a more progressive attitude towards equality of sexes, races etc and I'm with you on that. You are even entitled to criticise a work or its author based on your wish list of content, as long as you're not openly attacking or harassing the people involved. What you are not entitled to is expecting your demands to be met, listened to, or given any real attention. Nor are you entitled to smear, attack or generalise with labels those that don't agree with you or don't care either way."
Fantasy,3dyigr,StephenKong,32,Mon Jul 20 15:58:45 2015 UTC,"I like fantasy, but I don't read all these books as soon as they come out. I feel about as confident voting for the Hugos as I would voting in the Laotian presidential elections."
Fantasy,3dyigr,Elan-Morin-Tedronai,7,Mon Jul 20 17:59:02 2015 UTC,"That's why they started doing the voters packet, so you could read almost all of the nominated works (some publishers choose to only do excerpts)"
Fantasy,3dyigr,wishforagiraffe,4,Mon Jul 20 18:12:13 2015 UTC,"One of my favorite parts of the sci-fi year, actually, is when EscapePod buys up and reads all the hugo short-story nominees. I don't have time to read every book nominated, but the short stories are handed to me on a silver platter!"
Fantasy,3dyigr,Kiram,5,Mon Jul 20 20:56:59 2015 UTC,To vote for the Laotian president you would have to be a member of the National Assembly of Laos.   I don't know what my point is.
Fantasy,3dyigr,wurstomat,1 point,Tue Jul 21 12:10:21 2015 UTC,Worldcon members receive a packet each summer w/ the short works and excerpts from the novels.
Fantasy,3dyigr,Koppenberg,47,Tue Jul 21 14:18:05 2015 UTC,Every true fan urges George RR Martin to write.
Fantasy,3dyigr,rj20876,5,Tue Jul 21 01:29:30 2015 UTC,My first thought as well.
Fantasy,3dyigr,8nate,23,Tue Jul 21 04:55:26 2015 UTC,The only award that matters it the Stabby.
Fantasy,3dyigr,ShawnSpeakman,14,Mon Jul 20 17:47:31 2015 UTC,"The Gemmells took over 36,000 votes this year, dwarfing the Hugos despite the puppy-boost."
Fantasy,3dyigr,MarkLawrence,9,Mon Jul 20 19:37:55 2015 UTC,Both the stabby and the Gemmell Legend give a real fantasy weapon to the authors so they are both the only legitimate award.  (Legitimacy is directly related to how many damage dice you would throw if equipped with it in a role playing game)
Fantasy,3dyigr,still-at-work,11,Tue Jul 21 01:05:02 2015 UTC,"It does help one can vote as many times as one wants. Until that gets fixed, I consider the Gemmell a waste of time. The Locus Awards now, that's a proper award that dwarfs the Hugos in terms of number of voters."
Fantasy,3dyigr,tuf-havilandtuf,-9,Mon Jul 20 21:11:46 2015 UTC,That's not true.
Fantasy,3dyigr,MarkLawrence,11,Mon Jul 20 22:33:16 2015 UTC,"Yes it is. It incredibly easy to change what IP address the server sees your vote coming from, without changing computers. Off the top of my head:   Unplug your modem for few minutes. Most people get dynamic IPs assigned to them by their ISPs. When you plug it back it, it's very possible that you will get a new IP assigned to you. Even easier, use one of dozens of free or paid VPNs. Even easier than that, use one of dozens of free or paid proxies. Use some onion routing software. Go to the library and vote from there. And vote next time you're at your friend's house. Or your mom's house.   To just say it's not true that people can't vote multiple times is silly, and honestly your tone in a lot of these replies is condescending. It reads like you're using your status as an author to push people around here. Just my 2 cents there.  edit: apparently I have a hard time properly formatting bullet points on reddit."
Fantasy,3dyigr,h8theh8ers,3,Tue Jul 21 01:28:39 2015 UTC,"To just say it's not true that people can't vote multiple times is silly,   It was stated in a way that implied it was easy and permitted. That is silly and untrue.  Changing your IP is necessary but not sufficient to cheat."
Fantasy,3dyigr,MarkLawrence,2,Tue Jul 21 08:00:32 2015 UTC,"These downvotes are interesting. Each time you have merely pointed out it is not as easy to rig the system as implied, and have gotten blasted for it. They have even waffled between qualifiers, from:   any ip can vote unlimited times, to ok, any network can, to well, if I use a variety of systems to mask my ip, I can.   Finally, when you point out there are protections against that too, there is still blind denial. I mean, anyone can attempt to rig any vote system, even the Hugo (obviously). But no one claims it is rigged simply because it is possible to attempt such actions.  Reddit is odd sometimes."
Fantasy,3dyigr,Lost_Scribe,-1,Tue Jul 21 11:30:14 2015 UTC,Amen.  Perhaps it's just one guy demonstrating how easy it is to rig a poll.  :)  Ah - figured it out. 'People' have been posting links elsewhere to whip up down votes from the 'behaviour police'. LMAO.
Fantasy,3dyigr,MarkLawrence,2,Tue Jul 21 11:40:29 2015 UTC,"No, no, it's just an angry and impotent Robert Stanek back to avenge...something."
Fantasy,3dyigr,Forest_Green_,1 point,Tue Jul 21 15:49:46 2015 UTC,Really? Where? That's kinda silly. I thought the downvotes were for another reason.
Fantasy,3dyigr,tuf-havilandtuf,1 point,Tue Jul 21 15:15:44 2015 UTC,A subreddit that specialises in 'reddit dramas' and dog-piles the troops in to one side or the other. I find the downvotes highly amusing and encourage more.
Fantasy,3dyigr,MarkLawrence,4,Tue Jul 21 17:56:03 2015 UTC,"No registration required, as you pointed out yourself a few days ago. You don't have to enter your name or email address or anything. There's a button and you click on it. You don't think that might be susceptible to folks voting multiple times?"
Fantasy,3dyigr,tuf-havilandtuf,-8,Mon Jul 20 23:06:26 2015 UTC,"You just stated as fact that one can vote as many times as one wants, carrying the very strong implication that to do so is allowed / expected / trivial.  That's not true.  Obviously it's possible to cheat in any poll."
Fantasy,3dyigr,MarkLawrence,9,Mon Jul 20 23:11:34 2015 UTC,"Mark, I'm basing this on my own experience voting in the Gemmell awards. You may believe otherwise, and you're fully entitled to your opinion, but please believe me when I say with great certainty that it was extremely easy to vote multiple times in the Gemmell awards. I'm not saying many people did this, because I have no idea how widespread it was. I'm not saying it affected the results in any meaningful way, because I have no access to that information. I'm not trying to take away from the achievement of winning the award. However, if you truly believe that it's not possible to vote multiple times in an award that doesn't require any form of registration or vote identifier, you are mistaken. I hope that this vulnerability in the DGA voting process will be resolved in the future, but right now it's there for any 15 year old with rudimentary programming skills to take advantage of."
