Fantasy,3dxp0x,MikeOfThePalace,4,Mon Jul 20 12:44:55 2015 UTC,"My first book is called The Liberation of Sundrian City - and I'd say fans of Harry Potter and the Goblet of Fire. That one specifically because it has the most action, I reckon. In my first book, Linus, 13, finds out the hard way that he is a gifted war-elephant rider. This makes him overnight go from a regular kid to an extremely powerful weapon. He then has to work out where exactly to use that power - with the rebels trying to free their city, or the army, trying to protect it. The whole book is a bit of an allegory on whether it's better to live a safe life but in ignorance, or to know the truth, even if it is dangerous. It's made interesting by the fact that Linus is 13, and at 13, most boys are a bit torn between boyhood and manhood, and it's probably, in my opinion at least, the most tumultuous year of your life.   My second book is called A Duet for Swans, and geek magazine said it was ""Like reading a Miyazaki film,"" and I'd agree with that. It's book one in a trilogy, and in it a young sorcerer travels across the land in a flying tugboat looking for the ocean. It is told from the perspective of the girl Grace who wouldn't let him make the journey alone. Alex is feeling his power growing stronger, and fears that if he doesn't find a mentor, his power might become too strong to contain. His non-magical mentor sends him on an errand to complete during his trip to the ocean - to visit the evil Witch Shakti on the Black Mountain. Reading level, I would say fans of Spirited Away - meaning I've had 8-year-olds read it and 80-year-olds and they love it just the same.   I'm trapped on an island. I'm taking Golem XIV by Stansilaw Lem, Harry Potter (the whole series, if it's all the same to you...), and IT by Stephen King, cos I'm currently halfway thru it, it's long (good rereadability) and it's awesome."
Fantasy,3dxp0x,stopormymumwillpost,5,Mon Jul 20 13:26:20 2015 UTC,When are we gonna get some more of this?
Fantasy,3dxp0x,WovenMythsAuthor,3,Mon Jul 20 13:10:27 2015 UTC,"HA. My brother is making me a guitar right now, and when it's finished, I'm gonna record an EP on it. Peep it here: https://instagram.com/p/5TWa9ixd0a/"
Fantasy,3dxp0x,tomolly,4,Mon Jul 20 13:29:21 2015 UTC,"Just went by your website. Love the sepia artwork. Since it looks like it was done by one artist, should I assume that it's yours?"
Fantasy,3dxp0x,tomolly,2,Mon Jul 20 15:46:16 2015 UTC,"Thanks! I am not much of an illustrator though. The artwork from my first book, including that big banner picture on my website with the elephants charging each other, is done by Jimmy Manton, another Melbourne dude. I went to high school with Jimmy, and even back in those days when we were just kids, the guy could draw. I'd be sitting next to him squiggling stick figures in class, and I'd look over and he's just doodled a photo-like giant rhino being ridden through a dust storm into war or something. And then 10 years later, trying to track him down to get him to do the cover for my book, I learned that he wasn't even an illustrator by trade, he's an architect! Had to hound him for weeks to make him agree to draw my cover!  I love collaborating, and with a novel there really isn't that much collaborating to be done. But I think of it like, I'm making this item, a book, and I want it to be the very best I can get it, so I gather up a team of people to work on each element. The typography is always done separately from the image too, because that's a whole different art form. (On that, one advice I tell a lot of indie writers, if you are going to spend money on cover art, and have a limited budget, spend it on typography, not on an illustration. It's more important, and a crappy image with good custom type looks more professional than the other way round.)"
Fantasy,3dxp0x,tomolly,3,Mon Jul 20 23:16:44 2015 UTC,Hi Ander!  What's your favorite board game?  Favorite sport?  Which superpower would you choose?
Fantasy,3dxp0x,ashearmstrong,4,Mon Jul 20 14:23:31 2015 UTC,"Hi Tomolly. Just looking at your amazon profile, pretty nice looking collection of work!   My fav board game: The Game of Thrones board game. I played this pretty solid for a year when I lived down in Tasmania (2013), but now I'm home in Melbourne and have no one to play it with. Such an epic game.  Fav sport: Probably tennis. I don't really play or watch much sport, but I do like watching tennis and playing it. I like rally cars too, when they race.   Superpower: I'd probably say being a jumper (like the film jumper) or telekinetic like in the film chronicle (including being able to fly). I really love the bit in that film where he goes to his dad (possibly step-dad, can't remember), ""I could crush you!"" and throws him against the wall. So good."
Fantasy,3dxp0x,urlol-,2,Mon Jul 20 14:33:05 2015 UTC,"Hey, thanks, I didn't realize I was so easily found on Amazon.  Teleportation would be an extremely awesome power. Just look at what Nightcrawler did with it mixed with combat in X-Men. So cool.  I never saw Chronicle. Do you recommend it?"
Fantasy,3dxp0x,urlol-,2,Mon Jul 20 21:21:27 2015 UTC,"Yeah the robot t-rex really caught my eye. Pretty badass. Chronicle, yeah I didn't mind it. Not great... but some cool moments. Has a lot of shaky cam tho, so be warned!"
Fantasy,3dxp0x,urlol-,2,Mon Jul 20 23:08:28 2015 UTC,"Thanks, the artist did such a good job on the t-rex.  I'll look into Chronicle, thanks for the recommendation."
Fantasy,3dxp0x,G_R_Matthews,3,Tue Jul 21 04:22:19 2015 UTC,What genres would you like to see get bigger or just see more of?
Fantasy,3dxp0x,starbreakerauthor,2,Mon Jul 20 18:21:41 2015 UTC,"Hmmm, actually I don't really know. I'm not much of a genre man, to be honest. I'm reading IT right now and horror doesn't interest me in the slightest, but I'm reading it because it is more than just a horror book - it's an Epic, it's a whole town's history, and it's kind of a masterpiece! That's what interests me, different works of great art. Not so much genres, really. I loved Harry Potter, His Dark Materials, A Trio for Lute - but fantasy isn't one of my favourite genres either. I read more sci-fi than fantasy, even though I write fantasy novels.  Err... tough question, I don't think I really answered it at all!"
Fantasy,3dxp0x,starbreakerauthor,3,Mon Jul 20 23:31:06 2015 UTC,"I was in Melbourne a coupe of weeks ago, and now I look at your book cover, I realise I saw it on shelves down there. Awesome!  Umm... What do you see as the biggest roadbump as an Australian author?"
Fantasy,3dxp0x,WovenMythsAuthor,1 point,Tue Jul 21 00:55:44 2015 UTC,"That's pretty cool! Are you an Aussie? Roadbumps... I think persistence is key, especially if you're an indie author. Making a cool book isn't all it takes, you really need to stand behind it for a long time before it gets off the ground. It's not easy to do the overnight success thing, but if you stick to it long enough, you can slowly build an audience. Kind of like being a garage band, you gotta go and do the legwork yourself!"
Fantasy,3dxp0x,swish22,2,Tue Jul 21 01:23:05 2015 UTC,"I am indeed haha. Aspiring author like so many of us peon's :)   I've recently become really interested in the  phenomenon of Australian cultural cringe. It seems like many Australian's are unwilling to help support many of our creative industries, for a myriad of weird and depressing reasons. It feels as though you have to ""make it"" out out of Australia, before anyone see's your work as credible. It feels like an extension of the tall-poppy syndrome to is unfortunately lodged into our culture.  Next time I have cashola I will pick one of your things up :)"
Fantasy,3dxp0x,swish22,2,Tue Jul 21 06:45:06 2015 UTC,"Oh man, yeah don't even get me started bout that! I don't like to go on about that really, because I'm aware that I've sold a few thousand  books to aussies who are very supportive of indie artists, and who get right behind what we're doing. But yeah, the problem with especially Melbourne is that everyone is an artist, and yet most of them never do any damn art. And when you tell them you have a book out all they say is ""Oh, yeah, I'm working on a book too.""   The shops aren't much better. Getting my book in stores was the flip of what I expected - indie book sellers and pop-culture stores were either completely dismissive or kind of took it as a favour but didn't really get behind it at all. One popular pop-culture store (cough Minotaur on Elizabeth St end cough) straight up said to me when I took my book in to ask if they'd stock it, ""We don't believe in indie authors"". To which I promptly replied ""I definitely exist, I'm standing right here!"" They have a fricken 50 meter long bookshelf of sci-fi/fantasy, but won't get behind an author from their own city, making waves in the genre that the claim to be such fans of... But major book chains got right behind my stuff, promoted it in store, put it on shelves in multiple shops, put it on their blogs, etc. I guess the small indie shops can't afford to take a chance on something that might not sell, so they just call up their book distributor and say, ""30 copies of Hunger Games, 30 copies of Twilight, better make it 80 of 50 Shades...""   Errr... end rant."
Fantasy,3dxp0x,matilda93,2,Tue Jul 21 08:03:13 2015 UTC,"Oh no don't stop I love it! Hahaha. That sounds really bizarre, but I guess not completely unexpected when you flip it that way! I am a dancer as well, and once when I went into a shop looking for costumes, that they won't stock any Australian indie brands. It was a bit disheartening. The response they gave you must have been pretty shocking however.  I published a novelette last year, then proceeded to not tell anyone about it because I was afraid of backlash like that haha. I have become more thick-skinned since then however. You have inspired me to head to all the fantasy bookshops in Sydney and ask if they stock Australian artists! I know that in Brisbane, Pulp Fiction near Central station are big supporters of local talent :)  Of course, there are some absolutely amazing people out there supporting independent artists, but it unfortunately feels like a black-and-white scenario: unless you are actively supporting Australian a creatives, you are actively not supporting. It doesn't help with these recent Reclaim Australia shenanigans tying themselves so close to ""Australian Identity"", blergh. It makes sense why people want to shy away from our culture when crap like that is dragged up.  I saw on your website that you were at the Melbourne Ozcomicon. Are you thinking of coming to the Sydney one in September? I'd love to pick your brains in person haha."
Fantasy,3dxp0x,sevendeadlypings,1 point,Tue Jul 21 14:03:19 2015 UTC,"Yeah it's tough for us indies. I went to a meeting right, get this, and it was about how to get published. And it was held by publishing industry professionals. And they said that the first step these days is to be an indie author and make a name for yourself, then you can more easily get a traditional publisher. Then when you ask them how does one successfully be an indie author they just sort of mutter something about social media and shrug and change the subject. They don't know! And that's completely fair enough, cos why would they know? They are traditional publishers! But if they are saying to be indie authors, and the indie bookshops won't stock indie books, and the papers and mags and mainstream media won't review an indie book... then what can we do? We either do the legwork, or we go digital and sell our books to Americans! And watch and see, once you get an American audience, suddenly they wanna know all about you. It honestly, they only way I can understand it, is that they don't trust their own judgment on stuff. They don't know what's good, they just know what other people think is good. Even if you do get traditionally published, they aren't looking for the Next Big Thing, they are looking for their version of the current Big Thing. They don't trust themselves to go ""This new thing here is gonna be HUGE!"" The most faith they can stock in their opinions is ""Wow, this was reminiscent of that other thing that was popular!"" Our inability to read something and go ""Heh, I liked that!"" without relying on popular opinion to guide our opinion is turning literature into utter trash.   My advice: stick to your guns. Write what you think is important. Someone, eventually, will come up to you and go ""Wow, I really got that! Thank you for writing what you wrote, it meant a lot to me!"", and it'll be worth a hell of a lot to ya!   But hey, I'm no best-seller.   Oh, and I probably won't be at that con, but I will be at one in Sydney soon. Supanova, Anime thingy, or Ozcc. Follow my FB probably is the best way to see where I'll be."
Fantasy,3dzf8l,DickSmithers,4,Mon Jul 20 19:49:37 2015 UTC,"East of Eden.  I've read a fair bit of ""serious literature"" for school,  but that's the only one I enjoyed enough to reread purely for fun.  It's a bit of a tough one to describe; it takes place following two different families over a few generations, it's sort of a analysis/retelling of the Biblical story of Cain and Abel, and has some interesting insights into good, evil, and human nature.  (I did also reread Crime and Punishment... but more because I was interested in it philosophically than because I enjoyed the experience of reading it)"
Fantasy,3dzf8l,Retsam19,1 point,Tue Jul 21 00:09:46 2015 UTC,"Oh god yes, East of Eden is my favorite non-fantasy book. I love the main themes of the book and the characters."
Fantasy,3dzf8l,CowDefenestrator,6,Tue Jul 21 05:57:03 2015 UTC,"Oh boy. Time to shine. Once every year or so I pick one of the big names and read as much of their shit as I can stand. Just because I want to know what the fuss is all about.  Your examples I've read. Big fan of Count. In that vein I also read Don Quijote and Les Mis. Both alright but do they ever drag. As does Moby Dick. Liked reading Gulliver, Musketeers and Crusoe. More adventure to keep my attention. Same with Huck Finn and the like.  Read about half of Shakespeare's works over the years. Many I didn't care for (those various King named books) but a big fan of Midsummer Night's Dream, Hamlet and Tempest. Also MacBeth way back when in school. Never felt the need to re-read it, but it was one of the more enjoyable mandatory reading experiences.  From the classical period, I've read the Iliad and Odyssey both in 'original' if translated versions as in modernizations. I've read some of Plutarch's accounts. I've read a few of Caesars books. Specifically Bello Gallico and his treatise on the Civil War. Can only rec all of that, especially Caesars accounts. A real life source talking to you from 2000 years ago. Incredibly fascinating, if obviously biased, read if you keep that in mind. The Civil War account is pretty much Game of Thrones with Romans.  I've read the Dystopian Triumvirate, Fahrenheit, 1984 and Brave New World. All good, though I like BNW the most out of the three.  Jane Austen's books were a thing I once really forced myself to read. It's alright, but I wouldn't exactly recommend it. Liked it well enough overall but I'll probably never touch them again.  Read Tolstoi. If you want historical epic, you can't go wrong here. Sometimes tedious, but I liked it overall. The scope makes his books.  My favourite ever 'classic' author would be Kafka. His shorts have this wicked, twisted, experimental feel to them. As do his books, but there aren't many of those. I think I've read everything he's ever written prose-wise. (Don't care for correspondence.) I liked him because I could only take him in small doses, but one of the few authors that made me think after consumption and re-read after.  Don't know how much of it counts as classic, but being German I've read all of Günther Grass. And it's good, weird reading if you want to read literature level prose with Nazis in it. No idea of the translated quality, but his prose is top notch if dry.  Again, as a German, I've had to and sometimes by my own free will, read Goethe. Faust 1+2 is pretty fun for all the wrong/ right reasons. Sorrows of Young Werther is bullshit emo bullshit for emos.  In a more Fantasy vein, everyone should read Lovecraft and Poe. I did, and don't much care for Poe, with notable exceptions like 'The Masque of the Red Death'. (That story is gorgeuosly morbid. Bit in your face with its message, but I loved it.) Still, hugely influential. If you're interested in the roots of the genre, even if it's more Horror than plain Fantasy, you need to read Poe.  In the same vein, if you're interested in the genres roots, read Schillers The Ghost Seer. Necromancy in the 1700s. (He also wrote a version of Jeanne D'arc which I liked very much.)   In the same vein, everyone should give Chaucers Canterbury Tales a go. It's basically an anthology without a theme. The genres switch with every tale.  Burroughs and Howard are well worth a read for similar reasons. You need to be able to put up with cheese and tropey tropes. Just because something is tropey though, doesn't mean it's not entertaining. Barsoom is entertaining as shit. B-movie/ Flash Gordon like fun. Same for Conan.  There are more, but I'll stop now. Honestly, while I didn't like all, I found something to like in most any classic I attempted. They're classics for a reason. With one exception...  Fucking Ulysses. Maybe I need to be Irish or something, but that thing gave me nothing at all. I've read the different reading approach recs, don't bother trying to help, that tome will remain a secret to me. And that's fine."
Fantasy,3dzf8l,eferoth,2,Mon Jul 20 21:40:38 2015 UTC,Have you read We by Zamyatin? I would make it a Dystopian Quadrumvirate and throw We in there.
Fantasy,3dzf8l,ryanstorm,2,Tue Jul 21 03:58:02 2015 UTC,I like We the best out of those four. Recently I've bought a few different translations of it and I'm thinking about reading em all in a row.
Fantasy,3dzf8l,cantrelate,1 point,Tue Jul 21 04:49:26 2015 UTC,"Nope. I own it since ever because of that, never got around to it though and plain forgot. Thanks for the reminder."
Fantasy,3dzf8l,eferoth,1 point,Tue Jul 21 08:52:20 2015 UTC,"Wow. You are very well read. I need to read more classics tbh.   I love Poe. His short ""Ligeia"" has always been a favorite, along with ""The Cask of Amontillado""."
Fantasy,3dzf8l,lrich1024,3,Mon Jul 20 22:39:02 2015 UTC,"Conqueror Worm, an tombing in your victims, eh?  Being well read is unnecessary. Motives/ Themes repeat. The interest lies in 'who did it first', and none of them did I think . Original is lost to the ages.  If you don't enjoy the writing, ignore it. Yeah, it gives perspective, doesn't mean nowadays copy-cats won't do it better suited to current tastes."
Fantasy,3dzf8l,eferoth,1 point,Mon Jul 20 23:20:07 2015 UTC,"Not so much the tombing in my victims (although that is appealing, I will admit), but the whole 'I still get to go to Heaven because of this loophole in my religion' aspect. I've always found that fascinating."
Fantasy,3dzf8l,lrich1024,1 point,Mon Jul 20 23:39:32 2015 UTC,"Freaking Werther!! I expected emo but a bit more relatable. I think even Goethe regretted it, he was very young when he wrote it after all. I really want to read Faust though but I have to read Marlowe's first."
Fantasy,3dzf8l,Frances_Cauldhame,3,Tue Jul 21 02:18:02 2015 UTC,Siddhartha by Hermann Hesse
Fantasy,3dzf8l,alienbro48,1 point,Mon Jul 20 20:19:35 2015 UTC,"Siddhartha was a good read, but I think I liked Damien by Hesse even more.  Both books are worth reading, though."
Fantasy,3dzf8l,Deltia,5,Tue Jul 21 05:09:48 2015 UTC,The Sharpes books by Bernard Cornwell.
Fantasy,3dzf8l,p0x0rz,7,Mon Jul 20 20:03:26 2015 UTC,"And the series. Sean Bean's many on screen deaths are just balancing the scales for all the time he spent as that unkillable god of war Richard Shape.  The series production values aren't great, having been made on a shoestring budget, but the acting is superb."
Fantasy,3dzf8l,MikeOfThePalace,3,Mon Jul 20 20:10:25 2015 UTC,"I had no idea there was a series with bean as Sharpe. Gonna have to watch this, now."
Fantasy,3dzf8l,p0x0rz,1 point,Mon Jul 20 23:06:39 2015 UTC,"And he doesn't die, either."
Fantasy,3dzf8l,crowqueen,2,Tue Jul 21 10:32:38 2015 UTC,SPOILERS YO
Fantasy,3dzf8l,p0x0rz,2,Tue Jul 21 19:05:18 2015 UTC,Well no. But then if he did the series would be fairly short.
Fantasy,3dzf8l,crowqueen,2,Tue Jul 21 19:34:47 2015 UTC,"Thanks for reminding me of them! I picked quite a few up in a second hand bookstore expecting them to be mediocre, but they turned out to be quite the fun read."
Fantasy,3dzf8l,vetw,6,Mon Jul 20 21:58:53 2015 UTC,"The Three Musketeers. A rolicking story of adventure and intrigue, plus being funny as all hell."
Fantasy,3dzf8l,MikeOfThePalace,2,Mon Jul 20 20:11:16 2015 UTC,I finally read this about 10 years ago and loved it! The characters were what made this story but I always felt D'Artagnan was the weakest out the four.
Fantasy,3dzf8l,WovenMythsAuthor,1 point,Mon Jul 20 20:33:26 2015 UTC,"Check out Brust's Khaavren Romance series if you want to see a hilarious, well-written fantasy pastiche of Dumas."
Fantasy,3dzf8l,turtledief,1 point,Mon Jul 20 21:29:20 2015 UTC,Count of Monte Cristo got me to Dumas. Good fun!
Fantasy,3dzf8l,gunnapackofsammiches,2,Tue Jul 21 00:06:56 2015 UTC,Wuthering Heights by Emily Bronte - she's one of the original Grimdark authors.
Fantasy,3dzf8l,Mr_Noyes,2,Mon Jul 20 20:56:24 2015 UTC,Hmm. Classic books that I occationally reread:   The Little Prince Jane Eyre Jane of Lantern Hill   Then of course there are classic works which are fantastical like the Professor Challenger books by Sir Arthur Conan Doyle.
Fantasy,3dzf8l,kzielinski,2,Mon Jul 20 23:41:13 2015 UTC,The Hobbit?
Fantasy,3dzf8l,APLemma,2,Tue Jul 21 03:17:46 2015 UTC,Vonnegut! Each and every thing he's written. And of course The Count of Monte Cristo. And Im shocked no ones mentioned The Sword in the Stone/The Once and Future King.
Fantasy,3dzf8l,blaissed,3,Tue Jul 21 04:53:46 2015 UTC,Jane Austen's stuff can pass as a modern YA historical novels.
Fantasy,3dzf8l,wave32,2,Mon Jul 20 20:36:05 2015 UTC,1984 is my favorite that is at all related to fantasy. Lolita I love for totally different reasons. The Adventures of Sherlock Holmes is really good as well. Hard to believe it's the only book (and only a short story within it) with Irene Adler in it.
Fantasy,3dzf8l,NoNoNota1,1 point,Mon Jul 20 21:35:33 2015 UTC,"I love John Steinbeck for his melancholy, his tone, and his visual imagery.  I love Cormac McCarthy for his brevity, his violence, and his realism.  And, farther from classic or modern classic, I love John Irving for his surrealism, his characterization, and his epic scale."
Fantasy,3dzf8l,justamathnerd,2,Mon Jul 20 22:17:33 2015 UTC,"Classics...hmm.  Austen. I love Austen. Favorite is Persuasion. I feel like a lot of people read her for the romance, but the social commentary and her really silly characters are what attract me most.  To Kill a Mockingbird. Damn, I just loved that book.  The Good Earth. Not sure why but that book always stayed with me, just one of those great and terrible tales.  A lot of Shakespeare. Not really the histories, but much of the other stuff. (And maybe I'm a traitor to my gender because I love The Taming of the Shrew for some reason....)  Poe.   Jane Eyre by Charlotte Bronte.  Probably more that I can't think of at the moment."
Fantasy,3dzf8l,lrich1024,1 point,Mon Jul 20 22:50:53 2015 UTC,Jules Verne all the way.
Fantasy,3dzf8l,koos_koos_,1 point,Mon Jul 20 23:48:23 2015 UTC,The Count of Monte Cristo Dracula Frankenstein Pride and Prejudice Strange Case of Dr. Jekyll and Mr. Hyde Robinson Crusoe Crime and Punishment Faust We (a Russian dystopian by Yevgeny Zamyatin)
Fantasy,3dzf8l,starbreakerauthor,2,Tue Jul 21 00:13:53 2015 UTC,"Nice to see C&P getting the love from this thread. When I read it, it was far and away the most accessible of the big classic books, and I think it's one of the best stories out there."
Fantasy,3dzf8l,crowqueen,2,Tue Jul 21 10:35:36 2015 UTC,"I like almost all of the ones typically considered classics. In fact, it'd probably be easier to list the ones I wasn't particularly fond of. Didn't really like Catcher in the Rye or War and Peace, and hated On the Road.  My favorite modern classics are probably 1984, To Kill a Mockingbird, and Catch 22."
Fantasy,3dzf8l,ansate,1 point,Tue Jul 21 03:02:59 2015 UTC,Love Joseph Heller!
Fantasy,3dzf8l,blaissed,1 point,Tue Jul 21 04:54:28 2015 UTC,"I try to read as many classics as I can but I'm a somewhat slow reader. Some of my favourites are Death in Venice, The Red and the Black and obviously, The Catcher in the Rye.  However I feel compelled to earnestly recommend Jorge Luis Borges, who's more of a modern classic. He writes short stories and Ficciones is a mind-blowing collection that has had a great impact on me as a reader, I wish everyone would read it. Borges has a very peculiar approach to fiction and although he's sometimes associated with science fiction I think he's as close to it as he's to fantasy."
Fantasy,3dzf8l,Frances_Cauldhame,1 point,Tue Jul 21 03:05:10 2015 UTC,"I loved To Kill a Mockingbird.  Other classics I've really enjoyed were Pride and Prejudice, Jane Eyre, Ivanhoe, several of Edgar Allan Poe's short stories, East Wind, West Wind and The Pavilion of Women (but not The Good Earth), several of Shakespeare's plays, Anne of Green Gables, Alice in Wonderland and The Wizard of Oz, Brave New World, The Trumpet of the Swan, 1001 Arabian Nights, I could probably keep going on and on but I'll stop now. :)"
