Fantasy,3e3cdz,MLBrennan,2,Tue Jul 21 17:15:57 2015 UTC,"Archer's Goon by Dianna Wynn Jones has a list of ""things this book will prove"" my favourite one that makes me laugh everytime I read it (making me grin just writing it) Is  when an imovable object meets and irresitable force the resuktbis a family fight  Also from the same book an exchange between a writer and his daughter 'Awful'  W - ""what does it matter to Awful that I am a famous author and my name is a household word"" A - ""so is drains a household word"""
Fantasy,3e3cdz,manyshaped,1 point,Tue Jul 21 17:50:53 2015 UTC,"One fantasy author who has always made me laugh was the late Brian Jacques with his Redwall series. His non-traditional speakers, specifically the moles and the hares, always had hilarious things to say, and unique dialects to say them in! This has made his series re-readable into adulthood, as his hilarious magic carries over from each reading."
Fantasy,3e3cdz,gdavis57,1 point,Tue Jul 21 17:40:18 2015 UTC,"I have to say that the ""The Road to Gandolfo"" by Robert Ludlum made me bend over laughing the entire time I was reading it.  A plot to kidnap the pope to make millions of money off ransoming him to the world's Catholics?  Genius"
Fantasy,3e3cdz,DrBodyguard,1 point,Tue Jul 21 17:50:16 2015 UTC,"My response is a bit meta, unfortunately.  I am currently reading The Sword of Shannara, but the annotated edition.  I am finding the annotations to be unintentionally hilarious, as they are incredibly serious and ignore all of the problems with the book.  I haven't read it in decades, so I am largely coming at it as if I am reading it for the first time.  The writing is clunky, the descriptions are overdrawn, and the characterization is rough.  Of course, it is a first novel, and Brooks gets better as his writing goes on.  But I just wonder what went through his mind as he was rereading this and annotating it.  There are pages and pages with no comments at all, and I just wish there was more, where he would talk about the problems and how he learned from them.  The funniest thing so far is what I read last night, where he told his whole theory on brothers, where he had already had two sets of brothers who got along, so he figured that he now needed a set of brothers who did not get along.  Really?  Was that really what he thought about as he was writing it in the 1970s?"
Fantasy,3e3cdz,scottrice98,1 point,Tue Jul 21 18:06:08 2015 UTC,I have to go with a classic in which two of my favorite authors Terry Pratchett and Neil Gaiman collaborated and created Good Omens(and please don't tell me that it isn't a Fantasy book).  And my favorite scene is the one where we find out how Crowley(your rather friendly demon) makes his flowers grow so excellent and sadly I have tried his method without success but maybe I'm not terrifying enough.
Fantasy,3e3cdz,Liamine,1 point,Tue Jul 21 18:09:34 2015 UTC,"There are too many funny moments to be terribly specific, but Kevin Hearne's Iron Druid Chronicles often have turns of phrase that make me laugh - notably 'douche canoe' and 'monstrous fuck puddle'.  Lois McMaster Bujold's Vorkosigan Saga makes me howl with laughter every time, if only because her hero's snarky internal monologue is fairly close to the kind of thing that runs through my head."
Fantasy,3e3cdz,MahrialDiSilvanus,2,Tue Jul 21 18:12:24 2015 UTC,"""There. There,” said the marquis de Carabas, awkwardly, patting her shoulder. And he added, for good measure, “There.” He did not comfort well.   Neil Gaiman, Neverwhere  It wasn't a very funny moment in the book but I laughed because that's literally what I do when someone cries in front of me."
Fantasy,3e3cdz,7el-3ane,1 point,Tue Jul 21 18:15:59 2015 UTC,"Simple. In Rhys A. Jones's THE BEAST OF SEABOURNE, a YA fantasy, one character chastises another for special stupidity:  ""You mollusc."""
Fantasy,3e3cdz,SheckyX,1 point,Tue Jul 21 18:21:44 2015 UTC,"“The story so far: In the beginning the Universe was created. This has made a lot of people very angry and been widely regarded as a bad move.”  ― Douglas Adams, The Restaurant at the End of the Universe"
Fantasy,3e3cdz,mirrordog,1 point,Tue Jul 21 18:21:51 2015 UTC,My favorite comedy moment in a SF/F book has got to be in Jim Butcher's Side Jobs the short story about Harry's day off where he had to deal with the Psychic flees on Andi and Kirby and Molly using the lab unsupervised for the first time.  That whole short story had me cracking up.
Fantasy,3e3cdz,thetateman,2,Tue Jul 21 18:27:17 2015 UTC,"The four of our favorite characters from Lies Of Locke Lamora. I remember I was drinking watermelon juice when I read the below lines   “... It's perfect! Locke would appreciate it.""  ""Bug,"" Calo said, ""Locke is our brother and our love for him knows no bounds. But the four most fatal words in the Therin language are 'Locke would appreciate it.'""  ""Rivalled only by 'Locke taught me a new trick,'"" added Galo.  ""The only person who gets away with Locke Lamora games ...""  ""... is Locke ...""  ""... because we think the gods are saving him up for a really big death. Something with knives and hot irons ...""  ""... and fifty thousand cheering spectators.”   just spit out red watermelon juice all over the book. Stained and now the book looks like a spectator in a gruesome vampire showdown."
Fantasy,3e3cdz,arzvi,1 point,Tue Jul 21 18:28:48 2015 UTC,"My most recent SF/F laugh out loud moments are all from the comic series Saga. From the very first pages of the first issue where Alana is giving birth to her daughter, I laughed fairly regularly. The dialogue especially between the two main characters combined with the magic of Fiona Staples's art was thoroughly entertaining."
Fantasy,3e3cdz,sekhmet4,1 point,Tue Jul 21 18:47:51 2015 UTC,"The Way of Kings by Brandon Sanderson /u/mistborn. I enjoy Shallan's sharp wit and have laughed on many occasions. One example is when she was talking to Davar. Davar says, “Brightness...I believe you stray into sarcasm."" Shallan counters with, ""Funny. I thought I'd run straight into it, screaming at the top of my lungs.”"
Fantasy,3e3cdz,BaconWise,1 point,Tue Jul 21 19:02:11 2015 UTC,"Im currently reading through Dark Tower Book 3: The Waste Lands and during the part where Roland begins to describe a time travel theory of his, Susannah says "" I see, I think. This time travel business is some confusing shit, isnt it?"". Made me bust out laughing in the middle of the night. I liked how she was speaking for herself and the reader at the same time."
Fantasy,3e3cdz,gholaday,1 point,Tue Jul 21 19:02:50 2015 UTC,"Chris Holm's Collector series is a riot. The main character is basically Hell's repo man: if you made a deal with a demon, he's the one that comes to collect your soul. As a result, his humor is quite dark, but it made me laugh often."
Fantasy,3e3cdz,blitzschmeiss,1 point,Tue Jul 21 19:15:50 2015 UTC,"I’ve fought in three campaigns,” he began. “In seven pitched battles. In countless raids and skirmishes and desperate defences, and bloody actions of every kind. I’ve fought in the driving snow, the blasting wind, the middle of the night. I’ve been fighting all my life, one enemy or another, one friend or another. I’ve known little else. I’ve seen men killed for a word, for a look, for nothing at all. A woman tried to stab me once for killing her husband, and I threw her down a well. And that’s far from the worst of it. Life used to be cheap as dirt to me. Cheaper.  Dark brooding and violent yet I couldn't help but laugh at the brave woman who ended up in a well for trying to stab the Bloody-nine.  Joe Abercrombie The First Law Series. I highly recommend!"
Fantasy,3e3cdz,Sour_Badger,2,Tue Jul 21 19:16:48 2015 UTC,"In House of Chains by Steven Erickson there is a dialogue that goes something like:  ""So soldier do you have a name?""  ""Maybe""  ""Well, what is it then?""  ""I just told you...""  (His name is Maybe)"
Fantasy,3e3cdz,wedge713,1 point,Tue Jul 21 19:18:28 2015 UTC,"Not entering the contest, I already own all of your novels and already have Dark Ascension pre-ordered.  Just wanted to say thanks for writing one of my favorite Urban Fantasy series."
Fantasy,3e3cdz,Axenos,1 point,Tue Jul 21 19:19:09 2015 UTC,I share all my fantasy books with my younger cousins so that we can bond over good literature. I recently gave one of them The Lies of Locke Lamora while I was reading Red Seas Under Red Skies. Both books at points had us simultaneously laughing hysterically.  I'd love to snag copies of your books so that I could share them with the next generation. :)
Fantasy,3e3cdz,jachreja,1 point,Tue Jul 21 19:35:23 2015 UTC,"The ""swearing"" in the WOT series.  ""Fish loving scavenger"", ""Sheep swallop"", and ""Goat spawned toad"" are a few highlights."
Fantasy,3e3cdz,KittenRaffle,1 point,Tue Jul 21 19:54:08 2015 UTC,"“She did love to talk, Margaret did.” “Don't they all,” Tristan says. “They say that Eve came from Adam's rib, but I think she must have come from his jaw.”  ― Roberto Calas, The Scourge  There's so many more dark and witty lines in that book. Tristan is just a sarcastic guy, just my type of humor. The other lines escape me at the moment."
Fantasy,3e3cdz,peterspancakes,1 point,Tue Jul 21 19:58:15 2015 UTC,"So much Terry Pratchett. Ranging from subtle philosophical smiles to laughing out and waking my woman.   I'm gonna go with one that has stuck with me:  ""The trouble with having an open mind, of course, is that people will insist on coming along and trying to put things in it."""
Fantasy,3e3cdz,Jimmith,1 point,Tue Jul 21 20:08:12 2015 UTC,"I was reading a book once (can't remember the name) and suddenly, out of nowhere, it read like a really bad fanfiction. Just the protagonist, laying on a balcony and some sort of vampire-angel (naked of course) descended from who-knows-where and they make vivid love. The whole situation, completely riped out of the main story just made me laugh for a good twenty minutes. It wasn't even that funny, but just the thought that the author got randomly horny and just channeled his inner Smut-Fic-Author."
Fantasy,3e3cdz,Alianos,1 point,Tue Jul 21 20:25:29 2015 UTC,"Just re-read a childhood favorite. The Keys to the Kingdom by Garth Nix. All the stuff the Piper's children say is just hilarious.  ""Likely we’ll be fighting Saturday’s lot and the Piper’s Newniths, but if we can make them fight each other, that’ll be better. Any questions?’ A Piper’s child near the front raised his hand. ‘What do ye call a Denizen with a sore foot?’ ‘I dunno,’ said Suzy. ‘What do you call a Denizen with a sore foot?’ ‘Well, I dunno either,’ said the Piper’s child. ‘That’s why I asked; I heard someone tell the first half of the joke in the elevator on the way up here but never the rest.’  ‘Newniths at nine o’clock!’ shouted Fred, quickly adding, ‘That’s west!’ as several Raiders got out their watches for the joke."
Fantasy,3e3cdz,ReallyNotRicardo,1 point,Tue Jul 21 20:41:03 2015 UTC,"I'm gonna cheat and use a webcomic. Eight Bit Theater. If you haven't read it, do yourself a favor and read it. If you have, I would like to mention the greatest brick joke in webcomic history. In the beginning of the comic strip, Black mage is running away from a giant. He consults a gaming magazine on the way and rejects one solution because it requires four White Mages to work. At the end, the Big Bad of the series reveals himself and is about to destroy the anti heroes and the world when he explodes. When the dust settles, what do we see? Four White mages. From set up to punchline it was nine years and about two thousand pages worth of comics.  Also I would like to mention another great joke but this one I won't spoil. The identity of Sarda, the demented all powerful mage who has been toying with the party from the moment they met him.  Edit - In case you don't accept webcomics (in which case shame on you) I have another one. In Scott Lynch's The Lies of Locke Lamora we get the fantastic line 'There's a few things I'm going to ask him. Philosophical questions, like 'How does it feel to be dangled out a window by a rope tied to your balls motherfucker?'' You can't deny the powerful imagery in the words of Scott Lynch."
Fantasy,3e3cdz,pitaenigma,1 point,Tue Jul 21 20:48:26 2015 UTC,"I hope this counts as technically it's a graphic novel, but hey""  ""There is no talking Back Here/ There is no unspoken Agreement to leave you with a scrap of dignity/ There is, in fact, no guarantee you'll be able to walk out of here/ LISTEN TO THE CHAIR LEG OF TRUTH! IT DOES NOT LIE/ What does it say?/ It's saying ""Shut up Fred""!/ Can you hear it?""  Transmetropolitan #50 - Warren Ellis and art by Darick Robertson  I fell out of my chair laughing at this page. I love the idea that there is nothing more honest than a chair leg to the face. There is no ambiguity there."
Fantasy,3e3cdz,22cthulu,1 point,Tue Jul 21 21:08:17 2015 UTC,The plate stretcher that Robert asks for in game of thrones. Picturing it in my head had me laughing a good bit.
Fantasy,3e3cdz,Mr_LIMP_Xxxx,1 point,Tue Jul 21 21:27:35 2015 UTC,"Chapter 16 of /u/MarkLawrence's Prince of Fools ends with Prince Jalan finding out that Brother Emmer gets what Brother Emmer wants. And not only does the good prince save half a silver ducet, he gets a copper crown of his own the next morning!   That's all I'm going to say (because spoilers suck) but the entire sequence had me howling."
Fantasy,3e3cdz,Halaku,1 point,Tue Jul 21 17:29:41 2015 UTC,"I'm going to go with Stardust. The Star has fallen from the heavens in a blaze of light and sound, and then:   And there was a voice, a high clear, female voice, which said ""Ow"", and then, very quietly, it said ""Fuck"", and then it said ""Ow"", once more.   Reddit's formatting doesn't quite do it, but the ""fuck"" is printed in a very small font. It's just such a human way to react that I had to laugh."
Fantasy,3e3cdz,MikeOfThePalace,1 point,Tue Jul 21 17:34:50 2015 UTC,"So this might be a bit atypical, but I remember reading the ""Broken Empire"" series by Mark Lawrence, and actually laughing quite often.  There's this specific part of the last book, where the protagonist, an otherwise rational and emotionally cold young guy, decides that he simply won't go down. So he goes on a murderous rampage, mercilessly slaughtering the enemy army, using his own band of psychopathic friends and a bunch of goat herders in the process. He does so out of pure stubbornness and rage.  The scene itself is not funny at all, it's actually rather morbid, but his single-mindedness and zeal really rubbed off on me. I spent 20 minutes reading that passage, and all of that time I was smiling broadly, with the occasional hysterical laugh and grunt. Looking back, I'm really just happy no one else was there to witness me..."
Fantasy,3e3rzo,Kassaapparat,11,Tue Jul 21 19:01:31 2015 UTC,"Lord of the Rings, for one. Read and reread and reread again since I was about 10.  And then there's The Wheel of Time. I have no idea how many times I've reread it since I first picked it up in 1996, since if I wasn't in the middle of a full reread I would often skip around and read favorite parts, or over character's striking story line, that sort of thing. I took a couple years off after aMoL, since i needed the to adjust to the fact that I was no longer waiting for the next book. I only recently started an audio book reread again."
Fantasy,3e3rzo,MikeOfThePalace,9,Tue Jul 21 19:28:32 2015 UTC,"I've reread the Redwall books about 20 times in my life, though all of those were before the age of fifteen. I just read them over, and over, and over when I was a kid.  My Dad introduced me to The Hitchhiker's Guide to the Galaxy when I was about sixteen, and I've probably read it bi-annually since then...So about ten times? Twelve?  As far as current works go, the only series I've reread are The Malazan Book of the Fallen, which is practically written with the idea of rereads in mind, and The Riyria Revelations, another series with tons of stuff you miss the first readthrough."
Fantasy,3e3rzo,p0x0rz,2,Tue Jul 21 19:08:28 2015 UTC,"I missed out on the Redwall books. It's one of those memories I have of friends loving something that, for whatever reason, I never tried. I regret that - I wish I'd immersed myself in more of those things when my friends were all about it instead of trying to be cool by not caring. Or whatever my motivation was (like pretending not to like Power Rangers then rushing home to watch it in secret).  When did this turn into a confessional thread?"
Fantasy,3e3rzo,jayonaboat,6,Tue Jul 21 20:13:56 2015 UTC,Dragonlance. I've read them sooo many times
Fantasy,3e3rzo,thatbookchick,2,Tue Jul 21 19:53:50 2015 UTC,I'm just about to re-read the Chronicles (Autumn/Winter/Spring) again! Should be ~7th time for me.
Fantasy,3e3rzo,ShameSpear,1 point,Tue Jul 21 21:22:50 2015 UTC,Awesome. They're by far my favorites. I've read Soulforge about 23 times
Fantasy,3e3rzo,thatbookchick,1 point,Tue Jul 21 21:24:01 2015 UTC,I'm just about to re-read the Chronicles (Autumn/Winter/Spring) again! Should be ~7th time for me.
Fantasy,3e3rzo,ShameSpear,5,Tue Jul 21 21:23:03 2015 UTC,Harry Potter. Read them as they where published and reread the series whenever a new book was released.
Fantasy,3e3rzo,Jernsaxe,5,Tue Jul 21 19:16:38 2015 UTC,I am going to be really original and say Harry Potter. I have read the first one so many times. Probably 40ish. I actually just finished listening to the series last week. Have not gotten sick of them yet.  The other big ones are The Chronicles of Narnia. The Magician's Nephew was my favorite.
Fantasy,3e3rzo,JayRedEye,2,Tue Jul 21 19:20:27 2015 UTC,"The Magician's Nephew was my favorite.   Only read the series once, but The Magician's Nephew was also my favorite. The Wood Between The Worlds was fascinating to me. I'd love to see it made into a movie."
Fantasy,3e3rzo,krayziepunk13,5,Tue Jul 21 20:59:21 2015 UTC,"Kushiel's Dart. I don't even know how many times I've read it, but a lot. Also Damia by Anne McCaffrey (which is probably more SF...)"
Fantasy,3e3rzo,lrich1024,4,Tue Jul 21 20:02:35 2015 UTC,Homeland by R.A. Salvatore. It is chronologically the first Drizzt book and takes me back to a different Era for both me and fantasy. I loved reading Drizzt training and coming of age story.   I haven't read any of the new ones on the last 10 years or so because they no longer fit my tastes but I enjoy Homeland still.
Fantasy,3e3rzo,Curry_Ramen,3,Tue Jul 21 20:06:31 2015 UTC,"I don't re-read a lot, but I've read The Silmarillion about 4 times. For me that's a lot"
Fantasy,3e3rzo,erai91,3,Tue Jul 21 19:25:58 2015 UTC,"Harry Potter. Probably read all of them 50+ times. Also, all the Pern books by Anne McCaffrey, Kushiel's books by Jacqueline Carey and Melanie Rawn's DragonPrince/DragonStar trilogies.  They're all my ""comfort"" reading now, I'm trying to branch out more."
Fantasy,3e3rzo,DoesTheOctopusCare,3,Tue Jul 21 20:10:02 2015 UTC,"Dresden Files. For a couple of years in highschool, they were the only books I had on my iPod touch. So I read and reread them many times."
Fantasy,3e3rzo,TristanTheViking,4,Tue Jul 21 20:18:37 2015 UTC,"Yeah I imagine it's Harry Potter and the Sorcerer's Stone. As a kid you just have so much more free time, and so much less to read. And it's not that long a book. I can't even guess the number of times I've read it. Same goes for a lot of the first half of that series, but the first book is always going to be the most.  From my adult life I'd say it's probably The Name of the Wind, which is at 3 reads. Though I have to imagine The Way of Kings is going to eventually outdo it over the next decade as I decide to do rereads in prep for a new Stormlight book."
Fantasy,3e3rzo,SageOfTheWise,3,Tue Jul 21 19:07:38 2015 UTC,Have to be a tie between one of the Discworld novels (likely Guards! Guards! or Small Gods) and Eye of the World (only because I re-read the whole series each time a new book came out).
Fantasy,3e3rzo,CerebralBypass,2,Tue Jul 21 19:08:51 2015 UTC,The Black Company by Glen Cook currently on my 6th reread/relisten. Not just the first book but the entire series.
Fantasy,3e3rzo,hausarian,1 point,Tue Jul 21 19:48:49 2015 UTC,"Was my first run-in with ""important story characters are not invincible!""   I read that right after the first Drizzt books when I was younger, was something totally different."
Fantasy,3e3rzo,Stranger371,2,Tue Jul 21 21:20:46 2015 UTC,Probably A Wizard of Earthsea by Ursula K. LeGuin.
Fantasy,3e3rzo,Vadhakara,4,Tue Jul 21 20:36:07 2015 UTC,"My own, because I have to remember what I wrote so I don't contradict myself in future books.  Luckily, i'm a big M. Todd Gallowglas fanboy.  Other than that, it's probably a tie between my big tome of Harlan Ellison and Steven Erikson."
Fantasy,3e3rzo,mgallowglas,2,Tue Jul 21 19:12:26 2015 UTC,Malazan Book of the Fallen.  I've reread all ten books at least 5 times now.
Fantasy,3e3rzo,420DnD,1 point,Tue Jul 21 19:18:34 2015 UTC,I re-read many of the first books of Discworld
Fantasy,3e3rzo,Tubilok,1 point,Tue Jul 21 19:44:28 2015 UTC,"Same as some others, Harry Potter, lotr, and wot are probably what I've read the most. Followed pretty closely by Narnia"
Fantasy,3e3rzo,wishforagiraffe,1 point,Tue Jul 21 19:50:30 2015 UTC,"I've read through the wheel of time about six times now (or rather listened as I'm a delivery driver), same with kingkiller by rothfuss. Sandersons stormlight and lynchs bastards at twice a piece."
Fantasy,3e3rzo,hxcscarecrow,1 point,Tue Jul 21 20:00:59 2015 UTC,"I love rereading. The winners are probably Name of the Wind and Wise Man's Fear - I've read both nine times and am not done with them either. Next would be Lord of the Rings, with six reads, then there's probably a whole lot of books with five, I don't know. These two and Malazan are the only ones I keep count on."
Fantasy,3e3rzo,improperly_paranoid,1 point,Tue Jul 21 20:15:11 2015 UTC,Dragonvarld Trilogy. I really like the description of Magic.
Fantasy,3e3rzo,mkfffe,1 point,Tue Jul 21 20:21:00 2015 UTC,In descending order:   Earthsea series. The Deed of Paksenarrion LotR Narnia Once a Hero by Stackpole
Fantasy,3e3rzo,d_ahura,1 point,Tue Jul 21 20:33:57 2015 UTC,"It's a toss up between the Dune series, the first two Thomas Covenant series and the first 5 or 6 WoT books."
Fantasy,3e3rzo,IGmobile,1 point,Tue Jul 21 20:40:07 2015 UTC,The spine on my Tales of Komar trilogy by Elizabeth Kerner books are completely broken...and it's almost time to read again!
Fantasy,3e3rzo,stinerG,1 point,Tue Jul 21 20:50:38 2015 UTC,"I love to re-read books, so I've got multiple adventures through just about every series which I own, but so far none come close to The Lord of the Rings. On my most recent spat of air travel I finished my 38th cover-to-cover read of it, though like /u/MikeOfThePalace I have no idea how many times I've read each section, because I often will read just a few chapters here or there, or pick up The Return of the King at the Battle of the Pelennor Fields and shortly afterward find myself with Samwise returning to Rosie and Elanor. I love that book. At this point I read it only once or twice a year, but in the first year after my parents gave me a copy (bound now with three layers of masking tape to keep the cover together) I read it twelve times.   I'm at maybe eight or nine times with The Wheel of Time, and probably 12 with The Silmarillion, but they're obviously very distant 2nd- and 3rd-place to The Lord of the Rings."
Fantasy,3e3rzo,YearOfTheMoose,1 point,Tue Jul 21 20:54:43 2015 UTC,WoT  LotR  The Belgariad and Malloreon  GoT
Fantasy,3e3rzo,PsychoticMessiah,1 point,Tue Jul 21 21:00:58 2015 UTC,"I've re-read The Hobbit and The Lord of the Rings a few times. Re-read most of the Discworld novels at least twice, and most Roger Zelazny novels at least twice. The Chronicles of Amber I've probably read six or seven times by now. A Night in the Lonesome October I often re-read chapter-by-day in October, so I'm probably up to around a dozen times on that by now."
Fantasy,3e3rzo,CommodoreBelmont,1 point,Tue Jul 21 21:04:22 2015 UTC,"The 7th Sword Trilogy by Dave Duncan.  Yep, you've never heard of it. But go give it a try - it's awesome."
Fantasy,3e3rzo,TheAbyssGazesAlso,1 point,Tue Jul 21 21:12:00 2015 UTC,"David Gemmell. Legend, Stones of Power, etc.   Must have read some of them 15+ times. Granted I could and did skip some parts. One of the first books I read as a preteen was Legend. Hooked me and my lil brother (he reread them tons also) . Druss's code actually had an impact on us.  Those books are all in pieces and tatters.   Edit: notable books. The Coldfire Trilogy. The Saga of Recluse. Dresden. Malazan. Sanderson. Rothfuss."
Fantasy,3e3rzo,Aiolus,1 point,Tue Jul 21 21:16:28 2015 UTC,"LotR. I've read the main series as well as the Hobbit dozens of times, and the Silmarillion several times."
Fantasy,3e3rzo,TRAIANVS,1 point,Tue Jul 21 21:19:17 2015 UTC,"I love rereading The Night Circus by Erin Morgenstern, except I always end up gnashing my teeth in jealousy at how amazing her writing is.  Sharon Shinn's Troubled Waters is my go-to book for when I have a cold and am grumpy -- I really love that book."
Fantasy,3e3ujm,artragev1,1 point,Tue Jul 21 19:18:59 2015 UTC,"They might like it even more in /r/scifi, because this feels like something out of one of those old DAW yellow-spined novels from the '70s.  Which were awesome."
Fantasy,3e3ujm,kmmontandon,1 point,Tue Jul 21 20:58:41 2015 UTC,That is awesome! Thanks for sharing :)
