Fantasy,3dy5tv,Zakkeh,1 point,Mon Jul 20 23:54:02 2015 UTC,"Try Neil Gaiman, Terry Pratchett, Jim Butcher, Scott Lynch.   None of them are exactly like Rothfuss, but they all share certain elements.   Rothfuss considers Jim Butcher's Dresden Files to be the single best fantasy series ever written (though the first three are the weakest).   Neil Gaiman is a genius. Try Neverwhere and Stardust first.  Terry Pratchett wrote the funniest and smartest stuff you'll ever read.   Scott Lynch is usually my recommendation for ""a book anyone should enjoy."" If you don't like the Lies of Locke Lamora, you probably just don't like fantasy."
Fantasy,3dy5tv,inbedwithabook,6,Mon Jul 20 15:14:57 2015 UTC,I love fantasy and I thought LoLL was ok. I thought the rest of the books is the series were seriously bad. I also fail to see how not liking a book in a very specific sub-genre could mean that you don't like the genre itself. It's like saying if you don't like cricket you don't like sports in general
Fantasy,3dy5tv,Sentient_Ink,1 point,Mon Jul 20 18:16:23 2015 UTC,It's hyperbole. They obviously adore the book.
Fantasy,3dy5tv,SecondaryHammerSmith,5,Tue Jul 21 13:26:47 2015 UTC,"If you don't like the Lies of Locke Lamora, you probably just don't like fantasy.     I agree with mostly everything else you said, but that just isn't true. I wasn't a fan of ""Locke Lamora"" and I am a huge fan of fantasy."
Fantasy,3dy5tv,BeardyAndGingerish,1 point,Mon Jul 20 18:40:47 2015 UTC,"I second Terry Pratchett. If you want something relatively light, but with humour, memorable characters, and a strong story, then Discworld is your series.  I also love the Lies of Locke Lamora, but it's not particularly relaxing.   Edit: Clarified Discworld, rather than Pratchett in general."
Fantasy,3dy5tv,mattybravo,2,Mon Jul 20 15:58:05 2015 UTC,Pratchett is the only prose author to make me cry. I will freely admit that when I recommend him.
Fantasy,3dy5tv,Sharadee,1 point,Mon Jul 20 18:02:00 2015 UTC,"Fucking Last Hero, every damn time..."
Fantasy,3dy24d,Zephandrypus,2,Mon Jul 20 13:54:03 2015 UTC,"In Sergej Lukianenko's Nightwatch there are multiple layers of reality. All those and only those that are supernatural beings can enter the deeper layers, depending on how strong they are.  The first layer under the human world is still partially connected to the physical world (e.g. you can walk through closed doors, but not through walls), but ordinary people won't notice you."
Fantasy,3dy24d,sirin3,1 point,Mon Jul 20 16:20:20 2015 UTC,Ooh good call. It's a book worth reading too.
Fantasy,3dy24d,GlasWen,1 point,Mon Jul 20 21:35:40 2015 UTC,"Do you know if there are more books in this series that haven't been translated to English yet? It looks like there's more than 6 books on Goodreads, but I've only got 5 on my kindle: Night Watch, Day Watch, New Watch, Twilight Watch, and Last Watch.  I would totally recommend them, and the slipping through realities is a very important thing to the series."
Fantasy,3dy24d,FryGuy1013,1 point,Mon Jul 20 22:12:26 2015 UTC,"It looks like there's more than 6 books on Goodreads, but I've only got 5 on my kindle: Night Watch, Day Watch, New Watch, Twilight Watch, and Last Watch.   The Sixth Watch, Шестой Дозор (Shestoy Dozor )  Do not know if there is an English translation.  There is a German translation, I will read that."
Fantasy,3dy24d,sirin3,2,Mon Jul 20 22:52:46 2015 UTC,This is essentially the D&D concept of being ethereal.
Fantasy,3dy24d,DjangoWexler,1 point,Mon Jul 20 21:12:24 2015 UTC,Spren and soulcasters I guess can do this sort of thing.
Fantasy,3dup1t,Vindsvept,2,Sun Jul 19 17:33:40 2015 UTC,Thanks for posting these! I subbed you last time you did and have been exploring a lot of your work.
Fantasy,3dup1t,Forest_Green_,2,Sun Jul 19 19:51:28 2015 UTC,What book is this inspired by?
Fantasy,3dup1t,electric_eclectic,1 point,Mon Jul 20 02:27:58 2015 UTC,Love the track. I love listening to music like this when reading books. It allows me to let my mind wander and helps me visualise characters and scenes better.
Fantasy,3dup1t,Coenani,1 point,Sun Jul 19 17:53:28 2015 UTC,i love you man.
Fantasy,3dup1t,PERSIANSPHINX,1 point,Mon Jul 20 03:42:37 2015 UTC,This is wonderful. Thank you for sharing!
Fantasy,3dup1t,StephenJWolf,1 point,Mon Jul 20 04:46:07 2015 UTC,I love this!
Fantasy,3dstc2,MichaelJSullivan,16,Sun Jul 19 02:56:48 2015 UTC,Awesome. Looking forward to it :).
Fantasy,3dstc2,urbanphoenix,7,Sun Jul 19 03:16:44 2015 UTC,Great!  Hope you enjoy it.
Fantasy,3dstc2,AngryWizard,28,Sun Jul 19 15:43:12 2015 UTC,"Well I uh, changed my bedsheets today. I'm pretty proud of that. (Or at least I was until mjs took the wind out of my sails)."
Fantasy,3dstc2,AngryWizard,14,Sun Jul 19 04:27:01 2015 UTC,Haha...well maybe you could use the bedsheets you removed to make some sails!!
Fantasy,3dstc2,thedoze,5,Sun Jul 19 15:39:55 2015 UTC,"I would, but I refuse to be one-upped again today, so I've committed to accomplishing nothing of note; it's the only way. Seriously though, congrats on finishing the book, it must feel incredible."
Fantasy,3dstc2,mgallowglas,4,Sun Jul 19 19:56:24 2015 UTC,At least he didn't leave you with bedbugs.
Fantasy,3dstc2,GetMeOffReddit,20,Sun Jul 19 17:06:34 2015 UTC,Congrats man.
Fantasy,3dstc2,GetMeOffReddit,6,Sun Jul 19 03:08:40 2015 UTC,Thank you.
Fantasy,3dstc2,wmay613,9,Sun Jul 19 15:43:19 2015 UTC,"I'm always incredibly impressed when someone manages to finish their book, no matter how many times they've done it before. Congrats and I'm looking forward to reading it!"
Fantasy,3dstc2,Scottiedk,10,Sun Jul 19 04:18:06 2015 UTC,"It is an achievement without a doubt. This is #29 for me. There is nothing worse than finishing one and then putting it in a drawer because it wasn't ""good enough.""  That's happened to me before - and it's painful. This one is a ""keeper"" or I wouldn't be announcing it.  But I'm sure there will be changes from the alpha and beta readers to improve it."
Fantasy,3dstc2,Alhiniath,3,Sun Jul 19 15:42:10 2015 UTC,"Yeah, having to desk a novel really is an incredibly painful experience. If only because you know just how good the story is in your head, but that it didn't translate right somewhere down the line. I've only finished (and desked) one so far, but I'm hoping the one I'm working on now will be a step in the right direction if nothing else.   You know, does it ever feel weird to change your work from the first stage to the last? I've always wondered what that was like being able to compare the first and last drafts."
Fantasy,3dstc2,FacinatedByMagic,6,Sun Jul 19 16:38:18 2015 UTC,Congrats Michael!!
Fantasy,3dstc2,SBPeck,3,Sun Jul 19 03:37:39 2015 UTC,Thank you!
Fantasy,3dstc2,Salaris,5,Sun Jul 19 15:43:02 2015 UTC,You can go ahead and send it over to me. Thanks.
Fantasy,3dstc2,Mikethebassist,2,Sun Jul 19 05:05:16 2015 UTC,Haha - well it's not ready for others yet.  But if you do want to get in on the beta read here is a link.
Fantasy,3dstc2,Bearded-Guy,2,Sun Jul 19 15:39:12 2015 UTC,When will the beta readers be decided anyways?
Fantasy,3dstc2,Chronometrics,3,Sun Jul 19 17:37:41 2015 UTC,"Congrats, you deserve it.  Perhaps schedule some spa time for yourself as well as Robin if that's something you're into."
Fantasy,3dstc2,Chronometrics,3,Sun Jul 19 03:56:38 2015 UTC,"Robin is going to the spa...but you are right, it's not my kind of thing. I'd rather do some jogging and get a pint at a pub. Which I suspect I'll be doing."
Fantasy,3dstc2,Mystiax,4,Sun Jul 19 15:42:56 2015 UTC,I can haz?
Fantasy,3dstc2,Glavyn,4,Sun Jul 19 04:26:18 2015 UTC,"No, not yet.  But if you are interested in beta reading, here is a link."
Fantasy,3dstc2,propzilla,2,Sun Jul 19 15:40:18 2015 UTC,Congratulations on finishing your book! I'll look forward to reading it.   Enjoy your vacation! =D
Fantasy,3dstc2,Ilya77,2,Sun Jul 19 04:24:47 2015 UTC,Thank you.
Fantasy,3dstc2,appocomaster,2,Sun Jul 19 15:40:27 2015 UTC,So happy about this. Still reading through the last of the trilogy. Looking forward to this new book. Congrats!
Fantasy,3dstc2,appocomaster,2,Sun Jul 19 12:33:33 2015 UTC,"Thanks!  When you get done with Heir of Novron, let me know and I'll send you an afterword you might like."
Fantasy,3dstc2,crowqueen,1 point,Sun Jul 19 15:36:00 2015 UTC,Cheers!
Fantasy,3dstc2,crowqueen,1 point,Sun Jul 19 04:27:31 2015 UTC,Thanks!
Fantasy,3dstc2,stoneshank,1 point,Sun Jul 19 15:39:26 2015 UTC,Break open the bubbly!
Fantasy,3dstc2,tealatte,3,Sun Jul 19 05:44:16 2015 UTC,"Or in my case, pour a Guinness."
Fantasy,3dstc2,hiyosilver64,1 point,Sun Jul 19 15:38:37 2015 UTC,"Or in my case, pour a Guinness.   Here's to filling up my bookshelf, and your glass!"
Fantasy,3dstc2,hiyosilver64,1 point,Sun Jul 19 19:33:16 2015 UTC,Woohoo!
Fantasy,3dstc2,hiyosilver64,1 point,Sun Jul 19 06:16:14 2015 UTC,;-)
Fantasy,3dstc2,WhisperAzr,1 point,Sun Jul 19 15:38:23 2015 UTC,Cheers! I shall hoist a glass in your honour...
Fantasy,3dstc2,GeneParm,2,Sun Jul 19 06:20:30 2015 UTC,Thank you - I'll hoist one back.
Fantasy,3dstc2,momanie,1 point,Sun Jul 19 15:38:15 2015 UTC,Can't wait!
Fantasy,3dstc2,GeneParm,1 point,Sun Jul 19 07:03:17 2015 UTC,Glad to hear it.
Fantasy,3dstc2,taisuru,1 point,Sun Jul 19 15:38:02 2015 UTC,"Woo! Can't wait to read it! :) Enjoy your holiday, man!"
Fantasy,3dstc2,Analpinecone,2,Sun Jul 19 09:23:00 2015 UTC,Thank you!
Fantasy,3dstc2,Lemmus,1 point,Sun Jul 19 15:37:55 2015 UTC,"I really can't wait. This has been a pretty awesome year for you; congratulations! Enjoy your vacation and I am sure there will be a spa trip in the near future, too!"
Fantasy,3dstc2,Lemmus,3,Sun Jul 19 09:34:43 2015 UTC,"I'm already sending my wife to a spa for the work she did no the Kickstarter. I'm not much of a ""spa"" guy - but finding a nice pub to spend some time at sounds good to me."
Fantasy,3dstc2,Emma-R,1 point,Sun Jul 19 15:37:47 2015 UTC,"Well it's thoroughly deserved for both of you. A truely awesome pairing - though very different to Hadrian and Royce!   I can't wait to beta read more books, and then to read the final copies and see the differences. Well done for finishing so quickly. :)"
Fantasy,3dstc2,cyborgmermaid,1 point,Sun Jul 19 15:46:30 2015 UTC,"Well done, MJS. I'm sure you don't need this, but good luck with it."
Fantasy,3dstc2,JW_BM,2,Sun Jul 19 10:39:40 2015 UTC,Thank you...I'll never turn away wishes of luck or any well wishes.
Fantasy,3dstc2,DarrenTPatrick,1 point,Sun Jul 19 15:36:50 2015 UTC,Is this the one you've recently kickstarted?
Fantasy,3dstc2,bephers,1 point,Sun Jul 19 15:38:59 2015 UTC,"Wow grats! !!! Finally getting some days off in the summer and all! Personally my goal in the near future is end of august, when I finally get to take my future best friend home. She's a lovely dog and I can't wait to spend time with her!"
Fantasy,3dstc2,inkfinger,2,Sun Jul 19 12:11:09 2015 UTC,Nice!  Hope you have a great time together.
Fantasy,3dstc2,Whirrun,1 point,Sun Jul 19 15:36:28 2015 UTC,"Well done! After all of the work you've put into the book and the campaign, you must need a decent break."
Fantasy,3dstc2,anbknaga,3,Sun Jul 19 12:41:45 2015 UTC,Certainly a lot of work on the book - most of the campaign stuff was done by Robin - we both need some time off ;-)
Fantasy,3dstc2,p0x0rz,0,Sun Jul 19 15:33:49 2015 UTC,whoo hoo!! Congratulations and enjoy your time off! :)
Fantasy,3dstc2,FernandoQroz,2,Sun Jul 19 12:56:29 2015 UTC,Thank you - I will.
Fantasy,3dstc2,Arrakiv,0,Sun Jul 19 15:33:17 2015 UTC,You are welcome :)  Nana internet hug
Fantasy,3dstc2,Ozwegian,2,Sun Jul 19 15:42:15 2015 UTC,Wow - that was tight - you have strong arms - thanks!
Fantasy,3dstc2,Demaj,0,Sun Jul 19 15:44:52 2015 UTC,HA! You are welcome! Hugs are a good way to start anything - especially a vacation :)
Fantasy,3dstc2,skyskr4per,1 point,Sun Jul 19 15:51:01 2015 UTC,"Congrats, can't wait to give it a read! You're an absolute machine, getting all that done so quickly.   How do I get in on beta reading?"
Fantasy,3dstc2,whatyu_c,1 point,Sun Jul 19 12:59:49 2015 UTC,"Re-uniting with ""the boys"" was easy to do - I missed them a lot. Robin is forming the beta readers now, Here is a link to sign up. Will probably close to submission on or about July 30th."
Fantasy,3dstc2,DavidWFrank,1 point,Sun Jul 19 15:33:06 2015 UTC,Vacation? Come on man when are you gonna finish #4?  On a serious note: Any big plans on how you are going to treat/reward yourself?
Fantasy,3dstc2,thatbookchick,3,Sun Jul 19 13:11:50 2015 UTC,"Can't even think about a 4th until I see how the 3rd goes.  I do have the next series (five books written) and I'm waiting on my publisher's feedback so that is on hold.  I do have some ""minor plans""    Today - clean the house which has become a disaster area since both Robin and I have been so busy.  Then watching the Nats game at 1:30. Tomorrow - reading!! I've not been able to do much laterly. Tuesday - I'm going to ""the land"" (something my wife bought for me last year - for a writing retreat). I'm going to cut the grass. Yeah that sounds boring but it's when doing things like grass cutting that I get story ideas - and I have a lot of grass to cut - about 4 acres worth. Robin bought be a high tech commercial grade zero-turn mower that is being delivered. Wednesday - Going to a Nats day game - us verses Mets - should be fun. Saturday - helping Robin with a free lecture we are doing for writers on ebooks Sunday - heading west. Going to take a road trip to Michigan and Indiana (for Gen con).  Will probably be incorporating alpha edits while we also do some vacation stuff.   Not sure when we will be coming back, gonna play it by ear but looking forward to all of it."
Fantasy,3dstc2,knoekie,1 point,Sun Jul 19 15:30:47 2015 UTC,tommorow your going to read what book will you be reading?
Fantasy,3dstc2,jayonaboat,1 point,Sun Jul 19 21:30:09 2015 UTC,"Robin bought be a high tech commercial grade zero-turn mower that is being delivered.   That is awesome! Have fun, you deserve it."
Fantasy,3dupba,heehahee,12,Sun Jul 19 17:36:06 2015 UTC,"The Black Company by Glenn Cook.  Lots of powerful magic users, epic battles, but gritty realism and grounded main characters.   It's about a mercenary band being hired by the evil demi-god empress to help fight against a rebel uprising."
Fantasy,3dupba,_patheticgirl43_,2,Sun Jul 19 18:24:24 2015 UTC,"I've generally heard very good things about this series, but haven't heard much about its thematic content. What would you say were its most prominent themes?"
Fantasy,3dupba,BobRawrley,3,Mon Jul 20 00:20:37 2015 UTC,"morality, how power corrupts and the good are never truly good and the bad rarely truly bad, the struggles of the simple soldier tossed around in a larger war."
Fantasy,3dupba,UnsealedMTG,2,Mon Jul 20 01:28:38 2015 UTC,"I think the books (first trilogy anyway, all I've read) are the best exploration I've read in any genre about the maintenance of humanity among inhumane systems"
Fantasy,3dupba,mmSNAKE,6,Mon Jul 20 01:58:58 2015 UTC,"Want an intelligent read? Try R.Scott Bakker's Second Apocalypse. Starting with The Darkness That Comes Before. It certainly has themes worth thinking about, though his books can be exhausting, but brilliant nevertheless.  Acts of Caine by Matthew Stover, if you want philosophy of violence, choice, identity, primal urges and a very heavy dose of social cometary and criticism, look here. Main character doesn't really do much magic (he kills people with his bare hands mostly) but series in general has a whole damn lot of magic and other fantastical elements.  Malazan Book of the Fallen by Steven Erikson if you want to have a series that covers more themes than I can remember. Ranging from social, political, ethical, moral and all sort of philosophical musings all packed with magic everywhere soldiers, shapeshifting super elves, ice mage centered orcs with a sense of humor, and a race of super zombies hell bent on targeted genocide.  Wars of Light and Shadow by Janny Wurts, free will is a very good theme that it explores throughout the series. Obviously morality and choice. Story is about two half brothers who are bound to the fate of the planet they are having their err disagreements.   Broken Empire by Mark Lawrence. Follows a sociopath prince in exile that really does some nasty things with a fairly blase attitude regarding it.  The Black Company by Glen Cook, following a band of elite mercenaries that go from one job to the next. Morality is a big one here, essentially teaching you not try try to be certain to label things good, bad or evil. Since it is a mess.   All of these should have plenty of what you are asking for."
Fantasy,3dupba,YearOfTheMoose,21,Mon Jul 20 05:09:34 2015 UTC,"<_<  >_>  ...[whisper] Malazan   Someone had to say it. ^_^ It really does fit the bill, though, with its many strong themes (most prominently Erikson's exaltation of the virtue of compassion). There are any number of both overt and subtle ones, so you're bound to find something you like if all you're searching for are theme-rich stories with lots and lots of magic."
Fantasy,3dupba,Mr_Noyes,10,Sun Jul 19 18:33:46 2015 UTC,"I totally understand your apprehension when bringing up the M-word (over in the SF reddit it's ""Blindsight"" by Peter Watts) but hey, there is a reason why the M-word is mentioned so often."
Fantasy,3dupba,Bonzai-the-jewelz,2,Sun Jul 19 20:06:11 2015 UTC,Why has Malazan become the new voldemort?
Fantasy,3dupba,Mr_Noyes,9,Sun Jul 19 21:49:52 2015 UTC,It's brought of a lot in recommendation threads so that not-fans occasionally get sick of hearing it.
Fantasy,3dupba,Bonzai-the-jewelz,7,Sun Jul 19 21:54:27 2015 UTC,Ah I see. Since I haven't read it I'll just jump on the bandwagon out of politeness.  Booo!
Fantasy,3dupba,Mr_Noyes,6,Sun Jul 19 22:05:10 2015 UTC,"That's awfully kind of you, sir. ducks rotten tomatoes"
Fantasy,3dupba,RonnieRim,2,Sun Jul 19 22:09:17 2015 UTC,How exactly does the theme of compassion's virtue manifest in the series? Is it mostly in large fate-of-the-world type or conflicts or is it in the characters' narrower and more personal conflicts? What are some of the other more prominent themes?
Fantasy,3dupba,yetanotherhero,7,Mon Jul 20 00:30:58 2015 UTC,"Compassion manifests itself in everything from the smallest character interactions to the largest of world-shattering events - when people say that Malazan is about compassion, they really mean it. There are possibly dozens of themes in this series, Erikson loves his themes and has said before that his stories are virtually written around them. Some of these other themes include the follies of pride and greed, the importance to never underestimate even the smallest players in the game (eg. in the battles between gods, even a lowly mortal can make a real impact) etc."
Fantasy,3dupba,Tarcanus,5,Mon Jul 20 04:07:05 2015 UTC,"In regards to your first two questions, it's both. The reader is first introduced to compassion as an overt theme of a particular character's arc. From that point, we see compassion rear its thematic head several times throughout the story, with different characters and settings, until finally its relevance to some- perhaps all- of the most central, earth shaking conflicts of the series becomes clear.   Other prominent themes include the cruelty and cost of war, the nature of justice, power and its use for oppression or liberation, and vengeance. Close reading and re-reading reveals how the central theme of compassion interweaves and over-arches the rest of these themes. It's an incredibly ambitious work, and not without its flaws. But it really is something to finish the ten books and realise you just read an epic fantasy examination of the human condition. Featuring undead dinosaurs with swords for arms."
Fantasy,3dupba,jabari74,0,Mon Jul 20 04:14:38 2015 UTC,"It won't do it justice to even try to explain.  Whereas many fantasy books have characters as the focus or plot or magic, Erikson focused on the themes of the novels.  The books wind up being a bit philosophically heavy at times, and he does explore other themes as he goes along(civilization, empire, greed, excess, etc) but compassion is always there at its core.  The main plotline's resolution is nothing but an extreme act of compassion.  To try to boil down the ""how is the theme expressed?"" question would be futile."
Fantasy,3dupba,karlmdavis,9,Mon Jul 20 17:47:51 2015 UTC,I'll point out the low hanging fruit - Discworld.
Fantasy,3dupba,jabari74,2,Mon Jul 20 02:36:14 2015 UTC,Truly. Their overwhelming... humanity really sets them apart. Sam Vimes (of 'Guards! Guards!') in particular is just so completely relatable.
Fantasy,3dupba,mattcolville,3,Mon Jul 20 02:40:37 2015 UTC,"It's more or less got a little bit of everything in there at some point or another, surprised it didn't get mentioned before now (and the themes aren't particularly hidden or lofty)."
Fantasy,3dupba,alienbro48,1 point,Mon Jul 20 02:42:04 2015 UTC,"I think Pratchett, at his best, was better than Wodehouse, at his best, in the humanity department."
Fantasy,3dupba,CptNoble,3,Mon Jul 20 03:22:55 2015 UTC,If you're into Zen philosophy or psychedelic drugs read Dune.
Fantasy,3dupba,alienbro48,10,Sun Jul 19 18:48:37 2015 UTC,"I love Dune, but I'm not sure I'd call it ""grounded and relatable."""
Fantasy,3dupba,lrich1024,3,Sun Jul 19 19:03:01 2015 UTC,I'm sure if you've done Psychedelics you could probably relate to some of Paul and Jessica's experiences on Melange.
Fantasy,3dupba,1tepa1,4,Sun Jul 19 19:04:07 2015 UTC,"I haven't done psychedelics but I've listened to a lot of Pink Floyd, does that count? ;)  (Dune is such a good novel.)"
Fantasy,3dupba,ashearmstrong,2,Mon Jul 20 00:05:06 2015 UTC,Thank you for this. I love psychedelics very much myself and I havent read dune before but now it seems like a good idea.
Fantasy,3dupba,CptNoble,3,Sun Jul 19 20:10:51 2015 UTC,"Just so I'm clear here, what constitutes grounded and relatable themes?"
Fantasy,3dupba,Job601,4,Sun Jul 19 18:54:42 2015 UTC,I think the OP needs to give us an example of what they are thinking otherwise we're sort of shooting in the dark here.
Fantasy,3dupba,lrich1024,4,Sun Jul 19 19:04:00 2015 UTC,"I just meant themes that can be easily tied to peoples everyday lives. Things like family, friendship, finding ones place in the world are themes I'd consider grounded and relatable. Themes like power, good vs evil, justice are all much more abstract to me and I wouldn't consider them very relatable or grounded."
Fantasy,3dupba,yetanotherhero,5,Sun Jul 19 20:20:26 2015 UTC,"Daniel Abraham's work is what you're looking for.  The long price quartet is about self-sacrifice, aging, and responsibility; the dragon's path books are about guilt, selfishness, the banality of evil, and professional ethics."
Fantasy,3dupba,pornokitsch,5,Sun Jul 19 22:11:51 2015 UTC,"If you're into court intrigue and not expecting too much action/adventure, I'd highly recommend The Goblin Emperor. Very grounded and very relatable themes. Very prominent themes. One of the reasons I enjoyed it so much, relatability. It has some magic, but it's not a huge feature in the series, but it about fantastical races of beings so it's very much fantasy."
Fantasy,3dupba,wishforagiraffe,5,Mon Jul 20 00:03:45 2015 UTC,"Based on this, I'd heartily recommend the work of Guy Gavriel Kay. I've only read two of his books so far, but both were very human and involved the themes you mention. Tigana especially weaves a heartbreaking tale about family, loss, grief, revenge and above all the sense of belonging to a home."
Fantasy,3dupba,Maldevinine,4,Mon Jul 20 04:17:16 2015 UTC,I am not sure what you mean by themes. But I'm sure our good friend RecBot might be able to help you.  /taps foot impatiently
Fantasy,3dupba,BaconWise,4,Sun Jul 19 19:33:57 2015 UTC,didn't use any of the keywords =P
Fantasy,3dupba,Job601,2,Sun Jul 19 21:55:34 2015 UTC,Sorry. What is RecBot?
Fantasy,3ducfo,PaulineMRoss,2,Sun Jul 19 15:40:49 2015 UTC,Bought and ready to read!
Fantasy,3ducfo,QuentinMagician,1 point,Sun Jul 19 17:51:09 2015 UTC,Thanks! I hope you enjoy it.
Fantasy,3ducfo,QuentinMagician,2,Sun Jul 19 18:01:30 2015 UTC,I am starting the second chapter and I am hooked. Is this a standalone book or is it part of some larger set?
Fantasy,3ducfo,DavidWFrank,2,Sun Jul 19 19:00:06 2015 UTC,"All my books are standalones, but all set in the same world, so sometimes things from one book pop up in another. Like Easter eggs. :-)"
Fantasy,3ducfo,DreamweaverMirar,2,Sun Jul 19 20:22:35 2015 UTC,I recently finished her 2nd book The Fire Mages and really enjoyed it. I look forward to this one as well.
Fantasy,3ducfo,thelonelypubman,2,Mon Jul 20 04:26:07 2015 UTC,Going on vacation with only a couple of books on my to read- I'll be sure to check it out!
Fantasy,3ducfo,Queenlizo,1 point,Sun Jul 19 23:32:34 2015 UTC,Thanks! I hope you enjoy it.
Fantasy,3dwfy6,aybarah,4,Mon Jul 20 02:36:25 2015 UTC,"Acts of Caine. Not really a passion but one of the few book purchases I made without actually trying to find out much about it - good series, doesn't get enough mention."
Fantasy,3dwfy6,jabari74,4,Mon Jul 20 02:37:13 2015 UTC,Bought a signed Words of Radiance at the Amsterdam airport. Hadn't read WOK and didn't think the opportunity would present itself in the future. Worth every pricey euro.
Fantasy,3dwfy6,yettibeats,1 point,Mon Jul 20 04:47:34 2015 UTC,Have you read WoK yet? If not I highly recommend it. Its amazing and WoR is even better.
Fantasy,3dwfy6,yettibeats,1 point,Mon Jul 20 05:08:54 2015 UTC,I have! Purchasing WoR gave me an excuse to start WoK. Loved them both.
Fantasy,3dwfy6,UndertakerSheep,1 point,Mon Jul 20 17:36:24 2015 UTC,How did a Sanderson signed copy end up in the Netherlands?
