geology,3a3ab6,CrustalTrudger,0,Wed Jun 17 15:27:20 2015 UTC,"I think it would be instructive as a thought experiment to imagine that such relatively small forces acting around the biosphere could drive plate tectonics. After returning to that thought experiment occasionally -- suspending disbelief and casting about for new mechanisms of action -- new and useful insights may crop up. Very small concentrations of chemicals can have global effects in a  ""climate geoengineering"" context, and there are plenty of other cases in the physical world where very small forces have outsize effects. Though our understanding of the planetary-scale masses involved in plate tectonics makes us think that all surface effects should be negligible, it may not be the case.  But of course, at present the most we could possibly say is that massive erosion or storm events, or uneven distribution of mass across oceans, on the surface of the earth -- that these things could at best trigger events that are on the brink of happening anyway for unrelated reasons, and that this idea is not well tested. I'm just a layperson working in an unrelated field, and I had this idea somewhat randomly in 2009. I've been pleasantly surprised to find that other much more capable people in a position to do real research were thinking about this at about the same time not too far away in the Himalayas and Taiwan. Score one for the spontaneous, simultaneous bubbling up of an idea in the culture at large."
geology,3a3ab6,thetimbo2,3,Wed Jun 17 16:10:19 2015 UTC,"Score one for the spontaneous, simultaneous bubbling up of an idea in the culture at large.   No it isn't you complete fruitcake! Like /u/CrustalTrudger said, the ideas that have been put forward have been put forward in a lecture during a Geophysics meeting. It's one or two studies - nowhere near enough to conclude anything. In fact, it's just a correlation we're talking about here. The earth is an incredibly complex dynamical system; do you even begin to understand how many entirely unrelated things correlate?  To add insult to injury, one inch of rainfall on an acre of land already weighs well over a metric ton. India, being a country of almost 4 million square kilometers in size, receives well over 900 mm of average rainfall during a monsoon. If you calculate how much added weight that is, you'll come to find it's a number that can't even be expressed in Gigatons - you have to use a power of 10 to make sense of it (on the order of magnitude of a million billion - that's 1015 kg, or millions of Gigatons). Peat burning accounts for about 2-3 Gigatons of mass loss a year. That isn't even a millionth of a fraction of the rainfall in India. And even then, those millions of gigatons of rainfall only account for a mere ~3 kilopascals of change in the stress of the fault according tot the scientists in the article you linked to.  So, if millions of gigatons of rainfall in a year's time cause a meagre 3 kilopascals in stress change on the local faults, just imagine how impossibly small of an effect peat burning (about 2-3 Gt a year) has on tectonics or stress fields!   Even if we burned peat at the same rate for over a million years, we still wouldn't be able to induce the same change in stress-fields that the monsoon induces in one year.  Get off your high-horse buddy, your idea makes no sense."
geology,3a3ab6,thetimbo2,-1,Wed Jun 17 17:46:22 2015 UTC,"Could you quantify the effect on the water cycle in Indonesia of all this peat burning? Specifically, on the volume and mass of water and the mass of eroded soils that follow peat burning on such a large scale? You seem quite interested in my little idea and I'd like you to keep doing some more math for me."
geology,3a3ab6,thetimbo2,2,Wed Jun 17 18:03:25 2015 UTC,"This isn't quantum chromodynamics; it's geology. You can't just quantify the effect on the water cycle in Indonesia like it's /r/theydidthemath up in here. The system is simply too complex and noisy. That's why I didn't calculate monsoon rainfall in terms of concrete numbers, I specifically spoke of orders of magnitude because that's all we can say, really.  With that being said, and with the general feel I was able to provide you with, the same line of reasoning holds for peat burning and droughts. The orders of magnitude involved in peat burning and droughts are so incredibly small, and so negligible compared to the other effects that play a role in fault mechanics, it's just beyond the realm of possibility. Take a look at Sumatra for example, arguably one of the primary locations for peat fires. It's less than half a million square kilometers in size. The whole of Indonesia still has less than half of India's land area.   Most of all: India lies on its own plate, the Indian plate - one of the smaller plates of the Earth's tectonic system. Even on this very localized tectonic zone, an unfathomably vast mass transfer in the form of millions of Gt of rain isn't enough to make a meaningful contribution to the surrounding stress fields.   Now take Indonesia. Pretty much all of Indonesia's land mass is on the Eurasian plate. Do a google search for ""Eurasian Plate"". See how stupendously big that plate is in comparison to the Indian plate? If millions of gigatons of mass transfer on India is barely enough to make a few kilopascals worth of difference in the faults of its very local and very small plate, what exactly do you expect will happen from a few insubstantial gigatons of mass transfer on a very small patch of an otherwise immense plate?  Even if we succumb to absolute madness, say we've lost our mind, and by some feat of bad science we find that there's thousands of gigatons of mass transfer on Indonesia because of peat burning. So what? Millions of gigatons were hardly enough to induce 3 kilopascals in India's confined fault system on its equally local and confined plate. If such absurd amounts of mass transfer due to rain on such a (comparatively) small amount of space (the Indian plate) still turn out to be minute, what is to be expected from far smaller mass transfers on far larger plates?  It's pointless and ill-conceived.   And finally, let's say we've lost our minds yet again, even more so than last time, and say we find that all this burning peat and the resulting erosion somehow - don't ask me how, probably by some divine intervention - manages to create a few kilopascals in stress change in the local faults. So what? Indonesia is practically on top of the ring of fire and right next to the place where the Eurasian, Philippine, Australian and Pacific plates meet! The incomprehensibly big forces, stresses, strains and other geodynamics of the region would most certainly drown out any such insignificant and minor effects that Indonesia's peat burning would cause. It's like dumping a few truck loads of water into a stormy ocean - it's not going to do or change a thing."
geology,3a3ab6,duckraul2,-1,Wed Jun 17 18:58:12 2015 UTC,"I can't help but get the feeling that you're the nutty one here. You do seem to be ignoring the cases of Haiti and Taiwan that are linked to above. Perhaps you think that research is wrong? Do all seismic events occur due to only forces that are comparable to the size of the plates involved? Are the small earthquakes precipitated by filling or draining dams, regional drought, or hydraulic fracturing -- are those real things? Do they exist? Do they involve forces that must act on the entire, say, North American plate? Or can they be relatively local events?  My guess is that the amount of water (including change in weather -- drought) and sediment lost from Indonesia due to peat burning (a relatively small part of the landscape that, when removed, has a large effect on local climate) -- my guess is that total mass is not insignificant. That it is probably quite similar to the masses moving around in Taiwan's typhoons, or in the case of Haiti. That's all. They seem similar. Worth investigating.  You don't have to spend any time on it. Feel free to recuse yourself from this area of research. If you want to ""prove"" me wrong though, feel free to quantify the masses involved, and see if their movement is associated with seismic activity. Shouldn't be too hard. No field research is really even involved. Just a large survey of the existing data. You seem to feel rather threatened by the idea that this could even be possible, much less that anyone would bother investigating it.  It may turn up conclusive evidence that drought, massive erosion of soils, and transient heavy-rain events do not correlate at all with seismic events. You seem to think that's settled science -- that it's a disgrace for me to even bring up the idea. You have a real talent for useless, non-constructive criticism.  I do love that final line in your comment above though. It reminds me of the ""geoengineering"" case of iron fertilization... ""like dumping a few truck loads of water in a stormy ocean"" as you say. Just a funny little echo there. How much lubricant (water, or something else?) would you have to pour into a fault to give it that little extra oomfph for a slip. Such an interesting field of study.  https://en.wikipedia.org/wiki/Iron_fertilization"
geology,3a3ab6,thetimbo2,4,Wed Jun 17 19:42:02 2015 UTC,"Oh my god. You aren't just a silly layman chiming in with an equally silly idea - you're a delusional fool!  Let's start with Haiti and Taiwan. First of all, and this is very important, the amount of significance and certainty you attribute to one study (and your ability to use that study to make a case for your idea) is nothing short of absurd. On the other hand, the amount of doubt you're casting on well-established scientific consensus is worrisome, to say the least.  I'm a post-doc whose work is primarily concerned with earth rheology and continuum mechanics. Right now, I could conduct a study into the most obscure correlations between seismic activity and surface processes, and I guarantee you, I'd be able to find numerous such correlations.  Why? Because that's the nature of our terrestrial dynamic system. It's so dynamic and so chaotic, there's bound to be odd correlations that don't have to mean anything. Have a look at this website. Correlation does not imply causation.   So what is the issue here? Let's go through this.   You do seem to be ignoring the cases of Haiti and Taiwan that are linked to above. Perhaps you think that research is wrong?   The research doesn't have to be wrong for me to ignore it. Also, I'm not ignoring it - I'm prioritizing. The idea that there is ""earthquake weather"" is very, very controversial, and the geophysical consensus is quite clear on this (hell, even the news article you linked to begins with ""The U.S. Geological Survey’s website states it in no uncertain terms: “There is no such thing as ‘earthquake weather.’”""). This doesn't mean that the current science is infallible; far from it. So what does it mean?   That a layperson like yourself is in no position whatsoever to just declare certain studies as correct simply on the basis of ""it sounds reasonable"" or to make guesses about what seems insignificant and what doesn't (because you don't nearly have enough knowledge to do that). Don't you see how ridiculous you are? This is like me walking into /r/physics and saying ""yeah, see guys, my guess is that black holes produce thermal radiation and that this thermal radiation contains information about their inner structure because I read a few news articles that talked about Gauge-gravity duality."" No. I'm in no position to say such a thing because my PhD isn't in quantum gravity - it'd be absurd if we could just ""guess"" something like that. The same thing goes for geophysics. Just because geophysics seems to be more tangible and real than quantum gravity, that doesn't make it more valid for people to just guess and pick what seems more ""natural"" to them. There are people who devote their entire lives just studying one sort of fault, or one method by which fault mechanics takes place. For instance, take a look at this paper. This sort of subject matter isn't something a layperson like yourself can casually ""guess"" about. The studies you linked to actually don't support your idea at all. They're irrelevant to your idea. Sure, both papers explored possible triggers for earthquakes. But they explored these triggers specifically within the context of sudden, abrupt quantities of mass transfer. We're talking gigatons of rain in just a matter of days, not years like in the case of peat burning. And that's ultimately the problem here; for a critical stress-field to be triggered, you need a sudden, ""unnatural"" alteration of ambient factors, not a gradual change like in the case of peat fires because in that case, the effects of the mass transfer by peat burning will just be drowned out by regular ambient forces like tectonics - forces that are far more powerful in the long term. To give you an analogy; if I were to forcefully push you out of balance with my right hand, but in the process also gently poke you with the index finger on my left hand, would you argue that it was my index finger that pushed you out of balance? Of course not; the force exerted by my index finger on your body is negligible in comparison to the force exerted by my right hand. I could have just as well not poked you with my finger - it wouldn't have made a difference in the grand scheme of things. However, had you already been on the verge of losing your balance, and had I then poked you quite vigorously with my left index finger in a very short amount of time, you wouldn't have been able to regain your balance because of the speed by which this sudden force was introduced into your body. That's what these scientists are saying; that this sudden mass transfer caused by hurricanes in Taiwan in a very shot window of time is capable of triggering stress fields. The key thing here is the time-frame: the same amount of mass transfer spread out over a year would have made no worthwhile contribution to the escalation of the stress fields because in that same time-frame, much greater forces would have been at work (tectonics causing strain, compression, chemical processes causing failures in the structural integrity of the rock - every single one of these is magnitudes more significant and noticeable than mass transfer on the surface, unless that mass transfer is enormous like what happened in the various glacial periods).   I'll give you another analogy. Suppose you have an old-fashioned cast-iron bridge. Suppose the bridge can take a max. of 50 tonnes. Suppose you have a truck that weighs 20 tonnes. What would happen if we slowly drove that truck across at maybe 10-12 miles an hour? Nothing. The bridge could easily take it and would probably not even bulge - it might deform a few millimetres, maybe even a few centimetres (an inch or so), but on the scale of a bridge of a hundred metres in length, that's nothing (a milimetre is one one-hundred-thousandth part of a 100 metre bridge, and a few centimetres deformation would represent about one-ten-thousandth part of the size of the bridge). This is equivalent to your peat burning idea. Now, what would happen if we lifted that same truck 100 yards up in the air and dropped it onto that bridge? In this case you're introducing all this sudden kinetic energy and momentum into the bridge's structure in a very short amount of time, and the effects are going to be more noticeable. This is what happens in hurricanes; a very sudden and fast introduction of a lot of material that would otherwise have an insignificant effect, but is now amplified by the time-frame in which it takes place.   Are the small earthquakes precipitated by filling or draining dams, regional drought, or hydraulic fracturing -- are those real things? Do they exist? Do they involve forces that must act on the entire, say, North American plate? Or can they be relatively local events?   Sure they can be local events. Fracking causes small earthquakes because that's what it's designed to do; to fracture rock. As with the others; that's more controversial. Either way it doesn't matter because your idea was about plate tectonics: ""an idea for one mechanism behind plate tectonics"". Plate tectonics necessarily involves large plates. There's no way around it. And as such it's a silly idea, because plate tectonics entail some of the most powerful forces known to mankind. Peat burning is just laughably insignificant. Again, you're involving irrelevant things. The fact that hurricanes might trigger stress-fields to escalate into a seismic event has nothing to do with plate tectonics.    You don't have to spend any time on it. Feel free to recuse yourself from this area of research. If you want to ""prove"" me wrong though, feel free to quantify the masses involved, and see if their movement is associated with seismic activity. Shouldn't be too hard.   And here you show us just how delusional you really are. Shouldn't be too hard? Are you kidding me you utter whackjob? Do you have any clue how immensely difficult it is to quantify mass transfer in a given system without explicit field, production, and satellite data? What, I'm just supposed to find local erosion rates, study the local hydrological system to see what effect the erosion and peat burning has on subsurface water movement, find out what the hydrochemical properties are of the rest-mass of all those tonnes of burned peat, find out what the local geodynamics is (which happens to be incredibly complex due to the four plates meeting just northwest of Indonesia), do a statistical elimination of all these variables and then set up a correlation? You are literally asking me to do a study on this, and you're writing it off as ""shouldn't be too hard""? You know nothing about geology, and with your current arrogant demeanor, you never will. I have given you a lot of qualitative insight into why peat burning is insignificant compared to the sheer forces, masses and powers that are involved in plate tectonics. This is like asking an astronomer ""my guess is that shooting a rocket at a big, rocky planet will change its orbit by a thousand kilometres"" and then when the astronomer tells you that that's an absurd exaggeration, telling him to ""prove you wrong"" by working out a lot of tedious calculations just to show how your claims contradict known orbital mechanics. Only orbital mechanics are a lot simpler and a lot more straight-forward than geophysics. The onus isn't on me to prove you wrong, the onus is on you to prove your statement. You can't just say ""I think that deep inside black holes, there's a million different universes"" and then say ""well, you will have to prove me wrong"" That's not how science - or the world, for that matter - works. The burden of proof lies with someone who is making a claim, and is not upon anyone else to disprove. The inability, or disinclination, to disprove a claim does not render that claim valid, nor give it any credence whatsoever."
geology,3a3ab6,CrustalTrudger,-2,Wed Jun 17 22:03:42 2015 UTC,"You seem to enjoy this. Because you are writing volumes. But you're shooting a missile at a tiny gnat. It's so adorable.  I'm seeing you willfully gloss over facts, such as    ""The island’s most devastating earthquake in recent history, the magnitude-7.6 Chi-Chi earthquake that killed an estimated 2,400 people in 1999, was preceded by Typhoon Herb in 1996, which dumped about 2 meters of rain.""   You'll notice the latency between the weather trigger and the event is ~3 years. That does not bode well for your loudly and uselessly expressed conviction that:   Sure, both papers explored possible triggers for earthquakes. But they explored these triggers specifically within the context of sudden, abrupt quantities of mass transfer. We're talking gigatons of rain in just a matter of days, not years like in the case of peat burning.   You also overlook that in both the Taiwan and Haiti studies, landslides and other forms of erosion were considered to be likely drivers of the ""trigger"", and those processes were taking place on the scale of months and years, not days as you would have it.   Your misreading of the source material to fit your view makes me thing you're not worth talking to.  Furthermore, no mechanism was investigated for those studies -- it could be excess water migrating into the faults and lubricating them -- Wdowinski doesn't propose to know. He just feels he's got a statistically significant correlation between typhoons, erosions events, and seismic activity. If you think he's a crank, fine! If you think I shouldn't be allowed to talk about his study and speculate on other parts of the world where the same methods of investigation could prove useful, you're a flaming jagoff.   The onus isn't on me to prove you wrong, the onus is on you to prove your statement.    Ah, but here's the crux of it, right? You seem rather mistaken here! There is no ""onus"". There is not need to prune me out of the discussion so vigorously. We would both agree that Wdowinski's studies are not conclusive. I'm not sure why you think it's off limits to discussion, or that we need to remind everyone at every turn how provisional the research is. This is not a package of cigarettes that must warn users of imminent danger, it's a DISCUSSION about A FEW STUDIES that are nowhere near joining the broader concensus. SO WHAT!  I could try to butt heads with you on this more, but you seem to be taking this completely out of proportion to what it is. I'm not making any extraordinary claims -- I'm making TINY claims. You're responding like I'm barging in and upsetting all the furniture. I'm just tapping on the glass and saying ""maybe we should look into all known large weather and erosion events, estimate their masses, and see if they correlate with seismic activity, probably with a lag time, like was done in these other studies.""  Maybe the title of my post should have been ""Could extreme weather events and erosion associated with peat burning and deforestation on large scales trigger seismic events up to a magnitude 5 or 6?"" Would that make you happy, my poor baby? Do you need the words spoonfed to you? Are you so sensitive that you can't accept a quick gloss of the issue as a start to a conversation?  I am completely in the right to talk about this research and link to it. I take it for what it is, highly provisional, likely to be proven wrong. But if it's true that a typhoon can trigger an earthquake, we might want to look around at similar events and see if they correlate with seismic activity too. How much effort could it take? How many human hours do you think went into Wdowinski's study?  I handle a lot of remote sensing data on a global scale. I can estimate the mass of sea ice across the entire world, because there's so much free data and so much footwork on that sort of thing. I can go out on a limb and ask questions like ""what is the mass of all apple trees in north america"" and even though no one has identified the specific spectral signature of all apples ina  way that is handed to me on a platter, it would at most take me a few months, maybe 200 hours of works at most, to get a good enough answer to the question to move onto the next step. I see no reason why Wdowinski's method can't be expanded to several other regions in a matter of tens of hours for a provisional look at the correlation between weather, erosion, and seismic events. I don't see what the fuss is about. I'll do the work myself eventually, but I'm here looking for useful insights into how best to go about it, and instead I'm been hit by your wall of hot air about why this line of thinking is so COMPLETELY OFF LIMITS."
