geology,3e2uq5,bigsquish,7,Tue Jul 21 15:11:38 2015 UTC,"It truly is the best mineral collection I've ever seen in person. And I've seen a lot of Gem and Mineral shows. I do wonder though, how does the Smithsonian stack up? Does anyone know?"
geology,3e2uq5,bodhisugi,4,Tue Jul 21 16:04:49 2015 UTC,"No idea about the Smithsonian, but the Denver Natural History museum has a pretty amazing display. Especially if you love gold nuggets."
geology,3e2uq5,IronOreAgate,3,Tue Jul 21 17:03:44 2015 UTC,Cool! Maybe I'll make it this September...  Who doesn't love gold?
geology,3e2uq5,bodhisugi,3,Tue Jul 21 17:12:38 2015 UTC,"It has been a long time, but from what I remember they had a vault filled with gold nuggets owned by someone who loved Geology and owned a mining company. If memory serves, he would pay his workers extra if they found/brought him really interesting gold nuggets."
geology,3e2uq5,IronOreAgate,3,Tue Jul 21 18:40:57 2015 UTC,Smithsonian is awesome. I haven't been to the LA though.
geology,3e2uq5,KaiserReisser,2,Tue Jul 21 17:17:57 2015 UTC,The Smithsonian one in DC is enormous. It takes up pretty much an entire floor of the museum. I've never been to the one in LA.
geology,3e2uq5,Smoothvirus,2,Tue Jul 21 20:01:20 2015 UTC,"I live in the DC Area and have spent many hours getting lost in the gems and mineral exhibit in the Smithsonian. I've also been given a behind the scenes tour of one of the storage centers for the collection.  I know for a fact that it's the largest and most valuable collection of its kind in the US, and in my opinion it far outshines the LA Natural History Museum."
geology,3e2uq5,Patchespirate,1 point,Tue Jul 21 21:59:42 2015 UTC,It just made my bucket list...
geology,3e2uq5,bodhisugi,1 point,Tue Jul 21 22:46:59 2015 UTC,"Don't just visit the gems and minerals collection, all of the Smithsonian institute is really cool and all of the museums are really close together. They're free and there's something for pretty much everyone. I highly recommend both Natural History and Air and Space."
geology,3e2uq5,Patchespirate,1 point,Tue Jul 21 23:31:53 2015 UTC,I'm going to piggyback on this and make the strong assertion that everyone should visit the Smithsonian at some point in their life if they can.  The cumulative exposure knowledge and culture in the set of Smithsonian museums is enough to fuel an imagination for a lifetime.
geology,3e2uq5,MervynChippington,3,Wed Jul 22 01:03:54 2015 UTC,Soooo.... who wants to take a road trip to LA? I call shotgun!
geology,3e2uq5,rab0t,3,Tue Jul 21 15:20:01 2015 UTC,"Just got back from there, (I live in Phoenix)   The I-10 is CLOSED due to a bridge being washed out.  Take the 40, or the 8 or 95/62 up through 29 Palms.  Nobody knows when the bridge is going to be replaced, because the supports have been totally washed away, so it's going to be while."
geology,3e2uq5,rab0t,4,Tue Jul 21 15:24:32 2015 UTC,"Dang, thanks for the info! If and when I pull off a cross-country road trip I'll keep that in mind. :) I live on the East coast, so I was mostly joking... but only mostly."
geology,3e2uq5,MrFaxmachine,3,Tue Jul 21 15:38:53 2015 UTC,How would you say this compares to the Houston Museum of Natural Science?
geology,3e2uq5,Follow_your_Rocks,2,Tue Jul 21 19:00:02 2015 UTC,"HMNS has an impressive mineral collection, not sure how it compares to Los Angeles."
geology,3e2uq5,Flynn_lives,2,Tue Jul 21 19:05:42 2015 UTC,"You guys need to make a pilgrimage to The Arkenstone in Dallas Tx(They opened one up in Shanghi, China)    I can't disclose it's exact location but, the inside is a wonderland of stuff.....much of which is sold to museums like this.  And there's more stuff stored in like 24+ high end safes that line the walls.    All available for your view pleasure and the staff is very friendly to geologists.  They served me champagne last time I went to browse."
geology,3e2uq5,Baright,2,Tue Jul 21 19:08:38 2015 UTC,"Locally, the Colorado School of Mines Geology Museum is enormously impressive."
geology,3e2uq5,strewth86,2,Tue Jul 21 23:19:02 2015 UTC,"So glad somebody posted this! I went there once to kill some time and stumbled upon this awesome collection. Ended up killing significantly more time than I had originally intended. I highly recommend it! (Also, the space shuttle Endeavor is parked next door in the Science Center, which is also a must see in this part of LA!)"
geology,3e2uq5,suplauren,1 point,Tue Jul 21 19:59:22 2015 UTC,The Science Center is free too! And their ecosystems exhibit is wonderful!
geology,3e2uq5,done-gone,1 point,Tue Jul 21 22:07:33 2015 UTC,I'd love to have this in my house
geology,3e4toq,TekBuddha,1 point,Tue Jul 21 23:31:37 2015 UTC,"Cubic Boron Nitride (borazon) is slightly harder, you can buy it on eBay, but as a coating cutting tools. Neither is harder than diamond, borazon is about 45% as hard as diamond."
geology,3e4bof,CoolHandMike,2,Tue Jul 21 21:17:40 2015 UTC,Perhaps in geophysics?
geology,3e4bof,Gargatua13013,2,Tue Jul 21 22:29:24 2015 UTC,"This! Honestly. Look into any of the geophysical manufacturing companies. (Geonics, Zonge, etc)"
geology,3e4bof,tpm319,2,Wed Jul 22 00:18:38 2015 UTC,"I was an electronics tech with the Air Force before I separated to get my BS in geology.  The military and electronics experience has definitely helped!   I would suggest checking out USAjobs for openings in your area. There are all sorts of positions that you can fill with your degree. The electronics is going to be a big bonus in positions where you could be working in the field, or building and developing equipment.    The Navy and NAVO have geology positions that would definitely benefit having someone with electronics experience, but they might not be in your area. Good luck!"
geology,3e4bof,JoyousMaximus,1 point,Tue Jul 21 23:55:42 2015 UTC,"I see the words ""wife"" and ""family"", so that makes me hesitant to recommend this since I'm assuming you want to keep them, especially in the current job market, but I saw lots of ""experience with electronics preferred""-esque statements attached to MWD/LWD job postings with oil service companies."
geology,3e4bof,Kongsfjorden,1 point,Tue Jul 21 23:10:07 2015 UTC,"Check Schlumberger or Halliburton. Their wire line logging divisions would hire someone with your background as a field engineer. The money is really good. The hours are really long though. However, Schlumberger is likely to move you out of the field after a year or two. You may also want to look into their logging while drilling groups."
geology,3e2v6y,terpichor,2,Tue Jul 21 15:15:07 2015 UTC,"This counts as work, right?"
geology,3e4ki3,CreeperClothing,7,Tue Jul 21 22:20:48 2015 UTC,It looks like glass to me.
geology,3e4ki3,NV_Geo,2,Tue Jul 21 23:22:02 2015 UTC,Thats what I thought. This older lady said her grandfather kept it for a long time and never knew what it was either lol.
geology,3e4ki3,st0rmbrkr,1 point,Tue Jul 21 23:30:07 2015 UTC,I'm agreeing with glass on this was too.
geology,3e4ki3,MagicalMonks,1 point,Wed Jul 22 02:29:47 2015 UTC,Amethyst? Which is essentially quartz with iron impurities.
geology,3e4ecm,Wheres_my_phone,1 point,Tue Jul 21 21:36:40 2015 UTC,Looks like pumice.
geology,3e4ecm,duckraul2,1 point,Tue Jul 21 22:08:47 2015 UTC,"That is a chunk of blueschist which appears in many parts of the California Coast Range in the Franciscan Complex. It is a metamorphic rock which experienced High-Pressure Low-Temperature conditions as it was subducted under the North American plate down to 12-20 miles or so, and was then exhumed to the surface. A favorite rock of many (at least Californian) geologists."
geology,3dzikw,mo11usk,24,Mon Jul 20 20:12:14 2015 UTC,"Oh, that looks like fossilized coral to me. In that area, it's not uncommon to find fossilized coral, which is exactly what petoskeys are."
geology,3dzikw,Somewhat_Artistic,4,Mon Jul 20 20:24:20 2015 UTC,It's definitely a coral. A lot larger than the Charlevoix & Petoskeys though which is why I'm so curious of what kind specifically.
geology,3dzikw,thanatocoenosis,14,Mon Jul 20 20:31:39 2015 UTC,"The preservation is too poor for a specific identification other than to call it some kind of silicified stauriid rugose.   Those two names you used are local colloquial usages for two very different, and very common, orders of anthozoans; ""charlevoix"" are  various favositid tabulates and ""petosky"" refers to the disphyllid rugose Hexagonaria sp."
geology,3dzikw,Somewhat_Artistic,3,Mon Jul 20 21:28:05 2015 UTC,"Yeah, true. It's not one I've seen before either."
geology,3dzikw,botchman,4,Mon Jul 20 20:41:39 2015 UTC,is it agatized?
geology,3dzikw,rockmasterp,3,Mon Jul 20 20:36:18 2015 UTC,"Yes, definitely."
geology,3dzikw,porygonzguy,6,Tue Jul 21 00:00:06 2015 UTC,"I'd wager that it is some type of rugose coral, which can grow in colonies. They don't look exactly alike, which is why I think it is a type of rugose. Great specimen!"
geology,3dzikw,FossilGirl,1 point,Mon Jul 20 21:09:34 2015 UTC,I would agree.    Pretty badly preserved though.
geology,3dzikw,slalomstyle,1 point,Tue Jul 21 01:49:56 2015 UTC,Kind of resembles an echinoid from here.
geology,3e0gyh,throwme56,4,Tue Jul 21 00:30:51 2015 UTC,"Aside from learning about the origins of igneous and metamorphic rocks, there are viable careers that employ petrographic techniques.  Here's one such job listing.  https://sjobs.brassring.com/TGWEbHost/jobdetails.aspx?jobId=1343287&PartnerId=25664&SiteId=5383&codes=IID"
geology,3e0gyh,hydeman11,2,Tue Jul 21 00:34:58 2015 UTC,I've done some optical work for the Forest Service comparing mineralogy of different locations containing rare plant species. It was neat but could have been done by sending samples in for bulk geochemical analysis. I think they just liked the xpl photos for their report.
geology,3e0gyh,logatronics,1 point,Tue Jul 21 04:43:34 2015 UTC,"I have a question about petrology, is there any application of it to geological engineering. I ask this because it is part of my curriculum, and I'm currently unsure as to how it contributes to the field of geological engineering."
geology,3e0gyh,dead_in_the_water,3,Tue Jul 21 00:37:22 2015 UTC,"It's like mineralogy where the stuff just keeps coming back.  It appeared in sedimentology, ore deposits, and a few other upper year courses."
geology,3e0gyh,twinnedcalcite,1 point,Tue Jul 21 03:50:44 2015 UTC,"Interesting, however I was wondering that since I'm looking to specialize more in geotechnical engineering in the future, would the course be helpful or useful? I should have also specified that I'm currently taking the course and am frustrated with it due to not really finding it interesting or useful to my goals. Therefore, I'm wondering whether it has any value for me with the future I want to go towards."
geology,3e0gyh,dead_in_the_water,1 point,Tue Jul 21 05:12:26 2015 UTC,"If you really want to understand your soils, their formations, and their behaviors then you will need Petrology.  Trust me if you have sedimentology as a required course then you will need it and it will make your life much when doing soil identification.     Sedimentology made the geotechnical engineering design course much easier to go through because we had the full soil knowledge, so we'd get a soil and the environment and be able to make assumptions about it's properties and how to build on it.  The civil's without that background had a harder time with the estimations and environmental assumptions.   As someone who has completed Geological Engineering, this is what I discovered."
geology,3e0gyh,twinnedcalcite,1 point,Tue Jul 21 05:41:22 2015 UTC,"Thank you very much for your response, it helped clear up a lot of the issues going through my mind with regards to the geology-specific courses that were mandatory in my program. Sedimentology is a mandatory course in my program, so I'll make sure I get the most use out of it when I take it in the winter."
geology,3e0gyh,dead_in_the_water,1 point,Tue Jul 21 06:04:48 2015 UTC,"Yeah half the stuff seems silly at the start and then it suddenly appears again.  Linear algebra did that to a few of my classmates in 4th year, the phrase 'SO that's why we took the course' was said a few times.  Advanced structural geology, apparently faults can be written as matrices.   There is method to the madness.  Also by chance are you a UWaterloo student?  Just asking because the schedule seemed familiar to mine in undergrad."
geology,3e0gyh,twinnedcalcite,1 point,Tue Jul 21 06:12:41 2015 UTC,"Yeah, Class of 2017 (hopefully). Good to know that the stuff we learn will be useful in 4th year."
geology,3e0gyh,dead_in_the_water,1 point,Tue Jul 21 06:22:31 2015 UTC,"Yeah it will be useful,  I was class of 2013 so I had a slightly different course offering then you do now but we did have a hand in some of the changes.  Make sure you have money saved for 390 since it's not 100% covered by your fees.  Also take mineral deposits, it's a really fun class since you get to do an exploration simulation.  Good luck with finals and if you need anything feel free to message me, I still have most of my notes."
geology,3e0gyh,twinnedcalcite,1 point,Tue Jul 21 06:27:34 2015 UTC,"Thanks, will do if I have any questions and concerns. Glad to see some UWaterloo alumni here!"
geology,3e0gyh,dead_in_the_water,1 point,Tue Jul 21 06:28:45 2015 UTC,"In my opinion petrology isn't essential for an engineer, but it is for a geologist. If you want a good foundation in understanding igneous and metamorphic processes then I suggest you continue with petrology."
geology,3e0gyh,Harzburgite,1 point,Tue Jul 21 23:50:11 2015 UTC,I once had a lecture on using microscopy and petrology to study concrete and how it chemically breaks down.
geology,3dyulb,loolwat,1 point,Mon Jul 20 17:23:37 2015 UTC,If you were interviewing a candidate for your job or an entry level position what kind of questions would you ask?  I went straight from undergrad to a masters program in geophysics and I'm currently looking for work in environmental remediation. Any tips? Thank you!
geology,3dyulb,Lava39,2,Mon Jul 20 18:01:01 2015 UTC,"click through to the AMA, the OP should be able to help."
geology,3dyulb,eta_carinae_311,2,Mon Jul 20 18:35:45 2015 UTC,"This is why I usually add a little blurb about checking out the AMA, to try to make it less confusing. Thanks for posting!"
geology,3dzls1,selairanie,3,Mon Jul 20 20:34:57 2015 UTC,Where? The color reminds me of olivine. Is it actually glassy like it looks in the picture?
geology,3dzls1,BigWillyTX,2,Tue Jul 21 01:56:49 2015 UTC,Northwest Colorado in the Yampa river. It is very glassy
geology,3dzls1,Sappert,2,Tue Jul 21 02:42:49 2015 UTC,"100% not olivine, olivine doesn't have cleavage."
geology,3dzls1,HingleMcringleberry1,2,Tue Jul 21 18:10:46 2015 UTC,"Out on a limb here, but I say Microcline. Going by the cleavage at the bottom end of the sample."
geology,3dzls1,Bbrhuft,1 point,Tue Jul 21 05:24:07 2015 UTC,It does exhibit Microcline cleavage and reminds me a LOT of Amazonite. I have never seen one with dark green coloring this intense. Perhaps it gets its color from a high chrome content?
geology,3dzls1,KillaGoza,1 point,Tue Jul 21 12:21:46 2015 UTC,"I could be clinozoisite, I don't think it's dark enough to be epidote. Clinozoisite has a strong pleochroism, from green to brown. Another possibility are green Vesuvianite or Diopside. Out of these I think Diopside is most likely.  Edit:  Your mineral is definitely coloured by iron. Amazonite is coloured by minute traces of lead btw."
geology,3dzls1,Bbrhuft,1 point,Tue Jul 21 23:23:13 2015 UTC,Test the sample by trying to scrath it on glass. It probably does but if it doesn't it might be something else like green calcite.
geology,3e0apa,pisspoopisspoopiss,2,Mon Jul 20 23:39:30 2015 UTC,Could be a volcanic tuff.
geology,3e0apa,derzahc,2,Tue Jul 21 01:05:26 2015 UTC,"A fresh surface would be easier to interpret, could you chip off a fresh face and wet it then repost pics?"
geology,3e0apa,HingleMcringleberry1,1 point,Tue Jul 21 06:17:34 2015 UTC,Are any of the crystals stretched out? Looks a little like an ignimbrite.
geology,3e0apa,CageB0y,1 point,Tue Jul 21 01:33:17 2015 UTC,That pale hexagonal looks like leucite to me.
geology,3e0apa,rapax,1 point,Tue Jul 21 05:48:59 2015 UTC,"If it's transparent when you hold it up to the light, then it might be what's known as an Apache Tear, which is basically a form of volcanic glass."
geology,3e0apa,Dinodude101,-1,Wed Jul 22 02:01:51 2015 UTC,"That looks like a lucky meteor (aka, airplane turd)"
geology,3e0o65,smegma_toast,2,Tue Jul 21 01:30:10 2015 UTC,"One of the layers is a stratum, representing compressed remains of a time and place. All of the layers contemplated are strata, each representing an earlier (if below) or later (if above) time and place.  Metamorphic or Igneous rock formations may have strata, representing some identifiable difference between segments of the rock  Remains of dead creatures, of course, end up all over the place and always have. To find the old ones that somehow survive as fossils, best to look for an environment where the remains were covered up and only mildly compressed. This is the definition of sedimentary rock.  Remember that you have to look in sedimentary rock of the right age. What kind of fossils are you looking for? Shark tooth from 2 million years ago? Mollusk shell from 20 mya? Trilobite from 450 mya?"
geology,3e0o65,SonofaDevonianFish,1 point,Tue Jul 21 03:21:43 2015 UTC,"I see, so stratum is one layer while strata is multiple layers. How does one tell which layer is sedimentary?   To be honest I'm not really looking for anything specifically, I just wanted to see fossils in its ""vanilla"" state (as in not in a museum)."
geology,3e0o65,KyleMFKarl,1 point,Tue Jul 21 03:29:49 2015 UTC,"Examples of sedimentary rocks include Shale, Limestone, or Sandstone. They're made up of bits of mud, coral/shells/cement, and sand respectively. These bits have been buried and hardened into a rock. However, temper your expectations because most sedimentary rocks don't have fossils."
geology,3e0o65,OrbitalPete,1 point,Tue Jul 21 13:49:25 2015 UTC,"Identifying sedimentary rocks requires a bit of experience and know how that is difficult to communicate in a post over the internet without demonstration samples in front of us. It's also important to note for your purposes that the vast majority of sedimentary rocks do not contain large visible fossils in any meaningful way.   For what you want to do by far your best bet is to search for known fossil hunting sites in your area.  It's most likely to be in an area of limestone exposure. If you give us your location we can probably even take a look and give you some suggestions. Even then it is well worth going along with someone who knows what they're doing - if you don't know what you're looking for then the chances are you will walk right by even really good examples.  If you want to go more into an intro geology type of thing in how to actually identify rock types then we can do that too, but it won't be quick."
geology,3dyzzt,mi1ksteak,2,Mon Jul 20 18:00:46 2015 UTC,"Hm, I can't think of any specific resource offhand, but I know one of the most important events out here on the coast would be the Appalachian orogeny, which is related to the Alleghanian, Taconian, and Acadian orogenies. Is there any particular region of the east coast you're interested in? I'm from the southeast, so most of the stuff I know is related to here. I'm moving to AZ for geophysics graduate school, so I'm in a similar boat as you!"
geology,3dyzzt,sogorthefox,1 point,Mon Jul 20 18:36:27 2015 UTC,"Congrats!  I'll be in the northeast. I took historical as an undergraduate so I'm familiar with the general geological history of North America, but I'd like to be really familiar with the tectonics and stratigraphy. It's funny because I'm so used to finding new and updated sources on evolution of Basin and Range or the Great Basin or anything associated with the western margin, but there's nothing like that for New York or New England (that is easily found, anyway). Closest I've come is the Roadside Geology of New York, but I'm skeptical whether that's what I'm really looking for."
geology,3dyzzt,thanatocoenosis,1 point,Mon Jul 20 20:15:16 2015 UTC,"Go to the GSA(if you're not a member, yet, you should be) website and plug ""appalachian orogeny"" or ""appalachian basin"" into the search engine. You will find what you are looking for."
geology,3dyzzt,rab0t,2,Mon Jul 20 21:31:45 2015 UTC,appalachian orogeny   The Mother Lode.... Thanks! Another good one I found is Geology of New York State: A Simplified Account. It's apparently a popular textbook for east coast schools.
geology,3dyzzt,GeoWheel,1 point,Mon Jul 20 22:09:20 2015 UTC,Would love to hear these suggestions as well! I live on the East coast and I'd love to know more about the geology of my home. :)
geology,3dyzzt,twinnedcalcite,1 point,Mon Jul 20 18:12:14 2015 UTC,"NEICG is a good resource. Their guidebooks are for sale, but I think you can find some pdfs for free online with a bit of googling. Hope this helps!  http://w3.salemstate.edu/~lhanson/NEIGC/"
geology,3dyzzt,schistkicker,1 point,Mon Jul 20 22:06:24 2015 UTC,Canada Rocks is a good book to start with if you want some eastern Canadian geology.
geology,3dzg40,austa_rasta,1 point,Mon Jul 20 19:55:38 2015 UTC,"Colorado School of Mines has a pretty top notch exploration geophysics group.   Also is it important to contact the professor that I would potentially want to work under before I apply?   Very important.  It's important to show interest.  Also, when applications start going across their desks they'll be able to associate your name with the applications."
geology,3dzg40,NV_Geo,1 point,Mon Jul 20 21:52:19 2015 UTC,What are some key things I should  talk about when contracting professors?
geology,3dzg40,NV_Geo,1 point,Tue Jul 21 03:38:45 2015 UTC,Basically introduce yourself and talk about how their research interests you. Why do you want to be a part of it?  Keep it pretty brief. Professors are pretty busy and won't have time to read a novel.
geology,3dzg40,tpm319,0,Tue Jul 21 03:42:05 2015 UTC,Montana Tech has a decent program too
geology,3dzg40,llamacorn_787,0,Mon Jul 20 22:38:39 2015 UTC,"Definitely check out Mines like /u/NV_Geo suggested. It's a really great program for applied geophysics. You might also want to check out UT Austin and A&M. Though really the best thing to do is to just get a list of universities offering geophysics programs and go to the department websites and read the professors' research sections. That's what I did when I was looking at program. Though, admittedly, I wish I had been more thorough about it.   And yes, it's super important to contact the professor. At a lot of schools, admissions decisions hinge hugely on professor interest. So, gather a list of schools up right now with professors you might want to work with and then start sending out emails."
geology,3duu0a,chucksutherland,3,Sun Jul 19 18:16:11 2015 UTC,Interesting stuff. It kinda freaked me out when he put his hand down to try and figure out if it was bedrock.
geology,3duu0a,littlemissohwhocares,3,Mon Jul 20 04:42:38 2015 UTC,"Don't go near a water drain. Differential pressure, commonly known as ΔP, is a big hazard. Plenty of divers have died from this. If you get dragged down a hole with suction, where water pressure is stabilizing, and your body seals the hole you will get stuck and most likely drown."
geology,3duu0a,ispeakswedish,2,Mon Jul 20 09:43:51 2015 UTC,"These swallets seem to be formed in deep sections of unconsolidated bed load. Under that we suspect the actual cave in bedrock. Aside from these being pretty dangerous for their suction power, there is the possibility that one is standing on a thin shelf of dirt and rock."
geology,3dygf4,np_blitzkrieg,12,Mon Jul 20 15:44:01 2015 UTC,"Some hematite is naturally magnetic, but not all of it.  Magnetite is a naturally occurring magnetic iron mineral."
geology,3dygf4,M_tridactyla,2,Mon Jul 20 15:56:53 2015 UTC,"Hematite is weakly attracted to a magnet, the reason for its weak magnetism is weird...    Hematite is an antiferromagnetic material below the Morin transition at 250 kelvin (K) or -9.7 degrees Fahrenheit (°F), and a canted antiferromagnet or weakly ferromagnetic above the Morin transition and below its Néel temperature at 948 K, above which it is paramagnetic.   Some strongly magnetic (ferromagnetic) minerals I know of are Pyrrhotite, Maghemite and Cubanite. Magnetite is also strongly attracted to a magnet, it was thought to be ferromagnetic but it's actually ferrimagnetic.  Edit: Here's a two more magnetic minerals, Smythite (a highly magnetic monoclinic form of pentlandite) and Batiferrite   (a very rare strongly ferromagnetic mineral). And there's native Iron which is strongly ferromagnetic, as are some platinum nuggets if they contain iron."
geology,3dygf4,Bbrhuft,2,Mon Jul 20 17:47:55 2015 UTC,https://en.wikipedia.org/wiki/Lodestone
geology,3dygf4,NV_Geo,1 point,Mon Jul 20 18:42:32 2015 UTC,"Thanks everyone! This a great place to start. Lodestone looks awesome and I didn't even think of magnetite. As someone planning to study earth sciences, (Early stages. I'm no graduate student.) I'm excited to explore more of everything that's been posted. Also if you folks are experienced looking for good books for beginning geo nerds with little experience."
geology,3dygf4,Dinodude101,1 point,Mon Jul 20 21:41:55 2015 UTC,"I almost want to say emerald because of the color, but the crystal structure says otherwise. But I'm also not sure if it's snowflake plagioclase, again, because of the color. I haven't known plagioclase to be a green color like in the photo."
