geology,3b7sbs,walktheglobe,4,Fri Jun 26 17:36:47 2015 UTC,"I'm primarily a sedimentologist   Sheesh. Settle down...  Slump geology via google scholar:  http://geology.gsapubs.org/content/12/1/27.short  http://trid.trb.org/view.aspx?id=127430  http://archives.datapages.com/data/sepm/journals/v01-32/data/031/031003/0343.htm  http://trngl.lyellcollection.org/content/23/centenary/1.short (oldie, but goodie)  http://eeg.geoscienceworld.org/content/xviii/1/17.short  Mass wasting? Someone slip vodka into the communion wine?  Think about it."
geology,3b7sbs,Rocknocker,1 point,Fri Jun 26 18:44:19 2015 UTC,"Thanks for the tips, this is a new direction of research for me, and I'm under some time pressure."
geology,3b248v,Sappert,6,Thu Jun 25 10:23:24 2015 UTC,I have upvotes waiting for you to go ahead and make a gif of one full revolution in crossed nicols.
geology,3b248v,Zyphit,2,Thu Jun 25 15:09:49 2015 UTC,I might just do that soon.
geology,3b248v,hypo-osmotic,1 point,Thu Jun 25 17:01:13 2015 UTC,Can anyone ELI5 how you identify twinning in a thin section like this? Mineralogy (especially optical) was always my weakest subject.
geology,3b248v,SamwiseGamgee01,5,Thu Jun 25 15:54:33 2015 UTC,All the thick parallel lines are twins
geology,3b248v,furrowsmiter,1 point,Thu Jun 25 15:57:35 2015 UTC,"I call calcite the ""80s mineral.""  It looks like all of that pastel art they had back then.  Reminds me of Nagel and Miami Vice."
geology,3b440k,Dkehs71,14,Thu Jun 25 20:25:57 2015 UTC,"As much as I love the topic of geology, my current job as an exploration geologist for an intermediate mining company in North America is not really doing it for me. I actually despise my job a lot of or most of the time. This is for a combination of reasons:  The biggest one being: I work away from home 75% of the year. 3 out of 4 weeks of the month I'm not sleeping in my own bed. I can't own plants, or a pet and it is a difficult strain on a relationship. My SO is also a geologist so he understands. This schedule is not the case for all geologists - but this is what I've had since I've graduated 4 years ago.  The company I work with is not the greatest. The corporate BS we have to put up with on a daily basis is sickening. It is not an efficient system and we are not an efficient department. The people that I work with are very talented and the skills in most of the people far surpass those of the 'management' of our department. not necessarily a problem specific to geology but my company however it adds to my feelings of resentment towards the job.  The market is EXTREMELY volatile. Ups and downs in the field of exploration and mining is magnified compared to other industries. Right now we are in a down - SO lost his job in dec. I lost mine for three months - most geologists I know don't have work. Apparently this happens once a decade for a few years. So that is something to consider about the finacial stability I'm in for in the future. I am 27, no kids, no house but one day I'd like those things and I can't have my current job and have those too.   Day-in-day-out job wise is ok. Not the best either. I LOVE working outside so I thought this job was going to be great. Turns out I spend most of my time inside a core-shack (most of the time these are a big garden shed with benches for looking at drill core) with my nose to the rock for 10 hours a day trying to stay interested in looking at the same god damn thing over and over again.  I honestly think I am suited more towards something else in the field of geology than the exploration industry. I don't get any fulfillment from my job. I am paid to find gold deposits in beautiful places so my company can make money. I'm the first to admit that mining is required for our live style. I believe I would rather be on the environmental/remediation side of mining or earth science.   Sorry for the RANT. I love the topic of geology. I think it's amazing and I am really happy that I went down that road. I often wonder what I will do when I need to leave my current job.  What about you? Are you like me or are you thinking of joining this field."
geology,3b440k,hitslittle,4,Thu Jun 25 23:23:43 2015 UTC,"Thank you for your post about exploration.  I've been looking to get involved in exploration for a couple of years now, but my physical location and lack of experience in mining makes it difficult.  Right now I'm working as an unpaid laborer in a gem mine, but I'm trying to get out and move on to something better.  So far, what you briefly described in your post sounds like what I want to do.  I have no obligations and wouldn't mind traveling for 75% of the year.  How did you go about finding your job in the first place?  If you want to talk more about it privately please feel free to PM me."
geology,3b440k,Eclogital,3,Fri Jun 26 00:45:32 2015 UTC,The world of exploration geology is really small so most of the time it's about who you know. Networking is important. Most schools will have lots of networking opportunities so don't fret if you don't know anyone yet. Profs./instructors and other students have been excellent in networking for me and my colleagues. There are also exploration and mining events/conferences/seminars that offer cheap rates to students (or you can usually get in free by offering a few hours to volunteer). These are typically really fun (and include beer/wine/spirits) and are a great way to meet new friends and network.   I think I came off a bit harsh in my rant above. I think a lot of it has to do with burn out from an exhausting schedule. Not all geology jobs are like mine (the company I work for demands a lot of time out of all of their geologists). Overall I've been to some pretty awesome places through work and have seen some pretty amazing things.   If I could stay on top of the work-life balance of being an exploration geo I think things would better for me. It's something I am working on.   The money is really good. However the market is tough right now - not a lot of jobs out there with almost all metal prices being down. Especially gold - the commodity I work in.   Picking the right school can be important as well. Some are better than others depending on if you want to be in exploration vs. environmental.
geology,3b440k,hitslittle,2,Fri Jun 26 20:43:13 2015 UTC,"Thanks for the information.  I have been hearing the ""who you know"" aspect of this job from everyone else in exploration so I guess it's the truth.  Unfortunately, I have been out of school for a couple of years now from a university with a very small geology department.  All the professors were PhD status without ever stepping foot in the workforce.  My fellow students mostly went into the local geotech sector and absolutely no one went into mining.  I'm trying to focus on picking a graduate school I can get into and has the opportunity to network with professors and students with similar interests to me.  I've been told most companies don't offer internships so much as student contract work; it doesn't matter to me, I just want experience.  I know of networking meetings such as PDAC in Vancouver and Toronto, but are there meetings in the U.S.?  The money isn't a big deal to me, I just want to get a job I can find satisfaction and be interested to go.  I know metal is down right now so jobs are tight, but I am still trying to break through despite the rougher times.  If you have any advice for someone in my position I would love to hear it."
geology,3b440k,Eclogital,5,Sat Jun 27 07:15:38 2015 UTC,"I work in environmental, to be honest I got quite jaded pretty early on with respect to being an environmentalist working in this industry. I do work to protect human health and the environment, but I also work for the companies that are causing the problems in the first place. So... it's kind of a situation of doing what you need to to get the job done, in the most efficient/ cost-effective way you can. I spend a significant amount of my time negotiating.  Some days I think it would have been better to go into the regulatory side, but I know those guys get bogged down in bureaucratic crap too. I think ultimately it's a matter of reconciling the vision you had of what things would be like when you were in school with what things are actually like in the real world."
geology,3b440k,eta_carinae_311,1 point,Fri Jun 26 14:07:46 2015 UTC,Thanks for the reply.   That's probably where I'm at now - feeling jaded for sure. I have always wanted to do environmental since finishing up my degree. Just haven't found the job yet. I'll take what you said as a reason not to assume things will magically be different in that field vs. exploration.
geology,3b440k,hitslittle,1 point,Fri Jun 26 20:54:35 2015 UTC,"But there's work though right? Because when I finish school, that's a gonna be mah main concern."
geology,3b440k,Krona74,2,Fri Jun 26 23:35:36 2015 UTC,"Environmental is probably hiring the most right now, O&G is definitely in a slowdown"
geology,3b440k,eta_carinae_311,4,Fri Jun 26 23:43:27 2015 UTC,"I really enjoy my job. I'm a hydrogeologist working for a state survey. So far it's been a mix of groundwater flow modeling, water quality sampling and water level measurements, and database development. I travel about 10% of the time, split between field work and conferences/planning meetings. It was fortunate timing on my part, I've had a chance to work on some really cool projects that have generated a lot of interest.  The one thing I dislike is being at the mercy of government funding. We've increasingly moved towards contract work instead of being paid out of general revenue, so we're very much subject to the current political climate. The state's funding situation was never great and the pay is definitely mediocre compared to the private sector. We're fortunate to have a lot of existing contracts or else we'd probably need to cut staff."
geology,3b440k,reverse_thrust,2,Fri Jun 26 00:09:02 2015 UTC,"Had a very similar experience working at one of the USGS' Water Science Centers, albeit in an internship between degrees. The hydrologists there pretty much echoed all of your sentiments at the time, and in reality drove me away from continuing down a path that would have led me to become a hydrologist.   All of them loved what they did, but definitely not how they had to do it."
geology,3b440k,PSN-Honestly,2,Sat Jun 27 06:12:11 2015 UTC,"Exactly. It's unfortunate really, if it were a better location and the pay were more competitive I'd consider sticking around permanently, but there's no way that will happen. We're probably not getting raises this year, we were barely keeping up with inflation as it was.   That and water supply planning is only sexy when there's a crisis, so I'm worried about the future of our funding sources as we work towards solving the problem... sigh."
geology,3b440k,reverse_thrust,4,Sat Jun 27 11:41:00 2015 UTC,"I work as a pit geologist at a copper mine and I love it. For two years out of undergrad, life is good. Family is far away but I can deal with that for now. Work is rewarding, and the people I work with are great."
geology,3b440k,clothsocks,3,Fri Jun 26 00:44:09 2015 UTC,What's it like? What sort of experience did you have beforehand?
geology,3b440k,Lefacavus,3,Fri Jun 26 07:05:57 2015 UTC,"I am a geologist that works as an underground miner for a gemstone mine in the United States. I am not paid to do my job. I work underground a few days a week to learn the ins and outs of a small mining operation including how we look for gemstones. This mine has no need for a geologist since the area isn't very large and all they have to do is follow the zone of mineralization. The average work week consists of finding the paystreak (zone of mineralization), drilling a bunch of holes, sticking in dynamite, blowing up the wall, and hope something is on the other side worth extracting. Rinse and repeat until you have a network of tunnels for an underground mine. The job is fine, it's not difficult, but is physically taxing.  The job is okay in itself even though I'm not getting paid.  I don't get to practice the typical sense of geology, but I am getting experience in mining which is what I want right now.  I enjoy the job because I never get office work.  I'm either in the mine helping drill and stuff or on the surface gathering equipment and sorting mud coated rocks looking for gems which is perfectly fine with me because I had office work geology jobs before and I didn't enjoy.  If you want to get your hands dirty work in a mine.  I'm not too excited to go into work every day, but I think that's partly because I have to wake up at 5:00 A.M. because we start work long before the typical 9-5 day jobs.  If I could wake up later I don't think it would be much of an issue.  Honestly, though I wish at times I did choose a different field of study.  I spent almost a decade living in Silicon Valley, the land of startups, and sometimes I wish I got the skills to get involved with that kind of business, but this is what I have going for me now so it's what I get.  The bonus is I get to work some beautiful granites and pegmatites all day long.  At any lull period in the mine you can find me peeling and bending the layers of the infinite supply of muscovite in the walls and on the floor, it just feels good!"
geology,3b440k,Eclogital,1 point,Fri Jun 26 05:24:51 2015 UTC,"FWIW I have a 9-5 and I get up at 5am :) Actually I work 730-530 M-Th, 8 hours one Fri and have every other Fri off. I have about an hour commute each way. Anyway, point is, you could have a ""traditional"" job and still end up getting up early :)"
geology,3b440k,eta_carinae_311,2,Fri Jun 26 14:11:06 2015 UTC,Good old 9/80 - I'll be starting that in the fall!
geology,3b440k,asalin1819,2,Sat Jun 27 12:20:29 2015 UTC,"So, I'm a geologist that loves his job.  Ironically, I got into the field because I wanted to do the type of work that (as of writing) all the other posters do - namely work outside, collect samples, and do science. Now while I don't work outside, or with my hands, I do get to do a lot of really interesting science & physics.  I work for a service company that provides software/project work for oil & gas companies. I started with the company 2.5 years ago (while finishing my Master's) doing software support, and have since moved on to working on pressure studies. It's been quite fulfilling because every project we get is different, which means solving various complex problems that oil & gas companies have trouble answering on their own. I get to work closely with the geophysicists and geomechanicists, and because of our relatively small size, the dialog between our disciplines tends to be very open - i.e. you don't get siloed.   I didn't go to school for any of the things I'm currently doing, really. I had always planned on becoming a hydrologist, although wasn't quite sure what my end goal was. My background is quite plainly, geology, even through my grad work I hadn't really specialized. So I think I've been extremely lucky to get on with the company I have, one that exposes me to so many different disciplines.  I know plenty of others that have had very different experiences since graduating, some of them have even left the field altogether. My advice is to make sure the company you might join is a good fit for you, and not just you for them."
geology,3b440k,PSN-Honestly,4,Sat Jun 27 06:47:30 2015 UTC,"I'm starting to get burned out.  More for the fact that I am using practically none of my skill-set.  I work for a reasonably large ($250M/yr) Environmental/Consulting firm.  While I am technically a Staff Geologist, I have been running dual-phase groundwater remediation systems for the last several months.  That's not to say I haven't worked on interesting projects (like large scale decomissioning of an NRC-licensed nuke facility), however it feels like I'm spinning my wheels.  I really enjoy learning and practicing geology and would love to get into exploration except most places favor paper champs over those with real world practice and skills rather than just straight academia."
geology,3b440k,k4ylr,2,Fri Jun 26 01:10:46 2015 UTC,"Go work for a smaller firm... I was a geo with one of the bigger consulting firms for about 4 years, and started to get really burnt out.  I moved on to a small firm (<10 employees), and love my job now.  Instead of focusing on one small area of expertise, now I get to do project work, business development, contracting and procurement, and am pretty integral to the company as a whole.  I've been there for over 4 years now, and would highly recommend it.  That said, I do value the experience I got with the larger company.  I got to work on a really diverse set of projects, and after I was done there my resume looked amazing."
geology,3b4ypq,linoleum79,6,Fri Jun 26 00:33:09 2015 UTC,Probably galena.
geology,3b4ypq,SetFoxval,7,Fri Jun 26 03:33:01 2015 UTC,Definitely galena.
geology,3b4ypq,icefoxen,2,Fri Jun 26 04:19:41 2015 UTC,yep
geology,3b4ypq,funkthulhu,3,Fri Jun 26 14:13:37 2015 UTC,niiiiiiiiiiiiiiiiiiiiiiiiiiiiiiice galena.  that must feel heavy as shit.
geology,3b4ypq,YellowstoneRangersFC,2,Sun Jun 28 04:26:52 2015 UTC,"Wash your hands after you touch it, galena is a lead sulfide."
geology,3b4ypq,Biogeopaleochem,0,Tue Jun 30 18:07:36 2015 UTC,It's cubic
geology,3b4391,UT_Sisyphus,7,Thu Jun 25 20:20:38 2015 UTC,"I see quartz, malachite and presumably chalcopyrite. There's also a dark gray mineral which I don't recognize but this looks to be copper ore ish."
geology,3b4391,Sappert,2,Thu Jun 25 21:06:41 2015 UTC,I agree - there may also be some carbonate in with the quartz which often forms with malachite. An acid and/or hardness test could tell you this. The grey mineral could be magnetite (see if it's magnetic)?? or maybe specular hematite (scratch it with something hard and if it streaks red then it's probably this).
geology,3b4391,hitslittle,3,Thu Jun 25 23:30:59 2015 UTC,"Chalcopyrite, malachite, and quartz with possible chalcocite (the sooty black stuff). This could have formed from a skarn deposit, but there are other ways."
geology,3b4391,tjhillbsu,3,Thu Jun 25 23:49:15 2015 UTC,"Looks like a copper sulfide mineralized quartz vein. The minerals are mainly quartz, chalcopyrite, and pyrite. The green stuff is supergene copper mineral alteration, likely malachite if there is carbonate in system or chrysocolla if not. These form when hot fluid carrying metals, commonly of magmatic origin, rise through the overlying host rock in fractures. When the fluids cool, decrease in pressure, or are altered chemically, they precipitate their metals as sulfide phases along with lots of quartz or calcite. The sulfer is often introduced into the system by assimilating the host rock which is often sedimentary and high in sulfer."
geology,3b4391,fuzzie47,1 point,Fri Jun 26 01:38:50 2015 UTC,"Regardless of its genesis that is a beautiful, beautiful hand specimen. What a gorgeous lump."
geology,3b3b1q,adamrobertt,19,Thu Jun 25 16:56:27 2015 UTC,"""you like rocks, hu? what are you going to do with that?""  ""drink beer, play outside, and generally have a good time in life.""  done. if they're not interested in a serious answer, don't give them one."
geology,3b3b1q,eta_carinae_311,7,Thu Jun 25 18:01:26 2015 UTC,You forgot get paid on that list.
geology,3b3b1q,twinnedcalcite,9,Thu Jun 25 19:55:11 2015 UTC,"Some people will make fun of anything, especially science related, but if they really think that there aren't jobs in geology tell them about how many different areas employ geologists in the ""real world"".  Between oil and gas, minerals and other mining, groundwater/environmental, and engineering geology, there are a lot of options that aren't just in academia/research.    If they don't care about that, you could try looking at how many geology grads get jobs or at least offers for funded grad programs which will likely result in a job after anyways.  I don't know the nationwide numbers, but my undergrad graduated 10 people and only one has not worked as a geologist (and this was graduating in the recession in 2009), and he never really tried to get a job and instead went into the Navy.  My grad school was about the same way, almost all have been able to find work except for a couple who don't want to move for a job and are limiting their options."
geology,3b3b1q,giddyup523,7,Thu Jun 25 17:29:51 2015 UTC,"Tell them if you don't grow it, you mine it.  I'm still pushing to use the word ""mine"" with groundwater because in many places that seems to be the case......."
geology,3b3b1q,Kongsfjorden,1 point,Thu Jun 25 23:14:39 2015 UTC,"Yeah.  Part of the problem is that I'm still a novice and learning, so I don't really have the knowledge to rattle off a bunch of great geology jobs even though I know they're out there.  When I say ""I'm not really sure what I'd like to do with it yet, specifically, but there are lots of great jobs out there for geologists"" people don't really seem to believe me."
geology,3b3b1q,giddyup523,1 point,Thu Jun 25 17:39:06 2015 UTC,"You could also mention that pretty much any material people use that isn't a plant comes out of the ground and we need geologists to find them.  Without geology we couldn't mass produce cars, electronics, plastics, cement, etc.  Even glass requires sand which is mined.  Add in that many people around the world rely on groundwater which requires hydrogeologists, and there are tons of jobs to be had.  There are plenty of other roles for geologists beyond these areas also.  I had a professor once say that without geology, modern civilization as we know it would not exist."
geology,3b3b1q,icefoxen,4,Thu Jun 25 18:03:22 2015 UTC,"You're hanging out with the wrong people.  I nearly uniformly get ""Oh cool, I did a geology class for my science requirement in college!  It was so much fun!""  Closely followed by ""You're not working in fracking, are you?"""
geology,3b3b1q,anytimeyoulike,3,Thu Jun 25 18:22:19 2015 UTC,Cluelessness. They have no idea what geology is or how valuable a geology degree is. Personally I think it's fucking fantastic- it means there's less competition in the field than there would be if people knew what it's like.
geology,3b3b1q,Krona74,3,Thu Jun 25 18:07:06 2015 UTC,Tell them they will be bowing to you and 'kissing the ring' once we start running out of water. And you will be there with the knowledge to save the human race.  Then give them that 'Immorta Joe' look.
geology,3b3b1q,Gneissisnice,3,Thu Jun 25 18:27:28 2015 UTC,I just remind people that pretty much everything we use comes from the ground one way or another.
geology,3b3b1q,furrowsmiter,3,Thu Jun 25 19:15:03 2015 UTC,"Just ask them, ""What did you major in, again?""  If they say any degree other than a science degree just give them a condescending roll of the eyes."
geology,3b3b1q,unsupervisedchild,1 point,Fri Jun 26 15:04:59 2015 UTC,"Haha, but why?  I don't get it.  Do people just not know what geology is?  Or is it just adult nerd shaming?"
geology,3b3b1q,asalin1819,2,Thu Jun 25 17:05:22 2015 UTC,"I think it's because a lot of people don't realize that Geology is such a vast subject that encompasses everything from the microstructure of atoms to volcanic eruptions to oil and climate change to planetary formation.  Other scientists who take jabs at Geology I feel like do so because they see it as a soft science. It's not as pure as math,  it's not as pure as physics etc.  But really it's the application of every science,  but people see it as a lot of what we do is inferred and interpreted which is why we get the butt of the joke in science culture. Those who don't study science just see it as dirt rocks and ""its minerals Marie.""  People remember it from what they vaguely remember from Earth Science in 7th Grade.  I think."
geology,3b3b1q,thahamer,2,Thu Jun 25 17:06:12 2015 UTC,"People like to make fun of things they don't know. Don't let it bother or dissuade you, they're usually just jealous (or they will be when you're making six figures in your first job) or they have doubts about their own choice of field (so they hate seeing people who really enjoy what they do).   I just roll with it. ""Yeah, I like rocks. They're pretty awesome things. Rocks tell stories."" and proceed to share my rock collection from around the world. Even was a pickup line once."
geology,3b3b1q,asalin1819,1 point,Thu Jun 25 17:51:39 2015 UTC,"Wait, geologists make 6 figures int heir first jobs? Apparently my employer didnt get that memo"
geology,3b3b1q,dinochic22,1 point,Thu Jun 25 18:46:38 2015 UTC,"Sure, not everyone - probably a majority of people don't, but the money earning potential is quite high: AAPG Salary survey"
geology,3b3b1q,Seth-a-saurus,2,Fri Jun 26 16:50:32 2015 UTC,"There was an ask reddit about a month ago about the best major. Geology was the top one (when I checked it, I suppose that could have changed). So maybe you've just been talking to the wrong people. When I found geology it was the answer to my life. But I've also found people that major in more 'traditional' degrees such as business and prelaw seem to turn up their nose. Or do a little pity speech for me. So whatever. Geology was the most fun major, I got tons of funding for conferences and field trips, and I'm going to grad school for free. So let them judge. Just know you're in a good place and get to go on field trips!!! Plus now there's less job competition for us once we graduate."
