geology,3csspz,usedsocks01,2,Fri Jul 10 14:36:36 2015 UTC,We have 6 different field trips in 10 weeks to various places throughout California. I think mostly Northern California. And a couple of those are over nighters.
geology,3csspz,morehambones,2,Fri Jul 10 14:57:01 2015 UTC,What school are you going to?
geology,3csspz,usedsocks01,1 point,Fri Jul 10 16:50:33 2015 UTC,UC Santa Cruz
geology,3ctwcm,evilpoptart3412,2,Fri Jul 10 19:08:59 2015 UTC,Try the Minerals Education Coalition- they have lots of information sheets.
geology,3ctwcm,FossilGal,1 point,Sat Jul 11 05:41:02 2015 UTC,That is a pretty good starting point. Thanks for the reference.
geology,3cmlix,jonny_jump_up,14,Thu Jul 9 02:07:51 2015 UTC,"Very interesting. From what you've said I would say no, not desiccation cracks. The bedding is all wrong (if there even is bedding), desiccation cracks typically don't form such square shapes. The cracks should also be filled in with some sort of sediment, not just left open - there is rarely negative space in the subsurface.   No, I would go out on a limb and suggest that this rock is a basic igneous rock and the pattern that you are seeing may be from rapid cooling, causing contraction and cracking. My evidence for this is that you've said the sample is hard (like basalt) and so its also probably pretty heavy as well, indicating a basic igneous rock. There are also flecks of white which may be some larger feldspar minerals which are commonly larger than the matrix which is usually made up of pyroxenes and amphiboles.  I would first try to identify if the rock is igneous (this is hard on a fine grained rock I know). Look at the white flecks and try to identify a crystalline shape - they should be lath shaped with reasonably square sides. Furthermore, to test if these patterns are in fact caused by rapid cooling the cracked surfaces should be finer grained than the rest of the rock. Good luck!"
geology,3cmlix,livetoletlive,2,Thu Jul 9 08:46:41 2015 UTC,The rocks isn't as round as it should be for something like a bread crust bomb.
geology,3cmlix,CampBenCh,1 point,Thu Jul 9 14:17:38 2015 UTC,"Just read about bread crust bombs. Except for lacking the aerodynamic shape, it seems right."
geology,3cmlix,FossilGal,1 point,Thu Jul 9 14:31:28 2015 UTC,"The rapid cooling was also a thought that I had, as this was found in Iceland, so igneous made sense. Because the pattern is on all sides, I thought it may have been expelled in an eruption, and had a chance to cool while airborne, but I kind of thought that would result in pumice. Obviously I know nothing about geology."
geology,3cmlix,mjackl,18,Thu Jul 9 14:28:59 2015 UTC,"Mud cracks form parallel to bedding. This pebble has the cracking on two intersecting surfaces. These are also a very weird shape for mud cracks, which tend to the hexagonal. When you see mud cracks in a sedimentary rock, the cracks have been filled in by later-deposited sediment.  This is what preserved mud cracks typically look like. So, no, not mud cracks."
geology,3cmlix,Incomprehensibilitea,1 point,Thu Jul 9 05:40:10 2015 UTC,"Seems that smaller mud cracks could form on the side of a larger mud crack. I imagine a much thicker and deeper mudcrack could form, then the rock could be re-moisturised, and then dried out again, forming the typical mud crack pattern on the exposed side of the block.  On the other hand, I'm a structural geologist, so what do I know..."
geology,3cmlix,The_Rock_Guy,3,Thu Jul 9 15:44:36 2015 UTC,I'd just like to give you a thumbs up for posting a really highquality photo and put in my vote for 'not mudcracks'. Looks like a contact between two rock types one of which is fractured all to hell.
geology,3cmlix,Sappert,15,Thu Jul 9 11:58:22 2015 UTC,"Yep, I gotchu bud.  This was likely around or at the bottom of a lake and this form of rock leaves these signature crack patterns when the water later evaporates.  By the color, composition, and signature crack patterns, it's clay.    The mechanism for clay deposition is incredibly slow; this stuff probably was slowly moved by erosion to the bottom of a lake that later evaporated.  This makes sense as glacial run-off is the exact type of erosion that would bring a clay deposit into the bottom of a valley that would later dry up and leave these rocks around.    Desiccation cracks! Thank you SchrodingersRapist for stating that; it was bothering me that I could not think of the name.  Uhm.  I feel weird thanking  you...."
geology,3cmlix,FossilGal,10,Thu Jul 9 02:34:39 2015 UTC,"I'm sorry but these do not look like mud cracks to me. Especially weird is that they occur on two different sides of the rock. Clay doesn't deposit and dry up in such a way that a rock will have multiple sides with mud cracks. Sadly I don't have a better idea of what it is, but mud cracks it certainly isn't."
geology,3cmlix,Comrade_Snarky8,1 point,Thu Jul 9 08:41:22 2015 UTC,The cracks are on every side
geology,3cmlix,kawaiiju,3,Fri Jul 10 04:02:30 2015 UTC,"Just because a rock is found in a glacial valley does not mean it was originally formed in that valley. If sediment were deposited in a glacial run-off lake, it would not lithify until the sediment was deeply buried, compacted and cemented. A geologist would not see it until all the rock on top had eroded off, and that means the glacial valley would be long gone. Sedimentary rocks don't form from sediment drying up."
geology,3cmlix,Sappert,1 point,Thu Jul 9 05:45:05 2015 UTC,"Dried clay was my first thought as well, but I thought it would be crumbly. This is hard, like basalt, and that made me think something besides sedimentary."
geology,3cmlix,SchrodingersRapist,7,Thu Jul 9 03:10:10 2015 UTC,Sedimentary rocks condense with pressure and time.
geology,3cmlix,Chlorine37,8,Thu Jul 9 04:18:17 2015 UTC,Looks like mud cracks to me! It looks really fine grained so it could be that?
geology,3cmlix,Sappert,6,Thu Jul 9 02:32:34 2015 UTC,Not mud cracks. You'd only see it on one side of the rock if it were mud cracks.
geology,3cmlix,GeoWheel,1 point,Thu Jul 9 09:25:19 2015 UTC,"Same thing I would have said, desiccation cracks"
geology,3cmlix,caithaha,2,Thu Jul 9 02:48:42 2015 UTC,"I am totally guessing here, but to throw out a random theory since I agree they are not mud cracks: there were intersecting fractures that create the strange faces.    Edit: I still think the face represent fracture surfaces but not so sure about the mechanism for creating the filling and cracking?  Rapid cooling?"
geology,3cmlix,Fairbanksbus142,1 point,Thu Jul 9 14:40:32 2015 UTC,"The straight angle which the two sides with the weird structure make, as well as the seemingly different material of which the outer part and the inner part are made of, makes me think this might be something man made."
geology,3cmlix,Fairbanksbus142,1 point,Thu Jul 9 09:26:56 2015 UTC,"Honestly, I'm surprised no one has realized that this is clearly a fossilized part of a very angular/blocky dinosaur, preserved skin and all! /s"
geology,3cpzrw,Flunkie_Drugs,4,Thu Jul 9 21:08:01 2015 UTC,"2 - Looks like a jointed sandstone to me. I don't see any distinguishable offsets to make me think ""normal fault.""  3 - these appear to be ripple marks for sure, although my guess would be from water deposition, not wind erosion.  4 - tilted sedimentary layers  5 - geode? Sure.   6 - I'd guess azurite and malachite too  7 - conglomerate. ""porphyritic"" refers to an igneous texture, which is not what we see here.  8 - It's in a cave and hangs from the ceiling, so it's a stalactite of some sort. Based on the sort of flaky texture, I'd guess gypsum but that's just a guess.   9 - Not an angular unconformity; riverine(?) cross bedding. Any sort of 'unconformity' must represent a gap in time - this was a continuously deposited sequence, although the depositional environment changed to show cross bedding.   10 - meandering river with yes, an oxbow lake."
geology,3cpzrw,PineHand,2,Fri Jul 10 00:04:53 2015 UTC,Definitely Malachite and Azurite or slight variation of things in that group
geology,3cpzrw,IonOrchid1,2,Fri Jul 10 00:52:06 2015 UTC,Yep 3 is definitely a sedimentary structure
geology,3cpzrw,Sappert,2,Fri Jul 10 10:03:07 2015 UTC,Take another look at 8. Look at the shape of the rock bits. It's not illustrating an igneous feature.
geology,3cpzrw,FossilGal,2,Thu Jul 9 21:50:38 2015 UTC,"Some thoughts on these photos:  Normal fault- There are definitely fractures here, but it doesn't look like there's any clear offset. I think these are joints. Ripple patterns- Definitely ripple marks. how do you know they're form wind? water ripples are more likely to be preserved. Angluar unconformity-  ""Porporitic""- This is a conglomerate, not porphyritic texture, If that's what you mean. Porphyritic texture is a result of magma that has cooled slowly enough for significant crystals to grow. plenty of google images to give you examples here. Angular unconformity- These are cross beds, and I don't think that's what most people mean of when they say angular unconformity. On a larger scale, an angular unconformity involves the deposition of bedding, uplift/tilting of bedding, erosion, and then deposition of more sediments."
geology,3cpzrw,GeoWheel,1 point,Thu Jul 9 21:59:39 2015 UTC,Just wondering why you say water ripples are more likely to be preserved?
geology,3cpzrw,caithaha,1 point,Tue Jul 14 16:49:43 2015 UTC,"My impression is: water-formed ripples are more likely to have sediment deposited on top of them to preserve them. In areas where sand is exposed to air and is unconsolidated, that sand is probably going to be transported somewhere else."
geology,3cpzrw,GeoWheel,2,Tue Jul 14 19:48:02 2015 UTC,"So I would argue its just as likely to occur in either environment.  In order for ripples of any kind to be preserved, an influx of sediment from somewhere is required. And this really goes without saying, and I'm only mentioning it for completeness of my own thoughts, but if there is no increased sediment load - in either type of environment - then all you have are migrating bedforms.   I guess I see what you're saying, if you're saying that aqueous environments are more likely than eolian environments to have this sediment influx. I'm not really sure what evidence there is of that, though. It seems pretty unlikely to me that any dynamic environment - sub-aqueous or eolian - would become permanently  stagnant i.e. produce ripples and then no further movement would occur causing sediments to settle out due to gravity. ""Permanent"" in the sense that no movement would occur for a long enough period of time to allow preservation (not necessarily consolidation or lithification, though).  So, I guess if I had to choose which of those environments that scenario was more likely to occur in.... you're right, it would be sub-aqueous."
geology,3cpzrw,caithaha,1 point,Tue Jul 14 21:34:49 2015 UTC,"Right on. This is definitely not my area of study. When I picture smallish ripples of any kind, I immediately recall outcrops of interlayered sands and silts from an estuarine environment. In this case, deposition of silt-sized particles is the norm, punctuated by comparatively high energy events introducing sand sized grains (storm deposits, exceptionally high tides?), then overlain by more silt-sized material. With the potential for channels to migrate, it seems like this would be an ideal environment for ripples to be preserved, and potentially(?) more widespread than events leading to deposition of material in an aeolian setting that is significant enough to shield the ripple from erosion.   To my detriment, I escaped undergrad w/o sed/strat except for a crash course during field camp, so I apologize if this is total... hogwash."
geology,3cpzrw,GeoWheel,1 point,Wed Jul 15 01:50:49 2015 UTC,"Haha not at all hogwash!   Despite my primary interest in hard rocks and geophys in undergrad, I did some extra work for my sed/strat prof and then worked for him as an undergraduate learning assistant for the following term. Sometimes I like to challenge myself on reddit with how much I remember...but I'm not always right and I admit I'm better at sedimentology than stratigraphy...even though strat is really, way more fascinating. Yay sand  Anyway, I agree with what you're saying here. I didn't really consider which ""reservoirs"" contain more sand and silt sediments but I guess it's pretty obvious that ocean basins would. I've been land locked in Colorado for quite a few years now so I tend to forget about those things called oceans and beaches. =P"
geology,3cpzrw,caithaha,1 point,Wed Jul 15 17:21:16 2015 UTC,"Thank you friends, much appreciated. 8/10 answers correct with a C in the course (5 week mini)  Once again much thanks :)"
geology,3cpzrw,caithaha,1 point,Fri Jul 10 16:21:50 2015 UTC,Which two did you miss?
geology,3cpzrw,caithaha,1 point,Tue Jul 14 16:53:19 2015 UTC,"OP - I know your class is over but if you can look at the sorting, sizing, and composition of the rock this can help determine if they're eolian or  not."
geology,3cn268,clothsocks,1 point,Thu Jul 9 04:32:46 2015 UTC,"Awesome! I have a gold claim by Buena Vista and I keep seeing vids of crazy crystal finds all around it, got me thinking about changing gears. Nice work prospecting there if that is you in the vid."
geology,3cn268,agoldprospector,-1,Thu Jul 9 08:01:41 2015 UTC,"I might be the only one but it really makes me sad to see all the nice rock formations being mined down like this for economic gains. And the whole rock hounding culture just makes me sad. Ore mining I can understand, our society actually needs metals, but most of these rocks just end up in some dusty collection."
geology,3cn268,Sappert,1 point,Thu Jul 9 08:44:22 2015 UTC,"It is kind of sad, I wish they would leave some behind, but I suppose it's not as sad as crystals getting crushed in a mine crusher. I met a former miner who's job was to destroy every mineral specimen he could find in the opencast Tynagh Mine in Galway, Ireland, using a steel rod. He'd use the rod to smash all the crystals in the vugs. The mine had some of the world's finest azurite and cerussite crystals, rivalling Tsumeb, Namibia. It was done to deter collectors.   Also, in South America, the European Union sponsors training of former miners, teaching them how to collect and prepare minerals for collectors. That way they still have a job after mines close down. One example is the El Desierto Sulfur Mine, Potosi, Bolivia.   http://www.mineralogicalrecord.com/pdfs/TheMineralogicalRecord_ElDesierto.pdf"
geology,3cmjhu,KinkyKhajiit,1 point,Thu Jul 9 01:51:52 2015 UTC,Where are we today?
geology,3cmjhu,HingleMcringleberry1,2,Thu Jul 9 06:31:48 2015 UTC,"The Mount Isa Inlier, just south of a little town called Cloncurry in central Queensland  Australia"
geology,3cmjhu,HingleMcringleberry1,2,Thu Jul 9 09:21:20 2015 UTC,"Mate, coming up there in a few weeks for geo-mapping!"
geology,3cmjhu,HingleMcringleberry1,1 point,Thu Jul 9 09:24:59 2015 UTC,"You're going to have lots of fun haha, are you coming up with a  group?"
geology,3cmjhu,kmmontandon,1 point,Thu Jul 9 13:05:23 2015 UTC,"Nah, Han Solo for this mission. Fun is not the word I am thinking of hahah"
geology,3cmjhu,Gargatua13013,1 point,Thu Jul 9 18:27:21 2015 UTC,"I guessed New Mexico.  Only off by 10,000 miles, but that's better than usual for me."
geology,3cn6sh,grantanamo,4,Thu Jul 9 05:18:24 2015 UTC,"Come visit us in /r/geologycareers - ongoing AMA series with different professionals, as well as other resources. There are also some old threads here in /r/geology if you do a search."
geology,3cn6sh,asalin1819,2,Thu Jul 9 10:11:33 2015 UTC,You're killing it. Mvp of geologycareers marketing.
geology,3cn6sh,loolwat,2,Thu Jul 9 20:56:50 2015 UTC,And you're the undisputed king of giving answers to real questions - I just like seeing each sub get its day.
geology,3cn6sh,asalin1819,1 point,Thu Jul 9 22:38:55 2015 UTC,I'm just a really good bot.
geology,3clr54,protest777,3,Wed Jul 8 22:06:04 2015 UTC,"Hopefully it doesn't break during drilling because you need to measure and record orientation before extracting (though breakage does occur somewhat frequently)!  We used to use a small chisel to break the cores out, one small enough to slide into the gap a bit, then a few taps would usually break it out. This gives a little bit of information geared towards paleomagnetic sampling, though the pictures are tough to make out and you probably don't care about paleomag if you are sampling granite and diorite. Still, it is good practice to record the orientation information when collecting samples even if you don't think the information will be useful."
geology,3clr54,JMGurgeh,1 point,Wed Jul 8 22:48:02 2015 UTC,Thanks!
geology,3clr54,slim_plug,1 point,Wed Jul 8 23:13:26 2015 UTC,Stick a rod or chisel down the hole (to the side of the core) and pop it with a hammer.
geology,3cjn4m,Jens---,10,Wed Jul 8 12:48:36 2015 UTC,"1). When you cut a core from formation that you suspect has gas in it, the general procedure is to pull the core out of the hole slowly (usually about 2minutes per 27m), to allow the core to degas in a controlled manner. Assuming your reservoir is permeable, there shouldn't be any gas in your core by the time it reaches the surface. The main reasons for this are primarily safety (believe me, you don't want a core full of gas at 440bar arriving at your drill floor) and also to preserve the structural integrity of your core (as the gas will expand when it is exposed to lower pressure on its way to surface and if it expands too fast your core will shatter).   It might be that there's a bit of condensate with the gas accumulation. Condensate should remain in the core, which fluoresces a very light yellowish green color.  Definitely worth checking out. A word of warning if you do this, check the drilling fluid used to cut the core. Oil Based Mud filtrates are also very low gravity oil and may look similar to condensate under a UV light. They will also be concentrated at the edge of the core - so if you see fluorescence at the edge but not in the centre, it's probably contamination.   2) depending on the resolution of the pictures, you can probably throw together a sedimentary log at a reasonable scale. Also, depending on where and when your core was cut, you might be able to get a lot more information on it than you'd think. I work out of the North Sea and pretty much all well data has to be made publicly available after a certain time period (varies from sector to sector).   Good luck!!"
geology,3cjn4m,ObscenePenguin,1 point,Wed Jul 8 16:01:07 2015 UTC,As far as I'm aware the only way you would see gas in a core would be as very light residual fluorescence. You would need chromatograph readings or something along those lines to confirm gas
geology,3cjn4m,mxfb038,1 point,Wed Jul 8 14:01:00 2015 UTC,"That's what I thought as well, though I can't find anything on it. I suppose because there's nothing to write about it :D"
geology,3cjn4m,Gargatua13013,1 point,Wed Jul 8 14:40:17 2015 UTC,"Q-1: I'd give it a whirl cause it's cheap and dirt easy, but success will depend on the materials at hand. Shale might be a lost cause, but limestone and sandstone might trap some hydrocarbons in fluid inclusions. Whether those would fluoresce enough to be perceivable is anybody's guess. We use UV to spot such inclusions in micro-thermobarometric studies on fluid inclusions, but under a microscope. I'd put that one in the ""Try it but keep low expectations"" category. Perhaps with a handlens on sparry cements?  Q-2: With good high-res macro shots you can do quite a lot. I've routinely used such for mineral counts for classification of granitic rocks for instance. You can even use color distribution stats from commercial image processing software to get percentages. With sedimentary rocks, you could do the same after standard coloring procedures to sort out K-spar, Plag and Qz proportions to build QFP diagrams.  Textures, fossils are also quite good from high res pix, provided they are good of course."
geology,3cjn4m,gfdvca,1 point,Wed Jul 8 15:37:34 2015 UTC,"I risk stating the obvious, buy you may want to take a more detailed look at the logs that you have available. Your best gas indicator will come from porosity logs or a gas log (gas concentrations in the drilling mud as it reaches surface). Based on my experience, if the operator is willing to invest their time and money into drilling a core, there should be at least a wellsite gas log/mud log/formation evaluation log. If you can find a porosity log with neutron/density crossover (neutron curve reads low porosity where density reads high porosity) you have probably found yourself a gas zone.  You should also consider a GRI analysis if you are working with shale and looking for shale gas. (http://www.corelab.com/ps/gri-analysis) With about 6"" of full diameter core, the lab takes the intact sample, pulverizes it, and measures any gas that is liberated during the test. This test might not be very useful with older core samples, as I'd imagine that the gas escapes fairly quickly (over a matter of days or weeks) once it is exposed to atmospheric conditions.  Best of luck."
geology,3cjn4m,physicsyakuza,1 point,Wed Jul 8 17:33:16 2015 UTC,"And here I was hoping for an inner/outer core question, I can answer those!"
geology,3cjn4m,slim_plug,1 point,Wed Jul 8 21:28:34 2015 UTC,"I produce high resolution images of core samples. From image analysis you can determine porosity, permeability, mineral composition, grain size, pay dirt, depostion/different layers and patterns, hydrocarbon content, and fossils galore. Magnification is no issue, can go all the way up to SEM via plugs or thin sections from the core."
geology,3cls9h,data91,3,Wed Jul 8 22:14:44 2015 UTC,"You seem to be right about the pyrite/quarts (could also be calcite, I can't tell from the photos)  It's worth whatever somebody will pay for it. That isn't exactly a high quality specimen, so not very much IMHO."
geology,3cls9h,-HoldMyBeer-,2,Thu Jul 9 00:53:27 2015 UTC,"As a collector, I'd pay $30."
geology,3cls9h,IonOrchid1,-1,Thu Jul 9 05:12:00 2015 UTC,It's a geode!  Part of one anyway.  A pretty big and nice one.  Might be worth $40 to a collector?
geology,3cls9h,icefoxen,3,Thu Jul 9 00:51:09 2015 UTC,That's not a geode.
geology,3cl5i9,sciencefolyfe,6,Wed Jul 8 19:33:46 2015 UTC,"Kept mine, and they were useful particularly when I ended up being a lab TA."
geology,3cl5i9,Eve_muscovite,4,Wed Jul 8 20:29:56 2015 UTC,"Personally, I got rid of all my texbooks and I regret it. The bookstore gave me so little for them that I wish i just held onto them"
geology,3cl5i9,thahamer,3,Wed Jul 8 19:54:00 2015 UTC,It will come in handy later when you need to reference something simple in a paper you're writing. The defininitions in an intro book are great for writing papers that may be read by non geology folks
geology,3cl5i9,Weasel1088,2,Wed Jul 8 21:25:54 2015 UTC,"If you don't need the cash, you won't regret keeping it."
geology,3cl5i9,ouemt,2,Wed Jul 8 20:30:04 2015 UTC,"KEEP ALL OF YOUR GEOLOGY TEXTS!  I would also recommend keeping your math, physics, and chemistry texts."
geology,3cl5i9,thanatocoenosis,1 point,Wed Jul 8 23:27:28 2015 UTC,"Personally, I got rid of all my texbooks and I regret it. The bookstore gave me so little for them that I wish i just held onto them"
geology,3cl5i9,thahamer,1 point,Wed Jul 8 19:54:38 2015 UTC,I think the intro book is easily sell-able. Between the internet and that awesome library at your campus you will be covered. Anything after the intro book you should hold onto. I used my mineralogy book in my petrology class.  The petrology book will be a great reference that I used both in and out of other upper division courses.
geology,3cl5i9,Chainwreck,1 point,Wed Jul 8 20:07:49 2015 UTC,bookzz.org  I've found almost every textbook I've needed on there and more.  I'd only use physical books if the way you study and retain a information is improved with a book.
geology,3cl5i9,hawaiihatch,1 point,Wed Jul 8 22:57:22 2015 UTC,"If you wind up taking the GIT exam in prep for professional licensing, they say it's really helpful to review all your textbooks as prep."
geology,3cl5i9,skimmer,1 point,Thu Jul 9 00:42:40 2015 UTC,"Yeah, it'd be good to hold onto it. If you go on to grad school in geology those intro books are supposed to be fantastic for your comp exam."
geology,3cfmlk,eta_carinae_311,1 point,Tue Jul 7 15:18:01 2015 UTC,heck of a conversation. thanks folks.
geology,3ch822,keraneuology,6,Tue Jul 7 21:59:08 2015 UTC,"Boss: ""Good news boys, there's no active fault under the development site!  You know what this means? Anything we build there will be invulnerable to earthquakes!""  Underling: ""But sir the site is still located in, you know, the L.A. Basin. How are we any safer?""  Boss: ""Get the fuck out"""
geology,3chp6d,pipsqueak922,5,Wed Jul 8 00:10:30 2015 UTC,"I'll take slag for 200, Alex"
geology,3chp6d,secondbase17,2,Wed Jul 8 04:30:35 2015 UTC,"""moldy cheesecake""-Imgur comment. hahahah"
geology,3chp6d,smalltownatheart,1 point,Sun Jul 12 16:10:00 2015 UTC,Hey! Where was this found? Did you break it off a rock outcrop or was it loose on top of the ground?
geology,3chp6d,HingleMcringleberry1,1 point,Wed Jul 8 00:30:13 2015 UTC,/r/whatsthisrock is your friend.
geology,3chp6d,daReaper88,0,Wed Jul 8 07:30:07 2015 UTC,Just some flint.
