gifs,3c8yti,astroman9995,"At first I was like, ""Pffft, I see that every time I go to Kyoto Steakhouse,"" then I was like, ""Nnnnnoope; never seen those impostors do that."" Very skillful!"
gifs,3c8yti,ZorkFox,"You have to go all the way to Hoboken, NJ to learn! \n\n-Barney Stinson"
gifs,3c8yti,dc300,lets go to shinjitsu
gifs,3c8yti,lasvegasfun,Ha chooo!
gifs,3c8yti,timespacer8032,I bet you I can do all of the stuff they do. If I can I get to touch Lilly's boobs.\n\nEdit: Here is the video! https://www.youtube.com/watch?v=Su1MNX4Vnh4
gifs,3c8yti,DudeWithAHighKD,So Ted and Victoria...
gifs,3c8yti,al3xanderr,"I'm loving this chain of comments. Even if it's from an episode that, if I think hard enough about, is really weird."
gifs,3c8yti,DoctorSteve,"Bang, Bang Bangity Bang\n\nI said Bang, Bang Bangity Bang\n\nBang, Bang Bangity Bang\n\nI said Bang, Bang Bangity Bang\n\nBang, Bang Bangity Bang\n\nI said Bang, Bang Bangity Bang (Bang, Bang, Bang, Bang)\n\nBang, Bang Bangity Bang\n\nI said Bang, Bang Bangity Bang"
gifs,3c8yti,idwthis,"Bang, bang, biggity bang!"
gifs,3c8yti,davi00a1,so I never seen that episode. Did he win or lose? And did they follow through with their terms?
gifs,3c8yti,toekneeg,"Season 7 Ep 3\n\nIt turns out Barney mastered all the techniques of the trade by going to a night school for it in NJ. He also intentionally conditioned Marshal over years of practice, to associate that restaurant with Barney sneezing. Every time Marshal said ""lets go to shinjitsu"" Barney would sneeze. Then when Marshal finally had something Barney wanted, in this case to touch Lilly's pregnant boobs, he sneezed and Marshal recommended Shinjitsu. After they made the bet all of a sudden he started explaining his plans and how he is a master of the art. Lilly called a deal to let him just see both in the back alley and call the rest off. Barney agrees to that deal. Last minute Marshal stops Lilly and says he is bluffing. Then it cuts to Barney tossing around knives and doing tricks because he wasn't bluffing. Barney does every trick but as he is performing the shrimp in the pocket, Lilly flashes him to distract him and he misses it. He then had to wear that ducky tie for months until he made a new deal with Marshal to trade it in for 3 extra slaps, 2 of which Marshal used immediately."
gifs,3c8yti,DudeWithAHighKD,Hmm mildly interesting.
gifs,3c8yti,itonlygetsworse,God I need that ducky tie
gifs,3c8yti,JosePajamas,http://www.cbsstore.com/how-i-met-your-mother-ducky-tie/detail.php?p=450614&v=cbs-howimetyourmother-barneys-man-cave
gifs,3c8yti,DudeWithAHighKD,That was a thorough yet succinct summary for the episode. Well done.
gifs,3c8yti,Shylamb,Oh shit. I forgot about the slap bet. I need to re watch that show.
gifs,3c8yti,amrocthegreat,"As I recall, just as Barney was just about to finish the ol' shrimp in the pocket, Lily lifts up her shirt and distracts Barney, keeping him from completing the trick. Barney then went on to wear the Ducky Tie for one year a while, as agreed."
gifs,3c8yti,thatoneguy95,"Actually, Barney gets off early from that deal, but he has to give Marshall some extra slaps."
gifs,3c8yti,chunkymonkeyman,(╯°□°)╯︵ ┻━┻
gifs,3c8yti,DoesNotRespectTables,Name checks out.
gifs,3c8yti,Thepres_10,(╯°□°)╯︵ ┻━┻
gifs,3c8yti,DoesNotRespectTables,Holy shit.  Someone protect the periodic table!
gifs,3c8yti,Generic_Student,(╯°□°)╯︵ ┻━┻
gifs,3c8yti,DoesNotRespectTables,someone call /u/PleaseRespectTables !
gifs,3c8yti,joachim783,You mean to tell me that the only thing you have done for a year is flip tables?
gifs,3c8yti,Liz_zarro,Unagi!\n\n-Ross
gifs,3c8yti,thebigbadben,As someone who lives in Hoboken. What is the deal with Hoboken and hibachi?
gifs,3c8yti,joe-clark,"Hoboken, no jokin'."
gifs,3c8yti,GoldenChrysus,"Brentwood, up to no good!"
gifs,3c8yti,Madetofap,"Hoboken resident here. Can confirm, we all know the secret art of the Hibachi."
gifs,3c8yti,jordanscales,Yes! I was thinking wow nothing special here... Then he shows his true art. Amazing.
gifs,3c8yti,i-be-steady-lurkin,I'd be really impressed if he drew a dickbutt.
gifs,3c8yti,saintshing,Eggselent skills indeed
gifs,3c8yti,farmerwouldsay,Imposters they may be they still put on a pretty great show and the food is great.
gifs,3c8yti,Yetanotherfurry,"I like to imagine that he didn't mean to do this and just said ""Fuck it, lets make some shit up."""
gifs,3c8yti,Midgard9,"Unless it was Valentine's day, that shit is pretty fucking random."
gifs,3c8yti,whiskey4breakfast,..and on that day his girlfriend extremely impressed by him.
gifs,3c8yti,Dorisyaln,I imagine the chef has a shit-eating grin after pulling this off in front of whatever couple.
gifs,3c8yti,roogug,First I make yo eggs\n\nThen I steal yo girl
gifs,3c8yti,g3t0nmyl3v3l,Eat that wonton soup\n\nWet like wonton soup
gifs,3c8yti,jm001,This is how he proposed...that an assassin murder his girlfriend with an arrow to the heart.
gifs,3c8yti,zazie2099,It's Japanese Teppanyaki - they always do stuff like this!
gifs,3c8yti,jamesinc,Only outside Japan. There are no theatrics at teppanyaki restaurants in Japan.
gifs,3c8yti,JoeyButtafuocosTaint,Yep the chef is dead serious the entire time and if your meat isn't cooked right he commits seppuku right there in front of you
gifs,3c8yti,MurdochAV,On the grill.  Everyone has to take a bite.
gifs,3c8yti,Xombiwulf,Course in those tacky American versions the chef flips little bits of his guts at you with a spatula and you have to catch them in your mouth
gifs,3c8yti,MurdochAV,Delicious.
gifs,3c8yti,Ifromjipang,Only if you order innards.
gifs,3c8yti,JoeyButtafuocosTaint,"Last time I was at benihana every got their steaks medium except the girl next to me and she said medium-rare and hers was on the longest, obviously extremely well done, and she didn't say a word."
gifs,3c8yti,lolimafuckincop420,"Funny thing, in most of the teppanyaki restaurants I've been to outside of Japan, the chefs are either Hawaiian or Filipino."
gifs,3c8yti,testbug0,"I've never seen doing that in Europe, either. I thought the reason was because I go to cheap-ass Japanese restuarants, but hey, if people in Japan don't do it, then that thing is just some tacky fortune cookies/fettuccini alfredo shit."
gifs,3c8yti,MarcoBrusa,Don't you dare talk shit about fettuccini alfredo that shit is delicious.
gifs,3c8yti,Benkyoushiteimasu,"Hey, I do like fake Chinese food, but that doesn't make it less fake!"
gifs,3c8yti,MarcoBrusa,Or to hit on my girlfriend right in front of me. I don't like going to these places anymore.
gifs,3c8yti,PodcastGuy,Imagine the fuck around for the rest of the kitchen if it takes him this long to crack an egg every time
gifs,3c8yti,stretchcharge,I assume a Shokugeki will be announced against him next.
gifs,3c8yti,Narcle,Best girl cabbage pink
gifs,3c8yti,FedoraTippinGood,"It warms my heart that that link was already purple, ahem, dark pink."
gifs,3c8yti,Freezman13,Even better with sound
gifs,3c8yti,TheDerped,That link is harmful.\n\nChrome gave me a warning that the site contains harmful programs.\n\nhttp://i.imgur.com/LTFXy1h.png
gifs,3c8yti,jackrunes,You should get RES.
gifs,3c8yti,PrismDoorKnob,"Its a filesharing website, of course somebody shared a harmful program there."
gifs,3c8yti,Shinhan,"Okay, what was that, because I have to watch it now."
gifs,3c8yti,Valdrax,"I'm not sure but judging by the context I'm assuming it's shokugeki no soma aka food wars, it's on crunchyroll.\n\nI could be completely wrong though"
gifs,3c8yti,scorcher117,nope you're not wrong thats exactly what it is.
gifs,3c8yti,joachim783,Torn feline Icelandic horse
gifs,3c8yti,krebstar_2000,"When you eat his food, you get an orgasmic sploosh fantasy."
gifs,3c8yti,3rdSun,I never thought I would see a woman have an intense orgasm over some roast.
gifs,3c8yti,grantistheman,What about the tentacle porn in the first 5 minutes of the first episode? Got me hooked instantly.
gifs,3c8yti,MellowMoa,"Was ok, until you realized peanut butter was involved. Could you IMAGINE."
gifs,3c8yti,grantistheman,...the POSSIBILITIES!
gifs,3c8yti,ManicLord,i understood that reference.
gifs,3c8yti,thecloudsystem,"Man I've been reading the manga since like 40 chapters in and my initial reaction to the first episode was, ""I hope to god nobody ever hears me watching this."" I never truly understood how bizarre the whole idea was, but still I continue to watch/read."
gifs,3c8yti,Treecko160,"In the beginning, this reminded me of Hannibal."
gifs,3c8yti,WaldenStrom,"“We are more than a bit concerned with the Benihana egg trick called for in the script. I’ve tried it and can only get it 1 out of 4 tries, and I’ve seen Benihana chefs flub the manoeuver when they have an entire grill as target. Mads has to crack his eggs into a 8-inch diameter skillet. The props Master calls his guy. The Production Manager calls in his guy. I call my guy. On the morning of the shoot we have 8 dozen eggs and 3 Japanese chefs with their hands made up to be hand doubles.\n\nI guess I don’t have to tell you that when Mads arrives on set, he just tosses an egg up in the air and the egg breaks on the spatula. No problem. Unbelievable. I insist it was a lucky fluke but he does it again. I accuse him of practicing when I wasn’t looking but he laughs (as if he has time to practise egg-cracking between scenes) and tells me he was a juggler in his youth.”\n\n\nfrom Janice Poon's (the show food stylist) blog.\n\n\nEDIT: added link source, MAJOR SPOILER ALERT."
gifs,3c8yti,the_lucky_cat,And Mads gets even fucking cooler.
gifs,3c8yti,MotherBeef,But what's cooler then being cool?
gifs,3c8yti,0takuSharkGuy,Ice-Mads?
gifs,3c8yti,MotherBeef,MadIce!
gifs,3c8yti,MushroomedAnus,I came here to see if someone would post this up. Thanks for doing that!
gifs,3c8yti,lastresort08,Benihannabal
gifs,3c8yti,lockboy84,Is that egg from a human?
gifs,3c8yti,mission17,"Of course, where else does one get eggs?"
gifs,3c8yti,WaldenStrom,yes
gifs,3c8yti,Bordeaux107,"I love that they were going to have someone else perform this maneuver and Mads was just, ""Nah, I got this."" And pulled it off in the first few shots."
gifs,3c8yti,lolacarmenlisterine,Benihana? Beni-fucking-hana!?BENI-FUCKING-HANA!!??
gifs,3c8yti,DUBBZZ,Benihana
gifs,3c8yti,no_zageesi,Just rollin around on some square wheels with my triangle feet
gifs,3c8yti,rdubya18,"Square they may be, but some clever tricks with the design of the wheel texture makes it very hard to notice when in motion."
gifs,3c8yti,zanhoshi,So here I am
gifs,3c8yti,abc123shutthefuckup,Doin everything I can
gifs,3c8yti,Heinzliketchup,Why would you choose a chain of fucking hibachi restaurants to take me down
gifs,3c8yti,TreeFittyy,the guy that started benihana was a real interesting dude. Rocky Aioki
gifs,3c8yti,yasserkhan1,And his son is phony DJ Steve Aoki
gifs,3c8yti,PLEASE_KICK_MY_ASS,we not talking about the game...we talking about benihana?
gifs,3c8yti,opusink,i like you more than i should
gifs,3c8yti,asshole_commenting,"24 hours, this back on the front page, edited so that instead of a heart, he makes a dick-butt."
gifs,3c8yti,Atworkwasalreadytake,24hs? Too much credit. Also someone will find the source and post on /r/videos.
gifs,3c8yti,justsyr,You got it backwards. People make gifs of shit from /r/videos and post it here
gifs,3c8yti,SingleLensReflex,"It's just a perpetual loop, you're both right depending on the day and time"
gifs,3c8yti,therealgreenbeans,"I'd be impressed if anybody could do it convincingly, cos you'd have to make it so his arm moved like he was drawing dickbutt as well."
gifs,3c8yti,BarneyBent,Not if you sped it up and repeated frames
gifs,3c8yti,cooper12,"I'm not saying it's impossible, would just be really tough. A lot harder than most dickbutt gifs, I'd imagine."
gifs,3c8yti,BarneyBent,"Oh yes, I've heard of chef"
gifs,3c8yti,Stureson,He's the owner of dog
gifs,3c8yti,SleepTalkerz,Some pancakes with your eggs?
gifs,3c8yti,p0m,When do you add the dog?
gifs,3c8yti,adafferaf,I remember running into this channel a while back. It makes me feel like I have a Japanese grandmother.
gifs,3c8yti,RelaxRelapse,"So, crippled with shame and ridiculously high expectations?"
gifs,3c8yti,idevxy,"Hello there, children."
gifs,3c8yti,Predatormagnet,"Oh yes, I've heard of chef\n\n\nYou should see what he can do with chocolate salty balls"
gifs,3c8yti,its_casual,I think he was hoping the yolk would make the arrowhead.
gifs,3c8yti,McPiddles,"yeah, probably felt like a failure. \n\nand he should. those fletchings are all kinds of fucked up"
gifs,3c8yti,PreteenSlut,are you an asian parent?
gifs,3c8yti,almostcondor,"According to its name, yes."
gifs,3c8yti,lolimafuckincop420,dude - the yolk is the blood from the arrow stick! its flawless
gifs,3c8yti,ch_ex,"Ya, he fucked up the initial crack, and it started coming out too fast.  I don't think they let you graduate from Bennihana school until you can do this, and a few other tricks.  The most impressive egg trick that I've seen involved like five of these guys chucking eggs across the room at high speeds, only ever catching and throwing with their spatulas."
gifs,3c8yti,px403,Meanwhile I still can't crack an egg without getting it all over my hands.
gifs,3c8yti,e_claire,"The trick is to bounce it on a spatula a few times, then let it land on the edge of the spatula and make a heart shape.\n\nReally though, just crack it on a flat surface, not the edge of the pan/bowl. Way easier and more consistent."
gifs,3c8yti,cscott024,Dude I think you need to go back to egg cracking school. Somethings clearly wrong with your technique.
gifs,3c8yti,KYLO__REN,I now think I was overly impressed by this
gifs,3c8yti,CnuteTheGreat,Bout to go fuck up a carton of eggs trying this.
gifs,3c8yti,Fuckhole82i,I believe in you
gifs,3c8yti,Toothfairyagnostic,"""Asian Hooters"" -Andy Bernard"
gifs,3c8yti,Sleepyhead88,It is my job to be there for Michael.  How can I be there for Michael if I'm here for my Michael?\n(piece of shrimp from O.S. hits Dwight's face)
gifs,3c8yti,drutastic,That's impressive as fuck
gifs,3c8yti,iBleeedorange,"well, fuck is impressive"
gifs,3c8yti,thairussox,"I find it hilarious that people are this good at things like this. Not in a bad way, it just kinda blows my mind when I see something as simple as an egg crack turned into ninja skills and art."
gifs,3c8yti,Draxus335,"Almost belongs in /r/streetfoodartists, but obviously he's in a kitchen. Is there a sub similar to that, but just for chefs in general?"
gifs,3c8yti,RavenPanther,"If you had a video of something like this, it could probably go in /r/ArtisanVideos."
gifs,3c8yti,Azzaman,I fucking love /r/streetfoodartists.
gifs,3c8yti,-cupcake,"Man, that sub is awesome."
gifs,3c8yti,One-Two-Woop-Woop,I think if i tried to do that it wouldn't be as good.
gifs,3c8yti,requium94,"I'm not even comparatively this skilled at breathing, and I've been doing that since the day I was born."
gifs,3c8yti,lycao,I fucking love Benihana.
gifs,3c8yti,Dmib1236,Is it wrong that I was hoping for dickbutt?
gifs,3c8yti,xanatos451,can someone make this into dickbutt?
gifs,3c8yti,inb4thisguy,yes
gifs,3c8yti,catsupbot,Thanks
gifs,3c8yti,AskMeAboutMyWiener_,"Oh, no not me! But someone can.."
gifs,3c8yti,EStew42,"We did it, reddit!"
gifs,3c8yti,topiary_quail,Bundle-of-sticks-OP isn't delivering... 1+ hours...
gifs,3c8yti,TheSteelPhantom,Hibachi chefs are the best showmen
gifs,3c8yti,xVIRIDISx,WHY WULD YOU STOP THE GIF THERE?!?!?!?!!!  Bbfahhhhhhhttghhnh
gifs,3c8yti,Buffalobismuth,I expected a one handed egg crack that was for some reason amazing to reddit but I suppose that I underestimated everyone.
gifs,3c8yti,Bane047,japanese steakhouse dining is so amazing the first time you see it. after that its all about how many sake bombs you can get the cook to drink with you.
gifs,3c8yti,spyguysix,"Man teppanyaki chefs are damn good. They train for years, upwards to a decade before they get the right to serve during the dinner hours. I watched a competition of them once, it was pretty amazing what they can do."
gifs,3c8yti,Lost_in_costco,"First person to mention teppanyaki, not Benihana.\n\nHave an upvote!"
gifs,3c8yti,temporaryuser1000,I'm going to break so many eggs trying to get this one right!
gifs,3c8yti,Bl4kc,Amazing and awesome talent.
gifs,3c8yti,chrissharris,Impressive. This is the best I can do
gifs,3c8yti,adanfime,And here I struggle cracking open an egg without shell going all up in that shit
gifs,3c8yti,PM_ME_UR_BOOBS_WOMAN,"Broke the yolk, amateur"
gifs,3c8yti,bellypouch,ho lee shit
gifs,3c8yti,Tactica1Panda,This is why they are so good at ping pong.
gifs,3c8yti,indeeptrouble_uk,"I was expecting dickbutt since, y'know, it Is Reddit."
gifs,3c8yti,ryanheart93,I too have been to a strip mall Japanese steakhouse
gifs,3c8yti,potato_bus,I'm pretty sure the shaft of the arrow would be to think for it to fly properly.
gifs,3c8yti,Myrdraall,I wonder how much these guys get paid?
gifs,3c8yti,peskoly,Broke the yolk..egg's ruined now.
gifs,3c8yti,MJZMan,Hacks.
gifs,3c8yti,the_shepard_n7,HowToBasic does it better.
gifs,3c8yti,ChubbyDLumpkins,"I can barely crack an egg without breaking the yolk. ""Huh, looks like I'm eating a scramble again."""
gifs,3c8yti,Warriordance,Is that Kyoto's in Salem Oregon?
gifs,3c8yti,technoseq,It looks like the inside of every hibachi grill I've ever been in. They all look similar.
gifs,3c8yti,mohjustin,Is being a magician a prerequisite when applying as a chef at Benihanas?
gifs,3c8yti,The_Battler,"I've been to this restaurant before, it's in Birmingham. When I went they tossed potato wedges into our mouths with incredible accuracy."
gifs,3c8yti,Ambidextroid,"Is this ""flaming wok and tepanyaki""?"
gifs,3c8yti,crayphor,"I would imagine that most hibachi-style Japanese grills have chefs this skilled. My local one does, and and I've been to others with equally skilled chefs."
gifs,3c8yti,TehTrollord,Clearly fake. It's reversed
gifs,3c8yti,Lolmoqz,Does anyone know where this eatery is located?
gifs,3c8yti,Zi_Sakura,I think this is a Benihana
gifs,3c8yti,starmiemd,That's some crazy dexterity.
gifs,3c8yti,PM_ME_UR_AREOLE,that's crackin
gifs,3c8yti,AndyHu,so this is how you make sunny-side up eggs
gifs,3c8yti,gearbest_peter,So...Anyone know how he flipped that? Would love some sauce
gifs,3c8yti,GoHugARabidRabbit,I'd tip that
gifs,3c8yti,SubliminalPepper,level 1000?
gifs,3c8yti,Roman420,"I read ""amazing egg crack thief"""
gifs,3c8yti,Time-Master,How the fuck is this even possible. I can't even Crack an egg normally without making a mess.
gifs,3c8yti,glasser999,Stop playing with your food!
gifs,3c8yti,Stephhers,"Hard rock hotel?,"
gifs,3c8yti,SgtNuts,Benihana?
gifs,3c8yti,Flatscreens,"Reminds me of Beverly Hills Ninja, Haru wasn't quite as good though.  :s"
gifs,3c8yti,LarsAlexandersson,I'm pretty sure this is the hibachi grill I live by! I was very impressed the first time I saw this. The show is pretty damn cool and the food is good.
gifs,3c8yti,playtboi,I want to see him flip and/or plate that thing up.
gifs,3c8yti,Zandoss,"If anyone is interested, they do this very trick in a restaurant called Sen Nin, in London."
gifs,3c8yti,RupeyDoop,Am I the only one wondering how annoying this will be to take off and place into a plate?
gifs,3c8yti,AnonymousTidder,I've been eating eggs wrong my whole life.
gifs,3c8yti,goflames,Does amazing display....... egg shell falls onto grill.
gifs,3c8yti,Le_Reddit_Elder,See this all the time at Benihanas
gifs,3c8yti,-DirtyDude,"just wondering, how many eggs has he sacrificed to perfect this?"
gifs,3c80li,iBleeedorange,Original video / Source: https://www.youtube.com/watch?v=FXgokniKNE4&t=5
gifs,3c80li,Moyk,That noise he makes at 0:47 was the best part for me.
gifs,3c80li,mackinoncougars,"That was the most Skeletor-ass ""Nyaaaah!"" I've ever heard."
gifs,3c80li,D14BL0,NUH MAN 3:06  was the best part
gifs,3c80li,shit_dickss,I am dying! That lady was in complete shock. She just kept screaming.
gifs,3c80li,heat13ny,Where dey\n\nwhere dey\n\nwhere dey at doe
gifs,3c80li,brtdud7,BLAAAHGGRGH!!
gifs,3c80li,dubstepzeph,Me too thanks
gifs,3c80li,SickPuppyLover,"Missed some good opportunities to say, ""I hope that chicken is BONELESS!"""
gifs,3c80li,H4Kek,I ATE THE BONES!
gifs,3c80li,SamAdamsGaming,Holy fuck do those faces annoy me.
gifs,3c80li,Raneados,wat
gifs,3c80li,lukas8u,YOU NOW HAV SPOOKY SKELTINGTON INSIDE U\n\nUPDOOT IN 2SPOOPY4U SECONDS IF U WANT TO LIF
gifs,3c80li,Sacrix,I was expecting someone to offer him milk for his bones TBH.
gifs,3c80li,AdmiralShark,I was expecting a joke about how long he had to wait for his food. So many missed opportunities.
gifs,3c80li,CalculonsGhost,"OH, HE LEAVIN'!"
gifs,3c80li,highfivingmf,thank
gifs,3c80li,thehonestyfish,mr skeltal
gifs,3c80li,The7thTaco,calcium
gifs,3c80li,theinedible,doot doot
gifs,3c80li,CommanderBob22,Can someone explain this doot thing to me?
gifs,3c80li,girlwithruinedteeth,Doot
gifs,3c80li,emclean,https://youtu.be/kmqOV4JkRcs
gifs,3c80li,Mr_Torgue_Flexingt0n,I'm more lost now than when I asked.
gifs,3c80li,girlwithruinedteeth,Some questions are better left unasked.
gifs,3c80li,vbelt,dank mr skeltal
gifs,3c80li,dfloob22,/r/ledootgeneration
gifs,3c80li,femanonette,r u gud wiht cmputters?
gifs,3c80li,urbanbutter,fuccboi
gifs,3c80li,JJWattGotSnubbed,> tfw fuccbois forget 2 thank
gifs,3c80li,crozone,OmAN
gifs,3c80li,Corpse_Sundae,dank for de calcium
gifs,3c80li,Sacrix,Sp00kie
gifs,3c80li,Aidencleary,you
gifs,3c80li,Big_Test_Icicle,very
gifs,3c80li,karl2025,skeltal
gifs,3c80li,gdawg16,doot
gifs,3c80li,LordeTech,doot
gifs,3c80li,lolwtfidk1,doot
gifs,3c80li,SpideyScott,[doot intensifies]
gifs,3c80li,stewmberto,http://dedd.it/
gifs,3c80li,Ipvpburst,So like... How is he able to see where he's going?  I suppose he could just line everything up before he puts the face part down but I'd be so worried of accidentally scraping my shit on the side of the building.
gifs,3c80li,TeddyGNOP,For him it's worth the risk.
gifs,3c80li,Vectorbug,"In the very beginning, it looks like he put some kind of screen near his face."
gifs,3c80li,SmokyMcBalls,"I don't really know, I've been wondering the same. Maybe there are tiny holes in the fake headrest, so at least he sees where he goes. If he feels like he is too close to a wall, he can just grab the wheel and adjust."
gifs,3c80li,Moyk,I think he is also holding the wheel from the bottom
gifs,3c80li,Garrus_Vakarian__,Interwebs!!!
gifs,3c80li,BeefSerious,"He does that to everybody, it's on the Interwebs!\n\nIf I could change one thing about my wife, it'd be to give her that accent."
gifs,3c80li,ThellraAK,"Wish I could upvote twice; once for source, once for using the time function to skip the intro graphics. Nicely done."
gifs,3c80li,wingchild,I aim to please! Appreciated.
gifs,3c80li,Moyk,Chicken Nuggets!
gifs,3c80li,other_shirt,You want sauce with that?
gifs,3c80li,pallsack,"THAT'LL BE FOUR BUCKS BABY, YOU WANT FRIES WITH THAT?"
gifs,3c80li,JPannullo,HE JUST LEFT...WITH NUTS!
gifs,3c80li,Merrai,Those fast food places are all weirdly racially segregated.
gifs,3c80li,CANOODLING_SOCIOPATH,Chick-fil-a always hires fine white girls.
gifs,3c80li,fenix_nigger,"It reflects the differences in clientele, and culture."
gifs,3c80li,fenix_nigger,I suspect that he got the best reactions at the most racially specific venues.
gifs,3c80li,molrobocop,"Yah, that is why I enjoy his videos. A good prank is a prank that leaves someones surprised for a few seconds, then allows them to join the laughter without being embarassed."
gifs,3c80li,Moyk,"At 2:45 he missed the perfect opertunity to say ""to put some meat on my bones"""
gifs,3c80li,SecretiveNarwhals,Crazy how that girl at the end recognized his videos! \n\nHe's really good at these pranks!
gifs,3c80li,black13n,"Yeah, he does those pranks a ton, always with a few details changed to keep it interesting. I really enjoy them since there is no harm done to anyone and everyone involved can have a laugh."
gifs,3c80li,Moyk,That was funny. Thanks.
gifs,3c80li,Netfear,Thank
gifs,3c80li,lilwick,Mr Skeltal
gifs,3c80li,MissSara13,classic Rahat
gifs,3c80li,140414,Not one person made a joke about the wait being so long that he died. Disappointed
gifs,3c80li,ewweaver,He should've asked for milk
gifs,3c80li,Dlucz,that was the best video I've ever seen
gifs,3c80li,skeddles,"Be sure to check his other videos if you enjoyed this one, he pulled a few other pranks with the same concept."
gifs,3c80li,Moyk,The first person's reaction is a good indicator on how everyone else will react.  That's actually cool as hell!
gifs,3c80li,meodd8,That was actually funnier than I thought it was going to be.
gifs,3c80li,serosis,"Simple, yet effective. Only works with the right kind of audience though. I bet there were a few outtakes not worth putting online."
gifs,3c80li,Moyk,THE RIDE NEVER ENDS.
gifs,3c80li,TemptThePuffin,72 hours...the exit is just another line for the entrance...
