gifs,3c92bd,Rentington,Has to be. Clearly wearing a bra.
gifs,3c92bd,lusirius,Or a man with moobs
gifs,3c92bd,NoFucksGiver,with well defined legs?
gifs,3c92bd,-Lucario-,Did anyone else see the Eagle smack that guy's sign next to him?
gifs,3c92bd,paigehymel,https://www.youtube.com/watch?v=IhnUgAaea4M
gifs,3c92bd,VSynV,JUST DO IT! flapflap
gifs,3c92bd,linesreadlines,USA dropping more bombs on Japan from long range than in WWII.\n\nhttp://gfycat.com/WigglyLinedCollardlizard
gifs,3c92bd,caveman_chubs,"This needs a good Doc Emrick ""SCOOOOOOORES"" \n\nEdit: spelling"
gifs,3c92bd,TheToeTag,"""Lloyd with the dump in from center ice SCOOOOOORE CARLI LLOYD!!! 4 nothing team USA. ...Oh my."""
gifs,3c92bd,whiskey06,"Thankfully, things will be back to normal tomorrow here in Vancouver. Well, except for the smoke."
gifs,3c92bd,HalfSquirrel,And the reposts begin...
gifs,3c92bd,Mutoid,"Oh god, the horror! The quality deterioration is insane for this repost."
gifs,3c92bd,Fromyoo2me,Im glad I wasn't the only one that found this amusing
gifs,3c92bd,KorranHalcyon,i can't get over how many people wore the same costume. after awhile i got tired of watching.
gifs,3c92bd,levon14,This shit gets less attention then a regular Premier League match ...
gifs,3c92bd,cguy1234,"To be fair, it is just a bird."
gifs,3c92bd,Hasse-b,Congratulations!
gifs,3c92bd,spoonplaysgames,one day we'll stop saying murica and merica and on that day i will finally not want to kill half the people my age.
gifs,3c92bd,Hearthing,I wonder how well he could see out of that.
gifs,3c92bd,monzzter221,I want that costume.
gifs,3c92bd,seouled-out,when I saw this on TV I knew I'd be seeing it as a gif on reddit within a couple hours
gifs,3c92bd,ExpAwesome,"So many people in that crowd going ""YEAHHhhhhhh....eh"""
gifs,3c92bd,alisonxxx,Seems legit
gifs,3c92bd,taiwanispartofchina,Was this in vancouver?
gifs,3c92bd,dat_astro_ass,"Haha, as soon as I saw that I knew it would be on the front page within a few hours."
gifs,3c92bd,barsik_,Can't tell if the eagle is a guy or a girl
gifs,3c92bd,FredAstaireTappedTht,Steagle Colbeagle?
gifs,3c92bd,Tango_Nero,I guess it's a sign of my age when everyone's first thought is the Pigeon Boys from Sunny and mine is...\n\nhttps://www.youtube.com/watch?v=O4-e4nlfdRI
gifs,3c92bd,pollo4546,He looks so majestic
gifs,3c92bd,CaptainDexterMorgan,We need to turn this into a continuous/infinite gif.
gifs,3c92bd,Swailem95,"Rock, flag and eagle, right Charlie?"
gifs,3c92bd,SSJNinjaMonkey,"Moobs or Boobs, one shall never know."
gifs,3c92bd,PolarBearIcePop,repost this to /r/PeopleWithBirdHeads
gifs,3c92bd,ELbrownbuffalo,I've been waiting for this Gif for hours...thank you
gifs,3c92bd,its_casual,Left Shark and World Cup Eagle are going to be top trending Halloween costumes this year
gifs,3c92bd,issame2,It's Eagle Man reborn! https://youtu.be/O4-e4nlfdRI
gifs,3c92bd,Haihappening,"As a European: And that's why I L-O-V-E it, when Murica wins at sports."
gifs,3c92bd,legsbackwards,He flaps with such determination
gifs,3c92bd,texastoasty,Does anyone else think the camera makes it look digital or like a video game?
gifs,3c92bd,thehyrulehero,fucking hipsters have to ruin everything
gifs,3c92bd,jplow1,"Stomp, clap, stomp clap, stomp stomp clap, stomp clap"
gifs,3c92bd,Joshhawk,Ahhahhaha the eagles born out of thunder! Ahhahhaha he flies through the night!
gifs,3c92bd,Byron12347,"It was those two people with the signs, time to shine, and they blew it."
gifs,3c92bd,dogfighter42,The overweight eagle is having a hard time on lift off.
gifs,3c92bd,alphabtc,I had a feeling this would become a gif when i saw it yesterday.
gifs,3c92bd,patmd6,I knew this was going to become a meme
gifs,3c92bd,theycallmetbs,"Ama request, eagle dude"
gifs,3c92bd,sarcastroll,"I've got something for you!\n\nOOOOOH, look at those low rates!"
gifs,3c92bd,i2ich,I knew I'd see this here when I was watching the match last night.
gifs,3c92bd,i_hate_vegans,Sports fans have such a cult mentality. No wonder football and hyper-nationalism go hand in hand.
gifs,3c92bd,MadHiggins,"ever since being patriotic has become a kind of internet meme, it's made me feel......kind of patriotic.  i saw this gif and i honestly said to myself ""Fuck yeah America""."
gifs,3c92bd,mtnb1k3r,"Every time they showed the eagle, I made my wife look. It was so awesome!"
gifs,3c92bd,cguy1234,"""Honey, there it is again."""
gifs,3c92bd,daChr0nicGenie,Lol that's my buddy in the white shirt jumping like an idiot
gifs,3c7e2n,VerGuy,This is some attack on Titan shit
gifs,3c7e2n,rdnanez11,Reminded me of this monster.
gifs,3c7e2n,often-wrong-soong,I remember wanting to murder that baby when I was a little kid.
gifs,3c7e2n,VintageHawaiianShirt,/r/nocontext
gifs,3c7e2n,Mammal-k,"It's an old rugrats episode, where Angelica's parents think they're going to have another baby"
gifs,3c7e2n,Ronald--Raygun,It isn't that he doesn't understand the context necessarily but that without context the comment would be funny.
gifs,3c7e2n,dankmoomoo,oh... sorry :/ that went over my head
gifs,3c7e2n,Ronald--Raygun,It's cool just one of those reddit things.
gifs,3c7e2n,no_sec,"Haha thanks for the info, though! I knew it looked familiar, but I couldn't remember where I'd seen it."
gifs,3c7e2n,MellowSnow,"definitely should check out that subreddit, it has some fucked up shit comments"
gifs,3c7e2n,Myracl,That episode was freaky. I had some nightmares.
gifs,3c7e2n,FuckinNiceKitty,I remember being terrified of that baby and every other episode hoping Angelica would die.
gifs,3c7e2n,Ronald--Raygun,That's my favorite scene from spirited away.
gifs,3c7e2n,Shadowspace,I was cool with that baby terrorizing Angelica.
gifs,3c7e2n,Free_Apples,"Hold up, let's talk bout dat bitch Angelica for a second...."
gifs,3c7e2n,rednat16,I was not ready to see that again after years of repressing it.
gifs,3c7e2n,SICCSE7EN,I was looking for it. It's amazing how these things never leave us
gifs,3c7e2n,Generic_Student,Or this. http://m.youtube.com/watch?v=97GDQOBLk6E
gifs,3c7e2n,TheEnforcer246,What the Jesus did I just watch?
gifs,3c7e2n,Dolpies,Drakenguard one of a kind mind fuck games. Here's another one. https://youtu.be/gdHc8L2Pymg
gifs,3c7e2n,TheEnforcer246,I knew I wasn't the only person scarred by that rugrats episode.
gifs,3c7e2n,badphish94,NOW YOU'RE NUM NUMS
gifs,3c7e2n,downrightfierce51,This triggered me
gifs,3c7e2n,kingbondy,Trigger
gifs,3c7e2n,tokenwalrus,triggered
gifs,3c7e2n,SmartandJunk,your /r/shittytumblrgifs are triggering me
gifs,3c7e2n,Faaret,/u/HRH_Puckington
gifs,3c7e2n,Systral,lousy motherfuckers stealing my jokes
gifs,3c7e2n,HRH_Puckington,This episode used to scare the shit out of me.
gifs,3c7e2n,Matthew_McHiniNini,http://ak-hdl.buzzfed.com/static/2014-12/17/17/enhanced/webdr02/grid-cell-11924-1418854973-4.jpg
gifs,3c7e2n,thugg3ry,Yes! I was trying really hard to remember why this bothered me for no apparent reason...
gifs,3c7e2n,allicyn,"I forgot about that monstrosity, I thought of this one instead"
gifs,3c7e2n,DrCybrus,same. scared me as a child.
gifs,3c7e2n,Hydrogen_Ion,Oh thank god I wasn't the only one who thought of that
gifs,3c7e2n,Darkanglesmyname,Reminded me of this monster.
gifs,3c7e2n,PoumTchak,Flashback to Pixar's Tin Toy. ಠ_ಠ
gifs,3c7e2n,heynicepenis,Made me think of Gluttony from Fullmetal Alchemist.
gifs,3c7e2n,Mrnoone696,Nope. No. Nope. It's the baby from Spirited Away.http://imgur.com/XM0A3RF
gifs,3c7e2n,goldboyaj,Exactly what came to my mind initially.
gifs,3c7e2n,Tundraaa,I thought of the huge baby from spirited away.
gifs,3c7e2n,Jay_Go_Hard,"""If you don't play with me I'll cry!"""
gifs,3c7e2n,Jungian_Ecology,https://gifsound.com/?gif=i.imgur.com/2wzQsW9.gif&v=XMXgHfHxKVM
gifs,3c7e2n,SubArkNova,Gif with sound.. What's the difference between this and a video?
gifs,3c7e2n,EvansCantStop,It's a gif with sound.
gifs,3c7e2n,Synsc,"Oh, got it."
gifs,3c7e2n,EvansCantStop,A sequence of still frames changing at a rapid rate with music playing simultaneously. It's a motion picture. Coming to theaters near you
gifs,3c7e2n,Hworks,"I prefer the name ""movers""."
gifs,3c7e2n,Hopely,Alright Varrick.
gifs,3c7e2n,DamnNoHtml,THIS IS AN EXAMPLE OF LACONIC WIT WHICH IS NAMED FOR THE REGION OF GREECE KNOWN AS LACEDAEMON WHICH CONTAINS SPARTA AND SURROUNDING AREAS AND SERVED AS THE HOMES OF MANY HEROES OF THE TROJAN WAR
gifs,3c7e2n,yellsaboutjokes,How long have you been waiting to be able to say that?
gifs,3c7e2n,Jungian_Ecology,SINCE THE DAYS WHEN ZEUS THE FATHER RULED FROM ON HIGH
gifs,3c7e2n,yellsaboutjokes,Why not just use YTMND?
gifs,3c7e2n,fightfordawn,A gif is already a video...\n\nVideos don't need audio
gifs,3c7e2n,itsbarron,I'm a dumb ass.
gifs,3c7e2n,EvansCantStop,It's rarely in sync.
gifs,3c7e2n,cpnHindsight,They really should incorperate a baby titan. That would be some creepy shit just crawling around gobbling up humans.
gifs,3c7e2n,Feffen91,"Hahahahaha, you'll get why I'm laughing in s2"
gifs,3c7e2n,toastyj247,"No lie... Those are the verbatim words I thought when I saw this. \n\nThank you, friend."
gifs,3c7e2n,L00fah,SIND SIE DAS ESSEN NEIN WIR SING DIE JÄGER
gifs,3c7e2n,ArgonGryphon,I turned to my roommate and said these exact. Fucking. Words. When I saw this. Mind blown.
gifs,3c7e2n,JagerBaBomb,It's a prototype from the baby geniuses. \nFor anyone who remembers that awful movie.😉
gifs,3c7e2n,Akhaziri,Reminded me a bit of /r/giantess
gifs,3c7e2n,EruptingVagina,TIIIIIIIIIIIIIITAAAAAAAAAAAAAAAAAAANNNN!!!!!!
gifs,3c7e2n,nneiil,Made me think of Boh from Spirited Away
gifs,3c7e2n,Allkipalki,Play with me or I'll break your arm!
gifs,3c7e2n,danavenkman,Play with me or I'll break your arm!
gifs,3c7e2n,nord88,I couldn't put my finger on it.
gifs,3c7e2n,chemicalbeats37,"Good, you could probably get arrested for that."
gifs,3c7e2n,omicronperseiB8,He didn't say in it
gifs,3c7e2n,fork_yuu,made me think of this guy
gifs,3c7e2n,HRH_Puckington,I still have nightmares about that episode.
gifs,3c7e2n,TomHanksInSpace,"I KNOW, OMG WHY IS IT SO TERRIFYING?\n\n""WELL NOW YOU'RE NUM NUMS!"""
gifs,3c7e2n,Autumn-Moon,Why the hell does that look like it's moving?
gifs,3c7e2n,michael1026,"WHAT THE FUCK!!!?\nI only noticed it when I read your comment, now it won't stop!!"
gifs,3c7e2n,BenChowMein,It has this weird swelling sensation.
gifs,3c7e2n,TangledUpInAzul,I thought something was wrong with me.
gifs,3c7e2n,michael1026,Bring me Solo
gifs,3c7e2n,LilMiloMiloMilo,And the wookie
gifs,3c7e2n,Rhodesm96,"That pause when he just looks at the camera... I can see him thinking,\nYup, goin' in the mouth. HAUMP"
gifs,3c7e2n,poobop,GET IN MY BELLY!
gifs,3c7e2n,TheWolfOfWallSt-,can't erase reading this in a scottish accent
gifs,3c7e2n,Lobstrositiesbitme,you need to change the my to MA
gifs,3c7e2n,glorkcakes,Gross
gifs,3c7e2n,Iamaredditlady,"Well, it's someone's fetish."
gifs,3c7e2n,__Pancakes__,/r/Vore
gifs,3c7e2n,BWandstuffs,Babies are gross.
gifs,3c7e2n,Dirtstick,Right? I find it to be really creepy and gross
gifs,3c7e2n,levenseven,Anndddd that is a new phobia...eaten by a giant.
gifs,3c7e2n,Kaison58,You shouldn't watch Attack on Titan then
gifs,3c7e2n,FrankuSenpai,Baby.
gifs,3c7e2n,rokudaimehokage,Cloverfield.
gifs,3c7e2n,DankoJones84,SIE SIND DAS ESSEN UND WIR SIND DER JAGER!!!! DUH NUH NUH NUH NUH NUH NUH NUH! DUH NUH NUH NUH NUH NUH NUH NUH!
gifs,3c7e2n,patchsonic,NOM
gifs,3c7e2n,clsbabe,GLOMP
gifs,3c7e2n,Wahots,When Angelica thought she was gonna have a baby brother
gifs,3c7e2n,tylerg182,Now ur num num
gifs,3c7e2n,danl89,Rick Morranis has done it again!
gifs,3c7e2n,B0Boman,Genuine question: does the baby actually think the camera is food or do they just want to taste it or what?
gifs,3c7e2n,Herp_McDerp,"It's called mouthing, and it's also a part of babies exploration in getting to know the world. It's also gross. \n\nEdit. More info on it http://www.babycenter.com/404_why-does-my-baby-put-everything-in-her-mouth_6721.bc"
gifs,3c7e2n,Beiti,"If I were six inches tall, that would be terrifying."
gifs,3c7e2n,mikestorm,That is a thumb with a mouth
gifs,3c7e2n,jamiecrews04,Cloverfield anyone?
gifs,3c7e2n,Jespenson,Drakengard? https://www.youtube.com/watch?v=ybKp_Zck6-g
gifs,3c7e2n,Pacoroto,This gives me a deeper respect for boobies.
gifs,3c7e2n,Sherman14209,This is...disconcerting.
gifs,3c7e2n,asummar,With the voice of Tara Strong.
gifs,3c7e2n,DishwasherTwig,"Babies put everything in their mouths. First the gotta see it, then they gotta touch it, then they gotta taste it."
gifs,3c7e2n,thisisrediculou,Feels like a Rugrats perspective shot.
gifs,3c7e2n,Riptor_Co,This Made frontpage? Wow
gifs,3c7e2n,Jomicorreia,That's some Cloverfield shit right there.
gifs,3c7e2n,sinalpha,"What an ugly child.\n\nedit: before you take it too seriously and get angry, know that even ugly babies are cute. I'm not hatin! You can't tell me you've never seen a baby and thought it was kinda ugly. Don't worry, the baby will not read this thread."
gifs,3c7e2n,MrGMinor,"I'm not sure, that angle can be deceiving."
gifs,3c7e2n,bossbrew,"Your right, original gif She looks a little tired but still cute."
gifs,3c7e2n,KingoPants,That is indeed really cute.
gifs,3c7e2n,Phantomonium,I hate to be that guy that fixes you're grammer but its your left*
gifs,3c7e2n,Ironhead2,this
gifs,3c7e2n,Cyndi1976,"Aww, cute baby."
gifs,3c7e2n,Wahots,Fisheye lens isn't helping either.
gifs,3c7e2n,Cyndi1976,How can you tell it's tired?
gifs,3c7e2n,ArgonGryphon,Was that Jon Snow in the background?
gifs,3c7e2n,whycuthair,"Also, fisheye or very wide angle lenses doesn't do wonders on your looks."
gifs,3c7e2n,nilleftw,"I dunno, I've seen some legit ugly babies.."
gifs,3c7e2n,AnnaBortion269,"nothing wrong with finding babies ugly, especially newborn ones. they need time to put on fat and for their bones to unwarp"
gifs,3c7e2n,specXeno,Bad angle. She's actually super cute! http://i.imgur.com/DcTnzPt.gifv Or at least I think so.
gifs,3c7e2n,roboribbit,"Aww, you're right!"
gifs,3c7e2n,MrGMinor,"I'm more of the ""even cute babies are ugly"""
gifs,3c7e2n,ArgonGryphon,"All babies are ugly. I can't even lie anymore about them and do the obligatory ""what a cute baby!"" Bullshit. I refuse. ""Aw it's a baby"" is as far as I'm gonna go, my real friends know I hate babies. Not a fan of kids either anymore."
gifs,3c7e2n,FartsWhenShePees,Am I the only one here who thinks that is one ugly baby
gifs,3c7e2n,AgainstCotton,"Its in the angle, there's a full .gif of him/her in here and he/she is really adorable."
gifs,3c7e2n,Wahots,"Look at the original gif, she's pretty darn cute. http://i.imgur.com/DcTnzPt.gifv"
gifs,3c7e2n,roboribbit,Oh god the Rugrats flashbacks.
gifs,3c7e2n,rokudaimehokage,Just in time for Shark Week ...... Stay aware people
gifs,3c7e2n,KiloOz,AAAAAAAAAAHHHHHHH-
gifs,3c7e2n,Janye,I could feel the (adorable) terror.
gifs,3c7e2n,TicTacPilgrim,/r/AttackOnTitan
gifs,3c7e2n,Drusiph,I don't know how to feel. That was adorable and terrifying all at the same time!
gifs,3c7e2n,YakYonson,This reminds of that rugrats episode.
gifs,3c7e2n,jmiller321,Reminds me of that episode of Rugrats... Still gives me shivers.
gifs,3c7e2n,Toxik_Repo,This baby... This baby is the hypothetical little sibling of Angelica Pickles. Still kinda terrifying. I hope it has the same voice.
gifs,3c7e2n,TirraLirraByTheRiver,"Add a green screen, or some type of scaled-to-size claymation set-piece and this is your money shot in a found-footage giant baby-monster film. I can dig"
gifs,3c7e2n,MemphisMarcos,"This is nice, eerie, weird and sick.\n\nI'm down with that, 10/10 would get eaten again."
gifs,3c7e2n,Userlicious,That's a scary baby!
gifs,3c7e2n,JihadInMyPants,https://www.youtube.com/watch?v=d3zpT502CEs
gifs,3c7e2n,Goonerofoz,Someone edit buildings and streets and make it look like a giant baby in a city
gifs,3c7e2n,goingTofu,It needed some Sean Paul.
gifs,3c7e2n,red_foot,"i find it hilarious that you made that association, even though i have no clue why you did"
gifs,3c7e2n,yumas,Heh heh what the fuck?
gifs,3c7e2n,Pachi2Sexy,Who else watched the GIF like 10 times straight? lol. It's so adorable and odd in a strange way.
gifs,3c7e2n,My_Name_Is_SKELETOR,Dafuq.
gifs,3c7e2n,Jomicorreia,"Can't believe people are saying this baby is ugly, I think s(he's) adorable"
gifs,3c7e2n,Domin8rDutt,That is an ugly fucking baby.
gifs,3c7e2n,ahf95,spoilers:all babies look like boiled potatoes.
gifs,3c7e2n,trainercatlady,I must be a different era. I thought of this first:\nhttps://m.youtube.com/watch?v=2cNOIuijfLs
gifs,3c7e2n,Rprzes,Konjiki ashisogi jizo?
gifs,3c7e2n,Draydii,"Ha, the Jon Snow video."
gifs,3c7e2n,backtolurk,"It was that day, humanity received a grim reminder.  We lived in constant fear of the babies."
gifs,3c7e2n,gimmesomespace,Konjiki Ashisogi Jizō
gifs,3c7e2n,Dlobregon,Haha reminds me of the Simpsons ride at universal studios!
gifs,3c7e2n,Taftac2002210,Ahhhhhhhhhhh
gifs,3c7e2n,nomer2,nom nom
gifs,3c7e2n,Rob-J,oral fixation visualized
gifs,3c7e2n,DivorcedAMuslim,Shingeki
gifs,3c7e2n,Axient,I remember this scene in Akira
gifs,3c7e2n,marsinfurs,A new variant type...Titan baby
gifs,3c7e2n,Ashypenis,Cloverfield monster?
gifs,3c7e2n,Gigglepops1,Its scary how its first instinct is to put it into its mouth.
gifs,3c7e2n,SoberOver,Looks like me when I go to snapchat and the selfie cam is on.
gifs,3c7e2n,FreeTimeReddit,Reminds me of the moment Hud gets owned by Cloverfield.\n\nhttps://www.youtube.com/watch?v=ocb7pXndlug
gifs,3c7e2n,Corumain_Duvantar,nom
gifs,3c7e2n,kilkil,Reminded me of this
gifs,3c7e2n,_UltraDerp,https://24.media.tumblr.com/dd89ed1005889141c271fca525b436c4/tumblr_mtziu8hRC91shrbvmo1_500.gif
gifs,3c7e2n,Met5anvartija,Kept thinking of Spirited Away
gifs,3c7e2n,Joshywah,Drakengard has ruined me.
gifs,3c7e2n,Phraxic,My head suddenly feels moist.
gifs,3c7e2n,chucklingmoose,your baby ?
gifs,3c7e2n,asafghi6,"Nah I saw this on facebook a few days ago, OP just gif'd it for all that karma"
gifs,3c7e2n,TheGingerLow,Anyone play the final level of Half-life back in the day? I remember thinking it looked like a giant baby. http://cdn.pcgamesn.com/sites/default/files/halflife2342_0.jpg
gifs,3c7e2n,relativityboy,Queen Victoria would have hated this kid.
gifs,3c7e2n,RadioIsMyFriend,How scary!
gifs,3c7e2n,painfe,Reminds me of the Stay Puft Marshmallow Man.
gifs,3c7e2n,apoth24,"Mama, may i have cookie?"
gifs,3c7e2n,IThinkURDum,Baby hungry....  Must eat now
gifs,3c7e2n,poundcakelover,Reminded me of cloverfield
gifs,3c7e2n,bacon_and_eggs,majinbu
gifs,3c7e2n,readytodo,"That's it, I'm getting an oculus rift."
gifs,3c7e2n,I_DATE_GRAPES,I love the pause before he devours you whole.
gifs,3c7e2n,justsomeguy75,Looks like the covetous demon
gifs,3c7e2n,ZachakaSpecs,"Just in case you didn't know, babies put things in their mouths to feel them. A babies mouth has more nerve endings per square millimetre than any other part of her body."
gifs,3c7e2n,themaybeguy,"All around the world worms face this fate, let's be glad we don't have to worry about this... Anytime soon..."
gifs,3c7e2n,TheBananaBaby300,"""What it's like to have a baby in the house"" would've worked for a title as well"
gifs,3c99i7,Aldamato,Fucking sorceror...\n\nMy cat barely tolerates my existence on a good day.
gifs,3c99i7,Mimos,I can't even teach my cat not to wake me up at six am. This is amazing.
gifs,3c99i7,math-yoo,Stop feeding him/her in the AM. He/she will eventually get the idea.
gifs,3c99i7,Jeffro1265,My cats have learned to avoid nighttime discipline.  Mittens played with the blinds at 4am exactly one time.
gifs,3c99i7,phrodo913,"This sounds sinister, like Mittens new name is Stumps now."
gifs,3c99i7,math-yoo,O.o
gifs,3c99i7,Jorumvar,Punch it in the face.
gifs,3c99i7,redditwentdownhill,Blow it on the nose!
gifs,3c99i7,Seawolfe,"And then when the claws come out, what do we do?"
gifs,3c99i7,craniumonempty,We cry.
gifs,3c99i7,VendettaGreen,And bleed
gifs,3c99i7,Mysteryck_386,"Blow harder? Seriously, it works. Although I resorted to struggle-snuggles to teach my cat not to wake me up."
gifs,3c99i7,SinisterSintram,"Lol, I was actually playing. I've never really had those types of problems with the cats I cared for."
gifs,3c99i7,craniumonempty,People really get clawed by their own cat?  Y'all motherfuckers  need to teach your animals about love.  Mine would never scratch me except when we're hand wrestling.
gifs,3c99i7,im_a_grill_btw_AMA,"I took care of feral cats for years. I only got scratched up once when capturing kittens. I figured it wouldn't be that bad since it's siblings came quietly, we had it's mother, and it was a little kitten. I was wrong. Thing turned into the devil. I ended up taking off my shirt and wrapping it up to get it back inside. Currently, she's a mouser for a farmer. I heard he had no trouble anymore with rats, opossums, birds.. Probably even dogs. That cat was aggressive even after we somewhat got them used to us. The siblings and mother were so sweet compared to her, but she didn't scratch me after catching her.. Well, there was a little biting."
gifs,3c99i7,craniumonempty,Ha try 3am for constant exercising which sounds like a heard of elephants. Followed by a 4am wake up to feed em.
gifs,3c99i7,theghostwithoutaname,"You can tell she is serious by her spandex, as if this is her golden child and she is coaching it to the Olympics."
gifs,3c99i7,Itspropaganda,And for his next trick.
gifs,3c99i7,Mountaiineer,When you get reincarnated as a cat and all you remember is that ball is life
gifs,3c99i7,Madamejay,Air Bud 9: Kitty's Got Game
gifs,3c99i7,my_name_is_cooler,Airbud 10: I want to get off of Mr. Bones wild ride: electric boogaloo
gifs,3c99i7,Stackhouse_,"I like how the dog looks away like, ""Fuck, what is it that I do around here?"""
gifs,3c99i7,MercurysOverbite,"You can tell he's seen it before. Like, ""Not this tired trick again."""
gifs,3c99i7,jus10beare,"""Pfffft, I could do that.. I just don't want to."""
gifs,3c99i7,Exsous,Cat lady score: 9 of 10.
gifs,3c99i7,DCisforBoners,That's a travel.
gifs,3c99i7,snotbag_pukebucket,Shot caller.
gifs,3c99i7,if_ewe_only_gnu,Twenty inch blades on the impala.
gifs,3c99i7,TheifOfVirtue,Impaller
gifs,3c99i7,InukChinook,Holla
gifs,3c99i7,PteradactylPilot,the Harlem Volespotters
gifs,3c99i7,adarkfable,I wish I was a little bit taller
gifs,3c99i7,puffah0lic,I wish I was a baller.
gifs,3c99i7,Raustan,I wish I had a girl who looked good.
gifs,3c99i7,khayber,I wish I had a girl.
gifs,3c99i7,M4gikarp,Reminds me of that simpsons episode.\n\nNow im no  /user/squalor- so dont jump on me if im not totally correct but...\n\nI think its the one where Bart gets that other dog with the fake credit card and they cut to a littlw part where they say the animals are starting to act weird. I
gifs,3c99i7,BlazinTed,it was the elephant episode.  the cat and dog were trying to get attention because the elephant was getting all of it.
gifs,3c99i7,Hanleytheaverage,"He thinks he's one of the Models, Inc. Get that cat outta there!"
gifs,3c99i7,norbster1,They see me rollin'...
gifs,3c99i7,slushycavebear,I felt it necessary
gifs,3c99i7,ryker888,"Americas funniest home videos, here we come."
gifs,3c99i7,503AccessDenied,Dog doesn't seem impressed
gifs,3c99i7,KingJames_253,"Wanna be a baller, shot caller, \n\n20 P.S.I on the basketballa\n\nKitty cat gettin' laid tonight\n\nCatnip rolled tight got sprayed by Ike\n\nI hit the highwayyy makin' money the fly wayyyy\n\nBut there's gotta be a better way\n\nA better way, better way, Yeaahhhh"
gifs,3c99i7,jld2k6,"Wanna be a baller, shock collar. \n\nMight be funnier."
gifs,3c99i7,BEN_therocketman,I'm going to have to try this.
gifs,3c99i7,actttappalled75,It's pretending to be a mechanical mouse.
gifs,3c99i7,whatshisuserface,"I was just waiting for the girl to smash down on the ball, the cat to go flying and land on it's feet.\n\nThis was pretty awesome too though :p"
gifs,3c99i7,HalfSquirrel,I could do that too if I had a tail.
gifs,3c99i7,reciprocake,I think I'd piss myself laughing if he had fallen back
gifs,3c99i7,HabsFan4Life,Humans are weird.
gifs,3c99i7,wpthroweth,Is that Gary Busey?!
gifs,3c99i7,5hmacko,"""Hello pants."""
gifs,3c99i7,khayber,The Anonymous Lady Cat Circus
gifs,3c99i7,backtolurk,"ahh, cute! cat seems pretty relaxed and eager to do it, too. wonder how you even go about teaching them to do that? i assume its gotta be a kitty with a people-pleasing personality"
gifs,3c99i7,objectual,What is she doing with her right hand?
gifs,3c99i7,Tovora,Timing it with a stop watch. Gym teacher level 10.
gifs,3c99i7,Thephonecian,"""Cat is life"" -Ball"
gifs,3c99i7,empireJC,"it looks like hes saying ""are u sure i dont think this will work"""
gifs,3c99i7,SpringBob,Some say he is still going rolling that ball with his feet
gifs,3c99i7,dan_sundberg,I'd pay 5 years 80 million for that.
gifs,3c99i7,DanBootleg,probably an acrocats fan. The acrocats lady will teach you how to get your cat to do tricks. Her cat plays drums. Not even kidding.
gifs,3c99i7,PicklesOfDethklok,What crazy cat ladies are doing when not posting to /r/aww
gifs,3c99i7,Kavalactones,that cats got better handles than delly
gifs,3c99i7,slouchlock,Cruel
gifs,3c99i7,5rapid,Do you have to teach cats how to balance on the ball along teaching it how ro get on it or are cats just natural walkers?
gifs,3c99i7,watashiwameow,"The dog is think ""I could've done that if you asked"""
gifs,3c99i7,Rockzilla4000,I'm going to have to try this.
gifs,3c99i7,tduente,Cat.
gifs,3c99i7,Loud_Volume,Her fingering technique is flawless! What a perfectly trained pussyfoot
gifs,3c99i7,mynameistgw,https://hamm0ndeggs.files.wordpress.com/2012/09/simpsonsdidit.png
gifs,3c99i7,greengrasser11,Dat cat know ball is life!
gifs,3c99i7,darkpitt,Ball is life
