gifs,3c7uyc,StrawHousePig,"Did you miss Vader ordering one of the higher ups to intentionally let them go heavily implying they missed all the shots on purpose to have them lead the imperial forces to the rebel base on Yavin 4? Or are you just doing the usual ""sturmtroopers can't hit anything am i rite XXDDD"" circle-jerk?"
gifs,3c7uyc,PoisonousFaith,Rebel base\nEndor\n\n\nPick one
gifs,3c7uyc,EvilEthos,Are you talking about the Rebel base on Hoth that they over ran in minutes?\n\nAnd on Endor where they were crushing until they were outnumbered like 100 to 1?
gifs,3c7uyc,BeingJustGoodEnough,And he forgot Leia ship in the opening where they boarded a hostile ship and fucked some rebel shit up.  Let me step over my dead compatriot and shoot you in the face rebel scum.
gifs,3c7uyc,one_comment_only,that's one less rebel
gifs,3c7uyc,Tyranith,"Sorry, I got the names mixed up. Fixed now."
gifs,3c7uyc,PoisonousFaith,Pluto.
gifs,3c7uyc,TheCaptainR,You know the one thing possibly worse than people bringing up Stormtrooper inaccuracy in a Star Wars thread is people bringing up Stormtrooper accuracy as if nobody ever discussed that before.
gifs,3c7uyc,marcuschookt,They hit porkins.
gifs,3c7uyc,Jonatc87,They all missed because Star wars wouldve sucked if it was 30 minutes long.
gifs,3c7uyc,marino1310,"You want this, don't you?"
gifs,3c7uyc,StrawHousePig,They still can't hit jack shit.
gifs,3c7uyc,DatBrony,I don't recall them shooting at jack shit.
gifs,3c7uyc,crooks4hire,"""woo a fire.... HOLY SHIT IS THAT A PLANE?...... oh."""
gifs,3c7uyc,chadrob,I second that...
gifs,3c7uyc,AGiantNun,Wait just a f****** minute. Tie fighters are single person aircraft. Where the devil did that other stormtrooper come from? This is obviously just a PR stunt.
gifs,3c7uyc,MrAlakad,also that's not the appropriate dress for tie fighter pilots. this is.
gifs,3c7uyc,theycallmeponcho,Because they weren't piloting the carft. They responded to the emergency and are guarding the ship in case some rebel comes to check it out.
gifs,3c7uyc,amogo,*rebel scum
gifs,3c7uyc,Squaseghost,*rebels cum
gifs,3c7uyc,DatBrony,*Cisrebel scum
gifs,3c7uyc,Talvoren,"What'd they do, walk there? There's no other imperial craft in the vicinity. This seems like some kind of major coverup to me."
gifs,3c7uyc,crooks4hire,Perhaps they were dropped off. I don't recall tie fighters ever traveling solo. Could be some more damaged fighters up the road.
gifs,3c7uyc,StickyLavander,Duh!
gifs,3c7uyc,doesntakethehighroad,Or two fighters collided. The other one is in the woods.
gifs,3c7uyc,GenericGeneration,"Jesus, does being a pilot give you scoliosis or something?"
gifs,3c7uyc,Yetanotherfurry,You'd have problems too if you spent all your time crammed into the cockpit of the cheapest starfighter on the battlefield
gifs,3c7uyc,dickbuttzz,Shields are for pussys.
gifs,3c7uyc,Yetanotherfurry,So are hyperdrives.
gifs,3c7uyc,dickbuttzz,No need for them when you are a carrier based fighter.
gifs,3c7uyc,Yetanotherfurry,"Well I mean depending on your source the empire disagreed. The X-wing, before it's prototypes fell into rebel hands, the TIE scout, TIE advanced(hunter? I forget the exact designation, it had S-foils), and TIE defender all had hyperdrives.\n\nThough I don't know how much of that was ever considered canon."
gifs,3c7uyc,-Scootis,As is life support.
gifs,3c7uyc,idiotsonfire,"That's probably because the pilot is inside the craft or in front of it talking to his commanding officer, explaining how those damned rebels got the jump on him."
gifs,3c7uyc,AGiantNun,"damn son, you got me. I completely forgot they had different garb for pilots. haha, a ten-year-old me would have been on that, but I had to ditch my collection when I was twenty to make room for roomates. Good memories."
gifs,3c7uyc,hipcatcoolcap,Pilot has better shit to do.. like debrief on why the fuck he crashed a tie fighter... these two are just waiting the jawas for pickup.
gifs,3c7uyc,xanatos451,"Oh so it's a color thing now? What, you gotta be black to be a pilot now? Man, this is some affirmative action bullshit!"
gifs,3c7uyc,FenrirIII,Maybe one of them is a girl and they were working on their million mile high club membership.
gifs,3c7uyc,Wandering_Seoul,They're clones aren't they?
gifs,3c7uyc,SolIII,There were recruits and clones based on multiple templates. Still no girls though.
gifs,3c7uyc,Nexxus213,Not since the time between 3 and 4. They're basically slaves to the empire.
gifs,3c7uyc,Wandering_Seoul,I did not know that.
gifs,3c7uyc,Nexxus213,TBH most don't. Don't feel bad.
gifs,3c7uyc,Wandering_Seoul,I do though.. I always was okay with the Death Star being destroyed because I always thought it was just clones! Now that I know it was real people just doing their jobs... Omg! The massacre! Those rebel scum!!
gifs,3c7uyc,FenrirIII,Don't forget all the construction workers there just trying to make a living.
gifs,3c7uyc,Wandering_Seoul,Dude! Wtf!? Have I been rooting for the wrong side this whole time?
gifs,3c7uyc,FuckinNiceKitty,"The Empire was doing what it was to ready the Galaxy for the Vong invasion. An extragalactic invasion threat was the reason Palp's gave the public for keeping the Imperial Navy at its massive size. The Rebellion was minor annoyance in the grand scheme of things. But because they won, the Galaxy was fractured. And the wars between only worsened things. That's why 365 trillion beings died in the Vong War. If the Galaxy united under the Empire with its massive armies, navy and super weapons that number would be far less.  \n\nThe Light and Dark don't truly exist. There are only shades of grey."
gifs,3c7uyc,Nuke_A_Cola,Join the slightly darker side!
gifs,3c7uyc,talones,So clones aren't real to you? They don't have feelings?   It's 2015 you monster!  Cloneism is alive and well in the USA. Wake up people.
gifs,3c7uyc,Nexxus213,Well... Yeah...
gifs,3c7uyc,karl2025,They're troopers who have responded to the crash?
gifs,3c7uyc,InfinityCircuit,"My mind didn't register this as a TIE fighter and storm troopers until the third loop. \n\nIt just didn't compute. Amazing. Love it, despite the nerd anarchy going on in the rest of this thread. Calm down people, nobody cares if storm troopers can't fly TIE fighters."
gifs,3c7uyc,aatencio91,Wow. I noticed the stormtroopers but I didn't realize that it was a TIE fighter...
gifs,3c7uyc,CanadianSaint,I'm pretty sure this is fake guys. You can tell by the pixels.
gifs,3c7uyc,Max_da_Moscha,no no it´s fake because stormtroopers would have never hit the road in the first place....
gifs,3c7uyc,Xendarq,Is that a TIE fighter?
gifs,3c7uyc,Wandering_Seoul,"More like a ""LOSE"" fighter amiright?"
gifs,3c7uyc,D-woo19,Damnit dad... Go to bed!
gifs,3c7uyc,JUMPDRIVES,"Dear Dad,\n\nYou sound like my Dad. Hey quick question Dad, why did you leave for a pack of smokes one night and never come back?\n\nLove,\n\nXendarq's Son"
gifs,3c7uyc,bsugano,"""Move along. Move along."""
gifs,3c7uyc,natephant,I feel like I'm the only one who thought this was fucking awesome. I would have been ABSOLUTELY stoked if they chose to PR this in my area. You guys really suck at appreciating golden things like this.
gifs,3c7uyc,___Towlie___,This is so unrealistic TIE fighters only seat one and pilots wear black uniforms.... Definitely fake.
gifs,3c7uyc,dyingangel667,"Bruh they're just guarding it while the pilot debriefs, duh. Totally not fake."
gifs,3c7uyc,Siiknesss,Debriefs. Heh. I'd crap my pants too if I crashed a TIE fighter.
gifs,3c7uyc,peterpaullake,"Go to bed, dad."
gifs,3c7uyc,gagsy92,"Not to mention all the storm troopers were dead a long, long time ago."
gifs,3c7uyc,dasherman1357,"My legit reaction was: sees plane parts on road ""Holy fuck! realises its stormtroopers oh my God -.-"""
gifs,3c7uyc,FIsh4me1,Definitely in Russia.
gifs,3c7uyc,Aftermathmike,"Can't be Russia, there's no dash cam footage."
gifs,3c7uyc,sarashac,I actually needed to watch it twice just to make sure
gifs,3c7uyc,forgot_a_leter,Looks like stormtroopers standing by the wreck
gifs,3c7uyc,Justworkhere,Makes sense considering its a wrecked TIE Fighter.
gifs,3c7uyc,cr0gd0r,Storm Troopers don't fly TIE Fighters.
gifs,3c7uyc,Justworkhere,Oh jesus here we go hold on to your light phazers
gifs,3c7uyc,MrAnonman,Storm Troopers don't use phasers. Phasers aren't in the Star Wars universe.
gifs,3c7uyc,Talvoren,next you're gonna tell me snape didn't kill gandalf
gifs,3c7uyc,MrAnonman,Gandalf should've just used the force to choke Voldemort's exhaust port into Mordor.
gifs,3c7uyc,DatBrony,it would've saved them the trouble of stealing the enterprise
gifs,3c7uyc,storysunfolding,http://youtu.be/Qe4Nb92pn34
gifs,3c7uyc,TheCloned,They're securing the asset. The imperial chair force obviously wasn't going to do it.
gifs,3c7uyc,KingMoonfish,This is apparently what happens when they do.
gifs,3c7uyc,mod1000098alpha,Storm troopers can't melt TIE fighter beams.
gifs,3c7uyc,Gimbodan,"Didn't notice that until you pointed it out, wonder if they were looking for droids and had a small, problem."
gifs,3c7uyc,AceWhole420,Stormtroopers can't even hit a runway...
gifs,3c7uyc,shinyisthenewblack,"Holy shit that is well done, I thought it was some alien ship or secret satellite with a harmful chemical  with hazmat suit guys waiting for the FBI to show up to collect it for a second"
gifs,3c7uyc,Perdster,Damn it. They've found our planet. Now we're screwed. Only forces we have to work with are stupid or racist. So screwed.
gifs,3c7uyc,spgrst,"""Oh my God, it's on fire oh my god.... brings phone closer frikken troopers, thought this was real. Shakes head"
gifs,3c7uyc,rubiksmasta,Not real...Where's the blood from the Ton-Ton he supposedly hit?
gifs,3c7uyc,travisrwr123,It took me a few minutes until I realized... this shit is fake
gifs,3c7uyc,chaotic_goody,Omg.. is this fake? When did they come out with white pilot suits? Tried searching CNN I can't find any news on this.
gifs,3c7uyc,jofus_joefucker,Spotify started playing Star Wars music when I scrolled past this. So confused.
gifs,3c7uyc,remola,This isn't realistic at all. \n\nTie Fighter Pilots wear black space outfits.
gifs,3c7uyc,bamajohn251,I hope they were with the AAotE (Automobile Association of the Empire).
gifs,3c7uyc,REDDWARFIX,"Don't get ""tied down"" in traffic."
gifs,3c7uyc,CamaroM,"I always wanted to be a stormtrooper! I remember being a kid and wanted to be bad guys in all of the movies. Like Germans (cool uniforms) in WW2, Prussian cavalry, Trogans... and the British. Sorry but many uniforms look a bit cheap."
gifs,3c7uyc,snyderxc,/r/starwars
gifs,3c7uyc,juliesjabbers,/r/unexpected
gifs,3c7uyc,justsomegraphemes,I'm downvoting everyone that doesn't realize that's a storm trooper.
gifs,3c7uyc,stiansen222,What is a storm trooper?
gifs,3c7uyc,texastoasty,Am I 10 high?
gifs,3c7uyc,juliesjabbers,This looks like bullshit to me...
gifs,3c7uyc,foriamgod,Obviously
gifs,3c7uyc,a_shiny_heatran,"Am I the only one that thinks it is the Stig, after all he probably no longer has a job now that Clarkson is gone."
gifs,3c7uyc,justsomegraphemes,"correct me if im wrong, but dont TIE fighter pilots wear different armor?"
gifs,3c7uyc,Williek113,"You are correct. All black, I believe."
gifs,3c7uyc,gunnLX,Just saw the first movie. Can confirm this is sweet
gifs,3c7uyc,Invius6,is that the friggin enterprise?
gifs,3c7uyc,thelidpatrick,This is not the tie fighter you are looking for
gifs,3c7uyc,AceRaymond,Is this the new battlefront?
gifs,3c7uyc,OBAMA_HATES_SNOWDEN,That guy standing near the plane looked like a storm trooper.
gifs,3c964o,Self_Manifesto,Looks like a videogame.
gifs,3c964o,TRUSTMEBABE,USA\n\nUSA\n\nUSA\n\nUSA\n\nUSA\n\nBow down to the greatest soccer power in the world!
gifs,3c964o,linesreadlines,"So it basically was a videogame.  I scored all of those goals by screaming at the TV ""SHOOT!""."
gifs,3c964o,my_name_is_cooler,Yep.  Spammed the B button over and over again until someone shot it.
gifs,3c964o,Ayotte,Japan should really work on defending set-pieces.
gifs,3c964o,Luk0sch,That defending is dreadful.
gifs,3c964o,jtw7,"On that fifth goal I was going to say 'wasn't that American player offside standing in the back of the net' then I saw there was a Japanese player who was leaning back against the net back there with her.  Good marking, Japan!"
gifs,3c964o,LLv2,After some light research I've found it wouldn't have mattered. Offsides only is called if the person in the offside position becomes a part of the play.
gifs,3c964o,koatheking,Too bad this never happens in fifa
gifs,3c964o,hunt_the_gunt,That is the most rage inducing game in the world hands down.
gifs,3c964o,-Schweini31-,In fact this happens several times a week in every minimally serious league.
gifs,3c964o,scumah,"You can ""become part of the play"" by shifting your body weight towards the ball.. Even if you're 30 yards away."
gifs,3c964o,yoinker272,"Pretty much this; offsides doesn't extend past the goal line, so it doesn't matter if a Japanese player was one inch past the goal line and a US player was 30 feet past the goal line,."
gifs,3c964o,zwinger,"It does matter if the player comes back into the play.  The fact that she is beyond the end line is irrelevant, it's the fact that she isn't drawing a defender to her or effecting the play in some other manner.  For some reason offsides only applies to players in the attacking play, if you are an inactive player you can be in an offside position as long as you regain an onside position prior to resuming your attack.  I imagine the rule was originally intended allow attacks on goal to continue while an  injured/debooted player is down.  \n\nI understand offside, and hate offside"
gifs,3c964o,mudbuttcoffee,It used to be that inactive player counted as offside. The rule changed to make the game more fun and to score more goals.
gifs,3c964o,romario77,"Here is a great example of the rule from the worlds best player, Messi (#10 red/blue).  If he had made a move towards the ball, he would have been offside. \n\nHis teammate (#7 red/blue)was onside when the ball was passed, so was legally able to get it, and then could pass to Messi who by that point was onside himself."
gifs,3c964o,Sewer-Urchin,LOL... I understand what's occurring and it makes perfect sense and I know who Messi is (obviously) but everytime I watch this loop it just looks like Messi is some idiot who can't keep up with the pace of the play. Like me when the ball gets too close to the goal... :)\n\nPS: I play goalie and this play would have me pulling my hair out. If I had any left...
gifs,3c964o,illannoysnazi,"If Messi made a move to the ball, he'd have been an idiot. Instead he was a genius."
gifs,3c964o,ccguy,Also you can't be offside if the ball is passed backwards.
gifs,3c964o,Appanna,Yes you can.  If 2 players are so far ahead of any defensive player if you pass it backwards to the other player he is still offsides.
gifs,3c964o,Final21,No he (or she) isn't.
gifs,3c964o,procrastaboy,"no, because the two player rule is moot if the ball is behind them.  the rule is the receiving player must be behind two opposing players or behind the ball, whichever is further up the pitch"
gifs,3c964o,littlebrwnrobot,"No, only if you pass it forwards. 2 players can be behind all defenders and pass it backwards but not forwards."
gifs,3c964o,Roymachine,Offside. Not offsides
gifs,3c964o,Smegment,"It wouldn't have mattered, you're right. But drawing a defender makes you part of the play."
gifs,3c964o,torquesteer,"Good on you for doing some research on your own. I will mention something you may not know, in that regardless of the positioning, a player needs not one but two players to hold them from being in an offside position. Usually that second player is the keeper, but not always."
gifs,3c964o,_Hey-Listen_,"Yeah the player in the net doesn't count, but otherwise, nobody is offside anyway? She passes backwards."
gifs,3c964o,Dumbledozer,"Two things:\n\n1.) Offside is determined by being closer to the goal line than the SECOND to last defender.  This is often forgotten because the goal keeper is usually the last defender. So one player in the net with her wouldn't  have kept her from being offside, there would have needed to be two.\n\n2.) By staying in the net, she removed herself from being involved in the play.  It's worth noting though, that while involvement is usually pertaining to coming into contact with the ball or running towards the ball, it doesn't have to.  Say Alex Morgan and the keeper both were in the back of the net.  If Morgan was in front of the keeper and even obstructing her view or her ability to get back involved with the play, she could be ruled as offside.\n\nOffside is a very simple rule that can get tricky.\n\nReference: 13 years of referee experience"
gifs,3c964o,kgcubera,"Wouldn't obstructing her ability to get back into play be considered obstruction rather than offside?\n\nJust wondering cuz as a goalie, I used to always be irked by the forwards who would try to box me in on a corner."
gifs,3c964o,Sack_Of_Motors,dayyyuuum girls
gifs,3c964o,jonbristow,I just noticed how the sun was in the Japanese goalie's eyes. Seems unfair!
gifs,3c964o,asdfjlk55,"Yeah, i was there. she was standing in the only shade around at that end, which was why she was so far out of the goal. There's a bit of a heatwave at the moment. I went to several games during the tournament, and most of the high scoring happened at that end the of the goal."
gifs,3c964o,generic_human_1979,"That 3rd goal just looked too easy. Routine, almost."
gifs,3c964o,ARCHA1C,Fire that goalie for god's sake.
gifs,3c964o,Raneados,"More like fire that defense. Only 1 goal was conceded because of a mistake made by the goalie. Set-pieces are defendable 99% of the time and we don't even need to talk about goal number 3 I think.\n\nEdit: Well okay, rewatched goal number 5. She should have catched the ball in the first place so yeah, 60% goalie and 40% defense on that goal I think."
gifs,3c964o,Luk0sch,"I cringed at goal number 3. For real, what was she thinking!!"
gifs,3c964o,MrWhite2020,What was who thinking?  The defender who headed it?\n\nShe obviously didn't mean to head it up like that... she just mistimed it...
gifs,3c964o,cv0972,The keeper should have gone for the ball instead of stutter stepping and freezing in place. She would have at least been in the way of the attacker and not let her make such an easy shut.
gifs,3c964o,Chefzor,Hmmmm maybe.... I don't think she would have made it or would have possibly given a penalty away if she had gone for it
gifs,3c964o,cv0972,"Not necessarily, there were two defenders right next to the forward. They could have done something to stop the defender. \n\nUsually the goalie only comes off the line as a last resort. \n\nIn this case, I could see it going either way. It's a lot easier to criticize the decision after having seen it and its outcome but it's a lot harder to make the decision in that split second."
gifs,3c964o,Sack_Of_Motors,Still just major flaws in the defense.  3 crosses across the field that have just blatant lack of defending.  The replays show the whole story: most of the players take a couple steps and plant their feet like the play is dead.  You shouldn't let your goalie be your whole line of defense.\n\nThe ramming header was a bad judgment call.  No clue what she was even thinking.\n\nThe half field kick should have never had a chance.
gifs,3c964o,keepinithamsta,For women.
gifs,3c964o,lludson,Bow down to the greatest soccer power in the world!\n\n\nBold statement given the men's team didn't make top 8.
gifs,3c964o,blackrat47,"If you like video games:\n\n1\n\n2\n\n3\n\n4\n\netc, etc!\n\nfemale bonus for good measure"
gifs,3c964o,backtolurk,https://www.youtube.com/watch?v=vTzTjP1Na0o
gifs,3c964o,gobeavs69,60 fps and artificial motion makes you feel like it is.
gifs,3c964o,riki137,Is it because it was 60fps or something?
gifs,3c964o,darksourcekon,FUCK THE GOAL. THIS GIF IS SO SMOOTH
gifs,3c964o,bsfdk2,60fps
gifs,3c964o,fabjuice,That's because it isn't a gif..
gifs,3c964o,Ozin,"i dont know shit about soccer, but that was a crazy good shot.\n\nhowever my not knowing shit about soccer makes me question why you would even try from that far when there appeared to only be 1 person ahead of you left to defend. not that matters since it worked out and was a goal,but still"
gifs,3c964o,Miko00,The fact that USA was up 4-0 3-0 only 15 minutes into the game probably had something to do with it.
gifs,3c964o,why_ur_still_wrong,"Up 3-0 15 mins in, took a crazy shot because they know the game is going to be easy mode and team USA started getting cocky, she got lucky it was on net. \n\nLet the downvotes commence for telling the truth."
gifs,3c964o,GenAmbroseBurnside,"Or in preparing for the game they noticed the keeper trends to drift out and she saw she was doing that so she took her shot and boom! Hat trick. Not saying she would have done it if they were losing, but that doesn't man they weren't planing on trying it."
gifs,3c964o,backtolurk,"As a French football lover, I say ""a little bit of this and a little bit of that"". The result is a magnificent goal and a clear victory. Would have been fun if Japan had lost cause of a own goal in the last minute but I'd rather watch a great performance like the one these girls delivered."
gifs,3c964o,Obi-StacheKenobi,"Agreed. Catching the goal keeper sleeping. Making a smart, on target boomer. Love it"
gifs,3c964o,drparker,Youre not getting downvoted for telling the truth butbut for being an idiot and making a dumb generalization.
gifs,3c964o,ATXBeermaker,"No, he's also being downvoted for being flat out wrong. The keeper was cheating up and was out of position. Lloyd saw that and took advantage."
gifs,3c964o,DumbledoresFerrari,"She saw the keeper off her line and knew she could score, so she shot. It happens occasionally even in close matches."
gifs,3c964o,Crunkbutter,I wouldn't say she was lucky it was on goal because it was what she was aiming for.
gifs,3c964o,mrcheeese,On net? Never heard that one before
gifs,3c964o,FloTheSnucka,I was going to say... This looked like shoddy goaltending to me. But I'm not a soccer fan by any means.
gifs,3c964o,noodlenova,"There was no guarantee that she was going to beat the last defender, and the JP keeper was so far off her line that a shot from that far out is really tempting. It doesn't always pay off, of course, but if you can catch a keeper off their line, in no man's land (if you'll excuse the term), then you'd be stupid not to at least try when you are yourself so far out from the goal line.\n\nEDIT: Just for emphasis, that keeper was WAY out of position. Shots like these are not commonly taken, let alone scored, because keepers generally know better than to stray that far out when your team isn't attacking with the ball."
gifs,3c964o,crimson777,"Plus, you need to take those crazy shots every once in a while, because otherwise the goalie can pretty much just sit in one spot and be perfectly comfortable with that."
gifs,3c964o,Joebranflakes,The Japanese keeper was also delayed in her reaction due to the sun being pretty much directly in her eyes. You can see it in the video. She probably missed half of the kick and couldn't get back in time to save it.
gifs,3c964o,leftpaw17,"She saw the goalie move up to defend the shot, which is usually good strategy, so she decided to see if she could get it in over her head."
gifs,3c964o,UniverseCity,"A bold strategy, Cotton. Let's watch the gif of it working out for her another 1776 times."
gifs,3c964o,linesreadlines,why you would even try from that far \n\n\nBecause blooters are fun
gifs,3c964o,Mintastic,The highlight of Adam's career (that doesn't involve him trying to cripple someone).
gifs,3c964o,AllfatherPidgeon,"The keeper was so far out, it was easier than it looks for a skilled player."
gifs,3c964o,eaglesquadgaming,"She spotted the goalkeeper standing out way too far. If she knows she can hit a shot like that, why not try it when you're 3-0 up. Still a pretty shit attempt to save by the Japanese goalkeeper."
gifs,3c964o,Shgrizz,"Normally you wouldn't try from there because it's almost certain get saved, and then you've just given away possession of the ball. This is more a fuck up on the goalie's part than anything else, as there's no way that shouldn't have been saved."
gifs,3c964o,DontGiveMeGoldKappa,dat view tho
gifs,3c964o,ForceBlade,Gif so mooth I thought it was rendered/a game
gifs,3c964o,jk3us,"To be fair, is a video."
gifs,3c964o,CryptoGreen,"Is it just me or is the sun in the Japanese goal-keeper's eyes?  Also, that camera drone is awesome, definitely the future of sports."
gifs,3c964o,rrrrthatsfivers,"It's a camera suspended by cables. Still very cool, though."
gifs,3c964o,CryptoGreen,what a contraption!
gifs,3c964o,Peace_Unleashed,You don't watch sports much do you?
gifs,3c964o,CryptoGreen,Esports mostly.
gifs,3c964o,Tankers,Let me translate for you. Skycam is basically an observer that can watch any part of the map irl.
gifs,3c964o,PM_me_not_a_thing,So basically a maphack?
gifs,3c964o,GinkNocab,More like spectator mode in something like CS
gifs,3c964o,xgenoriginal,you dont call it spidercam ?
gifs,3c964o,FSUfan456,I'm pretty sure it's used in most stadiums...
gifs,3c964o,TropicalAmerican,Most college football games have them
gifs,3c964o,CryptoGreen,"Tuition money well spent!\n\nedit: Seriously, can people have a sense of humor about things?  Why would I be soliciting a fact-checking about tuition and college sports?"
gifs,3c964o,Philyeagles710,"College football pays for itself and all the other sports at a school, not tuition money."
