gifs,3c81fs,n3dward,I loved reading that in JRs voice
gifs,3c81fs,hope_2010,THIS IS MAKIN MEH SIHCKK
gifs,3c81fs,Pewkie,Look at this !
gifs,3c81fs,orangepart,THE CARNAGE!!
gifs,3c81fs,antmansbigxmas,HE KILLED HIM!
gifs,3c81fs,theghostwithoutaname,Wheres the dam ref???
gifs,3c81fs,Channer81,THERE IS NO BELL TO RING
gifs,3c81fs,kdapiton2,WHAT THE F**K IS A REF?!?!?!?!
gifs,3c81fs,ibleed4games,Umpire's uncle.
gifs,3c81fs,U238Th234Pa234U234,https://youtu.be/KM7hLzhAdD8?t=9m20s
gifs,3c81fs,el_crunz,Look at Randy Orton just slitherin' up there.
gifs,3c81fs,pray4mayhem,"Watch out, watch out, watch out!"
gifs,3c81fs,Detrivance,Source: https://vine.co/v/eKVPHMBH2q7
gifs,3c81fs,iloveoreos13,"This needs to be upvoted more, so much better with sound"
gifs,3c81fs,letice721,Everyone on here freaking out bc its staged.  No shit. does it have to be real to be funny?
gifs,3c81fs,Chet_Awesomelad,"That's my issue with some people. It's like, yeah, this is obviously staged. It's still entertaining. Fiction can be entertaining."
gifs,3c81fs,404_UserNotFound,FUCK YOU!!! Jurassic World is a true story!
gifs,3c81fs,bigdanrog,Smokey & the Bandit is my favorite documentary.
gifs,3c81fs,But_spelled_write,Never forget what Will Smith gave for this country on Independence Day
gifs,3c81fs,twiztedice,"Never forget what Will Smith gave for this country on Independence Day\n\n\nYou dont seem to get the joke, they were mentioning things that are fake. The alien attack of 1996 is no small matter."
gifs,3c81fs,Disgruntled_marine,He's one of those conspiritards who thinks the Great War for Independence documentary was just some hollywood summer blockbuster.
gifs,3c81fs,twiztedice,EXACTLY!!
gifs,3c81fs,yomanwazzap,"Hey guys. I know we're focused on independence day, but can we please step back and see that 2012 really hit me hard."
gifs,3c81fs,Daniel3_5_7,"Not for his country, but for the whole Earf."
gifs,3c81fs,Klaxonymous,It's not fake... It's predetermined.
gifs,3c81fs,JPannullo,"He's not flying. He's falling, with style."
gifs,3c81fs,ILIKETOWRITETHINGS,It's only shitty if it depends on being true to be interesting. This doesn't.
gifs,3c81fs,letice721,U cant tell me that clean ass RKO wasn't interesting
gifs,3c81fs,ILIKETOWRITETHINGS,"It was extremely interesting! And, like i said above, it didn't depend on being a natural, un-staged moment to be interesting, since it was funny and well produced."
gifs,3c81fs,letice721,Oh shit haha i completely misread what u wrote my bad lol. I kind of jumped the gun haha
gifs,3c81fs,ILIKETOWRITETHINGS,np :)
gifs,3c81fs,MattyNiceGuy,"ITS STILL REAL TO ME, DAMNIT!!!"
gifs,3c81fs,marshall_law89,Its just not as funny
gifs,3c81fs,m-p-3,I'd be freaking out if it was real. Hope the guy at a water resistant phone :/
gifs,3c81fs,unknownentity1782,"Rule I learned from a film and advertisement class...\n\nIf it was recorded, it was staged at least somewhat."
gifs,3c81fs,poisonsmoke,Untrue
gifs,3c81fs,JarekBloodDragon,"does it have to be real to be funny?\n\n\nWith stuff like this, yes, it does."
gifs,3c81fs,IcySnake,"That's it, he's dead."
gifs,3c81fs,DenvercCoder_9,"I must be getting old, I was cringing how dangerous that was the whole time."
gifs,3c81fs,Qynchou,WATCHOUTWATCHOUTWATCHOUT
gifs,3c81fs,SuperDuperNameGuy,That looks like the hotel from Archer when he lost his memory and Lana went to restore it.
gifs,3c81fs,Canadian_Clubfoot,Kiss that phone goodbye
gifs,3c81fs,general-meow,its a dummy/display phone
gifs,3c81fs,ILIKETOWRITETHINGS,A lot of phones are waterproof to like 10m these days.
gifs,3c81fs,All_hail_9gag,not iphones...
gifs,3c81fs,I_Have_3_Legs,It is if you have a life proof case.
gifs,3c81fs,nilleftw,"Haha, shit iPhones can't even swim! Oh, damn, my phone isn't waterproof either...\n\niPhones are pretty cool, who needs water proofing?"
gifs,3c81fs,UpTheDump,"S5 active,  it'll still work. Guarantee"
gifs,3c81fs,zeteticwolf,Go blue..
gifs,3c81fs,Citizen_Gamer,"After watching a story about a woman who was paralyzed after someone playfully pushed her into the pool, stuff like this just scares me."
gifs,3c81fs,D_Man10579,WATCH OUT WATCH OUT WATCH OUT
gifs,3c81fs,Thisgameblows,The aftermath of that
gifs,3c81fs,grgriffin3,"That RKO had great form, Randy would be proud.\n\nAlso, Go Blue."
gifs,3c81fs,pearlmuter,This is the guy I picture as Ozymandias from Watchmen
gifs,3c81fs,imanAholebutimfunny,its obviously staged but i want to do this to someone standing by a pool now. thanks for the bad idea.
gifs,3c81fs,cubanb407,rKo! rkO!  <jerry lawler yelling voice>
gifs,3c81fs,biblicalsin,GOOD GAWD ALMIGHTY HE'S DEAD
gifs,3c81fs,Thare187,O-H...
gifs,3c81fs,Claw-fulCatPuns,IO BABY
gifs,3c81fs,johnkeenan218,Absolutely hate Logan Paul. Terrible human being
gifs,3c81fs,_xGizmo_,Why?
gifs,3c81fs,asilli,Reason #14365825 why Michigan sucks. Go Buckeyes!
gifs,3c81fs,DoctorAwesomeBallz69,"I dunno man, not sure what gif you saw, but Michigan kinda owned ass in the one I saw."
gifs,3c81fs,CharmsCandy,I don't even get offended anymore when Ohio State people mock UofM. It's just silly.
gifs,3c81fs,TheRedHand7,Right. You can just get offended based on the fact that you have lost 12 out of the last 14 times we have met.
gifs,3c81fs,CharmsCandy,How is OSU's better football program (at the moment) supposed to offend me?
gifs,3c81fs,TheRedHand7,"It is just some harmless trash talk from your better neighbor. Oh and ""at the moment""? Do you mean since WW2?"
gifs,3c81fs,HunterTier5,"""At the moment"" is pretty accurate.  OSU has at least sixteen years to go to even tie up the series.  Admittedly they have accomplished quite a bit during Michigan's coaching woes these past years but historically Michigan has just been better."
gifs,3c81fs,TheRedHand7,Sure if you want to talk about preWW2 stats U of M comes out ahead but if you talk about modern history the trend is pretty obvious.
gifs,3c81fs,borkborkbork99,Ann Arbor is a dirty whore
gifs,3c81fs,ChitChatJuiJitsu,"Yeah, but she's MY dirty whore and I love her. Lived here for 15 yrs and I fucking love this town!"
gifs,3c81fs,IhateSWGEMUmods,"This looks like a Vine, so I bet  it was staged. Still funny though!"
gifs,3c81fs,TheLongGame,They would stage a wrestling move? But wrestling is real.
gifs,3c81fs,OBAMA_HATES_SNOWDEN,All muscle no brains.
gifs,3c81fs,blinkanboxcar182,Boo Michigan
gifs,3c81fs,palfas,Fake and still dangerous going head first into a shallow pool.
gifs,3c81fs,Mister_Potamus,Sorry mom
gifs,3c81fs,sakkara,"The fakest of fakes, give it a fake crown! Still funny."
gifs,3c81fs,gayfreakyman,staged
gifs,3c81fs,Midgar-Zolom,"Thank you, captain obvious, for pointing that relevant bit of information out."
gifs,3c81fs,gayfreakyman,Seven!
gifs,3c8tou,cordeezy,He could just be going to the bathroom or going to get something to drink.
gifs,3c8tou,Bears54,Get out of here with your logic.
gifs,3c8tou,I-AM-Canadian-Eh,But I'm on TV!
gifs,3c8tou,dc300,"All OP said is that he was leaving.. something. He never specified that it was the stadium, he could have just meant leaving his seat. I think you're the one making assumptions."
gifs,3c8tou,WalterWhitesLeftNut,I think it's pretty clear what OP was implying
gifs,3c8tou,Lavaswimmer,i think the op was inferring
gifs,3c8tou,front_page_monkey,How dare you think logically.
gifs,3c8tou,IhateSWGEMUmods,Maybe he's going to take a dump on his girlfriend.
gifs,3c8tou,FLGulf,That's the most logical course of action.
gifs,3c8tou,hurdur1,Saw this after Japan's 1st goal.
gifs,3c8tou,BigDrew80,He has t-rex arms!
gifs,3c8tou,Snow_Falls,MRW I get an upvote on an old post
gifs,3c8tou,spmurp2,What was the point of this post. It wasn't even funny.
gifs,3c8tou,theeseesit,How does he realise he's on TV.. if he clearly doesn't look up at the screen in the stadium?
gifs,3c8tou,SirMehdi,How do you know who he's rooting for?
gifs,3c8tou,Greyhaven7,Really? Look at him
gifs,3c8tou,AceWhole420,How do you know hes a Japanese fan?
gifs,3c8tou,lo0ped,"Husband made the same joke when he saw it live..  ""Ooohp look hes leaving.. He knows its over..""  too funny someone gif-ified that moment"
gifs,3c8tou,jessizu,That is a Chinaman.
gifs,3c8tou,_graboid,"The Chinaman's not the issue, dude."
gifs,3c8tou,furrowsmiter,"""The Chinaman"" is the issue."
gifs,3c8tou,IceChinchilla,He was afraid he was going to be exiled like the guy who didn't sink with the Titanic.
gifs,3c8tou,xMASSIVKILLx,/r/NormalDayInJapan
gifs,3c8ald,Meunderwears,"Last time I went to a county fair, there was a whole display of horse-powered farm equipment like this.  It was pretty amazing, really."
gifs,3c8ald,Smeghead333,Why have and feed a horse if they aren't going to pull their weight?
gifs,3c8ald,tidder112,view from the other side
gifs,3c8ald,GentlyWithAChainsaw_,Pull up to engage the flywheel. I love it.
gifs,3c8ald,StrawHousePig,The more impressive feat of engineering is getting that horse on the treadmill. that's a 2 thousand pound horse!
gifs,3c8ald,SoapMasterFlex,How much wood do you have to split that way to make setting all that crap up worth it compared with splitting some extra wood by axe each day?
gifs,3c8ald,tomdarch,"You typically wouldn't chop wood every day. Anyone I know that chopped their own firewood typically did a cord or so at a time. If you live in a place that's cold and need to burn wood constantly to heat your home in the winter you can use in the range of four to eight cords during that season, exponentially more I'd assume if you lived somewhere it snows often.\n\nI'm out of shape now and don't even live where it's necessary but even when I was young and way more fit it was still a dreaded chore. It's not the time spent designing, engineering and building it's the effort saved from physically having to do it yourself."
gifs,3c8ald,Kryeiszkhazek,"I love chopping wood and my dad does it for exercise. This is probably only because we dont NEED the wood, otherwise it would be a chore."
gifs,3c8ald,washyleopard,"Having lived in Colorado for many years, I'll gladly shovel snow and chop wood while others do vacuuming and dishes.  Exercise is part of it, but so is ""that counts as my share of the chores"""
gifs,3c8ald,Semantiks,It's also faster unless you're a professional lumberjack
gifs,3c8ald,worstchristmasever,"To clear a few things up:\n1. The treadmill has a clutch/brake system, the horse can't go any faster than a slow walking speed.\n2. Horse stops = everything stops. Horses likes to walk, if not, you get another horse.\n3. Getting the horse on the treadmill is easy, backing them off takes a bit more trust.\n4. The steel bar behind the horse stops them from falling off the back. If they get bored (never seen a horse get tired on a treadmill), they sit on the bar."
gifs,3c8ald,SuMoto,How much horse power does that baby have?
gifs,3c8ald,HATES_THE_REDDITORS,One.
gifs,3c8ald,Tylray,I remember reading that a horse has the ability to make 14.9 peak horsepower.
gifs,3c8ald,Xrayruester,But 1hp is what it can produce at a steady pace for long periods of time.
gifs,3c8ald,Big_Brain_On_Brad,I think it's supposed to be average output of a horse over the duration of an entire work day.
gifs,3c8ald,478431188447,"If they know the kaio-ken maybe, but I've only seen one person do more than x10 and that was under extraordinary circumstances."
gifs,3c8ald,angrinord,Why do you hate us
gifs,3c8ald,apath3tic,"My only concern is the length of the treadmill, it's only just long enough for his stride. Seems like a small margin for error."
gifs,3c8ald,TechnicallyMagic,"My grandfather had a system where the horse(s) went in a circle which drove a drive shaft that could be connected to different tools like a thrasher, log splitter, etc. \n\nIt took more space but could use multiple horses."
gifs,3c8ald,FrozenPhotons,"It is directly bring driven by the treadmill,  rather than a dynamo creating electricity and powering a motorised saw."
gifs,3c8ald,raytrace75,There's a gear ratio I'd assume
gifs,3c8ald,seriousarcasm,Probably a few screws at at least one bolt too.
gifs,3c8ald,QuiteKid,It's being driven by the treadmill.  You can see the crankshaft leading from the treadmill to the machine.  It looks like it's purely mechanical.
gifs,3c8ald,478431188447,I'd guess hydraulics or something. The horse is the pump.
gifs,3c8ald,Peppyperoni,"damn, how many horsepower does that thing have?"
gifs,3c8ald,hastobetrueitsreddit,"Well, it appears to be powered by one horse, so I'd say anywhere between zero and one."
gifs,3c8ald,LoganPhyve,I'm just going to leave this here ;) https://m.reddit.com/r/todayilearned/comments/2ezxvw/til_an_individual_horse_has_a_peak_power_output/
gifs,3c8ald,hastobetrueitsreddit,Unguarded PTO shaft omg
gifs,3c8ald,96throwaway96,I still shudder at that after tractor safety...
gifs,3c8ald,Tubes_69,Bye arms
gifs,3c8ald,Paradox,Farm equipment is dangerous.  You have to really pay attention all the time.
gifs,3c8ald,hamsammicher,"It's guarded.  That red part you see on the outside is just sitting loose over the other shaft.  You could walk up and grab that with your bare hands and you'd be fine.  What's dangerous is the open chain drive, and spokes on the flywheel.  That, and of course, the open area where a ram drives wood into a sharp wedge.  If it'll split that wood so easily, just imagine what it would do to a body."
gifs,3c8ald,PigSlam,"When I run on a treadmill, it's got a motor. I'm not powering anything, Im just along for the ride.  Am I stupid for not understanding this?"
gifs,3c8ald,PursuitOfAutonomy,"A treadmill is a device generally for walking or running while staying in the same place. Treadmills were introduced before the development of powered machines, to harness the power of animals or humans to do work, often a type of mill that was operated by a person or animal treading steps of a treadwheel to grind grain. In later times, treadmills were used as punishment devices for people sentenced to hard labor in prisons. The terms treadmill and treadwheel were used interchangeably for the power and punishment mechanisms."
gifs,3c8ald,jfende,not sure what you don't understand but the main difference here is if the horse stops walking nothing happens. He stands still. Your treadmill on the other hand forces you to maintain a certain speed by moving the treadmill surface.
gifs,3c8ald,jspenguin,"wouldnt the horse need something to pull against, though?  without something to pull/push against and without  a motor, you just walk off the treadmill right?"
gifs,3c8ald,syuk,Gravity. The treadmill is on an incline.
gifs,3c8ald,Frivolicious,ah.  that makes sense.
gifs,3c8ald,Booshanky,Anyone else notice the little horse walking in the background?
gifs,3c8ald,prjindigo,...that's a dog.
gifs,3c8ald,_stonecoldsaidso,Fucking hipsters....
gifs,3c8ald,hamsammicher,https://www.youtube.com/watch?v=dGGH4XKNULU\n\nwhat the fuck is the horse for?
gifs,3c8ald,NessLeonhart,"This is the first time I've seen anything like this. Best design I've seen yet, very simple."
gifs,3c8ald,Peppyperoni,The horse rig is splitting much larger logs.
gifs,3c8ald,stemgang,what happens when the horse slows for a half-step and its rear leg finds no purchase? seems like a good way to injure a horse and fuck up a treadmill
gifs,3c8ald,Peppyperoni,When the horse stops the treadmill stops.
gifs,3c8ald,ajumbaje,Instantly? Or is there maybe a little inertia in the mechanism?
gifs,3c8ald,Licna,Perhaps that's why there's a bar behind the horses ass?
gifs,3c8ald,abovetheabyss24,"Probably the job Virginia Tech's ""Horse on a Treadmill"" gets when it retires"
gifs,3c9wfb,shorrrno,Only if we were all that diligent about picking up litter.
gifs,3c9wfb,come2daddy,/r/unexpected
gifs,3c9wfb,titanroller,"I feel dumb having to watch it that many times to find out ""why?"".  I guess he was going for the cup as a souvenir."
gifs,3c9wfb,SmugglingPlums,"That is indeed why. Or maybe he wants to secure some grade A cycling athlete DNA to clone it, I dunno..."
gifs,3c9wfb,Lee1138,"If you clone a cyclist, is it considered recycling?"
gifs,3c9wfb,ConfusedOilworker,/r/shittyaskscience\n\n/r/showerthoughts
gifs,3c9wfb,Beck3570,or he was looking for some residual performance enhancing drugs
gifs,3c9wfb,Nizzler,And he wasnt even racing anybody else to get to it.
gifs,3c9wfb,IHateTheLetterF,"That's crazy, those bikers are going so fast and in such close proximity. One wrong move would result in every single one of them crashing quite painfully into the ground/one another/spectators. Oh and the fat guy falling flat on his face was funny too."
gifs,3c9wfb,Not_athrowaweigh,"Have a search for some gopro footage inside the peleton, it's quite insane."
gifs,3c9wfb,Lobo2ffs,https://www.youtube.com/watch?v=aeCRnFq_9Lo
gifs,3c9wfb,treezin0314,Wow that was insane. Thanks for sharing
gifs,3c9wfb,Leopoldf,I'd love some gopro footage of that falling guy.
gifs,3c9wfb,dutch4264,"Saw the gopro footage from the time trial on Saturday. Those guys are flying, spectators were close and very loud.  It was insane"
gifs,3c9wfb,-Replicated,Here and this is a pretty good montage aside from the potato quality.
gifs,3c9wfb,Talibistan,RIP
gifs,3c9wfb,yearound,"That was unexpected... After watching them keep a perfect line without one accident, i bet this guy felt stupid for not being coordinated enough to make it across the street without busting his ass."
gifs,3c9wfb,JarekBloodDragon,Slowing down him falling ruins this for some reason
gifs,3c9wfb,TheIrishDrinkinger,Interesting. I thought exactly the opposite. I thought it added some comedic affect..
gifs,3c9wfb,Jack_E_Boy,I don't know what I was expecting.
gifs,3c9wfb,ASmileOnTop,"I dunno about you, but I was expecting a huge group of collapsing bikers"
gifs,3c9wfb,LaterGatorPlayer,and then one of these
gifs,3c9wfb,jaybub,"Neither did I, but that was unexpected."
gifs,3c9wfb,Djzjizj-ORuouiu-668,I knew cycling was a dangerous sport.
gifs,3c9wfb,thrillhouse26,It's a damn good thing the snow-mo broke his fall.
gifs,3c9wfb,Scal3s,/r/wastedgifs
gifs,3c9wfb,comradeTJH,This needs a wasted-edit.
gifs,3c9wfb,Big_bets,"A bad crash did actually happen on the tour de France a few minutes ago,  saw this link and was like, how did they post this so fast. Pleasant surprise op thanks."
gifs,3c9wfb,buywhizzobutter,Link?
gifs,3c9wfb,who-the-hell-cares,Did he get the bottle after all?
gifs,3c9wfb,Doctor_Fritz,some say he's still on the ground to this day
gifs,3c9wfb,Denmen707,"I checked, he is still there. Cyclists refuse to give a shit."
gifs,3c9wfb,LOLShibe,http://i.imgur.com/rg7SI0C.gif
gifs,3c9wfb,CalebTechnasis,"I love how he grabs it anyway like ""Well as long as I'm down here."""
gifs,3c9wfb,TheIrishDrinkinger,That commitment tho...
gifs,3c9wfb,wittenvdp,one lesson: always wear a helmet
gifs,3c9wfb,not_castor_pollux,that was actually really good form.
gifs,3c9wfb,NickDangerrr,Paging /r/WastedGifs
gifs,3c9wfb,IM_A_GIRL_BY_THE_WAY,¯_(ツ)_/¯
gifs,3c9wfb,andrejevas,You dropped this \
gifs,3c9wfb,eyenigma,You insensitive person you. He was probably thirsty.
gifs,3c9wfb,-Replicated,"What the fuck was he doing, it looked like he dived for the cup for some reason."
gifs,3c9wfb,aliass_,"Someone please add the ""wasted"" from GTA."
gifs,3c9wfb,juanlee337,I think it would been better to remove the slow effect.
gifs,3c9wfb,califorte1,I was really excited for a big pile up.
gifs,3c9wfb,imanAholebutimfunny,i love the slow mo
gifs,3c9wfb,bochez,I was convinced it was just going to loop for a second there.
gifs,3c9wfb,TheIrishDrinkinger,Perfect setup to do a Michael Bay explosion
gifs,3c9wfb,dutch4264,That is hilarious
gifs,3c9wfb,Vilmond,"I was half expecting it to be a loop of bikes just flying past the screen until I saw the cup and went ""oh shit its not just a troll loop""."
gifs,3c9wfb,royal_wit_cheese,you son of a gun
gifs,3c9wfb,Bobgoblin1,NSFL jeez
gifs,3c9wfb,mantisinmypantis,Wasted
gifs,3c9wfb,bryanrobh,Like he was sniped from the building or the cement monster got him.
gifs,3c9wfb,samsquanch321,r/unexpected
gifs,3c9wfb,HungryMoose1,"I was watching the tour last year and they interviewed a guy and asked him what it felt like when they crashed. His response was epic, ""strip down to your underwear and drive your car 40mph and then jump out, thats what it feels like"""
gifs,3c9wfb,frostyjacks,He was vision was probably distorted from the motion of the bikes.
gifs,3c9wfb,Aint_not_a_dorkus,That was even better than I expected
gifs,3c9wfb,CheapNoodle,ALLAH AHKBAR
gifs,3c7wxs,JWStarfish,His expression at the end explains it all.
gifs,3c7wxs,Syrup_Chugger_3000,'I wish that didn't happen'
gifs,3c7wxs,bikepsycho,"""FML"""
gifs,3c7wxs,maxblack88,I can't believe you've done this.
gifs,3c7wxs,audiguy7,Context.\n\nMakes me giggle like Ron Swanson every time.
gifs,3c7wxs,ChickenInASuit,"Everyone who has flown models knows that feeling. \n\nC of G looked too far back or too much ""up"" trim on the elevator, better if it pulls up not down so you have more time to make trim adjustments to get your shiny new plane flying right...unless there's a fence....fuck"
gifs,3c7wxs,graspedbythehusk,"Dude I'm too scared to maiden my zephyr/juggernaut style 54"" wing for that exact reason. No matter how many times I check the CofG, I'm convinced it will die on the first throw haha"
gifs,3c7wxs,Horatio_Stubblecunt,"I actually own a Radian like this one, its hands down the best foam glider I've ever had.  While its a little touchy with the CG I've never had something like this happen.  From experience with the Radian launching into the wind will push the nose up and make you stall in a heartbeat or in heavy winds flip like this.  All in all I still recommend it for a starter plane because of its smooth handling."
gifs,3c7wxs,404_Username,"""And this ladies and gentlemen, exemplifies defeat."""
gifs,3c7wxs,ngarofalo,That's a bummer. A whole day of fun gone. If he was an old man I would have hugged my phone to make myself feel better.
gifs,3c7wxs,Killahdanks1,/r/instant_regret
gifs,3c7wxs,imonthehighway,Pure disappointment
gifs,3c7wxs,EJ-ericjackson,http://i.imgur.com/JFAuC2C.jpg
gifs,3c7wxs,MAXAMOUS,"""aaaaaaaaaaaaand.....I wasted $200"""
gifs,3c7wxs,dewdude,That man's face on the other end of his head must've had the most disappointed look.
gifs,3c7wxs,Wavering_Radiant,"Dat shrug.\n\n""Welp, I've done it again."""
gifs,3c7wxs,GoodShitLollypop,"When I was a child I wanted an RC plane for years. I begged my parents for one and finally they caved and got me one for my birthday. We took it to a field, tried to launch it, and it nosedived and broke in half. I'm still scarred."
gifs,3c7wxs,MightierThanThou,Get back on the horse! You can get insanely resilient cheap foam planes now!
gifs,3c7wxs,Horatio_Stubblecunt,The hands of disappointment at the end are priceless.
gifs,3c7wxs,ImplicitLife,Ha. Everytime I compile.
gifs,3c7wxs,Sosadu2,Sums up my decade.
gifs,3c7wxs,daneeka10,Can someone recreate this with a Michael Bay type explosion at the end?
gifs,3c7wxs,allryuken,I think I would actually cry
gifs,3c7wxs,donathontv,Looooooooool. All the gear and no idea!
gifs,3c7dtr,Unconquered1,"It's part of their ""One Step Forward, 10 Steps Back"" program."
gifs,3c7dtr,Sylvester_Scott,"implying he's not bulking \n\n\nFirst you gotta built some size, then cut.\n\nIts the SS + GOMAD + Pizza routine."
gifs,3c7dtr,linesreadlines,Bulking like Cartman.
gifs,3c7dtr,Zomgsauceplz,I mean 11 steps is a pretty hefty workout if you ask me.
gifs,3c7dtr,Jethelas,"Eat like a pig during workout and it's fine, grunt even a little while doing a tough set and you're out of there"
gifs,3c7dtr,ArchangelPT,Is it that bad that they kick you out if you grunt there? I personally find it entertaining
gifs,3c7dtr,mantich92,"When I go with my buddies and we mess around like while doing deadlifts we'll moan while doing warm ups,yet I don't go to planet fitness"
gifs,3c7dtr,themoderation,I've never seen anyone kicked out for grunting a little when working hard. I have seen people getting kicked out for being showy assholes.
gifs,3c7dtr,lishmunchkin,"He's not sitting at the table eating a whole pie. He has one slice and he didn't even stop his workout, that's dedication. You can't go cold turkey on a diet, that's why so many people fail. U have to let yourself have something u like every once in a while so u don't burn out and give up. And u r allowed to grunt a little bit, u just can't b loud and obnoxious and bothering other ppl, that's our rules at my PF anyway."
gifs,3c7dtr,Higher_higher,"He's not sitting at the table eating a whole pie. He has one slice and he didn't even stop his workout, that's dedication. You can't go cold turkey on a diet, that's why so many people fail. U have to let yourself have something u like every once in a while so u don't burn out and give up\n\n\nWhat do you mean ""cold turkey"" on a diet? Yeah, you absolutely can exercise a bit of willpower and not eat pizza while trying to lose weight. Otherwise you just arent on a diet. Eating junk food while on a damn machine at the gym is insanity."
gifs,3c7dtr,themoderation,"So anytime someone eats something off their diet they are no longer on a diet? You should council addicts:\n\n""Well bud, I know you're TRYING to recover but you slipped up  once and now you're done. It's just heroine and whores from here on out."""
gifs,3c7dtr,Higher_higher,"You talk like junkfood = heroin. If you suffer painful physical withdrawal from not eating junkfood, then by all means ""taper"" your ""dose"" until you can come off of pizza and doughnuts."
gifs,3c7dtr,themoderation,"My point is that tripping up does not make you a failure in either case, and that feeling like a failure makes you a lot less likely to succeed."
