InjusticeMobile,3cuvew,godsavant,4,Sat Jul 11 05:34:42 2015 UTC,Trinity refers to the number three. Tri- 3. Three characters. Why would it have a bad connotation if there is a sale on three characters?
InjusticeMobile,3cuvew,Dethstrke,-2,Fri Jul 10 23:45:18 2015 UTC,"Traditionally, of course, it's most common usage is in the phrase ""Holy Trinity"", as in the father, the son, and the holy spirit. I'm not sure who is who in this case, though; if Martian Manhunter was in it, we'd at least have a candidate for spirit."
InjusticeMobile,3cuvew,simulcat,-7,Sat Jul 11 01:28:27 2015 UTC,"because they worth something in between their sell on value and 75k. The point is don't buy, ok?"
InjusticeMobile,3cuvew,dreamerintherye,2,Sat Jul 11 00:23:01 2015 UTC,"Those 3 characters are consider CD's Trinity, their core characters. DC had made several series of just those 3 characters and even named those titles Trinity. Definitely no bad connotation to them."
InjusticeMobile,3cuvew,Jmm060708,1 point,Sat Jul 11 01:25:41 2015 UTC,Pass. Not that interested in those characters. Anyone else buying?
InjusticeMobile,3cuvew,dragon290513,1 point,Sat Jul 11 00:10:07 2015 UTC,probably have something to do with SDCC going on this weekend and the new bat vs sup flick
InjusticeMobile,3csxd4,capitantelescopio,7,Fri Jul 10 14:47:33 2015 UTC,I also like MKXS Fireball! And Statics electrical bubble thing.
InjusticeMobile,3csxd4,Txmaluda,3,Fri Jul 10 14:57:44 2015 UTC,"Sinestro's back flip is really cool, and I love KF's ice sword swipe followed by an elegant leg kick."
InjusticeMobile,3csxd4,IronTitan12345,2,Fri Jul 10 16:21:19 2015 UTC,CCBG - Two-hit combo of an elbow down then an uppercut upwards looks cool and is really effective!
InjusticeMobile,3csxd4,awkwardharvey,1 point,Fri Jul 10 15:59:50 2015 UTC,"hawkgirl, i don't even know how she does that"
InjusticeMobile,3csxd4,Aurora_Panagathos,1 point,Fri Jul 10 15:52:12 2015 UTC,Don't forget Godfall Superman's fireball!
InjusticeMobile,3csxd4,jedispyder,3,Fri Jul 10 17:02:57 2015 UTC,Godfall Superman's fireball laser vision thingy.
InjusticeMobile,3csxd4,IronTitan12345,1 point,Fri Jul 10 18:17:31 2015 UTC,"I know it's laser vision, it just looks too large to be regular laser vision so I like to think of it as a fireball."
InjusticeMobile,3csxd4,jedispyder,1 point,Fri Jul 10 18:28:36 2015 UTC,"Ah, okay. I guess shooting fire balls out of his face is pretty cool too"
InjusticeMobile,3csxd4,IronTitan12345,1 point,Fri Jul 10 22:52:28 2015 UTC,What??? I've managed to get AOJoker to Level 50 without using his light combo!
InjusticeMobile,3csgw8,adamd22,11,Fri Jul 10 12:14:00 2015 UTC,"Hahaha, just wait 'till you see my A Tier. I love AOPain, he's phenomenal. It's just that he's not as obviously devastating as AODS and for some reason people think AOBats is amazing. So since he takes more thought than the others to use people assume he's worse. This is not the case."
InjusticeMobile,3csgw8,Greidam,3,Fri Jul 10 12:33:33 2015 UTC,"I wouldn't say he even takes much thought to use, which is why I'm so reckless with him. All I need to remember is the order in which to use characters in: AOB, AODS, AOBane.   How have you geared your team? I mean it doesn't exactly need gearing that much though I suppose, I have an S2 boost gear on Bats, Ras, gloves of azrael, promethium long sword for DS, and unupgraded venom harness for bane."
InjusticeMobile,3csgw8,Greidam,2,Fri Jul 10 12:51:06 2015 UTC,"I run both harleys with AOPain, sometimes I swap AnHQ for AODS or AOBM. In both versions of the team bane has the ibistick/demon cloak/demon blade. Unblockable bane barrage is nuts, especially because with his gear and passive Bane makes power real quick.   Btw you'd be better off swapping the gauntlets on AODS for literally anything else lol. Personally I recommend a basic attack gear or comically long pistol. If you want the heal then just use bone spikes."
InjusticeMobile,3csgw8,IronTitan12345,4,Fri Jul 10 17:04:21 2015 UTC,"At EVII, he hits like an 18 wheeler with no breaks and is actually one of the few characters I'm wary about fighting and have to use legitimate strategies on.  On the offensive, he doesn't give a rat's ass about anything and will cut through anything like a lawnmower with adamantium blades. He's great."
InjusticeMobile,3csgw8,Aurora_Panagathos,4,Fri Jul 10 16:02:29 2015 UTC,"yeah, Bane looks swag, has enormous stat but I think he's overpriced. more expensive than AODS"
InjusticeMobile,3csgw8,simulcat,2,Fri Jul 10 12:32:02 2015 UTC,"""Why all the hate for AOBane?"" I don't know. I bet if you look through the past few weeks of posts, you'll find WAY more posts talking about how he's fucking amazing than posts saying that he's meh. I haven't really seen any negative posts about him. So, I don't think there's that much hate for AOBane. (Though personally, I'm kind of lukewarm. Sure, great S2. But Bane's fighting animation is still slow and stupid. I hate using his basic attacks)"
InjusticeMobile,3csgw8,Abbhrsn,1 point,Fri Jul 10 16:37:36 2015 UTC,"I love him, I've been using him AOBats and AOJoker and having a blast with the team"
InjusticeMobile,3csgw8,TehFierceIllusion,1 point,Fri Jul 10 16:31:46 2015 UTC,"I haven't seen anyone saying he's bad, but yeah he's fucking awesome."
InjusticeMobile,3csgw8,Dsweaponxx,-1,Fri Jul 10 17:04:33 2015 UTC,I read this comment and I had to send you a private message. Wow.
InjusticeMobile,3csgw8,Perfectblood,1 point,Sat Jul 18 00:06:05 2015 UTC,"Actually I play him with AOBAT, AOharley, and he is a beast. Unblockable sp2 with sp2 crit gear and he takes out one enemy and the next one leaves with half of his hp, even sometimes he can take out two..."
InjusticeMobile,3csgw8,byBumi,1 point,Fri Jul 10 23:05:22 2015 UTC,"I love AOBane's S2. Even when blocked, he will still rip through enemies."
InjusticeMobile,3csgw8,rjjjr82,1 point,Sat Jul 11 00:29:33 2015 UTC,"I have AOBane, AOBats, and AOJ on the same team. I have been demolishing teams easily with this group until yesterday. On four different occasion i ran into the HO TRAIN and got my ass kicked. HO train is KF, RKF and WW600. Once RKF got off a special power generation got reduced by 100% for my team. Somehow i keep running into this team but i do not own RKF but badly want to."
InjusticeMobile,3ctn85,nakednark,1 point,Fri Jul 10 18:02:58 2015 UTC,"Have you tried opening the app offline or in airplane/flight mode? The might help.  If that doesn't work try throwing your phone at the wall again. If that doesn't work, do it again. Third times the charm, I hear."
InjusticeMobile,3ctn85,IronTitan12345,1 point,Fri Jul 10 18:16:01 2015 UTC,"I just tried opening the app up in airplane mode. The log in bonus did not show up. I turned off airplane mode and the log in bonus ended up popping up again and being annoying.   I bashed my phone with a hammer, so hopefully that'll do the trick.   I think this might be a sign to retire from Injustice, haha!"
InjusticeMobile,3ctn85,IronTitan12345,1 point,Fri Jul 10 18:55:56 2015 UTC,I guess you could say a great injustice was done to you... just don't turn evil and enslave the world.
InjusticeMobile,3ctn85,--quoth-the-raven--,1 point,Fri Jul 10 19:03:36 2015 UTC,"I have an unrelated question but I'm mobile so I can't do posts. I played for a few months a while ago and rather than exerting some self control I just deleted the app. I've reinstalled it and started again, but lost a few characters like Raven, GFSM, etc.   Can I retrieve that account, or is it too late? I tried resetting the password but never received anything."
InjusticeMobile,3ctn85,IronTitan12345,1 point,Fri Jul 10 21:59:46 2015 UTC,"As log as you had logged online before uninstalling the application your progress should be saved to your account, as long as you use the same operating system as before. If you log in to that same account and did all of those other things all of your progress should be saved. If there is a problem I'm not really sure what more you can do."
InjusticeMobile,3ctn85,--quoth-the-raven--,1 point,Fri Jul 10 22:50:13 2015 UTC,"Alright, thanks for the feedback."
InjusticeMobile,3ctn85,Delusions_of_Grandpa,1 point,Sat Jul 11 01:00:56 2015 UTC,Press the back button.
InjusticeMobile,3ctn85,dreamerintherye,1 point,Fri Jul 10 19:00:55 2015 UTC,"I always have trouble with the damn free card. I'm on Android and I have to keep hitting the return but until it asks if I want to exit the app, at which point I saw no and it closes the dialog box."
InjusticeMobile,3ctn85,bdckr,1 point,Fri Jul 10 19:28:30 2015 UTC,I tried this and it doesn't work :(
InjusticeMobile,3ctn85,bdckr,1 point,Fri Jul 10 23:55:57 2015 UTC,Have you done the glitch where you oversell a character?  Specifically the bronze Green Lantern card?  What you're describing is pretty typical of what happens when an oversold character appears as the daily login bonus.
InjusticeMobile,3cs8oz,Hiendaoduc,3,Fri Jul 10 10:29:12 2015 UTC,The AI getting better makes the game worse?  How does that make sense..
InjusticeMobile,3cs8oz,Abbhrsn,2,Fri Jul 10 16:17:54 2015 UTC,Well if u tag in mid-enemy-combo u can always get a special unblocked
InjusticeMobile,3cs8oz,Aurora_Panagathos,3,Fri Jul 10 12:29:38 2015 UTC,Oh and I forgot that they can escape their killing blow by tag out mid combo.
InjusticeMobile,3csuh3,gondi,5,Fri Jul 10 14:23:55 2015 UTC,"The sweet spot for gear is around +6 after evolving -- that's the point at which you've spent about 55% or so of the gear's total cost (that being the total cost of taking a brand new piece from never-been-fused to Evolved +10) but the gear's effects are already at about 90% of what they'll be when max'd out. Here's a specific example, quoting a post I wrote about this on the WB forums:   Keep in mind also that while the cost of each fuse increases exponentially, the benefit that you get for each fuse is flat. Meaning, for example, if you've just evolved your Alloy Sword into Promethium Longsword: if you want to evolve it from E to E+1, that costs 4 R and 4 G and gives you +1% Basic Damage and +1% Crit Chance. But if you've already got it E+5 and want to make it E+6, that costs 28 R and 28 G and but still only gives you +1% Basic Damage and +1% Crit Chance. And then from E+9 to E+10? Another 72 R and 72 G -- all for just one more +1% Basic Damage and +1% Crit Chance.  Therefore, the ""sweet spot"" is around E+6 or so -- at E+6, you've only paid a little over 50% or so of the total cost of full evolution (taking it from unevolved to E+10) but the gear's effects at E+6 are already around 85-90% of what they're ever going to be at E+10. So don't worry about going higher than E+6 until you've got a wide variety of gear at that level -- arming a three-person team with nine E+6 gears will be much more effective than having one or two E+10 gears and a bunch of crap in the other slots.   Also, if you're going for a healing gear, stick to the three-stars but, failing that -- if you feel you absolutely need to evolve a healing piece for fewer shard than the three-stars take -- then evolve a one-star piece... just don't evolve the Strange Elixir. When they nerfed healing gears' percentages a long time ago, the newly lowered percentages left the Strange Elixir/Lazarus Formula as the worst healing value proposition in terms of effect for the shards used -- see my lengthy write-up detailing the specifics here: https://www.reddit.com/r/InjusticeMobile/comments/2qy8f5/not_worth_it_stop_evolving_the_strange_elixir/"
InjusticeMobile,3csuh3,lahatiel,1 point,Fri Jul 10 15:36:27 2015 UTC,"really great point u bring up. most of the time i fuse just enough to evolve. when one wins without straining oneself, there's no point fusing gear anymore"
InjusticeMobile,3csuh3,Aurora_Panagathos,2,Fri Jul 10 15:56:45 2015 UTC,"It drives me nuts to have all those +6 gears sitting around. I have five at +9, and I keep itching to max them out because it just bugs me to have incomplete gears... but while they keep throwing new gears at me, I feel compelled to put my shards there first. That said: if you're not an obsessive nut like me, I completely agree that there's no reason to go past +6. (The one exception is the Gauntlets of Azrael, since it gives you a lot more than 1% increases per upgrade. But you don't really need to upgrade that gear anyway, since there are much better gears out there.)"
InjusticeMobile,3csuh3,simulcat,1 point,Fri Jul 10 16:32:38 2015 UTC,"really good post, thank you for it!  I did not know any of that before, but I have stopped at E+5 with most of my gears just because I can get by with those. Eventually I will (hopefully) fully evolve everything, but those pesky Green shards keep running out all the time!"
InjusticeMobile,3csuh3,Mellakka,1 point,Fri Jul 10 16:37:47 2015 UTC,Man how didn't I read your post earlier? I just fused the Strange Elixir to evolved +10 out of boredom. 18% hp and 10% s1 heal costed me almost every shards I have.
InjusticeMobile,3csuh3,Hiendaoduc,1 point,Fri Jul 10 16:52:56 2015 UTC,"thanks man! this really helped. Haven't really gone beyond E+6 on anything, but that's because i keep running out of those damn red shards."
InjusticeMobile,3csuh3,IronTitan12345,1 point,Fri Jul 10 18:04:19 2015 UTC,"Like /u/lahatiel said, the set spot is the +6 level, since the cost sort of resets. Although with all of the new gear out, like Ibistick, GoA and Cloak, I think it's best to just evolve them to conserve shards, because you'll need them (especially friggin' red shards, those are like socks, one can never have enough). Once you've evolved all of them, then I recommend seeing which ones you prefer, establish your priorities, then find the sweet spot on them. Once you have all of your favourite gear at the sweet spot, then once again start leveling them up in order of priority when you're ready."
InjusticeMobile,3crmpt,square_root_of_jason,5,Fri Jul 10 05:33:33 2015 UTC,"He's in there, but he's extremely rare. I have him EVII, but it took forever."
InjusticeMobile,3crmpt,IronTitan12345,3,Fri Jul 10 05:43:41 2015 UTC,I have gotten him twice now. Harley seems to be the one I get the most from those packs though.
InjusticeMobile,3crmpt,Doright36,1 point,Fri Jul 10 08:01:20 2015 UTC,"Which is really annoying since if you played when the app launched, she was the 10th day log in for at least 60-80 days"
InjusticeMobile,3crmpt,MyNameIsFreeman,2,Fri Jul 10 14:29:40 2015 UTC,Drop table guy here. Yes. We have the data
InjusticeMobile,3crmpt,tlk742,1 point,Fri Jul 10 13:24:07 2015 UTC,"I finally got him to EVII just last week, but it took even longer than it did to get Shazam to EVII from gold packs. I had to have spent at least 1.4 million (maybe more) credits on bronze packs for that, and I only did it because I think that's the best Flash skin currently in the game."
InjusticeMobile,3crmpt,JimTuna,1 point,Fri Jul 10 06:28:41 2015 UTC,"Yup, he's in there. I spent waaaay too much opening pack after pack getting him to E7, but I love him, so I don't have any regrets!"
InjusticeMobile,3crmpt,Voidhound,1 point,Fri Jul 10 07:11:00 2015 UTC,Didn't even think he was available in Bronze packs. Flash N52 & Batman Beyond are the only 2 cards that I don't  have :(  At least I know that Flash is obtainable even if its unlikely
InjusticeMobile,3crmpt,JimGrim,1 point,Fri Jul 10 08:25:19 2015 UTC,"I've gotten 3 so far, all from Challenge Reward Bronze Packs."
InjusticeMobile,3crmpt,jedispyder,1 point,Fri Jul 10 14:17:39 2015 UTC,He's in there. I have mine up to E7 and he's tied with Elseworlds Flash as my favorite Flash skin.
InjusticeMobile,3crmpt,Serapius,1 point,Fri Jul 10 16:35:59 2015 UTC,I've gotten him in the packs they give you in the challenge...
InjusticeMobile,3crmpt,Sabermawile,0,Sat Jul 11 15:15:18 2015 UTC,"Yes. Like you was buying bronze packs because he was the only card I was missing. Then got him from the AOBane challenge (while you could reset it), then got him again...."
InjusticeMobile,3cqfj9,handsolo85,4,Thu Jul 9 23:10:33 2015 UTC,I'd just be happy if they made a bronze or silver Batman. Easily my favorite but why only gold?
InjusticeMobile,3cqfj9,Jmm060708,3,Fri Jul 10 00:15:07 2015 UTC,why only gold   Because MP viability
InjusticeMobile,3cqfj9,CoalhouseWalker,3,Fri Jul 10 02:27:45 2015 UTC,"Not really, it'd be easy to have a weak Batman/Superman/Wonder Woman just like there is a weak version of Deathstroke."
InjusticeMobile,3cqfj9,jedispyder,3,Fri Jul 10 03:41:53 2015 UTC,"I'm just saying that at this point, most people who have been playing this game for any length of time wouldn't get much use out of new bronze or silver cards. All the new ones are gold because that is what most players want.    Why would I opt to play twice as many MP matches with a silver team? Unless the new cards are really unique and fun to play with in some way (I've seen the Adam West Batman idea pop up several times here...)"
InjusticeMobile,3cqfj9,CoalhouseWalker,2,Fri Jul 10 05:22:25 2015 UTC,I've been playing for 10 months or so and still like using Silver and Bronze teams in MP. That is where you get the most variety of team composition and not the same team 5 times in row.  Also new Bronze would help bring back Darkseid teams which have faded out of existence.
InjusticeMobile,3cqfj9,jedispyder,1 point,Fri Jul 10 12:16:43 2015 UTC,"They could make an extra multiplayer mission for silver/bronze only and that would get some interest in those tiers. Otherwise, not much use for them like you said indeed other than if you like them or for challenges."
InjusticeMobile,3cqfj9,Feezbull,2,Fri Jul 10 13:13:47 2015 UTC,"That's already what the current challenges do. When you complete the whole ladder you win a bronze pack, a silver pack and a challenge character. You also randomly win a silver character in the middle of a ladder too.   .  But in all seriousness, getting some new silver characters would be pretty sweet."
InjusticeMobile,3cqkha,Metabeemeta,3,Thu Jul 9 23:50:23 2015 UTC,I've spent probably near 10 mil credits on gear lockers. Have yet to receive it. :/
InjusticeMobile,3cqkha,Txmaluda,3,Fri Jul 10 00:06:04 2015 UTC,it is supposed to be abt 100
InjusticeMobile,3cqkha,Aurora_Panagathos,2,Fri Jul 10 00:06:10 2015 UTC,"I know I was insanely lucky, but I got mine in my 4th (I must've opened over a hundred trying to get Zod's Kryptonian Pistol, though, and I still haven't got one!)"
InjusticeMobile,3cqkha,Voidhound,2,Fri Jul 10 00:16:10 2015 UTC,"The actual odds are something like 1%, but it took me about 20 packs (65kx20=1.3M credits). That's if you're lucky."
InjusticeMobile,3cqkha,CruxOfArgon,2,Fri Jul 10 00:47:24 2015 UTC,I got it rather early. Maybe about five or six?
InjusticeMobile,3cqkha,kingofthyhill,2,Fri Jul 10 03:14:44 2015 UTC,"I got 2 in my first 10 packs. I was confused because I was told it was ""super rare.""   Fortunately most of my packs have been lucky. 3 KJJs in one pack was pretty freaking awesome. Someone has to balance out all those bad draws."
InjusticeMobile,3cqkha,Bsimmons4prez,2,Fri Jul 10 12:02:48 2015 UTC,"Got 3 of him in about 10 packs, and I still getting him, but no Harley Pistol or DS sword, damn :/"
InjusticeMobile,3cqkha,buhrainbow,2,Fri Jul 10 13:34:37 2015 UTC,I got my 1st on my 2nd pack! still new here so I don't know how to put pictures. No shards with only 6 gears including Ras. After that I think I got another one within the 20 range but no more after that.
InjusticeMobile,3cqkha,mugiwarajill,2,Fri Jul 10 14:26:00 2015 UTC,"I got mine on my 5th gear locker, so I was really lucky. I've probably bought total of 100 gear lockers and I've gotten 4 Ra's daggers. Still no Green Arrow's Bow or Darkseid's Chestplate though. At least I have no gears fully fused, so I have pleeeenty of time to pull those remaining gears :)"
InjusticeMobile,3cqkha,Mellakka,1 point,Fri Jul 10 16:46:48 2015 UTC,"I got 2 daggers within my first 5 Gear Lockers... I was pretty excited for it.  But I've been buying a lot of Gear Lockers and I'm STILL missing Zod's sig gear, Darkseid's sig gear, and Black Adam's sig gear, so I suppose it evens out in some form. I'm still working on fusing everything up. I have maxed most of my well used gear, but I have a long way to go still."
InjusticeMobile,3cqkha,Serapius,1 point,Fri Jul 10 16:38:07 2015 UTC,"I got it, along with all my Shazam's rather quickly. >10 for the dagger I'd say. Saw it was coveted here and went for it. I'm pretty lucky on the draw."
InjusticeMobile,3cqkha,A-Wild-Cynic-Appears,1 point,Fri Jul 10 22:00:43 2015 UTC,1 pack. I literally opened my first pack after really thinking hard of i wanted to blow the 65k. Got it on first pack. Almost shit pants.
InjusticeMobile,3cqkha,OneLeggedPigeon,1 point,Sat Jul 11 20:36:56 2015 UTC,1st try. I didn't know how lucky I was until now.
InjusticeMobile,3cqkha,amak22,1 point,Sat Jul 11 21:08:15 2015 UTC,I got it by accident ony first purchase..i didnt mean to buy that pack :-P
InjusticeMobile,3cr9m4,rizzaxc,6,Fri Jul 10 03:24:42 2015 UTC,"wait patiently for it to return, and it sure will. Not in pack"
InjusticeMobile,3cr9m4,Aurora_Panagathos,3,Fri Jul 10 03:27:33 2015 UTC,"It's only in the MP challenges. Like Aurora said, wait patiently for its return."
InjusticeMobile,3cr9m4,IronTitan12345,2,Fri Jul 10 05:44:36 2015 UTC,Ra's' Dagger is the only 4-star gear available in Boosters; the rest are so far Online season-exclusive.
InjusticeMobile,3cndk8,Greidam,5,Thu Jul 9 06:35:09 2015 UTC,"Very nice tier list.  I've been running Ares, Batgirl, and AODS for my team and it's been getting me 35 second long matches. Maybe a little longer if I have to deal with KFs. But I'm definitely going to try out your team when if I get Ibis.  Thank you for this!  I know this must've taken a whole lot of work and I understand that you have a life. Very much appreciated sir."
InjusticeMobile,3cndk8,SquirtleDope,6,Thu Jul 9 07:00:00 2015 UTC,"Aw thx bb  Idk if you read the old one or not, but if you didn't and you think this one was a lot of work then you'll be dumbfounded by the other. Just hit that little link at the bottom."
InjusticeMobile,3cndk8,SquirtleDope,3,Thu Jul 9 07:05:09 2015 UTC,"I have read it before, and was amazed at how much I was reading. So much detail and helped me progress a lot.  Great work my man."
InjusticeMobile,3cndk8,Sap1l,4,Thu Jul 9 14:44:19 2015 UTC,"Want to know what's really crazy? I typed that out on mobile.  I've since migrated the list to my laptop and keep it on a word doc for easier editing and organizing, and it was 12 pages and 6k+ words I think."
InjusticeMobile,3cndk8,Smellyjuji,4,Thu Jul 9 16:33:47 2015 UTC,"Nice tier list.  Here's an idea: Do a gear tier list (is this even possible) when you're done with this.   Also, I can write up the terrible tier characters (F tier if there even is one) for you if you want. <3"
InjusticeMobile,3cndk8,eRazorVL,2,Thu Jul 9 11:11:00 2015 UTC,"Excellent write up, and fun to read as well. Looking forward to more in the future. Btw, Boss Grundy and EW Flash aren't as bad as you say they are, and here are 12 reasons why!"
InjusticeMobile,3cndk8,doodledeedoodle,3,Thu Jul 9 14:45:55 2015 UTC,"Lol yes, I went from livid to laughing real quick"
InjusticeMobile,3cndk8,freddy_bonnie_chica,2,Thu Jul 9 15:53:57 2015 UTC,"I wish I'd waited for your feedback before blowing all my shard supply on gauntlets. Oh well, at least AODS can solo with them and ra's"
InjusticeMobile,3cndk8,IronTitan12345,1 point,Fri Jul 10 08:59:15 2015 UTC,"Ares, Batgirl and Lucy really is an insane team. My Ares is only E3 and it's still one of the easiest teams to grind multiplayer with. Much thanks for showing me the light, wouldn't have thought of it on my own.  Edit: Also I'm fairly certain the cloak was made specifically for Lucy. Can't wait for next week. I'm curious to see how the actual math will work with the increases to stun chance, crit chance, and total damage. I also run Lucy with demon cloak and blade, and each S2 generally runs around 150k depending on which hit falls in between a character being KO'd and the next one coming in. Not sure if the 200% damage against stunned will actually multiply all of that by 2, or maybe that will just apply to the first hit of his S2 chain. But even if it is just the first hit, 50% more damage on crit is pretty ridiculous. I'm guessing that alone will push his S2 into the 200k range."
InjusticeMobile,3cndk8,beomagi,5,Thu Jul 9 14:51:07 2015 UTC,"I mentioned this somewhere else on this sub; everyone is like ""zomg this gonna be cray on Lucy"" but really it's kind of a waste on him. I mean, he's already basically guaranteed a kill on switch. The cloak does what? Overkill damage? His S2 doesn't even hit multiple opponents. It'd be better put on a character who can turn their strong hits into OHKOs and likes to switch a lot."
InjusticeMobile,3cndk8,TheINTL,1 point,Thu Jul 9 16:35:53 2015 UTC,Is Ares in any of the packs?
InjusticeMobile,3cndk8,TehFierceIllusion,2,Thu Jul 9 18:12:13 2015 UTC,No.
InjusticeMobile,3cndk8,kopkiwi,2,Thu Jul 9 19:53:43 2015 UTC,No. Ladder only :(
InjusticeMobile,3cndk8,kopkiwi,1 point,Thu Jul 9 19:55:32 2015 UTC,Who is Lucy?
InjusticeMobile,3cndk8,kopkiwi,1 point,Thu Jul 9 23:00:52 2015 UTC,"Luchador Bane. I have a habit of pet naming my favorite cards. I've recently added AOPain (bane) too, so that's what that means if you see it on the next list."
InjusticeMobile,3cndk8,Metabeemeta,0,Thu Jul 9 23:35:14 2015 UTC,"On your last tier list you mentioned that the red sons were just plain bad now, but I have to disagree. While yes with grundy the team is underwhelming but RSWW, RSSupes, and RSGL is a really fucking solid team. 75% basic damage, 45% power gen, 20 less special damage taken, immune to stun, AND crit."
