InjusticeMobile,3aj6a0,ImJustATeen,7,Sat Jun 20 18:34:03 2015 UTC,"But ""Heal Self on Special 2"" effects don't stack -- having more than one is of little benefit. Granted, the increased Health from the additional gears stacks, and so the one heal effect you do get is bigger because it's healing a percentage of a higher Health, but that's going to be minimal.  It's a fun idea as a way to make use of cards that aren't normally considered go-to characters, but I'd change up Cyborg's gears slightly just for a little added advantage. For instance, just swapping one of the three for the Venom Injection System would give you the same health boost, so there'd be no difference on Sp2 heal, but would also give the option for the same heal on Sp1 just in case it was ever necessary. Or swap two of them for the Khandaq Royal Garb and the Carbonfiber Mask. That which give you a double chance to crit-hit on his Sp1; you might only use it ever rarely, if it all, but you may as well give yourself that option and chance since you'd still have the Sp2 heal with no difference anyway.  Personally, I'd probably sacrifice the Health boost on one of his slots and give him the Demonic Cloak instead instead -- power gen to get to that Sp2 faster, and then crit-chance on Sp2 which will usually kick in on at least one hit of the multi-hit Touchdown.  Again, it's a decent team that's a good break from the norm, I just think it could be optimized a little more."
InjusticeMobile,3aj6a0,lahatiel,1 point,Sat Jun 20 19:16:05 2015 UTC,"I agree with /u/lahatiel. It's a good team, by the lack of diversity in Cyborg's gearing doesn't give it it's full potential. If you were to change it up to something like Venom Injection System, Cybernetic Exoskeleton and either Nanocarbon Mask, Khandaq Royal Garb or even Silicon Carbide Batsuit would give you the same effect as your current lineup plus some powerful effects on your S1, should you choose to use it. Even Cyborg's sig gear gives him an effect on S1, so you would be healing an impressive amount of health with a crit and power drain chance, making it much more effective than your original team. Another good option is to put some basic attack boosts like Powered Escrima Sticks to just give Cyborg a little more oomph. If not you can also add Demonic Cloak for some crit chance on Touch Down,Ettinger you use it more often and making it more powerful. Other than that it's a good team with a good idea, just not at its full potential."
InjusticeMobile,3aj6a0,IronTitan12345,1 point,Sat Jun 20 19:39:22 2015 UTC,Interesting team. I don't have any of those characters though.
InjusticeMobile,3aj6a0,shadyone33,1 point,Sun Jun 21 00:12:59 2015 UTC,I love how Cyborg can self heal when he's tagged out. But I don't like his SP1
InjusticeMobile,3ahwd0,CiobySpartanu,2,Sat Jun 20 09:37:05 2015 UTC,It was a generic banner to remind new players about completing current challenges. It was not meant for those two specifically since those challenges have already run.   You will have to wait till they both get added to the challenge pack in the next update.
InjusticeMobile,3ahwd0,andriodleftbehind,1 point,Sat Jun 20 11:15:46 2015 UTC,Any soon now that next update? Thanx for the info anyway
InjusticeMobile,3ahjhc,Robotic_Potato,2,Sat Jun 20 06:08:59 2015 UTC,I am constantly going up against the same people. Some of it is because of revenge fights.. others I just think because they are playing with similar leveled cards and the pool at that level is a bit more limited.
InjusticeMobile,3ahjhc,Doright36,1 point,Sat Jun 20 07:05:30 2015 UTC,"No it wasn't because of similar levels. His were around level 10, mine are around level 30"
InjusticeMobile,3ahjhc,Devlyn16,1 point,Sat Jun 20 14:36:07 2015 UTC,"It isn't exactly 'level' what they mean is the figure MP uses to match teams against each other.    Foe example: highest card  [on your team  team] damage plus  highest card [on your team] health   results in a numerical figure. The server then searches for a team with that figure multiplied by 1.xx [dependant on what stage you are in a battle 2/3, 5/5, 6/7 etc] and selects a team from a plus /minus range based on the result. If there are only a small poool of teams that fall in that range then you will face the same player multiple times."
InjusticeMobile,3ahjhc,Devlyn16,1 point,Sat Jun 20 15:33:27 2015 UTC,I see. That's a fairly complex and interesting algorithm. Thanks
InjusticeMobile,3ahjhc,Doright36,1 point,Sat Jun 20 15:40:58 2015 UTC,To be clear that is just an example of what is happening server side not the actual formula they use.
InjusticeMobile,3ah04q,CaptainNeatoman,1 point,Sat Jun 20 02:29:40 2015 UTC,"It's mainly used by people who put out bronze defensive teams, to draw in easy revenge battles. These revenge battles are then fought to finish daily missions with a gold team that they sub in after.  I guess you could also use it to get revenge on people that beat you, if you're that kind of person"
InjusticeMobile,3ah04q,locomofoo,1 point,Sat Jun 20 04:12:35 2015 UTC,Oh that's an interesting idea.
InjusticeMobile,3ah04q,stuartadamson,1 point,Sat Jun 20 04:14:28 2015 UTC,"If you get an easy fight, you can get revenge multiple times for sweet sweet currency and battle points."
InjusticeMobile,3ag6hu,HankNasty_HK64,3,Fri Jun 19 21:48:37 2015 UTC,I'm like 30 packs in and still no 3 star or above gear
InjusticeMobile,3ag6hu,dhend595,2,Fri Jun 19 23:00:02 2015 UTC,"Yeah, probably."
InjusticeMobile,3ag6hu,CaptainNeatoman,2,Fri Jun 19 22:21:37 2015 UTC,"Nice pull! I think you and I might have stolen the luck from the other people replying -- I decided to open some gear lockers today for the first time in a couple months, and ended up buying 16 because I was on such a roll: out of 16 packs/48 gears, I ended up with only 15 one-star, 20 two-star, 12 three-star, and a RAG Dagger.  I've always gotten 8-10 packs at a time, any time I've bought them in the passed, and apart form one eight-pack burst that only netted a single three-star piece, I've always had good luck, getting right around the expected averages or just slightly higher -- but I'd never had a run this good before today."
InjusticeMobile,3ag6hu,lahatiel,1 point,Sat Jun 20 01:12:09 2015 UTC,"How in the hell are you getting enough money to buy 10 packs at a time. I been back playing a week after playing it originally for a few months (before online battles and gear upgrades even existed). Now i been top 5% last week and am so far top 3% now but only with bronze and silver teams, I dont have a gold team strong enough to compete as mine always loose, however im not even making enough gold to upgrade my gold players at 200k a time. How do i make 6.5 million to buy 10 packe at a time?"
InjusticeMobile,3ag6hu,garthy1982,1 point,Sun Jun 21 13:12:01 2015 UTC,"6.5 million would be enough for 100 gear lockers -- to get 10 lockers at a time only takes 650,000. And 650K is pretty damned easy (for me). On my 20-minute train rides to/from work every day, I beat BB6 three times each ride.  BB6 three times per ride is 60K per ride, twice a day is 120K per day, so that means I'm making 600K per work-week even if I never touch the game apart from when I'm on the train (but I do play outside the train rides on occasion, usually when taking the train other places but also some MP at home occasionally to make sure I rank for a prize).  As to how I get that much, I've been playing the game for nearly two full years now, so the only cards I don't yet have at EVII are the ones I just never felt like bothering with. Consequently, I have so many cards that can solo BB6 that I literally run out of play time before my cards are out of energy. In your position, all you can do is grind, grind, grind. I know it really sucks, but it's part of the game, just a plateau that everyone will reach and need to get passed. I know I had to; so will you."
InjusticeMobile,3ag6hu,lahatiel,1 point,Sun Jun 21 14:46:59 2015 UTC,My bad on the maths. Dude ty very much for the tip though thats awesome. Thank you :)
InjusticeMobile,3ag6hu,garthy1982,1 point,Sun Jun 21 22:36:13 2015 UTC,"I'm gotten about 50 packs or so, but after all crap and never being this lucky I've decided I'm done and just use my season rewards now"
InjusticeMobile,3ag6hu,DEADP00L_,1 point,Sat Jun 20 00:33:47 2015 UTC,I once got 2ra's daghers and kryptonian battlesuit
InjusticeMobile,3aew31,BBAMFCOAL,6,Fri Jun 19 15:47:40 2015 UTC,"I faced him/her too yesterday! But his/her team was ABB, Raven and Static. I managed to beat him with may AO team. Also, don't you think is highly suspicious that someone on first place, with an EVII CCBG is just at level 40?"
InjusticeMobile,3aew31,capitantelescopio,3,Fri Jun 19 17:22:01 2015 UTC,"This is actually a good point, then he is for sure a hacker... No way he could get CCBG with that many lifetime wins"
InjusticeMobile,3aew31,Perfectblood,-2,Fri Jun 19 17:25:20 2015 UTC,He!!!...everyone online is a male unless proven otherwise...
InjusticeMobile,3aew31,Perfectblood,1 point,Fri Jun 19 17:40:45 2015 UTC,Pics or it didn't happen
InjusticeMobile,3aew31,Xicoro,2,Fri Jun 19 18:06:30 2015 UTC,I just fought him too! He demolished me somehow. Wasn't concentrating maybe?
InjusticeMobile,3aew31,phoneaccount1,1 point,Fri Jun 19 18:42:54 2015 UTC,"I also believe that its more than possible that whoever this player is could possibly be a hacker. Hes at level 40 and has all that maxed out gear? None of my 4 star gear is maxed out, not even close and i've been playing for 5 months. I'm calling hacker or its just someone that has money to give away."
InjusticeMobile,3aew31,capitantelescopio,5,Fri Jun 19 15:57:43 2015 UTC,"Mostly Hacker, I mean, if there is an EVII CCBG he/she must have ended top 3 at least 3 times. Thats a lot of battle points."
InjusticeMobile,3aew31,Devlyn16,0,Fri Jun 19 16:14:16 2015 UTC,Not true. The CCBG card season has been run enough times that anyone who finished top 1%in all of them would have enough cards to max elite AND sell back a few. On top of this the top 3 get their rewards in ADDITION to the top 1% rewards. This may have changed when they upped the MP rewards a few weeks ago but was in effect prior to that.    That said it would be extremely unlikely to get her to EVII with a low battle rating
InjusticeMobile,3aew31,CaptainNeatoman,1 point,Fri Jun 19 17:23:55 2015 UTC,Probably just someone who plays offline a lot.  I've had this game forever and I hardly ever played online until recently.
InjusticeMobile,3aew31,Perfectblood,0,Fri Jun 19 17:40:27 2015 UTC,"I don't understand your reasoning behind this, when it can be perfectly explain... It could be a player who mainly plays SP and he maybe recently decided to play MP....ever think about this possibilities?"
InjusticeMobile,3aew31,capitantelescopio,1 point,Fri Jun 19 19:43:17 2015 UTC,"But you can only have an EVII CCBG if you play a a lot online. Also he/she doesn't have active support cards, another hacker signal."
InjusticeMobile,3aew31,TheWikitommy,1 point,Fri Jun 19 17:23:05 2015 UTC,"I've been fighting against him for the sixth time today and won. Also, check his offense and defense. He has higher defense battle than offense."
InjusticeMobile,3aew31,Smellyjuji,1 point,Sat Jun 20 03:02:03 2015 UTC,"I've faced this person a few times myself this season, and I had even taken a few screenshots yesterday of his wins/losses and whatnot. Didn't have a tough time winning against him/her, but I was a little curious as to how this person has managed to hold the top spot with mainly defensive wins. As of yesterday, he had 17/18 offensive wins and ~370/10000 defensive wins. He/she gets attacked every few seconds it seems, because every time I backed out and checked the screen again, a few more defensive battles popped up.  I saw a post about this player earlier today but didn't have a chance to comment. A few users seem to wonder if hacking is involved, but I honestly don't know how one could hack to generate massive amounts of defensive battles. Still is pretty suspect tho, if anyone can shed some light on this it would be greatly appreciated, because I'm stumped."
InjusticeMobile,3aew31,adamd22,1 point,Fri Jun 19 17:34:09 2015 UTC,Why have I never faced this team with 3 extremely effective gold teams? I feel like the matchmaking is really strange on this game.
InjusticeMobile,3aew31,Aurora_Panagathos,1 point,Fri Jun 19 19:47:39 2015 UTC,Silver Flash with 172 Gear score? Amusing! Can u share a bit of your gearing and strategy?
InjusticeMobile,3aew31,Aurora_Panagathos,2,Fri Jun 19 21:52:01 2015 UTC,Heres a video i posted last month on how i get by and why i use RFlash. I'm still gear grinding to make him and EWFlash better.
InjusticeMobile,3aew31,andriodleftbehind,1 point,Sat Jun 20 00:42:21 2015 UTC,Thanks. Amazing. That is exactly what I am practicing with N52 NW swipe now.
InjusticeMobile,3aew31,Aurora_Panagathos,1 point,Sat Jun 20 22:23:06 2015 UTC,I'm sure you can hack enough to figure out your own strategies.
InjusticeMobile,3aew31,NateGT86,1 point,Sun Jun 21 01:01:06 2015 UTC,i hacked once. stopped using that account. now i do not even take advantage of glitch. i think we have the same code now
InjusticeMobile,3aew31,CSLking,1 point,Sat Jun 20 11:40:34 2015 UTC,Definitely a hacker. Just battled against them. Their total battle rating is too high (18 mil) to only be level 40.  Several thousand defensive wins and only 30 something offensive? Very obvious.
InjusticeMobile,3aew31,MiguelCAT,1 point,Sat Jun 20 15:13:59 2015 UTC,"I found that the user ""donofjusti"" is a hacker yesterday, report him if you want less hackers and more legit players. Refer to my post below:  http://redd.it/3ac6t0"
InjusticeMobile,3afe8n,Magic-Man2,5,Fri Jun 19 18:06:12 2015 UTC,"We do not promote the Challenge Glitch on here. So in order to make sure you do not accidentally reset your game, make sure you do not accidentally start the game not connected to the internet.  ;)"
InjusticeMobile,3afe8n,jedispyder,1 point,Fri Jun 19 18:43:01 2015 UTC,Sorry for asking ;)
InjusticeMobile,3afe8n,Ratarang,1 point,Fri Jun 19 18:53:54 2015 UTC,"While we're on the topic of not talking about glitches, the flip glitch won't work for me anymore"
InjusticeMobile,3afe8n,jedispyder,1 point,Fri Jun 19 22:22:35 2015 UTC,"Pack glitch? Hasn't worked in months for me. It works for some devices, just not all."
InjusticeMobile,3afe8n,Masterdikkster,1 point,Fri Jun 19 22:27:05 2015 UTC,It still works for me. Kinda
InjusticeMobile,3afe8n,docloren,2,Sat Jun 20 01:19:28 2015 UTC,"Don't mess with the clock, just go into airplane mode, open the game, exit airplane mode and log into multiplayer.  Exit the game and restart and the challenge will be reset.  On android at least."
InjusticeMobile,3afe8n,Jmm060708,1 point,Fri Jun 19 18:52:59 2015 UTC,"Without meaning to, played the game without internet, game says challenge is over, went home, back on wifi, challenge reset itself."
InjusticeMobile,3afe8n,Sabermawile,1 point,Fri Jun 19 19:07:15 2015 UTC,"Turn off WiFi, go on injustice, then turn it back on, and go back to I justice."
InjusticeMobile,3afe8n,fixyyh3,0,Fri Jun 19 22:24:53 2015 UTC,"From what i found out,you can force close the app,turn the clock for how much you want,enter the game and challenge will give you credits,but not sure if it will work."
InjusticeMobile,3aevew,OhhKnows,1 point,Fri Jun 19 15:42:28 2015 UTC,"First team:   Crit gear on KJJ is amazing, especially with Harley Quinn. So gear like Blade of the War God and Powered Escrima Sticks are great, and some healing on S1 like Mutated Bone Spikes and Knife Collection work well too.  For Shazam, pick something you like about his passive. If you like the bonus +300% damage on basic attacks, you can basically go the same build as KJJ because his swipes can deal up to 17k damage. If you want to spam his S2, then Ibistick (Can be replaced with Demon Blade), Demonic Cloak, and KryptBattle Suit are really fun to massively buff that spammable S2, and Ibistick's DoT hurts like hell. For Harley, go with her sig gear and power gen. It doesn't really matter what power gen, just put some So you can spam S2.   Second Team:   Since this team doesn't have much for a tank, AOBM gets The hob. Good gear for him is Charged Disk, Venom Injection System and Lexcorp Mechsuit for a fun stun chance on S2. Again, for a this Joker character, the setup stays the same as the other Joker, except replace one crit gear with Ibistick, and it will do wonders. For AODS, a good setup is Ra's, Prometheum Longsword and Mutated Bone Spikes/Knife Collection.   I know you said to leave Ibistick it of it; but I couldn't resist. Plus,when you get it you'll know who to put it on."
InjusticeMobile,3aevew,IronTitan12345,1 point,Sat Jun 20 05:20:15 2015 UTC,"Does the Ibistick add additional DOT if the character already inflicts DOT? I'd test it out myself, but I don't have the Ibistick."
InjusticeMobile,3aevew,astrospeedyj,0,Sat Jun 20 13:11:55 2015 UTC,"What Ibistick does I'd increase both your S1 and S2 damage by 30%, add +20% power gen and whenever you use a special the enemy is lit on fire and takes 1% of their max health every second for 10 seconds. It applies to every special you use and will be applied multiple times when you use multiple specials really fast, doing insane amounts of damage. It's also affects the next person if your special knocks out an opponent so the DOT is never wasted.  TLDR: Yes. The DOT is applied to every special no matter what."
InjusticeMobile,3aevew,IronTitan12345,0,Sat Jun 20 14:42:35 2015 UTC,"Your Arkham team lack some bunkyness, so I would recommend put some blocking gear on AOB.   I think the best advice I can give is go find a pro team u lose to easily and try to find out how it is geared."
InjusticeMobile,3aetbq,Digit66,5,Fri Jun 19 15:25:00 2015 UTC,nope
InjusticeMobile,3aetbq,Gawdzillers,2,Fri Jun 19 15:27:55 2015 UTC,"More stuff is expected soon; they're mostly testing the waters to see how Android users respond to it and have a chance to accumulate more Alliance Credits before introducing more stuff to purchase.  Personally, I'd like to see excess challenge credits get turned to alliance credits (probably at a 10 to 1 exchange) when challenges expire since getting them through daily bonus takes forever."
InjusticeMobile,3aetbq,cuteinsanity,3,Fri Jun 19 20:48:40 2015 UTC,More stuff is expected soon   Source?
InjusticeMobile,3aetbq,xxpashuxx,1 point,Fri Jun 19 21:09:26 2015 UTC,It was in the announcement that accompanied the initial release of Alliance Credits.
InjusticeMobile,3ae1wb,Dahvidmh,8,Fri Jun 19 10:43:46 2015 UTC,"He's fast and incredibly efficient with all-around great combat mechanics. His 5-hit tap combo and 4-hit swipe combo mean greater basic damage and faster power generation. His S1 is an effective power drainer (around 1.5 bars), which is super useful in this game, and his S2 is like a 10-hit that can inflict multiple enemies and deal great damage. He can just go on and on with his basic attack and power drainer, or tag in to dish out a dangerous S2.  His signature gear boosts his basic attack's damage, crit, and unblockable chance, which you can see goes very well with his design. If you give him Ra's scimitar too, his tap combo's 2-hit ender drains half a bar of energy (on top of giving him an initial one bar that he can bank in case of emergency.)  And did I say he's fast? He can get right back up after delivering a combo or a special. Gold Nightwing is always a pleasure to use. In fact I prefer playing with him much more the 'OP' characters like Raven or Shazam. I think that's also why he's got so much love. Just pure great gameplay instead of overpowered nonsense."
InjusticeMobile,3ae1wb,xxxamazexxx,6,Fri Jun 19 12:44:46 2015 UTC,"He can get right back up after delivering a combo     He has a bad pause after his light/hard combos. Hard especially. He used to be able to use an s1 at the end of it instead of just standing there, but the new change prevents that.  The pause is so bad on his swipe, that even if he connects, and hits the enemy, they recover faster than he can.  It's better to use his tap attack (delay isn't as bad), or use his swipe before tagging out. His tap attack is fast fast fast - even if he is  blocked, he can react faster than some characters and get in his hits before the defender hits him.  His 2 hit ender is excellent for ras. His 5 hit attack means more power, which means more special attack damage, and just more damage overall."
InjusticeMobile,3ae1wb,beomagi,2,Fri Jun 19 13:56:45 2015 UTC,"Great summary of NW, but I'll have to correct you with regards to that 10-hit S2. Unfortunately, it's not that amazing (if only it was), it's only a 6-hitter.  Doing combos with the S2 mainly relies on you finishing off an opponent with the first 3 hits, then smacking the next one to tag in with 2 or 1 hit(s), depending on the circumstance."
InjusticeMobile,3ae1wb,locomofoo,1 point,Fri Jun 19 14:45:29 2015 UTC,"Mental note, try and get New 52 Nightwing."
InjusticeMobile,3ae1wb,leedguitars,4,Fri Jun 19 18:03:15 2015 UTC,Personally I prefer Regime Nightwing and his 50% resistance to basic attacks.
InjusticeMobile,3ae1wb,HumanChicken,2,Fri Jun 19 13:37:17 2015 UTC,i agree. Regime NW's passive is so much more useful than new 52 NW's. And i think his sp2 just looks cooler.
InjusticeMobile,3ae1wb,gondi,3,Fri Jun 19 14:21:39 2015 UTC,2 hit combo ender.  Fast attack  Power drain S1
InjusticeMobile,3ae1wb,Aurora_Panagathos,4,Fri Jun 19 10:50:31 2015 UTC,gear
InjusticeMobile,3ae1wb,GoodLittleMine,1 point,Fri Jun 19 11:32:17 2015 UTC,"He's strong because of his attack mechanic. It's not flawless - there's pauses but you can work with it.  His swipe hits 4 times and tap 5 times. That's power and damage. More power = more specials. More specials = more healing!  So now you have someone that hits more often, drains opponents of power AND heals often. Obviously gear considerations come into play. It's common to see him with bone spikes/knife collection, his bo staff and ra's.  Use the swipe before you tag out. His tap attack is one of the fastest in the game. You can start your attack after some opponents and hit them first.  Being one of few power drainers, he can keep teams from using their specials. I generally use him with Lucy Bane tagging between the two. They with fudge you up. FUDGE YOU UP!!"
InjusticeMobile,3ae1wb,beomagi,-2,Fri Jun 19 14:04:52 2015 UTC,"Personally, i don't like him, I have use him with the right gear and he is ok. He is just..... Weird, he had like a weird pause in between his tap and swipe attack."
InjusticeMobile,3aelds,kasper11,1 point,Fri Jun 19 14:18:39 2015 UTC,"RKF passive affects life drain, waiting for confirmation."
InjusticeMobile,3adxmq,sathyaguru,5,Fri Jun 19 09:38:36 2015 UTC,Looks like grinding time...
InjusticeMobile,3adxmq,cysghost,2,Fri Jun 19 09:59:37 2015 UTC,Already started!
InjusticeMobile,3adxmq,devd02,3,Fri Jun 19 12:03:40 2015 UTC,Its Grinding Time.. :D
InjusticeMobile,3adxmq,Masterdikkster,1 point,Fri Jun 19 10:45:52 2015 UTC,Saving up credits!
InjusticeMobile,3adxmq,kasper11,3,Fri Jun 19 12:07:19 2015 UTC,Pretty disappointed actually.  Was hoping for a double credit weekend for Father's Day.  They did one for Mother's Day. How about some equality?
InjusticeMobile,3adxmq,CallousCao,16,Fri Jun 19 14:15:44 2015 UTC,One might say it's an... Injustice?  I'll show myself out.
InjusticeMobile,3adxmq,BamAlegre,2,Fri Jun 19 14:45:19 2015 UTC,I've been grinding for the Most Wanted Pack and then this happened. So much win.
InjusticeMobile,3adxmq,BamAlegre,3,Fri Jun 19 10:51:00 2015 UTC,I think this sale is much worth than betting on the MW pack for Batman prime and AniHQ etc...who we can obtain in store easily!
InjusticeMobile,3adxmq,lxaibz832,1 point,Fri Jun 19 12:05:00 2015 UTC,"right on! btw, may I know what characters are usually in the Most Wanted pack?"
InjusticeMobile,3adxmq,Stewthulhu,1 point,Fri Jun 19 12:25:02 2015 UTC,"That I know for sure were in there (from 3 I bought recently). Killing Joke Joker, AOB, Martian Manhunter, Raven Prime, Shazam & (for some stupid reason b/c he kinda sucks post-nerf and is far from what I'd consider to be ""Most Wanted"" given the nerf) Regime Superman."
InjusticeMobile,3adxmq,shadyone33,2,Fri Jun 19 18:31:47 2015 UTC,"Oh choices, grind for AO pack or grind for the Gauntlets of Insurmountable OP"
InjusticeMobile,3adxmq,Fishtodaface,1 point,Fri Jun 19 13:18:41 2015 UTC,Dang. Just bought the two final packs I needed earlier this week. Shoot!
InjusticeMobile,3adxmq,Sabermawile,1 point,Fri Jun 19 14:16:34 2015 UTC,"Does anyone remember the cost of the pack? I think it was 750k, which would make it 600k with the discount.  Am I remembering correctly?"
InjusticeMobile,3adxmq,Hiendaoduc,3,Fri Jun 19 15:03:28 2015 UTC,"It's originally 750k, yes."
InjusticeMobile,3adxmq,ArrowBat,1 point,Fri Jun 19 16:17:16 2015 UTC,"O....kay, time to grind 5mil then."
InjusticeMobile,3adxmq,NickObaama,1 point,Fri Jun 19 16:33:47 2015 UTC,how do you guys get so many credits? I've only been playing for a month but I got 3 gold elite 1s lol
InjusticeMobile,3abfo5,CiobySpartanu,9,Thu Jun 18 19:06:56 2015 UTC,"Yea, been there.   ""Oh, a single hit that's blocked will kill you?  Lemme grab Harley for her S2 bomb, JUUUUUUUUUUST to make sure..."""
InjusticeMobile,3abfo5,Dark_Knight7096,6,Thu Jun 18 19:16:02 2015 UTC,"Yeah well this ia even more hardcore because harley deals 35k with the bomb, doomsday does about 70k and i also had full upgraded ibistick, but i gotta say it's more stylish with hq"
InjusticeMobile,3abfo5,Dark_Knight7096,8,Thu Jun 18 19:24:41 2015 UTC,They way I have her setup she does 60K :-D
InjusticeMobile,3abfo5,jedispyder,5,Thu Jun 18 19:26:33 2015 UTC,Care to share how you beef her up?
