InjusticeMobile,3bhi5f,IronTitan12345,1 point,Tue Jun 30 17:59:55 2015 UTC,"I think Batman (Prime),  Superman (Prime) and Nightwing (52) are a decent Single Player team.  Leveled up to E5, E6, or E7 they will carry you to the 2nd main grinding level (32) and maybe to the main grinding level (B6).  Levels above B6 are hard for most ""good"" teams anyhow.  Then you can work on decent teams for challenges and MP.  For the first few challenges, your goal will be to beat the 1st level of the challenge to unlock the character.  Your goal will not be to beat nightmare level and get all 3 of the character (if you can, but don't expect it until your 3rd or 4th challenge).  My default Bronze/Silver teams are Flash, Nightwing and Lex (Bronze), Green Lantern (Silver), but that is a preference thing.  So, I would level up your Gold team to E5+ (whatever is needed to get to level 32.  Grind there and save.  When you're bored buildup your Bronze/Silver teams (or gear packs), but not too much.  Just enough to beat the Challenge 1st level.  Between the challenges and the Day 10 bonuses you'll get a ton of Bronze and Silver people eventually (not fast, but eventually).    Eventually, you can binge (E7) on a Red Son pack which will let you grind B6, dominate Challenges up to Nightmare, and get to the 5% in MP.  .  A few notes:   The secret to Nightwing is use the light jab to fill up his 1 power slot, and then power drain the other player.  Repeat, Repeat, and then repeat some more.  Nightwing isn't there for this 3 move (although if the opportunity presents itself). You need 5 good Gold characters to efficiently run 32/B6 (1 per battle) or else you end up waiting a lot to recharge your energy.  B6 is also very good to leveling people up to level 46 (pair a new guy with your dominating Gold guy) B6's 1st battle is a mirror image battle (same people as your team).  You can make this easier by using 1 Gold guy and 2 Bronze people. When starting out with gears, it is worth it to evolve a 2 star gear first (e.g., power gloves,  Mark of the Tiger).  It is cheaper to do that and almost as effective.  I wouldn't evolve all your 2 stars gear, but doing so for 1 or 2 gives you some decent gear at a low cost. Some say the Femme Fatale pack is almost as good as the Red Son.  I haven't tried them.  What you don't want is to have an E4 team of them.  Try to buy 8 packs at once."
InjusticeMobile,3bhi5f,IronTitan12345,1 point,Wed Jul 1 14:38:43 2015 UTC,"What do you mean ""completed his challenge?"""
InjusticeMobile,3bhi5f,IronTitan12345,1 point,Tue Jun 30 17:59:28 2015 UTC,"When his challenge was out, like the Arkham Origins Bane challenge currently. If you complete the challenge unlocks the ability to promote him with credits. That's the only way to do so. If you miss it you must promote all of the challenge characters through the packs they're available in."
InjusticeMobile,3bhi5f,lahatiel,1 point,Tue Jun 30 18:17:56 2015 UTC,so is it more cost efficient if I just try to E7 Batman or buy the 75% gold packs?
InjusticeMobile,3bhi5f,HITNRUNXX,1 point,Tue Jun 30 18:38:20 2015 UTC,This depends. How large is your roster?
InjusticeMobile,3bhi5f,Sabermawile,1 point,Tue Jun 30 18:49:11 2015 UTC,25 characters
InjusticeMobile,3bhi5f,2007rnc,1 point,Tue Jun 30 18:52:42 2015 UTC,"Actually, one second thought that's a bit irrelevant. Get 75k packs, since I'm assuming your highest card is EI. This will either expand your roster or help promote your current cards for a low price. It's a cost effective way to get a variety of farming characters and eventually unlock BB6. Then you can be free to spend those sweet, sweet BB6 credits on whatever you please."
InjusticeMobile,3bgx1e,BaconMagician,5,Mon Jun 29 03:06:49 2015 UTC,"No, same as characters."
InjusticeMobile,3bgx1e,FetusFeedingFetish,2,Mon Jun 29 03:09:20 2015 UTC,No. Any repeated gear just shatter it and get some crystals.
InjusticeMobile,3bgu40,Tyler0314,8,Mon Jun 29 02:38:33 2015 UTC,"Last season was super intense, because it started near the end of a challenge, when everyone had already won AOJ.  Plus, it was brand new gear.  But this season started concurrently with the AOBane challenge, so that drew some attention away.  Plus, the Batmobile's been offered before. So people who already have it are probably laying off.  As for me, I'm just wiped from last season.  I'm checking in a couple times a day to make sure I'm in the top 1%, and that's all I have the energy for."
InjusticeMobile,3bgu40,CaptainNeatoman,1 point,Mon Jun 29 03:04:00 2015 UTC,"That's me exactly, I'm focusing on eliting my AOBane and hitting as close to 50 by next season as possible."
InjusticeMobile,3bgu40,2007rnc,1 point,Mon Jun 29 03:14:25 2015 UTC,Same. Free cash and shards for me yo
InjusticeMobile,3bgu40,CruxOfArgon,1 point,Mon Jun 29 02:43:22 2015 UTC,Right now I'm a bit over 300k and somewhere deep in the 3% bracket. Doubt I will push hard enough to get into the 2% or higher but I am sure I will play enough rounds the next two days to keep with that. If I am going to do some grinding I will do it for coin so I can get another Arkham pack.
InjusticeMobile,3bgu40,Doright36,1 point,Mon Jun 29 05:55:00 2015 UTC,"I played a little bit the first couple of days and go to 2%, I think. but haven't checked back since Thursday - I'd imagine defense would be enough to have kept me in the top 5%... I'll check later tonight, not too worried about it this season."
InjusticeMobile,3bgu40,CoalhouseWalker,1 point,Mon Jun 29 17:10:29 2015 UTC,"Good for noobs. But it just does feel boring, because nobody wants to the batmobile."
InjusticeMobile,3bgu40,Sabermawile,1 point,Mon Jun 29 17:14:53 2015 UTC,"Didn't play for 2 days, still sitting in the top 1%. I want those shards."
InjusticeMobile,3bgu40,kopkiwi,1 point,Mon Jun 29 20:29:39 2015 UTC,"Havn't tried since cheaters/hackers (donofjusti, jerb., and soulcrush2 was really suspicious since 2 seasons ago, his characters were spamming sp2 with empty bars) are rank 1,2,3. I was rank 2 two and three seasons ago, probably won't get rank 1 with these dishonest players, but I already got the icons and backgrounds I want."
InjusticeMobile,3bgu40,CSLking,0,Mon Jun 29 02:50:17 2015 UTC,Lol cry cry cry about hackers.
InjusticeMobile,3bgu40,andriodleftbehind,-1,Wed Jul 1 03:08:23 2015 UTC,"yeah, I receive an unprecedented defense match with my EIV team."
InjusticeMobile,3bewpn,zulfanism,10,Sun Jun 28 16:30:20 2015 UTC,Self confidence.
InjusticeMobile,3bewpn,Tyler0314,2,Sun Jun 28 19:24:41 2015 UTC,"I think not, idk why they even have that feature."
InjusticeMobile,3bewpn,zaap005,2,Sun Jun 28 17:32:22 2015 UTC,"Petty revenge, easy points if you play defense with a weak team."
InjusticeMobile,3bewpn,CruxOfArgon,1 point,Sun Jun 28 23:23:57 2015 UTC,"Having established that unless you have a maxed out gold group with 200+ gear you cant use gold to earn MP points, i leave my silver team in Defence overnight. Then my gold guys to do easy revenges the next morning which earn semi decent points and tend to be over in 30 seconds. Sadly i have 3 gold lvl 50 EVII and its impossible to even complete a 3 match fight with them as I have no gear and they are old characters so everyone they match agains has almost double attack and Hp so this is what I use them for. But no nothing special at all just easy points."
InjusticeMobile,3bewpn,garthy1982,3,Mon Jun 29 00:31:44 2015 UTC,What? What are the 3 EVII u have?
InjusticeMobile,3bewpn,Aurora_Panagathos,1 point,Mon Jun 29 02:03:49 2015 UTC,"Using Bane, superman and Regime Black Adam. I cannot eve dream of competing for example the last 3 match fight i did  the third match was against arrow green arrow, raven and krypto lex luther My HP total 172k My damage total 71k My gear total = 105 Their HP 210k Their damage total 106k Their gear total = 827  And thats not even close to the worst I've faced, given up trying to do gold 3 matches because of that crap i have no chance often i cant even get past the first fight , so i just do 5 or 7s with my silver n bronze teams."
InjusticeMobile,3bewpn,garthy1982,1 point,Mon Jun 29 17:38:50 2015 UTC,"yeah, supes and bane is lame."
InjusticeMobile,3bewpn,Aurora_Panagathos,1 point,Mon Jun 29 23:40:40 2015 UTC,play the challenges get the new characters from there they all good af. like if you got kf max her. shes amazing youll start keking in no time then once u have her and a few other better ppl depending on who ur 3 golds are play the seasons and get gear
InjusticeMobile,3bewpn,icouldgetofftothat,1 point,Mon Jun 29 05:15:38 2015 UTC,"Yeah thats what im doing although again my golds are not good enough to do nightmare last challenge. So just gotta spend time n get better ones I guess. im acheiving top 1% this season jaut using my silvers n bronzes, in the last season i got to 3%. So with low cards it possible i just have to do a lot more work than others having gold cards."
InjusticeMobile,3bg5gs,LegoGreenLantern,3,Sun Jun 28 22:51:45 2015 UTC,AOBane is a huge boon to arkham teams. He also makes AOBatman's super viable in conjunction with his batmobile maxed. I hit one guy for 120k and the other two for 30k. It's fun and devastating. Without an arkham team? He's outshines by other better cards.
InjusticeMobile,3bg5gs,2007rnc,1 point,Mon Jun 29 02:25:01 2015 UTC,"Waiting to get him to L50 before using him in MP, but at E7 L40 his S2 is criting for around 192K so far. I can see him becoming a great late match revenge killer on Arkham teams, either enabling AOBats to get off a super, Harley to get off a heal or AODS getting off Point Blank/Identity Crisis. To be honest though I'm just glad we've now got a Bane who's actually viable."
InjusticeMobile,3bg5gs,MaxInnit,1 point,Mon Jun 29 09:43:57 2015 UTC,Without any other arkham characters...he's not near as good. His S2 pretty much wrecks regardless though. Kinda want to see what he could do with the cloak and the stun/tag in damage bonus on his S2.
InjusticeMobile,3bg5gs,BobTaco,1 point,Wed Jul 1 06:30:25 2015 UTC,"It would seem that his true colors come through on an Arkham team. For 1.5 million you could get 2 Arkham packs and receive DS, Bat, and HQ."
InjusticeMobile,3bg5gs,Dethstrke,0,Sun Jun 28 23:24:28 2015 UTC,"Upgrade KF, nuff said."
InjusticeMobile,3bg5gs,JohnHavers,1 point,Mon Jun 29 00:25:10 2015 UTC,never got her because of the stupid android issue. I have RKF maxed out though.
InjusticeMobile,3be3dx,CSLking,9,Sun Jun 28 10:26:34 2015 UTC,You can open a case to get them banned here:  http://support.wbgames.com/ics/support/ticketnewwizard.asp?style=classic
InjusticeMobile,3be3dx,kikesaltos,8,Sun Jun 28 11:30:21 2015 UTC,"Let's ignore that toxic clown raging in my post -.- Also, I did report both of those cheaters/hackers as well as that low life spammer. Anywho, I post these threads so that more people can report them (even though it might not get them banned) so mp on ios doesn't end up like on android."
InjusticeMobile,3be3dx,2007rnc,5,Sun Jun 28 12:58:42 2015 UTC,"Thank you, both are reported by me at least :P and that dudes down voted. Cursing at people like that is disrespectful and goes against everything my favorite heroes stand for, would Superman or Kyle Rayner ever just get randomly pissed and start screaming and cursing? Well Frank Miller's All Star Batman might. But I'm pretty sure that's just a homeless dude in a batman costume. Ok, I'm done ranting :P"
InjusticeMobile,3be3dx,andriodleftbehind,-18,Sun Jun 28 13:29:57 2015 UTC,So you don't think wb knows the guy who has been in first the last two seasons is a hacker?   Of course they do. They just don't care and unless you are in the top ten neither should you. Stop being a pussy.   Get the sand out of ur clit and move along
InjusticeMobile,3be3dx,Glsector1988,1 point,Sun Jun 28 13:24:10 2015 UTC,"You, I like you. we should be friends."
InjusticeMobile,3be3dx,r0xxon,3,Wed Jul 1 02:26:04 2015 UTC,"At least ios hackers are more covert.  Meanwhile on Android, the last two top event winners is lordhacker"
InjusticeMobile,3be3dx,2007rnc,2,Sun Jun 28 16:19:13 2015 UTC,"Honestly, I prefer them at least being honest about it xD"
InjusticeMobile,3be3dx,Perfectblood,4,Sun Jun 28 17:51:07 2015 UTC,"Does reddit suspend or ban users like this ""andriodleftbehind"" guy? Seriously, the guy is beyond toxic over a topic against hackers/cheaters, cheap entertainment to me, like an ugly stripper begging for attention."
InjusticeMobile,3be3dx,Smellyjuji,2,Sun Jun 28 14:02:16 2015 UTC,"""Andriodleftbehind"" is probably one of those top hackers, this is why he is talking this subject so personal..."
InjusticeMobile,3be3dx,Mailcarrier,1 point,Sun Jun 28 18:45:41 2015 UTC,"No use banning this guy, he'll come back with a new alt. account like he has in the past. Better to downvote and not even reply to his comments."
InjusticeMobile,3be3dx,Mailcarrier,2,Sun Jun 28 15:57:01 2015 UTC,And what would that reason be? Oh and congrats on forming a sentence with a swear. I know that must be hard for you
InjusticeMobile,3be3dx,Mailcarrier,3,Sun Jun 28 14:17:51 2015 UTC,"Thanks for pointing out my mistake, friend. Good to know I have people here who care about me. And actually I did mean to use ""reason"" as in do you have any particular reason why you say I'm a dick? As always, I'd love to hear back from you and patient wait by my screen to read your response.  Love Always,  Mailcarrier"
InjusticeMobile,3be3dx,Sabermawile,2,Sun Jun 28 15:13:38 2015 UTC,"Yes and yes. Thanks for grammatically correcting my post, but you still have yet to answer the question"
InjusticeMobile,3be3dx,Aurora_Panagathos,1 point,Sun Jun 28 15:19:52 2015 UTC,And you're an insult to the human race with no life. Seriously. Get a job. What the fuck satisfies you in having to tell online forums for entertainment?
InjusticeMobile,3be3dx,Mailcarrier,1 point,Sun Jun 28 20:14:35 2015 UTC,"the game is already injustice, duh doy. any who, u seem so passionate about it that i reported them both."
InjusticeMobile,3bfkpr,Tumorzxd,-3,Sun Jun 28 19:58:01 2015 UTC,Bump
InjusticeMobile,3bfkpr,Fishtodaface,0,Sun Jun 28 22:53:41 2015 UTC,"I would build tanky on RSWW, because i think she does less damage than 600 WW, so maybe the sword and shield, maybe lex's gear, and an s1, or s2 heal, so venom harness, or kryptonain battle suit.  Id go power gen and the revolvers on AHQ, so shazam's cloak, or the Arcane wand, Depends on what you want for the seconday effect, this will give you the maximum amount of specials on her which is the best part of harley. On 600 WW id probably, depending on what gear you have, I'd go Ibistick, kryptonian rifle, and then you could do a basic attack gear, or something else. Knife collection, escrima sticks, something like that. Hope that helps, if you have other ideas just let me know."
InjusticeMobile,3beqxw,DEADP00L_,2,Sun Jun 28 15:35:24 2015 UTC,"He's a great juggler, does a decent amount of basic damage and IMO, he's better for quick kills than Prime Aquaman.  His S2 is a rapid series of strikes with his trident, whereas PA calls in a soldier to fight for him.  The soldier thing is cool, but he may or may not do much damage, and it kind of extends the length of the match. So Regime's s2 is better if you want to end things quick without getting fancy.  And his passive is good.  Not great, but good."
InjusticeMobile,3beqxw,CaptainNeatoman,1 point,Sun Jun 28 15:53:13 2015 UTC,"he is a great combatant in AI hand if u look for a online defense team. otherwise he is ok, not too bad"
InjusticeMobile,3beqxw,Aurora_Panagathos,1 point,Sun Jun 28 15:57:19 2015 UTC,"Aquaman is the one I find it very hard to juggle, him and Batgirl Cain. They're just lightning fast."
InjusticeMobile,3beqxw,Hiendaoduc,2,Sun Jun 28 15:59:47 2015 UTC,"Batgirl Cain is one of my fav characters, so if he's anything close I'll be happy"
InjusticeMobile,3beqxw,IronTitan12345,1 point,Sun Jun 28 17:02:55 2015 UTC,"His S1, paired with Ibistick and BRCW hurts like hell. He gets increased damage from the bleed, which is nice. Unfortunately, his passive isn't that noticeable, since only Shazam really uses a super, but overall he's a fun character."
InjusticeMobile,3beqxw,Sabermawile,1 point,Sun Jun 28 18:35:51 2015 UTC,Better than the other one.
InjusticeMobile,3beq5s,Magic-Man2,5,Sun Jun 28 15:27:22 2015 UTC,"As long as you give him ra's and a heal on S1, hes pretty adaptable to most setups"
InjusticeMobile,3beq5s,Mailcarrier,1 point,Sun Jun 28 20:10:10 2015 UTC,"I like to use Animated Harley and Batgirl, to really up his power generation. His power drain S1 is pretty helpful, and Harley's damage boost makes the matches go by quicker."
InjusticeMobile,3beq5s,astrospeedyj,1 point,Sun Jun 28 21:47:22 2015 UTC,"I'd replace Batgirl with Killer frost prime, her passive as well and special one really help the opponent starve for power."
InjusticeMobile,3beq5s,Joe787,1 point,Sun Jun 28 16:31:17 2015 UTC,"I have seen him often paired with AOB and Shazam. So with Ra's, you have two characters that start with power while you can tackle the opponent if they have  an AOB."
InjusticeMobile,3beq5s,thesaruaon,0,Sun Jun 28 19:49:43 2015 UTC,"Nightwing, lex luthor, martian manhunter"
InjusticeMobile,3beq5s,Aurora_Panagathos,-1,Sun Jun 28 23:19:46 2015 UTC,"NW,RGL,AHQ  NW,LB,HG NW,AGA,MM"
InjusticeMobile,3bfab2,mrjacksparrow,1 point,Sun Jun 28 18:30:33 2015 UTC,uninstall-reinstall maybe?
InjusticeMobile,3bfab2,Aurora_Panagathos,1 point,Sun Jun 28 23:53:50 2015 UTC,I tried several times. No dice.
InjusticeMobile,3bbzs9,Greidam,10,Sat Jun 27 19:45:01 2015 UTC,42k heavy swipe   Dear merciful jesus
InjusticeMobile,3bbzs9,CruxOfArgon,5,Sat Jun 27 20:08:21 2015 UTC,With RSS it's ~45k
InjusticeMobile,3bbzs9,CruxOfArgon,3,Sat Jun 27 20:10:14 2015 UTC,O_O   Can Ares get that high?
InjusticeMobile,3bbzs9,CruxOfArgon,14,Sat Jun 27 20:16:30 2015 UTC,Not even close. Puny god.
InjusticeMobile,3bbzs9,andriodleftbehind,2,Sat Jun 27 20:21:17 2015 UTC,What if he was backed up by AniHQ and Prime Batsy?
InjusticeMobile,3bbzs9,andriodleftbehind,3,Sat Jun 27 20:41:52 2015 UTC,Still not even close. I can run a test later when I have energy again but I promise you it's not even comparable. After AOJ is KJJ and after that is AODS
InjusticeMobile,3bbzs9,IronTitan12345,0,Sat Jun 27 21:04:41 2015 UTC,Without the damage boost it would Be:  Aoj Rsds Kjj Aods
InjusticeMobile,3bbzs9,IronTitan12345,2,Sat Jun 27 22:04:05 2015 UTC,I always assume Harley's boost because it's so easy and free and I just about never play a serious team without her
InjusticeMobile,3bbzs9,Aurora_Panagathos,-1,Sat Jun 27 22:06:31 2015 UTC,Ok....not sure how that changes my statement.
InjusticeMobile,3bbzs9,VoidTorcher,1 point,Sat Jun 27 22:15:14 2015 UTC,Oh sorry thought you were correcting me so I just explained why I didn't have RSDS up there. My B.
InjusticeMobile,3bbzs9,jedispyder,2,Sat Jun 27 22:16:03 2015 UTC,"Harley's dynamite to blow past that silly 20% window.    You don't even need that. Unless Raven runs pure health gear, AOJ can easily smash through that threshold with a S1 without any buffs from Harley."
InjusticeMobile,3bbzs9,jedispyder,2,Sat Jun 27 21:59:02 2015 UTC,"Ya, it's just slightly harder so I prefer dynamite. If Raven blocks Bang! then it does about 21k which gives you a smaller window than dynamite's 40+k"
InjusticeMobile,3bbzs9,rizzaxc,1 point,Sat Jun 27 22:02:55 2015 UTC,"Yeah, I'm just used to getting unblockable Bangs. It's a bit touchy, but extremely satisfying when done right. But yeah, Harley's S2 is much easier."
InjusticeMobile,3bbzs9,rizzaxc,2,Sat Jun 27 23:23:54 2015 UTC,Can Anyone elaborate how AOJ get 42k swipe attack? I do not play crit-basic gear so I don't know anything about this
InjusticeMobile,3bbzs9,Serperior10101,7,Sun Jun 28 01:10:48 2015 UTC,Base damage: 1150  All support enhancements: 1150 x 1.35 = 1552.5  E7 level 50: 1552.5 x 29 = 45022.5  Heavy basic attack: 45022.5 x 0.04 = 1800.9  Gear + Harley (passive and s2): 1800.9 x (1 + 70% x 3 + 40% + 50%) = 7203.6  Crit: 7203.6 x 1.5 = 10805.4  4 hit heavy combo: 10805.4 x 4 = 43221.6 (I don't think he actually means AOJ gets that much per hit)
InjusticeMobile,3bd413,PyroToniks,3,Sun Jun 28 02:11:56 2015 UTC,"I have. I can say that Bane's passive is a really good boost if you're getting a beat down while Batman's passive can make for an immediate K.O, Deathstroke doesn't provide too much unless used correctly. Unfortunately, I didn't get to do the AO Joker challenge so I can't tell you how he could be beneficial to a match-up with other AO teammates. All in all, it's a pretty good team."
InjusticeMobile,3bd413,BaconMagician,5,Sun Jun 28 03:39:51 2015 UTC,"AOJ is used at his maximum potential with 2 other Arkham characters. The increased DOT is really helpful for those heavies. He's more of a hit and run though, considering his health."
InjusticeMobile,3bd413,byBumi,3,Sun Jun 28 06:04:24 2015 UTC,AOJ is actually better with 1 arkham team mate and BRCW
InjusticeMobile,3bd413,UriskLyErg,1 point,Sun Jun 28 10:39:45 2015 UTC,Does her passive now work?
InjusticeMobile,3bd413,--quoth-the-raven--,1 point,Sun Jun 28 15:13:12 2015 UTC,"yup, they fixed it."
InjusticeMobile,3bd413,dc_fanboyforever,1 point,Sun Jun 28 21:00:59 2015 UTC,Thanks for the feedback y'all! Makes me wish I did the AOJ challenge....
InjusticeMobile,3bd413,BaconMagician,1 point,Sun Jun 28 22:52:00 2015 UTC,It's worked since the latest update
InjusticeMobile,3bd413,UriskLyErg,1 point,Tue Jun 30 01:02:00 2015 UTC,Honestly I pretend Deathstroke doesn't have a passive and just put power gen gear on him and spam his beautiful S2 that hits like 7 times.
InjusticeMobile,3bd413,2007rnc,1 point,Sun Jun 28 17:55:13 2015 UTC,"I myself like to run AOBats, AOJ, and ArHQ. At the moment I'm trying to make a second team with AODS, AOBane, and an undecided third. AODS is the main damage dealer, while Bane takes hits and/or does some heavy hitting. DS and Bane compliment each other pretty well due to DS having a crazy S1, and Bane being able to supply another S1 to him when his health reaches 50 percent. Can be a really solid team. I might put AOJ in there for his DOT, or Harley for heal support."
InjusticeMobile,3bd413,byBumi,1 point,Sun Jun 28 05:59:42 2015 UTC,AO Bane/AO Batman work very well together. I prefer something like AOJ instead of AOD so you can get use out of using Bane.
InjusticeMobile,3bg5h4,OhhKnows,7,Sun Jun 28 22:51:48 2015 UTC,Lmao those coins and alliance credits though
InjusticeMobile,3bg5h4,YourLocalJoker,2,Sun Jun 28 23:58:03 2015 UTC,"In his defense, the alliance credits are building for me too. I'm at like 350 now xD it's terrible."
InjusticeMobile,3bg5h4,2007rnc,5,Mon Jun 29 03:16:03 2015 UTC,LVL 73 in MP battles but u got well over 900 Alliance points... cheater beating cheater ... nothing to see here.
InjusticeMobile,3bg5h4,SteelGuardian,3,Mon Jun 29 08:02:19 2015 UTC,Cheater
InjusticeMobile,3bg5h4,DavidTheGreat97,2,Mon Jun 29 00:26:46 2015 UTC,How is the defender a cheater?
InjusticeMobile,3baxsb,Mr_Bazinga,3,Sat Jun 27 13:52:58 2015 UTC,http://www.gamefaqs.com/iphone/710163-injustice-gods-among-us/faqs/70731?single=1
InjusticeMobile,3baxsb,darxide23,1 point,Sun Jun 28 00:38:33 2015 UTC,"This is a very, very comprehensive guide. We should stick this somewhere on the sidebar."
InjusticeMobile,3baxsb,locomofoo,1 point,Sun Jun 28 17:18:24 2015 UTC,"It's constantly updated, too. Check out the update notes at the very end. Guy is on top of things."
InjusticeMobile,3baxsb,darxide23,1 point,Sun Jun 28 17:54:02 2015 UTC,"No static, no MKX scorpion, no Raven, no GFS, no ABB I think."
InjusticeMobile,3baxsb,Aurora_Panagathos,1 point,Sat Jun 27 14:35:53 2015 UTC,Raven is in there. Both prime and regime.
InjusticeMobile,3baxsb,I_rock_speedos69,1 point,Sat Jun 27 16:57:10 2015 UTC,No RSGL either
InjusticeMobile,3baxsb,Abbhrsn,1 point,Sat Jun 27 17:24:09 2015 UTC,That is weird. i bought an awful lot of challenge pack (60 up)and do not get a single Raven. Did u manage to get one via challenge pack?
InjusticeMobile,3baxsb,Aurora_Panagathos,1 point,Sun Jun 28 01:47:55 2015 UTC,I'm not sure why you're being told that you can. The only Raven in challenge packs is the Regime Raven.   Prime Raven (the one with health swaps) can only be found in Most Wanted Packs.
InjusticeMobile,3baxsb,locomofoo,1 point,Sun Jun 28 16:40:18 2015 UTC,"yep, i doubt this guy too."
InjusticeMobile,3baxsb,Aurora_Panagathos,1 point,Sun Jun 28 16:45:29 2015 UTC,"Yes, both Ravens can be found in challenge packs. She is pretty rare though. And you have to have bought them after the last update."
InjusticeMobile,3baxsb,I_rock_speedos69,1 point,Sun Jun 28 02:16:08 2015 UTC,Regime Raven only. Prime is only in MW packs
InjusticeMobile,3baxsb,r0xxon,1 point,Sun Jun 28 17:47:15 2015 UTC,Is there any chance that Static and Killer Frost will be added to the Challenge Packs in future?
InjusticeMobile,3baxsb,oliviaamy,1 point,Wed Jul 1 19:17:02 2015 UTC,"In the future yes. But we dont know when that ""future"" is. They will be added though."
InjusticeMobile,3bb7qq,OhhKnows,5,Sat Jun 27 15:36:00 2015 UTC,Everyone already has the batmobile
InjusticeMobile,3bb7qq,Abbhrsn,3,Sat Jun 27 15:52:03 2015 UTC,Likely working on getting AOBane. Now that I have one of him I plan to get back on MP a bit more this weekend. I'm just looking for the lovely shards to further fuse the new epic gear.
InjusticeMobile,3bb7qq,jedispyder,2,Sat Jun 27 15:55:24 2015 UTC,"The bat mobile is just such a niche gear too, all it gives on anyone other than batman is health and that's it. Not to mention super moves are generally a poor choice in multiplayer due to the blocking feature."
