InjusticeMobile,3e60wk,shadyone33,1 point,Wed Jul 22 05:49:40 2015 UTC,And what about those with excess alliance credits? I have about 250 alliance credits I can't use as I've already maxed out KJJ and have all the supporting cards.  A different idea could be have different level daily multi player rewards (gold / silver / bronze).
InjusticeMobile,3e4up0,gjetsonamongus,1 point,Tue Jul 21 23:39:52 2015 UTC,what are the gears?
InjusticeMobile,3e5dwd,YesManFNV,5,Wed Jul 22 02:17:03 2015 UTC,It's stunningly good...
InjusticeMobile,3e5dwd,beomagi,1 point,Wed Jul 22 02:36:16 2015 UTC,relevant flair
InjusticeMobile,3e5dwd,morsegar17,1 point,Wed Jul 22 03:54:13 2015 UTC,"Potent offensive squad. Lots of fun to fight with.   Marginal defensive squad, however."
InjusticeMobile,3e5dwd,mrjacksparrow,1 point,Wed Jul 22 03:55:27 2015 UTC,Great fun on offensive. Will smash most teams if equipped with the right great
InjusticeMobile,3e47ju,KyleCrysCologne,5,Tue Jul 21 20:48:09 2015 UTC,well at least I got BG to EVI
InjusticeMobile,3e47ju,Devlyn16,1 point,Tue Jul 21 21:22:26 2015 UTC,u can try ur luck with challenge pack now. i finish most of my promotion via challenge pack
InjusticeMobile,3e47ju,Aurora_Panagathos,3,Tue Jul 21 21:30:23 2015 UTC,"As a defensive team they're terrible due to incompetent AI.   However, as an offensive team, I find them very fun and effective. I replace Nightwing with Doomsday, and they're rather dominant."
InjusticeMobile,3e47ju,mrjacksparrow,1 point,Tue Jul 21 21:45:19 2015 UTC,Dam pack won't show up for me.
InjusticeMobile,3e47ju,kopkiwi,1 point,Wed Jul 22 04:14:21 2015 UTC,Word. Already rebooted my phone twice!
InjusticeMobile,3e47ju,MattPointM,-1,Wed Jul 22 04:47:15 2015 UTC,i personally dont think any of these characters are special. When i play MP these characters are NEVER the reason i lose.
InjusticeMobile,3e47ju,rjjjr82,5,Tue Jul 21 20:52:27 2015 UTC,"yeah, they suck at defense, but really good on offense"
InjusticeMobile,3e47ju,Aurora_Panagathos,3,Tue Jul 21 21:27:43 2015 UTC,"^ this. I rarely come up against them online, but I love playing as them. Though I prefer CCBG instead of Nightwing."
InjusticeMobile,3e47ju,clayscarface,0,Tue Jul 21 21:54:35 2015 UTC,"Luchador Bane with the Cloak of Destiny can be a bit annoying, high % of stun while tagging in and then landing just his S1 will KO most cards even from full health.  But I agree, I wouldn't lose just because of Luchador Bane (or N52 Nightwing or Hawkgirl), but he is definitely someone to look out for. It is a pack I would consider buying, if I didn't decide to go with Batgirl as my Cloak of Destiny card. Now it's a bit mehh."
InjusticeMobile,3e47ju,Mellakka,5,Tue Jul 21 20:57:22 2015 UTC,N52 Nightwing can solo multi-player
InjusticeMobile,3e47ju,TheMManhunter,1 point,Tue Jul 21 21:01:54 2015 UTC,I solo him all the time. Power and life drain non-stop!
InjusticeMobile,3e47ju,dreamerintherye,0,Wed Jul 22 03:46:53 2015 UTC,"No doubt, I could potentially solo MP matches with him, but how does he perform defensively? At least to my recollection, I have not lost to a team with N52 Nightwing in a very long time, if ever.  For some reason I just immediately started thinking about these cards like I was facing them in MP matches."
InjusticeMobile,3e1uzg,Viziaa,4,Tue Jul 21 08:52:21 2015 UTC,"If you time glitch you lose your packs until it actually hits that day or something like that, did you time glitch?"
InjusticeMobile,3e1uzg,niko213,2,Tue Jul 21 09:26:01 2015 UTC,well fuck. im on ios and and my friend wanted to see if it worked for me. it didnt but i remember fowarding the date to 2016..
InjusticeMobile,3e1uzg,Delusions_of_Grandpa,12,Tue Jul 21 10:01:40 2015 UTC,Pretty sure you won't get them back until that date in 2016.
InjusticeMobile,3e1uzg,DoesHasError,2,Tue Jul 21 10:18:55 2015 UTC,"You can buy only once a day, if that is the case."
InjusticeMobile,3e1fab,PAPERCUT_UNDER_NAIL,3,Tue Jul 21 05:34:01 2015 UTC,"I think it depends heavily on distance from them when you start, plus a random element."
InjusticeMobile,3e1fab,beomagi,2,Tue Jul 21 11:24:27 2015 UTC,"Depends on your opponents. Some can be juggled easily, some so-so, some are really hard."
InjusticeMobile,3e1fab,Hiendaoduc,1 point,Tue Jul 21 11:00:25 2015 UTC,It is totally random!! I mainly care about AODS conbo ender because he is my main. And i have games where the other team can't get out of my combo enders and games when he barely does one or two. The most annoying part is that sometimes when i have ra's scimi and my adversary has over one bars of spell i do not hit a single combo ender until he used the spell so the power drain is useless and i hate it when it happens because the first combo after the spell has a combo ender
InjusticeMobile,3e2ksj,afetosin,4,Tue Jul 21 13:52:06 2015 UTC,"No, because once they implemented online play a looong time ago by now, sharing of WBIDs became a bannable offense."
InjusticeMobile,3e2ksj,lahatiel,-3,Tue Jul 21 15:26:28 2015 UTC,But why isnt it still possible?
InjusticeMobile,3e2ksj,Mellakka,4,Tue Jul 21 15:34:34 2015 UTC,you mean why people won't share anymore? Because people want to play MultiPlayer and get the exclusive rewards from those seasons and sharing WBID will get you banned from the MultiPlayer. Just like /u/lahatiel said.
InjusticeMobile,3e0x50,morsegar17,1 point,Tue Jul 21 02:43:19 2015 UTC,"Yes, Android. It was meant to fix the Android-only challenge reset bug."
InjusticeMobile,3e0x50,lahatiel,1 point,Tue Jul 21 02:58:21 2015 UTC,yes android only. i posted a thread on it because i didn't want to update and get screwed over due to my ignorance (again):p
InjusticeMobile,3e12rd,DEADP00L_,10,Tue Jul 21 03:31:14 2015 UTC,"AFAIK, AODS is not in MW yet. Arkham is a guaranteed buy that includes him, while challenge pack can be hit or miss, and difficult to promote from."
InjusticeMobile,3e12rd,Zenima,4,Tue Jul 21 03:42:49 2015 UTC,Not in mw
InjusticeMobile,3e12rd,zororod123,4,Tue Jul 21 03:33:16 2015 UTC,"Personally I would say to grind and save your credits for when the AO pack comes back to the store. If you don't have any of the characters, you get a ready made team per pack. If you are only after AODS, you're guaranteed to get him AND you'll be able to sell the other 2 back for credits."
InjusticeMobile,3e12rd,shadyone33,3,Tue Jul 21 05:09:06 2015 UTC,"I'm just not disciplined enough to save up that much lol, I'll probly just keep playing in the odds in the challenge packs, I really wanna get BG and Raven as well anyway"
InjusticeMobile,3e12rd,Aurora_Panagathos,1 point,Tue Jul 21 13:28:09 2015 UTC,batgirl and raven are really rare for me in challenge pack
InjusticeMobile,3e12rd,BobTaco,1 point,Tue Jul 21 16:04:01 2015 UTC,"Raven for sure is, but I've probly bought 12 packs in the last week and pulled 3 batgirls, maybe I'm just lucky, just not when it comes to AODS lol"
InjusticeMobile,3e12rd,Mellakka,1 point,Tue Jul 21 22:24:51 2015 UTC,Raven is easier to get in most wanted packs.
InjusticeMobile,3e12rd,Aurora_Panagathos,2,Wed Jul 22 00:48:50 2015 UTC,"I seem to keep getting him quite often from the challenge pack, but it could be just my luck. As suggested by others, Arkham pack is the only one that can guarantee AODS, challenge packs have huge range of cards so you might be opening those packs for the rest of your life and never see another one. That's why I spent millions on Femme Fatale packs to get that Batgirl to E7."
InjusticeMobile,3e12rd,batfleck91,1 point,Tue Jul 21 07:24:18 2015 UTC,"I hate AOB. I think Ark HQ sucks too, now that RKF stop her healing.  I get DS from EI to EVII with around 7 million on Challenge pack. AODS wise, that would be a lost of almost 2 million. Maybe that is justifiable because now I have at least one of every gold."
InjusticeMobile,3e12rd,Aurora_Panagathos,3,Tue Jul 21 08:54:21 2015 UTC,Ark HQ is garbage I don't understand the infatuation. Even the game itself makes her super rare to find. Like it's a reward.   I think AOB is overrated but it's still a good card.
InjusticeMobile,3dxiev,Hiendaoduc,2,Mon Jul 20 10:19:47 2015 UTC,"Due to a troll problem, this sub has a minimum karma count. Karma can be earned easily on reddit, go explore.  I am a bot, and this action was performed automatically. Please contact the moderators of this subreddit if you have any questions or concerns."
InjusticeMobile,3dxiev,Aurora_Panagathos,1 point,Mon Jul 20 10:55:59 2015 UTC,Does he automatically release block between attacks?
InjusticeMobile,3dxiev,Aurora_Panagathos,1 point,Mon Jul 20 10:55:59 2015 UTC,"No. At least his character model is still blocking. Or if he did, it would be just a split second so I couldn't see it clearly. If it was sloppy screen, the other two guys would suffer the same things, but no."
InjusticeMobile,3dylup,rjjjr82,9,Mon Jul 20 16:22:38 2015 UTC,"Her main use is definitely her passives, but her attack and health stats are strong and she's an effective character in her own right. The way I see it is that you can use her for support and not have to worry about your other two characters being glass cannons. When I have 600WW on my team I rarely use her, but if I get unlucky and my other two cards get knocked out early, I know I can rely on her to finish the fight even if it's not quick. This is where AniHQ isn't as good. If my other two characters are dead, AniHQ usually isn't good enough to finish a fight against more than one character. Her only real weapon is her S2, she isn't as quick, and her health is a lot worse than 600WW.  I would recommend not using 600WW and AniHQ together - IMO you really want two strong offensive female characters, which there are a lot of. Any combination of  Batgirl prime, CCBG, Raven, BRC, and either KF in your first two slots will make for easy wins with 600WW as the third.  Also, for gear, I just overload S1 gear on 600WW since her use in fights is generally brief. Her signature gear with hook and chain (or arcane wand) and bone spikes is a good combination, allowing for crit chance, stun chance, increased damage, and heal all on S1."
InjusticeMobile,3dylup,doodledeedoodle,1 point,Mon Jul 20 17:45:00 2015 UTC,I play S1 intensive Harley. stun and disable on S1. ibistick for extra fun. cannot stay on the field with that.
InjusticeMobile,3dylup,Aurora_Panagathos,1 point,Mon Jul 20 22:33:59 2015 UTC,But isn't Harley really designed more for S2? I mean just with the automatic team heal from her sig gear. I always see her as more support character (usually play AniHQ with KJJ and Ares) though. It's a great surprise when I somehow end up with just Harley and she's able to pull off a win :)
InjusticeMobile,3dylup,clayscarface,1 point,Tue Jul 21 21:58:03 2015 UTC,"I don't care about heal that much. When there is the need to heal, shit already happened, plus most 7 match battle has RKF.   Another thing is that her dynamite though unblockable is heavily penalized.  The good point in her S1 is that it hits 4 times, allowing most stun or disable effect to trigger."
InjusticeMobile,3dylup,Aurora_Panagathos,4,Wed Jul 22 00:45:54 2015 UTC,"I've been loving Killer Frost, Batgirl and WW600. The power generation and extra bar and I usually just wipe people out with KF."
InjusticeMobile,3dylup,Jmm060708,2,Mon Jul 20 18:15:15 2015 UTC,"True, WW600 isn't anything special by herself, but one thing I haven't seen anyone mention is her S2, which doesn't inflict massive damage in and of itself, but deals the best bleed damage in the game (unless I've overlooked something, feel free to prove me wrong). This can work to your advantage in two ways: first, it can force a tag-out, which may be advantageous depending on the situation; second, you can unleash the S2 on someone who just tagged in and watch with glee as your opponents health quickly plummets.  As for gear, I have a bit of an unconventional setup with her, but hear me out:  The Ibistick: boosts power gen, damage to S1 and S2, and adds burning damage to both specials. The combined bleed/burn damage from her S2 is great, and sometimes just for fun, I'll hit the last remaining opponent with that S2 and just block and watch their health drop to nothing.  Ra's Al Ghul's Scimitar: damage boost to basic attacks, 1 bar of starting power, and power drain on combo ender. This is useful for both offense and defense, since WW600 is one of the few characters who use her combo ender when controlled by the AI. Get a rhythm going with basic attacks, keep the opponents power to a minimum, and wait for the right time to unleash that S2, which leads me to...  Martian Manhunter Garb: health boost and heal on S2. This will give her a much needed health boost, and a nice heal whenever you get that S2 off.   Pair her with AniHQ and pretty much any decent third female character and you should have no problem winning ultimate battles consistently. I rarely even have to switch out with her, but I do to speed the battles up a bit. Her S2 fills pretty quickly, and you can stall with her as long as you like until someone else's S2 is ready, tag out, unleash a teammate's S2, and bring WW back in whenever you feel like it. I usually only use her S1 (which hits hard) to kill Raven or for a KO, but just a side note: knock someone out with either special and the burning damage is applied to whoever tags in."
InjusticeMobile,3dylup,Smellyjuji,3,Mon Jul 20 21:14:28 2015 UTC,use an S2 to force a tag out is really desperate. S2 should kill. and opponent can tag out freely so i doubt if u can watch them bleed.
InjusticeMobile,3dylup,Aurora_Panagathos,3,Mon Jul 20 22:20:42 2015 UTC,"I respectfully disagree.   This can work to your advantage in two ways: first, it can force a tag-out, which may be advantageous depending on the situation; second, you can unleash the S2 on someone who just tagged in and watch with glee as your opponents health quickly plummets.  opponent can tag out freely so I doubt if u can watch them bleed   Here's what I meant by that: Say you're beginning a fight and the opponent leads with AO Bats. Pretty common right? Right off the bat (no pun intended) I'll try (and usually land) a basic combo with a finisher to drain power, which will then prompt Batman's S1. Block, land another combo. Now I've got WW's S2 ready to go, but I know from experience that good ol' Bats is about to tag out, so maybe I land one more basic combo and hold on to the S2. Sure enough, he tags out and let's say just for shits that a tanky Darkseid tags in, although I do realize it could be anyone. Now I've got the S2 locked and loaded, and I know Darkseid won't be able to tag out right away, so I unleash WW's S2 and now Darkseid is taking heavy bleed damage, while burning, all the while getting pummeled by WW's basic attacks.   force a tag out is really desperate   Perhaps this can be seen as desperate by some, but for me, it's not so much that I'm forcing the tag out, it's that I know my opponent will tag out as a result, so let me see if I can use this to my advantage. Say you're facing one of those KJJ, Shazam, and whoever teams (Static, Godfall Supes, Darkseid, etc.) and you're dealing with the Joker. If possible, you want to avoid killing him so you don't risk dealing with Shazam's super. Hit KJJ with an intentionally underpowered S2 from WW and he'll tag out. Now maybe I've got Raven or KF prime ready or almost ready with one of their own S2s. If Shazam tags in, I'll land a combo, maybe block his S1, and by that time most likely, hit Shaz with that S2 I've built up with KF or Raven, which can KO with the right gear.  I'm not saying this works all of the time, but in certain situations I think these tactics can be helpful."
InjusticeMobile,3dylup,Smellyjuji,1 point,Mon Jul 20 23:30:37 2015 UTC,"Animated HQ, 600, anD raven with all energy gen gears = every match under 30 seconds. Tried it with CC batgirl, but it sucked. Raven is just stupidly OP."
InjusticeMobile,3dylup,Shizm00,1 point,Mon Jul 20 18:35:49 2015 UTC,"600WW with any combination of the two Killer Frosts and/or Raven. Load WW up with defensive gear. Use her for blocking, and taking the big hits/specials. Use the other for damage. Load power generation up on the others, and you are rotating SP2s as fast as you can."
InjusticeMobile,3dylup,HITNRUNXX,1 point,Mon Jul 20 18:49:12 2015 UTC,"I tend to use KF, AniHQ and 600WW. With the right gear, 600WW can wipe the board by herself - i can get her damage to about 6k per hit. Since everyone and their brother seems to have AOBats or AODS, she is the sacrifice character to take that first S2 or and S1 from AODS. I pump her with reflect gear and get lucky occasionally. If not, then she might survive. KF and AniHQ with her heal on S2, can restore everyone to max quickly."
InjusticeMobile,3dylup,daxel123,1 point,Mon Jul 20 19:27:02 2015 UTC,with Ras on KF sometimes i can get a combo off draining AOBats so he cant get off SP2. Then he uses SP1. The KF whipes out the board.
InjusticeMobile,3dylup,nakednark,1 point,Mon Jul 20 19:57:01 2015 UTC,"I agree with you, I thought that WW600 would be more of a tank, but her damage and health stats are pretty low which is really upsetting. I find myself just using her for her passive and that kind of bothers me because I feel like your limited by the team combinations you can have."
InjusticeMobile,3dylup,LacidOnex,1 point,Mon Jul 20 19:29:56 2015 UTC,"Okay - let me explain how I've always used her. Granted I have nearly perfect gears, and I've missed the last few four star pieces out of apathy.  She's a fairly high HP character, so giving her the venom harness for an increase to total HP and an S1 heal is perfect. Now, a lot of people will disagree but I give her statics disk instead of her shield. I like the reflect chance for ALL better than just an S2.  Now, if you give her either her shield (serious nerf to blocked damage, but also a very high chance to reflect S2s) or even better, an S1 and power gen gear like zatannas wand, she can basically be invincible.  She's ultimately an anchor char. She won't kill another healing char unless you have the ability to spam S1, she has no use for damage or crit gear (hawkgirl is best for this). But through stupidity I've lost my raven, been stuck with a training char (like KF but at level 30 when I'm fighting perfect 50s), lost that, and then managed to pull a victory against those stupid Shazam AOB KJJ teams. With basically just shield toss and recouping the tiny damage that actually gets through."
InjusticeMobile,3dylup,Aurora_Panagathos,2,Mon Jul 20 20:07:59 2015 UTC,"agree. her S2 is the main problem. fighting with a S2 that does not kill is awful! I put disc, sword and shield and Harness. Reflect like a mirror and spam s1. she can either tank or solo. my other 2 does not heal, i can count on Ww to solo when i screw up"
InjusticeMobile,3dylup,kopkiwi,1 point,Mon Jul 20 22:28:23 2015 UTC,"You're using her wrong. Put crit S2 gear on her, heal for s2 and S1 stun and she's a tank."
InjusticeMobile,3dylup,Aurora_Panagathos,1 point,Mon Jul 20 20:16:49 2015 UTC,i don't understand this. crit on a bleed S2? does the bleeding crit? and stun on shield toss? it's just a one-hit
InjusticeMobile,3dylup,kopkiwi,1 point,Mon Jul 20 22:14:56 2015 UTC,She hits 4 times on her S2. Normally with S2 crit gear you can get two of those hits to crit. Add those up and she can do around 55k of damage plus the bleed from it at around 4k per second. Adds up.
InjusticeMobile,3dylup,Aurora_Panagathos,1 point,Mon Jul 20 23:25:08 2015 UTC,can i have a detail gear set? definitely will try
InjusticeMobile,3dylup,kopkiwi,1 point,Tue Jul 21 00:07:25 2015 UTC,"I go with the demon sword, or Ravens cloak, though it's better for her if she's on your team, (S2 boost and crit chance on S2) and her own gear will give the stun on S1. Then the 3rd gear is either a power gen, or an S2 heal. Taken your pick. I use her basically as a quick power hitter once her S2 is charged as once the opponent is bloody others damage increases."
InjusticeMobile,3dylup,shadyone33,1 point,Tue Jul 21 00:19:35 2015 UTC,"I use her with 2 crit boost gears and a SP1 heal gear and she does good for me. With the extra energy generating she can spam the SP1 all day long. My go to team is:  WW600 equipped with: Knife Collection, Powered Eskrima Sticks and Netherrealm Kama. Killer Frost equipped with: Blade of the War God, Kryptonian Battle Suit, Ra's Al Ghul's Dagger. Cassandra Cain Batgirl equipped with: Cloak of Destiny, Mutated Bone Spikes, Promethium Long Sword.   All gear maxed.  This team is too good. Wonder Woman hits for 6300 on Crit, CCBG hits for 9700 crit and her SP1 if you get the stun is 69 or 70k damage. I rarely use Killer Frost but when I do its to use her SP2 and then tag out."
InjusticeMobile,3dylup,Irishlb14,1 point,Tue Jul 21 05:10:54 2015 UTC,"She was a better card when you could chain her special one, but she is an excellent support character that fits well on several different teams. When you promote her higher you will notice how great of a card she really is. I do agree that AniHQ is better because she can heal and  her passive works with everyone instead of only with characters with slits, but WW600 is still one of the top cards in the game."
InjusticeMobile,3dylup,Abbhrsn,1 point,Tue Jul 21 15:52:09 2015 UTC,"Yea, the way I use the team is with WW600 and AniHQ buffing up another character, like KF or Raven or any tanky female character you like.  I actually prefer swapping out AniHQ on the team though and using Prime Batgirl, WW600, and KF.  The female characters are so powerful in this damn game..lol, makes me wish they'd add someone that boosted male characters"
InjusticeMobile,3dylup,Abbhrsn,1 point,Mon Jul 20 16:30:46 2015 UTC,i tried that too it was better but not as good as i thought. I actually used AOBats KF with Ras and BG and it was really successful. Being able to launch 2 SP2s right away and BG special 1 with CLOAK is really brutal.
InjusticeMobile,3dylup,Abbhrsn,1 point,Mon Jul 20 16:42:01 2015 UTC,"Ya, that's a nice little combo.  The 600WW really helps with that extra power gen though, my KF generates power so quickly, plus with the scimitar she does power drain at the end of her combos so it's hard to fight back against her.  And with her gear her S2 does lifedrain which makes it even harder to kill her"
InjusticeMobile,3dylup,Abbhrsn,1 point,Mon Jul 20 16:45:35 2015 UTC,"100% agree. I have ras, necklace and ibstick on her. That s2 is devastating. I really want to try to get Regime KF also"
InjusticeMobile,3dxfvs,E_Vans,5,Mon Jul 20 09:43:51 2015 UTC,"AODS. He is a powerhouse alone with just his signature gear, add some of those legendary gears and you have a God Among Us."
InjusticeMobile,3dxfvs,Mellakka,3,Mon Jul 20 10:02:57 2015 UTC,aods
InjusticeMobile,3dxfvs,eRazorVL,2,Mon Jul 20 11:38:24 2015 UTC,"AODS is the most well rounded card in the game, high health, best sustained damage in the game, 2 part combo ender, SP1 hits for 50k damage with sig gear, the list goes on..."
InjusticeMobile,3dxfvs,Joe787,1 point,Mon Jul 20 15:40:31 2015 UTC,AODS. He's one of the most OP characters in the game.
InjusticeMobile,3dxfvs,zulfanism,1 point,Tue Jul 21 06:45:14 2015 UTC,"It isn't even close, AODS is the strongest player in the game. RHG is a decent card with good damage and passive, but I would t put her in the top ten. I've enjoyed using her, but I've noticed that there isn't really a team where she couldn't be replaced with a better fit."
InjusticeMobile,3dxfvs,Irishlb14,1 point,Tue Jul 21 15:43:31 2015 UTC,"Aods because his sp1 crits and thats better than having a sp2 crit, as it takes less energy. Also, it's unblockable at 200%"
InjusticeMobile,3dwopc,nakednark,2,Mon Jul 20 03:58:29 2015 UTC,"""Offense wins: 10/12"" - Stopped reading here."
InjusticeMobile,3dwopc,CSLking,2,Mon Jul 20 12:03:34 2015 UTC,"Sorry, am I not supposed to put anything down about offense wins or anything of the sort? I'll take it down if that's the case."
InjusticeMobile,3dwopc,Aurora_Panagathos,2,Mon Jul 20 14:37:50 2015 UTC,"One of a few point I agree with CSLking. When u try to sell the team, a 83% win rate is that thing you want to hide"
InjusticeMobile,3dwopc,Doright36,2,Mon Jul 20 14:55:54 2015 UTC,I have a hard time reliably getting stuns myself with characters that have an S1 Stun. Seems like 80+% of the time the enemy will block when I hit special 1 and while it still does some damage it wont stun. Seriously the amount of time I spend punching into blocks makes me think trying to rely on stuns a waste of time. Better to just amp up the damage.
InjusticeMobile,3dwopc,beomagi,2,Mon Jul 20 09:17:54 2015 UTC,"If your specials are being blocked, you need to work on timing.  Easiest way for unblockable specials is to use it while the enemy is doing a basic attack. The time between hits in their basic attack varies, often having an easy window to drop a special."
InjusticeMobile,3dx384,XxXZeusKillerXx,0,Mon Jul 20 06:40:23 2015 UTC,"You could easily cut that time in half by giving ares the ibis stick and batgirl the cloak. Start with a god smack, then sweep with batgirl's now op s1."
InjusticeMobile,3dx384,zororod123,3,Mon Jul 20 13:11:33 2015 UTC,"Then that defeats the purpose of Static. Teams don't have to be for speed, if I wanted to do 10 second matches I could as I have all gear and characters ready for me to choose from. This is a team that is fun to use for me and I thought I should share it."
