Jeep,3e3cmg,grantnel2002,1 point,Tue Jul 21 17:17:30 2015 UTC,It's so hooooooooot.
Jeep,3e3cmg,arfeifei,1 point,Tue Jul 21 19:19:31 2015 UTC,You have any issues with your transmission? Sorry for the off topic question.
Jeep,3e3cmg,JiMM4133,1 point,Tue Jul 21 20:21:41 2015 UTC,You should submit a post describing your problem so we can help
Jeep,3e3cmg,ElCapitan09,1 point,Tue Jul 21 20:36:40 2015 UTC,"I did, software updates helped, believe it or not."
Jeep,3e3cmg,GRZMNKY,1 point,Tue Jul 21 20:51:26 2015 UTC,How do you know it's Rhino Liner?
Jeep,3e34da,TimHugh,2,Tue Jul 21 16:21:11 2015 UTC,"Dude, Fort Stevens is excellent! Just like those jeeps lol"
Jeep,3e34da,nicktitan50,1 point,Tue Jul 21 20:36:06 2015 UTC,Beautiful! I don't understand why everyone goes through the effort of getting every detail right...except the rims. Fantastic Willys nonetheless.
Jeep,3e2jfi,xpkranger,17,Tue Jul 21 13:40:04 2015 UTC,The fact that they could remotely kill the brakes is really fucking dangerous. And why is that even possible.
Jeep,3e2jfi,GOA_AMD65,9,Tue Jul 21 14:04:01 2015 UTC,Just wait until they have self driving cars. I'm glad I drive an XJ and don't have electronics controlling everything (there is some of course but nothing exposed to OTA attacks).
Jeep,3e2jfi,aussie_jason,4,Tue Jul 21 14:10:48 2015 UTC,I was thinking the same thing. All my family's cars are not internet facing in any way. Thank goodness for that. I'm surprised Jeep can't push these security updates OTA
Jeep,3e2jfi,xj4me,3,Tue Jul 21 16:36:01 2015 UTC,"Here's a funny thing...OTA upgrades would require access to the vehicle via the cell network that probably doesn't exist.  You know, the same access that these ""hackers"" are claiming.  Attacking the car or upgrading the firmware officially is pretty much the same thing."
Jeep,3e2jfi,calvarez,4,Tue Jul 21 18:59:09 2015 UTC,"I don't know why you're being downvoted for this.  Adding firmware updates via 3G/LTE greatly increases the attack surface, in addition to someone simply hijacking the signal to man-in-the middle it and push through whatever he wants.  Sure, not an issue now if you use up-to-date cryptography, but most people keep their cars for 10+ years, and 10+ year old standards become hackable (i.e. Poodle and Logjam vulnerabilities)."
Jeep,3e2jfi,donjulioanejo,1 point,Tue Jul 21 19:32:43 2015 UTC,"Good points.  Also a failure would likely mean that the car can't be driven, and can't be re-flashed without physical access.  The dealer really needs to be able to plug into it for this."
Jeep,3e2jfi,calvarez,1 point,Tue Jul 21 19:41:11 2015 UTC,Why when they can charge you $350 to hook up a USB cable?
Jeep,3e2jfi,Eeyore_,2,Tue Jul 21 18:35:11 2015 UTC,All of the software updates on all of my cars have been free.
Jeep,3e2jfi,calvarez,3,Tue Jul 21 18:58:10 2015 UTC,"Amen to that, only enough electronics to make the engine run efficiently-ish."
Jeep,3e2jfi,FedexSentMeAHead,3,Tue Jul 21 18:26:52 2015 UTC,Was wondering that myself about the brakes.
Jeep,3e2jfi,atomicllama1,3,Tue Jul 21 14:18:24 2015 UTC,Brakes and steering should always be mechanical. If you want to add a motor than can apply the brakes sure.   But my ECU shouldn't be able to stop me from steering or braking.
Jeep,3e2jfi,db295,2,Tue Jul 21 19:03:52 2015 UTC,Traction and stability control use individual braking on the wheels to help control the car.
Jeep,3e2jfi,Apotropaic_Sphinx,2,Tue Jul 21 19:26:57 2015 UTC,"why is that even possible.   Newer cars have electric braking systems that integrate ABS and more advanced traction control (applies brake to one wheel to prevent it from spinning.) So the computer has a lot of control. All a hacker has to do is tell the ABS that the brakes are on full with no wheel spin and the system will cut the brakes, thinking the car is in a skid.  The fact that that system is anywhere near a networking device is absolutely unacceptable. I can't believe the engineers at Fiat/Chrysler would be so stupid."
Jeep,3e2jfi,calvarez,-5,Tue Jul 21 21:05:31 2015 UTC,"It probably isn't.  That article was full of complete lies about many other things, so the entire thing is suspect.  Kind of like the idiot who claimed he could control a plane through the entertainment system."
Jeep,3e2jfi,GOA_AMD65,6,Tue Jul 21 16:42:46 2015 UTC,Its making itself around the news a lot today. It's not fake. Jeep has already issued a patch to fix this. You have to bring your car in for it.
Jeep,3e2jfi,calvarez,-4,Tue Jul 21 17:30:32 2015 UTC,"There are limited parts of the article that aren't fake.  Most of the article is.  And ""issued a fix"" doesn't mean it's a real threat, it means they may have found a POTENTIAL issue and addressed it.  I manage servers that currently have open vulnerabilities, but it's not realistic to exploit them so we leave them alone."
Jeep,3e2jfi,NoShaDow,2,Tue Jul 21 17:47:58 2015 UTC,"Explain to me what exactly is fake about it and why. Additionally, the vehicle is out, it isn't a potential problem, it IS one because someone successfully can make it happen, but rather than be malicious they made it apparent and Jeep issued a fix."
Jeep,3e2jfi,calvarez,-1,Tue Jul 21 18:16:12 2015 UTC,"Potential problems, in network security, are those which would take such a ridiculous amount of effort that they aren't realistic.  Many of the ""OMG vulnerability"" articles you read in mainstream media have ZERO impact on us because they require such ridiculous steps to execute.  Like you could walk up to some of my servers and with some software and specialized knowledge, take over them.  But they are in a locked cabinet, with alarms, inside a huge facility with armed guards and crazy access controls.  So it's a potential problem, but not a realistic problem.  Same could be said about being able to find and attack a car over the cell network.  Here is the most obvious error:  This is a patently false statement that any of us here could go verify by looking at the Jeep site: ""Miller and Valasek say the attack on the entertainment system seems to work on any Chrysler vehicle with Uconnect from late 2013, all of 2014, and early 2015.""  Bull-fucking-shit.  Most of the Uconnect systems have no ability to communicate (no cell radio). There is no two-way Uconnect option for most vehicles; I looked carefully to see if I could get it on my JK, nope. So the ""hackers"" outright lied about that. PLUS then the magazine was grossly negligent in researching the validity of such a bold statement. Therefore the entire article is worthless and not believable."
Jeep,3e2jfi,calvarez,0,Tue Jul 21 18:36:21 2015 UTC,"Really, down-voting FACTS about the hardware which you could verify yourself?  Nice."
Jeep,3e2jfi,tinydisaster,1 point,Tue Jul 21 19:31:30 2015 UTC,"Dude, you're the only one making a counter point.  I am fascinated by the amount that people who have already made up their mind that Jeep has been making a hacker minion-bot fleet since 2013.  The entire article was written with an aura of fear mongering.   While I am highly suspicious of this technology and don't trust Chrysler as as far as I can throw them, they certainly are going to take basic steps to avoid making terrorist life sized RC cars.  Also, while I'm on my soapbox:  Gone are the days of analogue cars.  Gone.  Quit whining about how good things used to be with your death on wheels CJ that turned gas into noise.  New cars will all have more and more connectivity so while reminiscing about easy engine swaps and vacuum diagnosis we gotta realize that new cars are cleaner, safer, more efficient and more comfortable and you can bet they're not going backwards."
Jeep,3e2jfi,calvarez,1 point,Tue Jul 21 20:45:07 2015 UTC,"I think your point is well taken but the vulnerability exists and it's still super important to shame auto makers for these faults in 2015.  If you had a non-cellular connected rental car and hacked it to ""go off"" after 48 hours and if the speedo was > 70 mph, pin the wheel all the way left and stab the brakes, that's a big fucking problem."
Jeep,3e2jfi,nathanm412,1 point,Tue Jul 21 20:56:51 2015 UTC,"I wonder if they could do it to a rental Jeep, sight unseen?  I agree, if it's a problem they should be pressured into an immediate fix.  I just haven't seen enough evidence that it is a problem and u/calvarez seems to think that it's not as easy as the article makes it seem."
Jeep,3e2jfi,calvarez,6,Tue Jul 21 21:12:39 2015 UTC,"Just in case you felt ok because you don't drive a Cherokee - ""Miller and Valasek say the attack on the entertainment system seems to work on any Chrysler vehicle with Uconnect from late 2013, all of 2014, and early 2015."""
Jeep,3e2jfi,calvarez,-6,Tue Jul 21 13:40:48 2015 UTC,FALSE FALSE FALSE.  Period.  One of the many things that shows this article is bullshit.
Jeep,3e2jfi,calvarez,3,Tue Jul 21 17:44:05 2015 UTC,They are making a claim that UConnect is exploitable and has a connection to the CAN network. They've been able to a rewrite firmware on a chip that allows them to remotely send instructions to the control network of the car. They also claim that the technology is similar across other cars of the same manufacturer that it can affect other brands. What about their claim makes it obviously false?
Jeep,3e2jfi,fat_over_lean,3,Tue Jul 21 19:03:36 2015 UTC,"I explained that in another post just a few minutes before you posted, so maybe you missed it.  Read this thread again, basically the hardware for remote access (cell modem) simply doesn't exist in most models."
Jeep,3e2jfi,calvarez,2,Tue Jul 21 19:28:14 2015 UTC,"I'm curious as to how you know that it is false.  Why would they be so specific if they hadn't tested it on several models and found it to work on some and not others.  Again, yes, they could be just lying through their teeth - and I want to say that you could very well be right - but can you please point to one or more specific things in the article where they tell an intentional falsehood?  I am genuinely curious."
Jeep,3e2jfi,fat_over_lean,4,Tue Jul 21 18:36:08 2015 UTC,"Because the hardware to enable two-way communications simply doesn't exist in most models.  It's UNAVAILABLE for the Wrangler, I wanted to get it.  Nope.  The list of models that have the two-way hardware is pretty small.  Unfortunately Chrysler uses the ""Uconnect"" name on both stand-alone and two-way systems.  The two-way version however is ""Uconnect Access.""  The person in the article lied.  And then Wired was grossly negligent by not doing their own research to corroborate such a bold statement."
Jeep,3e2jfi,calvarez,4,Tue Jul 21 18:56:59 2015 UTC,"I see.  Thank you for clarifying.  So, the article appears to be overly broad by not delineating Uconnect vs. Uconncect Access.  It seems like they were able to do something - what we don't know are the details of what and how it was done.  I'd say it's too early to say that the article is 100% bullshit, especially since FCA responded with a patch.  If there was no vulnerability, why issue the patch?  So, while someone hacking your Chrysler vehicle is less likely than Wired might have you believe, it is apparently not impossible given the correct set of circumstances (having the correct model) despite the overstatements within Wired's article."
Jeep,3e2jfi,Aaron_At_Work,2,Tue Jul 21 19:27:38 2015 UTC,"I didn't say the entire article is necessarily WRONG, but the entire thing is suspect and can't be taken as having any value because they outright published several false statements.  Therefore, we simply don't know.  If someone lies to you on one thing, don't you suspect they may lie to you on other things?  Trust...  Patches are often issued on potential but unrealistic vulnerabilities for the same reason we're having a debate here.  If you're not a network guy, you wouldn't understand what's going on with the issue and whether it's a credible real-life threat or not."
Jeep,3e2jfi,Aaron_At_Work,1 point,Tue Jul 21 19:44:59 2015 UTC,"Agreed that we need more time for the wheat to be sifted from the chaff.  I think it is telling that FCA issued a patch.  FWIW, I'm quite familiar with patches and vulnerabilities. I manage enterprise patching for about 600 servers.  Yes, there are occasionally patches that we choose not to deploy, mostly because of some problem demonstrated after patching our test servers.  If it is marked as a critical vulnerability though, we make every effort to include it in that month's patching routine, regardless of the likelihood of the use of the vulnerability.  We have to meet certain legal standards as well as client defined standards and to not patch something solely on the basis of whether or not something is likely would subject my organization to risk of legal liability.  Basically, if it's a critical patch - there'd better be a damn good reason (like it breaks stuff) we don't deploy it."
Jeep,3e2jfi,calvarez,3,Tue Jul 21 20:09:45 2015 UTC,"How though, where does my Jeep transmit a signal from?"
Jeep,3e2jfi,calvarez,3,Tue Jul 21 15:06:12 2015 UTC,"The JKs don't have two-way capability at all.  This would only apply to the Cherokee and some others that have the Chrysler version of Onstar.  It's a two-way data connection over cellular, just like your phone."
Jeep,3e2jfi,fat_over_lean,2,Tue Jul 21 16:44:15 2015 UTC,"I have a 2012 JK, but got the Mopar EVTS thing. It's an aftermarket hardware button they install on my dash, but its not wired to my UConnect Nav. I press the button and then they give me a call on my cell phone. The people at EVTS said it was tied to my sensors (even though they didn't install any additional sensors) so I assume it must be plugged into the computer? I don't think they can remote unlock doors though...  EDIT: Looks like they can unlock, thats pretty cool ;)"
Jeep,3e2jfi,fat_over_lean,1 point,Tue Jul 21 17:04:42 2015 UTC,"Yup, there are add-ons you can put on any vehicle with OBD II to allow remote feedback and control."
Jeep,3e2jfi,db295,1 point,Tue Jul 21 17:43:03 2015 UTC,"All Jeeps (I believe) have a satellite transceiver I believe.  In Wranglers it is located in the sound bar just under the roof.  This transmits at a minimum, your XM downstream traffic and any uConnect two-way traffic."
Jeep,3e2jfi,Archr5,3,Tue Jul 21 15:28:45 2015 UTC,Two way traffic is actually sent/received over Sprint's network. There is no data sent over the satellite network.
Jeep,3e2jfi,xj4me,3,Tue Jul 21 16:06:06 2015 UTC,Thank you.  TIL.
Jeep,3e2jfi,aussie_jason,3,Tue Jul 21 16:06:34 2015 UTC,"Question - I have another vehicle that is a GM vehicle.  OnStar has a feature where I can locate the vehicle with an app on my phone.  If Jeep has a similar feature then, are you saying that it would not work outside of cellular coverage?"
Jeep,3e2jfi,calvarez,4,Tue Jul 21 16:09:09 2015 UTC,Correct. UConnect uses Sprint's network to send data.
Jeep,3e2jfi,xj4me,0,Tue Jul 21 16:17:59 2015 UTC,"Receiver, not transceiver.  Traffic is not two-way.  XM is not two-way.  Nothing in your JK transmits anything."
Jeep,3e2jfi,calvarez,2,Tue Jul 21 16:45:01 2015 UTC,"Not an EE, but doesn't the Sprint connection qualify as a transceiver?  I know the basic difference I (mistakenly) thought the satellite antenna was connected to a transceiver - but by definition, doesn't the the Sprint mobile network connection have to use a transceiver?    ""A transceiver is a device comprising both a transmitter and a receiver which are combined and share common circuitry or a single housing. When no circuitry is common between transmit and receive functions, the device is a transmitter-receiver.""  I'll be the first to admit I have no idea if the mobile phone technology shares the same circuitry, but it would not surprise me if it did."
Jeep,3e2jfi,xj4me,2,Tue Jul 21 16:51:22 2015 UTC,"The JK doesn't have a Sprint transceiver.  That is only on the models that have two-way Uconnect.  Unfortunately Chrysler chose to call both the stand-alone systems and the two-way systems ""Uconnect.""  You cannot get two-way on a JK (or most models, just a few)."
Jeep,3e2jfi,calvarez,2,Tue Jul 21 17:00:12 2015 UTC,Cool.  That makes sense.
Jeep,3e2jfi,xj4me,6,Tue Jul 21 17:06:41 2015 UTC,"That these hackers sent someone out on a public road despite the fact that they ""assured me that they wouldn’t do anything life-threatening."" is grossly irresponsible, perhaps even criminal.  You don't know what's going to be life threatening or not if you aren't the driver.  Too fast, too slow, too distracted - all of these could have contributed to a major accident.  Stay the fuck on a test track or at least a parking lot."
Jeep,3e2jfi,calvarez,4,Tue Jul 21 14:22:49 2015 UTC,Yeah that really bugged me. This should be heavily investigated.
Jeep,3e2jfi,xj4me,1 point,Tue Jul 21 15:05:58 2015 UTC,"A hard shutoff of all wifi would be ideal, and maybe they can make an app for your smartphones that downloads vehicle security updates and put'em in your car? Sounds weird though, haha."
Jeep,3e2jfi,calvarez,2,Tue Jul 21 16:39:43 2015 UTC,Sounds like it's time for a firmware upgrade.
Jeep,3e2jfi,xj4me,2,Tue Jul 21 16:54:46 2015 UTC,They issued one several days ago.
Jeep,3e2hyy,spacebrew,3,Tue Jul 21 13:27:41 2015 UTC,You can also touch up spots on dip with namptha. It's very forgiving. Looks great!
Jeep,3e2hyy,filthyllama,1 point,Tue Jul 21 15:10:55 2015 UTC,"namptha   I just Googled Namptha but didn't find anything related... Can you elaborate on this, please? Thanks!"
Jeep,3e2hyy,williamthe3rdd,2,Tue Jul 21 15:30:01 2015 UTC,Google Naphtha instead
Jeep,3e2hyy,filthyllama,4,Tue Jul 21 15:57:49 2015 UTC,Pre-coffee. I blame Obama.
Jeep,3e2hyy,CaptGatoroo,2,Tue Jul 21 16:26:18 2015 UTC,Looks great. I did the same. I've had it for 4 months and just have a few spots of missing dip from rock chips.   I'm thinking of redoing mine but adding the plastidip glossifier to make it just slightly more protected and it gets rid of those shiny spots and makes it look more professional.   I would recommend you do the same while it's still fresh.
Jeep,3e2hyy,CaptGatoroo,1 point,Tue Jul 21 15:26:35 2015 UTC,"I was wondering about that. I know Plasti-dip makes a protectant that you're supposed to seal it with to make it feel more like a regular paint job. I bought a can of glossifier, but I don't want it to be glossy. Would a couple of coats achieve what you're talking about?"
Jeep,3e2hyy,TechnicianOrWhateva,1 point,Tue Jul 21 15:30:51 2015 UTC,http://youtu.be/VthNA3hqDSM  This is what I'm going for.
Jeep,3e2hyy,RhinoEggs,1 point,Tue Jul 21 15:47:24 2015 UTC,Man I'm starting to think I might use a couple of coats of that gloss. Nice.
Jeep,3e2hyy,RhinoEggs,2,Tue Jul 21 15:57:23 2015 UTC,"Looks good, love me some plastidip. When it comes time for removal, save your fingertips. Peel what comes off easy, then just pressure wash the rest. Or just use some gasoline, it melts plastidip"
Jeep,3e2hyy,Holmium22,1 point,Tue Jul 21 16:34:08 2015 UTC,You can peel off the letters on the Jeep logo pretty easily if you want. You just need a steady hand. This is what mine looks like  Edit: Corrected picture link
Jeep,3e3wgf,Likitesplit113,1 point,Tue Jul 21 19:31:47 2015 UTC,"Before lift, bumper, wheels, and tires."
Jeep,3dzo81,CptSandbag73,49,Mon Jul 20 20:52:10 2015 UTC,"Whoa! I clicked on the post because I saw FFX Co Pkwy on the title and did not expect to see my jeep! This is my rig, OP. This is my daily commute since I work in Sterling!"
Jeep,3dzo81,AirWick519,8,Tue Jul 21 02:33:01 2015 UTC,"Haha word!!! I was hoping you'd see this. I was the d-bag in the shitty grey Dodge Dakota behind you if you were wondering. But once I graduate and commission, I want to do a build similar to yours, for what it's worth."
Jeep,3dzo81,AirWick519,11,Tue Jul 21 02:38:47 2015 UTC,"I'm an AF Vet so my hat's off to you! It'll take some time and money to build your rig the way you want it to but unfortunately (or fortunately, however you view it), my upgrades were due to being hit by another driver's negligence."
Jeep,3dzo81,Evan1701,8,Tue Jul 21 03:09:20 2015 UTC,Air Force all the way!! Thank you for your service.   It might be a few years though. I want to sort out my SO's college debt as a first priority... but this is definitely something I want to do down the road.
Jeep,3dzo81,EvadeTheirLies,2,Tue Jul 21 03:13:07 2015 UTC,"I got a Jeep too because of a negligent driver! I used to ride a Harley and an old man came into my lane and hit me, breaking my collarbone and scapula. I got a Jeep-sized payout, also bought my wife a new car, and we're well on our way to a down payment for a house. It's been almost a year and I'm still unsure whether it was worth it or not. I used to say it wasn't, but now... man, I love my Jeep!!!"
Jeep,3dzo81,AirWick519,1 point,Tue Jul 21 10:55:57 2015 UTC,Wheels?
Jeep,3dzo81,oGKevin,5,Tue Jul 21 19:18:15 2015 UTC,Haha! I actually saw you from my rear view! But I was more mean-muggin' at the driver next to me while she was texting and driving.
Jeep,3dzo81,papaninja,1 point,Tue Jul 21 03:03:17 2015 UTC,Cool to see another Fairfax Jeep! I'm the dark red JK around GMU if you're ever around
Jeep,3dzo81,MrBullyGoat,10,Tue Jul 21 04:05:49 2015 UTC,Are you aloud to chive and reddit???
Jeep,3dzo81,AirWick519,9,Tue Jul 21 00:38:40 2015 UTC,"I see these a lot.  Who put those on their car?  I just perused their site, it doesn't seem good enough to tell everyone you use it."
Jeep,3dzo81,NastyKnate,6,Tue Jul 21 01:51:44 2015 UTC,"The decal seemed like a good idea at the time before a lot of people knew about the Chive but now it's like a butthole, everyone has it!"
Jeep,3dzo81,AirWick519,1 point,Tue Jul 21 02:57:56 2015 UTC,just edit it. keep calm and jeep on
Jeep,3dzo81,Shibby303,4,Tue Jul 21 04:01:05 2015 UTC,"I didn't think so, but that's such a badass jeep that I think I'll allow it this one time."
Jeep,3dzo81,dajanx,4,Tue Jul 21 00:42:07 2015 UTC,I'll take it! Lol
Jeep,3dzo81,AirWick519,7,Tue Jul 21 02:58:30 2015 UTC,The license plate is pretty funny. I need one for my CJ.
Jeep,3dzo81,DsanzTJ,6,Mon Jul 20 23:25:29 2015 UTC,He needs new tires according to that tread wear.
Jeep,3dzo81,obj126,4,Tue Jul 21 00:57:03 2015 UTC,"Yeah man, no kidding! Tires took the brunt of daily commute from Aldie to NVCC campuses to GMU for a couple of years!"
Jeep,3dzo81,Thatpurplexj,4,Tue Jul 21 02:37:15 2015 UTC,Nova Jeeper here too! off Old Keene Mill and Shiplett
Jeep,3dzo81,isthisoptional,4,Mon Jul 20 22:34:54 2015 UTC,"I too am a NOVA jeeper, out here in Gainesville"
Jeep,3dzo81,idioteques,3,Mon Jul 20 22:52:20 2015 UTC,"Nova checking in here too, right off the Parkway and sydenstricker!"
Jeep,3dzo81,AirWick519,2,Mon Jul 20 22:22:27 2015 UTC,"In Fairfax for a few more weeks this summer, what's the closest trail that is newbie friendly?"
Jeep,3dzo81,Thatpurplexj,2,Mon Jul 20 23:23:53 2015 UTC,I would check out NOVA jeepers  - I believe they have group runs near by.
Jeep,3dzo81,3legna,2,Tue Jul 21 02:47:11 2015 UTC,"I used to frequent NVJA's forum when I was a member and they would post up threads for any upcoming events or wheeling trips in one of the section of the site. If you're lucky to catch it, some are user-planned and others are group-sponsored wheeling trips"
Jeep,3dzo81,THEMUDBONEMONSTER,1 point,Tue Jul 21 03:41:21 2015 UTC,George washington national forest is your closest bet. Peters mill and taskers gap are fun and stock friendly. Flag pole knob is a bit farther but the same terrain. Everything else around here isn't legal
Jeep,3dzo81,whalesalad,2,Tue Jul 21 00:47:08 2015 UTC,Hey I live in Chantilly I always see nice jeeps going up and down 50.
Jeep,3dzo81,Aryada,2,Mon Jul 20 23:57:08 2015 UTC,"NOVA jeeper here (McLean), we have a decent sized community where I am."
Jeep,3dzo81,Ninja_Duck,2,Tue Jul 21 00:01:18 2015 UTC,Wow I used to live right near Weihle and Leesburg Pike. Small world!
Jeep,3dzo81,ImmortalBacon,1 point,Tue Jul 21 01:05:20 2015 UTC,I'm off bandy run/sugarland road. Nice little neighborhood.
Jeep,3dzo81,novajk,2,Tue Jul 21 01:12:55 2015 UTC,Except for that KCCO sticker.
Jeep,3dzo81,shewantsthedj,1 point,Tue Jul 21 06:43:18 2015 UTC,Mmmm I love the narrow look of skinny tires on older jeeps and I dig the fat tires and wide look on the JK.
Jeep,3dzo81,manyouswear,1 point,Tue Jul 21 00:55:31 2015 UTC,"NOVA here, warrenton and GMU commuter. Yall got me giddy now."
Jeep,3dzo81,DocOe96,1 point,Tue Jul 21 01:20:13 2015 UTC,"NovaTJ here! JK  Club member for years, Stafford, just back from Flag Pole!"
Jeep,3dzo81,AirWick519,1 point,Tue Jul 21 01:34:53 2015 UTC,NovaJeeper here as well checking in from Fairfax
Jeep,3dzo81,ForeverAnalog,1 point,Tue Jul 21 01:36:11 2015 UTC,Herndon checking in!  Right off ffx county parkway!
Jeep,3dzo81,Private1nvestigator,1 point,Tue Jul 21 01:46:47 2015 UTC,Where does one get that Reddit decal?
Jeep,3dzo81,AirWick519,1 point,Tue Jul 21 03:06:08 2015 UTC,Not sure if he's still a mod of this subreddit but I got it from /u/rawrr_dinosaurs.
Jeep,3dzo81,safety_tips,1 point,Tue Jul 21 03:18:34 2015 UTC,NoVA Jeeper checking in from Leesburg!
Jeep,3e16b3,daglytch,4,Tue Jul 21 04:04:00 2015 UTC,Awesome. What's your tire/lift setup and which bumper is that if you don't mind me asking?  Looks like exactly what I want to do with mine in the near future.
Jeep,3e16b3,subirex,1 point,Tue Jul 21 11:22:21 2015 UTC,"Thanks! 2009 JKUR 2.5"" Teraflex spring lift. (Soon to be 3.5 or 4"") 35"" Trepadors (radial) Front: LOD signature series shorty front bumper.  Zeon 10k winch. Back: (not shown) Ace Engineering pro series with tire carrier"
Jeep,3e16b3,Valkyrie4x4,1 point,Tue Jul 21 14:02:21 2015 UTC,Hollister Hills?
Jeep,3e16b3,Valkyrie4x4,1 point,Tue Jul 21 05:08:10 2015 UTC,"Yep, last weekend"
Jeep,3e16b3,Kiriesh,2,Tue Jul 21 05:16:21 2015 UTC,Awesome to see someone from my same area on here!
