Jeep,3dydja,ry2k,1 point,Mon Jul 20 15:22:44 2015 UTC,"Speaking as an owner of both, they're both great vehicles and very similar in many ways but also VERY different in many ways. First off, the 3.8L V6 is a perfectly good engine, the 3.6L is simply a better engine. So while yes the 3.6 is more preferred, that shouldn't dissuade you from buying the 3.8L. I got my 4 door used with 33's and a 2.5"" lift for 16.3k with 72k miles. Now that they've been out for a while the cost of 4 door models used is finally coming down to reasonable prices. The sport and the sahara are equally as capable offroad, the only difference is bells and whistles. The sport is usually pretty barebones while the sahara tends to have nicer audio/leather etc. If you park on campus, you'll want a hard top. They're all good vehicles, I would seriously recommend test driving both before making a decision. Also the 2 door rear storage (with no seat) is pretty small, personally I'd shoot for a 4 door if you move often."
Jeep,3dydja,Kiriesh,1 point,Mon Jul 20 16:04:16 2015 UTC,"Thanks for the response.  And yea I really like the tacomas too, but I've always wanted to cruise down the beach with the top down & doors off, ya know?  But if I find a really good deal on a tacoma I won't pass it up.  Did you get your wrangler through a dealership or individual?"
Jeep,3dydja,Kiriesh,1 point,Mon Jul 20 16:12:37 2015 UTC,"If you're buying used, buy private party. The sole exception is if you're buying certified used, otherwise the dealership knows just as much about it as you do with just as much liability for it as the PO yet charge way more than buying it directly from the previous owner."
Jeep,3dydja,areiseye,1 point,Mon Jul 20 16:28:47 2015 UTC,Ok sounds good thank you so much
Jeep,3dydja,NotTheRightAnswer,1 point,Mon Jul 20 16:35:23 2015 UTC,"3 weeks ago I bought a new 2015 JK Sport for 24k out the door. The only option was air conditioning. That looks like it's in your budget, it's got the 3.6, and is devoid of all the bells and whistles you might remove modding it down the road."
Jeep,3dwax4,waverunner95,2,Mon Jul 20 01:51:29 2015 UTC,"Looks awesome man. What kind of lift, tires, and bumpers do you have?"
Jeep,3dwax4,pushit_pushit_realgd,2,Mon Jul 20 12:01:47 2015 UTC,"Thank you! 15"" Fuel revolver wheels with 33"" Goodyear duratracs, No lift (yet) and the Moab edition comes with the upgraded front and back AEV bumpers"
Jeep,3dwax4,anabonger,2,Mon Jul 20 12:48:48 2015 UTC,"As a fellow JKU Moab owner, I fully endorse this picture. Wheels look fantastic!"
Jeep,3dzkaq,FuttBuckhole,1 point,Mon Jul 20 20:24:24 2015 UTC,Check out zone offroad
Jeep,3e0ebt,Fargone,1 point,Tue Jul 21 00:09:33 2015 UTC,"The last information I heard was orders have already started for 2016, but delivery won't be until October. Orders for 2015 were over a month ago. The only new color I remember off the top of my head was ""Rhino."" So expect either dark grey or actual rhino liner, I guess."
Jeep,3due7q,PandoraJeep,14,Sun Jul 19 15:57:59 2015 UTC,That is one sexy restore
Jeep,3due7q,Cloo159,3,Sun Jul 19 16:09:35 2015 UTC,Haha awesome gif
Jeep,3due7q,himbimbly,12,Sun Jul 19 17:34:00 2015 UTC,You have no idea how much I envy you right now. That is one damn fine Jeep.
Jeep,3due7q,mattwire,2,Sun Jul 19 16:50:58 2015 UTC,"Thank you, it was a long process but totally worth it!"
Jeep,3due7q,thehulk0560,10,Sun Jul 19 17:34:25 2015 UTC,"My '89 Wrangler Islander edition that was given to me by my mother a few years ago. It's been in the family since' 96, but saw a lot of neglect while my step dad drove it.   4 banger, 144k miles, pretty much completely stock (except for interior) and the engine was completely redone thanks to my awesome dad/mechanic. I don't know much about the tires except they are pretty old and need to be replaced.   Also, I messed up when making my imgur album, I typed up descriptions but put them in the wrong place. Sorry!   Link to bedlining picture from older account I lost the password to- https://www.reddit.com/r/Jeep/comments/1qc6l8/bedlined_the_old_girl_last_night_loving_the/?"
Jeep,3due7q,thehulk0560,8,Sun Jul 19 16:02:09 2015 UTC,i'm drooling over the interior
Jeep,3due7q,thehulk0560,3,Sun Jul 19 16:54:29 2015 UTC,"Thanks, that's my favorite part too haha especially the red seat belts."
Jeep,3due7q,idmo,5,Sun Jul 19 17:43:13 2015 UTC,I really like that you put the radio in the console. Was that hard to do?
Jeep,3due7q,John_the_Piper,2,Sun Jul 19 16:59:16 2015 UTC,"Not too difficult, just have to run the cables a bit further then cover them so it looks nice. The console is a Tuffy media console or something."
Jeep,3due7q,RumorsOFsurF,1 point,Sun Jul 19 17:36:43 2015 UTC,What did you do to the dash hole?
Jeep,3due7q,John_the_Piper,3,Sun Jul 19 17:39:47 2015 UTC,"There is a small recessed little cubby hole there now, useless but looks nice. My dad found it, not sure where he got it. I have a picture where you can see the cables for the radio and the covered dash hole. I took it for a different reason, so excuse the angle.   http://imgur.com/N46ZrqN"
Jeep,3due7q,RumorsOFsurF,2,Sun Jul 19 17:49:42 2015 UTC,That's cool. Thanks for the picture.
Jeep,3due7q,John_the_Piper,2,Sun Jul 19 17:55:07 2015 UTC,"I had that Tuffy console in my YJ, the dash hole is perfect size for mounting a recessed CB radio."
Jeep,3due7q,John_the_Piper,1 point,Mon Jul 20 13:03:21 2015 UTC,That's what I was planning on doing with it eventually.
Jeep,3due7q,John_the_Piper,4,Mon Jul 20 23:55:05 2015 UTC,Phew! That gives me motivation to go do some work on my 87.
Jeep,3due7q,zack065,3,Sun Jul 19 16:56:46 2015 UTC,Same here.  My 88 has been sitting for almost 2 years.  I really want to restore it now.
Jeep,3due7q,justy98,1 point,Sun Jul 19 21:51:45 2015 UTC,I'll start my projects if you start yours haha
Jeep,3due7q,MaxDerps,1 point,Mon Jul 20 01:47:21 2015 UTC,Deal!  I actually fired it up the other day and moved it. My 10 year old Optima still holds a charge.
Jeep,3due7q,Elchapin,1 point,Mon Jul 20 17:06:50 2015 UTC,"Mines currently a DD, in need of a new cooling system, new brakes, wiring, and a good cleaning"
Jeep,3due7q,the-G-Man,2,Mon Jul 20 17:31:23 2015 UTC,"I honestly didn't think she could look this good again, a little bit of work goes a long way"
Jeep,3due7q,LethargicMonkey,2,Sun Jul 19 17:40:41 2015 UTC,"My Wrangler is in great shape as far as the frame and body goes, but she needs a little TLC. What did you use to coat the interior of your tub?"
Jeep,3due7q,Resevoir_Dog,1 point,Sun Jul 19 18:19:30 2015 UTC,"I used Rustoleum bedliner. It's pretty watery, It was essentially like painting the tub, I don't think it'll protect it from much. I would go with a thicker product if I were to do it again, but its not terrible. I've already had to touch up a few spots and it's only a year old."
Jeep,3due7q,Danjfreiberger,1 point,Sun Jul 19 18:34:26 2015 UTC,"The PO put that in mine, I believe. He put the original carpet back in and its in pretty decent condition, so I think I'm going to keep them both."
Jeep,3due7q,Resevoir_Dog,4,Sun Jul 19 18:48:16 2015 UTC,damn man you did a great job
Jeep,3due7q,cleancutmover,1 point,Sun Jul 19 17:01:03 2015 UTC,"Thanks! I had a lot of help, I definitely couldn't have done this in my own"
Jeep,3due7q,fergy80,2,Sun Jul 19 17:42:37 2015 UTC,Good work! Like the dog tax too.
Jeep,3due7q,epicurean56,1 point,Sun Jul 19 17:32:03 2015 UTC,"Thanks man! She was less excited than I wanted her to be, I'm slowly training her to be a Jeep Dog."
Jeep,3due7q,wolfygirl,2,Sun Jul 19 17:54:55 2015 UTC,"Wish I had a shop lift, that thing looks amazing now"
Jeep,3due7q,bobthebobofbob,1 point,Sun Jul 19 18:12:42 2015 UTC,"Lucky for me my dad has his own shop. Thanks, man."
Jeep,3due7q,omgsohc,2,Sun Jul 19 18:27:58 2015 UTC,"Congrats dude! Awesome car, I really like the emblems on the door."
Jeep,3due7q,John_the_Piper,1 point,Sun Jul 19 18:14:31 2015 UTC,"Thanks man, hell of a process but worth every bit."
Jeep,3due7q,John_the_Piper,2,Sun Jul 19 18:30:21 2015 UTC,Beautiful.
Jeep,3due7q,noise_shaper,2,Sun Jul 19 18:32:29 2015 UTC,Awesome restoration! I can't wait till I have a real job so I can fix up my busted ass jeep. At this point it's my main motivation for finishing college lol.
Jeep,3due7q,gooberzilla2,1 point,Sun Jul 19 19:29:03 2015 UTC,"That's motivation enough, I just finished my bachelor's in December, keep it up!"
Jeep,3due7q,Itsnotgivingmewhat,2,Sun Jul 19 19:41:29 2015 UTC,"See youre in Fl got a 90 that needs some work, whats the name of the shop?"
Jeep,3dvudv,b1llb3rt,3,Sun Jul 19 23:24:24 2015 UTC,"Is that trail called rock creek? I've been on that trail before, can't remember the name. I miss that place."
Jeep,3dvudv,ThePartyWagon,1 point,Mon Jul 20 03:21:53 2015 UTC,"Yes it is, We did Death trap right before and went the entire length of Rock Creek. I had the smallest rig of our group with 33""s"
Jeep,3dvudv,notafedora,2,Mon Jul 20 12:17:44 2015 UTC,"@anvil_in_distress on Instagram nearly blew his turbo and broke an axle shaft on that trail when I was there, we had a fun time getting all of the oil out of his exhaust with brake parts cleaner and a lighter in the hotel parking lot though"
Jeep,3dvudv,Sluggworth,1 point,Mon Jul 20 15:24:10 2015 UTC,"That ""trail"" is nuts"
Jeep,3dvudv,TheVaporChef,2,Mon Jul 20 05:16:42 2015 UTC,"It's called ""Rock Creek"" and it's pretty rough.  There are more difficult trails to drive at Rausch but this is pretty high up on the difficulty scale."
Jeep,3dwoo7,thecatstits,1 point,Mon Jul 20 03:58:11 2015 UTC,Mantua?
Jeep,3dwoo7,asadog,1 point,Mon Jul 20 04:32:04 2015 UTC,"Yes it was, didn't catch shit two weeks in a row so I'm done out there!"
Jeep,3dwoo7,asadog,1 point,Tue Jul 21 02:19:57 2015 UTC,Shitty. Head out there around sunset with a fly the blue gill like that lots. I got skunked at Weston Reservoir a couple weeks ago. 5 hours in the water and we didn't catch shit.
Jeep,3dwoo7,iPadycake4hire,1 point,Tue Jul 21 02:25:03 2015 UTC,What bumper is that?
Jeep,3dwoo7,iPadycake4hire,1 point,Mon Jul 20 19:44:00 2015 UTC,Poison spyder brawler
Jeep,3dxyam,ScubaSteveeeeeeee,2,Mon Jul 20 13:19:50 2015 UTC,Well...  Just so happens.  I did just this.  My 2014 was totaled and I had to have another Hydro Blue but wanted to upgrade from the Altitude edition (blacked out sahara)  to the Rubicon Hard Rock. I also must have manual.  These three things and coming up on the end of the year made it hard to get what I wanted and the local dealer wouldn't do all the leg work. So I flew from Massachusetts to Wisconsin and drove my Jeep home. 1100 Miles.  It was Awesome.  I took my daughter and we had a great road trip.
Jeep,3dxyam,AdaminBillerica,1 point,Mon Jul 20 21:44:43 2015 UTC,What part of Illinois.   And usually just check for rust on the frame and just take it for a drive. Ensure 4wd engages fine.
Jeep,3dxyam,AbrahamLeanin,1 point,Mon Jul 20 14:19:28 2015 UTC,Champaign and yeah the issue is how to do the transfer and money of and title without me being there.
Jeep,3dxyam,AbrahamLeanin,1 point,Mon Jul 20 17:14:46 2015 UTC,Private seller or dealer?
Jeep,3dxyam,HeraclesX,1 point,Mon Jul 20 17:37:38 2015 UTC,Private
Jeep,3dvu7a,Cramd,4,Sun Jul 19 23:22:51 2015 UTC,"more shots of this Jeep on the ramp can be found here: http://imgur.com/a/ajgdZ  This beast seemed to have it all, including a killer diesel conversion."
Jeep,3dvu7a,Zombiesai,2,Sun Jul 19 23:23:52 2015 UTC,I don't recognize the coilover/shock setup on that jeep. Any idea what it's called?
Jeep,3dvu7a,Zombiesai,5,Sun Jul 19 23:31:18 2015 UTC,"They are ORI struts. I've never seen them before either, but boy do they stretch!"
Jeep,3dvu7a,Patman03,2,Sun Jul 19 23:41:35 2015 UTC,"Thanks guys. I'll look them up. I'm sure I can't afford them, or need them. But that's hardly stopped me before.  Edit: wow. Somewhere in the neighborhood of $650 a piece. Super sweet but definitely for professionals and ultra jeepers only."
Jeep,3dvu7a,Nazeron,4,Mon Jul 20 01:11:08 2015 UTC,"A fellow club member of mine runs them on the front of his yj. He loves them and they replace sway bar, shocks and springs all in one nice package."
Jeep,3dvu7a,jdieter91,2,Mon Jul 20 00:18:03 2015 UTC,is that linex or something similar i see?
Jeep,3dvu7a,RokStacker,1 point,Mon Jul 20 01:38:10 2015 UTC,It is a very tough wrap called BushSkinz. Stands up to abuse really well.
Jeep,3dw3gb,Gmonst,3,Mon Jul 20 00:44:18 2015 UTC,"i'm also an xk owner.  granted i'm not doing anything nuts with it off road like a lot of the wrangler guys do but it does well.  my beef is how wide it is...  trails my xj or kj can fit down without an issue, this thing is smacking tree branches like it's its job."
Jeep,3dw3gb,loligatorific,3,Mon Jul 20 02:26:18 2015 UTC,Fucking mint.
Jeep,3dw3gb,Jordan597,-2,Mon Jul 20 03:15:18 2015 UTC,Mall crawler mint...
Jeep,3dw3gb,Money_Bags97,1 point,Mon Jul 20 20:13:28 2015 UTC,There's a picture of him on a trail.
Jeep,3dw3gb,Jordan597,4,Tue Jul 21 16:32:36 2015 UTC,"/r/pcmasterrace   Yes, I read your plate."
Jeep,3dw3gb,GiveMeAFuckingCoffee,3,Mon Jul 20 12:53:29 2015 UTC,"""PC Gamer"" plate...but...you're outside?  Weird."
Jeep,3dw3gb,my_trombone_is_rusty,3,Mon Jul 20 19:06:35 2015 UTC,Sooooo that's what Commanders are called. Was always curious. How's it handle on/off road. What are your specs?
Jeep,3dw3gb,clarksr,6,Mon Jul 20 01:15:58 2015 UTC,I didn't know that either. I actually like the looks. It reminds me of a Liberty with a boner.
Jeep,3dw3gb,Zombiesai,3,Mon Jul 20 01:34:42 2015 UTC,A freedom boner
Jeep,3dw3gb,MattKS303,2,Mon Jul 20 02:30:01 2015 UTC,Definitely need to put that sticker on my Commander. Any ideas for my Liberty?
Jeep,3dvwa8,jwthewtfkid,4,Sun Jul 19 23:40:39 2015 UTC,The best part is your back seat friend over there flashing the bird haha
Jeep,3dvwa8,ElCapitan09,2,Mon Jul 20 00:22:36 2015 UTC,"Yeeaahhhhh... I had that pointed out not long after posting. Eh, to hell with it. It can stay. I've seen worse on Reddit."
Jeep,3dvwa8,Zombiesai,2,Mon Jul 20 01:29:22 2015 UTC,At least you left the windows down for him while you were parked. Give him some water and he'll forgive you for leaving him in there.
Jeep,3dvwa8,LooksPrettySquatchy,2,Mon Jul 20 01:32:32 2015 UTC,"Or you could take off the plastic flares, or both!  That's what I did  http://imgur.com/kNzXE5y"
Jeep,3dvwa8,LooksPrettySquatchy,2,Sun Jul 19 23:48:17 2015 UTC,"I just looked at this post, and just looked a MC fenders. I want some so, so bad. Too bad being 16 without a job hinders that decision. I really might take the flares off."
Jeep,3dvwa8,vbaspcppguy,1 point,Sun Jul 19 23:58:21 2015 UTC,"Haha yeah any full replacement for YJs TJs and LJs are gonna be expensive cause there's a lot of metal to replace.  Another option is just to trim the plastic, which I did very shitily before buying the Metalcloaks"
Jeep,3dvwa8,THEcannon6,1 point,Mon Jul 20 00:00:47 2015 UTC,"In all seriousness, Ebay. The seller e-autogrilles and a couple others. It's chinese stuff, but it gets pretty good reviews on forums. Although, I just looked and they don't have much for YJ flares listed right now but they usually do."
Jeep,3dvwa8,asadog,2,Mon Jul 20 09:18:07 2015 UTC,we are bumper bros
Jeep,3dvwa8,Gnarnar,0,Mon Jul 20 03:52:45 2015 UTC,Did you get the Shittybilt too?
Jeep,3dvwa8,asadog,2,Mon Jul 20 05:29:10 2015 UTC,Just use the Sawzall... https://imgur.com/a/sBip4
Jeep,3dvwa8,somewhere_in_VT,1 point,Mon Jul 20 04:33:49 2015 UTC,Did you relocate the hood latches or fuck em?
Jeep,3dwbqr,jimm7y,1 point,Mon Jul 20 01:59:04 2015 UTC,Ikea parking lot!
Jeep,3dwrtr,TerkRockerfeller,2,Mon Jul 20 04:29:14 2015 UTC,"I always love going up there. But I have to ask, what's with the LEDs?"
Jeep,3dwrtr,PyroPhan,1 point,Mon Jul 20 06:19:56 2015 UTC,Which ones? Not sure what you mean
Jeep,3dwrtr,PyroPhan,3,Mon Jul 20 06:24:33 2015 UTC,The flashing LEDs in the windshield?
Jeep,3dvahi,TypicalWhiteKid,1 point,Sun Jul 19 20:35:27 2015 UTC,She looks good without makeup.
Jeep,3dvahi,nophoney,1 point,Sun Jul 19 22:41:42 2015 UTC,She's all natural.
Jeep,3dvrf9,GranfatherGlock,4,Sun Jul 19 22:59:04 2015 UTC,Tell me everything.
Jeep,3dvrf9,evilpuke,1 point,Mon Jul 20 01:31:01 2015 UTC,"Sure! I've had this on the back burner for a while. I did this now because I blew a fuse for my electric fan on my ZJ at a water crossing last weekend. I bought a 5 pack of relays with harnesses, and two 6 position terminal strips off of amazon. The fuse block I already had laying around, but I got it from a parts store, I think. I wired it up like any normal relay, only five times. The ground for each relay is soldered together so they only share a single wire bolted to ground. The wire from the switch goes to one terminal block, and the wire to the accessories goes to another(it looks like there's only one terminal step because I stacked then for space saving). The power wires are all separate on the fuse block using an appropriately sized fuse. The terminal strips make it super easy to connect and disconnect accessories. Having everything labeled, organized, and in one spot is another big plus. Now that everything is laid out, I can go out and get a waterproof box of the correct size. That should solve my fuse blowing problem!  Also, it complements the switch panel I just finished!"
Jeep,3dvrf9,evilpuke,2,Mon Jul 20 01:45:55 2015 UTC,Looks pretty dope yo
Jeep,3dvrf9,hydrogenous,1 point,Mon Jul 20 12:18:47 2015 UTC,Thanks man! It's nice to finely clean up the rats nest of wires under the hood.
Jeep,3dvrf9,Nathan_reynolds,1 point,Mon Jul 20 12:25:33 2015 UTC,"Dude, that switch panel deserves a post of its own! Looks very clean.  Do you use bladed crimp connectors or do you solder to the switch? I don't really trust crimp connectors anymore..."
Jeep,3dwd7f,1makfly,3,Mon Jul 20 02:11:44 2015 UTC,TL;DR: Unibody. Boo.
Jeep,3dwd7f,GOA_AMD65,2,Mon Jul 20 13:16:45 2015 UTC,Thumbnail is not a picture of the new Grand Wagoneer.  There is no picture in the article.  The picture is one of the really cool Jeep concepts that never get turned into real cars.
Jeep,3duu8z,bigmiker,4,Sun Jul 19 18:18:18 2015 UTC,Welcome to the family brother! Any idea of future mods?
Jeep,3duu8z,clarksr,2,Mon Jul 20 00:34:22 2015 UTC,"I have an excel spreadsheet filled haha. It's already lifted 3 inches, so 33s next month. Front bumper, winch and rear bumper with tire carrier in the next 2 weeks. Led lighting soon too"
Jeep,3duu8z,clarksr,2,Mon Jul 20 01:36:41 2015 UTC,Nice! What kind of tires and what brand bumpers?
Jeep,3duu8z,IGotYourMaam,1 point,Mon Jul 20 10:20:29 2015 UTC,"I'm a college student so not much money to overspend lol, so barricade bumpers. I like the dick cepak wheels with either general grabbers or good year wrangler duratracs"
Jeep,3duu8z,IGotYourMaam,2,Mon Jul 20 12:19:28 2015 UTC,"Can I ask the stats? Mileage, manual/auto , cost?"
Jeep,3duytp,shawndabrookebays,2,Sun Jul 19 18:56:40 2015 UTC,It has been so long since I have seen a stock one that I forgot how low they sit.
Jeep,3duytp,Skwirlman,1 point,Mon Jul 20 03:02:29 2015 UTC,Such a clean looking Jeep!! Love it.
Jeep,3duytp,waverunner95,1 point,Sun Jul 19 19:40:47 2015 UTC,Need a boob job! But beautiful
Jeep,3dvig4,markymarksprow,2,Sun Jul 19 21:42:47 2015 UTC,"2001 XJ Sport. Totally rust free (yes even underneath) with 133K miles. I've wanted to join the XJ club for about 2 years and finally found one in my price range ($4000). Super excited to start modding, but it's going to be my DD in college this fall, so the typical 4"" lift and 31"" tires is not going to happen. Lots of painting, leveling, a roof rack, lighting, and sound quality audio work to be done to this thing!"
Jeep,3dvig4,aussie_jason,2,Sun Jul 19 21:46:45 2015 UTC,"Why would you paint it? At least in the pic the paint looks great. Just get a cheap aftermarket head unit with Bluetooth to upgrade the audio, no need to go all out, you're still going to have tons of road noise so pumping $ into a sound system is kind of a waste.  It looks like the rear is just sagging due to old leaf springs so the only leveling I would do is to replace them, no need to mess with blocks or the like. For lighting definitely upgrade the headlight harness, if you search this sub (actually no, you should search /r/CherokeeXJ not here )for headlight you will get some quality results on how to do that.  With the roof rack I would advise to leave the factory rails on even if they aren't needed otherwise you will have to deal with rust around the nutserts once they are exposed to the elements, which is something on my todo list to address."
Jeep,3dvig4,JustEmptyEveryPocket,1 point,Mon Jul 20 04:01:57 2015 UTC,"I work in the car audio industry, so having a bitching system is pretty much a must. In terms of road noise, Stinger makes a great product called RoadKill to kill engine and road noise. The faded trim is annoying, and the clear coat is pulling up on a few different spots.   I've looked for some leaf springs, I've heard I can take some off an S10... Is that true?   I like the headlights they are brand new, but you aren't the first person to advise for the beefier harness so that'll be on that list.   And yes agreed on leaving the factory rack. The one I was planning on getting does utilize them so I should be in great shape.   I've also heard that I can replace the brakes with Jeep WJ brakes, is that also advised? The perks are apparently a huge improvement in stopping power Nd I think they are a little cheaper."
Jeep,3dvig4,TheMelonKid,3,Mon Jul 20 05:16:15 2015 UTC,"-I'm not so sure that replacing old worn out leaf springs with different old worn out leaf springs is a good idea even if they do fit. I can't comment on whether S10 springs would actually work or not, never heard of it til now. If you're going through the trouble of replacing them it's worth it to buy new parts in my opinion. That will definitely lift the truck back to stock height.  -Why do you feel the need to replace the factory harness for the headlights? My factory harness has 235k miles on it with no signs of wear or overheating issues on the wires. I just did a motor swap on my XJ last month and saw them up close while removing the grill. Sounds like a waste of money unless you're having issues with your sealed beams or upgrading to higher than stock wattage bulbs. Not saying it wouldn't be an improvement, I just don't see it as being necessary. It is easy and cheap though, so have at it.  -My wife and I own several jeeps. (2 XJ's, 1 WJ, and 1 TJ) The WJ uses a 16"" wheel (17"" for the V8 models) and your XJ uses a 15"" wheel. The calipers are usually sized as big as possible to get the best braking performance. I read several reviews saying they made 15"" rims fit on their WJ's but had to grind a little or had to use pretty thin rims. Officially Jeep says that 16"" rims are the MINIMUM size for a WJ. This translates to if you use the calipers, rotors, and pads for a WJ on your XJ you'll likely need a 16"" wheel to compensate for the size, or at least a thin walled 15"". You will definitely see an improvement in braking performance over the standard XJ braking system. Just beware you might need new wheels and tires to make it work. And don't bother getting the wheels and tires off the WJ you're pulling the brakes from because WJ's use a 5x5 bolt pattern and your XJ uses 5x4.5.   Hate to be the devil's advocate but wanted to offer an informed opinion from someone with experience in the subject.  Tl;dr - Use new leaf springs for your XJ, changing headlight wiring harness is unnecessary but wouldn't hurt, and you'll likely need 16"" wheels for a brake system swap with a WJ."
Jeep,3dwmfy,linuxguy192,3,Mon Jul 20 03:36:25 2015 UTC,Probably in the 15 -17k range but it has to be the right buyer. If you try to sell it to a dealership or someone who's looking at kbb they're going to tell you 5k.
Jeep,3dujw3,OlDrtyHorton,1 point,Sun Jul 19 16:49:41 2015 UTC,What size tires are those?
Jeep,3dujw3,Calebwotring5,1 point,Sun Jul 19 22:05:24 2015 UTC,35s
Jeep,3dtztx,MerakiHD,15,Sun Jul 19 13:23:17 2015 UTC,I'd like to inform you that you're doing it right.
Jeep,3dtztx,eroriguez93,4,Sun Jul 19 14:39:26 2015 UTC,Thank you!  I've been DYING to go off road.
Jeep,3dtztx,dweck451,5,Sun Jul 19 15:14:26 2015 UTC,You're gonna slowly be cleaning mud out of the inside for the next few months. You will see it in the vents in the speakers behind the dash. Good luck I went through the same recently.  http://i.imgur.com/I4k2sfe.jpg
Jeep,3dtztx,dweck451,3,Sun Jul 19 13:32:34 2015 UTC,It's definitely mostly the front passenger side. And the back seat lol the seat covers saved the seat.
Jeep,3dtztx,TheMelonKid,4,Sun Jul 19 14:15:44 2015 UTC,I recommend you take out all the seats/ plugs and powerwash the whole inside. Once everything's out you might as well bed line the whole thing.
Jeep,3dtztx,dweck451,1 point,Sun Jul 19 15:03:14 2015 UTC,How much would it be to bed line it? Is it just in a spray can?   Also I don't really have access to a power washer so I mean would a hose work? 😂
Jeep,3dtztx,dweck451,3,Sun Jul 19 15:13:41 2015 UTC,"You can buy a nozzle that simulates a power washer, however a hose won't help. Dried caked on mud doesn't come off easy."
Jeep,3dtztx,guerochuleta,3,Sun Jul 19 15:45:36 2015 UTC,Well that's the plan then!
Jeep,3dtztx,thecatstits,3,Sun Jul 19 16:01:45 2015 UTC,It cost me about $95 with buying the Bedliner and a sander to rough up the surface: http://i.imgur.com/Bsy3OUj.jpg http://i.imgur.com/cvfMAAf.jpg
Jeep,3dtztx,aelwero,1 point,Sun Jul 19 18:21:05 2015 UTC,Is that the stock radio? If not we have the same exact one lol
Jeep,3dtztx,dbotamous,1 point,Mon Jul 20 21:58:50 2015 UTC,"No, it's a kenwood unit"
