Jeep,3dr9ny,m4ttr33d,2,Sat Jul 18 21:06:04 2015 UTC,I have a 6 plus also I use a Panavise bracket that uses 2 of the radio screws to mount it. I'm also using a Rockform case which has a rare earth magnet embedded in the back anti slip pad. Since the Panavise bracket is steel the phone sticks really well.  It's pretty much the perfect setup for me.
Jeep,3dr9ny,Grandmastrgusto,2,Sat Jul 18 22:22:33 2015 UTC,"I put a lot of thought into this, and created a solution that is a mix of things. Here's my original post: http://www.reddit.com/r/Jeep/comments/3a8vs0/cell_phone_mount_had_to_get_it_right_part_links/  Basically started with the Rugged Ridge dash mount, but the phone holder was flimsy and out of reach, so I attached a RAM mount arm to the camera socket and then a Scosche magnetic mount to that. I love it. Looks clean and custom, super sturdy, and the phone position is perfect.  Edit: more pics of the set up: http://m.imgur.com/a/B9qfl"
Jeep,3dr9ny,NikonD3s,2,Sun Jul 19 03:23:52 2015 UTC,Not specifically for iPhone but I use this for my Note 4.  http://www.amazon.com/dp/B00JRGOKQ8/ref=cm_sw_r_udp_awd_vLPQvb8BR2JXP  Very adjustable and stays on through the heat in Houston.  It has adhesive on the suction cup so make sure it's where you want to keep it when you put it on.  It's not impossible to take off and move but it's not easy.  The clamps hold the phone well and are easily engaged/released.
Jeep,3dr9ny,miked1be,2,Sat Jul 18 18:26:21 2015 UTC,"Got this one for my dad for Christmas, he loves it. It seems like a real solid phone mount, might have to pick one up for myself."
Jeep,3dr9ny,lionlocks79,2,Sat Jul 18 20:21:31 2015 UTC,"I second this holds really well, and the holder release is a really simple really clever device."
Jeep,3dr9ny,therealrico,1 point,Sat Jul 18 20:58:42 2015 UTC,The Clever Grip
Jeep,3drwek,bschinz10,5,Sat Jul 18 21:32:58 2015 UTC,"This is going to sound weird but a rubber cleaning glove, one of those rubber coated garden gloves, or a squeegee. The rubber holds onto the hair and works amazingly well.  I have 2 dogs and 2 cats and this is how I get the hair out of the stairs."
Jeep,3drwek,Photojared,1 point,Sat Jul 18 22:16:44 2015 UTC,http://www.amazon.com/Fur-Zoff-00003-Pet-Hair-Remover/dp/B003465G9M
Jeep,3drwek,peanutbuttergoodness,1 point,Sun Jul 19 15:52:40 2015 UTC,"I'm a vet and my dog and everyone else's is in mine a lot. I have car seat covers to help protect, but hair is inevitable. Short hair is impossible to get out. I had a CRV for 8 years, and honestly it looked pretty good how often my dog was in it with me.  He literally is in my vehicle every single day at least once.    Treat the source. Even with shepherds, regular bathing and brushing will cut down a lot on the hair. Use a rake, furminator, or stripper brush. Important is actually a really good shampoo. Then they shed less.    I tend to throw a blanket down just to keep the hair from the cracks a lot. It helps. Not as much of a pain in the ass as covers.  Easy to swap out.   lint rollers are a lot of work. I did pick up one of those as seen on TV sticky buddys. It does help gather the hair even out of Cracks so it's easier to pick up. Similar to the rubber glove idea.  https://www.stickybuddysale.com/?mid=1453515 A trick I still use is to spray static guard on all the seats regularly. Helps a ton!!!! So much easier to vacuum it out when the time comes."
Jeep,3drwek,alwayswithlove,1 point,Sun Jul 19 18:25:47 2015 UTC,50/50 fabric softener and water in a spray bottle.  Lightly spray area and it should vacuum right up ;)
Jeep,3drwek,MochaPancake,0,Sun Jul 19 21:50:34 2015 UTC,"I used to detail cars, if you have an air compressor get a blow gun attachment or whichever it is called. Also anything rubber tends to work well. Both in combination helped with tighter spots. Last few hairs I would just use tweezers."
Jeep,3drwek,romasoccer,-1,Sun Jul 19 02:18:00 2015 UTC,Rip out the carpet and put some nice mats in.
Jeep,3dof3q,bobchuckx,10,Fri Jul 17 22:49:38 2015 UTC,Just bought this beauty about a month ago in Eastern Washington (nice dry air!) and drove it down to New Orleans after having the transmission rebuilt. Only 47000 miles!
Jeep,3dof3q,JohnnyReefe,1 point,Fri Jul 17 22:51:16 2015 UTC,Beautiful Jeep and a great buy! What is the back like? Does it have another row of seats or is it just a flat bed?
Jeep,3dof3q,JohnnyReefe,3,Fri Jul 17 23:34:15 2015 UTC,"Yes, it has the passenger seat row, which is in pristine condition. It looks like no one ever sat in it. The original carpet is in so so condition, but all the trim and accessories look fantastic."
Jeep,3dof3q,frazzledrobot,1 point,Sat Jul 18 00:07:38 2015 UTC,Thats cool as hell. Do you plan on doing any lifts or anything?
Jeep,3dof3q,Telefunkin,2,Sat Jul 18 02:24:02 2015 UTC,"I want to try and keep it looking stock for now. My wife works in film and tv, I might be able to make some money renting it as a picture car to a tv show or movie."
Jeep,3dof3q,Telefunkin,1 point,Sat Jul 18 18:31:04 2015 UTC,beautiful
Jeep,3dof3q,Sumguy42,1 point,Sat Jul 18 02:55:08 2015 UTC,Where in eastern Washington?
Jeep,3dof3q,Treefifty15555555555,1 point,Sat Jul 18 18:04:59 2015 UTC,Pasco. I live in New Orleans but I travel to northern Idaho to visit my dad from time to time. When I'm there I always check craigslist for jeeps and land cruisers. The air is very dry so the bodies of older vehicles are usually in good shape. My persistence paid off finally!
Jeep,3dof3q,deafy_duck,1 point,Sat Jul 18 18:33:19 2015 UTC,Holy shit. I'm from Richland. Right across the river. Yeah. That place is a great place to have a car stored.
Jeep,3dof3q,weelluuuu,1 point,Sun Jul 19 02:38:42 2015 UTC,"Lived in Richland in the 80's for a few years, my dad worked at Hanford. I went to Hanford Elementary which doesn't exist anymore."
Jeep,3dof3q,WestCoastSide,1 point,Sun Jul 19 03:18:59 2015 UTC,Nice man.  I like the 2 door SJs.  360? 401? Do tell.
Jeep,3dof3q,gramkrakerj,2,Fri Jul 17 23:54:57 2015 UTC,"Compression is right on the money. Leaking a little oil but not bad. She sat in a garage for maybe 15 years or so and the fuel system is pretty screwed up. Fuel pressure was super low when I bought it. I put a new fuel pump in which got the pressure up to normal but I still have problems when the tank starts to get low so I'm guessing there's a lot of crap at the bottom of the tank, so my next move is a new gas tank. The weird thing about this particular Chief that I've never seen before is the ""Travel Tanks"". It has two gas tanks, the main tank switches over to the auxiliary tank automatically when its empty. On the dash is a switch for the gas gauge to show how much fuel is in each tank. Kind of crazy. I'd like to replace it with the original Travel Tank system but that seems unlikely."
Jeep,3docx5,scarletjku,39,Fri Jul 17 22:31:26 2015 UTC,The chances that this thing has ever seen a trail in its life is slim to none.
Jeep,3docx5,clarksr,6,Sat Jul 18 02:03:01 2015 UTC,Mall Rated.
Jeep,3docx5,litefoot,3,Sat Jul 18 10:57:15 2015 UTC,Hang around till owner gets bored and buy it for a lot less than they paid for all that junk. Sell the garbage and use the cash to remove the mall crawler look.
Jeep,3docx5,Zombiesai,2,Sat Jul 18 17:01:43 2015 UTC,"Everyone who drives a Jeep is in the Jeep club, didn't you get the memo? /s"
Jeep,3docx5,motleyjeep,9,Sat Jul 18 17:44:03 2015 UTC,Looks like a Starwood motors jeep
Jeep,3docx5,fulltankofgas,26,Sat Jul 18 04:21:09 2015 UTC,"Well, it is ugly as shit IMO but I'm still jealous of some of those upgrades."
Jeep,3docx5,numbNunspoken,10,Fri Jul 17 22:36:06 2015 UTC,"Yeah, I think the fenders are awesome. MetalCloak makes some good looking products."
Jeep,3docx5,CaliKido,2,Fri Jul 17 23:32:50 2015 UTC,Defiantly not how I would upgrade a JK... Agreed that like 1/5 of me is jealous tho
Jeep,3docx5,ScubaSteveeeeeeee,14,Sat Jul 18 02:16:21 2015 UTC,Why are you so defiant?
Jeep,3docx5,Minatorious,6,Sat Jul 18 03:36:29 2015 UTC,The rims and lights are hilarious
Jeep,3docx5,Michaelbama,6,Sat Jul 18 02:29:53 2015 UTC,"There are some sick ass Jeeps around here, but I'm not a fan of this one tbh"
Jeep,3docx5,-Theis,7,Sat Jul 18 02:55:17 2015 UTC,Is that near a mall by any chance?
Jeep,3docx5,iPadycake4hire,2,Sat Jul 18 01:02:21 2015 UTC,"That is actually downtown birmingham so, pavement everwhere"
Jeep,3docx5,Parabola605,6,Sat Jul 18 14:41:12 2015 UTC,Well...I think it looks cool AF. 10/10 would drive. 11/10 with rice.
Jeep,3docx5,DrGoose53,2,Sat Jul 18 02:24:25 2015 UTC,"What is that, like painted bedliner?"
Jeep,3docx5,TexMarshfellow,3,Sat Jul 18 01:08:23 2015 UTC,"I'm pretty sure it's Line-X Body Armour, which is put on like regular bedliner but a bit thinner and lighter"
Jeep,3docx5,Bpjk,2,Sat Jul 18 03:08:29 2015 UTC,There's not much he's not spotting with the amount of money he has in lights. Especially if they're Rigid.
Jeep,3docx5,einulfr,2,Sat Jul 18 01:47:31 2015 UTC,Jesus Christ all of those LED's are probably worth more than my XJ.
Jeep,3docx5,Grizzlypaws,2,Sat Jul 18 05:35:45 2015 UTC,"Alabama Power (HQ in Bham) had ordered some company Jeeps to use around the city.  An employee decided to take off the top and ride around the city in it. I don't know what there is to learn from that story, but I always find it pretty funny. Gotta control those urges!"
Jeep,3docx5,rLeJerk,6,Sat Jul 18 19:09:55 2015 UTC,Spotted on 4th Ave North outside of the FedEx building if anyone is familiar with the area. Didn't get a chance to speak with the owner unfortunately. Looks like it came right off the dealer's lot or right out of Starwood's factory.   Rear view: http://i.imgur.com/C7BVHzH.jpg
Jeep,3docx5,schlonghair_dontcare,14,Fri Jul 17 22:34:08 2015 UTC,"Oh god, those wheels..."
Jeep,3docx5,mantich92,13,Sat Jul 18 02:51:58 2015 UTC,"I mean I'm all for doing whatever you want with your ride, whether it be a mud coated monster on the trail or a sparkling sight to see in the parking lot at the mall....  ....but fuck are those wheels ugly as homemade sin."
Jeep,3docx5,Money_Bags97,6,Sat Jul 18 03:03:31 2015 UTC,The back screams I'm a hummer h3 wanna be. Only thing I like is the shade of blue line x
Jeep,3docx5,mantich92,2,Sat Jul 18 04:20:23 2015 UTC,If I wanted a hummer I'd call your sister
Jeep,3docx5,Beesto5,1 point,Sat Jul 18 22:06:28 2015 UTC,"That's not very nice from a fellow zj owner,plus I don't have a sister haha"
Jeep,3docx5,ZaneMasterX,2,Sat Jul 18 23:54:02 2015 UTC,"Jesus Christ man. It didn't look too terrible in the first picture, but those wheels... Might as well not have a back window either, that spare is up so high."
Jeep,3docx5,Imperial_Stout,1 point,Sat Jul 18 05:35:43 2015 UTC,Needs more bling.
Jeep,3docx5,einulfr,1 point,Sat Jul 18 13:31:16 2015 UTC,why are there so many lights...
Jeep,3docx5,craigjclemson,1 point,Sat Jul 18 15:38:45 2015 UTC,Lights are the new brocessory. Never mind the fact that they're illegal to use anywhere but off-road.
Jeep,3docx5,adamlewis25,1 point,Sat Jul 18 19:20:27 2015 UTC,The paint on those rims seems to be in suspiciously perfect condition.
Jeep,3docx5,b1gv3rn,2,Sat Jul 18 19:09:41 2015 UTC,Gross
Jeep,3docx5,Tragyn,-2,Sat Jul 18 00:35:07 2015 UTC,Lots of paint weight
Jeep,3docx5,TexMarshfellow,4,Fri Jul 17 22:56:39 2015 UTC,The paint weight at this point is negligible.
Jeep,3docx5,vbaspcppguy,2,Sat Jul 18 01:31:28 2015 UTC,"Actually, if that's the Line-X ""Body Armour"" stuff (which it looks like it is), then it's ""only"" 50-75lbs. Which I know is still quite a bit, but it's not really that much to add overall. I've filled coolers up to weigh more than that."
Jeep,3docx5,b1gv3rn,1 point,Sat Jul 18 03:07:29 2015 UTC,I actually contacted MonstaLiner and their guy figured about 30lbs on a JKU.
Jeep,3docx5,TexMarshfellow,1 point,Sat Jul 18 11:05:13 2015 UTC,"That's some weight tho. Imagine an extra ""caddy"" from the gym in your passengers seat."
Jeep,3docx5,Farleymcg,9,Sat Jul 18 12:28:33 2015 UTC,"Jesus, fuck off bot"
Jeep,3docx5,rioryan,1 point,Sat Jul 18 03:08:00 2015 UTC,It's really interesting to see this type of paint job/coating in person. Definitely an interesting look.
Jeep,3drgz2,Pete599,2,Sat Jul 18 19:16:54 2015 UTC,It's not going to match the paint unless you get matching paint and paint over. That's why most people go with a different color. What color are your fenders? I would go with matching that instead of the white. Or go crazy and paint the fenders along with the grill so that they do match.
Jeep,3drgz2,DragonsFyre,1 point,Sat Jul 18 20:59:16 2015 UTC,"My fenders are black, I see what you're saying now"
Jeep,3do6s9,jagrbomb,2,Fri Jul 17 21:41:08 2015 UTC,"That LJ man, LJs are best"
Jeep,3do6s9,_BETTY_WHITE,2,Sat Jul 18 03:08:28 2015 UTC,Have LJ. Can confirm.
Jeep,3do6s9,ForeverAnalog,1 point,Sat Jul 18 17:28:51 2015 UTC,"I couldn't be happier with my TJ to LJ upgrade, and it's still stock. So much more room for activities"
Jeep,3do6s9,_BETTY_WHITE,2,Sun Jul 19 00:19:28 2015 UTC,Nice tits
Jeep,3do6s9,I_AM_THE_LIQUEUR,1 point,Sat Jul 18 05:39:25 2015 UTC,"Man, too bad they're not all topless"
Jeep,3do6s9,MrKrinkle151,2,Fri Jul 17 23:38:24 2015 UTC,"Honestly, I prefer top off OR doors off... I like the look of just one of those better... could just be me being weird"
Jeep,3do6s9,poop_flinging_monkey,2,Sat Jul 18 01:43:08 2015 UTC,"It was a joke to follow the ""sun bathing babes"", dude."
Jeep,3do6s9,MrKrinkle151,1 point,Sat Jul 18 07:33:29 2015 UTC,"Every time I talk myself into not wanting an LJ and being content with my TJ, I see one and it all goes out the window. They're the best of ALL WORLDS"
Jeep,3dpdyd,Photojared,8,Sat Jul 18 04:12:56 2015 UTC,This is waiting at home for a LS swap.  Ordered motor mounts this past week.  http://imgur.com/hLf5ECw
Jeep,3dpdyd,aykalper,2,Sat Jul 18 04:15:28 2015 UTC,"Actually, you've got a great fleet: Civic Si and Jeep"
Jeep,3dpdyd,lionlocks79,1 point,Sat Jul 18 12:21:25 2015 UTC,Thanks!
Jeep,3dpdyd,lionlocks79,2,Sat Jul 18 22:12:44 2015 UTC,Is that a 15 SI?
Jeep,3dpdyd,bobthebobofbob,2,Sat Jul 18 20:23:04 2015 UTC,Yep!  Had it for about 3 months.  It already has over 5k miles!
Jeep,3dpdyd,SeattleOverSF,1 point,Sat Jul 18 22:13:21 2015 UTC,"Nice! I work at a Honda dealership and I'm always jealous watching people drive away in their 15's, they're definitely I nice car"
Jeep,3don8k,KurtX22,6,Sat Jul 18 00:00:45 2015 UTC,"Really cool Jeep, but I can't help but feel like I've see it before...   oh that's right, looks exactly like mine  http://imgur.com/gallery/NfG4iSL/new?forcedesktop=1"
Jeep,3don8k,OlDrtyHorton,4,Sat Jul 18 01:44:38 2015 UTC,I definitely thought you were about to call OP a bundle of sticks.
Jeep,3don8k,downhillcarver,3,Sat Jul 18 10:24:07 2015 UTC,Nice! Yours is a little cleaner than mine.
Jeep,3don8k,OlDrtyHorton,5,Sat Jul 18 01:55:51 2015 UTC,I plan on fixing that this weekend. Where did you get those seat covers?
Jeep,3don8k,b1gv3rn,1 point,Sat Jul 18 12:59:21 2015 UTC,"Ha, Couldn't tell you. They actually came with the Jeep. I can check what brand they are for you though."
Jeep,3dod4n,John_the_Piper,3,Fri Jul 17 22:33:14 2015 UTC,The ole' Whidbey Island Jeeperoo
Jeep,3dod4n,Karitz,3,Sat Jul 18 07:21:25 2015 UTC,Arlington jku checking in! I'm so guilty of doing this.
Jeep,3dod4n,nwbartender,2,Sat Jul 18 21:48:22 2015 UTC,"Small, Medium, Large"
Jeep,3dod4n,mccracking,2,Sat Jul 18 02:53:56 2015 UTC,Is yours red or white?
Jeep,3dod4n,Curtofthehorde,1 point,Sat Jul 18 04:00:36 2015 UTC,Mines the 'lil white one in the middle. I have my eye on some second hand lift shackles to give me a boost until I get the more important stuff situated.
Jeep,3dod4n,deafy_duck,1 point,Sat Jul 18 04:15:59 2015 UTC,Hah I'd be the guy on the Boulevard parking next to a buncha jeeps since I don't have one of my own yet.
Jeep,3doly0,Sharkbait_2,3,Fri Jul 17 23:49:24 2015 UTC,That's a nice ford!
Jeep,3doly0,GSR_b17,4,Sat Jul 18 01:48:23 2015 UTC,Thanks! The funny thing is that truck has been in a barn for the past 5 years but I got it out about 2 or 3 months ago and took it back to town and got it to where it is now!
Jeep,3doly0,TexMarshfellow,2,Sat Jul 18 02:08:13 2015 UTC,"Diggin the tow rig, OP"
Jeep,3doly0,asadog,1 point,Sat Jul 18 03:28:04 2015 UTC,Welcome to the club! https://i.imgur.com/Y4h2s8l.jpg
Jeep,3dr2ua,getyashinebox,1 point,Sat Jul 18 17:14:52 2015 UTC,"I do not, have not owned one, nor have been in one, so take this as you wish. If you can get passed the looks of them, some people like the look of them, a lot of people don't but that's all opinion based, they sound like pretty good vehicles. I haven't really heard one bad thing about them other than the appearance. I hear the ride is quite comfortable and are an all around great vehicle. YouTube them and look at some reviews, they may have insights from owning them that I can't give you. So, looks aside, it seems like a fairly decent daily driver!"
Jeep,3dr2ua,cjb211,1 point,Sat Jul 18 18:58:05 2015 UTC,One of my clients has one.  His wife loves it.  He loves it except for the transmission.   He says he hates how and when it shifts.  He said it seems to always be going into the wrong gear in his mind.   But he did say other than that he likes it.
Jeep,3dr2ua,AdaminBillerica,-1,Sat Jul 18 19:07:24 2015 UTC,I had a 2011 jeep grand Cherokee  until Thursday when it got totalled in a head on collision with a Ford escape  (so a littke smaller than my car). Both me and the other driver going about 50 mph and I was able to crawl out of my jeep with just a broken foot (Other driver had broken arm and leg). I loved my car a lot and am very sad it is gone now. I wouldn't hesitate to get another one. It's definitely not an off road type like the wranglers are but I drove it daily and it had about 80k miles in it.  I did notice the transmission was getting a little tired on me but I drive my cars really hard too. Go take one for a test drive your wife will love it.
Jeep,3dr2fm,TechnicianOrWhateva,1 point,Sat Jul 18 17:11:05 2015 UTC,"Better selection is why I went with 245/75/16. Keep in mind if you are not lifted, you might get some rubbing.  Of those two, I'd go with Cooper, but only due to past secondhand experiences with kumho. I wouldn't trust them off-road."
Jeep,3dphql,termanader,1 point,Sat Jul 18 04:52:48 2015 UTC,"I like how my YJ has 33's, 4"" springs, and 1.25"" boomerang shackles, but a stock 4 door JK can out flex it by miles."
Jeep,3dphql,ABusFullaJewz,1 point,Sat Jul 18 09:08:52 2015 UTC,"37s, 1/2"" booms, 4"" springs and my YJ can flex more than that."
Jeep,3dpavn,endeavour3d,1 point,Sat Jul 18 03:42:11 2015 UTC,Where you live ill sell you my 96 4.0 zj
Jeep,3dpavn,burny36,1 point,Sat Jul 18 13:53:58 2015 UTC,I live in Sandusky Ohio and I'm looking to buy a 4.0 zj
Jeep,3dpavn,Zacaton,1 point,Sun Jul 19 22:24:37 2015 UTC,I'm sure you can buff that out. You just need a lot of elbow grease ;)
Jeep,3dpavn,dm0untain,1 point,Sat Jul 18 13:57:10 2015 UTC,Buggy time!
Jeep,3dpavn,Texploration,1 point,Sat Jul 18 14:37:42 2015 UTC,killed?  more like Trail Rig!!
Jeep,3dpavn,AdaminBillerica,1 point,Sat Jul 18 15:14:06 2015 UTC,"Never let your mom barrow your jeep. My mom got hit using my first one and it was totalled. Now I have another and this one's lifted. Nobdy wants to drive it because of all the wonky things a lift does to handling, and I'm just fine with that."
Jeep,3dpavn,jeepinfreak,-5,Sat Jul 18 17:35:33 2015 UTC,Never let a chick drive your Jeep dude :-)
Jeep,3dpd2p,MattKS303,3,Sat Jul 18 04:04:32 2015 UTC,Stock JK high five*
Jeep,3dpd2p,DougGaveld,4,Sun Jul 19 08:12:01 2015 UTC,Something something disconnect swaybar
Jeep,3dpd2p,LooksPrettySquatchy,1 point,Sat Jul 18 07:47:07 2015 UTC,Didn't think you could on a sport without modding?
Jeep,3dpd2p,lifelite,2,Sun Jul 19 17:15:14 2015 UTC,It's just a 13mm bolt to take off the links.  You can install quick disconnects though
Jeep,3dpd2p,LooksPrettySquatchy,1 point,Sun Jul 19 17:23:05 2015 UTC,Oh yeah? Didn't know that!  Thought only rubis have them.
Jeep,3dpd2p,lifelite,1 point,Sun Jul 19 18:32:34 2015 UTC,"Nope, all Wranglers and pretty much all 4x4 vehicles have swaybars, Rubicons just come with electronic disconnects for the front.  Yours should look like this.  You can just take out the bolts and remove the link when you're on the trail and put it back on for the road or get some sort of mounting bracket thing, like this"
Jeep,3dmktb,xj_scuba,2,Fri Jul 17 14:19:11 2015 UTC,SeXJ
Jeep,3dmktb,Parabola605,1 point,Sat Jul 18 02:29:28 2015 UTC,Details on bumper/winch?
Jeep,3dmktb,Ravenstown6,1 point,Fri Jul 17 14:37:50 2015 UTC,Bumper: Hanson Winchguard http://www.hansonoffroad.com/proddetail.php?prod=JXJ1202-P Winch: Warn VR8000  http://www.warn.com/truck/winches/VR8000_winch.shtml
Jeep,3dmktb,DiscoDirtNap,2,Fri Jul 17 14:47:24 2015 UTC,I swear there is an endless supply of XJ bumpers on the Internet. I find a new one at least once a week
Jeep,3dmktb,ave_seitanas,1 point,Fri Jul 17 21:00:36 2015 UTC,hey what are the specs on your wheels and tires?  include backspacing if you can.  Thanks!
Jeep,3dmktb,cjb211,2,Fri Jul 17 18:58:26 2015 UTC,Looks fairly identical to my setup so if I had to guess those are 31s and the wheels have roughly 3.75 inch backspacing
Jeep,3dmktb,JOHNxJOHN,1 point,Fri Jul 17 19:25:19 2015 UTC,What roof rack is that? U have a 2000 XJ and I've been shopping around for one. I like the way yours looks.   Also bonus for the clean rig. Mine's starting to get pretty rusty.
Jeep,3dmktb,scarletjku,1 point,Fri Jul 17 19:27:02 2015 UTC,"Thule MOAB, and thanks, I'm trying to keep it as clean and rust free as possible but the paint is starting to get a little beat up"
Jeep,3dmktb,SeattleOverSF,1 point,Fri Jul 17 19:51:27 2015 UTC,Looks great! Are they LED or halogen?
Jeep,3dpc9x,Andypwns,2,Sat Jul 18 03:56:37 2015 UTC,"This is my 2012 JK, I've had a blast with this car. I sold my 2013 Nissan Altima 3.5L for this and I haven't looked back once. I just installed a 2.5"" Rough Country coil lift kit on it and it is looking good! Now I just need to save for some good tires. I'm thinking 285/75/16 but i'm not sure yet."
Jeep,3dpc9x,LooksPrettySquatchy,1 point,Sat Jul 18 03:59:05 2015 UTC,Don't forget to disconnect your front swaybar when you flex it out like that
Jeep,3doi1u,noliebro,2,Fri Jul 17 23:14:54 2015 UTC,Looks fantastic.....I'm really digging the greyscale look.
Jeep,3doi1u,Gaingreane,2,Sat Jul 18 01:32:23 2015 UTC,I like! How'd you do it?
Jeep,3doi1u,FastShark,2,Sat Jul 18 01:33:38 2015 UTC,Here's more info on the process: http://www.jk-forum.com/forums/jk-write-ups-39/american-flag-grill-mod-315425/
Jeep,3doi1u,clarksr,1 point,Sat Jul 18 03:44:10 2015 UTC,/r/MURICA
Jeep,3doi1u,AdaminBillerica,1 point,Sat Jul 18 02:04:02 2015 UTC,The design is awesome.  The color scheme looks so good.
Jeep,3dnuew,S_Killingsworth,5,Fri Jul 17 20:04:59 2015 UTC,she looks pissed about it.
Jeep,3dnuew,mtbrgeek,6,Fri Jul 17 20:54:42 2015 UTC,I always feel like Jeeps are friendly. No need to scowl at everyone!
Jeep,3dnuew,WallyMetropolis,8,Sat Jul 18 03:47:13 2015 UTC,"Not a huge fan of those. But it's not my jeep. If you like it, you rock it."
Jeep,3dnuew,fulltankofgas,4,Fri Jul 17 21:53:49 2015 UTC,I like that it keeps the grill slots and not just a big square like some after market ones. Can't say much other than that.
Jeep,3dnuew,Valkyrie4x4,1 point,Fri Jul 17 20:09:23 2015 UTC,Did you paint it?
Jeep,3dnuew,Somnambulist333,2,Fri Jul 17 23:23:29 2015 UTC,sprayed with rhino liner. Manufacturer claims increased air flow but I'm somewhat skeptical about that
Jeep,3dnuew,Alkali,1 point,Sat Jul 18 00:49:49 2015 UTC,Looks great!
Jeep,3dnuew,thabarrtender,1 point,Sat Jul 18 01:24:39 2015 UTC,Looks awesome man! Like the mean gritty look
Jeep,3dnuew,rbrockett2,1 point,Sat Jul 18 02:39:26 2015 UTC,"Its looks angry, and i really like it. Kudos!"
Jeep,3dnuew,MattKS303,1 point,Sat Jul 18 04:00:37 2015 UTC,What bumper is that?
Jeep,3dnuew,MattKS303,2,Sat Jul 18 04:07:02 2015 UTC,Smittybilt src
Jeep,3dnuew,Grandmastrgusto,1 point,Sat Jul 18 06:42:07 2015 UTC,"Looks good, I've got the same thing coming in from Nfab some day soon"
Jeep,3dnuew,grumpwolf27,1 point,Sat Jul 18 23:52:54 2015 UTC,Looks like an Orc from WOW.
Jeep,3dnuew,Elchapin,1 point,Sat Jul 18 11:27:48 2015 UTC,"Grr some old lady parked in my favorite spot in front of Hot Topic!  But seriously, I usually don't like the rhino-lined stuff but this is nice.  It's not super overdone, looks like you are just protecting the stuff that will see wear."
Jeep,3dnuew,SirNut,1 point,Sat Jul 18 14:05:46 2015 UTC,That looks boss.... I need to get a jeep.. sigh
Jeep,3dnuew,hersha,1 point,Sat Jul 18 15:00:12 2015 UTC,I like the liner idea. Helps hide all the bug and rock dings
Jeep,3dnuew,justnotdoingmywork,1 point,Sat Jul 18 17:02:06 2015 UTC,Ahhh the Angry Birds grill.  You're welcome.
Jeep,3dni5k,joshreid45,2,Fri Jul 17 18:33:55 2015 UTC,check the rust yet? I'm worried that plastidip? Is hiding a shit ton of rust
Jeep,3dni5k,Ravenstown6,3,Fri Jul 17 18:45:52 2015 UTC,not too worried about body rust. Pics of the frame look solid. It's literally just going to be towed to trails and beat on. 500 bucks for it.
Jeep,3dni5k,RumorsOFsurF,4,Fri Jul 17 18:49:42 2015 UTC,Dude the top is worth 500 bucks here in Oregon. Snag that Jeep quick.
Jeep,3dni5k,snootsmagoots,3,Fri Jul 17 21:29:50 2015 UTC,I know! Same here. Fucker sold it while I was on my way. Even made a custom towbar at work to get it home.
Jeep,3dni5k,Leakedd,2,Fri Jul 17 22:05:37 2015 UTC,so your saying you haggled him down to 300 cause he sold it without your knowledge right :)
