Jeep,3di0mv,davantalus,1 point,Thu Jul 16 17:01:22 2015 UTC,A ziplock bag or two should do it... If its submerged for any length of time the drybag becomes a moist bag anyway.
Jeep,3di0mv,AdaminBillerica,2,Fri Jul 17 15:58:40 2015 UTC,Um it would be tough. Welds aren't the full length and there is a hole up by the lock mechanism. Possible maybe but pretty difficult  But the other post about a watertight sack in the box would be perfect
Jeep,3di0mv,Fenrir51,1 point,Thu Jul 16 17:46:34 2015 UTC,There are a few holes in it.  One large enough to run a charging cable to your phone into.
Jeep,3di0mv,Varnigma,2,Fri Jul 17 20:25:27 2015 UTC,Real nice. I keep debating between this or the tuffy security center console. My father in law mounted his .45 Glock in the center and its pretty slick.
Jeep,3di0mv,RedRoosterJK,1 point,Thu Jul 16 13:57:29 2015 UTC,"Never messed with the security console but I can't give any bad marks for this unit. Aside from the liner.  I like this because it's hidden. And if I'm not carrying (rare) I can stuff valuables like when I take doors off. Garage opener, ezpass, anything. You literally can't tell it's there till to put your head in the footwell."
Jeep,3di0mv,BathSaltsrFun,2,Thu Jul 16 14:11:30 2015 UTC,I really wish there was an option for 2-doors.
Jeep,3di0mv,Varnigma,2,Thu Jul 16 15:26:47 2015 UTC,Bestop makes one for 2drs...i have one and use it all the time
Jeep,3di0mv,RedRoosterJK,2,Thu Jul 16 17:55:19 2015 UTC,Yeah I have one in my 2 door too.
Jeep,3di0mv,Varnigma,1 point,Thu Jul 16 18:53:48 2015 UTC,"For ""fold and tumble"" drivers seat?  Last I checked it wasn't possible."
Jeep,3di0mv,RedRoosterJK,1 point,Thu Jul 16 18:28:25 2015 UTC,"The JK doors dont fold and tumble, just slide"
Jeep,3di0mv,Echo_one,1 point,Fri Jul 17 00:24:09 2015 UTC,"Slide, tumble, whatever. LOL  All I can say is that last I checked,  these boxes wouldn't work on my 2012 2-door.  As I recall, there is a bracket under the seat that's in the way.   I'll have to check and see if that has changed."
Jeep,3di0mv,the_bacardi_bat,1 point,Fri Jul 17 01:05:06 2015 UTC,Did some research and found mine only fits 2007 - 2010...guess they changed the floor or seats in the newer models
Jeep,3di0mv,Varnigma,1 point,Fri Jul 17 15:24:26 2015 UTC,Me too. :(  I think I might end up getting the one that goes into the center console.
Jeep,3di0mv,calvarez,1 point,Thu Jul 16 15:45:15 2015 UTC,Didn't realize this wouldn't fit 2 doors figured seats were the same design.   :/
Jeep,3dl9zl,sambo613,4,Fri Jul 17 04:41:06 2015 UTC,"Hill or not, I never let my vehicles rest on the parking pawl. Parking brakes are designed for this purpose.  When parking a vehicle, I always engage the parking brake before releasing the service brakes. Perhaps this is a carry-over from my manual-transmission usage."
Jeep,3dl9zl,LAN_Geek,1 point,Fri Jul 17 13:38:06 2015 UTC,I do this every time! I remember awhile back I read it was better for your transmission because the pawl can break. Figure shit is expensive so why not!
Jeep,3dl9zl,Cryo21,3,Fri Jul 17 14:12:39 2015 UTC,My emergency brake is the parking brake. Over time the cables can stretch but they're adjustable so nothing to worry about. Also it takes like years before it might need adjusting.
Jeep,3dl9zl,Patman03,2,Fri Jul 17 05:12:10 2015 UTC,The emergency brake manually engages the rear brakes. There is nothing to wear out except the cable.
Jeep,3dl9zl,C41n,0,Fri Jul 17 05:23:20 2015 UTC,So pretty much it does the same wear and tear as if I only engaged the parking brake instead of both and it's safe to use the emergency everyday?
Jeep,3dl9zl,C41n,2,Fri Jul 17 06:10:36 2015 UTC,It does less than the wear and tear as pressing your brakes once each time you engage it. It is completely safe to use 100% of the time.
Jeep,3dl9zl,Stig-wannabe,0,Fri Jul 17 06:15:08 2015 UTC,Thank you!
Jeep,3dl9zl,TheVaporChef,2,Fri Jul 17 06:17:14 2015 UTC,"What do you mean Parking Brake and Emergency Brake?  Do you mean ""Park"" when you say Parking Brake?   Either way, you are fine to use the E-brake at all times when parking"
Jeep,3dl9zl,TheVaporChef,0,Fri Jul 17 05:06:05 2015 UTC,"Yes, the E-Brake is what I mean."
Jeep,3dl9zl,djdisturbed,1 point,Fri Jul 17 06:09:25 2015 UTC,What do you mean by parking brake then?  Just the regular brakes that you use your foot to engage while driving?
Jeep,3dl9zl,calvarez,0,Fri Jul 17 10:25:36 2015 UTC,"Emergency Brake: http://www.audizine.com/gallery/data/500/806100_4975.jpg  Parking Brake: http://cf.ltkcdn.net/cars/images/std/154603-301x300-gear-shift.jpg   Yes, I know the parking brake is technically what I'm referencing as the ""emergency brake"". I did that to make it clear."
Jeep,3dl9zl,TeamJim,2,Fri Jul 17 16:38:55 2015 UTC,"Where are you from?  I've never heard the park position on an auto transmission shifter called ""the parking brake."""
Jeep,3dl9zl,Elitesoulman,2,Fri Jul 17 18:29:35 2015 UTC,How about you give me the correct term so I know since it seems like I'm wrong.
Jeep,3dm6em,Harriet_Chubman,21,Fri Jul 17 11:54:27 2015 UTC,Is that not the wiring for the speaker bar?
Jeep,3dm6em,My_Empty_Wallet,2,Fri Jul 17 12:05:47 2015 UTC,Yeah thanks I was confused as to why it was on just one side but seems about right. If I get caught in the rain do I have to worry and immediately cover it?
Jeep,3dm6em,clarksr,2,Fri Jul 17 21:12:48 2015 UTC,"Depends, most of the jeep is set up to be ""water resistant"" but not ""water proof"" a light rain, while driving, I would not worry about (I have never worries about mine, and it's fine 4 years later). But if it's starts raining hard you might want to just to be safe."
Jeep,3dm6em,My_Empty_Wallet,1 point,Sat Jul 18 02:51:39 2015 UTC,I'll love that to the far more capable people here to answer
Jeep,3dm6em,TechnologyFetish,1 point,Fri Jul 17 21:25:54 2015 UTC,Probably dome light too.
Jeep,3dm6em,3toss,1 point,Fri Jul 17 23:53:20 2015 UTC,"Fyi those connectors are rather ""resistant"".  The lack of the word proof is more for legal than anything else."
Jeep,3dm6em,BDYDB,10,Sun Jul 19 00:16:29 2015 UTC,"It's for the automatic tilt over control mechanism. Jeep added this feature so people don't have to have upside down stickers that read,""if you can read this flip me over."" You just push a button and the jeep rights itself. Amazing feature."
Jeep,3dm6em,Bobcat35,1 point,Fri Jul 17 16:10:46 2015 UTC,"if you need to view it in action, play any halo series."
Jeep,3dm6em,bonez3113,4,Sat Jul 18 16:59:33 2015 UTC,Not sure why just that one side is exposed. When I had my stereo components installed they said it was waterproof and not to worry. I thought about covering it. But just left it.
Jeep,3dm6em,PivoLiubitel,2,Fri Jul 17 13:17:18 2015 UTC,"It's the wiring for the soundbar (speakers and light).  The wiring harness is just run down the passenger side, making things easier."
Jeep,3dm6em,nwatchmn,3,Fri Jul 17 15:15:08 2015 UTC,Its a 2015 so its obviously the wiring for the flux capacitor.
Jeep,3dm6em,aussie_jason,-3,Fri Jul 17 12:27:19 2015 UTC,I think that is the satellite radio antenna.
Jeep,3dm6em,calvarez,1 point,Fri Jul 17 11:56:22 2015 UTC,"There's no coax cable visible, so not likely at all.  The antenna is up there in the bar, but MUST use a coax cable and not standard wires."
Jeep,3dm6em,aussie_jason,1 point,Fri Jul 17 20:49:13 2015 UTC,"Yeah my bad, I only glanced at the pic preview, I know the antenna is up there somewhere so jumped to conclusions."
Jeep,3dm6em,jeeparmstrong,1 point,Fri Jul 17 21:28:27 2015 UTC,now I may be wrong here but anytime I've ever installed a satellite radio it never had coax to the antenna only like a 14ish gauge wire going to it. I know an actually radio or a cb needs to have coax but I don't think satellite does..
Jeep,3dm6em,calvarez,1 point,Fri Jul 17 22:35:08 2015 UTC,"It's a very thin coax, but it is coax.  Take a look at the connector; it's even a coaxial connector.  Some people think coax is always the huge stuff in your house (RG-8 or RG-58).  Coax just means coaxial, one conductor inside another."
Jeep,3djqlm,SafariJeep,6,Thu Jul 16 20:48:51 2015 UTC,"I currently drive a decent lifted truck but its time to move on. I recently took a new job that pays a lot better and allows me to travel. So I want to get a nice looking 4-door Jeep and travel where its warm all year. Lifted with nice tires and all that. Probably keep the normal doors cuz I have a dog. But definitely safari straps. A lot of you probably wont care, but the rest of you will be seeing me frequent this sub in the next few months as I purchase and upgrade the ride."
Jeep,3djqlm,Kiriesh,6,Thu Jul 16 20:52:59 2015 UTC,"For what its worth, your dog (especially in a wrangler) should be harnessed into the seat anyways so doors won't really matter. Mine loves riding in the back seat with the doors off. She's lazy as hell so she'll sprawl on the seat and still have her nose sticking out beyond the door-sill. If you're looking to research, I'd suggest reading the JK FAQ (JK is the factory designation for any wrangler made 2007+, so any 4 door wrangler will be a JK, or often referred to as JKU). Feel free to PM me or ask here if you have any specific questions!"
Jeep,3djqlm,Kiriesh,-1,Thu Jul 16 23:29:55 2015 UTC,"I guess in regards to safety and all that, my dog should be harnessed in but Ive taken him on road trips all over the east coast and never harnessed him. Knock on wood its never been a problem. He likes to stick his head out the window or sit in the passenger seat like a human and watch all the sights. So, right or wrong, Im gonna continue to do that."
Jeep,3djqlm,peanutbuttergoodness,2,Fri Jul 17 15:53:15 2015 UTC,Have you ever owned a convertible? Because that completely changes the situation.
Jeep,3djqlm,Grayuberman,1 point,Fri Jul 17 15:58:16 2015 UTC,"No. But thats what the net is for, and why I intend on keeping the stock doors. I will make sure my boy wont be able to jump out or anything, if thats what your wondering."
Jeep,3djqlm,Grayuberman,1 point,Fri Jul 17 16:12:01 2015 UTC,We're in the same boat.  I bought mine a few weeks ago and I'm slowly upgrading things.  It's so fun but holy shit it's expensive.
Jeep,3diad2,fulltankofgas,2,Thu Jul 16 14:24:44 2015 UTC,Is this one Squaw Peak?
Jeep,3diad2,NotTheRightAnswer,2,Thu Jul 16 22:00:07 2015 UTC,Squaw peak it is
Jeep,3diad2,NotTheRightAnswer,2,Thu Jul 16 22:33:09 2015 UTC,"I grew up, and still live, in Orem, the town directly west. I'd recognize those mountains anywhere. And I've spend a fair amount of time in Moab, too. I'm having a hard time picking out where your OP picture is, is it Tip Over Challenge on Hell's Revenge?"
Jeep,3diad2,NotTheRightAnswer,1 point,Thu Jul 16 22:41:28 2015 UTC,Nice I go to BYU. Home in michigan for the summer. Are you a part of UJC? And yep that is tip over challenge. My sister lives in Orem.
Jeep,3diad2,NotTheRightAnswer,1 point,Thu Jul 16 23:44:53 2015 UTC,"Never heard of UJC. I just sold my '93 Wrangler last fall, so I'm jeepless now. I used to be pretty active on Rocky Mountain Extreme but now I just log on for nastalgia's sake."
Jeep,3det31,Thegermanway,22,Wed Jul 15 18:36:19 2015 UTC,"As a Colorado native, I disagree. There is no dog in that picture."
Jeep,3det31,lazerpants,53,Wed Jul 15 20:46:23 2015 UTC,http://imgur.com/j3iGdtv   They were around. Hard to keep em still :)
Jeep,3det31,cbs5090,30,Wed Jul 15 21:03:42 2015 UTC,Dat delivery.
Jeep,3det31,a_leprechaun,3,Wed Jul 15 21:13:37 2015 UTC,Shiiiiit. /u/lazerpants got told.
Jeep,3det31,realfinkployd,12,Thu Jul 16 15:17:56 2015 UTC,Or pot. What the hell?
Jeep,3det31,Archr5,4,Wed Jul 15 21:23:57 2015 UTC,Generally mixing guns and pot in a picture is a bad idea :)  Unless you want special attention from the Feds.    Thanks Obama.
Jeep,3det31,The_Punniest,35,Thu Jul 16 15:35:35 2015 UTC,I like how no one in this sub even comments on the girl.
Jeep,3det31,Yrrem,26,Wed Jul 15 21:56:47 2015 UTC,"I know, she could dent the jeep!"
Jeep,3det31,4_low_and_go,16,Thu Jul 16 01:14:34 2015 UTC,haha I told her not to dent my jeep. She gave me the death gaze
Jeep,3det31,PLACENTATACOS,14,Thu Jul 16 01:58:41 2015 UTC,While holding a gun
Jeep,3det31,lord-steezus,4,Thu Jul 16 02:16:31 2015 UTC,there's a girl?
Jeep,3det31,Redwrath,1 point,Thu Jul 16 01:25:31 2015 UTC,Yeah it's that thingy on the front of the jeep
Jeep,3det31,droolingBONER,1 point,Thu Jul 16 12:39:12 2015 UTC,"Well she's white, looks rugged, and willing to go adventuring... Wait, we're still talking about the Jeep, right?"
Jeep,3det31,R0beddi,9,Thu Jul 16 15:57:33 2015 UTC,"10/10, would bang.   Girl's alright too, I guess."
Jeep,3det31,ZaneMasterX,15,Thu Jul 16 02:20:48 2015 UTC,I'm moving to Colorado beginning of August. I'm looking forward to this!
Jeep,3det31,laikasghost,8,Wed Jul 15 19:03:19 2015 UTC,Awesome! It's a great place to live. I've been here for almost a year now and can't ever see myself moving out of this state.
Jeep,3det31,Garbagemn,8,Wed Jul 15 19:25:05 2015 UTC,How are those 20rd mags treating you these days?
Jeep,3det31,TheMrNick,13,Wed Jul 15 19:44:31 2015 UTC,"I think its 15 actually, i could be wrong though. Unfortunate that had to happen to Colorado."
Jeep,3det31,GOA_AMD65,3,Wed Jul 15 20:04:56 2015 UTC,My girlfriend lived at the Olympic training center out there while she was on the national pistol team. Those limitations really got in the way of training.
Jeep,3det31,cleancutmover,9,Thu Jul 16 03:10:08 2015 UTC,I'm originally from Texas and have 30rd's grandfathered in. And it's 15 which is even worse. Pistols are the big issue. Almost any double stack 9mm full length is illegal cuz of the mag
Jeep,3det31,LostMyPasswordAgain2,3,Wed Jul 15 20:09:32 2015 UTC,That law is so easy to get around that it's laughable.
Jeep,3det31,LostMyPasswordAgain2,2,Wed Jul 15 20:10:59 2015 UTC,I've heard of 30rd rebuild kits being sold in stores in CO.   http://dailycaller.com/2014/10/31/colorados-ban-on-high-capacity-magazines-is-easy-to-skirt/  And I was right.
Jeep,3det31,meaty_yodeler,12,Wed Jul 15 20:59:55 2015 UTC,And this is the kind of person who wants the bans. This lady literally thought magazines were a one and done type deal lol
Jeep,3det31,peanutbuttergoodness,5,Wed Jul 15 21:10:03 2015 UTC,Try living in MA. We have a 10 round limit. You can buy pre ban mags to get around it.
Jeep,3det31,ZaneMasterX,2,Wed Jul 15 21:49:26 2015 UTC,So sad that it's even an issue.
Jeep,3det31,account_information,1 point,Wed Jul 15 23:19:05 2015 UTC,Your state's representatives did not do themselves any favors when they pushed that through.
Jeep,3det31,xj4me,2,Wed Jul 15 23:18:06 2015 UTC,"It's 10 round mags. But stores still stock and sell 30 or more round mags as ""parts kits"". Especially p-mag They just pop off the bottom after you buy it so its ""parts"""
Jeep,3det31,xj4me,1 point,Thu Jul 16 23:39:15 2015 UTC,No one gives 2 shits about that law.  Still plenty of ways to get any mag you want.
Jeep,3det31,TeamJim,1 point,Thu Jul 16 03:11:00 2015 UTC,Colorado gave a shit enough to pass it and thats the slippery slope thats starting to surface. CO is being overrun by ubber liberal assholes from CA which is slowly ruining it.
Jeep,3det31,Jakereese7,1 point,Thu Jul 16 03:14:33 2015 UTC,They ran out of water and are migrating east.
Jeep,3det31,R0beddi,1 point,Fri Jul 17 09:24:06 2015 UTC,I'm contemplating moving to Colorado Springs next year from Hawaii. Any clubs you'd recommend?
Jeep,3det31,Jakereese7,1 point,Thu Jul 16 03:22:39 2015 UTC,idk many in the springs but around here there is grand mesa jeep club in grand junction and jeepers creepers here in durango.
Jeep,3det31,Witbox,1 point,Thu Jul 16 04:01:32 2015 UTC,Great! Thanks! I'm looking forward to a change
Jeep,3det31,jodomcfrodo,2,Thu Jul 16 06:13:51 2015 UTC,I want to move out west so badly...
Jeep,3det31,JJohnsonMtMan,2,Wed Jul 15 22:20:47 2015 UTC,Same here! Are you going for college?
Jeep,3det31,xtrasneakygastro,1 point,Thu Jul 16 07:26:28 2015 UTC,Sort of. My wife was accepted to a PhD program at CSU so we are relocating.
Jeep,3det31,benly1,2,Thu Jul 16 16:26:20 2015 UTC,Nice! I'm moving to Durango this August.
Jeep,3det31,ExigentCalm,1 point,Thu Jul 16 17:40:59 2015 UTC,Maybe OPs sister could show you around.
Jeep,3det31,keatonisballin,6,Mon Jul 20 01:33:32 2015 UTC,What is the mesh looking stuff under the fender in the wheel well. That looks really good!
Jeep,3det31,I_AM_THE_LIQUEUR,5,Wed Jul 15 20:40:41 2015 UTC,poison spyder vented inner fender kit. Thanks man
Jeep,3det31,TexMarshfellow,2,Wed Jul 15 21:05:18 2015 UTC,"Looks good but does it serve any purpose vice not having anything at all?  Looks great so, honestly if that's the only purpose then awesome, just curious. Hopefully they have one for JKs."
Jeep,3det31,TexMarshfellow,2,Thu Jul 16 02:41:51 2015 UTC,From what I can see it replaces the engine bay with a vented one for more airflow but still protecting vital parts
Jeep,3det31,bloodthirsty77,2,Thu Jul 16 03:33:04 2015 UTC,Crawler concept has one for jks
Jeep,3det31,CreepingJeeping,2,Thu Jul 16 03:44:53 2015 UTC,you'd be able to see all the ugly shit ur hood hides if u didnt have the inner fenders. But some people run it and it looks fine. Personal preference I guess.
Jeep,3det31,Chester_Cheetah,8,Thu Jul 16 03:59:56 2015 UTC,Your wheel wells look awesome. Cool jeep.   Also nice rifle and girlfriend. Well done.
Jeep,3det31,bobthebobofbob,3,Wed Jul 15 20:57:17 2015 UTC,Awesome jeep dude the wheel wells look sick. I like the flat fenders too what brand are they?
Jeep,3det31,craigjclemson,2,Wed Jul 15 21:44:44 2015 UTC,poison spyder from front to rear. Didn't wana pay a crap ton of shipping charges so bought all at once for a decent shipping price
Jeep,3det31,craigjclemson,3,Wed Jul 15 21:52:52 2015 UTC,Nice rig! Are those tiny lights in the front of the fenders? Are they turn signals?
Jeep,3det31,Gatodeocho,1 point,Wed Jul 15 22:11:59 2015 UTC,that they are. Clear on the front and threw in an amber on the inner fenders
Jeep,3det31,peanutbuttergoodness,3,Wed Jul 15 22:20:05 2015 UTC,"OP how do you like the Birddogs? Are they particularly heavy?  And I know CO isn't really a ""muddin"" state, but have you had any opportunities to see how they do at the self-cleaning?"
Jeep,3det31,Th3Roman,2,Thu Jul 16 05:50:24 2015 UTC,"I like em. I snagged a killer deal on ebay for 3 used ones and bought one full price. They are fairly light, lighter than the stock rubicon wheels (15"" vs 16"" too though so apples and oranges kinda) They were one of the only wheels with 3.5"" backspacing I liked. They stay pretty clean. It's monsoon season so it rains daily. My whole jeep stays pretty dirty but the wheels tend to stay clean somehow. I've also aired down to 5 psi with no blown beads while climbing. Sometimes with almost all the jeeps weight on one wheel. I will be going to 17"" beadlocks to fit bigger brakes. But for the money these wheels are worth"
Jeep,3det31,droolingBONER,1 point,Thu Jul 16 15:56:01 2015 UTC,"Awesome, thanks for the info!"
Jeep,3det31,TexMarshfellow,2,Fri Jul 17 00:54:27 2015 UTC,How are the shocks? Thinking about picking some of those up.
Jeep,3det31,THEcannon6,3,Wed Jul 15 19:52:08 2015 UTC,I have 2.0 on my JKU and I like them better than the bilsteins
Jeep,3det31,THEcannon6,2,Wed Jul 15 20:21:11 2015 UTC,They are definitely worth the money. I ran 5100's before and they feel somewhat similar but the 2.0's soak the rocky shit up better.
Jeep,3det31,kjmccarx,2,Wed Jul 15 20:59:26 2015 UTC,"Nice rig, man! What part of CO? I like Jeeps and guns too!"
Jeep,3det31,Zombiesai,1 point,Wed Jul 15 23:23:19 2015 UTC,Durango
Jeep,3det31,Zombiesai,2,Thu Jul 16 01:57:43 2015 UTC,I was stationed in Colorado Springs when I was in the Army and I miss it so much. Once I'm done with schooling I think I'm going to try to move back up there. I moved back to Arizona and I'm so sick of the heat. I just loved the Colorado terrain so much more than the desert.
Jeep,3det31,Zombiesai,2,Wed Jul 15 23:48:18 2015 UTC,That's where my girl goes to school. Big army town
Jeep,3det31,mike1919,2,Thu Jul 16 01:57:35 2015 UTC,What is your opinion on the Currie Antirock?
Jeep,3det31,Guyuute,1 point,Wed Jul 15 23:50:10 2015 UTC,Love it. No highways where I live so the fastest I go is 50 tops. Well worth the slight roll u gain
Jeep,3det31,PhilDeezNutz,1 point,Thu Jul 16 01:56:42 2015 UTC,"aside from not having to actually go through the trouble of disconnecting, do you think it works better than regular discos off-road?"
Jeep,3det31,PhilDeezNutz,2,Thu Jul 16 02:00:41 2015 UTC,I do. I used quick dicos for a while. It was fine if ur not crawling but once u start climbing rock it feels incredibly unstable when u disconnect the sway bar completely. With this I can crawl and it doesn't feel like im tipping over all the time. It's worth on the front. rear I think the only time u need ones is if ur stretching the wheelbase
Jeep,3det31,droolingBONER,2,Thu Jul 16 02:05:08 2015 UTC,"Well we should probably be friends.  Nice rig, have you crawled any granite with those tires?"
Jeep,3det31,AceGeister,1 point,Thu Jul 16 00:57:26 2015 UTC,Not these no. Fairly new. Haven't had the time to hit moab in a while.
Jeep,3det31,kjmccarx,2,Thu Jul 16 01:56:03 2015 UTC,Where in CO are you?
Jeep,3det31,ZaneMasterX,1 point,Thu Jul 16 03:13:54 2015 UTC,durango
Jeep,3det31,kjmccarx,2,Thu Jul 16 03:57:51 2015 UTC,"Thought since this got a ton of feedback I'd give specs. 06 jeep tj Rubi 6 speed manual (so 44's and locker all around), 3.5"" RE springs, fox 2.0 smooth body's, currie heavy duty drag link and tie rod, currie adjustable track bars, Rough Country adjustable short arms (soon to be replaced, don't recommend), poijson spyder front bumper with brawler bar, mile marker 8k winch, currie anti rock sway bar, poly performance hood tabs, highline aluminum poison spyder negative flare fenders with vented inner fender kit, rocker knockers, rear poison spyder steel armor, aftermarket tire carrier and spare in the rear, 15x9 intercco birddog wheels, 35x12.50x15 general red letters air to 32 psi front 33 psi rear, Nth degree tummy tuck (just put it on), chromoly shafts front stock rear, and a set of 4.88 gears that are waiting to be installed (I used to have all the time in the world and no money, now I have the money and no time at all......)"
Jeep,3det31,AceGeister,3,Thu Jul 16 21:41:18 2015 UTC,"My only complaint about this whole picture: I hate high waisted shorts. Aside from that, thumbs up all around"
Jeep,3djb4c,jasper_snipes,3,Thu Jul 16 18:56:32 2015 UTC,"Yep. Not sure where you are but that would be 16,500 here in California."
Jeep,3djb4c,GolfXXX,2,Thu Jul 16 19:41:51 2015 UTC,yes.
Jeep,3djb4c,cleancutmover,2,Thu Jul 16 19:58:28 2015 UTC,Sounds like a great buy to me
Jeep,3djb4c,jaketurd,2,Thu Jul 16 22:11:05 2015 UTC,I paid 16k at a stealership for an 05 LJR with 62k miles so ya thats a good price.....
Jeep,3djb4c,theflyer007,1 point,Thu Jul 16 22:37:19 2015 UTC,"You got a great deal. I paid 16 for my LJR with 160k miles. It was on 2"" of lift, 1"" body, 35s, winch etc. Anyone who knows what they have can get a pretty penny for an LJ"
Jeep,3djb4c,fulltankofgas,2,Fri Jul 17 02:19:45 2015 UTC,"I paid 18 for my 06 LJ dead stock with 37k miles. The LJ is the best model of jeep ever made, so yes please buy it. Here's mine btw"
Jeep,3djb4c,Priddee,1 point,Fri Jul 17 03:34:33 2015 UTC,"damn, thats clean!"
Jeep,3djb4c,Bat-Meow,1 point,Fri Jul 17 11:56:40 2015 UTC,jeep noob here. what makes a LJ better than  TJ?
Jeep,3djb4c,Priddee,1 point,Sat Jul 18 02:56:13 2015 UTC,"An LJ is a longer wheelbase. Like a JK unlimited, but the LJ still has 2 doors. So more space same classic jeep look"
Jeep,3djb4c,Bat-Meow,1 point,Sat Jul 18 17:33:35 2015 UTC,wouldn't you want a shorter wheelbase for offroading?
Jeep,3djb4c,Priddee,1 point,Sat Jul 18 18:01:31 2015 UTC,The only reason you'd want shorter is for tighter turning I guess? But longer wheelbase means you won't get stuck one hills with steep inclines. And more cargo room. A bigger base at the bottom of anything means it's more stable
Jeep,3djb4c,Elchapin,1 point,Sat Jul 18 18:20:45 2015 UTC,think i'm going to go make the deal today :)
Jeep,3djb4c,TeamJim,1 point,Fri Jul 17 11:57:03 2015 UTC,Please post some pics when you get it.
Jeep,3djb4c,Tig_Ol_Bitties_,1 point,Sat Jul 18 20:22:43 2015 UTC,"Definitely. That's slightly less than I paid for my 06 TJ that had a few more miles, but with some extras (new top, budget boost, 33's, etc). LJ's go for ~$1000-1500 more than similar TJ's typically."
Jeep,3dihnm,joes_nipples,6,Thu Jul 16 15:22:13 2015 UTC,"Guy in my apartment complex has one and he has a small lift and all terrains on it. Almost always had mud on it. He even waves to me in my Wrangler.   Personally, I have never driven one but the people I've met who have them love it."
Jeep,3dihnm,Spartan2842,3,Thu Jul 16 15:44:26 2015 UTC,http://imgur.com/a/jKFkl
Jeep,3dihnm,upperVoteme,2,Thu Jul 16 17:42:21 2015 UTC,"It's basically a big boxy WK Grand Cherokee.  I've heard the third row seats are pretty much useless and the current director of Jeep thinks they were about the worst vehicle ever made.  That being said, every owner of one I've ever encountered loves them."
Jeep,3dihnm,TheMrNick,4,Thu Jul 16 21:45:43 2015 UTC,"I like them... the way the roof rails wrap down the back is kinda strange but whatever. BUT I know several people with the cylinder deactivation feature and they've all had numerous problems and ended up disabling it via an aftermarket tuning interface. Have also heard of mystery electrical problems in the commanders... but to me that just proves they are indeed jeeps lol I was thinking about buying one, but all I could find was RWD, and even they were stupid expensive still so I went with their little sister, the KK Liberty."
