JessicaNigri,3bt342,Tictac472,1 point,Fri Jul 3 17:02:52 2015 UTC,"I understand the moderation is absolutely shite on this sub, but she hardly posts shit and if she does 90% of the time its a repost of one of her costumes or some useless shit with her boyfriend. So when she does upload something good people are scrambling to get first post to get that sweet juicy karma hence the multiple reposts."
JessicaNigri,3bs8ru,Djlynch2009,3,Wed Jul 1 18:58:17 2015 UTC,"Gentlemen, the reflection of perfection."
JessicaNigri,3bs8ru,spartan337,2,Thu Jul 2 08:14:27 2015 UTC,And ladies. :D
JessicaNigri,3bs8ru,BulbasaursMeow,3,Thu Jul 2 21:52:03 2015 UTC,I'll be uhh... I'll be right back
JessicaNigri,3bs8ru,wardenofthethread,2,Thu Jul 2 18:02:59 2015 UTC,Gotta take the photos with you behind the bushes?
JessicaNigri,3bs8ru,Psychozoa,1 point,Fri Jul 3 14:50:13 2015 UTC,"The one in the set where she's got white lingerie and purple hair, and she's sitting on the arm of the sofa? Favorite!"
JessicaNigri,3bs8ru,CheekySprite,3,Fri Jul 3 04:49:52 2015 UTC,Anyone have an album pre-surgery? I know I've seen a few darkstalkers pics (white outfit...obviously) but that's about it. Any others?
JessicaNigri,3bs8ru,chubbsmagoo,1 point,Wed Jul 1 22:22:33 2015 UTC,"I'm pretty sure there were some pics (like the one with ""love"" white and black bikini) that are older."
JessicaNigri,3bs8ru,kancolle_nigga,1 point,Thu Jul 2 18:05:38 2015 UTC,man that balding spot is kinda of a boner killer
JessicaNigri,3bs8ru,Tiervexx,0,Fri Jul 3 15:12:01 2015 UTC,What on earth are you talking about?
JessicaNigri,3bs8ru,kancolle_nigga,0,Fri Jul 3 21:36:21 2015 UTC,It's pretty visible in pic #5  http://i.imgur.com/Bad4QSN.jpg
JessicaNigri,3bs8ru,Tiervexx,0,Fri Jul 3 21:40:58 2015 UTC,Nobody's scalp gives 100% coverage and there is no such thing as a lady that will look sexy in every possible funny face.
JessicaNigri,3bs8ru,kancolle_nigga,0,Fri Jul 3 21:52:53 2015 UTC,http://i.imgur.com/oAxUL3g.jpg
JessicaNigri,3bs8ru,Tiervexx,1 point,Fri Jul 3 22:28:03 2015 UTC,"She has a bit of a high forehead so when she's making a face with her hair pulled back, it looks weird.  But seriously, who fucking cares?  It's possible to make anyone look unflattering.  The only reason you'd not be able to find a pic like that of most models is because they'd never post such unstyled photos.  EDIT:  Removed an insult."
JessicaNigri,3bs8ru,kancolle_nigga,0,Fri Jul 3 23:41:07 2015 UTC,"If it honestly bothers you, you are exposing yourself as a clueless virgin.   I was just stating a fact, there's no need to use personal insults."
JessicaNigri,3bs8ru,Tiervexx,2,Sat Jul 4 08:44:40 2015 UTC,"My use of a personal insult was regrettable.  Yes, she has a flaw.  But it is a pretty trivial one and kind of silly to make a big deal out of."
JessicaNigri,3bzf7a,Nuge89,23,Fri Jul 3 11:40:38 2015 UTC,It's been about her boobs WAY before this subreddit was a thing.
JessicaNigri,3bzf7a,Overruler101,17,Fri Jul 3 13:20:35 2015 UTC,She is â€œfamousâ€ because of her tits. Leave it be. Stop trying to bring down a good thing.     Iâ€™m positive that with some research scientists will discover that her cleavage will cure cancer.      Do you want to be the one who ruined the cure to CANCER?!
JessicaNigri,3bzf7a,Stevangelion,-7,Fri Jul 3 16:08:48 2015 UTC,Haha. You win
JessicaNigri,3bzf7a,chubbsmagoo,2,Sat Jul 4 17:02:26 2015 UTC,Kinda funny how OP made another post about her tits. Will he get annoyed when he scrolls through and sees his own? Besides... Her tits and good looks are what make her. (I'm sure she has a lovely personality) If she stopped cosplay and did strait up modeling... Her career and this sub would carry on.
JessicaNigri,3bzf7a,AlexYuuki,0,Sat Jul 4 10:19:57 2015 UTC,"These posts confuse me even more than the ones you are talking about, can you really not understand why her tits are the main point of discussion? I'm gonna go ahead and guess the majority of people are here because of them, heck I am they are a great pair of boobs, or as you like to say ""bewbs""."
JessicaNigri,3bzf7a,blackouteyes,0,Fri Jul 3 14:49:28 2015 UTC,"It's 2015 and people are still almost getting to autistic levels over whether she had surgery, like the answer is somehow going to change anything at all. I'm not looking for any votes, but if you're downvoting, you're one of those people."
JessicaNigri,3bzf7a,Doctor_Poopdapus,-2,Sun Jul 5 11:55:02 2015 UTC,
JessicaNigri,3bzf7a,chubbsmagoo,0,Fri Jul 3 13:05:13 2015 UTC,"Na man, she hit puberty."
JessicaNigri,3bzf7a,trevx,4,Sat Jul 4 10:20:12 2015 UTC,"Yeah, Dr P. Uberty, Plastic Surgeon."
JessicaNigri,3bzf7a,Immortails,1 point,Sat Jul 4 19:17:31 2015 UTC,Nice.
JessicaNigri,3bsijb,Thisty,1 point,Wed Jul 1 20:07:36 2015 UTC,Man that is some really obvious fanservice. And I like it.
JessicaNigri,3b765j,popcornbattery,34,Fri Jun 26 14:54:07 2015 UTC,Just featured on Playboy I don't think this is what they mean.
JessicaNigri,3b765j,TheRobert428,-42,Fri Jun 26 16:04:11 2015 UTC,"I understand but if you look at the top, she retweeted it! If she had no interest in playboy she would have just ignored it"
JessicaNigri,3b765j,cosmicandshit,44,Sat Jun 27 02:53:45 2015 UTC,This is so illogical
JessicaNigri,3b765j,everythingispancakes,15,Sat Jun 27 03:12:23 2015 UTC,shhh he's too deep in his delusions
JessicaNigri,3b765j,Dommzz,18,Sat Jun 27 04:48:45 2015 UTC,I feel something ( Í¡Â° ÍœÊ– Í¡Â°)
JessicaNigri,3b765j,Tech0ne,2,Fri Jun 26 15:14:13 2015 UTC,Me too ( Í¡o ÍœÊ– Í¡o)
JessicaNigri,3b765j,apdodog2,11,Sat Jun 27 13:28:45 2015 UTC,"I didn't even know she was planning to do playboy. Playboy doesn't only do naked stuff, I believe. They do like lingerie, which is what she already does. Wouldn't get your hopes up on nudes."
JessicaNigri,3b765j,tehsocks,4,Fri Jun 26 21:24:37 2015 UTC,Oliviamunngate
JessicaNigri,3b765j,Loydzero,2,Sat Jun 27 14:01:48 2015 UTC,i was about to mention this.
JessicaNigri,3b765j,JoyousCacophony,1 point,Fri Jun 26 21:53:12 2015 UTC,idontbelieveyou.jpg
JessicaNigri,3b765j,image_linker_bot,4,Sat Jun 27 07:57:48 2015 UTC,idontbelieveyou.jpg      Feedback welcome at /r/image_linker_bot
JessicaNigri,3b765j,Deefunct,4,Sat Jun 27 07:57:56 2015 UTC,"Their 'This week in sexy cosplay' is different than a photoshoot. They're just taking pictures of cosplayers and posting them on their site, not always giving credit either.   Edit: Credit to the photographers, I mean."
JessicaNigri,3b765j,Destino23,1 point,Sat Jun 27 02:15:51 2015 UTC,Here is a link to the tweet https://twitter.com/playboy/status/614259288106762241
JessicaNigri,3b765j,Roderickje,1 point,Fri Jun 26 14:55:32 2015 UTC,Can anybody source that photo. Please
JessicaNigri,3b765j,theforceds,-6,Sat Jun 27 05:46:44 2015 UTC,If true .... i called it about a week ago.
JessicaNigri,3b765j,sakura608,-46,Fri Jun 26 22:11:45 2015 UTC,"I guarantee you, as someone who isn't 15, the second she does Playboy your interests will drop. Her boobs would be undeniable fake, more so than they already are (She couldn't deny it, topless) and nobody would give a shit after."
JessicaNigri,3b765j,theforceds,11,Fri Jun 26 16:30:38 2015 UTC,Cause you know Pamela Anderson lost all her fame after Playboy and her sex tape.   /s
JessicaNigri,3b765j,TotallyKafkaesque,-6,Fri Jun 26 22:52:56 2015 UTC,"Most of the sextape hype was mythical. I remember because I was of that age when it came out. The hype was around it being out there and the internet not being as prevalent. Not the actual video itself, which isn't great."
JessicaNigri,3b765j,SmilesTheEmo,2,Fri Jun 26 23:10:26 2015 UTC,"That's how all sextapes are, mostly hype. It's just a shitty home video that happens to feature famous people."
JessicaNigri,3b765j,apdodog2,6,Sat Jun 27 08:43:48 2015 UTC,And yet you're on a subreddit devoted to her fake tits?
JessicaNigri,3b765j,theforceds,4,Fri Jun 26 22:57:54 2015 UTC,"To be fair, it isn't just about her tits. She has a nice face too. Stomach as well."
JessicaNigri,3b765j,seequiNz,-4,Sat Jun 27 03:23:00 2015 UTC,"Because I think she's hot and her boobs, most of the time, look very nice. I'm simply stating that when stripped nude, boobs are boobs if they're not fake. If they are fake, they tend to look a bit silly."
JessicaNigri,3b765j,Dt8295,29,Fri Jun 26 23:11:09 2015 UTC,That might be the dumpest thing ive read today. Dumpest.
JessicaNigri,3b765j,theforceds,7,Fri Jun 26 16:44:03 2015 UTC,"I don't give a shit NOW. Tits are tits. They still look nice, real or not."
JessicaNigri,3b765j,Dt8295,-17,Fri Jun 26 20:13:38 2015 UTC,"You've not seen a lot of boobs nude, then. Real or fuck, some are fucking gross. Some are boring as fuck.  Only those seriously deprived of female contact think that nude tits are the world's most exciting thing."
JessicaNigri,3b765j,TotallyKafkaesque,8,Fri Jun 26 22:04:45 2015 UTC,"Lol well while you're busy analyzing and disecting the goods and bads of the female body, I'm gonna sit back and enjoy myself."
JessicaNigri,3b765j,ancient_horse,5,Fri Jun 26 22:09:11 2015 UTC,Hey I have good news. You can get married now!  So exciting!
JessicaNigri,3b765j,Gertford,2,Sat Jun 27 08:44:40 2015 UTC,You forgot to add that that is entirely your personal opinion.
JessicaNigri,3b65uz,pyroness,19,Fri Jun 26 07:57:24 2015 UTC,One of these days something made by her will break / pop and there'll be pics.
JessicaNigri,3b65uz,SephirothFFX,36,Fri Jun 26 09:13:19 2015 UTC,"For anyone that's curious.  This is the fanart/character that it's based off  Needless to say, I'm interested to see the rest.... You know... For science."
JessicaNigri,3b65uz,Chase1ne,11,Fri Jun 26 09:23:24 2015 UTC,Lindsay pulled it off gorgeously. I can't wait to see what Jess can do with it!!!
JessicaNigri,3b65uz,Soulas,9,Fri Jun 26 13:50:31 2015 UTC,Source please?
JessicaNigri,3b65uz,popcornbattery,5,Fri Jun 26 14:59:06 2015 UTC,http://cosplaypins.com/tags/lindsay-elyse?mob=1 I'm on mobile. Sorry about that. Scroll down a bit and you'll see it.
JessicaNigri,3b65uz,Soulas,-17,Fri Jun 26 20:16:57 2015 UTC,.
JessicaNigri,3b65uz,iWantALongNameToo,4,Fri Jun 26 15:08:49 2015 UTC,good god. one can only hope
JessicaNigri,3b65uz,grawlings,20,Fri Jun 26 09:25:21 2015 UTC,/r/titlegore
JessicaNigri,3b65uz,Dimpled,9,Fri Jun 26 09:47:49 2015 UTC,"She didn't make those tits by her self, that's damn sure."
JessicaNigri,3b65uz,ronnie_d_coleman,2,Fri Jun 26 19:21:10 2015 UTC,Ah-ha
JessicaNigri,3b65uz,edgeorge92,2,Fri Jun 26 19:55:53 2015 UTC,"Al: (Looking around Kelly's aerobics studio.) God, look at all this mondo talent in all these micro bikinis. All I ask is for just one seam to burst. (Al's shirt rips.)"
JessicaNigri,3b65uz,PastelFlamingo150,2,Fri Jun 26 12:04:44 2015 UTC,God bless silicon.
JessicaNigri,3b65uz,Danba26,1 point,Sat Jun 27 00:24:47 2015 UTC,"Okay, I don't usually comment here, but there's no way in a million years those could be real. I don't have a problem with it, but you can't deny that she's had work done. That might even be a hint of a scar you can see in the bottom pic (under the boob to our left)"
JessicaNigri,3b65uz,Mrmister1,1 point,Mon Jul 6 04:22:12 2015 UTC,"Everybody knows that, it's just that nobody cares."
JessicaNigri,3b65uz,SmilesTheEmo,1 point,Sun Jul 12 15:45:51 2015 UTC,Christmas has come early.
JessicaNigri,3b65uz,Rriot,-34,Mon Jul 6 07:38:31 2015 UTC,Oh look. Titties. She never showed them before.
JessicaNigri,3b65uz,Overruler101,19,Fri Jun 26 12:06:45 2015 UTC,Then why are you here?
JessicaNigri,3b65uz,NarWhatGaming,-10,Fri Jun 26 14:42:40 2015 UTC,"Try to act sarcastic,  and get downvoted hard. Just another day on reddit."
JessicaNigri,3b65uz,Overruler101,1 point,Fri Jun 26 19:38:02 2015 UTC,Need the /s then lol
JessicaNigri,3b8qoj,wedgluv,14,Fri Jun 26 21:53:47 2015 UTC,Well that's disappointing
JessicaNigri,3b8qoj,PTbest,3,Fri Jun 26 23:47:54 2015 UTC,holy shit did people actually think she was going to announce she was doing porn or something?
JessicaNigri,3b8qoj,LotusCobra,12,Sat Jun 27 12:56:08 2015 UTC,Nah I'm not that delusional. I'm not sure what I expected but this news isn't relevant to me
JessicaNigri,3b8qoj,PTbest,7,Sat Jun 27 13:31:47 2015 UTC,As long as I can see her in skimpy outfits I'm all for it .
JessicaNigri,3b8qoj,howardtheduck126,4,Sat Jun 27 01:40:17 2015 UTC,This is who she's most likely going to be cosplaying as (judging by the bracelet). Orendi from Battleborn She's voiced by the same person who voiced Tiny Tina from Borderlands 2 so I assume that's why she picked that character.
JessicaNigri,3b8qoj,RiskyDINGO,7,Sat Jun 27 09:04:28 2015 UTC,But that character actually has clothes that covers most of her skin and boobs.  You can bet your ass Jessica will find some way to alter the outfit to show skin + cleavage.
JessicaNigri,3b8qoj,Margull,2,Sat Jun 27 16:41:34 2015 UTC,I love how her garage is full of her old costumes
JessicaNigri,3b0eso,FacepIant,54,Wed Jun 24 23:32:06 2015 UTC,(Titties intensifies )
JessicaNigri,3b0eso,Overruler101,14,Thu Jun 25 02:07:41 2015 UTC,"I love cleavage, its one of my fav things"
JessicaNigri,3b0eso,Twoheaven,0,Thu Jun 25 05:00:54 2015 UTC,Agreed. A rare art.
JessicaNigri,3b0eso,theforceds,74,Thu Jun 25 20:39:31 2015 UTC,God damn it! When is she going to get into nude modeling?! She knows she's got the goods for it
JessicaNigri,3b0eso,toxygen,28,Thu Jun 25 01:26:29 2015 UTC,She makes way to much money selling prints and doing appearances to ever do something like that.
JessicaNigri,3b0eso,Sanc7,23,Thu Jun 25 03:32:00 2015 UTC,Doesn't mean much. Playboy has been getting famous actresses to do nude modeling for decades. It's a vanity thing as much as a money thing.
JessicaNigri,3b0eso,Beingabumner,36,Thu Jun 25 08:17:13 2015 UTC,I think I can understand why a woman would be hesitant to do something like that... but we need to form a kick starter or something to bribe her to do it!
JessicaNigri,3b0eso,Tiervexx,2,Thu Jun 25 02:45:26 2015 UTC,Yes please.
JessicaNigri,3b0eso,pranavrules,2,Thu Jun 25 23:00:03 2015 UTC,show her 1 million dollar and you might just get it.
JessicaNigri,3b0eso,Rockstar1996,9,Fri Jun 26 06:25:50 2015 UTC,"The moment she does she will lose tons of interest. And she knows it, she'd rather show a few inches of skin and make cash selling prints or whatever than going nude and not making much more."
JessicaNigri,3b0eso,amidoes,23,Thu Jun 25 12:04:43 2015 UTC,"Plus once you go nude you get paid less for non nude.  Some places won't even consider you for modeling if you've gone nude.  You can either go huge and get lucky or make a shoot or two and lose your market.  She's clearly an expert at non nude, it literally would make no sense to change other than to give into demands or she gets the eye of some insane Japanese billionaire."
JessicaNigri,3b0eso,Th3Instruct0r,2,Thu Jun 25 13:23:45 2015 UTC,Faye Reagan.  American Apparel model and hardcore pornstar at the same time.
JessicaNigri,3b0eso,EricPlasencia,3,Thu Jun 25 20:07:57 2015 UTC,"Couldn't get mainstream work after porn and gained a bad heroin and coke addiction, wasted away."
JessicaNigri,3b0eso,johnedeadly,3,Fri Jun 26 03:15:15 2015 UTC,Hmmm. Ok.   How about Emily Ratajkowski?
JessicaNigri,3b0eso,EricPlasencia,2,Fri Jun 26 09:35:18 2015 UTC,Actually yeah she has pulled off a nice career.
JessicaNigri,3b0eso,johnedeadly,0,Fri Jun 26 11:58:07 2015 UTC,Also Kelly Brook
JessicaNigri,3b0eso,BlueEyed_Devil,32,Thu Jul 2 23:14:04 2015 UTC,That's exactly where I want to put my master sword.
JessicaNigri,3b0eso,Shyt4brains,7,Thu Jun 25 00:11:21 2015 UTC,"Man, Facebook lookin' good with all that cleavage."
JessicaNigri,3b0eso,Sgtbaha,14,Thu Jun 25 04:22:28 2015 UTC,Holy shit.   Jaw literally dropped.
JessicaNigri,3b0eso,pyroness,15,Wed Jun 24 23:57:08 2015 UTC,Added her on Snapchat.... All I saw were videos of her douchebag boyfriend. Soon thereafter I deleted her.
JessicaNigri,3b0eso,RockemSockemDSP,9,Thu Jun 25 10:09:58 2015 UTC,"it's basically everything she posts now, i'm surprised he wasn't somewhere in this picture"
JessicaNigri,3b0eso,ZeroSignal316,7,Thu Jun 25 16:10:15 2015 UTC,"I'm really glad that I added her on snapchat. Before this I slightly worshipped the ground she walked on. After seeing what her and her boyfriend are like on snapchat, I realized they act stupid as fuck and I would hate meeting them"
JessicaNigri,3b0eso,Robert237,7,Thu Jun 25 16:41:22 2015 UTC,"I get it... I understand why people like her. Tits and games, but her snaps are terrible. Half dressed douchebag boyfriend making noises and her laughing."
JessicaNigri,3b0eso,RockemSockemDSP,4,Thu Jun 25 17:13:39 2015 UTC,Haha well that is true. Helps to make you realize we're all just here for tits
JessicaNigri,3b0eso,ZeroSignal316,-7,Thu Jun 25 20:09:51 2015 UTC,Jealousy in a man is quite the awful trait.  Pls cry more because hes hittin that and you're not.
JessicaNigri,3b0eso,RemixxMG,7,Fri Jun 26 18:09:06 2015 UTC,I'm not even jealous. I follow her on Snapchat specifically for titties and there are no titties.
JessicaNigri,3b0eso,CMDR_Muffy,3,Fri Jun 26 19:00:11 2015 UTC,beautiful
JessicaNigri,3b0eso,captainspang,3,Thu Jun 25 07:38:08 2015 UTC,Sweet mother of god
JessicaNigri,3b0eso,pad117,2,Thu Jun 25 11:03:49 2015 UTC,Holy momma
JessicaNigri,3b0eso,LeviathanDementia,5,Thu Jun 25 15:48:46 2015 UTC,Is the left side of her head shaved? If so...this is a more perfect photo.
JessicaNigri,3b0eso,Deezer19,8,Thu Jun 25 03:28:07 2015 UTC,Yeah. not too long ago she did the side shaved type style.  Maybe a month or so ago if im remembering right.  I love it.
JessicaNigri,3b0eso,dannytdotorg,3,Thu Jun 25 04:33:59 2015 UTC,"""Damnit, not had any attention for a little bit looks down, oh YEAH! """
JessicaNigri,3b0eso,JonnyArtois,1 point,Thu Jun 25 23:04:49 2015 UTC,you could set a table for 4 on top of those
JessicaNigri,3b0eso,hiltzy85,1 point,Thu Jun 25 20:09:14 2015 UTC,hnnnnggggggggg
JessicaNigri,3b0eso,Yotep,0,Wed Jun 24 23:35:48 2015 UTC,She looks like a fucking scene kid now with the hair and nose ring. Trashy.
JessicaNigri,3b0eso,alabrand,-17,Thu Jun 25 20:23:32 2015 UTC,I just feel that nose rings ruin so much of this shit. I know that makes me a bad person on planet reddit. Where is that damn puffin when you need him?
JessicaNigri,3b0eso,Tyraid,2,Thu Jun 25 02:39:36 2015 UTC,"She doesn't need the nose ring. I don't know why she got it, but that's cause I haven't asked her."
JessicaNigri,3b0eso,dallonv,-6,Thu Jun 25 03:54:33 2015 UTC,"Stop feeding their egos, these hoes are out of control"
JessicaNigri,3b0eso,Chinkibus,-31,Thu Jun 25 13:40:48 2015 UTC,"Those keep getting bigger and bigger, just like some of the assholes that are in this sub."
JessicaNigri,3b0eso,johnedeadly,11,Thu Jun 25 00:38:12 2015 UTC,Yep. It's kind of embarrassing to be a fan of her and see the bullshit these thirsty assholes say to justify why they can't get a girl like her
JessicaNigri,3b0eso,nightwing2024,5,Thu Jun 25 05:15:33 2015 UTC,Unsubscribe from this subreddit and follow her on Instagram then
JessicaNigri,3b0eso,toxygen,4,Thu Jun 25 06:17:40 2015 UTC,"I follow her on many forms of media. I think she's a cool person, and I've met her a couple times. Of course it doesn't hurt that she's gorgeous, but it's just pathetic how most of the posters here act."
JessicaNigri,3b0eso,nightwing2024,2,Thu Jun 25 06:36:17 2015 UTC,"Yeah I never understand why people who hate posters in a subreddit don't just NOT go into the comments section. Come for the pics of the pretty girl, throw an up vote at it and on to the next. If you know what's lurking in the comments, then avoid it. Stop leaving comments whining about the terrible trolls."
JessicaNigri,3b0eso,Raulimus,7,Thu Jun 25 12:26:31 2015 UTC,I usually come for higher res photos or more of a set  Â¯\_(ãƒ„)_/Â¯
JessicaNigri,3b0eso,Tictac472,-1,Thu Jun 25 17:09:30 2015 UTC,Fair enough. Have an upvote.
JessicaNigri,3b0eso,Raulimus,2,Thu Jun 25 18:15:32 2015 UTC,"I get the photos on other sites, I come here for the comments, and putting retards in their place because it's reddit."
JessicaNigri,3b0eso,johnedeadly,-15,Fri Jun 26 03:17:45 2015 UTC,Plaster on that makeup and put ln your best pushup bra men say they like girl next door but only ever like the skankasaurus. Hot she may be but thirsty she is
JessicaNigri,3b0eso,seesaw4640,-5,Thu Jun 25 07:59:20 2015 UTC,Dat LoZ Shirt!
JessicaNigri,3atvow,hokagenaruto,12,Tue Jun 23 13:50:20 2015 UTC,who would watch this
JessicaNigri,3atvow,Nordok,7,Wed Jun 24 02:32:45 2015 UTC,"This is totally lame, I blame Ryan."
JessicaNigri,3atvow,assman1,7,Wed Jun 24 19:33:28 2015 UTC,no boners here :/
JessicaNigri,3atvow,johnedeadly,12,Wed Jun 24 07:42:29 2015 UTC,Dousedingasoline posted this 15 days ago
JessicaNigri,3atvow,Rockstar1996,0,Tue Jun 23 15:42:19 2015 UTC,My bad I didn't see it
JessicaNigri,3atvow,dragon2513,-19,Thu Jun 25 05:30:16 2015 UTC,16 days ago lol
JessicaNigri,3atvow,Hyena69,1 point,Wed Jun 24 00:57:48 2015 UTC,wat WAT!
JessicaNigri,3ajluk,dousedngasoline,19,Sat Jun 20 20:56:44 2015 UTC,and now our watch begins.
JessicaNigri,3ajluk,skylinedude,15,Sun Jun 21 02:16:35 2015 UTC,Fuck Olly.
JessicaNigri,3ajluk,ZombeaArthur,-1,Sun Jun 21 04:09:18 2015 UTC,For the watch
JessicaNigri,3ajluk,Goldenbrownfish,9,Sun Jun 21 16:42:21 2015 UTC,Summer won't be the only thing that's coming.
JessicaNigri,3ajluk,grody10,4,Sun Jun 21 08:27:28 2015 UTC,Winter is.
JessicaNigri,3ajluk,AxelYoung95,6,Sun Jun 21 14:28:30 2015 UTC,The stickiest winter in 1000 years
JessicaNigri,3ajluk,Ctwenty20,7,Sun Jun 21 15:17:23 2015 UTC,ðŸ’œ Jessica Nigri ðŸ’œ (@jessicanigri) posted this Image at 2015-06-20 19:37:10:   I've purchased a bunch of new strappy weird bikinis that no one would ever wear ever in the history of the world that @fakenerdboy and I are going to shoot in soon!! :D IMPRACTICAL SWIMSUIT SEASON. Photo by @larryalanphoto  Image  Re-hosted     I'm just a bot that rehosts Instagram posts to Imgur. Don't have video working yet. Will soon!  [Subreddit] [Code] [Creator]
JessicaNigri,3ajluk,instagram-bot,15,Sat Jun 20 21:04:45 2015 UTC,"""I've purchased a bunch of new strappy weird bikinis that no one would ever wear ever in the history of the world that @fakenerdboy and I are going to shoot in soon!! :D IMPRACTICAL SWIMSUIT SEASON. Photo by @larryalanphoto"""
JessicaNigri,3ajluk,PTbest,50,Sat Jun 20 20:57:25 2015 UTC,Looking forward to saving a bunch of pictures to my computer and then cropping them.
JessicaNigri,3ajluk,nate0515,16,Sat Jun 20 22:03:28 2015 UTC,"May be that he's taking them, since he's been practicing photography.  I hope"
JessicaNigri,3ajluk,Jules2000,5,Sat Jun 20 22:09:18 2015 UTC,We can only hope brother.
JessicaNigri,3ajluk,Nuclear_Bomb,0,Sun Jun 21 00:09:34 2015 UTC,khaleesi pls
JessicaNigri,3agt6d,WhackyVengeance,37,Sat Jun 20 01:18:16 2015 UTC,Muh filters    Edit: I was bored and fixed the image because it looked like shit http://i.imgur.com/dBsfcgb.jpg
JessicaNigri,3agt6d,Tictac472,17,Sat Jun 20 02:07:00 2015 UTC,*save  God Save the Queen
JessicaNigri,3agt6d,bucherman7,-21,Sat Jun 20 05:01:15 2015 UTC,But that was the joke...
JessicaNigri,3agt6d,sandith752,23,Sat Jun 20 08:11:18 2015 UTC,Well it was a terrible fucking joke then mate
JessicaNigri,3agt6d,Cirty_Dunt,6,Sat Jun 20 13:52:30 2015 UTC,My god her tits are awesome!
JessicaNigri,3agt6d,Overruler101,6,Sat Jun 20 12:54:58 2015 UTC,"Looking a bit ""green"" there,  Jessica."
JessicaNigri,3agt6d,CanadianUncleSam,11,Sat Jun 20 01:32:04 2015 UTC,"Do people really think filters make for better pictures?  I wish all people would stop using them, they're always so gimmicky and useless."
JessicaNigri,3agt6d,JoyousCacophony,3,Sat Jun 20 02:17:20 2015 UTC,I share your hatred for filters.  I started /r/instashit to showcase horribly filtered photos.  I haven't gotten around to doing anything with it yet.
JessicaNigri,3agt6d,killmekillmekillmeki,3,Sat Jun 20 08:24:44 2015 UTC,Just put a shitty tint over the whole thing(css)
JessicaNigri,3agt6d,instagram-bot,6,Sat Jun 20 17:30:59 2015 UTC,ðŸ’œ Jessica Nigri ðŸ’œ (@jessicanigri) posted this Image at 2015-06-20 01:07:28:   ENGLAND. LETSHANGOUTAGAIN.  Image  Re-hosted     I'm just a bot that rehosts Instagram posts to Imgur. Don't have video working yet. Will soon!  [Subreddit] [Code] [Creator]
JessicaNigri,3agt6d,Meterus,3,Sat Jun 20 01:28:35 2015 UTC,"Thank you, honored bot."
JessicaNigri,3agt6d,triplicas,3,Sat Jun 20 13:34:23 2015 UTC,Top notch pair of breasts.
JessicaNigri,3agyrl,Lolturtle145,22,Sat Jun 20 02:15:13 2015 UTC,Is topless too much to ask? That nipple is the national treasure to my nicholas cage..
JessicaNigri,3agyrl,SloptimusXPrime,31,Sat Jun 20 04:39:53 2015 UTC,"Unfortunately, yes, a topless is too much :/ If she leaks one or out right puts one out here, her fan base will decline and she won't get as much attention I don't think. The ""so close I could almost taste it"" keeps drawing people in, and she keeps them a mystery to do so~  At least, that's my theory on it."
JessicaNigri,3agyrl,SloptimusXPrime,7,Sat Jun 20 06:05:47 2015 UTC,I would probably follow more if she had nudes..
JessicaNigri,3agyrl,Stevangelion,2,Sat Jun 20 22:10:40 2015 UTC,She would gain and lose a lot of fans. Her entire career is based off of the imagination. If there is nothing left to the imagination then they is less $$$ coming in.      I will be curious as to where her career will be in 20 years. She might lean on voice acting. Sonico was good. Since it was her first role I give her a ton of credit. I went into it WANTING to hate it and I didnâ€™t.      No matter what we shall never see her like again.
JessicaNigri,3agyrl,Frostymcstu,3,Sat Jun 20 22:27:13 2015 UTC,Sonico was not her first voice acting role. She has a part in RWBY voice acting Cinder Fall
