JessicaNigri,3cgw48,hi_0,15,Tue Jul 7 20:56:21 2015 UTC,"I think there's usually a lil bit of ""She has an interesting persona, a following and she's a talented cosplayer"" but this video is legitiamately all boobs.  Not that I have a problem with that, but all this video is is 60+ seconds of boobs so she gets ad revenue. (I'm assuming its monetized)"
JessicaNigri,3cgw48,Faemn,46,Tue Jul 7 20:47:16 2015 UTC,http://m.imgur.com/jPWbmal
JessicaNigri,3cgw48,kobyok,3,Tue Jul 7 20:41:15 2015 UTC,Whoever sent in the ball gag had the right idea.
JessicaNigri,3cgw48,PsycoSaurus,1 point,Wed Jul 8 16:44:48 2015 UTC,ur welcome
JessicaNigri,3cgw48,guardian38,10,Wed Jul 15 10:48:53 2015 UTC,What a  time to be alive
JessicaNigri,3cgw48,manga2panda,8,Tue Jul 7 20:37:36 2015 UTC,Literally stripping for views.  +1 jess
JessicaNigri,3cgw48,quintonmccain15,8,Tue Jul 7 20:59:21 2015 UTC,http://i.imgur.com/yUN2Duk.gif http://i.imgur.com/4V1k7TH.gif  She's great.
JessicaNigri,3cgw48,fucknaggers,7,Tue Jul 7 21:44:29 2015 UTC,"She obviously know what her fanbase wants, there's nothing wrong with that."
JessicaNigri,3cgw48,Zuqoo,5,Tue Jul 7 23:48:03 2015 UTC,"Everyone please continue to send her bikinis, preferably smaller ones too"
JessicaNigri,3ca4tr,Knoqer,19,Mon Jul 6 08:13:05 2015 UTC,10/10 would still bang if she normally  looked like this. Haha.
JessicaNigri,3ca4tr,NEEDmoarPSI,9,Mon Jul 6 10:24:40 2015 UTC,Still cute af
JessicaNigri,3ca4tr,comby93,3,Mon Jul 6 19:39:36 2015 UTC,That's how I felt Sunday at 2am
JessicaNigri,3ca4tr,AnonymousMaleZero,1 point,Mon Jul 6 09:26:02 2015 UTC,http://i.imgur.com/FGpJQQC.gif
JessicaNigri,3ca4tr,goldengrave,1 point,Sat Jul 11 08:55:56 2015 UTC,The look when you're about to sneeze.
JessicaNigri,3ca4tr,FNG_WolfKnight,0,Sun Jul 19 21:39:11 2015 UTC,Jessica derpgi
JessicaNigri,3ca3hy,LiteLordTrue,8,Mon Jul 6 07:53:44 2015 UTC,I think he does cosplay too
JessicaNigri,3ca3hy,michaelzelen,28,Mon Jul 6 11:00:49 2015 UTC,does he cosplay jobless bums who mooch off their much more successful significant others?
JessicaNigri,3ca3hy,sinapzwork,7,Mon Jul 6 12:46:59 2015 UTC,Yes
JessicaNigri,3ca3hy,fnvmaster,6,Mon Jul 6 15:23:46 2015 UTC,why are you so salty?
JessicaNigri,3ca3hy,d-bowman,7,Mon Jul 6 20:26:48 2015 UTC,What the fuck happened I posted a picture of her boobs and reddit went all tumblr
JessicaNigri,3ca3hy,Stevangelion,38,Tue Jul 7 02:49:20 2015 UTC,"Getting tired of seeing this dude. This sub is about Jessica, not Jessica and her tag along."
JessicaNigri,3ca3hy,RoadRunnerdn,-56,Tue Jul 7 19:49:45 2015 UTC,He's a big part of her life dude and as you said this sub is about her and not just her body.
JessicaNigri,3ca3hy,TryHardFapHarder,68,Mon Jul 6 11:18:57 2015 UTC,whatcha talking about? Is totally about her body dude
JessicaNigri,3ca3hy,barrinmw,-23,Mon Jul 6 13:19:10 2015 UTC,Because it most certainly isn't about her personality.
JessicaNigri,3ca3hy,blubase,39,Mon Jul 6 14:29:17 2015 UTC,I can't fap to him and I certainly can't fap to her personality
JessicaNigri,3ca3hy,Svri,26,Mon Jul 6 15:40:51 2015 UTC,Not with that attitude.
JessicaNigri,3ca3hy,urrk01,6,Mon Jul 6 15:57:20 2015 UTC,I can't have sex with your personality and I can't put my penis in your college degree and I can't shove my fist in your childhood dreams so why you sharing all this information with me?
JessicaNigri,3ca3hy,FNG_WolfKnight,-12,Mon Jul 6 16:52:38 2015 UTC,"It her personality that is why I stuck around. I mean, Megan Fox is physically attractive, but she just seems super shallow. I follow people with fun character and substance. I like how this sub is just here to find bate-in' material."
JessicaNigri,3ca3hy,Xander756,8,Tue Jul 7 00:27:38 2015 UTC,lol if you like her personality then you must be an incel because any real man would be turned off by that childish nonsense.
JessicaNigri,3ca3hy,FNG_WolfKnight,-5,Mon Jul 6 18:04:08 2015 UTC,"So real men are suppose to objectify women? She needs to be all eye candy? Sorry to break it to you, but the people in this world are package deals. You take all or nothing. You can't just a la carte people."
JessicaNigri,3ca3hy,Xander756,-6,Tue Jul 7 01:07:13 2015 UTC,Real men want mature women not childish girls. If you like Jessica's personality I would honestly be concerned you might be a pedophile.
JessicaNigri,3ca3hy,FNG_WolfKnight,-1,Tue Jul 7 02:56:17 2015 UTC,"There is a vast difference between those comparisons, dear sir. Thinking someone is a fun person because they have an energetic/ADD like personality is not even compare able. This real men argument has 0 legs to stand on since the majority of this subs wants her to do porn/playboy. ""Real men"" would actually be respectful of what she does as an entertainer and a crafts(wo)man. Being respectful is very different from liking. Not every piece of content is for everyone. You get to decide what you partake in. Our society has gotten to a place where if something doesn't meet their expectations and/or desires, they get to flame the content maker. And that isn't ok. If I may be so bold to say that demanding life be a certain way is frankly childish. So, enjoy her as eye candy, but if you can't be respectful of who she is, then pick someone else to oogle at."
JessicaNigri,3ca3hy,Xander756,-1,Tue Jul 7 03:29:04 2015 UTC,See look now you're white knighting a girl online that you don't even know. You truly are a pathetic specimen. Talk about beta incels.
JessicaNigri,3ca3hy,Stevangelion,-1,Tue Jul 7 07:29:15 2015 UTC,"Ugh, okay you know exactly what I meant.      This sub is just as much about her body as it is about her life and donâ€™t act like it isnâ€™t. People here care about what she (solo) does with her time mostly because she spends her time taking pictures of herself and her boobs in some fashion.  People came here and continue to come here to see HER. Want to know why they came here in the first place? Hint 1* It wasnâ€™t her gleaming relationship. Hint 2* Tits.      No more white knighting bruhg."
JessicaNigri,3ca3hy,killmekillmekillmeki,1 point,Tue Jul 7 14:02:33 2015 UTC,"Look at the top posts, it's all about the tits dude."
JessicaNigri,3ca3hy,Stevangelion,1 point,Mon Jul 6 21:56:45 2015 UTC,I know thatâ€™s what I said.
JessicaNigri,3ca3hy,FNG_WolfKnight,-3,Thu Jul 9 04:19:00 2015 UTC,"Let's objectify her, but when I comes to day to day, we fight for equality. Hypocrites, amirite?"
JessicaNigri,3ca3hy,deviousgiant,-3,Thu Jul 9 09:02:13 2015 UTC,REKT
JessicaNigri,3ca3hy,thelonious_bunk,10,Mon Jul 6 18:00:22 2015 UTC,This whole thread stinks of that bullshit in Japan where the shitnerds get upset if an Idol girl has sex even though shes a fucking adult with a life.
JessicaNigri,3ca3hy,thelonious_bunk,-1,Mon Jul 6 18:37:53 2015 UTC,"Not everyone works 9-5, who cares what time they post shit of themselves?"
JessicaNigri,3ca3hy,chubbsmagoo,2,Tue Jul 7 03:59:30 2015 UTC,Gotta keep squishing them to keep em soft.
JessicaNigri,3ca3hy,Hyena69,2,Tue Jul 7 17:44:15 2015 UTC,This sob
JessicaNigri,3ca3hy,upekarox,2,Wed Jul 8 18:39:18 2015 UTC,Imgur link isn't working??? can some please rehost?
JessicaNigri,3c9djy,Djlynch2009,3,Mon Jul 6 02:54:57 2015 UTC,"I will, since this doesn't look anything like an Umbreon..."
JessicaNigri,3ch447,theforceds,8,Tue Jul 7 21:30:26 2015 UTC,ITT: people who can not read
JessicaNigri,3ch447,Misguidedvision,36,Wed Jul 8 12:23:23 2015 UTC,This is the worst shitpost I've ever seen on this sub
JessicaNigri,3ch447,tenhotuisku,1 point,Tue Jul 7 21:50:03 2015 UTC,Youre not wrong.
JessicaNigri,3ch447,jesuthewise,-35,Wed Jul 8 03:11:25 2015 UTC,As proven with this comment. Thanks.
JessicaNigri,3ch447,deviousgiant,3,Tue Jul 7 21:58:28 2015 UTC,"I mean, there are sub rules, specifically rule number 3. But then, whatever..."
JessicaNigri,3ch447,jokerjohn09,5,Wed Jul 8 01:55:18 2015 UTC,IMO two separate subs would be the way to go. That way everyone's a happy camper. :p
JessicaNigri,3ch447,PTbest,10,Tue Jul 7 22:06:14 2015 UTC,"I guess but realistically the ""non-fap"" one would be really inactive."
JessicaNigri,3ch447,Tictac472,6,Tue Jul 7 22:20:35 2015 UTC,So /r/Jessica_nigri
JessicaNigri,3ch447,jokerjohn09,2,Tue Jul 7 22:59:34 2015 UTC,"There are tons of ""non-fap"" fan pages on Instagram already. It would just give them a home on reddit. Besides, we wouldn't have so many pointless arguments on here anymore."
JessicaNigri,3ch447,MrMorlonelycat,3,Tue Jul 7 22:27:26 2015 UTC,k
JessicaNigri,3ch447,flubberisking,1 point,Wed Jul 8 00:44:27 2015 UTC,"It is about her tits/body on this sub, it always has been. We don't give a fuck, so go away and let us jerk off in peace. Go make another sub if you care so much."
JessicaNigri,3ch447,jesuthewise,-11,Wed Jul 8 05:23:06 2015 UTC,"Did you even read the thread, moron? I was agreeing."
JessicaNigri,3ch447,jesuthewise,-10,Wed Jul 8 06:04:33 2015 UTC,Oh my god I was agreeing. Read the fucking post.
JessicaNigri,3ch447,jesuthewise,1 point,Wed Jul 8 06:07:49 2015 UTC,This sounds like some SJW bull. She objectifies herself so really theres no much difference if others do it. You should try tumblr though they may care more.
JessicaNigri,3cahc0,Roderickje,10,Mon Jul 6 11:18:11 2015 UTC,I didnâ€™t see any nip. Boo.
JessicaNigri,3cahc0,Stevangelion,5,Mon Jul 6 11:29:51 2015 UTC,"Her right, our left @ 0:40. Not that I've analyzed frame by frame or anything.......XD"
JessicaNigri,3cahc0,puttyhands,4,Mon Jul 6 11:42:40 2015 UTC,Hahahaha! I shall do my due diligence and investigate! Thank you for the nip tip!
JessicaNigri,3cahc0,Stevangelion,5,Mon Jul 6 14:06:52 2015 UTC,It's EXTREMELY visible at 2:48 of that video
JessicaNigri,3cahc0,Xander756,1 point,Wed Jul 8 14:11:29 2015 UTC,yeah she did say it was her nipples and eve Kassam G said it also on his instagram then days later it was deleted!
JessicaNigri,3cahc0,kirbyforlife69,1 point,Fri Jul 10 05:36:25 2015 UTC,She talked about that in a later interview. She said it was a pasty. She wears pasties under all her revealing cosplays just in case.
JessicaNigri,3cahc0,xxXEliteXxx,3,Mon Jul 6 14:10:48 2015 UTC,"She denied it at first, probably out of emarresment, but later said that was a nip-slip."
JessicaNigri,3cahc0,SolidSoarel,5,Wed Jul 8 02:35:27 2015 UTC,She didn't say that. She admitted to Kassem that it was her nipple.
JessicaNigri,3c86ur,IceCreamPirate,9,Sun Jul 5 20:27:58 2015 UTC,Annoyingly stupid face.
JessicaNigri,3c86ur,xdeviousx,17,Mon Jul 6 00:19:59 2015 UTC,But tits.
JessicaNigri,3c86ur,MrMorlonelycat,-5,Mon Jul 6 01:37:39 2015 UTC,What is her Snapchat username?
JessicaNigri,3c86ur,toxygen,10,Sun Jul 5 23:47:56 2015 UTC,Reading.
JessicaNigri,3c86ur,nate0515,9,Sun Jul 5 23:50:51 2015 UTC,"Yeah, the title ""New Snapchat"" could easily be perceived as meaning that she has created a new Snapchat account."
JessicaNigri,3c86ur,uncledavid95,18,Mon Jul 6 08:01:04 2015 UTC,Except op's title makes it seem as though she has a new one.
JessicaNigri,3c86ur,kill619,16,Mon Jul 6 00:05:11 2015 UTC,Sorry
JessicaNigri,3c8806,IceCreamPirate,2,Sun Jul 5 20:38:03 2015 UTC,Hmm? hair? what hair?
JessicaNigri,3c8806,Bigingreen,10,Mon Jul 6 12:31:21 2015 UTC,everyone needs to start cropping her fag boy out
JessicaNigri,3c8806,YumeJoka,4,Sun Jul 5 21:56:15 2015 UTC,That should be a new rule for this sub.
JessicaNigri,3c8806,ElDuderino2112,13,Wed Jul 8 05:50:46 2015 UTC,"waiter, there's far too much salt in this dish."
JessicaNigri,3c8806,butreallythobruh,-6,Mon Jul 6 03:17:33 2015 UTC,Maybe some water for the burn is needed!
JessicaNigri,3c8806,Ilixion,-1,Mon Jul 6 17:47:36 2015 UTC,damn
JessicaNigri,3c5tmg,joanofarch1,20,Sun Jul 5 02:30:25 2015 UTC,So ... did that chick censor her face on her own Instagram account?
JessicaNigri,3c5tmg,Cereborn,10,Sun Jul 5 07:11:46 2015 UTC,She only posted anime characters on her account.  Cant say im suprised.
JessicaNigri,3c5tmg,Overruler101,6,Sun Jul 5 11:40:20 2015 UTC,Aw what happened to the bot that rehosted instagram pictures :'(
JessicaNigri,3c5tmg,conjureSC,3,Sun Jul 5 17:15:18 2015 UTC,https://igcdn-photos-e-a.akamaihd.net/hphotos-ak-xfa1/t51.2885-15/11426414_504938516326436_1716762972_n.jpg
JessicaNigri,3c5tmg,Xirious,0,Sun Jul 5 22:26:23 2015 UTC,https://www.youtube.com/watch?v=3LOBEdSEono
JessicaNigri,3c5tmg,89reatta,-14,Sun Jul 5 05:52:26 2015 UTC,Much fake boobs.
JessicaNigri,3c5tmg,SoGeeky,20,Sun Jul 5 06:08:24 2015 UTC,Its so plastic its fantastic! Go Go barbie lets Go partyy
JessicaNigri,3c5tmg,TryHardFapHarder,6,Sun Jul 5 06:58:47 2015 UTC,Are we doing this again?
JessicaNigri,3c5tmg,yajyuu,5,Sun Jul 5 06:50:46 2015 UTC,>Implying it's not always going on here
JessicaNigri,3c5tmg,Tictac472,-20,Sun Jul 5 12:27:21 2015 UTC,"Claiming this based on nothing, even though she's denied it many times and explained her costumes."
JessicaNigri,3c5tmg,utmostdown,14,Sun Jul 5 12:22:40 2015 UTC,Anyone with eyes can see they're fake
JessicaNigri,3c5tmg,utmostdown,-23,Sun Jul 5 13:57:26 2015 UTC,That's not really how it works at all.
JessicaNigri,3c5tmg,sleggs,5,Sun Jul 5 13:59:09 2015 UTC,"Well as I mentioned before, as a chick with actual huge real tits and having a girlfriend with fake tits I'm pretty qualified to say if they're real or not. You can easily see the implant shape in this Jibril costume with the side boob. But as I've said there is nothing wrong with fake tits. I love them. They look great."
JessicaNigri,3c5tmg,ImperfectSanity,-1,Sun Jul 5 14:10:52 2015 UTC,She finally admitted to it a little while back too.
JessicaNigri,3c5tmg,alpinefoliage,0,Sun Jul 5 14:53:05 2015 UTC,Source? Or are you referring to the post where she didn't deny they were fake?
JessicaNigri,3c5tmg,Sour_J,0,Sun Jul 5 15:58:21 2015 UTC,Source?
JessicaNigri,3c5tmg,3point3,-28,Mon Jul 6 00:27:27 2015 UTC,Push up bras push out to the sides too??  NOT. Big fake porn star boobies!   Still waiting for her BF to break up with her so we can get a sex tape on revengegf.com
JessicaNigri,3c5tmg,Sour_J,-14,Sun Jul 5 07:26:03 2015 UTC,"If they're only pushing upwards, yes they do go out the sides. Get a clue."
JessicaNigri,3c5tmg,3point3,5,Sun Jul 5 13:39:08 2015 UTC,Um do you know how bras work? They do not push out on sides lol.
JessicaNigri,3c5tmg,Sour_J,-6,Sun Jul 5 13:56:54 2015 UTC,Get laid to know virgin.
JessicaNigri,3c5tmg,3point3,-6,Sun Jul 5 17:30:52 2015 UTC,Cheap insults since you don't have a leg to stand on.
JessicaNigri,3c5tmg,Sour_J,-7,Sun Jul 5 17:43:02 2015 UTC,Experience. Something you dont have.
JessicaNigri,3c5tmg,3point3,-3,Sun Jul 5 17:58:43 2015 UTC,The exact same insult again.
JessicaNigri,3c5tmg,Vallarta21,-5,Sun Jul 5 17:59:18 2015 UTC,"Sorry bruh. There's a couple sites out there that also prove her tits are fake. The reason why people get on her so much is that she keeps denying it.  If you look at how flat she was a couple years ago you would obviously know, unless you're a clueless virgin in denial."
JessicaNigri,3c5tmg,SoGeeky,-7,Sun Jul 5 18:07:15 2015 UTC,There's never been any proof or real evidence. There's a reason she denies it.
JessicaNigri,3c5tmg,Sour_J,4,Sun Jul 5 18:12:36 2015 UTC,"Let me help you.  http://queenofthenerds.net/the-top-4-professional-cosplayers-and-why-they-annoy-actual-nerds/  Look at the pictures at the top and bottom. She even tweeted she wanted fake boobs before and deleted it, but not before people captured it. Its shown there. If you still deny she has had any work done you are delusional."
JessicaNigri,3c4x7g,Cloda,8,Sat Jul 4 20:42:07 2015 UTC,Oh...... Glorious....... Side-boob........
JessicaNigri,3c4x7g,KalebTheKraken,2,Sun Jul 5 02:47:36 2015 UTC,Well I love her to death but this pretty much takes out guessing if they are real. Sorry Jess no more denying
JessicaNigri,3c4x7g,StitchesxxMitch,13,Sun Jul 5 02:18:05 2015 UTC,"The guessing went away a long time ago, buddy. see"
JessicaNigri,3c4x7g,Sacar25,4,Sun Jul 5 03:40:50 2015 UTC,"Yes I ""knew"" that from size change, but I was just stating that you can see the implant in this one"
JessicaNigri,3c4x7g,StitchesxxMitch,2,Sun Jul 5 09:47:09 2015 UTC,Oh yes very much so.
JessicaNigri,3c4x7g,Sacar25,3,Sun Jul 5 13:10:57 2015 UTC,"Definitely no guessing now, because she finally admitted to it a few months ago."
JessicaNigri,3c4x7g,masshe,2,Sun Jul 5 14:03:19 2015 UTC,Really? Good for her.
JessicaNigri,3c4x7g,Sacar25,1 point,Sun Jul 5 14:05:45 2015 UTC,Source?
JessicaNigri,3c4x7g,WinOSXBuntu,5,Mon Jul 6 20:31:47 2015 UTC,"You don't understand, it's just push-ups and better bras! /s"
JessicaNigri,3c4x7g,Rhapsodize,2,Sun Jul 5 05:01:51 2015 UTC,She admitted it a few months ago.
JessicaNigri,3c4x7g,masshe,6,Sun Jul 5 12:26:46 2015 UTC,Source?
JessicaNigri,3c4x7g,sandith752,8,Sun Jul 5 14:36:52 2015 UTC,"I think they meant their buddy, the guy, got a picture with Jessica."
JessicaNigri,3c4iqy,GenZod,12,Sat Jul 4 18:30:22 2015 UTC,"God shes beautiful. I sometimes get envious of gorgeous fake boobs. When you have big real ones, they dont look nearly as pretty when you're laying down like this.  lol"
JessicaNigri,3c4iqy,joanofarch1,4,Sat Jul 4 22:57:46 2015 UTC,Now someone post a higher res version with him cropped out. :P
JessicaNigri,3c4iqy,CanadianUncleSam,11,Sat Jul 4 23:35:37 2015 UTC,Best I could do..
JessicaNigri,3c4iqy,seequiNz,2,Sun Jul 5 10:40:06 2015 UTC,I salute you sir.
JessicaNigri,3c4iqy,Thetoofa,-18,Sun Jul 5 13:56:33 2015 UTC,Does he even lift?
JessicaNigri,3c4iqy,blasphemyisgood,25,Sat Jul 4 18:47:56 2015 UTC,"Yes, he lift her tits"
JessicaNigri,3c4iqy,kancolle_nigga,-26,Sat Jul 4 22:29:48 2015 UTC,"That doesn't count. Tatted dad bod, 10/10 would assume he's rich..."
JessicaNigri,3c4iqy,blasphemyisgood,4,Sat Jul 4 22:33:02 2015 UTC,"Or, and this might come as a surprise, they have a connection that isn't based on looks or money. Like some sort of relationship."
JessicaNigri,3c4iqy,Classtoise,-11,Sun Jul 5 13:57:15 2015 UTC,"This might surprise you as well Gentlesir, a relationship with no physical attraction won't work..."
JessicaNigri,3c4iqy,blasphemyisgood,2,Sun Jul 5 14:59:22 2015 UTC,"Some chicks like somewhat effimated guys who has soft features, nothing wrong with that."
JessicaNigri,3c39d6,Flaszka,6,Sat Jul 4 09:49:26 2015 UTC,She should cosplay as sonneiko to support his getting a visa for TI5.
JessicaNigri,3c39d6,johnyann,3,Sat Jul 4 21:48:19 2015 UTC,I neeeed her ab workout.
JessicaNigri,3c39d6,kill619,8,Sat Jul 4 18:22:09 2015 UTC,Abs like that are a lot less about what ab exercises you're doing and a lot more about what you're not eating.
JessicaNigri,3c39d6,Tiervexx,2,Sat Jul 4 20:38:10 2015 UTC,"My body fat percentage stays  at/under 10, I think I'm at a point where I just need to pick a workout and stick to it."
JessicaNigri,3c39d6,kill619,3,Sun Jul 5 03:06:14 2015 UTC,"50 supersets of weighted machine crunches and regular crunches on a mat, 20 reps weighted, 40 reps regular. 45 second rest between each superset."
JessicaNigri,3c39d6,blasphemyisgood,1 point,Sat Jul 4 18:42:03 2015 UTC,I know. Seriously. She has the best stomach ever
JessicaNigri,3c3crh,GenZod,2,Sat Jul 4 10:47:35 2015 UTC,Oh she's shaving her eye brow like a gang banger.
JessicaNigri,3c3crh,Lilbitevil,0,Sat Jul 4 12:36:46 2015 UTC,Special person* FTFY
JessicaNigri,3c3crh,blasphemyisgood,1 point,Sat Jul 4 18:45:23 2015 UTC,cute
JessicaNigri,3c2faj,TheGooeySpoon,13,Sat Jul 4 03:21:15 2015 UTC,Bullshit. Finn is afraid of the ocean.
JessicaNigri,3c2faj,Ecchi-Dono,11,Sat Jul 4 05:56:32 2015 UTC,"I'm guessing she had surgery fairly recent when this photo was taken. The boobs appear hard and firm. After a year or so, implants start to loosen up and ""drop"" more like she has now."
JessicaNigri,3c2faj,joanofarch1,6,Sat Jul 4 22:59:50 2015 UTC,"Yeah, no push ups here. ;)"
JessicaNigri,3c2faj,Rekthul,3,Sun Jul 5 01:38:39 2015 UTC,Nope definitely no push ups needed anymore. Though I hope she still does. glorious boobs
JessicaNigri,3c2faj,Sacar25,7,Sun Jul 5 03:44:31 2015 UTC,Damn..
JessicaNigri,3c2faj,seequiNz,2,Sat Jul 4 09:32:23 2015 UTC,For some reason this picture just looks completely edited to me haha.
JessicaNigri,3c2faj,JonnyArtois,10,Sat Jul 4 12:59:04 2015 UTC,Because the boobies are fake. I'm fine with that though.
JessicaNigri,3c2faj,Sacar25,-9,Sat Jul 4 13:09:51 2015 UTC,Speculation much?
JessicaNigri,3c2faj,musshe,7,Sun Jul 5 14:58:47 2015 UTC,Here we go again.
JessicaNigri,3c2faj,Yosonimbored,1 point,Sun Jul 5 15:59:05 2015 UTC,"C'mon, how can people still think they're real? Tits don't magically grow overnight. http://i.imgur.com/XRUK5I5.jpg"
JessicaNigri,3c2faj,stormrider133,1 point,Fri Jul 17 03:33:28 2015 UTC,"Those pics are 5 years apart, not ""overnight""."
JessicaNigri,3c2faj,musshe,-9,Fri Jul 17 18:05:47 2015 UTC,Baffles me that people can actually delude themselves into thinking her tits are real. Still amazing.
JessicaNigri,3c2faj,SHIT_ON_MY_BALLS,23,Sat Jul 4 03:59:05 2015 UTC,Nobody thinks they're real
JessicaNigri,3c2faj,pad117,8,Sat Jul 4 12:35:12 2015 UTC,Trust me there are enough people out there. On the subject though she's still hot.
JessicaNigri,3c2faj,Lemonian,2,Sat Jul 4 14:55:01 2015 UTC,People on this very sub think so and she even says they're real herself and that she's 'really good at making them look big' or some sort of bs like that.
JessicaNigri,3c2faj,SHIT_ON_MY_BALLS,0,Sat Jul 4 23:27:15 2015 UTC,She admitted it a few months ago.
JessicaNigri,3c2faj,masshe,3,Sun Jul 5 13:20:19 2015 UTC,Where?
JessicaNigri,3c2faj,SloptimusXPrime,3,Sun Jul 5 13:44:50 2015 UTC,I'll bet her tits are bigger than yours.
JessicaNigri,3c2faj,Equinoqs,0,Sat Jul 4 15:34:21 2015 UTC,"big fake tits make girls angry because we feel conflicted about breast augmentation. Not oc, but I have massive titties but they will never be as perky as Jess's and it makes me sad lol. Still love her tho."
JessicaNigri,3c2faj,ballzntingz,1 point,Sat Jul 4 20:01:51 2015 UTC,I'm not at all concerned about breast size. I just wanted to make fun of that comment.
JessicaNigri,3c2faj,Equinoqs,0,Sat Jul 4 20:05:22 2015 UTC,Yeah it was pretty stupid. I just felt compelled to explain women.
JessicaNigri,3c2faj,ballzntingz,6,Sat Jul 4 20:09:14 2015 UTC,...where did that come from? Nobody said anything about her tits.
JessicaNigri,3c2faj,WTFbeast,2,Sat Jul 4 12:06:37 2015 UTC,I was admiring the beautiful blue water.
JessicaNigri,3c2faj,maflor0711,1 point,Sat Jul 4 19:06:13 2015 UTC,"Yeah, I mean I was looking for those sharks I keep reading about"
JessicaNigri,3c2faj,StitchesxxMitch,2,Sun Jul 5 02:23:06 2015 UTC,nobody thinks they're real and nobody cares.
JessicaNigri,3c1nw6,David_24_,16,Fri Jul 3 22:59:15 2015 UTC,This has been posted here probably dozens of times but I'll still upvote it each time
JessicaNigri,3c1nw6,PTbest,6,Sat Jul 4 00:15:15 2015 UTC,There's nothing more to say.
JessicaNigri,3c1nw6,I-AM-Canadian-Eh,3,Fri Jul 3 23:59:03 2015 UTC,They don't get any faker than those boys.
JessicaNigri,3c1nw6,Sour_J,-10,Sat Jul 4 10:19:00 2015 UTC,They aren't even fake. That's an underwire bra pushing them up and together. She's denied it many times.
JessicaNigri,3c1nw6,utmostdown,-3,Sun Jul 5 12:23:36 2015 UTC,And you believe her because you're a virgin?
JessicaNigri,3c1nw6,Sour_J,-7,Sun Jul 5 17:30:25 2015 UTC,No I believe her because what she says makes sense.
JessicaNigri,3c1nw6,utmostdown,3,Sun Jul 5 17:39:21 2015 UTC,"He is absolutly right though. Heres proof. http://queenofthenerds.net/the-top-4-professional-cosplayers-and-why-they-annoy-actual-nerds/ She actually had said before she wanted fake boobs and deleted it after immediately, but not after someone screen captured it. If those before pictures compared to what she has now arent convincing enough than you guys are delusional. ...and NO PUSH UP BRA CAN EVER ACHIEVE THE RESULTS SHE HAS NOW. So stop it now."
JessicaNigri,3c1nw6,Vallarta21,-3,Mon Jul 6 01:23:05 2015 UTC,Virgin confirmed.
JessicaNigri,3c1nw6,Sour_J,0,Sun Jul 5 17:59:05 2015 UTC,Childish asshole confirmed.
JessicaNigri,3c1nw6,nevejtn,3,Mon Jul 6 00:16:48 2015 UTC,"He is absolutly right though. Heres proof.  http://queenofthenerds.net/the-top-4-professional-cosplayers-and-why-they-annoy-actual-nerds/  She actually had said before she wanted fake boobs and deleted it after immediately, but not after someone screen captured it. If those before pictures compared to what she has now arent convincing enough than you guys are delusional.  ...and NO PUSH UP BRA CAN EVER ACHIEVE THE RESULTS SHE HAS NOW. So stop it now."
JessicaNigri,3c1nw6,Vallarta21,1 point,Mon Jul 6 01:17:11 2015 UTC,This doesn't even look like her after all the photoshop. Still hot as fuck though.
JessicaNigri,3c1nw6,sinapzwork,0,Tue Jul 7 01:24:32 2015 UTC,my fav pic of Jess <3
JessicaNigri,3c2w8h,rickyhorror,9,Sat Jul 4 06:30:51 2015 UTC,Sigh
JessicaNigri,3c2w8h,Shinyfrogeditor,2,Sat Jul 4 20:26:36 2015 UTC,Not what I expected
JessicaNigri,3c2w8h,alex_aleksandr,0,Sat Jul 4 13:54:00 2015 UTC,Source?
JessicaNigri,3c21j8,quintonmccain15,5,Sat Jul 4 01:05:10 2015 UTC,From her Facebook
JessicaNigri,3c21j8,nate0515,1 point,Sat Jul 4 01:22:59 2015 UTC,Such a cute costume. Love that eye color on her
JessicaNigri,3c1uyp,EthanMcl,31,Sat Jul 4 00:02:44 2015 UTC,She's famous because of her tits and how everyone wants to see her get dicked in a porno.
JessicaNigri,3c1uyp,thorsedidbadstuff_II,18,Sat Jul 4 13:13:26 2015 UTC,But her personality is kind of obnoxious and irritating more often than not. I stick around for the tits. But that's just me
JessicaNigri,3c1uyp,quintonmccain15,7,Sat Jul 4 14:48:50 2015 UTC,"She seems to have a lot of fun doing what she does and what she does inserts more cleavage and weird behaviour into my day, so more power to her."
