JessicaNigri,38y0kk,Jhallows,26,Sun Jun 7 23:19:50 2015 UTC,Mute is an awesome invention.
JessicaNigri,38y0kk,jotch,30,Mon Jun 8 01:13:33 2015 UTC,"I've watched a few, her personality seems borderline fake, and its honestly just obnoxious"
JessicaNigri,38y0kk,RuneTheWolf,5,Mon Jun 8 04:34:05 2015 UTC,"Yeah I'm usually straight face if i try and watch a video. She's just a good looking girl, don't care what she does with her life."
JessicaNigri,38y0kk,olbleedyeyes,44,Tue Jun 9 02:54:47 2015 UTC,"I think i have made my feelings clear in another post :  I think i can't watch these videos anymore! Not because of Jess, but because of that guy next to her! Don't get me wrong i hope he makes her happy and i am not jealous i don't have any illusions that that should be me sitting next to her. But he just ruins it for me. All we get from him is lame sound effects and dumb faces. These video's used to be pretty cool, not just for the jiggling but the things were sent to Jessica and she enjoyed them and liked them or maybe not but it was her reaction and not from some dude that she is dating. Now he is litteraly ripping the things out of her hands to get some attention even though playfull still very weird because its send to Jessica and not to him. No, im done with these video's im unsubscribing and i hope that Jess will soon be doing HER stuff by HERSELF soon again. If this guy wants attention then he should start his own mail monday but i guess he would have alot less people watching!"
JessicaNigri,38y0kk,Roderickje,22,Sun Jun 7 21:10:41 2015 UTC,"Yeah, before I felt like she made the videos for us, her fans, but now I feel as though she makes them as a way to hang out with her boyfriend."
JessicaNigri,38y0kk,valitzky,61,Sun Jun 7 21:19:49 2015 UTC,"Couldn't really care less, I'm just here for the tits. And from the looks of the stuff that gets upvoted I'm not alone."
JessicaNigri,38y0kk,WhiskeyMash,13,Sun Jun 7 21:18:14 2015 UTC,Fair enough
JessicaNigri,38y0kk,Lilbitevil,46,Sun Jun 7 21:20:03 2015 UTC,I fucking hate it. HATE IT!!!
JessicaNigri,38y0kk,ZeroSignal316,17,Sun Jun 7 20:45:37 2015 UTC,"Yeah, I feel like it isn't the same channel i subscribed to."
JessicaNigri,38y0kk,Margull,5,Sun Jun 7 21:10:19 2015 UTC,It looks like the all new tweeker channel.
JessicaNigri,38y0kk,Psychozoa,5,Mon Jun 8 01:18:44 2015 UTC,"I've stopped watching everything. All of her social media and stuff is actually like 70% her bf who looks like a dude I wouldn't care to know, let alone look at vids and phots of him."
JessicaNigri,38y0kk,eehreum,16,Mon Jun 8 02:21:59 2015 UTC,"It's a freaking dumb move by Jess, and I'm surprised she doesn't know better.  Letâ€™s be honest, Jessica is a sex-symbol, she knows exactly what she is, and where she gets her fame from, sheâ€™s not stupid. At the same time, weâ€™re not stupid, we know she has a boyfriend, and even when sheâ€™s single sheâ€™s still insanely off-limits, but thatâ€™s the point of being a â€œfantasy girlâ€, at least give people the illusion that you are available, even if everyone knows you're not.  This illusion however gets quickly broken when the dude banging her appears next to her in most of her videos. A constant reminder that your â€œdream girlâ€ is taken, which I think bothers a lot of people.  She must know that showing her boyfriend in videos will probably get him a LOT more hate than love. If not, I am seriously questioning her intelligence."
JessicaNigri,38y0kk,KalebTheKraken,3,Mon Jun 8 00:49:41 2015 UTC,"Watched some of her stuff before, really don't now. Nothing against her but I just normally get annoyed with any channel that brings in an SO into 50%, or more of their videos. Had that thought process when I was single, been happily dating someone for a good amount of time and still think the same way.  I subscribe to a YouTuber for the YouTuber, not their SO."
JessicaNigri,38y0kk,barrinmw,0,Mon Jun 8 03:30:17 2015 UTC,"By bringing in her SO she drops a lot of creepers that want to be her imaginary internet boyfriend.  This in turn brings in more mainstream watchers and fans who aren't turned away by the creepers.  It doesn't really affect the people who are just there for tits.  So for her it might be a beneficial career move. But holy shit has she become completely unfunny at the same time.  I can only see her getting less popular from now on, unless she magically gets her humor and quirkiness back.  Couple that with this unfunny douche taking 50% of the time and there's absolutely no reason to watch this anymore.  Thank god for the benevolent webm/gif makers that cut out the sound and only give us the good parts."
JessicaNigri,38y0kk,ElDuderino2112,3,Mon Jun 8 06:53:23 2015 UTC,Here for the tits....that is all.
JessicaNigri,38y0kk,blackouteyes,2,Tue Jun 9 02:10:29 2015 UTC,But we get about 1/3rd to 1/2 less boobs because of him.
JessicaNigri,38y0kk,salmalight,9,Fri Jun 12 12:52:54 2015 UTC,"I never watched her youtube stuff anyway so I don't care. Let's be honest, we're all here for tits. Why would I waste time looking at the stupid stuff people send her when anything good ends up on this sub anyways? It's good that she's happy with the dude, but I don't have to pretend to give a shit about him because I like a pair of tits that are all over the internet."
JessicaNigri,38y0kk,Xxpat5xX,2,Sun Jun 7 23:05:23 2015 UTC,"It's hard to run a program of any type for long term without it getting stale and requiring change in format/people involved, etc. She enjoys the guy's company and it's changed things up a little for the moment."
JessicaNigri,38y0kk,donniesdiabetes,2,Mon Jun 8 15:22:28 2015 UTC,Whatever makes her happy man.
JessicaNigri,38y0kk,slai47,2,Tue Jun 9 00:36:46 2015 UTC,"I was thinking about this the other day actually.  I find that before the mail Monday videos (when she did post them) felt more personal and genuine, where she actually spent time reacting and reading about the stuff she got.  Now it feels like the genuine reactions are gone and seems like she has a I deserve this attitude about the whole thing.  I'm not sure if she is acting like this because of the bf in the picture but it felt more genuine and real when it was just her.  Also they seem to be getting shorter and shorter.  Before it was a good 10ish items if not more she got to, now it's open like 3, bf makes weird noises, informs us where she will be and bye."
JessicaNigri,38y0kk,omkirk,5,Tue Jun 9 06:30:54 2015 UTC,"Who gives a shit, you're watching videos that are basically about her life so if her boyfriend is present then that's just how it'll be. technically there's no real point to this as its her channel and her choice on the content on said channel.( really i just can't stand pointless opinions and i'm a grumpy cunt, so sorry mate)   Edit: Us guys have no real deciding factor on her content so all im doing is telling the truth(more the truth to me, my pointless opinion), its just pretty pointless. anyway her boyfriend seems to make her happy and thats whats important."
JessicaNigri,38y0kk,theforceds,4,Sun Jun 7 23:29:31 2015 UTC,Not the hugest fan of it but it has added different laughs to it.
JessicaNigri,38y0kk,aeonion,1 point,Sun Jun 7 20:37:23 2015 UTC,"For anyone who is like me and have been following her on social media for a number of years, I think it is naive of me to say that I am not jealous. I'm not a psyco-dude in love with her, but still, her just being single and looking at me (the camera) being goofy in her own way, with her tits bouncing around all up over my screen is fuckin' awesome! On a realistic note, I have no trouble sleeping at night over this guy being with her. My selfish horny monster version of myself is dampened thanks to the dude in the videos."
JessicaNigri,38y0kk,Lolturtle145,1 point,Mon Jun 8 03:02:45 2015 UTC,Not into it.
JessicaNigri,38y0kk,DragonFlyer123,1 point,Mon Jun 8 18:39:17 2015 UTC,"Imagine if you go to a concert and instead of watching your rock/dj/pop idol interact with the audience you see their OS clowning all over the stage (Yoko ONO Style), thats how i feel  Its not like she is a rockstar though but the guy is goddam annoying!  it is a bad version of an attention whore in a man, he seems so tryhard to be like ""im such a random weird guy"" and you can even notice he is there just to get more Instagram folowers and make money.  We should call the dude YONO NIGRI.  edit:words"
JessicaNigri,38y0kk,SlyJackson,1 point,Tue Jun 9 16:02:25 2015 UTC,"Personally I don't mind it. The recent Japan Box thing with her brother too had me in some good laughs. FakeNerdBoy adds to it in a few ways, but I think that MOST mail monday should remain a Jessica exclusive. If he were in one every so often, say, two times per month, that'd be fine. Other vids with them two/her brother also could be their own social thing. She just kind of needs to sort things out, and get a video work ethic more organized. Still enjoy them, though."
JessicaNigri,38y0kk,Ashyneko,1 point,Sat Jun 20 07:44:53 2015 UTC,It makes no difference
JessicaNigri,38y0kk,killmekillmekillmeki,1 point,Sun Jun 7 21:32:06 2015 UTC,I just don't care to look at shit with his face in it. Nothing against the guy but I don't subscribe because I'm interested in them. I subscribe because I like what the content used to be and he is certainly hurting the quality of the content.
JessicaNigri,38y0kk,Ashyneko,2,Mon Jun 8 00:21:55 2015 UTC,"No one complains about other girls that rock up in her vids though, in vlogs... HMMMMM I WONDER WHY ITS JUST RYAN THAT GETS SHIT."
JessicaNigri,38y0kk,jk01,1 point,Mon Jun 8 08:31:09 2015 UTC,"Lol, if he grews tits and shaved he would blend right in, looks effeminated enough shit."
JessicaNigri,38y0kk,Timmarus,1 point,Tue Jun 9 06:48:20 2015 UTC,tehe
JessicaNigri,38y0kk,SunlightSpear,1 point,Thu Jun 11 12:17:58 2015 UTC,"I stopped watching it because he;s annoying. I dont have a problem with him, just his stupid slapstick sense of humor."
JessicaNigri,38w2ku,TheLaggingNinja,147,Sun Jun 7 08:54:28 2015 UTC,Not sure if my favorite thing about this is Jessica or the fact that you edited out the unnecessary douche.
JessicaNigri,38w2ku,Reaper111888,84,Sun Jun 7 09:21:19 2015 UTC,"Glad to see I'm not the only one that hates that wannabe. It's not even from a jealousy standpoint, he just seems like an insufferable human being."
JessicaNigri,38w2ku,pyrozerker,14,Sun Jun 7 12:34:33 2015 UTC,"Amen, good sir"
JessicaNigri,38w2ku,DylanWhite86,-18,Sun Jun 7 18:04:35 2015 UTC,you guys are so jelly.
JessicaNigri,38w2ku,joshthewall,-33,Sun Jun 7 21:32:08 2015 UTC,Lol people complaining about him when he is basically Jessica Male form hahaha  You guys are really unable to say its jealousy? I honestly find him as funny as Jessica and they look great and happy together
JessicaNigri,38w2ku,GodTierJungler,98,Sun Jun 7 12:45:12 2015 UTC,funny as jessica   So equally unfunny
JessicaNigri,38w2ku,Neighbour-Totoro,-35,Sun Jun 7 12:57:31 2015 UTC,Different strokes for different folks
JessicaNigri,38w2ku,GodTierJungler,68,Sun Jun 7 13:03:38 2015 UTC,"Let's stop pretending we watch her for anything besides her tits. She's not a real person, her personality is a pile of garbage. Who cares though?"
JessicaNigri,38w2ku,Bazampi,-22,Sun Jun 7 15:50:15 2015 UTC,"Look,  there is nothing wrong with watching her for her boobs, I find her attractive yeah, but if I wanted to watch videos just for boobs I would have gone to other subreddits I enjoy more, I honestly enjoy seeing her interact with her bf and the stuff that she does on her videos it's the type of silly playful shit I used to do with my friends and it makes me laugh.   The boobs are just a bonus"
JessicaNigri,38w2ku,GodTierJungler,6,Sun Jun 7 16:08:03 2015 UTC,She's like Andy Dick when it comes to being funny
JessicaNigri,38w2ku,Yosonimbored,5,Sun Jun 7 21:32:10 2015 UTC,"Everyone else here made it really easy for me to unsubscribe haha. I think everyone cares too much about who her boyfriend is, considering they're just here for her boobs."
JessicaNigri,38w2ku,afoxis,17,Sun Jun 7 22:39:40 2015 UTC,"Exactly, he's perfect for her"
JessicaNigri,38w2ku,Edmonty,26,Sun Jun 7 14:41:34 2015 UTC,She is completely annoying too. Mute button ftw
JessicaNigri,38w2ku,IAmAnAlternate,14,Sun Jun 7 15:16:37 2015 UTC,Lol people complaining about him when he is basically Jessica Male form hahaha   Yeah but I have a feeling most people don't subscribe to this subreddit because of Jessica's personality.
JessicaNigri,38w2ku,PTbest,2,Sun Jun 7 16:07:56 2015 UTC,"Male   Except when men act like women, it generally means they are gay. He's not masculine in the slightest."
JessicaNigri,38w2ku,Xander756,-2,Sun Jun 7 18:03:22 2015 UTC,"I'm  pretty sure he is the one dating Jessica, so if he is happy with how he acts and she enjoys it I really don't care."
JessicaNigri,38w2ku,GodTierJungler,-6,Sun Jun 7 18:21:15 2015 UTC,Yes gay people have girlfriends as beards all the time. Some have even been known to go so far as to get married and have kids. Not only is she a great beard but he can also use her for attention. Look how many vids he's been in. Compare that with how many vids her previous bf was in - zero.
JessicaNigri,38w2ku,Xander756,1 point,Sun Jun 7 22:19:37 2015 UTC,"Humm ok I see what you mean, still don't think he is gay but I get your point of view"
JessicaNigri,38w2ku,GodTierJungler,0,Sun Jun 7 22:24:03 2015 UTC,"It very much isn't jealousy, I'm in a very happy relationship. The fact is that I hate him the most for ""acting"" like her so much its disgusting."
JessicaNigri,38w2ku,pyrozerker,23,Sun Jun 7 19:31:20 2015 UTC,Cropped version
JessicaNigri,38w2ku,valitzky,39,Sun Jun 7 17:32:03 2015 UTC,laughed hard at the cut
JessicaNigri,38w2ku,grawlings,9,Sun Jun 7 11:05:11 2015 UTC,I'm so glad we can all be honest with each other regarding the fact that her rack is the only reason this sub stays intact.
JessicaNigri,38w2ku,kobyok,4,Mon Jun 8 03:04:57 2015 UTC,And that her boyfriend is trash
JessicaNigri,38w2ku,quintonmccain15,1 point,Mon Jun 8 05:07:19 2015 UTC,People tried to pretend it wasn't until this dude showed up and everyone got so mad they all admitted the truth.
JessicaNigri,38w2ku,amidoes,23,Thu Jun 25 21:48:05 2015 UTC,It's there to prove a point
JessicaNigri,38w2ku,Casio1988,7,Sun Jun 7 17:24:55 2015 UTC,I didn't want the video to lose any quality. Sorry if the black box is somehow a huge turn-off for you.
JessicaNigri,38w2ku,quintonmccain15,1 point,Sun Jun 7 22:24:08 2015 UTC,It's funnier that he went out of his way to black out the doucheiness in the photo
JessicaNigri,38w2ku,SevenDeviations,19,Sun Jun 7 23:29:47 2015 UTC,Gotta love fake tits
JessicaNigri,38w2ku,ssj7blade,9,Mon Jun 8 05:06:56 2015 UTC,Such very little movement :(
JessicaNigri,38w2ku,wazupdog1234,3,Sun Jun 7 16:07:45 2015 UTC,"It cant be just me, but I hate how she has her BF in all of her videos. If I wanted to watch him I would watch his YouTube videos."
JessicaNigri,38w2ku,Mardant,2,Sun Jun 7 17:41:09 2015 UTC,Same goes for her snaps. 90% of her snaps are of him..
JessicaNigri,38w2ku,lastrideelhs,2,Mon Jun 8 03:21:17 2015 UTC,Totally just tried watching a mail Monday with him in it and made it about 30 seconds and dude looks and sounds like a douche
JessicaNigri,393i2n,dousedngasoline,50,Tue Jun 9 00:11:25 2015 UTC,And so the sexually frustrated men (and you know probably women too) formed a posse and killed Jessica's boyfriend. She was totally cool with it and the police hardly got involved and everyone lived happily ever after.
JessicaNigri,393i2n,Jules2000,10,Tue Jun 9 01:59:01 2015 UTC,Who gives a shit. Come here for boobs
JessicaNigri,393i2n,everkiller,26,Tue Jun 9 15:25:10 2015 UTC,"Why do you care what she does?  You're busy here being butthurt that Jessica has a boyfriend who she likes to spend time with, while she's actually out there living her life.  I'm sure whatever she's doing is of her own choice and none of your business."
JessicaNigri,393i2n,Firebombastic,25,Tue Jun 9 00:20:33 2015 UTC,Shut the fuck up
JessicaNigri,393i2n,valitzky,7,Tue Jun 9 00:30:09 2015 UTC,I feel weird masturbating with him in the shots....
JessicaNigri,393i2n,ButtholeBerserker,10,Fri Jun 12 06:37:45 2015 UTC,You getting a lynch mob together?
JessicaNigri,393i2n,johnedeadly,6,Tue Jun 9 00:17:44 2015 UTC,We are here.
JessicaNigri,393i2n,KalebTheKraken,5,Tue Jun 9 02:11:22 2015 UTC,ok
JessicaNigri,393i2n,FisterMeister,4,Tue Jun 9 01:38:27 2015 UTC,They're a couple now. Can't do anything about it.  http://cdn.memestache.com/2013/4/3/a46c1942e42eb9e803cc2388606f323b.jpg
JessicaNigri,393i2n,Overruler101,1 point,Tue Jun 9 01:29:49 2015 UTC,now? I thought they were dating for a while?
JessicaNigri,393i2n,zeefomiv,2,Wed Jun 10 21:10:10 2015 UTC,That's nice
JessicaNigri,393i2n,salmalight,0,Tue Jun 9 00:20:36 2015 UTC,lol
JessicaNigri,393i2n,WindowsBro,1 point,Tue Jun 9 00:13:38 2015 UTC,"What. The fuck. Do you involve yourself with pornstars personal lives and values too?   Get over yourself, don't like it, leave. This is the bullshit fans of a lot of things don't get. People, bands, politicians, anyone has a right to change, just as much as you're allowed to stop liking them, but to act like you have control or even a say is laughably ridiculous."
JessicaNigri,393i2n,skylinedude,1 point,Fri Jul 10 09:19:20 2015 UTC,Oh no someone is butthurt cuz a person is doing something they dont like! Just let her do what she wants.
JessicaNigri,393i2n,olbleedyeyes,0,Tue Jun 9 02:53:32 2015 UTC,maybe she cut her hair for a cosplay she is doing
JessicaNigri,38u2g4,daxg2001,6,Sat Jun 6 20:47:39 2015 UTC,Jesus... It's like hey have a mind of their own...
JessicaNigri,38u2g4,Aperture_TestSubject,0,Sun Jun 7 06:04:13 2015 UTC,This just looks creepy
JessicaNigri,38tjlr,bananadude123,30,Sat Jun 6 18:15:49 2015 UTC,She just knows that's 90% of the reason to watch.
JessicaNigri,38tjlr,JonnyArtois,32,Sat Jun 6 19:40:18 2015 UTC,"Yeah she doesnt pretend anymore, cuts the bullshit and go straight to the point, i kinda respect that in someway."
JessicaNigri,38tjlr,TryHardFapHarder,23,Sat Jun 6 19:51:09 2015 UTC,yep im serious when i say this.. i really respect her for this.. shes not like other girls who play innocent have their tits out but would never mention it.. ya know
JessicaNigri,38tjlr,REDDIT-IS-TRP,6,Sat Jun 6 20:55:48 2015 UTC,I agree with that completely.
JessicaNigri,38tjlr,JonnyArtois,0,Sat Jun 6 20:48:48 2015 UTC,Except she doesn't and denies they're fake.  I also follow Tara Babcock and if you want no bullshit check her out. Nigri just pretends her tits came out of nowhere in weeks and denies she had surgery. And now her boyfriend eggs her on to milk them on camera.
JessicaNigri,38tjlr,amidoes,0,Sun Jun 7 03:36:30 2015 UTC,When was the last time she said they weren't fake?
JessicaNigri,38tjlr,raezor30,4,Sun Jun 7 07:14:04 2015 UTC,https://m.facebook.com/OfficialJessicaNigri/posts/10151318849477533
JessicaNigri,38tjlr,amidoes,-4,Sun Jun 7 13:19:59 2015 UTC,"because its not surgery,they have another methods like hydrogel. AND hyper push-up like this video"
JessicaNigri,38tjlr,McGee4,11,Sun Jun 7 10:04:01 2015 UTC,She's fully aware that generating 1-2 gifs for each mail monday will give her so much more popularity!
JessicaNigri,38tjlr,Margull,6,Sat Jun 6 20:00:05 2015 UTC,"Tbh, I prefer gain respect from people by doing something ""honest"" rather than using this kind of vicious bait.   Vicious bait? Who's getting hurt here? Bait for what?  You'd rather gain respect for doing something ""honest""? Go ahead.  You'd like to judge everyone that doesn't fit your ideal of what's ""honest""? No thanks."
JessicaNigri,38tjlr,MetalAsFork,6,Sat Jun 6 21:12:48 2015 UTC,"Are you one of those ""White Knights"" I've been hearing about?"
JessicaNigri,38tjlr,sjmck,3,Sun Jun 7 00:29:22 2015 UTC,"Yes. On a glorious white, fedora adorned horse."
JessicaNigri,38tjlr,bangbrah,4,Sat Jun 6 21:50:14 2015 UTC,Fedoradorned?
JessicaNigri,38tjlr,Galiphile,8,Sat Jun 6 23:24:05 2015 UTC,"What's to debate? It just seems like you're one of those folks who respects women as long as they aren't utilizing their own sexuality in a manner they find advantageous to themselves. I haven't heard any good reason to disrespect that.  You think there are ""deeply negative consequences"" to the way Jessica ""plays with her fans."" I don't even know what you mean! How is she playing with her fans? What are these negative consequences? Apparently too deep for us to even imagine, by your telling. Seriously, I don't mind debating facts, but you haven't presented any.  And I would never say ""lol"". How dare you?"
JessicaNigri,38tjlr,sjmck,0,Sat Jun 6 23:46:47 2015 UTC,"So you want a debate, but you're not willing to take either side which is literally the first requirement of a debate. You know you could have that debate at home with a mirror  right?"
JessicaNigri,38tjlr,blackouteyes,3,Sat Jun 6 22:05:40 2015 UTC,I think most people watch it muted.
JessicaNigri,38tjlr,Alekpowah,5,Sat Jun 6 23:27:05 2015 UTC,Even muted Ryan still annoys the fuck out of me.
JessicaNigri,38tjlr,DylanWhite86,5,Sun Jun 7 11:56:39 2015 UTC,They are both pretty fucking annoying.
JessicaNigri,38tjlr,JesusCripe,1 point,Sat Jun 6 21:13:51 2015 UTC,She doesn't even try to hide it now.
JessicaNigri,38tjlr,amidoes,7,Sun Jun 7 02:34:43 2015 UTC,Doing Gods work right here.
JessicaNigri,38tjlr,manga2panda,-34,Sun Jun 7 12:03:54 2015 UTC,"By ""God"" I hope you mean Nicolas Cage."
JessicaNigri,38tjlr,blasphemyisgood,26,Sun Jun 7 03:35:19 2015 UTC,Well memed friend! /s
JessicaNigri,38tjlr,kleymex,2,Sat Jun 6 18:29:32 2015 UTC,Every time I start to feel bored of her schtick she does something like this to reel me back in.
JessicaNigri,38tjlr,PTbest,0,Sat Jun 6 21:11:24 2015 UTC,So 3 years ago. Just because she hasnt come out and said they're fake doesn't mean she still denies it. So you can't really keep holding that against her.
JessicaNigri,38tjlr,raezor30,-2,Sat Jun 6 22:31:29 2015 UTC,Seriously   Gyazo
JessicaNigri,38u39w,pyroness,1 point,Sat Jun 6 20:54:31 2015 UTC,Holy shit how do those things not just pop out of her shirt?
JessicaNigri,38u39w,Overruler101,1 point,Sat Jun 6 22:22:52 2015 UTC,Extreme engineering. Also I assume they do but she just has to reshoot.
JessicaNigri,38tiv9,Thisty,33,Sat Jun 6 18:10:20 2015 UTC,"I think i can't watch these videos anymore! Not because of Jess, but because of that guy next to her!   Don't get me wrong i hope he makes her happy and i am not jealous i don't have any illusions that that should be me sitting next to her. But he just ruins it for me. All we get from him is lame sound effects and dumb faces.  These video's used to be pretty cool, not just for the jiggling but the things were sent to Jessica and she enjoyed them and liked them or maybe not but it was her reaction and not from some dude that she is dating. Now he is litteraly ripping the things out of her hands to get some attention even though playfull still very weird because its send to Jessica and not to him.  No, im done with these video's im unsubscribing and i hope that Jess will soon be doing HER stuff by HERSELF soon again. If this guy wants attention then he should start his own mail monday but i guess he would have alot less people watching!"
JessicaNigri,38tiv9,Roderickje,14,Sat Jun 6 22:46:14 2015 UTC,"Agreed. I think I posted something like this in the last video. It used to be her reading letters from fans who took the time to write to her, now she pretty much just glosses over the letters so Ryan can stick the paper to his face and make noises. I remember so many people writing heart felt letters to her and if I saw my letter just ignored for that moron I'd be sad and annoyed. Like you said, he can get his own mail monday video."
JessicaNigri,38tiv9,DylanWhite86,2,Sun Jun 7 02:14:26 2015 UTC,"It's kind of like she isn't taking time with individual gifts anymore, and just treats some things with little respect with him around ):"
JessicaNigri,38tiv9,Envisional,4,Sun Jun 7 18:24:59 2015 UTC,"Is it even confirmed that they're dating? Because honestly, I think that guys gay. Like an actual homosexual, I'm not even trying to insult him. He looks and acts very feminine to me."
JessicaNigri,38tiv9,mason_3_d,4,Sun Jun 7 13:54:53 2015 UTC,Doesn't really matter to me if they are dating or not. The fact remains  he ruins her video's for me.
JessicaNigri,38tiv9,Roderickje,-2,Sun Jun 7 13:58:30 2015 UTC,Wait do people still think that acting feminine =gay?
JessicaNigri,38tiv9,GodTierJungler,-3,Sun Jun 7 18:31:24 2015 UTC,"I'm here for the fapping experience of this video, don't give a shit about the rest of the videos"
JessicaNigri,38tiv9,Ranir,5,Sun Jun 7 03:12:31 2015 UTC,"As weird as it sounds, this episode made me think of TopGear and how much I miss the show.    If you don't know what I mean, here's the video:  https://www.youtube.com/watch?v=_W28z03BpIQ"
JessicaNigri,38tiv9,burns1200,5,Sun Jun 7 03:06:22 2015 UTC,"Dear Jessica,  Your fans are sending you kind letters and stuff for YOU to have and enjoy, not for him to put in his pants or try to take from you."
JessicaNigri,38tiv9,SpaZtiK6,4,Sun Jun 7 21:25:52 2015 UTC,"https://www.youtube.com/watch?v=TapFG7zuWWE BOOB LOOP FROM MAIL MONDAY, :D"
JessicaNigri,38tiv9,lazymainly,2,Sat Jun 6 19:47:38 2015 UTC,so she think she can get 1 million subs with a 5 min video and you don't really know when the next one coming out and if its gonna be good
