JessicaNigri,3e2he6,Katie_Pornhub,6,Tue Jul 21 13:22:14 2015 UTC,looks like a blow up doll
JessicaNigri,3e2he6,Giony1,2,Tue Jul 21 15:59:40 2015 UTC,Where do you get your blow up dolls
JessicaNigri,3e2he6,nightwing2024,1 point,Tue Jul 21 19:07:49 2015 UTC,"the face i meant, lol"
JessicaNigri,3e2he6,Giony1,8,Tue Jul 21 20:13:37 2015 UTC,"but seriously, where do you get your blow up dolls?"
JessicaNigri,3e2he6,iusereddittofap,1 point,Tue Jul 21 21:55:10 2015 UTC,Yeah there is something weird about how she's made up and how the photo has been processed from raw. A selfie taken during the shoot is probably ten times better than this.
JessicaNigri,3e2he6,Herak,3,Tue Jul 21 21:05:44 2015 UTC,More... MORE!!! For the love of god MORE!!!
JessicaNigri,3e2he6,beverboy,3,Tue Jul 21 17:53:55 2015 UTC,"No, we want Power Girl"
JessicaNigri,3e2he6,nightwing2024,-1,Tue Jul 21 19:07:21 2015 UTC,/u/Katie_Pornhub posting jessica nigri pics. Can we maybe have a meeting of the minds making sure that we can get a supergirl without the top on? im sure pornhub has the finances and means to make this happen :D
JessicaNigri,3e2he6,Roderickje,24,Tue Jul 21 14:07:40 2015 UTC,nah.
JessicaNigri,3e2he6,Roderickje,6,Tue Jul 21 14:17:46 2015 UTC,Fair enough
JessicaNigri,3e2he6,somerandomer,0,Tue Jul 21 15:04:15 2015 UTC,Carol Danvers  Edit - Linda Danvers
JessicaNigri,3e2he6,Kejsare102,1 point,Tue Jul 21 21:05:34 2015 UTC,That is not Carol Danvers.
JessicaNigri,3e2he6,somerandomer,0,Tue Jul 21 21:23:57 2015 UTC,"Sorry, Linda Danvers"
JessicaNigri,3e1fnc,Project209,12,Tue Jul 21 05:37:40 2015 UTC,oh man tha titty tho  sprinkle sum cinnamon on 1
JessicaNigri,3e1fnc,KindOldMan,8,Tue Jul 21 05:39:12 2015 UTC,Agreed you kind old man you.
JessicaNigri,3e1fnc,Syncfx,6,Tue Jul 21 12:24:10 2015 UTC,How nice of her to squeeze her tit for us when taking the picture
JessicaNigri,3e1fnc,amidoes,3,Tue Jul 21 16:41:08 2015 UTC,Paging /u/bubblr
JessicaNigri,3e1fnc,LUSTY_BALLSACK,1 point,Tue Jul 21 17:41:44 2015 UTC,"i didn't bubble this shot, but i did bubble another. also, here is a search for her over at /r/bubbling"
JessicaNigri,3dryx1,fodafap,84,Sat Jul 18 21:55:48 2015 UTC,"That is not a nipple, that is barely the border of a areola."
JessicaNigri,3dryx1,coldweathersurvivor,28,Sun Jul 19 01:14:06 2015 UTC,I'LL TAKE IT
JessicaNigri,3dryx1,PM_ME_BIG_ANIME_TITS,16,Sun Jul 19 14:39:25 2015 UTC,i dont think this is even an areola its to far to eh side and i know areolas are not on he side of a boob
JessicaNigri,3dryx1,kirbyforlife69,0,Sun Jul 19 07:55:35 2015 UTC,oh yeas i know that but i dont think its her nipple
JessicaNigri,3dryx1,kirbyforlife69,4,Sun Jul 19 20:39:49 2015 UTC,i kinda doubt it's even that unless her nipples have shifted deeply towards her armpits. /u/sandith752 posted a picture with her nips showing they are in a pretty normal position.
JessicaNigri,3dryx1,Sp00p,5,Mon Jul 20 08:44:08 2015 UTC,what pic are you talking about
JessicaNigri,3dryx1,kirbyforlife69,24,Sun Jul 19 06:56:53 2015 UTC,https://i.imgur.com/9apEPW6.jpg
JessicaNigri,3dryx1,Reaper111888,1 point,Sun Jul 19 07:54:44 2015 UTC,oh ok now i know
JessicaNigri,3dryx1,kirbyforlife69,63,Sun Jul 19 08:25:02 2015 UTC,Lets be real here. Nigri doesn't have nipples.
JessicaNigri,3dryx1,dousedngasoline,71,Mon Jul 20 08:45:05 2015 UTC,Dunno about that
JessicaNigri,3dryx1,sandith752,55,Sat Jul 18 22:00:24 2015 UTC,Thats obviously a prop nipple to keep the illusion alive
JessicaNigri,3dryx1,DigitalSterling,38,Sat Jul 18 22:54:34 2015 UTC,Here's two gifs of the video.  1.  http://gfycat.com/SpanishFriendlyIvorygull  2.  http://gfycat.com/ChubbyBlueCaudata
JessicaNigri,3dryx1,anon8755,1 point,Sun Jul 19 01:33:04 2015 UTC,Where are these from?
JessicaNigri,3dryx1,Justinsipod3,15,Sun Jul 19 04:56:27 2015 UTC,"Nah, she's cramming so much boob into that top that it casts shadow. But hey, boob shadow is cool too!"
JessicaNigri,3dryx1,bullshitXdetector,7,Mon Jul 20 22:02:06 2015 UTC,Holy titties!
JessicaNigri,3dryx1,Twoheaven,-28,Sun Jul 19 02:51:56 2015 UTC,And they say they aren't fake...right. She went from a B cup to that....
JessicaNigri,3dryx1,Sour_J,34,Sun Jul 19 04:26:33 2015 UTC,"I might get downvoted for this, but fuck it.  How, exactly, does it impact your life whether or not her tits are real or fake? Why does this conversation need to come up EVERY FUCKING TIME there is a post about her?"
JessicaNigri,3dryx1,mrespman,9,Sun Jul 19 09:13:15 2015 UTC,Because it's the internet and people always argue about something.
JessicaNigri,3dryx1,Totally_Not_A_Bear,7,Sun Jul 19 09:58:08 2015 UTC,I'm not sure I can take a bears comment seriously...
JessicaNigri,3dryx1,aCarrotsSoul,6,Sun Jul 19 10:41:15 2015 UTC,"Good thing I'm not a bear, right? right?"
JessicaNigri,3dryx1,Totally_Not_A_Bear,1 point,Sun Jul 19 10:50:15 2015 UTC,"I dunno. You say you're not, but you begin by saying totally. It's hard to say really."
JessicaNigri,3dryx1,aCarrotsSoul,1 point,Sun Jul 19 10:59:45 2015 UTC,"Well of course, just saying I'm not a bear is how a bear would get caught. Not that I am one."
JessicaNigri,3dryx1,Totally_Not_A_Bear,1 point,Sun Jul 19 11:11:45 2015 UTC,"Well, I guess there's no real way to tell if you are a bear or not. Unless someone OH LOOK AN UNATTENDED PICNIC BASKET!"
JessicaNigri,3dryx1,aCarrotsSoul,1 point,Sun Jul 19 11:21:09 2015 UTC,Pfft. Everyone knows the real bears are into honey pots.   Take that as you will
JessicaNigri,3dryx1,Totally_Not_A_Bear,5,Sun Jul 19 11:27:10 2015 UTC,Because she denies it and the white Knights give their lives to the cause of defending fake tits. I don't bother because it's blatant but some people feel the need to bring it up all the time
JessicaNigri,3dryx1,amidoes,1 point,Sun Jul 19 11:39:46 2015 UTC,No clue. Tits tits are tits. I love all of them.
JessicaNigri,3dryx1,boxisbest,-7,Sun Jul 19 21:05:43 2015 UTC,She keeps saying they're real and these nerds keep defending her! They won't admit they're wrong.
JessicaNigri,3dryx1,Sour_J,5,Tue Jul 21 15:13:43 2015 UTC,"And you won't stop bitching about it. Your one man crusade of ""I told you guys so"" Is really annoying ."
JessicaNigri,3dryx1,johnedeadly,3,Sun Jul 19 15:39:42 2015 UTC,"You find me the last post she said her tits are real. It was 2 years ago. That doesnt count as ""keeps saying"" and what was it 1 facebook post and her twitter bio for a while. Im not saying they aren't fake cause they obviously are. But you can't hold something someone said years ago against them."
JessicaNigri,3dryx1,raezor30,-2,Sun Jul 19 16:22:13 2015 UTC,Oh yes you can if she never admitted it. Of course she's gonna ignore the subject now
JessicaNigri,3dryx1,Sour_J,1 point,Sun Jul 19 17:58:35 2015 UTC,You can but it makes you pretty shitty. Why would she bring it up now? To please people like you that hold a grudge for 2 years?
JessicaNigri,3dryx1,raezor30,3,Sun Jul 19 20:07:33 2015 UTC,"I don't give a flying donkey butt if they're real or not, tits are tits man."
JessicaNigri,3dryx1,Twoheaven,3,Sun Jul 19 20:26:22 2015 UTC,No one thinks those are real. Everyone still likes them!
JessicaNigri,3dryx1,Sacar25,2,Sun Jul 19 19:02:29 2015 UTC,Who.  The Fuck.  Cares.
JessicaNigri,3dryx1,GingerSnapBiscuit,7,Sun Jul 19 13:58:45 2015 UTC,Dude she's gotta chill with those boobs. Any more pressure and they'll literally explode.
JessicaNigri,3dryx1,ElDuderino2112,12,Sun Jul 19 11:18:59 2015 UTC,It's like they're just holding on for dear life to avoid slipping out
JessicaNigri,3dryx1,WalkableBuffalo,12,Sun Jul 19 17:07:42 2015 UTC,They should let go.
JessicaNigri,3dryx1,NoButthole,5,Sat Jul 18 23:44:36 2015 UTC,i wanna see 1 titty pop out wit some honey on it
JessicaNigri,3dryx1,KindOldMan,11,Sun Jul 19 06:47:36 2015 UTC,"Woah, where the fuck did that forehead come from."
JessicaNigri,3dryx1,EmptyRed,9,Sun Jul 19 11:35:51 2015 UTC,They did a great job with her nose
JessicaNigri,3dryx1,scrappycoco2494,6,Sun Jul 19 01:53:07 2015 UTC,Am I part of the Fantastic Four? Because I'm rock hard right now.
JessicaNigri,3dryx1,ukjohndoe,2,Sun Jul 19 15:59:03 2015 UTC,SMH I nut to her and all but yall dont think they look dumb here?
JessicaNigri,3dryx1,theforceds,-1,Sun Jul 19 18:04:57 2015 UTC,"Life in plastic, its fantastic!"
JessicaNigri,3dryx1,Sour_J,1 point,Sun Jul 19 16:49:29 2015 UTC,She is a goddess
JessicaNigri,3dryx1,MrGunnermanhaz,3,Sun Jul 19 12:57:48 2015 UTC,Tight-fitting Corset does much the same thing on those implants
JessicaNigri,3dryx1,Hezkezl,-4,Sun Jul 19 17:42:18 2015 UTC,"Whoopy-fucking-doo, a nipple slip of Jessica Nigri. What's the big deal? inb4 haterz!"
JessicaNigri,3dsm3z,Womper1,7,Sun Jul 19 01:42:03 2015 UTC,Look at that side boob!
JessicaNigri,3dsm3z,Overruler101,-5,Sun Jul 19 02:02:11 2015 UTC,Looks a bit like it's a bra.
JessicaNigri,3drpon,Djlynch2009,1 point,Sat Jul 18 20:32:35 2015 UTC,I never thought I would want to do nasty things to Mario
JessicaNigri,3dryq8,rockusurper,3,Sat Jul 18 21:53:57 2015 UTC,Love the eyes
JessicaNigri,3dnnaj,WhiteElephant12,46,Fri Jul 17 19:12:13 2015 UTC,"Let it be known, he's here to help."
JessicaNigri,3dnnaj,My_Socks_Are_Blue,31,Fri Jul 17 20:49:34 2015 UTC,"i was undecided, but now i think he's actually pretty cool not that it really matters and god DAMN Kassem G is a borderline asshole with some of those questions lmao"
JessicaNigri,3dnnaj,grawlings,4,Sat Jul 18 04:45:35 2015 UTC,"Ya, those were some hardball Diane Sawyer level questions!  Also, any guy that uses a DKP/Epic loots reference appropriately gets half my vote. I'm still holding onto the other half for a nude pic or something. I dont want to give out my vote for just ANYTHING."
JessicaNigri,3dnnaj,azaizai,5,Sat Jul 18 11:54:24 2015 UTC,"So, you'll like him better if he gives a nude pic of himself out?"
JessicaNigri,3dnnaj,kareesmoon,4,Sat Jul 18 13:31:28 2015 UTC,I'd be willing to see him nude if I also got to see like...78% of her nude in the picture.  I'm not a picky guy.
JessicaNigri,3dnnaj,azaizai,9,Sat Jul 18 20:38:36 2015 UTC,"""We are both attention whores"". We know you are xD"
JessicaNigri,3dnnaj,GamingTheo,45,Sat Jul 18 10:26:32 2015 UTC,she has got a new pair of implants
JessicaNigri,3dnnaj,nomorenapkins,12,Fri Jul 17 19:33:25 2015 UTC,"If you wanna look like anime girls, you got to look the part."
JessicaNigri,3dnnaj,Asphaltcrow,18,Sat Jul 18 01:42:21 2015 UTC,"For real....she just keeps getting them bigger....more silicon than breast now by far,,,,"
JessicaNigri,3dnnaj,Hope499,55,Fri Jul 17 21:22:08 2015 UTC,I bet they can run crysis 1080p 60fps on ultra settings doe
JessicaNigri,3dnnaj,Goldenbrownfish,29,Fri Jul 17 23:04:25 2015 UTC,"Wonderbra, multiple wonderbras, padding...  Don't get me wrong; they're totally fake. But they're not any bigger than they were a week ago."
JessicaNigri,3dnnaj,Classtoise,2,Fri Jul 17 22:51:59 2015 UTC,Silicon Valley is real
JessicaNigri,3dnnaj,Colorfag,6,Sat Jul 18 02:38:17 2015 UTC,Prepare yourself for downvotes.
JessicaNigri,3dnnaj,Overruler101,0,Fri Jul 17 20:43:36 2015 UTC,I really wonder if she did.... Her boyfriend in the interview said he was pushing for more tits...
JessicaNigri,3dnnaj,SoGeeky,14,Fri Jul 17 22:15:17 2015 UTC,"As in showing more, not getting more."
JessicaNigri,3dnnaj,dovah_kun,10,Sat Jul 18 00:06:53 2015 UTC,The moment he said DKP I was in love
JessicaNigri,3dnnaj,Goldenbrownfish,3,Fri Jul 17 21:39:30 2015 UTC,That caught my attention as well.
JessicaNigri,3dnnaj,deviousgiant,5,Sat Jul 18 03:48:39 2015 UTC,"Okay, the look on her face when he referred to her as an ""epic drop"" was ADORABLE."
JessicaNigri,3dnnaj,atlasimpure,18,Sat Jul 18 10:54:23 2015 UTC,Im not saying that i hate her boyfriend or anything but it does seem like its becoming more and more about him then Jessica
JessicaNigri,3dnnaj,Frostymcstu,47,Fri Jul 17 22:38:07 2015 UTC,Jessica is basically a pair of tits who cares if he wants to add personality.
JessicaNigri,3dnnaj,NathanKiernan,15,Fri Jul 17 22:59:33 2015 UTC,truth bomb. damn.
JessicaNigri,3dnnaj,husky_humpernickle,5,Sat Jul 18 02:00:39 2015 UTC,"Eh, I'd rather see her brother in her videos for more personality. I don't hate her boyfriend, but I do find him annoying. I can't put my finger on why. I think it seems like he tries too hard? It's entirely possible that that's the way he really is, but I feel like he's insincere. It irks me.  This is coming from a straight girl Jessica fan, so I'm not jealous. I'm just less likely to watch her videos if her boyfriend is in them. And I wanna watch her videos. Oh well."
JessicaNigri,3dnnaj,CheekySprite,4,Sat Jul 18 14:31:43 2015 UTC,"I don't hate her boyfriend, but I do find him annoying. I can't put my finger on why. I think it seems like he tries too hard? It's entirely possible that that's the way he really is, but I feel like he's insincere. It irks me.   Replace ""boyfriend"" with ""Jessica"" and you have Jessica's on video personality in a freaking nutshell."
JessicaNigri,3dnnaj,StxrStruck,8,Sat Jul 18 15:11:01 2015 UTC,"That's true. Someone on here described it as the ""cutesy retard act"".  I can put up with her hyperactivity, because she actually amuses me. He does not. Two cutesy retards in one video is too much."
JessicaNigri,3dnnaj,CheekySprite,2,Sat Jul 18 15:54:45 2015 UTC,Wow. That's a fucked up way to think.
JessicaNigri,3dnnaj,nightwing2024,3,Sat Jul 18 14:18:03 2015 UTC,Am I the only one who was happy that he makes her happy?
JessicaNigri,3dnnaj,hundous,1 point,Sat Jul 18 17:57:18 2015 UTC,TIL i have the same birthday as Ryan. Neat.
JessicaNigri,3dnnaj,Jbravo182,-1,Mon Jul 20 05:39:15 2015 UTC,It's not that I hate him; it's that his name is too stupid for me to look past. Fake. Nerd. Boy. What the fuck?
JessicaNigri,3dnnaj,MiltonDGAF,-7,Sun Jul 19 07:11:49 2015 UTC,Her boyfriend is almost like some kind of leech lately.  Jesus Christ.
JessicaNigri,3dnnaj,Cubejam,-10,Sat Jul 18 07:32:26 2015 UTC,I'm actually in this video walking away because of how ridiculously boring it was. She looked pretty trashy with her fake boobs supported that much.    The April O Neil video was much better.  So was the Tanya Tate.  Both of them have SO.
JessicaNigri,3dot59,Odintime,7,Sat Jul 18 00:55:03 2015 UTC,why? you can just search her name and find what ever you want of her
JessicaNigri,3dot59,Goldenbrownfish,0,Sat Jul 18 03:49:56 2015 UTC,"Oh hey, I did one a while back as well, but got lazy with updating it. /r/JessicaNigriMWP. Not sure if you had the same intentions as me."
JessicaNigri,3dforw,SchweatyBallsack,13,Wed Jul 15 22:19:48 2015 UTC,Her boyfriend's Snapchat. Here's the original
JessicaNigri,3dforw,Baalzabub,2,Wed Jul 15 22:49:31 2015 UTC,Whats his snapchat?
JessicaNigri,3dforw,triple6seven,2,Wed Jul 15 22:58:49 2015 UTC,fakenerdboy
JessicaNigri,3dforw,Yosonimbored,2,Thu Jul 16 01:08:10 2015 UTC,is that a pokemon sleeve? i see koffing and gyarados
JessicaNigri,3dforw,DBenjaz,1 point,Thu Jul 16 08:00:13 2015 UTC,Yup. Might be dumb but I like it.
JessicaNigri,3dforw,triple6seven,0,Thu Jul 16 01:22:39 2015 UTC,"Not a sleeve, those are actual tattoos, he has one in his hand with a Pikachu as well, totally crazy"
JessicaNigri,3dforw,DBenjaz,2,Thu Jul 16 13:16:10 2015 UTC,"when the tattoo wraps the arm like that, its called a sleeve.."
JessicaNigri,3dforw,carl2k1,1 point,Fri Jul 17 05:28:58 2015 UTC,and I just made myself look stupid... I'll see myself out... (thanks for the detail :) )
JessicaNigri,3dforw,Sacar25,1 point,Fri Jul 17 12:19:28 2015 UTC,Bewbies are glorious
JessicaNigri,3dforw,LeejSm1th,3,Fri Jul 17 13:33:14 2015 UTC,Yes! She's got the who Nicholas cage face going on though. Someone fix it.
JessicaNigri,3dforw,Sacar25,12,Thu Jul 16 02:41:35 2015 UTC,http://i.imgur.com/nGCGQ67.jpg
JessicaNigri,3dforw,atlasimpure,2,Thu Jul 16 10:46:24 2015 UTC,LMFAO yes that's exactly it lol!!!!!!!! Have an up vote!!!
JessicaNigri,3dforw,conjureSC,2,Thu Jul 16 20:27:14 2015 UTC,Do you have a problem with our Lord and Savior?
JessicaNigri,3dcz5c,Goldenbrownfish,77,Wed Jul 15 08:21:52 2015 UTC,"that squish was actually kind of surprising. edit: pleasantly, ofc"
JessicaNigri,3dcz5c,grawlings,1 point,Wed Jul 15 11:24:06 2015 UTC,( Í¡Â° ÍœÊ– Í¡Â°)
JessicaNigri,3dcz5c,Tictac472,18,Wed Jul 15 22:05:09 2015 UTC,Holy cow is she a wizard!? them boobies disappeared in a flash like Minato
JessicaNigri,3dcz5c,Bilbo_McKitteh,2,Wed Jul 15 16:30:08 2015 UTC,No she's clearly some angel thing look at the wings :^)
JessicaNigri,3dcz5c,Tictac472,5,Wed Jul 15 22:05:39 2015 UTC,source of the video?
JessicaNigri,3dcz5c,GamingTheo,17,Wed Jul 15 10:32:25 2015 UTC,There you go
JessicaNigri,3dcz5c,TFDutchman,10,Wed Jul 15 11:01:34 2015 UTC,"dat glorious sideboob though,btw thanks for the source"
JessicaNigri,3dcz5c,GamingTheo,4,Wed Jul 15 11:09:22 2015 UTC,"""I'm not wearing a bra right now..."" Thank you, Jessica."
JessicaNigri,3dcz5c,haroldsavatar,1 point,Wed Jul 15 19:17:30 2015 UTC,"Is my mind playing tricks on me, or can you guys see her nipple through the sportsbra aswell?"
JessicaNigri,3dcz5c,jonasblm,6,Fri Jul 17 20:18:37 2015 UTC,"That sideboob though, damn."
JessicaNigri,3dcz5c,Asphaltcrow,10,Wed Jul 15 12:03:14 2015 UTC,Seems like something you would do before a recording but  Â¯\_(ãƒ„)_/Â¯
JessicaNigri,3dcz5c,Tictac472,11,Wed Jul 15 09:10:40 2015 UTC,To be fair the gif is taken out of context
JessicaNigri,3dcz5c,Overruler101,5,Wed Jul 15 09:14:33 2015 UTC,Squeak-squeak
JessicaNigri,3dcz5c,ancient_horse,3,Wed Jul 15 13:47:02 2015 UTC,Goku's face was priceless
JessicaNigri,3dcz5c,alligators_suck,5,Wed Jul 15 10:30:43 2015 UTC,I'm more impressed by the pretty awesome Jibril cosplay
JessicaNigri,3dcz5c,Riddy86,2,Wed Jul 15 20:28:48 2015 UTC,Im not surprised at all how fine I am with there being no audio to this.
JessicaNigri,3dcz5c,PM_ME_BIG_ANIME_TITS,1 point,Wed Jul 15 13:25:44 2015 UTC,That sideboob is fucking glorious!
JessicaNigri,3dcz5c,marcelothefellow,1 point,Thu Jul 16 10:47:53 2015 UTC,why is it so hard for people to crop the gifs they make?
JessicaNigri,3dcz5c,marcelothefellow,2,Thu Jul 16 01:13:46 2015 UTC,can you do that on imgur? How? it would be awesome to know I don't have any of the fancy programs.
JessicaNigri,3dcz5c,marcelothefellow,0,Thu Jul 16 01:42:26 2015 UTC,how are you making the gif?
JessicaNigri,3dcz5c,Frostymcstu,1 point,Thu Jul 16 01:55:08 2015 UTC,Imgur's video to gif feature
JessicaNigri,3dcz5c,rosietherose,-1,Thu Jul 16 02:28:44 2015 UTC,well then i understand..
JessicaNigri,3dcz5c,Badbutthole,-20,Thu Jul 16 02:49:02 2015 UTC,"They seem to be a bit soft and squidgy for fake tits, don't you think?"
JessicaNigri,3dcz5c,ancient_horse,28,Wed Jul 15 09:28:02 2015 UTC,"It's modern times, with enough money and good surgeon, they can be as squishy as any normal boobs."
JessicaNigri,3dcz5c,YodaGuy5,18,Wed Jul 15 10:40:07 2015 UTC,fake tits are often soft and can be squeezed. Its not the 90s anymore guys. lol  When you get implants you can have them put them under your muscle which will make them appear more real. Most girls do this.  Actually this video proves to me she doesn't stuff her bra like everyone says. Those are her boobs. Her glorious beautiful fake boobies.
JessicaNigri,3dcz5c,TheFabulousRBK,-37,Wed Jul 15 16:50:01 2015 UTC,Yeah way too soft too be fake imo
JessicaNigri,3dcz5c,CaptainMojo,41,Wed Jul 15 09:42:43 2015 UTC,"You can still squeeze fake tits, guys.  They're not rock hard."
JessicaNigri,3dcz5c,TurboBatman,6,Wed Jul 15 10:29:36 2015 UTC,They're not like a bag of sand?
JessicaNigri,3dcz5c,WinstonBucksworth,13,Wed Jul 15 18:30:55 2015 UTC,"Check your logic at the door, please."
JessicaNigri,3dcz5c,rosietherose,8,Wed Jul 15 11:18:04 2015 UTC,Lol this isn't the 90's man
JessicaNigri,3dcz5c,Equinoqs,-19,Wed Jul 15 15:18:34 2015 UTC,They're fake.. Heres proof.  http://imgur.com/mSAiYF1
JessicaNigri,3dcz5c,TurboBatman,4,Wed Jul 15 19:00:16 2015 UTC,Huh I didn't think she was making money on her cosplay back then
JessicaNigri,3dcz5c,FisterMeister,3,Wed Jul 15 19:04:59 2015 UTC,Not as much as she is now.
JessicaNigri,3dcz5c,CMDR_Muffy,3,Wed Jul 15 20:21:52 2015 UTC,she has sold prints since the very beginning.
JessicaNigri,3ddq2y,Djlynch2009,2,Wed Jul 15 13:49:41 2015 UTC,one of her best
JessicaNigri,3ddq2y,rosietherose,4,Wed Jul 15 20:22:03 2015 UTC,Had to. http://oyster.ignimgs.com/wordpress/stg.ign.com/2015/06/3555643-batman+adventures+-+mad+love-13.jpg
JessicaNigri,3ddq2y,Overruler101,-5,Wed Jul 15 13:55:29 2015 UTC,Deepened.
JessicaNigri,3ddq2y,Deep_Dream,3,Wed Jul 15 22:06:16 2015 UTC,Why?
JessicaNigri,3dbqwj,TheMacLord,8,Wed Jul 15 01:08:09 2015 UTC,Will its nice to see shes using the stuff people sent her ;)
JessicaNigri,3dbqwj,Rockstar1996,1 point,Wed Jul 15 05:49:47 2015 UTC,yes she gets alot of stuff and she does use them and your right its nice
JessicaNigri,3dbqwj,kirbyforlife69,3,Thu Jul 16 08:00:32 2015 UTC,That guy's face ruins my jerking off.
JessicaNigri,3dbqwj,carl2k1,15,Thu Jul 16 02:43:18 2015 UTC,I wonder how many people here will bitch about her boyfriend this time.
JessicaNigri,3dbqwj,nightwing2024,10,Wed Jul 15 02:19:26 2015 UTC,I'm just upset at the cropping
JessicaNigri,3dbqwj,Tictac472,7,Wed Jul 15 04:41:43 2015 UTC,"This guy probably has this game he plays when he's bored. It's called ""Let's take selfies with my gf and watch how  fat, jealous reddit nerds explode over it, while I just sit here munching on this sweet, buttery popcorn"".  (The name still needs some work though)"
JessicaNigri,3dbqwj,Cauchemar89,5,Wed Jul 15 07:11:53 2015 UTC,"Because people who just come here to fap and don't want to see a man in the pictures are fat and jealous? Dude is fucking Jessica, good for him. I'm sure he's having a great time. Doesn't mean I wanna nut to a pic with him in."
JessicaNigri,3dbqwj,theforceds,0,Wed Jul 15 21:07:36 2015 UTC,Open the picture in paint and then scribble him out. Enjoy the nut.
JessicaNigri,3dbqwj,FisterMeister,1 point,Wed Jul 15 21:16:50 2015 UTC,lmfao no shit u are right lol but we do have to admit he is LUCKY to have a chick like that nice body big (fake) tits  im just hoping that someday a nude pic will leak out like we dont knwo she takes nude pics and sends them to her bf
JessicaNigri,3dbqwj,kirbyforlife69,1 point,Thu Jul 16 08:02:42 2015 UTC,I remember the days when she had a small booty. AND LOOK AT HER NOW!
JessicaNigri,3dbqwj,Overruler101,6,Wed Jul 15 03:43:12 2015 UTC,? It's still small. Her hips are up. That girl needs to squat.
JessicaNigri,3dbqwj,chubbsmagoo,1 point,Wed Jul 15 14:00:09 2015 UTC,Welcome back cleavage.
JessicaNigri,3dbqwj,Yosonimbored,-6,Wed Jul 15 13:45:46 2015 UTC,Cropped image - http://imgur.com/lXGCjKK
JessicaNigri,3dbqwj,ImperfectSanity,5,Wed Jul 15 07:38:13 2015 UTC,Why wouldn't you post this instead?
JessicaNigri,3dbqwj,ImperfectSanity,-2,Wed Jul 15 08:17:35 2015 UTC,Unsure on how to edit a post on mobile :/
JessicaNigri,3dbqwj,Lilbitevil,3,Wed Jul 15 10:43:10 2015 UTC,"To be honest, I don't think you can change link once it's been posted."
JessicaNigri,3dbqwj,Thrill_Of_It,-14,Wed Jul 15 17:11:10 2015 UTC,"Look out, creepers explode."
JessicaNigri,3dbqwj,Giony1,16,Wed Jul 15 02:27:51 2015 UTC,"bruh don't even pretend to be above everybody else right now. You know your in it, on some level, for those tittes."
JessicaNigri,3d3w58,hazzarad,11,Mon Jul 13 08:58:51 2015 UTC,Wait she's not... She's not showing her tits! How dare she im offended!
JessicaNigri,3d3w58,TryHardFapHarder,2,Mon Jul 13 10:59:51 2015 UTC,This is the first step to her never showing her tits again.
JessicaNigri,3d3w58,Nordok,1 point,Mon Jul 13 15:08:01 2015 UTC,So this is the first step to nobody following her ever again?
JessicaNigri,3d3w58,GimmeNews,4,Mon Jul 13 20:40:44 2015 UTC,originals from https://www.flickr.com/photos/alex_matthews/19448914748/sizes/k/ https://www.flickr.com/photos/vsmak/19619844662/sizes/o/
JessicaNigri,3d0x4t,Goldenbrownfish,25,Sun Jul 12 16:27:19 2015 UTC,a reminder of how talented of a fabricator she is.
JessicaNigri,3d0x4t,Scadden,0,Sun Jul 12 17:31:21 2015 UTC,"Did she make this? I thought this was her sponsored one for EA or whatever. (I'm just curious, not doubting her)"
JessicaNigri,3d0x4t,Tictac472,14,Sun Jul 12 18:37:06 2015 UTC,Sponsoring =/= made for her.  I'm pretty sure she's even posted WIP videos of this costume somewhere
JessicaNigri,3d0x4t,paltala,2,Sun Jul 12 19:19:19 2015 UTC,"Ah, I thought that was for the Venias (sp?) cosplay. Thanks!"
JessicaNigri,3d0x4t,Tictac472,0,Mon Jul 13 05:10:07 2015 UTC,They gave her money to make it. I can't even imagine the cost.
JessicaNigri,3d0x4t,AnonymousMaleZero,27,Mon Jul 13 12:16:07 2015 UTC,A cosplay with no cleavage.
JessicaNigri,3d0x4t,Yosonimbored,11,Sun Jul 12 16:57:20 2015 UTC,This is a really impressive cosplay especially considering the amount of time that was available to do it in.
JessicaNigri,3d0x4t,Svri,7,Sun Jul 12 18:50:33 2015 UTC,A lot of people forget that Jessica is an incredible cosplay creator and not just a titty monster... they think that she puts cleavage in her cosplays out of laziness but she's clearly capable of incredible cosplays.
JessicaNigri,3d0x4t,safetyseal,5,Sun Jul 12 19:55:10 2015 UTC,That is as cool as fuck
JessicaNigri,3d0x4t,TomDeLune,2,Sun Jul 12 21:40:02 2015 UTC,As much as i love those sweater puppies i really respect this costume because of the lack of said jugs.
JessicaNigri,3d0x4t,SloptimusXPrime,-2,Sun Jul 12 19:44:56 2015 UTC,0/10 no boobs /s But dang I forgot how good she is at cosplay
JessicaNigri,3cze0c,Flip878,158,Sun Jul 12 04:09:34 2015 UTC,"She's acting like it's her first time, that's cute."
JessicaNigri,3cze0c,Flux83,26,Sun Jul 12 05:37:19 2015 UTC,"Her mind is saying ""I'm going to regret this, aren't I?"""
