mercedes_benz,3cs5l1,B-Andretti,0,Tue Jul 14 19:24:28 2015 UTC,"It's not, do you mean that the design dates back to 1982? It's older than that, actually."
mercedes_benz,3cs3vu,Playstatiaholic,2,Fri Jul 10 09:19:14 2015 UTC,Hello fellow PNW'er!  Thanks for snapping a shot of a G-Class!
mercedes_benz,3cs3vu,traitorous_8,2,Fri Jul 10 16:10:14 2015 UTC,The G class Mercedes is flawless
mercedes_benz,3cs2u9,Playstatiaholic,1 point,Fri Jul 10 09:03:46 2015 UTC,I think that is possible on the net
mercedes_benz,3cs2u9,Kentaki0,1 point,Fri Jul 10 10:55:05 2015 UTC,"I don't know which model you have, but you can download firmware updates from the MB website and map updates on ""certain websites"" (or you buy it) and install them yourself."
mercedes_benz,3cs2u9,JimmysBruder,1 point,Fri Jul 10 15:21:03 2015 UTC,Map update?  If it's an older model a map update is as simple as buying a CD/DVD from the dealership and sticking it into your nav system.  I'm not sure on the newer models but they most likely have hard drives and need to go to the dealership.
mercedes_benz,3cr4jj,lolly_lolly_lolly,3,Fri Jul 10 02:40:54 2015 UTC,www.PeachParts.com  www.BenzWorld.org
mercedes_benz,3cr4jj,MinnowWouldBeLost,1 point,Fri Jul 10 03:45:33 2015 UTC,Thank you!  I'll check them out.
mercedes_benz,3cr4jj,BowlerNona,2,Fri Jul 10 14:31:38 2015 UTC,Where are you located? What color? Can you message or post a picture and provide some info?  Wouldn't mind adding her to my SL collection if everything lines up.  :)
mercedes_benz,3cmj1f,zshift,1 point,Thu Jul 9 01:48:13 2015 UTC,"Yeah we havent been able to get anything except '14 2 door coupes as employee lease vehicles and those are all but gone. While I wasnt super thrilled with my '13 coupe, i think if I wanted a 2 door I'd get a 2014 C250 C  as a CPO anyways. I'm much happier with the dash and console on the 2014 C class than the 2015.  As a comment, the doors on a coupe are longer, have to really be careful in parking lots."
mercedes_benz,3cmj1f,dave_r,-5,Sat Jul 11 22:22:48 2015 UTC,I'm still wondering why the CLA and CLS are listed as coupes. They have 4 fucking doors. So fucking stupid.
mercedes_benz,3cmj1f,Poop_is_Food,5,Thu Jul 9 06:50:10 2015 UTC,"They call them that because they don't have the standard sedan roofline, and fall more in line of the styling of a coupe with how rakish the rear roofline is, and lack of rear headroom."
mercedes_benz,3cmj1f,Mochashaft,-1,Thu Jul 9 13:36:07 2015 UTC,That's bulshit
mercedes_benz,3cmj1f,Poop_is_Food,7,Thu Jul 9 17:43:58 2015 UTC,"Easy killer, I was just telling you why. It's been that way since the CLS came out, and I dont think It's hurting anyone."
mercedes_benz,3cmj1f,Mochashaft,3,Thu Jul 9 18:31:13 2015 UTC,"Coupe doesn't mean 2 doors. Often times it does, but not always.     Today coupé has become more of a marketing term for automotive manufacturers, than a fact of the vehicle's design and technical makeup. The term has been ascribed to vehicles with two, three, or four doors, for their perceived luxury or sporting appeal. This is because coupés in general are seen as more streamlined and sportier overall lines than those of comparable four-door sedans. Hence a coupé would be marketed as a sportier vehicle than a two-door sedan. While previous coupés were ""simply line-extenders two-door variants of family sedans"", some coupés have different sheet metal and styling than their four-door counterparts.   Also, while not always the case, this gives a good description:     a coupe is defined as a fixed-top car with less than 33 cubic feet of rear interior volume. Typically a car with less than 33 cubic feet of rear interior volume has only two doors, hence the common practice of associating two doors with the term “coupe.” However, there are plenty of vehicles out there which have only two doors but more than 33 cubic feet in the rear. These cars, while their manufacturers may call them coupes, are technically two-door sedans."
mercedes_benz,3cmj1f,SamTheSammich,2,Thu Jul 9 18:22:29 2015 UTC,"I vaguely remember a few years back an advertisement for ""4 door coupe"" ...I guess they were trying to be nifty?"
mercedes_benz,3cmj1f,Mystery_Log,1 point,Thu Jul 9 11:16:53 2015 UTC,"Their chassis codes are c117 and c218/c219, respectively. C standing for coupe. Like a c class coupe was a c204 instead of a w. Mercedes truely classifies them as coupes."
mercedes_benz,3cmj1f,tiny2ner,1 point,Thu Jul 9 16:18:20 2015 UTC,Yeah and my question is why do they do that
mercedes_benz,3cmj1f,Poop_is_Food,1 point,Thu Jul 9 17:42:53 2015 UTC,"I do not know, Mr. Poop. Just like why is the s2000 a mid engine car? http://m.youtube.com/watch?v=QyIa3y6An3Y"
mercedes_benz,3cmj1f,tiny2ner,1 point,Thu Jul 9 19:27:24 2015 UTC,Is it C219/C218 or W219/W218 then? I'm confused.
mercedes_benz,3cmj1f,Shengbo,1 point,Thu Jul 16 11:11:35 2015 UTC,"Thats a really good question. I actually had to look it up. Internally we rarely use the letter with the number, just the number. With exception to the GL and GLK class, with them being x166 and x204 respectively. So rare is it infact that I couldnt find a cut and dry answer. I am about 80% sure I have seen them listed as c219/c218, but its like a foggy memory. I know the CLA is the c117 so it wouldn't be too far of a stretch to say the CLS is a c chassis as well. I will keep looking and if I find anything I will post it. I wont be using wikipedia because I have personally see them be wrong before on this little detail."
mercedes_benz,3cmj1f,tiny2ner,1 point,Thu Jul 16 14:23:42 2015 UTC,"Oh, thanks for trying to answer my question, I see the CLS listed as w219 and w218 nearly everywhere, and as far as I know they were initially based on the E-Class(w211 maybe?) so it's a bit confusing."
mercedes_benz,3cmj1f,Shengbo,1 point,Sun Jul 19 15:46:43 2015 UTC,"Well the cls shares many parts with the e class of the smae generations that they are built, but I was trying to get something thatmercedes themselves had labelled because everybody seems to list almost all chassis as a W be it an s class or R or Clk Or anything."
mercedes_benz,3cmj1f,tiny2ner,1 point,Sun Jul 19 19:39:33 2015 UTC,Their reasoning is that they don't have window frames.
mercedes_benz,3cmj1f,ChuckinTucson,1 point,Wed Jul 15 02:40:06 2015 UTC,That actually makes a little bit of sense.
mercedes_benz,3cjwiw,HappyCampers_CS,7,Wed Jul 8 14:13:10 2015 UTC,"The car has the headlamps of a C-Class and is surrounded by camouflage to hide what it is, Mercedes also made a video saying ""something fast is coming"" which is another hint at the C63 Coupé.   EDIT: Full album"
mercedes_benz,3cjwiw,Kaserati,3,Wed Jul 8 14:15:43 2015 UTC,"Pardon my ignorance, but could it be the C450 AMG? Since it's supposedly coming out in Fall. Though, the camouflage wrap is telling me its not...  http://www.mbusa.com/mercedes/future"
mercedes_benz,3cjwiw,Boltok_The_Raypist,1 point,Wed Jul 8 14:34:19 2015 UTC,"You're right, the camouflage wrap tells us that it's a new body and we already know what the C450 body is gonna look like."
mercedes_benz,3cjwiw,Mochashaft,0,Wed Jul 8 15:19:06 2015 UTC,"No, it's the C63 coupe. Look at the brakes, they're the carbon ceramic option. You'll never see a $15000 option on a non-AMG."
mercedes_benz,3cjwiw,elmariachi304,4,Wed Jul 8 22:39:04 2015 UTC,"Considering the C63 coupe has already been spotted out in the wild, I would say that its a sure thing."
mercedes_benz,3cjwiw,tiny2ner,1 point,Wed Jul 8 16:33:08 2015 UTC,"More than likely, yes!"
mercedes_benz,3cjwiw,WIDSTND,1 point,Wed Jul 8 19:02:55 2015 UTC,Has benz released anything about a 213 chassis yet?
mercedes_benz,3cbg7y,ibran,3,Mon Jul 6 16:38:20 2015 UTC,"Just cleaned and waxed before a Sunday drive yesterday. Over the weekend, I installed the European headlights, which give it so much more presence -- and, more importantly, throw so much more light on the road.   Wasn't planning on installing the clear marker lights, but the mounting tab on one of the original amber lights broke off during removal, so these will have to do for now."
mercedes_benz,3cbg7y,shades_of_cool,2,Mon Jul 6 16:44:27 2015 UTC,I've been thinking very seriously of buying one of these things. I've loved them since I was kid. It's turned into a bit of an obsession lately.
mercedes_benz,3cbg7y,shades_of_cool,2,Tue Jul 7 03:36:28 2015 UTC,"You should do it! Parts are still easy to come by; the local junkyards usually have one to pull parts from. Pelican Parts/Peach Parts, Mercedes Source, and iFixit are my go-tos for DIY tutorials and parts resources. I've found it easy to work on, as if the engineers actually cared about ease-of-access and repairability when designing it.   If you like to work on cars on the weekend, they're fantastic. But, if you prefer to pay someone to do it... bring a big wallet."
mercedes_benz,3cbg7y,BryceAnderson1998,1 point,Tue Jul 7 13:17:47 2015 UTC,"See, that's the problem. I've never so much as changed my own oil! Ha!"
mercedes_benz,3cbg7y,trav110,1 point,Tue Jul 7 20:03:46 2015 UTC,check out benzworld
mercedes_benz,3cbg7y,newfagalicious,1 point,Wed Jul 15 01:26:51 2015 UTC,How difficult was it finding euro lights? Are they expensive?
mercedes_benz,3cbg7y,dr3gs,2,Mon Jul 6 17:33:55 2015 UTC,"They're actually pretty easy to find, even on eBay. This style was from the European 123 coupes and then all European 123s after 1981. Definitely makes it look more like its W126 and R107 siblings.  These particular lights are a new set of Depo knock-offs. Fit and build quality is passable but nothing like the genuine Hella or Bosch units, but they're functional and they certainly look the part. These were about $180 shipped with the wiring adapters; Hella/Bosch units can go $400+."
mercedes_benz,3cbg7y,eckre,1 point,Tue Jul 7 00:07:30 2015 UTC,What a beauty!
mercedes_benz,3cbg7y,___dreadnought,1 point,Mon Jul 6 19:38:30 2015 UTC,Wow that's gorgeous. Never let it go!
mercedes_benz,3cbg7y,Covell007,1 point,Mon Jul 6 22:12:56 2015 UTC,beautiful.
mercedes_benz,3cbg7y,GnomertEFC,1 point,Tue Jul 7 02:30:23 2015 UTC,"What a beaut! We've got the same year in the same hue, although ours is a little worse for wear in the looks department."
mercedes_benz,3cbg7y,Vanquish96,1 point,Tue Jul 7 06:03:29 2015 UTC,"You can call it ""patina"" ;)   This one is a California native; no rust at all. Hope to keep it that way."
mercedes_benz,3cbg7y,wartzilla,1 point,Tue Jul 7 13:42:29 2015 UTC,sigh 127k miles ago this is what mine looked like im assuming....
mercedes_benz,3cdj21,super_simba_42,3,Tue Jul 7 01:53:31 2015 UTC,"If you're looking to do simple repairs yourself head over to benzworld.org, they have a a great DIY section for the W210.  http://www.benzworld.org/forums/w210-e-class/"
mercedes_benz,3cdj21,2StrokeFanatic,2,Tue Jul 7 04:29:25 2015 UTC,"Great, thanks!"
mercedes_benz,3cdj21,forrestandfuzzz,1 point,Tue Jul 7 18:36:22 2015 UTC,I've got a service manual on the computer and I've never once used it. You can find detailed solutions to even the dumbest problems searching forums.
mercedes_benz,3c8ftn,sarrcho,7,Sun Jul 5 21:45:00 2015 UTC,"Yes, you can see the solenoid."
mercedes_benz,3c8ftn,Dont_Believe_Me_Ever,4,Sun Jul 5 23:17:06 2015 UTC,It's a 1965 mercedes benz 190d btw
mercedes_benz,3c8ftn,minibudd,2,Sun Jul 5 21:46:13 2015 UTC,"wow! a Heckflosse! Great find! Tell us the story, please"
mercedes_benz,3c8ftn,im_so_not_cool,1 point,Mon Jul 6 13:04:21 2015 UTC,Looks like a flux capacitor to me...
mercedes_benz,3c7d7a,CsteveC,11,Sun Jul 5 15:58:12 2015 UTC,"That front plate is an unfortunate sore. I wish they weren't mandatory in so many places. In my city if you get a certain number of front plate violations you lose your license (or so I've been threatened), so I had to get a hideaway plate mount. I just wish you could opt to pay more in taxes or registration and not have to display a front plate! It's not like anyone with a beater would care anyway."
mercedes_benz,3c7d7a,laguys,3,Sun Jul 5 17:11:29 2015 UTC,"I'm living in British Columbia, Canada and front plates are mandatory."
mercedes_benz,3c7d7a,PokE_Pro,3,Sun Jul 5 17:34:08 2015 UTC,I know a guy where I live in Iowa where its mandatory who doesn't have a front plate on any of his cars and has never been warned about it.
mercedes_benz,3c7d7a,springinslicht,3,Sun Jul 5 22:27:17 2015 UTC,It doesn't look so bad when the plate is where it's supposed to be - in the middle.  http://ag-spots-2015.o.auroraobjects.eu/2015/02/12/mercedes-amg-gt-s-c725412022015223921_4.jpg
mercedes_benz,3c7d7a,laguys,4,Sun Jul 5 23:54:19 2015 UTC,True but that's also a thinner front plate. U.S. plates are larger than European ones.
mercedes_benz,3c7d7a,40ozkiller,3,Mon Jul 6 00:16:16 2015 UTC,I thought the smudge was a poorly photoshopped puff of smoke.
mercedes_benz,3c7d7a,WhiteBing,2,Sun Jul 5 16:12:35 2015 UTC,hot stuff
mercedes_benz,3c90k3,cardr,7,Mon Jul 6 00:53:30 2015 UTC,Big thing on the early M156's (until mid 2011) are the head bolts which would stretch and snap with age before their revision. otherwise the engines are very robust
mercedes_benz,3c90k3,drunkenup,2,Mon Jul 6 01:15:48 2015 UTC,"With the head bolts, are they a one-time replacement or is it designed in such a way that they will need to be replaced again with time?"
mercedes_benz,3c90k3,drunkenup,2,Mon Jul 6 14:39:23 2015 UTC,you shouldn't have to worry about them once they are replaced with the revised part. Weistec sells an even tougher ARP head bolt.
mercedes_benz,3c90k3,minibudd,1 point,Mon Jul 6 16:10:58 2015 UTC,"if I remember correctly they were a factory recall. once recall is complete, the head bolts will last longer than you."
mercedes_benz,3c90k3,Boltok_The_Raypist,3,Mon Jul 13 16:47:36 2015 UTC,"You'll be fine. The GM of my dealer drove a C63 coupe through the winter of 2013-14 (the one where it reached -40 a few days in our area). Just get proper wheels and tires, don't cheap out."
mercedes_benz,3c90k3,Boltok_The_Raypist,2,Mon Jul 6 11:23:11 2015 UTC,Blizzaks have been recommended
mercedes_benz,3c90k3,LLUSKYY,4,Mon Jul 6 14:39:50 2015 UTC,Go with Michelins. That's the main tire we use on most of the dealer vehicles. We've heard and seen nothing but great things.
mercedes_benz,3c90k3,vzelol,0,Mon Jul 6 15:25:04 2015 UTC,IMO Blizzaks are better suited for highway driving. If you live in the city I would get Hankook iPikes or similar studded tires.
mercedes_benz,3c90k3,elmariachi304,2,Mon Jul 6 14:52:13 2015 UTC,"Dunno if it helps you but I recently purchased a rwd manual transmission c230 for Toronto after doing a lot of research on the subject of awd vs rwd in winter. Basically 99% of the difference comes down to having proper winter tires, otherwise with rwd having increased handling and braking in the winter but is harder to accelerate from a dead stop."
mercedes_benz,3c90k3,JoeBarTeam,2,Mon Jul 6 13:50:51 2015 UTC,"Beyond fuel costs, you should look into the cost of tires. With a RWD V8 car like this, you'll be going through back tires every 7,000-10,000 miles, and that's driving easy.  The cost of tires was one major thing I forgot to budget for when I got my last car, you should def factor this in!"
mercedes_benz,3c3x56,zlesti,1 point,Sat Jul 4 15:09:00 2015 UTC,"German aftermarket specialists McChip-DKR has introduced their new tuning program for the Mercedes-AMG GT, available for GT and GT S models"
mercedes_benz,3c29pa,CarGuy5,1 point,Sat Jul 4 02:24:41 2015 UTC,Nice work.  I admire people who can work on their own cars.  I have zero mechanical ability and just have to trust the people who work on my cars to do the job correctly.
mercedes_benz,3c29pa,ChuckinTucson,1 point,Sun Jul 5 21:17:44 2015 UTC,Thank you. I think that its very easy now to work on cars. The internet has so many different resources that you can use and many auto part stores now have a program where you can borrow tools you need.
mercedes_benz,3bvhop,checkmarshall,9,Thu Jul 2 14:13:57 2015 UTC,Once we get her cleaned up for the show room I'll post more pictures.
mercedes_benz,3bvhop,illohnoise,2,Thu Jul 2 14:15:02 2015 UTC,I just saw one just like this on my way to work this morning.
mercedes_benz,3bvhop,pivoprosim48,5,Thu Jul 2 14:52:46 2015 UTC,"Never realized they used the ""mercedes benz"" branding on the Maybach .. i.e. runners on the side of the door"
mercedes_benz,3bvhop,ohshititsjess,6,Fri Jul 3 02:14:17 2015 UTC,They didn't in the past but now maybach is basically like AMG to my understanding.
mercedes_benz,3bvhop,ChiPhiMike,3,Fri Jul 3 05:57:23 2015 UTC,Maybach no longer exists as a standalone brand. It's just the ultra luxury trim for the S600
mercedes_benz,3bvhop,BooeyBaba,1 point,Fri Jul 3 13:00:34 2015 UTC,Really detracts from the je ne sais quoi of it all
mercedes_benz,3bvhop,Boltok_The_Raypist,3,Fri Jul 3 07:32:51 2015 UTC,Where about are you located (generally)?
mercedes_benz,3bvhop,poktanju,9,Thu Jul 2 15:23:15 2015 UTC,Maryland.
mercedes_benz,3bvhop,PocketChant,6,Thu Jul 2 16:16:48 2015 UTC,Sheeeeeeeeeiiit.
mercedes_benz,3bvhop,Boot_Shrew,3,Thu Jul 2 16:33:38 2015 UTC,Euro Motorcars?
mercedes_benz,3bvhop,B00TYMASTER,2,Thu Jul 2 17:47:17 2015 UTC,Nope.
mercedes_benz,3bvhop,Hahahahahahai,1 point,Thu Jul 2 17:54:59 2015 UTC,"Hah, that was my guess! I went over there a couple days ago to see if it was there."
mercedes_benz,3bvhop,d4rk_sh4d0w,2,Fri Jul 3 14:39:04 2015 UTC,It was a very rainy day in Maryland today.
mercedes_benz,3bvhop,xampl9,2,Fri Jul 3 05:51:09 2015 UTC,There's enough room in the back to both comfortably make and have a baby.
mercedes_benz,3bvhop,BooeyBaba,4,Wed Jul 8 20:44:00 2015 UTC,No suicide doors? Disappointed 😞
mercedes_benz,3bvhop,SeaBass2712,2,Thu Jul 2 15:00:11 2015 UTC,It's amazing just how good the Mercedes designers are.
mercedes_benz,3bvhop,IntrntKybrdWarrior,1 point,Thu Jul 2 15:06:25 2015 UTC,"It looks like the back of a W12....is this built to a better standard? What's the draw besides the badge? Forgive my ignorance in advance, its late."
mercedes_benz,3bvhop,ChuckinTucson,1 point,Fri Jul 3 07:30:30 2015 UTC,The Maybach shown is a W222 S600 (with a longer wheelbase?). Maybach is basically more luxurious than the standard S-Class. A person who buys one is generally  chauffeured in it. They're not really meant to be daily drivers.
mercedes_benz,3bwrtf,xDex_,10,Thu Jul 2 20:05:42 2015 UTC,I still can't differentiate the new C class from S class which will be weird to me for some reason. All of Mercedes's cars look so similar now.  Still a beautiful design for both classes though.
mercedes_benz,3bwrtf,Ninjapro2,2,Fri Jul 3 00:59:01 2015 UTC,"I love the look of both of 99th, mostly because it's the same look. But I hate driving down the road thinking I see one and it's the other. Its embarrassing to call out c class and it's really an s"
mercedes_benz,3bwrtf,Obnoxiousdonkey,1 point,Fri Jul 3 07:26:18 2015 UTC,S doesn't have that grille and is much larger. Personally I think that the E and C look very similar from the front.
mercedes_benz,3bwrtf,SeaBass2712,3,Sat Jul 4 23:44:26 2015 UTC,I still like the look of the old W211. The 2009 with the sport-style front fascia was damn fine looking. The new fascias seem a little bare. Those big scoopy holes in the side feel like they need something. Like some LED lights or something.
mercedes_benz,3bwrtf,Quackledork,3,Fri Jul 3 02:43:45 2015 UTC,The W211 is a timeless model.
mercedes_benz,3bwrtf,deutsch-technik,1 point,Mon Jul 6 09:27:15 2015 UTC,"Indeed, it looks far more stately than the newer models in my opinion."
mercedes_benz,3bwrtf,kademah,1 point,Mon Jul 6 21:21:34 2015 UTC,It look much better than the old one
mercedes_benz,3bwrtf,Kentaki0,-7,Fri Jul 3 08:28:32 2015 UTC,The W211 has not aged well
mercedes_benz,3bwrtf,Blinkinage,8,Fri Jul 3 02:01:09 2015 UTC,I couldn't disagree more. The W211 E55 is one of my favorite cars.
mercedes_benz,3bwrtf,Bhayes547,1 point,Fri Jul 3 03:19:13 2015 UTC,"Well my opinion is that e classes age well with the exceptions of the W210 and W211, never really liked those round headlights. I do like the W212 though."
mercedes_benz,3bwrtf,Blinkinage,3,Fri Jul 3 03:44:34 2015 UTC,To each his own! I think the headlights give them a formal look while also being slightly aggressive.
mercedes_benz,3bwrtf,Bhayes547,1 point,Fri Jul 3 03:48:37 2015 UTC,"Definitely agree here. Used to not like them though, they are a bit of an acquired taste."
mercedes_benz,3bwrtf,UsernameNumber6,2,Fri Jul 3 05:46:43 2015 UTC,"Jesus, why the downvotes for the different opinion?   I do disagree though, when they're well kept like the one in the photo, they look great. When they've been neglected..yeah, they look a little tired."
mercedes_benz,3bwrtf,LeFunkwagen,0,Fri Jul 3 13:07:27 2015 UTC,Absolutely incorrect
mercedes_benz,3bwrtf,seth11111,1 point,Fri Jul 3 12:44:12 2015 UTC,That's just my opinion :)
mercedes_benz,3bvvny,ja647,1 point,Thu Jul 2 16:03:59 2015 UTC,"That seems like a very good price for a solid, rust-free 300D. Check eBay for comparables - they typically sell for much more. Only problem is will he be insulted if ask to get it inspected by another mechanic? :)"
mercedes_benz,3bvvny,mullinerparkward,2,Fri Jul 3 00:43:08 2015 UTC,"Like most Mercedes of this age, it's simple to work on and parts are available and cheap.  But, if you insist on having everything working 100% and hire a mechanic to do it, it could be an expensive proposition. This is why a pristine 300D with working A/C, clean paint and superb mechanicals will sell for $10,000.    However, if you can do all the work yourself and you budget ahead of time for a transmission replacement at 250,000 miles, it will be an economical and efficient car that is so much more satisfying than a $3,000 Honda or Ford."
mercedes_benz,3bvvny,mullinerparkward,1 point,Fri Jul 3 18:22:57 2015 UTC,"get it inspected by another mechanic? :)   I don't think that would bother him!  I misheard him though, it's $2K plus my car or $3k. I drove it today. It seemed pretty nice. It's rust-free, or should be, it's only been in NC. It does need to be repainted (that's another grand) but he told me that up front."
mercedes_benz,3bvvny,minibudd,1 point,Fri Jul 3 00:53:28 2015 UTC,"$5k is more accurate if it's truly a pristine w124 300d. Those things are tanks that last longer than the Earth. I'd love one. I've only has gas models, which are way more fun but not as reliable or efficient."
mercedes_benz,3bvvny,BryceAnderson1998,1 point,Fri Jul 3 17:20:21 2015 UTC,now I'm even more tempted......
mercedes_benz,3bvvny,ConvertsToMetric,1 point,Sat Jul 4 01:43:11 2015 UTC,"thats probably a great deal, the one thing that i run into all of the time is the vacuum tubes, they crack and cause leaks. its like $1 for 1.5 feet or so. its cheap but kind of annoying. i own a 1992 300d with 264K on it, it runs great, i just recently did an egr delete. it doesnt change much but you dont have a bunch of exhaust going back into your car. the car drives great it totally owns the road. 3k sounds like an awesome price for the condition its in. i would check the resonator. mine rusted through from the top. but other than that it will last you a very long time."
mercedes_benz,3bvvny,BryceAnderson1998,1 point,Wed Jul 15 01:40:45 2015 UTC,Mouseover to view the metric conversion for this comment
mercedes_benz,3bt2mw,urprotienpooperpal69,1 point,Wed Jul 1 22:35:50 2015 UTC,"Haha, well...  In Merc lifespans, this car isn't exactly ""old."" It's probably middle aged. :)"
mercedes_benz,3bt2mw,minibudd,1 point,Thu Jul 2 12:38:36 2015 UTC,Good point!
mercedes_benz,3bt2mw,TheInvisibleUnknown,1 point,Thu Jul 2 19:44:36 2015 UTC,I like these W126's..  I like the 500SEl W126 very much
mercedes_benz,3bt2mw,mopar617,1 point,Fri Jul 3 09:01:13 2015 UTC,"It does my heart good to see an ""old"" W126 still on the road"
mercedes_benz,3bt2mw,Hoffmeisterfan,1 point,Wed Jul 8 02:02:16 2015 UTC,W126 is one of my favorites. I want one with a widebody kit so bad
mercedes_benz,3bt2mw,Blinkinage,2,Wed Jul 1 23:17:47 2015 UTC,Thats a W126 :)
mercedes_benz,3bt2mw,Hoffmeisterfan,1 point,Thu Jul 2 00:18:22 2015 UTC,Damn lol thanks man. I should probably get the chassis code on my favorite one memorized
mercedes_benz,3bt2mw,JessieAMorris,1 point,Thu Jul 2 00:28:16 2015 UTC,"Sorry I'm not to acknowledge about older Mercedes,  I just thought you guys would enjoy. Is this an old s class?"
mercedes_benz,3bt2mw,Hoffmeisterfan,2,Wed Jul 1 23:59:13 2015 UTC,"Mercedes has chassis numbers, so regardless of engine the chassis number for a given era of class is the same. This happens to be a w126 chassis."
mercedes_benz,3bt2mw,Rabben,1 point,Thu Jul 2 01:25:39 2015 UTC,"Yes an old S class, short wheelbase version"
mercedes_benz,3bt2mw,doggscube,1 point,Thu Jul 2 00:28:42 2015 UTC,"Wrong, its a long wheelbase."
mercedes_benz,3bt2mw,Hoffmeisterfan,1 point,Thu Jul 2 09:37:46 2015 UTC,"Yep. It's a twin of my 300SDL, except subtract the arch trim and add oxidized hood and roof clear coat."
mercedes_benz,3bt2mw,Buy-theticket,1 point,Thu Jul 2 12:34:44 2015 UTC,You are correct
mercedes_benz,3bt5rp,HighClassProletariat,5,Wed Jul 1 22:59:49 2015 UTC,Mann filters are dirt cheap on ebay. They are way better than any others.
mercedes_benz,3bt5rp,stankyinthahood,2,Thu Jul 2 02:29:09 2015 UTC,"FCP Euro, Rock Auto, Pelican Parts, and Amazon would be good places to start. I use and highly recommend Mann Filters."
mercedes_benz,3bt5rp,MemoryAccessRegister,1 point,Thu Jul 2 16:10:08 2015 UTC,I get all my filters from Amazon. I have a window regulator on my wishlist for when I get to it. Amazon has everything.
mercedes_benz,3bt5rp,doggscube,1 point,Thu Jul 2 13:19:52 2015 UTC,The factory filters are manufactured by MANN
mercedes_benz,3bt2cv,Miya81,6,Wed Jul 1 22:33:23 2015 UTC,Hell no.
