mercedes_benz,3e3tw8,actasifyouare,11,Tue Jul 21 19:14:33 2015 UTC,Am I the only one that thinks it's ugly as sin?
mercedes_benz,3e3tw8,Mikevercetti,3,Wed Jul 22 01:38:07 2015 UTC,"Nope, it looks like its hiking its pants up on the ass end."
mercedes_benz,3e3tw8,pursuitoffappyness,2,Wed Jul 22 02:00:19 2015 UTC,"I've seen it. In every picture it looks like vomit, but in person it's great."
mercedes_benz,3e3tw8,Tnargkiller,2,Wed Jul 22 02:37:54 2015 UTC,Nope. The crossover trend needs to die
mercedes_benz,3e3tw8,trav110,4,Wed Jul 22 04:22:10 2015 UTC,"Looks great in person, waiting for them to unwrap the car and check out the new interior and also see what this 9 speed transmission is all about!"
mercedes_benz,3e3tw8,MBGLK,4,Tue Jul 21 19:16:18 2015 UTC,"9 speed? holy, that shit must be buttery smooth"
mercedes_benz,3e3tw8,ivannliang,1 point,Tue Jul 21 20:10:24 2015 UTC,waiting for the interior to get unwrapped to try it out!
mercedes_benz,3e3tw8,elmariachi304,1 point,Tue Jul 21 23:35:26 2015 UTC,"Is this in Vancouver, B.C?"
mercedes_benz,3e3tw8,BloodPolska,1 point,Tue Jul 21 23:16:36 2015 UTC,Mercedes-Benz Langley so technically Vancouver ;-)
mercedes_benz,3e3tw8,IDownloadYourMom69,2,Tue Jul 21 23:33:49 2015 UTC,So beautiful in white... I am seriously considering one now
mercedes_benz,3e3tw8,TheHorseSizedDuck,3,Wed Jul 22 01:18:08 2015 UTC,Ugly :/
mercedes_benz,3e3tw8,Tnargkiller,2,Wed Jul 22 02:00:12 2015 UTC,Thats not a coupe.
mercedes_benz,3e3tw8,twoplustwoequalstwo,3,Wed Jul 22 06:03:01 2015 UTC,This looks too much like a X6.
mercedes_benz,3e3tw8,Kaserati,1 point,Wed Jul 22 02:18:55 2015 UTC,"I think there's only one real way to integrate the roofline into the rear tailgate area, so there will be similarities. In person it's pretty great."
mercedes_benz,3e3tw8,zshift,1 point,Wed Jul 22 02:39:09 2015 UTC,My first thoughts as well.
mercedes_benz,3e3tw8,t1sh,1 point,Wed Jul 22 03:27:00 2015 UTC,it looks so....futuristic
mercedes_benz,3e39uv,temuiini,2,Tue Jul 21 16:59:08 2015 UTC,Inspiring photo! Lovely. Makes me wish I hadn't sold mine.
mercedes_benz,3e39uv,omegle2010,1 point,Tue Jul 21 17:51:59 2015 UTC,"Unfortunately this was only on loan. It was so much fun to drive, less aggressive than SLK's, more like royalty."
mercedes_benz,3e39uv,omegle2010,1 point,Tue Jul 21 18:56:27 2015 UTC,"I'm a bit of a mercedes nut. 27yo and I've had 4 SLK's, the 500SL and an S-class. Nothing makes my heart beat more then a Benz. Try the SLK320! So much fun."
mercedes_benz,3e39uv,omegle2010,1 point,Tue Jul 21 20:12:58 2015 UTC,"Yeah, me too. I have had w123, w124, r170/230k, r171/350 and now I'm driving w164/350. No more two seaters for me 'cause of family, so next one could be CL..?"
mercedes_benz,3e39uv,Joshua_Seed,1 point,Tue Jul 21 21:25:46 2015 UTC,YES!
mercedes_benz,3e39uv,alqassimi98,1 point,Tue Jul 21 22:03:45 2015 UTC,"Daisies, Bees, and Mercedes."
mercedes_benz,3e40x4,temuiini,2,Tue Jul 21 20:02:10 2015 UTC,"It's been crappy summer here, so I was lucky to get several nice (sunny, +22c) driving day within one week I had this old beauty at my disposal. I really liked to drive it, even it's ""only"" 3litre engine, it moves nicely. Would be interesting to try 6l version of this... :)"
mercedes_benz,3e40x4,greatgerm,2,Tue Jul 21 20:04:22 2015 UTC,"I have a 2000 SL500. It's not the fastest car on the planet, but it definitely scoots along and it's so damn comfortable to drive."
mercedes_benz,3e1s4h,kingvalant,1 point,Tue Jul 21 08:11:00 2015 UTC,"They're gorgeous and like all well-maintained older Mercs, they're pretty reliable.   But, for someone who's new to wrenching... I'd go a generation newer for a W126 or a W123, simply because parts are more common and available in local junkyards.   Anything older like that W108 is going to be hard to source parts locally, so be prepared to wait a few days for shipping when something breaks. A W126/123 will still get you that classic Mercedes style, but it's an easier and cheaper entry point, IMO.  Full disclosure: I have a 123 and everyone should have a 123."
mercedes_benz,3e1s4h,ibran,1 point,Tue Jul 21 17:02:37 2015 UTC,the 126 and 123's arent as pretty as the 280se
mercedes_benz,3e1s4h,ibran,1 point,Tue Jul 21 17:47:43 2015 UTC,http://giant.gfycat.com/LastBrokenHorsefly.gif  (I do kinda agree. Kinda.)
mercedes_benz,3e1s4h,HighClassProletariat,1 point,Tue Jul 21 17:55:33 2015 UTC,"I picked up a 72 280SE about a month ago, and from what I've seen in bringing it back to its former luster, if you take care of the car, it'll take care of you. These cars are pretty much all mechanical, and will run forever with proper maintenance, the only real problem is some of the more specialized parts are difficult to find and/or expensive."
mercedes_benz,3e1s4h,autfag,1 point,Tue Jul 21 17:04:03 2015 UTC,"We dont own one right now but my father did once. There is lots of parts around for these cars (at least in europe) so maintaining it wont be a problem (if you have the coin of course). Be aware tho that this model especially is NOT really suited for everyday usage. Its nice to take it on a ride occasionally, but frequent usage is not really recommendable."
mercedes_benz,3e1s4h,pivoprosim48,1 point,Tue Jul 21 18:18:11 2015 UTC,"You have 2, o great! Then you don't need any info."
mercedes_benz,3e0qvu,UH8MEandIH8U,3,Tue Jul 21 01:52:06 2015 UTC,"I would have liked a more comprehensive makeover, but it looks nice as it always did.  I hope they don't fuck up the G Class before I get a chance to buy a new one"
mercedes_benz,3e0qvu,MBGLK,1 point,Tue Jul 21 14:00:16 2015 UTC,"I like how they blocked the benz logo in the grille and not on the hatch. Lol.  Either way, I like what I'm seeing!!"
mercedes_benz,3e2ccj,Danny41294,1 point,Tue Jul 21 12:32:30 2015 UTC,"Do you know the names of the actual parts? There are a few websites that have the catalogs online, but the difficult part is knowing the exact name of the part to get the number for it.    Example: http://mbonlineparts.com/parts/?action=&siteid=215843&make=&model=    Have you spoken with the service manager?"
mercedes_benz,3e2ccj,SamTheSammich,1 point,Tue Jul 21 16:50:42 2015 UTC,Try this:  http://epc.startekinfo.com/epc/  You can sign up for a year for free and it has diagrams and the part numbers for your car.
mercedes_benz,3dzjpp,ashy88,3,Mon Jul 20 20:20:24 2015 UTC,What a beauty!! I think those wheels suit the w211 facelift more than any other.So what engine is under the hood?? I am guessing e350 v6.
mercedes_benz,3dzjpp,petroskrn,3,Tue Jul 21 00:48:08 2015 UTC,"You know it's funny.. when I bought it I was planning on swapping out the wheels, but they've really grown on me. I may still get some AMG style wheels for summer tires, and keep these for winter. She's a 550, cannot beat that V8. A real joy to drive. Her airmatic (and my wallet) can probably thank my ex bf for talking me out of tracking her.. :P"
mercedes_benz,3dzjpp,petroskrn,1 point,Tue Jul 21 03:07:52 2015 UTC,"Haha I see.I have never seen a E550 in my entire life. I live in Greece and most w211 here are E200 kompressor some E220,E270 CDIs and very few 350s.If one wants a V8 the choice is between the S class or the (gorgeous) CLS."
mercedes_benz,3dzjpp,petroskrn,2,Tue Jul 21 22:10:41 2015 UTC,"Very interesting! It's amazing how different every country is. Even here in the states though big engines are becoming harder to find with everything. Everyone is so concerned about fuel economy, and I think the bottom line is most people just don't care about engine size. I probably wouldn't have bought this car if it was less than a V8. It really is a rocket. And smooth as can be. I hope you get to see one some day! :)"
mercedes_benz,3dzjpp,Bobhuntly,1 point,Wed Jul 22 03:51:18 2015 UTC,Thanks! :) Take care.
mercedes_benz,3dzjpp,SpadoCochi,1 point,Wed Jul 22 09:44:27 2015 UTC,nahhh thats got to be an S 63 AMG???
mercedes_benz,3dyg1y,MB280C,6,Mon Jul 20 15:41:25 2015 UTC,600 Pullman Landaulet
mercedes_benz,3dyg1y,oranjeboven,3,Mon Jul 20 16:37:09 2015 UTC,"Beautiful car! Also, Jay Leno has one of these and it's one of his best videos on Jay Leno's Garage. Here."
mercedes_benz,3dyg1y,eggequator,1 point,Mon Jul 20 16:29:23 2015 UTC,"Well, he's the cheap one..."
mercedes_benz,3dyg1y,newfagalicious,1 point,Mon Jul 20 17:02:57 2015 UTC,Dude he's the best. I was coming down Coldwater Canyon once and he pulled up next to me in a vintage Jag and gave me the nod of approval on my '84 300TD. Sorry I'm a peasant Jay and this is my daily driver!!!!
mercedes_benz,3dyg1y,ChuckinTucson,1 point,Mon Jul 20 18:59:03 2015 UTC,"When Jay was a teenager he worked as a lot boy for a Mercedes Benz dealership, so he has a soft spot for them.  I've met him at his ""garage"" and he's a heck of a nice guy."
mercedes_benz,3dyg1y,autfag,1 point,Wed Jul 22 00:11:13 2015 UTC,Wo konnte man die Prachtstücke besichtigen?  Zufällig in Österreich?
mercedes_benz,3dyg1y,oranjeboven,1 point,Mon Jul 20 19:14:42 2015 UTC,Schwetzingen
mercedes_benz,3dyg1y,autfag,1 point,Mon Jul 20 21:05:44 2015 UTC,"Ah Deutschland, trotzdem schön; )"
mercedes_benz,3dyg1y,mister_bmwilliams,2,Tue Jul 21 03:31:23 2015 UTC,I need this
mercedes_benz,3dyg1y,derda,1 point,Tue Jul 21 02:21:07 2015 UTC,"According to the sign next to it, the car has been owned by 70s Formula 1 driver Didier Pironi"
mercedes_benz,3e0tyh,boogiefur,2,Tue Jul 21 02:16:17 2015 UTC,"You really don't want to drive a 30 y/o car on 6 hr trips regularly.  However, if you insist, a 240d w/ 60k miles is  a pretty damn good option."
mercedes_benz,3duli2,SpadoCochi,7,Sun Jul 19 17:04:05 2015 UTC,Good choice.  Welcome to the MB family!
mercedes_benz,3duli2,ChuckinTucson,3,Sun Jul 19 17:19:02 2015 UTC,Happy to be here!
mercedes_benz,3duli2,christopherjenk,5,Mon Jul 20 02:28:39 2015 UTC,Best looking E class in my opinion.
mercedes_benz,3duli2,Seaborn2016,1 point,Mon Jul 20 04:02:58 2015 UTC,Thanks!
mercedes_benz,3duli2,J0HNNYCUPCAKES,2,Mon Jul 20 15:45:59 2015 UTC,"Beautiful - and a CarMax buy on top of it all! Congrats, and enjoy it in the best of health."
mercedes_benz,3duli2,temuiini,2,Mon Jul 20 04:19:55 2015 UTC,"Thanks! Yea, I'm sold on Carmax. I'm happy with spending 5% more on the car to have complete peace of mind with the vehicle history and the comprehensive warranty."
mercedes_benz,3dut4r,Frank_Sandbeans,4,Sun Jul 19 18:08:42 2015 UTC,"Jesus this thing is a unicorn in Europe, didn't even know they sold them in the states!"
mercedes_benz,3dut4r,derpderpdurr,1 point,Sun Jul 19 21:25:38 2015 UTC,There are still a few of them about in London/ I see 2 on a regular basis. Loads of non estate versions
mercedes_benz,3dut4r,everyonelovescheese,1 point,Mon Jul 20 07:09:21 2015 UTC,This car was a Japanese export.
mercedes_benz,3dut4r,actasifyouare,3,Tue Jul 21 19:36:31 2015 UTC,"Rear badge is fucked, how does that happen?!?"
mercedes_benz,3dut4r,hautpot,2,Sun Jul 19 21:22:27 2015 UTC,In the description it says it was a theft attempt. Probably some dumbshit kid tried to pull it off.
mercedes_benz,3dut4r,Clavis_Apocalypticae,1 point,Sun Jul 19 21:31:35 2015 UTC,What a bloody cunt. I remember someone telling me that kids used to clip off the ornaments on older cars.
mercedes_benz,3dut4r,hautpot,1 point,Mon Jul 20 05:10:39 2015 UTC,They did it all the time. Any car that had a hood emblem that stood up was at risk. That is half the reason Rolls made the hood emblems retract into the grill on the Phantom.
mercedes_benz,3dut4r,TheSherbs,1 point,Mon Jul 20 14:29:55 2015 UTC,"I've never had a problem losing mine, but my folks had several Benz's in the 80s. They replaced a half dozen of them or more over 10-12 years. If I remember correctly, it was the Beastie Boys who started that trend. (RIP MCA). People used to wear them on chains around their necks."
mercedes_benz,3dut4r,Clavis_Apocalypticae,2,Mon Jul 20 17:03:41 2015 UTC,"I didn't even know these were a thing. Now that I do, I want a thing. That thing."
mercedes_benz,3dut4r,Just_Is,1 point,Mon Jul 20 03:20:10 2015 UTC,"Good luck. Inported asian to canada. Likely no possible way to register in the US without $20k in ""certifications""  edit: verified with NHTSA, this car cannot be driven in the US. DO NOT BUY IF YOU LIVE IN USA."
mercedes_benz,3duzau,lepriccon22,4,Sun Jul 19 19:01:00 2015 UTC,I've got a 1998 e320 with 168k miles and it runs fantastic. It's a bit of a gas guzzler but besides that I love it.
mercedes_benz,3duzau,Whoatemypoptart,1 point,Sun Jul 19 21:05:22 2015 UTC,Have you had to do many repairs though?
mercedes_benz,3duzau,Whoatemypoptart,1 point,Mon Jul 20 00:41:52 2015 UTC,I had to replace a 17 year old wire harness but that's it
mercedes_benz,3duzau,dudeperson3,2,Mon Jul 20 01:24:04 2015 UTC,"My 92' 190E has issues with those shitty plastic (they used to be decent ceramic) fuses, but Mercedes made the wire harnesses more ""eco-friendly"" after...1994? 1995-6? So they naturally degrade after 15+ years. BUT...its not very hard to keep up with as long as you just keep an eye out for degrading wires"
mercedes_benz,3duzau,Whoatemypoptart,1 point,Mon Jul 20 02:00:53 2015 UTC,"Have there been things that have gone wrong that you haven't replaced?  Like the clock LCDs going out, or a door not unlocking electronically--things like these?"
mercedes_benz,3duzau,Whoatemypoptart,1 point,Mon Jul 20 05:16:44 2015 UTC,"I have to stand close for the remote to work, but besides that, no"
mercedes_benz,3duzau,satin_rules,0,Mon Jul 20 05:41:29 2015 UTC,"These kinds of things scare me a bit though.  If MB electrical engineers can't properly get a remote to last a few years in 1999, what makes me think their mechanical engineers can make a suspension not spontaneously collapse while driving 60 mph?"
mercedes_benz,3duzau,mmtree,1 point,Mon Jul 20 05:58:40 2015 UTC,A few years? Try 16. I have 168k miles on my 98 and it's near perfect.
mercedes_benz,3duzau,BassPlayaYo,1 point,Mon Jul 20 06:48:55 2015 UTC,Sorry! I didn't mean literally a few years--just saying these sorts of things concern me :/
mercedes_benz,3duzau,DrSnuggles8675,1 point,Mon Jul 20 07:02:03 2015 UTC,Dude there are way bigger problems with most car brands
mercedes_benz,3duzau,xampl9,2,Mon Jul 20 12:49:03 2015 UTC,We have a 2000 E320. It has about 60k miles on it(more suburban driving). No major issues and still runs like a champ.
mercedes_benz,3duzau,derpderpdurr,1 point,Sun Jul 19 21:36:05 2015 UTC,"Most of that year and 2000 suffered from problems with the display namely the temperature and the time not showing or being distorted due to pixels not lighting up.  Rust is an issue, especially with the springs on the strut.  They break at the bottom because of rust.  With any used Mercedes you should be able to do work on cars otherwise it's going to cost you.  I own a 2000 E320."
mercedes_benz,3duzau,xampl9,1 point,Mon Jul 20 14:04:56 2015 UTC,"Current 99 e330 owner, 161k on it, never had any major issues.   Just check for rust, especially around the spring perches.  Major repairs for mine over the years were a cracked manifold, and leaky oil pan.  Leaky oil pan was my fault though, dark parking lot... didn't see the concrete curb...  not sure what was up with the cracked manifold, my indie mechanic said mine was the second or third he ever had to do though.   Car has been a tank, decent mileage, good pickup and it should go another 100k with any luck.  I think if the one you're looking at is in good shape, it'll be a great car for a good while."
mercedes_benz,3dttnd,esh484,3,Sun Jul 19 11:59:01 2015 UTC,I love that last line about the sunroof. Typical Mercedes. May be rough but that sunroofs like new
mercedes_benz,3dttnd,Imfamous-,1 point,Sun Jul 19 20:13:30 2015 UTC,It is the best working thing on the car. Nothing is absolutely terrible (or I wouldn't have bought it) but that thing just glides open.
mercedes_benz,3dttnd,dudeperson3,1 point,Sun Jul 19 23:03:16 2015 UTC,"aw dude, I'd have her mechanically like new before my next paycheck (wait, that's bad right?) that's a beautiful car"
mercedes_benz,3dttnd,Poop_is_Food,1 point,Mon Jul 20 02:08:50 2015 UTC,"She's a work in progress. Definitely gonna need a few things, but she's running well enough for now."
mercedes_benz,3dshcj,Hung_Longdong,3,Sun Jul 19 00:52:33 2015 UTC,We had an edition one come in that was already sold. We have one 15 507 coupe left and a couple used ones. Flying off the shelves.
mercedes_benz,3dshcj,actasifyouare,2,Sun Jul 19 04:46:50 2015 UTC,We had one for four days. They sell super fast. Incredible cars.
mercedes_benz,3dshcj,gromitfromit,2,Sun Jul 19 01:26:00 2015 UTC,"they don't make the new c63's with the old design anymore, right?"
mercedes_benz,3dshcj,rickgee23,2,Sun Jul 19 02:07:42 2015 UTC,"If you mean to say they don't make the last Generation C-Class C63, then, yes, I believe so. If they haven't phased it out yet. But most likely its yes."
mercedes_benz,3dshcj,iYoona,2,Sun Jul 19 02:49:37 2015 UTC,those looked more aggressive than they do now.
mercedes_benz,3dshcj,rickgee23,1 point,Sun Jul 19 03:15:51 2015 UTC,Yeah they are. At first I didn't like the new C63 but it kind of grew on me. I'm super excited for the Coupe that they'll come out with though
mercedes_benz,3dshcj,iYoona,2,Sun Jul 19 03:58:27 2015 UTC,"We just had a base 2015 C63 come in, no S Package and no AMG Performance Package either. We have 2 Edition Ones on the lot, and 2 507s. The owner of the dealer just received the last C63 507 that rolled off the assembly line. They've been selling pretty well so far. Many are waiting for the coupe in the spring."
mercedes_benz,3dq9xf,mmtree,3,Sat Jul 18 12:01:26 2015 UTC,"Man that's ""cheap"". Trying to configure the new (2015) model & options of the (just) C Class that I have and I've hit 60k Euros."
mercedes_benz,3dq9xf,endre84,2,Sat Jul 18 20:37:06 2015 UTC,cool
mercedes_benz,3dq9xf,xcxb,1 point,Sat Jul 18 15:38:50 2015 UTC,"Are the heated / ventilated seats standard?  Also, everything in that Premium 1 package should be standard... especially the rear view camera which they have to make standard soon."
mercedes_benz,3dq9xf,skundu744,1 point,Sat Jul 18 16:07:18 2015 UTC,By law all 2016 and later vehicles must have back up cameras
mercedes_benz,3dq9xf,reddit_hater,2,Sat Jul 18 18:03:17 2015 UTC,I think the requirement only starts phasing in in 2016. Not all required until 2018.
mercedes_benz,3dq9xf,doublecards,1 point,Sun Jul 19 15:32:55 2015 UTC,"Seats are heated, but didn't get ventilated (tried changing it but it was too late, not a huge issue as I live in an area where winter is 9 months of the year lol- I'll spend the money on tint instead). The lane tracking package and rear view camera are standard, but the bigger screen/nav/media features, plus the leather require the premium package. There's a few other features that I wanted that require the premium package too, it's on my itemized hardcopy--i remember him going through and adding features I really needed like power folding mirrors (single car garage) and the system said you needed the premium package."
mercedes_benz,3dpgyu,iamdrogg,1 point,Sat Jul 18 04:44:31 2015 UTC,"Should also note that my phone will connect perfectly fine via Bluetooth for incoming and outgoing phonecalls, with no spotty connection."
mercedes_benz,3dpgyu,MBGLK,1 point,Sat Jul 18 04:45:25 2015 UTC,"2011 C300 doesn't actually support bluetooth streaming, you need an adapter this one here is one of the only ones that is guaranteed to work"
mercedes_benz,3dpgyu,MBGLK,1 point,Sat Jul 18 05:53:11 2015 UTC,"I have the option for the Bluetooth streaming, the first time I set it up it worked. Hasn't worked since."
mercedes_benz,3dpgyu,dave_r,1 point,Sat Jul 18 06:14:21 2015 UTC,"The facelifted model does support that but AFAIK that's 2012+, maybe I'm mistaken, sorry."
mercedes_benz,3dpgyu,SpadoCochi,1 point,Sat Jul 18 18:10:33 2015 UTC,"I had 2 2012 C's and both did this. Bluetooth connectivity has really improved, seems like it got sorted out in 2013 based on the later C's I leased.  It isn't your phone, its the cars software. The only thing I can suggest is swinging by the dealer (or calling) and ask if there are any software updates available for your car to address this."
mercedes_benz,3doyte,dayvieee,1 point,Sat Jul 18 01:47:53 2015 UTC,"The dealer would be the place to get them. 6 years of experience I've never seen, used, or installed them.   Does it drive straight? Do you have strange tire wear? Otherwise I wouldn't worry about the camber being a little off.  If it's way off camber, a bolt won't help and there's something bent."
mercedes_benz,3doyte,illohnoise,1 point,Sat Jul 18 04:45:14 2015 UTC,Drives straight if I pull the steering wheel to the left a bit(due to alignment done by local shop). If I have them align it to where the steering wheel will stay dead center then the vehicle will start pulling right. I was told to get the bolts from the dealer but I was hoping to pick up the bolts for like 50% of what the dealer would mostly charge them for and have it done at my local shop.
mercedes_benz,3doyte,Ganker907,1 point,Sat Jul 18 08:14:52 2015 UTC,"Get an alignment done and see how far out it is. The kits only fix about 30 minutes of angle. But if you are questioning it, an alignment check never hurts."
mercedes_benz,3doyte,Ganker907,1 point,Sat Jul 18 05:30:32 2015 UTC,I've gotten alignments done several times since then and the shop was able to align it but in order for me to drive straight I would have to pull the steering wheel to the left.
mercedes_benz,3doyte,SamTheSammich,1 point,Sat Jul 18 08:12:38 2015 UTC,"I don't know the area you live in but sometimes the crown of the road can be pretty noticeable. If the steering wheel seems to always be pulling the the left, let the guys that did the alignment know. They should be able to double check their work and if it was done recently they i don't see why it wouldn't be free.  Also, if the technician sees that it is still dead-on, he can sometimes adjust the steering a bit to make up for the crowned roads. It all depends on works on your car."
mercedes_benz,3dikrj,schmeth,5,Thu Jul 16 15:45:15 2015 UTC,It looks good. Keep in mind that the back has stickers covering the lights.
mercedes_benz,3dikrj,BumWarrior69,2,Fri Jul 17 12:32:05 2015 UTC,Oh my fucking god... I want one so bad
mercedes_benz,3dikrj,KillerCh33z,2,Fri Jul 17 22:27:28 2015 UTC,I think it's beautiful.
mercedes_benz,3dikrj,Tnargkiller,1 point,Wed Jul 22 02:41:37 2015 UTC,"Ugh, just no."
mercedes_benz,3dikrj,trav110,1 point,Thu Jul 16 23:22:34 2015 UTC,Why don't you like it?
mercedes_benz,3dikrj,Tnargkiller,1 point,Wed Jul 22 02:41:52 2015 UTC,"seriously, my thoughts exactly, wtf is this"
mercedes_benz,3de7yn,IntercityLines,2,Wed Jul 15 16:08:22 2015 UTC,"I've hauled a couple of these.  Have a similar trailer to this, but work for a different company.  One was from an auction in Scottsdale (not Barrett Jackson).  I took it to Cargolux in Atlanta.  They are an all cargo airline that goes between different US airports and Europe.  The car was being shipped back to the Mercedes classic restoration center in Germany to have the engine worked on.  The car looked great but didn't run so great.  Another one I picked up at an auction in Dallas last year and took back to the company who was trying to sell it who was based in Southern California.    They are not that bad to load, even with the gullwing doors as they really aren't all that wide in comparison to modern cars.  You can actually drive it with the door open (up?) on to the trailer, which is good because the windows don't really roll down, they just kinda flip open a little bit."
mercedes_benz,3de7yn,ChuckinTucson,1 point,Thu Jul 16 04:47:29 2015 UTC,Nifty
mercedes_benz,3da7az,MB280C,1 point,Tue Jul 14 18:27:34 2015 UTC,Wow. I knew about the later C class coupes but I didn't know they had them in 123 chassis.
mercedes_benz,3da7az,McBEAST,1 point,Wed Jul 15 01:48:33 2015 UTC,"Of course MB had these in the market :-) See wiki for details.. https://en.wikipedia.org/wiki/Mercedes-Benz_W123#Model_history  If you see more pics of my coupe, watch this.. http://mb280c.de/uwes-280c/uwes-280c-bilder-exterieur/#"
mercedes_benz,3d8izl,lp608,4,Tue Jul 14 09:49:20 2015 UTC,It's a great time to buy. It's purported to be one of the best cars they've built in a long time.   The last year of any car is typically the best. All bugs have been worked out and they will likely cut you a deal to make room for the new model.
mercedes_benz,3d8izl,minibudd,1 point,Tue Jul 14 12:03:23 2015 UTC,"I agree. My wife has it (2014) and I think its an amazing vehicle, solid as a tank, comfortable, not made to be a sports car but still fun to drive (in sport mode). I would buy a second one to put in storage just in case something happens to this one, if we had the money haha. Tons of power (which the GLC won’t have) but we still get about 22 mpg with fairly aggressive driving, gas-wise. I definitely prefer it to the newer GLC thats coming out, at least based on the photos and the specs. Had it for about two years now - zero problems or complaints. I’m glad we went with this over the Q5."
mercedes_benz,3d8izl,this_neverhappened,2,Mon Jul 20 22:01:31 2015 UTC,"I would wait. I just purchased the ML350's upgrade, the GLE350. The newer models that are coming out aren't a new car per say, but renamed and with more aesthetic upgrades so they won't have all the quirks of a newly designed vehicle(like the TLX for example). The internals are pretty much the same and some may be getting a new transmission but I believe that is only for the AMG lines. Mercedes seems to be upping their game with the newer models to compete with BMW and try to take the market. If you're not rushing for a new car, wait a month for the new line to come out and make a decision. If anything, the GLK350 will be cheaper."
