mercedes_benz,3ba248,BrainJar,6,Sat Jun 27 05:41:15 2015 UTC,Why? Looks good to me.
mercedes_benz,3ba248,Vanquish96,1 point,Sat Jun 27 09:12:57 2015 UTC,I think some purists would have a problem with it.  I'm on your side though.  I think it's a cool set of cars.
mercedes_benz,3ba248,p0werslav3,3,Sat Jun 27 15:30:46 2015 UTC,"It reminds me of a VW Golf, maybe they're trying to get away from ""only old people drive a Mercedes""?"
mercedes_benz,3ba248,Oddi,2,Sat Jun 27 23:43:41 2015 UTC,I'd look at one if I was in the market for a new car.
mercedes_benz,3ba248,Neon_Orange_,2,Sat Jun 27 16:55:19 2015 UTC,Some press photos from the refresh.
mercedes_benz,3ba248,Oddi,1 point,Mon Jun 29 19:37:29 2015 UTC,Sweet!
mercedes_benz,3ba248,Aventil,1 point,Mon Jun 29 19:43:32 2015 UTC,Not available in the US I assume?
mercedes_benz,3ba248,typewritertrew,2,Sat Jun 27 14:21:06 2015 UTC,"It's not sold in the US. The coupe (CLA) and SUV/crossover (GLA) variants are available, but not the normal A-class hatch."
mercedes_benz,3b39zg,PeteFord,6,Thu Jun 25 16:48:46 2015 UTC,"if you're in seattle, there's a benz shop in bellevue of bel-red called ""mercedes centrum"" - ask for Russell - he can help you with literally anything benz-related, including finding and inspecting cars. Not 100% sure how familiar he is with diesels but he probably has the info you're looking for."
mercedes_benz,3b39zg,Chippy569,4,Thu Jun 25 19:28:30 2015 UTC,Because every one else answered your questions ill just interject. They are the holy grail of turbo diesels and will spoil you with they're unbelievable build quality and reliability. Plus they look fucking great in wagon form in my opinion.
mercedes_benz,3b39zg,satin_rules,2,Thu Jun 25 20:31:09 2015 UTC,"I'm partial to the coupe myself, but I think I'll get a sedan.  The GF is gonna have the wagon."
mercedes_benz,3b39zg,satin_rules,3,Thu Jun 25 21:02:38 2015 UTC,"Opt for a turbo, the n/a's really are unbelievably underpowered especially in metropolitan ares."
mercedes_benz,3b39zg,elementboarder,3,Fri Jun 26 13:50:38 2015 UTC,"Not a mechanic, might not be much help but:  1) Don't know  2) They came with 2 different turbos i think, a Garrett turbo and another one, www.superturbodiesel.com might be of help here  3) I think 85*  4) The 240 and 300 are massively under powered. I owned a 300 and a 300 turbo and the 300 was so slow that it was almost unsafe to drive (at least in southern CA, where people tend to drive quite fast). I'm not sure of exact hp / torque numbers but you can google those. From a practical standpoint, you should only really buy a 240/300 if you want the 4 speed manual.  5) If I still owned one, i would be keeping it forever"
mercedes_benz,3b39zg,ChuckinTucson,6,Thu Jun 25 17:49:00 2015 UTC,"I had a 300D non turbo and OMG, 0-60 in 2-1/2 days."
mercedes_benz,3b39zg,elementboarder,2,Fri Jun 26 00:42:41 2015 UTC,haha yep. gotta make an appointment to merge onto the freeway.
mercedes_benz,3b39zg,ChuckinTucson,2,Fri Jun 26 02:12:01 2015 UTC,"Haven't heard that expression before.  If you don't mind, I think I'll borrow it from time to time.  It's a good one!"
mercedes_benz,3b39zg,elementboarder,1 point,Fri Jun 26 16:13:28 2015 UTC,"Haha, I read it on the benzworld forums a few years ago and it stuck with me. great way to describe the speed of those old non turbo diesels"
mercedes_benz,3b39zg,ChuckinTucson,1 point,Fri Jun 26 19:09:41 2015 UTC,I've owned a couple of them . . . a 300D non-turbo and a 190D non-turbo (at least it was the 5 cylinder not the 4).  Definitely leisurely.
mercedes_benz,3b39zg,rick_barrs,3,Fri Jun 26 22:42:45 2015 UTC,"I can help answer a few of those questions.  2)  There was a Garrett and a KKK turbo.  The Garrett seems to be far more prevalent than the KKK, and there's parts/rebuild kits available.  I know nothing about the KKK turbo.  Unsure of performance gains, but the turbo is a standard T3 flange so if you can bolt it up, it should work.  I've heard of people using VNT setups with success (A guy I know is using the VNT turbo setup from the diesel motor found in the Jeep Liberty - I want to say it's a GT28 frame but not 100% sure) but I'm not familiar with how they control the vanes.  Edit:  The KKK turbo is a ""K26"", still uses a standard T3 flange.  The Garrett is something like a 45 trim.  4)  The 300 turbo is not fast but has adequate power - that being said I couldn't imagine how scary merging into freeway traffic with a 240 or non turbo 300 would be.  5)  Yes/Yes, I would consider selling my car to the right person."
mercedes_benz,3b39zg,Chucky332,2,Thu Jun 25 18:09:02 2015 UTC,I have a '78 manual 300D non turbo with a European spec injection pump and it's actually pretty nippy for an old diesel... I bet it could take a Honda of similar year
mercedes_benz,3b39zg,rick_barrs,1 point,Thu Jun 25 23:02:26 2015 UTC,"Manual or auto?   My only other diesel ""experience"" is my duramax pickup so I'm ruined/spoiled in the power department."
mercedes_benz,3b39zg,Chucky332,1 point,Thu Jun 25 23:53:23 2015 UTC,Sorry yes it's a five speed manual
mercedes_benz,3b39zg,CineSuppa,3,Thu Jun 25 23:53:58 2015 UTC,"I can't answer these with complete confidence as I haven't rebuilt a 617 block up, but I have had 2. Both N/A, one with a 4-speed and one with an automatic transmission.  A press is required to re-sleeve the block.  There are several OM617A turbo variants, but the factory turbo is a Garrett. You can pick up remanufactured ones for $250 or so. I'm pretty sure it's an early T3. You can also upgrade. There's a handful of KKK turbos that would fit the bill, and with no electronics, there's nothing for the car to get mad at. Except for too much boost... the valves can't take the heat and that engine will likely become toast. There's no upgrade for the oil squirters. On that note, make sure whatever turbo vehicle you find was originally turbo. Slapping a turbo on the N/A 617 is bad news without the upgraded oil squirters of the 617A.  There's 2 versions of the thermostat available. The 80C and the 95C. I believe the latter is for the turbo, but don't hold me to it. Normal operating temp is 175-200F. Under load, 195F is perfectly acceptable.  Power differences: they're all slow. Just varying degrees of slow. 65 hp, 88 hp, 125 hp. Less, due to deterioration. My N/A 617 with auto trans in the W123 coupe was slow as hell. But then again, it had a thrown rod. I had another N/A 617 with a 4-speed manual in a much heavier chassis and it kept up in traffic ok. It also had Monark injectors. Highly recommend them.  The 300 Turbo's 617A is really the best way to go for power. But the N/A 617's get 1 mpg better and are slightly more reliable. But they're all slow.  I don't live near Seattle but you probably shouldn't be getting a car from up there anyway. Come down to SoCal. We have tons of old Merc diesels for sale (albeit at a premium), but the dry conditions mean many of them are survivors. Some in very, very good condition.  Best of luck."
mercedes_benz,3b39zg,BillNyesEyeGuy,3,Thu Jun 25 18:25:01 2015 UTC,"I think most of you questions have been answered, but I thought I'd share my experience as a w123 owners because I love the old girl so much. Maybe I can help convince you to get one. I've owned a lot of cars over years,  60's muscle, classic Japanese,  European. Some really unique and rare gems, but hands down my 123 is my favorite. I don't really know why exactly, it's kind of counterintuitive, she's loud, slow, and kind of ugly(just like my wife heeyo).  But it's really just a pleasure to drive, it rides great, handles excellent, very comfortable and great for highway cruising.    I spent quite a long time looking for mine. I did some research on what to look for, and just patiently waited for the right one. I looked at probably fifteen before finally purchasing an 84 turbo, from a little old lady who'd taken excellent care of it had it regularly serviced at a dealership, she was the 2nd owner but had kept receipt since the car was new. It has 427000km on it ATM, and still going strong. I don't drive it tons, I've put maybe 6-8000 a year on it though, and I've had exactly zero issue with it. Everything except the sunroof works perfectly. The only major repairs since new were a trans and a head rebuild at 375k. Obviously experiences may vary but if you get a well maintained example it will give you years of faithful service. They really are every bit as good as you've probably heard.  Edit: Also I live near Seattle but I'm not selling it ha! Seriously though there's lots available, do it."
mercedes_benz,3b39zg,Boot_Shrew,1 point,Thu Jun 25 21:37:37 2015 UTC,Am I the only one running around ~3000 rpms at 70mph?
mercedes_benz,3b39zg,Covell007,1 point,Mon Jun 29 22:50:03 2015 UTC,3k @ 65 for me
mercedes_benz,3b39zg,superhurt98,1 point,Sun Jul 12 15:46:52 2015 UTC,"Your a diesel tech and your asking about sleeving the block and turbo improvements...Are you planning on modifying the motor and getting real power from it? It takes crazy engineering to get enough airflow through this thing as it is being a uniflow head. I highly recommend an OM603 car, much more like a modern diesel and if your going to rebuild one you may as well find a wasted om603. OM603 is a strong motor as it is but it can support up to 500hp on stock internals. The OM60x motors are the best they ever made if you get a revised head and do the other small revisions (newer style con rod bolts, updated vac pump and a few other stupid things). You can also fit a MLS gasket on a 603. Much easier to work on, AC compressors that don't suck, serpentine belt, self adjusting valves, 80 amp stock alternator and another cylinder. Fyi, the pumps have to be sent to finland for more fuel and it costs like 2 grand. Nobody in USA has a bosch flow rate test bench for these old M pumps"
mercedes_benz,3b59as,dreamerkid001,5,Fri Jun 26 02:06:41 2015 UTC,"Hey bro, Mercedes Guy here... What you want to do is hit the left or right arrow on your multi-functional steering-wheel. (The arrows on the left side of the wheel). Find your driver-assistance features (lan tracking, blind-spot assist, etc will be in the same menu, I believe). You will see Distronic Plus in the menu. When you select it, it will give you the option to ""enable"" or ""disable"" it. You got it from here... Happy motoring! ;)"
mercedes_benz,3b59as,Lhtfoot,1 point,Fri Jun 26 21:32:22 2015 UTC,Thank you for your help.  Is concerned appreciate it!
mercedes_benz,3b59as,masterdoofus,6,Sat Jun 27 06:56:11 2015 UTC,why?  EDIT: i found this video for you since google is a foreign object you to. here
mercedes_benz,3b59as,xampl9,2,Fri Jun 26 02:41:42 2015 UTC,"I knew all of that already.  My question was speaking more to permanently disabling it.  Also, I posed the question here because I could not find the answer on Google.  Thanks for the attempt at helping, though."
mercedes_benz,3b59as,daneshmend,1 point,Fri Jun 26 08:40:18 2015 UTC,You are unlikely to be able to permanently disable it. MB would want to have it always on for liability reasons.
mercedes_benz,3b59as,MBGLK,1 point,Fri Jun 26 11:28:51 2015 UTC,Disconnect the distronic connector from the sensor. Then take to a Mercedes shop and ask them to disable distronic on star. This will not work on pre 2005
mercedes_benz,3b59as,elmariachi304,0,Fri Jun 26 15:30:36 2015 UTC,"I appreciate the report, whoever did it, as much as I'd like to remove the post, it's not really violating any rules, aside from being a lazy asshole."
mercedes_benz,3b59as,MBGLK,1 point,Fri Jun 26 19:04:53 2015 UTC,"I'm sorry.  I just figured that the best place to ask a question like this would be in the subreddit of the car brand.  I didn't mean to be lazy.  I checked the manual and googled it, but I couldn't find anything.  I was simply looking for help.  Thankfully, I got it from a kind user.  I've asked several questions of this sort in /r/BMW and have never faced any sort of flack for it.  I'll try and remember it the next time that I'm here."
mercedes_benz,3b4us5,Mystery_Log,2,Thu Jun 25 23:59:02 2015 UTC,Why do you want to buy it?
mercedes_benz,3b4us5,chrisbrns,1 point,Fri Jun 26 02:43:01 2015 UTC,My current Benz (96 c220) is on its last leg and the C32 is a beast
mercedes_benz,3b4us5,chrisbrns,1 point,Fri Jun 26 03:09:19 2015 UTC,Cool
mercedes_benz,3b4us5,Just_Is,1 point,Thu Jul 2 12:30:59 2015 UTC,"http://mbworld.org/forums/c32-amg-c55-amg-w203-48/  Lots of info in there. But don't just go in making a new thread expecting people to tell you everything you need to know. You'll have to take time and read through threads.   Also, why not the C55? They appear to be similarly priced."
mercedes_benz,3b4us5,minibudd,1 point,Fri Jun 26 03:57:44 2015 UTC,Gas mileage really
mercedes_benz,3b4us5,Just_Is,1 point,Fri Jun 26 10:02:30 2015 UTC,Driving a C55 like a normal person would get almost the exact same MPG as driving a C32 like a normal person. I've squeezed 26mpg out of a tank in my C43.
mercedes_benz,3b4us5,ndetro,1 point,Fri Jun 26 12:50:36 2015 UTC,"I think you'd be surprised at how minimal the difference is between the 2 in terms of MPGs. I'm a w208 CLK guy, but in our cars the v6 and the v8 (both 4.3 and 5.4) have a mpg difference of maybe 1-2 mpg. Brief search on the c32/55 forum suggests it's the same case for C. Good luck with your search!"
mercedes_benz,3b4us5,Just_Is,2,Fri Jun 26 16:57:24 2015 UTC,Just wanted to say hey. CLK 320 cab here xD
mercedes_benz,3b4us5,ndetro,1 point,Sun Jun 28 20:18:11 2015 UTC,Gotta love 'em. Just finished buttoning up the 5.4 swap on my 2001 coupe today. waiting on the battery to charge right now and see if it will finally turn over!
mercedes_benz,3b26al,lucky0225,1 point,Thu Jun 25 10:53:11 2015 UTC,Ehhh I'll keep my R171 :P
mercedes_benz,3b26al,Traxxas119,1 point,Thu Jun 25 23:36:03 2015 UTC,There are only a select few cars in the world that I want more than this one. Long live the R170!
mercedes_benz,3b31g2,MBGLK,1 point,Thu Jun 25 15:46:48 2015 UTC,Other than if its covered under warranty what are you wanting to know?
mercedes_benz,3b31g2,tiny2ner,1 point,Thu Jun 25 22:04:50 2015 UTC,Not entirely sure to be honest
mercedes_benz,3b31g2,xampl9,1 point,Thu Jun 25 22:14:16 2015 UTC,"No experience with the ML550, but I've had other vehicles with air suspension.  Your symptoms indicate a leak.  The compressor ran a long time trying to refill the air bags and overheated.  The bumpy ride is because you're riding on the stops, not the air bags.  Your mechanic can find the leak with some soapy water.  A new bag should be in the $200 range (parts cost). Labor will be steep, as much of the suspension will have to be taken apart."
mercedes_benz,3b31g2,tiny2ner,1 point,Thu Jun 25 23:42:17 2015 UTC,Well depending on the model. The 164 and 166s are only a couple hours do do both sides. The bags are expensive. Like 800. For the rear. I dont remember labor or parts if its a front though. Also I just plain havent had to do this on a 163 model though so I cant say but I do know that they are pretty labor intensive..
mercedes_benz,3b31g2,xampl9,1 point,Fri Jun 26 22:45:24 2015 UTC,"The bags are expensive. Like 800.   That's 3 times the price of a bag for a 38,000 pound motor coach."
mercedes_benz,3b31g2,g0ldenb0y,1 point,Sat Jun 27 01:02:06 2015 UTC,Less expensive fix if you purchase it from Arnott: https://www.arnottindustries.com/part_MERCEDES-BENZ_yid18.html
mercedes_benz,3asmke,kingvalant,3,Tue Jun 23 04:34:04 2015 UTC,http://mbworld.org/forums/gl-class-x164/563587-gl350-got-good-deal-extended-warranty.html  Maybe an Extended Warranty would be the way to go? I don't know about the GL's as I don't have one but at 40k a year you might be better to drive it into the ground for the next 2/3 years as it seems like you have taken the hit already on the depreciation.
mercedes_benz,3asmke,beefstockcube,1 point,Tue Jun 23 07:40:18 2015 UTC,From a purely financial perspective you're almost always better driving something until it explodes.  Edmund's has some TCO calculators that will answer this.  It's especially the case if you have to take a loan for something.  At least drive it and put away what you can afford to every month until you can pay cash for what you want.  Earn interest.  Don't pay it.
mercedes_benz,3asmke,RoboErectus,1 point,Tue Jun 23 12:21:39 2015 UTC,you act like 200k km's is a lot
mercedes_benz,3asmke,MBGLK,1 point,Tue Jun 23 12:53:27 2015 UTC,"200ks is not a lot for a Merc, but for most that have passed that mark and are still going because the driver has replaced things that go like alternators, pumps, bushings, radiators..EG $$$$$$ Don't think your car is special and wont need anything done.  They keep going, but you WILL have to replace things as they wear out/perish."
mercedes_benz,3arlvf,trippinpotato,2,Mon Jun 22 23:09:17 2015 UTC,SL65 BS are selling for between $160k and $200 USD - depending on mileage and condition.
mercedes_benz,3arlvf,laguys,1 point,Tue Jun 23 00:30:35 2015 UTC,"I've seen the special edition packages from Brabus go for $300,000. I remember seeing an enthusiast on Instagram post a photo of the specs on his order for an S coupe 850 and the price at the bottom was over 1.2 million emirati dollars.   The S class would cost a lot on its own, but the Brabus modification would cost just as much without the stock car! I bet the SL65 black would be way cheaper. I can't tell you how much they have depreciated, but they are quite rare still.   However, Brabus as a customization specialist can do projects for much cheaper. It depends on the features. Their flagship models like the 850 are always fully customized but I've seen several Brabus without much extra customization."
mercedes_benz,3arlvf,laguys,1 point,Mon Jun 22 23:58:48 2015 UTC,"Would I just email an authorized Brabus distributor like 3WD, or in Canada SR, Pfaff, Toyz Auto Art in Quebec, etc. and ask them how much a light-tune modification (or full-blown flagship mod) cost?"
mercedes_benz,3arlvf,laguys,1 point,Tue Jun 23 01:19:38 2015 UTC,Yes. I've reached out to them before regarding my brother's G wagon and they were very professional and kind. We didn't end up doing anything but it was nice to have a pleasant experience. They aren't stuck up or anything like that.
mercedes_benz,3arlvf,bawse1,1 point,Tue Jun 23 01:42:42 2015 UTC,I will mention that I don't have the money at the moment. But it would be interesting to dream and find out how much the cost would be.  Would the distributors be upset since I'm not looking to buy right now?
mercedes_benz,3aog48,mixedop,16,Mon Jun 22 04:50:27 2015 UTC,Lol I can never understand why people feel the need to switch the badges on their Mercedes. It's already a nice car to begin with regardless of the class.   The worst are fake AMGs. I see them all the time!
mercedes_benz,3aog48,laguys,6,Mon Jun 22 07:07:06 2015 UTC,Fake AMGs give me cancer
mercedes_benz,3aog48,Hoffmeisterfan,6,Mon Jun 22 14:25:34 2015 UTC,"In LA there are a lot of real AMGs with all the right badges and body kits and other obvious signatures of a real AMG. But still, I'll spot a different C250 ""AMG"" or S550 ""AMG"" every other day it seems. The worst is when someone will drop the third digit, so you see a 2015 S55 ""AMG"" with two extra exhaust pipes that don't connect to anything under the car. That's someone who seriously put in a good amount of effort to fake his already expensive S class. There are real AMG models, brand new and fully optioned up, that are worth less than an S550! (Like my edition 507 C63 for god's sake!) I wonder how these people rationalize their actions. They're undermining the intrinsic value and rarity of real AMGs everywhere!  The new badge style that MB is going with for newer models of AMGs like the w205 C63s, with AMG on the left side, will hopefully make it more difficult for people to fake.   ^ At least I thought that until I saw a w204 with the a fake AMG badge on the left side and a fake C63 badge on the right.... with an S class ""S"" next to the 63. I had to pull over and take pictures. I should upload them to this site. It makes me sick haha!"
mercedes_benz,3aog48,laguys,1 point,Mon Jun 22 16:51:05 2015 UTC,"Ooooh you have the 507 Edition?   That's actually my dream car right about now.   I do agree with you though, the fake C230 AMG's and so on that I see every day are ridiculous like you're not fooling anyone and there is no need to parade your car as something it's not."
mercedes_benz,3aog48,CrazyOdder,2,Sat Jun 27 22:55:46 2015 UTC,Then you get things like this..
mercedes_benz,3aog48,LeFunkwagen,2,Mon Jun 22 11:55:33 2015 UTC,"What about license plate frames that say AMG? I've seen a few of those. (Also seen a few BMWs with ///M license plate frames.) The badges are still stock, though."
mercedes_benz,3aog48,PM_ME_YOUR_WATERMELO,2,Tue Jun 23 01:51:45 2015 UTC,That's not too bad in my opinion. It's small and insignificant enough for me to let it slide.
mercedes_benz,3aog48,laguys,2,Tue Jun 23 02:43:52 2015 UTC,"If it's an OEM part it's not ""fake"".  Case in point, the 18"" wheels on my C class say AMG on them, but they come that way from the factory. There's no other AMG badge anywhere on my car."
mercedes_benz,3aog48,elmariachi304,2,Sat Jun 27 14:25:13 2015 UTC,"That's whatever. Nobody is gonna think that your car is an AMG because of the license plate, I feel like that just shows they're somewhat of an enthusiast."
mercedes_benz,3aog48,StoleAGoodUsername,3,Fri Jun 26 13:00:08 2015 UTC,man this fuck shit would happen in atlanta too lol
mercedes_benz,3aog48,GeneralButtNekid,2,Mon Jun 22 18:55:30 2015 UTC,Every time someone puts a fake AMG badge on their non-AMG Mercedes God kicks a puppy.
mercedes_benz,3aog48,ChuckinTucson,1 point,Tue Jun 23 00:27:46 2015 UTC,"someone in my neighborhood drives a ""GLK550 AMG"" and his license plate reads ""EX-SPOOK""  I don't know which one I believe less."
mercedes_benz,3aog48,minibudd,1 point,Mon Jun 22 20:43:56 2015 UTC,"Jesus I can't stand this shit. While shopping for a used W204 I found one which checks all the boxes for me.  Test drove it, got the bank loan, etc. everything seems great. Then stepped out to take some pic of the car I'm about to sign up for and saw a goddamn CLS300 badge.  Then I start thinking how previous owner probably wasn't a mentally stable person and start to imagine what else has been molested with the car. The stupid poor taste rattled all parts of my cage and I made it a point to just throw my hands up and walk away. Picked up a clean C300 from another dealer some days later. Fuck your CLS300."
mercedes_benz,3aog48,Borealis116,1 point,Sun Jun 28 07:32:27 2015 UTC,"I have a glk 350, and I spotted one with a crooked amg badge, I asked the dude about it, he said it came with it from the factory... I looked him in the eye and shook my head."
mercedes_benz,3anebz,six60six,10,Sun Jun 21 22:46:10 2015 UTC,"My 2013 C63 was called up on the lease ""pull forward"" program so I decided to see what the dealer had in stock.  Knowing that the new C400/450/63 were not available yet, I had little interest in a new W205 and after driving a C300 that was confirmed.  The new chassis just isn't as good as the old one IMO and the turbo I4 didn't really seem lively.  Then I decided to drive a E400, which again is the old chassis until 2017 and is a great car, but the lease payments were a little much for what is known to be a end-of-life platform and I feel like I see a TON of E350's around Chicago, so again it wasn't really doing it for me.  Then I spotted a 2015 CLA45 sitting in the corner next to a new AMG GT and decided to have a peak at it.  I will be the first to admit that I am not a fan of the CLA body styling and up to this point have only seen CLA250's on the road, which at their base trim just don't do it for me.  After talking to my salesman a little, I asked him to pull it out of the showroom so I could take it for a spin, which I felt bad for doing since they had to move the GT to get the CLA out.  After about a half hour or so of them jockeying cars around, it was sitting out front and he came up and handed me the keys and told me it was mine to take out without him and to please just not break it.  ""Break it?"" I thought, I own a C63, a car that will try to kill you when you simply poke it with a stick, how could this little CLA be any different? Wow was I in for a surprise.  Upon getting in I realized a few things, its small, its tight and the Recaro's just grab you.  The rear window is tiny and the rear view mirror is even smaller, the doors are super high compared to the W204 and the whole thing just seems to wrap around you.  I put it in manual mode, turned off the stability control and eased it out of the dealership parking lot.  Turning into traffic and not even giving it much pedal, it started snarling, popping and burping with every gear shift and I had to catch myself with the speed climbing way quicker than I thought the little I4 could manage.  Ok I thought, this thing is kind of fun, kind of like an angry rodent trapped in a cage just waiting for you to open the door.  It's not going to kill you, but you may get hurt.  Handling is crisp as expected, gear changes from the new double clutch are still a little sluggish but better than the old wet clutch system.  Overall it just feels like a fun car that you can use to it's full potential, which with my C63 was a recipe for disaster or bald tires every couple thousand miles.  So after a 20 minute test drive, I was sold and ended up taking a step down the AMG ladder, but a step into a car that should be fun for the next 2 years none the less.  TL/DR: Traded in my C63 for a CLA45 despite hating the body styling and also the AMG I4 Turbo is a crazy piece of engineering that makes hilarious sounds no matter how you drive it."
