mercedes_benz,39vqgt,forrestandfuzzz,2,Mon Jun 15 22:13:22 2015 UTC,"The older guy I bought it from was the original owner, I guess he brought it over from Germany to Canada in the 90's. The plate is original to the car I think"
mercedes_benz,39vqgt,superhurt98,1 point,Mon Jun 15 22:25:33 2015 UTC,Royal blue 300D was my first car! It will forever be my favorite!
mercedes_benz,39vqgt,cbg79,1 point,Mon Jun 15 15:37:28 2015 UTC,Sweet! I love the color.
mercedes_benz,39vqgt,Sheree000,1 point,Mon Jun 15 17:20:41 2015 UTC,i had a silver blue w123 as my first car! love the 124
mercedes_benz,39vqgt,ImportantPotato,1 point,Mon Jun 15 18:30:06 2015 UTC,300e? My gramps always drove those and kicked the absolute hell out of them....great cars!
mercedes_benz,39vqgt,ChuckinTucson,1 point,Mon Jun 15 18:32:35 2015 UTC,This model can last forever
mercedes_benz,39vqgt,StoleAGoodUsername,1 point,Fri Jun 19 17:07:37 2015 UTC,"I believe it will, 345,000 km with full service history"
mercedes_benz,39vqgt,rawrkex,1 point,Fri Jun 19 18:40:48 2015 UTC,that's nothing
mercedes_benz,39ybwe,SkarTisu,4,Mon Jun 15 20:03:57 2015 UTC,"Various electrical issues are common with this car. Rust will be a problem. Models around this time (W203, W210, and W220) had rust issues on wheel arches and doors.   Airmatic is great when it works, car will be undrivable if it fails completely.   Instrument cluster screen can fade when the car is hot."
mercedes_benz,39ybwe,deutsch-technik,3,Tue Jun 16 00:36:38 2015 UTC,I've had several w220's and they all had their own problems. Airmatic wad a common theme of not working. One of them had an electrical problem with the sound system where the speakers in the back didn't work; mercedes told me to replace the entire sound system if I wanted it to work.   Probably the worst cars I've ever owned.
mercedes_benz,39ybwe,TILalot,2,Tue Jun 16 13:46:39 2015 UTC,"I'm in the market for a W220 as well, so I'm curious about this topic."
mercedes_benz,39ybwe,longhornjeeplover,2,Tue Jun 16 04:23:02 2015 UTC,"I have a 2004 S500 that I've owned since about 2007 and it's my daily driver.  The airmatic issue mentioned is 100% true, the compressors will go out and will be expensive.  I've also experienced some of the electrical gremlins that are commonly mentioned -- things like various relays and switches that have needed replacing and are invariably about $800 each time.  Also minor electrical problems that I've just learned to live with -- for example one rear window won't express-up (even after resetting it with the suggested procedure) once out of every 4-5 times, the COMMAND system rebooting for no reason once in a while, rain sensing wipers ""freeze"" once in a while, etc.  Each single problem doesn't really happen often enough to pose a big problem and doesn't seem to be getting worse, so it's hard to justify the thousands of dollars it would take to fix them all.  I haven't heard of, nor have I experienced any water drain/clog problem.  On the plus side, the 500 engine is basically bulletproof provided the oil seal issue is addressed (and almost certainly would have been under warranty years ago by the original owner).  The interior trim and fit is fantastic.  I've had very little wear on the leather and trim pieces and they still look great.  No rattles or creaks or general ""old car sounds"" have ever developed.  I like the W220 styling and think it is aging gracefully.  It was such a radical departure from the W140 that it still seems modern (even if it won't pass for a W222) and has neat touches like the kinda-avant-garde-looking triangular, striped taillights that stand out."
mercedes_benz,39ybwe,andreirublev,2,Tue Jun 16 16:20:26 2015 UTC,"Looks like there's one compressor for the entire car. It also looks like a 15 minute/$350 replacement. To me, that's not bad at all.  I see the struts can be around $2000 for the whole car, which is in line with what I would expect. I have to wonder how durable the lines and fittings are between the compressor and the struts.  Which oil seal is the one that commonly fails?  I drove a 2005 S500 4Matic with 75k miles on it last year and it felt fantastic. It's probably for the best that I couldn't purchase it at the time. lol  I'm also a big fan of the styling, inside and out. Great proportions, excellent restraint and the interior is very comfortable and attractive. Thanks for the insight!"
mercedes_benz,39ybwe,andreirublev,2,Tue Jun 16 18:14:56 2015 UTC,"If I recall, in my case what happened was the strut's failures caused the compressor to burn up while it tried and failed to maintain pressure and I had to replace both front struts plus the compressor.  One other thing while on the topic of suspensions, it seems like I run through various wear parts at a really accelerated rate.  Stuff like bushings, ball joints, the occasional control arm.  Don't remember which seal, but it was early-on and while still under warranty.  I remember the service advisor saying there was a bulletin out on that issue and they pretty much just replaced it for every 500 engine that came in for anything whether a leak was present or not."
mercedes_benz,39ybwe,bsclifton,2,Tue Jun 16 18:25:29 2015 UTC,"I had a 2006 S430 for just over 3 years and it was a great car :) The Airmatic will likely go bad, at least in the front struts, near 100,000 miles. I got replacements from Arnott and replaced them myself at a cost of ~ $1300ish (and on top of that, you get a rebate of $75 per strut if you return the bad ones)  I never had any electrical problems. It was a solid car. Only thing I can think of that sucks was the motor for the rear sun shade broke. I looked up the part in EPC and got it fixed for under $200.  The soft close can go bad and is expensive to fix... But it's optional. And if you get a 4matic or non-AMG body kit, you'll be able to rotate the tires which is great.  The earlier years have more issues, but I'd highly recommend a 2005 or 2006"
mercedes_benz,39ybwe,ChuckinTucson,2,Wed Jun 17 03:04:03 2015 UTC,"I've owned probably a dozen or so Mercedes.  The '02 S500 I had was the most costly in terms of repairs.  If it wasn't the Airmatic, it was a check engine light, the passenger seat quit working, the plastic storage bins under the seats completely fell apart, several batteries, etc., etc.  But the #1 thing is the Airmatic."
mercedes_benz,39ybwe,BassPlayaYo,2,Fri Jun 19 03:34:18 2015 UTC,"I have a 2004 S430, great car for the person that knows how to fix things.  The Airmatic isn't as big a deal as some have mentioned.  If the compressor goes it's about $300 and easy to install.  If the front shocks go, they are 400-500 a piece and easy to install.  Water drain clogging?  You do need to stay on top the up keep of the car which means cleaning out leaves that may potentially block the drains."
mercedes_benz,39xqra,hfkarma,2,Mon Jun 15 17:36:14 2015 UTC,"I have this and I love it. I can't promise you'll be as lucky as me, but as long as it's had regular maintenance and you keep up on it, it'll last a good while. If you get it, it'll do you good to keep a couple inline pre-filters in your trunk, they tend to clog at random intervals, but at a couple bucks a pop, it doesn't make a difference. It's a diesel after all.  Do you mind if I ask the asking price?"
mercedes_benz,39xqra,mister_bmwilliams,3,Mon Jun 15 22:18:32 2015 UTC,He's asking $600 OBO
mercedes_benz,39xqra,mister_bmwilliams,3,Tue Jun 16 04:04:03 2015 UTC,"Holy shit, I paid 1700 for mine. I'd definitely get it inspected, very thoroughly. At that price, there's probably something wrong with it, it's worth way more.   Or he's dumb, idk."
mercedes_benz,39xqra,JessieAMorris,1 point,Tue Jun 16 09:53:18 2015 UTC,At that price I would offer $500 and see if I could get it for cheaper. $600 is still a pretty good deal though. Get it checked out by a mechanic first.
mercedes_benz,39xqra,elementboarder,1 point,Tue Jun 16 05:00:30 2015 UTC,"its worth 600 for scrap / parts, if you can buy a running drivable w123 for $600 you should do it.  hell if youre in so cal and you don't want to buy it, i will."
mercedes_benz,39xqra,Covell007,2,Thu Jun 18 07:02:28 2015 UTC,What filters are you using? I want to replace mine but I'm not sure what to use
mercedes_benz,39xqra,mister_bmwilliams,1 point,Mon Jun 15 23:29:31 2015 UTC,Bosch is always really good
mercedes_benz,39xqra,JessieAMorris,1 point,Mon Jun 15 23:43:59 2015 UTC,I use Wixx and I am very happy with them. Better filtering than OEM and cheaper to boot!
mercedes_benz,39xqra,Covell007,1 point,Tue Jun 16 05:55:59 2015 UTC,Does size matter?
mercedes_benz,39xqra,JessieAMorris,2,Tue Jun 16 14:53:16 2015 UTC,"Some, but for the most part it's about filtering particle size efficiency. I seem to recall (don't quote me on this) that OEM will get 90% of 50 micron particles, Wixx gets 90% of 6 micron particles. Something like that."
mercedes_benz,39xqra,carbonite_duckface,2,Tue Jun 16 16:59:16 2015 UTC,"Shit man, I just paid $4000 Australian for one of these. Then again I have Certs 1 and 2 in Automotive plus I own a 1977 240 Diesel too so this chef knows his way around the kitchen."
mercedes_benz,39vn7n,Skidoo23,3,Mon Jun 15 04:16:38 2015 UTC,Badass! Enjoy swimming in a sea of babes!
mercedes_benz,39vn7n,cbg79,3,Mon Jun 15 18:33:25 2015 UTC,I can hope.
mercedes_benz,39vn7n,wavecrasher59,1 point,Mon Jun 15 20:52:17 2015 UTC,"I have a good job for my age and the deal I found was amazing, came with a bumper to bumper 50,000 warrenty."
mercedes_benz,39vn7n,wavecrasher59,1 point,Mon Jun 15 04:59:41 2015 UTC,"It's a C300 sport 4matic, tan interior with a panoramic roof. I'm currently about to go into my second year at UC, putting myself through college. It came time I needed a car and I absolutely had to get a Benz."
mercedes_benz,39vn7n,ChuckinTucson,1 point,Mon Jun 15 15:10:05 2015 UTC,Very nice young man! I'm guessing you have a company?
mercedes_benz,39vn7n,JackassPenguinass,1 point,Mon Jun 15 04:18:45 2015 UTC,"Nope no company, good job though."
mercedes_benz,39vn7n,Starving_Kids,1 point,Mon Jun 15 04:40:37 2015 UTC,Well welcome to the MB family!
mercedes_benz,39vn7n,Starving_Kids,1 point,Mon Jun 15 15:10:20 2015 UTC,I wouldn't have it any other way! :)
mercedes_benz,39vn7n,Starving_Kids,3,Mon Jun 15 15:13:15 2015 UTC,"You're starting out right.  I'm old enough to be your grandfather, but my first Mercedes was a 1972 280C that was a college graduation present from my parents.  I've owned over a dozen since and except for a W220 that was a hunk of junk, they've been great cars.  I've had some diesels that refused to die even with 300K miles on them.  I have a '14 C250 now and a '13 ML350 Bluetec.    A word of advice.  Follow the recommended maintenance as if your life depended on it.  Believe me, the life of your car depends on it.  Hopefully you have an owner's manual.  If not, they're available online.  Transmission fluid changes, brake fluid changes, radiator flushes, etc., should all be done when recommended.  Only use Mobil 1 synthetic oil.  The car will tell you when it needs to be serviced and what service is due.  Mercedes uses terms like Service A, Service B, Service C, Service D depending on what type of work needs to be done.  Again, welcome to the Mercedes Benz family.  You made an excellent choice."
mercedes_benz,39vn7n,kliff0rd,1 point,Mon Jun 15 15:55:34 2015 UTC,Thanks! My dad immediately looked at the manual and checked what had to be done next. I need this car to last me though college so I'll be taking good care of it.
mercedes_benz,39vn7n,elmariachi304,1 point,Fri Jun 19 03:43:01 2015 UTC,Congratulations! Great car!
mercedes_benz,39vn7n,Sheree000,1 point,Sat Jun 20 15:35:47 2015 UTC,"Thanks, surreal that I have this car, it was a pipe dream for most my life."
mercedes_benz,39vn7n,SpadoCochi,1 point,Mon Jun 15 09:13:23 2015 UTC,What year/price? Nice car
mercedes_benz,39vzf1,Covell007,1 point,Mon Jun 15 06:27:51 2015 UTC,"My 400e did that, I had to replace the window regulator. As a quick fix I pulled the motor out and just pulled the window up and down by hand until I could replace it."
mercedes_benz,39vzf1,forrestandfuzzz,1 point,Mon Jun 15 15:54:47 2015 UTC,"the window in my C350 used to get to the top and then come down and open a bit, it was because the window tint  I had was covering some sensor."
mercedes_benz,39s4lt,i_am_stig,3,Sun Jun 14 05:43:07 2015 UTC,"Hello, Charlotte!  Enjoy your new owner."
mercedes_benz,39s4lt,ChuckinTucson,4,Sun Jun 14 15:22:08 2015 UTC,"Charlotte is a 2006 ML 350, and my proper ""first"" car. She may be a bit older in age but she only has 80,000 km. I'm looking forward to the adventures we'll have together!"
mercedes_benz,39s4lt,petroskrn,2,Sun Jun 14 05:46:04 2015 UTC,Looking good!! how much did you pay for it?
mercedes_benz,39s4lt,raptornation112,3,Sun Jun 14 18:10:45 2015 UTC,About 20K.
mercedes_benz,39q9q6,ClassicLightbulbs,9,Sat Jun 13 18:28:28 2015 UTC,"History: bought in October and virtually nothing worked. Found a mouse nest behind the glove box, master cylinder went on the freeway, got everything working, total cost to be reliably moving + car purchase= 3kUSD"
mercedes_benz,39q9q6,BigGut,3,Sat Jun 13 18:37:37 2015 UTC,that's a good price for fixes and drivin' that classic old school cool benz :D congrats!
mercedes_benz,39q9q6,Snillepopp,5,Sun Jun 14 00:36:24 2015 UTC,Beautiful!
mercedes_benz,39q9q6,buick_speed,3,Sat Jun 13 18:32:52 2015 UTC,Thanks mate. Turns some heads in Detroit!
mercedes_benz,39q9q6,mirrorwebcam,2,Sat Jun 13 18:35:40 2015 UTC,r107 FTW.  I'm very happy for you!  Any future plans for the car?
mercedes_benz,39q9q6,Vesploogie,2,Sat Jun 13 19:40:25 2015 UTC,Just a daily driver for now. Would like to reupholster the back .
mercedes_benz,39q9q6,VeteranKamikaze,1 point,Sun Jun 14 01:40:07 2015 UTC,Are you allowed to install the much prettier European bumpers?
mercedes_benz,39q9q6,VeteranKamikaze,1 point,Sat Jun 13 21:32:45 2015 UTC,"I am allowed, but I don't know how much more money I want to throw at the car. Odometer is locked at 132k. Right now I've got a very nice deal on a very nice car. Don't want to start throwing money at it and have something serious go on me. I think I would sell it if I had to make a $2k repair."
mercedes_benz,39q9q6,VeteranKamikaze,1 point,Tue Jun 16 18:56:01 2015 UTC,"Very nice car, can't beat the 107."
mercedes_benz,39s5go,macchinarossa,21,Sun Jun 14 05:55:31 2015 UTC,No
mercedes_benz,39s5go,cptsamir,10,Sun Jun 14 07:23:39 2015 UTC,"Never did, never will."
mercedes_benz,39s5go,knollexx,5,Sun Jun 14 11:34:26 2015 UTC,"The things that make this 7 series innovative are things that 7 series/S-Class/A8 buyers don't really care about. However, when the Carbon Core structure design makes its way into a 3 series that will be a very challenging car for Mercedes to compete with."
mercedes_benz,39s5go,KR0N0SXx,3,Sun Jun 14 19:18:36 2015 UTC,Not with that ugly trim on the sides it won't.
mercedes_benz,39s5go,polloretardo,2,Sun Jun 14 19:31:27 2015 UTC,"Yeah, people haven't been particularly kind about the styling. I'm not much for those headlights to be honest."
mercedes_benz,39s5go,choguy,2,Mon Jun 15 12:50:57 2015 UTC,NAHHH
mercedes_benz,39s5go,IncandescentParticle,2,Sun Jun 14 21:13:55 2015 UTC,You're asking a community of dedicated Benz owners this question...Is the answer not obvious?
mercedes_benz,39s5go,pillwark,2,Thu Jun 18 15:48:17 2015 UTC,"fragrance, interior ambient lighting, and etc stolen STRAIGHT out of the s class.. anyone else think the steering wheel looks similar too?"
mercedes_benz,39s5go,TheSillyLion,1 point,Tue Jun 16 05:04:39 2015 UTC,The front and dash make it look like an enlarged 3- Series
mercedes_benz,39s5go,SeaBass2712,1 point,Wed Jun 17 07:14:06 2015 UTC,"I don't think so. These features don't really speak to the projected demographic that the 7 series/S class are aimed towards. And even the other improvements, like the interior lighting, the S class has already had. IMO, Mercedes has the S class under lock down while the 3 series probably has an edge on the C class."
mercedes_benz,39s5go,11chaehi,2,Tue Jun 16 23:25:18 2015 UTC,"New C-Class is dominating the 3-Series, in Australia, anyway."
mercedes_benz,39s5go,SeaBass2712,1 point,Wed Jun 17 07:14:36 2015 UTC,"Maybe the w204 c class was being dominated by the 3 series, but the w205 probably has an edge over the 3 series."
mercedes_benz,39msgh,FerrAriel,4,Fri Jun 12 21:12:27 2015 UTC,Great taste. Owning part of a Mercedes dealership isn't a bad look either. I would swap cars every week!
mercedes_benz,39n43e,Chakson,1 point,Fri Jun 12 22:38:53 2015 UTC,"Go to https://www.parts.com/index.cfm?fuseaction=store.home and start comparing the OEM part numbers, or you can call a local dealership and ask the part department."
mercedes_benz,39n43e,2StrokeFanatic,1 point,Sat Jun 13 07:20:18 2015 UTC,"Thank you for your answer but i do not know what u exactly mean and there is no windshield to choose when i select my car there is no c220 cdi engine aswell to chose, even if that should not matter.  Thank you."
mercedes_benz,39n43e,2StrokeFanatic,1 point,Sat Jun 13 09:46:50 2015 UTC,"I'm guessing you're based in Europe in that case you'll first need to make sure you know which windscreen you have....with a rain sensor or not, then call your local dealership and get the part number for your car, then call back sometime later and get the part number for the replacement windshield.....then you will know if it fits."
mercedes_benz,39n43e,2StrokeFanatic,1 point,Sat Jun 13 18:27:31 2015 UTC,Im in Bosnia and Herzegovina (europe) and i doubt my local dealerships will do that. I would just like to know if usually the windshield from the facelift fit on the pre-facelift c class. I hope someone knows that :/ the crack is getting bigger and bigger. I have contacted many dealerships and nobody knows :(
mercedes_benz,39nrjo,Kuwago,3,Sat Jun 13 01:56:43 2015 UTC,I can get closer at the year than I can the model. It is early 2000s. Maybe 2003-2005
mercedes_benz,39nrjo,JessieAMorris,3,Sat Jun 13 02:59:22 2015 UTC,W220 S-Class pic  I am 95 % sure.
mercedes_benz,39nrjo,petroskrn,1 point,Sat Jun 13 11:40:02 2015 UTC,Damn that looks huge
mercedes_benz,39nrjo,SpadoCochi,2,Tue Jun 16 14:46:41 2015 UTC,C class? Early 2000
mercedes_benz,39nrjo,satin_rules,2,Sat Jun 13 03:05:18 2015 UTC,2002-2005 C230/C240
mercedes_benz,39nrjo,andyfox1979,2,Sat Jun 13 07:18:05 2015 UTC,Its a 2000-2006 S Class or Possibly CL Class.  C class have different buttons on the steering wheel.  Very hard to differentiate CL vs S class from that angle as the wheels are the same and only the outer cluster cover is slightly different.  It would be a non-V12 (ie 600) as you can't see any upgraded leather trim.
mercedes_benz,39nrjo,mitks07,1 point,Sat Jun 13 12:43:10 2015 UTC,hmm it could be CL too you are right..
mercedes_benz,39nrjo,petroskrn,1 point,Sat Jun 13 16:52:37 2015 UTC,"Yup, likely an S430 or S500... But possibly a CL500"
mercedes_benz,39hnl0,iYoona,5,Thu Jun 11 19:53:01 2015 UTC,"What do you mean in terms of size? Head room, leg room, cargo capacity? Here are some numbers:   M Class Mercedes:  Front Head Room (in.) 38.9  Rear Head Room (in.) 38.5  Front Leg Room (in.) 40.3  Rear Leg Room (in.) 38.4  Front Shoulder Room (in.) 58.5  Rear Shoulder Room (in.) 58.4  Front Hip Room (in.) 60.6  Rear Hip Room (in.) 60.2  Toyota 4 Runner:  Front Head Room (in.) 38.6  Rear Head Room (in.) 38.6  Front Leg Room (in.) 41.7  Rear Leg Room (in.) 32.9  Front Shoulder Room (in.) 57.8  Rear Shoulder Room (in.) 57.8  Front Hip Room (in.) 56.5  Rear Hip Room (in.) 55.7"
mercedes_benz,39hnl0,austex_mike,4,Thu Jun 11 22:11:46 2015 UTC,Probably an M class would be the closest to a 4runner
mercedes_benz,39hnl0,sugeknight,2,Thu Jun 11 20:28:55 2015 UTC,Definitely the m class
mercedes_benz,39hnl0,wavecrasher59,1 point,Thu Jun 11 20:30:21 2015 UTC,ML / GLE (the new name for it )
mercedes_benz,39hnl0,lordtema,1 point,Thu Jun 11 23:40:36 2015 UTC,The GLE is the new crossover version of the M class.
mercedes_benz,39hnl0,WaffleIronMan,1 point,Sun Jun 21 19:35:12 2015 UTC,"GLE is the new name for the ML , GLS for the GL , and G for the Geländerwagen , C and E is going to retain their name , GLK will be GLC and so forth .."
mercedes_benz,39hnl0,lordtema,1 point,Mon Jun 22 04:18:55 2015 UTC,"That is what they originally said, but now they're comign out with a crossover based on the ML, and calling it the GLE. Either that, or they're turn the ML into a crossover."
mercedes_benz,39hnl0,WaffleIronMan,1 point,Mon Jun 22 04:52:04 2015 UTC,"You sure about that ? ive only heard that they are going to rename it, nothing more !"
mercedes_benz,39hnl0,lordtema,1 point,Mon Jun 22 04:54:21 2015 UTC,Do a google image search for Mercedes GLE. It's coming out this fall in Europe.
mercedes_benz,39hnl0,WaffleIronMan,1 point,Mon Jun 22 05:04:25 2015 UTC,"They are going to have two different versions :) , GLE Coupe , which is as you say a crossover like the X4 / X6 from BMW , and then they will have a ""regular"" SUV named just GLE :)"
mercedes_benz,39hnl0,lordtema,1 point,Mon Jun 22 05:09:39 2015 UTC,"Ah, I see. That make sense."
mercedes_benz,39hnl0,WaffleIronMan,1 point,Mon Jun 22 05:12:21 2015 UTC,Just like they got rid of the CL and instead introduced the S class coupe :)
mercedes_benz,39hnl0,lordtema,-5,Mon Jun 22 05:15:31 2015 UTC,iirc they are all pretty small. I'd say just stick to the 4runners if you need an SUV.
mercedes_benz,39hnl0,argilla11,2,Thu Jun 11 20:18:23 2015 UTC,An M class and a 4Runner are almost identically sized.
mercedes_benz,39gevz,doctor-nope,5,Thu Jun 11 15:29:48 2015 UTC,"The E class is significantly better than the C class in my opinion.  I owned an E350 for several years and whenever I would take it in for service, they would give me a C-class loaner car. I regularly drive 250mi round trip for business and many times I took the c-class loaner so I could put miles on another car.  Road noise was similar between the two cars (both pretty quiet), but the comfort and ride in the E class is quite a bit better and the interior (while still a little 'cheap' feeling), is nicer in the E. Steering input, braking, etc. were also all smoother and nicer in the E-class.   This was comparing an '09 E to '13 and '14 C class, so I'm not sure if anything has changed for current model year.  Tires are going to make a HUGE difference in road noise. Some quality tires designed to quiet noise will go a long way."
mercedes_benz,39gevz,2wheels30,2,Thu Jun 11 17:07:20 2015 UTC,"Thanks. To clarify, I'm looking at a 2015 C class or 2013 E class."
mercedes_benz,39gevz,rib-bit,1 point,Thu Jun 11 17:10:49 2015 UTC,I've never driven a recent Camry but I know the two are significantly quieter than any car I've rented.  Not sure if that helps.
mercedes_benz,39gevz,BrainJar,1 point,Thu Jun 11 17:08:59 2015 UTC,"I own the 2015 C300 with a bunch of options, but the option that is most applicable to this question is Airmatic suspension.  In comfort mode with Airmatic active, the car is incredibly quiet and smooth.  /u/2wheels30 is right, in that tires make a fair amount of difference.  The stock tires that I have on my car are very quiet though.    This video has a good representation of the topic, specifically related to the 2015 C300 and the improvements made to lowering noise levels in the car.  The best thing to do is to go to a dealer and drive both cars.  You'll get to hear and feel the difference.  This is exactly what I did, and I was very happy with the new improvements on the C300 2015 model."
mercedes_benz,39gevz,BrainJar,1 point,Thu Jun 11 18:03:42 2015 UTC,Thanks! What kind of car did you drive before the C300?
mercedes_benz,39gevz,2wheels30,1 point,Thu Jun 11 18:54:59 2015 UTC,I still have it! It's a 2008 Honda CR-V and I use it for longer commute days.  It's like a tin can on wheels for cabin noise though.  :)
mercedes_benz,39gevz,iroll20s,1 point,Thu Jun 11 19:07:05 2015 UTC,It should be noted my experience is based on a bare bones C class.  My E was base suspension as well.   Test drives are always the best way.
mercedes_benz,39gevz,SeaBass2712,1 point,Fri Jun 12 00:38:24 2015 UTC,"I have a c350 and its quieter than my acura TL was. If you're  looking for a smooth ride, make sure you drive the luxury models. The sport ones have a substantially stiffer suspension (I have a sport)"
mercedes_benz,39gevz,iroll20s,1 point,Thu Jun 11 20:06:14 2015 UTC,"In comfort mode the suspension is pretty smooth though. Although, I'd imagine the luxury package would make it even more comfortable. No complaints though with the sport package."
mercedes_benz,39gevz,SeaBass2712,1 point,Thu Jun 18 03:02:49 2015 UTC,You have the dynamic handling package? Those are extremely rare in the us.
mercedes_benz,39gevz,iroll20s,1 point,Thu Jun 18 04:46:02 2015 UTC,I thought the sport package included the dynamic handling package on the w205. Are they actually rare? Is it rare on w204's?
mercedes_benz,39gevz,SeaBass2712,1 point,Thu Jun 18 10:26:59 2015 UTC,Yup. It was something you had to special order on the w204.
mercedes_benz,39gevz,--fap--,1 point,Thu Jun 18 13:13:03 2015 UTC,That makes sense. I haven't seen one with the dynamic handling package.
mercedes_benz,398c2t,ianlin,4,Tue Jun 9 23:59:42 2015 UTC,"Beware, mobile users"
mercedes_benz,398c2t,TheSoftBuIIetin,4,Wed Jun 10 15:13:02 2015 UTC,Well researched article. Deserves more love on here.
mercedes_benz,398c2t,flashwurks,2,Wed Jun 10 05:04:59 2015 UTC,"Surprised to see Honda so far up the chart, I guess even rappers appreciate reliability and good fuel economy"
mercedes_benz,398c2t,roro_mush,1 point,Wed Jun 10 18:17:41 2015 UTC,"I think this article is awesome and Medium is a favorite medium, of course."
