pakistan,3dalz0,khanabadoshi,4,Thu Jul 16 07:41:53 2015 UTC,"I found your rewording amusing. The idea of Pakistan itself manifested from those Indian Muslims, was fought for by them, and initially totally ruled by them. All for a region to which they were foreign, the people of which were rather apathetic to being apart of Pakistan or not.   The native people of the region weren't particularly for/against Pakistan except for the fact it would be ruled by Muslims. The reason being they were already majority muslim and throughout history no matter who ruled their lands; Dehli, Kabul, Iran, or Britain -- they were always the fringe of each empire and effectively ruled themselves.   This is why the hypernationalism of Indians doesn't exist in Pakistan. Pakistanis don't see the sub-contitnent as one nation as Indians do, nor to do they see it as 2 nations as most muhajir Pakistanis or the elite of Pakistan do -- they see it like Europeans see Europe -- a vast geography of many nations with cultural overlaps.   This is why all regions of Pakistan are inherently autonomous, the federal government is weak, and why the army is the only thing that keeps things in line.   Pakistaniyat to the average Pakistani is unified belief that we are not one and that each deserves respect.  The most hypernationalistic Pakistanis are those who came from Indian punjab or UP urdu-speakers. And naturally so, without the strong identity of Pakistani = not-India then who are they? Just people from Lucknow, Dehli, Ludhiana and Jalhandar. They need the identity more than anyone else. Everyone else can call themselves Pashtoon, Baluch, Sindhi, Punjabi, Multani, Hunzai..etc. They don't have to call themselves Pakistani.   What I am saying is not something revolutionary. Everyone here knows it.... Mein Karachi sy hoon = Hindustani. If that wasn't the case we wouldn't be calling them Muhajir after 70 years."
pakistan,3dalz0,the_brown_stockton,3,Thu Jul 16 07:41:53 2015 UTC,"Can't disagree with you there, since Im an ""urdu speaker"", I have no real ethnicity and is what probably makes me a bit more nationalistic(rightly or wrongly)than other Pakistanis.   So you say an Indian Muslim and a Pakistani are one and the same culturally, do you think anything can differentiate them now after 60 odd years?"
pakistan,3dalz0,RoastedCashew,2,Thu Jul 16 05:52:00 2015 UTC,"You do have an ethnicity. Maybe you are a Mughal, maybe a Bihari, Haryanvi etc, etc. Most Muslims are the same thing as the people around them. Urdu-speaking Muslims and Hindi-speaking Hindus are the natives of Northern India -- so essentially they call themselves Hindustani. However, UP Muslims of all the Muslims of South Asia are the most likely to be descended from elsewhere, as the rulers of Dehli were always from Central Asia. A great number of Muhajir are Pashtun but assimilated into Mughlai culture. So it's hard to generalize.   Pakistani isn't an ethnicity, it's a nationality. However, so many people equate Pakistaniyat to culture and ethnicity. This goes especially true of the people of Karachi who equate Pakistaniyat to the modern incarnation of the Mughal Empire. This is faulty because Dehli only directly ruled Northern India (Agra, Dehli etc.) and Lahore for most of history and is represented culturally by mostly Uttar Pardesh. So the guy in Hyderabad, Multan, Peshawar, Quetta isn't feeling much of a connection with this idea. In fact, Pakistan is more of a reincarnation of the Durrani Empire than the Mughals.  Northern Punjab readily adapted to Urdu because of Lahore being very much apart of the Dehli's rule for most of history. That's is the most simple answer as to why Punjabis are more likely to speak Urdu than every other group.   The Muslims of Hyderabad and UP/Bihar are culturally similar. And it's their descendants in Karachi who brought their culture to what is now Pakistan. Biryani was not so famous, nor was a Sherwani until the arrival of Muhajirs. The ideals of what the high-class culture should be also comes from Muhajirs. This all stems from the fact that at partition almost all the natives of Pakistan were uneducated. There was one university and one medical school. The majority didn't live in cities. Even the cities population levels were considered a town in Bahrat. Those Muslim who came from India were urbanized and educated, and this is why Urdu became a big deal and why the Mughal culture entered all facets of life, in terms of food, clothes, national narrative, etc. So to say a Muhajir has no sense of belonging in Pakistan is totally wrong. Muhajirs are very much the reason Pakistan is the way it is today. However, at the same time they are the most in denial of their ancestry and roots and the most likely to propagate the fantasy of Persian, Turkish, Arab roots (Not that some aren't...but most certainly ALL can't be). Also, the entire notion that everyone who is Muslim became Muslim in the 7th century with Muhammad bin Qasim's arrival or came with him. (That is a lengthy conversation, the spread of Islam, for another post if you are interested) What is the shame in being from Lucknow? Nothing. If all the Mujahirs that settled in Sindh spoke Sindhi like all the Muhajirs of Punjab did by speaking Punjabi, no one would consider you anything else -- today you would be Sindhi. Even all the Pashtun rulers of Multan speak Saraiki today. Everyone in the history of the region adapted to the language of where they settled in daily public life (at home people may continue to speak mother tongues) except the Indian Muslims who settled in Karachi. There is a disproportionate amount of power in the 7%. So is it surprise that Sindhis have issues? In fact, every separatist movement in the country is because of this. No one can read/write their native language. If Bangladesh was still apart of Pakistan, today no one would read/write Bengali. Until 1971 they were apart of Pakistaniyat -- ironically, no one here even thought about that.   So in that way the Muslims who came from India are like the Muslims of India today. In Hyderabad, Urdu rules even though they are in a Telugu state. But all Muslims share similarities no matter where they are from. So a Peshawari is going to find more in common with the UP Muslim than the UP Hindu. So those commonalities are not exclusive to just the Muhajir.   On the other hand, Karachi is its own unique culture now too, borrowing from the native cultures as well. So it has diverged. If you can tell in Indian Punjabi from a Paki Punjabi then you can tell the difference between the Urdu-speakers too. I mean I can tell a Hyderabadi a mile away. At the same time I can tell who is a Hariyanvi in Paki Punjab, or the guy from Ludhiana. Pakistan's standard of Urdu is also based on Karachi -- not Lucknow -- and they are not the same. So even in speech you will hear the difference. So after 60 years there are distinctions as well.  However, the best way to answer your question is simply to ask: If you were in Dehli today, would you be seen as foreign? No. ...but the guy from Quetta definitely would be.   If Pakistaniyat is supposed to be not-Bahratiyat, then Pakistan would have embraced everything non-Indian that is native to Pakistan... we'd be speaking Farsi as the national language, every region would teach in their own language, probably everyone would know Punjabi or Pashto as a 2nd language, and most likely Afghanistan would be a part of the country (Almost happened in the 1950s).  tl;dr: Same ethnically (usually, there are exceptions); slightly different culturally; vastly different in terms of self-identity."
pakistan,3dalz0,Paranoid__Android,2,Thu Jul 16 12:00:44 2015 UTC,"Very interesting thanks for that. To answer your question of where I may be from being an urdu speaker,  my grandfather came from Karnal and his ancestors came from Iraq. Its a pretty interesting read https://en.m.wikipedia.org/wiki/Saadat-e-Bara"
pakistan,3dalz0,h___nisar,2,Thu Jul 16 13:57:57 2015 UTC,"Is the the same as the Iraqi Biradaris? I have read studies about them from Nothern India and they all have Iraqi male lineage, confirmed by DNA testing. Same for the Yemeni groups.   You should do an DNA test! I'm super curious and encouraging of most South Asian to do so. It will answer lots of questions.  EDIT: I read the article. So are you Zaidi? Very few Zaidis in the subcontinent. Mostly all are in Yemen. Shias of North India are more likely than Sunnis to be of Arab decent as well in general."
pakistan,3dalz0,Paranoid__Android,1 point,Thu Jul 16 14:09:01 2015 UTC,"Yeah im a Zaidi, the guy Abul Fara Wasti came from Wasit in Iraq, where there is a Zaidi population I'm guessing? Think they're different from the Yemeni Houthi Zaidis am I right?"
pakistan,3dalz0,TaazaPlaza,2,Thu Jul 16 14:34:40 2015 UTC,"Zaidis were all over at one point, however, today they only exist in great numbers in Yemen. I assume you are the same as them if you believe in 5 imams?   Historically, Zaidis (5'ers -- end at Zain-ul-Abidin) represented the majority of Shias (they are the most close to Sunnis in terms of beliefs and fiqh), then the Ismailis (After Jaffar As-Sadiq they take Ismail as the Imam and go from there) pushed them to the sidelines; ie. the Fatemid Caliphate of Egypt. They lost prominence when Ayyubids of Salahudin took Egypt; then the Qarmati Ismailis (7'ers who end at Ismail) which took Mecca, Medina, most of East Arabia and Multan from the Abbasis and even stole the black rock and ransomed it. They lost the Arab lands and last power was in Multan -- the Ghaznavids invade everything from Kabul to Multan to root them out (this is the period most of Pakistan and Afghanistan is introduced to Islam) and succeed.. they die out. Then whats left of the mainstream Ismailis splintered into the Nizari (Aga Khanis), Dawoodi (Bohra), Mustali depending on the Imam they chose. Dawoodis were also mostly based out of Yemen. While all this is going on you have the 12ers who were minor players in the Muslim world taking Musa al-Kadm as the 7th Imam instead of Ismail. They rise to prominence in the 1500s with the Safavid dynasty in Iran which were a sufi order that converted to 12'ers and forced conversions of largely Sunni Iran. Since that time they are the major Shia group in the world. The minorities existing today are the Druze in Lebanon/Syria/Iraq; the Nizari Ismailis (Aga Khanis), majority in Northern Pakistan, and some large South Asian cities, and East Africa; Dawood Bohra mostly in Gujurat and Karachi; and Zaidis, mostly exclusive to Northern Yemen.  Besides them you have a group called Ibadis/Zikris -- they are not Sunni or Shia and are the majority of Oman. They are the direct decedents of what Sunnis call the Khawarij.  They are unique in that they sided with Ali and then turned against him because he made a truce, saying that, by doing so he had forsaken God's commands to uphold the sanctity of the Caliph. So they fought both sides and once held much of East and Southern Arabia. Now they are found only in Oman and are the majority. They reject almost all hadith from Sunnis or Shias and are thus are often referred to as ""Quran-only"" Muslims.    A little flowchart for you."
pakistan,3dalz0,Cicerotulli,2,Thu Jul 16 15:03:49 2015 UTC,"Ok so I just read up on some ish. Turns out you are not Zaidi in the religious sense. You are a Zaidi in the familial sense; you claim Syed lineage through the line of Zaid-ul-Abidin's decedents who didn't return to Hejaz, settled in Iraq, and subsequently migrated east. You are most likely Ithna‘ ashariyyah (12'er)?"
pakistan,3dalz0,okonawi,2,Thu Jul 16 21:07:59 2015 UTC,"Yeah you got it, though personally, my beliefs are closer to Sunnis than 12ers"
pakistan,3dalz0,IzmailPirzada,2,Thu Jul 16 21:24:29 2015 UTC,"Awesome. I love having discussions like this. There is a lot to learn. I didn't know about the Wasitis until today, so thanks for the education!   Reddit is bad for me, I'm sitting here typing up essays when I have studying to do. I'll drop by again soon."
pakistan,3dalz0,IzmailPirzada,2,Thu Jul 16 21:52:44 2015 UTC,"No man thank you! I can read about this type of history all day, I'm very interested by ancestral ties and all especially in the subcontinent."
pakistan,3dalz0,Paranoid__Android,3,Thu Jul 16 22:00:49 2015 UTC,"Pakistan and India are both insanely diverse countries. For example,  Baloch or pashtun muslims have nothing in common with South Indian tamil muslims and vice versa. Or Sindhis in Pak have little in common with East Indian or bengali muslims"
pakistan,3dalz0,Pleasant_Jim,2,Thu Jul 16 22:14:28 2015 UTC,"Yeah think a singular Pakistaniyat identity would be hard to come by with the diverse cultures. Would you say India has more, or less of a singular identity?"
pakistan,3dalz0,Paranoid__Android,1 point,Wed Jul 15 04:52:17 2015 UTC,The North and South are not alike..
pakistan,3dalz0,Pleasant_Jim,2,Wed Jul 15 04:55:24 2015 UTC,"That was not the question though. Ask North India or a South Indian, and they will identify themselves as an Indian."
pakistan,3dalz0,ChachaKirket,5,Wed Jul 15 06:20:53 2015 UTC,"Southie here, Indian. (If you have interacted with gultis, it should sound as 'yendian') :)"
pakistan,3dalz0,Paranoid__Android,1 point,Wed Jul 15 10:36:59 2015 UTC,"Babu, have hundreds of gulti friends. Know enough about Hyd, Vizag to be dangerous. :-)"
pakistan,3dalz0,SirDickbut,2,Wed Jul 15 11:52:31 2015 UTC,"It's not even a north - south divide. There's central, west, east, north east divide. Northeast Indians for example range from Tibetic to Indo Aryan, Hindu to Theravada Buddhist to Tibetan Buddhist to Christian."
pakistan,3dalz0,YouHaveTakenItTooFar,6,Wed Jul 15 12:33:05 2015 UTC,"What makes a British different from Australian, Austrian from German, Canadian from American?"
pakistan,3dalz0,KingJamesX,3,Fri Jul 17 07:03:39 2015 UTC,Well they each have their own distinct cultural aspects. Not saying that Pakistanis don't but would like to see what different people find to be defining traits for a Pakistani
pakistan,3dalz0,Pleasant_Jim,5,Tue Jul 14 23:21:44 2015 UTC,"Why can't people associate with piece of land they live in? I mean, isn't Pakistan just an acronym for various regions it contains? Being an Indian, what I identify with Indian-ness is the region called India. I am a Sanadhya Brahmin and we have our own culture but I am Indian in the sense that I belong to just one of the various conglomerates of this vast region. So why can't Pakistanis identify themselves on that basis ? I am asking this because the top comment is about Urdu. Sure the concept of Pakistan is quite new but again, it is a group of various Muslim majority regions (since that was the reason for partition) situated on the western part of Indian subcontinent bordering the Iranian plateau."
pakistan,3dalz0,zalib,3,Tue Jul 14 23:36:13 2015 UTC,"I don't know to be honest, it isn't the sort of thing I can actually evaluate and put into words. It differs heavily from person to person dependent on where they've lived, their own personal background, and the friends they keep.  There was a glut of diversity in my high-school, it was mainly an international school with diaspora kids who held dual citizenship (the Third Culture crowd). I personally knew two Indian Muslims, one from Chennai/Bangalore and the other from the Urdu fantasy-land of Hyderabad.  I'm half-Punjabi and half-Kashmiri myself, and to be very honest with you, those two guys I could relate to the most alongside the Pakistanis I knew. We ate virtually the same things, our lingua franca of Urdu was the same, our parents all dressed the same and watched the same South Asian content at home, and on cultural showcase days we wore the same things.  If anything, if I hadn't known they were Indian I would've cognitively classified them as Pakistani since I'm one myself.  So what makes us exactly Pakistani as opposed to Muslims of Indian origin? The fact that we were either born in Pakistan or our ancestors moved during partition, that's pretty much it in my eyes."
pakistan,3dalz0,YouHaveTakenItTooFar,2,Wed Jul 15 06:16:33 2015 UTC,"I can completely relate, I'm a third culture kid myself (grew up in the UAE) and was surrounded by a myriad of different nationalities. Honestly the only time when I would be at odds with my Indian Muslim buddies was during cricket matches. However I dont know if this makes any sense, but Pakistanis do seem to be more outspoken and jazba-prone than Indian Muslims. What say you"
pakistan,3dalz0,lahorimunda,2,Tue Jul 14 23:26:08 2015 UTC,"Oh Lord, the cricket games. Whenever India played Pakistan there used to be so much banter infused with jokes about Siachen/Kargil that it would become a roast session of unparalleled proportions.  As for outspokenness, I get what you're trying to say. I'm a pretty reserved person, and with friends I can get a bit rowdy, but that's not because of cultural tendencies and it usually takes place in English.  My folks always made sure I knew the native languages formally. However, the moment I switch from English to Urdu/Punjabi in a setting with no adults (usually for the purposes of humour), I can feel my control over language slipping, and the paindu begins to creep in with the stretched vowels and the haaain. It's the kind of speech our mothers would call ""cheapo.""   The Hyderabadi guy would in no way ever have that jazba mode initiated because those guys get heavily drilled in proper Urdu, and the Chennai/Bangalore guy would just never have that in him since those in the south of India are generally timid, no-nonsense folks."
pakistan,3dalz0,fixnum,3,Wed Jul 15 00:04:40 2015 UTC,Hahaha yeah that's a great way to put it. Totally feel you on the haaainnn
pakistan,3dalz0,khanabadoshi,-2,Wed Jul 15 00:47:33 2015 UTC,"If anything, if I hadn't known they were Indian I would've cognitively classified them as Pakistani since I'm one myself. So what makes us exactly Pakistani as opposed to Muslims of Indian origin? The fact that we were either born in Pakistan or our ancestors moved during partition, that's pretty much it in my eyes.   Haha, this is quite interesting. I had a Pakistani friend who was from Lahore in my grad school. There were only 3-4 other Pakistan origin students, and a couple of them were from very rich (and may be even political, idk) families, and the other two had spent a lot of time in Europe, and were fairly ""foreign"" in their outlook.   So this guy used to live with other Indians (including one Indian Muslim), used to hang out with a bunch of us all the time, cooked with us, watched cricket with us, did literally everything with us. Mind you there were a fair number of students from middle east, Iran, Indonesia, Malaysia, Bangladesh. Other people just categorized this Pakistani as an Indian. After the first few months, I don't think even he resisted it too much, after he struggled to explain how he was a Pakistani and how he was different than an Indian.  Pakistan (at least in my mind) is a Middle East like governance structure imposed on Indian Muslims. Pakistan (in a bid to be clear about its raison detre) has sought to remove multi polarity (which pretty much is a signature of India - I am this, and I am that) from it, whether it is language, culture or whatever. Bangladesh, on the other hand is far more uniform, and far less in denial about the fact that they are practically Bengali Indians just separated with a man made line.  Pakistan feels that it would lose its identity if it absorbs diversity, and it refuses to take inspiration from India which has absorbed mind boggling amount of diversity while staying Indian. We started at ~15 states, went to this when I was in school, and are now at this. We have sought to create new administrative units, and have given more power to state. Even the Prime Minister Baby blood drinking devil himself has been pushing for more administrative power to the states, while pushing for a market level integration of the country. This is what NEEDS to happen in any large nation for success.   Until Punjab holds the de facto hegemony over Pakistan, this structure would not be stable.   IMHO."
pakistan,3dalz0,HMTheEmperor,2,Wed Jul 15 01:54:44 2015 UTC,That's a typical Indian post right there.
pakistan,3dalz0,khanabadoshi,3,Wed Jul 15 05:56:39 2015 UTC,"Wow, look you guys, this guys knows how to ad hominem! What originality. Shoot down the ideas, bro, not the messenger."
pakistan,3dalz0,HMTheEmperor,1 point,Wed Jul 15 10:30:01 2015 UTC,"Sorry, maybe I came across as a tad flippant there but I just found the post quite generic and typical of Indian outlook when it comes to Pakistan - I find similar posts in comment sections on news articles. For the record though, I do often agree with some of your comments around here."
pakistan,3dalz0,khanabadoshi,1 point,Wed Jul 15 10:35:14 2015 UTC,"No need to apologize, Mr. Apne munh mian mithoo doesn't know shit about Pakistan.   Punjab doesn't hold a de-facto hegemony over Pakistan, the 18th Constitutional amendment guaranteed that all provinces are for the large part autonomous and in-charge of their own economic fate.   You were also right in regards to labeling the comment as a ""typical Indian post"" because like most other times the sanctimonious and smug tone is ever present.   And like most other things with their new government, it's all rhetoric. This dude is here lecturing us about de-centralization while every major business deal in their country is essentially funneled through one man.  I've stopped interacting with them, let them bark into the void."
pakistan,3dalz0,HMTheEmperor,1 point,Wed Jul 15 10:42:36 2015 UTC,"across as a tad flippant there   I was narrating the travails of a Pakistani caught in a bus full of Indian grad students, so it was flippant by design.   typical of Indian outlook when it comes to Pakistan   So tell me which one of my points you disagree with. It does NOT matter whether it is typical of an outlook (Indian, American, or Chinese) or not. It frustrates me when I am trying to make a dialogue, and all I hear from the other side is a variant of ""...but he is a kafir..."" in so many words."
pakistan,3dalz0,khanabadoshi,2,Wed Jul 15 13:45:35 2015 UTC,From experience and observation. Strictly my own view.
pakistan,3dalz0,Cs-133,1 point,Wed Jul 15 11:00:02 2015 UTC,Basically Muslims in general
pakistan,3dalz0,IzmailPirzada,1 point,Wed Jul 15 09:14:50 2015 UTC,"I have met with a lot of Indian Muslims in middle east, Canadian mosques and MSA meetings at University and i am still trying to figure out what differentiates me from them. I do like to consider myself as a Pakistani Indian Muslim nowadays. It's important to note that i am from migrant community that migrated from India to Pakistan during the partition and according to the DNA test i did with 23andMe, i have fourth cousins and fourth cousins once removed that are Hindus residing in India. Answers would be different for Pakistani Punjabi and Pushtun Muslims that are native to this land"
pakistan,3dalz0,Cs-133,0,Wed Jul 15 13:50:00 2015 UTC,I do like to consider myself as a Pakistani Indian Muslim nowadays   Are you're folks Muhajir?
pakistan,3dazdx,shehzad,1 point,Tue Jul 14 21:39:51 2015 UTC,Google Abdul Sattar Edhi and you'd be even more amazed
pakistan,3ddck9,sak_14,7,Wed Jul 15 11:29:35 2015 UTC,The reporter's english isn't top notch either.
pakistan,3ddck9,Paki_mon,9,Wed Jul 15 13:01:05 2015 UTC,"Cheap journalism.  Not only was the reporters English severely lacking ''How will come the prosperity to Pakistan""  He also doesn't have any right to make anyone speak to him in a language they do not choose to speak. The second guy who refused to cooperate was right to do so.  Thirdly ""how will come the prosperity to Pakistan"" is a stupid question with no solid answers.   And that stupid laugh track was really annoying.  We have a fair number of politicians whose Urdu is bad enough and reflects their poor education."
pakistan,3ddck9,ahyuknyuk,8,Wed Jul 15 13:46:35 2015 UTC,Cheap journalism.   Pakistani media in a nutshell.
pakistan,3ddck9,Striker_X,-1,Wed Jul 15 14:02:17 2015 UTC,"But that journalist didn't got the job to decide our future, did he?"
pakistan,3ddck9,DroidsRugly,0,Wed Jul 15 13:50:18 2015 UTC,"If you mean that its not the journalists job to decide our future, its the assembly members job then the answer to that would be that even a competent assembly member(which I'm not claiming they are) wouldnt ponder vague questions like ""How would I bring prosperity to Pakistan""  Assembly legislation is about specifics. Specific issues with specific answers.  If the reporter in question had a full show dedicated to a discussion that lasted at least an hour(and even that wouldnt be long enough). Because the answer to the question, ""How can we bring prosperity to Pakistan"" has a simple answer, ""Fix the problems in Pakistan""  And we all know what the problems with Pakistan are. Illiteracy, energy shortages, corruption, nepotism, law and order problems, religious extremism and terrorism.  Its the solutions to these problems that have complicated answers that need long discussions to be justified and proven correct.  So the first possibility I see is that he was expecting a coherent answer from the assembly members. Which makes him an incompetent journalist. The second possibility I see is that he wanted to have a full blown discussion with people by accosting them outside the Punjab Assembly and asking them vague questions with complicated answers, which AGAIN makes him an incompetent journalist. And the third possibility I see is that he was baiting assembly members into looking incompetent(which they probably are but it still isnt justified) by asking them vague questions and asking them to answer in a language they are not comfortable speaking in."
