pakistan,3e5o6i,ryzvonusef,5,Wed Jul 22 03:43:27 2015 UTC,"However, an official of a small seminary in F-6 shot back at the query regarding the defacing: “Do you want to see Muslim women in such a state? There should be a ban on such nakedness because it is a conspiracy of the West against Islam.”"
pakistan,3e5o6i,saurongetti,0,Wed Jul 22 03:44:55 2015 UTC,http://www.jewishquarterly.org/issuearchive/articled325.html?articleid=38  http://www.wilhelmreichtrust.org/sexual_revolution.pdf
pakistan,3e32c3,Cream1213,19,Tue Jul 21 16:06:35 2015 UTC,IMO the youth is becoming more polarized. Some turn to religion as an answer and others are disenfranchised by it. It'll be interesting to see what happens next.  But I do feel that the state/establishment now realizes that their overzealous Islamization policies have led to extremism and are toning them down.
pakistan,3e32c3,squarerootof-1,7,Tue Jul 21 17:36:16 2015 UTC,It doesn't feel like the government realizes that. The medical school I go to really tries their hardest to push religious dogma down our throat. Is it really that polarized I mean one of my very good friends in pakistan is called molvi sab because he prays 5 times a day but he is very accepting of my kafirness haha.
pakistan,3e32c3,ahyuknyuk,5,Tue Jul 21 18:38:56 2015 UTC,"Medical and Engineering schools tend to be more conservative. For some reason science attracts the religious.  Art schools like National College of Arts, Beaconhouse National University and Indus Valley School of Arts and Architecture have a very different atmosphere."
pakistan,3e32c3,ahyuknyuk,2,Tue Jul 21 18:48:45 2015 UTC,That's so weird you would think the sciences would attract the less religious people. Doesn't it get hard to be in a major where you constantly have to justify your beliefs with science.
pakistan,3e32c3,squarerootof-1,6,Tue Jul 21 18:53:30 2015 UTC,"Its because they like to put their minds in a box, which CAN work if you want to be an engineer or a doctor. Humanities and Arts require some creative thinking. Which these people dont have.  Its why the Muslim world produces so many doctors and engineers but no scientists. No Biologists or Physicists. Because being a scientist, and making discoveries require that you open your mind."
pakistan,3e32c3,WisestAirBender,7,Tue Jul 21 18:56:56 2015 UTC,You also have to account for our education system which emphasizes rote learning over analytical thinking.
pakistan,3e32c3,WisestAirBender,1 point,Tue Jul 21 19:42:52 2015 UTC,Yeah they call it ratta over here haha some people over here are so much better at memorizing than I am.
pakistan,3e32c3,ahyuknyuk,4,Tue Jul 21 19:45:33 2015 UTC,Nah. The same thing is happening in India. Parents want their child to become a doctor or an engineer rather than a 'painter'.
pakistan,3e32c3,squarerootof-1,1 point,Tue Jul 21 18:59:29 2015 UTC,Is that stereotype really that true I mean I choose to be in my field just so happens to fit with my stereotype. Do these parents force these kids into these careers only because of prestige and money?
pakistan,3e32c3,Varyskit,1 point,Tue Jul 21 19:07:23 2015 UTC,Most of the parents that do this are the ones who struggled while growing up and literally worked in the boiling sun to make enough money to educate their kid. They just want the best for their kids and want to invest in something reliable.
pakistan,3e32c3,wromit,2,Tue Jul 21 19:12:11 2015 UTC,Yeah well in those circumstances I could see why they would force their kids into a stable career.
pakistan,3e32c3,khanartiste,0,Tue Jul 21 19:24:44 2015 UTC,"Oh ok but even then how would medical students in Pakistan justify their beliefs in evolution, or what about the 300 yr sleeping guy. It still seems like a battle but I understand where you are coming from."
pakistan,3e32c3,lalafied,2,Tue Jul 21 19:09:41 2015 UTC,I dont know what the 300 year sleeping guy is but I doubt you have to acknowledge or understand evolution to be a doctor.
pakistan,3e32c3,lalafied,1 point,Tue Jul 21 19:30:31 2015 UTC,"I came across a book from one of heads of department at Shifa trying to disprove evolution, laced with Quranic verses and horrible science."
pakistan,3e32c3,squarerootof-1,-1,Tue Jul 21 19:59:37 2015 UTC,Some story in the quran about how god kept a man alive 300 yrs sleeping in a cave. Or Hadith unsure. I mean yeah you don't need to believe in evolution however it does a fantastic job at explaining why how  it works
pakistan,3e32c3,ieattoomuch,3,Tue Jul 21 19:40:01 2015 UTC,This seems more like the story about the people of the cave who also for a very long time according to the Quran.
pakistan,3e32c3,ProphetLucifer,1 point,Tue Jul 21 19:52:57 2015 UTC,"Most religions preach stories about miracles in some form or the other. The key for religions is to ensure that the ""miracles"" are unfalsifiable. If a person is miraculously sleeping in a cave for 3000 yrs, no one can disprove it. We have however used science to dismiss some beliefs commonly held by Muslims, e.g. Prophet Nuh's flood covered the entire globe, etc."
pakistan,3e32c3,baboonexecutioner,2,Tue Jul 21 23:02:15 2015 UTC,"Yeah that's a great point wikislam turns a lot of islamic miracles on its head by using science do dismiss them. Yeah the whole idea of god, heaven and hell is unfalsifiable."
pakistan,3e32c3,ieattoomuch,2,Tue Jul 21 23:08:05 2015 UTC,"Actually I don't think the Quran says that the whole world was flooded. A ""local flood"" interpretation is possible in Islam. Or so I believe, I still need to do more research"
pakistan,3e32c3,ahyuknyuk,0,Wed Jul 22 02:16:52 2015 UTC,Why our body works they way it does*
pakistan,3e32c3,supamonkey77,1 point,Tue Jul 21 19:42:26 2015 UTC,I don't think being religious means denying evolution. Can't a person believe in both?
pakistan,3e32c3,ahyuknyuk,1 point,Wed Jul 22 00:03:14 2015 UTC,No I don't think evolution happened over hundreds of millions of years ago In Islam everything was made in 6 days. Christians believe the earth is 5000 yrs old etc...
pakistan,3e32c3,supamonkey77,1 point,Wed Jul 22 00:52:34 2015 UTC,"Really, didn't know that? I should probably learn more about the religion that I follow."
pakistan,3e32c3,ahyuknyuk,1 point,Wed Jul 22 00:55:06 2015 UTC,Indeed I followed it blindly for years.
pakistan,3e32c3,supamonkey77,3,Wed Jul 22 01:08:33 2015 UTC,"The realization seems slow but I do think, or at least hope, that they're coming around to it. Musharraf repealed some of the hudood ordinances from the previous military dictator Zia. He also started the operation against Lal Masjid, which was an asset for the war in 80s. The democratic governments don't want to risk losing the conservative vote I guess and so can't be as drastic in their measures. But everyone looks at madrassahs, Lal Masjid and their ilk as a problem now rather than a solution or an ""asset""."
pakistan,3e32c3,ieattoomuch,1 point,Tue Jul 21 19:56:28 2015 UTC,Yaar aap shifa  tou nai jaatey?
pakistan,3e32c3,ieattoomuch,3,Tue Jul 21 18:42:17 2015 UTC,No I don't I wish I hear it's on of the best med school here in pakistan.
pakistan,3e32c3,KingJamesX,5,Tue Jul 21 18:49:22 2015 UTC,"Commas. They're really important, my friend."
pakistan,3e32c3,IzmailPirzada,6,Tue Jul 21 21:43:01 2015 UTC,"It's like if your parents are stricter, the kids are going to find more discreet ways to be rebellious. The government is so over-religious and conservative that it makes those who question it frustrated.   I think a big part of the problem is we are only getting the Saudi-sponsored Wahhabi version of Islam imported into Pakistan. There's people all over the world with different ways of practicing Islam in their culture. Forget the Middle East, just look to Central Asia. In this excellent documentary Meet the Stans, the host and the journalist go to a Muslim fortune teller in Uzbekistan who uses the Quran to predict fortunes. They all end with a short ""Bismillah"" lol. Later he's in Tajikistan, also an Islamic country with majority Sunnis, joining a group of officials for dinner at a Tajik border post who openly served (lots of) vodka with their kabaabs. They all end the feast with a short thanks to Allah. According to Wikipedia, only 10% of Tajiks follow daily prayer. Contrast these facts with what people are raised with in Pakistan.   It was eye opening to me how Islamic cultures can be so different in Pakistan's own backyard and not many know about it. All we get is Arabic being mandatory in govt. schools to further kiss Saudi's ass."
pakistan,3e32c3,ProphetLucifer,5,Tue Jul 21 22:19:14 2015 UTC,"Yar think about how many pakistanis  there are. Then how many of them are priveleged enough to go abroad. Of that sub section how many choose Canada. Of that how many choose your particular city. Of that how many are in your age group and share some interests with you. Of that how many you've met. Of that how many hang out with you and of that how many  don't disprove of you , atleast in front of you. You can't really draw any meaningful conclusion from this. But in my expierence  even a progressive and a liberal pakistani  would struggle with accepting casual sex and drinking.   But /u/squarerootof-1 is right , pakistani youth has become very polarised. You are either a good Muslim who prays 5 times or you are a kafir. You are either a progressive pakistani who eschews everything religious or else you are a  jahil mulla.    Everything is in black and white. There's no grey area anymore."
pakistan,3e32c3,Paki_mon,3,Tue Jul 21 18:17:18 2015 UTC,"Then how many of them are priveleged enough to go abroad. Of that sub section how many choose Canada.   This is no criteria to measure how religious someone will become. Plenty of British, European and Canadian Pakistanis are very religious. VERY RELIGIOUS. American Pakistanis tend to be less religious.  The irony is that America is a more religious country than Britain or European countries. Some of the most religious Pakistanis I have met have been from Norway and Demark, which are practically atheist countries.   Edit: I would say, middle and lower middle class Pakistanis from Europe, Canada and Britain are more religious than upper and upper middle class Pakistanis living in Pakistan."
pakistan,3e32c3,zalib,1 point,Tue Jul 21 18:25:15 2015 UTC,"My experience is that for a lot of people, when they move abroad, the home country becomes static. The image that they had in their mind of the country stays the same. It doesn't matter how long they have been away, if they left in the 80's, the home country stays in the 80's in their minds. And these are the people who appear to be more conservative even when they return because the local culture has changed to much."
pakistan,3e32c3,saurongetti,2,Tue Jul 21 18:37:30 2015 UTC,"That is a factor but not the only one. Its also that for some people moving abroad can be very jarring. Booze on store shelves, women having the kind of freedom they have and suddenly becoming a minority. You cant understand or identify with that culture so you become a very conservative Muslim instead to find a sense of place and identity."
pakistan,3e3tb7,ryzvonusef,7,Tue Jul 21 19:10:31 2015 UTC,"Neem hakeem, khatra jaan. Neem mullah, khatra emaan.  In bhai ko chahiye, apni bolti bund rakhain. Auratain heera nahi hoteen. Insaan hoti hain."
pakistan,3e3tb7,greenvox,3,Tue Jul 21 20:18:42 2015 UTC,"I've had it up to here with these misogynistic idiots. I'm glad they're being called out by the majority of the public. Somebody should've reminded him about the so called ""bechari"" woman Hazrat Ayesha R.A who led an entire army and fought against soldiers in the battlefield...  Were the woman suppose to be so ""bechari"" in Islam, Prophet PBUH's own wife wouldn't have fought for her beliefs."
pakistan,3e3tb7,offendedkitkatbar,2,Wed Jul 22 04:06:49 2015 UTC,"This time, it appears that he felt he had to correct his mistake quickly, as he took to his Facebook page and issued a 'clarification. ' In the carefully edited video, he explains that he did not intend to offend or belittle women at all. He cites Quranic verses that relate the high stature of women.  However, he closes with the sexist remark: ""A woman is a diamond. Diamonds are meant to be hidden."""
pakistan,3e3tb7,raytrace75,4,Tue Jul 21 19:10:39 2015 UTC,"Prove him wrong; show where there's a name of woman mentioned in the Quran, with the exception of Honourable Maryam (a.s)."
pakistan,3e3tb7,raytrace75,1 point,Tue Jul 21 20:00:20 2015 UTC,I don't think it's the FACT that's pissing people off so much as the CONCLUSION that he drew from it.
pakistan,3e3tb7,chootrangers,2,Tue Jul 21 20:02:15 2015 UTC,"The objection is being made about his first statement,  about names of women not being mentioned. It is quite evident that who ever wrote the article probably didn't know this fact."
pakistan,3e3tb7,boomaya,0,Tue Jul 21 20:12:47 2015 UTC,"whoever wrote the quran was less qualified, so no harm done eitherway."
pakistan,3e3tb7,WorkReddit3420,1 point,Wed Jul 22 03:25:54 2015 UTC,"Aja mamay, tu bi aja aur apni bongian maar lay."
pakistan,3e3tb7,chootrangers,0,Wed Jul 22 03:50:45 2015 UTC,Could not happen to a nicer guy!
pakistan,3e46ud,WorkReddit3420,2,Tue Jul 21 20:43:30 2015 UTC,"These are the places I used to shop when I was growing up there. This info might be outdated though.   KDA stop (near Bait-ul-Mukarram masjid) in Gulshan-e-Iqbal for used books/magazines Frere hall on the weekends Urdu bazaar near saddar Urdu bazaar in Nazimabad (mostly textbooks) Ferozsons publishers Newsstands for new and old magazines (Naunihal, Taleem-o-tarbiyat)"
pakistan,3e3jdi,iamyounow,7,Tue Jul 21 18:02:59 2015 UTC,"I don't know if it's common or not, but you've just made me hungry."
pakistan,3e3jdi,rushinobby09,3,Tue Jul 21 20:46:34 2015 UTC,that pizza looks so good!
pakistan,3e3jdi,greenvox,0,Tue Jul 21 21:33:55 2015 UTC,Came here to say this.
pakistan,3e3jdi,TeslaModelE,3,Wed Jul 22 02:11:19 2015 UTC,Yes. Common among local fast food places.
pakistan,3e3jdi,ProphetLucifer,1 point,Tue Jul 21 21:48:20 2015 UTC,Yes. The ink and paper is probably not food grade.
pakistan,3e3jdi,saurongetti,1 point,Wed Jul 22 04:04:04 2015 UTC,"Incredible. In my city, the capital of Pakistan, food is delivered on hides of the animals just slaughtered. We often use the blood that is stuck on the carcass as something my cousins call ""kaitchupph""...  OK I'm sorry for being a dick but I don't get why this sub gets these questions. Its a pizza - did you think Pakistan invented some new way, completely different from the rest of the world, for delivering pizza? Or are you surprised that Pakistanis would be eating pizza? Or is it the recycled material used in some of the packaging, which also started happening about 10-15 years ago? I'm sorry but wtf man?  It gets incredibly insulting to read such often well-intentioned and earnest questions, simply because they start from this really strange idea of Pakistan in the first place. And I'm fine with that, but not when we start questioning whether a pizza box is a novelty in Pakistan.   Perhaps they are intended as ways of wanting to know more about Pakistan, but that's pretty easy too. Reddit has a very limited Pakistani community, but there's a lot more on the internet itself that can help one move past the OMG Pizza phase about knowing Pakistan."
pakistan,3e3jdi,karachikhatmal,1 point,Wed Jul 22 02:27:11 2015 UTC,"Chill out. I'm pretty sure the OP was referring to the recycled boxes, and perhaps the hygiene aspect of it."
pakistan,3e3jdi,greycap7,1 point,Wed Jul 22 03:42:55 2015 UTC,"What does that mean? Recycling is surprising? Since this is how fast food is delivered everywhere else in the world, I don't think hygiene comes into play."
pakistan,3e3jdi,karachikhatmal,-1,Wed Jul 22 03:45:48 2015 UTC,"Clearly you haven't been to the United States, where pizza is delivered in brown or white cardboard boxes. These boxes are void of any other branding especially mouthwash boxes. OP probably thinks it's strange that cardboard is now being used for other things namely delivering food. Elitism at its finest."
pakistan,3e3jdi,greycap7,1 point,Wed Jul 22 04:20:25 2015 UTC,Elitism? Chalo khair its not that important and I reacted too strongly. I don't get this post still but it'd not gonna kill me
pakistan,3e3jdi,karachikhatmal,1 point,Wed Jul 22 04:23:25 2015 UTC,"U wanna fight m8? Outside Butlers in Zamzama, after Imran Merchants tuition. I'll see u there.   Haha just kidding dude, no worries I probably used irrelevant language too."
pakistan,3e1uhe,ryzvonusef,6,Tue Jul 21 08:44:58 2015 UTC,"Gilgit-Baltistan, which borders China, Afghanistan, and Kashmir, has not been granted full constitutional status by Islamabad - meaning that it is not an official province, and that its residents cannot vote in national elections.    Why is this?"
pakistan,3e1uhe,Pleasant_Jim,3,Tue Jul 21 11:00:00 2015 UTC,"Because Pakistan.  It is either because they simply never have gotten around to do it (no one's brought it up) or they wish to keep these places under territorial governance so they can fine-tune their socio-political environment dependent on whatever crisis level the Kashmir issue is on simultaneously.   In this case, however, Gilgit is being wound down to prepare it for CPEC."
pakistan,3e1uhe,IzmailPirzada,4,Tue Jul 21 11:35:28 2015 UTC,"Because Kashmir.  GB was a part of the Kashmir Kingdom, as a vassal of the Raja or some such.  Right now, we claim that we are merely supporting the Kashmiris in their bid for freedom. Hence the so called ""Azad"" JK, and GB as a ""protectorate"" or whatever the fuck. We are merely keeping them ""safe"" from big bad India   (which isn't wrong mind you, it's just that we aren't that altruistic as we like to claim)  Which is why GB can't be part of Pakistan, since it destroys the narrative. If accept GB as part of Pakistan, we can no longer claim to be ""neutral"".  Which is why the Hurriyet leaders refused to talk to Pakistan recently, they are pissed we are trying to give GB rights and destroy their own struggle, their case at the UN, so to speak. India will demand different terms, since we we will be on level, we occupying GB, them occupying IHK.  Which is bull fuck, I mean GB never wanted any part of the Kashmir issue, they AREN'T Kashmiris, they actually WANT to be Pakistanis, and Kashmiris are being a bit self centric in their struggle (Kashmiris aren't that hot for a merger with Pakistan)"
pakistan,3e1uhe,IzmailPirzada,4,Tue Jul 21 11:35:49 2015 UTC,"Kashmiris aren't that hot for a merger with Pakistan   Is this the situation on the ground? Through all the jingoistic Pakistani Facebook comments on how our Kashmiri brothers are vital Pakistanis I find it difficult to tell.  I just hope this nonsense is sorted out within my lifetime, and that I can visit both my grandmothers' ancestral homes in Srinagar one day."
pakistan,3e1uhe,okonawi,3,Tue Jul 21 11:48:10 2015 UTC,"One of the biggest shocks of my life was when, beneath the jingoism, I discovered this.  I mean, sure, there are loads of Kashmiris who want to be Pakistanis, but the two damning facts are that (1) the entire Kashmir struggle is based on Independence, NOT a merger with Pakistan and (2) a significant proportion of Kashmiris a support this idea. (Specifically, the ones in IHK, the one in AJK have become more used to with the status quo as an area with greater autonomy)  I'm not one to force people to join Pakistan when they don't want to, but we need to understand that ""Kashmir Azad Karein gey"" and ""Kashmir Ban Key Rahe Ga Pakistan"" are two DIFFERENT ideas.  The aftermath of a successful Kashmir Freedom struggle is that an Independent Kashmir would want the AJK part back and become a sovereign state (oh, and they will want the GB part back too). A merger with Pakistan is NOT the initial goal, only a possible aftermath."
pakistan,3e1uhe,sammyedwards,2,Tue Jul 21 11:58:49 2015 UTC,"oh, and they will want the GB part back too   Yeah Kashmir itself is a pretty diverse region. It's just because Kashmiris form the majority of population of the erstwhile princely state of Jammu and Kashmir that they form the hegemony."
pakistan,3e1uhe,blahmhin,1 point,Tue Jul 21 12:40:35 2015 UTC,"The diversity is the very problem. Almost everyone wants something different-Jammuites and Ladakhis want to stay with India, some Kashmiris want an independent Kashmir, some want to stay with India or Pakistan. It is a very muddled situation, an tbh there is no uniform view."
pakistan,3e1uhe,supamonkey77,1 point,Tue Jul 21 19:51:16 2015 UTC,"Interestingly, most Indians also don't know that Kasmiris want an independent nation. The propaganda is usually about how Pakistani state wants to take Kashmir from us. Never about independence. Of course, the ethnic cleansing of Pandits from the valley made sure that there won't be public support for the Kashmiris in India for a long time."
pakistan,3e1uhe,Paki_mon,1 point,Tue Jul 21 14:08:47 2015 UTC,"I would disagree. There might have been a large element in the Militancy that wanted to join with Pakistan and that was used as propaganda by the GOI. But majority of Kashmiris that are against Indian rule now do want Independence and most Indians know that in spite of the Government propaganda. Its also why the stars of Separatists groups like Hurryat etc are not so bright in Pakistan, because they( the groups) had to go along with the people and also ask for independence ( otherwise it would seem they didn't have the people's support in their efforts) and asking for independence, for Pakistan is a future headache of major proportions.  Unfortunately you are right in that, when the Militants targeted  the KP ethnicity, they really alienated themselves and any support for the Kashmiris' struggle in India evaporated. And with the KP diaspora having to settle in all parts of India and people hearing stories, first hand, about what the militants did only hardened them and provided excellent propaganda for GOI.( The atrocities committed by the military on the Kashmiri population was mostly suppressed at the time).  Now I fear it might be worse. In recent years money has gone into Kashmir, tourists have come, colleges, schools have opened, new jobs are opening, but if there is another flair up The GOI, cheered on by the Indian people, hardened, will go for blood like never before.(Especially in the current international atmosphere, where the insurgents will be equated with ISIS and will get no international support/blind eye to what the GOI does there)"
pakistan,3e1uhe,TotallyNotObsi,4,Wed Jul 22 01:23:01 2015 UTC,"This is complete BS from Pakistani establishment. GB doesn't even have the same rights as Azad-Kashmir enjoys. The Legislative assembly of GB is a fucking joke. There is a bloody secretary that controls GB and can veto any legislation and overrides all elected representatives.   The argument of Kashmir and self determination doesn't stand as GB is different from Kashmir. Why have they even less rights than the Azad-Kashmiris? Doesn't make one iota of sense!  The real reason is that the GB people are majority Shia (Twelver and Ismaili) and the establishment does not want control in hands of Shias. There is another Shia-majority area: Parachinar, and you might be aware of the treatment meted out to them."
pakistan,3e1uhe,IzmailPirzada,0,Tue Jul 21 15:15:41 2015 UTC,"I have to say, it is weird how we treat people from GB. Considering so many of them serve in the army and gave their lives in Kargil, it makes little sense to not give them their rights."
pakistan,3e1uhe,ozaq,5,Tue Jul 21 23:50:48 2015 UTC,"Always found this ironic. We thump our chests and stroke the jugular vein notions whenever Kashmir is mentioned, but we've never really done anything significant with either Gilgit-Baltistan or Azad Kashmir in terms of bringing them into the fold of mainstream Pakistan. Put your money where your mouth is. And here we are now; this article makes it seem as if the federal government is tightening its grip further to make sure any CPEC activity there runs smoothly.  Before anyone mentions the troubled history of Jammu and Kashmir, you've missed my point."
pakistan,3e1uhe,ozaq,4,Tue Jul 21 09:43:06 2015 UTC,"Stroke the jugular vein notions, baby"
pakistan,3e1uhe,ozaq,2,Tue Jul 21 09:45:27 2015 UTC,"Oh yeah baby, right there, you hit the GB spot baby..."
pakistan,3e1uhe,IzmailPirzada,4,Tue Jul 21 11:59:36 2015 UTC,My minar e pakistan is throbbing
pakistan,3e1uhe,ozaq,2,Tue Jul 21 12:02:43 2015 UTC,You are making my fertile plains wet
pakistan,3e1uhe,ozaq,2,Tue Jul 21 12:04:57 2015 UTC,Stahhp. You'll make my laal mosque explode.
pakistan,3e1qhv,EhsanAhmad,2,Tue Jul 21 07:49:08 2015 UTC,I hope she does everything and anything she can to acheive acdemically until she's 18 (although I'm sure she doesn't need to).   Edit: spelling and grammar
pakistan,3e1qhv,Pleasant_Jim,3,Tue Jul 21 08:48:03 2015 UTC,"There are those who speak English academically and then there are ""It's so cool, yaar..."""
pakistan,3e28ln,hanadiode,2,Tue Jul 21 11:55:04 2015 UTC,"Free deserts, wow. Where is the chai table.  That chicken looks delicious, but the biryani needs to be more, a lot more than whats in the pot.  Too bad, cant see the hairdo.  Good mehendi work.  Interesting, do some more videos."
pakistan,3e28ln,zalib,1 point,Tue Jul 21 20:10:58 2015 UTC,"Wow thanks! I heard there was going to be a chai table but I didn't see any (I don't drink tea anyways)  Oh, that's yakhni pilau, I'm sure there was more, it probably got eaten. Thank you, thank you. I will do : )"
pakistan,3e0zkp,grassologist,3,Tue Jul 21 03:04:03 2015 UTC,"it's an air cooler, not an air conditioner. Also it can only be comfortably used in low humidities."
pakistan,3e0zkp,zurvanyazdi,1 point,Tue Jul 21 05:03:14 2015 UTC,Very cool
