pakistan,3c6ikf,Drudeboy,14,Sun Jul 5 08:24:44 2015 UTC,"Well if they are fairly open minded then it shouldn't be a problem. Just a few things which might be helpful since I've seen things like this happen :   1) No handshakes or hugs with the female cousins. No matter how open minded they are, if you do that...those family aunties will start talking.  2) If you've converted, then I doubt you would be drinking alcohol, but if not, stay away from it when they are there. But if they drink too, then no problem.  3) Does the rest of the family (aunts, uncles etc) know about your live-in situation? if not...then don't bring it up and don't tell them you live there before marriage.  4) Be prepared for lots of questions about your family, job, how much money you make etc. There's no way around it. Just answer them with as much patience as you can...because everybody will ask those questions.  that's all that I can think of right now. Hope it helps. Cheers."
pakistan,3c6ikf,ahsanemo,3,Sun Jul 5 12:38:12 2015 UTC,"Thanks for the advice! I don't live there, but I'll be visiting for around 10 days.  Number 4 is the hardest. Last time I was there they sat me down (mom along with her sister) to tell that basically my plans weren't cutting it and that I had to get my shit together. I have since then (a bit I guess) but it still left a bad taste in my mouth. I'm most apprehensive about getting cornered like again, but like you said, it's probably inevitable.   I've dated people from a lot of different cultures and their parents were generally happy that their daughter wasn't with some who was completely fucking up. Her family seems to want someone who's really well-off.   Also, thanks for the tip on hugs and handshakes. I'll keep that in mind."
pakistan,3c6ikf,rahmad,5,Sun Jul 5 13:34:33 2015 UTC,"btw, the classic hug move with aunties (if an auntie opens and raises her arms like she's intending to hug you). rotate to be about 3/4 away from you and lower yourself and droop your arms. this allows the auntie to embrace you kind of sideways (sort of like a more wrapped around pat on the back), while you just sort of meekly take it.  classic pakistani male move when dealing with an older auntie."
pakistan,3c6ikf,Pleasant_Jim,2,Mon Jul 6 07:06:22 2015 UTC,You just reminded me of Christian side hug.
pakistan,3c6ikf,Bushbone,1 point,Mon Jul 6 12:28:55 2015 UTC,Also remember not to eat pork in front of them.
pakistan,3c6ikf,ahsanemo,2,Fri Jul 10 23:56:37 2015 UTC,This move is a life saver! saves you from the awkwardness
pakistan,3c6ikf,rahmad,1 point,Tue Jul 7 11:46:37 2015 UTC,"re: hugs, yeah, avoid. re: handshakes, read the room. i think it really depends on the family and the scenario."
pakistan,3c6ikf,Striker_X,4,Sun Jul 5 16:59:06 2015 UTC,No handshakes or hugs with the female cousins.   Handshakes is a bit of a stretch don't you think? Cause my family is pretty conservative and that is not an issue.
pakistan,3c6ikf,ahsanemo,3,Sun Jul 5 14:00:24 2015 UTC,"yeah handshakes are usually not a big deal but you never know. Playing it safe is the best thing to do here, I think."
pakistan,3c6ikf,The1stCanary,3,Sun Jul 5 14:05:55 2015 UTC,"1) No handshakes or hugs with the female cousins. No matter how open minded they are, if you do that...those family aunties will start talking.   On this, I usually wait for the girl to initiate a handshake/hug. Maybe because I'm already Pakistani, and somehow have a stellar reputation among the aunties, I really don't care, but that's my advice on the physical interaction front."
pakistan,3c6ikf,lightningbar0n,2,Sun Jul 5 16:09:10 2015 UTC,"Her immediate family is all women so they're pretty chill about hugs and stuff. I tried to hug a friend though last time I visited and she played it off really well, just ""oh oh oh I don't hug I don't hug"" kind of laughing."
pakistan,3c6ikf,Pleasant_Jim,9,Mon Jul 6 03:23:17 2015 UTC,"Given that I will be putting my fiance through the same thing soon. All I can say to you is good luck.   Godspeed my friend. May the Force be with you.   I'm afraid, nothing I do, nothing I think of, nothing I say to you can even begin to describe what Pakistani inlaws are like."
pakistan,3c6ikf,I_Wish_to_remain_ano,7,Sun Jul 5 10:52:13 2015 UTC,"The whole marrying-into-the-family thing.  To be fair, I thought my family was wayyyy more accepting than they actually are. They love to party and they are actually really laid back, already a multi-cultural family (Puerto Rican and Eastern European), but some actually weren't that accepting of my fiance when she came to visit. People have a tough time dealing with different sometimes.   But Goddamn, high context communication. I'm so afraid of being too forward and everything being misconstrued T T"
pakistan,3c6ikf,zalib,1 point,Sun Jul 5 10:55:01 2015 UTC,"I'm afraid, nothing I do, nothing I think of, nothing I say to you can even begin to describe what Pakistani inlaws are like.   Damn - that sounds daunting."
pakistan,3c6ikf,zalib,7,Mon Jul 6 12:29:55 2015 UTC,Hey /r/Drudeboy! See you in /r/Islam quite alot. Good luck!
pakistan,3c6ikf,DoktorJeep,6,Sun Jul 5 15:23:30 2015 UTC,Thanks homes :)
pakistan,3c6ikf,Pleasant_Jim,8,Mon Jul 6 03:39:39 2015 UTC,Make sure the bed doesn't squeak. Music perhaps.
pakistan,3c6ikf,DoktorJeep,3,Sun Jul 5 15:55:33 2015 UTC,"If only that was an issue. Despite marrying a gora, she's a pretty ""good"" Pakistani girl."
pakistan,3c6ikf,rahmad,4,Mon Jul 6 03:33:21 2015 UTC,That is why they have 31 flavors @ Baskin Robbins.
pakistan,3c6ikf,Sunriseninja,6,Mon Jul 6 05:30:37 2015 UTC,"Sit in the room with the men and speak little to no words at all.   Pull out prayer beads and start whispering to yourself if someone asks you an uncomfortable question,  Wait for the women to serve the food and then get up and help yourself before anyone else can.  If you need an excuse to leave for a bit, run out to buy some paan  Play scrabble and don't complain when they start using Urdu words   Find out about which cousins your girls age didn't show up and make plans to hang out with them next time instead if you actually want to have fun with your new family."
pakistan,3c6ikf,sarsubz,2,Sun Jul 5 20:25:17 2015 UTC,"It's actually a really matriarchal household, interestingly enough."
pakistan,3c6ikf,callipygia,5,Mon Jul 6 03:40:15 2015 UTC,A lot of people assume that the men run shit in Pakistani families and never realise thats it's often far from the case.
pakistan,3c6ikf,l-sonya,2,Mon Jul 6 12:33:19 2015 UTC,"Exactly, why do you think the men are confined to one room."
pakistan,3c6ikf,Striker_X,4,Mon Jul 6 22:27:08 2015 UTC,"if family's over, food will be had.  love that food. just. love. it. comment about it. if it's homemade (especially) ask questions about it. talk to the cook (if it's one of the aunties, i.e.)  the old guard of pakistani women are largely homemakers, and even if they aren't they are part of a culture of homemaking.  the way to their hearts is through your own stomach."
pakistan,3c6ikf,offendedkitkatbar,3,Sun Jul 5 17:00:26 2015 UTC,the way to their hearts is through your own stomach.   That's beautiful.
pakistan,3c6ikf,l-sonya,4,Mon Jul 6 03:41:41 2015 UTC,"I have Pakistani in laws. They are really nice people. When I visit I dress more conservatively than my normal. Stay quiet, polite and answer when spoken to. Bring some gifts. I can't help you with the job situation, what you're saying is true, they want to be able to know their daughter will be cared for but also it's something to brag about. (ie Yes, my daughter married a non-Pakistani BUT he's a doctor/lawyer/engineer/etc). Good luck!"
pakistan,3c6ikf,The1stCanary,2,Sun Jul 5 13:52:09 2015 UTC,"Thank you :)   I understand where you coming from. There are a lot of things I admire about it and some things that bum me out, just like with any culture. And speak when spoken too... That'll come in handy for me actually."
pakistan,3c6ikf,Pleasant_Jim,4,Sun Jul 5 13:53:51 2015 UTC,"1) Ask you fiancee before hand what the structure of her family is. Who is the most respected, who is more chill. A big thing is respect: make sure you address everyone properly and be more on guard with the older folk. Cousins you can be chill with.   2)Be social. I have a couple of non-Pakistanis in my extended family and the most lasting impression comes from whether they speak to everyone or not. Try to be charming. The aunts will love you if you can make them laugh  3) Come up with answers for the personal questions before hand. Try not to make them detailed because they will ask you the same questions every time. It's better to be vague than to tell them everything and have to change it the next time you see them  4) Know what food you're going to eat and how to eat it. They will watch you eat and judge you on it.   Good luck! Once you get to know everyone, it won't be that hard. Congrats on getting engaged!"
pakistan,3c6ikf,WisestAirBender,3,Sun Jul 5 16:58:05 2015 UTC,"Ambiguity is a virtue. Noted. That makes sense.   And judged on eating, that's a little terrifying :P"
pakistan,3c6ikf,rahmad,4,Mon Jul 6 03:41:24 2015 UTC,"Practice modesty. Don't speak too much, especially to the women, but also try to exude confidence."
pakistan,3c6ikf,The1stCanary,3,Sun Jul 5 17:03:22 2015 UTC,Nothing. Just act normally.
pakistan,3c6ikf,Zazazakana,6,Sun Jul 5 13:12:30 2015 UTC,"That strategy didn't work very well for me last time I visited :P  Apparently it's not okay to say, ""later, baby bear"" to your future brother-in-law."
pakistan,3c6ikf,Zazazakana,11,Sun Jul 5 13:30:20 2015 UTC,"""later, baby bear""   HAHAHHAhahAHHAH ( ͡͡ ° ͜ ʖ ͡ °) yeah... don't say that :P"
pakistan,3c6ikf,sak_14,5,Sun Jul 5 13:36:15 2015 UTC,"My fiance was like ""duuuude, you can't get that familiar with people that fast."""
pakistan,3c6ikf,Striker_X,8,Sun Jul 5 13:38:30 2015 UTC,"Apparently it's not okay to say, ""later, baby bear"" to your future brother-in-law.   😂😂😂😂 LOOOOL omg, I like you already, hope your in laws will as well.  Full disclosure though; In laws are a freakin pain regardless of whether you're Pakistani or not :/"
pakistan,3c6ikf,sulaymanf,2,Sun Jul 5 15:33:27 2015 UTC,I can see that from my parents :)
pakistan,3c6ikf,Striker_X,1 point,Mon Jul 6 03:34:24 2015 UTC,Thanks :) Good advice!  and thanks for making it easy on your brother-in-law!
pakistan,3c6ikf,tejmuk,3,Sun Jul 5 19:39:37 2015 UTC,"Calling someone you don't know well enough ""baby bear"" is creepy in any culture."
pakistan,3c6r30,sak_14,1 point,Sun Jul 5 11:03:02 2015 UTC,".... What next Zimbabwe funding mqm?  Because according to sources of r/Pakistan comment section,  USA, India, UK, Afghanistan, Saudi Arabia and now China has funded mqm"
pakistan,3c6r30,Thelog0,5,Sun Jul 5 17:36:00 2015 UTC,"china cutting is different than you think.It's not blamming china or anything relating to china, its a method in which people keep cutting land that doesn't belong to them.  more information at: http://pkpolitics.com/discuss/topic/what-does-china-cutting-mean"
pakistan,3c6r30,nonotmeplx,1 point,Sun Jul 5 18:39:05 2015 UTC,Killers' gotta eat too
pakistan,3c6r30,isalmanr,1 point,Sun Jul 5 13:30:21 2015 UTC,"Wow! Nice justice system you got there. A trail that lasted couple of minutes behind closed doors in which the defendant, whose face was covered confessed and was sentenced on the spot without a public hearing. Then you wonder why your country is shit."
pakistan,3c6nmn,ryzvonusef,12,Sun Jul 5 09:59:04 2015 UTC,WHAT THE.
pakistan,3c6nmn,KingJamesX,12,Sun Jul 5 10:01:27 2015 UTC,FUCK.
pakistan,3c6nmn,Cream1213,6,Sun Jul 5 10:03:34 2015 UTC,But that's.......
pakistan,3c6nmn,Thelog0,9,Sun Jul 5 17:39:18 2015 UTC,"Appeasement of Mullahs and assorted nut-jobs. There are some conspiracy nuts who think Mosque and mosquito have the same etymology.   This is most certainly a giant leap forward for the country, a bit like the moon landing was for America."
pakistan,3c6nmn,lightningbar0n,3,Sun Jul 5 10:47:50 2015 UTC,"Islamabad: The Pakistan Prime Minister, Nawaz Sharif, on Saturday approved a summary prohibiting English translation of Islamic terms meaning thereby the word “Masjid” would not be allowed to substitute with the English word “Mosque.”  Sacred Arabic names and words such as Allah, Masjid, Sala’at and Rasool are now forbidden to be translated into English as God, Mosque, Prayer and Prophet, as per the summary approved by the Prime Minister.  Religious scholars have appreciated the government’s move and stressed over implementation of the decision. Prominent cleric Mufti Naeem said that the decision is commendable but it should be enforced in letter and spirit. He appreciated the Prime Minister for taking the decision in the holy month of Ramzan."
pakistan,3c6nmn,boomaya,5,Sun Jul 5 09:59:40 2015 UTC,Lol wtf goies. Why u so stupid.
pakistan,3c6nmn,isalmanr,5,Sun Jul 5 14:57:23 2015 UTC,much appreciated
pakistan,3c6nmn,hugga4u,3,Sun Jul 5 13:38:11 2015 UTC,"Yeah, such a big day for humanity."
pakistan,3c6nmn,sufimalang,4,Sun Jul 5 19:47:03 2015 UTC,both the articles on pak reddit about this topic are indian news web sites. post a Pakistani reference or GTFO.
pakistan,3c6nmn,IzmailPirzada,1 point,Mon Jul 6 03:59:35 2015 UTC,http://www.pakistantoday.com.pk/2015/07/04/national/govt-forbids-english-translation-of-sacred-islamic-names-words/  http://www.samaa.tv/pakistan/04-Jul-2015/govt-forbids-english-translation-of-sacred-islamic-names-terms
pakistan,3c718q,shahkhan1230,4,Sun Jul 5 13:44:41 2015 UTC,"Unless the guy who died was a suicide bomber (in which case good riddance) yours is a really insensitive comment. Would you like it if a Pakistani (or anyone for that matter) thumbed their nose at you after there was a blast in India?   Obviously, anonymity allows us to be assholes on the internet, but would it not be better if we did not really draw down upon that privilege again and again?"
pakistan,3c5skb,mo_rar,12,Sun Jul 5 02:17:04 2015 UTC,I think the real issue is poondi which should be kept in check. Paki boyses are too much fond of ogling at girls and this problem is not confined to this particular mall. It is a much bigger problem.
pakistan,3c5skb,Paki_mon,3,Sun Jul 5 03:39:43 2015 UTC,https://www.facebook.com/BindasLog/videos/vb.318403908221067/740850212643099/?type=2&theater  The only way to stop oogling
pakistan,3c5skb,sak_14,6,Sun Jul 5 12:50:12 2015 UTC,So now members of the lower class are not allowed to look at richer women?
pakistan,3c5skb,lightningbar0n,16,Sun Jul 5 09:35:42 2015 UTC,I don't think you have ever been at the receiving end of pindi boys. Some of these guys are true creeps
pakistan,3c5skb,KingJamesX,4,Sun Jul 5 10:26:54 2015 UTC,"I'm sure they are. The world is full of creeps, I just find the attitude of Islamabad's entitled few to hard working, poorer residents of a neighbouring city be even more disturbing and creepy."
pakistan,3c5skb,lightningbar0n,3,Sun Jul 5 10:38:09 2015 UTC,No.  Rich class is saying pay Rs100 to google at us.  Rich class is cheap.
pakistan,3c5skb,2oosra,1 point,Sun Jul 5 10:29:18 2015 UTC,"It's not confined to class (though that does play a part I'd say in other issues), and it's not just ""looking at""."
pakistan,3c5skb,SamBoosa58,0,Tue Jul 7 07:50:00 2015 UTC,"""oogling"" this made my day"
pakistan,3c5skb,Muck113,1 point,Sun Jul 5 05:24:50 2015 UTC,Edited. Happy now?
pakistan,3c5skb,Paki_mon,7,Sun Jul 5 13:00:36 2015 UTC,"I find this funny because my family always complains of how Islamabad's population has exploded and brought ""undesirables"" in (Centaurus included). But when I point out the only reason they have  an issue with it is because they have a sense of class entitlement, they adamantly refuse that that's the case."
pakistan,3c5skb,IzmailPirzada,3,Sun Jul 5 02:57:16 2015 UTC,Class tends to make people uncomfortable. No one wants to talk about how they're fucking other people over.
pakistan,3c5skb,Zazazakana,5,Sun Jul 5 03:59:05 2015 UTC,"My family is similarly stubborn when it comes to ignoring their own rotten elitist mindset. When I moved back to the west at the age of 19 I found that a society where people actually do their own damn cooking/cleaning - i.e. wipe their own asses, is usually much more level headed and responsible. I think we have 6 full time workers at my house and I have always told my parents this is a sign of cultural rot (they seem to shrug it off as I am a heretic who cannot be saved)."
pakistan,3c5skb,lightningbar0n,1 point,Sun Jul 5 09:38:36 2015 UTC,In an economic sense the servants need these kinds of jobs till the economy fully industrializes. Without it what else will they do with their limited skill set?
pakistan,3c5skb,YouHaveTakenItTooFar,1 point,Sun Jul 5 14:05:32 2015 UTC,"Although my parents pay well, these employees still have no formal contracts and are therefore open to mistreatment, they are essentially part of an socio-economic underclass that serves the rich. People frequently, kill, torture and rape their servants and this they can do with impunity, often when a rich individual has killed a member of this poor underclass they are allowed to get away with it by paying blood money (sanctioned by Islamic Law) -  that is if it gets taken to court at all, usually a much smaller settlement will be agreed upon privately.   I do not think it is economically productive for these people to be wiping the asses of the rich, the same way it is a waste of resources for an economy to specialise in the provision of luxury goods, what good do Rolex watches and diamond rings provide to society at large? None whatsoever, yet they beef up GDP figures and might be described by some as being ""good for the economy"".  It is often argued that if we do not employ these people, they will be forced to go into farming, perhaps even farming is better in a country where people frequently starve to death."
pakistan,3c5skb,lightningbar0n,2,Sun Jul 5 15:14:42 2015 UTC,"Luxury is a subset of art, and art provides utility in itself. Not everyone should become STEM majors. Besides, it makes no sense sending people into farming when you need less people year after year for agriculture."
pakistan,3c5skb,YouHaveTakenItTooFar,1 point,Sun Jul 5 16:12:53 2015 UTC,"I think in a country where resources could be put to much better use and the basic needs of people aren't being met - in that specific context having a large swathe of people employed in assuring the luxury of a few is a waste of resources.   Even outside that context, economies like London's will soon find that industries that cater to the needs of the rich do not really do much for the larger economy. Sure it looks good on paper, 100,000 people employed in fine dining for instance, but historically these measures have been harbringers of economic peril.   I am no economist, but common sense says that if you are looking to build a foundation for a strong economy, you'd rather your major industries were more ""useful"" to people at large. i.e. car manufacturing as opposed to private jets"
pakistan,3c5skb,lightningbar0n,5,Sun Jul 5 17:48:07 2015 UTC,"But what about harassment by these 'unentitled classes', such as whistling, blatant staring, following etc."
pakistan,3c5skb,Playear,4,Sun Jul 5 06:49:42 2015 UTC,"I think, if anybody is caught actively harassing another individual then mall security is welcome to escort them off the premises.   Staring is not harassment, everybody has the right to look at anybody else in a public space, male/female whatever.   Since when did a whistle kill anybody?   The idea that public spaces should be quarantined for the rich is what's truly sickening here."
pakistan,3c5skb,lightningbar0n,0,Sun Jul 5 09:41:03 2015 UTC,What? This happened inside Centaurus like whistling and following? Staring is sth you can't sto.
pakistan,3c5skb,sak_14,3,Sun Jul 5 09:26:10 2015 UTC,"I have spent most of my life in England, but have also lived a few years in Pakistan, most of which were spent in my ancestral hometown of Peshawar. I was always shocked by the elitism and sheer arrogance of my cousins and relatives in Islamabad. In fact, a culture of elitism and aloofness from the rest of the country pervades the capital and its residents see themselves as rockstars in a new age.   I'll be honest with you guys I've been around the world - London, New York, Tokyo, Beijing, you name it - I've yet to see such pronounced class divisions anywhere."
pakistan,3c5skb,lightningbar0n,5,Sun Jul 5 09:34:13 2015 UTC,"If you want to see how the British were before 1947, you have to just take a look at this prevalent elite class. Their elitism was a product of racism. Their gap was filled by a select few. These people not only took the status but also took on the persona/psyche of the British Raj."
pakistan,3c5skb,lightningbar0n,1 point,Sun Jul 5 20:45:14 2015 UTC,"Certainly, I agree."
pakistan,3c5skb,KingJamesX,5,Sun Jul 5 20:58:50 2015 UTC,"Beijing, you name it - I've yet to see such pronounced class divisions anywhere.   Did you say Beijing? I hope you're joking! They literally ban people from rural areas settling in Beijing  Also, Tokyo is elitist and racist as fuck. They look down on every person thats not Japanese.   Not great examples m8"
pakistan,3c5skb,lightningbar0n,1 point,Sun Jul 5 09:59:44 2015 UTC,"Tokyo is not elitist, in fact Japan has a very large middle class, as a nation class divisions are not as pronounced, at least among the general public. Doesn't mean there aren't rich people in Japan, but most people are educated to some degree and earn a decent income.   The Japanese are an isolated and ethnically homogenous nation, they are most certainly xenophobic to outsiders, but there are very few outsiders settled in Japan as a result of their closed-border policies. I don't know why you raised this point though as it is unrelated to domestic elitism  In the case of Japan you are confusing xenophobia with elitism, which are two different things.  While there are class divisions in Beijing, the idea that there is an underclass living in a sister city that is unwelcome in the richer city next-door is still unheard of. Gentrification is common in most cities but not to the extent of Pindi v Islamabad."
pakistan,3c5skb,KingJamesX,4,Sun Jul 5 10:13:12 2015 UTC,Elitism and xenophobia are often inter related.  I have been to alot of cities as well and isloo is definitely not on the top of classism. See paris with their ghettos and how their job prospects get severely diminished if they mention they are from there
pakistan,3c5skb,lightningbar0n,2,Sun Jul 5 10:19:48 2015 UTC,"Elitism and Xenophobia, while often interrelated have no relation in the context of Tokyo, the vast majority of Japanese society is middle class and they face little discrimination in Tokyo.  I have been to Paris numerous times, there is definitely an issue with gentrification in London/Paris, there are people who are pigeonholed into deprived Ghettos and so on but if you are seriously suggesting that French society (although riddled with its own issues) is anywhere near as elitist as Pakistani society you are deluding yourself.  What proportion of French people live in high walled houses with servants (who are not paid minimum wage and denied contracts)?   You need a major reality check, compared the rest of Pakistan Islamabad is a microcosm of relative wealth and with that comes elitism."
pakistan,3c5skb,iwantramen,2,Sun Jul 5 10:31:40 2015 UTC,"If they wanna have a entrance fee that's fine, though I don't agree with it, but then it should apply to everyone. I get some of the exemptions like children and senior citizens but it's pretty ridiculous otherwise."
pakistan,3c5skb,lightningbar0n,4,Sun Jul 5 13:21:32 2015 UTC,"You should feel guilty, only a self-important prig would have that attitude. The real sickness is how our people are abused and denied basic human rights by construction companies in Dubai/Qatar.   It is government policy in Dubai to hide labourers and keep them away in unlivable camps so that they don't tarnish the prosperous image of Dubai. The sheikhs of Dubai are human garbage, a major shit-stain on the planet.   The water those labourers drink is not even desalinated properly."
pakistan,3c6o0h,ryzvonusef,2,Sun Jul 5 10:05:48 2015 UTC,Easier to drone them?
pakistan,3c6hkl,saurongetti,3,Sun Jul 5 08:06:36 2015 UTC,Non-Orwellian Heading: Rupee to be debased(devalued) to pay as Inflation Tax to Empire of the United States
pakistan,3c6hkl,Paranoid__Android,1 point,Sun Jul 5 08:08:43 2015 UTC,"Damn, I hate to agree with you, but I agree at the end of the day over the longer period this is an Inflation Tax to the US Empire. They are using their printing powers a bit too casually these days. However, in the shorter term, our countries DO need USD reserves."
pakistan,3c6hkl,lightningbar0n,0,Mon Jul 6 05:47:24 2015 UTC,LOL
pakistan,3c6hkl,zalib,1 point,Sun Jul 5 09:44:46 2015 UTC,"You will never get rich, the market is rigged for a few rich people.  Just like the games at the fair."
pakistan,3c66wa,Peryaane,5,Sun Jul 5 05:18:09 2015 UTC,"Great news, I sincerely hope the energy crisis in Pakistan will end soon."
pakistan,3c6q1v,ryzvonusef,2,Sun Jul 5 10:44:39 2015 UTC,"Only 13,000 more MW and we can light up Chicago."
