pakistan,3co6n0,TotallyNotObsi,2,Sat Jul 11 00:11:16 2015 UTC,"To actually answer your question though...  Yes. I belong to Dashti/Dasti Baloch tribe. However, as we are settled on the right bank of the Indus we speak Saraiki and no longer speak Balochi. We do maintain a Sardari system but not as rigorous or binding as one may see in Balochistan proper. The people of the tribe meet in large jirga fashion to discuss prevalent matters. This is especially true in matters of who to support for an election or events like the floods. There is a Sardari family, meaning chief family of the tribe, from whom the Tumandar (chief) is always from. Upon the death of one the whole tribe meets and discusses/selects/accepts the next leader. This is finalized by a respected elder wrapping the turban around the head of the new leader.   Most issues are usually land/qabza issues, thefts of cattle, settlement of debts, etc etc. These are mainly civil in nature and there isn't much of a hierarchy involved. It is more akin to arbitration by elders of the tribe, with consent from Sardari family.   Practically speaking, the main value of a tribal system as it exists in our tribe is not the feudal aspect as the tribe itself was a slave tribe of the Rind; neither the civil aspects as most disputes are minor and things don't usually get to a point of full-scale community involvement; but rather in 2015 the biggest benefit of being in a tribe of decent numbers and aligning with other tribes is that you can get the man you want elected locally -- whether or not the Establishment approves.   Those of you familiar with Pakistani politics must have heard the name of Jamshed Dasti.  Though the Sardari family disputes his claim of being a Dasti, they did not put obstacles in his way by nominating another candidate since the main bulk of the tribe supported him. However, even though he is an MNA and wielding considerable power (and was so at the time of the existing chief's death) no one of the tribe even considered him to be the next head. Status and wealth do not outweigh lineage in these matters.  As all tribes do, there are rivalries. But as the heads and people are not as jahil as before there is less violence. Historically, the Dastis and Khars of Kot Addu (Yes, Ghulam Mustafa and Hina Rabbani) are enemies and the Gurmanis (Mushtaq Ahmed) are/were (not sure anymore) allies. This is seen mostly in politics though.   Interesting side note though. The Khars are Jat and have a panchayat model. Ghulam Mustafa's daughter is Aminah Haq (model/actress). It is rather well known that G.M. issued and edict to his clan and allies that should she ever enter into Muzaffargarh district to kill her on sight. I don't know if this is still standing or even if it was just widespread rumor.  A very bad example of Sardari tribal system is the Mukhtara Mai case, also in Muzaffargarh. You can read about the incident here."
pakistan,3co6n0,TotallyNotObsi,1 point,Sat Jul 11 06:42:41 2015 UTC,"Mukhtār Mā'ī:       Mukhtaran Bibi (Punjabi, Urdu: مختاراں بی بی‎, born c. 1972,  now known as Mukhtār Mā'ī,  ur) is a Pakistani woman from the village of Meerwala, in the rural tehsil (county) of Jatoi of the Muzaffargarh District of Pakistan. In June 2002, Mukhtār Mā'ī was the survivor of a gang rape as a form of honour revenge, on the orders of a tribal council of the local Mastoi Baloch clan that was richer and more powerful as opposed to her Tatla clan in that region.    Although custom would expect her to commit suicide after being raped,    Mukhtaran spoke up, and pursued the case, which was picked up by both domestic and international media. On 1 September 2002, an anti-terrorism court sentenced 6 men (including the 4 rapists) to death for rape. In 2005, the Lahore High Court cited ""insufficient evidence"" and acquitted 5 of the 6 convicted, and commuted the punishment for the sixth man to a life sentence. Mukhtaran and the government appealed this decision, and the Supreme Court suspended the acquittal and held appeal hearings.  In 2011, the Supreme Court too acquitted the accused.  Though the safety of Mukhtaran, and her family and friends, has been in jeopardy  she remains an outspoken advocate for women's rights. She started the Mukhtar Mai Women's Welfare Organization to help support and educate Pakistani women and girls. In April 2007, Mukhtar Mai won the North-South Prize from the Council of Europe.  In 2005, Glamour Magazine named her ""Woman of the Year"".  According to the New York Times, ""Her autobiography is the No. 3 best seller in France , and movies are being made about her. She has been praised by dignitaries like Laura Bush and the French foreign minister"".  However, on 8 April 2007, the New York Times reported that Mukhtar Mai lives in fear for her life from the Pakistan government and local feudal lords.  General Pervez Musharraf, the former president of Pakistan, has admitted on his personal blog  that he placed restrictions on her movement in 2005, as he was fearful that her work, and the publicity it receives, hurt the international image of Pakistan.    Image i     Relevant: Bibi (title) | Rape in Pakistan | Nasir-ul-Mulk | Inzari   Parent commenter can toggle NSFW or delete. Will also delete on comment score of -1 or less. | FAQs | Mods | Call Me"
pakistan,3co6n0,Cicerotulli,1 point,Sun Jul 12 09:08:37 2015 UTC,What's Wakhri type?
pakistan,3co6n0,Shaanistan,1 point,Sun Jul 12 09:09:55 2015 UTC,"I think it means, that's amazing or special."
pakistan,3co6n0,Shaanistan,1 point,Fri Jul 10 01:27:47 2015 UTC,What language?
pakistan,3co6n0,Zaindy,2,Fri Jul 10 02:38:50 2015 UTC,"Punjabi, Seraiki."
pakistan,3cqyh7,iamyounow,3,Fri Jul 10 01:48:26 2015 UTC,"www.transferwise.com they will give you the best exchange rate. they will charge fee, transfer only to a bank and will take about 3 days.  westernunion moneygram etc .. they will give you a very bad exchange rate, plus their fee is more than transferwise, however once you give them money, the money can be picked up instantly in Pakistan. in a few minutes.  I use transferwise and never use westernunion moneygram etc .."
pakistan,3cqyh7,sufimalang,1 point,Fri Jul 10 08:14:44 2015 UTC,transferwise    this requires a bank account?
pakistan,3cqyh7,sufimalang,-1,Fri Jul 10 08:33:36 2015 UTC,"yes, you will need bank account in both countries, if you decide to go with this then please PM me, I will send a referral link that way I will get some bonus as well :D"
pakistan,3cqyh7,reddevilz11,2,Sat Jul 11 06:52:09 2015 UTC,"Your best option would be Western union or Moneygram. Yes options such as xoom and transferwise are available, and they offer better exchange rates plus a lower transfer fee, but there is a caveat. With xoom and transferwise you 1) have to have a bank account. 2) The Govt deducts i think 6% when the money is deposited to the account. 3) takes a couple days for Funds to be available.  With Western Union or Moneygram you pay a slightly higher fee and get lower exchanges, but no bank account required and can get money instantly. Hope this helps."
pakistan,3cqyh7,sufimalang,1 point,Fri Jul 10 16:49:42 2015 UTC,Moneygram it is!
pakistan,3cqyh7,reddevilz11,0,Fri Jul 10 22:57:21 2015 UTC,"I did not pay the 6% you are talking about when I used transferwise, this 6% is a recent thing. So I will assume that both moneygram and westernunion will also have to implement it in Pak or risk losing the license to do business.   The exchange rate offered by WU & MoneyGram is so bad that it is a rip off."
pakistan,3cqyh7,It-Wanted-A-Username,1 point,Sat Jul 11 06:54:00 2015 UTC,"I sent money via xoom just last week and my cuz told me they took out a percentage, and sent WU yesterday as a eid present to a poor family in PK because they do not have a bank account and they got the exact amount they are to receive that was stated on my receipt over here in the US. so i dont know what experience you had. but mine was different and satisfactory."
pakistan,3cqyh7,TheBrokenMan,1 point,Sat Jul 11 18:19:17 2015 UTC,I'm not sure if it's the best option but you can always do a wire transfer.
pakistan,3cntpf,abs2k12,8,Thu Jul 9 10:21:04 2015 UTC,It feels that TTP is getting weaker. Lets hope for more.
pakistan,3cntpf,HJMaverick,3,Thu Jul 9 14:02:36 2015 UTC,This dude had left TTP for ISIS. Maybe he'll get more than 72 hooris for that.
pakistan,3cntpf,Paki_mon,1 point,Thu Jul 9 14:40:58 2015 UTC,You're a very funny man.
pakistan,3cntpf,Zazazakana,1 point,Thu Jul 9 16:48:19 2015 UTC,/u/Zazazakana warza pe
pakistan,3cntpf,Paki_mon,0,Fri Jul 10 14:01:13 2015 UTC,Many of them just melt away or join other groups. Or move to Afghanistan. It's a long fight.
pakistan,3cntpf,TotallyNotObsi,6,Fri Jul 10 01:30:20 2015 UTC,Good riddance
pakistan,3cntpf,Paki_mon,3,Thu Jul 9 11:58:58 2015 UTC,"Dear drones, please also help Fazlullah meet his maker ASAP. Thank you."
pakistan,3cntpf,Cicerotulli,3,Thu Jul 9 12:06:12 2015 UTC,Fuck Yeah
pakistan,3cntpf,DroidsRugly,4,Thu Jul 9 13:52:59 2015 UTC,"Good riddance but how many civilians did these drone take out as well? Have we just stopper listing civilian causalyies, and forgotten what drones really do?"
pakistan,3cntpf,the_brown_stockton,-2,Thu Jul 9 15:54:02 2015 UTC,"What do you expect from the stupid users in this sub? This was in Afghanistan, but they support drone strikes and military campaigns in FATA too, and then throw tantrums when people from those areas bash Pakistan."
pakistan,3cntpf,Zazazakana,2,Thu Jul 9 16:48:07 2015 UTC,So what solution do you propose to the terrorism in Pakistan that doesnt involve using military force?
pakistan,3cntpf,ahyuknyuk,-4,Thu Jul 9 17:31:19 2015 UTC,"Armed resistance is needed, but it has to come from the people themselves. The government can arm the lashkars in those areas, instead of completely betraying them to the Taliban. I'm not going to support military operations carried out by a force that has more blood on its hands than the Taliban do (1971, Balochistan) and which continues to use religious extremists as proxies."
pakistan,3cntpf,Zazazakana,8,Thu Jul 9 17:58:43 2015 UTC,"And how would this result in less bloodshed?  It might even result in more considering a conflict between two groups which have more or less the same firepower will last longer.  In order to drive the Taliban out quickly we need jets, helicopters, heavy artillery and a professional disciplined armed force.  Doing it your way would only result in prolonging the conflict.  And how are Bangladesh and Balochistan even relevant? Bangladesh and Balochistan had/have armed independence movements which should have been dealt with politically but they werent so thats how it turned out.  The TTP and IMU however have the goal of creating pockets of their own territory in Pakistan ruled under medieval Shariah law. They want to expand these pockets of territory as far as they can and use them to export their brand of Salafi terror into the neighboring regions. This is intolerable and absolutely requires our army to hit them as hard as they can.  Have you been to Swat recently? I was there about a year ago. Ask them what life was like for them under the Taliban and ask them if they like being governed by the Taliban or the army(practically zero presence of the police or civilian government in Swat, all security and administration is carried out by the army)."
pakistan,3cntpf,ahyuknyuk,-4,Thu Jul 9 18:24:26 2015 UTC,"In order to drive the Taliban out quickly we need jets, helicopters, heavy artillery and a professional disciplined armed force.   Yeah, and that means tons of civilian casualties. Just because you don't hear about them because of the media blackout doesn't mean it's not an issue. Just look at pictures of Miranshah now. Its been reduced to rubble. It looks like Aleppo or Gaza.  The Taliban are guerrilla fighters and it would be good to fight them with an unconventional force. The lashkars know the area, the language, and how to fight. I'd much rather have well armed militias defending their communities than have the Pakistan Army commit its war crimes.   And how are Bangladesh and Balochistan even relevant?   My point was about the brutality of the army. The historical record is very clear. The Pakistan Army is an institution that has committed genocide against its own people (Bengalis were Pakistanis at the time).   Have you been to Swat recently? I was there about a year ago. Ask them what life was like for them under the Taliban and ask them if they like being governed by the Taliban or the army(practically zero presence of the police or civilian government in Swat, all security and administration is carried out by the army).    Lmao, I'm from Malakand and lived in Swat for seven years."
pakistan,3cntpf,Zazazakana,8,Thu Jul 9 18:34:23 2015 UTC,"Yeah, and that means tons of civilian casualties. Just because you don't hear about them because of the media blackout doesn't mean it's not an issue. Just look at pictures of Miranshah now. Its been reduced to rubble. It looks like Aleppo or Gaza.   Name one conflict without civilian casualties. And doing it your way would make the conflict last at least 8 to 10 years, because a tribal lashkar does not have the destructive power that a jet or helicopter does, a lashkar could take 3 days to destroy a Taliban stronghold whereas 3 jets can do it in 15 minutes. This way it should be done in two, with the military remaining in the region to keep security and prevent the Taliban from regaining a foothold.   The Pakistan Army is an institution that has committed genocide against its own people (Bengalis were Pakistanis at the time).   Its been 44 years. Anyone involved in the 1971 atrocities is dead or retired. Name one army which one could not accuse of genocide or needless slaughter during an armed conflict.   Lmao, I'm from Malakand and lived in Swat for seven years.   Then you must have heard the stories right? Women flogged in public because a little too much skin could be seen on their wrists? People having their ears cut off for listening to music? The collapse of the tourism industry which feeds and clothes a large segment of the Swati population? Trout farmers having their water reservoirs poisoned because they failed to pay the Taliban their extortion money? Parents having their children stolen from them so that their boys can turned into suicide bombers and their daughters can be married to Taliban commanders?  The Pakistan army has a lot of blood on its hands, because it is a military force. And a military is the institutionalization of violence. Its that simple.  However the Pakistan army does not commit all those atrocities committed by the Taliban I mentioned above."
pakistan,3cntpf,ahyuknyuk,-5,Thu Jul 9 19:11:55 2015 UTC,"Name one conflict without civilian casualties.   Is that your argument? No conflicts are nonviolent, but some are carried out more carefully than others. The operations launched by the Pakistan Army are worse than what the Americans do in Afghanistan. You can't justify war crimes and atrocities by simply saying that other military offensives result in deaths too.   Its been 44 years. Anyone involved in the 1971 atrocities is dead or retired. Name one army which one could not accuse of genocide or needless slaughter during an armed conflict.   The Pakistan Army is an institution, not some random group of individuals. If you want to understand the way it operates, you study the historical record. That's what serious people do. Even if you think the army is different from what it was like during 1971, I also mentioned Balochistan. What the army is doing there is absolutely unacceptable. Or look at what they did in Okara. Or their secret policy of murdering journalists. Or all the coups and years of military dictatorship. The fact remains that the army you love so much is a brutal institution, and counting on it to take care of a mess that it created itself is practically the definition of delusion.   Then you must have heard the stories right?   Yes, I heard them from my own family. I also heard about the indiscriminate bombing of densely populated areas, the arbitrary abductions, the torture of suspected militants, the extrajudicial executions, the dropping of bodies form helicopters, the violence against independent journalists, and the public display of mutilated prisoners in the markets. See, you seem to think I support the Taliban, which is why you needlessly mentioned their crimes to me. I don't. I'm against negotiations and operations. You, OTOH, do support the army and its murderous operations, which is why I'm telling you all this.   However the Pakistan army does not commit all those atrocities committed by the Taliban I mentioned above.   So? That means absolutely nothing at all. As I stated earlier, the Pakistan Army commits violence in its own way."
pakistan,3cntpf,Zazazakana,5,Thu Jul 9 19:21:58 2015 UTC,"The operations launched by the Pakistan Army are worse than what the Americans do in Afghanistan.   Now thats a VERY bold claim. I didnt downvote any of your comments before this because thats an immature thing to do in a debate but I did downvote this one because of this.  Not only was the American occupation of Afghanistan a needless conflict which the the conflict in FATA is NOT(The war in Afghanistan was about retribution, the war in FATA is about protecting the people of Pakistan from an enemy. The American people were protected from Afghan militants by the North Atlantic Ocean and the combined landmass of Europe and Central Asia. The people of Pakistan are not), you seem to think the American Army does not torture(unless you believe 'enhanced interrogation' is not torture), you seem to think that the American military does not abduct and worst of all America launched stupid war without an endgame in mind.   I also mentioned Balochistan.   Balochistan, like I said earlier is an independence movement. The problem their is that its a group of people who do not want to identify themselves as Pakistani. The conflict against the Taliban is not an independence movement it is an occupation by a group of criminals(many of who are not even Pakistani) who want to topple the state and create their own emirate. What gives these scum the real courage to go about doing this is their belief that if they use civilians and civilian areas as shields against the Pakistan army they wont have to face the Pakistan army. Doing it your way proves them right.   The fact remains that the army you love so much...   I dont love the Pakistan Army, I believe its actions in the past have been wrong and have been wrong often and that its the old fatcat generals in the amry who are mainly the reason we still havent been able to have peace with India yet, peace which we need very much. However, I do know that for all its sins its the only stabilizing force in Pakistan, and if things dont get better for Pakistan it is the only institution which will be able to prevent balkanization and civil war.  I also know that if I am passing through a security check post I am much more likely to be harassed by a policeman who belongs to an institution run by the civilian government than by a soldier who belongs to the Pakistan Army. I respect and like talking to the lower and middle ranking members of the army. They are not the fatcat generals I mentioned above, they are men who follow orders, they do it well and they understand the concept of 'protect and serve' far better than the Pakistan Police.   Yes, I heard them from my own family. I also heard about the indiscriminate bombing of densely populated areas, the arbitrary abductions, the torture of suspected militants, the extrajudicial executions, the dropping of bodies form helicopters, the violence against independent journalists, and the public display of mutilated prisoners in the markets.   That this stuff happens is a sad reality and I cannot defend it. However, I will say that people in Pakistan do not respect the writ of state. They respect their own tribes, traditions, sects, religion etc. Countries cannot function this way. Were things different perhaps the Pakistan Army would not have to resort to this kind of terrorism(I'll admit this is terrorism). At the end of the day even in a place where nobody respects anything, everyone respects a loaded gun.  And the nature of the media in Pakistan is also a reason for all the secrecy. Remember how after the Lal Masjid incident somehow the army was seen as the bad guy and Abdul Rahid Ghazi was a hero? Even though anyone with a brain could see that the army and police gave them every chance to surrender peacefully. Gave them every chance to send out the women and children.  And this is the nature of guerrilla warfare in which one side is made up of insurgents who move in and out of the civilian population and the other side is a large, professional military with access to modern weapons and other tools of war. At the end of the day, the side which can keep fighting the longest wins. Its interesting because the FATA warzone is in Pakistan, even if nobody in the Pakistan Army is from that area. However a large number of the Taliban fighting force is Arab, Afghan, Uzbek, Chechen and Uighur so they also have places they can run to and not come back.  I'm not going to debate this with you any more. You want the fight against Taliban to have the minimum number of civilian casualties even if it means risking the war by using an inferior fighting force and I want the Taliban defeated using the only professional military we have. So we'll never agree. Whats the point?"
pakistan,3cntpf,ahyuknyuk,-3,Thu Jul 9 20:12:06 2015 UTC,"Not only was the American occupation of Afghanistan a needless conflict which the the conflict in FATA is NOT(The war in Afghanistan was about retribution, the war in FATA is about protecting the people of Pakistan from an enemy. The American people were protected from Afghan militants by the North Atlantic Ocean and the combined landmass of Europe and Central Asia. The people of Pakistan are not), you seem to think the American Army does not torture(unless you believe 'enhanced interrogation' is not torture), you seem to think that the American military does not abduct and worst of all America launched stupid war without an endgame in mind.   I'm talking about the way the two wars are being waged. Yeah, the Americans commit war crimes, but it pales in comparison to what happens in Pakistani military operations. With all the media and investigative reporting going on, we see a few cases of abuse being uncovered every once in a while with the Americans. In FATA and KPK, however, journalists aren't even allowed to operate freely and there are still hundreds of proven atrocities. It's all documented by leading rights groups, I can link their reports to you if you'd like. Just to give you an example, a few years ago, a mass grave was uncovered in Bajaur. Locals talked about the Pakistan army rounding up people arbitrarily and shooting them up. Did you even hear about this in the media? If something like that had happened in Afghanistan and the media heard about it, they would at least pretend to have an investigation, because there is some kind of accountability there. There's none here.   Balochistan, like I said earlier is an independence movement. The problem their is that its a group of people who do not want to identify themselves as Pakistani.   Again, you miss the point. I'm not comparing the Baloch to the Taliban, I'm talking about the army and its terrible human rights record. If they regularly commit crimes in Balochistan, they're probably doing the same in the tribal areas.   You want the fight against Taliban to have the minimum number of civilian casualties even if it means risking the war by using an inferior fighting force and I want the Taliban defeated using the only professional military we have.   And you somehow believe that the same group of thugs who created these militants (and continue to use them in certain places) bombing the shit out of FATA is the solution. Operations have been launched before and the Taliban are still there, but you can believe what you want to believe, dude."
pakistan,3cntpf,Zazazakana,1 point,Thu Jul 9 20:51:10 2015 UTC,Is this the same guy who threatened Jibran Nasir or am I thinking of another spokesman?
pakistan,3cntpf,TotallyNotObsi,2,Thu Jul 9 19:06:35 2015 UTC,That was Ehsanullah Ehsan.
pakistan,3cntpf,squarerootof-1,1 point,Fri Jul 10 01:31:55 2015 UTC,Seeing a pattern in their names.
pakistan,3cntpf,greenvox,1 point,Fri Jul 10 07:04:06 2015 UTC,"Its a style of nom de guerre for Taliban spokespersons. IIRC there used to be a Taliban information minister who got killed by the US, and Taliban started calling all spokesperson by similar style of names. Pakistani Taliban carried that tradition into TTP."
pakistan,3cntpf,Cicerotulli,0,Sat Jul 11 06:59:14 2015 UTC,Yay
pakistan,3cntpf,dhobi_ka_kutta,0,Sat Jul 11 08:14:21 2015 UTC,One less terrorist?
pakistan,3cntpf,dhobi_ka_kutta,0,Thu Jul 9 15:23:40 2015 UTC,Yay
pakistan,3cpbc7,sak_14,7,Thu Jul 9 18:07:33 2015 UTC,"Literally the whole sentence was corruption happens but the people hold the leaders accountable (i.e. via democracy). Not exactly something you should be talking about with kids, but this is just ARY news being ""fair & balanced""."
pakistan,3cpbc7,squarerootof-1,3,Thu Jul 9 18:47:47 2015 UTC,"Why the fuck is he even talking about that shit in front of them? Look at the kids ages (6-7yrs?), like they understand what hes saying..."
pakistan,3cpbc7,Striker_X,4,Thu Jul 9 18:35:22 2015 UTC,"Children would have enjoyed more, if he had sung ""Akar bakar bambay bo""."
