postpunk,32bs6s,weblypistol,2,Mon Apr 13 21:35:32 2015 UTC,"Here's my five minute quintessential list in no particular order: Joy Division, Pere Ubu, Gang of Four, Wire, Public Image Limited, Pylon, ESG, Section 25...  Keep in mind you'll want to stick to releases from 78ish to the mid-eighties typically. You might pick up a release and hate it only to realize another album is fucking awesome. For example, I don't particularly care for early Wire but Ideal Copy is awesome."
postpunk,32bs6s,Memnarchthe59th,2,Sun Apr 12 13:22:41 2015 UTC,The Sound  New Order  The Convent  Wire - Pinkflag  Section 25
postpunk,32bs6s,brightshinies,2,Sun Apr 12 15:02:23 2015 UTC,"A great book on the subject of postpunk is Rip It Up And Start Again by Simon Reynolds.  Its a pretty detailed history and examination of postpunk from 77-84.  Tons of important bands are covered in it.  It can be frustrating when you're new to postpunk that it is so diverse but when you read that book it kind of makes sense of how so many different sounds -from more of a punk style, to dub influenced sounds, to synthpop, to early industrial, to second generation ska, to goth -all get lumped under the postpunk banner depending on who you talk to."
postpunk,32aeii,monster_truk_madness,1 point,Sun Apr 12 01:15:39 2015 UTC,Here's a playlist that recollects the original 1987 4AD video compilation of artists release this was on. Lonely is an Eyesore
postpunk,32aeii,weblypistol,2,Mon Apr 13 11:43:02 2015 UTC,"Thanks!  This was a great compilation, I had it on cassette  - but they shouldn't have sequenced it with this song second - impossible to follow."
postpunk,32aeii,weblypistol,1 point,Mon Apr 13 15:15:13 2015 UTC,I was just looking at it and I am sure there is a Wolfgang Press track missing.  Edit. Originally track 3. Wolfgang Press - Cut the Tree.  https://www.youtube.com/watch?v=DKp-FhIF-Pw
postpunk,32auy3,ReverbandDelay,2,Sun Apr 12 03:53:59 2015 UTC,Shes the best
postpunk,328o3j,ssserpentskirt,3,Sat Apr 11 16:03:26 2015 UTC,I have an incommunicable love of Cope of the fab three. This song is joy. I like to pretend no one has heard Sunspots besides me.
postpunk,322kkt,miraoister,3,Fri Apr 10 01:46:16 2015 UTC,"Pretty great. If you haven't seen it, check out the video for Tell me Why. It's amazing!"
postpunk,31zb3k,forcehatin,3,Thu Apr 9 09:28:26 2015 UTC,Straight Joy Division worship. I love it.
postpunk,31zb3k,stonecoldbastard,2,Thu Apr 9 18:44:08 2015 UTC,I've been having a brain explosion over this change in genre. I love it though.
postpunk,31zb3k,fathervoodoo,1 point,Thu Apr 9 19:26:10 2015 UTC,Band has a long history of genre metamorphosis. I'm really into this most recent one.
postpunk,31zb3k,gangsta_turnip,1 point,Thu Apr 9 09:28:49 2015 UTC,"Sounds like they are going full on post punk with the new album, I dig it though.  It took me a few to get into Zoo seeing it was such a departure from how they started out sounding, and the fact that those three previous albums are three of my favorite hardcore albums ever, but once I didn't look at it in comparison to those and as it's own thing I really enjoyed it a lot. Stoked for the new album."
postpunk,31veau,miraoister,2,Wed Apr 8 13:38:42 2015 UTC,So much Depeche Mode.
postpunk,31veau,obsidianight,2,Wed Apr 8 13:56:27 2015 UTC,"This is great! I'm a casual New Order listener and I went through and came across a track I hadn't heard before called ""Procession"". Good shit."
postpunk,31veau,GG306,2,Wed Apr 8 16:12:23 2015 UTC,Didn't expect to see such a high amount of Crass.
postpunk,31veau,iZiReddit,1 point,Thu Apr 9 15:12:06 2015 UTC,"yeah weird that, then it suddenly changes by about 85' and the big labels have their own ""indie sub labels"" taking over..."
postpunk,31veau,weblypistol,3,Thu Apr 9 15:42:10 2015 UTC,Kylie Minogue
postpunk,31j1td,SoImadeThisSong,2,Sun Apr 5 15:58:50 2015 UTC,"Hmm, nice and psychedelic... I really have to want to hear the post in it. It's more like a pure shoegaze, though ou've got that sharp EQ on the drums right for Post Punk, though! Faen ti helvete you're good!"
postpunk,31j1td,TheInundation,1 point,Sun Apr 5 16:49:59 2015 UTC,"Haha, thank you! Listen to ""I don't want this to end"". Its less shoegazey and more post punky - at least the instrumentals. I do tend to lean more towards the new order sound than the joy division sound if one is to compare.."
postpunk,31j1td,ElasticDawg,2,Sun Apr 5 17:06:02 2015 UTC,Real purdy. I followed ya.
postpunk,31j1td,binhu,1 point,Sun Apr 5 20:02:54 2015 UTC,"Thanks man! Though I don´t think you actually followed me.. didnt pop up on the thing. Anyways, thanks alot! Appreciate it!"
postpunk,31j1td,binhu,1 point,Sun Apr 5 22:54:50 2015 UTC,"first track sounds a bit bassy/muddy for my taste.   second track sounds better and clearer. drums seem a bit dry, crash is maybe a bit too loud.   on the third track drums seem too dry and i think maybe too loud for the style. sounds poppier than the others with the vocal more upfront.   i think the 4th track has the best balance of them all."
postpunk,31j1td,binhu,1 point,Sun Apr 5 17:38:17 2015 UTC,"Thanks for the feedback! These are just demos, so they are not meant to sound perfect by any means. But really, thank you! You going down the list? Like from ""Wish I Knew"" to ""care""?"
postpunk,31f9e3,miraoister,2,Sat Apr 4 14:58:37 2015 UTC,The soundtrack from Urgh! A Music War is one of my favorites. Youtube Playlist
postpunk,31f9e3,Metalek,2,Sat Apr 4 17:15:17 2015 UTC,Fame! Jon Savage's Secret History of Post Punk  New York Noise
postpunk,31f9e3,huckingfipster,2,Sat Apr 4 18:36:37 2015 UTC,God's Favorite Dog  Tuatara  FAST PRODUCT: MUTANT POP aka The First Year Plan
postpunk,31f9e3,bidness_cazh,2,Sat Apr 4 20:49:45 2015 UTC,"I'll try and list some Australian stuff, as that's where my knowledge stems from.  Pardon Me For Barging In Like This: M Squared Rare Recordings 1979 - 1983  Can't Stop It!: Australian Post Punk 1978-1982  Can't Stop It! II: Australian Post Punk 1979-1984  The Fast Forward compilations  The Missing Link Story  One Stop Shopping  Primitive Calculators and Friends  Terrace Industry: M Squared Box 1980 - 1983 41 Pardons: M Squared Rare Recordings 1979 - 1983 Volume 1  Both of the above can be bought as a set here"
postpunk,31f9e3,ragablagah,1 point,Sun Apr 5 00:25:21 2015 UTC,Wanna Buy a Bridge?
postpunk,31f9e3,cgsparkly,1 point,Sun Apr 5 07:45:41 2015 UTC,http://en.wikipedia.org/wiki/Pillows_%26_Prayers
postpunk,31f6kk,amish_no_wave,1 point,Sat Apr 4 14:29:54 2015 UTC,Love Delicate Tension.
postpunk,319d7l,Bonphire,1 point,Fri Apr 3 01:11:20 2015 UTC,I immediately thought of this song.  https://youtu.be/ktPhG2MhV8o
postpunk,319hc9,Bonphire,1 point,Fri Apr 3 01:46:53 2015 UTC,More of a punk version
postpunk,3142ha,RTE2FM,1 point,Wed Apr 1 21:23:30 2015 UTC,such a cool woman.
postpunk,30yvi6,brightshinies,1 point,Tue Mar 31 20:36:10 2015 UTC,This is excellent. Adding the CD to my Amazon list!
postpunk,30ytgd,brightshinies,2,Tue Mar 31 20:22:24 2015 UTC,Love this band. THIS is what music on Sub Pop is supposed to sound like.   Can't wait for the new record.
postpunk,30x014,PangarFionn,1 point,Tue Mar 31 11:54:00 2015 UTC,Can anyone help me decipher the lyrics for Home? A great song but can't put it into perspective.
postpunk,30pp9e,Laetans,5,Sun Mar 29 17:02:45 2015 UTC,Why is this being upvoted? Go to r/newwave....
postpunk,30pp9e,ssserpentskirt,2,Mon Mar 30 08:38:38 2015 UTC,I don't think this is post punk either but there are such fuzzy lines here it has to be let be.
postpunk,30pp9e,weblypistol,2,Mon Mar 30 19:45:08 2015 UTC,Synth Pop.
postpunk,30ljpq,blackcake666,3,Sat Mar 28 13:47:42 2015 UTC,I always upvote 70s Wire stuff. This song makes me think of modern architecture.
postpunk,30ljpq,vaguelyhuman,2,Wed Apr 1 05:38:03 2015 UTC,One of my favorite songs ever.
postpunk,30j6yx,amish_no_wave,2,Fri Mar 27 20:53:24 2015 UTC,Grimy as fuck.
postpunk,30izpo,thefriendcatcher,1 point,Fri Mar 27 19:54:34 2015 UTC,"There's a cover of this by Uncle Tupelo somewhere, as well. I like it."
postpunk,30izpo,endless_sleep,1 point,Sat Mar 28 04:59:45 2015 UTC,This has 'class' written all the way through it like a stick of rock.
postpunk,30iv5x,Memeshaw,3,Fri Mar 27 19:19:35 2015 UTC,Self-titled for me but I've only dabbled thru the rest of their catalogue.  Guess I'll be checking out Night Time.
postpunk,30iv5x,Spodyody,2,Fri Mar 27 20:51:46 2015 UTC,"It's probably Brighter than a Thousand Suns the most but it's hard to say really. I really love Extremities but I honestly love all of them, yes even Outside the Gate, thought One Jump Ahead would probably get a skip from me."
postpunk,30iv5x,ZizzazzIOI,0,Mon May 11 11:30:04 2015 UTC,"I like Outisde The Gate too, America and My Love of this Land are really good songs. I love everything they've made as well, Hosannas is a really strong album too."
postpunk,30iv5x,onelasttime,2,Wed May 20 16:48:17 2015 UTC,"Brighter Than a Thousands Suns or Nighttime, but IMO Killing Joke is more of a ""singles"" band than an ""albums"" band."
postpunk,30iv5x,washington23,1 point,Fri Mar 27 21:53:36 2015 UTC,"1st, 2nd and 4th album are solid listens for me, but then yeah, everything after that is hit or miss."
postpunk,30iw0x,williamseezy21,1 point,Fri Mar 27 19:25:59 2015 UTC,agreed. The spirit of this recording trumps any technical aspect of the production
postpunk,30iw0x,weblypistol,1 point,Tue Mar 31 11:25:10 2015 UTC,"This is why artists are artists. They see something else, something wonderful. This sounds so shite but is an interesting insight."
postpunk,30fyly,HiltonSouth,1 point,Fri Mar 27 01:21:08 2015 UTC,There is something strangely wonderful and shambolic about this. I don't know if it is a Russian wedding reception or school leaving do but it is very warming. All I can offer in return is a steel drum carnival float playing  Transmission.
postpunk,30fyly,weblypistol,1 point,Fri Mar 27 01:36:19 2015 UTC,They're russian middle schoolers
postpunk,30fyly,mike_stifle,1 point,Fri Mar 27 13:57:55 2015 UTC,"Just downvote, no need to be a jerk."
postpunk,30cpei,Memeshaw,1 point,Thu Mar 26 08:13:16 2015 UTC,"I have no idea if Lydon had any control over the video but suspect he did. There is a picture on the wall that was very iconic of the early 70's, he had a thing with illness that made 'home' almost alien to him, plus the whole era. Read into it what you will."
postpunk,30cpei,weblypistol,0,Fri Mar 27 01:48:54 2015 UTC,"I know Lydon had Meningitis as a child, which makes sense with what you said, but I'm wondering what lines like ""Let's talk politics/Every dog has it's day"" mean in this context?"
postpunk,30cpei,weblypistol,1 point,Fri Mar 27 18:35:36 2015 UTC,"This is only me. Lydon has always stood up for the underdog so I read that part like that. Let's talk politics sounds like him getting fed up and arsey saying cut to the chase. So cut to the chase, you are talking shit here is reality and I am going to bite you on the arse.  It's a guess."
postpunk,30bf1z,amish_no_wave,1 point,Thu Mar 26 00:17:25 2015 UTC,Excellent. Making me think of a Savage Republic track but  can't place it
postpunk,30a4qc,weblypistol,3,Wed Mar 25 18:39:48 2015 UTC,Strange that the image with this is Revenge of the Goldfish by Inspiral Carpets.
postpunk,30a4qc,etchgtown,2,Wed Mar 25 18:55:17 2015 UTC,Now I have Saturn 5 earworming into my brain. Thanks for that.
postpunk,30a4qc,tornflags,2,Wed Mar 25 18:57:22 2015 UTC,this is amazing
postpunk,305y5e,HoneyVortex,4,Tue Mar 24 19:20:40 2015 UTC,"Great timing, I'm going to see them tomorrow and have been binging on the Swans because I'm so excited."
postpunk,305y5e,schadenfroyde,2,Tue Mar 24 20:13:09 2015 UTC,I saw them last summer. They were more 'The Seer' than The Burning world.  https://youtu.be/bzdw1MVJQME  Their percussion is unbelievable -much better than when I saw them in '88.
postpunk,305y5e,adrift98,1 point,Tue Mar 24 20:23:16 2015 UTC,Saw them a couple weeks ago. They were outstanding! Even got some time to talk to some of the band/management after the show at a bar. Great guys.
postpunk,30537w,Fuck_the_police,1 point,Tue Mar 24 15:37:52 2015 UTC,"great band, great label"
postpunk,30537w,GasedBod,1 point,Tue Mar 24 19:03:02 2015 UTC,awesome!
postpunk,3065yd,amish_no_wave,1 point,Tue Mar 24 20:16:02 2015 UTC,Quite liked the first track
postpunk,302ah4,Arcanal,1 point,Mon Mar 23 22:09:45 2015 UTC,"Has a Frank Black feel. Obviously needs production (expensive) and drum and bass needs punching up to my ear. But yeah, not bad."
postpunk,302ah4,weblypistol,2,Tue Mar 24 14:29:10 2015 UTC,thanks for the feedback!
postpunk,302ah4,earlyspirit,1 point,Tue Mar 24 15:16:26 2015 UTC,"Is the super lofi sound an aesthetic choice our just a lack of mixing ability or good equipment?  The composition is not bad but the sound it's definitely not my cop of tea.  Vocals, bass, and drums are too muddy.  Volume on bass and drums could come up.  The guitar sound sounds very digital.  Was it recorded on a real amp cause if not it could use a better amp sim.  Again all this applies only if you were not intending on this being lofi."
postpunk,302ah4,earlyspirit,1 point,Tue Mar 24 15:56:48 2015 UTC,I was inspired by the band Yuck so I guess I'm going for lo-fi.Seems like I definitely need to turn up drums and bass though. I actually don't have any real amps atm I just record everything through ableton. and thanks for the feedback it helps a lot!
postpunk,2zt00f,iofthebeholder,1 point,Sat Mar 21 13:56:21 2015 UTC,"discovered this band surfing youtube playlists, they have some pretty amazing songs,  kinda surprising they didn't receive wider recognition.   good luck finding whatever vinyl might still float around out there from the 80s, but you can download 17 awesome MP3s from their own website - http://personalcolumn.info/  so many solid songs, here's one with johnny marr-esque guitar sounds: http://personalcolumn.info/soundpc01/02same%20old%20situation.mp3  another great one with a fun, clash-y kinda pop vibe: http://personalcolumn.info/soundpc01/10dreamer%20in%20babylon.mp3  somebody should reissue this stuff!"
postpunk,2zqlwb,nat130,3,Fri Mar 20 20:38:25 2015 UTC,Cool but I'd hardly consider them pop icons.  I'm also going to have to echo the top comment on the article and say that most of Kotaku's reader base probably has no idea who these people are.
postpunk,2zqlwb,pikachuuuuu,2,Sat Mar 21 00:25:55 2015 UTC,I take it these are by the same guy who did the DC parody series with (mostly) the same musicians?
postpunk,2zqlwb,SaintBroody,2,Sat Mar 21 01:06:01 2015 UTC,"Ah, NOT Pop icons - those are post-punk gods. They eat pop artists for breakfast.  I still <3 Siouxsie. My teenage crush still lives.  edit: had to update when i realized it was PiL Johnny and not Sex Pistols Johnny."
postpunk,2zpvpv,damienlucifuge,1 point,Fri Mar 20 17:15:05 2015 UTC,Mmm Nick Cave.
postpunk,2zk6yz,Daenerys_Stormfag,6,Thu Mar 19 06:31:58 2015 UTC,not_sure_if_want.gif
postpunk,2zk6yz,Joe_Hole,3,Thu Mar 19 08:00:28 2015 UTC,I love it!
postpunk,2zk6yz,dazza20,1 point,Thu Mar 19 09:00:04 2015 UTC,Brilliant!
postpunk,2zk6yz,lightningp4w,1 point,Thu Mar 19 23:37:00 2015 UTC,source?
postpunk,2zaiq9,ynthona,0,Mon Mar 16 23:43:20 2015 UTC,"In my opinion The Sound are as good, if not superior to The Cure,  Joy Division etc.  R.I.P. Adrian Borland"
postpunk,2zaiq9,GermanBanana,2,Fri Mar 20 18:30:35 2015 UTC,I agree. There's just something more there with The Sound. Something that satisfies me more than other artists
postpunk,2z9sbg,amish_no_wave,1 point,Mon Mar 16 20:26:41 2015 UTC,it's soooo gooooooooooood
postpunk,2z9sbg,delanie,1 point,Tue Mar 17 05:01:26 2015 UTC,Here's their Bandcamp with all the songs from this tape and their other tape.  There's also a live tape floating around Blogspot.
postpunk,2zaxxc,L3aBoB3a,0,Tue Mar 17 01:47:27 2015 UTC,"I am gonna have to disagree.  The closer you get to Ultramega Ok, the more of a bad metal bar band they sound like.  And at the very least, Down on the Upside was their most pop-metal effort."
postpunk,2zaxxc,uzmifune,0,Tue Mar 17 04:43:17 2015 UTC,"Badmotorfinger? I'd say that's their most metal album. UltramegaOK had major production issues and many prefer Screaming Life/Fopp.   DOTUS was more alternative rock with 2 or 3 pretty punky songs imo. This song came off that album because it was supposed to show all the different styles of the band through the years (they decided to disband after it was released).   I'll just take the quote right off their wiki bc it's pretty solid:  Soundgarden were pioneers of the grunge music genre, which mixed elements of punk rock and metal into a dirty, aggressive sound. ""Soundgarden are quite good…"" remarked Black Sabbath's Tony Iommi, ""It's very much like the same sort of stuff that we would have done.""[102] Soundgarden's sound during the early years of the Seattle grunge scene has been described as consisting of ""gnarled neo-Zeppelinisms.""[103] The influence of Led Zeppelin was evident, with Q magazine noting that Soundgarden were ""in thrall to '70s rock, but contemptuous of the genre's overt sexism and machismo.""[104] According to Sub Pop, the band had ""a hunky lead singer and fused Led Zeppelin and the Butthole Surfers.""[105] The Butthole Surfers' mix of punk, heavy metal and noise rock was a major influence on the early work of Soundgarden.[105]  Black Sabbath also had a huge impact on the band's sound, especially on the guitar riffs[106] and tunings.[107] Joel McIver stated: ""Soundgarden are one of the bands I've heard closest to the original Sabbath sound"".[108] Soundgarden, like other early grunge bands, were also influenced by British post-punk bands such as Gang of Four and Bauhaus which were popular in the early 1980s Seattle scene.[109] Cornell himself said: ""When Soundgarden formed we were post-punk - pretty quirky. Then somehow we found this neo-Sabbath psychedelic rock that fitted well with who we were"".[110] Thayil described the band's sound as a ""Sabbath-influenced punk"".[111]  Either way, sometimes I like to post in other subs to discuss and maybe show people a song or two they might not know from a band plagued with a song like ""Black Hole Sun"" 😂"
postpunk,2zaxxc,uzmifune,0,Tue Mar 17 12:32:58 2015 UTC,What song by Soundgarden sounds like a Gang of Four song?
postpunk,2zaxxc,uzmifune,2,Wed Mar 18 03:46:48 2015 UTC,"Trying to give you the best answers here with citations. Here's a good mention from Thayil:    Paste: I have to tell you, I was into metal at the time, and you were the first Seattle band I checked out.  Thayil: Even before we slowed down and got more heavy and groove-oriented, we did stuff in weird time signatures. I don’t know how to describe it. Kinda like a Bauhaus-y-Gang of Four-Minute Men-ish-Big Boys amalgam. That was sort of before and up to Screaming Life. I mean you hear a little bit of that in “Hunted Down” or “Entering”—that sort of quirkiness or gothiness. But when we slowed down that quirkiness manifested itself in a sort of prog rock sort of quality. I remember when Badmotorfinger came out, and I remember Mark [Arm] from Mudhoney said, “Hey man, I just heard Badmotorfinger.” I’m all, “What do you think?” [Laughs] And he’s like, “Fuck, it sounds like Rush!”   I definitely hear more of the prog in their early stuff but sometimes I feel like I can't trust myself to be as objective when it comes to this band because I'm such a big fan and I've listened to their discog extensively so I may hear things differently. If that makes any sense."
postpunk,2zaxxc,LittleHelperRobot,0,Wed Mar 18 03:59:24 2015 UTC,"Yeah I think Mark Arm's famous words to Green River about them sounding like Rush ends their postpunk aspirations.  Though, I will see if ""Hunted Down"" sounds like Gof4 or Bauhaus."
postpunk,2z591k,Spodyody,3,Sun Mar 15 18:25:03 2015 UTC,This band is awesome.
postpunk,2z591k,thefriendcatcher,1 point,Sun Mar 15 18:30:11 2015 UTC,coneheads!
postpunk,2z28k7,untoku,1 point,Sat Mar 14 22:02:40 2015 UTC,"don't know what the reason for all this Neubauten in this sub as of late, but I'm loving it"
postpunk,2z28k7,hexonox,1 point,Sun Mar 15 02:57:52 2015 UTC,this was awesome
postpunk,2yxknp,thefriendcatcher,3,Fri Mar 13 17:55:37 2015 UTC,Its good to see some Loop!
postpunk,2yxknp,Galacticuspedro,1 point,Fri Mar 13 20:52:44 2015 UTC,You can't spell Hoopla without Loop or something. It's the good stuff.
postpunk,2yxknp,weblypistol,2,Fri Mar 13 22:37:09 2015 UTC,i saw them a year ago.  awesome show! But they brought my tinnitus back.
postpunk,2yxknp,PKD00fuss,2,Fri Mar 13 23:56:28 2015 UTC,"Loved Loop when I was in college and ""studied"" all the time."
postpunk,2yur7x,betti_cola,2,Thu Mar 12 23:49:24 2015 UTC,"Back in January I started doing a post-punk show on my university's internet radio station - called Never Been In A Riot after the Mekons song. Just thought some people on here might be interested in it. You can check out the previous shows here, and there's also a Facebook page."
postpunk,2yt986,miraoister,5,Thu Mar 12 17:05:54 2015 UTC,Klaus Nomi was the shit. I've never thought of what he did as post-punk though.
postpunk,2yt986,CobraStallone,2,Fri Mar 13 08:49:33 2015 UTC,Thanks this is new stuff for me. I love it.
postpunk,2yt986,iberis,2,Thu Mar 12 17:21:25 2015 UTC,"Found out about him awhile back in /r/morbidreality. I'm still kinda surprised that I like his music as much as I do since operatic vocals tend to annoy me. His straight up opera stuff is really nice too. Doesn't have the fun, weird/quirky/whatever quality that his new-wavy stuff has, but it's still worth listening to imo."
postpunk,2yt986,sprokolopolis,1 point,Thu Mar 12 20:13:07 2015 UTC,arseholes at morbid reality blocked me!
postpunk,2yt986,detroitvinyl,2,Fri Mar 13 03:01:46 2015 UTC,I remember discovering Klaus Nomi from a very odd and hilarious flash website back in the early 2000's.   This is the site. Just click around and explore: http://www.unosunosyunosceros.com/tRibuTO/Nomi.swf  Even the root site is odd:  http://www.unosunosyunosceros.com
postpunk,2yu12h,RouletteSyndrome,5,Thu Mar 12 20:28:27 2015 UTC,Pere Ubu is pretty awesome. They have a sizable and varied discography but that is definitely a good thing. They used to play CBGBs with Devo I believe. Cool band: Pere Ubu - Street Waves:  https://youtu.be/mk1sqOpPn3E
postpunk,2yu12h,coopgirl82,2,Fri Mar 13 01:56:07 2015 UTC,"Cool, thanks! I listened to a few, and it's crazy that all of these are apparently on the same album. Lots of variety already. Definitely gonna be working my way thru their discography."
postpunk,2yu12h,fearofnormalcy,5,Fri Mar 13 03:05:18 2015 UTC,"This is one my favorite subgenres, and unfortunately there's not enough of it. First and foremost, Au Pairs. I can't recommend them enough. And I also second the Pere Ubu, Slits, and Kleenex/Liliput recommendations.   Here's some others I came up with after doing a quick scan of my collection.  Delta 5  Beakers  Medium Medium  Bush Tetras  Fire Engines  James Chance  Marquis De Sade  Pylon  The Tapes  XTC"
postpunk,2yu12h,fearofnormalcy,1 point,Fri Mar 13 15:00:30 2015 UTC,"Thanks, these are exactly what I was hoping for when I started the thread! I really should get around to listening to more James Chance. Someone that I used to talk to linked me to a few of his songs a couple years ago, and I really liked what I heard, but he kinda slipped onto back burner and I never put too much thought into looking for more.  Also, I really liked the 70s glam vibe of the XTC one. Maybe it's just me, but I was definitely reminded of that kinda stuff when I was listening!"
postpunk,2yu12h,spaceache,3,Sat Mar 14 20:15:49 2015 UTC,"If you want a couple more recent bands, try:   The Rapture - Out Of The Races And Onto The Tracks Institute - Salt  Q And Not U - Wonderful People Clap Your Hands Say Yeah - Satan Said Dance The Mall - Acrid   I hope these assist you in shaking your ass on the dance floor."
postpunk,2yu12h,Spodyody,2,Fri Mar 13 18:07:43 2015 UTC,"Whoa, thanks! Yeah, I'm cool with modern stuff. The only one I couldn't get into was the Q And Not U one, but the rest are great."
postpunk,2yu12h,TheLeakyBurrito,1 point,Sat Mar 14 20:52:34 2015 UTC,"That Q And Not U song is more indicative of their later output....what I like to refer to as the ""Prince inspired"" era.  The older stuff is more my speed, but far less dancey. They were a Washington DC band, and they represented that scene (Fugazi, Dismemberment Plan, Jawbox, etc.) well:  Q And Not U - Hooray For Humans"
postpunk,2yu12h,TheSchneid,3,Sat Mar 14 21:35:56 2015 UTC,You might like some of these songs (I've danced like a maniac to all of them):  Ausgang - I am a horse  Death cult - God's zoo  Grauzone - Eisbaer  Joy Division - A means to an end   Malaria! - Kaltes klares wasser   1919 - Giant   Sex beat - Sex beat  Spizzenergi - Soldier soldier   Theatre of hate - The hop  Tuxedomoon - No tears
postpunk,2yu12h,weblypistol,1 point,Sat Mar 14 08:13:30 2015 UTC,"Thanks, I liked these a lot!"
postpunk,2yu12h,vaguelyhuman,3,Sun Mar 15 03:09:00 2015 UTC,"Lots of good stuff going around already, but I'll add these.  Foetus - I'm Surrounded By Incompetence  The Flowers - (Life) After Dark  APB - Shoot You Down  Shriekback - Accretions  A Certain Ratio - Do the Du  The Pop Group - Kiss the Book  Not postpunk but like a long lost Talking Heads song:  Robert Fripp (w/ David Byrne) - Under Heavy Manners"
postpunk,2yu12h,TheSchneid,2,Sun Mar 15 18:40:21 2015 UTC,"Au Pair's album ""Playing With a Different Sex"" is pretty dancey"
postpunk,2yu12h,uzmifune,2,Fri Mar 13 13:20:16 2015 UTC,"I'll give this a listen later on. Only started really listening to stuff in the thread earlier today, and I'm eating + doing other stuff atm."
