postpunk,39lwa7,weblypistol,0,Sat Jun 13 07:14:10 2015 UTC,No he wasn't and that is a stupid thing to say. Your other reply? Jarman was a film maker that arose in DIY punk ethos. He got close to post punk with the Smiths films and Last of England (Jubilee was a film that had a punk theme). Caravaggio is about a renowned gay artist from the Baroque period.
postpunk,39kg2e,weblypistol,2,Fri Jun 12 10:19:54 2015 UTC,Did anyone else find her book a disappointing mix of name-dropping and jilted lover vitriol?
postpunk,39kg2e,TyroneFeldstein,1 point,Fri Jun 12 11:09:59 2015 UTC,Not read it. Dunno. Probably. Don't want to know. I love the music of M.E.S. but would probably get a court order if he came within a five mile radius. I'm about the music and this track is pretty sound.
postpunk,39kg2e,TyroneFeldstein,1 point,Fri Jun 12 11:14:40 2015 UTC,"Yeh I hear ya, it didn't make me any less of a Sonic Youth fan either."
postpunk,39g4xm,miraoister,8,Thu Jun 11 14:25:44 2015 UTC,"This song is currently the 9th, 12th, & 15th most popular thing ever posted on this subreddit."
postpunk,39g4xm,amish_no_wave,1 point,Fri Jun 12 01:30:22 2015 UTC,"well yesterday was a special day, a day of morning for a famous vampire who died, while the community of Reddit found out our CEO is infact a vampire."
postpunk,39g4xm,mrminty,2,Fri Jun 12 03:44:54 2015 UTC,Holy shit I haven't heard this in ten years. Thanks.
postpunk,39g4xm,QuatroCrazy,3,Thu Jun 11 15:18:15 2015 UTC,Great track but..  This is already on the 1st page twice when you sort by top posts in this subreddit.
postpunk,39ij7e,Gatchan,2,Thu Jun 11 23:22:19 2015 UTC,"Everyday I get up and pray to Jah And he increases the number of clocks by exactly one Everybody's coming home for lunch these days Last night there were skinheads on my lawn    Take the skinheads bowling, take them bowling Take the skinheads bowling, take them bowling    Some people say that bowling alleys got big lanes (got big lanes x2) Some people say that bowling alleys all look the same (all the same x2) There's not a line that goes here that rhymes with anything (anything x2) Had a dream last night but I forgot what it was  (what it was x2)   Take the skinheads bowling, take them bowling Take the skinheads bowling, take them bowling    Had a dream last night about you my friend Had a dream, I wanted to sleep next to plastic Had a dream, I wanted to lick your knees Had a dream, it's about nothing   Take the skinheads bowling, take them bowling Take the skinheads bowling, take them bowling   Take the skinheads bowling, take them bowling Take the skinheads bowling, take them bowling"
postpunk,39ij7e,SlackBadger,1 point,Thu Jun 11 23:30:06 2015 UTC,"Awesome song, not post-punk, but whatevs."
postpunk,39bhsw,amish_no_wave,4,Wed Jun 10 17:12:26 2015 UTC,wire you making such bad pun jokes?
postpunk,39bhsw,thelongdivision,3,Thu Jun 11 07:26:35 2015 UTC,Slits just too much fun to stop.
postpunk,39bhsw,ohyeahbutts,1 point,Thu Jun 11 14:20:55 2015 UTC,there's no such thing as a bad pun.... they're all intended :3
postpunk,39bhsw,laurenzaccio,3,Thu Jun 11 07:52:11 2015 UTC,"I don't know if this is hilarious or sad, either way good job"
postpunk,39bhsw,geniusbob3,3,Wed Jun 10 18:43:32 2015 UTC,/r/3amkrautrockjokes
postpunk,39bhsw,endless_sleep,3,Thu Jun 11 02:50:08 2015 UTC,"What was Dominoes' favorite krautrock band for a few years in the late eighties?  Neu!  Alright, I'm going to bed."
postpunk,398wb2,FarKingCnut,1 point,Wed Jun 10 02:35:56 2015 UTC,This is going off
postpunk,39723c,miraoister,2,Tue Jun 9 18:48:54 2015 UTC,This is really great. Thank you for sharing.
postpunk,395p17,TheSchneid,2,Tue Jun 9 13:05:20 2015 UTC,"Doesn't make me think ""no wave"" at all.. Too nice. Doesn't feel dangerous."
postpunk,3933s2,Gatchan,2,Mon Jun 8 22:22:42 2015 UTC,"My mother, the Red Arrow fly Nosedives towards me    London is falling down London is falling down    Shining new pylons descend to the earth As I walk towards them skyscrapers crash down to the ground    London is falling down, down down London is falling down    Inside and outside what goes up comes down London is falling down, down down down down London is falling down    I'll take a plane or a kite I'm flying Northwards I'm going uptown    London is falling down, down down down down London is falling down    Inside and outside what goes up comes down London is falling down London is falling down London is falling down London is falling down"
postpunk,38z4aq,Psychlone23,2,Mon Jun 8 01:46:07 2015 UTC,"RIP, 53 is too young."
postpunk,38z4aq,my_lucid_nightmare,1 point,Mon Jun 8 02:30:03 2015 UTC,"I hadn't heard he'd died before this post, that's really sad news. My brother got me into his solo album A Universe Between Us which is really great."
postpunk,38udov,Blank-her-blank,2,Sat Jun 6 22:19:53 2015 UTC,Livin at night isn't helpin my complexion
postpunk,38utx9,Gatchan,2,Sun Jun 7 00:42:21 2015 UTC,"Check out Paralisis Permanente, great band."
postpunk,38utx9,kobaian,2,Sun Jun 7 03:57:54 2015 UTC,"Yes, it was another great band. A pity they were so short-lived. No pun intended."
postpunk,38utx9,weblypistol,1 point,Sun Jun 7 23:11:10 2015 UTC,1980..Very cute.
postpunk,38utx9,ED-209-MKII,1 point,Sun Jun 7 01:43:47 2015 UTC,Keyboardist guy is full of epicness!
postpunk,38rfyq,SlackBadger,3,Sat Jun 6 04:24:48 2015 UTC,"Hey boys, see any action?"
postpunk,38rfyq,Joe_Hole,3,Sat Jun 6 16:30:07 2015 UTC,one of my fave bands.  andy gill's spastic guitar playing is incredible  edit:   he moves like hes playing the missing parts in his head
postpunk,38rfyq,foetus_lp,2,Sat Jun 6 22:23:30 2015 UTC,"I love his jagged guitar playing, At Home He's A Tourist is probably the pinnacle of his style."
postpunk,38rfyq,foetus_lp,2,Sat Jun 6 22:26:53 2015 UTC,100% agree
postpunk,38qmli,Gatchan,1 point,Sat Jun 6 00:06:27 2015 UTC,"Feels like summer Gosh, my skin's so itchy Not a feature on my face Just a piece of yellow plastic I never thought I'd sink so low So slow  Morning's always weak God it's hopeless when I'm talking I'm lonely in the field Just a baby treading water It's red and dark And God is my friend The end, the end  Stumble on the dress She's screaming that she loves me It's not the way to give It's the cruelest way to lie I got myself a gun today Hey"
postpunk,38n8n9,spaceache,4,Fri Jun 5 08:48:04 2015 UTC,Yes!  One of the best songs they ever recorded.  Love Ivy's guitar.  And hair.  And legs.  And attitude.  And heels.
postpunk,38n8n9,papawasatrollinstone,1 point,Fri Jun 5 10:05:04 2015 UTC,Poison Ivy will always be the coolest female guitarist ever IMO.
postpunk,38n8n9,IAMAGrinderman,2,Mon Jun 8 00:27:02 2015 UTC,https://youtu.be/jyX-KwwOAuo
postpunk,38n8n9,Blank-her-blank,1 point,Mon Jun 8 01:08:05 2015 UTC,"Never been a huge fan of The Gun Club, but this is awesome. For some reason, I love that they did this and that Kid Congo Powers was in both bands."
postpunk,38n8n9,IAMAGrinderman,2,Mon Jun 8 03:09:11 2015 UTC,"Glad to share. Not a huge fan myself, but i am quite fond of this album."
postpunk,38n8n9,Blank-her-blank,1 point,Mon Jun 8 04:13:02 2015 UTC,I'll give the album a listen. Thanks for bringing it + the song up!
postpunk,38n8n9,IAMAGrinderman,1 point,Mon Jun 8 04:51:21 2015 UTC,Amen to that brother.    Her solo on Goo Goo Muck is my favourite ever piece of guitar.
postpunk,38n8n9,papawasatrollinstone,1 point,Mon Jun 8 00:39:19 2015 UTC,"Yeah, it's an awesome solo. Her tone was always perfect too. Definitely up there in my list of top guitar tones."
postpunk,38n8n9,IAMAGrinderman,1 point,Mon Jun 8 03:29:09 2015 UTC,"She's the reason I own the Chet Atkins 6120.  Well, her and Scotty Moore  anyway."
postpunk,38n8n9,papawasatrollinstone,1 point,Mon Jun 8 04:10:19 2015 UTC,"Oh awesome. I intend to get a Gretch someday. Right now, it's a Tele + Jaguar for me tho."
postpunk,38n8n9,IAMAGrinderman,0,Mon Jun 8 04:36:51 2015 UTC,Nice.  Always wanted a Tele.    Yeah I love my Gretsch.  She's a special bird.  The tone is exceptional.
postpunk,38l98o,Gatchan,5,Thu Jun 4 23:07:03 2015 UTC,Real Life is so good.
postpunk,38l98o,SlackBadger,3,Thu Jun 4 23:20:24 2015 UTC,"They will show me what I want to see we will watch without grief we stay one step ahead of relief you tell me we've been praying for a bright and clever hell I think we've been forced to our knees but I can't tell    Sometimes I forget that we're supposed to be in love Sometimes I forget my position    It's so hot in here What are they trying to hatch? We must not be frail, we must watch Now that I'm out of touch with anger now I have nothing to live up to and I don't know when to stop joking when I stop I hope I am with you    Sometimes I forget that we're supposed to be in love Sometimes I forget my position    What on earth is the size of my life?"
postpunk,38lmzd,fuxthat,1 point,Fri Jun 5 00:42:34 2015 UTC,There's some Sumerian Fleet in there I think if that helps.
postpunk,38h4wa,Psychlone23,1 point,Thu Jun 4 04:20:45 2015 UTC,great band
postpunk,38h4wa,shitting_frisbees,1 point,Thu Jun 4 05:38:10 2015 UTC,Wasn't this Albini produced? I vaguely recall that. It certainly sounds more abrasive than George Best stuff.
postpunk,38g95r,weblypistol,2,Thu Jun 4 00:33:53 2015 UTC,"Well, he's not wrong..."
postpunk,38g95r,Psychlone23,-2,Thu Jun 4 03:35:58 2015 UTC,There's  the old comedy staple  that revolves around a judge asking who the Beatles are to be told they are a popular beat combo. I kinda find this the bizzarro world version where a judge has to be like a Fall fan and listen to multiple versions of the same tune probably each a few times over. And I bet they are still humming it in their head.  Judge was a she.
postpunk,38g95r,amish_no_wave,2,Thu Jun 4 03:52:43 2015 UTC,"Judge, in a later case, also finds water to be ""relatively damp."""
postpunk,38e4d8,miraoister,3,Wed Jun 3 16:50:22 2015 UTC,Are the Pixies considered post-punk? Always thought of them like Dino Jr.
postpunk,38e4d8,theLinKuei,1 point,Wed Jun 3 19:52:45 2015 UTC,"Yeah I would never consider them post-punk in the classic sense. They definitely have punk influences though, and put a spin on the normal ""punk"" sound."
postpunk,38e4d8,SlackBadger,0,Wed Jun 3 20:11:50 2015 UTC,"anything can be postpunk, we have this discussion every month, but for example I like to think that its anything connected to ""punk"" but by creative influence and not a clone copy of the last clone copy.  if you will it is the music that was inspired to come up with new ideas."
postpunk,38dz2a,miraoister,2,Wed Jun 3 16:21:29 2015 UTC,"Love this song, there's some pretty horrific back up vocals near the end here though."
postpunk,388p90,miraoister,2,Tue Jun 2 17:08:15 2015 UTC,This is silly.
postpunk,387zul,lelebuonerba,2,Tue Jun 2 14:36:13 2015 UTC,"I have been listening to this lately, enjoying it, but, man, they have done their homework.  A couple songs sound exactly like Gang of Four.  A lot of Young Marble Giants, too."
postpunk,384xoj,HotDogHell,3,Mon Jun 1 21:55:00 2015 UTC,I like it and approve but the former Crucifux singer (excellent band) is very much from  the US or as he might say Indian Land.
postpunk,384xoj,weblypistol,2,Mon Jun 1 22:00:00 2015 UTC,"ah! Thanks for the correction. I** was reading the liner notes and saw it was recorded in England, and obviously only English people record in England.  ** never listened to  Crucifux, suggestions?"
postpunk,384xoj,weblypistol,2,Mon Jun 1 22:06:56 2015 UTC,"Ohhh....well first I got the name wrong , It's Crucifucks. The whole 1st s/t album is just ace but pretty much hardcore punk. I like Hinkley had a Vision and By the Door. The second album Wisconsin is far more post punk and musically complicated. A lot of fans hated them for that . It's a good album and When the Top Comes off is the stand out for me. There are two other releases I vaguely recall but I can only hear so many tunes at one time."
postpunk,384xoj,endless_sleep,2,Mon Jun 1 22:16:01 2015 UTC,"Here's a really great interview with Doc Dart that was done by Sam McPheeters (Born Against, Men's Recovery Project, Wrangler Brutes)."
postpunk,3830cg,jameson_water,2,Mon Jun 1 14:13:33 2015 UTC,"nicer than I expected but surprisingly all the filthier for being so, +1"
postpunk,3830cg,TyroneFeldstein,3,Mon Jun 1 17:50:22 2015 UTC,just wait until you get caught singing it at work.
postpunk,3830cg,TyroneFeldstein,1 point,Mon Jun 1 17:54:14 2015 UTC,ikr? expected the dwarves and landed closer to del shannon
postpunk,3830cg,DarkmanBeyond,1 point,Mon Jun 1 18:02:21 2015 UTC,"Downloaded the entire album, it's really good. I don't find that many info on the band though."
postpunk,3830cg,TheSchneid,1 point,Mon Jun 1 18:16:20 2015 UTC,"If you liked them maybe you'll like this guy too.  Maybe, maybe not  https://www.youtube.com/watch?v=fR8PXcm53UI"
postpunk,383umi,TyroneFeldstein,2,Mon Jun 1 17:40:28 2015 UTC,"for the shoegazers, enjoy"
postpunk,3808ww,SlackBadger,3,Sun May 31 22:00:57 2015 UTC,"Oh, John McGeoch. How you continue to improve my world from beyond it."
postpunk,3808ww,GuitarAntiStar,1 point,Sun May 31 22:16:51 2015 UTC,"my favorite of theirs is ""Shot by Both Sides"" https://www.youtube.com/watch?v=ybUqM8jf3mU"
postpunk,37yebl,amish_no_wave,1 point,Sun May 31 13:14:30 2015 UTC,Great song.  I love it.
postpunk,37yebl,jameson_water,1 point,Sun May 31 17:10:27 2015 UTC,This is brilliant. Who knew the Mekons once sounded like this?
postpunk,37uhon,TheSchneid,1 point,Sat May 30 14:31:58 2015 UTC,Seriously cannot wait for their full length to release.
postpunk,37uhon,atomobot,1 point,Sat May 30 17:27:42 2015 UTC,"Yeah, all their records are so damn expensive and sold out already..."
postpunk,37spbw,feltsandwich,2,Sat May 30 02:05:28 2015 UTC,My cone approves
postpunk,37spbw,relaxandenjoy,2,Sat May 30 06:26:25 2015 UTC,"Me too, too bad the tape has sold for $70 on discogs... You'd think a band that put out a tape themselves would just make some more right?"
postpunk,37spbw,TheSchneid,2,Sat May 30 15:14:20 2015 UTC,"Two of the tapes were released on a German label on vinyl, and according to the label they've tried getting in touch with the Cones to repress but have gotten no response.  So I guess it's fair to say that it's not a particularly commercial endeavor.  Either that, or the lads were snared by the law and are inconecerated.  Nevertheless, you can buy mp3s of that vinyl release, if that's your bag.  Coneheads + bandcamp = makeout."
postpunk,37qh1h,tornflags,3,Fri May 29 16:13:32 2015 UTC,"This chick dragged me and some friends to a Gossip show in NYC. Bowery Ballroom if I remember correctly. It wasn't really for us punk teenagers so we wandered downstairs and saw some dude playing acoustic guitar. It was pretty cool, so we listened to the rest of the set. The next day when we go and look this ""Nikki Sudden"" guy up we find the report of his death. He had passed away that night after the show. We lucked out because the gossip were a little too gay for us and saw a man's last performance. That's my Nikki Sudden story."
postpunk,37qlvb,miraoister,3,Fri May 29 16:45:52 2015 UTC,"With this and Sham 69, you are really testing my patience,"
postpunk,37nv9q,weblypistol,3,Fri May 29 00:41:13 2015 UTC,"I love Christine but Shine On makes me want to dance bongers around Terry Bickers. That huge, shiny guitar sound tho ❤"
postpunk,37qm7h,miraoister,3,Fri May 29 16:48:08 2015 UTC,This would be from that period of pre-post-punk more commonly known as punk :p
postpunk,37qm7h,untoku,2,Fri May 29 23:07:35 2015 UTC,Like you said! Saw them late last year together with The Exploited and some other great bands and they're still fantastic.
postpunk,37qm7h,Paraboxia,1 point,Sat May 30 01:55:00 2015 UTC,"yeah, but this particular song has a very nice originality and unique sound.   of course it spawned a whorde of shit music, but this song is good."
postpunk,37qm7h,my_lucid_nightmare,2,Sat May 30 03:26:02 2015 UTC,Nothing post about this punk.
postpunk,37qm7h,my_lucid_nightmare,1 point,Mon Jun 8 02:32:46 2015 UTC,"just enjoy the energy,"
postpunk,37ea1q,GuitarAntiStar,2,Wed May 27 00:13:10 2015 UTC,"From the intro: ""Factory Records (joint owned by Tony Wilson of BBC ""Nationwide"") have been in touch, interested in Eno and Enovations. They say they'll be sending some records and information, so when they arrive we'll let you know what they're up to.""  Imagine a Joy Division album--or better yet, Durutti Column record--co-produced by Hannett and Eno! (Obviously, knowing Hannett's disposition, this would have been unlikely at best, but it's fun to entertain the notion.)"
postpunk,37btod,jameson_water,2,Tue May 26 13:57:05 2015 UTC,Yeah it's quite sweet. Very much a wake up morning song to go with decent coffee.
postpunk,37btod,weblypistol,2,Tue May 26 14:47:05 2015 UTC,Im still getting the feel of this sub.  I didn't know how well new(er) stuff would be received.  I do dig this song alot.  Here's another one that's been pretty heavy in my 'decent coffee' rotation Tomorrow's Tulips - Casual Hopelessness
postpunk,37btod,weblypistol,2,Tue May 26 15:38:46 2015 UTC,"I am only one voice but I liked the original post and your follow up. Older stuff does do better, I love some of the brand new stuff that comes through though."
postpunk,37btod,weblypistol,2,Tue May 26 16:34:29 2015 UTC,Papal Breakdance - Psychic TV
postpunk,37btod,FIDLAAR,3,Tue May 26 16:45:45 2015 UTC,You're in the zone.
postpunk,37btod,FIDLAAR,2,Tue May 26 16:47:39 2015 UTC,ha.  just bored at work.  last one.  thanks for the encouragement   Ten Twenty Ten - The Generationals
postpunk,37btod,weblypistol,1 point,Tue May 26 16:52:39 2015 UTC,"I ve never thought Best Friends as post punk. Always thought they were more of a lofi garage rock genre. Can you educate me what makes it post punk, i might ve missed something."
postpunk,378xt9,LukasJ,5,Mon May 25 21:03:25 2015 UTC,"WOW, my two favourite bands in one song, this is amazing."
postpunk,378xt9,ssickboy,3,Mon May 25 22:52:19 2015 UTC,The Cure covering a Joy Division song is like having chocolate with peanut butter: it's a winning combination. Great cover. Robert Smith keeps the whole theme of the song intact while staying true to himself. Does anyone know when the Cure covered the song?
postpunk,378xt9,petezahut93,0,Fri May 29 04:54:20 2015 UTC,This is a really cool cover but this is my favorite LWTUA cover.  http://youtu.be/dp017Crrx7I
postpunk,378xt9,Bloodbird26,1 point,Tue May 26 00:02:16 2015 UTC,lol everytime i see this i think gira is just really obstinate about not trying to look like he got forced into this
postpunk,379p6j,weblypistol,1 point,Tue May 26 00:36:02 2015 UTC,Tracklist  00:00 Handsome Devil        02:48 Still Ill  06:22 This Charming Man  09:09 Pretty Girls Make Graves  12:56 Reel Around The Fountain  18:46 What Difference Does It Make?  22:15 Miserable Lie  26:27 This Night Has Opened My Eyes  29:41 Hand In Glove  32:20 These Things Take Time  Encore: 34:44 You've Got Everything Now
postpunk,36zrjh,amish_no_wave,5,Sat May 23 15:00:56 2015 UTC,"These guys and spacemen 3 were my jam in high school,"
postpunk,36zrjh,RadicalUsername,5,Sat May 23 15:53:47 2015 UTC,"one of the scariest songs I've ever heard, and I love it!"
postpunk,36zrjh,0_amato,3,Sat May 23 18:27:13 2015 UTC,If you listen to this song on acid...you're gonna have a bad time.
postpunk,36zrjh,miraoister,2,Sun May 24 00:38:11 2015 UTC,look at Alan Vega's solo material...  http://www.reddit.com/r/postpunk/comments/33dpc9/alan_vega_wipeout_beat/
postpunk,36zrjh,Caelmor,1 point,Sun May 24 13:03:50 2015 UTC,"First heard this as a Lydia Lunch cover. The cover is good, but the original is superior."
postpunk,370x03,KingWhurlder,1 point,Sat May 23 20:55:03 2015 UTC,Sun's coming up...
postpunk,3723j1,amish_no_wave,1 point,Sun May 24 03:37:38 2015 UTC,"Primitive Calculators are not noise, they are very ""pop"" song orientated. Can someone please jog my mind on the beef between birthday party and calculators?"
postpunk,36v8x6,Edwug,2,Fri May 22 11:55:57 2015 UTC,Still good. Really. Really good.
postpunk,36v8x6,BlackMarketClash,2,Fri May 22 16:54:16 2015 UTC,Reminds me of high school
postpunk,36sdkb,jameson_water,5,Thu May 21 19:07:17 2015 UTC,"This was probably the first non-mainstream album (""Psychic.. Powerless.. Another Man's Sac"") I ever bought, when I was around 15 years old.  I purchased it mainly because I liked the band name, I think.  The music was way over my head at the time (this particular song is, I think by far, the tamest on the entire album), but a few years later it became one of my all-time favorites.  ""Cherub"" (from same album) is absolutely mind-blowing."
postpunk,36sdkb,teduh,2,Fri May 22 00:12:06 2015 UTC,"Yeah i got the tape as a kid and just spent 40 bucks for the vinyl a couple months ago. Theres some really good butthole surfers out there if youre bold enough to give them a try.  I really do like the song you are talking about, but I also still giggle every time i listen to lady sniff."
postpunk,36n7oa,Memeshaw,3,Wed May 20 16:48:51 2015 UTC,"Anytime I listen to early New Order, I think of how good they would have been with Ian just a little longer...  I love this though."
postpunk,36oyky,weblypistol,1 point,Wed May 20 23:51:54 2015 UTC,Full LP First Avalanche.  A1. Stick In The Works (at 0:00)  A2. Rise To The Groove (at 4:17)  A3. A Thousand Landscapes (at 7:38)  A4. Conceal Me (at 13:23)  B1. Goddess (at 17:44)  B2. American Girls (at 22:47)  B3. Gimme Some Lovin' (at 26:53)  B4. L.A. Rain (at 31:10)
postpunk,36k46z,AllRamonesAllTheTime,1 point,Tue May 19 23:45:23 2015 UTC,Why are the crowd just standing there?
postpunk,36k46z,weblypistol,1 point,Wed May 20 13:31:53 2015 UTC,I love the feelies!!!!
postpunk,36ir6l,weblypistol,5,Tue May 19 18:12:45 2015 UTC,"I try to listen to every music genre there is, both older and new releases. Music is very important to me. THIS song is my favourite one."
postpunk,36ir6l,heavyrauser,1 point,Tue May 19 22:24:20 2015 UTC,"It does hit all the right buttons.  I've been mocked before for posting this. I still hold it is post ponk, and suspect you might like this too? It's my favourite or at least permanent number 2 favourite depending  on  fluctuations of excitement.  Camera Obscura - Lloyd I'm Ready To Be Heartbroken [2006]."
postpunk,36jxg7,ReverbandDelay,2,Tue May 19 22:53:56 2015 UTC,nice to see another And also the trees fan! Thank You!
postpunk,36edm5,Spodyody,3,Mon May 18 19:01:11 2015 UTC,A 30 year sympathetic callback to I Am Damo Suzuki?
postpunk,36edm5,weblypistol,3,Mon May 18 20:14:10 2015 UTC,"I didn't get the reference, so thank you.  And then youtube led me to this.  Doubly thanks."
postpunk,36edm5,weblypistol,2,Mon May 18 20:28:31 2015 UTC,"I can praise you on taste all day, could point you in all things Fall, but be aware the first screen note looks a bit like something the Yorkshire Ripper Peter Sutcliffe once wrote."
postpunk,36edm5,lolhaibai,1 point,Mon May 18 23:13:56 2015 UTC,Iiiiii aaaaam Mark E Smitthh. Pretty fuckin groovey in a demented sense. Spotify totally delivered on this one.
postpunk,36cu9j,KingWhurlder,2,Mon May 18 10:50:36 2015 UTC,"As I was scrolling through, in the thumbnail, Johnny looked like Bubbles from Trailer Park Boys."
postpunk,36cu9j,istillusedialup,1 point,Mon May 18 16:18:52 2015 UTC,"Don't have high hopes for this, but it could be cool."
postpunk,36cu9j,lanceponk,0,Thu May 21 16:30:50 2015 UTC,Cool
postpunk,36dbih,Dood_Meister,6,Mon May 18 14:02:44 2015 UTC,"Bass over guitar.. Dark over light. I liked the way Chameleons, Comsat Angles, Cure, and Cocteau Twins did it."
postpunk,36dbih,Noughiphiet,4,Tue May 19 01:43:17 2015 UTC,Hard one. New wave does not necessarily mean post punk. There are times when they are near identical styles but came to it from a different approach. Bit like that weird evolution thing when completely different species come up with the same solution. Then there are things that seem so removed but you know just fit in. And there are plenty of fellow travellers that are not exactly post punk but you know they have a part. It's down to judgement though at the end of the day it is really about is this tune good.
