postpunk,33pnbo,FIDLAAR,4,Fri Apr 24 18:27:33 2015 UTC,"This is a cross-post from another comment. But here is some of my suggestions to some Joy Division/ New Order influence songs. I have even made a work-in progress playlist of songs that sound reminiscent of JD & NO.  Here is the playlist link; it doesn't have that much variety of artists, mostly comprised of New Order/ Joy Division songs, but I am still working on it.  Here are some of my favorites of the list and the highlights worth noting.  Johnny Aries - This Grave is My Bed Tonight   Inspired by The Smiths melody & got the melancholic feel of The Cure; Video is pretty entertaining as you can see that the singer even got that Robert Smith vibe and even down to that cheesy 80s dance like Robert Smith & Morissey. I also really like his previous work with his old band (Two Wounded Birds); its 50s rock/ Elvis/ Surf punk/ Ramones  inspired (they got the whole Ramones look down as well) .   Broncho - Class Historian    Very catchy, earwormy sound with that do-do-do-do; song is about a high school reunion and hooking up with those ""single mamas"" at the reunion.   Bos Angeles - Days of Youth   Dark post-punk with a touch of Surf Punk; vocals sound similar to the deadpan, emotionless quality of Ian Curtis.   Bos Angeles - Beach Slalom   Same description as above but vocals sound less deadpan and melody is uplifting for a post-punk band.   Bos Angeles - All I Do Is Dream   Very uplifting, and whenever I listen to this, it just makes me feel happy and optimistic of the future. You can not listen to this on my Spotify link because it has not been released on it yet. Otherwise they have only one album released so far and its free.     Before I intro these songs, I want to say how much I fkn love Corners (an upcoming new post-punk act of LA with a touch of West Coast / Surf Punk influence). As a huge Joy Division/ New Order fan, it just makes me love them even more and appreciate their work. Also, each of the members of Corners are talented individually and had put out music of their own that are all unique from each other. As a band, they got a sick look (& sick hair) and very Joy Division look with the button ups tucked in and rolled up.   In terms of similarity with Joy Division/ New Order (early Movement era):    Their songs got a similar melancholic, romantic lyrics of Ian Curtis (though it is not as depressing, there are some uplifting songs). They got a similar atmospheric feel like Joy Division's Unknown Pleasures and New Order's Movement (that echo Martin Hannett produce in each album). The singer's vocals is pretty dynamic (sounds different in various songs). Three of the band members can sing as well providing some variety to some songs (Buoy). Similarity-wise, in some songs, singer sound very much like Ian Curtis but with an oomf of surfiness/ West Coast vibe (Pressure) or like Movement era Bernard Sumner. That infamous Peter Hook bass that became a core New Order and Joy Division sound; well, Corners got it. In couple songs (or maybe most), the bass act as a very upbeat surf-punkish rhythm and melody. The interludes of Bernard's guitar attacking at various part of the songs; Yup, Corners got that but its different from Bernard's straightforward guitar part, Corner's guitar interlude is where you get that surf punk/ West Coast touch and unique from New Order & Joy Division and what sets them apart as being a rip-off and as Corners. Corners even got that machine like, sharp drumming of The Human Drum Machine, Stephen Morris. Corners also got synth but as oppose as relying too much on it for the sound, it acts to complement their songs.   We're Changing    The opening on their album and starts off with a killer bass riff. I really like the lyrics on this songs as it is very relatable (and repeatable); songs is about forgetting past romance.     you know that's not the man I am   you know that's not the way I am     This verse just hits, i dont know if its just me or not, but it is very relatable as many of us had made many past mistakes that does not reflect on who we actually are. Hence ""you know that's not the man I am"" or ""the way I am."" Thus the singer, Tracy Bryant, eloquently ends it in a very anthemic shout: ""We're changing!""   Love Letters    This is the song that I think will get Corners a lot of recognition (and even they admit that). Song starts of with a robotic drumming reminiscing of Stephen Morris and dat fucking synth - very reminiscing of the synth of an 80s aerobic video; heck, with a very rhythmic bass of Peter Hook, this makes a great workout song like running or some aerobic exercise. But dat synth! You also get to hear some of that West Coastness to it with the various interludes of the guitar part. It even got the most stylish, finesse music video I ever seen (with all the smokes, sick visuals, swaying, and quick flashes of each band member's profile. In all, video is very original and unique from many music video I ve seen. You probably can't tell but video is recorded at The Smell.   The Spaceship   Starts off with a killer bass (similiar to Peter Hook's) and various interlude of a very menacing guitar part followed by dat scream (Yeaaaa!!). In this song, this is where you get to hear more of the vocals from a different band member (Jeffertitti). Whenever they scream ""In the space ship"" or ""in the basement"" it reminds me of the screams of ""Confusion!"" in New Order's Confusion or even Joy Division's Walked in Line & Ice Age; the drumming (and maybe feel) is very much like New Order's Hurt but still retain its own identity.   Pressure   In this song, this is where you get to hear more of Corner's surf-punk/ West Coast sound. Whenever I hear this song, I get this feeling that this song can be easily included into Pulp Fiction's soundtrack. At first time hearing this, you can hear that the vocals of this song is very reminiscent of Ian Curtis (and you also get that reminscent Peter Hook bass, the attacking guitar riffs of Bernard Sumner, and maybe some of the Martin Hannet's signature atmospheric feel found in Unknown Pleasures and Movement).   Buoy   This song is probably the closest to a New Order song (that bass, the drumming,atmosphere feel, and deadpan Movement era Bernard Sumner-like - or you can say Ian Curtis-like - vocals); if I blindly heard this, I could have easily mistaken it as on of New Order's unreleased material for Movement. You can also hear in the beginning that Martin Hannett's signature echo of glass cracking. In this song, this is where you here the variety of vocals the band has to offer ( plus 3 of them are vocalists in their respective solo work). Buoy sounds kind of similar to New Order's Hurt (most similar in terms of rhythm), Senses, Chosen Time, Denial, Everything Gone's Green (w/ the yelling), and maybe Mesh.   In all, I have a feeling they will be big soon. Last but not least but they will be having a homecoming show on May 14 at The Echoplex (I will be going for sure); to add to that, they are pretty good live as well (unlike New Order which I have heard is not that great live)."
postpunk,33pnbo,sebfaure,2,Fri Apr 24 22:22:13 2015 UTC,"This is great, thanks!  I'd love to see more of this sort of breakdown here.  It adds so much more to the songs and helps me dive into a new group with more than a cursory listen before moving on to old favorites."
postpunk,33pnbo,FIDLAAR,2,Sat Apr 25 10:53:19 2015 UTC,"No problem, might re-edit it again and repost on this subreddit to intro this band. I have high hopes for them (Corners). Getting into a new band is kind of difficult (w/ their wealth of materials), doing this ease it in for other people to get in. Discerning the details is a great way to get people to appreciate the song and get an idea of why I like it."
postpunk,33pnbo,feltsandwich,2,Sun Apr 26 00:22:57 2015 UTC,"Johnny Aries kind of reminds me of The Drums.  Thanks for the tip for Bos Angeles, despite the ear fatiguing lo fi sound it's effortlessly catchy and listenable.  A nice find."
postpunk,33pnbo,FIDLAAR,1 point,Sat Apr 25 15:52:30 2015 UTC,Johnny Aries old band was called Two Wounded Birds. They used to tour with (opening act) for The Drums. Then something happened (they broke up immediately after their debut album) and now Johnny Aries is a member of The Drums.
postpunk,33pnbo,feltsandwich,1 point,Sun Apr 26 00:18:35 2015 UTC,"Funny, I have the most recent Drums album but didn't remember the name from the credits.  Of course he fits right in!"
postpunk,33pnbo,forestpunk,2,Sun Apr 26 07:40:02 2015 UTC,DIIV are so good! I love how drowned in reverb they sound.
postpunk,33pnbo,chromiumsun,2,Fri Apr 24 20:43:54 2015 UTC,Þeyr (Theyr) from Iceland
postpunk,33pnbo,feltsandwich,2,Fri Apr 24 21:54:52 2015 UTC,"I'd recommend (not yet been mentioned): In Silence by Fra Lippo Lippi; Turn On The Bright Lights by Interpol; Diminuendo by Lowlife and Dead Can Dance by Dead Can Dance.  If you listen to one, listen to On The Beach by the Chameleons."
postpunk,33pnbo,FarKingCnut,1 point,Sat Apr 25 01:22:30 2015 UTC,"Bunker Strasse, Lebanon Hannover, Ytro, In a Lonely Place and Nick Cave are good places to go from."
postpunk,33pnbo,flux_the_deal,1 point,Sat Apr 25 10:10:31 2015 UTC,Motorama. Cold Cave.
postpunk,33pnbo,aelia-lamia,1 point,Sat Apr 25 14:35:15 2015 UTC,Electric Litany's Enduring Days You Will Overcome!
postpunk,33o4ui,amish_no_wave,1 point,Fri Apr 24 02:49:19 2015 UTC,so good! anywhere to buy/download?
postpunk,33o4ui,nowthenyogi,1 point,Fri Apr 24 11:37:08 2015 UTC,"I found it here.  Unfortunately there was probably only 15 - 20 physical copies made, so I doubt anyone will be able to buy a copy anytime soon."
postpunk,33o4ui,delanie,1 point,Fri Apr 24 12:20:34 2015 UTC,Yaaaaaaa!!
postpunk,33m2u1,LukasJ,2,Thu Apr 23 17:01:43 2015 UTC,One of their best songs. I just love this video. R.I.P. Ricky.
postpunk,33m2u1,nrith,2,Fri Apr 24 03:15:48 2015 UTC,w-h-o-a  i love this sub
postpunk,33m2u1,vet_laz,1 point,Fri Apr 24 05:42:58 2015 UTC,The B52's = summertime
postpunk,33m2u1,Metalek,1 point,Sat Apr 25 02:30:29 2015 UTC,"Great song, thanks for the link."
postpunk,33m2u1,ZizzazzIOI,1 point,Mon May 11 04:10:08 2015 UTC,That's the same band that brought us The Love Shack? 😱😂
postpunk,33m2u1,Cym0n,2,Thu Apr 23 21:08:41 2015 UTC,B52's are awesome. Check out this ode to anal sex and this time travel banger
postpunk,33m2u1,thepriceofgas,1 point,Thu Apr 23 23:07:21 2015 UTC,"Always remember, The B-52's biggest influence was Yoko Ono, they're definitely on that Punk tip!"
postpunk,33m2u1,my_lucid_nightmare,0,Fri Apr 24 12:35:58 2015 UTC,Their biggest influence was Fellini movies.  They considered naming themselves Fellini's Children for a while.
postpunk,33li1e,miraoister,2,Thu Apr 23 14:23:37 2015 UTC,"Get in the time machine, hurry up, Im leaving in 5 minutes."
postpunk,33gnrk,untoku,2,Wed Apr 22 11:11:21 2015 UTC,I'm reading We Are Devo at the moment; the early history of DEVO is fascinating.
postpunk,33gnrk,dgrieder,2,Wed Apr 22 11:13:30 2015 UTC,"thanks for sharing this video, and the rec! I'll check it out."
postpunk,33gnrk,Bzzt,1 point,Wed Apr 22 11:47:20 2015 UTC,"There's a mark mothersbaugh exhibit at the denver museum of art.  really cool, he's made some mechanical midi instruments, and there's a devo retrospective.  Apparently he makes up to 25 postcards every day, and now has a collection of around 30000.  There is a huge room there with binders of postcards, its pretty impressive."
postpunk,33dpc9,miraoister,3,Tue Apr 21 18:09:59 2015 UTC,"Awesome.  I love Suicide, but have never delved into Vega's solo career.  I think that has just changed.  Thanks!"
postpunk,33dpc9,numanoid,1 point,Tue Apr 21 23:30:07 2015 UTC,"if you find a rar of this album, its called Saturn something post it here!"
postpunk,33dpc9,numanoid,2,Wed Apr 22 05:11:31 2015 UTC,It's on rutracker.org
postpunk,339eul,miraoister,2,Mon Apr 20 18:25:36 2015 UTC,Is Sue really a foot higher?
postpunk,333e62,oldwhitelincoln,5,Sun Apr 19 03:31:43 2015 UTC,Seriously one of the best bands I've ever heard.
postpunk,333e62,muroidea,3,Sun Apr 19 15:04:35 2015 UTC,Been one of my favorites for longer than i can remember.
postpunk,333e62,SaintBroody,2,Sun Apr 19 19:40:15 2015 UTC,"Unfortunately, I was only introduced to real actual good music like Cocteau Twins and The Chameleons just a few years back. It has changed me in so many ways."
postpunk,333e62,muroidea,3,Sun Apr 19 19:45:00 2015 UTC,"Welcome home, brother."
postpunk,333e62,SaintBroody,2,Mon Apr 20 01:12:14 2015 UTC,http://www.youtube.com/watch?v=POOCbLyC7lY
postpunk,333e62,looki_chuck,2,Sun Apr 19 04:07:21 2015 UTC,I've always wanted to make Reddit a Cult to the Chameleons. http://youtu.be/ln3u41LNENE
postpunk,333e62,looki_chuck,2,Sun Apr 19 20:24:43 2015 UTC,The album cover is a Daft Punk dude kidnapping the devil's baby
postpunk,333e62,kingvictordeath,1 point,Fri Apr 24 14:49:16 2015 UTC,"My favorite Chameleons song, period. Everything about it is perfect. Thanks for posting, OP."
postpunk,333dld,sbroue,3,Sun Apr 19 03:24:46 2015 UTC,Still one of my favorite bands.  Try Heyday:  http://www.youtube.com/watch?v=h6T_BtPSRL0
postpunk,333i5t,YorjYefferson,2,Sun Apr 19 04:15:33 2015 UTC,Pop era Blancmange plus ᗅᗺᗷᗅ just has to be a huge win every time. I absolutely see this as post punk in a way I don't see Aha or Depeche Mode fitting. I loved their pop stuff ( particularly the Nononono bit from Don't Tell Me strangely) but then again I like  ᗅᗺᗷᗅ and Eurovision.  If you want to get really dirty you really need to check out their Irene & Mavis 1980 release which was quite different to following stuff. Concentration Baby is hilarious.
postpunk,333i5t,weblypistol,2,Sun Apr 19 11:42:55 2015 UTC,"Thanks, this was my first post here at your sub and I was worried it might be a bit too pop or new wave. I really like the song, both this one and the original. I also like how you spelled ᗅᗺᗷᗅ correctly with the backwards B :)  Blancmange is one of those groups I don't know a lot about, and most of what I do know is more from around this era. But I listened to a few of the clips from I&M that you linked, Disco a Bomb Bomb is fantastic.  *edit- I couldn't spell 'correctly' correctly, d'oh"
postpunk,333f9y,sbroue,1 point,Sun Apr 19 03:43:45 2015 UTC,nice
postpunk,331v4y,BeyondContext,2,Sat Apr 18 18:37:43 2015 UTC,"This thread has been linked to from another place on reddit.   [/r/titlegore] Joy Division - I remember nothing (live!!) I've literary cruised the wwww, but failed to find more live video's. Just about now it took me one hit..   If you follow any of the above links, respect the rules of reddit and don't vote. (Info / Contact)"
postpunk,331v4y,TotesMessenger,-3,Sat Apr 18 20:25:42 2015 UTC,"Cool story bros.   So. What does one like or want to see? A link only, or a text with a external link..   Titlegore? You now what Joy Division actually means? Well. It really doesn't matter because it was obviously the other words in the title.   Just because you're out of the jungle doesn't mean the money is still on your back,  BC"
postpunk,331v4y,joshuastarlight,3,Sat Apr 18 23:09:30 2015 UTC,Literary does not equal literally. That might be the issue. Also you don't need an apostrophe in videos unless you are meaning the video owns something ...
postpunk,331v4y,ThatRedEyeAlien,2,Sat Apr 18 23:56:17 2015 UTC,Literally cruising the web would be impossible.
postpunk,330ct5,thefriendcatcher,2,Sat Apr 18 07:07:30 2015 UTC,"Man, I drove people insane when this came out. The whole drum canto and Arabic-style wailing! I read somewhere that The Flowers of Romance is a reference to the band that Sid a Vicious was in before the Pistols."
postpunk,32yw9i,SlackBadger,2,Fri Apr 17 21:33:32 2015 UTC,I miss how sassy Robert Smith was on their first album :(
postpunk,32yw9i,TelevisionSky,2,Sat Apr 18 06:58:28 2015 UTC,And super drunk.
postpunk,32yw9i,blackseaoftrees,2,Sat Apr 18 16:46:37 2015 UTC,I wish they had never gone Goth.
postpunk,32zeav,cornflaskes,4,Sat Apr 18 00:27:31 2015 UTC,edgey name.
postpunk,32zeav,t1tg,3,Sat Apr 18 00:59:57 2015 UTC,"im aware  i had an argument with a guy on a brian jonestown masacre video. The guy said that BJM was an offensive name and blah blah, said it was like if someone named their band Sandy hook kid cadavers. I said I would do it and become #1 band in the world just to spite him"
postpunk,32vti6,protean_shake,3,Fri Apr 17 03:12:51 2015 UTC,Saw them at Rickshaw Stop in SF - one of the best shows I've seen in years.
postpunk,32xqna,HoneyVortex,2,Fri Apr 17 16:14:40 2015 UTC,Awesome haha
postpunk,32tohz,Vranak,6,Thu Apr 16 17:02:10 2015 UTC,THREE.HUND-RED.SIX-TY-FIVE.DEGREES.
postpunk,32tohz,HumpCakes,4,Thu Apr 16 18:01:52 2015 UTC,The original promo video is adorable.  https://www.youtube.com/watch?v=xNnAvTTaJjM
postpunk,32tohz,weblypistol,3,Thu Apr 16 23:12:21 2015 UTC,Fightin' fire with fire
postpunk,32tohz,justice6supreme,2,Thu Apr 16 22:03:35 2015 UTC,...hhhAAAAHHH
postpunk,32t6e8,miraoister,2,Thu Apr 16 14:50:15 2015 UTC,I'm really not one for the afterlife and such stuff. I would like to be shocked by a surprise that the grim reaper is real and in fact is JCC. He'd say sorry lad and take me for a pint. Maybe.
postpunk,32sh9z,youcandooooooooitnow,1 point,Thu Apr 16 10:29:39 2015 UTC,Need to get my headphones from the other room. Good name/title
postpunk,32qkwf,washington23,1 point,Wed Apr 15 22:33:29 2015 UTC,"sounds like a demented tubeaway army song, i like it."
postpunk,32ou4j,DaFishGod,3,Wed Apr 15 14:47:50 2015 UTC,"Great article. I've been really wanting some music like this for a while. I've heard some stuff on bandcamp labeled as black metal and post-punk, but so far it just sounds like neither."
postpunk,32ou4j,muroidea,2,Wed Apr 15 18:05:54 2015 UTC,"maybe try Hateful Abandon, Mourir et Revenir, Flown, Somnolence, Pinkish Black, Lifelover, Circle of Ouroborus, Decadent Aesthetix Coral Cross, or Joyless?  pretty wide variety of styles there, hopefully a few will appeal to you  also, this is straight-up post-punk w/o metal influence, but Soror Dolorosa is a band made up of a bunch of guys from the French metal scene playing post-punk & it's fucking great. there's also LowCityRain which is the guy from Lantlos playing post-punk"
postpunk,32ou4j,presscolor,1 point,Thu Apr 16 07:17:27 2015 UTC,Good choices. I was going to include Hateful Abandon in there but I felt like I didn't listen to their last album as much as the other ones in the post.
postpunk,32ou4j,Bloodbird26,1 point,Thu Apr 16 13:56:10 2015 UTC,"Then I'd say Vaura and An Autumn For Crippled Children are your choices.  There's also more bands that can capture a similar feel, perhaps Cold Body Radiation and some of Caina's catalogue. Hope you like them."
postpunk,32ou4j,Bloodbird26,3,Wed Apr 15 21:53:03 2015 UTC,Awesome. I'm a fan of both metal and post punk so this is perfect. Already listened to the Vaura record and it is great. One band I am surprised isn't on this list is Beastmilk (now Grave Pleasures. A bunch dudes from Black metal bands worshipping Joy Division and Samhain. Killer stuff.
postpunk,32i8g2,mattmacneil,1 point,Tue Apr 14 00:24:09 2015 UTC,This whole album is great! I think Talk About the Weather is the best track.
postpunk,32hlqu,michaelnoir,1 point,Mon Apr 13 21:32:40 2015 UTC,Great band great song. I still listen to the album Colossal Youth regularly.
postpunk,32fyjv,untoku,1 point,Mon Apr 13 14:10:16 2015 UTC,is the GPO's daugher?
postpunk,32fyjv,miraoister,1 point,Mon Apr 13 14:57:06 2015 UTC,"Yes, I think it's Caresse P-Orridge."
postpunk,32bs6s,Idimmu_Xul,4,Sun Apr 12 12:32:26 2015 UTC,"Well what do you already enjoy listening to? That will help a lot with giving you some recommendations. Or are you just looking for general stuff to check out?  I'd recommend checking out this cool flowchart that /u/santos_malandros made. That should give you something to start with.  As far as what I'd recommend, The Idiot, Lust For Life and New Values by Iggy Pop (he's mainly associated with straight up punk, but those albums are oozing with post punk-ish sound imo), Unkown Pleasures by Joy Division, Remain In Light by Talking Heads (watch their concert in Rome too! I've posted it in here before (or at least ""Born Under Punches""), and it's a fantastic gig), Pop Crimes and Teenage Snuff Film by Rowland S Howard, Bauhaus, Entertainment by Gang Of Four, and Tender Prey + Henry's Dream by Nick Cave.  Now, to get to the last part of your post, one thing you have to remember is that post punk is a ridiculously broad genre. You have stuff like Talking Heads, Gang of Four, and some Bauhaus categorized in the same genre as Nick Cave & TBS, who are categorized in the same genre as Swans, who are categorized with Big Black (even if they're typically just labeled as noise rock) or Sonic Youth. I can't specifically speak for whether I'd lump The Smiths in with other post punk acts, since I'm not very familiar with their work (I can't stand Morrisey's voice), but I still think that what I've said about it applies.  Edit: Check out the replies to this thread that I made awhile back. Comments are a gold mine imo, so you might find some cool stuff."
postpunk,32bs6s,MaGoGo,1 point,Sun Apr 12 13:06:15 2015 UTC,"Thanks for the awesome reply.  I think part of the trouble i have with the genre is its broadness. I do enjoy the smiths,  i really like some swans stuff. iggy pop is pretty cool.   Joy division is kinda lacking to me. But ill probably give em another shot. Same with bauhaus.   Ill have to check out that chart later when i get home!  Some random songs (idk if they fit perfectly) i like are Carry Home by the gun club, Sunlight Bathed the golden glow by Felt, and Decry by Film Noir.   But im really open to like ant suggestions that are difinitive or just super good songs."
postpunk,32bs6s,baroqueworks,4,Sun Apr 12 13:19:35 2015 UTC,"Before you dismiss Joy Division, read about Ian Curtis and his backstory. I would also keep in mind that there were very few bands that sounded like that when they came out. Also ""Transmission"", ""Love will tear us apart"", ""Isolation"", and more are excellent songs."
postpunk,32bs6s,MaGoGo,2,Sun Apr 12 13:26:11 2015 UTC,"You're welcome.  Yeah, it's one of the things that annoys me about post punk. I definitely wouldn't want all of the bands to sound the same, but I'd like it if they had more in common than just ""well, these are some bands that were inspired by punk rock and maybe Leonard Cohen and Bowie"". I know that's simplifying it a lot, but I think you know what I mean. :p  And I agree completely with what /u/MaGoGo said. Ian Curtis was an interesting guy with a tragic life. Definitely worth giving them a proper listen if you're interested in the genre. Like the sidebar says, they're basically the Led Zeppelin of post punk, so they're pretty important. :p  I'm not a huge fan of Gun Club, so I'm not familiar with their music either. I'll check out the other two tho.  I think I did a fairly good job of giving some definitive post punk stuff, and the chart will fill in any blanks that I've left out. Other than what I said before, maybe give Neubauten a shot. Very diverse band, and there's some stuff that definitely fits (""Dead Friends"" being a big one. I'd link, but internet is being shit).  Edit: Dunno if you're gonna be reading whole thread or not as replies come in, so check out the edit in my first post when you see this."
postpunk,32bs6s,BlackMarketClash,5,Sun Apr 12 13:59:52 2015 UTC,"Some of my favorite Post Punk songs, in no order.  A Certain Ratio - Flight/Faceless  Josef K - The Missionary  The Chameleons - Don't Fall/Nathan's Phase  The Membranes - Myths & Legends/Tatty Seaside Town  The Mekons - Where Where You?  Wire - Two People In A Room(Just get Chairs Missing & 154)  The Heat - Makeshift Swahili   The Birthday Party - Junkyard  Gang of Four - Return the Gift(Song, not album)  Flipper - Ha Ha Ha  The Residents - The Commercial Album(entire thing is great)  Big Black - Passing Complexion   New Order - Dreams Never End  Mission of Burma - Fame & Fortune (Signals, Calls, and Marches is a must have)  Magazine - Model Worker  Fad Gadget - Ricky's Hand  The Pop Group - She Is Beyond Good & Evil  Pylon - Crazy  The Urinals - Dead Flowers(Buy the anthology of them!)  100 Flowers - Strip Club/Horizontal(Basically Urinals under diff name)  The Wipers - Youth of America  Nocturnal Projections - In Purgatory  Devo - Patterns  Adam & The Ants - Zerox  Public Image Ltd - Death Disco  Nomeansno - Sex Mad  Minutemen - King of the Hill  Fugazi - Great Cop  Nash the Slash - Swing-Shift  The Vapors - Spiders  Rollerskate Skinny - Swab the Temples  The Fall - The Classical  Bauhaus - Dark Entries   Angst - Love Dissolves  The Cure - A Forest  Christian Death - Romeo's Distress  The Cramps - Surfin' Dead  U2 - The Electric Co.  Echo & the Bunnymen -The Back of Love   Blue Orchids - Dumb Magician  D.A.F. - Der Mussolini   Pere Ubu - Non-Alignment Pact  Tall Dwarfs - Dog"
postpunk,32bs6s,earlyspirit,1 point,Sun Apr 12 17:38:52 2015 UTC,"The Residents - The Commercial Album(entire thing is great)   I've never really thought of them as being close to post punk, but FUCK YES. While you're at it, listen to Not Available too! Commercial Album + Not Available are masterpieces imo.  Edit: Also, I never knew that Blue Orchids was the name of a band, just that ""Blue Orchid"" is a White Stripes song. Maybe that's where it came from? I know that Jack seems to have an appreciation for post punk (even if he's more associated with new wave, The Dead Weather have covered Gary Numan, and Jack was really digging Nick Cave's songs on Jools Holland circa Dig, Lazarus, Dig!!!). I'll listen thru the stuff in this list that I'm not familiar with!"
