postpunk,3e5uuj,psychsketch,1 point,Wed Jul 22 04:46:12 2015 UTC,"Disclaimer: A band I am sure most of you have heard of. Not always labeled post-punk, usually falling under the genre ""noise rock"". Nevertheless, they still fall under the post-punk genre. Enjoy."
postpunk,3e5td3,FIDLAAR,1 point,Wed Jul 22 04:31:39 2015 UTC,"I remember getting hold of this and this being on the b side. I can't remember what single it is but this track I played to death. An added bonus was that my family were not particularly fond in my tastes of music, but this track especially seemed to keep them well the fuck away from me. Happy days."
postpunk,3e4b70,weblypistol,2,Tue Jul 21 21:14:23 2015 UTC,that damn video changed my life when it first dropped.
postpunk,3e0fqj,Band-DaddysGirl,2,Tue Jul 21 00:20:58 2015 UTC,For some reason this made me think of Alice Donut - Lisa's Father.
postpunk,3e0fqj,weblypistol,2,Tue Jul 21 13:08:19 2015 UTC,There is no higher compliment
postpunk,3dy4iw,jamiecoughlan,7,Mon Jul 20 14:13:34 2015 UTC,"First sentence in:  ""It is hard a fuck to write about Joy Division"".  You can start by proofreading."
postpunk,3dy4iw,binhu,3,Mon Jul 20 16:06:32 2015 UTC,And fact checking: he's got the month of Ian's suicide wrong.
postpunk,3dy4iw,etchgtown,1 point,Mon Jul 20 16:26:15 2015 UTC,P.S. It was written by a woman.
postpunk,3dy4iw,relaxandenjoy,1 point,Mon Jul 20 17:16:26 2015 UTC,that shouldn't matter
postpunk,3dy4iw,relaxandenjoy,3,Mon Jul 20 18:55:14 2015 UTC,"It doesn't. But etchgtown said ""he's got the month of Ian's suicide wrong"", and I was just clarifying."
postpunk,3dy4iw,xpldngboy,2,Mon Jul 20 18:56:28 2015 UTC,Ah. Fair enough!
postpunk,3dy4iw,timrobbinsissopunk,1 point,Mon Jul 20 20:23:47 2015 UTC,Thanks for pointing out the errors! Hope you enjoyed the article despite the editorial foibles!
postpunk,3dy4iw,farmerdaniel,4,Mon Jul 20 17:14:35 2015 UTC,"Article seems to start promisingly and then gets nowhere fast. Also, I'm irked that the Smiths are off-handedly relegated as 'self-pity' music because I've never found that to be true at all. That's a cliche about them that only lazy journalists still use."
postpunk,3dy4iw,nrith,3,Mon Jul 20 19:39:19 2015 UTC,"Exactly, it's like they just look at the song titles or take the lyrics face value. If you didn't laugh to yourself a little the first time hearing, ""Heaven Knows I'm Miserable Now"" you're doing it wrong."
postpunk,3dzcwi,burning7planet,3,Mon Jul 20 19:31:49 2015 UTC,This is my kind of music!!!
postpunk,3dzcwi,timrobbinsissopunk,3,Mon Jul 20 20:16:22 2015 UTC,"Dear bandcamp type people, this is how to do it correctly.  As to the music? Not bad but not really my bag baby! This sub is a broad church and it fits."
postpunk,3dxzov,olilo,1 point,Mon Jul 20 13:32:46 2015 UTC,That whole EP is good. Seems like the label that released it has gone AWOL though.
postpunk,3dq9ts,IAMAGrinderman,2,Sat Jul 18 11:59:47 2015 UTC,"I've never really been a fan of Lydia Lunch, but her cover of ""Kill Your Sons"" is pretty cool imo..."
postpunk,3dphua,vaguelyhuman,4,Sat Jul 18 04:54:14 2015 UTC,"Goddamn, somebody needs to put Urgh! A Music War back together and give it a proper blu-ray release."
postpunk,3dphua,Shadow23x,2,Sat Jul 18 06:08:53 2015 UTC,The current release that is available from Warner Archive is a pretty beautiful transfer.
postpunk,3dphua,numanoid,1 point,Sat Jul 18 06:57:19 2015 UTC,Holy crap! Bookmarked. Looks like it's burned on demand. Might try to research an original playlist and cross-check it. There's been a lot of rights issues leading to different arrangements of the film over the years.
postpunk,3dphua,Shadow23x,2,Sat Jul 18 07:13:58 2015 UTC,I believe it is only missing the Splodgenessabounds song.
postpunk,3dphua,numanoid,1 point,Sat Jul 18 07:16:35 2015 UTC,"This, a thousand times."
postpunk,3dphua,SlackBadger,2,Sat Jul 18 06:45:17 2015 UTC,"Klaus Nomi is awesome. His straight up opera stuff is great too. Normally I can't get into that kinda stuff (honestly, I'm surprised that I even like Klaus' new wave stuff), but he's captivating as fuck.  This one's on the sidebar, and I figured I'd bring it up specifically in here. He was already dying from AIDS here, and iirc, he only really started wearing that collar regularly as a way to cover up the spots from Kaposi's sarcoma on his neck. Dude was pretty cool...  Gonna leave this here too."
postpunk,3dpomf,Shadow23x,5,Sat Jul 18 06:13:45 2015 UTC,"My favorite song of the movie, and that's saying a lot."
postpunk,3dpomf,SlackBadger,1 point,Sat Jul 18 07:01:47 2015 UTC,I used to love when they'd show that on USA Nightflight.
postpunk,3dpscz,SlackBadger,1 point,Sat Jul 18 07:04:13 2015 UTC,"Maybe it's just because I like gimmick bands, but this is fun. They look a bit like TISM as well."
postpunk,3dndz5,weblypistol,2,Fri Jul 17 18:03:06 2015 UTC,"Moveable backdrop  The backdrop shifted and changed, shifted and changed"
postpunk,3dndz5,SlackBadger,2,Fri Jul 17 18:24:59 2015 UTC,Thanks- never heard this before.
postpunk,3dndz5,Mattfromocelot,2,Sat Jul 18 13:13:01 2015 UTC,Got their totally wired cd when I was 16 and I still listen to it. Thanks for this
postpunk,3dfpha,uzmifune,5,Wed Jul 15 22:25:11 2015 UTC,I can only think this is good for the sheer boggling puzzle of working out multiple levels of irony.
postpunk,3dfpha,weblypistol,2,Wed Jul 15 22:35:22 2015 UTC,"I don't think North Korean officials are going to want to see a deeper meaning to their image other than the fact that they look like a bunch of nazis. This seems like a really good way to get yourself a free tour of the North Korean prisons, camps and possibly first hand experience of the firing squad."
postpunk,3dfpha,lzgr,2,Thu Jul 16 16:22:41 2015 UTC,"Been to their show last weekend, even though a lot of older fans don't really like their new stuff, personally new album is amazing! And terrifying at the same time...so terrifying I'm actually afraid they will get shot..."
postpunk,3dfpha,Psyrebro,2,Thu Jul 16 18:14:06 2015 UTC,"""The Whistleblowers"" is great and the video is even better. Would love to see them live."
postpunk,3dfpha,Psyrebro,3,Thu Jul 16 21:58:09 2015 UTC,"Well, it depends where you are from of course...I'm from Croatia so I can go to their show almost anytime :))) But anyways, they are a world class band and I'm sure you will get an opportunity soon if they don't get shot :P They are really an audio-visual experience with seriously heavy messages that anyone with a mind open to ideas and understanding can enjoy! :)"
postpunk,3ddlid,weblypistol,9,Wed Jul 15 13:07:09 2015 UTC,"Man, that's terrible news."
postpunk,3ddlid,mattmacneil,5,Wed Jul 15 16:08:48 2015 UTC,My heart goes out to Nick and his family. Terrible news to wake up to today.
postpunk,3ddlid,bangwhimper,3,Wed Jul 15 14:39:25 2015 UTC,"Not really the most appropriate song to go with, but yeah, the news is awful. Hopefully Nick's family will be able to pull thru (especially considering Nick's history of bad habits...).   On a related note, the last verse of ""Weeping Song"" is even more miserable to listen to after reading the news about Arthur's death.  Edit: So I was on FB, and it showed up in my feed. The press is fucking disgusting sometimes. I'm not surprised by it at all, but I'm still bothered (probably more than I should be, considering the lack of shock) that there's been pictures taken of Nick and his wife visiting the memorial that was set up by where Arthur died. They're going thru the worst thing that any parents could have to deal with, and can't even grieve without some fucks thinking ""Hmm, I wonder what would get us some page views? I KNOW, I'LL TAKE A COUPLE PICS OF THESE GRIEVING PARENTS!!!"". I can't imagine what it has to be like to not only be going thru this nightmare, but to also have to be made into a freak show for the public's viewing pleasure."
postpunk,3dg9i2,L3aBoB3a,1 point,Thu Jul 16 01:05:37 2015 UTC,XPost Subreddit Link: /r/Soundgarden
postpunk,3dg9i2,XPostLinker,1 point,Thu Jul 16 01:21:44 2015 UTC,This is metal/rock.
postpunk,3d9a46,miraoister,2,Tue Jul 14 14:33:33 2015 UTC,This is fucking awesome.
postpunk,3d9a46,_RedPillFedora_,1 point,Tue Jul 14 16:11:02 2015 UTC,"sort of comment I love to see, rather than some kid whining about ""is this post punk?"" which is what I had 2 weeks ago."
postpunk,3d9a46,kingofnumber2,2,Tue Jul 14 16:31:01 2015 UTC,"Damn, that was dope."
postpunk,3d2dbg,sporesofdoubt,3,Sun Jul 12 23:38:42 2015 UTC,fuckin saved
postpunk,3cx46b,tobeornotobe,2,Sat Jul 11 15:30:30 2015 UTC,I was lucky enough to see them live a few times. One of the loudest bands live ever. So loud it triggered your fight or flight instincts.
postpunk,3ctysf,amish_no_wave,3,Fri Jul 10 19:26:34 2015 UTC,"If this doesn't count as PP, sorry. Won't happen again."
postpunk,3ctysf,psychsketch,2,Fri Jul 10 19:27:04 2015 UTC,"In the traditional sense it isn't post-punk, but I don't see any reason as to why it should be taken down. Good song from a good album. WHICH, has close ties to post-punk. They Might Be Giants are essentially a college/alternative rock band, two genres which are deeply connected to post-punk. The obvious example of alternative/college's tie to post-punk, being R.E.M."
postpunk,3ctysf,istillusedialup,3,Fri Jul 10 20:32:00 2015 UTC,"TMBG used to describe themselves as ""the last new wave band."" So it's probably closer to post punk than not."
postpunk,3cseb3,farmerdaniel,3,Fri Jul 10 11:43:23 2015 UTC,"This whole album was great.  Also, the Pet Shop Boys were in on it too."
postpunk,3cseb3,Major_Tom42,0,Fri Jul 10 15:56:01 2015 UTC,Forgot that part. Which one?
postpunk,3cseb3,monster_truk_madness,2,Fri Jul 10 19:09:25 2015 UTC,'Getting away with it' and 'patience of a saint'
postpunk,3csuu0,_RedPillFedora_,3,Fri Jul 10 14:26:40 2015 UTC,Good band!
postpunk,3cr5up,miraoister,4,Fri Jul 10 02:52:21 2015 UTC,Such an under-appreciated band.
postpunk,3cr5up,L3aBoB3a,4,Fri Jul 10 06:13:44 2015 UTC,"When folk write off Butthole Surfers as a jokey band, this is what I play them."
postpunk,3cr5up,Spodyody,1 point,Fri Jul 10 09:29:08 2015 UTC,That was a punk tradition back in the day you know. To name your band something that would prevent radio play and get you dismissed by the rock press because you didn't want radio play and couldn't give a shit about the press.
postpunk,3cr5up,farmerdaniel,1 point,Fri Jul 10 11:38:03 2015 UTC,"I will never forget being at the first Lolapalooza when Gibby came out on stage during Nine Inch Nails set and started firing blanks at the audience with a real shotgun. It ruined NIN set, infuriated Trent, made the audience howl with laughter, and drove home the point of who was the more dangerous band."
postpunk,3cr5up,farmerdaniel,2,Fri Jul 10 11:35:31 2015 UTC,"amazing, what year? did he go to jail for that?"
postpunk,3cr5up,farmerdaniel,1 point,Fri Jul 10 14:36:18 2015 UTC,"Real shotgun but loaded with blanks. He didn't point it directly at the audience, just in the general direction, and was many yards from them so, legal I guess? Today would no doubt be different.  You should have seen him pour lighter fluid over a cymbal on a stand and then beat it with a drum stick. In a tiny punk club. With the entire audience dosed. That was scarier.   edit: 1992ish? Atlanta Lakewood. When was the first lolapalooza anyone?"
postpunk,3cr5up,farmerdaniel,2,Fri Jul 10 14:42:09 2015 UTC,"you sir, are a true American hero."
postpunk,3cr5up,SlackBadger,1 point,Fri Jul 10 14:47:10 2015 UTC,Thanks! I wear my punk era scars with pride.
postpunk,3cqjui,miraoister,2,Thu Jul 9 23:45:30 2015 UTC,"Oh man, the best!"
postpunk,3cqjui,lanceponk,1 point,Sat Jul 11 18:51:55 2015 UTC,yeah!
postpunk,3cpe4e,HoneyVortex,2,Thu Jul 9 18:29:40 2015 UTC,"Thanks for the link, that's really interesting, I hadn't head The Glove before."
postpunk,3crbul,ZizzazzIOI,1 point,Fri Jul 10 03:43:25 2015 UTC,i love that photo of the melvins at disneyland.
postpunk,3cpbq0,tornflags,1 point,Thu Jul 9 18:10:26 2015 UTC,"although im not a fan of rudimentary peni, you get an upvote!  edit- this track is actually quite good!"
postpunk,3cmvtc,amish_no_wave,1 point,Thu Jul 9 03:33:41 2015 UTC,This is so tight.
postpunk,3ck2hn,farmerdaniel,2,Wed Jul 8 15:00:32 2015 UTC,...and then it was sampled by Messiah:  https://www.youtube.com/watch?v=wKduhUXa0rg  Warning: This video is the most early-90's thing you may see all day.
postpunk,3ck2hn,solipsistnation,1 point,Wed Jul 8 16:31:08 2015 UTC,LOL amazing
postpunk,3ck2hn,giobot,0,Wed Jul 8 19:48:59 2015 UTC,I had effectively forgotten that track! On purpose. Damn you internet!  My revenge:  https://www.youtube.com/watch?v=eLfEpTnyJx0
postpunk,3ck2hn,solipsistnation,3,Wed Jul 8 16:35:16 2015 UTC,"Also, it's that SAME DAMN BASSLINE.   Stainless Steel Providers, Stigmata, ok ok we get it, it's a nice riff, but 3 records? Come on.  https://www.youtube.com/watch?v=oqS9KaEg_Xs"
postpunk,3ck2hn,solipsistnation,2,Wed Jul 8 16:49:08 2015 UTC,"Oh MAN. I haven't listened to this in YEARS!  The Skatenigs thing was a pretty sad story, too. Fuckin' Al."
postpunk,3ckh45,solipsistnation,1 point,Wed Jul 8 16:46:39 2015 UTC,I've been listening to this guy a lot lately-- he's generally pretty decent.
postpunk,3ci9tv,eratropicoil,2,Wed Jul 8 03:02:54 2015 UTC,"If I ever got married, I would want the first dance to be to this."
postpunk,3ci9tv,Comatose_Bat,1 point,Thu Jul 9 04:48:27 2015 UTC,Good choice.
postpunk,3cj2sq,weblypistol,0,Wed Jul 8 08:28:15 2015 UTC,0:00 - Enough  4:52 - We all die  10:43 - Great expectations  15:03 - Top expert  18:22 - Ice water  22:02 - Still in love  25:32 - Rockets  30:14 - Faces  35:14 - Fiance  35:45 - Wealthy Man  40:54 - Not what you want
postpunk,3cg8ci,_RedPillFedora_,3,Tue Jul 7 17:50:55 2015 UTC,"This thing is a goldmine, I have listened to it so much this year."
postpunk,3cg8ci,nature1,1 point,Tue Jul 7 23:58:26 2015 UTC,Soundtrack perfect for watching the sun come up.
postpunk,3cg8ci,orthodox_caveman,3,Wed Jul 8 12:16:05 2015 UTC,"I'm consuming For my living I'm assuming For my being!   So simple, so great"
postpunk,3cfh12,farmerdaniel,1 point,Tue Jul 7 14:35:16 2015 UTC,"This is good in a Mrs. Miller way, but it really is outside the boundaries. Why not here? It's not fucking post punk in any shape form or plankton. Look at this sub's title. Does this fit truly even if it is special?  I have seen this before and will stop it. It will hurt me more than you. That's what my Dad said. Now stop sniveling ."
postpunk,3cfh12,weblypistol,-2,Wed Jul 8 08:18:14 2015 UTC,"What ever ass hole? What it is is funny and there doesn't seem to be any ""incredibly strange music"" subs."
postpunk,3cfh12,weblypistol,0,Wed Jul 8 12:57:08 2015 UTC,"You are winning me over. It's mildly amusing in music history terms. Just because there is no strange (define) music sub, and I very much doubt that, does not make this a repository. The weird and wonderful is welcome if it fits and this does not.  I would also prefer to be called an arse not some form of equine anatomy thank you very much."
postpunk,3cfh12,weblypistol,0,Wed Jul 8 13:04:16 2015 UTC,Here's your definition: http://www.amazon.com/Incredibly-Strange-Music-Vol-1/dp/0940642220
postpunk,3cfh12,weblypistol,-2,Wed Jul 8 13:47:13 2015 UTC,"Postpunk is such a broad term, and considering that it was very much a part of the culture to also have things like this in your crate that  I can't imagine how it matters? Did you fuss at the Can post too?"
postpunk,3cfh12,weblypistol,1 point,Wed Jul 8 13:11:28 2015 UTC,Can and Krautrock are firmly linked to here. Where do you draw the line?
postpunk,3cfh12,weblypistol,-2,Wed Jul 8 13:17:08 2015 UTC,If you are including the things that were influential on postpunk...
postpunk,3ce69k,HalfEatenCat,4,Tue Jul 7 05:25:12 2015 UTC,"Lots of delay and chorus. On the chorus, use a slow rate and high depth. (10 o'clock and 2 o'clock works well for me.) Add a gritty analog delay and you're on your way to Monkeyland.   They also didn't tune to concert pitch, which is annoying when you're playing along."
postpunk,3ce69k,blackseaoftrees,4,Tue Jul 7 05:55:38 2015 UTC,"Reg sounds mostly like he's just using a bunch of overdrive for grit, and maybe adding some reverb on occasion. Dave Fielding's sound, to me, sounds like a ton of analog Memory Man delay + some chorus and reverb. I believe live he biamped and used a Fender Twin and a JC-120, but I could be totally wrong. I've definitely seen Twin usage in old live videos. The pickups on his Microfrets guitar look like P-90s but I could of course be wrong there too. As blackseaoftrees alluded to below, they tune up a whole step to F# on the first two records and then just a half-step to F on Strange Times."
postpunk,3ce69k,NostalgiumDirective,2,Tue Jul 7 16:56:00 2015 UTC,Thank you so much everyone!
postpunk,3cd9lw,lemrez,5,Tue Jul 7 00:34:38 2015 UTC,one of the best albums of this time period
postpunk,3cd9lw,giobot,4,Tue Jul 7 03:14:16 2015 UTC,"Yeah, I recently started going through the reissues released by the Minimal Wave label and they definitely stand out. But there are a couple of really cool bands among them. I really like Autumn (don't get confused, the youtube name is wrong), Deux and Futurisk as well."
postpunk,3cd9lw,_RedPillFedora_,3,Tue Jul 7 12:21:33 2015 UTC,That Autumn album is so tight. Same with Deux.  You guys might want to check out Artificial Records a label out of Toronto.
postpunk,3cdbml,Caelmor,2,Tue Jul 7 00:52:09 2015 UTC,"Killing Joke, originators of my tinnitus.   Good live shows, though. There are certainly worse ways to sustain permanent hearing damage."
postpunk,3cdbml,solipsistnation,1 point,Wed Jul 8 16:50:05 2015 UTC,I'm getting 'This video is not available'.
postpunk,3cb0h4,HoneyVortex,4,Mon Jul 6 14:35:56 2015 UTC,This is one of my favorite Yo La Tengo songs.
postpunk,3cb0h4,ghostworldvhs,2,Mon Jul 6 19:00:23 2015 UTC,"Favorite Bands. I'm so lucky to have seen them a dozen times. Often in the Fall, while holding the hand of a cute college girl. So indie."
postpunk,3cb0h4,farmerdaniel,3,Tue Jul 7 14:42:53 2015 UTC,"It's funny you say that because I'm gonna be seeing them this fall, my first year in college."
postpunk,3cb0h4,ghostworldvhs,1 point,Tue Jul 7 18:03:36 2015 UTC,"The only band I ever saw where some one yelled out ""Quieter!""   (They have as many pretty quiet songs as loud droney ones)"
postpunk,3cajmh,tornflags,2,Mon Jul 6 11:48:54 2015 UTC,"I absolutely adore Cranes and this is my favourite song with them. I'm not sure I would call them postpunk, but they're lovely nonetheless."
postpunk,3cajmh,spaceache,3,Mon Jul 6 14:04:04 2015 UTC,"Yeah I'd liken them a little more with the shoegaze trend. To be fair, there's a lot of crossover appeal. Love them as well."
postpunk,3cajmh,muroidea,1 point,Mon Jul 6 17:56:02 2015 UTC,"Great song, saw them open for the Cure in 92, not knowing the band at all and really enjoying their set."
postpunk,3c8m8l,disposablegoddess,3,Sun Jul 5 22:40:29 2015 UTC,had to.
postpunk,3c8m8l,numanoid,5,Sun Jul 5 22:40:37 2015 UTC,Might as well throw in the Lee Cooper jeans commercial: https://www.youtube.com/watch?v=ARCZJwjcEk8
postpunk,3c8m8l,Rainbow-,2,Sun Jul 5 23:30:56 2015 UTC,Whoa. Weird.
postpunk,3c8m8l,celesfar,2,Sun Jul 5 23:19:36 2015 UTC,We welcome our corporate overlords in this particular case.
postpunk,3ca0yo,farmerdaniel,2,Mon Jul 6 07:16:40 2015 UTC,Mitch Easter was the producer of REM's first album.   I had this as an EP  Good psyche/studio effects.  Edit: Came back with my favorite from that EP  http://youtu.be/Es4jpWlioTo
postpunk,3ca0yo,looki_chuck,1 point,Mon Jul 6 12:26:33 2015 UTC,I loved jangle pop.
postpunk,3ca0yo,miraoister,1 point,Mon Jul 6 17:44:23 2015 UTC,blocked in my country. japan.
postpunk,3c7nrl,miraoister,2,Sun Jul 5 17:39:41 2015 UTC,Oh hell yes.
postpunk,3c7q88,coffeescoldbynow,3,Sun Jul 5 18:02:06 2015 UTC,Hey I know the vocalist/guitarist! He played briefly in a synth pop band like 3 years ago. I saw them play their first show at a coffee shop. This is good stuff.
postpunk,3c7q88,t3h_p3ngUin_of_d00m,3,Sun Jul 5 18:15:19 2015 UTC,"That's awesome! I wish I coulda seen that, or any show for that matter. I would like to know what these dudes are up to these days(?). I moved to Boise from N. Idaho recently and just found out Deaf Kid was based out of here. Oddly enough, this was after finally looking into them today, after watching this video religiously over the past year... funny how that happens."
postpunk,3c7q88,Opesterfan,2,Sun Jul 5 18:52:37 2015 UTC,"This is so good, thank you. Just listened to it 4 times in a row. So I gather there's not much stuff of these guys out there?"
postpunk,3c7q88,Opesterfan,2,Mon Jul 6 11:39:35 2015 UTC,"They have broken up since this was recorded, as far as I can tell. There are a few songs on their bandcamp, which is: deafkididaho. I'm having trouble tracking down any other tunes or more recent projects."
postpunk,3c41a5,thefriendcatcher,2,Sat Jul 4 15:49:46 2015 UTC,Edwin Collins' voice is a national treasure of Scotland. And his story post-stroke is inspiring.
postpunk,3c41a5,etchgtown,2,Sat Jul 4 23:08:15 2015 UTC,this owns
postpunk,3c41a5,GasedBod,2,Sun Jul 5 06:43:14 2015 UTC,"amazing song, shame about the solo career though!"
postpunk,3c41a5,miraoister,1 point,Sun Jul 5 17:40:09 2015 UTC,any idea what tv show this was on?
postpunk,3c41a5,miraoister,1 point,Sun Jul 5 17:47:12 2015 UTC,here is a live recorded version from Old Grey Whistle Test...
postpunk,3c456p,thefriendcatcher,2,Sat Jul 4 16:26:03 2015 UTC,"Hey boys, seen any... action?"
postpunk,3c456p,SlackBadger,2,Sat Jul 4 19:31:26 2015 UTC,https://en.wikipedia.org/wiki/Urgh!_A_Music_War
postpunk,3c456p,foetus_lp,1 point,Sat Jul 4 22:59:17 2015 UTC,"Urgh! A Music War:       Urgh! A Music War is a British film released in 1982 featuring performances by punk rock, new wave, and post-punk acts, filmed in 1980. Among the artists featured in the movie are Magazine, The Go-Go's, Toyah Willcox, The Fleshtones, Joan Jett and the Blackhearts, X, XTC, Devo, The Cramps, Oingo Boingo, Dead Kennedys, Gary Numan, Klaus Nomi, Wall of Voodoo, Pere Ubu, Steel Pulse, Surf Punks, 999, UB40, Echo & the Bunnymen and The Police. These were many of the most popular groups on the New Wave scene; in keeping with the spirit of the scene, the film also features several less famous acts, and one completely obscure group, Invisible Sex, in what appears to be their single public outing.    Image i     Relevant: Dark Continent (album) | Bleed for Me (Dead Kennedys song) | The Alley Cats (punk rock band) | Message in a Box: The Complete Recordings   Parent commenter can toggle NSFW or delete. Will also delete on comment score of -1 or less. | FAQs | Mods | Call Me"
postpunk,3c456p,autowikibot,2,Sat Jul 4 23:00:22 2015 UTC,"I've listened to Urgh! at least 50, hell it's probably more like a 100 times. The standout highlights imho are:  Wall of Voodoo – ""Back in Flesh""  Toyah Willcox – ""Dance""  John Cooper Clarke – ""Health Fanatic""  Orchestral Manoeuvres in the Dark – ""Enola Gay""  Oingo Boingo – ""Ain't This the Life"" (possibly the best song in the movie)  Echo & the Bunnymen – ""The Puppet""  XTC – ""Respectable Street""  Klaus Nomi – ""Total Eclipse""  Gary Numan – ""Down in the Park""  Magazine – ""Model Worker""  Devo – ""Uncontrollable Urge""  Gang of Four – ""He'd Send in the Army""  https://www.youtube.com/playlist?list=PL1g1-Okh_ImOmN66QAIm1mxn5d6c7Knln"
postpunk,3c456p,SlackBadger,2,Sun Jul 5 01:32:46 2015 UTC,https://www.youtube.com/watch?v=3q-MTmh9p0E
postpunk,3c3so6,miraoister,2,Sat Jul 4 14:23:57 2015 UTC,It's a glamorous world
postpunk,3c3q4h,miraoister,2,Sat Jul 4 13:56:18 2015 UTC,Fucking yes.
postpunk,3c3q4h,Comatose_Bat,0,Mon Jul 6 20:53:03 2015 UTC,i wonder if Henry Rollins took influence from this.
postpunk,3c0lj3,kingy123,8,Fri Jul 3 17:55:23 2015 UTC,I see what you did there.
postpunk,3c0lj3,drij,2,Fri Jul 3 20:39:38 2015 UTC,Original by the Kinks '69 for comparison. I love both versions.
postpunk,3c0lj3,weblypistol,1 point,Fri Jul 3 18:00:23 2015 UTC,I looooove The Falls version of this song.
postpunk,3c0lj3,nosebleedx,0,Fri Jul 3 20:44:05 2015 UTC,https://www.youtube.com/watch?v=EzYwuI2hvfc&index=3&list=PLQ2ZVW2TA2riwtBV4fo6vlLcQ0zXhVP5a
postpunk,3c1yr2,farmerdaniel,3,Sat Jul 4 00:38:44 2015 UTC,Shoulder Pads is as post punk as the winner of a dress up competition  of a  Post Punk's annual festival dress up as post punk.  I also like this.
postpunk,3c1yr2,weblypistol,2,Sat Jul 4 00:45:02 2015 UTC,"Some day, me talk pretty too :)"
postpunk,3c1yr2,weblypistol,3,Sat Jul 4 01:34:29 2015 UTC,Me talk shite. Me don't give a shite.
postpunk,3c1yr2,weblypistol,2,Sat Jul 4 01:36:43 2015 UTC,Me post postpunk post. You post nice postpunk competition comment post script....too many IPAs already.I'm not really this smart.
postpunk,3c1yr2,SlackBadger,3,Sat Jul 4 01:44:10 2015 UTC,Me like cat. It furry.
postpunk,3c1yr2,SlackBadger,2,Sat Jul 4 01:53:25 2015 UTC,"We need at least 3 Fall posts today, challenge accepted."
postpunk,3c1yr2,weblypistol,1 point,Sat Jul 4 01:50:57 2015 UTC,Something curious and orange please!
postpunk,3c1yr2,SlackBadger,2,Sat Jul 4 01:51:45 2015 UTC,That's exactly what I was planning on posting.
postpunk,3c1yr2,weblypistol,2,Sat Jul 4 01:53:50 2015 UTC,And I saw it all.  Lollipops...free lollipops... I the childFall Catcher
postpunk,3c1yr2,altusnoumena,1 point,Sat Jul 4 03:35:04 2015 UTC,"I haven't seen Chitty Chitty Bang Bang in over 30 years, so I'm afraid the reference is lost on me :("
postpunk,3c1u4a,PaulRigggaaal,2,Fri Jul 3 23:54:38 2015 UTC,nice band.
