resumes,3dftl4,hamtaro3,1 point,Wed Jul 15 22:56:24 2015 UTC,"Cover letter is in this comment: Fake Name Fake Address     Fake number Fake cell phone number Fake email  July 18, 2015  Dear Hiring Manager:   It is with great enthusiasm that I submit my application for the position of cashier for Food Basics. As an experienced customer service professional, I strive to provide a positive experience for customers.  As you will see from the attached resume, I've built my experience in a variety of roles and industries, mostly in small communities where I was an office assistant, newspaper carrier and a part of the maintenance crew for a school. I’m not only used to wearing many hats, I sincerely enjoy it; I thrive in an environment where no two work days are exactly the same. I especially enjoy standing and greeting customers In addition to being flexible and responsive, I’m also a stickler for details. One of my recent projects involved delivering around 20 newspapers. I noticed these newspapers belonged to the wrong company!  I believe in applying this same level of attention to detail to tasks like counting change. Last but not least, I want you to know that I'm a passionate Food Basics fan and a longtime supporter of the Metro Company. I've been following Food Basics and I am always happy to alert fellow customers about the great deals Food Basics is offering.   In closing, I am thrilled at the possibility of being involved in the Food Basics team and would love the opportunity to meet with you and discuss the value that I can bring to the Food Basics organization and the Metro Company.  I appreciate your consideration and look forward to hearing from you. Warmest regards, Hamze Abdi"
resumes,3ddozc,RedLetterResumes,2,Wed Jul 15 13:39:34 2015 UTC,"I'm a visual type of person. Is there an example you could upload to your website, so I could see how different it is compared to a regular resume?"
resumes,3degmk,Slicedbread_,1 point,Wed Jul 15 17:10:29 2015 UTC,"This is definitely a unique approach, which some will like and some may not. In certain industries you'll probably get better responses.   The measure of success thing is odd. It's a good attitude to have, but it suggests that you don't accomplish things so much as try to make others accomplish things.  The 2nd and 3rd columns of your skills section can go away. They aren't relevant, at least not there. You've been out of high school a long time, and I assume scouts as well. It's time to drop that stuff.  The quotes at the bottom are meaningless unless we hear them from those people. We'll check references when necessary, we don't need those quotes. If you want them to count at all, have those people recommend you on LinkedIn and put a link to your LinkedIn on the resume. That way we can somewhat 'verify' that they are real comments."
resumes,3degmk,resumeraidersDOTcom,1 point,Thu Jul 16 13:40:13 2015 UTC,"Thank you for all the points of feedback.  I agree with the Measure of Success. As I've been revising, it is becoming more out of place. Upon further research here, I'm morphing that into a branding statement, so it will be completely reworked. What's more, reading it now makes it feel like a smart answer to an interview question, not a lead off.  Interestingly Boy Scouts resonate on a pretty 50/50 basis. As above, it's starting to feel like a better answer to ""interests etc"" in an interview.  I have on my website a list of all 20 of my recommendations  so that they can be viewed publicly in case someone isn't connected to me on LinkedIn or lacks premium etc. This page includes links to each recommender's LinkedIn profile etc. Additionally, I only post or source from recommendations that have been officially posted on my LinkedIn.  • How do you feel about that approach? I have a link in that section on my resume which links to that list."
resumes,3degmk,resumeraidersDOTcom,1 point,Thu Jul 16 14:33:56 2015 UTC,The website link is better than listing the names on a resume.
resumes,3deywj,Steelfromfire,1 point,Wed Jul 15 19:16:56 2015 UTC,"I'll chime in until someone else comes along, but keep in mind,  three bullet points for each job position."
resumes,3dediy,gasthetap,1 point,Wed Jul 15 16:48:29 2015 UTC,"Im in the engineering field, have been through many resumes and interviews. this is my critic on this resume:  1) First glance w/o reading, its too bulky. I prefer bullet points, shorter statements. I have gotten feedback on this and most other agreee on this.  2) I'm not sure what that first line is. you shouldn't need to state you're a mechanical engineer. If you're applying to specialized positions that request a mechanical engineer, then they will expect you are one. If not, they will see your education. The first line seems like it is also an objective statement. These should be very precise and clear about what you trying to achieve, not who you are. Research objective statements and read examples for more help on this.   3) If you take out that first part and replace it with an objective statement, then you'll want to swap the experience and education sections. With entry level positions, it is normal to base a student on GPA. This clearly depends on what type of company you are applying for, but my GPA set me apart for my most recent job. Also, Purdue is something to flaunt, especially with that GPA.  4.) You're experience section is very cluttered, remake the format so its easier to read. like, the time frame is so close to the words I had a hard time finding it. Your experience section seems very rigorous, but you're not talking about it enough. sure you managed $12MM, but did you make something more efficient? did it end well? did you improve anything by a %, did you save money in any way? you want to express you were successful at the job, not just have the job.  5) Unless your sustainability education at the bottom is relevant to the new job you're applying for, take it out. It's not an official degree or license so it may just come off as filler material. You've had an intership, and a full time job. you should be able to expand on this experience explanation tremendously.  overall, you've got some work to do if you want to compete with the other MechEs out there. Also, if you got this template from the school, completely change it. My school had a class on this stuff and all 100 kids in my major had an identical resume with practically the same content upon graduation. Stand out.   I'd like to send you a copy of my template, but idk how to send attachments or pictures ha"
resumes,3dediy,pm_me_a_pokemon,1 point,Fri Jul 17 20:15:22 2015 UTC,"Thanks for your feedback! The first line was meant more as a branding/summary statement than an objective statement, as is often suggested on the sub. I'd love to see your template. Unfortunately, the only real way I know to send the file would be to upload it on a third party site, such as google or imgur, and link to it."
resumes,3deahf,syncmatt,1 point,Wed Jul 15 16:26:41 2015 UTC,"Your profile reads as just a self-assessment - it's rather useless. I want to hear about what you can do or what you've done, not who you think you are. Everyone says they are ambitious, analytical, etc. - I promise you that hiring managers aren't reading your resume and saying ""Let's bring him/her in, the resume says he/she is ambitious!!""  A technical resume needs a skills section, or at least some mention of technical skills. You don't even list one technology on your resume. That's a huge problem for you."
resumes,3deahf,resumeraidersDOTcom,1 point,Thu Jul 16 13:43:58 2015 UTC,Awesome! Thank you for the great feedback! I will definitely look into making some edits on those.
resumes,3ddxuf,Alyssianna,1 point,Wed Jul 15 14:53:15 2015 UTC,"Get it on one page. Make your margins narrower, decrease the font size between your lines, experiment with fonts.   OR get rid of your ""skills"" section completely. Someone else might disagree with me there though. My reasoning is: places are going to assume you know Microsoft Office at this point. Everyone uses it. If you don't know how to use it, I'm not sure how you would've gotten through college. Knowing 3-4 languages is an awesome/amazing skill, but is it applicable to the jobs you are applying for? Everything you listed in the finance category sounds like stuff you learned in classes or internship and for entry level, they might assume you learned that in college already. Leadership skills...you already listed your leadership positions, thus demonstrating you have skills there, no need to reiterate it.   My two cents..."
resumes,3ddxuf,lavender28,1 point,Wed Jul 15 16:47:13 2015 UTC,Thank you!  Your help is really appreciated :)
resumes,3ddw2u,andres9888,1 point,Wed Jul 15 14:39:26 2015 UTC,"At 3 pages, this resume is about 2 pages too long. If you tighten up the contact info (name at top, address/phone/email all on one line) you can save some space. We don't need to know your college coursework either, use that space for something else.  You don't need to write ""Responsibilities included"" and ""accomplishments included"" - the reader will figure out what your responsibilities and accomplishments were based on the content. Bullet the accomplishments and not the responsibilities, just like you've done. That will save lots of lines.  The Ebay responsibilities - that's way too much to list, even if it's true. Be more focused.  We don't need 5 bullet points on your shirt selling experience from 9 years ago. It doesn't even need to be on the resume anymore, let alone taking up all that valuable space.  Not sure I'd list Google Calendar as a skill."
resumes,3ddd1l,thewun11,1 point,Wed Jul 15 11:35:59 2015 UTC,"Read resume you sent to them again. Very often they ask questions based on the information mentioned in your pplication documents. So, be ready to prove every word mentioned in resume and cover letter (if you sent it)"
resumes,3ddilu,shoo-in,1 point,Wed Jul 15 12:38:26 2015 UTC,Hey OP? I think you've mistaken this subreddit for /r/funny!
resumes,3dd14b,wombat_sauce,2,Wed Jul 15 08:51:03 2015 UTC,"Need more details on the current and last job since that's your main IT related work. We don't need any bullets on those earlier jobs if you are looking for IT work.   You can do programming you say, yet your resume doesn't say much about it.   This needs to be more technical - and it appears that you have some of the skills to get it there, based on what you wrote here. I'd be more likely to interview you based on this post than on reading your resume."
resumes,3dd14b,resumeraidersDOTcom,1 point,Wed Jul 15 14:13:30 2015 UTC,"Put your Skills summary at the top, then your education/qualifications in the same section or underneath (as much as people tell you a degree matters, it doesn't, just that you have one - more interested in if you actually have a brain than a degree, more of a check box). Then your experience in chronological order with most recent first.   Make the bulletpoints in your jobs more personal to you - use words like 'responsible for' when mentioning support/management bulletpoints etc. I would expand the first job out to more than 1 line otherwise remove it - looks like you didn't really do much at that job to me. I'm sure you can expand a few of the jobs out to have more bulletpoints (at the very least 5+ in each job).  If you have shortened areas/missed things out in order to fit onto one page, two pages is ok as well. If the interviewer/reviewer likes what they see on the first page they will carry on and read the second. This is a bad rule of this subreddit that scaremongers people into these ""meta"" resumes where they ""must"" do certain things. Context is everything, you can never have one rule for every context in your life unfortunately.  If you have any more questions please PM me and happy to give you some advice."
resumes,3db1b4,rental_toilet,7,Tue Jul 14 21:53:27 2015 UTC,"Hi, I looked over your resume and here are a few suggestions. Your summary is light. It needs to be focused more and really sell you to an employer. Your education could be moved to the bottom. You write employment history, I would use Professional Experience. All of your bullets are lackluster. Make them into accomplishments and quantify what you did in these positions. An employer wants a doer and someone that can add value to their company."
resumes,3db1b4,RedLetterResumes,3,Tue Jul 14 22:02:25 2015 UTC,"Moving education to the bottom is something I'll implement immediately, as is renaming Employment History to Professional Experience.  I like both of these suggestions a lot.  The trouble with the lack of focus in my summary is that I'm applying for jobs in multiple fields.  Specifically, fields where my degree is relevant and fields where my experience is relevant, and unfortunately, the two don't really overlap.  Do you think I'd have better luck using multiple resumes with their own summary statements?  What other tweaks would you recommend making if I go this direction?  Now, on to the lackluster bullets.  I'm a bit older, as I mentioned, and I always heard that you are supposed to basically describe your job and what you did.  Is this no longer the case?  I would love it if you had a link to some sample accomplishments I could look over to get a ""feel.""  Thank you so much for your help!  You've given me more valuable information in a few short minutes than any of the people in the real-world who have looked at my resume for me."
resumes,3db1b4,MichaelTreadgold,2,Tue Jul 14 22:35:11 2015 UTC,"I had similar issues recently, and after reading the side bar here, I modified the first page of my resume and immediately started getting call backs.  I'm not in the same field as you, but this is my main skills summary on the first page of my resume. I hope this helps.  High quality customer services Representative.  Skills:  Strong Customer Service Skills  Empathy and sensitivity  Mature and responsible person  Highly technical thinker who enjoys solving problems  Team player with supervisory skills when required  Excellent communication, great phone manner  Strong computer skills  Reliable / Punctual  Clean drivers license  Friendly Personality"
resumes,3db1b4,Philosofikal,2,Wed Jul 15 02:41:25 2015 UTC,"Got enough buzzwords there? You forgot go-getter, hard worker and results driven. Might want to throw in a ""thinks outside the box"" and a ""leverages synergy"" while you're at it  It is not enough to say all this stuff, you need to demonstrate it through  specific past actions and accomplishments ."
resumes,3db1b4,xshivax,1 point,Fri Jul 17 23:02:54 2015 UTC,"Yes, multiple resumes. I had 5 depending on the type of job I was applying for, all of which were tailored differently and highlighted different areas relevant to what I needed."
resumes,3db1b4,Gwaelin,-1,Wed Jul 15 15:00:53 2015 UTC,"You MUST tailor your resume for every job. That right there is the problem. Typically I spend about 8 hours tailoring and refitting my resume for each position for which I apply.  Did you check out the FAQ on the sidebar? There's an example therein of how to craft a bullet.  The problem with your current bullets is that a) they're obviously not tailored for the position at hand; b) they just say what you did, not how good you are at most of it; and c) where you do indicate how well you did something, they're totally unqualified self-assessments using generalizations. Superior customer service, you say? I'll be the judge of that... unless you can back it up somehow."
resumes,3db1b4,teamDINGUS,1 point,Wed Jul 15 03:04:22 2015 UTC,8 hours? Per resume?
resumes,3db1b4,xshivax,2,Wed Jul 15 11:37:12 2015 UTC,Don't know how he could possibly spend 8 hours doing it. That's a full working day. Maybe you can hire him to be a member of teamDINGUS? topkek
resumes,3db1b4,squirtlepk,1 point,Wed Jul 15 15:01:48 2015 UTC,"What sort of jobs are you looking to get?   At first glance, your skills section can be completely changed as it currently says nothing at all. Anyone can type fast nowadays. Anyone can talk on the phone. You mention technical skills in your opening statement but you list none of them in your actual skills section.  You had to have learned more at that 9 year job than just to type fast."
resumes,3db1b4,jessicatface,2,Wed Jul 15 01:22:10 2015 UTC,"I agree with this. The summary is useless, too. From a recruiter perspective: I never really read them.  Skills section: Make them quantifiable and niche. Like /u/squirtlepk said, everyone can type fast. Can you code? Which software programs can you use? What else do you have the skills to do that many others don't, or that are specific and required for your job area."
resumes,3db1b4,Resume_Pro,1 point,Wed Jul 15 10:25:06 2015 UTC,You know what? I will help you rewrite your resume completely free. Just send me a message on the job position you had like to tailor you resume to.  Jane
resumes,3db1b4,Roger-Croft,1 point,Wed Jul 15 09:27:20 2015 UTC,"I reviewed your resume for grammatical issues, and found that the tense in “troubleshooting” should be changed to past tense “troubleshooted”. Making sure the tense is consistent throughout is important for consistency in the flow of the resume:  Accepted payments, researched accounts, and troubleshooting wireless devices  Change to:  Accepted payments, researched accounts, and troubleshooted wireless devices"
resumes,3db1b4,Philosofikal,1 point,Thu Jul 16 06:55:44 2015 UTC,"Why is the past tense of ""troubleshoot"" not ""troubleshot""? Saying "" troubleshooted"" makes me feel stupid"
resumes,3dc1vl,wehaveadreamer,1 point,Wed Jul 15 02:35:37 2015 UTC,"Interested in this too. I work as a data analyst but I want to get an evening/weekend job delivering sandwiches or similar, just to switch off a little. Not sure what to do with my current resume to fit into these positions."
resumes,3dc1vl,InternetWeakGuy,1 point,Wed Jul 15 05:19:10 2015 UTC,Yeah it's like how do I not make it so obvious!
resumes,3dc1vl,InternetWeakGuy,1 point,Wed Jul 15 10:24:42 2015 UTC,"Ah it's a pity you didn't get any replies. Did you find anything online?  I'm thinking about taking some jobs I did a while back and changing the dates... I'm from a different country so it's easier for me to give them references they can't check. Only need one McJob to be able to get more, y'know."
resumes,3dc1vl,InternetWeakGuy,1 point,Wed Jul 15 21:14:36 2015 UTC,"Well I have plenty of references, that's not an issue. I found some hotel gigs in D.C. and some caregiving/personal assistant jobs. One person responded for overnight weekend elderly care, so we shall see if that pans out.   Would love some responses, and some ideas on the right jobs to look for in this vein."
resumes,3dc1vl,InternetWeakGuy,1 point,Wed Jul 15 21:16:51 2015 UTC,"Oh I have references, but they're for me being a data/operations analyst. I don't know that my ability to glean insight from datasets is going to impress someone who wants me to drive pizza from A to B.  Best of luck though! I'm going to start applying to things with my existing resume and see what comes back. Luckily what I do qualifies me for some things on odesk and similar, so hopefully will pick up a few things there too."
resumes,3dbql7,thatcurvychick,2,Wed Jul 15 01:05:57 2015 UTC,"I will review this tomorrow evening, but I want to note that the layout is very poor. There's a lot to be said for minimalist design, but there's a lot to be said against a wall of text.  RemindMe! tomorrow"
resumes,3dbql7,vermiculus,1 point,Wed Jul 15 03:58:13 2015 UTC,Thank you for taking a look! I eagerly await your suggestions.
resumes,3dbql7,GoBigBlue2013,2,Wed Jul 15 12:28:25 2015 UTC,"Your resume focuses on what you did (duties), not what you accomplished.  This is a good article that describes that: http://www.forbes.com/sites/dailymuse/2012/01/30/resume-revamp-how-to-turn-your-duties-into-accomplishments/  This isn't bad either: https://jobmob.co.il/blog/resume-achievement-writing-ideas-expressions/  I've also been recommending RezScore and VMock, two free resume review tools that give a lot of insight on improvements."
resumes,3dbql7,vermiculus,1 point,Fri Jul 17 18:21:35 2015 UTC,Thank you so much! I will give those a look :)
resumes,3dclag,kisschicken,1 point,Wed Jul 15 05:29:01 2015 UTC,"The ""applying for"" at the top is odd - don't do that.  I'm not sure that you do a good enough job describing what you actually do, but perhaps that is because we don't know what your company does. Sounds like a web agency or marketing, but the descriptions aren't great.   I like the format enough. You could probably benefit from a summary that describes what you do before you talk about your jobs."
resumes,3dbykd,CannibalAngel,1 point,Wed Jul 15 02:08:40 2015 UTC,Looking for a new IT job. How does this resume look?  http://i.imgur.com/xbrEDnv.png
resumes,3dbvj6,inthetallgrass,1 point,Wed Jul 15 01:44:37 2015 UTC,Anybody?
resumes,3dbtda,MAZF86,1 point,Wed Jul 15 01:27:55 2015 UTC,"Not really sure I understand what you mean.  I was thinking like communication cause that's key, can't deny that. Listening to your co-workers is part of communication but also very key. Giving out tasks on who should do what is also very important.  But if you wanna give examples only you know that since you were there.  Could you explain a bit more exactly what you want? Atleast I dont understand."
resumes,3dbtda,hL4w,1 point,Wed Jul 15 07:39:38 2015 UTC,"Sorry, I realize now it was a bit vague!  I was thinking something along the lines of, ""Gained leadership skills through managing people and processes"" but that sounds very non-specific.  So I was looking for a more specific way of stating what I gained and the result of said experience."
resumes,3dbtda,hL4w,1 point,Wed Jul 15 13:59:49 2015 UTC,"Well I dont know if there are many other ways of doing it, unless you really wanna go outside of the box. ^  You can always elaborate quite alot though.  Example: ""Gained leadership skills through managing people and processes. This made me highly efficiant when it comes to dealing with resources and where to best place them. It also taught me the importance of planning ahead in order to archive my goals in time. For me planning ahead holds some key componants..."" and so on.  Always ask yourself ""What did I learn from this?"" ""What did this help me understand?""  Hope it helps.  Sorry for any spelling mistakes."
resumes,3dc6u6,ThatBrokeCollegeDude,1 point,Wed Jul 15 03:15:32 2015 UTC,"Looks like most of the discussion went on in Imgur, awesome feedback, thanks ya'll! :)"
resumes,3dc4am,little-red-wolf,1 point,Wed Jul 15 02:55:15 2015 UTC,"You do the kinds of things our Event Coordinators do.  Ignore first two paragraphs of this sample job description: http://www.supportingadvancement.com/employment/job_descriptions/events_coordinator.htm  Steal ideas from this sample description or others as a starting point, then make it your own by pointing to your specific victories (like being an integral part of the largest outdoor festival west of the Mississippi, etc.)  Good luck."
resumes,3dbndo,talk_like_a_parrot,2,Wed Jul 15 00:40:35 2015 UTC,Can't see without access
resumes,3dbndo,Forever_Sorry,1 point,Wed Jul 15 02:14:40 2015 UTC,"sorry, try this https://drive.google.com/file/d/0B_dTSXcJgkfBaWFrcG5Jc05KVTA/view?usp=sharing"
resumes,3dbndo,Forever_Sorry,1 point,Wed Jul 15 02:52:53 2015 UTC,"Profile Summary :   1) Bachelor's  2) Possess  Work History :   3) (Preference) June - September 2012, June - September 2013  Outside of that it looks alright -- though it's hard to say for certain without the full formatting of all items. The only thing is that it's plain, but great job on keeping it to one page -- it definitely should be."
resumes,3dbndo,resumeraidersDOTcom,1 point,Wed Jul 15 19:22:16 2015 UTC,"6 resumes with no reply isn't all that bad just yet. One issue could be that you have a massive spelling error in the first sentence. Bacholor's? That is a problem for you.  The last sentence of your current role is also an issue ""Develop through the use company’s proprietary software."" Missing a word or two.  The overall writing just isn't strong. My apologies if you are not a native English speaker - this isn't terrible if English is your 2nd language, but it should still be fixed."
resumes,3dbfzh,ih8erryone,2,Tue Jul 14 23:44:15 2015 UTC,"Gave this a quick review and arrived at the conclusion that you have listed topics on your resume without any depth.  So, expand on those topics you mentioned in your Key Qualifications:   Bilingual Costumer Service Product Knowledge   Right away, I could see Bilingual translating into something like ""...Proficient in multiple languages to ensure communication is smooth and professional for clients to ensure a positive result""  Product knowledge...expand on that.  You need to be able to demonstrate your knowledge of hair products and styles through words.    Do you have any professional experiences at all?  Volunteer work?  Something you can truthfully say, even if embellishing, to add to your resume?"
resumes,3dbfzh,MAZF86,1 point,Wed Jul 15 01:16:56 2015 UTC,"Thank you! This is really helpful and makes sense. And I have volunteer work from back when I was in high school, 3 years ago, which is not relevant at all :/"
