resumes,3d6693,91239477348238942983,1 point,Tue Jul 14 01:34:13 2015 UTC,"Is 90s website resume a bad theme? I kind of just winged it on the layout.  Ah, well the reason I didn't include the results is that I am STILL working on that project. We did all the design work and are currently doing the construction part. Should I write that in the resume so they'll know? Are the bullets for other things also bad?"
resumes,3d643b,linz10783,1 point,Mon Jul 13 20:37:59 2015 UTC,"Leave off the soft skills, you shouldn't have to tell them that you are a team player. You should be to fit into any organization.   I wouldn't worry too much about the 6 months. Just have a reasonable answer to why you took time off (without speaking poorly of a past employer) and work on brushing up on your skills. You can tell them that too."
resumes,3d643b,DelightfulAsFuck,1 point,Tue Jul 14 02:19:21 2015 UTC,Thanks for the help!
resumes,3d57ai,dellophant,1 point,Mon Jul 13 16:50:20 2015 UTC,"Based on the limited experience you have, this is about the best you can do. Is it ""element schools"" or should that be ""elementary""? No typos if you're seeking writing and editing work. I might suggest using past tense in things that are completed as well. Move your degree up above your experience since it's more impressive than the non-relevant experience.  Some people might suggest having a 'relevant experience' section and 'other experience', so the au pair job wouldn't be the first thing we see."
resumes,3d57ai,resumeraidersDOTcom,1 point,Mon Jul 13 19:01:02 2015 UTC,Thank you!
resumes,3d613h,findingalife,1 point,Mon Jul 13 20:17:14 2015 UTC,"First off, you dont have your name or contact info at the top. That should be a priority.  Second, try your best to keep it to 1 page. Youve got alot of whitespace, theres probably a way you could fit the stuff you've got onto one if you play around with margins and spacing.  Not all your experience needs to be listed. Volunteering in the library doesn't seem to have anything listed thats particularly useful information. You could drop that one.  An interest section is likewise unnecessary. If you have relevant experience, focus on that instead, rather than personal details.  Other than that, you're leaving alot of blank space with all the indenting and margins. It makes your resume look sparse, which makes it look like there's not much to say about you. Try to compact things a bit."
resumes,3d613h,Bananawamajama,1 point,Tue Jul 14 04:07:34 2015 UTC,Thanks. I do have my contact information I just removed it before posting it on Reddit.
resumes,3d6qoe,darthKennedy,2,Mon Jul 13 23:24:59 2015 UTC,"Im not sure exactly what your desired job entails, but if your a coach worth being taught by your main job is to spot weaknesses with your student's game and think of ways to correct those flaws. You need a keen eye for detail to spot minute errors  and enough insight to recognize what would be a problem vs. individual playing style preference. That's all basically analysis your performing on your students."
resumes,3d6qoe,Bananawamajama,1 point,Tue Jul 14 01:11:52 2015 UTC,Thanks for pointing that out. I think that would make a great talking point during an interview
resumes,3d4j9r,job_finder_GIS,1 point,Mon Jul 13 13:42:04 2015 UTC,"I'm a GIS graduate working in the Gulf of Mexico as a marine surveyor for the last 8 years. I'm trying to get a ""land job"" in the GIS / geo-spatial field.  Any comments and critique of my resume would be greatly appreciated!"
resumes,3d4j9r,resumeraidersDOTcom,1 point,Mon Jul 13 13:44:12 2015 UTC,"You have a bit too much detail in the summary which should be in the experience section. Your background sounds rather interesting, but your resume is anything but. I'd include more detail about your day to day responsibilities and accomplishments."
resumes,3d4j9r,drdeadringer,1 point,Mon Jul 13 18:18:33 2015 UTC,"You don't need to call your cell phone a cell phone. Just put down the phone number.  Reword your summary without using ""I, me, he"". 3-4 short, concise sentences about the professional you. ""Geology Hero experienced in the design, deployment, and operation of recovery systems and salvage operations. Fluent with multi-beam echo-sounder surveys and over 6 million languages. Can also speak bocce.""  Rename your edu section to just ""education""; it is confusing if you say ""education and experience""... followed by ""employment"".  Rename ""employment"" to ""experience"". Same thing, but less awkward.  Remove the phone number of your workplace.  Remove your references; they want, they ask, you give.  If you actually do title your resume as ""Resume"" at the top... don't do that."
resumes,3d4j9r,defcon22,1 point,Mon Jul 13 19:22:17 2015 UTC,Lots of great suggestions. Thank you very much!
resumes,3d4kwc,Bears_Rock,1 point,Mon Jul 13 13:57:12 2015 UTC,"This isn't 2 pages because of your experience. It's 2 pages because it's not concise. You have a profile (which lists areas of expertise) which lists everything you've done (qa and sales presentations and public speaking?), then an areas of expertise which repeats much of it and starts to get into your job responsibilities, then you have the employment section which lists your job responsibilities. You basically have everything in duplicate. you're trying to do too much.  Your education section could be trimmed down (degree, school, date on same line for each one). The certs don't need to be listed out like that - why not list them with commas and only list the most relevant. And you really shouldn't put your reference names on the resume. When we need your refs, we'll ask.  No, you shouldn't expand anything unless you want to list more accomplishments and less of the 'fluffy' stuff"
resumes,3d4kwc,resumeraidersDOTcom,1 point,Mon Jul 13 18:25:21 2015 UTC,Thanks for the advice!
resumes,3d4kwc,drdeadringer,1 point,Mon Jul 13 18:45:00 2015 UTC,"Remove your references; you provide them when they ask, not before.  Move your skills section to just under your ""business profile"".  Rename ""business profile"" to ""summary"".  For those ""certifications//courses"", consider culling that down a bit. Include only actual certifications you have, not ""oh I took this class on Kahn Academy"". Consider moving those certifications into your skills section."
resumes,3d3hdy,thankyouandplease,7,Mon Jul 13 05:41:45 2015 UTC,"Before I started my IT career I only had experience as a waiter and no degree. It's always the matter of what spin you put on it. Customer service, handling money, doing inventory... all of these can help you in the long run."
resumes,3d3hdy,ciny,2,Mon Jul 13 09:43:20 2015 UTC,"I feel like it helps support the claim that I have people skills,    Then it may be beneficial to place it on the resume, until you have more professional work experience.   something I heavily emphasize on my resume/in cover letters, but  it is not a particular prestigious job nor will it be furthering my  career.   It  does not need to be prestigious to list it.   You don't necessarily need to list your side work,  as long as you are in school.  However, if there are notable things about your job that you are learning from  or that demonstrate what qualification you have, then it's probably worth it to report  that you have customer-service related work."
resumes,3d3hdy,Draco1200,1 point,Mon Jul 13 12:08:17 2015 UTC,Do you have a gap of not working if you don't put it in?   Yes --> yes
resumes,3d3hdy,TheDayTrader,1 point,Mon Jul 13 08:37:08 2015 UTC,"Definitely, I worked in a diner as a waiter for the whole summer right before I started college, and I was able to spin whatever I ""learned"" there to get an accounting job on campus, which I leveraged to get an internship at a startup for the following summer. Until you get more relevant work experience, put it on your resume."
resumes,3d49ie,muffunz13,1 point,Mon Jul 13 12:03:49 2015 UTC,"Work on fleshing out your experience...for example  Domino's Pizza Delivery Driver (cut the crap, mate)    Excelled in a fast-paced work environment where I completed an average of 15 deliveries per shift  Responsible for customer relations by fielding phone calls to provide solutions and manage problems.  Utilized cash counting software EXAMPLE to handle all accounting and revenue reporting.  -Duties included....   submit your resume at rezi.io for in depth critique...thanks mate"
resumes,3d49ie,rezi_io,2,Mon Jul 13 12:34:22 2015 UTC,"Domino's Pizza Delivery Driver (cut the crap, mate)   golden, haha"
resumes,3d49ie,vermiculus,1 point,Mon Jul 13 13:14:22 2015 UTC,"Rename ""profile"" to ""skills"".  Remove that ""quick learner"" bullet; it's pure fluff.  You can reduce that ""excel word powerpoint"" to just ""ms office suite""."
resumes,3d49ie,drdeadringer,1 point,Mon Jul 13 12:59:24 2015 UTC,"use consistent typography:   third bullet of second item uses oxford comma; this isn't present anywhere else hyphens are for hyphenated words, not ranges. use endashes for that: 2010–2011  for general punctuation, use either word(space)–(space)word or (word)—(word) – note the longer dash is called an emdash.   double-check grammar throughout, e.g.   Quick learner, professional, driven individual…   if you have anything to support an entry-level it position, i would include it in your résumé. to be honest, without anything supportive like that, i wouldn't call back for an interview :/   aside from that, it sounds like you've copy/pasted a bunch of this résumé. try to think of outstanding qualities of each position."
resumes,3d3s6q,leo_ash,1 point,Mon Jul 13 08:00:34 2015 UTC,Holy shit- experience with Microsoft Office?  How rare!
resumes,3d3s6q,duffzilla,1 point,Mon Jul 13 09:00:24 2015 UTC,"Do I make it look like it's something special? It's just there because that's what everyone here has on their demands list for interns  Also everyone demands ""advanced"" Office skills. It's kind of mutual bullshitting because only 5% of students actually are advanced at it from a neutral standpoint and then in the job you'll only use basic stuff anyway."
resumes,3d1v51,scienceygeek,1 point,Sun Jul 12 21:09:14 2015 UTC,"No offense (seriously), but your resume screams ""cannot write!"" - especially that first line. By the time they get down to ""Strong communication skills; written and oral"" they will be doubting the validity of the rest of your claims (btw, that is an improper use of the semicolon. It should be a colon).  Focus on writing clearly and concisely. If you notice that you have more than 1 ""and"" or your list has more than 3 commas, add a period in there to break it up.  For example, you could change your first sentence/section to:  (Specific Science) professional with international experience in HIV/AIDS research seeking a position with a well-established global public health organization (or just insert the company name here), (optional:) in order to utilize my (2-3 specific skills) skills to (insert noble goal here).  In your summary of qualifications, make sure to cut it down to only the most specific and exceptional examples - not the traits that they would expect any professional to have. This will help you stand out, and to cut down that very long section that they are likely to only skim over.  Lastly, is this supposed to be a resume or a CV?  A resume is only 1 page, while CVs can be a lot longer. Resumes also tend to have shorter job descriptions and don't include the list of publications."
resumes,3d1v51,Moose_Gwyn,1 point,Sun Jul 12 23:48:06 2015 UTC,"Your summary seems too long to me. Is this resume to be submitted to a recruiter/manager based in the US? If so, consider tightening that section up."
resumes,3d2rlc,SuppoCheng,1 point,Mon Jul 13 01:42:14 2015 UTC,"I have a couple of suggestions:   Drop the objective statement. Companies only care what you have to offer and not what you want/need. Change it to a short (3-4 sentence) summary of who you are, your main skills and what you have to offer. Try not to repeat what is in the rest of your resume. Don't bother listing all of the classes you've taken. Every student in chemeng takes pretty much the same course load. I'm assuming that by the third year of your degree you've worked on several academic or extracurricular projects. Create a new section called ""Project Experience"" and list each school project as if it were a job, i.e., with a bullet list of your accomplishments, achievements and contributions were to the project. Make the list of skills at the bottom more coherent. I would get rid of things like ""Attention to detail"" and make the list entirely your technical proficiencies. Like a list of all software, programming languages, hardware or software that you know how to use. You should do a google search for student engineering resumes. There are a lot of examples from school career service departments.    It's tough getting your foot in the door. Don't worry about the GPA, just focus on the skills that you are developing at school. Good luck!"
resumes,3d28sd,Bornofisais,2,Sun Jul 12 22:59:22 2015 UTC,"About the only thing that I see is your tendency to treat bullet points as paragraphs - they should be short and succinct - typically less than one line. If you wish to use bullets (which is a good idea - paragraphs are sometimes hard to wade through), try to break them into multiple one line bullets by removing words that don't add meaning.  Frankly, considering your major and GPA, I don't think you should have a problem finding a job. Good luck!  EDIT: The one thing that's missing that I'd wish you'd say something about - either in the resume or in the cover letter - is your ability to work as part of a team. That's going to be really important in an office environment, and there isn't really anything to that effect on the resume."
resumes,3d28sd,MacSev,2,Sun Jul 12 23:29:13 2015 UTC,"Ah good point (no pun intended)! I'll break up the paragraphs and, considering that my projects were done in a group, I'll make sure to include that. Thank you!"
resumes,3d28sd,vermiculus,1 point,Sun Jul 12 23:42:33 2015 UTC,"be careful to use consistent typesetting:   spacing hyphens vs. dashes (hyphens should only be used for hyphenated words; dates/ranges should always use endashes (–)) capitalization  avoid underlining to the best of your ability – it's (largely) a holdover from single-font typewriters as others have said, keep your bullet points short.  aside: if you only have one bullet point, should it really be a bulleted list?   nice senior project, by the way :) reminds me of my (and my teammates') aquaponics project for a class. you should look at digikey for your components."
resumes,3d23x2,Batair_Alai,2,Sun Jul 12 22:19:59 2015 UTC,Remove your High School. There is too much white space and it looks very empty. Expand on some of those jobs. You shouldn't have only 1 bullet point for every job. Maybe for ones that are 5+ years old but your most recent should have at least 3.
resumes,3d0mtm,Paranoid-Jack,10,Sun Jul 12 14:50:07 2015 UTC,"Remove your DOB.  Remove your references.  Remove your hobbies and interests. You talk about those in an interview when you are asked ""how are you a well-rounded human?"" and ""tell me about yourself"".   is it too wordy?   Yes it is.  Your ""skills and qualifications"" reads like a very, very long summary. No one cares that you are ""organized"" or ""have initiative"", or all those other things ""which are all traits I possess"". Why would I also care if you have a clean driving license unless we're talking about a job which requires driving? Kill all of that; everything. Kill it.  What you actually want in a summary is 3-4 short, concise sentences about your professional self. ""Archaeology student experienced with Jurassic World, DNA extraction, and training Raptors. Comfortable running around islands in fear of imminent death. One more sentence like this without using ""I, me, he"""". And title your summary ""summary"".  In your actual skills section, which goes just under your summary and is titled ""skills"", you put down actual real skills. Not ""organized"", not ""enthusiastic"", not ""responsible"", not any of that. What archaeological tools and software have you used? Name them. ""Pickaxe 9000"", ""mobile radar 2150"", and whatever other real skills which you believe will help you land an interview with what job you are applying to.  Now you have your work experience section. The format should be something like:  Baker Bakery                                01/2013 - 05/2014  Pastry Boy   Made pastries Delivered pastries Sugared pastries   Have 3-5 bullets of your most awesome accomplishments, tasks, and successes for each position.  Revamp your resume to something like this, and it will be kings to you."
resumes,3d0mtm,drdeadringer,4,Sun Jul 12 16:46:17 2015 UTC,This
resumes,3d0mtm,MAZF86,1 point,Sun Jul 12 20:53:01 2015 UTC,"Thanks, this has helped a lot! Will post the revised version soon."
resumes,3d0mtm,Jetzki,11,Mon Jul 13 13:23:23 2015 UTC,"I should not have to read about your favourite books, before I get to your work experience."
resumes,3d0mtm,CupcakeAndTea,9,Sun Jul 12 16:51:04 2015 UTC,Point form everything Why is you DOB on there? Grades aren't necessary on a CV When stating things about your previous experience you need to add tangible proof.  ex: turn I raised money for to I raised $XX in XX time to do XX
resumes,3d0mtm,blazingunicorn,3,Sun Jul 12 15:58:19 2015 UTC,Yes.
resumes,3d0mtm,FUSE_33,3,Sun Jul 12 15:43:38 2015 UTC,"Turned down how?  As in you submit your resume and never hear anything?  If so, then yes, it's your resume.  Keep in mind though, you may have the absolute most perfect resume and will still get ""turned down"".  /u/CupcakeAndTea outlines the beginnings of what you need to do.  You will make many revisions to your resume, it's a never ending process.  Now if you are being turned down after an interview, it has nothing to do with your resume then."
resumes,3d0mtm,CannibalAngel,3,Sun Jul 12 16:39:09 2015 UTC,"All of the other advice here is good but I didn't see one important thing mentioned. This NEEDS to be 1 FULL page and 1 page ONLY. No more, no less."
resumes,3d0mtm,CynicLibrarian,1 point,Sun Jul 12 20:16:20 2015 UTC,"Have you ever seen a resume?  Go find on on Google, and make one for yourself. Post it here and we'll critique it.  There should not be paragraphs about your life, anything at all about your interests or any grossly broken English sentences."
resumes,3d147y,xenofenix,0,Sun Jul 12 17:28:48 2015 UTC,"maybe do your best with making a resume and post it here and we can give some constructive feedback?  edit: not to be a huge debbie downer, but even if a weak resume is worse than no resume, there are going to be people applying with resumes that will automatically put them above you. Better off trying your absolute best to make a resume and looking into ways of spinning past experiences into something relevant to radioshack (eg team leader stuff, volunteer experience working with others/managing some task, etc etc)"
resumes,3d147y,jackapple89,1 point,Sun Jul 12 19:40:45 2015 UTC,"Perhaps you're right, thank you. I have a lot of ""stuff"" to put on a resume, but not all of it is relevant. I can't spin some of the volunteer work I did, or specific undergrad research, or leadership positions I held (chemistry-related). Without work experience, my resumes have always been weak. I have searched for resume formats that do not include work experience, though I still have trouble becoming a competitive applicant."
resumes,3d1ltz,qckdry,1 point,Sun Jul 12 19:52:38 2015 UTC,could you upload a different version and may be we could tell u which is better ?
resumes,3czl9m,Topher_lewis,5,Sun Jul 12 05:32:12 2015 UTC,"Any tips to make my skills more appealing to potential employers?   One useful thing here may be to really figure out what you want to do afterwards. You want to get out of the restaurant industry and that's great, but where do you want to go now?  Everyone here can suggest numerous different possible avenues for future work. However, not all of those avenues may be things you can immediately pick up to make your resume look incredibly attractive and not all of those avenues may be of interest to you.  Knowing where you want to go is important because successful resumes are tailored towards the job description. More often than not you are not going to fill every requirement. However, you want to be able to fill the ones that matter most to your potential employer.  So I would say start there. What's the next industry you want to get into?"
resumes,3czl9m,Laxaria,5,Sun Jul 12 11:50:58 2015 UTC,"So you know how to work with people. Having also worked at restaurants and bars, you likely know how to ""up-sell""; suggesting desserts after dinner, drinks with meals etc. You have sales experience and may not realize it. I'd  suggest trying to get a sales job which, in the right industry can yield a lot of commisions. Look into local beer, liquor, or condiment distributors and work your way up from there. From there, you can get into supply chain management, marketing, or other revenue  operations related fields. Best of luck."
resumes,3czl9m,caligrown87,1 point,Sun Jul 12 08:43:07 2015 UTC,Agreed. Look into working for companies that work with restaurants.   I'm a former chef and got an AS in networking and now work for a POS company.
resumes,3czl9m,citrus_sugar,4,Sun Jul 12 15:37:15 2015 UTC,Learn to code. Tech can be the great equalizer between you and someone else with a degree and put you way ahead of where you are now.
resumes,3czl9m,pachewychomp,2,Sun Jul 12 08:15:19 2015 UTC,"Look into becoming an EMT in your country, people can use that as potential medical experience to become a paramedic/nurse. EMT's get paid well depending on the country/region."
resumes,3czl9m,execjacob,1 point,Sun Jul 12 09:13:17 2015 UTC,go right in and introduce yourself. employers like those who work for it
resumes,3d11x8,jacobfreeman000,2,Sun Jul 12 17:10:11 2015 UTC,"Start with the FAQ, specifically:   How can I get the most out of this subreddit / help out?  Post a resume, even if you think it's garbage   and   I don't have any idea how to start.  If you are using MS Word, you may find this format helpful.   Searching online for ""graphic design resume"" or similar should also give you a start. We can't really help much more than that until you have some attempt at a resume."
resumes,3czjil,loving_embrace,3,Sun Jul 12 05:11:48 2015 UTC,"Just a quick scan (with the caveat that I'm no expert)   ""Proofread and edited short stories and full-length manuscripts."" How many did you edit? What type of short stories? What is the average word length? Genre? ""Updated Database Information"": Of what?  ""Reviewed press releases"" Try to be more specific! I would consider using the word ""copy,"" ""copywriting"" or ""copyediting,"" if appropriate, if you are applying to similar jobs.  ""Interacted with;"" eh. What was the interaction?    I might consider using present tense for your current projects. Put a larger emphasis on specificity."
resumes,3czjil,Laxaria,1 point,Sun Jul 12 11:56:52 2015 UTC,Thanks for the critique! I'll make the changes you suggested.
resumes,3czjil,MacSev,2,Sun Jul 12 12:35:36 2015 UTC,"Seconding everything Laxaria had to say.   For starters, I was modestly confused in the education section - because everything else has date ranges, but Rollins just has a month and a year. It's also unclear at which university you received the humanities award. I'd also definitely describe it in your own words rather than using a quotation - you can cut out a lot of unnecessary words/save space. I've never been a huge fan of the ""Relevant experience"" and ""additional experience"" division. The implication is that the ""additional experience is not relevant experience - which is certainly not true. If I were a hiring manager, I'd want to know that you managed 10 schedules and had the social chops to talk with 300+ people everyday - that's solid experience. I'd fiddle with the idea of shifting education to the bottom. I'm not sure your degree really sets you apart - but your experience might. I'm guessing most other applicants to a job you'd apply to would be college graduates in the liberal arts with an award or two, but they might not have the experience that you do. Consider a summary at the top. You've got some white space and what looks like an interesting background/more maturity than most fresh-out-of-college folks - and a one-to-two line summary could clearly demonstrate that. I sorta hinted at this before, but the assistant store manager bullets are really well written - it's quantified and sounds like you were trusted with responsibility."
