resumes,3e5xio,junkyself,1 point,Wed Jul 22 05:13:24 2015 UTC,"It's best management practices.  Need to focus more on the basics.  Ever trained lower level employees or other students.  That might show you can educate business owners.  Emphasize things like attention to detail, teamwork, willingness to learn.  Goodluck"
resumes,3e5xio,paddleme,1 point,Wed Jul 22 05:39:42 2015 UTC,"Thank you so much for catching that! I only did a teaching internship/class for one semester. How should I fit that in? Other than that I don't have experience in teaching/educating  EDIT: Also, is the little blurb (below the ""dynamic biochem professional"") too subjective? I def fluff a bit there. Should I cut it out to keep the resume objective? (har har objective in the resume. bad pun. sorry)"
resumes,3e45fl,ScumbagMario,1 point,Tue Jul 21 20:33:43 2015 UTC,looks good to me m8. Sure as fuck better than mine and it got me a retail job.
resumes,3e45fl,TClatch2,1 point,Wed Jul 22 04:56:00 2015 UTC,"Agreed. It looks good. As always, list achievements whenever you can. Good luck!"
resumes,3e5n5l,Saganaki,1 point,Wed Jul 22 03:34:03 2015 UTC,"I didn't post my address  JARED SMITH 755 Any Drive Sin City, NV 89120  Home: (702) 555-5555  test@gmail.com   is fake"
resumes,3e5n5l,orbitalteapot,1 point,Wed Jul 22 03:36:21 2015 UTC,Here is a more recent one i tried to make more modern Resume2
resumes,3e5a8n,SublimeEccentricity,1 point,Wed Jul 22 01:46:59 2015 UTC,"You can shrink it down to one page, that's for sure. Human attention span is short, so play with it.  Change the formatting a bit. a sample would be from reddit resume FAQ page.   You can also drop the high school part. The professional achievements are pretty good, however you can improve it more by assigning numbers if you can. Good luck!"
resumes,3e58l8,timothybugjunior,1 point,Wed Jul 22 01:33:14 2015 UTC,"Try temp agencies?   Or become self-employed and start your own business? You could get seed money from agencies that fund small businesses and there could be grants from the government that help with this kind of stuff. (I'm in Canada and there's stuff like this here, IDK how it's like where you're from.)  Build up your résumé by getting more relevant volunteer experience in the fields you want to work. This will take a while, but will be well worth it eventually.   Go to trade school and improve your technical skills there? If you don't have the money, maybe save up and work towards it in the future. You could make good money doing a trade; most people I know can't fix anything to save their lives. :P   Hope this helps! :)"
resumes,3e3azt,dplowman,2,Tue Jul 21 17:06:35 2015 UTC,"Your doc needs permission to access.  Edit: Cover letter   ""To Whom It May Concern:""  Tips:   You probably know this, but it's always better if you address the person you are applying to by name. I don't make a huge effort on this but if it's not listed on the job ad and I really want the job I'll do a quick search on their website.  Normally I format my cover letters into three paragraphs. This is just the format that I came up with.      One or two sentences of objective and intro. Rest of paragraph explains why I'm awesome. Paragraph of why you're awesome (ie. what you like about the job, why you like the company and why the job interests you) Paragraph of why we would be awesome together (ie. the experience/skills I have that perfectly fits in with the job).   For your cover letter I would focus on writing about only the info/skills that particularly pertains to the job ad and then elaborate on them (as you have done).  I'll often steal a couple words from the ad itself to make sure I get past the HR department. I've heard that some companies run your resume through a word filter for matches to the job ad.  At the bottom I always mention something about my availability and when I can start; interest in scheduling a time to get to know them better and learn more about the company; and repeat my contact info from my resume.   I try and keep my cover letter as short but badass as possible. Especially with the trades I think most employers don't want to screw around and just want someone reliable and efficient.  Maybe it would help you to apply in person at these jobs. My husband is in trades but he's new to Canada so I can't say for certain.  Your grammar and writing are easy to understand, so no problems there! Overall, it's not a bad cover letter and I think maybe you've just been unlucky so far.  I'm going out now but I'll check out your resume later."
resumes,3e3azt,bigcitylights1,1 point,Tue Jul 21 17:59:38 2015 UTC,"Sorry, just fixed that! It should be viewable by anyone now."
resumes,3e3azt,bigcitylights1,1 point,Tue Jul 21 18:07:16 2015 UTC,"Thank you for the advice, I'll reformat my cover when I get home and send it your way, if you don't mind looking at it again!"
resumes,3e3azt,drdeadringer,1 point,Tue Jul 21 21:39:33 2015 UTC,Sounds good!
resumes,3e3nj1,EvilSandman,1 point,Tue Jul 21 18:31:06 2015 UTC,"I'll point out that there is no such thing as the ""Army National Guard of the United States"". The Guard is run by each state.   Your resume seems solid but you could probably do a better job of quantifying your past experiences. Add some numbers and percentages to show improvement or adherence to timelines."
resumes,3e3jmn,IT_PIPE_BE,1 point,Tue Jul 21 18:04:54 2015 UTC,... dealing with customer allergies with all those cosmo chemicals? Safe UV levels for tanning? Specific order of applying makeup?
resumes,3e3jmn,drdeadringer,1 point,Tue Jul 21 21:30:17 2015 UTC,"Solid points, thanks for the response."
resumes,3e3iqo,gabemonroe,2,Tue Jul 21 17:59:07 2015 UTC,"In your edu section, consider killing the word ""completed"". As a little bit of time goes by, consider killing the year as well. Also, replace ""in progress"" with ""2018 (expected)""... using the year you expect to graduate with that.  Your ""career summary"" looks like two sections in one, with some added fluff. Redo like this:  Have a ""summary"" section... 3-4 short, concise sentences about your professional self. ""Management assistant experienced with keeping 007 in his place between and during missions. Efficient with organizing and scheduling events, including untimely deaths of government officials. Ensured regulatory compliance with local and federal guidelines.""  Have a ""skills"" section, located just under your summary section. Include that ""MS Office, SalesForce,"" and similar. Consider adding whatever other specific real skills you have... certifications, software you've used, hardware you've used, languages you speak, languages you program in...  The Fluff to kill:    If you want to spell out ""8 years of experience"", do so in the summary or in a cover letter. Don't say it twice, because now I'm wondering if it's 8 years or 16 years. Nobody knows what ""strong business acumen"" is or means. This is demonstrated in your work experience, not told by casually whipping it out. ""Excellent PC skills"" is vague and can be claimed by anybody. Spell these out. Can you program? What OSs have you used? Networking? Certifications? Admin anything? IT stuff? Be specific. Name things.""C++, HAL 9000, iOS HoneyDo Melon Jug"". ""Quickly build trust and..."" this may be true, but it's fluff to say it like that. Again, demonstrate this ""reputation as a team leader"". Show that you were a leader of a team. ""High level of comfort with increasing responsibility""... the exact same thing. Where is this ""increasing responsibility""? Show it to me. Promotions? Moving up from guarding the parking lot to being Watch Commander? Spell it out with specifics, do not casually whip it out."
resumes,3e3iqo,drdeadringer,2,Tue Jul 21 22:07:33 2015 UTC,Thank you so much!!=)
resumes,3e2mwa,Darth_Bowie,2,Tue Jul 21 14:09:49 2015 UTC,"You can always try. If you sent it to a specific person or email account, you can write a brief cover and mention that you were very interested in the position and realized that your previous resume did not accurately portray your experience, so you wrote a new one."
resumes,3e2hvu,1EagleEye1,1 point,Tue Jul 21 13:26:47 2015 UTC,"Top sentence reads a bit odd (when it gets to ""throughout any of the conservation...""). It looks like that phrase describes the devastation, and not your intent.  Your qualification and skills sections are unusual, and not in a good way. I think you list way too much stuff here that isn't going to impress people - particularly the generic organizational, interpersonal, and comm skills talk. That's all self-assessed filler content.   Some of the skills stuff is relevant (field skills), but the rest makes this resume unnecessarily long. It could easily be one page."
resumes,3e2pak,FatherlyTripod,3,Tue Jul 21 14:29:17 2015 UTC,"I would entirely delete or redo everything above the work experience. Your resume starts with sentences and bullets of self-assessed traits which are fluff. Nobody is going to interview you because you say you are hard-working and motivated. That is just noise on a resume, not signal. Tell them what you can do and what you have done."
resumes,3e2pak,resumeraidersDOTcom,1 point,Tue Jul 21 16:06:26 2015 UTC,"Ok, thankyou. Would it work better if I gave a point, evidence, explanation kind of format for the traits I listed? For instance for 'a vital sense of planning and organisation', move that down to an applicable job below, and describe how I organised a shoot for my clients, where it would be shot etc. Or should I attempt to re-write it and keep it above work experience?"
resumes,3e1a08,nardi-LAS,2,Tue Jul 21 04:39:36 2015 UTC,"Don't put your age on there. It's a point of discrimination and hiring managers just get queasy. Use endashes for ranges – hyphens are for hyphenated words only. As a software engineering student, consider using LaTeX. Right-align all of your description lists. 'Work' is about a vague a verb as 'do' – find something more specific. Listing your certs is a good idea, but listing your scores is probably unnecessary (especially since the higher-level cert doesn't have that high a grade). Try to pack your data points into very short pieces of prose to describe each position. ('Agile methodology: Scrum' sounds awkward when read.) I don't think you need to be as granular in categorizing the tools you've used. In mine, I have it split out into languages, software, and operating systems – you may be able to get away with just languages and software (since linux is ostensibly the only o/s you've used). I would nix the horizontal rules between sections and just make the whitespace between the sections more apparent. (The space taken up by the rule and its following glue seems more than enough.) Where you say 'involving payment integration (PayPal SDK), it's much simpler to just say 'using the PayPal SDK'. For the IEEExtreme business, calculate your percentile. It's more immediately meaningful. Properly capitalize 'github' as 'GitHub' – it's a trademark and should be treated with some level of consistency. (I think adding ™ would be far too much, though.) You should state which repository is the speech recognition one. Hiring managers are unlikely to care, but if it gets passed off to anyone technical, they're going to want to go right to it. I know I would. There are a lot of ways you can make your contact info more compact/meaningful, but I think these are enough suggestions for now :)"
resumes,3e1a08,vermiculus,2,Tue Jul 21 12:09:45 2015 UTC,"Thanks a lot for so detailed feedback! I'll make sure to make some modifications, I really appreciate this!"
resumes,3e1a08,blueboybob,2,Wed Jul 22 00:49:01 2015 UTC,"If possible try to convert your GPA to ""american"" if you want a job in the US. It helps recruiters/HR understand."
resumes,3e1193,createanewaccountuse,1 point,Tue Jul 21 03:18:16 2015 UTC,"TBH, in CS if you've been working rather than finishing your degree, that's fine -- probably better in some circles."
resumes,3e096m,nowismytime,2,Mon Jul 20 23:27:44 2015 UTC,"In your summary... I suggest not using bullets, but 3-4 short, concise sentences. GOOD NEWS -- Keep bullets 1, 2, 4 into this tiny tim paragraph, murder bullets 3 and 5 because they're fluff, and you're done with no difficult re-wording required. Tweak when bored."
resumes,3e0y8d,gloriouspapaya,1 point,Tue Jul 21 02:52:57 2015 UTC,"I would be very, very grateful for some blunt advice   Ok ;)  Your friends are too kind, I think.  Where are you from? Is this a European format? The whole formatting seems very strange.  It's immediately jaring and the obvious word and/or google docs default template doesn't help.  Absolutely ditch the blue text.  You need to tailor the resume for the job you want.  It's not clear what job you want from the resume.  You don't want to say what job you want on the resume (that's what the CL is for) but it should be obvious the value you're expecting to provide. It looks like in an effort to list everything, the things you need to be seen get lost.  The whole top section is pretty impenetrable.  Split into clear sections: education, work experience, relevant course work, other leadership stuff, etc.  I can't even find your education section, which is really, really bad if you're fresh out of school.  The strongest bit of your resume is your work experience, but I don't think you really highlight your accomplishments.  The first rule of the real world is ""no one cares how you did it."" There is no partial credit, and nobody wants you to show your work.  With that in mind restructure your experience focusing on your results rather than your effort.  For example:   Manage projects from intake to program evaluation and follow-up   What kinds of projects? How many? What was the result of your ""managing"" them?   Develop and initiate action plans...   How was the world a better place as a result of these action plans?   Influence individuals and groups...   Who did you present recommendations to? Did they listen to you? What benefit befell the organization as a result of them heeding your advice?  We could do that for every bullet, but I think you get the point.  I hope that helps."
resumes,3e0y8d,Mimshot,1 point,Tue Jul 21 03:41:29 2015 UTC,"Your friends are too kind, I think.   That's what's been a bit maddening- these aren't my friends giving me feedback. These are ""resume workshop"" professionals, my most recent boss, etc.   I'm from the US. I disagree that it's jarring, but I absolutely appreciate the note and will keep it in mind.   I should have been clearer- this is my generic resume template that I use, and I absolutely tailor it to individual positions. I will be absolutely certain to make that very clear!  Do you have any recommendations for wording my accomplishments more specifically? I've gone through a few attempts to make it more specific/tangible without having a list a mile long. The advantage of being a consultant is also the disadvantage- Tons of different kinds of projects that you do bits and pieces of, and rarely get to see the actual results of your work =/ I just went through my logs and I myself did intake, assessment, action-planning and implementation for 6 projects; worked on pieces of 9 others, and clients allowed me to work on assessment for 3 projects. Absolutely not trying to make excuses- you're totally right. I'm just not really sure what to do with that.   This is really the biggest reason I'm trying to get into internal work rather than consulting is that I absolutely hate the segmented work and being totally dependent on whether or not clients will respond to me or allow me access to their people to see what the impact of my work is. Not to mention the endless new clients that you do hours and hours of research for who never go forward with their project. I know it's not perfect by any means internally, but I can't imagine it's somehow more difficult internally to figure out what happened to your work."
resumes,3e0y8d,Mimshot,1 point,Tue Jul 21 04:24:07 2015 UTC,"Well you should really try to get it to one page, and make sure your education stands out, especially if you're looking for your first job out of your program.  I know it's hard to quantify results sometimes, but try -- and if you can't just be as specific as you can be.  Even saying ""worked on nine projects"" is better than ""worked on multiple projects.""  As an exercise, I would recommend adding more and more and more detail until it becomes truly ridiculous, then start removing things, vaguest first, to get to a reasonable starting point."
resumes,3e0y8d,imredtheredditor,1 point,Tue Jul 21 04:42:22 2015 UTC,Thank you for the feedback! It's much appreciated =)
resumes,3e0y8d,resumeraidersDOTcom,1 point,Tue Jul 21 04:50:20 2015 UTC,"I would try and limit it to one page. You can mess with the margin size, font size, etc to do this, but one page is definitely best. Throw the dates on the right side, balances the resume more.  Narrow down your descriptions, use a lot of action verbs. Also, put some numbers in there. They stick out more when glancing over.    I have an ""Skills/Hobbies"" section of my resume, where I list things such as skiing, biking, and camping.  Every interview I had, I was almost always asked about it.  I found having just even one line of non-job things makes you seem more human.  You have a lot of good info on that resume! I'm sure you'll get picked up soon. Good luck :)"
resumes,3e00dm,pizzathehut12,1 point,Mon Jul 20 22:19:33 2015 UTC,"Your skills should not be in the footer, but in their own section toward the top of your resume.  Consider killing your ""leadership"" section [you can save it for an interview]... especially if realestate is tight when you move your skills as above."
resumes,3dyfi9,pelotero2jn,4,Mon Jul 20 15:37:11 2015 UTC,"Maybe you can include projects you've been involved in that demonstrate relevant skills? Also, you could try doing freelance work in line with what you want to do, at least so you can gain relevant experience somehow ($$$ too)."
resumes,3dyfi9,kamyuz,2,Mon Jul 20 16:31:53 2015 UTC,"If you can point to specific projects or coursework that uses the skills you listed ""Statistical"" section, I would put those one and get rid of that section. Also, I don't think you need an objective"
resumes,3dyfi9,darthKennedy,2,Mon Jul 20 20:02:39 2015 UTC,"I would say it's this:  Office of Congressman Tupac Shakur                                                                                                          Some City, JK Intern"
resumes,3dyfi9,anondasein,2,Mon Jul 20 22:58:52 2015 UTC,Can you include your resume for us?
resumes,3dyfi9,wehaveadreamer,1 point,Mon Jul 20 18:56:45 2015 UTC,"These two tactics that I write about will help you with your resume, www.johnleonard.com/blog/two-simple-tactics-to-improve-your-resume. Check out these two tactics, and you will be on your way to securing an interview."
resumes,3dyfi9,Ebazinet,1 point,Mon Jul 20 19:55:00 2015 UTC,"You say you want a research/analysis job, but the first sentence of your resume says you're interested in data entry.  If I were screening, I would have stopped reading right there. Data entry is something we pay $3/hr to a BPO firm in India for."
resumes,3e24nt,linkedinakademi,1 point,Tue Jul 21 11:04:40 2015 UTC,What is this?
resumes,3dzmvz,Thatdudeguybro,1 point,Mon Jul 20 20:42:35 2015 UTC,"Here are a few suggestions:   Objective - Ditch the objective statement. It is generic and doesn't add any value. You are basically saying you want to find a job to do the work your company wants you to do. The fact that you are applying for a job says all of that. Profile - Get rid of this section as well. How you describe your experience in the bullet points should cover all of this. Do you really have excellent leadership skills at a professional level? Do you even know what that is? What is increasingly responsible work experience?  Education - As a soon to be graduate this should be at the top of your resume. You also need to include your GPA. If you don't include the GPA people will assume it is really bad. Since you want straight for an MBA after your bachelors you should include the GPA for both. Professional Experience - You need to focus more on what you accomplished in these roles instead of just what your job responsibilities were. What impacts did you have, what new ideas did you come up with, etc. Try to use numbers and quantify your accomplishments as much as possible. People remember numbers. Expand on these sections to demonstrate all of the things you list in your profile. Computer skills - Cut this out. You can't graduate college without knowing these. ACTIVITIES, HONORS, & VOLUNTEER EXPERIENCE Cut out all the high school stuff. This is a professional post-college resume. What you did in high school is obsolete unless it is truly amazing and relevant to the job you are applying for.   I hope this helps. Check out this resume template to get a better idea about formatting. It is geared toward finance but is a great template for just about any other university student."
resumes,3dzmvz,Judowned,1 point,Mon Jul 20 23:07:33 2015 UTC,"For a fresh out of MBA you use this format.  Full stop, there is nothing else.  You're coming out of an MBA program, so i'm going to be a bit harsh here, but I'm sure you can take it.   I am seeking employment with an organization in which I can use my skills and education to help achieve and surpass goals   This says nothing.  I know nothing more about you, what you want, or what you can provide after reading it than I did before.   PROFILE   All of the subpoints are worthless.  You need to show leadership skills, show logical thinking, show knowledge of finance, etc. with quantifiable outcomes from real examples of times when you utilized those abilities.  You're presumably applying for associate positions at either management consulting firms or investment banks.  Why are you listing off what sounds like a lot of blue-collar experience?  Not that there's anything wrong with good-honest work, but you need to make it seem relevant to what you're trying to do."
resumes,3dzmvz,Mimshot,1 point,Tue Jul 21 03:25:32 2015 UTC,"Not harsh at all! I appreciate it, in fact. Like I said, I'm relatively lost in this field.  I'm listing that particular work experience because it's the most professional and only real experience I have. If I were to list only relevant information for investment banking, etc., my resume would essentially be blank.   FWIW, and I don't know if it changes anything, but I am trying to apply for more of a process engineer or auditing position. Really, I'll apply to anything (finance included), but I know finance is my weakest link in my skill set. I think I'm more of an operations kind of person.    Again, thanks! I need the blunt, straight-forward advice, here.  EDIT: It appears you can't access the samples or templates without a Harvard account."
resumes,3dyh6a,beefsupreeme,1 point,Mon Jul 20 15:49:28 2015 UTC,"They way you have the dates formatted in the top job isn't working. I assume it's 2 separate stints, probably best to list them out.  You'd benefit from a profile statement to lay out who you are and let the resume fill in the details. For example, I was starting to snooze on your resume and about to stop reading, but then I got to the military experience. If I'd stopped reading, I'd not have seen that - but I'd have looked for it if I'd known it was coming. Some profile statement where you mention it would help. So it will be something like ""MS of Mech Eng grad with military leadership experience..."""
resumes,3dyh6a,resumeraidersDOTcom,1 point,Mon Jul 20 16:20:57 2015 UTC,"Ok thanks. I was leaning towards that, so will definitely rearrange the to fit the profile statement and redo the dates."
resumes,3dye1h,billyheathphoto,2,Mon Jul 20 15:26:26 2015 UTC,I would hire you. But people can be so dumb!!! you can use it as a filter for dumb people.
resumes,3dye1h,Antropomorphic,2,Tue Jul 21 01:41:35 2015 UTC,no man. I would totally hire you. It's great! your webpage everything.
resumes,3dye1h,Antropomorphic,1 point,Tue Jul 21 01:42:59 2015 UTC,Thanks for the encouragement!
resumes,3dzdyf,MTechMichaud,1 point,Mon Jul 20 19:39:42 2015 UTC,"I have an objective on mine.  Mine is ""To obtain a challenging position where I can utilize my electronic, electrical, mechanical and engineering experiences and education.""  I've had it on my resume for over 10 years and as my career has evolved so has my objective.  My resume has been reviewed by resume professionals and never once did anyone mention I should change that.  I'll also mention that I've seen to have less of an issue of getting interviews than my peers of similar experience and education but that could be a reflection of my resume overall as oppose to just the objective section."
resumes,3dzdyf,EngineerLuke,3,Tue Jul 21 03:59:35 2015 UTC,I was told that objectives are generally frowned upon.
resumes,3dzdyf,nobodytrickedme,1 point,Mon Jul 20 21:30:25 2015 UTC,"Every aspect of a resume is subjective really.  This hiring manager may be a font nerd and throw away stuff in Times New Roman.  This other one may hate it when people use bullet points on a resume.  You're trying to appeal to the broadest possible audience with your resume, hoping that the HR or hiring manager who sees your resume won't be a moron who throws away perfectly good candidate resumes because they don't say ""Objective"" at the top.  Full disclosure: my resume hasn't had an ""objective"" on it for perhaps 5 years.  It's generally considered archaic."
resumes,3dzdyf,fu_king,1 point,Mon Jul 20 21:36:43 2015 UTC,"Big places with big HR firms may be different, but my experience is the opposite: objective = strait to the garbage."
