resumes,3cpxld,resumeraidersDOTcom,2,Thu Jul 9 21:24:42 2015 UTC,"I did post this on the chemistry subreddit, I am just trying to get as much input as I can.  There sometimes seems to be really helpful people in this sub, and I am really looking for help."
resumes,3cpxld,Temptress75519,1 point,Fri Jul 10 00:20:04 2015 UTC,"Step 1: Convince yourself that it is not your one and only chance to get in with this company. Convince yourself that this is needed practice.  Step 2: Remember that they are people and not Gods.  Why do I say this? I have secretly recorded every interview I have been on. The audio that is, in my pocket so I can listen to myself later. When I was thinking that it was my be all end all, I spoke a mile a minute and gave tons of unnecessary details about myself and at some point I joked about illegal activity. Seriously, I put my foot in my mouth when I feel pressured.  When I thought, fuck it, this is just practice. Good practice for the big one: I was cool, calm and my thoughts were concise and well formed. Not that I have a job yet but I am going for state service so it takes a while.   As far as dress: if you're a guy, get a suit. A nice one. Jacket too. Get it tailored for god sake. It will look 100x better than one that seems like it fits from the rack.  Ask them questions about their experience with the company. Make it into a conversation. They are interviewing a ton of people and they are always asking questions. Ask them a few. They will loosen up a ton. I don't know much about your field so I can't suggest any questions specifically but ususally about their time with the company, in the field, etc.  don't worry about the sub your in, this one is fine."
resumes,3cq8o6,throwawaymhas,1 point,Thu Jul 9 22:16:04 2015 UTC,"Taleo sucks crab-ridden balls.   Each employer has specifics items they are looking for and Taleo sorts through keywords to find the matches. The applying for the same job in a different location probably won't help, unless the software restrictions are less strict for that particular Job ID#."
resumes,3cq8o6,Turkish_Fleshlight,1 point,Fri Jul 10 05:20:40 2015 UTC,I am a Taleo consultant.  Taleo has no such restrictions and does not effect your application if you do this.  Apply as much as you where you want.  Taleo doesn't care.
resumes,3cpkw6,ecoJamesbond,1 point,Thu Jul 9 19:24:33 2015 UTC,check the permissions on your google doc. when you click share make sure that anyone with the link and view it.
resumes,3cpy3j,ourblackenedsun,2,Thu Jul 9 20:55:46 2015 UTC,"Put your experience first and your education last. Your experience section is worded well and is overall more impressive.   I don't think the language section is necessary. You can put under your education that you are proficient in Japanese. If you don't know enough Spanish to have a full conversation, leave it out.   Also, under education you might want to put down courses or projects that are relevant to the position you're applying for. For example, if applying for a customer service position, maybe mention communications classes you've taken."
resumes,3cpy3j,alexiagrace,1 point,Fri Jul 10 00:48:52 2015 UTC,"Sounds good. Thank you for the advice!  I was following my university's template, which had the education up top, but I think their templates are geared more towards current students, not alumni... ;  Edit: Anything you'd change with the formatting/style?"
resumes,3cpy3j,alexiagrace,2,Fri Jul 10 00:53:21 2015 UTC,"I think besides that, it's formatted well. It's organized, simple, and clear. Just remember to brush up on interview skills as well."
resumes,3cpn9f,tdurden99,1 point,Thu Jul 9 19:42:16 2015 UTC,"One major thing I see missing is the ""how"" in your job experience section. ""Assisted in import/export of products."" -- HOW? Did you facilitate shipping/production? Did you take the orders? Did you use spreadsheets or software to track shipments? I really have no idea what you did to assist. Also, how many orders per day? Where did they go- national? international? ""Coordinated plans for organization of inventory"" -- Again, HOW? What specifically did you do? Did you take notes? Did you develop a new form or spreadsheet? Did you work with management to find flaws in the old system? Did you use a certain software? How much time did the new system end up saving? How did it benefit the team? ""Promoted retention of members"" -- how? Did you take a survey to see what people didn't like? Did you plan member events? Did you organize/attend recruitment events? Did you create publications to advertise? All of these details make a huge difference and help me better understand your skills and how you helped/impacted each organization.   I suggest putting down some specific classes that you took that may be relevant to positions you're applying for. Don't put class numbers (BUS 305). Put down the title (""International Marketing""). Or whatever the class was."
resumes,3cpmu0,Ready-2-Fire,2,Thu Jul 9 19:39:35 2015 UTC,"you spelled berkeley wrong. add months. 2014-current could mean january 2014 which would be 18 months or december 2014 which would be 7 months. huge variety so add some months! for summer 2014 too. starting with ""exceptionally talented"" is too much. come on, man. i would do ""expected graduation date: may 2017"" instead of ""class of 2017."" fix tenses under grill crew member. change bachelor degree to bachelor of science. you probably don't need high school bc if you're graduating from college, it's implied. you definitely need a skills section. make a extracurriculars (or delete yours), then skills with all technical skills and technical programs you've used. if you're applying for a/v stuff, this should be most emphasized. list every technical thing you've used, really. v important"
resumes,3cpmv4,WebDevResume,1 point,Thu Jul 9 19:39:47 2015 UTC,"I recruit developers and the market for front-end devs hasn't been better in my almost 20 years in the business.   First, this should be one page (particularly because you do front-end work). Put all the contact info into one line with small font (address, email, phone) to save a few lines. Delete some spaces. You should easily be able to get there.  You start out by saying you are 'trained in' programming, as opposed to saying what you've done. If you call yourself a web dev, tell us that you've done stuff - not that you've been trained to do stuff.  You have lots of different hats at the current job. If you want to be a web dev, you may want to talk more about dev and less about SEO, PPC, etc. You don't say much about what you built."
resumes,3cpmv4,resumeraidersDOTcom,1 point,Thu Jul 9 21:32:42 2015 UTC,"Thanks for the feedback! Sorry for my delay in replying. Part of the reason I didn't try harder to get this all on one page is that I omitted my references from this public version of the resume. My references were really making it hard for me to keep this all on one page. I think I'll maintain two different versions of my resume, one with the references and one without. The version without I've managed to get down to one page."
resumes,3coq68,mikeman10001,1 point,Thu Jul 9 15:35:34 2015 UTC,"Rewrite the qualifications section as a paragraph called ""Summary"" or ""Profile"" that outlines who you are and what you have done/can do. Many of the details from the bullets can stay. In the summary you can mention you are seeking jobs in the US.  ""Special IT projects"" - you should define a few.  Put your degree above any certs.  Not bad overall. I do tech recruiting for startups and would think you may get decent results if you improve this a bit."
resumes,3coq68,resumeraidersDOTcom,1 point,Thu Jul 9 15:41:03 2015 UTC,"I'm aiming for a very specific company that is most likely getting a lot of resumes right now, so anything I can do to make this stand out will help me out.  The reason why I put the certification at the top is because it's the most recent, and it's still in progress.  I like the idea of converting the bullet points to a paragraph.  If I can word it really nicely it might help demonstrate effective communication.  Also, I don't know if it changes much, but I'd be applying for data science positions."
resumes,3coq68,resumeraidersDOTcom,1 point,Thu Jul 9 15:44:49 2015 UTC,"I don't think you'll have much luck for data science positions in the current resume state. This doesn't read like a data science resume. You mention all kinds of data sciencey stuff in the qualifications, but your experience section doesn't back up those claims."
resumes,3coq68,resumeraidersDOTcom,1 point,Thu Jul 9 15:56:10 2015 UTC,"That's true.    Lately I've been applying to more managerial / project management positions.  I'll work on tailoring it, and including more technical details."
resumes,3coq68,resumeraidersDOTcom,1 point,Thu Jul 9 16:11:14 2015 UTC,Also curious: would it be worth while to get a resume professionally designed? or would that take away from it being related to the technical analytics industry?
resumes,3coq68,hardolaf,1 point,Thu Jul 9 15:46:40 2015 UTC,Professionally designed or professionally written?
resumes,3coq68,hardolaf,1 point,Thu Jul 9 15:56:43 2015 UTC,Professionally designed.
resumes,3coq68,Turkish_Fleshlight,1 point,Thu Jul 9 16:01:39 2015 UTC,"I don't think that's necessary, although you could build some kind of site that might show off data visualization skills."
resumes,3coq68,heywaitformenonotyou,1 point,Thu Jul 9 16:22:34 2015 UTC,"Most software balks at any sort of complex design for you resume. Keep it simple but effective. I'm using a template similar to yours that has landed me many interviews. It's simple. It's effective. And above all else, it's clear and concise."
resumes,3couz8,courtaks,1 point,Thu Jul 9 16:11:22 2015 UTC,No comment on content. On format: just a lighter background color. The dark red was not comfortable when reading black text.
resumes,3cncpg,luispancho,1 point,Thu Jul 9 06:24:22 2015 UTC,"Definitely shorten this to one page. Also, don't use a resume template (if you like it then try to re-create in Microsoft Word)"
resumes,3cnou4,Unslaad,2,Thu Jul 9 09:10:34 2015 UTC,"You did something, it doesn't matter if you did it for 3 hours or 3 days or 3 months. Just write what you did and how it made a difference/positive impact."
resumes,3cnou4,hitraj47,1 point,Thu Jul 9 13:25:55 2015 UTC,Yes.
resumes,3cnou4,Nynm,1 point,Thu Jul 9 14:41:29 2015 UTC,"You volunteered, I'd use it. You don't have to put the hours."
resumes,3cnmyy,Torzon,1 point,Thu Jul 9 08:43:21 2015 UTC,"I mean you no offense - you aren't a professional writer, and many people struggle with resumes. This is written a bit strangely, and it comes across as a first person bragfest. The resume can describe your accomplishments without coming across this way.  The resume you posted here is hardly 2 pages, so not sure where you are seeing 3 pages.  For starters, I'd put in the top section (which I'd call a summary) that you are seeking management positions. Otherwise that may not be clear.  Things that come across as bragging: ""highly respected"", ""My leadership, customer service, and management skills led to the creation of this team"", ""Other IT Teams in the organization purchased our services due to the efficiencies and processes I implemented."", ""due to my ability to work in a highly stressful environment"".   This is just you saying those things - let your references tell me that you are highly respected and able to work in stressful environments.   If you are applying for manager positions, I'd get the impression you were more about making yourself look good than making the team look good. That doesn't sound like leadership to me. Tone down the me me me stuff and stick to your accomplishments and responsibilities, and what impact they had on the business.   In this role, the end user experience was greatly improved when receiving software updates, OS patches, software installs, and new operating system deployments.   This isn't what you want to say. Say what you did (OS patches, updates, etc.), and you can say that users benefitted from that. The ""in this role"" lead isn't good. How about ""Managed team of n that performed software updates, OS patches, software installs, and new operating system deployments for x users""?  The description of the job from 03-08 reads like pure manager-speak. It doesn't say what you actually did. ""Improved customer service through improved business processes and staff coaching"". That says almost nothing.  I hope this helps. You have good experience and qualifications for the role you want, but the resume isn't good."
resumes,3cnmyy,resumeraidersDOTcom,1 point,Thu Jul 9 15:38:07 2015 UTC,Thank you.  I should have clarified that this was an attempt to cleanup a three page resume.  The bragfest was exactly why I don't like writing about myself.  Your example shows me a lot.  I will rework this atrocity.
resumes,3cnegj,mmjobs24,1 point,Thu Jul 9 06:46:36 2015 UTC,"I'd list both of those. Re: Your online classes:  I wouldn't even elaborate to say that the courses are online. I'd just list the name of the ""school"" and the city, state it's in."
resumes,3cnegj,scoopyloo,2,Thu Jul 9 15:33:30 2015 UTC,"Yup it doesn't matter if you did your classes online or in person, the important thing is you understand the material. You can just list your degree Bachelor of arts or whatever you do not have to go into specific unless it is related to the position you are applying for."
resumes,3cnegj,a1wonder,1 point,Thu Jul 9 16:06:35 2015 UTC,"I would list your education first if it's related to the job you're applying for, or if it's not and your past work experience is, then list your education after the work experience. You should shape your resume to the job you're applying for.    Don't put anything about online coursework, it doesn't matter. Just say you're a Candidate for the degree currently. For example:    Texas A&M University, College Station, Texas     Degree Candidate for MS in School Psychology, anticipated graduation December 2015    or something similar. You can mention it in your cover letter or application that it's online (so it's obvious you're not trying to relocate). It will be obvious that you live in one place and are attending school in another, so someone should be able to infer that you're taking classes online (if they're paying attention and care)."
resumes,3cnegj,Emalea,1 point,Thu Jul 9 16:45:38 2015 UTC,Awesome! Thanks.
resumes,3clxtp,cowloogi,10,Wed Jul 8 22:58:34 2015 UTC,I would re word it.  I hire for the same job type over and over.  Once I had basically two identical resumes.  They must have used a site like this.  It did hurt their applications.
resumes,3clxtp,GottaGetToIt,4,Thu Jul 9 02:01:36 2015 UTC,Put it in your words.
resumes,3clxtp,BasedDi0s,2,Thu Jul 9 09:46:57 2015 UTC,Use it as a guide but reword it
resumes,3clxtp,PeacekeeperAl,2,Thu Jul 9 10:18:26 2015 UTC,"Yes, that would be plagiarism.  You're best off just describing it in your own words."
resumes,3cmcy2,zyQUzA0e5esy2y,2,Thu Jul 9 00:58:52 2015 UTC,"Oye mate,   I would suggest the following:    Google Analytics (https://support.google.com/analytics/answer/3424288?hl=en)  -Extremely easy certification to get  Wordpress/HTML&CSS"
resumes,3cmcy2,rezi_io,1 point,Thu Jul 9 02:57:20 2015 UTC,Im going to look into google Analytics and as for html i know the basics of it. thank you!
resumes,3cmcy2,loldogex,1 point,Wed Jul 15 07:27:49 2015 UTC,microsoft excel and i dont mean beginner stuff.
resumes,3cmcy2,loldogex,1 point,Thu Jul 9 06:19:01 2015 UTC,my friend told me to learn microsoft suite thank you.
resumes,3cmcy2,scoopyloo,1 point,Wed Jul 15 07:28:04 2015 UTC,"ah, if you dont know any of the suit, it is best to familiarize yourself with it. everyone uses it at some point"
resumes,3cmido,leeny0,1 point,Thu Jul 9 01:42:47 2015 UTC,"Hi,  I just reviewed your resume and have a few pointers/tips for you. I understand you do not have a lot of experience, but the way you are positioning yourself is not great. Let me explain, you say that you have great customer service skills, etc, everyone and anyone can say the same things. Prove it! You need to show the employer. Also, you need to target your resumes towards the job you are applying for. I hope this helps you! Best of luck!"
resumes,3cmido,RedLetterResumes,1 point,Thu Jul 9 15:33:51 2015 UTC,"Hey thanks for the feedback!  I do have more experience but I was told I shouldn't include jobs that date so far back. I am turning 24 in a few weeks and I have been working customer service/retail jobs since I was 16! Perhaps I can include that to make myself look more ""legit"". Do you have any suggestions as to how else I can ""prove it""?   Also I totally agree that I need to 'customize' my resumes to cater to each job I apply for. Thanks for the feedback I really appreciate it!"
resumes,3cmido,RedLetterResumes,1 point,Thu Jul 9 15:36:34 2015 UTC,"When I say prove it, can you quantify what you did. When you write your resume, can you say that you added value and made the position yours or can anybody just follow what you said and ""push the button"" if you will. Check out this blog article http://www.redletterresumes.com/blog/2015/6/15/time-to-toot-your-own-horn. I think it will help you out. Let me know if you have more questions."
resumes,3cmido,RedLetterResumes,1 point,Thu Jul 9 15:51:43 2015 UTC,Good point! I think the best 'proof' of my merits is how quickly I was promoted and became my manager's 'second in command'. Thanks for the link and all the great advice!
resumes,3cj9t0,NervousEnergy,1 point,Wed Jul 8 10:09:48 2015 UTC,"Wow, I really hope this reaches the eyes of the people who really need it. I remember being in this position in life and it can be very scary. Great write up"
resumes,3cj9t0,unclecactus,1 point,Wed Jul 8 16:03:46 2015 UTC,This is fantastic! It'll help some really important people in my life. Thank you so much!   EDIT: HAPPY BIRTHDAY!!!!
resumes,3cm3zs,darkbridge,1 point,Wed Jul 8 23:47:08 2015 UTC,"The format is much clearer and easier to scan, but you have some grammar issues going on: random capitalizations and inconsistencies. For example, Master's in IT is not a thing. A resume is a formal document so you need to use the full formal name of your degree:  Master of Science in Information Technology. Also, ""Project Management"" is not a proper noun so don't capitalize it unless it's part of a title.  I would also only your title. What you did is more important than where you worked. I'd ditch the summary section and replace it with a skills section since you have a lot of technical skills to highlight.   Remember, a hiring manager is going to look at your resume for less than 30 seconds, so it needs to be scannable, easy to read and pull them in."
resumes,3cm3zs,crazycyclist,1 point,Thu Jul 9 15:44:37 2015 UTC,"Better. You can get this to one page. You need to ""buy"" about 25 lines to do so.  Name, address, email and phone all one one line (name can be larger than the other info - maybe name is 14 and other info is 8). And do you really think you need to write ""email"" next to your email address? We're smart enough to know that's an email address. That's 3 lines.  Get rid of all the lines above/below sections and all those spaces - you don't need them. That's probably another 8 lines or so, maybe closer to 15.  Education section can be reduced significantly. We need no detail on your degrees beyond School, City, Degree, Graduation date (we don't need start dates for any schooling). What you wrote about your BS is entirely unnecessary. What you wrote about the MS is as well (""developed a clear understanding""? Don't need that. You got the degree, that's all we need to say.). That's 7 lines.  Another trick to save space - look for bullet points that barely go past an extra line. Example is your first bullet under the current job - there is only one word on the 2nd line. We can ""buy"" a line by somehow cutting out a word or two from the description. Maybe we can change ""reducing our licensing costs year over year."" to ""reducing our annual licensing costs."" Just bought another line. In your description of Habitat - you call the section ""Volunteer"" (great) and start your description with ""Volunteered"". Do we need the word ""Volunteered"" there? Nope. You just bought yourself another line.  Getting better. It would be a stronger one page resume. Trim some fat."
resumes,3ckto2,undefineddd,1 point,Wed Jul 8 18:13:09 2015 UTC,I might suggest asking this question in the relevant science sub
resumes,3ckto2,johnbrowncominforya,1 point,Wed Jul 8 18:19:14 2015 UTC,"Ah, will do. Thanks"
resumes,3ckto2,johnbrowncominforya,1 point,Wed Jul 8 18:31:09 2015 UTC,Any thoughts about the format of my resume?
resumes,3ckto2,johnbrowncominforya,1 point,Wed Jul 8 18:32:12 2015 UTC,"Relevant vs additional experience.  Why am I reading irrelevant experience?  If you want all of it, list as professional experience or have sections like lab experience vs administrative experience etc.  Don't make it seem like one section is irrelevant. Categorize them so it seems like all of it makes you the right candidate.  Use more consistent active verbs to start the bullet points."
resumes,3ckto2,HairPhones,1 point,Wed Jul 8 18:47:45 2015 UTC,Great points. Thanks a bunch!
resumes,3clxg5,PowerGoodPartners,1 point,Wed Jul 8 22:55:40 2015 UTC,Whoops! Forgot the link in the post! Here it is:  http://i.imgur.com/7WZhJfX.png
resumes,3clxg5,RedLetterResumes,1 point,Wed Jul 8 22:56:02 2015 UTC,"Hi,  Here are a few tips, your summary is a little weak. It is more about what you want instead of what you bring. Did you have any work experience in IT? Any internship/summer jobs/ side projects? This would help you a lot."
resumes,3cmmli,_Myname_,2,Thu Jul 9 02:16:24 2015 UTC,There's a cat in the background...
resumes,3cmmli,Quant_Liz_Lemon,1 point,Thu Jul 9 05:08:17 2015 UTC,"Why is there a cat...?  Why are the points for certs up arrows? That's confusing and weird. And why do you have the IDs?   I would also stay away from all the colors. The blue underlined headers look like links, and the purple look like links you just clicked on. Also, it's probably because you removed it on purpose, but you should have your name/address and stuff under your name.   Align all the headers. ""Work Experience"" is indented, while ""Certs"" and ""Objective"" is not.   Your objective should be a little more specific. Right now it doesn't really say anything except you want a job and a promotion. It can be at McDonald's going from a janitor to a fry cook. We don't know what it is you want.   Is this the entirety of your resume? Or do you have other things below Work Exp?   I would remove the first bullet. The second bullet pretty much highlights this, so it's unnecessary.   The third bullet should go more towards the bottom. It's good practice to order your points by most important/relevant to the least important because a lot of employers don't finish reading it, they just scan it.   The fourth bullet says the same thing as the first and second bullet.  The 5th, 7th, 8th and 10th bullet say the same thing. Try condensing them into one point.  Bullet 11 and 12 can be merged into other points.   In reality, you should only have like 5 or 6 bullets on here. The last bullet point should be higher up on the list because it's a very specific, unique duty. I would remove the part ""issue in a diverse networking environment"" because that's already obvious. Everything else that I pointed out sounds kind of general and the same.     Hope this helps. Feel free to msg me if you want/need additional help."
resumes,3cmmli,Nynm,1 point,Thu Jul 9 15:09:05 2015 UTC,"Hi, To be honest, this is a very unprofessional resume. It would be thrown out by a recruiter immediately. Now with that being said, you can only improve here. Get rid of the cat. Quantify your accomplishments. Get rid of the objective. Your bullets need to be solid. Where is your education?"
resumes,3cl722,HairPhones,3,Wed Jul 8 19:44:17 2015 UTC,"Oye mate,   To answer your question, absolutely.   I'll be a little abstract in this critique but you Berkeley kids are pretty smart. But you must sell yourself more effectively...I know you can write, so think critically about your time at each position you've held and extrapolate on it. Include more than one bullet point for each position. Market yourself as the most bad ass TA out there. On resumes, we tend to undersell ourselves or use overused, boring jargon. Highlight your selling points using powerful, authoritative terms that explain your value to a potential employer.    Have any related interests  or projects?"
resumes,3cl722,rezi_io,1 point,Wed Jul 8 20:31:04 2015 UTC,Thanks for the response! I do acknowledge that my descriptions are not selling at all.  I don't have any related interests or projects that I could add to the resume. I plan to make the font size bigger to make up for lack of space.
resumes,3cl722,rezi_io,2,Sat Jul 11 04:34:31 2015 UTC,"pm me, let's work on this together!"
resumes,3cl722,goldenmirrors,2,Sat Jul 11 13:42:54 2015 UTC,"Any volunteer experience, awards, big presentations, etc? You can fill it up more! Make a separate skills section."
resumes,3cksz0,ADufrene,1 point,Wed Jul 8 18:08:36 2015 UTC,It's good.
