RoCirclejerk,2qpeqm,plictisit17,3,Mon Dec 29 12:43:26 2014 UTC,"Pai e destul de simplu. Ideea e sa fi ferm si totusi discret. Nu e ilegal daca nu esti prins. Si propozitiile cu dublu negativ par foarte deep.  Iti alegi tinta. Nu ar trebui sa fie greu, are balta peste. In special daca balta e a unui baron local. Iei si tu o dacie veche ca sa nu bati la ochi. Urmaresti programul pesedistului pt cateva zile, si vei gasi cu siguranta un moment de vulnerabilitate. Cand isi numara ouale sau ceva.   Urmatorul pas este sa il ademenesti in masina. Spune-i ca ai niste documente importante impotriva lui Iohannis sau claasica batista cu cloroform merge. In timp ce il poftesti in spate sau il inghesui in portbagaj, ii spui soptit ca esti trimisul lui Kovesi pe pamant si mai are cateva minute sa se mantuiasca. Indiferent ce zice, da-ti tricoul jos.  ESTE FOARTE IMPORTANT SA AI TATUAT DNA PE PIEPT IN COMIC SANS.   De-aici poti sa alegi calea usoara (sa plece si sa se chinuie usor pt restul zilelor) sau poti sa-l tai in bucati si sa-l trimiti la sediul PSD cu un biletel pe care sa scr-"
RoCirclejerk,2qq7yh,vrrrrrr,9,Mon Dec 29 17:49:59 2014 UTC,"Am luat ban 4 zile de pe /r/romania pentru ca am zis de un adolescent nervos ca-i o grasa. Se pare ca nu mai am voie sa folosesc cuvantul ""grasa"" pe /r/romania de acum incolo :("
RoCirclejerk,2qq7yh,keeekeeess,7,Mon Dec 29 18:15:13 2014 UTC,:(
RoCirclejerk,2qq7yh,victorrrrrr,2,Mon Dec 29 20:44:30 2014 UTC,:)
RoCirclejerk,2qq7yh,GheoTeo,5,Tue Dec 30 13:47:03 2014 UTC,"""Provocata de propria greutate"" ""Handicap adipos"". Is variante."
RoCirclejerk,2qp8ox,Strofocle,3,Mon Dec 29 10:14:20 2014 UTC,Si sunetul de mancat de Pringles.
RoCirclejerk,2qp8ox,GheoTeo,2,Mon Dec 29 12:06:59 2014 UTC,ma gandesc cum sa ii fac rau legal
RoCirclejerk,2qowjv,AlbinaViespeStup,5,Mon Dec 29 06:57:27 2014 UTC,Also known as the Truth. The Truth is up there.
RoCirclejerk,2qowjv,chiri988,4,Mon Dec 29 08:57:34 2014 UTC,Alo? Familia Brutalistu?
RoCirclejerk,2qowjv,cocstel,5,Mon Dec 29 10:10:24 2014 UTC,"Tu ești, Scully?"
RoCirclejerk,2qowjv,chiri988,3,Mon Dec 29 11:02:02 2014 UTC,Asta e animalu de la 4 lua-e-aj bormasinea in pule
RoCirclejerk,2qp5zk,SkepticalSagan,3,Mon Dec 29 09:25:44 2014 UTC,"Nu șiu, boss, eu sunt virgină și mă duc la biserică în fiecare miercuri, vineri și duminică. Ocazional, mă duc lunea, joia și marțea. Dar niciodată sâmbăta. Sâmbăta mă duc în club."
RoCirclejerk,2qp5zk,MonikaWithaK,1 point,Wed Dec 31 08:40:19 2014 UTC,"deci frate, cum sa iti explic e complicat ... in fiecare zi ma trezesc cu un animal langa mine si deja intru la suspiciuni ca si asta s-ar putea sa fie un extraterestru"
RoCirclejerk,2qp5zk,karmaemata,1 point,Mon Dec 29 10:24:12 2014 UTC,Dosarele X? Vecin cu Mulder?
RoCirclejerk,2qmv2w,magicsebi,6,Sun Dec 28 18:43:24 2014 UTC,"Prin comparație, uitați ce împopoțonat era biroul lui Băsescu."
RoCirclejerk,2qmv2w,sburatoru,3,Sun Dec 28 18:44:36 2014 UTC,confirmed
RoCirclejerk,2qmlim,Zeulodin,5,Sun Dec 28 17:03:00 2014 UTC,"Ideea e sa fi gentil. Il scoti la o cina romantica la Dristor, lumanari, meniu shaorma amestec cu sos iute si limonada, eventual intr-un loc mai exquisite ca cel de la Colentina, tot tacamul.  Dupa, ii propui sa mergeti la tine pentru un film. Spune-i ca ai downloadat Brokeback Mountain de pe filelist. In troleu ii spui cat de fericit esti ca v-ati intalnit, DAR NU INSISTA. E important sa stabilesti de la inceput ca tu esti liderul.   Ajungi la tine, ii spui sa se faca comod. De-aici incepe jocul. Te duci la baie si te pisi cu usa deschisa, conduci jetul fix in bolul de apa pentru sunet, E FOARTE IMPORTANT SA SE AUDA - astfel stabilesti dominanta. Nu trage apa.   Il conduci la tine in camera, si dupa 30 de secunde spui ca iti este foarte cald si iti dai tricoul jos. Il intrebi daca bea ceva, indiferent de raspuns tu te duci si iti iei o bere. Daca vrea si el ii spui sa isi cumpere. Trebuie sa fi cat mai alfa, ca sa se ""ude"" corespunzator.  Dai drumul la film, si incepi sa-l mangai pe ceafa. Il intrebi daca ii e cald, indiferent de raspuns ii dai tricoul jos. Il mangai pe piept in timp ce ruleaza filmul, dai volumul mai tare si...  De-aici te descurci tu. Daca vrei sa nu fie foarte messy situatia (desi nu inteleg de ce), lube it up calumea, scuipat la greu si eventual torni si niste bere. Se dilueaza destul de ok si o sa fie mai usor de curatat dupa. Ideea e sa va distrati.  Have fun si succes."
RoCirclejerk,2qn1lx,neshi3,4,Sun Dec 28 19:47:21 2014 UTC,"Dileme, OP?"
RoCirclejerk,2qmi7i,karmaemata,6,Sun Dec 28 16:24:29 2014 UTC,Acum am inteles ce-a vrut Eminescu sa zica  si de n-o fi cu banat
RoCirclejerk,2qmi7i,victorrrrrr,1 point,Sun Dec 28 16:48:16 2014 UTC,"o sa iasa un rahat (gen cu turcii, imperiul otoman, delicatese turcesti, prinzi tu gluma)"
RoCirclejerk,2qk9c7,nuunien,6,Sat Dec 27 21:37:05 2014 UTC,#OPproblems
RoCirclejerk,2qk9c7,plictisit17,6,Sun Dec 28 10:36:31 2014 UTC,"Ai grija la ce te bagi, nu e asa simplu cum crede lumea (pula-n pizda). Poti sa iei salmonella sau tuberculoza.  Dar daca iti doresti foarte tare, go for it. Ideal ar fi sa va futeti normal, si dup-aia sa incepi timid cu 4 degete in pizda (in timpul futerii). Apoi, scoti degetele si incepi sa pompezi mai cu avant. Cand iti faci curaj, o scoti de tot si ochesti la obiectiv. Ia-o prin surprindere, bitches love surprises.   Daca nu ai nimerit din prima, ii spui ca te-a luat valul si rinse and repeat.  Have fun si succes."
RoCirclejerk,2qk9c7,plictisit17,4,Sun Dec 28 17:47:42 2014 UTC,"Eo am inteles ca se poate lasa cu paraziti, nush kte luni iti fura toti nutrientii. Da mai stiu ca si creste sanii, ca pretena mea are sfarcurile cam mari, asa daca creste tzatza, e mai proportional"
RoCirclejerk,2qk9c7,plictisit17,3,Sun Dec 28 18:06:06 2014 UTC,"Daca ai problema asta, atunci trebuie sa te apuci de treaba imediat. S-ar putea sa ai nevoiesi de ajutor, vorbeste cu niste prieteni de-ai tai si vezi cine vrea sa te ajute.  Daca in cateva luni ii creste burta, da-i cativa pumni dinspre poala spre sani sa impingi tesutul acolo unde ar trebui sa fie."
RoCirclejerk,2qitln,magicsebi,4,Sat Dec 27 10:02:54 2014 UTC,Speranțele mele sunt în [Santa] Klaus Iohannis.
RoCirclejerk,2qitln,loolftw,3,Sat Dec 27 12:27:18 2014 UTC,Iohannis fă ceva cu acest subreddit. Dă-le o tabletă la moderatori să curețe zăpada.
RoCirclejerk,2qitln,loolftw,6,Sat Dec 27 12:32:41 2014 UTC,"va rog frumos, ban la chestiile astea."
RoCirclejerk,2qd86u,Zeulodin,3,Thu Dec 25 15:14:02 2014 UTC,http://i.imgur.com/EU77ct9.jpg
RoCirclejerk,2qb5la,magicsebi,3,Wed Dec 24 20:54:09 2014 UTC,">Domn, domn, sfă furăm"
RoCirclejerk,2qb5la,sburatoru,3,Wed Dec 24 22:59:22 2014 UTC,"OSANAAA, AMIN, OSANAAAA OSANAA"
RoCirclejerk,2qb5la,nuunien,1 point,Thu Dec 25 00:15:46 2014 UTC,This guy is ontopic
RoCirclejerk,2qa95k,Ardust,3,Wed Dec 24 15:46:49 2014 UTC,glorie caprei
RoCirclejerk,2qa27l,magicsebi,7,Wed Dec 24 14:22:28 2014 UTC,Pe ce apăs ca să se mişte? Vreau să se mişce!
RoCirclejerk,2qa27l,itsmegoddamnit,6,Wed Dec 24 14:51:02 2014 UTC,RoGold™ Circlejerk Snow Premium® users only. Pending approval. Not available in all regions. Additional charges may apply.
RoCirclejerk,2qa27l,cozmyn852,4,Wed Dec 24 14:53:25 2014 UTC,"Adică se mişcă cu DLC? Sau e fulgii™ de™ zăpadă™ 2: Acum™ Se™ Mişcă™? OP, eşti o EA?"
RoCirclejerk,2q9llf,nomemory,3,Wed Dec 24 09:38:21 2014 UTC,"Vat iz zis ""kumparand""? I took zem, ja? from ze gypzis and zend zem zurück auf vork."
RoCirclejerk,2q9ovu,nomemory,5,Wed Dec 24 10:37:07 2014 UTC,De paste pentru ca de craciun ii prea mainstream
RoCirclejerk,2q9ovu,GheoTeo,3,Wed Dec 24 11:49:39 2014 UTC,Se cerne matreata aici!
RoCirclejerk,2q9ovu,Zeulodin,2,Wed Dec 24 12:48:15 2014 UTC,in header
RoCirclejerk,2q89f4,neshi3,7,Wed Dec 24 00:29:17 2014 UTC,"pff, aia e nimic. Înaintea mea la bancomatul ING era o babă cu o ""cărămidă"" de bancnote de 500 de lei cam de 2 ori mai mare decât teancul lui op. Nu am mai văzut niciodată atâtea bancnote de 500 de lei la un loc. Baba cu cărămida m-a făcut să îmi chestionez sistemul de valori, rolul meu în Univers și să mă uit unde sunt camerele de supraveghere."
RoCirclejerk,2q89f4,victorrrrrr,3,Wed Dec 24 08:20:24 2014 UTC,lol toata lumea stie ca e limita la bancomat op vb prostii  dc vb prostii op  /r/RoCirclejerk asteapta raspunsul la intrebare  de ce nu raspunzi?
RoCirclejerk,2q89f4,victorrrrrr,4,Wed Dec 24 11:05:02 2014 UTC,le reddit army appears chill bros era doar sarcasm ce plm <s>tuva mama</s> nah asa e mai bine?
RoCirclejerk,2q89f4,vsdakku,3,Wed Dec 24 11:11:10 2014 UTC,"It's water dissolving toilet paper made in Romania. REALLY smooth to wipe your ass, then you throw it and pooof it disappears !"
RoCirclejerk,2q89f4,mircea_badea,3,Wed Dec 24 07:57:51 2014 UTC,"Îmi pare cunoscută poza, sper că duci banii ăia la ANAF, da?"
RoCirclejerk,2q89f4,chayton6,1 point,Wed Dec 24 08:24:38 2014 UTC,Go to a bank or international airport and trade them?
RoCirclejerk,2q89f4,nomemory,3,Wed Dec 24 01:31:03 2014 UTC,"I tried going to a bank ... but they cleric told me that his bank does not accept them, but he has a friend who could give me 20 euros for them, he's some kind of collector. I might go with him ... I could get like 4 meals at MacDonalds with that money"
RoCirclejerk,2q68zo,so_carelessly_here,8,Tue Dec 23 13:38:14 2014 UTC,"DAR NU TREBUIA SĂ NE ANUNŢI  JEEZ, CÂTĂ NEVOIE DE ATENŢIE  HAHA AM FĂCUT O GLUMĂ CĂ CICĂ NE ANUNŢI PE NOI CĂ TU EŞTI HOMOSEXUAL AI ÎNŢELES  ms papa"
RoCirclejerk,2q68zo,itsmegoddamnit,5,Tue Dec 23 13:41:04 2014 UTC,I could feel a you're op joke coming. So predictable. So Lame. So Careless.
RoCirclejerk,2q68zo,victorrrrrr,4,Tue Dec 23 14:03:56 2014 UTC,Careless.   Whisper.  Faci ce faci și tot spre chestii gay tragi.
RoCirclejerk,2q68zo,cozmyn852,5,Tue Dec 23 16:42:22 2014 UTC,You people keep adding more things to make our romance gay. Shame on you.
RoCirclejerk,2q68zo,sburatoru,9,Tue Dec 23 16:44:28 2014 UTC,Salut eu vreau sa ma autopropun pe /u/so_carelessly_here   L.E.: fuck cum sterg asta pls?  L.L.E: svf ce plm nu ma ajutati in plm
RoCirclejerk,2q6hqx,cocstel,7,Tue Dec 23 15:18:07 2014 UTC,And the winner is
RoCirclejerk,2q6hqx,victorrrrrr,7,Tue Dec 23 18:00:12 2014 UTC,/u/Zeulodin a primit şi sărut de la tine şi cred că ştim cu toţii că nu pentru personalitate sau inteligenţă.
RoCirclejerk,2q6hqx,so_carelessly_here,6,Tue Dec 23 15:24:20 2014 UTC,♪♫ VIAȚA ARE BUST ♪♫
RoCirclejerk,2q6hqx,nuunien,6,Tue Dec 23 15:49:01 2014 UTC,Ți le arăt pe-ale mele dacă mi le-arăți pe-ale tale
RoCirclejerk,2q6hqx,cozmyn852,1 point,Tue Dec 23 15:35:38 2014 UTC,http://i.imgur.com/vla8P2U.gif
RoCirclejerk,2q6hqx,sburatoru,4,Wed Dec 24 17:10:26 2014 UTC,io votez cu /u/strofocle pentru ca nu-mi plac silicoanele si nici alea cu par.
RoCirclejerk,2q6hqx,victorrrrrr,5,Tue Dec 23 18:40:15 2014 UTC,Sorry this was too much
RoCirclejerk,2q6hqx,sburatoru,4,Tue Dec 23 19:37:54 2014 UTC,da' ce-am zis?
RoCirclejerk,2q6hqx,victorrrrrr,4,Tue Dec 23 19:39:33 2014 UTC,nu tu. eu.
RoCirclejerk,2q6hqx,sburatoru,4,Tue Dec 23 20:07:19 2014 UTC,ce
RoCirclejerk,2q6hqx,magicsebi,2,Tue Dec 23 20:15:19 2014 UTC,GIFu ăsta e pe speed dial.
RoCirclejerk,2q6hqx,oana-oana,1 point,Wed Dec 24 09:38:44 2014 UTC,tind sa cred ca eu am postat cei mai uleiosi sani pentru /u/brutalistu anul asta.
RoCirclejerk,2q6780,nomemory,2,Tue Dec 23 13:14:08 2014 UTC,tereacu op
RoCirclejerk,2q6780,victorrrrrr,1 point,Tue Dec 23 17:53:29 2014 UTC,"god damn it, op..."
RoCirclejerk,2q6780,der_hump,1 point,Tue Dec 23 18:05:09 2014 UTC,Andreea Marina - prima poza in parasute
RoCirclejerk,2q6780,ytsoc,0,Tue Dec 23 19:44:00 2014 UTC,"da, defapt de ce-am dat click?"
RoCirclejerk,2q6cdx,filipomg,3,Tue Dec 23 14:20:45 2014 UTC,"Scuze de orientare, nu știu să o schimb pe reddit sync."
RoCirclejerk,2q6cdx,so_carelessly_here,4,Tue Dec 23 14:21:54 2014 UTC,uite aici
RoCirclejerk,2q6cdx,nuunien,1 point,Tue Dec 23 14:35:10 2014 UTC,"ma uit, n-am mai vazut bancnote de 001$ pana acum, wow"
RoCirclejerk,2q3ux4,sburatoru,2,Mon Dec 22 21:20:10 2014 UTC,"trebuie sa imi scot salamul din frigider, ca altfel o sa imi bubuie"
RoCirclejerk,2q3ux4,nuunien,1 point,Mon Dec 22 22:49:57 2014 UTC,Stiti unde se pune la pariuri ?
RoCirclejerk,2q3ux4,nomemory,1 point,Wed Dec 24 10:36:29 2014 UTC,"e 26 decembrie, OP. Ce facem aicea? Mințim oamenii pe Internet?"
RoCirclejerk,2q26zx,c6a6t6a9,9,Mon Dec 22 11:17:44 2014 UTC,"haha, pleb, publicul pro, generația ics, fanul lui vintilă, loredana și geanina corondan.   hah, true xmas masterrace dă jos DIE HARD ANTHOLOGY BRRip de pe TORRENTE!!!"
RoCirclejerk,2q26zx,so_carelessly_here,6,Mon Dec 22 11:27:50 2014 UTC,Preferatul meu e Singur Acasă 3.  E f bun  primele 2 sunt cam naşpa
RoCirclejerk,2q26zx,so_carelessly_here,9,Mon Dec 22 11:51:41 2014 UTC,"Știu că suntem pe /r/RoCirclejerk și glumim, caterincă, pula mea, da tot ți-am dat downvote."
RoCirclejerk,2q26zx,Zeulodin,6,Mon Dec 22 11:58:30 2014 UTC,Nici nu mă miră venind de la tine.  Tu eşti mai naşpa ca Singur Acasă 1.
RoCirclejerk,2q26zx,so_carelessly_here,7,Mon Dec 22 12:01:00 2014 UTC,"Yeah, but so are most things."
RoCirclejerk,2q26zx,so_carelessly_here,5,Mon Dec 22 12:02:38 2014 UTC,Cum ar fi?  Enumeră câteva.
RoCirclejerk,2q26zx,Zeulodin,7,Mon Dec 22 12:04:04 2014 UTC,"Satan. Scuze că intervin, aveați o conversație care conducea spre apropiere, intimitate recte sex?"
RoCirclejerk,2q26zx,magicsebi,6,Mon Dec 22 12:06:33 2014 UTC,"Nu cred, dar acuma că ai intervenit tu, numai la recte sex mă gândesc."
RoCirclejerk,2q26zx,Zeulodin,4,Mon Dec 22 12:10:31 2014 UTC,*wink*
RoCirclejerk,2q26zx,caisah,6,Mon Dec 22 12:17:52 2014 UTC,Vezi aici:  http://en.wikipedia.org/wiki/List_of_lists_of_lists
RoCirclejerk,2q26zx,GheoTeo,7,Mon Dec 22 12:06:40 2014 UTC,I can't find the bruta list.
RoCirclejerk,2q26zx,JackSixxx,5,Mon Dec 22 12:30:40 2014 UTC,Vezi în list of fictional characters.
RoCirclejerk,2q26zx,plictisit17,1 point,Mon Dec 22 13:04:54 2014 UTC,I found Satan.
RoCirclejerk,2q2mdm,Zeulodin,5,Mon Dec 22 14:58:08 2014 UTC,Goise Muran nu merită asta.
RoCirclejerk,2q2mdm,Poloniculmov,3,Mon Dec 22 15:02:17 2014 UTC,"dar el chiar face emisiuni mişto  îţi dai seamă că dacă faci o glumă din asta la adresa lui, o să se supere că nu e apreciat şi o să plece din ţară?  this is why we can't have nice things  Adică nu vreau să spun că e prost Guran ăsta. Adică e super deştept cu emisiunea lui, şi e educat şi astea, dar nu e destul de deştept să aprecieze o glumă. şi tocmai de asta îi iau eu apărarea.  adică guran..  când vine vorba despre glume  e ca o femeie"
RoCirclejerk,2q2mdm,so_carelessly_here,5,Mon Dec 22 15:20:55 2014 UTC,ați făcut o glumă care vă face cinste
RoCirclejerk,2q2mdm,cocstel,2,Mon Dec 22 16:51:54 2014 UTC,Analist... OP stop being a fag
RoCirclejerk,2q2b03,victorrrrrr,12,Mon Dec 22 12:24:44 2014 UTC,E mai bine decat nimic.
RoCirclejerk,2q2b03,victorrrrrr,12,Mon Dec 22 13:22:06 2014 UTC,That's what she said!
RoCirclejerk,2q2b03,victorrrrrr,14,Mon Dec 22 13:22:18 2014 UTC,Lol. Tare asta!
RoCirclejerk,2q2b03,chiri988,3,Mon Dec 22 13:22:35 2014 UTC,"M-am tot gândit dacă să-ți dau sau nu reply, să nu te sperii când afli că  nu ești singur în thread. Știi, ca atunci când intră cineva peste tine în cameră când te îmbraci și cânți.  Știi?  Bine, nu mai țipa, mă duc în bucătărie!"
RoCirclejerk,2q2b03,victorrrrrr,6,Mon Dec 22 14:22:35 2014 UTC,fa si mie o cafea daca tot te duci
RoCirclejerk,2q2b03,chiri988,4,Mon Dec 22 14:26:46 2014 UTC,Vrei zahăr?
RoCirclejerk,2q2b03,qiuChuck,2,Mon Dec 22 14:27:58 2014 UTC,ești singur pe aici
RoCirclejerk,2q2b03,victorrrrrr,4,Mon Dec 22 14:21:29 2014 UTC,singur cuc
RoCirclejerk,2q2b03,victorrrrrr,5,Mon Dec 22 14:24:48 2014 UTC,lol cuc geddit?
RoCirclejerk,2q2b03,qiuChuck,3,Mon Dec 22 14:24:58 2014 UTC,un cuc singur
RoCirclejerk,2q0tkm,somedud,7,Mon Dec 22 01:08:19 2014 UTC,Și ție!
RoCirclejerk,2q0tkm,therant,6,Mon Dec 22 10:28:01 2014 UTC,"Să ne trăiești o mie de ani somedud, anul care vine să te găsească și să te păstreze mereu vesel și valoros! La mulți ani! Sărbători fericite,"
RoCirclejerk,2q0tkm,victorrrrrr,3,Mon Dec 22 10:40:43 2014 UTC,Un strigat de ajutor. Cineva sa-i suga pula!
RoCirclejerk,2q0tkm,so_carelessly_here,4,Mon Dec 22 11:06:31 2014 UTC,LA MULŢI ANI TUTUTOR
RoCirclejerk,2q0tkm,nuunien,2,Mon Dec 22 12:09:12 2014 UTC,In viata nu am vazut atata shitposting.
RoCirclejerk,2pzox7,kick_a_cunt_monday,7,Sun Dec 21 18:41:41 2014 UTC,Pleaca ma. Asta ii botosani toata ziua. Pe tipa din stanga o stiu. Botoseneana 100%
RoCirclejerk,2pzox7,GheoTeo,4,Sun Dec 21 20:59:42 2014 UTC,"bai, vezi ca ai gresit meetu, asta-i din braila"
RoCirclejerk,2pzox7,nuunien,6,Sun Dec 21 19:47:39 2014 UTC,"my bad, uite aici de la alte meeturi de sfarsit de an galati, buzau, vaslui, bacau, focsani"
RoCirclejerk,2pzox7,nuunien,5,Sun Dec 21 20:35:54 2014 UTC,"ce vrajeala, baaaaah, nici macar nu sunt rockeri neckbeards p-acolo, si pe langa asta, tipele alea nici macar nu sunt grase, ce plm OP, ne minti asa pe fata? pai ce facem aici?????"
RoCirclejerk,2py3bj,Zeulodin,3,Sun Dec 21 04:19:49 2014 UTC,Am pierdut rocj meet? Erau niste tipi cu poza lu base in fata la cotroceni
RoCirclejerk,2pwkvi,victorrrrrr,3,Sat Dec 20 18:47:00 2014 UTC,TIL nevasta lui mos craciun e pengwing
RoCirclejerk,2pucfc,magicsebi,5,Sat Dec 20 00:57:09 2014 UTC,"E și în alte limbi, chiar nu le pasă, domne. Satan, Santa, Santana, Santa Ana, Satanana-nana-nana-nana-batman - toate sunt variante acceptate acuma..."
RoCirclejerk,2pucfc,multubunu,2,Sat Dec 20 09:37:07 2014 UTC,Satan e o grasă proastă.
RoCirclejerk,2pucfc,SandmanXC,1 point,Sat Dec 20 12:32:01 2014 UTC,K.
RoCirclejerk,2pucfc,victorrrrrr,6,Sat Dec 20 08:06:32 2014 UTC,"""Aici pe reddit există un obicei foarte prost de-a apăsa click (sus/upvote | jos/downvote )."" În primul rând downvotaţi în masă, care este treaba cu chestia asta ? Nu mai are voie omul să comenteze, să îşi exprime opinia liber asupra unui subiect, fie el politic, religios, ş.a.m.d este DIRECT downvotat, oricum majoritatea care comentează, fac parte dintr-un simplu grup ""expert în toate domenile"", aceleaşi persoane tind să comenteze prin ironie/paradoxie sarcastică la toate subiectele şi josvotează tot ce prinde. În partea 1, v-am explicat - când îţi cumperi tastatură nu eşti obligat să specifici cum o foloseşti, în beta voi explica cum karma, pe mâna românilor este o practică foarte ""proastă"", ""tâmpită"", ""handicapată"" ( HAH! )   Karma se foloseşte în comentarii când este relevant şi uneori se încureajează o conversaţie în legătură cu subiectul, aici pe România, există şi ""Salut vere, care-i baiul ?"" sau ""Te aştept în gară lângă grafiti"", evident este un mic grup, dar pentru treaba asta există software oferit de yahoo, skype, google, facebook, etc. Profitând de ignoranţa unora, conversaţile cele mai utile ajung ceva de genul : ""Salut ce faci ? Bine ! Cum e pe acolo ? Bine ! Glorie mielului !!"" logic, nu ajută pe nimeni acest still şi în general, redditul pe google are o relevanţă foarte mică, deoarece se încurajează o conversaţie fără rost, amuzantă dar fără rost, neinteresantă, irelevantă, ajunge să fie o comunitatea cu circuit închis de clovni, mai ales din cauza josvoturilor şi se încurajează copiarea articolelor din altă locaţie. Criticarea subiectelor controversat sau ironizarea într-un mod cât mai scurt, este ceva normal pe /r/Romania. Nu de mult am văzut, primul comentariu ( cel m-ai votat ) era ceva de genul ""Da."", scurt pe 2.  Dacă aprofundăm problema, ce discuţie contradicotrie iese când toată lumea foloseşte imgur şi vezi numai benzi desenate (desene), pur şi simplu iese o bandă desenată, nu ? dar dacă priveşti de jos în sus ? ce iese ? Nu prea mă complac cu ideea asta, defapt ... totul este confuz, fără noimă, fără o direcţie aici pe reddit, este un sistem furat, nu cred că creatorul original a gândit normal, şi-a însuşit o grămadă de abstracţi filozofice sau religioase, precum karma, desigur, într-un mod complex şi nu sa gândit exact într-un singur sens, un forum nu este loc de karma.  Acum oferă românilor karma, libertate, religie, cercuri de prietenie, umor, internet, forum sau sens şi vezi ce se întâmplă. Scurt pe 2, DA  Hai acum, Glorie Mielului ... Daaah, Daaah, Meeeh, Daaah, Daaah ; stop hai să gândim logic ; GATA iară, back to the future. Daaah, Daah, Meeh, Daaah. ( insert media here ), cum e ?  Ultima bombă este ignoranţa, o să ne ignorăm între noi până când Nimeni pleacă la plimbare. Welcome to my world, aici, indiferent că eşti deştept, nebun sau normal, fată sau băiat, bărbat sau femeie nu exişti. Ce vreau eu să explic până la urmă ? Din cauza ignoranţei, reptilienii se înmulţesc exagerat, haha ... hai că revin mai bine, data viitoare."
RoCirclejerk,2pucfc,sailorjc,3,Sat Dec 20 11:08:40 2014 UTC,Ggglint?
RoCirclejerk,2ptehk,youreallcirclejerks,3,Fri Dec 19 19:47:26 2014 UTC,sal. asl pls  yo 14f cali
RoCirclejerk,2pte98,magicsebi,3,Fri Dec 19 19:45:20 2014 UTC,"Uncool Sebi! Eu nu fac mișto de Elena, de ce a trebuit să o aduci pe Taylor în treaba asta?  La Unirii, la mec, la ora șase după ce termini doctoratul?"
RoCirclejerk,2pte98,Poloniculmov,3,Fri Dec 19 21:28:59 2014 UTC,"Doctorat never... norocul tau ca ajung mâine în România, f8 me irl m8 ya cheeky bastard. Sau lasam fetele in loc. Mmm... Elena vs Taylor, I'd watch that catfight."
RoCirclejerk,2prwp1,neshi3,1 point,Fri Dec 19 09:33:42 2014 UTC,/r/gigibecali /r/ler
RoCirclejerk,2prwp1,nuunien,1 point,Fri Dec 19 17:15:27 2014 UTC,= /r/gigibecaler ?
RoCirclejerk,2prxnv,Poloniculmov,4,Fri Dec 19 09:51:10 2014 UTC,Scz /u/nustiuboss
RoCirclejerk,2prxnv,nustiuboss,5,Fri Dec 19 09:51:21 2014 UTC,Stop trying to make 'putisoara' the new penis!
RoCirclejerk,2prpp3,nustiuboss,1 point,Fri Dec 19 07:35:56 2014 UTC,"Ba, da' ce-a slabit Puia."
RoCirclejerk,2prvxy,nustiuboss,3,Fri Dec 19 09:21:22 2014 UTC,"Nu are 100 de kile, go for it!"
RoCirclejerk,2povzc,vrrrrrr,7,Thu Dec 18 15:49:06 2014 UTC,"Nu numai că am fost, dar l-am și recunoscut pe /u/nustiuboss"
RoCirclejerk,2povzc,Zeulodin,4,Thu Dec 18 16:11:08 2014 UTC,Pe aici ii o chestie. Ii zice Gaura Dulce. Am incercat o data.2/10
RoCirclejerk,2povzc,GheoTeo,4,Thu Dec 18 17:58:05 2014 UTC,Pro-tip: Stop fucking beehives.
RoCirclejerk,2povzc,Zeulodin,3,Thu Dec 18 19:05:53 2014 UTC,Nu se merita la cat de umflat am fost dupa :)
RoCirclejerk,2povzc,GheoTeo,3,Thu Dec 18 19:35:50 2014 UTC,Da. Pe bune.
RoCirclejerk,2povzc,ErgoNonSim,2,Thu Dec 18 21:21:45 2014 UTC,Pe bune?
RoCirclejerk,2povzc,ErgoNonSim,2,Thu Dec 18 21:29:41 2014 UTC,Tu ce crezi?
RoCirclejerk,2povzc,ErgoNonSim,2,Thu Dec 18 21:54:05 2014 UTC,"Impresii, recomandări?"
RoCirclejerk,2povzc,nustiuboss,3,Thu Dec 18 23:15:26 2014 UTC,Nu recomand gaurile virgine.
RoCirclejerk,2poy73,Zeulodin,3,Thu Dec 18 16:10:05 2014 UTC,"E incompletă și nu crește în mod egal; dacă nu o țin mică arăt caraghios, dar dacă dau totul jos arăt cu 10 ani mai tânăr. Și părți mici sunt gri, nu știu care e faza.  Edit: A, scuze, nu știam că vorbiți de bărbi."
RoCirclejerk,2poy73,magicsebi,2,Thu Dec 18 20:20:35 2014 UTC,[air quotes]mâna[/airquotes]
RoCirclejerk,2poy73,nuunien,2,Fri Dec 19 09:17:22 2014 UTC,"Zeulodin-senpai, cand cresc mare vreau sa fiu si eu ca tine!!"
RoCirclejerk,2poy73,nuunien,2,Thu Dec 18 18:21:42 2014 UTC,notices /u/nuunien -kun
RoCirclejerk,2poy73,Poloniculmov,4,Thu Dec 18 19:01:50 2014 UTC,Zeulodin-senpai!!!!!!!!! *blushes*
RoCirclejerk,2ppykr,nuunien,3,Thu Dec 18 21:09:55 2014 UTC,"=> ""Pula Pula Pula Pula Pula Pula Pula Pula Pula Pula Pula Pula Pula Pula Pula Pula Pula Pula Pula Pula Pula Pula Pula Pula Pula Pula Pula Pula Pula Pula Pula Pula Pula Pula Pula Pula Pula Pula Pula Pula Pula Pula Pula Pula Pula Pula Pula Pula Pula Pula Pula Pula Pula Pula Pula Pula Pula Pula Pula Pula Pula Pula Pula Pula Pula Pula Pula Pula Pula Pula Pula Pula Pula Pula Pula Pula Pula Pula Pula Pula Pula Pula Pula Pula Pula Pula Pula Pula Pula Pula Pula Pula Pula Pula Pula Pula Pula Pula Pula Pula """
RoCirclejerk,2ppykr,Poloniculmov,3,Thu Dec 18 22:58:38 2014 UTC,"multumesc, am numarat ca sa ma asigur ca e cata Pula am nevoie. o sa platesc maine factura, spre ca providerul sa primeasca Pula, ca altfel am belit-o.  edit: am numarat din nou, nu am vazut in viata mea atata Pula si vroiam sa fiu 100% sigur  edit2: ai idee cat dureaza sa transfer 100 de Pula? multumesc"
RoCirclejerk,2ppykr,Poloniculmov,2,Thu Dec 18 23:11:58 2014 UTC,"pula_wallet = ""Pula "" * 100 new_owner = pula_wallet puts new_owner"
RoCirclejerk,2pnz9d,GheoTeo,3,Thu Dec 18 08:11:57 2014 UTC,Mai degrabă seamănă cu Măreția Sa Magesticul Regele Mihai
RoCirclejerk,2pnz9d,nuunien,2,Thu Dec 18 10:18:36 2014 UTC,neeeah
RoCirclejerk,2pmd0v,magicsebi,4,Wed Dec 17 22:21:26 2014 UTC,"""Cât ai zis că e rubla tovarășe!?"""
RoCirclejerk,2pmd0v,so_carelessly_here,5,Wed Dec 17 22:27:49 2014 UTC,Aia e şi faţa mea când încerc să-ţi înţeleg gusturile muzicale   :)
RoCirclejerk,2pmd0v,Ceausescu_Nicolae,3,Thu Dec 18 09:05:04 2014 UTC,Dragi tovarasi si pretini.  Asta este fata mea cand va amintiti de conducatorul vostru iubit.
RoCirclejerk,2pmd0v,GheoTeo,2,Thu Dec 18 07:37:44 2014 UTC,MRW roditorii se intrec in bancuri
RoCirclejerk,2pmd0v,victorrrrrr,2,Thu Dec 18 07:33:05 2014 UTC,E funny fiindca tocmai masluiam o portocala.  Geddit?
RoCirclejerk,2pkvwc,mybrainquit,3,Wed Dec 17 14:51:40 2014 UTC,auăleu maică aista ie muzichie? mă doare urechili
