RoCirclejerk,2z8jay,Zeulodin,3,Mon Mar 16 14:52:42 2015 UTC,"| s-a lovit la cap, în zona unui restaurant din Sectorul 1  Ce cap mare are!"
RoCirclejerk,2z1h8s,magicsebi,6,Sat Mar 14 18:16:45 2015 UTC,Pesemne ca avea peruca pe atunci.
RoCirclejerk,2z1h8s,MorrisM,3,Sat Mar 14 19:11:26 2015 UTC,Băsescu cannot into hair
RoCirclejerk,2z1h8s,therant,1 point,Sat Mar 14 20:01:55 2015 UTC,sunt două șuvițe lungi
RoCirclejerk,2z1h8s,Iazo,3,Sat Mar 14 21:35:21 2015 UTC,Pesemne ca esti fanariot.
RoCirclejerk,2z1175,loolftw,4,Sat Mar 14 16:00:13 2015 UTC,alea stramte au tatele mici. mai multe informatii la /u/garden_girl.  cu placere.
RoCirclejerk,2z1175,crocohelper,1 point,Sat Mar 14 16:23:47 2015 UTC,Așa cum își dau și ele dacă ai puța mică sau nu. Nu.
RoCirclejerk,2z1175,karmicthread,1 point,Sat Mar 14 18:25:02 2015 UTC,grasele am inteles ca au pizda stramta
RoCirclejerk,2z1175,GoguSclipic,2,Sun Mar 15 14:11:46 2015 UTC,"ti-a spus un prieten, nu-i asa?"
RoCirclejerk,2z1175,balaurs,1 point,Tue Mar 17 13:56:35 2015 UTC,"nu, am citit in enciclopedia britanica."
RoCirclejerk,2z1175,GoguSclipic,1 point,Tue Mar 17 14:15:25 2015 UTC,"Au mai multe straturi de pizda pe care trebuie sa la dai la o parte ca sa ajungi la miez, cam ca o ceapa..."
RoCirclejerk,2z0950,atheismthrowaway0,10,Sat Mar 14 10:02:32 2015 UTC,"pentru dat la buci, /u/crocodile92  pentru luat la buci, /u/monikawithak"
RoCirclejerk,2z0950,Ardust,3,Sat Mar 14 15:20:08 2015 UTC,"Gasesti o buca, aplici puternic palma, done."
RoCirclejerk,2z0c50,c6a6t6a9,1 point,Sat Mar 14 10:56:39 2015 UTC,ce gemene boss?
RoCirclejerk,2z0c50,crocodile92,1 point,Sat Mar 14 15:26:17 2015 UTC,Astea boss
RoCirclejerk,2z0c50,crocodile92,1 point,Sat Mar 14 16:29:51 2015 UTC,"Oh, mi-a murit pula."
RoCirclejerk,2yxn94,somedud,2,Fri Mar 13 18:15:51 2015 UTC,"Da, si mie imi pare rau de maestrul Beligan. A tras paiul scurt."
RoCirclejerk,2yt83m,karmicthread,5,Thu Mar 12 16:56:35 2015 UTC,"OP, ești femelă?  Arată-ne țâțele,  Sper că ești strâmtă."
RoCirclejerk,2yt83m,nuunien,1 point,Fri Mar 13 00:00:06 2015 UTC,"Nu sunt femală Știu doar cum merg lucruri Vrei fuți, ridică-l."
RoCirclejerk,2yt83m,BadBenedict,3,Fri Mar 13 00:14:02 2015 UTC,Îmi plac copii Mi se scoală cand îi văd Vreau să-i violez.
RoCirclejerk,2yt83m,BadBenedict,3,Thu Mar 12 18:48:33 2015 UTC,NOPEDO
RoCirclejerk,2yt83m,BadBenedict,1 point,Thu Mar 12 18:48:52 2015 UTC,"schema e de 5-7-5 silabe, mânca-mi-ai smegma"
RoCirclejerk,2yt83m,loolftw,1 point,Thu Mar 12 19:10:53 2015 UTC,"Am greșit, scuze Rămân boss orice ar fi, Tu tot sugi pula."
RoCirclejerk,2yt83m,Hescara,3,Thu Mar 12 20:41:25 2015 UTC,Pădurea de fag Noaptea ceva freamătă E badbenedict
RoCirclejerk,2ysiit,neshi3,2,Thu Mar 12 13:26:00 2015 UTC,eu sunt ala in costum. voiam sa cumpar un iaht dar nu erau destul de scumpe pt mine. te rog data viitoare sa numai imi  faci poze fara permissiune
RoCirclejerk,2ysiit,Hescara,2,Thu Mar 12 14:30:40 2015 UTC,"Cand eram copil, am condus un remorcher semi-ruginit ce candea a motorina de cand intrai in port. Pot sa intru si eu in clubul dvs pls?"
RoCirclejerk,2ysiit,nusuntacasa,2,Thu Mar 12 14:37:41 2015 UTC,cat de stramt era portul?
RoCirclejerk,2ysiit,Ardust,2,Thu Mar 12 19:39:15 2015 UTC,1km
RoCirclejerk,2yscpy,MonicaMacovei,6,Thu Mar 12 12:23:09 2015 UTC,Nu ești.
RoCirclejerk,2yscpy,magicsebi,5,Thu Mar 12 19:02:32 2015 UTC,Rogi o prietena sa își bage ambele mâini . Dacă poate sa bată din palme atunci nu ești strâmtă.
RoCirclejerk,2yscpy,ErgoNonSim,5,Thu Mar 12 23:58:07 2015 UTC,Baga-ti degetele in pizda
RoCirclejerk,2yscpy,bipolar-bear,4,Thu Mar 12 15:31:34 2015 UTC,Util
RoCirclejerk,2yscpy,cocstel,4,Fri Mar 13 06:27:31 2015 UTC,Faci un test de iq. 3€ + TVA SMS la 112!
RoCirclejerk,2yscpy,kryogenyk,2,Thu Mar 12 13:09:31 2015 UTC,"Tu nu mai ai nevoie, mamaie"
RoCirclejerk,2yscpy,youreallcirclejerks,1 point,Thu Mar 12 13:39:35 2015 UTC,:(
RoCirclejerk,2yscpy,MorrisM,2,Thu Mar 12 13:48:42 2015 UTC,Intreaba vreo 15 barbati.
RoCirclejerk,2yscpy,MorrisM,2,Thu Mar 12 17:31:53 2015 UTC,Si unde ii gasesc? La noi la partid nu sunt atatia...
RoCirclejerk,2yscpy,karmicthread,1 point,Fri Mar 13 06:48:11 2015 UTC,Momeste-i with your good looks.
RoCirclejerk,2yscpy,crocodile92,2,Fri Mar 13 12:44:33 2015 UTC,"Dă să te fut, că-ți zic eu."
RoCirclejerk,2yscpy,643_Barricade,1 point,Fri Mar 13 11:22:04 2015 UTC,ești gay?
RoCirclejerk,2yrrt7,Strofocle,10,Thu Mar 12 06:54:26 2015 UTC,de obicei bărbaţii spun asta când vor ceva de la tine.  adică nu zic că nu ai fi toate alea dar nu prea se întâmplă asta la femei. o femeie poate fi doar maxim 2 dintre lucrurile alea nu toate   şi mie mi-a zis unul o dată că fac un blow job super mişto şi că e cel mai bun dar eu eram reticentă şi chiar m-am simţit ofensată că am realizat că zice asta doar ca să-i mai fac  nu ca să mă simt eu bine ştii?
RoCirclejerk,2yrrt7,so_carelessly_here,7,Thu Mar 12 09:04:47 2015 UTC,"gandeste-te logic, un tip care vrea sa mai primeasca blowjob nu ti-ar zice ca faci prost ca sa-ti distruga complet stima de sine si valoarea ca femeie. Pe de alta parte, daca ai face prost ar fi clar ca esti inutila si nu ar vrea sa mai primeasca de la tine, deci e clar ca faci bine si nu existi degeaba.   Also, fa vocalize ca sa-ti antrenezi muschii."
RoCirclejerk,2yrrt7,so_carelessly_here,7,Thu Mar 12 09:10:55 2015 UTC,"Da, şi penisul şi vaginul şi sânii sunt nişte muşchi şi gura şi ochii şi trebuie să faci exerciţii la ei ca să şi vezi penisul mai bine  doar nu sugi penisul pe întuneric lol e penal"
RoCirclejerk,2yrrt7,so_carelessly_here,11,Thu Mar 12 09:14:47 2015 UTC,"Se vede că nu faci destule exerciții pentru ochi, că dacă ai face l-ai vedea și în beznă, ca pe un far care te ghidează către fericire."
RoCirclejerk,2yrrt7,so_carelessly_here,9,Thu Mar 12 09:16:44 2015 UTC,ochii i-am cam neglijat.  dar cred că şi tu că altfel ne-am vedea de lungul nasului şi nu am mai discuta aşa de deschis despre sex ca nişte prostituate şi fete indecente ce suntem.
RoCirclejerk,2yrrt7,magicsebi,10,Thu Mar 12 09:24:36 2015 UTC,"Se vede că ești femeie, nu gândești rațional: păi din moment ce suntem strâmte, nu e clar că suntem fete cuminți? Toată lumea știe că sex = găletificare, lol."
RoCirclejerk,2yrrt7,sburatoru,9,Thu Mar 12 09:29:38 2015 UTC,"Io ca să nu fiu largă ca o găleata abjectă, seara când mă culc îmi strâng vaginul cu un elastic ca şi cum mi-aş prinde părul în pony tail ştii?  şi îi mai pun nişte celofan din ăla de alimente şi bam STRÂMT"
RoCirclejerk,2yrrt7,MarinTaranu,12,Thu Mar 12 09:33:43 2015 UTC,"Sunt bune trucurile tale, fată. Eu ca să-mi mențin mușchii în formă maximă, nu iau taxiuri și nu merg în centrul vechi fără bărbați înalți."
RoCirclejerk,2yrrt7,MarinTaranu,2,Thu Mar 12 09:38:20 2015 UTC,:O
RoCirclejerk,2yrrt7,MonicaMacovei,1 point,Thu Mar 12 10:29:00 2015 UTC,găletificareeee
RoCirclejerk,2yrrt7,sixstringhead,0,Thu Mar 12 22:02:55 2015 UTC,"Nu, inseamna ca gagicutul care te fute are pula cit un pai. Normal, atunci cind dai de negru, ti-e teama cind vezi cit e un caltabos normal."
RoCirclejerk,2yrrt7,magicsebi,0,Thu Mar 12 13:50:42 2015 UTC,"Esti genial, ba ... Penisul nu e un muschi, e ca un fel de balon de carne care se umfla cu singe. Sinii muschi? Poate tesut adipos."
RoCirclejerk,2yrrt7,nuunien,4,Thu Mar 12 13:48:45 2015 UTC,Acest topic...it's fucking gold!  Pacat ca toata roditoarele sunt urate si grase.
RoCirclejerk,2yrrt7,nuunien,6,Thu Mar 12 10:24:35 2015 UTC,Si tu ești bătrână da-te dreacu
RoCirclejerk,2yrrt7,nusuntacasa,4,Thu Mar 12 13:39:19 2015 UTC,"te-o făcut, mă!"
RoCirclejerk,2yrrt7,Hescara,2,Thu Mar 12 14:31:22 2015 UTC,https://i.imgur.com/ko2vrtP.jpg
RoCirclejerk,2yrrt7,Hescara,2,Fri Mar 13 20:59:18 2015 UTC,"Wow, nu stiam ca circulaba e asa un taco fest.  Nu pot sa inteleg de ce sunteti voi fetele asa clueless. Daca inca nu te-a legat de pat si te-a dominat bine de tot inseamna ca nu te iubeste cu adevarat, e foarte simplu. Daca ar fi facut-o n-ati mai fi postat chestii dinastea p-aici."
RoCirclejerk,2yrrt7,victorrrrrr,2,Thu Mar 12 10:31:18 2015 UTC,Taco fest is best fest.  http://i.imgur.com/sKllGW2.gif
RoCirclejerk,2yrrt7,MarinTaranu,2,Thu Mar 12 11:02:39 2015 UTC,esti frumoasa??? raspunde cu poza pls :D
RoCirclejerk,2yrrt7,nustiuboss,3,Thu Mar 12 11:49:50 2015 UTC,"Nu, întotdeauna!"
RoCirclejerk,2yrrt7,MarinTaranu,2,Thu Mar 12 13:22:58 2015 UTC,ce te bagi wa in seaman crezi ca vbb cu tine ? :)))))
RoCirclejerk,2yrrt7,MarinTaranu,3,Thu Mar 12 14:29:23 2015 UTC,:))))))))))))))
RoCirclejerk,2yqami,kryogenyk,1 point,Wed Mar 11 22:32:32 2015 UTC,"Singurul Ion pe care il cunosc, a fost bunicu' care a murit si pe Ion Iliescu din tabloul lasat de bunicu'..."
RoCirclejerk,2ypz09,BadBenedict,6,Wed Mar 11 21:04:56 2015 UTC,Pasarica pasarea/ Sugi pula in pula mea
RoCirclejerk,2ypz09,batmanjr23,1 point,Wed Mar 11 21:21:17 2015 UTC,Pula mea în gura ta Face bine la măsea.
RoCirclejerk,2ypz09,AlbinaViespeStup,6,Thu Mar 12 18:51:29 2015 UTC,"Eram la sifoane-n pijamale, stam spate-n-spate,  Vad ca apare pe acest sub super-calitate,  Trandafirul e rosu, liliacul-i violet  N-am mai luat aur de cand m-am intors pe net,  Iar e primavara, sper sa-mi revin usor, usor,  OP, sper sa-i placa mamicii tale al meu martisor."
RoCirclejerk,2ypz09,Ham_Harris,3,Wed Mar 11 21:39:12 2015 UTC,"In vraja apusului de fior nepatruns O patrundeam in anus pe ma-ta, pe ascuns, Avea in ochi vapaia curvei de mai demult Ce cu un barbat bine pe bani te-a conceput Dintr-o greseala, printr-un prezervativ rupt."
RoCirclejerk,2ypz09,Ham_Harris,1 point,Wed Mar 11 21:51:33 2015 UTC,"OP de ce ne prostesti  Rime nu poti sa fauresti  Doar pula stii s-o belesti  Haoleu, viata mea  Fac pariu c-asculti manea  Hai sa te invat ceva  2+2 nu face 3  Iti dau 5 lei  Pentru ca esti proto-gay"
RoCirclejerk,2ypz09,nuunien,2,Wed Mar 11 21:55:57 2015 UTC,"Stau pe divan, ma uit inspre cer Racoarea ma mangaie sfios Si prietena ta fara sa ii cer Imi ia madularul la miros. I-am zis, stai draga ca nu e frumos Dar ea incepuse sa o linga Si sinestezia placerilor se-npleteste Cu alunecarea ei de limba."
RoCirclejerk,2ypz09,karmicthread,1 point,Wed Mar 11 22:11:51 2015 UTC,"Stau pe strada, pentru ca sunt sm£k€r de cartier Ma uit la tine, de mila imi vine sa zbier Iti arunc un celofan Sa-ti acoperi fata de dolofan Sor-ta zice ca sunt golan Ca o penetrez ca tarzan Cand tu ti-o arzi pe la Han, cholo Eu cu forta iti fut familia, ca Han Solo"
RoCirclejerk,2ypz09,karmicthread,1 point,Wed Mar 11 23:03:31 2015 UTC,OP esti poponar  Ziua toata sugi falusi  Ia un madular
RoCirclejerk,2ypz09,karmicthread,2,Wed Mar 11 22:19:39 2015 UTC,"Fa cancer si mori! Nu suge pula la toti, Poponar infect."
RoCirclejerk,2ypz09,Hescara,1 point,Thu Mar 12 13:29:15 2015 UTC,"Striga benedict pe reddit; Se credea mare poet; Am dat sa aud ce striga; Si am ajuns sa regret;  M-am gandit la un comeback; Pentru creierul sau plapand; Am zis ""poeziile tale-s cancer!; Ca-n cer, asa si pe pamant!"""
RoCirclejerk,2ypz09,Hescara,1 point,Thu Mar 12 01:46:21 2015 UTC,Am zis sa-ti dau una blanda Sa nu te fac chiar de rusine Dar te-ai luat de ale mele rime Si nu prea imi convine. E ceva nou pentru tine Sa faci battle cu mine Ti-am dat vers dupa vers In pula mea de pervers Si ti-am taiat respiratia Cu ce n-a vazut natia. Te ineci cu cacat Cand iti saturi pofta Si esti mai mare ratat decat Victor Viorel Ponta. Te-am dus la morga Ti-am facut si sicriu Asta se-ntampla daca te iei De felul cum scriu.
RoCirclejerk,2ypz09,Boomkin1337,1 point,Thu Mar 12 13:46:33 2015 UTC,Io te-aş onora c-o flegmă; In moaca ta de ratat; Dar în schimb îmi ofer pula; Femeii ce te-a fătat;  Eşti un şmecher şi un sfert; Eu mă piş pe-ăştia ca tine; Şi mă scutur peste dânşii; La fel ca mă-ta peste mine.
RoCirclejerk,2ypz09,nuunien,2,Thu Mar 12 14:11:57 2015 UTC,E-o onoare a ta flegmă Îți dau la schimb a mea spermă. Mi se scoală pula seara Parcă-i floare primăvara Mă-ta o suge gentil Floare-albastră de metil Slefuiesc la buci de zor Parcă-am pula polizor.
RoCirclejerk,2ypz09,fastandfurry,1 point,Thu Mar 12 18:57:53 2015 UTC,"Când mă pui jos, io mă ridic, ca P(h)e(o)nixu Am o pulă cum nici Pantagruel nu mai văzu Cu băieții vin și-ți bat la ușă, și răspunde mă-ta O facem poștă, nu erai, ți-am lăsat un plic la poștă    Meditez, m-adaptez, am învățat să formatez Două spații la sfârșit de rând, două flori Pe sicriul mă-tii am scris „pula” să te-nfiori Cu mine nu-ți merge, am uitat să menționez De ce? De nimic, fraiere."
RoCirclejerk,2ynz79,neshi3,5,Wed Mar 11 10:54:11 2015 UTC,"Da vezi că și căcatu e adictiv, zic așa doar că văd că-l mănânci și pe acela."
RoCirclejerk,2ynz79,karmicthread,1 point,Wed Mar 11 15:23:54 2015 UTC,dute ba la conciliere ce ne spui noua ?
RoCirclejerk,2ynz79,Hescara,1 point,Wed Mar 11 17:25:50 2015 UTC,"Da, saoarma cu de toate e foarte buna, si pot intelege cum devine adictiva, ca orice lucru bun, vrem mai mult si mai mult. Problema cu mincarea e ca devenim obeji, sau chiar putem plezni daca mincam ca neam prosti. Incearca metamfetamina, aia iti taie foamea si te tine activ."
RoCirclejerk,2yo96d,nusuntacasa,4,Wed Mar 11 13:03:24 2015 UTC,"Vere, aia nu e pula, e lindic."
RoCirclejerk,2yo96d,MarinTaranu,2,Wed Mar 11 13:55:32 2015 UTC,I cry every time
RoCirclejerk,2yo96d,MarinTaranu,0,Wed Mar 11 14:16:42 2015 UTC,"You have lindic?  C'mon, be brave, brother, the devil can't be that black... I am a horrible horrible person, I made you cry."
RoCirclejerk,2yo96d,nuunien,1 point,Wed Mar 11 14:56:32 2015 UTC,"OP, iti laud curajul, dar nu e nevoie sa fii jeleu ca o ai asa mica si verde."
RoCirclejerk,2yjuon,Zeulodin,2,Tue Mar 10 12:24:08 2015 UTC,mi-ai stricat ziua multumesc
RoCirclejerk,2yjuon,Hescara,1 point,Tue Mar 10 14:04:57 2015 UTC,TFW nu ești atât de bun vânzător încât să vinzi caprele altora.
RoCirclejerk,2ykno3,somedud,2,Tue Mar 10 16:42:42 2015 UTC,"nu ai inclus raspunsul ""ma-ta""? dezamagitor."
RoCirclejerk,2ykno3,Hescara,1 point,Tue Mar 10 20:03:50 2015 UTC,Dacii au fost primii!!!
RoCirclejerk,2ykno3,mybrainquit,1 point,Wed Mar 11 07:05:13 2015 UTC,Cine moare primul sau cine s-a nascut primul?
RoCirclejerk,2yfjzm,youreallcirclejerks,6,Mon Mar 9 11:27:23 2015 UTC,Părea cam întuneric acolo. Sper că nu te-a prins vreo furtună ceva (eu am făcut poza)
RoCirclejerk,2yfjzm,so_carelessly_here,7,Mon Mar 9 11:56:54 2015 UTC,Ce poza ai facut? aia cu furtuna?
RoCirclejerk,2yfjzm,so_carelessly_here,4,Mon Mar 9 12:49:57 2015 UTC,"dadada, e a mea.   eu am făcut-o."
RoCirclejerk,2yfjzm,so_carelessly_here,6,Mon Mar 9 12:51:51 2015 UTC,"Si eu am facut poza asta. am incercat sa pozez, in foarte departare, Sevastopol."
RoCirclejerk,2yfjzm,nuunien,2,Mon Mar 9 13:06:17 2015 UTC,"Foarte frumoasă. Aproape văd ceva, da.  Ce dor mi-ai făcut de o mare. Numai frig, vânt, zăpadă... vreau şi eu nişte soare.  *eu am făcut poza aia"
RoCirclejerk,2yfjzm,nuunien,3,Mon Mar 9 13:10:32 2015 UTC,"Poftim soare. Tot eu am facut poza, btw. Skill-ul  fotografic consta in faptul ca vezi si in masina si afara, pe un soare de iarna nemaivazut. Ha!"
RoCirclejerk,2yfjzm,Andana,4,Mon Mar 9 13:25:33 2015 UTC,"Sorry ca va deanjez discutia, dar, cat ai dat pe husa apa pentru dildo? Intreb pentru un prieten."
RoCirclejerk,2yfjzm,SugUnBitter,3,Mon Mar 9 13:49:13 2015 UTC,Tre sa raspund sau e mistocareala?
RoCirclejerk,2yfjdl,so_carelessly_here,7,Mon Mar 9 11:18:03 2015 UTC,dar gingase su iubytoare  de 8 martie va multumim pentru savarina femei dragi.
RoCirclejerk,2yfjdl,victorrrrrr,2,Mon Mar 9 11:40:47 2015 UTC,"la femeie nu există prostie, se numeşte ""gingăşie feminină""  aşa sunt ele săracele"
RoCirclejerk,2yfjdl,nusuntacasa,4,Mon Mar 9 11:49:06 2015 UTC,Lol da. Da' acum cine-i mai prost daca nu prostu care sta dupa proasta pentru ca e gingasa de proasta si vagin.   P.S. Țâțe.
RoCirclejerk,2yfjdl,nusuntacasa,3,Mon Mar 9 12:31:16 2015 UTC,"Gata, gata, uita-te aici daca te face sa te simti mai bine."
RoCirclejerk,2yfjdl,nusuntacasa,3,Mon Mar 9 12:38:42 2015 UTC,"Ce vrei ma frate sa insinuezi, ca femeia simte? Pai cum sa simta ma frate cand ea a fost conceputa sa produca copii si sa sangereze ocazional ejtiprost?"
RoCirclejerk,2yfjdl,nusuntacasa,3,Mon Mar 9 12:45:21 2015 UTC,"Nu ma, nu sunt prost, zic doar ca plm pana la urma suntem si noi si ele niste carcase de carne si nimic mai mult. Ma gandesc ca nu conteaza atat de mult faptul ca avem ""conectori I/O"" diferiti. Ce-i drept probabil ca experimentam anumite lucruri diferit, dar nu cred ca e de-ajuns incat sa produca o ruptura de gandire/personalitate atat de mare."
RoCirclejerk,2yfjdl,nusuntacasa,3,Mon Mar 9 12:48:25 2015 UTC,"Ba frate tu esti prost ma ejneboon? Baaa, asculta la mine, tie sangele ti se duce in pula ca esti barbat. Ramai prost pe moment ca n-ai de unde atata, dar dupa se intoarce sangele ala unde trebuie ba, in creier. Pai la ele ce plm ca se scurge tot sangele prin pizda. Pai de unde atat sange sa tina creieru ala in priza tu desteptule? De-aia ele au creieru stafidit, de gaina, nu le-a mai ramas ca sa simta, sa gandeasca."
RoCirclejerk,2yfjdl,nusuntacasa,3,Mon Mar 9 12:51:31 2015 UTC,Nu-i asa ma frate nu mai fii idiot in plm. Mai bine ajuta-ma-n plm sa gasesc pastilele si lasa femeile sa se bucure de viata. Daca nu le gasim cat mai repede vine si al trei-lea la joaca si stii cat de violent e shaw.
RoCirclejerk,2yfjdl,nusuntacasa,2,Mon Mar 9 12:53:57 2015 UTC,"Le-ati gasit? :) Nu. Bineinteles ca le-am ascuns, doar n-am sa ma las reprimat de un labagiu frustrat si de un rationalist cu mintea-n fum.   Asadar, ma baieț, desfaceti cate o bere, si hai sa vedem ce probleme avem astazi.  Tu cu pastilele, data viitoare iti rup picioarele. Vezi mainile astea doua? Da, astea de pe tastatura. EU sunt in control acum, nu tu, nu ideile tale de intelegere scoase din pur egoism. Pentru ca, sa fii deschis si de treaba este norma, nu-ti va aduce nici un avantaj, aici ai linia de plecare. Te concentrezi atat de mult pe asta incat uiti sa fii barbat, prostu pulii mele, esti mai adanc sub norma decat pula mea in gatu ma-tii inainte de conceptie.  Acum, vad ca cineva este strans de chiloti aici. Bai sclav, ultima pizda care s-a mozolit de muia ta e a ma-tii terminatule. Din disperat dupa pizda ai ajuns s-o urasti. La cat de disperat erai nici nu ma mira ca fugeau de tine cum fuge 336-le cand o vede pe ma-ta-n statie. Inabilitatea ta de a intelege o femeie si de a conversa cu una te-a adus aici, ca orice prost care uraste ce nu intelege. Si ura nu-i de-ajuns, nu, ti-e si frica, asa ca o urasti si mai tare, dai tu primul ca sa nu dea ea prima nu?"
RoCirclejerk,2yfjdl,nusuntacasa,2,Mon Mar 9 14:05:10 2015 UTC,"Ba frate eu nu vreau scandal ejneboon cand am zis eu asta? Zic asa ca plm ca sunt proaste ca stii tu ca se duc plm si stau 7 ore in mall si-ti sparg banii pe cacaturi dar plm cand ai asa bani oricum nu mai conteaza pentru tine dar d-aia zic eu ca-i proasta ma-ntelegi ca nu se gandeste la mine si la munca mea si d-aia in plm, nu te mai ambala si tu asea."
RoCirclejerk,2yfjdl,nusuntacasa,2,Mon Mar 9 14:08:04 2015 UTC,"Ba cand esti idiot esti idiot. Vezi ca asta-i nervos in plm taci si tu din gura.   Ma frate eu consider ca te inseli. Adica intr-un fel se uita o fata la tine daca-i tii usa deschisa si o curtezi si altfel daca vorbesti urat cu ea si nu ii oferi respectul pe care il merita. Am fost educati sa respectam femeile si sa nu fim porci misogini. Iar eu cel putin, nu sunt."
RoCirclejerk,2yfjdl,nusuntacasa,2,Mon Mar 9 14:12:43 2015 UTC,"Diseara cand ajungem acasa, va bat pe amandoi, sedinta dubla pentru prostia voastra dubla.  Ce munca bai sclavet? Sa freci pula pe bani nu inseamna munca, eventual ce-ti face ea tie e karma curata.   Consideri tu, tu care m-ai condamnat la intunecare prin pastile, ca aveai tu crize si ti-a trebuit tie doctor ca sa ""poti tine lucrurile sub control"". UNDE TI-E CONTROLUL ACUM NENOROCIT MIC? UNDEEE!!!?!??? Si ca tot veni vorba, da, ai dreptate, altfel se uita o femeie la tine atunci cand ii oferi respect si ii tii usa deschisa. Mai ales daca nu o cunosti iar ei nu i s-a dat pana acum ocazia sa-si castige respectul ala in fata ta, ca de alfel militezi pentru egalitate nu? Si pentru ce ii tii usa deschisa? Ca asa zice codul bunelor maniere? Ma baiatule, nu te dai tu rationalist? Pai, daca o vezi ca este sanatoasa, in puteri, cu doua maini si doua picioare, cu un cap pe umeri; la ce plm trebuie sa te intorci tu din drum 3 metri ca sa-ti tii usa? Ca sa insinuezi ca-i inapta si nu poate sa manevreze o usa? Sau ca sa-i transmiti din prima ca esti dispus sa-i deschizi orice usa, chiar si usa la dormitorul altuia? Am sa-ti tarai muia pe asfalt pana-ti intra-n cap faptu ca respectul se castiga prin comportament si nu prin aruncarea zarului fix dupa ce a realizat tac-tu c-a uitat de cauciuc."
RoCirclejerk,2yfjdl,Poloniculmov,1 point,Mon Mar 9 14:25:06 2015 UTC,Eu sper să nu le găseşti că e distractiv.
RoCirclejerk,2yfjdl,sburatoru,3,Mon Mar 9 13:05:55 2015 UTC,"Decy ieri mergeam pe stradă și întrebam femeile: ""Scuze, ești cumva doctor?"". Ca să știe și ele cum e să presupună lumea că au o meserie serioasă și nu că sunt curve sau florărese."
RoCirclejerk,2yfjdl,sburatoru,3,Mon Mar 9 14:16:13 2015 UTC,✓ femei care s-au trezit cu martisorul la cearseaf si se duc pe /r/rocerc sa-si bete bate joc
RoCirclejerk,2yfxw6,nuunien,3,Mon Mar 9 14:09:36 2015 UTC,am schitat un zambet
RoCirclejerk,2yfxw6,Hescara,3,Mon Mar 9 15:15:00 2015 UTC,"Poti incerca cu un saculet de rafie umplut cu malai, tinut peste noapte in dreptul gatului."
RoCirclejerk,2yfxw6,youreallcirclejerks,2,Mon Mar 9 15:43:33 2015 UTC,"Esti la medicina? Multumesc pentru sfat dar pe mine ma interesa partea cu aspirina aia. Nu am de unde sa fac rost de sac de rafie, si eu imi tin tot malaiul la banca. :("
RoCirclejerk,2yfxw6,youreallcirclejerks,3,Mon Mar 9 15:48:11 2015 UTC,"Repar chestii, deci pot fi numit """" doctor"" alternativ"""
RoCirclejerk,2yfbyx,SkepticalSagan,1 point,Mon Mar 9 09:13:16 2015 UTC,Exact ce-mi trebuie sa am unde sa vars dupa o noapte de betie crincena.
RoCirclejerk,2yc1f2,oIauPeMata,2,Sun Mar 8 13:13:46 2015 UTC,"Sa-l puna in celula cu woodrea, la wc turcesc. Vezi acolo coabitare."
RoCirclejerk,2ybx5n,c6a6t6a9,2,Sun Mar 8 12:04:11 2015 UTC,Exista poezie in ADHD!
RoCirclejerk,2ybx5n,victorrrrrr,1 point,Sun Mar 8 12:11:01 2015 UTC,"til dadaismul nu-i miscare literara, e simptom"
RoCirclejerk,2ybx5n,Ardust,1 point,Sun Mar 8 12:50:13 2015 UTC,sublim
RoCirclejerk,2ybx5n,Hescara,1 point,Sun Mar 8 16:32:48 2015 UTC,"Nu ție trebuia să ți se rupă, ci alor tăi. Mai încearcă!"
RoCirclejerk,2ybrf9,Victor548,2,Sun Mar 8 10:13:48 2015 UTC,Mă uit la Kove și mi se scoală.  FTFY
RoCirclejerk,2y984c,victorrrrrr,3,Sat Mar 7 17:35:45 2015 UTC,Dumnezeu exista si ma-ta-i tot curva
RoCirclejerk,2y984c,karmicthread,1 point,Sat Mar 7 22:40:16 2015 UTC,Ce-a îmbătrânit so_keresly_herr.
RoCirclejerk,2y98v0,magicsebi,3,Sat Mar 7 17:41:43 2015 UTC,tara romaneasca's finest memers may they live in peace
RoCirclejerk,2y98v0,Hescara,2,Sat Mar 7 18:07:49 2015 UTC,Domnii Ion Luca Caragiale și George Coșbuc au fost primii memari români. Se bănuiește că spiritele lor bantuiesc și acum /r/RoCirculaba.
RoCirclejerk,2y98v0,nuunien,2,Sat Mar 7 19:42:49 2015 UTC,--> /r/RoCirclejerkThroughHistory
RoCirclejerk,2y98v0,multubunu,2,Sun Mar 8 21:03:57 2015 UTC,ăla-i stră-tataia în dreapta sursĂ: știu sigur
RoCirclejerk,2y98v0,karmicthread,1 point,Mon Mar 9 10:36:27 2015 UTC,Ce-a îmbătrânit so_keresly_herr.
RoCirclejerk,2ya3en,loolftw,1 point,Sat Mar 7 22:10:29 2015 UTC,ce trebuie sa faca acest individ cu o voce dramatica? i know a guy
RoCirclejerk,2y8qkc,Hescara,1 point,Sat Mar 7 14:44:29 2015 UTC,:O
RoCirclejerk,2y8lhq,loolftw,0,Sat Mar 7 13:36:59 2015 UTC,"/r/romania se scurge si aici. Nu mai merge un misto' sau o injuratura ca imediat primesti ban!  Ce sa zic, remarc faptul ca de cant domnul Iohannis a devenit presedinte numai din regulamente si banari o duc majoritatea subredditelor romanesti!"
RoCirclejerk,2y8lhq,MonicaMacovei,2,Sat Mar 7 13:40:48 2015 UTC,"lasă că rezolv eu boss pula-n pizdă, căcat"
RoCirclejerk,2y4z6s,karmicthread,3,Fri Mar 6 14:36:34 2015 UTC,eu te vad in fiecare zi ( ͡° ͜ʖ ͡°)
RoCirclejerk,2y4z6s,Hescara,2,Fri Mar 6 15:17:33 2015 UTC,Eu ma vad in fiecare noapte!
RoCirclejerk,2y4z6s,oIauPeMata,2,Fri Mar 6 16:50:13 2015 UTC,/u/Hescara benis.
RoCirclejerk,2y4mwm,oIauPeMata,6,Fri Mar 6 11:58:10 2015 UTC,Lu' mă-ta!  inb4: ganging up on Morrwin.
RoCirclejerk,2y4mwm,Poloniculmov,1 point,Fri Mar 6 12:44:57 2015 UTC,Auto-felatie? Might work...
RoCirclejerk,2y4mwm,nuunien,3,Fri Mar 6 16:49:52 2015 UTC,tie?  edit: lolol jk
RoCirclejerk,2y4mwm,neshi3,2,Fri Mar 6 13:54:19 2015 UTC,diud ... muie nu se da .. se primeste
RoCirclejerk,2y4mwm,vrrrrrr,0,Fri Mar 6 23:52:40 2015 UTC,"Nu mersi, nu sunt poponar!"
RoCirclejerk,2y4mwm,anarchestie,2,Sat Mar 7 07:34:08 2015 UTC,Păi tocmai în culturile reprimate se consideră că nu-s dacă doar o dau și nu o primesc. Ar fi timpul să ieși din debara.
RoCirclejerk,2y4mwm,big0bum,3,Sat Mar 7 18:32:38 2015 UTC,It's true Morrwin. Everybody knows. It's ok.
RoCirclejerk,2y4mwm,victorrrrrr,1 point,Sat Mar 7 22:21:52 2015 UTC,Sa dai sau sa faci?
RoCirclejerk,2y4mwm,big0bum,1 point,Fri Mar 6 19:57:36 2015 UTC,Asta ma intrebam si eu
RoCirclejerk,2y1fu6,lurkerul,3,Thu Mar 5 17:17:16 2015 UTC,"explică ca și cum sunt 5?  am si eu o arma de 15inci, dar nu e serrated ( ͡° ͜ʖ ͡°)"
RoCirclejerk,2y1fu6,nuunien,1 point,Thu Mar 5 22:12:03 2015 UTC,Sper ca nu e ruginita.
