RoCirclejerk,3e3ede,magicsebi,2,Tue Jul 21 17:29:06 2015 UTC,cu prosopul ce faci?
RoCirclejerk,3e3ede,nebunelea,3,Tue Jul 21 19:50:58 2015 UTC,Te ștergi de mă scuzați după ce dai o labă festivă în cinstea noului aparat comandat.
RoCirclejerk,3e3ede,Ardust,1 point,Tue Jul 21 20:10:15 2015 UTC,budget version pls? am prea multa canicula si prea putina sticla de jwbl
RoCirclejerk,3e3ede,Hescara,1 point,Wed Jul 22 08:23:14 2015 UTC,/r/trollscience amirite brothers xddddddddddd
RoCirclejerk,3e3ede,MirrdynWyllt,1 point,Wed Jul 22 09:24:54 2015 UTC,"Instrucțiuni neclare, am rămas cu o sticlă de whisky infășurată de prosop în fund și una goală pe pervaz lângă vomă. Wat do?"
RoCirclejerk,3e2b99,Zeulodin,2,Tue Jul 21 12:21:56 2015 UTC,uitasem că acum 4 ani conectăr arăta ca văru cu trichineloză a lu sean paul
RoCirclejerk,3e2b99,Ardust,1 point,Tue Jul 21 13:42:27 2015 UTC,plimbări prin parc
RoCirclejerk,3e2b99,AndreiWeb,1 point,Tue Jul 21 16:30:45 2015 UTC,Welcome to prostinesti ... avem ditotzi
RoCirclejerk,3e1pf8,Poloniculmov,7,Tue Jul 21 07:34:36 2015 UTC,sa si-l inmatriculeze in bulgaria
RoCirclejerk,3e1pf8,Ardust,5,Tue Jul 21 07:37:00 2015 UTC,/u/you_cry_like_a_pussy
RoCirclejerk,3e1pf8,victorrrrrr,5,Tue Jul 21 07:56:33 2015 UTC,/u/credeam_ca_si_barbatii_se_pot_plange  /u/femeilematrateazarau  /u/glume_pisi  /u/de_ce_nu_pot_si_eu_sa
RoCirclejerk,3e1pf8,so_carelessly_here,4,Tue Jul 21 09:26:35 2015 UTC,hey_pussy  salut_pisi   bună_mâță
RoCirclejerk,3e1pf8,itsmegoddamnit,2,Tue Jul 21 12:22:16 2015 UTC,bună_mâță   ce_face_mata
RoCirclejerk,3e1pf8,Ardust,2,Tue Jul 21 13:58:05 2015 UTC,De aia am folosit diacritice.
RoCirclejerk,3dyk0l,Ardust,2,Mon Jul 20 16:09:45 2015 UTC,"reminding ""tarfa fascista""  keking"
RoCirclejerk,3dyk0l,Zeulodin,2,Mon Jul 20 20:55:15 2015 UTC,link pls.
RoCirclejerk,3dyk0l,Ardust,3,Tue Jul 21 10:17:51 2015 UTC,https://www.reddit.com/r/Romania/comments/39f13k/aaa_c%C4%83_reddit_se_transform%C4%83_%C3%AEn_coreea_de_nord/cs2u8ef
RoCirclejerk,3dyk0l,shaorma_mica_pui,1 point,Tue Jul 21 10:46:01 2015 UTC,i did nazi that coming
RoCirclejerk,3dvfjc,idiotsausage,2,Sun Jul 19 21:18:31 2015 UTC,Nu Cedryk e chill man e zeromasonerie rly word east coast peace.
RoCirclejerk,3dvfjc,kryogenyk,2,Sun Jul 19 23:44:08 2015 UTC,"Ms, mă îngrijorasem ms"
RoCirclejerk,3dvfjc,MarinTaranu,2,Mon Jul 20 12:11:05 2015 UTC,Trebuie sa fii calificat in onanism.
RoCirclejerk,3dvfjc,MarinTaranu,2,Mon Jul 20 03:21:49 2015 UTC,Cei aia sefu nam fost io nam făcut nimic
RoCirclejerk,3dvfjc,Hescara,2,Mon Jul 20 12:10:26 2015 UTC,Tocmai de aia.
RoCirclejerk,3dpwk6,caisah,1 point,Sat Jul 18 08:09:38 2015 UTC,Văd că i-a fost aprobată în sfârșit cererea. T_T
RoCirclejerk,3dm0jm,youreallcirclejerks,1 point,Fri Jul 17 10:33:23 2015 UTC,e traficant de carne vie eu zis sa suni politia
RoCirclejerk,3dlq07,loolftw,2,Fri Jul 17 07:58:49 2015 UTC,Mai nou mulțumești la încheierea comentariului. De ce? ms
RoCirclejerk,3dlq07,so_carelessly_here,1 point,Fri Jul 17 09:21:06 2015 UTC,ca să agăț nișe
RoCirclejerk,3dlq07,youreallcirclejerks,1 point,Fri Jul 17 09:37:41 2015 UTC,np
RoCirclejerk,3dlq07,youreallcirclejerks,2,Fri Jul 17 10:02:35 2015 UTC,"te servesc cu ceva. coffee, tea, me?"
RoCirclejerk,3dhxy9,Poloniculmov,3,Thu Jul 16 12:30:53 2015 UTC,asta e pe bune? adica chiar purtati costum?
RoCirclejerk,3dhxy9,Ardust,2,Thu Jul 16 14:59:20 2015 UTC,Tre' să fii în halul ăla de gras ca să participi?
RoCirclejerk,3dhb68,andreilol,2,Thu Jul 16 07:17:44 2015 UTC,amuzant.  acum știu de ce-ți zice lumea andreilol
RoCirclejerk,3dhb68,loolftw,0,Thu Jul 16 07:30:32 2015 UTC,André no1
RoCirclejerk,3dhb68,SandmanXC,2,Thu Jul 16 07:36:29 2015 UTC,Or sa stea niste gentilomi la intrare   Futfy
RoCirclejerk,3dehxp,somedud,2,Wed Jul 15 17:20:28 2015 UTC,Circlejerkul nu e dăunător sănătății.
RoCirclejerk,3dehxp,multubunu,1 point,Wed Jul 15 18:01:44 2015 UTC,"Totuși, ROCJ pare mai populat în ultima vreme. Tre' să fie un semn că circulaba serioasă de pe /r/Romania dăunează, chiar și la mâna a doua (heh)."
RoCirclejerk,3dehxp,andreilol,1 point,Thu Jul 16 05:28:22 2015 UTC,Bucurestiul nu poti sa-l vezi de atitea beserici.
RoCirclejerk,3ddfdk,JackSixxx,5,Wed Jul 15 12:04:47 2015 UTC,"ce cauti aici, nu ai treaba pe /r/romania?"
RoCirclejerk,3ddfdk,so_carelessly_here,2,Wed Jul 15 13:11:28 2015 UTC,Nu pentru ca azi nu e Doru acasa. S-a dus la o circulaba la Arad.
RoCirclejerk,3ddfdk,Poloniculmov,4,Wed Jul 15 13:13:18 2015 UTC,Am auzit că a fost mușcat de o felină mare. E ok?
RoCirclejerk,3ddfdk,Ardust,2,Wed Jul 15 14:31:57 2015 UTC,I-a halit creierul... nimic grav. Oricum nu-l folosea.
RoCirclejerk,3demve,loolftw,2,Wed Jul 15 17:54:08 2015 UTC,you want a piece of me?
RoCirclejerk,3demve,Ardust,1 point,Wed Jul 15 19:23:21 2015 UTC,heartless animal
RoCirclejerk,3demve,Hescara,2,Wed Jul 15 19:36:23 2015 UTC,spit sum fire
RoCirclejerk,3ddau1,youreallcirclejerks,1 point,Wed Jul 15 11:06:01 2015 UTC,"V-oi cand v-ati batut , doamenlor si domnisoarelor, barbatul ultima data? Vaduvele se exclud"
RoCirclejerk,3ddau1,Ardust,1 point,Wed Jul 15 11:06:43 2015 UTC,decy bunik zilnik k mare kpac cei da la moș cand i-l vede beat vraiste
RoCirclejerk,3d9cym,so_carelessly_here,2,Tue Jul 14 14:56:11 2015 UTC,el mereu iese la bere doar cu baietii al dracu nesimtit
RoCirclejerk,3d9cym,Poloniculmov,2,Tue Jul 14 14:56:46 2015 UTC,"plm, nu știam că ești sexist"
RoCirclejerk,3d9cym,nustiuboss,3,Tue Jul 14 15:16:20 2015 UTC,"IT-ist sexist  contele de Monte Crist   bag sexism, cubism   fara labarism  ms"
RoCirclejerk,3d9cym,idiotsausage,1 point,Tue Jul 14 15:20:35 2015 UTC,"/u/nustiuboss, da-mi si mie nr lui doc, ms"
RoCirclejerk,3d9cym,victorrrrrr,2,Tue Jul 14 15:40:58 2015 UTC,"Ti-l dau, da' de cand a semnat cu LOLdeLOL nu mai raspunde la sms, si doar ii scriu atata de des.  inb4 i-am dat bip"
RoCirclejerk,3d9cym,sburatoru,1 point,Wed Jul 15 06:13:45 2015 UTC,Da.
RoCirclejerk,3d9cym,andreilol,1 point,Tue Jul 14 16:58:04 2015 UTC,De ce tocmai la bere si nu la tuica de pufoaica?
RoCirclejerk,3d9cym,MarinTaranu,1 point,Tue Jul 14 18:20:01 2015 UTC,"este. ca sa nu fie, zi-i ca iesi cu fetele la un serbet de trandafiri."
RoCirclejerk,3d5g0u,somedud,2,Mon Jul 13 17:51:26 2015 UTC,f frumos /r/amscrisasta
RoCirclejerk,3d4gmu,so_carelessly_here,4,Mon Jul 13 13:16:44 2015 UTC,Aș zice că tu ai făcut asta.
RoCirclejerk,3d4gmu,Poloniculmov,5,Mon Jul 13 13:26:30 2015 UTC,Moloniculmov
RoCirclejerk,3d4gmu,Poloniculmov,5,Mon Jul 13 13:30:58 2015 UTC,mo_carelessly_here
RoCirclejerk,3d4gmu,sburatoru,5,Mon Jul 13 13:34:11 2015 UTC,mol ce tare!!
RoCirclejerk,3d4gmu,sburatoru,3,Mon Jul 13 13:35:23 2015 UTC,OP ti-ai luat carioci ?
RoCirclejerk,3d4gmu,ionataan,2,Mon Jul 13 14:17:41 2015 UTC,nu am facut eu asta lol ms  asa am gasit
RoCirclejerk,3d4gmu,Ardust,2,Mon Jul 13 14:28:17 2015 UTC,ffs samd wtf cca thx lol ms etc exe
RoCirclejerk,3d4gmu,Zeulodin,4,Mon Jul 13 15:30:28 2015 UTC,eu xD
RoCirclejerk,3d4gmu,Hescara,3,Mon Jul 13 14:26:48 2015 UTC,el xD
RoCirclejerk,3d4gmu,dngrs,2,Mon Jul 13 16:52:24 2015 UTC,"nu, eu sunt /u/Spartacus"
RoCirclejerk,3d4c3e,Zeulodin,3,Mon Jul 13 12:29:38 2015 UTC,Il scapa preafericitul Daniel.
RoCirclejerk,3d4c3e,MarinTaranu,2,Mon Jul 13 12:56:07 2015 UTC,vrei sa zici monta ai vazut cu euronews ce au zis cum au zis monta?   adica in loc de ponta si carje au zis monta si marje  mor d ras
RoCirclejerk,3d4c3e,so_carelessly_here,1 point,Mon Jul 13 12:58:55 2015 UTC,„pă bune”?
RoCirclejerk,3d4eyr,youreallcirclejerks,1 point,Mon Jul 13 13:00:23 2015 UTC,"Repost, sorry."
RoCirclejerk,3cxiua,lelwtfmeng,6,Sat Jul 11 17:42:10 2015 UTC,"Poate tu n-o sa mergi, bah! Eu de ani de zile imi antrenez genunchiul si-l sculptez ca sa ma asigur ca /u/so_carelessly_here are parte de o sedere confortabila!"
RoCirclejerk,3cxiua,Youthanizer,5,Sun Jul 12 10:38:22 2015 UTC,"Well, înlocuiește-o pe /u/so_carelessly_here cu /u/cocstel și ai descris cam toate reddit meeturile la care am fost."
RoCirclejerk,3cxiua,Zeulodin,2,Mon Jul 13 12:29:09 2015 UTC,Kelemen Hunor
RoCirclejerk,3cxiua,somedud,2,Sat Jul 11 22:27:31 2015 UTC,"Stai, voi chiar existati in realitate?"
RoCirclejerk,3cxiua,SkepticalSagan,2,Sun Jul 12 07:27:29 2015 UTC,in dimensiunea a 6-a si numai martea de la 8 la verde
RoCirclejerk,3cxiua,Ardust,1 point,Mon Jul 13 00:42:00 2015 UTC,"imposibil, domne"
RoCirclejerk,3cxiua,karmaemata,2,Sun Jul 12 15:03:09 2015 UTC,Reedit meet pamant cricăljesk!
RoCirclejerk,3cxiua,youreallcirclejerks,1 point,Mon Jul 13 13:02:49 2015 UTC,nice 4chan meme friendo XDDDDDDDDDDDD /r/fellowkids
RoCirclejerk,3cxiua,Hescara,1 point,Sat Jul 11 19:13:04 2015 UTC,Findca youreallyareafag e tipa.
RoCirclejerk,3cxiua,victorrrrrr,1 point,Sat Jul 11 19:31:15 2015 UTC,"Acum zici tu ce zici acolo, dar , atentie, eu chiar pot filozofa destul de mult pe orice tema. Si chiar daca nu filozofez, pot sa vorbesc despre cum am condus o locomotiva odata sau despre hăhăhă cum eram spart alta data hăhăhă si mi-a zis ala ca are juma de coleg si eu am crezut ca e chiar un om fara picioare si m-am crizat. Heh."
RoCirclejerk,3csiji,sixstringhead,1 point,Fri Jul 10 12:32:41 2015 UTC,antena 3
RoCirclejerk,3ctfza,crocodile92,8,Fri Jul 10 17:10:34 2015 UTC,Iar veniti sa va plangeti p'aci?
RoCirclejerk,3ctfza,victorrrrrr,8,Sat Jul 11 01:59:24 2015 UTC,Cică ban la ban și crocodil la crocodil trage
RoCirclejerk,3ctfza,Zeulodin,3,Sat Jul 11 09:56:46 2015 UTC,"E nada destul de proasta crocodilul pentru crocodili. Eu recomanda pufuleti, ii scoate la suprafata imediat si, pentru ca-s mamaligari, incep sa-si impartaseasca colectia de crocodiloaice despuiate."
RoCirclejerk,3co5f2,kick_a_cunt_monday,5,Thu Jul 9 12:41:58 2015 UTC,"deci dar daca eu am vazut postul asta acum 5 minute si comentez acum, dar peste 5 minute ma gandesc la un comentariu mai bun si il sterg pe asta din trecut, si il pun pe ala mai bun din ""viitorul prezentului"", cum ar veni, atunci nu e clar ca viitorul e mai bun decat trecutul unui comentariu prost?"
RoCirclejerk,3co5f2,so_carelessly_here,3,Thu Jul 9 12:49:30 2015 UTC,"pay ce zici tu inplica sa ai o scula pe care o arunci in masinaria timpului, stricando, in cazul de fata scula asta fiind functia de a edita comentari daca poti schinba trecutul asea de usor cum schinbi comentarii n-am mai fi dujmanie intre viitor si trecut ca te intorci si facy totul sa fie superok intelegy?"
RoCirclejerk,3co5f2,so_carelessly_here,2,Thu Jul 9 12:58:05 2015 UTC,stai ca ma confuzezi.   decy ce functie de editare? am facut aici o schema cu butoanele de le am si aratami tu plm unde e ala
RoCirclejerk,3co5f2,nuunien,3,Thu Jul 9 13:30:33 2015 UTC,"ai uitat sa precizezi daca e viitorul de maine sau viitorul de ieri. de asemenea, care prezent? cel de maine, sau cel de poimaine?  ms lol pwp"
RoCirclejerk,3co5f2,sburatoru,5,Thu Jul 9 14:24:44 2015 UTC,"filosofie coae, daca n-ai inteles po sa-ti esplic .. ca am dat bacu la filosofie, de doo ori, ca prima oara n-a vrut sa-mi dee zecele, mi-a dat noo noo zeci, am factut contestatie si mi-a dat de la inspectorat 8, am sucombat intr-o depresie esistentialista cu toane de realism negativist, am stat acasa in lotus si-am bagat frumos, elegant, iarba proaspata toata ziua - pentru meditatie transcedentala! -, m-am reintors in toamna am luat zece curat, i-am spart pe prosti, nu intelegeau nimica aia, le esplodase venele in cap de concentrare, am scris 30 de pagini in 1 ora, plangeau profesorii de fericire ca i-am facut sa inteleaga cu timpu si cu altele.."
RoCirclejerk,3co5f2,somedud,1 point,Thu Jul 9 19:33:42 2015 UTC,Curtremurător!
RoCirclejerk,3caslb,itsmegoddamnit,1 point,Mon Jul 6 13:24:25 2015 UTC,au dat rusii bomba?
RoCirclejerk,3caslb,Ardust,1 point,Mon Jul 6 23:08:06 2015 UTC,Lucrezi in it?
RoCirclejerk,3caslb,TheClassyDog,1 point,Tue Jul 7 08:36:49 2015 UTC,Eu și restul lumii de pe aici...
RoCirclejerk,3caiig,Zeulodin,6,Mon Jul 6 11:33:47 2015 UTC,"102010% din musulmani nu sunt tigani, dar 319238-19% din tigani sunt homosexuali teroristi, decy scuze dar asta e realitatea!"
RoCirclejerk,3caiig,so_carelessly_here,5,Mon Jul 6 12:14:06 2015 UTC,/r/RoAuFacutMatematica
RoCirclejerk,3caiig,somedud,5,Mon Jul 6 15:22:00 2015 UTC,E ziua în care ♪  Îmi scot rasismul la plimbare ♫
RoCirclejerk,3caiig,andreilol,4,Mon Jul 6 16:02:21 2015 UTC,Fac un pipi din picioare
RoCirclejerk,3caiig,andreilol,3,Mon Jul 6 16:02:32 2015 UTC,Și mă stropesc pe umblătoare
RoCirclejerk,3caiig,pugslington,3,Tue Jul 7 09:39:18 2015 UTC,mue steaua ?
RoCirclejerk,3cakzz,youreallcirclejerks,3,Mon Jul 6 12:05:32 2015 UTC,"deci pana bine /u/cainele_din_41 sa va minta, va spun eu.  Latra dupa cauciuce   ms"
RoCirclejerk,3cakzz,so_carelessly_here,2,Mon Jul 6 12:15:17 2015 UTC,/u/cainele_din_41   :'(. Low blow sch. Low blow. /u/cainele_din_41 nu se mai intoarce.
RoCirclejerk,3cakzz,victorrrrrr,3,Mon Jul 6 12:16:24 2015 UTC,hehehe suferiti ca cainii!!!
RoCirclejerk,3cakzz,so_carelessly_here,6,Mon Jul 6 12:17:50 2015 UTC,guise! cum dau josvot aicy? ms
RoCirclejerk,3cakzz,victorrrrrr,3,Mon Jul 6 12:18:29 2015 UTC,daca ai telefon inteligent smartphone descarci reddit si fun si dai josvoturi la aia care te enerveaza
RoCirclejerk,3carac,karmaemata,2,Mon Jul 6 13:11:06 2015 UTC,"tu esti realul cel mai valoros jucator, frate"
RoCirclejerk,3carac,Ardust,1 point,Tue Jul 7 09:20:53 2015 UTC,"independent sefule, independent ..."
RoCirclejerk,3caghd,yonica_caciulata,2,Mon Jul 6 11:07:09 2015 UTC,Слава
RoCirclejerk,3caghd,MirrdynWyllt,2,Mon Jul 6 13:06:43 2015 UTC,"Bă, noi avem aproape aceeași zi de naștere."
RoCirclejerk,3cc2gz,lolok25,7,Mon Jul 6 19:16:29 2015 UTC,Cum ar fi daca:   n-ai ucide pe nimeni. nu te-ai sinucide. ai vorbi cu cineva despre problemele tale.   ms.
RoCirclejerk,3cc2gz,victorrrrrr,3,Tue Jul 7 10:38:57 2015 UTC,Hai buey ne leași?
RoCirclejerk,3cc2gz,magicsebi,-1,Mon Jul 6 19:30:54 2015 UTC,"O las pe ma-ta, desi aseara dupa ce am fufut-o a zis ca mai vrea!"
RoCirclejerk,3cc2gz,Hescara,2,Tue Jul 7 05:37:35 2015 UTC,ortodoxi
RoCirclejerk,3c7ai2,yonica_caciulata,4,Sun Jul 5 15:30:02 2015 UTC,voturi? vezi ca-ti las unul da' tre' sa te apleci dupa el
RoCirclejerk,3c7ai2,Ardust,4,Mon Jul 6 01:25:25 2015 UTC,Multi inainte. Hai sa ridicam paharu.
RoCirclejerk,3c7ai2,MarinTaranu,3,Mon Jul 6 02:16:01 2015 UTC,la mulț ani boss!
RoCirclejerk,3c7ai2,loolftw,2,Sun Jul 5 17:27:53 2015 UTC,muțean!
RoCirclejerk,3c1w9l,iwasanewt,2,Sat Jul 4 00:14:42 2015 UTC,eu
RoCirclejerk,3c1w9l,Hescara,2,Sat Jul 4 07:44:07 2015 UTC,"brutalistu reprezinta 80% din motivele pt care stateam pe /r/romania.  fara brutalist, viata e pustiu"
RoCirclejerk,3c1w9l,Ardust,2,Sat Jul 4 14:26:10 2015 UTC,Lupiiii băăăăă
RoCirclejerk,3bz3z4,itsmegoddamnit,3,Fri Jul 3 09:12:39 2015 UTC,"Cu carne de sobolan proaspat. Taica-meu a vizitat o fabrica de salamuri d-astea si spunea ca sobolanii cadeau din cind in cind in mixer, si pentru ca nu-i vedea nimeni, mixerul ii strivea de vii, ca ii auzeai cum chitzcaie cind le venea moartea, si amesteca mizeria aia in salam. Pe care oamenii il maninca."
RoCirclejerk,3bz3z4,MarinTaranu,1 point,Fri Jul 3 12:16:27 2015 UTC,"Hah, eu mănânc numai parizer."
RoCirclejerk,3bz3z4,NoHomoDadPlz,1 point,Fri Jul 3 19:22:38 2015 UTC,Stii din ce-i facut parizerul? Mai bine nu-ti spun.
RoCirclejerk,3bywhm,nusuntacasa,3,Fri Jul 3 07:38:48 2015 UTC,"multumesc, aveam nevoie de asta"
RoCirclejerk,3bywhm,nuunien,2,Fri Jul 3 08:06:58 2015 UTC,noul meu ringtone
RoCirclejerk,3bq46b,Hescara,3,Wed Jul 1 06:22:05 2015 UTC,varza
RoCirclejerk,3bq46b,sburatoru,2,Wed Jul 1 10:17:17 2015 UTC,nu tu
RoCirclejerk,3bq46b,sburatoru,1 point,Wed Jul 1 11:00:38 2015 UTC,cine da josvot pe ro/cerc ?????
RoCirclejerk,3boz3s,kryogenyk,2,Tue Jun 30 23:42:01 2015 UTC,Baclavaua
RoCirclejerk,3be6i9,vrrrrrr,7,Sun Jun 28 11:23:56 2015 UTC,"Se simte Benone, omule."
RoCirclejerk,3be6i9,magicsebi,3,Sun Jun 28 13:54:47 2015 UTC,"No, /u/magicsebi did it, he's our only lord"
RoCirclejerk,3be6i9,VilleFTW,1 point,Sun Jun 28 19:07:19 2015 UTC,I came.
RoCirclejerk,3b8wdk,magicsebi,3,Fri Jun 26 22:41:32 2015 UTC,am dat upbarci in asa fel incat sa scrie benone upbarci va rog
RoCirclejerk,3b7kn8,magicsebi,1 point,Fri Jun 26 16:41:38 2015 UTC,eeeeeeeeeeeeeee
RoCirclejerk,3b3pib,itsmegoddamnit,5,Thu Jun 25 18:39:13 2015 UTC,Every android's dream.
RoCirclejerk,3b2gsv,magicsebi,1 point,Thu Jun 25 12:56:23 2015 UTC,God damn RES ruining my joke. aveț grijă cred că RES e unealtă de la SRI
RoCirclejerk,3b2gsv,Iazo,2,Thu Jun 25 13:06:47 2015 UTC,Eu literalmente nu vad problema.
RoCirclejerk,3b2gsv,MarinTaranu,1 point,Thu Jun 25 15:39:18 2015 UTC,Amindoua par bune de luat in pula daca sint destul de disperat.
RoCirclejerk,3b2gsv,somedud,1 point,Thu Jun 25 13:29:00 2015 UTC,"M-aș căsători în SUA cu CTP-ul, l-aș fute în draci 20 de ani, după care l-aș omorî și i-aș moșteni averea."
RoCirclejerk,3b3olw,Ardust,1 point,Thu Jun 25 18:32:39 2015 UTC,Stai în piață.... pe reddit. Și eu care ma consideram un no-lifer...
RoCirclejerk,3azn4u,Zeulodin,2,Wed Jun 24 20:00:57 2015 UTC,"Link for the interested:  /r/Romania: Romania, a country famous for its beautiful landscapes, gorgeous women and [...]    This is a bot and won't answer to mails. Mail the [Botowner] instead. v0.4 | Changelog"
RoCirclejerk,3ap4rm,nusuntacasa,4,Mon Jun 22 10:40:00 2015 UTC,"Sincer, cam sunt."
RoCirclejerk,3ap4rm,Greyko,2,Mon Jun 22 12:48:43 2015 UTC,"Eu nu sunt rasist ,dar, tiganii sunt de vina!"
RoCirclejerk,3ap4rm,ionataan,1 point,Mon Jun 22 13:11:32 2015 UTC,avem nevoie de un lider ca stefan cel mare sa ne conduca spre o epoca glorioasa in care ne vom invinge dusnmanii(ungaria si rusia hehe) si sa devenim romania mare! basarabia pamant romanesc!!!
RoCirclejerk,3an9f1,Greyko,5,Sun Jun 21 22:02:11 2015 UTC,prima mea data cand mi-am luat-o la buci  never forget
RoCirclejerk,3an9f1,nuunien,3,Mon Jun 22 01:57:24 2015 UTC,decy pussy too breathtaking. eram uberhipster si aveam cordonu dat dupa gat
RoCirclejerk,3an9f1,Ardust,1 point,Mon Jun 22 06:42:23 2015 UTC,MAAARShh88 nu KrED! Era cu sunca sau de curcan?
RoCirclejerk,3ao34s,anarchestie,2,Mon Jun 22 02:39:29 2015 UTC,baaa esti nebun e ca in mona lisa baaa wtf
RoCirclejerk,3alfbz,nuunien,2,Sun Jun 21 10:28:00 2015 UTC,top kek ms
RoCirclejerk,3aic0o,nuunien,3,Sat Jun 20 13:38:32 2015 UTC,rusia e glorioasa axaxaxaxaxaxa
RoCirclejerk,3aic0o,Hescara,3,Sun Jun 21 09:58:24 2015 UTC,Morrowin confirmed crocodilul sub acoperire
RoCirclejerk,3aenea,Zeulodin,5,Fri Jun 19 14:36:13 2015 UTC,Hail Satan!
RoCirclejerk,3aenea,Faraonul_,3,Fri Jun 19 14:39:40 2015 UTC,Hei I am back!
RoCirclejerk,3aenea,burtalistu,1 point,Fri Jun 19 21:32:20 2015 UTC,Heil I am back!   ARAPT
RoCirclejerk,3aenea,MarinTaranu,3,Sat Jun 20 11:51:47 2015 UTC,"Bai onanistule, tu nu vezi ce cretin esti, Redditul te face mai destept, ba sperma obosita. Uite, aici vezi tu cum ciinele fute femeia, cum strutzii sar la o jucarie, multe pisici, si multe filmulete care-ti arata cum vrea bunica ta sa ia carici de la negri barbosi."
RoCirclejerk,3aenea,nuunien,2,Sat Jun 20 03:23:14 2015 UTC,"why you not say that to my face? motherfucker? daca te prind te barbieresc, die my mother if i lie"
RoCirclejerk,3aenea,loolftw,2,Fri Jun 19 16:09:13 2015 UTC,Pe la ce ora ne-ntalnim pentru ritual?
RoCirclejerk,3aenea,youreallcirclejerks,2,Fri Jun 19 17:28:51 2015 UTC,Tial mi lernas Esperanton. Adica eu vorbesc esperanto din aceasta pricina.
RoCirclejerk,3aenea,RandiRobert94,1 point,Sat Jun 20 08:41:29 2015 UTC,Fustrarea face victime..din nou. -+=666=+-
RoCirclejerk,3aenea,vacaroiu,1 point,Sun Jun 21 05:14:47 2015 UTC,u wot m8?
RoCirclejerk,3a9boi,mybrainquit,5,Thu Jun 18 06:45:59 2015 UTC,"pacat ca nu are sunet acest gif pentru ca v-ati fi dat seama ce zice tipul. ok sunt de treaba si v-ajut, pentru ca stiu sa citesc buze. zice ceva de genu: muie basescu"
RoCirclejerk,3a9boi,loolftw,2,Thu Jun 18 09:56:47 2015 UTC,muie basescu   basescu   MFW
RoCirclejerk,3a9kie,magicsebi,2,Thu Jun 18 08:46:25 2015 UTC,Lol Emma Watson își dă singură like la poză. LAME!
RoCirclejerk,3a5ln9,so_carelessly_here,3,Wed Jun 17 12:17:04 2015 UTC,"Le-am văzut pe cele din Cora, nu m-au convins. Oricum dacă aș lua o sch aș merge cu cineva care se pricepe mai bine ca mine, eventual să găsim hibele din timp."
RoCirclejerk,3a5ln9,AlbinaViespeStup,3,Wed Jun 17 13:08:04 2015 UTC,"din cate stiu eu, hibele nu sunt din cauza sch-ului, ci din cauza utilizarii nepotrivite de catre proprietar.   daca ai grija de sch, sch be good to u"
RoCirclejerk,3a5ln9,AlbinaViespeStup,3,Wed Jun 17 13:14:22 2015 UTC,"bine, adevarul e ca e bine sa stii in ce te bagi. Nu e nimic rau sa vrei sa o testezi un pic sau ceva. Cum se comporta la oras, chestii din astea"
RoCirclejerk,3a5ln9,AlbinaViespeStup,1 point,Wed Jun 17 13:15:20 2015 UTC,"Da, revenind la ce ai intrebat de fapt, eu ti-as recomanda SCH cu conditia sa gasesti pe cineva cu experienta care sa mearga cu tine sa vada marfa, sa stie ce sa urmareasca, sa o incerce bine etc."
RoCirclejerk,3a5ln9,sburatoru,2,Wed Jun 17 13:17:48 2015 UTC,"iti trebuie ochiul format un pic, da. Asta e clar.   Din cate am vazut nu toti se pricep la sch, e destul de dificil, dar daca stii dupa ce sa te uiti, chiar sunt unii care pot vedea frumusetea exceptionala.  dar, da, cum zici si tu, trebuie cineva care stie sa recunoasca ceva marfa. (asta ai zis, nu?)"
RoCirclejerk,3a58ot,victorrrrrr,13,Wed Jun 17 09:29:22 2015 UTC,http://i.imgur.com/CQoCgC8.jpg  sunt f mandra de ea  azi dimi am gatit asta
RoCirclejerk,3a58ot,so_carelessly_here,2,Wed Jun 17 09:36:13 2015 UTC,deci arata foarte bine.
RoCirclejerk,3a58ot,loolftw,7,Thu Jun 18 14:27:58 2015 UTC,"Ha, ardei gras! Get it? GRAS! Ha! Amuzant!"
RoCirclejerk,3a58ot,itsmegoddamnit,1 point,Wed Jun 17 12:34:46 2015 UTC,gras esit tu cu...
RoCirclejerk,3a58ot,Wolfy21_,1 point,Thu Jun 18 09:44:50 2015 UTC,thats my fetish
RoCirclejerk,3a4ze1,magicsebi,2,Wed Jun 17 07:15:51 2015 UTC,Underrated post
RoCirclejerk,3a5vm7,PvtDragos,3,Wed Jun 17 13:54:35 2015 UTC,Înainte nu erai?
RoCirclejerk,3a5vm7,SandmanXC,3,Wed Jun 17 18:04:15 2015 UTC,Nu mai tin minte.Drogul marijuana a avut un efect puternic asupra mea.
RoCirclejerk,3a5vm7,nuunien,2,Wed Jun 17 18:22:03 2015 UTC,faggot
RoCirclejerk,3a5vm7,MirrdynWyllt,2,Wed Jun 17 13:57:52 2015 UTC,Ești pe-o listă acum.
RoCirclejerk,3a5vm7,MarinTaranu,2,Wed Jun 17 23:43:36 2015 UTC,Acum planteaz-o.
RoCirclejerk,39w4ch,NoHomoDadPlz,3,Mon Jun 15 07:33:53 2015 UTC,Eu am batut maimutza azi. De doua ori.
RoCirclejerk,39w4ch,MarinTaranu,2,Tue Jun 16 01:00:24 2015 UTC,"E vechi thread-ul dar: cum naiba ai ajuns pe roddit? Ai cules ceva uaifai, din ala de care tot aud, din gradina?"
RoCirclejerk,39w4ch,Xardas123,1 point,Fri Jul 3 11:33:36 2015 UTC,"Da, am făcut un ceai bun din el și se pare că merge."
RoCirclejerk,39t9ey,victorrrrrr,3,Sun Jun 14 15:37:59 2015 UTC,doua pompe hidraulice. fara ceapa ca-s cu masina
RoCirclejerk,39t9ey,Ardust,1 point,Sun Jun 14 16:19:03 2015 UTC,"nește floare, jtii tu d kre"
RoCirclejerk,39t5i7,daswareinbefehl,1 point,Sun Jun 14 15:00:04 2015 UTC,"Mai bine legitimat, decât un headshot?"
RoCirclejerk,39qaxv,crocodile92,2,Sat Jun 13 18:38:34 2015 UTC,nu vreau sa vad ce plete are pe sfarcuri  videochat nu vrei?
RoCirclejerk,39otp6,magicsebi,1 point,Sat Jun 13 09:04:40 2015 UTC,"Ma mut acolo, ca-mi place sa dau la buci."
RoCirclejerk,39mtpm,nuunien,1 point,Fri Jun 12 21:21:44 2015 UTC,"As iesi daca te-ai masturba. Semnat, Sperma."
RoCirclejerk,39mtpm,MarinTaranu,1 point,Sat Jun 13 01:34:56 2015 UTC,Practic tu din zece cuvinte unu îl scrii cu diacritice și altul nu. Ce pula mea e în capu tău?
RoCirclejerk,39mtpm,loolftw,1 point,Sat Jun 13 09:36:47 2015 UTC,"Imi e greu sa scriu cu o singura mana. Poftim, completeaza tu: ăîșțü"
RoCirclejerk,39k4sp,dngrs,-1,Fri Jun 12 07:58:17 2015 UTC,"Buna incercare, OP, dar chiar nimeni nu vrea sa-ti dea tie sus-vot doar de dragul urei fata de Ponta."
RoCirclejerk,39k4sp,CatalinMarcutiu,5,Fri Jun 12 12:03:46 2015 UTC,nu va lasa psd sa iesiti din banci?
RoCirclejerk,39k4sp,CatalinMarcutiu,-2,Fri Jun 12 12:13:04 2015 UTC,"Nu stiu, nu fac parte din PSD, tu să-mi zici."
RoCirclejerk,39l1c4,geekyloverboy,1 point,Fri Jun 12 13:53:16 2015 UTC,asl?
RoCirclejerk,39kczb,neshi3,2,Fri Jun 12 09:42:39 2015 UTC,au ajuns prostalaii pe /r/roCerc !!
RoCirclejerk,39bwyw,magicsebi,3,Wed Jun 10 18:51:07 2015 UTC,noroc de Ponta ca a scazut tva-ul la floare si noroc
RoCirclejerk,39bwyw,cocstel,3,Wed Jun 10 18:54:26 2015 UTC,"Daca iei ceva pe caiet, Tanti jeni trebuie sa iti dea bon fiscal ?"
RoCirclejerk,39bwyw,SkepticalSagan,1 point,Wed Jun 10 19:47:27 2015 UTC,"Tanti Jeni   Decy, sa moara bibi, asa o cheama pe tanti care vinde la alimentara din apropiere.   Cate Tanti Jeni sunt? Eh? Coincidenta? Nu prea cred..."
RoCirclejerk,39bwyw,Bob_Rooney,1 point,Thu Jun 11 16:14:05 2015 UTC,fuckin' normie.Ratia optima e 2 beri per pachet XL de seminte.
RoCirclejerk,39cg77,neshi3,2,Wed Jun 10 20:50:42 2015 UTC,"Mai degraba e un ailment, adica o boala cum ar veni."
RoCirclejerk,39cg77,victorrrrrr,1 point,Thu Jun 11 06:56:50 2015 UTC,we did it reddit!
RoCirclejerk,39amzp,AlbinaViespeStup,5,Wed Jun 10 13:29:00 2015 UTC,no personal information boss   te rog sa dai poza asta cu mine jos de aici!!!!
RoCirclejerk,39amzp,so_carelessly_here,5,Wed Jun 10 13:45:19 2015 UTC,"Esti cea colorata din randul apropiat, stiam eu!"
RoCirclejerk,39amzp,SandmanXC,2,Wed Jun 10 14:22:51 2015 UTC,"Mai întâi savarinele, apoi gogoșile. /u/so_carelessly_here clădește un monopol în piața dulciurilor cu tentă sexuală."
RoCirclejerk,39amzp,Zeulodin,2,Wed Jun 10 16:14:14 2015 UTC,MFW
