socialskills,3dvrrb,_9876543210_,1 point,Mon Jul 20 13:14:24 2015 UTC,"Best way to handle it is to not allow it to bother you. ""haha oh shit man, [insert another embarrassing thing] was hilarious."" ""Remember that time when we ( you and the person bringing up the mistake ) did XYZ? We got so busted/messed up/embarrassed/whatever!"" Rolling with the punches is always the best way to go about it. Remember no one can make you feel inferior without your consent. People like to reminisce about the past, it's only natural.   In the flow of that conversation, its not about whats being said, but how people end up feeling about it. For example, it may have been embarrassing, but embarrassing stories are funny. If you own it and elaborate on it then people wont see it as a put down, but an interesting anecdote."
socialskills,3dvrrb,BatmobileOver9000,1 point,Mon Jul 20 18:22:43 2015 UTC,"I had a friend that did this last year.  Let's just say we're not friends anymore.  Not specifically because of the embarrassment, but it was still horrible."
socialskills,3dvrrb,_TheViking_,-1,Mon Jul 20 23:18:57 2015 UTC,"punch  them hard in the shoulder every time they do it. then say ""see, the past can hurt. now shut up."" :)"
socialskills,3dxj5l,AdriaaaaaaaaaN,3,Mon Jul 20 10:30:48 2015 UTC,"The key to maintaining an interesting conversation is to let the person you are trying to be friends with do the ""wholesome"" talking, and you being the director of the conversation. Let me try and explain.  Scenario: I just met you, and I'm trying to talk to you. The only thing that you have mentioned is this post, about maintaining interesting conversations, so I would say:  ""Hey, how are you?  (Response)  Nice to meet you, I'm 9876543210. I see you're trying to make interesting in learning about interesting conversations. Can I ask what your outcomes for these conversations are?  (Response regarding stronger friendships because your dog died)  I now have two options to talk about, I can ask about ""interesting conversation"" or about ""Dogs"". This cycle can go on for a good period of time, and you can mold it to your interests.  I hope this helped OP, you can do it!"
socialskills,3dvkan,ducks494,10,Sun Jul 19 21:58:36 2015 UTC,"Honestly I bet she thought you said ""how am I doing?"""
socialskills,3dvkan,boogiemen,2,Mon Jul 20 00:52:39 2015 UTC,I didn't talk to her first. I just smiled.
socialskills,3dvkan,theseyeahthese,9,Mon Jul 20 01:13:47 2015 UTC,"Obviously we weren't there but here's how I read it:  She meant her first line earnestly, noting that you were dancing with hot chicks.  Then, your scrunched up confused face may have made YOUR statement sound condescending to her, like you mistook her first statement as a jab and you were retorting.  Then, she replies like ""woah, I was just trying to be nice [,chill out]"".  In any event, I can't think of a situation where this would be worth you worrying over--doesn't sound like anything bad."
socialskills,3dvkan,Postdott,5,Mon Jul 20 03:17:05 2015 UTC,"You know,it might be just her appreciating your dance moves,could be the fact that you were dancing with two chicks,could be both,lol.  Edit : maybe it was miscommunication and she didn't hear you quite well"
socialskills,3dvkan,ElMelonTerrible,4,Sun Jul 19 23:51:24 2015 UTC,"Probably she noticed that you were out of your comfort zone, or at least out of your zone of competence, and wanted to let you know that you weren't embarrassing yourself.  I'd take it as a compliment, a very honest one.  It would have been condescending to pretend you were tearing it up.  If you were a special needs kid she would have told you oh my gosh great job, you're such a good dancer ducks494!  But she knew that you knew that she knew that you knew etc. that you're not a great dancer, so she didn't pretend.  She made a comment that acknowledged the obvious while at the same time giving you a thumbs up and letting you know that what you were doing was reflecting well on you.  Another interpretation is that she noticed that you were making a favorable impression on one of your coworkers."
socialskills,3dvkan,greasymonkee,3,Sun Jul 19 23:57:15 2015 UTC,I would have taken it as she has no idea who you are or what you were thinking and was complimenting you for hanging out with two attractive chicks. She may have thought you were taking both of them home. Not everyone is an asshole. People can't read minds. I'm sure that she had no idea you weren't comfortable dancing.
socialskills,3dvkan,FantasyDuellist,1 point,Mon Jul 20 02:40:01 2015 UTC,She was pleased to see you enjoying your time.
socialskills,3dvkan,Jaalde,2,Mon Jul 20 03:56:51 2015 UTC,"She was trying to be encouraging. Everyone knows it takes courage to dance in public and lots of people won't even attempt it unless the dance floor is full and they won't get noticed. Everyone likes the guy who dances and encourages others to join in.  Is thinking about this making you feel bad/down? Remember that you don't deal with anxiety by rationalizing (since anxiety is inherently irrational), but by quelling negative thoughts altogether. Dancing in public is awesome and you had a POSITIVE experience."
socialskills,3dwuzb,icanthinksometimes,2,Mon Jul 20 05:01:44 2015 UTC,This thread has a bunch of comments on tips and tricks of social skills and techniques. https://www.reddit.com/r/AskReddit/comments/3bhdj2/what_are_some_good_conversation_and_social_skills/  Comment by user /u/V1Z1 from a similar thread from a year ago that I personally think may be useful in social situations: https://www.reddit.com/r/AskReddit/comments/1thau9/what_are_the_best_psychological_tricks/ce886i5  Similar threads:  https://www.reddit.com/r/AskReddit/comments/1thau9/what_are_the_best_psychological_tricks/  https://www.reddit.com/r/PsychologicalTricks/comments/31i7lw/a_somewhat_definitive_list_of_psychological/  https://www.reddit.com/r/AskReddit/comments/1vw8ih/what_social_mind_tricks_do_you_know/
socialskills,3duvpl,icanthinksometimes,9,Sun Jul 19 18:30:21 2015 UTC,"If nothing's up I like to respond with ""Thinking about..."" or ""Just got done..."""
socialskills,3duvpl,anarchokitten,2,Sun Jul 19 20:28:23 2015 UTC,I don't geddit : (
socialskills,3duvpl,pickled_dreams,1 point,Mon Jul 20 01:02:02 2015 UTC,"If nothing really is going on, I'll talk about what I'm thinking about or something that's been on my mind recently, or talk about something I did recently. You can also say ""Excited for..."" and talk about something you're planning on doing. I used to just say ""not much,"" but I've found doing it like this makes it a lot easier to start a conversation."
socialskills,3duvpl,anarchokitten,1 point,Mon Jul 20 16:03:01 2015 UTC,"Oh, ok. That makes sense : )  I retardedly thought that you only said the sentence fragment ""Thinking about"" and then stopped speaking. I thought it was some kind of inside joke. It never occurred to me that you went on to explain what you're thinking about.  I am not a clever man."
socialskills,3duvpl,pickled_dreams,18,Mon Jul 20 16:51:27 2015 UTC,"""Up is the direction perpendicular to, and moving away from the surface of the earth.""  No, just kidding.  Don't say this."
socialskills,3duvpl,RBeck,13,Sun Jul 19 21:20:13 2015 UTC,"Oh shit. Did that before, conversation suddenly turned into one about black holes."
socialskills,3duvpl,dudewheresmypen,8,Sun Jul 19 23:17:45 2015 UTC,"It worked, then."
socialskills,3duvpl,ElMelonTerrible,4,Mon Jul 20 05:16:13 2015 UTC,"Also, the answer to ""What's new?"" is ""C over Lambda"""
socialskills,3duvpl,jimmahdean,5,Mon Jul 20 03:52:46 2015 UTC,"Sometimes I say ""Positive values on the relative y axis""."
socialskills,3duvpl,Epicshark,3,Mon Jul 20 02:51:46 2015 UTC,"In R2  Or we can bring the z-axis into this if you really wanna tussle (sorry, only sophomore level undergrad math, I got nothing more advanced than that)."
socialskills,3duvpl,IAmNotAPerson6,23,Mon Jul 20 09:47:45 2015 UTC,Not much. You?
socialskills,3duvpl,FreeNaps,8,Sun Jul 19 18:50:56 2015 UTC,"'no, me neither.'  then the conversation ends."
socialskills,3duvpl,Bewilderex63,4,Mon Jul 20 05:46:41 2015 UTC,"It ends in your part /u/Bewilderex63 , but I can still ask something right after that such as:  ""What are your plans for today?""  ""How is your family doing?""  ""We should go get some lunch later today, how does your schedule look?"""
socialskills,3duvpl,_9876543210_,5,Mon Jul 20 13:29:40 2015 UTC,"Let me start by saying that I too dealt with this issue for quite sometime. Most of the time I'd answer with a simple shrug or 'I don't know'. It always lead to silence for awhile.   The way I view it is ""what's up?"" is just another way of asking someone: ""How are you?"", ""How's it been going?"", ""What's on your mind?"", or maybe even ""What is going on with you?"". Find your own definition for it or use one from one posted on here. It should be something that will work best for you.   In my past experience it's been easier to follow how I'm feeling to answer ""What's up?"". Even if it's something really random, it creates a pristine opportunity to communicate with someone. Good luck my friend. Believe in yourself and you can do it."
socialskills,3duvpl,yoshikiller27,4,Sun Jul 19 20:53:47 2015 UTC,"Just bullshit. It isn't about ""what is up"", but instead what you want "" to be up"".  They more than likely want to hangout with you or just talk. ""What's up?"" Is an ice breaker typically."
socialskills,3duvpl,FriendOfBrutus,4,Mon Jul 20 02:46:51 2015 UTC,Something's always up. You just launch into something you were doing or were going to do. Doesn't necessarily have to be something going on in the present.
socialskills,3duvpl,The_Wisest_of_Fools,4,Mon Jul 20 05:11:40 2015 UTC,"If not at work:  -Just hanging in there  -Still alive, so that is something.  -Nada.  -Just chilling.  If at work:  -Another day another dollar  -Meetings and such. You?  -Well my badge worked, so they must still want me here  (actually don't say this)"
socialskills,3duvpl,txs2300,6,Sun Jul 19 21:59:19 2015 UTC,That last one was awesome so...
socialskills,3duvpl,Changnesia101,2,Sun Jul 19 23:05:44 2015 UTC,"If there's nothing much on your end to talk about then ask the other person questions. Ask about what they've been up, what they're doing today, any questions really."
socialskills,3duvpl,FantasyDuellist,2,Sun Jul 19 20:34:31 2015 UTC,"You pretty much get to say anything to this.  Some options:   Tell them what's up. Make an observation or ask them about something that's going on with them. Tell them something you saw or thought about recently. ""Nothing, you?"""
socialskills,3duvpl,ElMelonTerrible,2,Mon Jul 20 04:03:29 2015 UTC,"What's your day about?  Every day you wake up with a purpose.  It might not be obvious.  Sometimes my entire purpose for the day is to stay employed while protecting myself from stress and overwork.  Maybe your purpose is to get stronger in the gym, write a new chapter in a book, plan a great birthday party for your kid, or break 5,000 karma on Reddit.  Or maybe your entire day is built around enjoying a new episode of a TV show.  Whatever it is, own that shit.  Don't downplay what's important in your life.  Don't assume people aren't interested.  The whole purpose of my day might be to be as lazy as possible without being fired, but when I say, ""Just trying to recover from working my ass off last week, took it easy at work and now I'm going to chill with Netflix.  Gotta give my brain its beauty sleep,"" that's something that 1) really tells the other person what's up in my life and 2) gives them something they can understand and relate to.    The important thing is to really be honest with yourself about what your day is about.  Don't judge prematurely and say ""nothing"" because you think the real answer is boring or doesn't reflect well on you.  Make a decent try at presenting yourself in a positive light."
socialskills,3duvpl,FoxEhGamer,2,Mon Jul 20 05:28:12 2015 UTC,"""What's up?"" is really just an acknowledgement. You don't have to follow up with anything but ""Nothing. What's up with you?"". Think of it more like an ice breaker. I personally like to just state my mood because I have an emotionless face most of the time. It helps people get a read on me. Try ""Feeling good today/I feel like shit today/It's Friday!/It definitely feels like a Monday. What's up with you?"". You now have established a conversation. You can talk about anything at this point.  But you can be a smart ass instead. Then they will just stop asking you."
socialskills,3duvpl,Broodje_met_beleg,0,Mon Jul 20 06:13:08 2015 UTC,Plan something to do and talk about that
socialskills,3duvpl,arkofjoy,3,Sun Jul 19 18:35:05 2015 UTC,That doesn't answer my question. There's always going to be times when I'm not doing anything.
socialskills,3duvpl,arkofjoy,4,Sun Jul 19 18:41:19 2015 UTC,"What's up is really just an attempt at starting a conversation.  So it doesn't actually have to be about what is happening at that moment.  In this instance perhaps you are just chilling,  but last night you killed lots of bad guys in your favourite game.  So you can say ""Just standing here thinking about how well I did in my game last night""  or thinking about what I am going to be doing on the weekend.    The other side of this is that if the answer is too often ""nuthin"" then you need to decide to get involved with something.  Join a voluntary organisation of some kind.  Or a sports team.  If the best thing in your life is an upcoming TV show, this can be changed."
socialskills,3duvpl,TGMCD,1 point,Mon Jul 20 01:33:59 2015 UTC,"The best thing in my life is an upcoming tv show, actually. I feel stuck. I've forgotten what I like to do."
socialskills,3duvpl,TheUltimateSalesman,2,Mon Jul 20 04:37:09 2015 UTC,"well the good news is that it is likely possible to change that. I would strongly encourage you to start volunteering. Anything. Soup kitchen, aged care facility reading to old folks, teaching young kids to read, cleaning out animal cages at the shelter.   Make the world a slightly better place will make a big difference to your world."
socialskills,3dvmil,Dissidia012,4,Sun Jul 19 22:17:09 2015 UTC,"That's not cool. If you're feeling awful, then there's obviously something wrong with the situation and it needs to change.   I feel like you can do one of two things. Either stick up for yourself more and show them that you won't take any of their shit, or cut them out. I've had friends like this as well. We were good buddies in highschool, and chirped each other all the time as most kids do. But the chirping got worse until it wasn't really chirping anymore, but disrespect. I stuck around for a while, thinking it was my fault that I wasn't cool or witty enough to be around them, and became depressed. It wasn't until I stopped hanging around with them and smoking weed that I realized it wasn't me; they just weren't the sort of people I could be friends with.  I didn't cut them out completely, but I started hanging out with other people slowly at first, then transitioned out of their circle. I still see them from time to time and we have a laugh, but I'm wary of getting too close to them again.  Anyways, what I'm trying to say is it's probably a good idea to branch out a little bit and meet some new people. Trying finding something that makes you happy and go for it, and hopefully you'll meet people you can actually connect with."
socialskills,3dvmil,SoquidSnake,4,Mon Jul 20 01:01:00 2015 UTC,"I had friends like that in high school.  People like that are toxic, and it's a problem with them, not you.  Them saying ""It's just a joke"" just shows that they are completely blind to the way they affect you, and can't be relied on to be empathetic friends.  They are loading you up with a whole fucking pile of incorrect, hateful beliefs, to the point that you are hating yourself.  It doesn't matter why they are doing this.  Maybe they are dealing with their own self loathing, who knows.  I cut those friends out of my life, and I'm glad I did.  I decided that I was out of patience for people who treated me that way.  Whatever their reason, I wanted their presence entirely out of my life.  It was a great decision.  It opened my life up to better, kinder friends, an incredible mentor, and a happy way of living.  You are not worthless or a failure.  That's just a shitty belief someone gave you, because someone else in society gave it to them.  Do yourself a huge favor and give yourself space from people who make you feel bad about yourself."
socialskills,3dvmil,SirDucky,3,Mon Jul 20 03:02:46 2015 UTC,"I want to cut them out but then I'd be all alone.   I find female ""friendship"" terrifying.  Men are friends with people they like and do not want to hurt.  Men expect their friends to be good to them, and if they aren't then they aren't friends.  If a friend betrays you, then they aren't a friend anymore.  When there aren't any true friends around, a man should have no friends, because it is better to have no friends than to have false friends.  Why not live by this credo and be friendless for a while until you find friends who are good to you?"
socialskills,3dvmil,ElMelonTerrible,2,Mon Jul 20 07:01:52 2015 UTC,"These are not good people. Anyone that makes you feel shitty about yourself is not your friend. Don't ever stoop to their level. You're better than that. What you need to do is find yourself some quality individuals that genuinely care about what you have to say and don't try to put you down to make them feel better about themselves. If anything, you should feel sad for them."
socialskills,3dvmil,Sadcab,2,Mon Jul 20 05:07:48 2015 UTC,"These others have it right and these people only have the value you give them.  Fuck them, they are assholes for treating you like shit, but you don't have to be friends with them.  Don't ever let anyone make you feel like a failure, because nobody's perfect all the time, everybody fucks up at something."
socialskills,3dudne,9Mmz,24,Sun Jul 19 15:52:39 2015 UTC,I feel like it happens sometimes but I wouldn't make like a law or some shit
socialskills,3dudne,guywhodoesnothing,4,Sun Jul 19 16:27:32 2015 UTC,"The plan is more to possibly use it. To hang out with the person of interest and use friends to push things.  I feel kinda evil saying that, as if it's manipulating people socially, but I think it's a rather common and accepted thing."
socialskills,3dudne,silverskull39,9,Sun Jul 19 16:45:53 2015 UTC,"Bad idea.  As strangenchanted says, it usually happens organically in real life. Orchestrating  it is manipulative not only towards the other party, but also puts pressure on your friendships."
socialskills,3dudne,strangenchanted,7,Sun Jul 19 17:04:42 2015 UTC,"I'm fairly sure it happens organically in most cases. This idea of orchestrating it... well, it sounds like the kind of bad idea you'd get from a dumb rom-com. It's gimmicky."
socialskills,3dudne,guywhodoesnothing,4,Sun Jul 19 16:55:34 2015 UTC,"Y'all kind of veered off the original post, but I'm pretty sure the OP meant that it's easier for your friend to notice that a girl is into you."
socialskills,3dudne,strangenchanted,3,Sun Jul 19 17:02:58 2015 UTC,"I for one would not count on that, though it can certainly be a confidence booster, and sometimes that's what someone really needs."
socialskills,3dudne,silverskull39,1 point,Sun Jul 19 17:07:25 2015 UTC,"Y'all kind of veered off the original post, but I'm pretty sure the OP meant that it's easier for your friend to notice that a girl is into you.    Op explicitly mentioned using friends to push it.   The plan is more to possibly use it. To hang out with the person of interest and use friends to push things.   Emphasis mine. Maybe thats not what he meant, but its certainly what he implied. We cant respond to what he meant if what he meant isnt clear."
socialskills,3dudne,guywhodoesnothing,2,Mon Jul 20 00:02:58 2015 UTC,Whoops...
socialskills,3dudne,silverskull39,1 point,Mon Jul 20 00:21:56 2015 UTC,"Its all good, happens to the best of us."
socialskills,3dudne,Coolstorybro56,1 point,Mon Jul 20 00:42:35 2015 UTC,This exist...in junior high and occasionally high school. Or maybe 3rd grade.
socialskills,3dudne,Pointwest418,4,Sun Jul 19 17:09:39 2015 UTC,"It's not that you're more observant from the outside, but that some people are just clueless at recognizing when someone likes them"
socialskills,3dudne,chemicalvelma,1 point,Sun Jul 19 18:51:43 2015 UTC,"This doesn't necessarily answer your question, but it's relevant and interesting. I know for a fact that I rarely pick up on people trying to flirt with me, but I'm in a happy, serious relationship, so I'm not exactly looking for it haha."
socialskills,3dudne,daiz-,1 point,Sun Jul 19 18:06:49 2015 UTC,"Kinda possibly does. My ""theory"" was that it's hard to see when it's us that's in the crosshair, while friends can more easily see it. Not sure if the test had the friend part in it though.  I am really not sure where my skills are. Better at least."
socialskills,3dudne,waterflock,1 point,Sun Jul 19 18:17:37 2015 UTC,"Yes, it is something we joke about from time to time. Just because someone says it doesn't always mean they saw something you didn't. They might think they did, or are just trying to encourage you to be open to the idea, or even make you blush.  Always take it with a grain of salt."
socialskills,3dudne,FriendOfBrutus,1 point,Sun Jul 19 20:02:06 2015 UTC,"Sometimes it happens, if she (the liker) is shy and looks at you (the liked) when you don't look at her (when she's behind you, or you're much involved in some conversation and don't concentrate on her), so an outsider will see all these things. Even if she isn't shy, her behavior outside of the interactions with you can be indicative."
socialskills,3dudne,RedErin,1 point,Sun Jul 19 20:24:34 2015 UTC,"Typically the recipient of feelings doesn't notice because their natural self defense is building a case why they aren't liked. Like I said, it's self defense. Protection. You know, ""just in case"", when in reality they're being pursued or sought after."
socialskills,3dxm4n,defeatedmac,2,Mon Jul 20 11:12:20 2015 UTC,"There is a saying - ""men don't talk face to face, but shoulder to shoulder"".  What hobbies do you have? Can you do them with others? By doing things together you get closer without even talking much and you get something common to talk about as a bonus."
socialskills,3dxm4n,Master_Ort,1 point,Mon Jul 20 11:36:32 2015 UTC,"Hmm, I play lots of my main sport (team and everything) and go to the gym a 6 days a week usually. I mean, my best guy friends are just 2 good blokes that I get along with for common senses of humor and I guess just being chill with?"
socialskills,3dx5xr,ahmedsreddit,1 point,Mon Jul 20 07:17:07 2015 UTC,"if i'm in a casual setting with friends, I'm almost never ""serious"", as in I consistently (not constantly or absolutely) make jokes or talk about things in a lighthearted way.  it's key to stay pretty shallow and lighthearted when you're speaking to friends, unless either of you are talking about something remotely serious (which you should be able to pick up on)!   also, ya, it's not fun to always joke around things, but approaching casual conversations with a sense of fun should be the norm."
socialskills,3dx082,wishIknewwho,3,Mon Jul 20 06:02:25 2015 UTC,"You're not overthinking things. It's a good question. I think gratitude is always the correct response to any compliment, unless it's backhanded."
socialskills,3dx082,icanthinksometimes,3,Mon Jul 20 06:05:08 2015 UTC,"In all of those cases, what is being overtly complimented is your taste.  Depending on the person who is complimenting you and the cost of the item mentioned, they might also be complimenting you on your ability to afford it, but you can't call somebody on that unless they make it explicit.  In any case, there aren't very many appropriate reactions to a compliment, and the only appropriate reaction to these is to accept them.  You cannot reject these compliments as blatantly offensive, nor can you humbly decline them, because de gustibus non est disputandum.  All you can do is say thanks."
socialskills,3dx082,ElMelonTerrible,3,Mon Jul 20 06:32:41 2015 UTC,...what is being overtly complimented is your taste   Wow. I hadn't considered it from that angle.  What a great response! Thank you!
socialskills,3dx082,Cdiddydee,1 point,Mon Jul 20 07:33:58 2015 UTC,"A simple ""thank you"" accompanied with smile is always an appropriate response to a compliment"
socialskills,3du357,nobuu30,7,Sun Jul 19 14:02:23 2015 UTC,"Think about the three topics you are most knowledgable about and would enjoy discussing with someone. Just start talking about it! The worst they can do is tell you to stop, but most likely they won't, and may appreciate the knowledge"
socialskills,3du357,PM_ME_A_MONKEY,4,Sun Jul 19 16:45:44 2015 UTC,"i like video game , movie , tv show  and i play guitar"
socialskills,3du357,PM_ME_A_MONKEY,3,Sun Jul 19 16:50:35 2015 UTC,"Cool! ""What kind of movies or tv shows do you life?"" Would be a good question to ask someone. After that, just go with the flow.  If you really get lost, just make meow noises, it works for me."
socialskills,3du357,PM_ME_A_MONKEY,9,Sun Jul 19 16:54:15 2015 UTC,wow it work! i did the cat sound thing and now im the most popular guy in town . thx!
socialskills,3du357,icanthinksometimes,2,Sun Jul 19 19:58:00 2015 UTC,No problem!
socialskills,3du357,Pointwest418,2,Sun Jul 19 21:00:22 2015 UTC,"This is awesome, are you serious?"
socialskills,3du357,TDN12,4,Mon Jul 20 04:42:25 2015 UTC,"Get a hobby and make yourself more in interesting.  Take up pistol shooting, take up a sport, anything."
