socialskills,3dpm38,QuantumHumanMyAss,-11,Sat Jul 18 12:09:24 2015 UTC,"The advice IS rude. Telling someone the truth is not a bad thing. You don't have to be mean about it.  ""Hey, so I know you like asking me to hang out but when we do, I do not get any enjoyment out of the things we are doing. If you invite me to do something I like I will come but I am not going to be coming to any more things that I would not go to on my own. I don't believe you would like doing things with me if everything I asked to do with you, you didn't like or worse, hated.""  Now if the person responds in a bad way, then the bad reaction is enough reason to bail all together. If the person says, oh, ok, I get that, then things are fine and you can move forward.  I had a girl ask me to be with her. I told her no. She said why. Most people would lie. I got out paper and told her that you both need physical and mental attraction. I told her on the physical part, there are a number of good things but some things I just was not attracted to and couldn't get past. Then on the mental side I explained how we didn't jive. I explained that we make decent friends but that the topics that relate to long term relationships, we just don't get along with. I told her she shouldn't have to change her personal opinions that can't be proven wrong just to be with someone and that I wouldn't be doing that either. She understood and then we were good friends for a couple years till she decided to do something not so good that couldn't be overcome.  Lying is rude and wrong if truth is an available option. Truth can be painful but isn't rude. It is honest and real.  In addition, lying to a long term friend isn't just rude, it is a massive disservice to that person. A person cannot improve or change something if they do not first have a signal that is telling them to change it. A person with bad breath will not know until someone tells them. That someone is the person who is the thanked one. Being selfish enough to not tell them due to a likely bad first response that might upset you or make you sound mean, is just not a good thing. It is selfish. If someone isn't your enemy there is no reason to hide something that could help them. You don't have to tell them that they have to change. Just why you are doing what you are doing. It gives them an option to do what they want. They can try or not try and both things are their choice and everyone is as happy as they could be."
socialskills,3dpm38,testmypatience,26,Sat Jul 18 13:19:51 2015 UTC,"Yeah... In theory, being ""honest and real"" all the time should be the right thing to do, right?  Truth is, real life is way more complicated, and you can never foresee how your life is going to change... Closing a relationship door being so ""direct"" today could harm you in the future...  I'm not saying you have to lie. I'm saying you can be diplomatic about it."
socialskills,3dpm38,QuantumHumanMyAss,1 point,Sat Jul 18 13:34:00 2015 UTC,"Yep, but fact is that the first suggestion is more rude than anything. I myself value honesty more than someone keeping something from me. Maybe I'd be more angry if someone would tell me something like that to my face in the short-term but atleast that person was honest enough to say it directly to me, which I would probably be thankful for later."
socialskills,3dpm38,EddzifyBF,-3,Sat Jul 18 18:43:15 2015 UTC,Do you like it when someone uses politics on you?
socialskills,3dpm38,testmypatience,8,Sat Jul 18 15:26:17 2015 UTC,Yes
socialskills,3dpm38,0xff8888somniac,9,Sat Jul 18 15:49:15 2015 UTC,"That sounds a lot worse to me. Personally, if I had a friend who didn't want to be friends anymore, I would prefer they just faded away rather than telling me exactly why they didn't want to be friends. That kind of thing is pretty crushing for a person to hear."
socialskills,3dpm38,_how_now_brown_cow_,7,Sat Jul 18 14:58:23 2015 UTC,"That kind of thing is pretty crushing for a person to hear.    Ok. When your best friend of 8 years stops answering your calls and just keeps blowing you off and won't tell you why, you are going to be happier about that than if they just told you that they just don't feel like you jive anymore and what about things don't jive?  I have a feeling the majority of people would rather be told that they are not friends anymore for a certain reason vs being lied to and said that you are friends but just don't have the time to do whatever. To say otherwise is highly ingenuous."
socialskills,3dpm38,testmypatience,1 point,Sat Jul 18 15:38:44 2015 UTC,"Hey man, that sounds rough, I'm sorry that happened to you. I was in a similar situation as that but I think this advice to fade out only works if the other party can get those subtle signals and has other friends that they also occupy their time with, allowing that fade out to gracefully and mutually occur.   In the case of being best friends and being suddenly dropped, what would probably be more tactful is to start limiting contact little by little and if the other party is not fading out as well, then it has to be directly communicated that the friendship is ending. If the other party is not receiving the signals then being frank with them is a must.    Man, I was dumped by a good friend of mine several years back by her going overseas with no communication and when she came back just not really making an effort to talk to me again despite how much I reached out. I should have seen the signs much earlier but I was under the impression she would have been honest with me directly. Oh well.  It's all about context and feeling out the individual dynamics of a relationship. When subtle cues don't work to start out polite then the direct approach is a good back up."
socialskills,3dpm38,VanellopeVonSplenda,1 point,Sat Jul 18 18:21:59 2015 UTC,but I was under the impression she would have been honest with me directly
socialskills,3dpm38,testmypatience,0,Sat Jul 18 18:26:19 2015 UTC,Just my personal opinion.
socialskills,3dpm38,_how_now_brown_cow_,2,Sat Jul 18 15:48:57 2015 UTC,... What?
socialskills,3dpm38,testmypatience,1 point,Sat Jul 18 15:53:53 2015 UTC,"To answer your question: yes, but that is just my personal opinion."
socialskills,3dpm38,_how_now_brown_cow_,1 point,Sat Jul 18 15:57:51 2015 UTC,I take it you have an issue with feeling self-conscious?
socialskills,3dpm38,testmypatience,1 point,Sat Jul 18 16:53:06 2015 UTC,"I have insecurities just like anybody else, but I wouldn't call it an issue. I just would prefer not to have somebody tell me exactly why they don't like me because that would be hurtful, especially coming from a friend."
socialskills,3dpm38,_how_now_brown_cow_,3,Sat Jul 18 18:06:36 2015 UTC,"Fading out can be difficult with some people. I've been avoiding this one person, it's been like 2 years and he still texts me once a week and I never reply. He did nothing wrong, I just don't want to spend time with them or advance the friendship. It's not like we were super close friends or anything, I hung out with him like 3 times."
socialskills,3dpm38,Phase--2,3,Sat Jul 18 16:43:33 2015 UTC,"That is a real crappy thing to do to someone, especially when they've done nothing wrong."
socialskills,3dpm38,MitchellLitchi,8,Sun Jul 19 03:59:53 2015 UTC,"Look it's pretty simple. What is it you prefer doing? Ask her if she's interested in getting into that to make your friendship more interesting, or tell her that you need to be getting on with whatever activity it is that you are otherwise doing.  Just ""hanging out"" is bound to be boring. Try doing something interesting instead, and if she doesn't want to do it, just tell her that it's important enough to you that you've got to get on with it."
socialskills,3dpm38,crap_punchline,3,Sat Jul 18 16:54:39 2015 UTC,"Exactly! Everyone's reactions here are ""ignore them and make lots of excuses until they give up."" Why not find something interesting to do with them?"
socialskills,3dpm38,MitchellLitchi,5,Sat Jul 18 20:24:36 2015 UTC,"I had a friend when I was younger like this.  There was a difference in that I enjoyed this friend but she literally wanted to one-on-one hang out ALL the time and would ask after the very next free minute in my time and if that was busy the next and if that was busy , the next.  She knew my work schedule.  If I told her I had plans, she wanted in.  I liked her, a lot actually, but you can't be with one person constantly.  I finally told her I had some need for just me alone time and it was nothing personal and set a time to hang out two weeks out.  I started doing this often.  Sometimes a week out, sometimes two or three.  (Remember I enjoyed time with her) Thing is she was a one friend, one-on-one all the time person so in the 'breaks' she started clinging to-um hanging with- a work friend ALL the time.  Your friend may be this person.  I think it is being afraid to be alone so looking for a one person solution.  Even though you are bored by this girl you might try the same.  She may even do the same and grab onto another all-the-time friend. In the end we lost touch because she really could only have one friend at a time."
socialskills,3dpm38,theuntamedshrew,4,Sat Jul 18 12:10:09 2015 UTC,Tell your mates she has an upside down vagina.
socialskills,3dpm38,farkenell,5,Sat Jul 18 12:56:25 2015 UTC,"I'm shocked by the responses people are posting. I thought this subreddit was for helping people make friends, but the replies in this thread seem to suggest it is about doing whatever is convenient no matter who it hurts. Everyone seems in favor of straight up ignoring her or making wild excuses to avoid her. People are being downvoted for suggesting that you actually talk to her and tell her the truth. I guess we truly do live in a world where lying and avoiding is the acceptable way to behave rather than communicating and being honest.  Lying and ignoring is a cruel way to end a relationship. Perhaps someone would ""get the message"" if they were starting a friendship for the very first time. But after 8 years this is not just that random guy/girl you met at work or school who wants a buddy, this is someone who probably thinks of you as a good friend.  Perhaps you can reach a compromise. Tell her that you can only hang out less often, or that you are still willing to chat/text her but you aren't comfortable spending so much time together. You may feel differently in the future and want to get back together again.  Put yourself in their shoes. If someone you were good friends with just stopped talking to you one day, you wouldn't just say, ""Well, that was fun while it lasted. Who's next?"" No, you would try to find out what was going on. Eventually you would need to tell the truth, and then it would hurt more than if you just told them in the first place.  Have you considered that you may be the only friend she has? If you have plenty of friends, it may be easy to think everyone else does as well, and there should be no problem because she still has tons of people to hang out with. If she is consistently asking you to hang out and not allowing the relationship to fade away, this is probably not the case for her.  People who lie, ignore me, and/or make excuses are a huge problem for me because I do start to suspect it, but I can't tell if it's my social anxiety/paranoia getting the better of me or if they are legitimately unavailable. Making friends is enough of a struggle already without having to deal with this shit, so it's better if everyone just communicates properly."
socialskills,3dpm38,MitchellLitchi,3,Sun Jul 19 03:57:20 2015 UTC,"Every day, think of a reason why you can't spend time with her. Then, when she asks you, you're ready. Tell her you can't spend time with her because of reason.  I like to keep my schedule open so I would say things I might do, but you could make stuff up or actually plan things instead.  Can't do that, I'm doing this."
socialskills,3dpm38,FantasyDuellist,10,Sat Jul 18 12:23:33 2015 UTC,"If she always wants to hang out then you need to shut her down fast.  If you're really bad at confrontation, it's up to you to be honest and say that you don't really feel like it (to which she's going to question and you have to answer awkwardly), or lie and say that you got into a new hobby/met other people/you already set up a day with some chick/friends on the internet to play vidya games together/you got work to do.  Just remember that this is basically your chance to get better at confrontation, because this is a much needed life skill. Otherwise people are going to just push you around."
socialskills,3dpm38,FaKeShAdOw,8,Sat Jul 18 05:45:35 2015 UTC,"What kind of thing am I supposed to say though? I feel like there's no mature way to approach this. Like,  ""Look, I don't want to hang out with you anymore because I think it is a boring thing to do. Also, please stop talking to me. Bye (forever)""  Well i wouldn't actually phrase it quite like that but I think that is the jist of anything i'd say if the point is to be honest.  I guess i am wondering, is there any way of doing it where it won't result in her crying"
socialskills,3dpm38,NorthKoreanDictator_,7,Sat Jul 18 08:43:58 2015 UTC,"Just tell her you are busy whenever she asks to see you, and use only short replies when she messages you something.  There is no real need to outright say that you find her boring. That is kind of rude."
socialskills,3dpm38,FaKeShAdOw,5,Sat Jul 18 09:07:14 2015 UTC,"Is she really that needy that she'll start crying like that?  Yo, this girl needs some hobbies that isn't hanging out with you, seriously. Maybe you should let her know this in a tactful way, as a caring person. Even she should grab some self-awareness at some point and realize that you two don't make for good friends anyway.  There's plenty of ""mature"" ways to deal with this, including being completely completely honest about why you don't wanna hang out anymore. But mature doesn't mean that it will avoid conflict. If all of them leads into crying then there's nothing you can do about that.   Also, if she keeps texting you or facebook-chatting you up, you DON'T have to keep answering. Just don't answer so much and you need to learn how to say 'no I'm not up to hanging out today' when she corners you. Don't be a people-pleaser at all if it just makes you feel like shit. She's not in control of your physical body anyway, so just don't even leave the house if you don't feel like it, lol. That's your right. You can even say something direct like ""I don't wanna leave the house today, this is a me-day"" for like 3 months if you want, who cares.   But it's up to you to add that last bit:  ""No, I'm not up to hanging out today, IDK when I ever will be honestly, I've been feeling like shit"" or ""I'm planning on hanging out with others today""  to make some avoidant shit up like everyone else,  or  ""No I'm not up to hanging out today because I don't think we're a good match friendshipwise, I'm sorry""  or you don't even have to owe her an explanation."
socialskills,3dpm38,no-mad,1 point,Sat Jul 18 08:49:49 2015 UTC,This will come up in your life over and over again. The better question to ask is. Why am I bored? Why am I not interested in this human being in front of me? What could we do that is not boring? These are better questions to ask. It is easy to blame the other person for the situation. She maybe as bored as you are. If you can answer some of these questions you will know what to do.
socialskills,3dpm38,ktappe,1 point,Sat Jul 18 14:53:23 2015 UTC,"""Sorry, I'm not up for hanging out this week. I need some 'me time'.""  Then the next week tell her you're busy with with work.  The next week tell her you're visiting your aunt."
socialskills,3dpm38,whiptheria,2,Sat Jul 18 18:20:52 2015 UTC,Introduce her to other people. Maybe she'll click with a new person and stop relying on you for friendship.
socialskills,3dpm38,dbzgtfan4ever,2,Sat Jul 18 14:10:48 2015 UTC,"Seems like the general advice here is to just stop talking to her and slowly fade out of your life. I am just wondering if there might be a different tactic you can take. Have you tried to liven things up to your liking? For example, if she talks about boyfriend and you find that boring, you can try changing the topic to something you find interesting. Or you can plan different activities that you do not find boring--watching movies, mini golf, video games. 8 years is a long time to be friends with someone, so maybe consider salvaging the relationship first rather than throwing it away so quickly. Take some responsibility for having boring hangouts and try to make them fun first."
socialskills,3dpm38,ThinkingTooHardAbouT,2,Sat Jul 18 15:13:36 2015 UTC,"Start filling your calendar with other stuff. That way you are doing things that are NOT a waste of your time, and you have a legitimate reason to turn her down."
socialskills,3dpm38,almondbutter1,2,Sat Jul 18 18:11:17 2015 UTC,Anyone else only here to make sure this thread isn't about them?
socialskills,3dpm38,22catch,3,Sat Jul 18 19:54:54 2015 UTC,Just keep on replying late. Like days late. And then apologise with lame reasons. And repeat the same lame reasons again when you reply late/decline invitations. Surely she'll get the message.
socialskills,3dpm38,Endigi,3,Sat Jul 18 11:57:20 2015 UTC,"Maybe make it so she comes to you, and you do what you do, but she's just there and if she doesn't like it tough? Like don't put any effort into going to her place / a place with her. Be like ""You can come over but I'm basically ignoring you while you're here"" god that sounds terrible... I dunno some people need somebody, the world is a lonely lonely place."
socialskills,3dpm38,greenSharkk,1 point,Sat Jul 18 08:13:26 2015 UTC,"I mean, that's what I have been doing for a long time. Haha"
socialskills,3dpm38,MitchellLitchi,3,Sat Jul 18 08:39:35 2015 UTC,"OP just be honest to your friend. Tell her everything, if you beat around the bush you may escape the friendship but she'll still continue to be the boring type and her future relationships may suffer still.  Since you've been friends so long, you can definitely communicate freely to her. Regardless of her reaction, if she knows the problem she can work on her character when meeting new people. For an 8 year old friendship that hasn't gone south, the least you could do is set her in the direction towards being a more entertaining person. (No one wants to be boring, especially boring and not know everyone dreads their company.)  Good luck."
socialskills,3dpm38,utterlygodless,1 point,Sat Jul 18 14:24:27 2015 UTC,I can't believe you're being downvoted for this. We truly do live in a world where lying and avoiding is the acceptable way to behave rather than communicating and being honest.
socialskills,3dpm38,herewegoaga1n,1 point,Sat Jul 18 20:04:00 2015 UTC,This is why Facebook still exists...
socialskills,3dpm38,speelabeep,1 point,Sat Jul 18 10:49:52 2015 UTC,"The slow fade, the ""I'm busy""..."
socialskills,3dpm38,dewarsmaduro,1 point,Sat Jul 18 14:52:24 2015 UTC,I suggest following this brief video tutorial
socialskills,3dpm38,EchoRadius,1 point,Sat Jul 18 17:02:01 2015 UTC,"In as much as you have been friends for 8 years and she is not a negative personality, I might take a more subtle approach. There does not appear to be a rush. Slowly but surely ween her from your company. Be unavailable on a regular basis. After awhile, even a cat will learn."
socialskills,3dpm38,guinader,0,Sat Jul 18 20:08:54 2015 UTC,"In my case, my friend was a stoner, and like all stoners they never really 'grow'. Sounds mean, but it's the truth. And by stoner, I mean straight up morning, after work (sometimes during), before bed.. every. Fucking. Day.  We happened to be in a band together. I got asked to join a different group (cause I'm the only one that practices of course), so I did. I regretted it for a long time and felt guilty. But you know what... As a musician, my skill skyrocketed in just a few months being around driven people.  Anyways, it's true... If you want to be a better person, you have to be around better people. I've been following that, and everything from attitude to relationships have gotten SO much better.  My friend? He moved to Colorado recently, and I think he's happier than ever.. so it all worked out for the best, for everyone."
socialskills,3dpm38,rattamahatta,1 point,Sat Jul 18 22:03:55 2015 UTC,I tired telling someone truths. It backfired I think gassing away is a better solution
socialskills,3dsn2p,Alkraizer,1 point,Sun Jul 19 01:51:54 2015 UTC,Wow sounds like your reading a insert from my life! I have gone through similar situations I'm at the point now where instead of hoping of getting back out into the social scene I'm happier just being alone with no worries. I don't feel lonely any longer.
socialskills,3dskkt,Eternalmars,1 point,Sun Jul 19 01:25:06 2015 UTC,"Well...if you feel lonely i would just try and text them see where that goes...but like you said that you ""don't like them enough"" then...can you go to places to meet new people? Maybe go to a place where you can find people with similar interests?   There's nothing wrong with you really...I guess you like to be more independent? But then again if you're lonely...id try to get out of the comfort zone and meet new people or text your current friends...i guess the friends that you don't like enough to hang out with are more like ""acquaintances"""
socialskills,3dskkt,Theaty,2,Sun Jul 19 01:30:11 2015 UTC,"Thanks, will try. Never really got along with guys much, mostly because of my personality (cocky,like to lead,impulsive). I've had a few, but it's mostly girls I get along with. But I'm never friends with these girls since most want to date or hook me up with a friend.   Thanks for the advice, gonna see if I can meet guys with similar interest."
socialskills,3dskkt,Theaty,1 point,Sun Jul 19 03:04:33 2015 UTC,"if you get along girls more and they would want to hook you up with a friend then be open to it ! :) maybe that friend is someone you'd enjoy, if not then just move on from that :D"
socialskills,3dskkt,Flmir,1 point,Sun Jul 19 04:51:31 2015 UTC,"Yeah, I think you're just not meeting the right people for you.  You can sometimes get stuck in groups/environments with people that you have absolutely no interest in, and that's okay!  As long as you aren't rude and are friendly to them, you don't have to force yourself to enjoy them.  People you are truly interested can be far and few between, so just keep looking!"
socialskills,3dskkt,dudewheresmypen,1 point,Sun Jul 19 04:06:15 2015 UTC,"Sounds like me too. Perhaps you're just not into texting or have similar interests as them. I used to think ""connecting with someone"" was some magical spark or something, and that I never experienced it. But it's only a linguistic expression anyway. Maybe ""connecting"" is simply being mutually happy with each other's company! You just haven't met people you can share that with yet. Nothing wrong with that :)"
socialskills,3dskkt,ElMelonTerrible,1 point,Sun Jul 19 07:22:51 2015 UTC,"Are you indifferent to yourself?  Your ability to relate to other people tends to be limited to how well you relate to yourself.  People who hate themselves hate other people, people who are apathetic about themselves are apathetic to other people, etc."
socialskills,3dsujt,tylertime98,1 point,Sun Jul 19 03:10:38 2015 UTC,Let your guard down and don't take things personal.
socialskills,3dsujt,TheCoolGuitarist,1 point,Sun Jul 19 03:57:01 2015 UTC,Just take the conversation as it comes. Don't start thinking.. Open yourself up.
socialskills,3dshs9,flyingmeowme,2,Sun Jul 19 00:57:10 2015 UTC,"You're 26 now, and this was in high school- why do you have to see her at all? Are you in the same social circles?  Don't say ""I should do this"" because you think that's what is expected, no one expects anything out of you. You can do whatever you want; if you know how you felt/feel about her, there's no reason to force yourself to keep bad company."
socialskills,3dshs9,Flmir,1 point,Sun Jul 19 04:08:58 2015 UTC,Hmm. I guess you're right :) I just thought maybe I can be friends with everyone. Hahaha.
socialskills,3dshs9,Flmir,1 point,Sun Jul 19 04:20:03 2015 UTC,"You can certainly be friendly, and if you really think there's a connection there and this person could be a great addition to your life, go for it! Just don't feel you're required to do something because it's the ""mature"" thing to do."
socialskills,3dshs9,indirectlysubtle,1 point,Sun Jul 19 04:28:06 2015 UTC,Ok. Thanks!! :D
socialskills,3dryfb,9Mmz,1 point,Sat Jul 18 21:51:07 2015 UTC,People generally want to respond with their own information so it's good to pause every now and then to give them an edge to come into the conversation.   You also have to know who you're talking to. Could be they have absolutely no interest in what you're saying and would rather be playing Tetris on their laptop before their lunch break is over. They may be interested but know nothing about what you're saying and have no chance to ask the relevant question because you're talking a lot.
