socialskills,3dmb1x,catfield,28,Fri Jul 17 15:52:46 2015 UTC,"Because girl. A lot of people here don't pick up on social things that come naturally to us, I try not to judge and just offer advice."
socialskills,3dmb1x,dhockey63,18,Fri Jul 17 19:00:58 2015 UTC,"""I try not to judge, and just offer advice.""  From the bottom of my heart, thank you."
socialskills,3dmb1x,wh0dareswins,5,Fri Jul 17 19:35:04 2015 UTC,"Because girl. OMG. WHAT DO I DO? SHE IS A SHE. IF I TOUCH HER IS SOMEONE GOING TO THINK I AM CHALLENGING HIS DOMINANCE? IF I GO IN FOR A HUG, WHAT IF SHE PULLS BACK? IF WE DO HUG, HER BREASTS MIGHT TOUCH ME AND THEN IT'S SEXUAL ASSAULT. OR I MIGHT GET A BONER. OKAY. GOING FOR HUG. BUT HOW LONG TO HOLD? IF TOO SHORT, IT MIGHT COME OFF AS REJECTION. IF TOO LONG, IT MIGHT BE CREEPY. OH NOES - I'VE CLOSED ONE QUARTER OF THE DISTANCE AND STOPPED. SAY SOMETHING. QUICK! ""THANK YOU FOR DINNER. IT WAS BREASTS.""  FTFY."
socialskills,3dmb1x,TemptThePuffin,3,Fri Jul 17 23:00:02 2015 UTC,I think that was said in jest but that is surprisingly accurate for what many people on this sub think.
socialskills,3dmb1x,Ndvorsky,2,Sat Jul 18 03:26:48 2015 UTC,I think that was said in jest but that is surprisingly accurate for what many people on this sub think. Advice needs to be surprisingly basic because some people literally can't understand the most basic of things. It's a bit like teaching grandma to play halo and she can't even find the x button.
socialskills,3dmb1x,Ndvorsky,2,Sat Jul 18 03:35:03 2015 UTC,"IIRC, that was said in Atlanta."
socialskills,3dmb1x,TemptThePuffin,2,Sat Jul 18 04:37:00 2015 UTC,What's in Atlanta?
socialskills,3dmb1x,Ndvorsky,1 point,Sun Jul 19 19:30:00 2015 UTC,"That was just wordplay.   I think that was said in jest   vs.   IIRC, that was said in Atlanta."
socialskills,3dmb1x,TemptThePuffin,2,Mon Jul 20 00:33:33 2015 UTC,you're awesome.
socialskills,3dmb1x,DLXII,4,Fri Jul 17 22:31:12 2015 UTC,"With my friend and his wife, I'd just pat my friend on the back and tell them something like ""See you around!"" and then look over at the wife (still kind of new to my circle of friends) and tell her ""Thanks for joining us"" or something like that. It's not awkward to not make physical contact. In fact, it's probably more likely to be awkward and overly formal (at least in my circle of friends.)"
socialskills,3dmb1x,Emperor_of_Cats,27,Fri Jul 17 15:19:24 2015 UTC,Stick your tongue as far down her throat as it will go
socialskills,3dmb1x,PM_ME_A_MONKEY,3,Fri Jul 17 15:56:09 2015 UTC,Have sex with her infront of your friend
socialskills,3dmb1x,GrandFappy,11,Fri Jul 17 22:52:48 2015 UTC,Touch her penis a little to show your appreciation.
socialskills,3dmb1x,OneFanFare,2,Fri Jul 17 17:00:32 2015 UTC,I came searching for this comment. Thanks for the laugh.
socialskills,3dmb1x,freakoffthewall,2,Fri Jul 17 20:52:40 2015 UTC,Happy to oblige.
socialskills,3dmb1x,PM_ME_A_MONKEY,4,Fri Jul 17 21:02:49 2015 UTC,"Thank you, I can't stress this more...  Also, it's shows extra appreciation and respect when you give your friends wife a quick squeeze on her left butt cheek... Its common knowledge. It's no different than a fist bump..."
socialskills,3dmb1x,overused_ellipsis,3,Fri Jul 17 19:30:14 2015 UTC,"hug females, handshake or hug males"
socialskills,3dmb1x,chachasir,2,Fri Jul 17 19:20:39 2015 UTC,Handshake? Do you honestly handshake your friends?
socialskills,3dmb1x,PersonOfInternets,3,Fri Jul 17 23:10:08 2015 UTC,"Why not? Of course it depends on where you live. We usually handshake when meeting and handshake when leaving. Not like a business meeting, though. More like, you know, friendly. I even handshake my father and grandfather.  I'm from Hungary, but I know they don't do this in Western Europe so much, for example, and handshake is more like a one-time thing for the first meeting."
socialskills,3dmb1x,SadistNirvana,1 point,Sat Jul 18 12:04:39 2015 UTC,"Absolutely, me too. The half handshake-hug is timeless"
socialskills,3dmb1x,chachasir,3,Tue Jul 21 13:51:30 2015 UTC,"Just say hi, if they're the hugging type the side hug is usually acceptable."
socialskills,3dmb1x,teejaded,2,Fri Jul 17 17:25:08 2015 UTC,"Say hi, smile, and give her a casual hug. You know, the one arm hug. Don't wrap both arms around her as that would be weird..  Only hug her if you don't have to go out of your way for it though. Like if you're 10ft away from her, don't walk up and hug her"
socialskills,3dmb1x,dhockey63,1 point,Fri Jul 17 18:59:22 2015 UTC,"""Alright, have a good night. Take care."" Smile and nod"
socialskills,3dmb1x,DethdayToad,1 point,Fri Jul 17 19:22:10 2015 UTC,I hug girlfriends  and shake hands/five/fist bump with guy friends.   I'll usually hug a girl as a greeting after 3-4 times meeting her. Give her a hug.   I have yet to meet someone who gets all awkward from a hug.
socialskills,3dmb1x,StopTop,1 point,Fri Jul 17 22:22:07 2015 UTC,"Is it only awkward because you think its awkward? Could you thinking its awkward actually make it awkward?  A simple ""cya <name>"" should do just fine I think. Likewise when saying hello."
socialskills,3dmb1x,JohnEbin,1 point,Sat Jul 18 00:02:00 2015 UTC,"If you want to hug, start the action of hugging (i.e., raising your arms) and see how she reacts. If she does not reciprocate, scratch your head. It should be fluid and you should not have to think about--that's when it gets a little awkward (but it is still salvageable--no need to overthink it)."
socialskills,3dmb1x,dbzgtfan4ever,-4,Sat Jul 18 00:02:00 2015 UTC,"A peck on  the  cheek (just go in for it, it feels natural to the recipient), and say ""lovely to see  you""  Source: I'm a shy female but people do this to me and  it's ok"
socialskills,3dmb1x,squishymarshmallows,30,Fri Jul 17 14:53:45 2015 UTC,"Maybe it's a cultural thing, but I really don't see this at all in America."
socialskills,3dmb1x,Emperor_of_Cats,2,Fri Jul 17 15:12:28 2015 UTC,im from los angeles and its really uncommon there but i went to a bqq in jersey last weekend and three girls peck on the cheek when i said goodbye in a platonic way.
socialskills,3dmb1x,espeebz,3,Fri Jul 17 16:28:20 2015 UTC,"Yeah it's really common in Italy (double peck on cheeks). Lots of Italians in Jersey, so I'm sure it's common all around there."
socialskills,3dmb1x,MakesTooMuchSense,2,Fri Jul 17 18:19:17 2015 UTC,"I think it depends on where you're from and the etiquette in that area.  Where I am it is commonplace to greet women with a kiss on the cheek, both for men and women.  It is more of a touching cheeks together simultaneously kissing than a full on smooch on their cheek."
socialskills,3dmb1x,laukkanen,1 point,Fri Jul 17 17:56:36 2015 UTC,"That's not an American thing really though, never seen a guy give his friend's girlfriend a peck on the cheek here."
socialskills,3dmb1x,dhockey63,1 point,Fri Jul 17 19:03:31 2015 UTC,"I see it in the States as a part of a goodbye partial hug. Basically more cheeks touching, but the same idea."
socialskills,3dmb1x,elkanor,-4,Sat Jul 18 04:13:04 2015 UTC,"Offer your hand in a friendly, warm way, and do the move that's like taking a lady's hand to lift it to kiss it, but you don't lift or kiss. Do not shake her hand, only take it in your hand for a moment.  Like this.   As you do that, begin the farewell phrase (""Great to see you again."" ""Take care."" etc) with a warm, gentle, genuine smile without showing teeth. If that feels too reserved, place your other hand gently and briefly on top of hers to show some increased sincerity. Let go with both hands gently and simultaneously. Maintain the warm, no-teeth smile until they exit."
socialskills,3dmb1x,OverKel,7,Fri Jul 17 16:03:23 2015 UTC,This is way too intense and formal.
socialskills,3dmb1x,AltPerspective,1 point,Fri Jul 17 19:12:18 2015 UTC,"Maybe I came off too technical. This is what I do as a failsafe if not sure what else to do, but I only mean it as a structural basis of what to do if not sure otherwise. I used to DJ nightclubs in Austin and San Antonio, Texas and gained my social chops through that, so I'm a pretty relaxed guy and can handle lots of personality types.  In any case, I don't mean it as an absolute script, but if I'm around people I don't know and I'm not sure what they're okay with, I do roughly this in a relaxed way and it comes off great. It's tuned to my mannerisms, so maybe that's another ""it depends"" facet of all this."
socialskills,3dmb1x,OverKel,1 point,Sat Jul 18 19:01:06 2015 UTC,Seconded.
socialskills,3dmb1x,epic93,1 point,Fri Jul 17 19:48:24 2015 UTC,"Hard to tell, but you might come off as a serial killer."
socialskills,3dogfy,social_fail,1 point,Fri Jul 17 23:01:06 2015 UTC,"First of all do a reality check.  Does your job require you to talk to people,  especially clients.  If not,  then there is no reason to think they are regretting your hire.    Then there is the solution.  I would hit this on all possible fronts.  If you can afford get counselling.  They are likely to be able to give you some tools to help you feel more confident. If you can't afford counselling,  check out your local colleges. If they offer a psych degree they may have cheap counselling available.  Otherwise look into things like 12 step programs.  A place to take the garbage in your head and dump it will greatly telp how you think.  Adult children of Alcoholics changed my life.    My wife and I have recently started attending toastmasters.  This is a great place to practice public speaking.  I have found my general confidence in speaking has greatly increased.  And at least at our club,  everyone who attends is reasonably socially awkward.  That is why they are there,    Start exercising.  Hormones released when exercising will help you feel better about your self.  This can be as simple as a walk around the block before dinner each night or before work in the morning.    Start dressing better.  Start haunting /r/malefashionadvice.  This doesn't have to cost a fortune.  Start checking out thrift shops.  Mostly they are full of clapped out junk but you can learn to spot good quality stuff.  Start by going to a good quality men's store and get measured.  Once you know your size,  the rest is a lot easier.    Eat better.  Improve your diet.  There are strong correlations between poor diet and depression.  It is an easy fix.  You don't have to go full vegan.  Just remove fast food and sugar from your diet.    Join some sort of voluntary organisation.  Get passionate about making the world a better place.  That will give you interesting things to talk about.   That should be enough to keep you busy for a little while.    Oh,  and check out a podcast called ""the art of charm""  tons of guests that can assist you with your challenges."
socialskills,3doksx,DickButtV2,4,Fri Jul 17 23:39:36 2015 UTC,"I personally cannot handle parties for too long because they drain me out, so my solution was: I go for an hour or two and leave but I let the people who need to know such as host and friends, that I cannot stay for long ahead of time. This has worked flawlessly for me. I give it all I got for an hour or two like Im an extrovert, mingle, then I head home to recharge.  It really helps with feeling like you're not going to die because you know you'll be gone in an hour or two.  The only time I broke that rule is when I was talking to a girl at a party"
socialskills,3doksx,i_yell_things,1 point,Sat Jul 18 00:16:58 2015 UTC,"Don't worry about your other coworkers as their heads will be in a different gear once they're at the party. I mean, socializing is what parties are for, right? So whether or not you'd like to socialize with them, it doesn't matter. They won't notice if ever you're uncomfortable around them.  You can, as i_yell_things said, inform the host ahead of time that you have to leave early, and that would be a good thing as it sets expectations. Also, as a follow-up, you can opt to tell the host and/or the person who invited you that you have to go ahead, and you never know, you might just get last minute conversations that will never end. At least, that's what I've experienced."
socialskills,3dowax,rednotgreen,1 point,Sat Jul 18 01:24:21 2015 UTC,"Try. And try again. Think of every possible interaction as a once a lifetime chance to spemd a few minutes with someone. Everyone has great lifestories - you and everyone you meet.   Sometimes it's hard to ask the first question, but just try. Pick something you could just try to find out, like ""would you know.. Where room 634/ a USPS mailbox/a bus stop is? Where I could get some lunch around here?""   Once you get started into the habit of asking random people, you can easily expand. You could e.g. ask someone for a recommendation where to find some clothes for a party (""I thought you might know where one could get some clothes for a party.."" As that implies the person has a good tadte in clothing).  You could ask someone what kind of sports they like to do (if they have an air of sportiness, good concentration skills, an open mind and confidence). Whatever sports it is, if you are unfamiliar with it but it sounds interesting, you could ask for advice for a beginner; how to get started, if ey have any tips (everyone loves feeling they are experts).  And ask the waiter, barista or the cashier too. How was your day? Any weekend plans? While you run your errands, you might get a nice 2-3 minutes of simple chitchat where neither of you have to reveal anything deeply personal to each other but can still have a nice chat that makes you feel good (and makes the next interactions with anyone else easier).  Also a tip for an easy chat: dog owners. Say hi to the friendly looking dogs ""hi puppy!""). Ask the owner if they seem friendly. Most people love their pets and are happy to talk about them for a few minutes with someone their pet likes. And pets are often easier to read than humans."
socialskills,3dowax,Unuhi,2,Sat Jul 18 02:35:10 2015 UTC,I don't want to sound ignorant or anything but the community college I go to doesn't have people I want as friends. I'm not into drinking and would rather go for a walk than to a house party.
socialskills,3dowax,Unuhi,1 point,Sat Jul 18 04:30:58 2015 UTC,"Then go for a walk. You'll see people while walking too. :) When I studied, I used to hang out with people usually unrelated to what I studied. With many I didn't even have a comfortable common language with. Yet somehow we managed to always talk about our daily lives and learn what something or other would be called in one language or other. If I drank, I could only afford one drink per night (student budget). So plenty of chat per amount of sipping."
socialskills,3dowax,Earthbounded,1 point,Sat Jul 18 04:39:15 2015 UTC,"Possibly try to join some organizations on campus? For example, a community service club like Circle K is a good start!"
socialskills,3dowax,Wao_alien,1 point,Sat Jul 18 07:55:48 2015 UTC,"If she is making excuses on multiple occasions maybe it really wasn't meant to happen (You could ask and get it straight out). There's nothing wrong with that, it's just right now you are looking for that someone and she has your attention. If you wait around doing new things, going places with friends and stuff like that you will broaden your horizons and it's likely you might find someone else."
socialskills,3dowax,LordPorker,0,Sat Jul 18 18:36:30 2015 UTC,Get a dog.
socialskills,3do8xd,cakecakecakey,2,Fri Jul 17 21:58:25 2015 UTC,"When you start community college, talk to people as often as you can. College is an excellent place to meet new people. It won't be hard: everyone wants to make new friends in college. Don't be so hard on yourself. It's OK to be quiet and shy. You might want to talk to a doctor or a therapist about your anxiety."
socialskills,3do8xd,sectb,2,Fri Jul 17 23:58:08 2015 UTC,"Also, there's nothing wrong about being quiet. Some people are quiet, some aren't, and that doesn't mean everyone needs to be the same.   A close friend of mine was also very quiet, like I didn't know what he was thinking, and I kept bugging him about it, but then I realized that it wasn't him who needs to be more interactive, it was me who needed to be more respective of who he is, you know?   I've also met a lot of other people who weren't ""talkative"" and they were fine. I mean, I left them alone and gave them the space that I believe they deserved, and whenever they reached out to me to talk, I just listened.  So I guess my point is, be comfortable in your being quiet. There's nothing wrong with it. People are different and some might prefer the opposite of what you tend to be but that shouldn't bother you at all. You'll find friends regardless. :)"
socialskills,3do8xd,navi-thejedimaster,1 point,Sat Jul 18 16:03:34 2015 UTC,MDMA?
socialskills,3dmy1m,wellgolly,8,Fri Jul 17 16:03:33 2015 UTC,"Eh. I'm kind of the same way, but I really don't let it get to me as much as you are, apparently. I have the reputation of being on-time 100% of the time if we are meeting somewhere. I'm super reliable when it comes to favours, helping out if they need anything. If they need emotional support, I'm there.  However, I also have the reputation of being completely and utterly unreliable when it comes to texting unless it's something super important. Why? Because I don't like texting. I really don't like texting and I let people know that I don't like texting. Most are generally understanding because I make up for it in other ways.  In your case? Let people know you suck at texting but try to make up for it in other ways. And, honestly, I don't think anybody really cares if you're a good texter or not."
socialskills,3dmy1m,Lord_Cornwallis,1 point,Fri Jul 17 16:38:58 2015 UTC,"Good point! I'm pretty open about being shit at text, but it's almost exclusively all I have these days, due to the issue of distance. Maybe insisting on friends and family actually calling is the way to go."
socialskills,3dmy1m,59763,2,Fri Jul 17 16:52:34 2015 UTC,"It seems like texting and texting back isn't that important to you. If you really don't want to make the effort, which if you did would prevent hurting people's feelings or offending them, try to make it up in other ways like Lord_Cornwallis says."
socialskills,3dmy1m,MrSleepyhead,1 point,Fri Jul 17 16:48:02 2015 UTC,"It's not so much effort, it just wigs me out like nobody's business. Having the conversation not happen in real time is just the worst - you have infinite time to second-guess yourself until something happens that requires your attention.  Making it up in other ways is some solid advice, though, thanks. :]"
socialskills,3dkpfm,yeeeehawwww,26,Fri Jul 17 01:30:09 2015 UTC,"Today I was at the gym. I overheard a conversation:   Guy 1: hey! I was thinking maybe we can do something outside of the gym sometime. Like watch a movie, or just hang out, go hike.    Guy 2: yeah, ok. Sounds cool.  Guy 1: yeah, it'll be fun. You guys can come over my place.    Guy 2: can I bring my gf?    Guy 1: yeah!    So in retrospect, I think these guys met at the gym or some sort, and go to the gym together since they can have a spot. But it can be as cool as you bring it up to be :)"
socialskills,3dkpfm,_wander,2,Fri Jul 17 07:55:50 2015 UTC,"That's actually really sweet, you just witnessed a friendship blossoming."
socialskills,3dkpfm,ShaBoomShaBoom,2,Fri Jul 17 21:00:24 2015 UTC,This makes me happy
socialskills,3dkpfm,save_the_pigs,7,Fri Jul 17 23:48:11 2015 UTC,"I recently started working a part time retail job so I am in a similar situation to you. The thing I noticed when it came to getting to know my co-workers was that I get along with and am much more comfortable around the people that are more of the outgoing type. Meaning they say whatever is on their mind, even if it is completely random and not related to the work. Whenever they would start talking about these random topics it would make me laugh and make me feel much more relaxed. As a result of this I opened up much more easily to these people because they 'allowed' those types of conversations to happen. I could have much deeper conversations than just the typical small talk or surface level types of conversations with them.  So I started doing the same thing myself when I would meet someone new that I hadn't worked with before and it helped so much. The sooner you start talking about 'random' topics with a person, the much easier it is to relate to them and to see how they view the world. One thing to keep in mind is that you are not going to get along with everybody. A lot (not always, but definitely some) of people will not like you and won't give you the time of day. This is the case for me also, there are some people where we literally just exchange ""Hello"" and that's it. And that's ok.  I guess the TL;DR version of this is be quick at talking about random things, be the person that starts those types of conversations so people know you can have fun and talk openly about whatever it is that's on your mind."
socialskills,3dkpfm,THROW_DIABETES_AT_U,5,Fri Jul 17 14:27:01 2015 UTC,"I find going out and doing something to strengthen a bond. I have a big group of friends, but some of them I am not nearly as close to as the others. One girl in particular, I really enjoyed talking to, but we just never were best buds. So her and I just said ""let's go out one day"" and we did. At first it was weird being one on one, but then it became really fun. All we did was grab sushi, but after that experience the bond strengthened and it lead to ""hey remember when we grabbed sushi and ______ happened"" Life experiences together make stronger friends. Sometimes bad times, like getting lost or being late to an event, end up being the stories that are brought up in a better light later on.   Now this girl and I are extremely close.  Another way I find to strenthen bonds is just by being open. I just started a new job a few weeks ago and the two guys I work in the same room with are very chill. It still felt weird because they knew each other longer, but I talked about myself or things that bugged me that day or personal things and cracked jokes and now we're close. We also grabbed drinks after work a few times and the dynamic of the room feels equal. We all equally enjoy talking to each other. So sometimes just being honest and open and vulnerable helps as well.  Good luck, hope this helps and keep us updated!  :)"
socialskills,3dkpfm,pizzafest,7,Fri Jul 17 15:11:46 2015 UTC,"I've always found concerts to be a good bond-deepening exercise. it's a shared interest of the music and hopefully the show is good. if that doesn't work, roophie them and stick them in your trunk while you drive around thinking of plan B. go get em champ! :]"
socialskills,3dkpfm,wellitsbouttime,2,Fri Jul 17 08:10:12 2015 UTC,"Hang out in a different context than when you met. And don't talk about that thing.  If you two are co-workers, meet outside of work and don't talk about it too much"
socialskills,3dkpfm,Pointwest418,1 point,Fri Jul 17 10:12:18 2015 UTC,"Hey Amigo! Deepening a relationship can be a hard thing to force. But I believe that this is because is it truly done over conversation. Sure asking good questions can be a great way to open up to someone but there comes a time in friendship it doesn't really matter what you say.   It is about how you make someone feel. You bond by creating good memories or by getting someone emotionally involved. Take a genuine interest in them, ask them to hangout, and most importantly take whatever you want them to feel (comfort, happiness, excitement, etc) and feel it yourself. Emotions are contagious and if you embrace a feeling and share how you feel through actions, they will feel it too."
socialskills,3dlef2,moremishal,3,Fri Jul 17 05:28:58 2015 UTC,"I've been living in the UK for 6 years now and I had to learn English in school, which was good, because I was in an environment where HAD to use my English, or I would pretty much have been an outcast and never have improved. So, about being self conscious, I would say just try to inject yourself in group conversations or make your own with some people. Maybe mention a few times that you know that your English isn't so good, that usually makes people very patient and they will also put more effort into understanding what you're trying to say.  As for vocabulary, if you feel like you can't really have everyday conversations, then try to pick up on other people's vocabulary.   If you want to develop a more personal, unconventional set if words, though, I guess you could read more books, or articles on the internet, then try to use some of the new words you learnt in conversations. You mentioned you do this, but try to focus on words you can implement in your 'regular vocab', so to speak.   You have nothing to worry about, though, as you probably speak English 100x better than English people speak your native language :)"
socialskills,3dlef2,degarn,2,Fri Jul 17 08:33:43 2015 UTC,"Interested in this, for a few reasons: I'm not native, I aspire to travel a lot but I don't want to get to the point where I'm travelling to learn how to improve my accent and the tonality of my voice. There are moments when I think twice about what I'm going to say that I end up saying nothing for seconds. So much for trying to be fluent...  A thing people suggested me to do was to find someone who roughly has the accent I want and try to emulate him by recording myself talking then listen how I sound like.  But in my opinion the best approach would be to get me a Skype friend whom we share common interests and call each other daily. Where do I find someone with the patience to listen to my broken accent or conscious enough that I'm ""using"" him to improve my English?  At least I managed to enrich my vocabulary by reading voraciously."
