socialskills,3e257d,AdriaaaaaaaaaN,10,Tue Jul 21 11:12:11 2015 UTC,"Say, ""Hey, how do I get in touch with you?""  99% of the time they'll give you their number.  The other 1%, they weren't comfortable for some reason, and you get an email address, which still works, and you go from there and work your way up to the phone number later, ""for convenience"" or ""if I ever need to get hold of you in a hurry.""  Saying ""How do I get in touch with you"" takes some of the pressure off because it's less direct and gives the person some options."
socialskills,3e257d,627534,9,Tue Jul 21 16:21:40 2015 UTC,Find a way to naturally flow it into whatever you're talking about if you feel weird about straight up asking.  Are you talking about a class you two share? Suggest studying and ask for their number to text for details.  Have you been talking about an interest you both have? Say you want to hit them up sometime to engage in that interest with them.
socialskills,3e257d,Ov3r9O0O,6,Tue Jul 21 12:23:39 2015 UTC,"I like to say, ""let's exchange numbers!"" rather than ""wanna give me your number?"" It sounds much less demanding IMHO."
socialskills,3e257d,TheClerksWell,3,Tue Jul 21 15:05:52 2015 UTC,"""Oh hey, do you mind giving me your number?""  Don't overthink these things, man. Nobody is gonna think you're a stalker for asking for a number. It's getting a number without asking that's stalkerish and desperate."
socialskills,3e257d,ruk_hai,3,Tue Jul 21 13:40:33 2015 UTC,"Well, I've seen people do it in a strange way that can seem like a stalker. It's all to do with body language, facial expression, the rhythm in the conversation etc. Like if you do it totally out of the flow of the conversation with a straight face with strange pose, it can be weird. But this is not something to obsess about. If a person is like that, they are like that. You can never be sure how you come across. The less you care, the better it may get (no guarantees though)."
socialskills,3e257d,waterflock,1 point,Tue Jul 21 14:38:45 2015 UTC,"Like if you do it totally out of the flow of the conversation with a straight face with strange pose, it can be weird.   That can be said for anything. Either wait for a good point in the conversation to ask for the number (i.e. if future plans get brought up tell the other person that you'd like their number so you can let them know when you have time) or if it doesn't come up naturally you can ask it at the end of the conversation (""I have to go now but I'd like to stay in touch, would you mind giving me your number?"")"
socialskills,3e257d,ruk_hai,3,Tue Jul 21 17:18:17 2015 UTC,"""Hey, I need to leave now, but we really should talk more, it's so much fun/interesting/learned so much/whatever. Let's exchange numbers!""  What seems wrong with this? Maybe you think you are below them and they do a favor to you by giving you their number. You think that they don't want to talk to you by default, so you must somehow demonstrate submission so they will throw you this bone. That's totally wrong. If you think they don't want to talk to you then don't ask for their number. Maybe you don't know yet. Then just assume they do want to talk. If not, it'll become clear. Move forward, don't excuse yourself for existing."
socialskills,3e257d,waterflock,3,Tue Jul 21 14:44:41 2015 UTC,You just ask? There isn't really much to it and if you really want a detailed explanation just use the search.
socialskills,3e257d,Zarrq,1 point,Tue Jul 21 12:19:19 2015 UTC,"The best way I find when I (F) make a new female friend is when we're in a conversation and have things in common, such as events. Going out to museums, exhibitions, clubs etc. I just say we should plan something then get their number.   If you're being friendly, have common interests and can hang out then it's quite easy"
socialskills,3e257d,scandium1,1 point,Tue Jul 21 19:22:48 2015 UTC,"Ask casually like it's a perfectly normal thing to ask them for their number, because it is. Don't be squeamish about it. If you are you'll make them feel uncomfortable about it. That's it. Really asking for someone s number should be given about as much thought and emotional investment as asking someone what time it is. 99% of the time they'll give you their number as long as your not weird about it."
socialskills,3e257d,dmvaz,2,Tue Jul 21 23:27:07 2015 UTC,Then just ask.  You could also ask if they are on some social medias in common with you. That would be less creepy than asking just for a phone number.
socialskills,3e257d,Unuhi,-2,Tue Jul 21 12:34:43 2015 UTC,"Ask her if she'd like to go out for lunch sometime and when/if she says yes, get her number."
socialskills,3dye4b,Sumit316,22,Mon Jul 20 15:26:56 2015 UTC,A lot of buddhist teachings in this one
socialskills,3dye4b,dcflynn13,8,Mon Jul 20 19:00:40 2015 UTC,Yeah that's what I was thinking. I was like this is a good list! Then I see most here don't approve of it.
socialskills,3dye4b,TheFlyingSpork,9,Tue Jul 21 05:31:26 2015 UTC,"The trick is figuring out how to give these things up. I know fear is holding me back, but I don't know how to rid myself of it."
socialskills,3dye4b,mydogisangry,6,Mon Jul 20 20:24:47 2015 UTC,By accepting it. Accepting fear and what it brings makes you able to live with it.
socialskills,3dye4b,clairysaur,8,Mon Jul 20 21:20:36 2015 UTC,"That's a lot of words just to say,  Don't give any fucks."
socialskills,3dye4b,iamAshlee,4,Tue Jul 21 01:30:27 2015 UTC,Give the right fucks. A zero-fuck life is pretty dull.
socialskills,3dye4b,SadistNirvana,68,Tue Jul 21 14:09:56 2015 UTC,Be someone else basically
socialskills,3dye4b,I-Cut-Myself,31,Mon Jul 20 17:49:17 2015 UTC,"Give up being human essentially. These lists are always terrible, since no one does this and people who try are often thrown under the bus just the same."
socialskills,3dye4b,Richandler,8,Mon Jul 20 23:50:25 2015 UTC,How does that translate to being someone else if the purpose of those quotes are to improve the self?
socialskills,3dye4b,Only1ModeBEAST,6,Tue Jul 21 04:14:08 2015 UTC,"unless you want to grow old without adapting to what youve learnt and no longer want to better yourself as a person. Then yeah, keep on truckin pal"
socialskills,3dye4b,abigblacknob,7,Tue Jul 21 10:36:29 2015 UTC,I disagree with a lot of those. Giving them up won't make you happy. It will make you a background character in the movie that is your life.
socialskills,3dye4b,Smokratez,1 point,Tue Jul 21 08:05:39 2015 UTC,"Interesting point of view. But it's important to see that most of the advice on this list is not intended to be taken like dogma or hard rules. They are like chewing gum: you chew it take the taste and then spit it out. They are part of a journey. It's not like ""now I know this, things will be fine"". There is no recipe for happiness. And realizing that there is no recipe for happiness is also not a recipe for happiness.  In many areas of life when you try too hard, you fail. But just not-trying doesn't guarantee success, it can even lead to a worse failure. The whole point is to give up the compulsive need for guarantees. To let things flow. Give way to spontaneity.  It's very related to being attractive as a man (I don't know much of the female perspective). If you try hard, you seem desperate. Playing hard-to-get, playing being aloof is part of it. But ideally you don't play it. Instead of having to play hard-to-get you are genuinely busy with things. Instead of seeming like being respected, just be respected. But that's not in your immediate control. You can't make people love/respect you. But it still depends on your actions.  It's easy to control mechanical things, like putting a framed picture up the wall. It will stay there. It's dependable. But dealing with humans is a different game. Sure they/we are just as much a part of the world as the picture on the wall, but they have processes that are very similar to your own thinking. So when dealing with people, it's best to [[[[]]]]. No recipe."
socialskills,3dye4b,SadistNirvana,2,Tue Jul 21 14:07:48 2015 UTC,There is no recipe for happiness.   There is.
socialskills,3dye4b,Smokratez,1 point,Tue Jul 21 14:10:47 2015 UTC,meth
socialskills,3dye4b,tats4uRtits,0,Tue Jul 21 22:12:24 2015 UTC,"Happiness and pleasure have a sort of surprise element. You need to constantly move forward to feel it. It's like an animal finding new food sources. It can't induce this by itself. It needs to actually find new food in places that it didn't expect. If it already expected to find it, it's not a new finding.  There is no recipe in the same sense as there is no algorithm for the halting problem in computer science.  I should say: if there is a recipe, then learning the recipe makes you happy already. Since following the recipe is now a mechanical thing with known outcomes. So this would mean the recipe is to learn the recipe. The whole discussion always gets this self-referential. That's why you just let things be and be aware and go about business. Not much to learn here."
socialskills,3dye4b,SadistNirvana,2,Tue Jul 21 14:27:01 2015 UTC,Happiness and pleasure have a sort of surprise element. You need to constantly move forward to feel it.   Not at all.   You have lots of things to learn. You are in your own way much more than you probably realize.
socialskills,3dye4b,Smokratez,0,Tue Jul 21 14:36:45 2015 UTC,"I do realize. And don't misunderstand. I'm not claiming that this sort of meta thinking that I produced in my prev comment will get you too far happiness-wise. It's not the point of it. It may even be counterproductive to obsess over understanding and putting things to words. But you know, humans talk, language is part of our nature. So I babble sometimes. Nothing to do with attaining happiness.  And it's great to have more to learn. How sad it would be to not have anything more. That was precisely my point. Go on the journey and that's all."
socialskills,3dye4b,SadistNirvana,1 point,Tue Jul 21 15:03:02 2015 UTC,That's more like it.
socialskills,3dye4b,Smokratez,52,Tue Jul 21 15:07:25 2015 UTC,"I think most of those are pretty dumb, honestly. And I doubt someone would be able to find true happiness by following those."
socialskills,3dye4b,CarneyAsada,42,Mon Jul 20 18:02:18 2015 UTC,"I kinda feel like much of life would be a lot worse if you NEVER criticized, complained, or ever said anything negative about anyone. Those kind of aphorisms don't take into account the possibility that other people will violate the rules.  Like the idea ""Just be awesome to everyone and your life will be great!"" which doesn't account for the fact that life is filled with people that take advantage of others and screw people over for their own ends. But apparently you're supposed to be nice to them anyhow as they're actively screwing you over.   Real life isn't that simple. A lot of the time it's about picking your battles, knowing when to call something a loss and move on, and dealing with disappointment and failure because it's impossible to live a life without some level of suffering.   Some of these are right, but some are just dumb. Most of them should more be ""Don't let social approval be your number one priority, but don't make it not a priority at all. Don't let what other people think of you be your source of all self-esteem, like yourself for who you are and accept your faults as you try to improve."""
socialskills,3dye4b,Kewl0210,3,Mon Jul 20 19:12:31 2015 UTC,"Real life isn't that simple. A lot of the time it's about picking your battles, knowing when to call something a loss and move on, and dealing with disappointment and failure because it's impossible to live a life without some level of suffering.    True.  I know people who laugh and be happy with my failures. Life itsefl is hard, for one to win another has to loose.  But in my 26 years of life the thing that my life most defenetly teached me is that you should always fight for your dreams until the very last. Try your best always.  Will try this attitude with girls now to see if it works. But the one I want seems to be impossible to get :("
socialskills,3dye4b,novaksnow,8,Mon Jul 20 22:26:35 2015 UTC,"No, life isn't a zero sum game. One person doesn't have to lose for somebody else to win. It's a basic economic principal because not all things are as useful for all people.  https://en.wikipedia.org/wiki/Comparative_advantage  Like if I have two hats and you have two pairs of sunglasses, you can't use two hats or two pairs of sunglasses at once so if you make a trade so you both have one of each, you can wear a hat and sunglasses at the same time to protect yourself from the sun so there's an advantage to both parties.  You shouldn't ALWAYS ""fight for your dreams"". You should if it's reasonably possible and you're not hoping for miracles. When your own agency is a deciding factor in whether or not it's achievable. You need to know when something is a lost cause and you're better off using your time in something else. Or else knowing when to ""change strategies"". Thinking totally in ideals and not compromising isn't mature.  Same with trying to get a girl you think is ""impossible to get"". If you ask someone out and they're not interested, then invest your time in finding someone else rather than trying to get the attention of someone not interested in you. Valuing yourself and your time not feeling worthless from rejection. Being a mature person means accepting when things don't work out, accepting things you can't control, and moving on to something you CAN do."
socialskills,3dye4b,Kewl0210,2,Tue Jul 21 00:09:55 2015 UTC,"I think it was more in the vein that ""I will look up to this as my goal, but I won't hold myself to it too staunchly"". Maybe I just read his post that way though..."
socialskills,3dye4b,Ooobles,2,Tue Jul 21 00:37:51 2015 UTC,True
socialskills,3dye4b,novaksnow,2,Tue Jul 21 13:01:38 2015 UTC,"Not sure if you're a native speaker or not, but you have some grammatical/spelling mistakes. I hope this doesn't across poorly, I just want to help you out(!) I would have rewritten your comment like:   True.  I know people who would be happier laughing at my failures instead of my successes. Life is hard. If one person wins, another loses.  But in my 26 years, the one thing that life most definitely taught me is that you should always fight for your dreams until the very end. Always try your best.  I will try this attitude with women to see if they are attracted by it. But the girl I'm eyeing seems impossible to get :("
socialskills,3dye4b,Ooobles,2,Tue Jul 21 00:44:01 2015 UTC,Not a native speaker sorry.
socialskills,3dye4b,novaksnow,1 point,Tue Jul 21 13:02:10 2015 UTC,"It's no problem, really! You're doing fine, it was understandable and that's all that matters"
socialskills,3dye4b,Ooobles,1 point,Tue Jul 21 13:12:18 2015 UTC,"So, be a ""nice guy"" which I'm sure only a few days ago it was suggested  here to not be as people can see through it. See the writings of Dr Robert Glover."
socialskills,3dye4b,round2acc,7,Tue Jul 21 03:38:37 2015 UTC,"What makes you think so? They all sound pretty solid to me. And while they might not be the way to achieve your dreams, these are the small things that generally increase quality of life and happiness."
socialskills,3dye4b,perk11,2,Mon Jul 20 19:05:20 2015 UTC,"I dont think that any of them are dumb... But to consider doing all of them is one. Just unrealistic. But its not healthy,  Balance is key."
socialskills,3dye4b,EasyFro,1 point,Tue Jul 21 06:28:21 2015 UTC,"Ya, I'll take this one with a grain of salt. Under the right circumstances, and in the right context, all of these points are valid. Buuuuut things don't always be like it do."
socialskills,3dye4b,The_Pert_Whisperer,5,Tue Jul 21 01:07:45 2015 UTC,give up the post.
socialskills,3dye4b,qtyapa,30,Mon Jul 20 23:19:20 2015 UTC,can we give up on comic sans?
socialskills,3dye4b,concrete_puppet,38,Mon Jul 20 16:23:05 2015 UTC,This isn't Comic Sans if that's what you're talking about
socialskills,3dye4b,A113-09,70,Mon Jul 20 17:33:36 2015 UTC,Give up your need to be right
socialskills,3dye4b,wxyn,8,Mon Jul 20 19:49:04 2015 UTC,Give up your hate for Comic Sans
socialskills,3dye4b,foo_fighter,6,Mon Jul 20 23:13:22 2015 UTC,This goes against like 6 points made on the infographic
socialskills,3dye4b,prollykindofhigh,1 point,Mon Jul 20 22:55:17 2015 UTC,STOP OPPRESSING HIM CIS SHITLORD
socialskills,3dye4b,Ooobles,6,Tue Jul 21 00:44:35 2015 UTC,"I'll keep it short and sweet. Family, religion, friendship. These are the three demons you must slay if you wish to succeed in business."
socialskills,3dye4b,bewmar,3,Mon Jul 20 20:46:34 2015 UTC,I'm reading this as if succeeding in business is the only thing that will bring you happiness.
socialskills,3dye4b,patootsi,6,Mon Jul 20 22:34:25 2015 UTC,It's a Simpsons quote
socialskills,3dye4b,The48thAmerican,2,Mon Jul 20 23:09:57 2015 UTC,What you mean with slay?
socialskills,3dye4b,novaksnow,4,Mon Jul 20 22:27:30 2015 UTC,pussy bruh
socialskills,3dye4b,Ooobles,4,Tue Jul 21 00:45:21 2015 UTC,"The attitude of ""no complaining"" or ""no limiting beliefs"" is extremely unhelpful. We are not happy all the time and life isn't good all the time and if we have to act like it all were or if anything negative in our life were a ""challenge"" we just need to overcome we will become pretty lonely behind our happy facades.  The ""limiting beliefs"" thing is also extremely frustrating when seeking help. You gain nothing if you seek help and you have to explain endlessly why your problem exists and is not just a belief (which makes you come off as complainer, see above)  I also think a lot of our loneliness comes from not acknowledging negative things in life.You are not supposed to talk or even think about your poverty without making a grand plan how to get out of it. Sometimes the great plan doesn't exist and sometimes a person is too exhausted or sometimes there is simply no way out. Then that person will feel like the only one in the world who is such a loser and will talk to no one about how he really feels in order to not be a ""complainer"". I think in fact the self help movement with all its motivational talk and positive thinking has forced us to put on a permanent mask and made us unhappier instead of happier."
socialskills,3dye4b,eouhojbshfber,1 point,Mon Jul 20 23:32:13 2015 UTC,"Depends on your local (sub)culture. There are complaining cultures and there are suck-it-up cultures. There are fate-based cultures and ""everyone's a self made man""-cultures. It's impossible to give advice to anyone without knowing their current mentality and in which direction they need a push.  Can you imagine a person in a certain mental situation where this advice list can be the right advice?"
socialskills,3dye4b,SadistNirvana,3,Tue Jul 21 14:18:45 2015 UTC,Give up this list.
socialskills,3dye4b,2015Procrasinator,2,Tue Jul 21 05:35:55 2015 UTC,"8, 13, 14, and maybe a little of 15 are my huge weaknesses.   I am very aware of my need for attention. Not that my awareness prevents me from continuously seeking attention. I am always subtly doing my best to be the most talented, capable, or useful person within a group."
socialskills,3dye4b,khaos14,2,Mon Jul 20 23:52:50 2015 UTC,"I like most of these, but give up the past is not perfect. We can and should learn from our past. Dwelling is never good, but forgetting makes our past experiences less valuable."
socialskills,3dye4b,Thebiglurker,2,Tue Jul 21 00:46:35 2015 UTC,This isn't how to be happy. This is how to become nothing.
socialskills,3dye4b,deafcon5,1 point,Tue Jul 21 01:02:50 2015 UTC,Great! Now you see you're something. Can this something do something?
socialskills,3dye4b,SadistNirvana,2,Tue Jul 21 14:20:19 2015 UTC,4 &  6 are my worst.
socialskills,3dye4b,flinty_day_off,2,Tue Jul 21 01:15:12 2015 UTC,So I don't have give up smoking and being overweight to be happy?  FUCK YEAH!
socialskills,3dye4b,WhateverJoel,5,Tue Jul 21 04:59:54 2015 UTC,"Read the first one, closed the image, and went in to the comment section to bitch."
socialskills,3dye4b,Xfactor330,2,Mon Jul 20 22:32:04 2015 UTC,I like the 8th one.
socialskills,3dye4b,lenn_eavy,1 point,Mon Jul 20 17:24:38 2015 UTC,1) HOPE!
socialskills,3dye4b,rubberseatbelt,1 point,Mon Jul 20 18:10:28 2015 UTC,"I will add to that list: porno, television, newspapers and  magazines  Cant tell you how much happier i am now that i have eliminated toxic media sewage"
socialskills,3dye4b,ohsnapt,1 point,Tue Jul 21 05:14:14 2015 UTC,and reddit
socialskills,3dye4b,SadistNirvana,1 point,Tue Jul 21 14:20:48 2015 UTC,How much of this list is based on real evidence? I'm not basing my self-improvement plan on vague advice found on a random screen capture.
socialskills,3dye4b,joelthelion,1 point,Tue Jul 21 09:00:29 2015 UTC,"You need to understand that most of the Buddhist and Eastern kind of advice here is not like a fool-proof ""you need to do this and then something will happen"". They are not recipes. They are things that can shake you up, make you see and click with a new mentality, realize things on your own.  All teaching is provisional and context-dependent. Someone may be in a situation where he/she needs to hear the opposite of what is said here.  Some people need to be told that you are able to have control, don't give up, things matter. Some people may be too caught up in trying to control that they end up ineffective and crippled by it. They need to be told to let go of control.  For every person who has some problem, another may have the opposite problem. So then the second kind of people will be angry at the advice given for the first kind. These are not hard, dogmatic things.  Look at the advice, immerse yourself in it and see where it gets you. See if it pops some insight in you. Maybe the insight will be that you disagree. Everyone (including the wise people) are our peers as humans. They don't have any special thing that is unattainable to you. We are a whirlpool in this universe. What you see and experience is valid. Reality/nature doesn't ""care"" if you agree with how it is. It is absurd to congratulate nature (or to get angry at it). Your thoughts and expectations will also affect your outcomes/reality. But the outcomes/reality makes you learn, too. It's a constant back-and-forth dance. But it's all normal and part of it, just like the wind bending the trees and water waving.  One just has to get rid of the crippling deep seated feeling that something may be objectively essentially wrong deep down with the universe that needs immediate correction. This thought pattern is wrong. But striving for improvement is still good. But take it all in a form of dance or musical tune. You don't need to intellectually analyze the rhythm patterns in music to ""get"" the music. The world is a dance. For nothing else than itself. But you can dance sometimes ""as if"". Acting can be fun, too. It's not losing your self, it's just like playing hide-and-seek."
socialskills,3dye4b,SadistNirvana,0,Tue Jul 21 13:53:10 2015 UTC,So much of this is bullshit...
socialskills,3dye4b,therightclique,1 point,Tue Jul 21 01:03:55 2015 UTC,"Is there a mass exodus from /r/GetMotivated to here? What's with all the salt and misinterpretation in the comments here? You guys frequently ask questions about your social life here and most often, the top answers are in some shape or another taken or related to one of the 15 things mentioned on this list that you should do."
socialskills,3dye4b,DetectorOfCirclejerk,-2,Tue Jul 21 03:47:59 2015 UTC,";) them eyes... There are very points on the list on the picture you posted. I could get it read. I agree with the points. For me Happiness... Just is. It doesn't need explaining. It's thst comfortable, warm, zen feeling inside, that words are never quite good describing. A glorious week, everyone @)----"
socialskills,3dye4b,Unuhi,0,Mon Jul 20 16:25:33 2015 UTC,"6 is a quote from Abraham Lincoln, not Ziggy.  What an awful mix up."
socialskills,3e2dmq,Gharials,2,Tue Jul 21 12:45:35 2015 UTC,"You sound pretty normal, actually. Yeah, you're a little lacking in social skills and you're self-absorbed, and you aren't great at reading between the lines... but nothing sounds crazy here. You can work on that stuff and at least you're willing to make changes, that's a major step.   You do tend to go on and on... if you're like that in real life, too, try to tone it down. Don't just talk about yourself, show interest in what's going on with other people. Maybe it's just coz you're posting here that you come off like that, but still, think about it.  Relax, don't take things too seriously, don't get hung up on that girl, expand your social circle. Get into mindfulness, it will help you  moderate your approach."
socialskills,3e40a8,Rezous32,3,Tue Jul 21 19:57:42 2015 UTC,"My biggest problem with interacting with strangers have been my inability to remain calm. In my mind I'll have everything planed beforehand. But once the interaction starts I freeze, my thoughts go chaotic and I loose it. I transform in a comical idiot."
socialskills,3e40a8,kovacz,3,Tue Jul 21 20:05:23 2015 UTC,Exactly how i felt ! But now i go blank and try to understand the situation ..
socialskills,3e40a8,kovacz,1 point,Tue Jul 21 20:12:09 2015 UTC,"I guess the best way is to slow down l, take your time and keep your cool.   I'll try to do that next time. Thanks for the advice OP"
socialskills,3e40a8,ElMelonTerrible,1 point,Tue Jul 21 20:21:32 2015 UTC,Yeah thats what i was trying to say ! No problem :)
