spiderbro,3d3kmj,SadAndMalone,1 point,Mon Jul 13 16:38:44 2015 UTC,Makes me think of Riff Raff from Rocky Horror and I think he probably needs a shower.
spiderbro,3d3kmj,ZappyKins,3,Mon Jul 13 20:59:42 2015 UTC,"Resolution is 6000x4000 if you want a closer look.  Side note, thanks to the /r/spiderbro community for bringing me around gradually to tolerate (working toward like) these helpful fellas."
spiderbro,3d1m8e,xblackdog,2,Sun Jul 12 19:55:52 2015 UTC,"I never would have seen him, damn. Great eyesight and cute guy though!!"
spiderbro,3d1m8e,officialxian,2,Mon Jul 13 04:30:57 2015 UTC,I surprisingly felt him before ever seeing him. Glad I didn't just brush my hand and squish him.
spiderbro,3d1m8e,officialxian,1 point,Mon Jul 13 05:26:15 2015 UTC,runs in panting I FINALLY FOUND YOU! I was sitting on the walkway to the dock that my dad is building and felt a bro just as small on me today! It's crazy how somehow the smaller ones are the ones you feel the most. Unfortunately I didn't have my phone on me to snap a picture.
spiderbro,3d28ui,limowrecks,4,Sun Jul 12 22:59:48 2015 UTC,It's a uloborid for sure--where were they?
spiderbro,3d28ui,ellipsoptera,1 point,Sun Jul 12 23:13:31 2015 UTC,"Yeah it looks like it!.... it was in my aquaponic system, i have ton of spiders there but this one really got my attention for her shape... its really diferent....the way they hunt its really unique too!.."
spiderbro,3d1kzz,TheBubblewrappe,1 point,Sun Jul 12 19:45:42 2015 UTC,I'm finally ok with spiders and now it seems they are invading my apartment. I love them but this is getting ridiculous. I thought it was a fly and when I stood up and brushed myself a spider came off of me. How do I mitigate these guys without killing them? Thanks brofriends.
spiderbro,3d1kzz,SweetLenore,1 point,Sun Jul 12 19:48:21 2015 UTC,"Paper/cup basically. If it's hard to get that close to them, find someone else who can. You can trap them in a cup while waiting."
spiderbro,3d1kzz,brocas_helm,1 point,Sun Jul 12 21:10:56 2015 UTC,I have been just not sure what's causing them in such high numbers.
spiderbro,3d1kzz,SweetLenore,1 point,Sun Jul 12 21:14:56 2015 UTC,"obviously there's a giant spider spawn nest beneath your residence. these spawn nests typically indicate proximity to one of the many gateways to satan's 9th hell, from which terrifying demons occasionally emerge to prey on unsuspecting humans. often these demons appear in the form of attractive figures of the preferred sex of their prey. has your significant other been behaving strange lately?"
spiderbro,3cxrie,crafty-fox,11,Sat Jul 11 18:56:53 2015 UTC,Those little guys are great! I had one on me once and he spun webs from my arm hair to my arm. Pretty cool to see.
spiderbro,3cxrie,AllOfTheDerp,2,Sat Jul 11 22:19:37 2015 UTC,They are all over our garage! Every time we get a box out there are about 10 of these little guys all over is!
spiderbro,3cxrie,Goliath_Gamer,5,Sun Jul 12 15:30:51 2015 UTC,Aw it's cute
spiderbro,3cxrie,Goliath_Gamer,2,Sun Jul 12 07:25:00 2015 UTC,I love how if you zoom in you can see his little shiny eyes!
spiderbro,3cxrie,espino12352,2,Sun Jul 12 15:31:32 2015 UTC,Right?
spiderbro,3cy97v,SweetLenore,9,Sat Jul 11 21:31:43 2015 UTC,With its adorable glow-in-the-dark moustache! Awww!
spiderbro,3cy97v,great-granny-jessie,6,Sun Jul 12 04:59:29 2015 UTC,"Such a cute little bro. You got a good picture of him. For anyone who doesn't know what it is, its Phidippus Audax, the daring jumping spider."
spiderbro,3cxub0,maluser,10,Sat Jul 11 19:20:19 2015 UTC,"Here's some slightly better pics, sry that ones kinda crappy I just love wolfies and jumpers. http://imgur.com/a/CNiMJ"
spiderbro,3cxub0,JermEC,3,Sat Jul 11 19:41:15 2015 UTC,He's just a little guy! Soon he'll grow up big and strong
spiderbro,3cxub0,Wuhblam,4,Sun Jul 12 12:02:39 2015 UTC,"Yea, we recently got flooded down there, so all kinds of insects moved in from outside. this guy and his wing man must have followed their food source and they have a crawling buffet to get fat on."
spiderbro,3czrdp,devildocjames,3,Sun Jul 12 06:54:35 2015 UTC,It's like a rare dop.  [Gloves of Nope]   undead only :D
spiderbro,3czrdp,emkill,3,Sun Jul 12 07:13:52 2015 UTC,Gives: Venom (-3hp/sec DoT)  Web Entanglement (-25% Speed/10 sec) 90% Chance to cause Terror in wearer.
spiderbro,3cxl0i,JWOOD24,1 point,Sat Jul 11 18:00:42 2015 UTC,Where do you live ?
spiderbro,3cxzif,Butt_stuf,1 point,Sat Jul 11 20:06:18 2015 UTC,wittle crab bro
spiderbro,3cx3qp,InfernoTurnip,8,Sat Jul 11 15:26:40 2015 UTC,Go and leave HIM on the floor as a message to HIS homeboys.
spiderbro,3cx3qp,SubDee54,2,Sat Jul 11 16:21:22 2015 UTC,"Blah, meanie."
spiderbro,3cx3qp,ThisIsGoobly,1 point,Sat Jul 11 20:03:56 2015 UTC,Nooo ):
spiderbro,3cyxsg,pikachika92,1 point,Sun Jul 12 01:24:35 2015 UTC,Location?
spiderbro,3cyxsg,TheFiveoIce,1 point,Sun Jul 12 01:50:39 2015 UTC,Seattle
spiderbro,3cyxsg,Watercoolest,1 point,Sun Jul 12 01:57:26 2015 UTC,definitely a hobo
spiderbro,3cyxsg,OfMiceAndMenus,1 point,Sun Jul 12 07:28:13 2015 UTC,Welp.  Time to recruit a bunch of harvestman.
spiderbro,3cyxsg,brocas_helm,2,Sun Jul 12 09:04:21 2015 UTC,Hobo spiders are harmless. Anyone saying otherwise is misinformed.
spiderbro,3cyxsg,brocas_helm,-2,Sun Jul 12 14:44:35 2015 UTC,Except for the fact that they're the Pacific Northwest equivalent of a brown recluse? Their venom is necrotic. Have you done hour research?
spiderbro,3cyxsg,OfMiceAndMenus,4,Sun Jul 12 15:12:28 2015 UTC,"your spider is more likely a tegenaria duellica, or eratigena atrica or tegenaria domestica, all of which are more common than a hobo spider and harmless. further, i don't believe hobo spiders deserve their reputation of dermonecrotic bites. here's one study to look at, showing the hobo spider's inability to carry the MRSA pathogen, and the spider's non hemolytic venom."
spiderbro,3cyxsg,brocas_helm,2,Sun Jul 12 17:04:42 2015 UTC,Are barn funnel weavers native to the Seattle area?
spiderbro,3cy9oz,ThievesCoonis,1 point,Sat Jul 11 21:36:05 2015 UTC,Looks nice and glossy
spiderbro,3cvc08,CarmineFields,19,Sat Jul 11 02:05:06 2015 UTC,"That's actually not a spider, but it's still a really cool bro.  I don't know the validity of this, but i seem to remember being told spiders 'taste' with their feet. (This Smithsonian article says 'legs' )  So glad I don't have that problem."
spiderbro,3cvc08,OfMiceAndMenus,8,Sat Jul 11 03:50:48 2015 UTC,Harvestbros are ok
spiderbro,3cvc08,GHenders,2,Sat Jul 11 05:33:36 2015 UTC,"Wow, TIL about opiliones! Very cool."
spiderbro,3cvc08,UnicornPenguinCat,2,Sat Jul 11 12:21:41 2015 UTC,Not a daisy either.  Poppy.
spiderbro,3cvnvj,GameDevsRule,12,Sat Jul 11 03:59:22 2015 UTC,wolf spider mama
spiderbro,3cvnvj,viatorinlovewithRuss,3,Sat Jul 11 04:11:55 2015 UTC,"thank you , making sure it was no aclus spider. seeing as I found him at work . I feel better now that I move her to a better location , she was in a place where she could be step on. my wife did not want me to bring her home lol."
spiderbro,3cvnvj,avryco,2,Sat Jul 11 10:51:34 2015 UTC,Yep
spiderbro,3cvnvj,CagedGod,3,Sat Jul 11 06:34:09 2015 UTC,Awww!
spiderbro,3cvnvj,Pressingissues,3,Sat Jul 11 07:12:41 2015 UTC,"Chevy, possibly 2500 HD"
spiderbro,3cvnvj,OfMiceAndMenus,2,Sat Jul 11 13:23:16 2015 UTC,"Wow, that's the tiniest baby-carrying Wolfie mom I've ever seen!"
spiderbro,3cvnvj,nsto,1 point,Sat Jul 11 13:57:15 2015 UTC,that there's a woof spider
spiderbro,3cwdbn,TheBubblewrappe,1 point,Sat Jul 11 09:38:48 2015 UTC,"Really hard to see with a dark spider and no lighting. A better picture would make an ID easier.  Looks like it lost a couple legs, though."
spiderbro,3cwdbn,OfMiceAndMenus,1 point,Sat Jul 11 14:01:42 2015 UTC,Yeah when I got him outside I noticed the legs. I accidentally swept him up while cleaning.
spiderbro,3cwdbn,brocas_helm,1 point,Sat Jul 11 17:49:47 2015 UTC,i'm in san diego and get plenty of grass spiders. looks similar enough
spiderbro,3cwdbn,brocas_helm,1 point,Sat Jul 11 17:09:26 2015 UTC,He was all black!
spiderbro,3cwdbn,brocas_helm,1 point,Sat Jul 11 17:48:35 2015 UTC,what's wrong with being black?
spiderbro,3cwdbn,brocas_helm,1 point,Sat Jul 11 18:52:32 2015 UTC,I feel like the photos of grass spiders were more brown in nature. Does that make sense? I'm actually quite proud that I got so close to him. I'm getting better at being around bro friends!
spiderbro,3ct7tq,MySpearIsRestless,18,Fri Jul 10 16:08:43 2015 UTC,Spider-raft for the baby bros!
spiderbro,3ct7tq,InfernoTurnip,4,Fri Jul 10 17:33:19 2015 UTC,I hope you rescued them!
spiderbro,3ct7tq,The_Smeow_is_Mine,6,Fri Jul 10 20:17:01 2015 UTC,"To give everyone an update, I used a small hand net to fish her out and let her crawl into the grass to safety with her babies."
spiderbro,3ct7tq,crafty-fox,4,Sat Jul 11 09:30:01 2015 UTC,Spider bra!
spiderbro,3ct7tq,RUSTY_LEMONADE,2,Fri Jul 10 18:42:04 2015 UTC,I wonder if she went in the water to escape those wasps.
spiderbro,3ct7tq,maluser,1 point,Sat Jul 11 00:03:08 2015 UTC,"If you're referring to those black winged insects floating nearby, they're actually ants. I'm pretty sure they're males, which come out to mate with new queens, and then die shortly after. I don't even think the males can sting. Nice heroic rescue OP."
spiderbro,3ct7tq,watashiofakku,2,Sat Jul 11 19:31:38 2015 UTC,Look at all those little babies!!
spiderbro,3ct7tq,iEliteTester,3,Sat Jul 11 00:14:08 2015 UTC,is kill?
spiderbro,3ct7tq,mechanix83,5,Fri Jul 10 20:41:49 2015 UTC,I don't remember the exact science but it's something about water tension that means creatures like spiders can be on water.
spiderbro,3ct7tq,jeffrowitdaafro,6,Fri Jul 10 21:18:59 2015 UTC,surface tension
spiderbro,3ct7tq,SweetLenore,1 point,Fri Jul 10 22:35:39 2015 UTC,Is she ok like that?
spiderbro,3ct7tq,alkyjason,1 point,Fri Jul 10 19:50:06 2015 UTC,That's a spider-mom. Did you rescue her?
spiderbro,3ct7tq,RussellLawliet,1 point,Sat Jul 11 00:48:03 2015 UTC,Well the wasps aren't doing quite so well.
spiderbro,3ct7tq,Purplesunset0304,1 point,Sat Jul 11 00:50:28 2015 UTC,Wolf mama's are the best.
spiderbro,3cuhlj,UpintheWolfTrap,3,Fri Jul 10 21:48:42 2015 UTC,"While i can't say for certain, that definitely looks like a long-jawed orb weaver!"
spiderbro,3cuhlj,Coglione,2,Fri Jul 10 23:27:07 2015 UTC,"i agree, looks like Tetranatha"
spiderbro,3cuhlj,tall_trees,3,Fri Jul 10 23:31:54 2015 UTC,"I encourage you to zoom in on this bro's head - it looks like he's got some rather large mandibles that almost look like proboscides or something, which i know isn't a thing on spiders, but i was like ""bro, what's up with your face, bro?"""
spiderbro,3cuhlj,OfMiceAndMenus,2,Sat Jul 11 00:15:15 2015 UTC,Huge chelicerae/fangs are totally a thing on spiders. Even the pretty shiny bro in our /r/spiders banner(Leucauge venusta) is in that category of bros.
spiderbro,3cuhlj,Rancid36,2,Sat Jul 11 00:51:47 2015 UTC,Fucken awesome looking! Sorry I have nothing of use to add.  Edit: perhaps http://www.spiders.us/species/cheiracanthium-mildei/ But idk
spiderbro,3cuhlj,OfMiceAndMenus,1 point,Fri Jul 10 22:51:44 2015 UTC,"I would guess Tetragnatha elongata or another similar long-jawed orb weaver. They're really cool bros. I have a couple on my porch, and they love to hide on my car mirrors."
spiderbro,3csimy,some1o1,13,Fri Jul 10 12:33:43 2015 UTC,"geez, the imgur comments.... at what point is that joke going to not be funny?  this spider is the size of a dime..."
spiderbro,3csimy,fayettevillainjd,1 point,Fri Jul 10 14:06:01 2015 UTC,Haha nope! /s
spiderbro,3csimy,Lochcelious,9,Fri Jul 10 21:03:20 2015 UTC,Aww he's so cute! It's just a tan jumping spider. One of the cutest spiders ever!  That was the comment I tried leaving on the imgur pic but of course it wouldn't let me.
spiderbro,3csimy,Purplesunset0304,1 point,Fri Jul 10 15:16:27 2015 UTC,"Apparently, only reddit style circle-jerk comments are allowed on imgur. I'll be damned if that ain't one cuddly looking salticidae."
spiderbro,3csimy,ItwasMothmens,5,Fri Jul 10 21:14:47 2015 UTC,Title/10
spiderbro,3csimy,Eine_Bier_Getrunken,3,Fri Jul 10 15:21:07 2015 UTC,This definitely!!!!
spiderbro,3csimy,semibacony,2,Fri Jul 10 16:13:38 2015 UTC,"The icon is cute and I also prefer...  oO,_,Oo or OO.OO < surprised spidey"
spiderbro,3csimy,mikaosol,2,Fri Jul 10 20:40:54 2015 UTC,"Aww, what a cute little mustache!!"
spiderbro,3cscvq,Iceclaw526,3,Fri Jul 10 11:24:58 2015 UTC,Jumping spider of sorts
spiderbro,3cscvq,fayettevillainjd,3,Fri Jul 10 13:52:42 2015 UTC,"Species, a tiger is a different species to a lion."
spiderbro,3cq3rv,perkisizer,3,Thu Jul 9 21:38:27 2015 UTC,"Shame he got an assassin bug, though."
spiderbro,3cq3rv,Rustnrot,3,Thu Jul 9 22:37:54 2015 UTC,My brother got jabbed by one years ago so I am not an assassin bug fan lol.
spiderbro,3cq3rv,SweetLenore,5,Thu Jul 9 23:00:44 2015 UTC,Yeah I'm majorly freaked out by non-spidey things so I'm ok with that too.   Although I would feel bad if it were a grasshopper or bumble bee.
spiderbro,3cq3rv,ItwasMothmens,2,Thu Jul 9 23:16:07 2015 UTC,"Their proboscis punctures are quite painful (yet not medically significant most of the time), so I'm also quite paranoid if I'm near them."
spiderbro,3coice,m0sketti,2,Thu Jul 9 14:37:00 2015 UTC,Frostbite Spider
spiderbro,3coice,011001011010,3,Fri Jul 10 04:43:12 2015 UTC,There are a surprising amount of tarantulas that never grow larger than the one in the picture.
spiderbro,3coice,Feriat,1 point,Thu Jul 9 18:26:25 2015 UTC,That is just adorable
spiderbro,3cob6p,fayettevillainjd,3,Thu Jul 9 13:38:24 2015 UTC,He's very photogenic.
spiderbro,3cqhfy,bemoreuseful,0,Thu Jul 9 23:26:00 2015 UTC,We're in southern New England. I keep almost messing up his web when I water the plants. :(
spiderbro,3cqhfy,fayettevillainjd,2,Thu Jul 9 23:28:42 2015 UTC,"could you get a dorsal shot (top view) of its abdomen (fat butt)? kind of hard to tell, but maybe a orchard orb weaver.  It's definitely an orb weaver of some kind."
spiderbro,3covgr,powerarmee,3,Thu Jul 9 16:14:41 2015 UTC,"Another :) I'm assuming it's a female, but I'm not 100% sure how to tell. Just looks like she's gonna have babies!"
spiderbro,3covgr,brocas_helm,4,Thu Jul 9 16:18:20 2015 UTC,dude that thing is huge
spiderbro,3covgr,fayettevillainjd,3,Fri Jul 10 00:24:57 2015 UTC,"It's a female, but I don't know that she's gravid. that species is just fat hehe.  I think it's a furrow spider, possible Larinioides cornutus"
spiderbro,3corsz,Nitrozah,1 point,Thu Jul 9 15:48:07 2015 UTC,Beautiful bro
spiderbro,3cpbr3,Carpetfreak,3,Thu Jul 9 18:10:38 2015 UTC,I have never HEARD a spider walk. Holy crap that shouldn't weird me out as much as it does lol. I'm not even afraid/grossed out by spiders. I love them because they eat flies and other crappy insects I don't like but I've never heard one walk before. That seriously blew my mind.
spiderbro,3cpbr3,Monkey_Face93,1 point,Sat Jul 11 04:36:30 2015 UTC,"I do foley and sound design to video, I think this is probably added in. But that is probably what it would sound like!"
spiderbro,3cpbr3,Gingerstachesupreme,1 point,Mon Jul 13 02:08:55 2015 UTC,No kidding? I've always been amazed by the kind of stuff y'all can do. I'll bet that's a really fun gig!
spiderbro,3cknjp,Transcriber3,6,Wed Jul 8 17:31:18 2015 UTC,"My wife would be so torn by this picture.  She is afraid of spiders, but she hates moths with the fire of a thousand suns.  So she would be terrified but grateful to your little buddy."
spiderbro,3cknjp,anillop,3,Wed Jul 8 20:50:26 2015 UTC,"I hate moths, this image makes me very happy."
spiderbro,3cknjp,octopenelope,1 point,Wed Jul 8 23:45:00 2015 UTC,Why do you hate moths? They don't bite or anything..
spiderbro,3cknjp,GIMPKING,2,Thu Jul 9 07:31:15 2015 UTC,They are annoying fucks that come into your room at night and make constant noises of them hitting the ceiling and sometimes get in your face. Luckily though I got plenty of true spiders so if they come into my room then it's easy food for my spiders.
spiderbro,3cknjp,Nitrozah,1 point,Thu Jul 9 11:04:18 2015 UTC,Looks like a Lace Webbed Spider (Amaurobius sp.) if you're curious.
spiderbro,3cn8hj,Hyphy_,2,Thu Jul 9 05:36:52 2015 UTC,"I'm guessing Misumenops bellulus. could also be Mecaphesa asperata as they are pretty similar. basically, it's a male crab spider"
spiderbro,3cn8hj,fayettevillainjd,1 point,Thu Jul 9 13:20:10 2015 UTC,Thank you good sir.
spiderbro,3cn8hj,SciFriedRice,2,Thu Jul 9 22:31:26 2015 UTC,"He's like ""Bro. How 'bout a hug?"""
spiderbro,3cn8hj,ASCIt,1 point,Fri Jul 10 01:08:43 2015 UTC,"It appears to be a bro, yes."
spiderbro,3clg5y,Douche_Kayak,1 point,Wed Jul 8 20:46:30 2015 UTC,What a sweetie!!! So cute.
spiderbro,3cmew3,xKillaBeex,3,Thu Jul 9 01:14:38 2015 UTC,"I'm not scared of spiders at all. This huge black widow has it's own spot secluded in my backyard. Thing is massive, I swear! I have watched it make it's web. There's no pattern to the web, looks like wherever it can contect two spots with its web it does. It's captured so many things in it's web (Roaches, Bees, Flies) My question is, do I leave it or is it a spider that I should get rid of?   Edit: it's looking up towards the camera. So the legs are in front and the butt in back. I honestly wish I had a good camera!"
spiderbro,3cmew3,fayettevillainjd,1 point,Thu Jul 9 01:19:01 2015 UTC,"yep, widows are in the cobweb spider family. so their webs are basically what you described.  Is it in a location that pets or people access a lot? obviously the best thing to do would be to just leave her be if possible, but definitely move her if anything is at risk."
spiderbro,3cmew3,philoponeria,2,Thu Jul 9 13:23:39 2015 UTC,I would only move it to a new location if you have a pet or child who may get bitten. Otherwise leave her be and you have a cool story.
spiderbro,3cmew3,philoponeria,1 point,Thu Jul 9 02:18:41 2015 UTC,I watch my niece during the weekends :/  How do you move a black widow?
spiderbro,3chpij,TexasMofo,7,Wed Jul 8 00:13:17 2015 UTC,"That's a gorgeous shot and a beautiful spider! What's that, an orb weaver?"
spiderbro,3chpij,NowThatsAwkward,6,Wed Jul 8 00:41:49 2015 UTC,"Thanks, it was just taken with my iPhone, which does take pretty good shots in outdoor daylight. And yep, it's a marbled orb-weaver (Araneus marmoreus)."
spiderbro,3chpij,UglyStru,2,Wed Jul 8 01:03:17 2015 UTC,"How dangerous are those? I always felt the bigger the ass, the worse the bite. That plus the flamboyant color is terrifying."
spiderbro,3chpij,xkcdfanboy,6,Wed Jul 8 04:31:01 2015 UTC,"Orb-weaver toxicity is extremely low and poses virtually no risk to humans unless the person happens to be allergic (like a bee sting.) The abdomen size has no correlation to venom toxicity. Look at the brown recluse, easily the most dangerous spider bite (in North America at least) and it has a relatively small abdomen. I think the large abdomen just gives the spider a more menacing appearance."
spiderbro,3chpij,Toa_Ignika,3,Wed Jul 8 06:06:44 2015 UTC,"The venom is actually inside a tiny sac, the size of the adomen has little to do with the power of the bite.  Spider Anatomy  I do agree though about the ""feels."" My human instinct is to be more afraid of bigger spiders which I'm sure evolutionary had some benefit."
spiderbro,3chpij,Brobi_WanKenobi,5,Wed Jul 8 05:46:57 2015 UTC,Wow.  I don't know if I should be scared out of my wits or in aw.
spiderbro,3chpij,xkcdfanboy,3,Wed Jul 8 03:37:49 2015 UTC,"When it comes to spiders, with me it's usually both."
spiderbro,3ci7xv,Joneeeebravo2,1 point,Wed Jul 8 02:46:34 2015 UTC,Gorgeous wolf spider.
spiderbro,3cfarx,Tape_measure,27,Tue Jul 7 13:43:09 2015 UTC,Actually from what I see is that it's a bro but not a spiderbro. That seems to be a baby harvestman which is an arachnid but not a spider since it only has one body segment. Still cute though.
spiderbro,3cfarx,Purplesunset0304,15,Tue Jul 7 14:07:00 2015 UTC,Hmm I didn't know the difference... Guess it's time to make /r/harvestbro
spiderbro,3cfarx,Nova_Dawn,8,Tue Jul 7 14:45:15 2015 UTC,/r/arachnidbro. I set this up just now. Please consider cross-posting there.
spiderbro,3cfarx,OldSpaceChaos,2,Tue Jul 7 17:00:59 2015 UTC,That's so awesome! Loll x-post it when I get home!
spiderbro,3cfarx,Spida-Mernkey,11,Tue Jul 7 20:12:35 2015 UTC,I knew you guys were a bunch of potheads :)
spiderbro,3cfarx,tishmaster,2,Tue Jul 7 17:19:33 2015 UTC,yep :)
spiderbro,3cfarx,fayettevillainjd,2,Wed Jul 8 00:39:55 2015 UTC,It's..it's true.
spiderbro,3cfarx,LonelyNixon,8,Tue Jul 7 21:49:12 2015 UTC,harvestbro
spiderbro,3cfarx,strppngynglad,3,Tue Jul 7 14:33:48 2015 UTC,Are you aware that pipe looks sort of like a dog dick
spiderbro,3cfarx,Boardshorts_andbabes,2,Wed Jul 8 04:14:01 2015 UTC,Your big toe is the only one not scared
spiderbro,3cbo8z,giganticpine,6,Mon Jul 6 17:37:30 2015 UTC,What an adorable brood!
spiderbro,3cbo8z,Alantha,6,Mon Jul 6 20:44:29 2015 UTC,Aw man. Charlotte's Web flashbacks.
spiderbro,3cbo8z,cadika_orade,4,Mon Jul 6 23:05:59 2015 UTC,"I sometimes wonder why I am subbed to this subreddit... This gives me the tingles.  Edit: well, apparently you're not allowed to be scared of spiders when you're subbed to /r/spiderbro..."
spiderbro,3cbo8z,tofman,5,Tue Jul 7 08:30:22 2015 UTC,"i got your back, bro! I hear stories sometimes of people that subscribe here and it slowly makes them more and more comfortable with spiders. Just keep at it! They ain't so bad. Especially when you remember that we are like walking buildings to them."
spiderbro,3cbo8z,tofman,2,Tue Jul 7 17:53:52 2015 UTC,"Thanks, bro! That's exactly why I subscribed. I find spiders interesting, but when I see them in real life, they scare the shit out of me. I'm hoping by looking at all these pics to become more comfortable with spiders as well! I've already come to find jumping spiders quite cute :)"
spiderbro,3cbo8z,Smark_Henry,0,Tue Jul 7 19:44:52 2015 UTC,One spider is a bro.   A hundred spiders is a state of emergency.
spiderbro,3cbo8z,alexandriaweb,6,Tue Jul 7 10:08:46 2015 UTC,"A hundred spiders is a state of emergency.   For household pests and the local mosquito population, yeah."
spiderbro,3cbo8z,chancebeloud,1 point,Tue Jul 7 14:36:55 2015 UTC,"squee I noticed a little nest on my parsley plant earlier so I'm hoping I have a similar adorable brood, who will with any luck eat all the bloody greenfly."
spiderbro,3cbo8z,RobotFarmer,1 point,Tue Jul 7 13:49:58 2015 UTC,I took a small video of (I think) the same kind of spiders after a hatching. They were so cute!
spiderbro,3ca00p,rawdra,60,Mon Jul 6 07:03:59 2015 UTC,"At least he died doing what he loved: squatting in an inconspicuous nook, waiting to terrify an unsuspecting passerby."
spiderbro,3ca00p,TomViolence,29,Mon Jul 6 09:21:31 2015 UTC,He terrified my husband which is remarkably hard to do.  We noticed him yesterday at my son's skateboarding competition.  Many little skater dudes oo'ed and awed..
spiderbro,3ca00p,webbens,30,Mon Jul 6 09:39:29 2015 UTC,"This bro (judging by its size), have a long and prosperous life, the warm of the lights and the appeal to other bugs let him choose that spot. So in the end lets cheer those who fall behind and those who are the future. Long live the bro of lights."
spiderbro,3ca00p,Douchewafer,36,Mon Jul 6 12:23:15 2015 UTC,"Welp, at least when you turn on your right blonker, you get a kinda cool spidey signal."
spiderbro,3ca00p,Douchewafer,9,Mon Jul 6 12:14:18 2015 UTC,Blonk at your discretion!
spiderbro,3ca00p,ToastedSoup,6,Mon Jul 6 13:26:50 2015 UTC,Wort wort
spiderbro,3ca00p,ThereIsBearCum,12,Mon Jul 6 17:15:51 2015 UTC,He would've been nice and warm.
spiderbro,3ca00p,Kothophed,10,Mon Jul 6 21:27:22 2015 UTC,"I took one look at this and exclaimed, ""awww, shit."" RIP spiderbro."
spiderbro,3ca00p,cky12qxz,4,Mon Jul 6 09:17:04 2015 UTC,What kind of spider is it?
spiderbro,3ca00p,biggusj,10,Mon Jul 6 14:16:28 2015 UTC,"He is a cane spider.  Judging by the size,  he was most probably a teenager.  They live in Hawaii, and enjoy running about the night scaring people who wake up to pee."
spiderbro,3cc5ki,tana-ryu,8,Mon Jul 6 19:37:47 2015 UTC,Total Lady Bro Gasteracantha spp. you've got there. :) Not really aggressive. Super pretty to look at.
spiderbro,3cc5ki,Alantha,5,Mon Jul 6 20:48:14 2015 UTC,So now we down vote for the Genus name?
spiderbro,3cc5ki,SpeedBeef,2,Mon Jul 6 23:13:13 2015 UTC,What happened?
spiderbro,3cc5ki,Alantha,3,Mon Jul 6 23:16:47 2015 UTC,"Assholes, man, assholes"
spiderbro,3cc5ki,SpeedBeef,7,Mon Jul 6 23:43:10 2015 UTC,This is driving me crazy. Where am I suppose to be looking at in the pic?
spiderbro,3cc5ki,Jizzipient,1 point,Mon Jul 6 21:06:05 2015 UTC,see that little square on the house in the middle of the pic? down and to the right just a bit.
spiderbro,3cc5ki,fayettevillainjd,5,Tue Jul 7 17:22:05 2015 UTC,That's a Broette. What you have there a Spinybacked Orb Weaver. The females are larger than males. They are real chill as long as you aren't aggressively bugging it.
spiderbro,3cc5ki,SpeedBeef,3,Mon Jul 6 20:27:00 2015 UTC,Cool my mom moved her to where she wouldn't be bothered. She made a massive web on our swing set. It was quite impressive.
spiderbro,3cc5ki,Purplesunset0304,3,Mon Jul 6 23:15:45 2015 UTC,If it's the thing with the smiley face on it then that's a ginormous spider.
spiderbro,3cc5ki,Jizzipient,1 point,Mon Jul 6 23:30:11 2015 UTC,Is that what we were suppose to be looking at? I thought that's some kind of reticulation system's sprout or something. Looks more plastic-ky than biological.
spiderbro,3cc5ki,Purplesunset0304,1 point,Tue Jul 7 05:04:34 2015 UTC,I think so but I'm not sure. I only looked at it when someone said spiny orb weaver.
