spiderbro,3e2em4,Purplesunset0304,2,Tue Jul 21 12:55:48 2015 UTC,That's a type of lynx spider.
spiderbro,3e2em4,Rustnrot,1 point,Tue Jul 21 15:07:40 2015 UTC,Nope jumping spider
spiderbro,3e45am,ViewAskewed,2,Tue Jul 21 20:32:44 2015 UTC,"Well I wanna say it's a Black Widow, but the quality makes it hard to tell. In that case, I'd say bro if you let it chill on its own"
spiderbro,3e45am,Katryonyx,1 point,Tue Jul 21 21:44:40 2015 UTC,Def a bro
spiderbro,3e3er2,kayrynjoy,1 point,Tue Jul 21 17:31:39 2015 UTC,I think it may be a female Barn Funnel Weaver. Pretty neat. One of the bigger spiders we get around here
spiderbro,3dzk4n,SpuriousLogic,3,Mon Jul 20 20:23:16 2015 UTC,Great view
spiderbro,3dzk4n,RobotFarmer,1 point,Mon Jul 20 23:19:23 2015 UTC,Chicago spiders are the best spiders.   She is a pretty orbweaver.
spiderbro,3dxn4z,princeofsaiyans89,23,Mon Jul 20 11:25:53 2015 UTC,I plan to release her in the woods far from the buildings.
spiderbro,3dxn4z,fayettevillainjd,13,Mon Jul 20 11:26:42 2015 UTC,oh I read that wrong and thought you were saying you found her dead.  so glad shes ok! thanks for your kindness.
spiderbro,3dxn4z,rogue_chicken,22,Mon Jul 20 14:13:18 2015 UTC,"They're only deadly to very small kids, small animals, the elderly and people with very compromised immunity. A healthy adult can survive a black widow bite no problem. Beautiful specimen!"
spiderbro,3dxn4z,P-01S,11,Mon Jul 20 15:29:09 2015 UTC,"Yeah, and yellow jackets won't kill me either... still don't want their venom inside me."
spiderbro,3dxn4z,Heratiki,19,Mon Jul 20 20:14:02 2015 UTC,The Black Widow is a beautiful creature and is rarely deadly for even weak people. But good god damn does it not hurt and some people can feel muscle pain for weeks afterwards. Some without antivenom can swell to the point of damage to the skin but that's about it. But good grief the pain. Such bad bad pain.
spiderbro,3dxn4z,murd3rsaurus,3,Mon Jul 20 16:45:24 2015 UTC,personal experience?
spiderbro,3dxn4z,Heratiki,13,Tue Jul 21 00:04:43 2015 UTC,"I watched the strongest person I know, who turned the tip of his fingers into flowers with a router (power tool) while making a sign, reduced to a sniveling child after a bite. It wasn't pretty to watch."
spiderbro,3dxn4z,murd3rsaurus,6,Tue Jul 21 00:22:40 2015 UTC,You paint pretty pictures
spiderbro,3dxn4z,Heratiki,6,Tue Jul 21 00:40:49 2015 UTC,The best part is how he handled the flowered fingers. He wiped the blood off the sign. Stuck paper towels around each finger and duct taped them back together. Finished the sign and just had to stain it a bit darker so you couldn't see where the blood stains were.   My step father is an amazing man. But a Black Widow bite to his inner thigh and he broke after a couple hours. It was hurtful to watch for sure. Knowing the pain was so intense that splaying the skin around your fingers couldn't even compare. I felt so bad. Never lost respect for him and still scared shitless he could probably still destroy me. And I'm 37 with my own grown kids.
spiderbro,3dxn4z,ifnull,2,Tue Jul 21 02:10:36 2015 UTC,I had minor necrosis from an untreated bite.
spiderbro,3dxn4z,Heratiki,2,Tue Jul 21 01:18:57 2015 UTC,Necrosis is probably the worst possible thing outside of death you could get. What exactly causes necrosis from the bite does anyone know?
spiderbro,3dxn4z,usedtoilet,2,Tue Jul 21 02:11:13 2015 UTC,"Don't quote me on this but I watched some clip on YouTube and it mentioned that the cause of necrosis in cases of bites is usually because of special proteins from the toxin.  The protein causes structural damage to a cell, causing it to break/die prematurely."
spiderbro,3dxn4z,Heratiki,1 point,Tue Jul 21 07:00:10 2015 UTC,I've heard something similar but doing cursory research on Widow bites doesn't show any necrosis as an effect of the bite. Not that it can't happen I'm  just curious how it happens!
spiderbro,3dxn4z,theamazingroberto,1 point,Tue Jul 21 12:59:58 2015 UTC,an untreated bite   : |
spiderbro,3dxn4z,WellPaidRichPerson,9,Tue Jul 21 04:52:52 2015 UTC,And let's not forget that they're very docile. Bites are the result of accidental (or intentional) handling.
spiderbro,3dxn4z,fatis4punching,2,Mon Jul 20 17:12:16 2015 UTC,Fatal Attraction
spiderbro,3dvq8z,Captainstupid13,4,Sun Jul 19 22:48:28 2015 UTC,"Don't know about bro status, but I love the pattern."
spiderbro,3dvq8z,SubDee54,3,Mon Jul 20 07:23:00 2015 UTC,"It's a juvenile female.  so, shebro."
spiderbro,3dvq8z,fayettevillainjd,1 point,Mon Jul 20 14:14:44 2015 UTC,Bro  With intro. Worth it.  Straight to the action
spiderbro,3dusy6,aLonelyClone,5,Sun Jul 19 18:07:10 2015 UTC,"That's not a banana spider?   If not, then man I'm in for a surprise."
spiderbro,3dusy6,flipett,5,Sun Jul 19 22:18:30 2015 UTC,"This is a banana spider.  It is apparently also called a golden orb weaver, TIL.    This type of spider has become much more common in the woods where I live.  We used to have a species of orb weaver here that was circular, more orb like if you will, but I hardly ever see those anymore."
spiderbro,3dusy6,Rookwood,2,Sun Jul 19 23:06:32 2015 UTC,This is so meta. This conversation happened earlier today too.
spiderbro,3dusy6,SewingLifeAlchemist,2,Mon Jul 20 03:27:37 2015 UTC,"I visited Hongkong this summer, and those bros were everywhere. The largest one we found had a leg span of about 10 inches."
spiderbro,3dwfjc,Quezacotl24,2,Mon Jul 20 02:32:35 2015 UTC,Some type of jumping spider.
spiderbro,3dwfjc,grendel_x86,1 point,Mon Jul 20 03:00:42 2015 UTC,"It has a slight green shimmer and very long, thick front legs. Found in northeast Ohio Here's a blurrier pic, but shows its legs more spread out http://imgur.com/NaeQcDL Edit: Here's a GIF http://imgur.com/htCfQ3T"
spiderbro,3dwfjc,Michaelfear,1 point,Mon Jul 20 02:33:56 2015 UTC,"More cat then spider, wicked fun to handle and hangout with, when my friends or family say they hate spiders I find one and talk them into holding it, needless to say they fall in love right away"
spiderbro,3dujqj,SplodeyMart,6,Sun Jul 19 16:48:14 2015 UTC,"Can't see it's back very well but it looks like Steatoda triangulosa. Triangulate orbweaver.  /r/spiders could probably away for sure, especially if you give them your location."
spiderbro,3dujqj,fluffyxsama,2,Sun Jul 19 17:45:07 2015 UTC,"This is it! Thank you. This was in Idaho. (I posted from my husband's account, but I took the picture.)  Glad to know it's a friendly bro. Happy little short-sighted cobweb spinner. I hope the baristas don't find her, I'll be happy to see her again next Sunday."
spiderbro,3dujqj,StarBelliedSneetches,4,Mon Jul 20 18:01:08 2015 UTC,Fun fact:  Spiders are affected by caffeine much like humans are affected by alcohol.  Poor little guy might be drunk...
spiderbro,3dujqj,Invictus227,2,Sun Jul 19 22:07:34 2015 UTC,He looks like a little coffee bean! :D
spiderbro,3dujqj,Debinatrix,2,Sun Jul 19 19:02:42 2015 UTC,"Definitely a brown widow. The good news is--he's kind of harmless. I used to live in a house full of them, and I didn't notice for the longest time because they hid as soon as they saw a shadow (they built their webs close to the carpet, and our carpet lining was poorly attached to the wall and big enough for them to hide in). They lived off of the roaches. This was in San Antonio, and not my house. Bad news is, pesticide doesn't work on them, so you'll have to get rid of him manually if you don't think he's bro enough."
spiderbro,3dujqj,arydactl,2,Mon Jul 20 01:38:06 2015 UTC,"looks like a brown widow, but I cant see the hourglass.  their bites aren't as harmful as their black cousins, but I would still recommend caution when handling them.  it could also be a false widow perhaps, though I've not seen one that brown."
spiderbro,3dujqj,fayettevillainjd,3,Mon Jul 20 14:21:36 2015 UTC,"Are you in SoCal or somewhere in that general vicinity? If so, this looks to be the Latrodectus Geometricus, or the Brown Widow, one of the only not-bro spiders I've come across. You may have noticed a lack of Black Widows in your area; this is soley because Brown Widows are not bros. Basically, they came from Africa and are astonishingly quickly driving the Black Widows out of their home. Anyhow, sorry for the rant, I just have a personal vendetta against these invasive bastards who are killing all the REAL bros. I suggest, however unpleasing it may sound, that you eliminate this feller. I am truly sorry to be the one to bring you this news."
spiderbro,3dwq9t,RolainTheVariable,4,Mon Jul 20 04:13:26 2015 UTC,"Honestly, if you've already done the research and know they won't hurt you, the best thing to do is to go handle bugs and spiders. Head to the local park, find a small, innocuous bug and start there, like a lady bug or caterpillar, watch them for a bit then pick one up. Rolie Polies work too. Then find small house spiders and just watch them. Literally just watch them move, think, problem solve, it's entrancing. Once you've got enough watching under your belt, just nudge one onto your arm or hand and let it explore. You'll grow more comfortable the more you know about them and more you play with them."
spiderbro,3dwq9t,Mad_Hatter93,2,Mon Jul 20 06:02:58 2015 UTC,I agree about rolley polleys. great intro bug.
spiderbro,3dwq9t,fayettevillainjd,1 point,Mon Jul 20 14:16:33 2015 UTC,"The one problem I find is accepting that they won't hurt me. Whenever I see a spider, the first thought is ""I don't want to get bit.""  When you play with spiders, how do you not get bit?"
spiderbro,3dwq9t,Mad_Hatter93,1 point,Mon Jul 20 16:08:48 2015 UTC,"House spiders, the ones you can find in any corner of a house, don't really bite. I've handled plenty of them and never been bitten. You just kinda stick your hand in their walking path and they climb right on. Jumping spiders don't bite either, and they're the cutest most inquisitive little arachnids ever :-)"
spiderbro,3dwq9t,8leggedyogi,1 point,Mon Jul 20 16:49:29 2015 UTC,"The initial comment is correct, they generally simply won't try. And honestly most of the spiders you would interact with are simply too small or to weak even if they wanted to."
spiderbro,3dwq9t,rogue_chicken,2,Tue Jul 21 12:00:32 2015 UTC,"I would add besides watching, do a lot of research and learn as much as possible. Years ago I was terrified of spiders and one day I sat down and looked at as many pictures of spiders in Google image search as I could, trying to appreciate something about each one. I gained a lot of respect for these elegant smart animals that day."
spiderbro,3dwq9t,fayettevillainjd,1 point,Mon Jul 20 07:32:29 2015 UTC,"I've never had a problem with bugs, but spiders I was afraid of until a year or two ago. I honestly credit /r/spiders completely for helping me overcome that fear.  I just browsed that sub everyday for months until I was pretty good at identifying.  once I understood what the (two) 'dangerous' spiders were in my area and how to identify them, I could cast all my other fears as illogical.  now I love spiders!"
spiderbro,3dwq9t,fayettevillainjd,1 point,Mon Jul 20 14:18:40 2015 UTC,Are the two dangerous spiders the brown recluse and black widow?
spiderbro,3dwq9t,fayettevillainjd,1 point,Mon Jul 20 16:09:17 2015 UTC,"in my area, yes.  depending on where you live, there could be more or less."
spiderbro,3dwq9t,fayettevillainjd,1 point,Mon Jul 20 16:10:46 2015 UTC,"Yup, I just looked it up and the only two spiders that are dangerous where I live are the widow and brown recluse."
spiderbro,3dwq9t,Ahhmyface,1 point,Mon Jul 20 16:16:46 2015 UTC,"well there you go.  the only thing is that the brown recluse and male southern house spider look very similar. otherwise, they are both really easy to identify.  so basically if you see a spider and it's not one of those two, then you are good to go!"
spiderbro,3ds87a,dieseldoggy,6,Sat Jul 18 23:22:58 2015 UTC,Pretty sure that is a yellow garden spider.
spiderbro,3ds87a,Gummybear_Qc,3,Sat Jul 18 23:44:18 2015 UTC,"Thanks so much! My roommates were super freaked out, but he was just chillen out not bothering anyone haha"
spiderbro,3ds87a,SewingLifeAlchemist,-1,Sun Jul 19 00:34:41 2015 UTC,"We call those banana spiders where I'm from. They come from Central America with bananas. I saw a massive one once. The body was at least the size of my hand. I was much younger though, so I don't know how big it actually was."
spiderbro,3ds87a,missinfidel,6,Sun Jul 19 00:50:04 2015 UTC,"You're probably from Florida (or anywhere south, but they're super prevalent in southern Florida), and you're thinking of golden orb weavers (sometimes misidentified as banana spiders). Garden spiders arr much smaller than golden orb weavers"
spiderbro,3ds87a,SewingLifeAlchemist,2,Sun Jul 19 05:08:02 2015 UTC,"Louisiana actually, so yeah. Close enough"
spiderbro,3ds87a,Gummybear_Qc,1 point,Sun Jul 19 05:34:28 2015 UTC,"Funny how you call them banana spiders there. They are completely different and quite dangerous, the real banana spiders. https://en.wikipedia.org/wiki/Brazilian_wandering_spider"
spiderbro,3ds87a,SewingLifeAlchemist,1 point,Sun Jul 19 17:23:05 2015 UTC,"According to Wikipedia, many, many spiders are called banana spiders, so I wouldn't call those the ""real"" banana spiders."
spiderbro,3ds87a,Gummybear_Qc,1 point,Sun Jul 19 20:01:50 2015 UTC,"Oh, well for me banana spiders were always the ones that came in banana crates, thus the brazillian wandering spider."
spiderbro,3ds87a,SewingLifeAlchemist,1 point,Sun Jul 19 21:05:25 2015 UTC,"I've always been told that these do, but that could be misinformation."
spiderbro,3ds87a,scootette,2,Sun Jul 19 21:29:02 2015 UTC,That's actually the lady spider. She's harmless. The bro spider is a little bitty dude. Usually lime green.
spiderbro,3ds87a,punxerchick,1 point,Sun Jul 19 16:40:00 2015 UTC,"Figured as much - most female insects, arachnids, etc are the larger of the species"
spiderbro,3dt56p,Jeremynow,2,Sun Jul 19 05:09:40 2015 UTC,Is he translucent?
spiderbro,3dt56p,SweetLenore,3,Sun Jul 19 05:29:49 2015 UTC,"Far too small for me to tell, I'm afraid. It's either translucent or shaded brown very very lightly. It has two big and dark palps that can't be seen in the picture."
spiderbro,3dr4co,tkseoul,2,Sat Jul 18 17:28:31 2015 UTC,Looks kinda like a false black widow male.  Kinda.   Post to /r/spiders.  They will figure it out for sure.
spiderbro,3dr4co,SistaSabuda,1 point,Sat Jul 18 21:11:52 2015 UTC,Sorry for potato quality
spiderbro,3dr4co,TotesMessenger,1 point,Sat Jul 18 17:28:51 2015 UTC,"I'm a bot, bleep, bloop. Someone has linked to this thread from another place on reddit:   [/r/whatsthisbug] What's this spider that moved into my light? [X-Post from r/spiderbro]   If you follow any of the above links, please respect the rules of reddit and don't vote in the other threads. (Info / Contact)"
spiderbro,3dnkss,SamMee514,8,Fri Jul 17 18:53:47 2015 UTC,X-post Subreddit Link: /r/awwducational   Original post: https://www.reddit.com/r/Awwducational/comments/3dmfjg/bagheera_kiplingi_is_the_first_known_spider_that/
spiderbro,3dnkss,XPostLinker,9,Fri Jul 17 19:11:01 2015 UTC,Aww with a cute little banana too!
spiderbro,3dnkss,Dat_Creep,2,Fri Jul 17 22:02:01 2015 UTC,Do you think they have a cute little spider banana farm?
spiderbro,3dnkss,SweetLenore,2,Sat Jul 18 06:34:18 2015 UTC,I feel like you just cured my arachnaphobia a little
spiderbro,3dnkss,CatsandPudding,6,Sat Jul 18 08:16:47 2015 UTC,"short article on the little fella. also they're known to be cannibals, which i think is the most metal vegetarian ever."
spiderbro,3dnkss,santeeass,1 point,Sat Jul 18 13:35:32 2015 UTC,"If they're cannibals, they can't be vegetarian. They'd be omnivorous at best."
spiderbro,3dnkss,zeniiz,2,Sat Jul 18 16:45:47 2015 UTC,"well, if you really wanna split hairs, true vegetarians don't exist, because there's always gonna be some sort of insect that'll sneak its way into fruits/veggies. in any event, though, most of the other articles i saw refer to B. kiplini as ""mostly vegetarian""."
spiderbro,3dnkss,santeeass,2,Sun Jul 19 02:36:26 2015 UTC,If that banana is to scale that is one big fucking spider!
spiderbro,3dnkss,Spdrjay,1 point,Sat Jul 18 11:33:55 2015 UTC,Ironic considering it's named for a panther. Cute though!
spiderbro,3dnesu,Mjbishop327,18,Fri Jul 17 18:09:11 2015 UTC,this is more cringeworthy than anything
spiderbro,3dnesu,DMTryp,7,Sat Jul 18 00:51:40 2015 UTC,Apparently this gif attracts spiders. http://imgur.com/gallery/hGvctPV
spiderbro,3dnesu,juanLegTapDance,3,Sat Jul 18 00:56:36 2015 UTC,"OP, why she didn't take a pic of it?"
spiderbro,3dnesu,nmarshall23,1 point,Sat Jul 18 01:51:44 2015 UTC,She sounds dumb
spiderbro,3dnesu,Brobi_WanKenobi,-4,Sat Jul 18 04:24:51 2015 UTC,Congratulations I'm unsubscribing
spiderbro,3dpejc,Iceclaw526,2,Sat Jul 18 04:18:43 2015 UTC,"Yes, although the web is looking kind of rough."
spiderbro,3dmfki,Singlot,5,Fri Jul 17 13:33:19 2015 UTC,"Hi ho, hi ho..."
spiderbro,3dmfki,DarkRubberDucky,2,Fri Jul 17 17:29:19 2015 UTC,I hate flies with a burning passion so this makes me incredibly happy.
spiderbro,3dmfki,Psychodelli,2,Fri Jul 17 21:27:50 2015 UTC,Awww eat up you cute little thing!
spiderbro,3dmfki,Hoody711,2,Sat Jul 18 01:12:56 2015 UTC,"""Bro, do you mind? Trying to eat here. This is why I never come here. Boy, you wait, I'm gonna spend all day writing a bad yelp review."""
spiderbro,3dmgui,amaster09,2,Fri Jul 17 13:44:53 2015 UTC,"Rock on, little guy.That title doe....."
spiderbro,3dmgui,CptJustice,2,Fri Jul 17 21:57:07 2015 UTC,"I know. I saw it a few hours ago. I first wrote, ""follow your own path"" but didn't like it and apparently stopped deleting too early."
spiderbro,3dmgui,VaqueroJustice,2,Fri Jul 17 22:00:33 2015 UTC,"I have a number of little jumpers living in my vehicle. I worry about them, but since I keep finding their webs and seeing them from time to time, I assume they are ok."
spiderbro,3dnkto,echoesguitar91,3,Fri Jul 17 18:54:02 2015 UTC,"Friend!  Of the Lycosidae, wolf spiders.  I'm crap with ID'ing wolfies though.  I don't know which you have there, but whatever variety, totally friend, not foe!"
spiderbro,3dnkto,zipbangcrash,3,Fri Jul 17 18:59:49 2015 UTC,"Awesome! Thanks! It was a decent-sized bro, kinda spooked me when I saw him from the corner of my eye. But thanks to this sub, I'm no longer afraid of spiders. I just took the pic and bid the bro adiue."
spiderbro,3dnkto,zipbangcrash,1 point,Fri Jul 17 21:56:27 2015 UTC,Fabulous!
spiderbro,3dmcvp,sdpet,3,Fri Jul 17 13:06:47 2015 UTC,NEAT! had an Orb Weaver here at my apts last fall. Their webs are always sooo dern pretty.
spiderbro,3dmcvp,NotQuiteOnTopic,2,Fri Jul 17 14:03:31 2015 UTC,"Argiope* typo, oops!"
spiderbro,3dmcvp,fayettevillainjd,1 point,Fri Jul 17 13:10:03 2015 UTC,I've never heard someone call it a writing spider. she's a beaut though!
spiderbro,3dmcvp,fayettevillainjd,2,Fri Jul 17 14:10:26 2015 UTC,"That's all I heard it called growing up haha, that along with if it wrote my name I'd die  I used to be terrified of them, but they are very beautiful!"
spiderbro,3dmcvp,wunderwood157,1 point,Fri Jul 17 14:21:21 2015 UTC,Everyone used to call them banana spiders when I was a kid.  now I see garden spider and zipper spider a lot.
spiderbro,3doemx,StarscreamKills,2,Fri Jul 17 22:45:47 2015 UTC,Cellar spider aka daddy long legs which is definitely a bro.
spiderbro,3doemx,Purplesunset0304,1 point,Fri Jul 17 23:53:58 2015 UTC,Thanks. I don't know a lot about spiders and this sub is really informative and cool. I went from being freaked out by them to being fascinated.
spiderbro,3doemx,SweetLenore,2,Sat Jul 18 00:02:47 2015 UTC,These were my favorite as a kid. And I was scared of spiders when I was a kid! But these were always alright by me.
spiderbro,3dnr8l,AjaxMelondes,2,Fri Jul 17 19:41:18 2015 UTC,Wild guess here but I'm going to say either a yellow sac spider or long jawed orb weaver. Your location would help others be more specific though.
spiderbro,3dnr8l,Purplesunset0304,1 point,Fri Jul 17 19:51:45 2015 UTC,South Mississippi along the coast. They're all over the hotel I work at. Lots and lots of bugs are being eaten.
spiderbro,3dkodv,Grape_leaves,5,Fri Jul 17 01:21:10 2015 UTC,This spider has been hanging in my side mirror for about a month. I just tap him and he runs behind the mirror -  that is a good spot for highway driving.  It's pretty amazing that he has a new web each time and has been hanging around for so many miles.
spiderbro,3dkodv,Insert_Whiskey,4,Fri Jul 17 01:23:05 2015 UTC,"That pretty fucking cool! 'Hey spiderbro, we're about to get moving.  Go behind the mirror so you don't blow away'. 'Yeah yeah I'm going.'   Maybe he has another crib back there.  Spider couch, maybe a tiny xbox..."
spiderbro,3dkodv,fayettevillainjd,5,Fri Jul 17 01:33:14 2015 UTC,That little shit is living the dream while I slave away!
spiderbro,3dkodv,Purplesunset0304,2,Fri Jul 17 01:51:53 2015 UTC,"this is pretty interesting, as those both seem to be females of the same species. spiders aren't typically very social, so this is peculiar to me.  they do look fairly small for cross orbs.  maybe they are sisters! I'm an idiot"
spiderbro,3dkodv,fayettevillainjd,1 point,Fri Jul 17 14:14:36 2015 UTC,It's one spider in a mirror.
spiderbro,3dit3e,officialxian,29,Thu Jul 16 16:46:10 2015 UTC,"Dolomedes tenebrosus, a fishing spider that's more adapted to woodlands. I've held a few of these, they're very gentle :)"
spiderbro,3dit3e,Satanic_Ginger,9,Thu Jul 16 17:10:05 2015 UTC,Really?? I had a dolomedes down on my dock but that one looked a bit different. I wonder if this is her because I haven't seen that one in awhile. I had to move the cinder block she was in so I moved her onto the grass.
spiderbro,3dit3e,Satanic_Ginger,9,Thu Jul 16 17:12:25 2015 UTC,"The Dolomedes genus has a lot of variation in colors, patterns, spots and stripes, but I'm pretty sure that is D tenebrosus you've got there. I wouldn't reckon she's the exact same spider you saw before, she probably has a few brothers and sisters in the area ;D"
spiderbro,3dit3e,Satanic_Ginger,11,Thu Jul 16 17:18:21 2015 UTC,I definitely don't doubt that its a dolomedes :) here's a picture of the one I had down at the dock... http://i.imgur.com/5iJuhqH.jpg
spiderbro,3dit3e,The_Smeow_is_Mine,5,Thu Jul 16 17:20:02 2015 UTC,They're everywhere! There must be some good fishing in that lake
spiderbro,3dit3e,The_Smeow_is_Mine,8,Thu Jul 16 17:23:42 2015 UTC,"China Lake, Maine, it's one of the top 100 bass fishing lakes in the world!  Edit: number 23: http://www.bassmaster.com/slideshow/top-100-bass-lakes-2014"
spiderbro,3dit3e,zipbangcrash,6,Thu Jul 16 17:26:50 2015 UTC,Dolomedes scriptus. My boyfriend brought me one back from Rhode Island recently.
spiderbro,3dit3e,Malicious_Mischief,2,Fri Jul 17 03:02:57 2015 UTC,"I think it's a tenebrosus due to the more subtly markings on the ""back"", it's hard to tell though :)"
spiderbro,3dit3e,fayettevillainjd,3,Fri Jul 17 03:15:13 2015 UTC,"Your original pic is tenebrosus, but the one down on the dock looks more like scriptus."
spiderbro,3dit3e,zachillo,1 point,Fri Jul 17 03:49:58 2015 UTC,"Lucky!  The my spouse-fellow and our housemate are too terrified to consent to me keeping one in the house.  I would sooooooo love to have a Dolomedes. Preferably tenebrosus since I love the patterning so. le sigh  I'm working on them both, but it's slow going.  Edit - added some emphasis."
spiderbro,3dit3e,PardonMyNerdity,7,Fri Jul 17 18:32:28 2015 UTC,Looks like some kind of wolf spider. I am most definitely not an expert though.
spiderbro,3dit3e,deadlittlepuppy,22,Thu Jul 16 17:09:25 2015 UTC,"easy mistake! it's not the most obvious angle, but this spider's legs are too long to be a wolfie.  the best indicator in this pic, though, is the way its hovering over its egg sac.  wolfies actually drag their egg sacs behind them, like this: https://en.wikipedia.org/wiki/Wolf_spider#/media/File:20071030_Wolf_Spider_Carrying_Egg_Sac_(Masked).jpg"
spiderbro,3dit3e,WeightyUnit88,2,Thu Jul 16 17:42:32 2015 UTC,"I'm not sure what it is exactly, but it looks like a wolf spider.  I have tons of these near my pond, they're very gentle.  They do bite though, so don't mishandle them."
spiderbro,3dit3e,bran_dong,3,Thu Jul 16 17:14:16 2015 UTC,I've compared pictures to another D Tenebrosus I have on my property and I think she's a D Tenebrosus
spiderbro,3dit3e,TimonAndPumbaAreDead,2,Thu Jul 16 17:21:26 2015 UTC,That's Carla.
spiderbro,3dk4j8,Insert_Whiskey,4,Thu Jul 16 22:33:07 2015 UTC,"I love this is all its glorious mundanity!  Thanks for posting, and I hope to see continued updates!"
spiderbro,3dk4j8,zipbangcrash,1 point,Thu Jul 16 23:24:49 2015 UTC,Haha glad you liked it!
spiderbro,3dk4j8,MonkeyWithMachete,1 point,Fri Jul 17 00:34:10 2015 UTC,What was the spiders name?
spiderbro,3dkdkp,Mr_FLuiD,2,Thu Jul 16 23:47:25 2015 UTC,I hope he remembered to turn it off when he left.
spiderbro,3dkdkp,SweetLenore,2,Fri Jul 17 03:59:45 2015 UTC,"Me too!  I left it on but it's also the room where I store my extra stock of beer for boating so I should probably go down there and check it out, bring a couple koozies!  :)"
spiderbro,3dkow5,deadlittlepuppy,2,Fri Jul 17 01:25:20 2015 UTC,no pic?
spiderbro,3dixj2,NewbRule,1 point,Thu Jul 16 17:19:01 2015 UTC,"What kind of spider is this? I actually saw the exact kind yesterday and was wondering, but couldn't catch a good enough picture."
spiderbro,3djqis,mrouija213,4,Thu Jul 16 20:48:19 2015 UTC,"Keep finding these all over my house in Virginia, pretty sure it's a brown recluse, aka not so spiderbro."
spiderbro,3djqis,brocas_helm,-2,Thu Jul 16 20:49:11 2015 UTC,all spiders are bros
