spiderbro,3djqis,StrawberySwitchblade,7,Thu Jul 16 20:53:32 2015 UTC,"I generally agree when we're talking just me... Not so much when it involves my 4 year old. I've been teaching him that spiders are Bros, much to his mother's behest."
spiderbro,3djqis,brocas_helm,5,Thu Jul 16 21:27:55 2015 UTC,"Yeah, my husband and I are in a war for my daughter's soul. If she can't like them, I hope that she at least won't be afraid of them."
spiderbro,3djqis,brocas_helm,4,Fri Jul 17 00:47:22 2015 UTC,"Yeah, our little man has no fear. Thunder and lightning? He jumps for joy counting them. Spiders and other 'creepy crawlies'? He wants to put them in his bug inspection kit so he can get a closer look. I love his fearlessness"
spiderbro,3djqis,brocas_helm,1 point,Fri Jul 17 01:02:15 2015 UTC,your little dude is gonna have some crazy girlfriends
spiderbro,3djqis,brocas_helm,4,Fri Jul 17 01:05:40 2015 UTC,"Lol, he already does... So he says. 2 girls at school (daycare), 1 teacher at school, 1 college girl from a baseball game, and another girl he met at the beach that teaches high school math. He introduces all the older ones to me, trying to get me in trouble I think..."
spiderbro,3djqis,SweetLenore,2,Fri Jul 17 01:09:39 2015 UTC,oh my god i need a kid
spiderbro,3djqis,danceswithronin,1 point,Fri Jul 17 01:14:21 2015 UTC,"Haha, yeah the baseball game was hilarious. He climbed further up the bleachers to sit next to this cute blonde and offers her his popcorn. Then he just starts telling her random kid things. Next thing I know he's all ""that's my mrouija213"" which caused me to turn around to her waving. Then mom was all ""well, at least if something happens to me you won't be alone for long."""
spiderbro,3djqis,Tralan,2,Fri Jul 17 01:28:32 2015 UTC,yeah that makes sense. if i had a kid they'd be in a bubble
spiderbro,3djqis,SweetLenore,2,Thu Jul 16 21:45:15 2015 UTC,"I want him to experience the world , but not a recluse bite"
spiderbro,3djqis,danceswithronin,3,Thu Jul 16 22:19:15 2015 UTC,"maybe not all spiders are bros, after all"
spiderbro,3djqis,danceswithronin,1 point,Thu Jul 16 23:11:13 2015 UTC,Recluses are nothing to mess around with. I wouldn't call them bros unfortunately.
spiderbro,3djqis,SpideyScott,5,Fri Jul 17 03:01:10 2015 UTC,"Yes, that is a brown recluse. If these are all over your house, you probably need to get some pest control involved."
spiderbro,3djqis,fayettevillainjd,6,Thu Jul 16 21:59:41 2015 UTC,"I was thinking that myself... I find them literally everywhere. Under the bathroom sink, behind the coffee pot, all over the garage and work shop... It's crazy. I actually find more recluses than anything else."
spiderbro,3djqis,ohherroeeyore,10,Thu Jul 16 22:16:50 2015 UTC,"You, my friend, need to get some Harvest Men in your house (sometimes called Daddy Long Legs, depending on where you're from).  They eat other bugs, and also plant matter.  And while then you'd have harvest men in your house, they are non-venomous and their mandibles are made for chewing, not injecting.  They're also not super aggressive and docile, and more bros than a lot of spiders."
spiderbro,3dhbbo,Thortimer_,3,Thu Jul 16 07:19:54 2015 UTC,Is that a yellow sac?
spiderbro,3dhbbo,SweetLenore,1 point,Thu Jul 16 09:26:26 2015 UTC,"That's what it looks like to me. I've got one living in my bathroom, at the moment. But with the lighting in this picture it does look close to a recluse as well."
spiderbro,3dhbbo,SadAndMalone,1 point,Thu Jul 16 17:09:34 2015 UTC,"It was about 2 1/2 inches from leg to leg if that helps identify it. Might have been bigger, it evilly contemplated like that above my bed all night.  I think he's waiting till I fall asleep..."
spiderbro,3dhbbo,SadAndMalone,1 point,Thu Jul 16 17:39:40 2015 UTC,"Well, Long-legged sac spiders are nocturnal, which would explain why he wasn't moving while you were there with the light on. The one in my bathroom does the same thing, and is about the same size. I'd say you're fine, but I am by no means an expert."
spiderbro,3dhbbo,semibacony,1 point,Thu Jul 16 18:51:27 2015 UTC,That's what I was thinking.
spiderbro,3dhbbo,MoistCrayons,2,Thu Jul 16 20:27:25 2015 UTC,I wish he wasn't directly over my bed... I'll never sleep tonight.
spiderbro,3dhbbo,zipbangcrash,2,Thu Jul 16 07:21:04 2015 UTC,"Pretty sure it's a recluse. Try to move bro if you can, but if you know you can't, bro's gonna have to take one for the team."
spiderbro,3dhbbo,zipbangcrash,1 point,Thu Jul 16 14:10:50 2015 UTC,"Just my luck, the one time I try to be a bro to a spider..."
spiderbro,3dhbbo,zipbangcrash,1 point,Thu Jul 16 15:16:39 2015 UTC,"I'm not an expert, but that's also not a recluse. Your geographic location might help with a better ID from one of the spID'er fairies, but I'm going to guess male Southern House Spider, Kukulcania hibernalis.  That or sac spider, which is also not dangerous. :)"
spiderbro,3deioe,susanfancyyyy,2,Wed Jul 15 17:25:32 2015 UTC,Whassat say?
spiderbro,3deioe,mikaosol,2,Wed Jul 15 20:50:20 2015 UTC,mbin
spiderbro,3deioe,PrudeJesus,1 point,Wed Jul 15 22:33:26 2015 UTC,"He was sitting in front of a reminder notecard that said ""cannot be combined with other discounts"" he was so tiny under the letter b :)"
spiderbro,3deioe,Vid-szhite,2,Thu Jul 16 16:06:45 2015 UTC,"The leg stripes and the eye pattern, plus the fact that he is looking at you with curiosity, all say jumping spider to me. A bro if ever there was one.  Jumpers are easy to spot. Most have two large eyes in front and two small eyes to the side, striped legs, and a distinct posture. Their good eyesight means they can recognize faces, and they will look at cameras and make eye contact if they see you watching them. Love the little buggers."
spiderbro,3deioe,Kothophed,2,Wed Jul 15 23:14:52 2015 UTC,They're the most sociable spider I've ever met.  Though when they jump around at you it still startles me.
spiderbro,3deioe,Vid-szhite,2,Thu Jul 16 11:37:53 2015 UTC,Can confirm. Their jump is shockingly fast. Startles me too.
spiderbro,3deioe,SweetLenore,1 point,Thu Jul 16 12:24:54 2015 UTC,He was super neat! I discovered he was a jumper when I tried to take him outside and he bounced all over the notecard I had gotten him on and my hand. Definitely made my heart pounce the first time he jumped- I think I was worried he would fall to his death from my hand if he wasn't careful haha
spiderbro,3dgkn7,katzekuchen,4,Thu Jul 16 02:38:55 2015 UTC,cross orbweaver!
spiderbro,3dgkn7,brocas_helm,2,Thu Jul 16 03:09:42 2015 UTC,Thank you! I thought it might be a small orchard spider but the coloring is different.
spiderbro,3dgkn7,Sharkn91,1 point,Thu Jul 16 04:12:11 2015 UTC,Other common name is the Orange Nope-weaver. Dunno why but spoders shaped like dis always give me the heebs and jeebs.
spiderbro,3dgkn7,Sharkn91,1 point,Thu Jul 16 13:57:57 2015 UTC,"Aw, don't let them hear you say that!"
spiderbro,3dgkn7,DarkRubberDucky,3,Thu Jul 16 14:52:29 2015 UTC,"I'm slowly overcoming my fear of spiders, I held my GF's tarantula for the first time a couple weeks ago. But the ones with long spindly legs, and the ones with the big donks, like this one, still creep me out."
spiderbro,3dgkn7,brocas_helm,3,Thu Jul 16 14:57:34 2015 UTC,"Baby steps, man. Sounds like you're doing great if you can hold a tarantula. :)"
spiderbro,3dgkn7,fayettevillainjd,2,Thu Jul 16 15:47:56 2015 UTC,"Holy cow, that picture makes them look terrifyingly huge."
spiderbro,3df46w,Clown45,6,Wed Jul 15 19:52:13 2015 UTC,"A ground sac spider, Castianeira amoena (or a closely related species).  It's generally best to provide geographic location when identifying animals as the animal kingdom is full of look alikes.  http://bugguide.net/node/view/39872"
spiderbro,3df46w,Rustnrot,2,Wed Jul 15 23:48:56 2015 UTC,Is it me or does the markings on its body look like one of those statues on Easter Island?
spiderbro,3df46w,ikesbutt,1 point,Thu Jul 16 04:27:06 2015 UTC,"About as close as I could get with my phone before it blurred, he's barely the size of a dime."
spiderbro,3dd2fx,Spiderbubble,7,Wed Jul 15 09:09:42 2015 UTC,"I never kill a spider on sight, relocating them if necessary but they are facinating to watch.   and in a certain light they are super cute, like in your picture there :)"
spiderbro,3dd2fx,Xenomemphate,5,Wed Jul 15 09:37:24 2015 UTC,"It's built into our instincts to be scared of spiders I think, since some of them are fairly dangerous. EDIT: personally i've helped a huntsman spider out of the house with bare hands, but also been scared to death of these black ones with a white stripe and red under the body/top of legs. They looked mean."
spiderbro,3dd2fx,Speedy-Dyl,5,Wed Jul 15 11:32:25 2015 UTC,"I like spiders but they freak me out a bit, I always get this heart palpitation when I first spot one. I won't kill them though, I'll always use the old cup and paper technique to move them outside. This sub is helping me appreciate what cool little dudes they are."
spiderbro,3dd2fx,JimElectric,2,Wed Jul 15 13:24:55 2015 UTC,Join /r/spiders too!
spiderbro,3dd2fx,fluffyxsama,3,Wed Jul 15 14:28:45 2015 UTC,I can understand the fear of spiders. I used to run from one when ever I saw one. But thanks to reddit over the last few years I love them. What annoys me most are the people who feel the need to spray them with aerosol products or try to light them on fire. Or just kill them just to do it.
spiderbro,3dd2fx,UltimateTaker,2,Wed Jul 15 14:55:53 2015 UTC,"Yes, it does annoy me and make me sad that when an insect/spider (that's not a butterfly or ladybug) is mentioned in a chat room, 99% of the other people go ""ewww, kill it with fire."" I got picked on a lot in middle school as I was the kid that wouldn't kill the bug."
spiderbro,3dd2fx,Dragonheadthing,2,Wed Jul 15 14:37:47 2015 UTC,Something so small shouldn't be able to kill me. Simple as that. I know I will probably never even get bit by a deadly spider. But just the fact that they exist scares the shit out of me.
spiderbro,3dd2fx,hinowisaybye,1 point,Wed Jul 15 17:00:24 2015 UTC,"Are you very old, very young, or have a compromised immune system? If not, its very unlikely any spider is going to kill you."
spiderbro,3dd2fx,Zewbacca,2,Wed Jul 15 23:41:51 2015 UTC,"It's not the spiders themselves that are scary, I think we project our fear of the unknown on them. They're hunting tactics are terrifying as well, but less so and less dangerous to humans than mosquitos by orders of magnitude.   Now, house centipedes, those are some scary motherfuckers running around slaughtering our spiderbros."
spiderbro,3dd2fx,Cloughtower,1 point,Wed Jul 15 17:36:37 2015 UTC,"Woah, woah, woah. Those guys are out hunting bros?! I mean, I already hated them enough"
spiderbro,3dd2fx,Katryonyx,1 point,Thu Jul 16 15:03:12 2015 UTC,"I once turned a light on to see one with a fresh-killed bro.   Sometimes when I'm out smoking a cig, I'll see one come out of the crack between the siding and the brick of my house and run around the door frame munching them."
spiderbro,3dd2fx,Cloughtower,2,Thu Jul 16 15:34:03 2015 UTC,"I wouldn't call them adorable, necessarily, but it does make me sad to see all the ""kill it with fire!"" reactions.  I have a couple little wolf spiders in my apartment somewhere, they don't bother anything and they keep the pests out."
spiderbro,3dd2fx,kasira,1 point,Wed Jul 15 18:29:06 2015 UTC,I always let mine keep their webs up.
spiderbro,3dd2fx,pingas-9000,1 point,Wed Jul 15 20:01:04 2015 UTC,"Spiders definitely do not deserve the hatred that they commonly recieve. To blindly label them all as dangerous, undesirable creatures in spite of all the great things they do is so naive. They're being the best spiders they can already; cut them some slack."
spiderbro,3dd2fx,SIRoldharry,1 point,Thu Jul 16 02:15:29 2015 UTC,I like spiders but I can definitely understand how they give people the heebee jeebies. That said instead of just dealing with it there is this weird movement for people to act like a bitch and kill them or run away scared.
spiderbro,3dbzj3,xSPYXEx,13,Wed Jul 15 02:16:34 2015 UTC,"Go home spiderbro, you're drunk."
spiderbro,3dbzj3,Spdrjay,7,Wed Jul 15 10:18:01 2015 UTC,"seriously, he looks absolutely trashed, stumbling home from the bars"
spiderbro,3dbzj3,brocas_helm,7,Wed Jul 15 13:01:24 2015 UTC,Fascinating. Hope the poor guy didn't die in the heat. He looks on the verge of insanity.
spiderbro,3dbzj3,zak7199,19,Wed Jul 15 07:42:55 2015 UTC,"He's cute. I was running a test when I heard my coworker screaming bloody murder. I guess it snuck up behind her while she was going through boxes.  No idea what kind it is though. Apparently it's a fishing spider, not entirely sure though. It's male because those weird dickbutt feet things are spiderdicks. I don't know how it works either.  We put him back outside where he'll probably get burned to a crisp in the Georgia heat. I wanted to keep him but my coworker calmly told me ""I swear to fucking god kill that fucking thing get it out of this office right now stop bringing it closer I swear I'll have you fired"".  RIP spiderbro, you won't be forgotten."
spiderbro,3dbzj3,brocas_helm,6,Wed Jul 15 02:16:55 2015 UTC,"it looks like it's drugged or something, or deformed, retarded"
spiderbro,3dbzj3,brocas_helm,7,Wed Jul 15 02:50:40 2015 UTC,"I mean not really, just pissed off at being stuck in a glass jar."
spiderbro,3dbzj3,bobsizzlack,9,Wed Jul 15 03:27:48 2015 UTC,maybe. his legs just look wacky as fuck
spiderbro,3dbzj3,Sharkn91,4,Wed Jul 15 03:36:59 2015 UTC,I just had a proper giggle fit reading that comment. Haven't heard/read someone using Wacky in a long while haha
spiderbro,3dbzj3,fayettevillainjd,2,Wed Jul 15 12:25:30 2015 UTC,"Yeah, tell your retarded, deformed coworker to stop doing drugs."
spiderbro,3dbzj3,OfMiceAndMenus,3,Wed Jul 15 12:19:32 2015 UTC,"I think it's actually a huntsman, Heteropoda venatoria though I couldn't find an image of one with that exact coloration."
spiderbro,3dbzj3,after_burner,1 point,Wed Jul 15 12:36:30 2015 UTC,The aussies told me it wasn't a Huntsman.
spiderbro,3dbzj3,after_burner,1 point,Wed Jul 15 14:03:58 2015 UTC,"Aussies have a different type of huntsman, but this is the more tropical climate version. Theirs are a bit bigger and more brown, while ours are usually whitish/tan with dark patterns.  https://en.wikipedia.org/wiki/Heteropoda_venatoria"
spiderbro,3dbzj3,brocas_helm,3,Wed Jul 15 14:49:51 2015 UTC,"It's male because those weird dickbutt feet things are spiderdicks.    Spinerettes are not the spider's dickbutt lol.    When they want to breed, they make a web, crawl under it and then blow a years worth of jizz all over it.   After this they punch it to get their pedipalps, the small arms on the front all jizzy. (The fists if you prefer) . Once they find a female they lift up her front legs and punch the sperm into her body (into the oviduct).  You can tell if it's a male in some species by looking for hooks on the first two legs about half way up the leg, or by checking to see if the pedipalps look like ""boxing gloves"" because on males they're larger and rounder at the tips than females. Based on your first picture I think you can see one of the hooks on it's legs, so it is a male."
spiderbro,3dbzj3,after_burner,3,Wed Jul 15 16:01:21 2015 UTC,Spiders are weird.
spiderbro,3dbzj3,brocas_helm,3,Wed Jul 15 16:08:34 2015 UTC,"Yup. It's even weirder when you have a bunch of horny eight-legged freaks, drumming in their cages for some sweet spider-poon at 2am."
spiderbro,3dbzj3,after_burner,2,Wed Jul 15 16:33:22 2015 UTC,in how many species do the females cannibalize the male?
spiderbro,3dbzj3,fluffyxsama,1 point,Wed Jul 15 18:36:33 2015 UTC,"I don't know off hand, but I'd say most. It really depends on how hungry the female is, and how fast the male can get away.   My experience is from breeding Tarantulas, and I lost plenty of males. All though it seemed like the female was less ""aggressive"" toward the male after if she'd been power fed leading up to the pairing attempt."
spiderbro,3dbzj3,OfMiceAndMenus,1 point,Wed Jul 15 18:46:44 2015 UTC,is opportunistic cannibalism typical among spiders?
spiderbro,3dbzj3,Naga-ette,1 point,Wed Jul 15 18:55:51 2015 UTC,"Based on all of my ""experiments"" with communal Tarantulas, I'm inclined to say yes. They're very instinctual creatures and will attack any food item when hungry.  I've only had one successful communal set up, and I lost half of the Ts to other Ts in the commune. (This was with Holothele sp. IIRC)"
spiderbro,3d9wox,islandeyes,3,Tue Jul 14 17:15:58 2015 UTC,"Check your couch cushions, that's where he leaves his rent."
spiderbro,3d9wox,RedditInfinity,3,Tue Jul 14 19:41:24 2015 UTC,He's a tan jumping spider
spiderbro,3dc0n8,1fym,2,Wed Jul 15 02:25:30 2015 UTC,Nightmares for a week. Thanks XD
spiderbro,3dc0n8,PyroDexxRS,2,Thu Jul 16 17:27:26 2015 UTC,Nope. This crossed the line.
spiderbro,3dc0n8,TheWordThis,1 point,Wed Jul 15 16:30:50 2015 UTC,A lovely family!
spiderbro,3dc0n8,Ahhmyface,1 point,Thu Jul 16 18:23:09 2015 UTC,Keeping their feet out of the snow!  What a concerned mama!
spiderbro,3d92eh,Purplesunset0304,6,Tue Jul 14 13:29:05 2015 UTC,"So this guy obviously has some battle scars. I went to put gas in the car and saw him hiding there. Well I coaxed him out for a pic and tried to hold him. He jumped off my hand and I didn't see where he went. When I got back to the car after going inside the store, I saw him climbing up the pump very slowly. I coaxed him onto my keys and put him back in his hiding spot. He seemed very happy with that. I figured he would be safer there.   Tl;Dr I selfishly tried holding a bro, he ran, I felt bad, put him back in his spot.   Edited for FYAC and addition of tl;dr."
spiderbro,3d92eh,evlgns,2,Tue Jul 14 13:31:32 2015 UTC,I'm sure he wasn't too mad about it since he hopped on your keys to go back. :)
spiderbro,3d92eh,kurohyou53,2,Tue Jul 14 16:42:59 2015 UTC,That's a nice pattern on that little bro
spiderbro,3d92eh,DarkRubberDucky,2,Tue Jul 14 19:26:31 2015 UTC,Good thing you returned him to his lair. He may have some spider ladies coming over. You gotta be a good wing man and let the ladies see him with his own place.
spiderbro,3d91pb,Galihan,1 point,Tue Jul 14 13:22:47 2015 UTC,"I had a pact with my bathroom spiderbro, you stay in here and get all the free bugs and I don't stomp your brains out. Well it was all great for about 6 months then one day he vanished, I found him on the bottom of my shoe when he appeared on the wall next to my bed."
spiderbro,3d91pb,XB1_Atheist_Jesus,1 point,Tue Jul 14 14:51:11 2015 UTC,"Yes, I don't appreciate when bros get into my space."
spiderbro,3daojm,HaraDoon,1 point,Tue Jul 14 20:24:09 2015 UTC,Them eyelashes though
spiderbro,3daojm,balls_d33p,2,Wed Jul 15 00:23:31 2015 UTC,a real diva
spiderbro,3dblb7,NauseatedNarwhal,1 point,Wed Jul 15 00:24:51 2015 UTC,just your everyday cellar spider. i've got a million in my garage and two in my room now. totally harmless and totally cool
spiderbro,3d67ds,STiNkYh,16,Mon Jul 13 21:01:27 2015 UTC,Read the book because of the game. Was not disappointed.
spiderbro,3d67ds,Justmindless,4,Mon Jul 13 23:34:08 2015 UTC,Was it better than the game in your opinion? I kinda want to pick it up.
spiderbro,3d67ds,Jubawub,5,Tue Jul 14 00:30:40 2015 UTC,It was just different. A lot of the info from the book is in the game anyway. I would try the audiobook. it was very immersive.
spiderbro,3d67ds,Justmindless,2,Tue Jul 14 00:44:08 2015 UTC,Thanks :D
spiderbro,3d67ds,Jubawub,2,Tue Jul 14 02:44:09 2015 UTC,"I have only read about a hundred pages in, and I have to agree that it is very different from the game, but it's different in a so much better way.  You have more complexity in the characters, and since there is actually dialouge from the main character, you get more immersed in what's going on.  If you can, pick it up and read it, it's well worth it!"
spiderbro,3d67ds,Jubawub,2,Tue Jul 14 08:23:55 2015 UTC,"I'll try to find it, thanks! :)"
spiderbro,3d67ds,Dopebear,3,Tue Jul 14 17:03:27 2015 UTC,Except it's very typical on Russian literature where there's a lot of dialogue. A lot of dialogue. That put me off of the novel a little but picked it up and read it after finishing the game a few times and still enjoyed it.
spiderbro,3d67ds,whoreticulturalist,1 point,Tue Jul 14 12:10:39 2015 UTC,"Personally I LOVE that amount of dialouge. Roadside Picnic and the movie STALKER are pretty much built on dialouge, and that's one of the reasons why I love it so much! :)"
spiderbro,3d67ds,CoolCatHobbes,4,Tue Jul 14 17:35:17 2015 UTC,"I just played though Last Light in two sittings, I really want to get a copy of this book from the library to read!"
spiderbro,3d67ds,ncopp,2,Mon Jul 13 22:40:40 2015 UTC,How do you like the book so far?
spiderbro,3d67ds,lilroy4,1 point,Mon Jul 13 23:19:12 2015 UTC,"It is really good. I am a sucker for post-apocalyptic things, and it's hard to put the book down.  It has the same storyline as the game, but it has so much more complexity, immersion and so much more to offer.  So I would say I recommend it!"
spiderbro,3d67ds,Shniggles,2,Tue Jul 14 08:19:44 2015 UTC,I honestly thought it said a single nope instead of a single hope. Sounded right either way
spiderbro,3d67ds,WcJessen,2,Tue Jul 14 02:35:12 2015 UTC,That book was great and it made me a little afraid to be out in the dark
spiderbro,3d67ds,DoggoneCat,1 point,Tue Jul 14 05:45:09 2015 UTC,"I've never been in a metro tunnel before, but after reading the books and playing the games, I'd probably be pretty wary..."
spiderbro,3d6ztp,jorgeous,6,Tue Jul 14 00:37:44 2015 UTC,"Close up, he said it's an orb weaver."
spiderbro,3d6ztp,fayettevillainjd,1 point,Tue Jul 14 00:39:01 2015 UTC,"yep, big ole orby. Genus Argiope. possibly Argiope aurantia"
spiderbro,3d6ztp,CosmicVomit,2,Tue Jul 14 14:19:07 2015 UTC,Spiderbro just wants to help.
spiderbro,3d6ztp,dokepi,1 point,Tue Jul 14 07:25:17 2015 UTC,"We have those here in Brasil, they are scary and I often have nightmares with them. Cuz they are big and make big webs. Often in high places."
spiderbro,3d2sw8,Gingerstachesupreme,5,Mon Jul 13 01:54:12 2015 UTC,"Aww, Blue!"
spiderbro,3d2sw8,missinfidel,3,Mon Jul 13 15:13:48 2015 UTC,It's so beautiful. what kind of jumper is that?
spiderbro,3d2sw8,Lyratheflirt,1 point,Mon Jul 13 17:11:25 2015 UTC,"Could be wrong (probably am), but it looks like a female Phidippus Regius Jumping Spider. Roommate wasn't as enthusiastic about her cuteness, so I had to release this she-bro."
spiderbro,3d2sw8,SciFriedRice,2,Mon Jul 13 19:46:45 2015 UTC,"It looks like a grandpa bro ready to tell you a story about ""Back in my day..."""
spiderbro,3d2it5,befuchs,23,Mon Jul 13 00:25:42 2015 UTC,It's stories like this that make me tell anyone who enters my house that all spiders within are bros and don't you dare ever touch any of them.
spiderbro,3d2it5,SweetLenore,18,Mon Jul 13 01:01:39 2015 UTC,"If I find them in my house I put them in a glass and let them outside now. I ain't gonna kill you for being creepy looking and trying to live, that's fucked up"
spiderbro,3d2it5,DyceFreak,6,Mon Jul 13 02:20:00 2015 UTC,"I'm guilty of breaking that rule. Normally I love them as they've been catching a lot of stuff but... There was a spider incubating in the corner of my room for about a week. I left her for a while but once I noticed how big the egg sack she was carrying was getting I decided to impose the rule, ""I'm the only one who gets to make babies in my bedroom"" so I kicker her out. I'd do the same with humans even though there's a slightly less chance of them producing a million crawlies to swarm me in my sleep."
spiderbro,3d2it5,alienfrog,14,Mon Jul 13 15:19:22 2015 UTC,Truly epitomises what this sub is all about. What an epic emotional journey.
spiderbro,3d2it5,spockified,2,Mon Jul 13 02:02:22 2015 UTC,Never thought I would care for a spider like this
spiderbro,3d2it5,fatis4punching,10,Mon Jul 13 20:31:43 2015 UTC,"This was beautiful. Rest easy, bro."
spiderbro,3d2it5,IdioticSavanting,16,Mon Jul 13 03:03:56 2015 UTC,"You should kill your dad, see how he likes it."
spiderbro,3d2it5,IdioticSavanting,5,Mon Jul 13 05:01:51 2015 UTC,"As a women who has been known to host spiderbros in her kitchen compost area, I know the pain of the ""slap"", ""clap"", and ""smack"".   RIP Ichabod and Ichabod ll.   I'm going to make spiderbro signs for the house, anyone else want one? ""My other roommate is a spiderbro""  etc...  Also, how do we get this on r/bestof ?"
spiderbro,3d2it5,IdioticSavanting,2,Mon Jul 13 11:44:23 2015 UTC,Got any that would fit on a Honda Nighthawk?
spiderbro,3d2it5,Olive_Jane,2,Mon Jul 13 11:50:52 2015 UTC,I'd be happy to make one.  Have a snazzy catchphrase in mind?
spiderbro,3d2it5,TotesMessenger,3,Mon Jul 13 12:33:01 2015 UTC,Here rode spiderbro. He who softened the hearts of men.
spiderbro,3d2it5,IdioticSavanting,1 point,Mon Jul 13 17:31:21 2015 UTC,"Pm me your address if you want me to send it to you. I'll make it tonight and post photos. I'm on Guam time, so it's currently around noon right now, just FYI."
spiderbro,3d2it5,IdioticSavanting,1 point,Tue Jul 14 01:43:51 2015 UTC,Gone but not forgotten.
spiderbro,3d2it5,SweetLenore,1 point,Mon Jul 13 20:14:48 2015 UTC,"I'm a bot, bleep, bloop. Someone has linked to this thread from another place on reddit:   [/r/bestof] Here rode spiderbro, he who softened the hearts of men. An unlikely tale of friendship and woe from r/spiderbro   If you follow any of the above links, please respect the rules of reddit and don't vote in the other threads. (Info / Contact)"
spiderbro,3d3kmj,blackrabt,5,Mon Jul 13 06:19:42 2015 UTC,http://imgur.com/jVCg3yI
