spiderbro,3cb0bm,romple,2,Mon Jul 6 14:34:42 2015 UTC,I believe that is the banner spider over at /r/spiders. Leucauge venusta or the orchard orb weaver
spiderbro,3cazpi,Alantha,2,Mon Jul 6 14:29:54 2015 UTC,That's a Wolf spider. My favorite bros! Maybe Hogna spp.. Where are you located?
spiderbro,3cazpi,fayettevillainjd,1 point,Mon Jul 6 20:49:19 2015 UTC,"Austin, TX"
spiderbro,3c9u4b,Billman6,1 point,Mon Jul 6 05:48:57 2015 UTC,update: he was directly above my clothes when I found him and while I was posting this he disappeared. I really don't want him on my clothes
spiderbro,3c9u4b,Alantha,1 point,Mon Jul 6 05:50:07 2015 UTC,"He or she looks like a Cellar spider, totally harmless. Common little house bros."
spiderbro,3cb63v,typhoon937,2,Mon Jul 6 15:20:25 2015 UTC,"Araneus diadematus maybe, where are you located?"
spiderbro,3cb63v,Nacamaka,1 point,Mon Jul 6 15:45:42 2015 UTC,Northern Michigan
spiderbro,3cb63v,Nacamaka,2,Mon Jul 6 17:58:29 2015 UTC,Looks like that's it:  http://www.spiders.us/species/filter/michigan/
spiderbro,3cb63v,fayettevillainjd,2,Mon Jul 6 18:03:20 2015 UTC,"hacklemesh weaver? its some kind of orb weaver, no doubt"
spiderbro,3c7hef,TheHornyToothbrush,17,Sun Jul 5 16:39:06 2015 UTC,"I have a lot of these guys in my house, we never have issues with flies with them around. They usually setup out of the way and never leave their webs. Bros to the highest degree in my opinion."
spiderbro,3c7hef,TheTraegs,6,Sun Jul 5 19:12:16 2015 UTC,"Never in the way, they pay rent, all around nice, what's more to ask for?"
spiderbro,3c7hef,officialxian,3,Sun Jul 5 22:08:15 2015 UTC,Oh good!
spiderbro,3c7hef,QuantumCow,6,Mon Jul 6 05:44:49 2015 UTC,"Looks like a long bodied cellar spider. It'll stay in approximately one place, usually a corner out of your way, and eat bugs for you. I have a few of them in my house and can attest to the fact that they are bros. https://en.m.wikipedia.org/wiki/Pholcus_phalangioides"
spiderbro,3c7hef,Nitrix77,1 point,Sun Jul 5 16:43:22 2015 UTC,"I have like 5 of these guys around my house, including one under my desk like 8 inches from my knee right now.  They are awesome, they eat the sugar ants that get uppity every time I open a sweet beverage."
spiderbro,3c7hef,Nitrix77,1 point,Fri Jul 10 04:41:15 2015 UTC,one under my desk like 8 inches from my knee right now.   See I'll never get how you're okay with that. That would freak me out so much.
spiderbro,3c7hef,Nitrix77,1 point,Fri Jul 10 14:37:10 2015 UTC,"They aren't very big, don't move, and only want to eat bugs :)   Doesn't make sense to be afraid of something that is 1/100000th my size and literally cannot hurt me."
spiderbro,3c7hef,ItwasMothmens,1 point,Fri Jul 10 16:02:58 2015 UTC,Doesn't move? Within in the first few minutes it moved across my bathroom . Now I don't know where it is.
spiderbro,3c51cs,bubbly_honeybee,28,Sat Jul 4 21:19:26 2015 UTC,"No need to apologise. When a moth flies over your screen, distracting you from something that kills you just before the next checkpoint in a game where all of your love interests are watching, that will be penance enough."
spiderbro,3c51cs,PoloJuice,12,Sat Jul 4 23:00:59 2015 UTC,He's already having the time of his life making another beautiful death-web for the local riff raff i'm sure he'll let it slide
spiderbro,3c51cs,deedledaw,4,Sat Jul 4 23:08:58 2015 UTC,"You actually probably did him a service; if the web was visible, it had collected enough dust to not be particularly viable as a home or a food-catching device (depending on the particular arachnid residing there.)  Sure, he has to rebuild, but you've basically cleared out his old, run-down place."
spiderbro,3c51cs,dorienne_grey,3,Sun Jul 5 09:12:58 2015 UTC,"It takes a spider about 30 minutes to complete a web, so there's really not much harm done."
spiderbro,3c51cs,AchtungKarate,1 point,Sun Jul 5 11:20:00 2015 UTC,"Yeah had the same today, they like making webs around my bike but i need it for transportation ... sorry spiders :( i relocated them to a nearby bush."
spiderbro,3c4bpa,Daggerbite,3,Sat Jul 4 17:25:50 2015 UTC,How... how tiny is he? He looks like he should be grabbing up Hobbitses.
spiderbro,3c4bpa,DarkRubberDucky,2,Sat Jul 4 18:13:52 2015 UTC,"About thumbnail sized when moving about, or little fingernail sized when in the OP image. Macro lens and some good cropping makes him seem bigger!"
spiderbro,3c4bpa,viatorinlovewithRuss,2,Sat Jul 4 19:01:41 2015 UTC,Here he is trying to escape his temporary lodging  https://www.flickr.com/photos/114294704@N05/19385905946/  Happily living outside now
spiderbro,3c4bpa,viatorinlovewithRuss,1 point,Sat Jul 4 17:28:23 2015 UTC,"so Daggerbite, we all know your name is Matt Turner now.  Any relation to Bootstrap?"
spiderbro,3c6knb,facetown,2,Sun Jul 5 09:02:15 2015 UTC,"Looks like a Solifuge. Not a spiderbro, but still a bro if you ask me!"
spiderbro,3c6knb,Feathers678,2,Sun Jul 5 09:26:31 2015 UTC,"Aw, it's a camel spider! Not really a spider, but I love these thing. How long was it?"
spiderbro,3c6knb,Stantrien,1 point,Sun Jul 5 18:48:51 2015 UTC,It was probably about two or three inches long.
spiderbro,3c3rnu,Alantha,1 point,Sat Jul 4 14:13:51 2015 UTC,Neato! Who knew?? I want to see one propelling itself<3
spiderbro,3c3d2w,RinEU,4,Sat Jul 4 10:53:04 2015 UTC,Mexican red-knee?  how friendly/handle-able is he/she?
spiderbro,3c3d2w,viatorinlovewithRuss,3,Sat Jul 4 18:11:08 2015 UTC,"Yeah :) Oh she is really charming ! She is used to me letting her climb on my hand and move her out of her terrarium :) but as every charming lady she has days where she just don't wants to do as told ;) she bit me once so far :)  Edit: looks like today is one of ""those"" days :) but i got an awesome Photo of her trying to scare me off i'll upload it soon :)  Edit2: looks like the photo is not as good as i thought xD light is stiupid :( http://imgur.com/H5wIaEt"
spiderbro,3c3d2w,olddoubleratbling,1 point,Sun Jul 5 10:47:44 2015 UTC,"Wait wait wait, she bit you?"
spiderbro,3c3d2w,orangeunrhymed,1 point,Thu Jul 9 06:28:43 2015 UTC,Yeah unfortunally :) but it was my own fault :) i let the doc check it but the bite of a red knee is comparable with a bee sting
spiderbro,3c3d2w,xblackdog,2,Thu Jul 9 10:10:48 2015 UTC,Best tarantulas ever!
spiderbro,3c3d2w,xblackdog,1 point,Sat Jul 4 20:34:01 2015 UTC,Do you have a pic of the whole viv? haven't seen many Ts with sliding door vivs. Also beautiful T you got there!
spiderbro,3c26y7,RobotFarmer,2,Sat Jul 4 01:58:43 2015 UTC,Did bro catch a wasp?
spiderbro,3c26y7,lDiamondsInTheSkyl,1 point,Tue Jul 7 17:21:19 2015 UTC,Just a big fat fly.
spiderbro,3c0j2s,Phobos_Deimos,17,Fri Jul 3 17:37:29 2015 UTC,"""Look, I was trying to get this really big mosquito and somehow ended up in your very nice home and thought 'Hey, maybe I'll hold down the fort for them!'... Please let me stay. I promise to only crawl on your beds and faces once a month."""
spiderbro,3c0j2s,DarkRubberDucky,6,Fri Jul 3 20:00:44 2015 UTC,"One month later:  ""You know, I really like this house. I can totally see some spider webs on the living room wall, maybe renovate the whole basement for my 43 kids. Ya, I think I'm gonna take over this house, scare the current owners out. Don't even need to kill them.""  Cuz that's what I'd do if I saw this 'bro' in my house..."
spiderbro,3c0j2s,Prettyniceguytoo,12,Sat Jul 4 05:00:04 2015 UTC,woozah that's a biggy
spiderbro,3c0j2s,Astilaroth,8,Fri Jul 3 19:26:04 2015 UTC,"Aphonopelma hentzi? Where are you located, OP?"
spiderbro,3c0j2s,TopHatAce,6,Fri Jul 3 22:05:49 2015 UTC,"Austin, Texas!"
spiderbro,3c0j2s,TopHatAce,8,Fri Jul 3 22:16:20 2015 UTC,Then my previous guess stands
spiderbro,3c0j2s,TopHatAce,5,Fri Jul 3 22:20:08 2015 UTC,"It looks similar, but the one I caught was darker, just a little less hairy, and it was more gangly. Maybe it was younger? Do they 'fill out' like people do, or just increase in scale as they grow?"
spiderbro,3c24g9,current_rotations,1 point,Sat Jul 4 01:33:50 2015 UTC,"Can anyone tell me what he is  I'm from Houston Texas, he was about the size of a penny, maybe a little bigger."
spiderbro,3bw05k,kegcoyote,7,Thu Jul 2 16:38:59 2015 UTC,"Voted!  And holy crap, I spent the last 10 min browsing that site and I'm ready to have aneurysm from all the cuteness"
spiderbro,3bw05k,Dooter,2,Fri Jul 3 00:16:19 2015 UTC,"I too am in love with the Squishable cuteness :) If you want to keep up to date with Squishables as they get approved and released, check out the r/Squishable subreddit!"
spiderbro,3bw05k,moviequote88,2,Thu Jul 9 21:24:42 2015 UTC,"Cool, thanks!  I subbed.  :D"
spiderbro,3bw05k,Dooter,2,Thu Jul 9 21:36:42 2015 UTC,Awesome :D
spiderbro,3bw05k,moviequote88,11,Thu Jul 9 22:01:53 2015 UTC,I like spiderbros and cute little fat stuffed animals. Consider this supported.
spiderbro,3bw05k,Amazonpage,6,Thu Jul 2 18:38:24 2015 UTC,"Shameless plug!  Okay, they're not fat, but my wife makes some great stuffed spiders!"
spiderbro,3bw05k,BC_Hawke,6,Fri Jul 3 07:52:20 2015 UTC,Those are FUCKING ADORABLE.  I MUST HAVE ONE
spiderbro,3bw05k,Trollioo,2,Fri Jul 3 10:39:24 2015 UTC,"I have seen these before and they're awesome. I really want one, but they're a little out of my price range ATM. I might have to bite the bullet and save for one."
spiderbro,3bw05k,Amazonpage,10,Fri Jul 3 16:32:02 2015 UTC,I feel like they messed up the pedipalps a bit. They need to use a different fuzzy fabric for that portion and then use a bit of the same fabric on the face. It would make it look more cute.
spiderbro,3bw05k,SweetLenore,2,Thu Jul 2 16:50:05 2015 UTC,"As the concept artist, I agree completely on the palps. The moustache might have been left off for simplification so I can understand that, but... fuzzy palps please :<"
spiderbro,3bw05k,Wollo,9,Mon Jul 13 17:51:04 2015 UTC,"The plush has been sitting in 'in progress' status since 2014, I figure a bit of support via their email notice system might push them to get the ball rolling on producing this spiderbro."
spiderbro,3bw05k,DagonDoesDallas,2,Thu Jul 2 16:40:31 2015 UTC,I for one would love to have a Squishable spiderbro!
spiderbro,3bw05k,Jaberkaty,2,Fri Jul 3 07:52:15 2015 UTC,Maybe a crosspost to /r/spiders and /r/awwnverts?
spiderbro,3bw05k,squishable,2,Fri Jul 3 10:55:01 2015 UTC,"Just noticed this!  SO, the spider design looks good but were having some trouble with the back - getting that exact type of tie-dyed fur has become a lot more difficult and we're trying to decide if it would be better with just purple.  I promise we're working on it though...:)"
spiderbro,3bw05k,Wollo,1 point,Thu Jul 9 19:18:58 2015 UTC,"Oohhh, I thought it might be a cost thing since the prism animals seem pricier than the regular ones, not a supply issue... is that the reason prism owl is out of stock too? How could tiedye ever be allowed to run out, what an injustice D: Rainbow butt spots are glorious though, please rainbow butt spots if at all possible! Even if they have to be pastel rainbow, or another of the prism colors (blue-purple is a really good one too!)  And, I agree the palps should still be fuzzy like in my concept, even if he doesn't get his moustache :P"
spiderbro,3bw05k,Wollo,1 point,Mon Jul 13 17:48:23 2015 UTC,"Woah, I'm always super glad that people like my design so much :D I was pretty overwhelmed with the support I got on that round of OpenSquish and I've been refreshing the in-progress page for a year, still hype to see him go into production <3"
spiderbro,3bw6my,my_futureperfect,8,Thu Jul 2 17:28:44 2015 UTC,Attack your coworker. Revenge!
spiderbro,3bw6my,InfernoTurnip,6,Thu Jul 2 18:09:19 2015 UTC,Good work looks to be in good condition still. What happened?
spiderbro,3bw6my,evlgns,4,Thu Jul 2 17:48:20 2015 UTC,"My coworker slapping at him with a stick and laughing. I took the stick and gently brushed at the really large jumping spider with my hand. I was trying to pick him up, but he was having none of that. My coworker told me that he was going to hurt me. ? . No way."
spiderbro,3bw6my,SweetLenore,3,Thu Jul 2 18:34:32 2015 UTC,"Dwah, poor little buddy. Maybe your coworker has bad aim and he didn't hit him luckily. Good job saving the bro. :-D"
spiderbro,3bwn8m,citricacidx,3,Thu Jul 2 19:31:40 2015 UTC,Dunno why it pixelated so bad.  http://imgur.com/OJpWaz8
spiderbro,3bu3wd,HSDclover,14,Thu Jul 2 04:08:06 2015 UTC,"An update, after almost an hour of tirelessly webbing, the spider finally got it. Eat well my friend."
spiderbro,3bu3wd,Sleeper_in_the_code,7,Thu Jul 2 04:28:52 2015 UTC,"Spiders always freaked me out as a kid, now i could just watch one work for hours."
spiderbro,3bu3wd,dbe7,1 point,Thu Jul 2 04:30:21 2015 UTC,"Looks like a daddy long leg.  Interesting note here:   The web has no adhesive properties but the irregular structure traps insects, making escape difficult. The spider quickly envelops its prey with silk and then inflicts the fatal bite. The prey may be eaten immediately or stored for later.   It's the Jigsaw of spiders."
spiderbro,3btbyj,Naknaknaknaknaknak,9,Wed Jul 1 23:51:03 2015 UTC,"Jewel Spider (Gasteracantha cancriformis or Austracantha minax, depending on your location). I had literally hundreds of these at my old house. We had a path between our garage and house that was the perfect length and height for them.  I can't tell you how many times I ran into those guys going to school or work in the morning. And they come in a TON of colors!"
spiderbro,3btbyj,DarkRubberDucky,4,Thu Jul 2 05:23:20 2015 UTC,Where I live they are Spiny-backed Orb weavers. The name spiny backed orb weaver sounds way cooler. I let on of these guys spin a web on both of my hands when I was swimming.
spiderbro,3btbyj,AweInspiringPickle,2,Thu Jul 2 22:11:55 2015 UTC,I can't tell you how many times I ran into those guys going to school or work in the morning.   I initially read this as saying that the spiders were going to school and work in the morning.
spiderbro,3btbyj,Traejeek,1 point,Fri Jul 3 03:33:35 2015 UTC,"Well, a few times I DID find them on me at work or school, so both apply!"
spiderbro,3btbyj,DarkRubberDucky,1 point,Fri Jul 3 03:44:10 2015 UTC,"Clearly, these are spiders with ambition and work ethic.  Stay in the yard and subsist on whatever happens to fly into their webs?  Nope; these bros are gonna go to school and breed sustainably-farmable fruit flies, like eight-legged Norman Borlaugs."
spiderbro,3btbyj,FeroxCarnivore,2,Fri Jul 3 05:28:50 2015 UTC,They are super amazing. If you run into their webs early evening... by daylight they have a whole new web up and ready to go. I kid you not when I say there were four in the row one morning... I had web on my glasses... it was beautiful.
spiderbro,3btbyj,DarkRubberDucky,2,Fri Jul 3 05:37:44 2015 UTC,"That's badass it looks like a skulltula from Zelda, what type of spider is this. Not gonna lie though it is a little creepy."
spiderbro,3btbyj,kizzeret,1 point,Thu Jul 2 03:12:10 2015 UTC,Spider companion is best companion.
spiderbro,3btbyj,FeroxCarnivore,1 point,Thu Jul 2 02:36:03 2015 UTC,Thanks so much everyone. I didn't realize this would get so many upvotes so quickly. This was actually my first post ever. (Besides from the same pic on r/pics to find the right subreddit).
spiderbro,3bul46,TheBubblewrappe,1 point,Thu Jul 2 07:28:31 2015 UTC,What area/region do you live in?
spiderbro,3bul46,kevlarkate,1 point,Thu Jul 2 17:31:52 2015 UTC,Los Angeles
spiderbro,3bul46,kevlarkate,2,Thu Jul 2 18:20:13 2015 UTC,My best guess would be a plain old wolf spider http://www.spiderzrule.com/wolf7.htm
spiderbro,3bul46,kevlarkate,2,Thu Jul 2 18:36:18 2015 UTC,That was my guess also!! Just wanted confirmation. Took me a week but he finally came off the ceiling to the floor and I got him outside. I named him Harold.
spiderbro,3bul46,kevlarkate,3,Fri Jul 3 09:20:55 2015 UTC,Hahaha he just wanted to be your roommate!
spiderbro,3bt8n3,Mughi,4,Wed Jul 1 23:23:28 2015 UTC,Awh so cute :3  I love jumping spiders
spiderbro,3bt8n3,TamedShozzie,1 point,Thu Jul 2 06:37:16 2015 UTC,That's a great pic!  Love the jumpers.
spiderbro,3brfcv,P-dubbs,2,Wed Jul 1 15:26:58 2015 UTC,Pretty!  Her markings remind me of a glass mosaic.
spiderbro,3brfcv,great-granny-jessie,2,Wed Jul 1 17:39:52 2015 UTC,Has the look of one I recently shared. Orchard Orb weaver. The official spider of /r/spiders if I am not mistaken.  Fantastic photo.
spiderbro,3brfcv,EGSlavik,1 point,Wed Jul 1 22:04:11 2015 UTC,Wow very nice. What is she hanging on to?
spiderbro,3brfcv,SweetLenore,1 point,Wed Jul 1 18:46:58 2015 UTC,"Some string that the bean plants are climbing, like this."
spiderbro,3brfcv,Faifig,1 point,Wed Jul 1 20:01:01 2015 UTC,"Wow, I didn't know such a small spider could make a web so thick."
spiderbro,3brfcv,abqnm666,3,Thu Jul 2 00:24:12 2015 UTC,"If I ever met any spider that could spin silk that thick I'd crown him and bow down, because he'd be as big as a small dog."
spiderbro,3bt9uf,boom3r84,3,Wed Jul 1 23:33:26 2015 UTC,Still better protection than Norton
spiderbro,3bqu4u,GIMPKING,2,Wed Jul 1 12:17:55 2015 UTC,I saw him moving on the wall and took this picture. Then I went to chill on the couch and I saw him there as well. He is a chill dude.
