victoriajustice,379otr,Colorfag,3,Tue May 26 01:20:53 2015 UTC,"From what I read. Someone she followed on twitter changed her name to something anti-Ariana. So, all Ariana fans that love to hate on Vic showed up in the comments."
victoriajustice,379otr,serendipitybot,3,Tue May 26 02:34:59 2015 UTC,Why cant we all just get along  Also both girls are great.
victoriajustice,3770qt,aomiep,0,Mon May 25 11:57:58 2015 UTC,Wow where is this photoshoot from?
victoriajustice,3770qt,CrackerJackBunny,13,Mon May 25 17:53:36 2015 UTC,You can find more there : https://imgur.com/a/Mowew
victoriajustice,3770qt,ThiefofNobility,11,Mon May 25 18:47:06 2015 UTC,Wow. I mean she's gorgeous to begin with but this shoot makes her look like a God Damn supermodel.
victoriajustice,3770qt,skiier23,1 point,Mon May 25 18:53:26 2015 UTC,amazing i just downloaded all these. thank you sir!
victoriajustice,3770qt,rulegamerz,2,Tue May 26 02:37:00 2015 UTC,It's from Kode Magazine  https://www.youtube.com/watch?v=VpHtHqjI-No
victoriajustice,3770qt,wisecracker1000,1 point,Mon May 25 18:04:46 2015 UTC,she's bronde
victoriajustice,3770qt,SilentDstroyr,1 point,Wed May 27 12:20:52 2015 UTC,Its kind of crazy seeing Tori Vega looking so sexy. How much one person can change in a few years.
victoriajustice,374son,Dedbent,2,Sun May 24 21:47:53 2015 UTC,"She's so skinny now that she's started losing her curves. Urgh, why do some girls do this!"
victoriajustice,374son,Haines11,1 point,Mon May 25 00:24:33 2015 UTC,"I'm not gonna deny, in some clothes it looks like she has no ass, but that is the fault of the clothes. She isn't too skinny and she is curvy. Just look at some more recent pics of her"
victoriajustice,374son,reecej101,0,Mon May 25 09:47:32 2015 UTC,I have and she's too skinny in them as well.
victoriajustice,374son,Haines11,1 point,Mon May 25 11:12:24 2015 UTC,"she doesnt look too skinny to me, she looks fine. she may be skinnier than you want but that doesnt mean she is too skinny. she looks lovely and still has her curves"
victoriajustice,374son,reecej101,3,Mon May 25 11:19:30 2015 UTC,I realised after I posted that I should have said that she's too skinny in my eyes as do I realise that one man's poison is another man's pleasure.  I'm just concerned is all.
victoriajustice,371b2h,Dedbent,3,Sat May 23 22:58:44 2015 UTC,"Got this from the photog's IG. Here is a link to a pic on his site. I tried to mess aroud with #s in the link to get a bigger version, but failed. Maybe someone else can succeed."
victoriajustice,371b2h,agkman,1 point,Sat May 23 23:17:36 2015 UTC,We need more outtakes from all of her shoots over the last 6 months.
victoriajustice,36pu4n,-OP_pls-,4,Thu May 21 04:03:39 2015 UTC,"It's a very glamorous and elegant way of saying ""I'm not wearing any underwear ;)"". She pulls it off great though. Simply gorgeous."
victoriajustice,36pu4n,JPLnavy,5,Thu May 21 16:47:42 2015 UTC,"Well I did some research and seems like this thing: NSFW https://imgur.com/Ggc6uaV is still called underwear. I could be wrong, but I think she could be into this stuff. Either way she's very good at messing with us. lol"
victoriajustice,36pu4n,HamLis,5,Thu May 21 20:29:14 2015 UTC,Case Closed she said herself that she was wearing underwear https://instagram.com/p/29noNEHIHP/
victoriajustice,36pu4n,DiamondRyce,1 point,Thu May 21 23:54:24 2015 UTC,"I was gonna say no way but after closer inspection I figured out how they did it, if they did it. I'll let the illusion trick me regardless."
victoriajustice,36pu4n,JPLnavy,7,Fri May 22 00:22:37 2015 UTC,"How do you sit in a dress like that?  And, uh, how do you wear underwear?  I volunteer to investigate further."
victoriajustice,36pu4n,hnf1975,-1,Thu May 21 13:33:33 2015 UTC,WHOOOOO is doing her makeup these days?! i love VJ she's my vote for the hottest girl in the world but in these pix her face is a dif color than the rest of her skin on her bod
victoriajustice,36neok,DiamondRyce,1 point,Wed May 20 17:33:36 2015 UTC,Still not sure where she is on the list since Maxim only said Taylor Swift is number one. Still a nice a picture of Vic even in Black and White.   number 8 on the slideshow of the link.   Edit: Not sure why Ari is the thumbnail of this link. Lol
victoriajustice,36neok,expletiveadded,1 point,Wed May 20 17:34:52 2015 UTC,I was confused for a second.
victoriajustice,36neok,expletiveadded,1 point,Thu May 21 07:39:30 2015 UTC,Yup. How you doing man haven't seen you on this subreddit for awhile?
victoriajustice,36ev25,Dedbent,2,Mon May 18 21:04:03 2015 UTC,"So once again with Cosmo, we seemingly miss out on a great pic with that outfit at 13-14 seconds with the shear fabric.  Something similar is in the magazine with the hat, but it's certainly not the same outfit.   Too bad, hope for outtakes that will never appear."
victoriajustice,36ev25,agkman,1 point,Mon May 18 21:50:09 2015 UTC,Here it is on Lusine's Instagram.
victoriajustice,3691kp,Dedbent,3,Sun May 17 10:19:50 2015 UTC,that's one mind fucking image.
victoriajustice,368d2z,cobyz831,6,Sun May 17 03:54:12 2015 UTC,Maddie got some titties and all... but Vicky is on a whole 'nother level of ravishing right here.
victoriajustice,368d2z,SlimJonesWall,1 point,Mon May 18 01:14:46 2015 UTC,"Right on.  Her sister would stand out in a crowd, but Victoria is obviously star quality."
victoriajustice,368d2z,idrink211,3,Fri May 29 01:10:34 2015 UTC,Wish they would do porn together.
victoriajustice,363zfc,PokemonTrainerYellow,1 point,Fri May 15 22:39:23 2015 UTC,gooby pls
victoriajustice,362xr5,DiamondRyce,4,Fri May 15 17:29:14 2015 UTC,"She is literally the definition of ""perfection""."
victoriajustice,362xr5,makeonebreak,-9,Fri May 15 22:29:13 2015 UTC,i'd give her a work out....WITH MY DICK!
victoriajustice,362xr5,skiier23,2,Sat May 16 04:18:25 2015 UTC,"You didn't really need the last part, just saying 'i'd give her a workout' implies that anyway. So yeah, I don't really know what else to say except who wouldn't"
victoriajustice,362xr5,reecej101,1 point,Sat May 16 17:02:29 2015 UTC,"once you start finishing sentences with ""with my dick"" its hard to stop."
victoriajustice,35z20k,Dedbent,7,Thu May 14 18:35:00 2015 UTC,HERE are larger but cluttered versions from the digital mag.
victoriajustice,35z20k,hundreddollarman,1 point,Thu May 14 19:15:38 2015 UTC,Hef chose... poorly
victoriajustice,360dq2,Dedbent,2,Fri May 15 01:00:30 2015 UTC,Out to celebrate Harvey's birthday. The site I got these mentioned rumors of the show coming back on another network. I'm not getting my hopes up.
victoriajustice,35zwav,Dedbent,3,Thu May 14 22:28:00 2015 UTC,I thought it was supposed to be out in June.
victoriajustice,35zwav,agkman,3,Thu May 14 22:28:24 2015 UTC,"It's a VJ project, why wouldn't there be issues in it just coming out normal.  Seriously, everything involving her is so ridiculous.  There's always some sort of delay or issue. I'll believe this movie is coming out when I see it with my own eyes, just like the indie film she made.   Cute poster though."
victoriajustice,35zwav,agkman,2,Thu May 14 22:33:35 2015 UTC,"BTW, the fact its May 14th and the film was supposed to come out June 26th, and no poster or trailer had come out yet should have been a clue something was up.    Even for a smaller film like this, you wouldn't put off any promotion til the last 30 days."
victoriajustice,35zwav,agkman,2,Thu May 14 22:49:17 2015 UTC,"Yeah, you are right. Its been so crazy busy at my job. It seems like March was last week."
victoriajustice,35zwav,hnf1975,2,Thu May 14 23:02:32 2015 UTC,Time flies  Here is the alternate poster that VJ tweeted first (with the wrong date of August 7th ... which seemingly was the first delayed date)  Outskirts Poster 2
victoriajustice,35vaxg,PokemonTrainerYellow,25,Wed May 13 20:28:51 2015 UTC,Bubbled version
victoriajustice,35vaxg,bubblr,10,Wed May 13 20:29:48 2015 UTC,you're welcome :)
victoriajustice,35vaxg,shitting_frisbees,11,Wed May 13 21:45:15 2015 UTC,we've already seen her boobs
victoriajustice,35vaxg,bubblr,6,Wed May 13 23:41:18 2015 UTC,"True, however I'm just saying that I was the one who did the bubbling. Like it or hate it, it's all good."
victoriajustice,35vaxg,thugroid,1 point,Thu May 14 00:09:23 2015 UTC,in fappening?
victoriajustice,35vaxg,shitting_frisbees,1 point,Thu May 14 02:58:07 2015 UTC,yee
victoriajustice,35vaxg,J13D,1 point,Thu May 14 03:42:56 2015 UTC,We did?
victoriajustice,35vaxg,Hybrid23,-1,Sat May 16 04:01:26 2015 UTC,How do you do that?
victoriajustice,35vaxg,lolhaibai,1 point,Thu May 14 06:59:22 2015 UTC,bikini body built for bubbling
victoriajustice,35vaxg,az_max,0,Mon May 18 23:17:26 2015 UTC,yummy
victoriajustice,35vmph,Dedbent,3,Wed May 13 21:57:31 2015 UTC,so purdy
victoriajustice,35tv0e,PokemonTrainerYellow,3,Wed May 13 13:44:39 2015 UTC,a link for the video please...!
victoriajustice,35tv0e,POOYAMON,3,Wed May 13 18:08:02 2015 UTC,"I found it on Bridgit's instagram, but this was the entire video. They do act and sing together in an episode of undateable though (This image is bts on that episode), so you could look that up!"
victoriajustice,35tv0e,POOYAMON,2,Wed May 13 18:32:17 2015 UTC,Thanks man
victoriajustice,35qv24,Dedbent,2,Tue May 12 19:32:40 2015 UTC,The offical shoot was supposed to release today. Just waiting for the HQs.
victoriajustice,35i3lv,Dedbent,2,Sun May 10 16:23:34 2015 UTC,Literally perfect
victoriajustice,35d8bq,idonottip,1 point,Sat May 9 04:42:28 2015 UTC,The dark hair and dark eyes are memorizing
victoriajustice,35d8bq,hoser89,1 point,Sat May 9 08:10:39 2015 UTC,Is she in the movie?
victoriajustice,35d8bq,coscorrodrift,1 point,Sat May 9 12:42:26 2015 UTC,Sadly not. It would have been huge role for her if she were.
victoriajustice,35d8bq,expletiveadded,1 point,Sat May 9 14:01:01 2015 UTC,"What a pity :(   Maybe she appears in a cameo or something, who knows"
victoriajustice,35bjk7,FinnOnTheRun,19,Fri May 8 19:04:14 2015 UTC,I dream of seeing the rear view of those shorts.
victoriajustice,35bjk7,JakeyG14,4,Fri May 8 19:30:01 2015 UTC,You beat me to it.
victoriajustice,35bjk7,MarcAntony,8,Fri May 8 20:10:49 2015 UTC,Looks like a camel got loose from the desert
victoriajustice,35bjk7,jdcnosse,9,Fri May 8 20:26:35 2015 UTC,I'd like to go to the desert and ride that camel.
victoriajustice,35bjk7,Dugommier,3,Fri May 8 22:32:47 2015 UTC,Wow red lips look amazing on her.
victoriajustice,35bn1x,Dedbent,1 point,Fri May 8 19:32:36 2015 UTC,Deleted the old thread when I did some sleuthing and found the shoot.
victoriajustice,35bn1x,reecej101,1 point,Fri May 8 19:33:06 2015 UTC,"hmm doesnt seem as sexy, outfit wise as was previously stated by some on here and on twitter"
victoriajustice,35bn1x,coscorrodrift,1 point,Fri May 8 21:08:37 2015 UTC,Look caliente at the playa. Seriously?
victoriajustice,359av3,DiamondRyce,1 point,Fri May 8 04:32:02 2015 UTC,Wtf?
victoriajustice,3533fu,ILIKEPIE4715,1 point,Wed May 6 18:22:39 2015 UTC,Thanks. I also posted them in the comments here for any non-U.S. peope.
victoriajustice,3512lp,Dedbent,1 point,Wed May 6 05:37:59 2015 UTC,He can try and fail.
victoriajustice,3519j7,DiamondRyce,2,Wed May 6 07:13:05 2015 UTC,So much cheering and whooping. I can hardly hear either of them.
victoriajustice,3519j7,SnobbyLion,2,Wed May 6 20:53:22 2015 UTC,I got them upped. I will say the east coast version is better. It has a nice little booty shot the west coast version doesn't have.  East Coast  West Coast
victoriajustice,3519j7,Dedbent,1 point,Thu May 7 00:10:52 2015 UTC,Yeah we got screwed over when she was singing. The camera only panned to Ed and Bridget.
victoriajustice,3519j7,reecej101,1 point,Thu May 7 00:41:06 2015 UTC,I saw the West Coast Version so this highlight I am assuming is from the East Coast version.
victoriajustice,3519j7,marthasamigo,1 point,Wed May 6 07:13:31 2015 UTC,There's different versions?? Can't they just show the same one
victoriajustice,3519j7,Dedbent,2,Wed May 6 09:06:41 2015 UTC,"It was very slightly different. The highlight I posted was a duet with those two singing some undatable song. On the west coast, we had Ed, Bridgit and Vic singing Britney Spears ""Baby One More Time"".  An apparently the in our we got Ed kissing the guy that was hitting on Victoria."
victoriajustice,3519j7,Jorfent706,1 point,Wed May 6 15:38:56 2015 UTC,Can you say what some of the differences are in the West Coast version? East coast was live. Did they have a separate live version for the West coast?
victoriajustice,3519j7,reecej101,3,Wed May 6 11:29:15 2015 UTC,I have both versions. I could upload them after work if anyone wants them.
victoriajustice,3519j7,marthasamigo,1 point,Wed May 6 12:31:15 2015 UTC,I would love to see them.
victoriajustice,3519j7,Dedbent,1 point,Wed May 6 15:00:02 2015 UTC,would be great if you did
victoriajustice,3519j7,gm33,1 point,Wed May 6 21:06:02 2015 UTC,I'd like to see it. I always thought the WC version was just the taped live version shown on the EC.
victoriajustice,34zule,Dedbent,1 point,Tue May 5 22:52:31 2015 UTC,Link
victoriajustice,34upou,Dedbent,2,Mon May 4 18:45:39 2015 UTC,PIC
victoriajustice,34upou,holla_secret,1 point,Tue May 5 15:53:20 2015 UTC,Could someone upload the west coast version? I will get the east coast feed.
victoriajustice,34upou,expletiveadded,1 point,Mon May 4 18:46:31 2015 UTC,I got them both if u need them.
victoriajustice,34upou,Azkadellio,1 point,Wed May 6 09:50:38 2015 UTC,What time is 'Undateable' supposed to be on tonight? Does anyone know?
victoriajustice,34upou,holla_secret,1 point,Tue May 5 12:04:59 2015 UTC,"9PM Standard Time, 8PM Central Time."
victoriajustice,34upou,Azkadellio,1 point,Tue May 5 15:41:05 2015 UTC,Thank you.
victoriajustice,34kyq1,SD-N,1 point,Sat May 2 01:48:54 2015 UTC,"It would be a shit drawing, but OK!"
victoriajustice,34ibsg,booboo40,6,Fri May 1 12:07:06 2015 UTC,I can't be the only one on here that is happy to see her barefoot!
victoriajustice,34ibsg,rudetubeboobnoob,5,Fri May 1 22:44:46 2015 UTC,"What're the requirements to be considered for ""sexiest woman alive?"" Because Kendall Jenner received second place this year and I think VJ is far more attractive and ""sexy"""
victoriajustice,34ibsg,JPete75,2,Fri May 1 15:55:13 2015 UTC,There are no actual requirements. These lists are just popularity contests.
victoriajustice,34ibsg,expletiveadded,-4,Fri May 1 16:26:26 2015 UTC,ariana grande is number 1 by far
victoriajustice,34ibsg,LordofLight66,1 point,Sat May 2 18:44:31 2015 UTC,"Stunning, never ceases to amaze me how beautiful she is"
victoriajustice,34ibsg,reecej101,-4,Fri May 1 12:39:47 2015 UTC,Wow.. Victoria is such a tease.. Showing her booty with clothes were you can't see her beautiful curves.
victoriajustice,34bpmc,Dedbent,1 point,Wed Apr 29 21:41:12 2015 UTC,Keep an eye out for the singing precap on Undateable's YouTube channel.
victoriajustice,349tba,Menomeee,14,Wed Apr 29 13:09:19 2015 UTC,There are cowboy boots in this picture?
victoriajustice,349tba,ononothimagen,10,Wed Apr 29 16:40:03 2015 UTC,I didn't make it down to the boots.
victoriajustice,349tba,hnf1975,4,Wed Apr 29 18:24:29 2015 UTC,Me either. Sync for Reddit app had the picture preview framed perfectly on her ass...didn't even need to tap on the picture.
victoriajustice,349tba,TheRipePunani,2,Thu Apr 30 18:35:13 2015 UTC,This is the first picture of Victoria that I believe really showed her booty well. mmm I like it OP
victoriajustice,349tba,phataznboy7070,2,Thu Apr 30 02:56:46 2015 UTC,i'd eat a mile of her shit just to see where it comes from.
victoriajustice,346v88,rhcp88,15,Tue Apr 28 19:45:24 2015 UTC,But completely fuckable.
victoriajustice,346v88,JakeyG14,1 point,Tue Apr 28 23:47:30 2015 UTC,What's the back story?
victoriajustice,346v88,legion4it,1 point,Tue Apr 28 20:40:56 2015 UTC,http://hollywoodlife.com/2015/04/28/victoria-justice-undateable-live-show/
victoriajustice,347bm2,Dedbent,2,Tue Apr 28 21:41:05 2015 UTC,Another
victoriajustice,34420q,Dedbent,1 point,Tue Apr 28 03:16:51 2015 UTC,"""Table read for the #Undateable live episode. Watch us mess up our lines and panic on May 5th at 9/8c on NBC!"""
victoriajustice,34420q,agkman,1 point,Tue Apr 28 03:17:30 2015 UTC,Cool. :)
victoriajustice,34420q,JPLnavy,1 point,Tue Apr 28 04:16:45 2015 UTC,It's actually the exact show I had in mind when the thread asked what she should do next. Should be a good watch.
victoriajustice,340q77,-OP_pls-,1 point,Mon Apr 27 11:40:30 2015 UTC,did she teleport back to the 70s?
victoriajustice,340q77,IrishMerica,0,Tue Apr 28 02:02:59 2015 UTC,"Who is that gangly fuck she is with?  I mean, if he can get it on with her, there's hope for the rest of you."
victoriajustice,33yr1l,-OP_pls-,3,Sun Apr 26 22:24:08 2015 UTC,one more  another  --edit-- both added to the gallery
victoriajustice,33biwf,vibeshive,3,Tue Apr 21 04:18:46 2015 UTC,Do those pockets even open?
victoriajustice,33biwf,Cnife,7,Tue Apr 21 19:30:09 2015 UTC,"almost Every girl I've ever talked to told me that their pants pockets are uselessly small and just for show, so these pockets are probably just decorative"
victoriajustice,33biwf,grilsrgood,2,Tue Apr 21 19:42:12 2015 UTC,So tight
victoriajustice,33c68b,-OP_pls-,-1,Tue Apr 21 09:39:05 2015 UTC,Did they purposely find the ugliest people to be in those pictures with her?   God damn.
victoriajustice,3370kt,Dedbent,1 point,Mon Apr 20 03:14:13 2015 UTC,holy cow did jj abrams take this pic? cause dat lens flare man. hehehe.
victoriajustice,3370kt,kingbane,1 point,Mon Apr 20 04:45:51 2015 UTC,HAHA oh man... that was my first thought before I checked the comments.
victoriajustice,333q27,Dedbent,3,Sun Apr 19 05:52:07 2015 UTC,"She's clearly helped create a wonderful and especially talented family, best hopes she spends as much time with them as possible."
victoriajustice,333q27,JPLnavy,2,Sun Apr 19 09:52:18 2015 UTC,Here's hoping for the best possible outcome.
victoriajustice,32yrfz,SD-N,15,Fri Apr 17 20:54:14 2015 UTC,LET THE PHOTO SHOPPING COMMENCE!
victoriajustice,32yrfz,OMEGACY,8,Sat Apr 18 01:33:22 2015 UTC,That bounce off her teeth with a trail of saliva. So epic!
victoriajustice,32yrfz,HamLis,1 point,Fri Apr 17 23:33:31 2015 UTC,i'M sPEECHLESS..... W̴̡̮̝̝̭͘O̵̬̻̦͙̗̩̳̠Ó̷̺̞̝͍̗̼̘͝F̣̪̳͙̫͖̠̩͝͠ ̦̼͢B̵͔̤̠́͢A̡̛̬͕̯̯̙͙̗̺R͖̭̘̣͎̲͠K̻͇̘̫̯ ̴̼̗̺W̵̡̬͓̟͙̝̱̯ͅƠ̭̥͠O̡̝͉͙̬̩̖̩F҉̻̟̝ ੯ੁૂ‧̀͡u
victoriajustice,32jwvg,louistulley,16,Tue Apr 14 11:42:39 2015 UTC,What I would give to see a video of this.
victoriajustice,32jwvg,SnobbyLion,0,Tue Apr 14 12:13:28 2015 UTC,Rekt.
victoriajustice,32jwvg,RANDOM_REPLY_BOT,1 point,Wed Apr 15 09:37:26 2015 UTC,I want to be the meat in that sandwich
victoriajustice,32jwg7,louistulley,2,Tue Apr 14 11:37:14 2015 UTC,Yay :)
victoriajustice,32bplq,Dedbent,6,Sun Apr 12 11:52:13 2015 UTC,"HQ  I added that one and a few more to the set I posted yesterday, check em out :)"
victoriajustice,32bplq,-OP_pls-,1 point,Sun Apr 12 14:14:48 2015 UTC,How do you take a picture and make it higher quality? Seriously asking!
victoriajustice,32bplq,MrSoloDolosFro,4,Sun Apr 12 14:24:50 2015 UTC,"I don't personally, but the person that takes the photos generally works for an agency that posts these images of varying size & quality. Someone then either throws down the cash for it, or they obtain the images some other way, I'm not really familiar with that kind of stuff.  I just find the HQ stuff and post them here :^ )"
victoriajustice,32bplq,-OP_pls-,1 point,Sun Apr 12 14:35:19 2015 UTC,He works for CSI.
victoriajustice,32bplq,TheQuantumiser,1 point,Sun Apr 12 14:36:18 2015 UTC,enhance...Enhance... ENHANCE...
victoriajustice,32bplq,-OP_pls-,2,Sun Apr 12 15:31:07 2015 UTC,Thank God for West Coast weather. That skirt and open back too...fuuck.
victoriajustice,32a4ti,-OP_pls-,1 point,Sat Apr 11 23:43:23 2015 UTC,Cole wants his hat back
victoriajustice,32a4ti,jeegte12,1 point,Sun Apr 12 00:21:50 2015 UTC,I spot a Bob Marley ring on her Coachella-d hand.
victoriajustice,326vaa,Dedbent,2,Sat Apr 11 02:17:02 2015 UTC,Gallery  2 More
victoriajustice,326rya,Dedbent,2,Sat Apr 11 01:44:28 2015 UTC,Slightly different pic from VJ instagram  Sisters
victoriajustice,3256ay,PokemonTrainerYellow,3,Fri Apr 10 17:50:54 2015 UTC,"Looks more like ""da fuq?!"" to me."
victoriajustice,3256ay,idrink211,-2,Sat Apr 11 00:30:41 2015 UTC,Wat
victoriajustice,326gty,Dedbent,3,Fri Apr 10 23:59:21 2015 UTC,With Pierson  Another
victoriajustice,326gty,agkman,2,Sat Apr 11 00:39:30 2015 UTC,"Her arriving.  https://www.facebook.com/video.php?v=838605959518680  Too much clothing for Vic, but I guess we'll probably see some pics in tight jeans."
victoriajustice,326gty,-OP_pls-,1 point,Sat Apr 11 00:09:45 2015 UTC,"I'm guessing the next few days will be better, it's been relatively mild the last few days weather wise but it'll be high 80s- low 90s this weekend at the festival... she'll probably show some more skin on the weekend :^ )"
victoriajustice,3255yh,PokemonTrainerYellow,2,Fri Apr 10 17:48:28 2015 UTC,Victoria has the cutest smile I've ever seen!
victoriajustice,31x5hl,FinnOnTheRun,18,Wed Apr 8 21:13:02 2015 UTC,Skates. Those are roller skates.
victoriajustice,31x5hl,mwproductions,11,Wed Apr 8 22:16:21 2015 UTC,Dat ass tho
victoriajustice,31x5hl,reecej101,5,Wed Apr 8 22:52:29 2015 UTC,A sweater and shorts?   I won't complain...
victoriajustice,31x5hl,aKarambit,3,Thu Apr 9 03:49:32 2015 UTC,"Easily one of the best ""lazy day"" outfits imo ;)"
victoriajustice,31x5hl,TheOneAndEverything,1 point,Thu Apr 9 05:23:03 2015 UTC,Some more  http://www.listal.com/victoria-justice/pictures//2
victoriajustice,31t1hv,Dedbent,7,Tue Apr 7 23:01:05 2015 UTC,We need more outtakes of her without pants. ;)
victoriajustice,31t1hv,agkman,1 point,Tue Apr 7 23:13:17 2015 UTC,I want to see more outtakes of this and the body suit. Unnnnfffff...
victoriajustice,31t1hv,TheRipePunani,3,Thu Apr 9 18:17:59 2015 UTC,"Found it on Alepel's Instagram.  Hopefully, we will get some full-sized outtakes."
victoriajustice,31t1hv,idrink211,3,Tue Apr 7 23:02:00 2015 UTC,"Damn, she's looks surprisingly nice as a blonde."
victoriajustice,31t1hv,ThiefofNobility,4,Tue Apr 7 23:11:01 2015 UTC,She almost looks like a completely different girl.
victoriajustice,31t1hv,kaos_tao,1 point,Wed Apr 8 01:52:10 2015 UTC,"I keep having this ""looks like shakira"" feeling"
victoriajustice,31t1hv,skiier23,-2,Wed Apr 8 12:55:56 2015 UTC,"cmon lads, we can do better than this! where is an HD desktop wallpaper sized image?"
victoriajustice,31tora,DiamondRyce,2,Wed Apr 8 01:59:50 2015 UTC,"So the bikini adventure is done for now, but I think it's Coachella this weekend, so maybe she'll be there again this year."
victoriajustice,31tora,agkman,1 point,Wed Apr 8 02:09:33 2015 UTC,"It starts this week, FRI-SUN this week. Same thing next week as well. We'll see if she goes this year :)"
victoriajustice,31tora,-OP_pls-,1 point,Wed Apr 8 03:05:50 2015 UTC,Both beautiful.
victoriajustice,31tora,rhcp88,1 point,Wed Apr 8 02:53:15 2015 UTC,Well she tweeted that she is Picking out her outfits for Coachella. So maybe she'll were a bikini top and short shorts
victoriajustice,31lrsl,GiantWithDwarfism,7,Mon Apr 6 06:54:56 2015 UTC,"For anyone interested, here's the interview"
victoriajustice,31lrsl,-OP_pls-,1 point,Mon Apr 6 11:10:27 2015 UTC,What the other way around.
victoriajustice,31lrsl,fernando_69,15,Wed Apr 29 12:26:58 2015 UTC,Christ fuck she's hot
victoriajustice,31lrsl,cfj1992,5,Mon Apr 6 07:57:53 2015 UTC,"damn that first one, amazing"
victoriajustice,31lrsl,Sxi139,1 point,Mon Apr 6 12:44:05 2015 UTC,such great legs!
victoriajustice,31gmhb,skiier23,5,Sat Apr 4 22:09:19 2015 UTC,"her public snapchat name is ""victoriajustice"" you can just add her and see it, at least i think so."
victoriajustice,31gmhb,quinyd,14,Sat Apr 4 22:11:09 2015 UTC,"Video is available here, but without stickers on."
victoriajustice,31gmhb,bigum,3,Sun Apr 5 09:52:11 2015 UTC,How?
victoriajustice,31gmhb,iamnotseanclark,3,Sun Apr 5 11:07:44 2015 UTC,Rooted Android users can record full videos with /without text and stickers. They can also take screens hits without having the sender know
victoriajustice,31gmhb,bigum,1 point,Sun Apr 5 13:54:43 2015 UTC,Thank you. Is it possible to record a video without rooting?
victoriajustice,31gmhb,iamnotseanclark,1 point,Sun Apr 5 14:51:00 2015 UTC,"It's tricky. Everything someone figures out a way, Snap chat patches and blocks it"
victoriajustice,31gmhb,Dedbent,1 point,Sun Apr 5 14:53:46 2015 UTC,"Yeah. I was using an extension on Chrome that let you run Android APKs. There was an app called Casper, but snapchat sent them a cease and desist letter yesterday.  So the guy just shut it down."
victoriajustice,31gmhb,burnie_mac,1 point,Sun Apr 5 20:27:19 2015 UTC,Casper shut down? I didn't update I can still use it... I think.
victoriajustice,31gmhb,quinyd,1 point,Tue Apr 7 11:50:15 2015 UTC,fyi I'm not using android.
victoriajustice,31gmhb,manicmaximum,1 point,Mon Apr 6 14:44:24 2015 UTC,great work johnson
victoriajustice,31gmhb,quinyd,1 point,Sun Apr 5 10:40:21 2015 UTC,is it possible to download this?
victoriajustice,31gmhb,quinyd,1 point,Mon Apr 6 22:55:14 2015 UTC,PM me and i can give you the file.
victoriajustice,31gmhb,quinyd,1 point,Tue Apr 7 08:15:48 2015 UTC,"im not familiar with how reddit works, but wouldn't it be more beneficial to everyone to just post a file here that everyone could download?"
victoriajustice,31gmhb,PastorOfMuppets99,3,Tue Apr 7 09:07:25 2015 UTC,"Ah well, https://mega.co.nz/#!zlkV0CBa!RW-ceE7u5bwHCl8i1J_4pruc7k8ODK5EBD5oHF7Ksb8 now everyone can have it :D cus im that nice!"
victoriajustice,31h5oe,Dedbent,7,Sun Apr 5 01:07:09 2015 UTC,Got this better version from SP.  Download
