victoriajustice,3e2umo,OZONE_TempuS,9,Tue Jul 21 15:10:43 2015 UTC,among other things
victoriajustice,3e3aux,Dedbent,9,Tue Jul 21 17:05:44 2015 UTC,Gallery
victoriajustice,3e3aux,rhcp88,7,Tue Jul 21 17:22:08 2015 UTC,"Not gonna lie, I'm disappointed that those paparazzi couldn't get behind her for at least one shot :/  Still looks great as usual though."
victoriajustice,3e3aux,JBgreen,2,Tue Jul 21 17:26:00 2015 UTC,"I imagine J. Jonah Jameson screaming at the photog, ""These are all rubbish, ASS SHOTS, THE PEOPLE WANT ASS SHOTS, I can't print these!"""
victoriajustice,3e3aux,az_max,1 point,Tue Jul 21 23:55:54 2015 UTC,She looks great
victoriajustice,3e3aux,HamLis,1 point,Wed Jul 22 04:17:12 2015 UTC,"I bet it took some time to remove those jeans after walk in this super hot weather, but yeah what wouldn't you do to look great.."
victoriajustice,3e10ut,Dedbent,1 point,Tue Jul 21 03:15:03 2015 UTC,"Escargot, my car go"
victoriajustice,3e10ut,rugtap,2,Tue Jul 21 03:24:02 2015 UTC,"one sixty, swiftly"
victoriajustice,3e10ut,expletiveadded,0,Tue Jul 21 04:32:22 2015 UTC,"Wreck it, buy a new one."
victoriajustice,3e10ut,kinhled8326,0,Tue Jul 21 05:05:56 2015 UTC,What's her snapchat?
victoriajustice,3dt81e,saints4lifexliv,8,Sun Jul 19 05:47:56 2015 UTC,"I love how slender and petite she looks, but then she turns around and BABAM that booty just goes full moon. :D"
victoriajustice,3dpetg,Dedbent,3,Sat Jul 18 04:21:33 2015 UTC,Aging is a beautiful thing. I say the same about Nina Dobrev too...she gets more and more gorgeous every year.   Love the black and pink...really bangin' outfit.
victoriajustice,3dpetg,TheRipePunani,8,Sat Jul 18 06:23:37 2015 UTC,http://imgur.com/a/2hKGu
victoriajustice,3dpetg,booboo40,3,Sat Jul 18 14:06:08 2015 UTC,Thanks for those.
victoriajustice,3doxxh,-OP_pls-,3,Sat Jul 18 01:39:32 2015 UTC,more
victoriajustice,3doxxh,conspiracy_thug,-1,Sat Jul 18 02:07:51 2015 UTC,Damn her friends are hot
victoriajustice,3dp6rc,Dedbent,1 point,Sat Jul 18 03:02:05 2015 UTC,Periscope is nice but that bad connection though. At least I can watch it after it was shown live.
victoriajustice,3dp6rc,DiamondRyce,1 point,Sat Jul 18 04:00:00 2015 UTC,Never heard of Periscope seems like a live snapchat
victoriajustice,3dn1fc,karmathiefupvotepls,13,Fri Jul 17 16:29:36 2015 UTC,/r/titlecringe
victoriajustice,3dn1fc,conspiracy_thug,4,Sat Jul 18 03:05:36 2015 UTC,M'lady
victoriajustice,3dn1fc,evengraves,1 point,Sat Jul 18 03:38:25 2015 UTC,I guess it's time to start building my victoria justice collection again. Is this from Eye Candy?
victoriajustice,3dn1fc,coolguyblue,3,Sat Jul 18 13:53:51 2015 UTC,Yes it is
victoriajustice,3dbbfj,Dedbent,3,Tue Jul 14 23:08:09 2015 UTC,What the fuck is that song?
victoriajustice,3dbbfj,heltflippad,1 point,Wed Jul 15 01:23:56 2015 UTC,Carly Rae Jepsen - I really like you
victoriajustice,3dbbfj,akbyr,5,Wed Jul 15 03:40:16 2015 UTC,Her friend/makeup artist.
victoriajustice,3dbbfj,pornaway888,0,Wed Jul 15 00:53:10 2015 UTC,She ain't got a belly button
victoriajustice,3d5y5p,Jhaev,13,Mon Jul 13 19:57:21 2015 UTC,Every photo of Victoria Justice is an amazing photo.  I've never seen a bad photo of her and I even tried finding one.
victoriajustice,3d5y5p,littlemisfit,4,Mon Jul 13 22:28:20 2015 UTC,She does define the term photogenic.
victoriajustice,3d5y5p,Emmersom,6,Tue Jul 14 14:36:14 2015 UTC,I would suck her daddy's dick just to get a taste of the recipe.
victoriajustice,3d5y5p,Emmersom,1 point,Tue Jul 14 14:37:23 2015 UTC,amen
victoriajustice,3d5ly9,RedPanda_98,4,Mon Jul 13 18:32:21 2015 UTC,one of her best looks ever
victoriajustice,3d6hwu,Dedbent,4,Mon Jul 13 22:17:38 2015 UTC,"She presented at something called the Campus Moviefest yesterday. I am pretty sure she also attended the Kode Magazine Issue 6 party last night, but I can't find any of her at the event."
victoriajustice,3d0o5r,Dedbent,12,Sun Jul 12 15:03:17 2015 UTC,I know this may sound really weird but her legs turn me on so damn much it's crazy.
victoriajustice,3d0o5r,thisshitcrayz,3,Sun Jul 12 16:30:10 2015 UTC,It's not weird! They're one of her best features. :)
victoriajustice,3d0o5r,ononothimagen,7,Mon Jul 13 01:08:10 2015 UTC,She has the best legs ever.
victoriajustice,3d0o5r,rock-bottom_mokshada,1 point,Sun Jul 12 16:20:28 2015 UTC,And that's quite a fine little belly button playing peek-a-boo with us.
victoriajustice,3d0o5r,Dugommier,1 point,Mon Jul 13 00:33:26 2015 UTC,"Yeah, if she was around, I'd want to read a book.  /sarcasm"
victoriajustice,3cvfzd,Dedbent,2,Sat Jul 11 02:42:02 2015 UTC,"She looks so casual here, against a great backdrop also!"
victoriajustice,3cvfzd,rock-bottom_mokshada,1 point,Sun Jul 12 01:44:30 2015 UTC,Anyone have anymore of her from this?? Or in this outfit?
victoriajustice,3cvfzd,TH3_N1GHTMAN,1 point,Tue Jul 14 23:12:57 2015 UTC,"Williamsburg, Virginia?"
victoriajustice,3cvfzd,iamdanman2196,1 point,Fri Jul 17 04:35:43 2015 UTC,NY
victoriajustice,3cuuxc,Dedbent,6,Fri Jul 10 23:32:38 2015 UTC,That would just be too much beauty in one place.  The world couldn't handle it.
victoriajustice,3cuuxc,rhcp88,2,Fri Jul 10 23:37:52 2015 UTC,Fill my eyes.
victoriajustice,3cpp9o,-OP_pls-,13,Thu Jul 9 19:55:05 2015 UTC,holy is she getting yummy
victoriajustice,3cpp9o,bakin25,12,Thu Jul 9 22:17:31 2015 UTC,She's always been yummy.
victoriajustice,3cpp9o,ononothimagen,2,Fri Jul 10 03:03:37 2015 UTC,"I agree, there is a maturity in her face now that is extra yummy."
victoriajustice,3cpp9o,bakin25,1 point,Mon Jul 13 12:55:59 2015 UTC,And them abs
victoriajustice,3cpp9o,squitzeaux,1 point,Mon Jul 13 23:07:02 2015 UTC,"seriously, holy.  The mods should revamp the side bar and top bar."
victoriajustice,3cpp9o,bakin25,5,Tue Jul 14 12:30:16 2015 UTC,literally that guy chazed her with his camera for half an hour
victoriajustice,3cpp9o,quienchingados,3,Fri Jul 10 02:46:58 2015 UTC,Omg. This just made my cheeks hurt just looking at these pics. Did she have to wave and constantly smile the entire time she was out and about in NYC?
victoriajustice,3cpp9o,Jchico1021,2,Fri Jul 10 05:47:06 2015 UTC,"Pleated skirt + .... = best combo.. I remember her wearing blue pleated skirt and white sweater.. Mmm.. edit Found it! I mixed up colors, but still: http://imgur.com/a/KrLcd"
victoriajustice,3cpp9o,HamLis,1 point,Fri Jul 10 16:35:58 2015 UTC,just downloaded most of the album--super high quality. Now my morning is busy.
victoriajustice,3coy9m,Dedbent,2,Thu Jul 9 16:35:29 2015 UTC,Bunch More
victoriajustice,3coy9m,bakin25,1 point,Fri Jul 10 04:45:18 2015 UTC,very very yummy indeed
victoriajustice,3cq7sb,DiamondRyce,1 point,Thu Jul 9 22:09:10 2015 UTC,"shes a fan of coldplay. fuck yes, another reason to want to marry her"
victoriajustice,3cq7sb,reecej101,1 point,Thu Jul 9 22:27:39 2015 UTC,"In the interview she also said she's very interested in documentaries, which I'm a fan of myself. One can dream, I suppose..."
victoriajustice,3chvjq,Dedbent,10,Wed Jul 8 01:02:56 2015 UTC,Another
victoriajustice,3chvjq,cryingtoad,2,Wed Jul 8 01:41:53 2015 UTC,Amen brother
victoriajustice,3chvjq,reecej101,7,Wed Jul 8 15:04:05 2015 UTC,"Please god, I don't ask for much but please please please have her half naked again with some backshots"
victoriajustice,3chvjq,cryingtoad,3,Wed Jul 8 06:13:39 2015 UTC,Again? Are there boobs pics out there?
victoriajustice,3chvjq,reecej101,2,Wed Jul 8 15:04:39 2015 UTC,"Yeah her leaked pics, I can't link them (unfortunately) but you will find them if you put leaked after her name"
victoriajustice,3chvjq,cryingtoad,3,Wed Jul 8 15:15:21 2015 UTC,Ok thanks man
victoriajustice,3c60yr,Dedbent,4,Sun Jul 5 04:00:14 2015 UTC,Mmm freedom never looked sexier. :D
victoriajustice,3c5vrh,Dedbent,1 point,Sun Jul 5 02:56:45 2015 UTC,"Is this her fan account or private account that fans somehow found and she just said ""forget it, I'll just keep this account because fans are always going to find my private social media accounts."" lol"
victoriajustice,3c5vrh,SilentDstroyr,1 point,Tue Jul 7 23:49:31 2015 UTC,She made it after she took over MTV's for a day.  I don't know if she has a private one or not.
victoriajustice,3c5vrh,SilentDstroyr,1 point,Wed Jul 8 00:01:49 2015 UTC,oh ok
victoriajustice,3c4q69,-OP_pls-,2,Sat Jul 4 19:37:14 2015 UTC,I wouldn't mind making some light purple
victoriajustice,3c0hum,jimmyd1911,3,Fri Jul 3 17:28:21 2015 UTC,Pretty is an understatement
victoriajustice,3c0hum,skagod69,1 point,Fri Jul 3 23:12:58 2015 UTC,Pretty much.
victoriajustice,3c0hum,anujsingh83,1 point,Sat Jul 4 00:52:12 2015 UTC,I think goddess is the correct term for her.
victoriajustice,3bx7dz,Dedbent,2,Thu Jul 2 22:07:06 2015 UTC,"Is this from her Snapchat? If so, what is it?"
victoriajustice,3bx7dz,veedawgydawg,2,Fri Jul 3 01:33:30 2015 UTC,"Yeah, it's from her Snapchat: victoriajustice"
victoriajustice,3bx019,Dedbent,1 point,Thu Jul 2 21:08:06 2015 UTC,Anyone know when this is coming out?
victoriajustice,3bx019,OceanaKid,1 point,Fri Jul 3 00:37:02 2015 UTC,"The premiere is in a couple weeks at Outfest, she has some info posted on her twitter if you're interested in going."
victoriajustice,3bwca5,Dedbent,2,Thu Jul 2 18:11:05 2015 UTC,What's her snapchat? :O
victoriajustice,3bwca5,JurreB,3,Thu Jul 2 20:38:23 2015 UTC,victoriajustice
victoriajustice,3bl7uu,Dedbent,5,Tue Jun 30 03:11:48 2015 UTC,"Her face says ""this date sucks..., where's spaceboogie?"""
victoriajustice,3bl7uu,TheRealSpaceBoogie,1 point,Tue Jun 30 22:55:13 2015 UTC,NO
victoriajustice,3bikgc,-OP_pls-,7,Mon Jun 29 14:54:03 2015 UTC,she looks annoyed
victoriajustice,3bikgc,bakin25,9,Mon Jun 29 19:42:58 2015 UTC,i agree. but i wonder if shes really walking just about or shes like doing a photoshoot in streets of NY.
victoriajustice,3bikgc,Arash310,7,Tue Jun 30 01:29:31 2015 UTC,It's a candid photoshoot.  It's probably related to clothing as all her 'candids' recently have featured jeans or jean skirts that all seem to have a similar style.
victoriajustice,3bikgc,agkman,4,Tue Jun 30 01:51:35 2015 UTC,"Not to mention she is on the payphone, then pulls out the cell phone 10 feet away from it."
victoriajustice,3bikgc,bakin25,0,Tue Jun 30 04:22:06 2015 UTC,dumpy jeans
victoriajustice,3bikgc,SnobbyLion,15,Tue Jun 30 12:19:32 2015 UTC,That septum does not suit her at all.
victoriajustice,3bikgc,MarcAntony,6,Mon Jun 29 15:40:52 2015 UTC,"I agree, it doesn't look very good on anyone really. Luckily she doesn't wear it all that much."
victoriajustice,3bii07,holla_secret,2,Mon Jun 29 14:33:12 2015 UTC,She comes in colors everywhere
victoriajustice,3bii07,mwproductions,-1,Mon Jun 29 15:16:44 2015 UTC,"She combs her hair  She's like a rainbow  Coming colors in the air  Oh, everywhere  She comes in colors"
victoriajustice,3bgsfn,IsThatYourBed,4,Mon Jun 29 02:22:43 2015 UTC,"Aka the crazy tight jeans outfit. There may be some duplicates mixed in, I'm not positive.  Bonus video to make up for it  https://www.youtube.com/watch?v=rFdr92EPNq0"
victoriajustice,3bdr79,AceMeepsm,10,Sun Jun 28 06:48:30 2015 UTC,http://m.imgur.com/r/gifs/zr9U0
victoriajustice,3bdr79,hummus3xual,9,Sun Jun 28 15:24:02 2015 UTC,More from this set please.
victoriajustice,3bdr79,dankniss,3,Sun Jun 28 09:32:19 2015 UTC,Someone explain how ladies can move a single step in heels like those. Do they walk on their toes? Oh and she's gorgeous
victoriajustice,3bdr79,JPete75,-2,Sun Jun 28 11:47:03 2015 UTC,One of my favorite photos showcasing her big butt.
victoriajustice,3bcse4,Dedbent,1 point,Sun Jun 28 00:12:25 2015 UTC,Another one.
victoriajustice,3b3lk0,FinnOnTheRun,3,Thu Jun 25 18:11:51 2015 UTC,sauce?
victoriajustice,3b3lk0,rockingharder,8,Thu Jun 25 18:17:34 2015 UTC,https://www.youtube.com/watch?v=gErFEyZxYZ0
victoriajustice,3b3lk0,athosghost,-4,Thu Jun 25 18:21:51 2015 UTC,PSA: that video is much better on mute
victoriajustice,3b3lk0,arrayed,6,Thu Jun 25 18:54:00 2015 UTC,"I think it's safe to say that the majority of us are not watching the video for the ""medley""...... LOL  :P"
victoriajustice,3b3lk0,Belrus,2,Fri Jun 26 03:22:31 2015 UTC,"idk, i didnt think it was that bad."
victoriajustice,3b3lk0,i_am_the_blood_ninja,0,Thu Jun 25 23:31:52 2015 UTC,"I love Victoria, but damn that video is horrible."
victoriajustice,3b3lk0,BlueEyedBrigadier,1 point,Thu Jun 25 20:08:57 2015 UTC,"I dunno...it's not the worst music video I've ever seen, but I'll say it's not my bag of chips.  Though the ""Dick in a Box"" reference? That I liked ;)"
victoriajustice,3b3lk0,hnf1975,1 point,Fri Jun 26 00:18:57 2015 UTC,"These one take videos she's been a part of are kind of neat, though this one falls a little flat.  Still, the way she moves. . . ."
victoriajustice,3b3lk0,arrayed,1 point,Fri Jun 26 13:55:33 2015 UTC,No Doubt!!!!!!!!!!!!!!!!
victoriajustice,3aup58,-OP_pls-,6,Tue Jun 23 17:35:40 2015 UTC,"In case you missed it, here's the first one."
victoriajustice,3aup58,ohaithere123,7,Tue Jun 23 17:36:32 2015 UTC,I love that semi-bitchy resting face. So pretty
victoriajustice,3aup58,throwawayrandia,3,Tue Jun 23 21:38:23 2015 UTC,She should take her shoes off and show her pretty feet to us..
victoriajustice,3aup58,JakeyG14,5,Wed Jun 24 09:44:59 2015 UTC,"Or, you know, get her tits out (again)."
victoriajustice,3asbjc,hundreddollarman,11,Tue Jun 23 02:51:42 2015 UTC,I enjoy this.
victoriajustice,3asbjc,VariableFactor,6,Tue Jun 23 07:23:06 2015 UTC,where is this from?
victoriajustice,3asbjc,JuniorDM7,7,Tue Jun 23 08:46:34 2015 UTC,Eye Candy
victoriajustice,3asbjc,holla_secret,1 point,Tue Jun 23 09:32:44 2015 UTC,You're doing God's work!
victoriajustice,3aqf6h,Dedbent,1 point,Mon Jun 22 17:46:41 2015 UTC,Ah Shit.   Anyone want to take a guess as to the two songs she will be lip syncing?  This outfit looks retro so maybe 80s or 90s.   then  Maybe Ellie Goulding's Love Me Like You Do?   Idk
victoriajustice,3aqf6h,DiamondRyce,4,Mon Jun 22 19:34:17 2015 UTC,"Not only is this comment bizarre in and of itself, but the formatting is also strange. Are you high right now?"
victoriajustice,3aqf6h,hansel4150,2,Mon Jun 22 22:18:50 2015 UTC,It's a poem.
victoriajustice,3aqf6h,kylekyleson,1 point,Tue Jun 23 00:03:41 2015 UTC,Link to the preview.  The episode will be on July 30th.
victoriajustice,3ak4ws,CrypticCraig,3,Sun Jun 21 00:03:52 2015 UTC,The colors of her dress and shoes are absolutely perfect for the show.
victoriajustice,3aj5um,hockeynewfoundland,3,Sat Jun 20 18:30:06 2015 UTC,JT is the shit
victoriajustice,3aj5um,Mother_Bosnia,2,Sat Jun 20 23:20:32 2015 UTC,JT and Victoria. Whats not to Love.
victoriajustice,3ag52w,SD-N,-6,Fri Jun 19 21:36:52 2015 UTC,"wtf is this gay shit? i want to see her tits, ass, and vaj."
victoriajustice,3ag52w,skiier23,1 point,Fri Jun 19 22:28:24 2015 UTC,"i want to see her tits, ass, and vaj  You'd better not, don't forget nofap really helped you. Hang in there man, you can do it."
victoriajustice,3ag52w,holla_secret,-5,Fri Jun 19 23:49:52 2015 UTC,"lol i feel like i have too much free time but i cant imagine what level of free time and boredom would drive me to look at someone else's comment history.   i got that monkey off my back, broke that habit. i've fapped to supposed naked pix of VJ enough i could see new ones and not burst out into a fapathon."
victoriajustice,3ag52w,skiier23,2,Fri Jun 19 23:52:51 2015 UTC,i've fapped to supposed naked pix of VJ enough i could see new ones and not burst out into a fapathon  If you say so...
victoriajustice,3a78cf,louistulley,5,Wed Jun 17 19:46:49 2015 UTC,2SPOOPY NSFL TAG PLS
victoriajustice,3a78cf,MothafckingThrowaway,3,Wed Jun 17 21:34:07 2015 UTC,http://i.imgur.com/iaRR15S.png
victoriajustice,3a3o5t,-OP_pls-,7,Tue Jun 16 23:50:16 2015 UTC,She's too beautiful.
victoriajustice,3a3o5t,rhcp88,7,Wed Jun 17 00:42:12 2015 UTC,"I think this is one of the best looks she's had in a little while. Sexy and  sophisticated, just all around beautiful. Plus the make-up and hair suits her to a tee for once lol. I like the Kode party looks and the like but to me this is more ""her""."
victoriajustice,3a3o5t,Jorfent706,3,Wed Jun 17 08:36:45 2015 UTC,"She looks fucking incredible, I mean wow."
victoriajustice,3a3o5t,JPLnavy,1 point,Wed Jun 17 09:38:09 2015 UTC,"That girl in the first pic is checking out Vic's ass. If I was there, I'd be doing the same thing."
victoriajustice,3a3o5t,Dugommier,1 point,Wed Jun 17 14:05:13 2015 UTC,"That's her stylist, it's her job to check her out and make sure she looks good. Best job ever."
victoriajustice,3a3o5t,Dugommier,1 point,Wed Jun 17 14:23:21 2015 UTC,I bet she'd stare at Vic's ass for free.
victoriajustice,3a27rs,FinnOnTheRun,13,Tue Jun 16 17:31:40 2015 UTC,Yes... yes she is.
victoriajustice,3a27rs,PoppaDR3W,4,Tue Jun 16 18:18:37 2015 UTC,Holy fuck she's hot as hell
victoriajustice,3a27rs,LeviathanDementia,8,Tue Jun 16 19:13:39 2015 UTC,Yes... yes she is.
victoriajustice,3a27rs,Adam__DeMamp,4,Tue Jun 16 19:31:06 2015 UTC,"She is a real goddess. An actual living, breathing goddess."
victoriajustice,3a27rs,MarcAntony,2,Tue Jun 16 19:46:43 2015 UTC,Gorgeous legs.
victoriajustice,3a27rs,tonman101,2,Wed Jun 17 00:47:57 2015 UTC,"This is one of my favorite photos of her. Nice posture, curves and legs and everything above."
victoriajustice,39ze1s,Dedbent,3,Tue Jun 16 00:50:40 2015 UTC,[MORE](http://imgur.com/a/nKXoK  Even More
victoriajustice,39z3jm,Dedbent,2,Mon Jun 15 23:23:16 2015 UTC,Looks like another see through Dress  Quick Vid
victoriajustice,39sdrf,JFN1234,2,Sun Jun 14 08:10:01 2015 UTC,when was this?
victoriajustice,39sdrf,vivinefertari,5,Sun Jun 14 13:56:05 2015 UTC,It was at New York fashion week last year.  More pics:  https://imgur.com/a/uW114  https://imgur.com/a/svgfw
victoriajustice,39sdrf,-OP_pls-,3,Sun Jun 14 14:37:52 2015 UTC,thank you!
victoriajustice,39sdrf,vivinefertari,1 point,Sun Jun 14 15:17:40 2015 UTC,Whats she doing with Hyuna?
victoriajustice,39ovu2,Maestro_Da_Vinci,1 point,Sat Jun 13 09:36:49 2015 UTC,Oh my god. She is so gorgeous.
victoriajustice,39nesw,chrisdeli,1 point,Sat Jun 13 00:05:12 2015 UTC,Life queen
victoriajustice,39mdkg,CJ105,-2,Fri Jun 12 19:26:50 2015 UTC,"But, that looks blue and gold...."
victoriajustice,39mdkg,SpamSpamSpamEggNSpam,3,Fri Jun 12 22:00:09 2015 UTC,Don't you go starting that shit.
victoriajustice,39mdkg,-OP_pls-,2,Fri Jun 12 22:01:28 2015 UTC,booooo
victoriajustice,39lvrh,Dedbent,5,Fri Jun 12 17:27:08 2015 UTC,She really does pick the worst films.
victoriajustice,39lvrh,JakeyG14,1 point,Sat Jun 13 01:09:00 2015 UTC,Those bangs
victoriajustice,39iwyn,-OP_pls-,5,Fri Jun 12 01:08:21 2015 UTC,I went ahead and replaced the old set with the HQs. Enjoy :)
victoriajustice,39ix72,booboo40,4,Fri Jun 12 01:10:09 2015 UTC,HQ set
victoriajustice,39hzea,Dedbent,9,Thu Jun 11 21:07:00 2015 UTC,I cannot wait until this trend dies out.
victoriajustice,39hzea,PaisanTed,2,Thu Jun 11 21:55:33 2015 UTC,I'm hoping that its for a role... I know its a vain hope but I still hope lol. https://scontent.cdninstagram.com/hphotos-xaf1/t50.2886-16/11424039_1094686093879435_380647272_n.mp4 for a non instagram version too
victoriajustice,39hzea,Jorfent706,4,Sat Jun 13 10:06:36 2015 UTC,Yeah. At least she hasn't gotten a bunch of stupid tattoos.
victoriajustice,39hzea,JPLnavy,6,Thu Jun 11 22:25:33 2015 UTC,"Love her to death and all but god no, please no."
victoriajustice,39hzea,comethrowitaway,-3,Thu Jun 11 23:01:57 2015 UTC,Septum rings are fantastic and she looks great with it
victoriajustice,398rog,Dedbent,5,Wed Jun 10 02:00:24 2015 UTC,Whoever planned that advertisement across her chest should be shot immediately.
victoriajustice,398rog,hnf1975,1 point,Wed Jun 10 12:15:28 2015 UTC,"Lol it's not fair. A ""Fat Booth"" photo of her would still be insanely hot."
victoriajustice,398hcq,Dedbent,1 point,Wed Jun 10 00:40:55 2015 UTC,one more
victoriajustice,398hcq,holla_secret,1 point,Wed Jun 10 07:54:29 2015 UTC,Another
victoriajustice,38v4ak,Dedbent,1 point,Sun Jun 7 02:17:48 2015 UTC,Another
victoriajustice,38rck7,Dedbent,1 point,Sat Jun 6 03:53:18 2015 UTC,I want a hat with my name in lucite
victoriajustice,38dw20,matinphipps,19,Wed Jun 3 16:04:59 2015 UTC,She should take more nudes.
victoriajustice,38dw20,evengraves,6,Wed Jun 3 21:18:22 2015 UTC,Slightly bigger.
victoriajustice,38dw20,Joker961,3,Thu Jun 4 10:43:31 2015 UTC,anyone have this in better quality?
victoriajustice,38dw20,ILIKEPIE4715,2,Thu Jun 4 00:42:01 2015 UTC,She is reeeeeeaaaallly cute in this pic
victoriajustice,38dw20,hoser89,2,Thu Jun 4 00:12:16 2015 UTC,That face is really turning me on.
victoriajustice,38a5gh,Dedbent,10,Tue Jun 2 21:49:51 2015 UTC,sad
victoriajustice,38a5gh,MyPr0nUser,3,Tue Jun 2 23:53:10 2015 UTC,"""oiling!...oiling!... "" welp, you guys can call me squints  i'd do the same shit given the chance."
victoriajustice,38a5gh,skiier23,3,Wed Jun 3 05:46:08 2015 UTC,"Is this an ad for alba? All I see are alba products and the ""alba botanica"" at the top looks like it was Photoshopped in because it's supposed to be angled towards her, but it looks like it's facing us."
victoriajustice,38a5gh,MisterJimJim,2,Wed Jun 3 09:55:52 2015 UTC,"Agreed, I'm almost entirely sure that's photoshopped. If this ends up on celebrity websites as ""caught by paparazzi"" it'll only fuel my already building trust issues for the media."
victoriajustice,38a5gh,JPLnavy,1 point,Wed Jun 3 10:27:39 2015 UTC,Also no drug store is going to let a paparazzo snap photos like that.
victoriajustice,38a5gh,flamingmenudo,1 point,Wed Jun 3 17:03:16 2015 UTC,"Apparently these were taken at Whole Foods (according to other places ive seen them posted). Ive seen sets come from there that were taken inside the store, but these do look different than most of those sets."
victoriajustice,38a5gh,-OP_pls-,3,Wed Jun 3 19:10:49 2015 UTC,"seriously? she's just picking up some sunscreen and she looks that good? god i'm glad i'm not a chick, cause if i was i'd probably kill myself from jealousy. jeez."
victoriajustice,38a5gh,kingbane,2,Wed Jun 3 05:21:02 2015 UTC,I'll volunteer to apply the cream.  Any cream.
victoriajustice,38a5gh,JakeyG14,2,Wed Jun 3 15:36:44 2015 UTC,VJ is the  current platinum standard of wife material.
victoriajustice,381mqo,PistolPete23,1 point,Mon Jun 1 05:02:24 2015 UTC,Damn she got nice legs and feet
victoriajustice,37tkqg,rondellr09,17,Sat May 30 07:31:55 2015 UTC,This is from her Kode Magazine shoot - more here  https://imgur.com/a/Mowew
victoriajustice,37tkqg,duhbicboii,12,Sat May 30 16:16:09 2015 UTC,Is there really no picture of her in this outfit from the rear side? :(
victoriajustice,37tkqg,xinnabtw,7,Sat May 30 16:28:37 2015 UTC,Hopefully this kind of shoot wasn't a one off thing for her
victoriajustice,37tkqg,BraverDanger,2,Sat May 30 10:07:19 2015 UTC,"She is so beautiful,  wish she would start appearing in movies."
victoriajustice,37tkqg,tonman101,3,Sat May 30 13:26:36 2015 UTC,"She has been in movies, but they rarely if ever do well. Her last show just got canceled, but imo it wasn't that great. She's better suited as a model."
victoriajustice,37tkqg,I_Tread_Lightly,4,Sat May 30 15:59:21 2015 UTC,"I'm not talking about a Nick movie or a Disney Channel movie, I'm talking about a real, big budget movie."
victoriajustice,37tkqg,tonman101,2,Sat May 30 19:42:13 2015 UTC,Holy shit
victoriajustice,37tkqg,mydadsnotaphoneduh,2,Sat May 30 14:57:31 2015 UTC,OP likes my 50/50 hm?
victoriajustice,37tkqg,skiier23,0,Sat May 30 21:43:28 2015 UTC,Is this the girl on the weeknd album cover
victoriajustice,37tkqg,poopedthebed,-7,Sat May 30 14:58:42 2015 UTC,Is she wearing a condom on her leg?
victoriajustice,37mu61,louistulley,2,Thu May 28 20:01:19 2015 UTC,INCREDIBLE  look.
victoriajustice,37h6zv,-OP_pls-,19,Wed May 27 16:39:33 2015 UTC,She is so close to flawless that it hurts.
victoriajustice,37h6zv,rhcp88,8,Wed May 27 16:42:20 2015 UTC,"Don't look at me like that, V. I'm going to melt if you look at me like that."
victoriajustice,37h6zv,coscorrodrift,3,Wed May 27 18:00:11 2015 UTC,"Unnngh...clicking through the album in succession with RES is just amazing. Even just a simple look at the camera, with a wave at the end as the cherry on top."
victoriajustice,37h6zv,TheRipePunani,4,Wed May 27 18:43:38 2015 UTC,She's not even trying and she looks so hot. Is this just some random person taking pics of her?
victoriajustice,37h6zv,CrackerJackBunny,-1,Thu May 28 01:10:24 2015 UTC,"I don't really think we can call this person ""just some random"", for these photos we own them more than that. Whom ever took these is an Ace."
victoriajustice,37h6zv,nadnerbman163,0,Thu May 28 13:43:51 2015 UTC,I love this. How many candids of celebs do you see where they are smile and waving at paparazzi? This looks more like a photoshoot than her just walking around. Did she just come back from the perfect date? Why is does she look so beautiful?
victoriajustice,37bzfz,SmoopyRocks,8,Tue May 26 14:41:22 2015 UTC,booooty!
victoriajustice,37bzfz,LeviathanDementia,4,Tue May 26 19:50:05 2015 UTC,Nice huh
victoriajustice,37bzfz,Lamachus,9,Tue May 26 19:50:47 2015 UTC,"More than nice. Her pants, her ass, her perfect tummy...  One day Vic's attractiveness is going to break the internet."
victoriajustice,37bzfz,arrayed,3,Tue May 26 21:27:09 2015 UTC,Hot Jeans!!
victoriajustice,379otr,Dedbent,1 point,Tue May 26 00:32:56 2015 UTC,I don't know why she took it down. There was some more dumb Ariana drama this morning.
victoriajustice,379otr,agkman,2,Tue May 26 00:34:33 2015 UTC,"Yeah, it's a cute pic ... don't see what issues she could have seen with it.  Usually when she removes things it's because people react negatively to something (such as that one with champagne at a photoshoot) ... because heaven forbid a 22 year old woman hold a bottle of alcohol ... or the video of her shooting a gun."
