victoriajustice,2sjlpt,TheRipePunani,3,Thu Jan 15 20:36:03 2015 UTC,"Good on her for responding in a polite manner. She definitely looked like she was thinking, ""oh god...do we really need to talk about this again?""  I can't blame her."
victoriajustice,2sjlpt,agkman,2,Fri Jan 16 10:26:05 2015 UTC,"The truth is the comment from Ari and the fact that Ariana has a bigger fan base is crippling her among that demo.  It's become a reality amongst her fans, regardless if it's true or not.  It never seems to go away."
victoriajustice,2sjlpt,Jchico1021,2,Thu Jan 15 20:09:30 2015 UTC,It wont especially when people take sides.
victoriajustice,2sjlpt,Lamachus,1 point,Thu Jan 15 20:18:36 2015 UTC,Mirror??
victoriajustice,2sjlpt,-OP_pls-,1 point,Fri Jan 16 05:03:50 2015 UTC,This sort of horseshit is what happens when a TMZ douche bag gets his hands on a mic and a camera.
victoriajustice,2sgwfb,rudetubeboobnoob,3,Thu Jan 15 01:47:52 2015 UTC,Higher quality ... dat url  Source
victoriajustice,2sg4hh,-OP_pls-,1 point,Wed Jan 14 22:03:13 2015 UTC,"Heading back to New York, she'll be on Jimmy Fallon Friday night."
victoriajustice,2sg4hh,agkman,0,Wed Jan 14 22:03:42 2015 UTC,Thank You  Wish she was heading there to talk about a new 'hit' show :(  Got to be bittersweet for her in that regard.
victoriajustice,2sg4hh,yellowrambo,-7,Wed Jan 14 22:54:48 2015 UTC,Attention whore
victoriajustice,2sfcn8,Dedbent,3,Wed Jan 14 18:38:23 2015 UTC,Premiering against the Championship game wasn't such a bright idea. Though from the overwhelming  positive response on Twitter. There might be an uptick in the ratings.
victoriajustice,2sfcn8,DiamondRyce,2,Wed Jan 14 18:45:21 2015 UTC,"Yeah that was unfortunate but people seem to forget that this live tv and it doesn't count for digital sales and all those free streams and piracy if you go that route for reasons.   Live TV is one form of entertainment nowadays with more content coming to different places like YouTube and Twitch, MLG etc  Sure the viewership could be better if it was a better date with nothing on TV happening. Lets hope for the best."
victoriajustice,2sfcn8,TheRipePunani,2,Wed Jan 14 19:21:23 2015 UTC,"Yeah, Neilsen ratings are very antiquated."
victoriajustice,2sfcn8,agkman,1 point,Wed Jan 14 20:03:31 2015 UTC,"Yep, the Nielsen ratings don't mean jack shit considering how many people stream and record on DVR and not watch live.  I'll hang on and keep watching. Victoria's acting isn't bad, not like I was expecting a whole lot going from Nickelodeon over to a dark, gritty MTV show. The whole hacker angle is going to be a hit or miss depending on how they pan it out...either way someone will complain."
victoriajustice,2sfcn8,agkman,1 point,Fri Jan 16 10:30:50 2015 UTC,"Yeah, those ratings are terrible, It's so disappointing given all the trending on twitter and excitement from the target audience."
victoriajustice,2s9z1k,expletiveadded,12,Tue Jan 13 13:00:37 2015 UTC,"http://www.gfycat.com/YellowOrganicHorsemouse  I made a few more, but I don't feel like they're worth posting (most of them are less than a second long and tumblr-esque in quality). For example there's this one. Complete with a few frames too many.   Editorial note: Cheesiness aside, I actually enjoyed the pilot. The fact that's on MTV had me expecting the worst. The show turned out to be a lot darker than I thought it would be."
victoriajustice,2s9z1k,arrayed,2,Tue Jan 13 13:15:32 2015 UTC,keep up the good work I say!
victoriajustice,2s9z1k,hnf1975,1 point,Tue Jan 13 23:12:12 2015 UTC,"Don't worry about it,anything you post is worth it based on your great effort :)"
victoriajustice,2s9z1k,Dawkins20wx,2,Wed Jan 14 00:13:08 2015 UTC,"Thanks, I made these late last night and was pretty much falling asleep at the time. I haven't been posting around here lately (but I'm always around). /r/TaylorSwift has been stealing some of my redditing time. But that'll change now that Eye Candy is airing."
victoriajustice,2saod8,Dedbent,3,Tue Jan 13 16:54:33 2015 UTC,Yeah exactly! Me too!
victoriajustice,2saod8,floor-plank,2,Thu Jan 15 08:04:04 2015 UTC,Any Non-U.S. people who can't watch. Send me a message.
victoriajustice,2saod8,rodinj,1 point,Thu Jan 15 10:05:28 2015 UTC,Or use Hola;)
victoriajustice,2saod8,TheRipePunani,2,Fri Jan 16 02:20:32 2015 UTC,When she's standing on the rooftop...unnnnfff dat butt.
victoriajustice,2saod8,evengraves,1 point,Tue Jan 13 16:56:52 2015 UTC,"As soon as those random ""tech words"" started popping up and she started spewing bullshit about imaging a hard drive, I had to stop watching."
victoriajustice,2saod8,Not_Too_Smart_,0,Wed Jan 14 23:42:35 2015 UTC,Yep I knew once this show was about hacking it was gonna be bullshit. Not only that but the show in general is incredibly boring.
victoriajustice,2saod8,jimmyd1911,1 point,Wed Jan 14 11:24:42 2015 UTC,"but, but, she's in a bra, and leather pants..."
victoriajustice,2saod8,Not_Too_Smart_,3,Wed Jan 14 03:36:01 2015 UTC,That is basically the only reason I'm watching this show! Great stuff
victoriajustice,2sa2zy,expletiveadded,4,Tue Jan 13 13:48:16 2015 UTC,Here's the twist: We show it.
victoriajustice,2sa2zy,cfj1992,1 point,Tue Jan 13 23:09:03 2015 UTC,I wish it was.
victoriajustice,2s92vu,Dedbent,4,Tue Jan 13 05:26:14 2015 UTC,If you can't watch the episode message me for a present.
victoriajustice,2s92vu,reecej101,3,Tue Jan 13 05:27:43 2015 UTC,What is the present? Because as you know no one from outside the us can watch it tbh haha :(
victoriajustice,2s92vu,reecej101,6,Tue Jan 13 06:32:33 2015 UTC,A solution to that problem.....;)
victoriajustice,2s92vu,Coldvision,1 point,Tue Jan 13 06:37:19 2015 UTC,Is it a torrent? That is the question on everyone's lips ;)
victoriajustice,2s92vu,Rais3dByWolv3s,3,Tue Jan 13 06:38:30 2015 UTC,Check your messages. Even better than a torrent.
victoriajustice,2s92vu,icyxwindz,2,Tue Jan 13 06:41:37 2015 UTC,I love presents aswell
victoriajustice,2s92vu,vinnie_the_chin,1 point,Tue Jan 13 07:06:36 2015 UTC,How do I get in on this present?
victoriajustice,2s92vu,PotatoGobbler,1 point,Tue Jan 13 07:14:01 2015 UTC,I want a present
victoriajustice,2s92vu,Azkadellio,1 point,Tue Jan 13 07:53:18 2015 UTC,Presentplz
victoriajustice,2s92vu,xDirtyyyy,1 point,Tue Jan 13 07:54:21 2015 UTC,I'm down for a present
victoriajustice,2s92vu,OmniBlade,1 point,Tue Jan 13 12:47:34 2015 UTC,Would you be able to message the present to me as well please?
victoriajustice,2s92vu,arrayed,1 point,Tue Jan 13 13:09:20 2015 UTC,I need a present pls
victoriajustice,2s92vu,coolguyblue,1 point,Tue Jan 13 14:21:59 2015 UTC,Present please :)
victoriajustice,2s92vu,arrayed,1 point,Tue Jan 13 16:55:37 2015 UTC,"It's as if she's been practicing those moves on the downlow,if you know what i mean...... :P"
victoriajustice,2s92vu,agkman,1 point,Wed Jan 14 00:11:05 2015 UTC,You act like you haven't seen the nudes. The only reason to send nudes is when you're trying to get fucked. She's done a lot of fucking.
victoriajustice,2s82y0,Dedbent,3,Tue Jan 13 00:11:10 2015 UTC,"On a side note. If you guys can't watch 'Eye Candy' tonight. Shoot me a message, and I might be able to make something happen. ;)"
victoriajustice,2s4fgg,louistulley,4,Mon Jan 12 02:26:46 2015 UTC,This whole episode was a goldmine
victoriajustice,2s4fgg,hnf1975,3,Mon Jan 12 22:50:18 2015 UTC,Dan Schneider is a genius.
victoriajustice,2s3xyl,DiamondRyce,3,Sun Jan 11 23:51:02 2015 UTC,"Oooooh... Justice League? Sorry, thats unforgivable"
victoriajustice,2s1puf,-OP_pls-,2,Sun Jan 11 08:59:44 2015 UTC,"Thank you for the pics. :)  I see in her chat today she mentioned hoping for a season 2 of Eye Candy, and that she has another film that hasn't been announced yet, plus hopes to film an additional one, and possibly music (I'll believe the music when I see it) :P"
victoriajustice,2s1puf,agkman,1 point,Sun Jan 11 20:07:58 2015 UTC,"I checked in on the Q&A awhile ago, but I couldn't make much sense of it. There's hundreds of questions coming in and it was kinda tough to navigate. She could have maybe tagged the people she was answering, so it would be a little easier to follow... or better yet, live chat.  I'm interested to see what future projects she has planned. It seems like music is on the back burner at the moment, so hopefully there's more film opportunities for her in the near future."
victoriajustice,2s1puf,DiamondRyce,3,Sun Jan 11 20:45:50 2015 UTC,Yeah I just posted this album. Freaking Facebook getting harder to navigate everyday https://imgur.com/a/3THRJ#0
victoriajustice,2s1puf,DiamondRyce,2,Mon Jan 12 00:00:23 2015 UTC,"Thanks for putting that together :)  Loooks like a lot of the same info as before... watch eye candy, 2 movies coming soon, etc. Oh well, it's nice to see she's still talking to the fans."
victoriajustice,2s1puf,jaibrooks1,3,Mon Jan 12 04:28:51 2015 UTC,"Oh she loves her fans. Havent seen a celeb who talks and chats her fans but also remembering either their username, actual first name, etc.   Hence as soon as she replies to someone(and its not planned tweet attack) all I see is a sea of questions towards her. Its gets annoying on my Tweetdeck when it happens."
victoriajustice,2s1puf,TH3_N1GHTMAN,1 point,Mon Jan 12 05:07:26 2015 UTC,"Havent seen a celeb who talks and chats her fans but also remembering either their username, actual first name, etc.    Ariana Grande"
victoriajustice,2s0e6y,Dedbent,1 point,Sat Jan 10 23:51:03 2015 UTC,Really cute outfit...damn hope to see more pictures.
victoriajustice,2s03ok,DehKitty,3,Sat Jan 10 22:15:48 2015 UTC,Is this what heaven looks like?
victoriajustice,2s03ok,AlmightyChicken,2,Sat Jan 10 22:22:46 2015 UTC,"If it's not, I don't wanna go."
victoriajustice,2s0g4k,DehKitty,3,Sun Jan 11 00:09:41 2015 UTC,DEAL WITH IT    feedback source creator
victoriajustice,2s0g4k,DealWithItbot,2,Sun Jan 11 00:11:09 2015 UTC,Why did the sweater get a pair of shades?
victoriajustice,2s1oiy,Milk_Cereal,5,Sun Jan 11 08:33:28 2015 UTC,Dude she is busy right now. With all this promotion of Eye Candy she doesnt have time to meet up with them. Yes we all of them together again but probably wont happen still.   Vic is at least on proper terms with Ari anyway which is good but not enough for all.
victoriajustice,2rx49k,Dedbent,3,Sat Jan 10 01:16:59 2015 UTC,She's the only one that can pull it off IMO.
victoriajustice,2rx49k,expletiveadded,-4,Sat Jan 10 03:17:09 2015 UTC,ariana grande can too
victoriajustice,2rx49k,QuantrelBitchop,-3,Sat Jan 10 09:28:58 2015 UTC,This pose is worse than duck face
victoriajustice,2rwp9k,DiamondRyce,2,Fri Jan 9 23:04:13 2015 UTC,There is another two or three minutes missing from the interview so IDK where it is atm still searching.
victoriajustice,2rwp9k,Dedbent,2,Fri Jan 9 23:04:45 2015 UTC,Here is the whole thing. It is only the first 6 minutes or so.
victoriajustice,2rwohs,DiamondRyce,2,Fri Jan 9 22:57:35 2015 UTC,This is an addition to the ExtraTV video where she was answering social media questions.   Also As a side note since Eye Candy Premieres this Monday at 10PM there are plenty more interviews that she will be doing so be on the lookout for those.   E! News and Jimmy Fallon are interviewing her soon  E! News should be tonight or tommorrow and The Tonight Show with Jimmy Fallon next Friday Jan 16.
victoriajustice,2rwohs,agkman,1 point,Fri Jan 9 23:01:51 2015 UTC,"Tonight Show, yeah I just saw her profile on their website, so next week. Awesome. :)"
victoriajustice,2rtm8g,Dedbent,3,Fri Jan 9 04:04:34 2015 UTC,Damn
victoriajustice,2rtm8g,expletiveadded,1 point,Fri Jan 9 07:54:51 2015 UTC,Pretty much...
victoriajustice,2rtm8g,Jorfent706,1 point,Fri Jan 9 10:39:45 2015 UTC,"Is it me, or does her smile in the last pic look kinda forced?"
victoriajustice,2rtm8g,Azkadellio,1 point,Fri Jan 9 13:22:22 2015 UTC,God she looks great in a skirt
victoriajustice,2rtm8g,LeviathanDementia,-1,Sat Jan 10 14:40:47 2015 UTC,"Can we stop using the word ""leggy"" please?"
victoriajustice,2rrq1r,rhcp88,2,Thu Jan 8 18:57:33 2015 UTC,Does anyone know where to find the picture that was on the cropped out skateboard?
victoriajustice,2rrq1r,SnobbyLion,3,Thu Jan 8 21:15:18 2015 UTC,I think he meant the actual photo that is on the skateboard.
victoriajustice,2rrq1r,SnobbyLion,5,Thu Jan 8 21:49:08 2015 UTC,Ah I found it. It's from a Teen Vogue photoshoot.
victoriajustice,2rrq1r,expletiveadded,1 point,Thu Jan 8 22:48:40 2015 UTC,haha thats awesome. Now he needs a skateboard with this picture on it.
victoriajustice,2rszh0,DiamondRyce,3,Fri Jan 9 00:46:21 2015 UTC,Access Hollywood Interview   Showing off her dance moves
victoriajustice,2rrf9l,DiamondRyce,1 point,Thu Jan 8 17:33:15 2015 UTC,Her laugh still sounds so fake.
victoriajustice,2rrf9l,expletiveadded,1 point,Fri Jan 9 00:33:32 2015 UTC,I guess so
victoriajustice,2ro4a5,louistulley,2,Wed Jan 7 21:20:28 2015 UTC,/r/wintergirls
victoriajustice,2rjvyf,Burkvest71,1 point,Tue Jan 6 20:53:23 2015 UTC,"Actually, this is her youtube channel: https://www.youtube.com/user/victoriajustice4all"
victoriajustice,2rei7k,louistulley,11,Mon Jan 5 14:21:37 2015 UTC,Gotta love the dork in her.
victoriajustice,2rei7k,SnobbyLion,3,Mon Jan 5 18:06:56 2015 UTC,/r/CelebrityFeet
victoriajustice,2rei7k,rudetubeboobnoob,1 point,Mon Jan 5 16:42:46 2015 UTC,do you know which episode this is from?
victoriajustice,2rdq5r,Jorfent706,4,Mon Jan 5 07:07:20 2015 UTC,"Here is a LINK. The episode is free, but you might still need a google wallet account to watch it."
victoriajustice,2rdq5r,Dedbent,1 point,Tue Jan 6 18:41:25 2015 UTC,You can't watch it outside of america
victoriajustice,2rdq5r,reecej101,1 point,Wed Jan 7 04:59:30 2015 UTC,If anyone in the US wants to download the youtube one I would use http://www.keepvid.com/ its easy to use and just needs java.
victoriajustice,2rdq5r,agkman,3,Thu Jan 8 05:52:17 2015 UTC,"Damn, VJ was trying on some nice outfits with Maddie in this special.  I'm sure some video will come out at some point and gif made :)  Oh lord, some good VJ in jeans. :)  VJ Cosmo shoot with that cleavage. :D  Special just ended.  I just love watching her, she's just so pretty and sweet."
victoriajustice,2rdq5r,arrayed,2,Tue Jan 6 04:29:41 2015 UTC,From Maddies instagram it will be at 2pm. (http://instagram.com/p/xc4gjonRtO/) I hope someone can record this as I'm in Australia and I doubt it will ever be on aussie TV =(.
victoriajustice,2rdq5r,arrayed,3,Mon Jan 5 07:09:39 2015 UTC,Working on it....... ✌♫♪˙❤‿❤˙♫♪✌... Stay tuned
victoriajustice,2rdq5r,arrayed,2,Tue Jan 6 05:48:12 2015 UTC,https://mega.co.nz/#!YYFCDT6I!82iJm_pol0wxEhoAuhB0Ieg10HdulsM2-I3yGedv38M
victoriajustice,2rdq5r,arrayed,2,Fri Jan 9 16:25:53 2015 UTC,Thank you some much =)
victoriajustice,2rdq5r,Dedbent,1 point,Fri Jan 9 17:38:37 2015 UTC,you are welcomed ᕕ( ͡° ͜ʖ ͡°)ᕗ
victoriajustice,2rb39q,devderp1,9,Sun Jan 4 16:14:34 2015 UTC,Is it just me or has her ass been getting bigger?
victoriajustice,2rb39q,anonymousmaus,3,Sun Jan 4 18:13:59 2015 UTC,"Well, this pic is 1 1/2 years old when she put on a little more weight during her tour, so I'd probably say no, given she's lost a little weight since then."
victoriajustice,2rb39q,agkman,7,Sun Jan 4 18:50:15 2015 UTC,She was a little THICKER near the end of her tour. Probably lost 10 or so pounds since then.
victoriajustice,2rb39q,Dedbent,2,Sun Jan 4 19:00:15 2015 UTC,"Yeah definitely. If you look at the shots of her recently walking around NYC her legs definitely look a little slimmer than before...just don't lose that ass, Vic. :P"
victoriajustice,2rb39q,TheRipePunani,3,Sun Jan 4 20:45:09 2015 UTC,"Yeah, here's a similar angle (of course with her sweater blocking her ass) from November.  Imgur"
victoriajustice,2rb39q,agkman,1 point,Sun Jan 4 21:29:58 2015 UTC,"So, isn't that pic likely from June 2014, if not did she wear the exact same outfit, hair style and make up in that pic as her instagram ... or post an old image as her outfit of the day?"
victoriajustice,2rb39q,agkman,1 point,Sun Jan 4 19:38:35 2015 UTC,I don't know. I was just posting because she looks a lot thicker in the legs.
victoriajustice,2rb39q,Dedbent,3,Sun Jan 4 19:59:00 2015 UTC,"That's a shame, it looks good on her."
victoriajustice,2rb39q,anonymousmaus,1 point,Sun Jan 4 18:52:07 2015 UTC,not that I mind
victoriajustice,2rb39q,The_Captain_Spiff,2,Mon Jan 5 23:27:50 2015 UTC,You mean Assss
victoriajustice,2rb39q,Grundle_Package,1 point,Sun Jan 4 17:01:36 2015 UTC,What bus?
victoriajustice,2r3jbo,SD-N,0,Fri Jan 2 13:14:10 2015 UTC,Oh **** sorry guys i didn't see this was a repost
victoriajustice,2r14un,-OP_pls-,6,Thu Jan 1 20:13:11 2015 UTC,Oh Lord please tell me there's ass shots and no shirt shots. Hot damn I'd love to see that
victoriajustice,2r14un,Rais3dByWolv3s,1 point,Thu Jan 1 21:12:14 2015 UTC,OP pls sauce
victoriajustice,2r1112,louistulley,2,Thu Jan 1 19:36:35 2015 UTC,...it.
victoriajustice,2r10ht,louistulley,1 point,Thu Jan 1 19:31:12 2015 UTC,I like the fact that you cropped out Jerome Jarre.
victoriajustice,2r11e7,DiamondRyce,2,Thu Jan 1 19:39:45 2015 UTC,If anyone has time post the pictures. Busy at the moment.
victoriajustice,2r11e7,killakyu5,2,Thu Jan 1 19:40:21 2015 UTC,"If some one can post a TL;DR, that would be great."
victoriajustice,2qzjrd,Dedbent,1 point,Thu Jan 1 05:49:22 2015 UTC,Damn cold weather. :(
victoriajustice,2qxh3q,CJ105,3,Wed Dec 31 16:29:50 2014 UTC,NOM NOM NOM
victoriajustice,2qxh3q,bakin25,3,Wed Dec 31 18:59:36 2014 UTC,The best pics from this shoot are the behind the scenes stuff so far.  Get with the program Seventeen and release the good pics.
victoriajustice,2qxh3q,agkman,5,Wed Dec 31 19:14:54 2014 UTC,Here's some more from a screenshot
victoriajustice,2qxh3q,ilpalazzo3,2,Wed Dec 31 19:20:46 2014 UTC,Tummy awesomeness <3
victoriajustice,2qyiqs,Bongo9911,2,Wed Dec 31 22:21:36 2014 UTC,"Could we maybe get a link in the sidebar, mods?"
victoriajustice,2qyiqs,-OP_pls-,2,Thu Jan 1 05:29:18 2015 UTC,"Can do, gimme a minute.   Done. Happy New Year!"
victoriajustice,2qvw4l,louistulley,3,Wed Dec 31 03:49:51 2014 UTC,Gorgeous!
victoriajustice,2qvbwu,rhcp88,2,Wed Dec 31 00:39:06 2014 UTC,She's too cute.
victoriajustice,2qtk3g,matinphipps,5,Tue Dec 30 15:31:18 2014 UTC,Nobody can rock a pair of jeans as spectacularly as Vic.
victoriajustice,2qtk3g,Lamachus,2,Tue Dec 30 16:53:03 2014 UTC,Yum
victoriajustice,2qtk3g,grilsrgood,2,Tue Dec 30 17:35:34 2014 UTC,Turn around!
victoriajustice,2qtstc,Dedbent,5,Tue Dec 30 16:52:30 2014 UTC,Leave it to Seventeen to somehow manage to take a bad picture of her.
victoriajustice,2qqu9j,rhcp88,1 point,Mon Dec 29 20:56:35 2014 UTC,damn straight she is elite
victoriajustice,2qvek3,blankdudex,1 point,Wed Dec 31 01:03:11 2014 UTC,Creepy AF
victoriajustice,2ql4rm,Dedbent,5,Sun Dec 28 03:17:11 2014 UTC,I'd unwrap that.
victoriajustice,2qhewx,Dedbent,8,Fri Dec 26 23:05:35 2014 UTC,I was able to aquire these from the Cosmo website. By messing around in the page source.
victoriajustice,2qhewx,agkman,1 point,Fri Dec 26 23:22:11 2014 UTC,Awesome work.
victoriajustice,2qhewx,expletiveadded,1 point,Sat Dec 27 02:50:04 2014 UTC,"Nice, now if only I could find some behind the scenes video for this shoot."
victoriajustice,2qhewx,-OP_pls-,2,Sat Dec 27 09:25:41 2014 UTC,a couple upgrades
victoriajustice,2qfhf8,Dedbent,2,Fri Dec 26 07:18:30 2014 UTC,Gorgeous shoot.
victoriajustice,2qeuo6,LoneWolve13,13,Fri Dec 26 02:33:10 2014 UTC,Mmm I want it all..
victoriajustice,2qeuo6,TheRipePunani,4,Fri Dec 26 03:30:22 2014 UTC,i wanna unwrap her for christmas
victoriajustice,2qeuo6,reecej101,3,Fri Dec 26 03:34:55 2014 UTC,Nice :)
victoriajustice,2qeuo6,agkman,2,Fri Dec 26 17:27:55 2014 UTC,I wish some very rich man would offer her 100 million dollars to shoot a porn.
victoriajustice,2qeuo6,TheRipePunani,2,Fri Dec 26 13:21:49 2014 UTC,Ooof...Victoria Justice gracing the cover of Maxim...  Fingers crossed.
victoriajustice,2q980u,louistulley,3,Wed Dec 24 06:23:32 2014 UTC,He knows.
victoriajustice,2q96jz,louistulley,5,Wed Dec 24 06:07:19 2014 UTC,Haha ... that mannequin upper body type looks kinda familiar. ;)  Thanks :)
victoriajustice,2q96jz,agkman,5,Wed Dec 24 07:26:22 2014 UTC,Was gonna say those are the shape of hers
victoriajustice,2q96jz,rdnanez11,1 point,Wed Dec 24 13:20:30 2014 UTC,I get this now. Creepy.
victoriajustice,2q7qp5,chrisdeli,1 point,Tue Dec 23 21:42:15 2014 UTC,babes!!
victoriajustice,2q8txd,Dedbent,2,Wed Dec 24 03:55:10 2014 UTC,She also put up a snapchat today from the mall.  One More
victoriajustice,2q4mxx,louistulley,1 point,Tue Dec 23 01:28:27 2014 UTC,Is that Sue Heck (Eden Sher) with her?
victoriajustice,2q4mxx,shrapnelstudios,2,Tue Dec 23 15:58:37 2014 UTC,Yes.  Doing some voice over work w/ the one & only @eden_sher for @outskirtsmovie ! Love this girl. Seriously can't wait for you guys to see the movie #excited
victoriajustice,2q0gp0,Dedbent,1 point,Sun Dec 21 23:06:16 2014 UTC,What's her snapchat?
victoriajustice,2q0gp0,taytleor,3,Mon Dec 22 05:16:53 2014 UTC,It is victoriajustice(all one word).
victoriajustice,2pznt0,Dedbent,4,Sun Dec 21 18:30:42 2014 UTC,Awful
victoriajustice,2pznt0,Spiveym1,2,Sun Dec 21 23:41:00 2014 UTC,crikey
victoriajustice,2pznt0,expletiveadded,5,Sun Dec 21 23:57:26 2014 UTC,VictoriaJusticeBrasil has the rest of the Snapchat videos here: LINK  She also just started her own account it is just victoriajustice. All one word.
victoriajustice,2pznt0,Pantz_Party,1 point,Sun Dec 21 18:34:38 2014 UTC,"That's Chav English, not Australian."
victoriajustice,2pwlq8,Dedbent,2,Sat Dec 20 18:55:39 2014 UTC,Eye candy indeed.
victoriajustice,2ptxwh,Dedbent,1 point,Fri Dec 19 22:34:45 2014 UTC,Whats the show actually about?
victoriajustice,2ptxwh,flames1471,1 point,Sat Dec 20 05:46:04 2014 UTC,"http://www.mtv.com/shows/eye_candy/   Eye Candy centers on tech genius Lindy, who is persuaded by her roommate to begin online dating and begins to suspect that one of her mysterious suitors might be a deadly cyber stalker. When her friends at the elusive cyber-police uncover a potential serial killer in Manhattan, all signs point to one of Lindy’s dates. Teaming up with this band of hackers, Lindy works to solve the murders while unleashing her own style of justice on the streets of New York City."
victoriajustice,2ptxwh,expletiveadded,1 point,Tue Dec 23 11:05:16 2014 UTC,Thanks
victoriajustice,2pug4a,Dedbent,1 point,Sat Dec 20 01:34:39 2014 UTC,"Weird, but more pics I guess.  Lindy  Connor  Tommy  Sophia  George"
victoriajustice,2pquv4,rudetubeboobnoob,14,Fri Dec 19 01:57:53 2014 UTC,Her O face is probably a lot like this.
victoriajustice,2pquv4,Dugommier,4,Fri Dec 19 04:24:25 2014 UTC,What's the source off this?
victoriajustice,2pquv4,rodinj,12,Fri Dec 19 08:37:31 2014 UTC,"Probably the victorious episode where they were trapped in an van at the beach with no ac in the summer, while Ariana grande(cat) was stuck outside cooling off playing with waterguns with some guys.  Hnnnnng"
victoriajustice,2pquv4,Jchico1021,4,Fri Dec 19 09:53:26 2014 UTC,"Loved that episode, I'm still not sure wether I liked the christmas episode more. The plot is so good."
victoriajustice,2pquv4,rodinj,2,Fri Dec 19 10:14:04 2014 UTC,It's called Survival of the Hottest
victoriajustice,2prdgp,rudetubeboobnoob,2,Fri Dec 19 05:07:24 2014 UTC,http://gifsound.com/?gif=gfycat.com/VacantArcticBee%23%3Fformat=gif&v=Oz_-VaTHpc8&s=69
victoriajustice,2prdgp,StarletM,1 point,Fri Dec 19 13:53:26 2014 UTC,That works so well.
victoriajustice,2pq8vv,louistulley,0,Thu Dec 18 22:34:23 2014 UTC,"Carmen Sandiego, Noir edition."
victoriajustice,2pimc1,louistulley,1 point,Tue Dec 16 22:53:31 2014 UTC,Which movie is it from
victoriajustice,2pimc1,Sum4,4,Wed Dec 17 08:28:32 2014 UTC,Not a movie. Its hers new TV Show Eye Candy coming out Jan. 12th
victoriajustice,2pdwot,Dedbent,8,Mon Dec 15 19:17:58 2014 UTC,Girls...  If someone is obsessed with you and trying to kill you it might be a good idea to put your blind/online dating life on hold for a while.
victoriajustice,2pdwot,MyPr0nUser,3,Mon Dec 15 20:11:47 2014 UTC,Download  Download .mp4
victoriajustice,2pdwot,agkman,3,Mon Dec 15 19:18:27 2014 UTC,"Hey, she's wearing a dress ... and a bra ... so not just pants :)  Very creepy."
victoriajustice,2pdwot,Gioboi,2,Mon Dec 15 21:08:12 2014 UTC,I wish I could set my DVR to record that far in advance
victoriajustice,2pdwot,Jorfent706,2,Mon Dec 15 23:13:36 2014 UTC,Words cannot express how happy I am that this looks so good =)
victoriajustice,2pdwot,DiamondRyce,2,Mon Dec 15 23:24:21 2014 UTC,"Scary, Dark, Love Scenes, Junkyard Date?, hacking, serial killers.   This trailer has it all and probably more I missed. #GoodbyeToriVega and Hello Lindy Sampson"
victoriajustice,2pdsbb,DiamondRyce,1 point,Mon Dec 15 18:43:13 2014 UTC,"Scary, Dark, Love Scenes, Junkyard Date?, hacking, serial killers. This trailer has it all and probably more I missed. #GoodbyeToriVega and Hello Lindy Sampson"
victoriajustice,2pagcx,DiamondRyce,1 point,Sun Dec 14 20:45:34 2014 UTC,Weird they used a paparazzi pic.
victoriajustice,2pagcx,Dedbent,1 point,Sun Dec 14 21:17:37 2014 UTC,Well its an independent movie so I guess they ran out of funds for a graphic designer idk.
victoriajustice,2p8asa,SD-N,3,Sun Dec 14 03:21:49 2014 UTC,Without the watermark
victoriajustice,2p8asa,expletiveadded,4,Sun Dec 14 10:27:25 2014 UTC,Fff...those jeans. :D
victoriajustice,2p8asa,TheRipePunani,2,Sun Dec 14 19:10:26 2014 UTC,The video before the concert
victoriajustice,2p7eqn,Dedbent,5,Sat Dec 13 21:45:56 2014 UTC,Slightly Longer
victoriajustice,2p6qmt,DiamondRyce,1 point,Sat Dec 13 17:50:19 2014 UTC,@mtveyecandy:   2014-12-13 17:11:10 UTC  The #EyeCandy trailer is coming. twitter.com     [Mistake?] [Suggestion] [FAQ] [Code] [Issues]
