victoriajustice,31h5oe,agkman,2,Sun Apr 5 01:09:49 2015 UTC,God bless VJ.  She is the best :)
victoriajustice,31h5oe,expletiveadded,1 point,Sun Apr 5 03:35:13 2015 UTC,RIP headphone users.
victoriajustice,31gfp4,DiamondRyce,7,Sat Apr 4 21:11:12 2015 UTC,"Once again, a little bigger"
victoriajustice,31gfp4,-OP_pls-,1 point,Sat Apr 4 21:37:31 2015 UTC,"Bert Blyleven, Walter Johnson and Sam McDowell I believe so."
victoriajustice,31gfp4,fernando_69,5,Mon May 11 16:39:32 2015 UTC,So glad she's no longer afraid to show off her body in her vacation pics ... although we could use a better shot from today's fun. ;)
victoriajustice,31gfp4,agkman,2,Sat Apr 4 21:26:51 2015 UTC,Dont think Victoria have Go Pros or action cameras. Then again...
victoriajustice,31gfp4,rodinj,1 point,Sat Apr 4 21:27:58 2015 UTC,"You should check out her snapchat then, it's a shame I can't rip the vids hope someone else can do it."
victoriajustice,31gfp4,Dedbent,2,Sat Apr 4 22:53:53 2015 UTC,Good stuff. She also just put up a snapchat vid today.
victoriajustice,31gfp4,reecej101,0,Sat Apr 4 21:35:57 2015 UTC,why is this being downvoted so much :/ its a pic of victoria in a subreddit about her. im confused
victoriajustice,31gfp4,-OP_pls-,5,Sat Apr 4 21:33:29 2015 UTC,"I can think of a couple reasons...   Instagram link. You have to screenshot to save the pic. Most people appreciate the imgur link over the direct link to an IG account. There's also the chance she deletes it from instagram and it vanishes. Dead link is no bueno. Maybe they don't like that its taken from a distance? More Vic, less water perhaps. Some people just downvote people they don't like/agree with. Its silly, but I've seen it happen.   None of those are really good reason to downvote, but sometimes thats all it takes."
victoriajustice,31gfp4,Dedbent,2,Sat Apr 4 23:17:44 2015 UTC,"No rhyme or reason. These are the same guys that upvoted the reposted rooftop pic, 80 times. While the original was still on the front page."
victoriajustice,31gfp4,reecej101,1 point,Sat Apr 4 23:23:16 2015 UTC,"yeah i saw that, i was thinking why dont these guys just scroll down slightly"
victoriajustice,31gfp4,-OP_pls-,1 point,Sat Apr 4 23:44:16 2015 UTC,"Re posting can be pretty bad, but most dont really seem to care. Its not as bad as some of the other celeb subs, but I feel like one is enough, save space for other new stuff to sit on the front page. Some people can't be bothered to check though."
victoriajustice,31d2sk,reecej101,6,Fri Apr 3 22:48:39 2015 UTC,http://i.imgur.com/uhEldrJ.gif
victoriajustice,31d2sk,hummus3xual,4,Sat Apr 4 02:40:02 2015 UTC,"I really couldnt care. Dont do that, its creepy and perverted"
victoriajustice,31d5re,SD-N,5,Fri Apr 3 23:14:12 2015 UTC,If she did this to me irl I'd jizz my pants
victoriajustice,31d5re,hoser89,0,Sat Apr 4 15:49:24 2015 UTC,How you doin'?
victoriajustice,31d259,DiamondRyce,8,Fri Apr 3 22:42:51 2015 UTC,Perfect body doubled.
victoriajustice,31d259,ViperVisor,5,Fri Apr 3 22:53:12 2015 UTC,Those pictures
victoriajustice,31d259,SD-N,8,Fri Apr 3 23:13:32 2015 UTC,"found these, slightly bigger"
victoriajustice,31d259,-OP_pls-,2,Fri Apr 3 23:17:12 2015 UTC,i have literally saved about 5 different sizes of these pics already lol god they are gorgeous
victoriajustice,31d259,reecej101,2,Fri Apr 3 23:22:14 2015 UTC,same
victoriajustice,31d259,zqxwhx,4,Fri Apr 3 23:24:39 2015 UTC,Could someone get the vid off of her snapchat?  Screenshots
victoriajustice,31d259,Dedbent,1 point,Sat Apr 4 00:04:55 2015 UTC,Sweet. The version on snapchat is a little longer.
victoriajustice,31d259,Dedbent,3,Sat Apr 4 00:21:13 2015 UTC,Original + 1 more
victoriajustice,31d259,Dedbent,2,Sat Apr 4 00:32:36 2015 UTC,God bless her for posting this! It truly is a good Friday
victoriajustice,31d259,zqxwhx,1 point,Fri Apr 3 22:50:48 2015 UTC,I saw that I when Wow and my jaw dropped
victoriajustice,31d259,zqxwhx,1 point,Fri Apr 3 23:25:23 2015 UTC,Now THAT is more like it. :)
victoriajustice,31d259,agkman,1 point,Fri Apr 3 23:12:13 2015 UTC,On mobile so screenshot will do since it will be deleted anyway
victoriajustice,31by34,u_play_T_no_GG,1 point,Fri Apr 3 17:38:13 2015 UTC,Such a pretty everything
victoriajustice,319cva,Dedbent,3,Fri Apr 3 01:08:12 2015 UTC,I cropped out the photographer.
victoriajustice,319qhr,DiamondRyce,4,Fri Apr 3 03:06:33 2015 UTC,Additional Pic
victoriajustice,319qhr,holla_secret,1 point,Fri Apr 3 03:08:36 2015 UTC,"I posted a link to the video in /r/victoriajustice, but it doesn't seem to show up (Spam filter?). It's still on the overview page of my user name though as Victoria Justice - First Time Target Practice Video."
victoriajustice,319qhr,holla_secret,1 point,Sat Apr 25 17:17:53 2015 UTC,Hey Thanks for that.
victoriajustice,319qhr,expletiveadded,1 point,Sat Apr 25 17:22:19 2015 UTC,"You're welcome, the link was caught by the Spam filter which has been fixed by the mod."
victoriajustice,319qhr,holla_secret,4,Sat Apr 25 17:44:44 2015 UTC,Some people ruin all the fun.
victoriajustice,312r48,SnobbyLion,10,Wed Apr 1 16:46:30 2015 UTC,Whoever did her makeup should be let go.
victoriajustice,312r48,MarcAntony,5,Wed Apr 1 19:37:34 2015 UTC,I like this new side of her. ALOT.
victoriajustice,312r48,IPlayGeetarSometimes,1 point,Wed Apr 1 23:24:46 2015 UTC,What shot is this?
victoriajustice,312r48,TH3_N1GHTMAN,1 point,Wed Apr 1 16:52:58 2015 UTC,It's from a recent Seventeen Magazine shoot.
victoriajustice,30z0z7,Dedbent,5,Tue Mar 31 21:13:18 2015 UTC,"Even when making goofy faces, she's still pretty."
victoriajustice,30z0z7,CrackerJackBunny,1 point,Wed Apr 1 05:43:01 2015 UTC,According to her Twitter. She is going to Alabama.
victoriajustice,30z0z7,skiier23,1 point,Tue Mar 31 22:12:52 2015 UTC,victoriajustice
victoriajustice,30u1yp,skiier23,3,Mon Mar 30 18:40:15 2015 UTC,Lucky SOB. Nice man.
victoriajustice,30u1yp,CharlesHapgood1958,4,Mon Mar 30 19:16:28 2015 UTC,thank you! i hope you get to meet her one day too.
victoriajustice,30u1yp,Amphibialrabies69,2,Tue Mar 31 01:18:04 2015 UTC,Did you get her number op
victoriajustice,30rn82,Burkvest71,11,Mon Mar 30 03:02:03 2015 UTC,i want to trade places with that olive so hard
victoriajustice,30rn82,skiier23,1 point,Mon Mar 30 05:29:54 2015 UTC,same
victoriajustice,30rmnl,Burkvest71,6,Mon Mar 30 02:56:46 2015 UTC,Is it just me or do her toes look rather thick? It's not the photo since I've seen at least one other picture of her feet where I thought the same thing.
victoriajustice,30qzmo,Dedbent,3,Sun Mar 29 23:30:50 2015 UTC,\Hopes for bikini pics//  Another
victoriajustice,30qzmo,colts4ever,4,Sun Mar 29 23:31:19 2015 UTC,no cleavage.. classic Vic
victoriajustice,30qzmo,Lurky-MacLurkerson,5,Mon Mar 30 06:23:40 2015 UTC,"Heh. I like how her photoshoots have been getting more ""grown up"" ever since her teats were shown to the world."
victoriajustice,30qzmo,forlio5,1 point,Mon Mar 30 10:01:00 2015 UTC,Are those confirmed her?
victoriajustice,30qzmo,Lurky-MacLurkerson,1 point,Sun Apr 5 19:58:07 2015 UTC,Yep
victoriajustice,30qzmo,forlio5,1 point,Sun Apr 5 22:40:22 2015 UTC,"Oh, great, she's over 18 in them?"
victoriajustice,30qzmo,Lurky-MacLurkerson,1 point,Mon Apr 6 05:39:05 2015 UTC,No idea sorry
victoriajustice,30qzmo,forlio5,1 point,Mon Apr 6 13:05:06 2015 UTC,"Haha don't worry thanks anyways, not like it's gonna affect what I do with them"
victoriajustice,30qzmo,fuckthemotherfuckers,-1,Wed Apr 8 04:26:36 2015 UTC,https://youtu.be/zzVB3zHeh4U  Edit:  YOU DARE DOWNVOTE THE BATS?!
victoriajustice,30oljt,Dedbent,-1,Sun Mar 29 07:56:15 2015 UTC,No more blond? Aww :(
victoriajustice,30oljt,comethrowitaway,2,Sun Mar 29 15:49:48 2015 UTC,It was a wig.
victoriajustice,30h0ko,GiantWithDwarfism,13,Fri Mar 27 08:24:38 2015 UTC,Just realized the sweater says yay and not gay
victoriajustice,30h0ko,DavidfCo1995,1 point,Fri Mar 27 13:04:27 2015 UTC,"How perfectly her hair obscured that word. Meh, I like it either way."
victoriajustice,30h0ko,SnobbyLion,1 point,Fri Mar 27 14:51:21 2015 UTC,I'd be ok with her being gay.
victoriajustice,30h0ko,expletiveadded,12,Sat Mar 28 02:11:28 2015 UTC,Album
victoriajustice,30h0ko,-OP_pls-,4,Fri Mar 27 14:00:46 2015 UTC,32 pics and no ass shot!
victoriajustice,30h0ko,JakeyG14,2,Fri Mar 27 20:02:46 2015 UTC,"There's more that I haven't added yet, but it's more of the same. Those first two are as close as it gets at this point."
victoriajustice,30h0ko,-OP_pls-,2,Fri Mar 27 20:13:56 2015 UTC,Rollergirl VJ
victoriajustice,30h0ko,agkman,2,Sat Mar 28 11:05:49 2015 UTC,SHOCKING!!! Another day ... more pics of VJ looking hot as fuck.  :D
victoriajustice,30h0ko,agkman,-3,Fri Mar 27 21:53:10 2015 UTC,the shirt...........
victoriajustice,30cyuv,-OP_pls-,4,Thu Mar 26 10:50:30 2015 UTC,"Interview Here   It’s fitting, considering she herself is embracing an edgier style as of late. “I always had to be conscious of that younger audience and couldn’t go too mature,” she says. “Now that I have a show on MTV, I am no longer part of that world as much. If I want to wear something that is low cut or show a little more skin, I embrace. I own it.”     That explains all the outfits recently. Go on and embrace Victoria!   And new music is on the horizon, too. “I’ve been telling my fans for such a long time that I’m going to be releasing music, so just wait—it’s coming! I think now is the time.”   YES! We have been waiting awhile, just release it yourself for now and get a label later."
victoriajustice,30bsbf,DiamondRyce,20,Thu Mar 26 02:03:14 2015 UTC,"Maxim, FHM, Esquire etc. Maybe just maybe.   EDIT: Coco Tigress be out and about now."
victoriajustice,30bsbf,supersoaker727,4,Thu Mar 26 02:06:58 2015 UTC,"She's not gonna do porn. She's made enough money through tv and stuff that she'll never need to do it. Also, I don't think being in a porn is something you pay for. I think it's probably got to do with who the director chooses."
victoriajustice,30bsbf,supersoaker727,3,Thu Mar 26 08:45:42 2015 UTC,"So you think if she did porn, she would let some rando who had money fuck her? I don't think she would. And if she ran out of money, she's well established by now and could get another tv show/movie."
victoriajustice,30bsbf,agkman,12,Thu Mar 26 13:50:32 2015 UTC,"She needs to keep working these photo shoots.  Honestly, looking amazing is what she does best.  Dat Kode shoot, especially the behind the scenes gifs & stills was just fire."
victoriajustice,30bsbf,ForeverAlone2SexGod,19,Thu Mar 26 16:42:05 2015 UTC,"Seeing as how Ariana is HUGE right now and she's always prancing around onstage in basically underwear.... and seeing as how Victoria is no longer a Nick girl AND her nudes leaked already...  ...Maybe she will decide to embrace a sexier, more risque image.  Please Obama, make a VJ Playboy spread happen."
victoriajustice,30bsbf,itsguardianjon,3,Thu Mar 26 17:41:58 2015 UTC,Now google image search is gonna blow up
victoriajustice,30bsbf,blacksantron,3,Thu Mar 26 02:32:09 2015 UTC,What nudes?? I'm not aware of these...
victoriajustice,30bsbf,LupusMechanicus,-9,Thu Mar 26 06:12:21 2015 UTC,I think there were fake nudes released during the Fappening.
victoriajustice,30bsbf,Introvariant,8,Thu Mar 26 16:10:06 2015 UTC,There were extensively proven nudes released during the fappening.
victoriajustice,30bsbf,paulstory77,-1,Thu Mar 26 14:30:42 2015 UTC,Right. Fake.
victoriajustice,30bsbf,hundreddollarman,1 point,Thu Mar 26 22:56:32 2015 UTC,Embracing the Latina Roots. It should happen soon.   Seeing as how Ariana is HUGE right now and she's always prancing around onstage in basically underwear   Yeah it sad how it is but I dont care what happens to her plus she's dating Big Sean.
victoriajustice,30bsbf,BrohanMannn,4,Fri Mar 27 01:53:49 2015 UTC,She's really blossomed into a world-class beauty.
victoriajustice,30bsbf,Myarvis,8,Fri Mar 27 00:34:19 2015 UTC,I definitely wouldn't rule it out with her
victoriajustice,30bsbf,saloco,3,Thu Mar 26 07:36:03 2015 UTC,fingers crossed
victoriajustice,30bsbf,Mor-Tax,3,Thu Mar 26 15:55:44 2015 UTC,Sweet Mother of God... are we ready for this? I am.. I AM!!!!
victoriajustice,30bsbf,agkman,2,Thu Mar 26 02:10:00 2015 UTC,"I find it rather amusing how naive most of you are to assume that if she were ever to pose for Playboy, she'll be actually nude. Have you been paying attention to their gallery of celebrities in the past decade or so? If she ever poses for that magazine, there is a 96.875 probability that she'll be no more naked than that Kode photoshoot."
victoriajustice,301f33,Pallas-Athena,8,Mon Mar 23 18:29:43 2015 UTC,"As usual, the behind the scenes and eventual outtakes will be better than what is in the magazine.    We need WAY more of that black outfit ... and from behind. ;)"
victoriajustice,301f33,agkman,7,Mon Mar 23 20:18:51 2015 UTC,gfy album  (thanks /u/imjustadude90)
victoriajustice,301f33,SnobbyLion,4,Mon Mar 23 18:30:53 2015 UTC,She's such a fucking pro at modeling. I bet she's fun to photograph.
victoriajustice,301f33,cjkb,3,Tue Mar 24 01:50:59 2015 UTC,"this made my day, thanks!"
victoriajustice,301f33,TheRipePunani,3,Mon Mar 23 18:42:39 2015 UTC,Oh man #2 & 3...I hope to see more outtakes of her in that body suit. Ffffffff...
victoriajustice,301f33,CrackerJackBunny,1 point,Mon Mar 23 19:39:07 2015 UTC,I hate those damn fast cuts. I'm trying to look at her black outfit and they edit it so I can't get a good view. Fuckers.
victoriajustice,301f33,comethrowitaway,1 point,Tue Mar 24 02:57:14 2015 UTC,She got some really intense hips out of nowhere in some of those gifs
victoriajustice,301f33,arrayed,1 point,Wed Mar 25 22:13:17 2015 UTC,DatGap!!!!
victoriajustice,300ngj,-OP_pls-,7,Mon Mar 23 15:05:46 2015 UTC,Shakira?
victoriajustice,300ngj,robotmorgan,5,Mon Mar 23 20:03:47 2015 UTC,"Aye, the body suit and blonde hair was my favorite outfit combo."
victoriajustice,300ngj,TheRipePunani,2,Mon Mar 23 19:37:56 2015 UTC,Holy shit
victoriajustice,302cd9,Dedbent,0,Mon Mar 23 22:23:48 2015 UTC,You got her Snapchat???
victoriajustice,302cd9,ronny618johnson,1 point,Sat Mar 28 20:44:17 2015 UTC,It is victoriajustice
victoriajustice,302cd9,ronny618johnson,0,Sat Mar 28 21:18:17 2015 UTC,Thanks buddy
victoriajustice,302cd9,holla_secret,1 point,Sat Mar 28 21:24:11 2015 UTC,"Victoria's snapchat is a public one: victoriajustice  Since I don't have snapchat installed at the moment, did Kode Magazine post anything new on there snap @kodemagazine about the Kode5 photoshoot?"
victoriajustice,302cd9,ronny618johnson,0,Sat Mar 28 21:21:44 2015 UTC,Thanks buddy I'll check now
victoriajustice,302cd9,holla_secret,1 point,Sat Mar 28 21:24:23 2015 UTC,"Thanks, I think it's kodemagazine without the @"
victoriajustice,302cd9,ronny618johnson,1 point,Sat Mar 28 21:27:45 2015 UTC,My friend request is currently pending
victoriajustice,300cig,-OP_pls-,5,Mon Mar 23 13:28:26 2015 UTC,Okay the lack of sound in the intro may have cause me to near deafen myself when the music started..... just a warning to everyone.
victoriajustice,300cig,Jorfent706,3,Mon Mar 23 13:58:44 2015 UTC,I'd let her date me.
victoriajustice,300cig,kodat,3,Mon Mar 23 18:50:02 2015 UTC,I made this BTS pic album not knowing about the almost superfluous amount already about here. Best not let all that go to waste. http://imgur.com/a/awLPG
victoriajustice,300cig,CJ105,1 point,Mon Mar 23 21:42:03 2015 UTC,God Damn
victoriajustice,2zs8v8,Pallas-Athena,5,Sat Mar 21 06:19:49 2015 UTC,another
victoriajustice,2zl86u,-OP_pls-,5,Thu Mar 19 14:48:51 2015 UTC,Bonus twitter pic
victoriajustice,2zl86u,DiamondRyce,5,Thu Mar 19 14:56:04 2015 UTC,Her goofiness is cute.
victoriajustice,2zl86u,skiier23,4,Thu Mar 19 15:40:40 2015 UTC,"i have been in love with VJ since her Zoey 101 days, and yet this is the BEST ACTING SHE HAS EVER DONE! i loved it! she was hilarious. she should act like this more instead of like in ""Eye Candy""...ugh, that show is awful."
victoriajustice,2zl86u,Lamachus,5,Thu Mar 19 21:37:59 2015 UTC,"I enjoyed Eye Candy, for all its problems. But I think her real talent is for comedy, and fun stuff like this. As was mentioned earlier, Vic's goofiness is cute. She does goofy/silly well. Not all actors have the chops for that."
victoriajustice,2zl86u,DiamondRyce,2,Thu Mar 19 23:03:02 2015 UTC,"Agreed. I tried to get into Eye Candy, i liked the concept... but Victoria wasn't meant to do those dark, serious roles. She either seemed to be trying too hard to play up the dramatics, or she came off as bland and uninspired. She has a bubbly personality, it just seems off when she tries to be anything else. Comedy will always be where she excels IMO."
victoriajustice,2zl86u,Lamachus,1 point,Fri Mar 20 01:23:09 2015 UTC,Remember that was like her first show outside of comedy of course its hard to adapt. We have seen her mostly in comedies which is why its hard to see her in Eye Candy.  I like anything she does so it doesn't matter to me what happens next.
victoriajustice,2zl86u,skiier23,2,Fri Mar 20 03:29:02 2015 UTC,"I didn't mean to imply that Vic can't do dramatic roles. I just really like her in light, fun stuff, and think she has a gift for it.  Actually, I was just glad to see her in anything new. Unless I missed something, Vic's last acting appearance was in that Big Time Rush episode from June 2013--a year and a half ago. It was a pleasure to have 10 hours of her company."
victoriajustice,2zl86u,Dedbent,2,Sat Mar 21 03:29:50 2015 UTC,"i got 30-45 seconds of her company in real life once at a mall she was randomly meeting anyone who showed up. even got a hug. gave her a little extra squeeze but not too much to where it was weird. its the little things in life like that, i think. :) anyway, back to her acting yeah i mean i always thought i could watch her host or whatever a documentary about how napkins are made but i agree with OP that she seemed like she was trying too hard in eyecandy and the whole show was just trying too hard."
victoriajustice,2zl86u,holla_secret,7,Mon Mar 23 09:08:17 2015 UTC,Behind the Scenes Vid  A couple of booty shots in this one.
victoriajustice,2zjnu4,SD-N,-6,Thu Mar 19 02:59:16 2015 UTC,what hips?
victoriajustice,2zjnu4,spenrose22,0,Thu Mar 19 19:06:51 2015 UTC,Ice cold bro...
victoriajustice,2zjnu4,Saiyanoflegend,3,Wed Mar 25 19:10:47 2015 UTC,"The correct answer he should have said is ""Dat Ass"""
victoriajustice,2zgh3i,Pallas-Athena,8,Wed Mar 18 11:35:47 2015 UTC,"Yes, yes, and more yes. She looks like the naughty librarian of my dreams."
victoriajustice,2zgh3i,Dugommier,0,Thu Mar 19 01:13:39 2015 UTC,No.
victoriajustice,2zgh3i,b-raddit,0,Wed Mar 18 22:51:03 2015 UTC,Mmmmm... Nah.
victoriajustice,2zglb0,louistulley,4,Wed Mar 18 12:29:17 2015 UTC,That guy is definitely fapping in that costume at that point in time.
victoriajustice,2zdrrk,Dedbent,1 point,Tue Mar 17 19:13:30 2015 UTC,"What is this for? I'm trying to think of who the girl on the left side of the group picture (black dress) is. She's recognizable, but I can't quite think of her name."
victoriajustice,2zdrrk,MarcAntony,3,Tue Mar 17 20:38:54 2015 UTC,Harvey had his co-stars from the Thundermans Nickelodeon show over to watch the finale. I think her name is Audrey Whitby.  One More
victoriajustice,2zdrrk,Lamachus,3,Tue Mar 17 20:59:46 2015 UTC,The girl in the black dress isn't Audrey Whitby. She's a lot blonder than the girl in this picture. Not sure who she is.  EDIT: I think it's McKaley Miller.
victoriajustice,2zdrrk,expletiveadded,3,Tue Mar 17 21:11:52 2015 UTC,McKaley Miller   Your right. Checked her twitter.
victoriajustice,2z9sna,chrisdeli,1 point,Mon Mar 16 20:29:22 2015 UTC,I thought she was carrying a keyboard at first
victoriajustice,2z5ong,Dedbent,1 point,Sun Mar 15 20:30:06 2015 UTC,Another  3 More
victoriajustice,2z4w4v,Dedbent,1 point,Sun Mar 15 16:39:19 2015 UTC,2 MORE  Another
victoriajustice,2z4w4v,-OP_pls-,1 point,Sun Mar 15 16:55:01 2015 UTC,more
victoriajustice,2z0t2v,Burkvest71,2,Sat Mar 14 14:44:12 2015 UTC,Anyone have the video?
victoriajustice,2z0t2v,Jorfent706,3,Sat Mar 14 18:07:49 2015 UTC,Only this filmed from screen capture at the moment.
victoriajustice,2ywar3,jmayer768,9,Fri Mar 13 10:24:42 2015 UTC,Moar (and bigger): http://imgur.com/a/dsZHO
victoriajustice,2ywar3,DrkHeart,2,Fri Mar 13 11:55:04 2015 UTC,"Hello, random glasses in that last picture."
victoriajustice,2ywar3,Mor-Tax,1 point,Fri Mar 13 12:13:01 2015 UTC,Some more: http://imgur.com/a/WoulR
victoriajustice,2ywar3,RedRedWhite,8,Sat Mar 14 00:10:55 2015 UTC,I love the illusion these kinds of outfits give off...leaves a lot to the imagination. Nina Dobrev wore an outfit a while back in white that was similar. So damn hot.
victoriajustice,2ywjj4,-OP_pls-,2,Fri Mar 13 12:29:50 2015 UTC,i could get lost in her eyes easily
victoriajustice,2ywjj4,SD-N,2,Sat Mar 14 04:52:15 2015 UTC,More: http://imgur.com/a/WoulR
victoriajustice,2ywjj4,RedRedWhite,2,Sat Mar 14 00:11:01 2015 UTC,Some more: http://imgur.com/a/WoulR
victoriajustice,2ytd7o,DiamondRyce,10,Thu Mar 12 17:33:30 2015 UTC,Yowza!!
victoriajustice,2ytd7o,Dedbent,13,Thu Mar 12 17:35:23 2015 UTC,"I have a feeling that the next coming shoots are going to be epic. Cosmo, Kode etc."
victoriajustice,2ytd7o,Dedbent,9,Thu Mar 12 17:46:48 2015 UTC,Somebody on another forum said there are going to be wet see through shirt shots. We'll see.
victoriajustice,2ytd7o,holla_secret,6,Thu Mar 12 22:13:00 2015 UTC,"Probably a reference to what paulnortonhair wrote 2 weeks ago on instagram:  ""I had the pleasure of meeting and working with @victoriajustice today on what I have to say was the wettest coldest yet most creative photo shoot I've done in ages!"""
victoriajustice,2ytd7o,agkman,4,Thu Mar 12 23:21:32 2015 UTC,"and that was for a photo shoot that I read won't come out until June.  ... yeah, I'd be all for see through tops in this magazine, but I'm not gonna expect it just to be disappointed when it's not there."
victoriajustice,2ytd7o,holla_secret,3,Thu Mar 12 23:23:00 2015 UTC,"Where did you read that? Lusine wrote on instagram ""Had the pleasure of working with this talented boy @paulnortonhair on a secret photoshoot! Can't wait for you all to see it !!!"". Laura Zapata Fashion editor & stylist at Cosmopolitan for Latinas Magazine wrote as comment: ""you guys RoCk and KILLED it yesterday. Thank you for all of your hard work & patience. Here's to team work overcoming all obstacles"". So another Cosmo shoot?"
victoriajustice,2ytd7o,agkman,5,Thu Mar 12 23:29:11 2015 UTC,"Thing is, if it was another Cosmo shoot or something like that, June would make sense given her movie The Outskirts comes out in theaters at the end of June."
victoriajustice,2ytd7o,agkman,3,Thu Mar 12 23:46:07 2015 UTC,"I can't remember who it was, but I wouldn't have recalled June unless it was stated by someone.  Maybe someone else in this thread will remember.  I'd prefer it came out tomorrow.   Come to think of it, I think someone asked if it was coming out soon and the response from one of them was June."
victoriajustice,2ytd7o,agkman,5,Thu Mar 12 23:34:44 2015 UTC,I'll believe it when I see it ... but yes please. ;)
victoriajustice,2ytd7o,Dedbent,5,Thu Mar 12 22:21:44 2015 UTC,Well i know where my money is going to next since I bought this one.
victoriajustice,2ytd7o,agkman,2,Thu Mar 12 22:24:36 2015 UTC,"Here is what was said,  ""The images probably won’t be released until the summer, but Victoria Justice did a photoshoot for Kode Magazine which involved cold water and a thin white top, which became very see through when wet. Not technically nudity, but very risque for her – pretty clear nipple view. "" Spiderswims over at phun said he read it in the comments section on recapped. I looked but couldn't find it."
victoriajustice,2ytd7o,Rais3dByWolv3s,6,Fri Mar 13 06:56:46 2015 UTC,"Wow, that is hot.  Figured it would be good based on her looks in her instagram pics from the shoot."
victoriajustice,2ytd7o,unfair57,5,Thu Mar 12 18:02:49 2015 UTC,Man ever since her leaks she has been taunting us with all this edginess. So damn sexy
victoriajustice,2ytd7o,expletiveadded,5,Fri Mar 13 09:02:44 2015 UTC,HNG
victoriajustice,2ytd7o,karma_trained,2,Thu Mar 12 20:04:09 2015 UTC,God damn
victoriajustice,2ytd7o,Azkadellio,2,Thu Mar 12 21:48:36 2015 UTC,Oh good lawd have mercy!
victoriajustice,2ytd7o,Dedbent,2,Thu Mar 12 23:39:05 2015 UTC,Could anyone edit out the text on this? This pic is awesome.
victoriajustice,2ytd7o,Azkadellio,6,Thu Mar 12 23:44:36 2015 UTC,Here you go.
victoriajustice,2ytd7o,Jorfent706,2,Fri Mar 13 21:21:12 2015 UTC,Thank you.
victoriajustice,2ytd7o,Cazmir09,-2,Fri Mar 13 23:33:57 2015 UTC,Pre Order the Mag now for $4.99 . http://kodemag.com/shop/  Comes out 3/18/15  EDIT  Payment total $8.98 Shipping was 3.99. So worth it!
victoriajustice,2ytd7o,zeusmeister,1 point,Thu Mar 12 17:38:18 2015 UTC,Is there any way to get it outside of the U.S?
victoriajustice,2yuzou,DiamondRyce,5,Fri Mar 13 01:01:16 2015 UTC,Done. Voted multiple times
victoriajustice,2yqu7c,SD-N,37,Thu Mar 12 01:17:14 2015 UTC,The one in the middle.
victoriajustice,2ypgq7,Dedbent,2,Wed Mar 11 18:53:00 2015 UTC,"I guess they all got together to watch the last episode of the season/series last night.  Also, she'll be hosting the Kode Magazine Spring Issue cover release party on Thursday. She did a shoot for the a month ago. I'm guessing she's on the cover."
victoriajustice,2ymoy3,PM_MeSomethingSexy,9,Wed Mar 11 01:37:02 2015 UTC,:3
victoriajustice,2ymoy3,Liefskaap,4,Wed Mar 11 09:15:23 2015 UTC,Hnng so f*cking cute
victoriajustice,2ymoy3,SD-N,1 point,Thu Mar 12 00:25:45 2015 UTC,"Awww, this is just too cute! BTW, where is this from?"
victoriajustice,2ymoy3,dal3y42x,1 point,Sun Apr 12 03:36:25 2015 UTC,"Tbh, my lovely girlfriend sent it to me."
